video_id,video_title,channel_id,channel_title,video_published_at,view_count,video_like_count,video_comment_count,comment_id,comment_parent_id,comment_author_display,comment_author_channel_id,comment_text,comment_lang,comment_published_utc,comment_published_local,comment_like_count,comment_reply_count
k1vWhii4tkE,Tyler Perry’s STRAW | Official Trailer | Netflix,UCWOA1ZGywLbqmigxE4Qlvuw,Netflix,2025-05-14T15:00:01Z,4580010,45062,6417,UgxA21cMIuXFMSlWT2J4AaABAg,NA,@vv1975,UCSM3DIUyneTtGVHf58TRYAw,terrible movie. dont waste ur time,en,2025-12-11T16:54:17Z,2025-12-11 11:54:17,0,0
k1vWhii4tkE,Tyler Perry’s STRAW | Official Trailer | Netflix,UCWOA1ZGywLbqmigxE4Qlvuw,Netflix,2025-05-14T15:00:01Z,4580010,45062,6417,UgxzGNxlV2XuVxxQbHF4AaABAg,NA,@dsnchntd-no4qu,UCpsMwxBcIB6e7SoOhmDAZmg,I hate that FBI guy,ig,2025-11-30T04:24:19Z,2025-11-29 23:24:19,0,0
k1vWhii4tkE,Tyler Perry’s STRAW | Official Trailer | Netflix,UCWOA1ZGywLbqmigxE4Qlvuw,Netflix,2025-05-14T15:00:01Z,4580010,45062,6417,UgyUCpdUZkAszm9evF14AaABAg,NA,@creepycrawler632,UCSEyfLX2G7wDy1Ktvg--bnA,It's amazing to see Tyler Perry moved onto outright ripping off John Q.,en,2025-11-29T16:39:31Z,2025-11-29 11:39:31,0,0
k1vWhii4tkE,Tyler Perry’s STRAW | Official Trailer | Netflix,UCWOA1ZGywLbqmigxE4Qlvuw,Netflix,2025-05-14T15:00:01Z,4580010,45062,6417,UgztIueQYgRnTS9oLaV4AaABAg,NA,@dgrn101,UC014XrA3eRcODfoYdmJOQsg,You know it's hard out here for a pimp.,en,2025-11-28T17:46:32Z,2025-11-28 12:46:32,0,0
k1vWhii4tkE,Tyler Perry’s STRAW | Official Trailer | Netflix,UCWOA1ZGywLbqmigxE4Qlvuw,Netflix,2025-05-14T15:00:01Z,4580010,45062,6417,UgzPTH_aBwkh_-zavfp4AaABAg,NA,@VogueJanice,UCxw7JLZsCj644bRwdQtQ8cw,"Terribly written, horrible acting, cornball awful garbage trash movie",NA,2025-11-22T19:39:53Z,2025-11-22 14:39:53,1,1
k1vWhii4tkE,Tyler Perry’s STRAW | Official Trailer | Netflix,UCWOA1ZGywLbqmigxE4Qlvuw,Netflix,2025-05-14T15:00:01Z,4580010,45062,6417,UgzI4hq6h0IP28T7Q2J4AaABAg,NA,@CarlSmith-ze4ks,UC1lRTmJ8pxPlzCd4hF2VNlQ,I hope in February that this movie wins an award!,en,2025-11-21T14:06:02Z,2025-11-21 09:06:02,0,0
k1vWhii4tkE,Tyler Perry’s STRAW | Official Trailer | Netflix,UCWOA1ZGywLbqmigxE4Qlvuw,Netflix,2025-05-14T15:00:01Z,4580010,45062,6417,UgyHHJSTKGjZGbo1ZJZ4AaABAg,NA,@KuzKuz11,UCqJudbYhW6kpYGytjHP84zw,Another black people struggling film. Pass,en,2025-11-21T13:20:00Z,2025-11-21 08:20:00,0,1
k1vWhii4tkE,Tyler Perry’s STRAW | Official Trailer | Netflix,UCWOA1ZGywLbqmigxE4Qlvuw,Netflix,2025-05-14T15:00:01Z,4580010,45062,6417,UgwN6rboEQuXyYjbEHR4AaABAg,NA,@MdChh-y1p,UCEsEpabazgGEYy9LG-9ubWw,💯💂🏾‍♀️💵🔥🔥🔥😤,ne,2025-11-19T09:31:07Z,2025-11-19 04:31:07,0,0
k1vWhii4tkE,Tyler Perry’s STRAW | Official Trailer | Netflix,UCWOA1ZGywLbqmigxE4Qlvuw,Netflix,2025-05-14T15:00:01Z,4580010,45062,6417,UgxNDFJnCjd-5730G2V4AaABAg,NA,@Belleisnice235,UCzlQKaIAQkeqMZGB-9bSfiA,Tyler Perry you pay for my therapy check😭😭😭😭😭😭😭,en,2025-11-17T06:24:10Z,2025-11-17 01:24:10,0,0
k1vWhii4tkE,Tyler Perry’s STRAW | Official Trailer | Netflix,UCWOA1ZGywLbqmigxE4Qlvuw,Netflix,2025-05-14T15:00:01Z,4580010,45062,6417,UgwOiz9aqaXt8rbNktB4AaABAg,NA,@saun_7,UCqTWpMsJFKCmIntxDKR0EGA,Excellent movie!,NA,2025-11-15T21:30:06Z,2025-11-15 16:30:06,0,0
k1vWhii4tkE,Tyler Perry’s STRAW | Official Trailer | Netflix,UCWOA1ZGywLbqmigxE4Qlvuw,Netflix,2025-05-14T15:00:01Z,4580010,45062,6417,Ugz6ezEI9-R6v07oGFh4AaABAg,NA,@Abi_62478,UClBEQTmZ4S6S2bHoZhXGYNA,"Tbh this movie is so sad😭🤧, it broke me my heart 💔 I cried lots of times",en,2025-11-11T02:48:18Z,2025-11-10 21:48:18,0,0
k1vWhii4tkE,Tyler Perry’s STRAW | Official Trailer | Netflix,UCWOA1ZGywLbqmigxE4Qlvuw,Netflix,2025-05-14T15:00:01Z,4580010,45062,6417,UgwzUBgzqwvdBbl5i754AaABAg,NA,@jacintofragoso1211,UCPCwH8ywUcxKlkvrWPmLobg,🤣🤣🤣🤣🤣over acting. Funny🤣🤣🤣🤣🤣,en,2025-11-09T02:06:21Z,2025-11-08 21:06:21,0,0
k1vWhii4tkE,Tyler Perry’s STRAW | Official Trailer | Netflix,UCWOA1ZGywLbqmigxE4Qlvuw,Netflix,2025-05-14T15:00:01Z,4580010,45062,6417,UgxSPqA5AuxHjNugfdp4AaABAg,NA,@BennieGray-x5r,UCOUHc6NXFQYoGKQxPJNV-gw,The most awesome movies all time by Tyler Perry,en,2025-11-07T14:17:26Z,2025-11-07 09:17:26,0,0
k1vWhii4tkE,Tyler Perry’s STRAW | Official Trailer | Netflix,UCWOA1ZGywLbqmigxE4Qlvuw,Netflix,2025-05-14T15:00:01Z,4580010,45062,6417,UgzuKHjIz5P7vQqAxWB4AaABAg,NA,@inaf1079,UC5jFvBYj8dqMhszEM9CHUHw,"Taraji did an amazing job in this movie, but...... Why is Tyler Perry so racist? Every single white person in this movie was portrayed as a major asshole. Sigh 🙄",en,2025-11-07T06:06:55Z,2025-11-07 01:06:55,0,0
k1vWhii4tkE,Tyler Perry’s STRAW | Official Trailer | Netflix,UCWOA1ZGywLbqmigxE4Qlvuw,Netflix,2025-05-14T15:00:01Z,4580010,45062,6417,UgwYht5jz6eI-VUks754AaABAg,NA,@OneWithZionz,UCbAerCsS-WGKpK8LrcbtPyQ,"Personally, loved it",en,2025-11-02T11:16:44Z,2025-11-02 06:16:44,0,0
k1vWhii4tkE,Tyler Perry’s STRAW | Official Trailer | Netflix,UCWOA1ZGywLbqmigxE4Qlvuw,Netflix,2025-05-14T15:00:01Z,4580010,45062,6417,Ugz3EgxKQIFBz60nDoJ4AaABAg,NA,@2F098,UCi33me1OfdFze47RNhLB-Zw,This was almost a masterpiece but too many plot holes for my taste. Still a very good watch and would recommend.,en,2025-10-31T18:05:25Z,2025-10-31 14:05:25,1,0
k1vWhii4tkE,Tyler Perry’s STRAW | Official Trailer | Netflix,UCWOA1ZGywLbqmigxE4Qlvuw,Netflix,2025-05-14T15:00:01Z,4580010,45062,6417,Ugw0BmQ0eOgwLoDlM-p4AaABAg,NA,@ReggieWilson-gm5dl,UCM_iZpkDj8Grw87oGANPeeg,Taraji P. Henson should be nominated for this,en,2025-10-31T00:30:27Z,2025-10-30 20:30:27,1,0
k1vWhii4tkE,Tyler Perry’s STRAW | Official Trailer | Netflix,UCWOA1ZGywLbqmigxE4Qlvuw,Netflix,2025-05-14T15:00:01Z,4580010,45062,6417,UgzF5lRYNbK1FzcRxxt4AaABAg,NA,@jwhistler2005,UCTD5tMgkTnMV0mHKN6P-Dfw,"As long as you've got a b(!)tth°le, you have a source of income. 😂",NA,2025-10-21T16:26:47Z,2025-10-21 12:26:47,0,0
k1vWhii4tkE,Tyler Perry’s STRAW | Official Trailer | Netflix,UCWOA1ZGywLbqmigxE4Qlvuw,Netflix,2025-05-14T15:00:01Z,4580010,45062,6417,UgxjS6eS0NAJRessmf14AaABAg,NA,@carlosgonzalez5467,UCAuByeienf4fRUGnkxBx4bg,This a 2025 version of John q,NA,2025-10-15T01:03:46Z,2025-10-14 21:03:46,0,0
k1vWhii4tkE,Tyler Perry’s STRAW | Official Trailer | Netflix,UCWOA1ZGywLbqmigxE4Qlvuw,Netflix,2025-05-14T15:00:01Z,4580010,45062,6417,UgzoZhD6BHhipl3m7rx4AaABAg,NA,@John-lo9qe,UCc-luQqs6iKRxzDxAikpH1w,That's thousands of people daily in America now because of inflation minus the bank robbery! While our politicians live like kings off our blood sweat and tears! Time to start eating the rich,en,2025-10-13T10:13:59Z,2025-10-13 06:13:59,1,0
k1vWhii4tkE,Tyler Perry’s STRAW | Official Trailer | Netflix,UCWOA1ZGywLbqmigxE4Qlvuw,Netflix,2025-05-14T15:00:01Z,4580010,45062,6417,UgzGQ6Zwto25Rxacb4J4AaABAg,NA,@YusufEbr,UCZYJm7hvdv0oP19T0FyBAmw,Give her an Oscar FFS.,NA,2025-10-13T08:53:57Z,2025-10-13 04:53:57,0,0
k1vWhii4tkE,Tyler Perry’s STRAW | Official Trailer | Netflix,UCWOA1ZGywLbqmigxE4Qlvuw,Netflix,2025-05-14T15:00:01Z,4580010,45062,6417,UgwmuiXYQTciG5NMOr54AaABAg,NA,@michaeljefferson8460,UCe8yIcxxCe_9Wf7hExZlIEg,JOHN Q all over again and I’m ABSOLUTELY HERE FOR IT.,en,2025-10-11T00:24:44Z,2025-10-10 20:24:44,0,0
k1vWhii4tkE,Tyler Perry’s STRAW | Official Trailer | Netflix,UCWOA1ZGywLbqmigxE4Qlvuw,Netflix,2025-05-14T15:00:01Z,4580010,45062,6417,UgxZc7n3SG5SgAYGYXt4AaABAg,NA,@Yaravegxta,UCuBpADXuKKx0XKXX4U-wBaQ,I watched this and a week later quit my job of 5 years 😂,en,2025-10-05T10:46:51Z,2025-10-05 06:46:51,0,0
k1vWhii4tkE,Tyler Perry’s STRAW | Official Trailer | Netflix,UCWOA1ZGywLbqmigxE4Qlvuw,Netflix,2025-05-14T15:00:01Z,4580010,45062,6417,UgzehoICc1tK_QTbywx4AaABAg,NA,@smalltime316,UCx6s_k0zcJ2pN0OjORMmOGQ,Worst ending ever.. wtf!! I don’t know about the comments I’m reading. The end made the entire movie pointless.. cliffhanger type shit.,en,2025-10-03T07:13:11Z,2025-10-03 03:13:11,2,0
k1vWhii4tkE,Tyler Perry’s STRAW | Official Trailer | Netflix,UCWOA1ZGywLbqmigxE4Qlvuw,Netflix,2025-05-14T15:00:01Z,4580010,45062,6417,UgwNM7KIOBxcFSGLUl94AaABAg,NA,@theunfortunatepatriot,UCVhDjxWc6FQFRAqyRCsJ2rA,So now we are romanticizing being entitled? As if being victimized by 13% is not enough?,en,2025-10-02T22:26:49Z,2025-10-02 18:26:49,1,0
k1vWhii4tkE,Tyler Perry’s STRAW | Official Trailer | Netflix,UCWOA1ZGywLbqmigxE4Qlvuw,Netflix,2025-05-14T15:00:01Z,4580010,45062,6417,UgyIZWTSCmAWX4YmVkp4AaABAg,NA,@endingalaporte,UCHccOLqJ28r881--fnmEIDw,single mother are heroes,en,2025-10-02T00:43:39Z,2025-10-01 20:43:39,1,0
k1vWhii4tkE,Tyler Perry’s STRAW | Official Trailer | Netflix,UCWOA1ZGywLbqmigxE4Qlvuw,Netflix,2025-05-14T15:00:01Z,4580010,45062,6417,UgxPMkjbJHwmAATvSK14AaABAg,NA,@duckling4393,UC_W17ZSP3tz6slelQ4eCiXQ,Everyone is black...where's the uproar about diversity,en,2025-09-30T18:11:13Z,2025-09-30 14:11:13,0,1
k1vWhii4tkE,Tyler Perry’s STRAW | Official Trailer | Netflix,UCWOA1ZGywLbqmigxE4Qlvuw,Netflix,2025-05-14T15:00:01Z,4580010,45062,6417,Ugy4LYKbX8Adr8bvZcl4AaABAg,NA,@PowerRain-m8g,UC2SxmzYdsXh7B3nV9Dcdd8w,Taraji is a puppet! She worships a whole different  god.,en,2025-09-28T21:00:19Z,2025-09-28 17:00:19,0,0
k1vWhii4tkE,Tyler Perry’s STRAW | Official Trailer | Netflix,UCWOA1ZGywLbqmigxE4Qlvuw,Netflix,2025-05-14T15:00:01Z,4580010,45062,6417,Ugx65r6MUhKK9xY92WR4AaABAg,NA,@PowerRain-m8g,UC2SxmzYdsXh7B3nV9Dcdd8w,"Terrible! Stereotypical 
.horrible",en,2025-09-28T20:58:57Z,2025-09-28 16:58:57,0,0
k1vWhii4tkE,Tyler Perry’s STRAW | Official Trailer | Netflix,UCWOA1ZGywLbqmigxE4Qlvuw,Netflix,2025-05-14T15:00:01Z,4580010,45062,6417,UgwvFfVUqXokDp85HCZ4AaABAg,NA,@MsDsTips,UCtlyrlNE25zoRgS3CmhlsOg,I cried watching 😢l really shed tears 😢,en,2025-09-28T00:04:58Z,2025-09-27 20:04:58,2,0
k1vWhii4tkE,Tyler Perry’s STRAW | Official Trailer | Netflix,UCWOA1ZGywLbqmigxE4Qlvuw,Netflix,2025-05-14T15:00:01Z,4580010,45062,6417,Ugx4UqQlB_57JsKYQuJ4AaABAg,NA,@maqueen61,UCX31-Xjtm95UYCr6MEcmvcA,"Tyler Perry omg plzzzz find something else to do!!!!🫩 How you have Taraji supposedly go into a ""Closed"" for the day bank whereas the guard wasn't going to let her in??!!😐 Then a couple scenes right after got ppl standing in line waiting to cash checks??!! Like WaaaaaT??!! Uuuuggghhhh noooooo more Tyler Perry movie or shows for me....DONE!!!!👎🏽👎🏽👎🏽👎🏽☹️😪😡",en,2025-09-27T15:36:23Z,2025-09-27 11:36:23,0,0
k1vWhii4tkE,Tyler Perry’s STRAW | Official Trailer | Netflix,UCWOA1ZGywLbqmigxE4Qlvuw,Netflix,2025-05-14T15:00:01Z,4580010,45062,6417,UgwuirTaPmgEOF4rQjZ4AaABAg,NA,@OKEREKEGODFREY-bw8by,UCXU5CK25jxNOb6uEHbqUhYw,Kudus to that female inspector she felt it too as a human. I respect from the start of the investigation where shes tryna correct her colleague concerning the how her boss  was shot,en,2025-09-26T22:32:09Z,2025-09-26 18:32:09,1,0
k1vWhii4tkE,Tyler Perry’s STRAW | Official Trailer | Netflix,UCWOA1ZGywLbqmigxE4Qlvuw,Netflix,2025-05-14T15:00:01Z,4580010,45062,6417,Ugx37jtYzyXMdPZMJMp4AaABAg,NA,@torriebrown9607,UC0bhWxQTVBJ93r07M6EIHDg,This movie made me cry. Unbelievable hurts.,en,2025-09-26T19:05:58Z,2025-09-26 15:05:58,0,0
k1vWhii4tkE,Tyler Perry’s STRAW | Official Trailer | Netflix,UCWOA1ZGywLbqmigxE4Qlvuw,Netflix,2025-05-14T15:00:01Z,4580010,45062,6417,UgynZRSGLUqe2jBAO214AaABAg,NA,@AlphardTenor,UCq8fSKQlNEVVru0QjoWGhDg,Amazing movie.. reflect to real life,en,2025-09-26T05:22:18Z,2025-09-26 01:22:18,0,0
k1vWhii4tkE,Tyler Perry’s STRAW | Official Trailer | Netflix,UCWOA1ZGywLbqmigxE4Qlvuw,Netflix,2025-05-14T15:00:01Z,4580010,45062,6417,Ugz4WgEyxWD17I55RdV4AaABAg,NA,@kenishah.784,UCkM6c7aUacOLACuA4RN0s9g,This movie needs a trigger warning ⚠️ 💯😞,en,2025-09-24T21:14:43Z,2025-09-24 17:14:43,0,0
k1vWhii4tkE,Tyler Perry’s STRAW | Official Trailer | Netflix,UCWOA1ZGywLbqmigxE4Qlvuw,Netflix,2025-05-14T15:00:01Z,4580010,45062,6417,UgyV9v2IWFFlmINlpjJ4AaABAg,NA,@darkcognitive,UC1ErFr5I0kafmDbxPtqCKPA,"Saw this like 2 years ago in the UK, wtf Netflix....",en,2025-09-24T01:42:51Z,2025-09-23 21:42:51,0,0
k1vWhii4tkE,Tyler Perry’s STRAW | Official Trailer | Netflix,UCWOA1ZGywLbqmigxE4Qlvuw,Netflix,2025-05-14T15:00:01Z,4580010,45062,6417,UgzqlpXkLtJhLPsrt7N4AaABAg,NA,@sunnyday4055,UCndgqLNWXVlpm3_XXgQUfrw,Omg so original omg daniel Washington but female.,cy,2025-09-23T18:06:35Z,2025-09-23 14:06:35,0,0
k1vWhii4tkE,Tyler Perry’s STRAW | Official Trailer | Netflix,UCWOA1ZGywLbqmigxE4Qlvuw,Netflix,2025-05-14T15:00:01Z,4580010,45062,6417,UgyzyzXu3uf4pifnXV54AaABAg,NA,@slm1496,UCCAhPFtdFLZ3K37vxmlI1KA,Why are white people being racist in the comments.. if you don't like it fine but that hate y'all have will NEVER stop black people from being great!,en,2025-09-21T20:33:32Z,2025-09-21 16:33:32,0,2
k1vWhii4tkE,Tyler Perry’s STRAW | Official Trailer | Netflix,UCWOA1ZGywLbqmigxE4Qlvuw,Netflix,2025-05-14T15:00:01Z,4580010,45062,6417,UgwBhkgv_MEY5_wZ2pJ4AaABAg,NA,@slm1496,UCCAhPFtdFLZ3K37vxmlI1KA,"I didn't get to watch this when it first came out because I didn't have netflix, I finally paid to watch it and I cried from start to finish. 

I felt every emotion, every tears and pain of Jania....I'm not a mother, but I know how it feels to have no one to call on for help...no one to hug you and tell you things will be ok.

Tyler Perry, this was phenomenal! 👏🏾",en,2025-09-21T20:27:43Z,2025-09-21 16:27:43,3,0
k1vWhii4tkE,Tyler Perry’s STRAW | Official Trailer | Netflix,UCWOA1ZGywLbqmigxE4Qlvuw,Netflix,2025-05-14T15:00:01Z,4580010,45062,6417,UgwX8feL5aN9qrEI_7d4AaABAg,NA,@cinderellaasmr,UCBqjFh6FtTADx8dCzhJ-Yww,"This movie was so so so good! I think I have only watched Madea movies from Tyler Perry, this movie was touching i teared up. So raw and I hope Taraji gets an award for this because she is amazing! Oh my! I felt what she felt through the screen that’s a damn good actress! Bravo! 👏",en,2025-09-21T02:16:58Z,2025-09-20 22:16:58,2,0
k1vWhii4tkE,Tyler Perry’s STRAW | Official Trailer | Netflix,UCWOA1ZGywLbqmigxE4Qlvuw,Netflix,2025-05-14T15:00:01Z,4580010,45062,6417,Ugzv-pNgFhpgM-kKDl94AaABAg,NA,@SuperSaiyanAK,UCR3QMTfdzOqwBuFP3b2GNTw,One of the most dumbest movie. Nothing but black fatigue,en,2025-09-20T22:58:37Z,2025-09-20 18:58:37,1,0
k1vWhii4tkE,Tyler Perry’s STRAW | Official Trailer | Netflix,UCWOA1ZGywLbqmigxE4Qlvuw,Netflix,2025-05-14T15:00:01Z,4580010,45062,6417,UgxfhJAWkZB0QgxTJqh4AaABAg,NA,@PAPPADASH,UCsXH3Rg6TSUAxfCEEMOnfAA,Sub Saharans committing crime go figure,NA,2025-09-17T23:53:03Z,2025-09-17 19:53:03,0,0
k1vWhii4tkE,Tyler Perry’s STRAW | Official Trailer | Netflix,UCWOA1ZGywLbqmigxE4Qlvuw,Netflix,2025-05-14T15:00:01Z,4580010,45062,6417,UgwxRwbKnDt4VzQmuBl4AaABAg,NA,@Riley880,UCRvXUkopQTy1QzIuoK0jbBw,"its Offended by Everything Ashamed of Nothing, the movie. What where they thinking this is pure cringe.",en,2025-09-17T22:09:13Z,2025-09-17 18:09:13,0,0
k1vWhii4tkE,Tyler Perry’s STRAW | Official Trailer | Netflix,UCWOA1ZGywLbqmigxE4Qlvuw,Netflix,2025-05-14T15:00:01Z,4580010,45062,6417,UgwKqnwH0Iyt4rj5Sqp4AaABAg,NA,@Salvatoressa,UCTU3lS6uUl4diwutjYrJiGA,Im cry hours for this movie,en,2025-09-11T15:17:37Z,2025-09-11 11:17:37,2,0
k1vWhii4tkE,Tyler Perry’s STRAW | Official Trailer | Netflix,UCWOA1ZGywLbqmigxE4Qlvuw,Netflix,2025-05-14T15:00:01Z,4580010,45062,6417,UgzVcselm7KWdrQOo414AaABAg,NA,@dusantatar3262,UCUwxLpfuJZrmKpz668uoP3A,John Q 🙂,NA,2025-09-11T08:13:38Z,2025-09-11 04:13:38,0,0
k1vWhii4tkE,Tyler Perry’s STRAW | Official Trailer | Netflix,UCWOA1ZGywLbqmigxE4Qlvuw,Netflix,2025-05-14T15:00:01Z,4580010,45062,6417,Ugzu-BFfadrwfbd1eZl4AaABAg,NA,@freespirit7450,UClyWYXvy1oO4PNN-N__3-Tg,Beautiful and sad movie.,NA,2025-09-11T05:28:28Z,2025-09-11 01:28:28,0,0
k1vWhii4tkE,Tyler Perry’s STRAW | Official Trailer | Netflix,UCWOA1ZGywLbqmigxE4Qlvuw,Netflix,2025-05-14T15:00:01Z,4580010,45062,6417,UgyKEY6vf-7zRe7SkMh4AaABAg,NA,@morelikesani,UCpdP-HuEW14-CnbBkhAfoFA,👎👎👎👎👎👎👎,ja,2025-09-09T05:17:05Z,2025-09-09 01:17:05,0,0
k1vWhii4tkE,Tyler Perry’s STRAW | Official Trailer | Netflix,UCWOA1ZGywLbqmigxE4Qlvuw,Netflix,2025-05-14T15:00:01Z,4580010,45062,6417,UgxAtvFpXmUYOcUHhcp4AaABAg,NA,@JohnDoe-uy3es,UC6iYnIBS0KwcMZEgJZ-4mkQ,Ähnlich wie John Q mit Denzel Washington,de,2025-09-08T20:24:12Z,2025-09-08 16:24:12,0,0
k1vWhii4tkE,Tyler Perry’s STRAW | Official Trailer | Netflix,UCWOA1ZGywLbqmigxE4Qlvuw,Netflix,2025-05-14T15:00:01Z,4580010,45062,6417,UgykVVwUHA_gkKkUWah4AaABAg,NA,@PriyankaKumar-t9y,UCngQpNlrX01el67HmSHZoEw,Taraji P- wow girl!! You need Oscar award. I had tears through out the movie.,NA,2025-09-08T02:41:14Z,2025-09-07 22:41:14,0,0
k1vWhii4tkE,Tyler Perry’s STRAW | Official Trailer | Netflix,UCWOA1ZGywLbqmigxE4Qlvuw,Netflix,2025-05-14T15:00:01Z,4580010,45062,6417,Ugw3k0nuv14l9OaAsPF4AaABAg,NA,@mujderhan2412,UC9Ny0LqfiHXPZoS2FfccirA,Just watching it with my mum we couldnt stop crying😢😢😢😢,en,2025-09-05T21:19:18Z,2025-09-05 17:19:18,3,1
k1vWhii4tkE,Tyler Perry’s STRAW | Official Trailer | Netflix,UCWOA1ZGywLbqmigxE4Qlvuw,Netflix,2025-05-14T15:00:01Z,4580010,45062,6417,Ugye9dIAJne7CxbThxt4AaABAg,NA,@LouiCypher-e7u,UClL865J9tY8Wmak34tdtB2g,This propaganda piece alone will get thousands of black's incarcerate 😂,en,2025-09-04T17:09:02Z,2025-09-04 13:09:02,0,0
k1vWhii4tkE,Tyler Perry’s STRAW | Official Trailer | Netflix,UCWOA1ZGywLbqmigxE4Qlvuw,Netflix,2025-05-14T15:00:01Z,4580010,45062,6417,UgyYotW59rr9aUSwLZh4AaABAg,NA,@squirrel_777,UC4sDj4uhSdBfCkjgVI2cSUA,She acts so naturally. Loved this film,en,2025-09-04T12:20:23Z,2025-09-04 08:20:23,1,0
k1vWhii4tkE,Tyler Perry’s STRAW | Official Trailer | Netflix,UCWOA1ZGywLbqmigxE4Qlvuw,Netflix,2025-05-14T15:00:01Z,4580010,45062,6417,UgyL39_uE_Oxh4leuPp4AaABAg,NA,@veheeo720,UCCfQz59LgwPfWtIYfD83zBg,Loved it when the officer punched the other  $%*^#🕺,en,2025-09-02T01:17:59Z,2025-09-01 21:17:59,2,0
k1vWhii4tkE,Tyler Perry’s STRAW | Official Trailer | Netflix,UCWOA1ZGywLbqmigxE4Qlvuw,Netflix,2025-05-14T15:00:01Z,4580010,45062,6417,UgyyFB0uOeXfTLki43p4AaABAg,NA,@malenyluna5275,UCQ5L8jikcgjTOilIDEIapmQ,"Heartbreaking.  Props to all the single moms out there. 

Taraji was amazing !! Teyana also did a great job.",en,2025-09-01T03:12:53Z,2025-08-31 23:12:53,2,0
k1vWhii4tkE,Tyler Perry’s STRAW | Official Trailer | Netflix,UCWOA1ZGywLbqmigxE4Qlvuw,Netflix,2025-05-14T15:00:01Z,4580010,45062,6417,Ugz6FuN_kCN84FxIXMZ4AaABAg,NA,@Domthesniper,UCWetbN7Ta8o4mDLd7K8XbvA,Never seen such much bad acting in a movie together,en,2025-08-31T14:06:45Z,2025-08-31 10:06:45,0,0
k1vWhii4tkE,Tyler Perry’s STRAW | Official Trailer | Netflix,UCWOA1ZGywLbqmigxE4Qlvuw,Netflix,2025-05-14T15:00:01Z,4580010,45062,6417,UgwfA08KbQxyqIaATgR4AaABAg,NA,@veronicayoung1105,UC82TH_-LhN1RE8CpIClUE2Q,"Tyler if you get to read this. I’ve been on your message board for years when you had it up and would comment on there if you still had it. So please take what about to say in humor. I was crying my behind off about this movie. Just broke my heart so you need yo axx whooped. I love you man but you took it there. 

Now on top of Taraji’s check please slip her another $1,000,000 under the table and an additional $40 because she killed this one too. I’m so proud of you all. Great job. Dang, now I need to find something happy to watch to get me out of the dumps.",en,2025-08-30T22:44:38Z,2025-08-30 18:44:38,0,0
k1vWhii4tkE,Tyler Perry’s STRAW | Official Trailer | Netflix,UCWOA1ZGywLbqmigxE4Qlvuw,Netflix,2025-05-14T15:00:01Z,4580010,45062,6417,Ugw0ta3yTiGGRu9VGZx4AaABAg,NA,@MeeMo27,UCN_UYDyC0XvuAQ6hImd6u3w,I think it’s about time Taraji wins an Oscar,NA,2025-08-30T20:32:51Z,2025-08-30 16:32:51,1,0
k1vWhii4tkE,Tyler Perry’s STRAW | Official Trailer | Netflix,UCWOA1ZGywLbqmigxE4Qlvuw,Netflix,2025-05-14T15:00:01Z,4580010,45062,6417,Ugzf-GXyIWXRk6mb3fx4AaABAg,NA,@MO_SPEKTRE,UC113qdZGgp0RzZaouY4E7Iw,Is this the same bank from Den of Thieves?,en,2025-08-30T04:44:02Z,2025-08-30 00:44:02,0,0
k1vWhii4tkE,Tyler Perry’s STRAW | Official Trailer | Netflix,UCWOA1ZGywLbqmigxE4Qlvuw,Netflix,2025-05-14T15:00:01Z,4580010,45062,6417,UgxpTN4TcOI_eBQj_2d4AaABAg,NA,@Louis275,UCWwLH9imjHwQaj9yCs5LjeA,John Q inspired movie!!,NA,2025-08-28T19:38:58Z,2025-08-28 15:38:58,0,0
k1vWhii4tkE,Tyler Perry’s STRAW | Official Trailer | Netflix,UCWOA1ZGywLbqmigxE4Qlvuw,Netflix,2025-05-14T15:00:01Z,4580010,45062,6417,UgydPrMCkYTApIqtBZd4AaABAg,NA,@adrianl7147,UCqH3dRI2uToFgNiA5uJ9aVA,So.....so....so bad,sl,2025-08-27T02:48:38Z,2025-08-26 22:48:38,0,0
k1vWhii4tkE,Tyler Perry’s STRAW | Official Trailer | Netflix,UCWOA1ZGywLbqmigxE4Qlvuw,Netflix,2025-05-14T15:00:01Z,4580010,45062,6417,Ugx9yx8ML-QDqa8P7Y94AaABAg,NA,@DavidBenZev,UCVheFQfNya7B9Nwz7jgrWww,Loved this movie so much. Taraji is freakin amazing,NA,2025-08-26T23:41:46Z,2025-08-26 19:41:46,1,0
k1vWhii4tkE,Tyler Perry’s STRAW | Official Trailer | Netflix,UCWOA1ZGywLbqmigxE4Qlvuw,Netflix,2025-05-14T15:00:01Z,4580010,45062,6417,Ugx_JtcteO6tb94UwSV4AaABAg,NA,@jesse29051,UCLaOc68HgjftAsrWDbR3nsQ,This has got to be the Dumbest Movie I’ve ever Watched FUUUUUDGE! 🗣️,en,2025-08-26T01:19:49Z,2025-08-25 21:19:49,0,0
k1vWhii4tkE,Tyler Perry’s STRAW | Official Trailer | Netflix,UCWOA1ZGywLbqmigxE4Qlvuw,Netflix,2025-05-14T15:00:01Z,4580010,45062,6417,UgxLr5r_Wm5G7frJ4n54AaABAg,NA,@kajunegi4453,UC5LBtn8fXJXRHiIBpVZl6mA,😭😭 peoples are always cruel,NA,2025-08-25T08:53:31Z,2025-08-25 04:53:31,0,1
k1vWhii4tkE,Tyler Perry’s STRAW | Official Trailer | Netflix,UCWOA1ZGywLbqmigxE4Qlvuw,Netflix,2025-05-14T15:00:01Z,4580010,45062,6417,UgwrEUqN3kKBrGVF7_x4AaABAg,NA,@EveryDayLifeChannel9777,UCFr8ZoufteZrjGB9Smf3I1A,Tyler Perry movies are like the beats I make dope ideas but trash production. Unlike him though I'm getting better because I know how to take feedback and do research 😂,en,2025-08-24T23:04:27Z,2025-08-24 19:04:27,0,0
k1vWhii4tkE,Tyler Perry’s STRAW | Official Trailer | Netflix,UCWOA1ZGywLbqmigxE4Qlvuw,Netflix,2025-05-14T15:00:01Z,4580010,45062,6417,Ugz9PRflGtdGVjhs2Ep4AaABAg,NA,@Lucky28PT,UCahMA-HvD5mQsj8LJVRJ_jA,This was awful 🤣🤣🤣,en,2025-08-24T19:38:20Z,2025-08-24 15:38:20,0,0
k1vWhii4tkE,Tyler Perry’s STRAW | Official Trailer | Netflix,UCWOA1ZGywLbqmigxE4Qlvuw,Netflix,2025-05-14T15:00:01Z,4580010,45062,6417,UgxXp3JIuhMbrbZdqsl4AaABAg,NA,@thestanz83,UC0DvS7Z50LPPcQiN_iFczdg,they remade Set It Off?,en,2025-08-24T17:22:22Z,2025-08-24 13:22:22,0,0
k1vWhii4tkE,Tyler Perry’s STRAW | Official Trailer | Netflix,UCWOA1ZGywLbqmigxE4Qlvuw,Netflix,2025-05-14T15:00:01Z,4580010,45062,6417,Ugz4dRko7g1C5fV-sLl4AaABAg,NA,@Destroy__Youtube,UC98qC4LDA4cXvKb2coaGjKQ,Trash bank,NA,2025-08-24T08:32:55Z,2025-08-24 04:32:55,0,0
k1vWhii4tkE,Tyler Perry’s STRAW | Official Trailer | Netflix,UCWOA1ZGywLbqmigxE4Qlvuw,Netflix,2025-05-14T15:00:01Z,4580010,45062,6417,Ugyz1En_rOiSCKtcW514AaABAg,NA,@djmatthewcarreon,UC_XvZa1MbCy3O174zEdGOwQ,Good movie,NA,2025-08-24T05:13:25Z,2025-08-24 01:13:25,1,0
k1vWhii4tkE,Tyler Perry’s STRAW | Official Trailer | Netflix,UCWOA1ZGywLbqmigxE4Qlvuw,Netflix,2025-05-14T15:00:01Z,4580010,45062,6417,Ugy04IUtomYjbx_1jvd4AaABAg,NA,@WinstonCharles2010,UCjkFn3RLTtmsdp1BNsKEyzw,I see one of the characters or two maybe look like good actors ….is this worth watching because usually I can’t finish Tyler Perry movies coz he’s just basically hiring beautiful people that cant really act😂,en,2025-08-24T02:14:18Z,2025-08-23 22:14:18,1,0
k1vWhii4tkE,Tyler Perry’s STRAW | Official Trailer | Netflix,UCWOA1ZGywLbqmigxE4Qlvuw,Netflix,2025-05-14T15:00:01Z,4580010,45062,6417,Ugy23cg9Nbch9GUXuKR4AaABAg,NA,@BranDawg81,UC7Qx6JkZ2U-VTyAGTHxDxww,"👍 if that crazy chick on the “Police Body-Cam” channel sent you here!👮 📸 

I know I ain’t the only one..😂 😮",en,2025-08-24T00:47:11Z,2025-08-23 20:47:11,0,0
k1vWhii4tkE,Tyler Perry’s STRAW | Official Trailer | Netflix,UCWOA1ZGywLbqmigxE4Qlvuw,Netflix,2025-05-14T15:00:01Z,4580010,45062,6417,UgwTwnQ_rZB3KAOUZ6x4AaABAg,NA,@D-Fens_Spawn,UCIxVT0eVivEASqLo7BvJb-A,People say this was made in 4 days and I believe it. 🤣,en,2025-08-24T00:07:35Z,2025-08-23 20:07:35,0,0
k1vWhii4tkE,Tyler Perry’s STRAW | Official Trailer | Netflix,UCWOA1ZGywLbqmigxE4Qlvuw,Netflix,2025-05-14T15:00:01Z,4580010,45062,6417,Ugxn1-ZbOsz5apjOxSd4AaABAg,NA,@RobynnexPaula,UCm1UfJUuC2XeJmEo1u97b7Q,Her manager pissed me off 😡,en,2025-08-23T16:27:15Z,2025-08-23 12:27:15,3,0
k1vWhii4tkE,Tyler Perry’s STRAW | Official Trailer | Netflix,UCWOA1ZGywLbqmigxE4Qlvuw,Netflix,2025-05-14T15:00:01Z,4580010,45062,6417,UgxLZd1HAUFe07GZCsp4AaABAg,NA,@Trisha-n3f1w,UC3Jki9zyEgtOamC6yvvjB2g,It's a sad world you can get thrown out of your home for no reason in any state if you don't even owe back rent they can evict you I am going through it right now I owe no background my landlord is not want to renew my lease I have nowhere to go I'm disabled it's a sad world that we live in but it seems like the landlord's always right movies incredible know I don't believe in robbing a bank to get money you have to earn it but it's awful what the system is allowing this happened to happen to people that have not done nothing wrong hopefully the broken system will heal it self😢,en,2025-08-23T14:07:55Z,2025-08-23 10:07:55,3,1
k1vWhii4tkE,Tyler Perry’s STRAW | Official Trailer | Netflix,UCWOA1ZGywLbqmigxE4Qlvuw,Netflix,2025-05-14T15:00:01Z,4580010,45062,6417,Ugw78SlL_d5XjHehd2l4AaABAg,NA,@erickfcc,UCuKS63Laa54pNAPhIXQ4naw,Horrible ass movie,lb,2025-08-23T05:04:04Z,2025-08-23 01:04:04,0,0
k1vWhii4tkE,Tyler Perry’s STRAW | Official Trailer | Netflix,UCWOA1ZGywLbqmigxE4Qlvuw,Netflix,2025-05-14T15:00:01Z,4580010,45062,6417,Ugxz1ivUd5hmZQ6DwM54AaABAg,NA,@king_bang40kang72,UCLUe1ntc6-Y95d5l-FQPacg,she never said something inside her broke..they added that,en,2025-08-23T00:49:11Z,2025-08-22 20:49:11,1,0
