video_id,video_title,channel_id,channel_title,video_published_at,view_count,video_like_count,video_comment_count,comment_id,comment_parent_id,comment_author_display,comment_author_channel_id,comment_text,comment_lang,comment_published_utc,comment_published_local,comment_like_count,comment_reply_count
k1vWhii4tkE,Tyler Perry’s STRAW | Official Trailer | Netflix,UCWOA1ZGywLbqmigxE4Qlvuw,Netflix,2025-05-14T15:00:01Z,4580010,45062,6417,Ugy0CEf-A656iN1K43Z4AaABAg,NA,@Lily_oii,UCJux7cY6XBz-CS4nF75KH8g,"Amazing movies 🎥 ❤ 
Definitely cried 😭😭",NA,2025-06-15T05:28:19Z,2025-06-15 01:28:19,0,0
k1vWhii4tkE,Tyler Perry’s STRAW | Official Trailer | Netflix,UCWOA1ZGywLbqmigxE4Qlvuw,Netflix,2025-05-14T15:00:01Z,4580010,45062,6417,UgwblCi5vQr1VPt6OKZ4AaABAg,NA,@amayajx,UCMmA4Fxg58wXjx9cShznwmA,She always sweaty and frustrated 😂,en,2025-06-15T04:56:25Z,2025-06-15 00:56:25,2,0
k1vWhii4tkE,Tyler Perry’s STRAW | Official Trailer | Netflix,UCWOA1ZGywLbqmigxE4Qlvuw,Netflix,2025-05-14T15:00:01Z,4580010,45062,6417,UgzWdBsDOIeQB8hiG4t4AaABAg,NA,@pauldiaferia8499,UCigzQ0KmUwzG3VEbiAOXsBg,EXCELLENT MOVIE!!!!!!!!!!!!!,NA,2025-06-15T04:53:49Z,2025-06-15 00:53:49,1,0
k1vWhii4tkE,Tyler Perry’s STRAW | Official Trailer | Netflix,UCWOA1ZGywLbqmigxE4Qlvuw,Netflix,2025-05-14T15:00:01Z,4580010,45062,6417,Ugy_ipi4SQEsbbkKChJ4AaABAg,NA,@ciantui1794,UCfVAHhbtBdYVJXqsRUQH9Sg,"Almost all cast are BLACK. All protagonists BLACK..... white people are reduced to either supporting cast and antagonists. ! if this is reversed, these people will surely cry RACISM!!!

Nonetheless, the plot is pathetic and unoriginal.",en,2025-06-15T04:10:00Z,2025-06-15 00:10:00,1,0
k1vWhii4tkE,Tyler Perry’s STRAW | Official Trailer | Netflix,UCWOA1ZGywLbqmigxE4Qlvuw,Netflix,2025-05-14T15:00:01Z,4580010,45062,6417,UgyNO0qNcD-yr-IlDrB4AaABAg,NA,@BruceDragon-sf1tr,UCiG5Kkmur3nrbIiI8De6cpQ,Basically some feminists film,NA,2025-06-15T03:56:40Z,2025-06-14 23:56:40,0,0
k1vWhii4tkE,Tyler Perry’s STRAW | Official Trailer | Netflix,UCWOA1ZGywLbqmigxE4Qlvuw,Netflix,2025-05-14T15:00:01Z,4580010,45062,6417,UgwayrPC_-Gl5mhwRT54AaABAg,NA,@Xystosz,UCodkyDx-zmUUckIS4-_emNA,Ehhh.... from the looks of it I wont be missing out on much if i dont watch it,en,2025-06-15T03:51:05Z,2025-06-14 23:51:05,1,0
k1vWhii4tkE,Tyler Perry’s STRAW | Official Trailer | Netflix,UCWOA1ZGywLbqmigxE4Qlvuw,Netflix,2025-05-14T15:00:01Z,4580010,45062,6417,Ugylm8SGzxoSOFvEYyx4AaABAg,NA,@adrianfeliciano7404,UC6VdW_7sfaAo8kQ_9HwSKtg,loved the movie. it shows the real trigger and discrimination against women,en,2025-06-15T03:35:00Z,2025-06-14 23:35:00,0,0
k1vWhii4tkE,Tyler Perry’s STRAW | Official Trailer | Netflix,UCWOA1ZGywLbqmigxE4Qlvuw,Netflix,2025-05-14T15:00:01Z,4580010,45062,6417,Ugzd8aDQ5Bef-OnxTWp4AaABAg,NA,@45kittyboo,UCN2dEWRD7phRapgxCxGnjZg,Some AWESOME ACTORS.......STANDING OVATION 👏🏽,en,2025-06-15T03:30:36Z,2025-06-14 23:30:36,0,0
k1vWhii4tkE,Tyler Perry’s STRAW | Official Trailer | Netflix,UCWOA1ZGywLbqmigxE4Qlvuw,Netflix,2025-05-14T15:00:01Z,4580010,45062,6417,UgxlZkNrdx9rVU0FFIF4AaABAg,NA,@reigndigrazia1,UCtVc6y68EZCSTyTMyFD6wZg,"Aside from the main characters acting, everyone else’s is terrible. Some of the scenes were hella awkward too",en,2025-06-15T03:12:22Z,2025-06-14 23:12:22,1,0
k1vWhii4tkE,Tyler Perry’s STRAW | Official Trailer | Netflix,UCWOA1ZGywLbqmigxE4Qlvuw,Netflix,2025-05-14T15:00:01Z,4580010,45062,6417,UgyLMJ0Qm0pIqg3Ail94AaABAg,NA,@SofaKingWeTodTed,UCxt9XrjIVc99Q3-2yIIEp6Q,"What a ridiculous waste of time this film was. The detective was so odd looking no female looks like that. Everyone in charge of anything was a black person, the bank manager, the tellers, the police, detectives, store manager, how unrealistic was that?! The ""bad"" ones were white people. ...   The only thing that surprised me was the store manager was a black man, Im surprised it wasn't a white man that she un-alived.    We all face difficulties in life but no civilized human would ever act like that even at their lowest. This film makes the black community look crazy and its offensive.  This film sucked!",en,2025-06-15T03:05:08Z,2025-06-14 23:05:08,0,0
k1vWhii4tkE,Tyler Perry’s STRAW | Official Trailer | Netflix,UCWOA1ZGywLbqmigxE4Qlvuw,Netflix,2025-05-14T15:00:01Z,4580010,45062,6417,Ugx9uXjEh505MMQJO4J4AaABAg,NA,@melodygreen5029,UC_3TYxHxGOOvbZEC7NrRplg,This movie is so over the top stereotypical in every situation!  Just seriously!,en,2025-06-15T02:33:41Z,2025-06-14 22:33:41,0,0
k1vWhii4tkE,Tyler Perry’s STRAW | Official Trailer | Netflix,UCWOA1ZGywLbqmigxE4Qlvuw,Netflix,2025-05-14T15:00:01Z,4580010,45062,6417,Ugws_evvhcKQQoMirKh4AaABAg,NA,@senorasalazar1462,UCym6KEtoDVH1CEV2xROwzzg,Excellent acting . Wow wow. But the plot was too much like John Q,en,2025-06-15T02:30:36Z,2025-06-14 22:30:36,2,1
k1vWhii4tkE,Tyler Perry’s STRAW | Official Trailer | Netflix,UCWOA1ZGywLbqmigxE4Qlvuw,Netflix,2025-05-14T15:00:01Z,4580010,45062,6417,UgwJigqS9oFI8wxWYcN4AaABAg,NA,@Ruby_Nash,UCWCfBIKfQ_S1PSHHLbsNEMg,Sherry in a serious acting role 👌,en,2025-06-15T02:27:23Z,2025-06-14 22:27:23,0,0
k1vWhii4tkE,Tyler Perry’s STRAW | Official Trailer | Netflix,UCWOA1ZGywLbqmigxE4Qlvuw,Netflix,2025-05-14T15:00:01Z,4580010,45062,6417,UgzQ-K76W45e8vD2gMt4AaABAg,NA,@TabbethaDobbins-s9v,UCh-7CK1pzJq-usExe4b1K-A,But I’m still confused. 😂,en,2025-06-15T01:46:19Z,2025-06-14 21:46:19,0,0
k1vWhii4tkE,Tyler Perry’s STRAW | Official Trailer | Netflix,UCWOA1ZGywLbqmigxE4Qlvuw,Netflix,2025-05-14T15:00:01Z,4580010,45062,6417,UgzaL1NZzd03YE3hfAl4AaABAg,NA,@TabbethaDobbins-s9v,UCh-7CK1pzJq-usExe4b1K-A,Better than John Q!!!❤❤❤,lb,2025-06-15T01:45:47Z,2025-06-14 21:45:47,0,0
k1vWhii4tkE,Tyler Perry’s STRAW | Official Trailer | Netflix,UCWOA1ZGywLbqmigxE4Qlvuw,Netflix,2025-05-14T15:00:01Z,4580010,45062,6417,UgwlX4-cm9b_VxF5RHR4AaABAg,NA,@thanhnguyen4158,UCJDkTiS0MiXM0bjliLb7nTQ,This firm made me crying so much,en,2025-06-15T01:22:21Z,2025-06-14 21:22:21,0,0
k1vWhii4tkE,Tyler Perry’s STRAW | Official Trailer | Netflix,UCWOA1ZGywLbqmigxE4Qlvuw,Netflix,2025-05-14T15:00:01Z,4580010,45062,6417,Ugxi18LLhjybbUPlSx54AaABAg,NA,@Kei-Kei,UCkukiEbuST_hOPz4eurUpDw,"Dang, this is I’m just doing my job gone ballistic. This is very plausible. Lord have mercy.",en,2025-06-15T01:12:17Z,2025-06-14 21:12:17,0,0
k1vWhii4tkE,Tyler Perry’s STRAW | Official Trailer | Netflix,UCWOA1ZGywLbqmigxE4Qlvuw,Netflix,2025-05-14T15:00:01Z,4580010,45062,6417,UgwsXWwDp7_TngGjq2p4AaABAg,NA,@CoachMalcolm,UCW2jp9OUjMVMVjtJ0JOa3qQ,"Tyler Perry continues to exploit the emotions of black women in these movies and every time, you all fall for it. This movie and acting was TERRIBLE. Over-exaggerated emotions and story telling. I’ll be the one to be honest about it because apparently everyone is blinded by this.",en,2025-06-15T00:58:00Z,2025-06-14 20:58:00,0,0
k1vWhii4tkE,Tyler Perry’s STRAW | Official Trailer | Netflix,UCWOA1ZGywLbqmigxE4Qlvuw,Netflix,2025-05-14T15:00:01Z,4580010,45062,6417,Ugz6oOwBSHXxHxv1iRh4AaABAg,NA,@bullcheese2236,UCj6frCcTrkJ9BIFw91UOaCw,"That twist got me, wasn't expecting to cry on this movie😢",en,2025-06-15T00:46:29Z,2025-06-14 20:46:29,0,0
k1vWhii4tkE,Tyler Perry’s STRAW | Official Trailer | Netflix,UCWOA1ZGywLbqmigxE4Qlvuw,Netflix,2025-05-14T15:00:01Z,4580010,45062,6417,UgxV2DQ6Ouf0yFpzbmx4AaABAg,NA,@neri3376,UCCy-Uh99-UJo1kwAf6WXYuw,"This movie is hard to get through because it was just one things after another and it pissed me off,  like it was so much that ot was just too unrealistic",en,2025-06-15T00:35:29Z,2025-06-14 20:35:29,0,0
k1vWhii4tkE,Tyler Perry’s STRAW | Official Trailer | Netflix,UCWOA1ZGywLbqmigxE4Qlvuw,Netflix,2025-05-14T15:00:01Z,4580010,45062,6417,Ugwhqq5Kym4BH5juxxR4AaABAg,NA,@Croikey,UCNAhGAlOS4Mgo0iR41fWiJw,Just watched.  Is someone cutting onions?,en,2025-06-15T00:31:47Z,2025-06-14 20:31:47,0,0
k1vWhii4tkE,Tyler Perry’s STRAW | Official Trailer | Netflix,UCWOA1ZGywLbqmigxE4Qlvuw,Netflix,2025-05-14T15:00:01Z,4580010,45062,6417,UgwOYBEtqHqyeFEO3RN4AaABAg,NA,@NYGIANT6,UCPctxlBWn_zztN4bHnMoeqQ,TYLER PERRY MUST BE STOPPED AT ALL COSTS!!!!!!!,en,2025-06-15T00:21:31Z,2025-06-14 20:21:31,0,0
k1vWhii4tkE,Tyler Perry’s STRAW | Official Trailer | Netflix,UCWOA1ZGywLbqmigxE4Qlvuw,Netflix,2025-05-14T15:00:01Z,4580010,45062,6417,Ugxi6ZfHrSnJuNnkMCB4AaABAg,NA,@RawMovementz,UCS2hxDpjHJ_FFOvJ3yoCPmQ,"Man this movie was well written, performed and directed. Definitely worth a Oscar nomination in my opinion. Reminded me of the movie Fractured.",en,2025-06-14T23:38:43Z,2025-06-14 19:38:43,0,0
k1vWhii4tkE,Tyler Perry’s STRAW | Official Trailer | Netflix,UCWOA1ZGywLbqmigxE4Qlvuw,Netflix,2025-05-14T15:00:01Z,4580010,45062,6417,UgyyFZYCfY9I5exhJqV4AaABAg,NA,@LovelyCamperVan-rm2nm,UCQjicubRkD25eSk9BWtDvEg,This movie just made me remember The hate you give 😢,en,2025-06-14T23:28:29Z,2025-06-14 19:28:29,0,0
k1vWhii4tkE,Tyler Perry’s STRAW | Official Trailer | Netflix,UCWOA1ZGywLbqmigxE4Qlvuw,Netflix,2025-05-14T15:00:01Z,4580010,45062,6417,UgxAtNSQEU2n0UtZ2st4AaABAg,NA,@hungrynapps,UCtcQDWlvBMEmDjNAQrjgNBQ,Why does this movie feel like a tubi production,en,2025-06-14T23:12:56Z,2025-06-14 19:12:56,1,0
k1vWhii4tkE,Tyler Perry’s STRAW | Official Trailer | Netflix,UCWOA1ZGywLbqmigxE4Qlvuw,Netflix,2025-05-14T15:00:01Z,4580010,45062,6417,Ugyr7m4RO4VOiM6_xj54AaABAg,NA,@angstvision7108,UCQXw2h0n5RCXWgefYqPVnAg,Set it off?,NA,2025-06-14T22:29:24Z,2025-06-14 18:29:24,0,0
k1vWhii4tkE,Tyler Perry’s STRAW | Official Trailer | Netflix,UCWOA1ZGywLbqmigxE4Qlvuw,Netflix,2025-05-14T15:00:01Z,4580010,45062,6417,Ugwl2nxtb3XsJ4zyHgd4AaABAg,NA,@sensual528,UCY9RxFZ2C0WOIJmmvups9VA,This was a very touching and powerful movie! Brought me to 😭 😊,en,2025-06-14T21:44:09Z,2025-06-14 17:44:09,0,0
k1vWhii4tkE,Tyler Perry’s STRAW | Official Trailer | Netflix,UCWOA1ZGywLbqmigxE4Qlvuw,Netflix,2025-05-14T15:00:01Z,4580010,45062,6417,UgygI5lyxUS2iaY0TBt4AaABAg,NA,@DutchEvilX,UCLt8wb6pHA0xW3y218S6z2Q,"Just watched this movie on Netflix. Damm, what a good movie. Recomended!",en,2025-06-14T21:28:07Z,2025-06-14 17:28:07,0,0
k1vWhii4tkE,Tyler Perry’s STRAW | Official Trailer | Netflix,UCWOA1ZGywLbqmigxE4Qlvuw,Netflix,2025-05-14T15:00:01Z,4580010,45062,6417,UgxFgORxxB2BAIIYM-V4AaABAg,NA,@fib5019,UCXvbHwhNeYbopi4yOHEJu6w,Im still shaking and I saw this almost a week ago.....twice!,en,2025-06-14T21:18:35Z,2025-06-14 17:18:35,0,0
k1vWhii4tkE,Tyler Perry’s STRAW | Official Trailer | Netflix,UCWOA1ZGywLbqmigxE4Qlvuw,Netflix,2025-05-14T15:00:01Z,4580010,45062,6417,UgzE2qffnPu1t0D_6xh4AaABAg,NA,@garycampbell2230,UCxS1jywsP23Cs5woGz5fBvQ,Little bit like John Q Story line but a bank instead of an emergency room,NA,2025-06-14T21:16:10Z,2025-06-14 17:16:10,0,0
k1vWhii4tkE,Tyler Perry’s STRAW | Official Trailer | Netflix,UCWOA1ZGywLbqmigxE4Qlvuw,Netflix,2025-05-14T15:00:01Z,4580010,45062,6417,UgyEwyfAPesw2RMgOWp4AaABAg,NA,@mozaicmusic6783,UCPzpcAu3OWSyMYQLCMk_qMg,I cryed a lot at this movie...🥺🥺,NA,2025-06-14T21:10:00Z,2025-06-14 17:10:00,1,0
k1vWhii4tkE,Tyler Perry’s STRAW | Official Trailer | Netflix,UCWOA1ZGywLbqmigxE4Qlvuw,Netflix,2025-05-14T15:00:01Z,4580010,45062,6417,UgwA5uHl74PHZC11VKd4AaABAg,NA,@kenneththamenace,UCsMNtyG5jOa0Xl4efY42ohw,Another liberal movie coddling and justifying crime...,en,2025-06-14T20:41:24Z,2025-06-14 16:41:24,0,0
k1vWhii4tkE,Tyler Perry’s STRAW | Official Trailer | Netflix,UCWOA1ZGywLbqmigxE4Qlvuw,Netflix,2025-05-14T15:00:01Z,4580010,45062,6417,UgwfXABndGdWLtg6KnR4AaABAg,NA,@definiteg4909,UCM_atRGu_QCJzPlJ8-tnqMA,I'm tired of the same old black struggle movies Tyler Perry makes. The narrative and brainwashing is getting old.😑,en,2025-06-14T19:55:27Z,2025-06-14 15:55:27,1,0
k1vWhii4tkE,Tyler Perry’s STRAW | Official Trailer | Netflix,UCWOA1ZGywLbqmigxE4Qlvuw,Netflix,2025-05-14T15:00:01Z,4580010,45062,6417,Ugw4B1OjK7Jm_ZUvMpp4AaABAg,NA,@Maggiepattie254,UCzpnfLz6yFHIzdBOMBCHcZw,😭😭😭😭,ja,2025-06-14T19:23:02Z,2025-06-14 15:23:02,0,0
k1vWhii4tkE,Tyler Perry’s STRAW | Official Trailer | Netflix,UCWOA1ZGywLbqmigxE4Qlvuw,Netflix,2025-05-14T15:00:01Z,4580010,45062,6417,UgxeZTIi3po6-u2dUn94AaABAg,NA,@andrewoyibo2063,UC93mW9IYu-FnqjCuV6cctAA,"I dare anyone to watch this movie without crying. It really got me tearing up, and I am a man!!",en,2025-06-14T19:06:53Z,2025-06-14 15:06:53,1,0
k1vWhii4tkE,Tyler Perry’s STRAW | Official Trailer | Netflix,UCWOA1ZGywLbqmigxE4Qlvuw,Netflix,2025-05-14T15:00:01Z,4580010,45062,6417,UgzcJ6cuzwQlCxJV43B4AaABAg,NA,@prettyblank1441,UCsmdD7h7BdXR8NbihnjD61g,I was not expecting to ugly cry multiple times. Omg such a sad movie,en,2025-06-14T19:02:12Z,2025-06-14 15:02:12,1,0
k1vWhii4tkE,Tyler Perry’s STRAW | Official Trailer | Netflix,UCWOA1ZGywLbqmigxE4Qlvuw,Netflix,2025-05-14T15:00:01Z,4580010,45062,6417,UgxS5vJ8douf5QYphdN4AaABAg,NA,@JUST_LOCO_,UCEX-aEFFkCdN1JblJ5Zfd5g,"Another Woke Movie Just Like Disney”..Netflix You're DONE..! 



Ps. This Is Just A Rip Off Of John Q..!",en,2025-06-14T19:00:45Z,2025-06-14 15:00:45,1,0
k1vWhii4tkE,Tyler Perry’s STRAW | Official Trailer | Netflix,UCWOA1ZGywLbqmigxE4Qlvuw,Netflix,2025-05-14T15:00:01Z,4580010,45062,6417,UgxU-9lpaoODFxS8Gol4AaABAg,NA,@Divyareddy91,UCJZRNqVdOGsT7hD0I_7NWLA,I cried watching this movie… I am single mom and have a daughter of her age,en,2025-06-14T18:54:42Z,2025-06-14 14:54:42,1,0
k1vWhii4tkE,Tyler Perry’s STRAW | Official Trailer | Netflix,UCWOA1ZGywLbqmigxE4Qlvuw,Netflix,2025-05-14T15:00:01Z,4580010,45062,6417,UgwXhkir5iFCjAn5q4V4AaABAg,NA,@ParkWorld504,UCCuW8bg6eXyOLrZINzJdr-A,"This movie is horrible. I’m 20 minutes in & I can’t do it. The security guard at the bank is not real. 😂 It took him 30 min to lock a door. 😫. I CANT DO IT 😫

This movie is 😫. It makes zero sense. Nobody has that much bad luck.  All I can do is laugh and click it off. Tyler Perry need his ass whipped for this BS. TAKE HIS PEN & HIS LAPTOP AWAY 😂. AND WHY TARAJI GOT TO BE A SLAVE IN 2025 all the damn time? I don’t think Harriet Tubman was this much of a slave. A racists white cop on a police force full of black ppl. And why does it say BANK TELLER. IVE NEVER WENT IN A BANK AND IT SAID BANK TELLER. IT HAS THE PERSON NAME. TYLER PERRY I NEED U TO STOP 🛑😫😫😫😫😳",en,2025-06-14T18:48:50Z,2025-06-14 14:48:50,0,0
k1vWhii4tkE,Tyler Perry’s STRAW | Official Trailer | Netflix,UCWOA1ZGywLbqmigxE4Qlvuw,Netflix,2025-05-14T15:00:01Z,4580010,45062,6417,UgyXL2FEPIdNNMZEv254AaABAg,NA,@TruthSeekersTarot1,UCTYmdUWZBCdf9w6A2YqwlHw,This is Tyler Perry trying to do over John Q but it’s not as good,en,2025-06-14T18:48:01Z,2025-06-14 14:48:01,0,0
k1vWhii4tkE,Tyler Perry’s STRAW | Official Trailer | Netflix,UCWOA1ZGywLbqmigxE4Qlvuw,Netflix,2025-05-14T15:00:01Z,4580010,45062,6417,UgzRKzCjNrN2kXNO_VZ4AaABAg,NA,@sifisomshengu2616,UCg-jRd601-39mYZGs4lJmlA,The most confusing moral story line.......yet so satanic written all over it,en,2025-06-14T18:44:59Z,2025-06-14 14:44:59,0,0
k1vWhii4tkE,Tyler Perry’s STRAW | Official Trailer | Netflix,UCWOA1ZGywLbqmigxE4Qlvuw,Netflix,2025-05-14T15:00:01Z,4580010,45062,6417,UgzofyXuRPYsAeLzod94AaABAg,NA,@Youknowwhyyyy,UCiVm324SoDtl6DB5fN9Fylw,Don’t watch this movie. Most depressed story ever… Negative vibes ONLY,en,2025-06-14T18:31:41Z,2025-06-14 14:31:41,0,0
k1vWhii4tkE,Tyler Perry’s STRAW | Official Trailer | Netflix,UCWOA1ZGywLbqmigxE4Qlvuw,Netflix,2025-05-14T15:00:01Z,4580010,45062,6417,UgwoSaNCXnSj-nIsF9h4AaABAg,NA,@gabriele9432,UCdXoajwKvQ31mrKHbeP85gg,The way I balled 😭,en,2025-06-14T18:10:51Z,2025-06-14 14:10:51,1,0
k1vWhii4tkE,Tyler Perry’s STRAW | Official Trailer | Netflix,UCWOA1ZGywLbqmigxE4Qlvuw,Netflix,2025-05-14T15:00:01Z,4580010,45062,6417,UgwCuLDPwYphsPAz-c94AaABAg,NA,@tatipachas525,UCrwI17zdutv5gVGEVOoeLvQ,Corny af. I love Taraji but this movie was not it. It would never go down like that in real life.,en,2025-06-14T17:40:25Z,2025-06-14 13:40:25,0,0
k1vWhii4tkE,Tyler Perry’s STRAW | Official Trailer | Netflix,UCWOA1ZGywLbqmigxE4Qlvuw,Netflix,2025-05-14T15:00:01Z,4580010,45062,6417,UgykZXRv-pw4iM4XlT14AaABAg,NA,@broccolii6827,UCxHHadFQ31thot-3itO1bEw,"THIS IS THE DUMBEST MOVIE I EVER SEEN IN MY LIFEEE😂😂 AND MAKES NO SENSE. All it’s trying to do is brainwash people into thinking single black womens lives are SOOOOOO HARDDD when in reality they put themselves in all those predicaments, (and then losing your job, losing your daughter, losing your home, losing your car, everyone being a piece of shit to YOU in particular, getting ran off the road by an “evil white man” and to top it all off he’s just coincidentally a cop too.) I’m sorry but Thats just so unrealistic and dramatic. It sounds like more like what a single black woman wants people to believe her life is like rather than what it actually is like. Aka being lazy expecting everything to be handed to her bc her great great great great grandmother had to do some yard work. Gtfooo😂😂😂",en,2025-06-14T17:37:50Z,2025-06-14 13:37:50,1,0
k1vWhii4tkE,Tyler Perry’s STRAW | Official Trailer | Netflix,UCWOA1ZGywLbqmigxE4Qlvuw,Netflix,2025-05-14T15:00:01Z,4580010,45062,6417,Ugy-m2UU95NrXSWFDi94AaABAg,NA,@Damien-u1x,UCx4YuxOrgh2da6fIdOkJ05A,and they wonder why blk women just go to work and stay childfree,en,2025-06-14T17:30:23Z,2025-06-14 13:30:23,0,0
k1vWhii4tkE,Tyler Perry’s STRAW | Official Trailer | Netflix,UCWOA1ZGywLbqmigxE4Qlvuw,Netflix,2025-05-14T15:00:01Z,4580010,45062,6417,Ugyw1L8cUsuyTfyVzj94AaABAg,NA,@AmaniRodah,UCEZI7kQJ7fObenUo73umjwA,I need this movie please I didn't find,en,2025-06-14T17:27:22Z,2025-06-14 13:27:22,0,0
k1vWhii4tkE,Tyler Perry’s STRAW | Official Trailer | Netflix,UCWOA1ZGywLbqmigxE4Qlvuw,Netflix,2025-05-14T15:00:01Z,4580010,45062,6417,UgwWknaSS08f5nU-V8R4AaABAg,NA,@LOL99756,UCAt5qG3P26kQT8pSf6JygVg,"What a tearjerker, excellent performance from the cast. Must watch! 💜",en,2025-06-14T17:26:17Z,2025-06-14 13:26:17,8,1
k1vWhii4tkE,Tyler Perry’s STRAW | Official Trailer | Netflix,UCWOA1ZGywLbqmigxE4Qlvuw,Netflix,2025-05-14T15:00:01Z,4580010,45062,6417,UgzI0ZYoMQGtO2EBn3l4AaABAg,NA,@JustUdoro,UCp0-Q-FNFZaeGOZ8S7NlGmw,SINBAD!!!!🙌🏾❤️😭🙌🏾❤️😭,NA,2025-06-14T17:06:31Z,2025-06-14 13:06:31,0,0
k1vWhii4tkE,Tyler Perry’s STRAW | Official Trailer | Netflix,UCWOA1ZGywLbqmigxE4Qlvuw,Netflix,2025-05-14T15:00:01Z,4580010,45062,6417,UgxnkrhKCeqw2tuTXn14AaABAg,NA,@foreign_bhai,UCOSCYNwnFPMvoStlVFEQ09w,"multiverse where amerca is occupied by the blaks ,and whites camer later on LOL",en,2025-06-14T16:55:12Z,2025-06-14 12:55:12,0,0
k1vWhii4tkE,Tyler Perry’s STRAW | Official Trailer | Netflix,UCWOA1ZGywLbqmigxE4Qlvuw,Netflix,2025-05-14T15:00:01Z,4580010,45062,6417,Ugy72JYJLg8ruN-y_UN4AaABAg,NA,@patsoy1329,UCN1kFeH6i3oxsC19GUd5KdA,USUAL SUSPECTS,en,2025-06-14T16:45:09Z,2025-06-14 12:45:09,1,0
k1vWhii4tkE,Tyler Perry’s STRAW | Official Trailer | Netflix,UCWOA1ZGywLbqmigxE4Qlvuw,Netflix,2025-05-14T15:00:01Z,4580010,45062,6417,UgxAypMDuBDWfuwyNft4AaABAg,NA,@WWJ09,UC_9GYjDfve95_RMopf6A26A,This movie was so bad..... unbelievable,en,2025-06-14T16:37:19Z,2025-06-14 12:37:19,0,0
k1vWhii4tkE,Tyler Perry’s STRAW | Official Trailer | Netflix,UCWOA1ZGywLbqmigxE4Qlvuw,Netflix,2025-05-14T15:00:01Z,4580010,45062,6417,UgxiXpoIxdMJg--j0f54AaABAg,NA,@Letsgooo554,UCREknoeZXjeR-Be7kVhfl8w,"Tyler Perry is the P Diddy of movies. This was already done with Denzel Washington. Be original, be better…",en,2025-06-14T16:24:09Z,2025-06-14 12:24:09,0,0
k1vWhii4tkE,Tyler Perry’s STRAW | Official Trailer | Netflix,UCWOA1ZGywLbqmigxE4Qlvuw,Netflix,2025-05-14T15:00:01Z,4580010,45062,6417,UgwcCu1ZjVSnwAz_YLN4AaABAg,NA,@joyceajok3793,UCHOhUVy0tv_TKZQcWOToNRw,This movie does not bring Hope to Blacks and so is all Tyler's movies. How can Black's suffer in all your. Movies😢,en,2025-06-14T16:19:35Z,2025-06-14 12:19:35,0,0
k1vWhii4tkE,Tyler Perry’s STRAW | Official Trailer | Netflix,UCWOA1ZGywLbqmigxE4Qlvuw,Netflix,2025-05-14T15:00:01Z,4580010,45062,6417,UgzlHxfBU-HXNHbgZPB4AaABAg,NA,@MarcusWeingartner,UC63nRvYMwOlu-m14c6nnjAw,"Einer der genialsten Filme,die ich kenne. Sehr sehr emotional.",de,2025-06-14T15:54:36Z,2025-06-14 11:54:36,1,0
k1vWhii4tkE,Tyler Perry’s STRAW | Official Trailer | Netflix,UCWOA1ZGywLbqmigxE4Qlvuw,Netflix,2025-05-14T15:00:01Z,4580010,45062,6417,UgwDpvwEJ5hc5lWxY1d4AaABAg,NA,@maninderjitkaur1940,UCUv4CzbU05zIqGqmzW3-hsg,I can not see the pain of anybody...this made me cry a lot during whole movie...,en,2025-06-14T15:09:44Z,2025-06-14 11:09:44,0,0
k1vWhii4tkE,Tyler Perry’s STRAW | Official Trailer | Netflix,UCWOA1ZGywLbqmigxE4Qlvuw,Netflix,2025-05-14T15:00:01Z,4580010,45062,6417,Ugyc39vEUp8lVWTSCIN4AaABAg,NA,@glenn20081965,UCKCTX3p09_MzGpFu3hjui_A,Absolute garbage...with a terrible script.,en,2025-06-14T14:46:11Z,2025-06-14 10:46:11,0,0
k1vWhii4tkE,Tyler Perry’s STRAW | Official Trailer | Netflix,UCWOA1ZGywLbqmigxE4Qlvuw,Netflix,2025-05-14T15:00:01Z,4580010,45062,6417,UgxzVGtbWs5aSytgQLN4AaABAg,NA,@derrickmaweu7264,UCrooFxzPdhWtE8cxj3Rz6ew,What’s this John q,NA,2025-06-14T14:26:08Z,2025-06-14 10:26:08,0,0
k1vWhii4tkE,Tyler Perry’s STRAW | Official Trailer | Netflix,UCWOA1ZGywLbqmigxE4Qlvuw,Netflix,2025-05-14T15:00:01Z,4580010,45062,6417,Ugzg9mfA5JvzZoYRK1t4AaABAg,NA,@vuppuluriraghuramireddy5757,UCmx1iqPRUFTl3Myp-NC1-BA,Just watched movie today in Netflix it was a good movie all departments excelled.,en,2025-06-14T14:25:56Z,2025-06-14 10:25:56,0,0
k1vWhii4tkE,Tyler Perry’s STRAW | Official Trailer | Netflix,UCWOA1ZGywLbqmigxE4Qlvuw,Netflix,2025-05-14T15:00:01Z,4580010,45062,6417,UgxyqwAK9dQebVy2PCt4AaABAg,NA,@nathanieadamso5026,UCCIOPtBi7667OeYgRHr_C3A,"But ain’t nobody talking about when switch lanes, made a mistake in cut somebody but the cop threw coffee and hit her",en,2025-06-14T14:17:10Z,2025-06-14 10:17:10,0,0
k1vWhii4tkE,Tyler Perry’s STRAW | Official Trailer | Netflix,UCWOA1ZGywLbqmigxE4Qlvuw,Netflix,2025-05-14T15:00:01Z,4580010,45062,6417,Ugw9aMrKmHrcEXql3qt4AaABAg,NA,@ArtUnlimited,UCRR93q_iw9VSOkUv-dojavg,"Another movie of helpless, black victims.  😒",en,2025-06-14T14:11:09Z,2025-06-14 10:11:09,0,0
k1vWhii4tkE,Tyler Perry’s STRAW | Official Trailer | Netflix,UCWOA1ZGywLbqmigxE4Qlvuw,Netflix,2025-05-14T15:00:01Z,4580010,45062,6417,UgwgDb6k4oTEdYEKGDp4AaABAg,NA,@charliefields7306,UCu2Ew-o1X67Ah-AqFtUYHVw,This what people was talking about? Hell Nawl man Lmao thats John Q a damn near duplicate I aint watching dat Tyler Perry should get sued how they let that fly come on mang,en,2025-06-14T14:00:34Z,2025-06-14 10:00:34,0,0
k1vWhii4tkE,Tyler Perry’s STRAW | Official Trailer | Netflix,UCWOA1ZGywLbqmigxE4Qlvuw,Netflix,2025-05-14T15:00:01Z,4580010,45062,6417,UgxFcy6SlzHn49OnWsJ4AaABAg,NA,@denisexx6337,UCm3dzUcjyaIE7YbLU_y_LJg,"No thank you , no more Tyler Perry trauma films for me",pt,2025-06-14T13:48:56Z,2025-06-14 09:48:56,0,0
k1vWhii4tkE,Tyler Perry’s STRAW | Official Trailer | Netflix,UCWOA1ZGywLbqmigxE4Qlvuw,Netflix,2025-05-14T15:00:01Z,4580010,45062,6417,Ugy6-JQ9bC6px9p9DHd4AaABAg,NA,@dangarcia9831,UCRg1DTMoWnp5cZvReOKq2kA,This looks like a bad John Q.  This will have an IMDb score of 3.5.,en,2025-06-14T13:36:28Z,2025-06-14 09:36:28,0,0
k1vWhii4tkE,Tyler Perry’s STRAW | Official Trailer | Netflix,UCWOA1ZGywLbqmigxE4Qlvuw,Netflix,2025-05-14T15:00:01Z,4580010,45062,6417,UgyeVnwhUmPHMA3t8wR4AaABAg,NA,@BrodyRow,UC5rGTRZC5ehxWWYeVC3IvMQ,So good,NA,2025-06-14T13:24:42Z,2025-06-14 09:24:42,0,0
k1vWhii4tkE,Tyler Perry’s STRAW | Official Trailer | Netflix,UCWOA1ZGywLbqmigxE4Qlvuw,Netflix,2025-05-14T15:00:01Z,4580010,45062,6417,UgyW0ZuLfM4ahY6UXhd4AaABAg,NA,@LisaMS444,UC2WQSMtBiG9J-Qjx_KgrALg,"There is ALWAYS hope and HELP with Jesus Christ----He has held my hand through MANY TRIALS AND TRIBULATIONS in my life. Tyler Perry needs Jesus and this movie is NOT pleasing to God. That's what's wrong with this world......billions of people out there LOST when God is whispering in your ears "" COME TO ME AND I WILL GIVE YOU REST "" Praying for this world to turn to God....time is almost up! Where will you spend eternity???? I love everyone.....the ONLY help and hope we have is JESUS CHIRST.",en,2025-06-14T13:16:38Z,2025-06-14 09:16:38,1,0
k1vWhii4tkE,Tyler Perry’s STRAW | Official Trailer | Netflix,UCWOA1ZGywLbqmigxE4Qlvuw,Netflix,2025-05-14T15:00:01Z,4580010,45062,6417,Ugy3SGRGSYGEjFKItU94AaABAg,NA,@HugoCarneiro-h9n,UCj-86JcOajj0RGMz_mFvO5Q,❤,ja,2025-06-14T12:42:44Z,2025-06-14 08:42:44,0,0
k1vWhii4tkE,Tyler Perry’s STRAW | Official Trailer | Netflix,UCWOA1ZGywLbqmigxE4Qlvuw,Netflix,2025-05-14T15:00:01Z,4580010,45062,6417,Ugy6Li5oFC2vbjsard14AaABAg,NA,@ilovemusiq2,UCa-mg2CGdgNZ3v99ZvsJu_g,Tarajiiiiiiii!!!!!!!!!Wow this made me cry so much!,so,2025-06-14T12:29:13Z,2025-06-14 08:29:13,0,0
k1vWhii4tkE,Tyler Perry’s STRAW | Official Trailer | Netflix,UCWOA1ZGywLbqmigxE4Qlvuw,Netflix,2025-05-14T15:00:01Z,4580010,45062,6417,UgyxPUExdHbutpofKKF4AaABAg,NA,@tayinap4269,UCoZdHzf-Dlo6U9V160GnHIQ,Such an Oscar worthy performance. Taraji is amazing!,NA,2025-06-14T11:55:06Z,2025-06-14 07:55:06,0,0
k1vWhii4tkE,Tyler Perry’s STRAW | Official Trailer | Netflix,UCWOA1ZGywLbqmigxE4Qlvuw,Netflix,2025-05-14T15:00:01Z,4580010,45062,6417,Ugwzjw28PcmQK55n6xN4AaABAg,NA,@Jack-b3e6y,UCHoaheAT6xl-uhsW_NoDJbw,This movie reminds me of a Denzel Washington movie I saw years ago Titled John Q. Seems like Tyler Perry copied that movie,en,2025-06-14T11:42:53Z,2025-06-14 07:42:53,0,0
k1vWhii4tkE,Tyler Perry’s STRAW | Official Trailer | Netflix,UCWOA1ZGywLbqmigxE4Qlvuw,Netflix,2025-05-14T15:00:01Z,4580010,45062,6417,UgzBgttWFU6QaqlitWd4AaABAg,NA,@One1Trillion,UCr2RgjMApX7M1RiFQEVUZ8g,I recommend this movie! One of the best movies. And teyana Tayler.,en,2025-06-14T11:28:51Z,2025-06-14 07:28:51,0,0
