video_id,video_title,channel_id,channel_title,video_published_at,view_count,video_like_count,video_comment_count,comment_id,comment_parent_id,comment_author_display,comment_author_channel_id,comment_text,comment_lang,comment_published_utc,comment_published_local,comment_like_count,comment_reply_count
k1vWhii4tkE,Tyler Perry’s STRAW | Official Trailer | Netflix,UCWOA1ZGywLbqmigxE4Qlvuw,Netflix,2025-05-14T15:00:01Z,4580010,45062,6417,UgzbmtV4ZlGL9MmL4FR4AaABAg,NA,@anneramlal1811,UCCjbT4VeQHOai1wXXI_jbiQ,This movie made me cry 😢 she went throught so much,en,2025-06-18T19:01:15Z,2025-06-18 15:01:15,1,0
k1vWhii4tkE,Tyler Perry’s STRAW | Official Trailer | Netflix,UCWOA1ZGywLbqmigxE4Qlvuw,Netflix,2025-05-14T15:00:01Z,4580010,45062,6417,UgwKwzSlHSq-IdbgQR14AaABAg,NA,@mariajohnson9901,UC7HnBf8dxBXLogIBfPVytPA,Mr Tyler Perry Love this Show we learn a lot from it and you too it's Part of life Reality,en,2025-06-18T18:47:36Z,2025-06-18 14:47:36,0,0
k1vWhii4tkE,Tyler Perry’s STRAW | Official Trailer | Netflix,UCWOA1ZGywLbqmigxE4Qlvuw,Netflix,2025-05-14T15:00:01Z,4580010,45062,6417,UgyofmVfsjSmW63K5gF4AaABAg,NA,@oktayşom,UCx3Hn-h-YGMKoI2KChvU2Gg,anne olanlar özellikle izlesin ay ben niye bu kadar ağladım,tr,2025-06-18T18:45:12Z,2025-06-18 14:45:12,0,0
k1vWhii4tkE,Tyler Perry’s STRAW | Official Trailer | Netflix,UCWOA1ZGywLbqmigxE4Qlvuw,Netflix,2025-05-14T15:00:01Z,4580010,45062,6417,UgwPEZdVlQ0PQmtcU3t4AaABAg,NA,@dazdealz4648,UCAAq455nZ-g-uT0KdIOl43w,saw basically Female John Q. She's no Denzel,NA,2025-06-18T18:15:52Z,2025-06-18 14:15:52,1,0
k1vWhii4tkE,Tyler Perry’s STRAW | Official Trailer | Netflix,UCWOA1ZGywLbqmigxE4Qlvuw,Netflix,2025-05-14T15:00:01Z,4580010,45062,6417,Ugwp-wHh30Pp1DVldwR4AaABAg,NA,@lorrie9431,UCheF7SX1L5AdTGrWJsSslmg,"This movie was so good!  Wow!  This stuff really happens, I was a single mom and the struggle is real!  My heart 💔 such an emotional story.",en,2025-06-18T17:54:30Z,2025-06-18 13:54:30,1,0
k1vWhii4tkE,Tyler Perry’s STRAW | Official Trailer | Netflix,UCWOA1ZGywLbqmigxE4Qlvuw,Netflix,2025-05-14T15:00:01Z,4580010,45062,6417,UgwzQbsMWKiP1QicN_N4AaABAg,NA,@marieflorencedelisca1046,UCi5I3diJZ9psBovllXeZjvg,"Tyler Perry, that's movie is so great and she did very well. It's about black people strongolling to rise our children with daddy.",en,2025-06-18T17:30:57Z,2025-06-18 13:30:57,0,0
k1vWhii4tkE,Tyler Perry’s STRAW | Official Trailer | Netflix,UCWOA1ZGywLbqmigxE4Qlvuw,Netflix,2025-05-14T15:00:01Z,4580010,45062,6417,UgxeCnJIQRLYPRw6sHh4AaABAg,NA,@isabellacitera468,UCzQfe9gF4-d-GrHGS2HS_1Q,"Good and sad story about life❤️ but the movie itself was boring, to dramatic for such a bad acting, sorry... So 1/5 stars.",en,2025-06-18T17:27:55Z,2025-06-18 13:27:55,2,0
k1vWhii4tkE,Tyler Perry’s STRAW | Official Trailer | Netflix,UCWOA1ZGywLbqmigxE4Qlvuw,Netflix,2025-05-14T15:00:01Z,4580010,45062,6417,UgwQP1z_CZgagdM8dR14AaABAg,NA,@fuongng2952,UCp0b_qr081WGNXzjMmZmhkg,The ending confused me a bit.  I dont know somehow Watching the whole movie  obsessed me so much.,en,2025-06-18T16:18:46Z,2025-06-18 12:18:46,1,0
k1vWhii4tkE,Tyler Perry’s STRAW | Official Trailer | Netflix,UCWOA1ZGywLbqmigxE4Qlvuw,Netflix,2025-05-14T15:00:01Z,4580010,45062,6417,UgwuN3nu-tuWoyDUXQN4AaABAg,NA,@M0ther_0f_Drag0nz,UC9HzEcSY-opsyg7kNW-F1jA,"Ah, this must be why she performed a WHOLE SATANIC RITUAL ON STAGE. I see you all 👀 did the Obama’s have their hand in this one?",en,2025-06-18T16:00:02Z,2025-06-18 12:00:02,2,0
k1vWhii4tkE,Tyler Perry’s STRAW | Official Trailer | Netflix,UCWOA1ZGywLbqmigxE4Qlvuw,Netflix,2025-05-14T15:00:01Z,4580010,45062,6417,UgysMVDnQnHOIwHTsC94AaABAg,NA,@jus10xx,UCTS2IqCP-ffxXdVqc84K9yA,Im a 38 yo man and when i say this movie made me cry...and the ending was even more emotional,en,2025-06-18T15:48:45Z,2025-06-18 11:48:45,0,0
k1vWhii4tkE,Tyler Perry’s STRAW | Official Trailer | Netflix,UCWOA1ZGywLbqmigxE4Qlvuw,Netflix,2025-05-14T15:00:01Z,4580010,45062,6417,UgxVnelHtpUqGvs1fTF4AaABAg,NA,@sunkicore,UCTwMS3WQLi5ympjYzwYALEQ,Ive never cried for any other movie like i did for this movie 😭,en,2025-06-18T15:24:53Z,2025-06-18 11:24:53,0,0
k1vWhii4tkE,Tyler Perry’s STRAW | Official Trailer | Netflix,UCWOA1ZGywLbqmigxE4Qlvuw,Netflix,2025-05-14T15:00:01Z,4580010,45062,6417,UgwhY97qfYG4iDpHshp4AaABAg,NA,@kristofferty9294,UCOg6_Ac8Q71Jo8Viy1NVh3A,i remember the movie crash,NA,2025-06-18T14:06:39Z,2025-06-18 10:06:39,0,0
k1vWhii4tkE,Tyler Perry’s STRAW | Official Trailer | Netflix,UCWOA1ZGywLbqmigxE4Qlvuw,Netflix,2025-05-14T15:00:01Z,4580010,45062,6417,UgwzSglIBqK4G0_s39J4AaABAg,NA,@UnderTheRadarForever,UCa1dnTR0LcwoLwk97xXpraw,"If you ever think you've had a rough day, watch this movie.  Her day was FAR worse.  Loved the movie except for the part where all the white people were complete jerks and the only good people weren't white.  I mean, come on Tyler, spread it around or just leave us completely out of your movies.",en,2025-06-18T14:00:27Z,2025-06-18 10:00:27,1,0
k1vWhii4tkE,Tyler Perry’s STRAW | Official Trailer | Netflix,UCWOA1ZGywLbqmigxE4Qlvuw,Netflix,2025-05-14T15:00:01Z,4580010,45062,6417,UgzGjvgHU_nR9Jav3IN4AaABAg,NA,@NOBODY0-f1t,UCat0yx0oBsrTGTqsDeKjuGw,Cookie is my favorite actress...I mean Taraji...she never disappoints....I love her❤❤❤😊,en,2025-06-18T13:39:31Z,2025-06-18 09:39:31,0,0
k1vWhii4tkE,Tyler Perry’s STRAW | Official Trailer | Netflix,UCWOA1ZGywLbqmigxE4Qlvuw,Netflix,2025-05-14T15:00:01Z,4580010,45062,6417,UgyhckG1GByYvVB6IMJ4AaABAg,NA,@z.b1077,UCL5jNxBWBLPgAb9ZcKx2Vdg,Greatest actress of all time .,en,2025-06-18T13:20:59Z,2025-06-18 09:20:59,0,1
k1vWhii4tkE,Tyler Perry’s STRAW | Official Trailer | Netflix,UCWOA1ZGywLbqmigxE4Qlvuw,Netflix,2025-05-14T15:00:01Z,4580010,45062,6417,Ugx2ldfKWuJAwE6H2Rt4AaABAg,NA,@artconsultantinparis,UC0tNqDrASl290vdyC0LT7cQ,"WoW ! Ok Netflix, one month to see this one.",en,2025-06-18T12:38:24Z,2025-06-18 08:38:24,0,0
k1vWhii4tkE,Tyler Perry’s STRAW | Official Trailer | Netflix,UCWOA1ZGywLbqmigxE4Qlvuw,Netflix,2025-05-14T15:00:01Z,4580010,45062,6417,UgyfNHOR7T8f10ROtIF4AaABAg,NA,@bobpritham2660,UCBiv5GW7ZlV3-KZYsjkPqVQ,Who here after Tyler Perry is accused for sexual assault. 😂,en,2025-06-18T11:27:49Z,2025-06-18 07:27:49,0,0
k1vWhii4tkE,Tyler Perry’s STRAW | Official Trailer | Netflix,UCWOA1ZGywLbqmigxE4Qlvuw,Netflix,2025-05-14T15:00:01Z,4580010,45062,6417,UgzCUkxlXufNX9CSPop4AaABAg,NA,@milksandrikenny1778,UC9A6l3mQ_NU01O9G5uC7ScA,I lost full this movie,NA,2025-06-18T09:44:30Z,2025-06-18 05:44:30,1,0
k1vWhii4tkE,Tyler Perry’s STRAW | Official Trailer | Netflix,UCWOA1ZGywLbqmigxE4Qlvuw,Netflix,2025-05-14T15:00:01Z,4580010,45062,6417,UgyVlkGxoHFkjiqgRVl4AaABAg,NA,@TReX88147,UCImQkRgOPxko1hr7fFAEbVQ,-1/10,ja,2025-06-18T08:04:37Z,2025-06-18 04:04:37,0,0
k1vWhii4tkE,Tyler Perry’s STRAW | Official Trailer | Netflix,UCWOA1ZGywLbqmigxE4Qlvuw,Netflix,2025-05-14T15:00:01Z,4580010,45062,6417,UgziDMzkGwBIogakBsR4AaABAg,NA,@jakehodder2173,UCyY9p0VbXHepagn4P6fzdZw,Who’s Tyler Perry and why does he or she have to have their name claiming the title lmao I hate when people do that,en,2025-06-18T06:34:09Z,2025-06-18 02:34:09,0,1
k1vWhii4tkE,Tyler Perry’s STRAW | Official Trailer | Netflix,UCWOA1ZGywLbqmigxE4Qlvuw,Netflix,2025-05-14T15:00:01Z,4580010,45062,6417,UgxtWvwvKhZIxzdqEVp4AaABAg,NA,@kramptha,UC2hLDjGrC9pNDgCJfTtCgGg,She lied again saying that she didnt rob a bank but clearly she did. Now no one really wants to help,en,2025-06-18T06:16:27Z,2025-06-18 02:16:27,0,2
k1vWhii4tkE,Tyler Perry’s STRAW | Official Trailer | Netflix,UCWOA1ZGywLbqmigxE4Qlvuw,Netflix,2025-05-14T15:00:01Z,4580010,45062,6417,UgzyAUEe8MAhtuiGhz54AaABAg,NA,@kramptha,UC2hLDjGrC9pNDgCJfTtCgGg,Lol hollywood blacks hates blacks,et,2025-06-18T06:14:20Z,2025-06-18 02:14:20,1,0
k1vWhii4tkE,Tyler Perry’s STRAW | Official Trailer | Netflix,UCWOA1ZGywLbqmigxE4Qlvuw,Netflix,2025-05-14T15:00:01Z,4580010,45062,6417,UgwcnzWzLZFhS4zPwWh4AaABAg,NA,@michaelburke4689,UCQToZMtTrs9P3bOG1hN5Zyg,"Professional Kudos to Tyler Perry. This Classic film was exceptionally written, magnificently directed and superbly acted. This movie is noteworthy of several Emmy nominations. The distinctive caveat is movie watchers feel they know someone OR identify STRONGLY with characters in the film. 

At what point in the film did her daughter die ?",en,2025-06-18T04:57:46Z,2025-06-18 00:57:46,0,1
k1vWhii4tkE,Tyler Perry’s STRAW | Official Trailer | Netflix,UCWOA1ZGywLbqmigxE4Qlvuw,Netflix,2025-05-14T15:00:01Z,4580010,45062,6417,UgwDWFN7K1IvcN23FYB4AaABAg,NA,@francellew2073,UCeEBO5v72hua_obVAEkBDpQ,Really good movie and great message to be kind to others; except for their white supremacy BS. So the white cop was the bad guy? And the evil white FBI agents? Really?,en,2025-06-18T04:07:23Z,2025-06-18 00:07:23,0,1
k1vWhii4tkE,Tyler Perry’s STRAW | Official Trailer | Netflix,UCWOA1ZGywLbqmigxE4Qlvuw,Netflix,2025-05-14T15:00:01Z,4580010,45062,6417,UgxvqEG9UPQEmU0HmkF4AaABAg,NA,@sir1junior,UCbslhOuGNf3JD6qorCdTTsg,Taylor look too dolled up for the part lol,en,2025-06-18T02:57:27Z,2025-06-17 22:57:27,0,0
k1vWhii4tkE,Tyler Perry’s STRAW | Official Trailer | Netflix,UCWOA1ZGywLbqmigxE4Qlvuw,Netflix,2025-05-14T15:00:01Z,4580010,45062,6417,Ugy6dqk-jgge3bKLJVd4AaABAg,NA,@WarGrowlmon18,UC0kISRX10XLCPXnRa49V-hg,The ringing when she's hallucinating its the flatline of her daughter's heart monitor at the hospital when she died 😭😭😭,en,2025-06-18T02:13:49Z,2025-06-17 22:13:49,0,0
k1vWhii4tkE,Tyler Perry’s STRAW | Official Trailer | Netflix,UCWOA1ZGywLbqmigxE4Qlvuw,Netflix,2025-05-14T15:00:01Z,4580010,45062,6417,UgxEtHT7QOfs9ApAPMh4AaABAg,NA,@mariapagan7786,UC-2ySvAP4X7zGC3JNROYz9Q,This is complete insanity what is wrong with this man???,en,2025-06-18T02:05:09Z,2025-06-17 22:05:09,0,0
k1vWhii4tkE,Tyler Perry’s STRAW | Official Trailer | Netflix,UCWOA1ZGywLbqmigxE4Qlvuw,Netflix,2025-05-14T15:00:01Z,4580010,45062,6417,UgyCjT0j6nWUlrOeqQR4AaABAg,NA,@VOVGIRL,UC0fAeoZkEYR1cCVVDsAr3yA,This movie is 🔥🔥🔥,en,2025-06-18T01:52:49Z,2025-06-17 21:52:49,0,0
k1vWhii4tkE,Tyler Perry’s STRAW | Official Trailer | Netflix,UCWOA1ZGywLbqmigxE4Qlvuw,Netflix,2025-05-14T15:00:01Z,4580010,45062,6417,UgxXqoiYIHqne3frcTV4AaABAg,NA,@WarGrowlmon18,UC0kISRX10XLCPXnRa49V-hg,She's clearly not in her right mind during the movie. When she's hallucinating you can hear a ringing sound in the background. At the bank she didn't even remember that she had the gun at first and when she initially talked to the female cop she didn't even remember having killed her boss. All of the signs were there from the very beginning that something more was going on here.,en,2025-06-18T01:52:15Z,2025-06-17 21:52:15,0,0
k1vWhii4tkE,Tyler Perry’s STRAW | Official Trailer | Netflix,UCWOA1ZGywLbqmigxE4Qlvuw,Netflix,2025-05-14T15:00:01Z,4580010,45062,6417,UgwqDJUmzpfIIdvuN3d4AaABAg,NA,@jasontodd8418,UCG8Bx3Tim6ja_t1XfJnnonQ,The story of a angry black woman why do this again 😒,en,2025-06-18T01:51:16Z,2025-06-17 21:51:16,1,0
k1vWhii4tkE,Tyler Perry’s STRAW | Official Trailer | Netflix,UCWOA1ZGywLbqmigxE4Qlvuw,Netflix,2025-05-14T15:00:01Z,4580010,45062,6417,Ugw76s_qTs_AvDESdYx4AaABAg,NA,@WarGrowlmon18,UC0kISRX10XLCPXnRa49V-hg,Ironically when she shoots her boss you can see a sign on the window saying No Weapons 🤣🤣🤣🤣🤣🤣🤣🤣🤣,en,2025-06-18T01:33:09Z,2025-06-17 21:33:09,0,0
k1vWhii4tkE,Tyler Perry’s STRAW | Official Trailer | Netflix,UCWOA1ZGywLbqmigxE4Qlvuw,Netflix,2025-05-14T15:00:01Z,4580010,45062,6417,UgysoqSHIYLCRfQWYgd4AaABAg,NA,@WarGrowlmon18,UC0kISRX10XLCPXnRa49V-hg,I love how the lady detective called her a Person of Interest. Too bad the Machine didn't see this one coming.🤣🤣🤣🤣🤣🤣🤣🤣🤣,en,2025-06-18T01:30:39Z,2025-06-17 21:30:39,0,0
k1vWhii4tkE,Tyler Perry’s STRAW | Official Trailer | Netflix,UCWOA1ZGywLbqmigxE4Qlvuw,Netflix,2025-05-14T15:00:01Z,4580010,45062,6417,UgwPmWvaEfBP3OUcBWB4AaABAg,NA,@NOMADcourier85,UCXuFubfTp9ewJU4tT4sc56w,This was some great unintentional dark comedy.,en,2025-06-18T01:13:37Z,2025-06-17 21:13:37,0,1
k1vWhii4tkE,Tyler Perry’s STRAW | Official Trailer | Netflix,UCWOA1ZGywLbqmigxE4Qlvuw,Netflix,2025-05-14T15:00:01Z,4580010,45062,6417,UgxAoJX5_9N7Gb8Zi_F4AaABAg,NA,@NOMADcourier85,UCXuFubfTp9ewJU4tT4sc56w,This was some great unintentional dark comedy.,en,2025-06-18T01:13:22Z,2025-06-17 21:13:22,0,0
k1vWhii4tkE,Tyler Perry’s STRAW | Official Trailer | Netflix,UCWOA1ZGywLbqmigxE4Qlvuw,Netflix,2025-05-14T15:00:01Z,4580010,45062,6417,Ugw7ecdIJ983FOmxpiZ4AaABAg,NA,@Gwen-d5g,UC5yCifFHAYS69eseJuycacQ,This was amazing and so real...🙏🙏🙏🎉🎉🎉💞💞💞,en,2025-06-18T00:38:30Z,2025-06-17 20:38:30,0,0
k1vWhii4tkE,Tyler Perry’s STRAW | Official Trailer | Netflix,UCWOA1ZGywLbqmigxE4Qlvuw,Netflix,2025-05-14T15:00:01Z,4580010,45062,6417,UgxR2G6z-2bd7cN6TFV4AaABAg,NA,@sashasweetz7989,UCMLvr7bL2-kQt-FsVu-7k4Q,It seems too sad for me personally,en,2025-06-18T00:34:24Z,2025-06-17 20:34:24,0,0
k1vWhii4tkE,Tyler Perry’s STRAW | Official Trailer | Netflix,UCWOA1ZGywLbqmigxE4Qlvuw,Netflix,2025-05-14T15:00:01Z,4580010,45062,6417,UgxXwVgSY1xqyZSi6Tx4AaABAg,NA,@Macdouble21,UCgf-jhxbfTpBoG4YcD8JnaQ,Anyone else notice the bank is the same one from Den of Thieves 1,en,2025-06-17T23:56:53Z,2025-06-17 19:56:53,0,0
k1vWhii4tkE,Tyler Perry’s STRAW | Official Trailer | Netflix,UCWOA1ZGywLbqmigxE4Qlvuw,Netflix,2025-05-14T15:00:01Z,4580010,45062,6417,Ugw2LLYVkQvJ35TTuCp4AaABAg,NA,@iulixMAXgames,UCadQdl_fDtDFPQUivc0ydsw,So all the people in this series are black 😂🤣,en,2025-06-17T23:01:22Z,2025-06-17 19:01:22,1,0
k1vWhii4tkE,Tyler Perry’s STRAW | Official Trailer | Netflix,UCWOA1ZGywLbqmigxE4Qlvuw,Netflix,2025-05-14T15:00:01Z,4580010,45062,6417,UgyE4x4ZSL7HKCWhOcJ4AaABAg,NA,@majedsaeed5367,UCFKT6Tvy43O-PkuAIzro56g,When Janiyas speaking with her mom does it was real or fake becouse it seems her phone literally was off then how she speaks to her mom dont tell me fbi opens up her phone pls,en,2025-06-17T23:01:15Z,2025-06-17 19:01:15,0,1
k1vWhii4tkE,Tyler Perry’s STRAW | Official Trailer | Netflix,UCWOA1ZGywLbqmigxE4Qlvuw,Netflix,2025-05-14T15:00:01Z,4580010,45062,6417,Ugw5w3P91Dqv528zDAp4AaABAg,NA,@Basedpackfan36,UCqRiM8AWk_AkJrCDezNcZUQ,Watched a bit of this passing and the female cop was siding with the main character murdering someone because she was fired from her job? Classic leftoid nonsense siding with the criminals. This madness truly has bled into everything even Tyler Perry movies 🤦‍♂️,en,2025-06-17T22:28:57Z,2025-06-17 18:28:57,0,1
k1vWhii4tkE,Tyler Perry’s STRAW | Official Trailer | Netflix,UCWOA1ZGywLbqmigxE4Qlvuw,Netflix,2025-05-14T15:00:01Z,4580010,45062,6417,UgwoPDbAHijA181qOip4AaABAg,NA,@madibasillah6925,UCeSPag2AWjMlLqT_CfnzNsQ,Hi,ca,2025-06-17T21:30:25Z,2025-06-17 17:30:25,0,0
k1vWhii4tkE,Tyler Perry’s STRAW | Official Trailer | Netflix,UCWOA1ZGywLbqmigxE4Qlvuw,Netflix,2025-05-14T15:00:01Z,4580010,45062,6417,UgxD5ZdJZTnfal-bbMp4AaABAg,NA,@Yaz_ku_on,UC53Knoh43X-wG_Cn4DOBBnw,"0:09 Actress did a phenomenal job, movie was worth watching. Netflix usually supports friction movies but this is was pure and 100% authentic down to earth real event based. As a Indian if a actress cant make audience feel her pain is not a true artist but this movie literally made me feel and thats true ""CINEMA"". Pick any individual of any caste they would feel the actress pain and that was a masterpiece. Film might be based on real events but this was above all emotions. Definitely vouch anybody to do watch this at least once. Producer, actress, director, cinematography and supporting cast all did a phenomenal job. Well Netflix just added a masterpiece in their library. Good job to the team. 👌👌👏👏👏👍👍🙏",en,2025-06-17T20:50:53Z,2025-06-17 16:50:53,0,1
k1vWhii4tkE,Tyler Perry’s STRAW | Official Trailer | Netflix,UCWOA1ZGywLbqmigxE4Qlvuw,Netflix,2025-05-14T15:00:01Z,4580010,45062,6417,UgxbhcSeqxya1-LztxN4AaABAg,NA,@CellDBS,UC0iDMUNfZS4e7ccsy2hqO6A,What is this racist trash?,en,2025-06-17T20:32:48Z,2025-06-17 16:32:48,2,0
k1vWhii4tkE,Tyler Perry’s STRAW | Official Trailer | Netflix,UCWOA1ZGywLbqmigxE4Qlvuw,Netflix,2025-05-14T15:00:01Z,4580010,45062,6417,UgzKcXN4hdjxHGFZKPJ4AaABAg,NA,@hiteshj2110,UCOd2MCZom3Amg_qKBV9m9jw,I cried my eyes out watching a movie in certainly the longest time also probably a movie that I cried the hardest. All the female leads done a great job. Congratulations to all the actors who worked on this film and thank you for making this!,en,2025-06-17T20:19:43Z,2025-06-17 16:19:43,13,0
k1vWhii4tkE,Tyler Perry’s STRAW | Official Trailer | Netflix,UCWOA1ZGywLbqmigxE4Qlvuw,Netflix,2025-05-14T15:00:01Z,4580010,45062,6417,UgxV4HlUW95NbgYNNa94AaABAg,NA,@Brismo7,UCgtpPYbtIfe6z0QaUGsIuXw,was this filmed in central africa?,en,2025-06-17T19:13:08Z,2025-06-17 15:13:08,1,0
k1vWhii4tkE,Tyler Perry’s STRAW | Official Trailer | Netflix,UCWOA1ZGywLbqmigxE4Qlvuw,Netflix,2025-05-14T15:00:01Z,4580010,45062,6417,UgwzBxIROpNWPF-Q-NB4AaABAg,NA,@christineclement9920,UCFxkTNqeCNte7bG5P2cB_XQ,Taraji gave a phenomenal performance. If not for her I wouldn’t have watched it all the way through. Some bad acting (lady cop👎) was making me want to turn it off but the main character I really felt for her and wanted to know she would be ok in the end.,en,2025-06-17T19:13:05Z,2025-06-17 15:13:05,0,0
k1vWhii4tkE,Tyler Perry’s STRAW | Official Trailer | Netflix,UCWOA1ZGywLbqmigxE4Qlvuw,Netflix,2025-05-14T15:00:01Z,4580010,45062,6417,UgwBZEUbYwo4lsJpcpZ4AaABAg,NA,@astral_walker,UCeDKUCYLx20UYbQNBuJd2Jg,Great Movie 🍿,NA,2025-06-17T18:58:02Z,2025-06-17 14:58:02,0,0
k1vWhii4tkE,Tyler Perry’s STRAW | Official Trailer | Netflix,UCWOA1ZGywLbqmigxE4Qlvuw,Netflix,2025-05-14T15:00:01Z,4580010,45062,6417,Ugx22m0ekFV-fU3afpB4AaABAg,NA,@mgtowanonymous3120,UC93w5iZN4TtW37inNg38ghA,"*""WHO IS LUIGI MANGIONE""*",NA,2025-06-17T18:36:29Z,2025-06-17 14:36:29,2,0
k1vWhii4tkE,Tyler Perry’s STRAW | Official Trailer | Netflix,UCWOA1ZGywLbqmigxE4Qlvuw,Netflix,2025-05-14T15:00:01Z,4580010,45062,6417,Ugz0pydKZAMIwfHqKwt4AaABAg,NA,@maggiepena7239,UCFaaPOu50Ji3w3xCzdk_mRw,Pay Taraji P what she is worth and that’s a lot. Taraji is freaking amazing. There’s not a black or white actress that can do it the way she does. She is my favorite actress. She pours everything she had to be in full blown character like no other. On my what a powerful role to place and she crushed it. This woman like wine gets better with time. Bravo 👏,en,2025-06-17T18:09:07Z,2025-06-17 14:09:07,0,0
k1vWhii4tkE,Tyler Perry’s STRAW | Official Trailer | Netflix,UCWOA1ZGywLbqmigxE4Qlvuw,Netflix,2025-05-14T15:00:01Z,4580010,45062,6417,Ugz6RjR8YdhGrM79iNB4AaABAg,NA,@champo187,UCASRqf-LGQW-OH3B5UOEGkg,"This is the same as the ""Breaking"" movie released in 2022",en,2025-06-17T17:04:54Z,2025-06-17 13:04:54,0,1
k1vWhii4tkE,Tyler Perry’s STRAW | Official Trailer | Netflix,UCWOA1ZGywLbqmigxE4Qlvuw,Netflix,2025-05-14T15:00:01Z,4580010,45062,6417,UgyaD8s-i2Xs-Q91w_54AaABAg,NA,@chilisaucecritic,UCeGCsikOAsvpCpy960RFCSA,"Just what we need, more black struggle porn,😢 where is our back to the Future equivalent, where is our raiders of the Lost ark equivalent?, we get one good Black panther movie and then it's right back to the same old same old😢",en,2025-06-17T16:53:21Z,2025-06-17 12:53:21,0,0
k1vWhii4tkE,Tyler Perry’s STRAW | Official Trailer | Netflix,UCWOA1ZGywLbqmigxE4Qlvuw,Netflix,2025-05-14T15:00:01Z,4580010,45062,6417,UgzEYk93oe9QX1DGIiJ4AaABAg,NA,@infectedgamer911,UCUh8-n-v_-nlFzSxXRgNX9A,hella dei. its gonna be terrible,en,2025-06-17T16:37:29Z,2025-06-17 12:37:29,1,0
k1vWhii4tkE,Tyler Perry’s STRAW | Official Trailer | Netflix,UCWOA1ZGywLbqmigxE4Qlvuw,Netflix,2025-05-14T15:00:01Z,4580010,45062,6417,UgwShQPYtii4JRrouGx4AaABAg,NA,@daphnebliss8796,UCMY_8l7-jWYmxCd-4qIuqgA,This Movie was Made to try to Divide Us… This is So Wrong Tyler Perry .. Stupid Shit,en,2025-06-17T16:28:40Z,2025-06-17 12:28:40,1,0
k1vWhii4tkE,Tyler Perry’s STRAW | Official Trailer | Netflix,UCWOA1ZGywLbqmigxE4Qlvuw,Netflix,2025-05-14T15:00:01Z,4580010,45062,6417,UgyJhXb3eqcdfMfSOg94AaABAg,NA,@williammckinley1035,UC8EMNdBK-YXLBLh_ts0_Ysw,In A World.....without White people.  LoL,en,2025-06-17T16:04:42Z,2025-06-17 12:04:42,1,0
k1vWhii4tkE,Tyler Perry’s STRAW | Official Trailer | Netflix,UCWOA1ZGywLbqmigxE4Qlvuw,Netflix,2025-05-14T15:00:01Z,4580010,45062,6417,UgxChwHw-u7LeRISlPl4AaABAg,NA,@Askmsslevi,UCS8hBglBE4_zq4Q1J4LC2xA,Live your lives Lady’s! Thank you Tyler Perry for showing up the way you are in this season; the industry needs it right now. Thank you for the JOY on the faces of these beautiful women. EXCELLENT! ❤❤❤,en,2025-06-17T16:02:27Z,2025-06-17 12:02:27,1,0
k1vWhii4tkE,Tyler Perry’s STRAW | Official Trailer | Netflix,UCWOA1ZGywLbqmigxE4Qlvuw,Netflix,2025-05-14T15:00:01Z,4580010,45062,6417,UgzJQtpFDb72k6dzIox4AaABAg,NA,@rittaose,UCzUC80jRAWjKXq2V5tEDHdg,I want the full movie 😢,mg,2025-06-17T15:50:05Z,2025-06-17 11:50:05,0,2
k1vWhii4tkE,Tyler Perry’s STRAW | Official Trailer | Netflix,UCWOA1ZGywLbqmigxE4Qlvuw,Netflix,2025-05-14T15:00:01Z,4580010,45062,6417,UgxecTqO7sPcTNds8054AaABAg,NA,@Assistttt,UC0d_WTFkXYq0791Wu91a20Q,It’s another John q plus the only person that can act is Taraji 🤣🤦🏽‍♂️,en,2025-06-17T15:46:13Z,2025-06-17 11:46:13,0,0
k1vWhii4tkE,Tyler Perry’s STRAW | Official Trailer | Netflix,UCWOA1ZGywLbqmigxE4Qlvuw,Netflix,2025-05-14T15:00:01Z,4580010,45062,6417,UgxQCtY5jJG-LAaiqTl4AaABAg,NA,@HOMEBOYZLIBRARYLATESTMOVIE-q6v,UCffa98SPXnzX7UkqrQbAhbw,GOOD PERFORMANCE,NA,2025-06-17T15:12:27Z,2025-06-17 11:12:27,1,0
k1vWhii4tkE,Tyler Perry’s STRAW | Official Trailer | Netflix,UCWOA1ZGywLbqmigxE4Qlvuw,Netflix,2025-05-14T15:00:01Z,4580010,45062,6417,UgxYdsVZUEVHuFdh5JB4AaABAg,NA,@bulletsRflying,UCpKFvpL5FyGQvIGYw5qD6Zw,She IS like this in real life. toxic af,en,2025-06-17T14:50:27Z,2025-06-17 10:50:27,1,0
k1vWhii4tkE,Tyler Perry’s STRAW | Official Trailer | Netflix,UCWOA1ZGywLbqmigxE4Qlvuw,Netflix,2025-05-14T15:00:01Z,4580010,45062,6417,Ugy4XfhGRBiOPjf_KXV4AaABAg,NA,@SimonxRitchie,UCdZiwp30jxgyflgVCfbXc0g,Taraji is a such great actress!,en,2025-06-17T14:30:59Z,2025-06-17 10:30:59,0,0
k1vWhii4tkE,Tyler Perry’s STRAW | Official Trailer | Netflix,UCWOA1ZGywLbqmigxE4Qlvuw,Netflix,2025-05-14T15:00:01Z,4580010,45062,6417,Ugyz9Im6mMNu4rGevf54AaABAg,NA,@genevagrace,UCAAQUdm9B80GBMNLK4L2I-w,Tyler Perry is a genius.  It's as  simple as that! ❤,en,2025-06-17T13:44:34Z,2025-06-17 09:44:34,0,0
k1vWhii4tkE,Tyler Perry’s STRAW | Official Trailer | Netflix,UCWOA1ZGywLbqmigxE4Qlvuw,Netflix,2025-05-14T15:00:01Z,4580010,45062,6417,UgyfZjqrcqiZ7zopGXh4AaABAg,NA,@U-Gin-j8z,UCoII7iDzaSbb8K4G7B5zMyQ,"As a Black viewer who genuinely wants to see our stories told with depth and realism, I find it hard to connect with Tyler Perry’s recent works—like “Straw.” The plots often feel forced, exaggerated, or completely detached from how real people behave. For example, a character going through intense desperation somehow turning into a killer and a thief, while dealing with so much? It just doesn’t add up, and it weakens the message.

This isn’t about race—it's about storytelling. I’ve called out white directors for similar issues, and I’ll do the same here. Black stories deserve better. We need layered narratives, not just trauma mixed with sudden unrealistic plot twists. Tyler Perry has a massive platform and the resources to give us excellence, but too often, it feels like we’re being handed rushed inspiration over solid storytelling. It’s okay to expect more.",en,2025-06-17T13:12:13Z,2025-06-17 09:12:13,1,0
k1vWhii4tkE,Tyler Perry’s STRAW | Official Trailer | Netflix,UCWOA1ZGywLbqmigxE4Qlvuw,Netflix,2025-05-14T15:00:01Z,4580010,45062,6417,UgwcBM0Vv4Ryg2qvoI54AaABAg,NA,@mariopalaciosjr4009,UC6H0Tcbt6tlPdWuP6w9sFpw,nothing new boring story,NA,2025-06-17T12:39:54Z,2025-06-17 08:39:54,0,0
k1vWhii4tkE,Tyler Perry’s STRAW | Official Trailer | Netflix,UCWOA1ZGywLbqmigxE4Qlvuw,Netflix,2025-05-14T15:00:01Z,4580010,45062,6417,UgzJ59-CHAcnNeDx_5p4AaABAg,NA,@christianbacon7448,UCQy6YAYUl4-ZFl1USoLzeoA,This reminds me of the movie Breaking with John Boyega,en,2025-06-17T12:39:01Z,2025-06-17 08:39:01,0,0
k1vWhii4tkE,Tyler Perry’s STRAW | Official Trailer | Netflix,UCWOA1ZGywLbqmigxE4Qlvuw,Netflix,2025-05-14T15:00:01Z,4580010,45062,6417,UgxtmcKt04B-lz80iK54AaABAg,NA,@MrKAHutch,UCZ-Jr9IwdwKy3ITCjLuqVlg,"Sheri Shepherd on the View “I’ve had more abortions than I would like to count”. Taraji was on the Obama podcast complaining about black women being perceived as “angry” but she plays the role frequently. These 3 women are sad (Tyler, Sherri, and Taraji.",en,2025-06-17T11:33:09Z,2025-06-17 07:33:09,1,0
k1vWhii4tkE,Tyler Perry’s STRAW | Official Trailer | Netflix,UCWOA1ZGywLbqmigxE4Qlvuw,Netflix,2025-05-14T15:00:01Z,4580010,45062,6417,UgzRi3cgjRtkHS1Qqb94AaABAg,NA,@boopal2235,UCRp6L4j8-EYFlIFkwcQTxbA,Tears.... Fantastic acting....,NA,2025-06-17T10:45:56Z,2025-06-17 06:45:56,0,0
k1vWhii4tkE,Tyler Perry’s STRAW | Official Trailer | Netflix,UCWOA1ZGywLbqmigxE4Qlvuw,Netflix,2025-05-14T15:00:01Z,4580010,45062,6417,UgydHk_KSQhKODZ6kmd4AaABAg,NA,@dionmcbean2578,UCfUvqWHOED06nNz1iyYDjKg,Tyler Perry will always have the best due to black people pain and imagine black people taking action itlll be something like this movie,en,2025-06-17T10:18:16Z,2025-06-17 06:18:16,0,0
k1vWhii4tkE,Tyler Perry’s STRAW | Official Trailer | Netflix,UCWOA1ZGywLbqmigxE4Qlvuw,Netflix,2025-05-14T15:00:01Z,4580010,45062,6417,UgwMeWIt0nrxXQonAYB4AaABAg,NA,@UsaRubber,UCtfe6ZF4nQKTPc13ZdWt7lw,Seriously great movie. Very John Q esque,en,2025-06-17T10:03:40Z,2025-06-17 06:03:40,0,0
