video_id,video_title,channel_id,channel_title,video_published_at,view_count,video_like_count,video_comment_count,comment_id,comment_parent_id,comment_author_display,comment_author_channel_id,comment_text,comment_lang,comment_published_utc,comment_published_local,comment_like_count,comment_reply_count
k1vWhii4tkE,Tyler Perry’s STRAW | Official Trailer | Netflix,UCWOA1ZGywLbqmigxE4Qlvuw,Netflix,2025-05-14T15:00:01Z,4580010,45062,6417,UgxI995wk7TC5bZ8wkx4AaABAg,NA,@ahl-ahlazodnem1217,UCW2qQuufnC2365Sr_FeCgVQ,wow this actress really give justice to her role.. she's really really good .. dang!  i hope she won a best actress award for this film together with the police woman and the brand manager.. i hope they won all in oscars,en,2025-06-25T16:06:16Z,2025-06-25 12:06:16,0,0
k1vWhii4tkE,Tyler Perry’s STRAW | Official Trailer | Netflix,UCWOA1ZGywLbqmigxE4Qlvuw,Netflix,2025-05-14T15:00:01Z,4580010,45062,6417,Ugy1Dss1HRyEOrLSx2N4AaABAg,NA,@joycaballesabendanomlang9083,UCBofTvBQvzAmLNMPFu2uosQ,Grave nakakaiyak tong palabas na to..😢,fil,2025-06-25T14:56:54Z,2025-06-25 10:56:54,0,0
k1vWhii4tkE,Tyler Perry’s STRAW | Official Trailer | Netflix,UCWOA1ZGywLbqmigxE4Qlvuw,Netflix,2025-05-14T15:00:01Z,4580010,45062,6417,Ugxn8QgKjUkw5VU_hyR4AaABAg,NA,@HOWARDDEANSCREAMTHIS,UCiAx--mCRpLC8QH5VSlDm7A,Black people will push black people over the edge. I'm so black fatigued I can't wait to move among the white people.,en,2025-06-25T13:57:26Z,2025-06-25 09:57:26,2,2
k1vWhii4tkE,Tyler Perry’s STRAW | Official Trailer | Netflix,UCWOA1ZGywLbqmigxE4Qlvuw,Netflix,2025-05-14T15:00:01Z,4580010,45062,6417,Ugz3S7ot7Q5nhe8FAP54AaABAg,NA,@veniggo,UCUy07GpjH15Z0xFRpk0RbTw,Bank manager is a brilliant lady,en,2025-06-25T13:41:40Z,2025-06-25 09:41:40,6,0
k1vWhii4tkE,Tyler Perry’s STRAW | Official Trailer | Netflix,UCWOA1ZGywLbqmigxE4Qlvuw,Netflix,2025-05-14T15:00:01Z,4580010,45062,6417,Ugzn1EctQaxvEi_4UzN4AaABAg,NA,@seanrose902,UCenEc-8ZGiMDCNiDhwvhJww,Those reaction videos already gave up the ending fuckers,en,2025-06-25T10:37:38Z,2025-06-25 06:37:38,0,0
k1vWhii4tkE,Tyler Perry’s STRAW | Official Trailer | Netflix,UCWOA1ZGywLbqmigxE4Qlvuw,Netflix,2025-05-14T15:00:01Z,4580010,45062,6417,UgyM05awThSOsqn_KYl4AaABAg,NA,@henrynjau5121,UCJIrsHmNKz6lgZR3-6PkM6w,"Feels like a gender-swapped imitation of John Q—same core plot, just a woman in the lead and a few script tweaks",en,2025-06-25T09:01:15Z,2025-06-25 05:01:15,1,0
k1vWhii4tkE,Tyler Perry’s STRAW | Official Trailer | Netflix,UCWOA1ZGywLbqmigxE4Qlvuw,Netflix,2025-05-14T15:00:01Z,4580010,45062,6417,UgyG-V3tWLefRjCCG1Z4AaABAg,NA,@vBAEIN,UCBfHwxRMo_ikTSUZdZy9Gwg,음....... 재미는 별로 없네.......,ko,2025-06-25T08:51:25Z,2025-06-25 04:51:25,0,0
k1vWhii4tkE,Tyler Perry’s STRAW | Official Trailer | Netflix,UCWOA1ZGywLbqmigxE4Qlvuw,Netflix,2025-05-14T15:00:01Z,4580010,45062,6417,UgxzHQLYH9cBkoYA6eh4AaABAg,NA,@superjerjer1,UCjs4TNiGhbLvDYFl1wYou0A,All is take one bad day,en,2025-06-25T05:32:45Z,2025-06-25 01:32:45,0,0
k1vWhii4tkE,Tyler Perry’s STRAW | Official Trailer | Netflix,UCWOA1ZGywLbqmigxE4Qlvuw,Netflix,2025-05-14T15:00:01Z,4580010,45062,6417,UgzG6ihEJyajkh6t3CJ4AaABAg,NA,@MihaelaHatch,UCeh1aPYPOolQXV9QlX1JYJQ,This looks like a really good movie,en,2025-06-25T03:34:50Z,2025-06-24 23:34:50,0,0
k1vWhii4tkE,Tyler Perry’s STRAW | Official Trailer | Netflix,UCWOA1ZGywLbqmigxE4Qlvuw,Netflix,2025-05-14T15:00:01Z,4580010,45062,6417,Ugx3LuPsWe5cojbxlF94AaABAg,NA,@KaisAIMoneyMastery,UCwsyBwt07fIZySMGxawzQ_w,Here this dude Tyler go again with the same single mom shizzzz for black women I will not be watching so disappointed he was the one who made it...might of gave it a try if it wasn't his tbr 💯,en,2025-06-25T01:45:54Z,2025-06-24 21:45:54,1,0
k1vWhii4tkE,Tyler Perry’s STRAW | Official Trailer | Netflix,UCWOA1ZGywLbqmigxE4Qlvuw,Netflix,2025-05-14T15:00:01Z,4580010,45062,6417,UgxtXiG-vHB01YBGS614AaABAg,NA,@anitajones846,UCv1qaDnkkqW_RW4Sf8luUFw,This was soooo good,so,2025-06-25T01:22:44Z,2025-06-24 21:22:44,0,0
k1vWhii4tkE,Tyler Perry’s STRAW | Official Trailer | Netflix,UCWOA1ZGywLbqmigxE4Qlvuw,Netflix,2025-05-14T15:00:01Z,4580010,45062,6417,UgxOLce9TzRvwyDQ4Tx4AaABAg,NA,@rockettt6722,UCb9SI8mjhzpZYnLM7u66R4Q,"I haven't seen it, but Taraji P. Henson is a goddess",NA,2025-06-25T00:13:26Z,2025-06-24 20:13:26,0,0
k1vWhii4tkE,Tyler Perry’s STRAW | Official Trailer | Netflix,UCWOA1ZGywLbqmigxE4Qlvuw,Netflix,2025-05-14T15:00:01Z,4580010,45062,6417,Ugzg2aMYjanY_9g0anF4AaABAg,NA,@Sweetbae504,UCel8qJf94IiGpiXwWqQjCWw,"This storyline reminds me so much of John Q, except he saves his son in the end😢",en,2025-06-24T22:40:49Z,2025-06-24 18:40:49,0,0
k1vWhii4tkE,Tyler Perry’s STRAW | Official Trailer | Netflix,UCWOA1ZGywLbqmigxE4Qlvuw,Netflix,2025-05-14T15:00:01Z,4580010,45062,6417,UgwTR3KNSF4WsWNRlDJ4AaABAg,NA,@richardchanda6806,UC7W_Q4_dQiQRh6X2rPPwVVg,What a talented woman without forcing just pure talent there 💯🙌🏽 A gangster like me cried. It was so hard for me to hold my tears 😢,en,2025-06-24T21:59:32Z,2025-06-24 17:59:32,0,0
k1vWhii4tkE,Tyler Perry’s STRAW | Official Trailer | Netflix,UCWOA1ZGywLbqmigxE4Qlvuw,Netflix,2025-05-14T15:00:01Z,4580010,45062,6417,Ugzpxkr1L_hnLClPDrd4AaABAg,NA,@abirdey5181,UCw-Hya6l8xfDcg0lfDKte_g,❤,ja,2025-06-24T21:16:43Z,2025-06-24 17:16:43,0,0
k1vWhii4tkE,Tyler Perry’s STRAW | Official Trailer | Netflix,UCWOA1ZGywLbqmigxE4Qlvuw,Netflix,2025-05-14T15:00:01Z,4580010,45062,6417,Ugyihy5zkjiBdohtKZd4AaABAg,NA,@thisiscrazy4122,UClO67YrX2uBiFzHpFdvQNmA,Teyana Taylor looks like ventriloquist's puppet,NA,2025-06-24T20:07:21Z,2025-06-24 16:07:21,0,0
k1vWhii4tkE,Tyler Perry’s STRAW | Official Trailer | Netflix,UCWOA1ZGywLbqmigxE4Qlvuw,Netflix,2025-05-14T15:00:01Z,4580010,45062,6417,Ugwc522oaAKeTTRWLft4AaABAg,NA,@IluvthuLRD,UCr1RSJn4unYS75Ruv7kJ_EQ,He's got a good grasp on this world the people in it and how it works.,en,2025-06-24T19:15:40Z,2025-06-24 15:15:40,0,0
k1vWhii4tkE,Tyler Perry’s STRAW | Official Trailer | Netflix,UCWOA1ZGywLbqmigxE4Qlvuw,Netflix,2025-05-14T15:00:01Z,4580010,45062,6417,Ugw5i4MXCACK6gruKZ14AaABAg,NA,@dallasblackfilm,UCxP-6zDCck1gologdwO9wYQ,"A bit of John Q starring Denzel Washington comes to mind ,but this is the opposite sex interesting .",en,2025-06-24T18:44:11Z,2025-06-24 14:44:11,0,0
k1vWhii4tkE,Tyler Perry’s STRAW | Official Trailer | Netflix,UCWOA1ZGywLbqmigxE4Qlvuw,Netflix,2025-05-14T15:00:01Z,4580010,45062,6417,Ugykangg9APd4-cUzkd4AaABAg,NA,@Naufalraynarr-n9q,UChra-ki-VDi8-s9wb3Gu6Yw,I'm crying 😭😭😭😭😭😭 good film,NA,2025-06-24T18:35:22Z,2025-06-24 14:35:22,0,0
k1vWhii4tkE,Tyler Perry’s STRAW | Official Trailer | Netflix,UCWOA1ZGywLbqmigxE4Qlvuw,Netflix,2025-05-14T15:00:01Z,4580010,45062,6417,UgzId10EDaJK55fndZh4AaABAg,NA,@theoriginalTimfromChat,UChp8Roz1Y0dJhgWXBDzIAXQ,"Wait, I want to see this, but is it mostly a hostage, all shot in one screen movie? I can't stand those kind of movies.",en,2025-06-24T18:09:34Z,2025-06-24 14:09:34,0,2
k1vWhii4tkE,Tyler Perry’s STRAW | Official Trailer | Netflix,UCWOA1ZGywLbqmigxE4Qlvuw,Netflix,2025-05-14T15:00:01Z,4580010,45062,6417,Ugw2SskiLVmp88uL_Ol4AaABAg,NA,@DariasDealer,UCTwJOnpoFCarBZwJOnCGWsg,So John Q but with women,NA,2025-06-24T16:41:47Z,2025-06-24 12:41:47,0,0
k1vWhii4tkE,Tyler Perry’s STRAW | Official Trailer | Netflix,UCWOA1ZGywLbqmigxE4Qlvuw,Netflix,2025-05-14T15:00:01Z,4580010,45062,6417,UgwbinjGImfKxvKFaVR4AaABAg,NA,@Katarina23,UCpGlHlpYawESlor2wK9IwIw,Yeah im not watching this anxiety inducing movie. I despise feeling hopeless for a fictional character,en,2025-06-24T14:04:11Z,2025-06-24 10:04:11,0,0
k1vWhii4tkE,Tyler Perry’s STRAW | Official Trailer | Netflix,UCWOA1ZGywLbqmigxE4Qlvuw,Netflix,2025-05-14T15:00:01Z,4580010,45062,6417,Ugykq9KCiuqABTFjrQp4AaABAg,NA,@fellipit,UCMfXRQAVsk7YaF6Qdr-2vFQ,Esse filme mostra completamente o sistema contra o negro fizeram a sociedade racista,pt,2025-06-24T13:17:21Z,2025-06-24 09:17:21,0,0
k1vWhii4tkE,Tyler Perry’s STRAW | Official Trailer | Netflix,UCWOA1ZGywLbqmigxE4Qlvuw,Netflix,2025-05-14T15:00:01Z,4580010,45062,6417,UgwOEpkCvo0GZlk_sfB4AaABAg,NA,@bossplayerstrongandindependent,UC5gzdSaQotpbiwg22Qr3YHw,😂 Strong and independent 😂,en,2025-06-24T12:14:21Z,2025-06-24 08:14:21,0,0
k1vWhii4tkE,Tyler Perry’s STRAW | Official Trailer | Netflix,UCWOA1ZGywLbqmigxE4Qlvuw,Netflix,2025-05-14T15:00:01Z,4580010,45062,6417,Ugy5V9R9iGYvFrO8fHx4AaABAg,NA,@wizzzer1337,UC3Iq2qgu15VDCxTIIGX1Mhw,"corny low quality trauma porn. this movie is Tyler Perry incapable of hiding his distain for black women all the while trying to make a movie about their struggle.
exploitation of the highest order, no matter how incredible Taraji was, this script could only have been written by someone who wants black women to suffer.",en,2025-06-24T11:50:33Z,2025-06-24 07:50:33,0,0
k1vWhii4tkE,Tyler Perry’s STRAW | Official Trailer | Netflix,UCWOA1ZGywLbqmigxE4Qlvuw,Netflix,2025-05-14T15:00:01Z,4580010,45062,6417,UgzWizx9v3e7BWj9-zZ4AaABAg,NA,@lukemorena9357,UCTYdUohGGvNvL89uGhouIhg,Low IQ movies for blck single moms,en,2025-06-24T10:47:32Z,2025-06-24 06:47:32,0,0
k1vWhii4tkE,Tyler Perry’s STRAW | Official Trailer | Netflix,UCWOA1ZGywLbqmigxE4Qlvuw,Netflix,2025-05-14T15:00:01Z,4580010,45062,6417,Ugxt3moOryHbo4Dd5Lx4AaABAg,NA,@retshegofaditswemoilwa9932,UCQMgBtBSK7R6WgBsgi8RHCg,Taraji is getting that Oscar. I repeat Taraji is getting that Oscar.❤❤❤,NA,2025-06-24T08:39:14Z,2025-06-24 04:39:14,0,0
k1vWhii4tkE,Tyler Perry’s STRAW | Official Trailer | Netflix,UCWOA1ZGywLbqmigxE4Qlvuw,Netflix,2025-05-14T15:00:01Z,4580010,45062,6417,Ugx8dUqmYdI_eBxqhxd4AaABAg,NA,@Tubifucall,UCy82KlR-6PnYizpwS1p63TQ,I hate the ending.. there were two whole story lines that never got wrapped up…,en,2025-06-24T04:38:31Z,2025-06-24 00:38:31,0,0
k1vWhii4tkE,Tyler Perry’s STRAW | Official Trailer | Netflix,UCWOA1ZGywLbqmigxE4Qlvuw,Netflix,2025-05-14T15:00:01Z,4580010,45062,6417,Ugz1fnrvjjfuyj1RvS94AaABAg,NA,@Coby_1010,UC_9MQ02TPeTeCp40sWgqCag,"At the end, THE GIRL IS ALREADY DEAD!!",en,2025-06-24T04:28:49Z,2025-06-24 00:28:49,0,0
k1vWhii4tkE,Tyler Perry’s STRAW | Official Trailer | Netflix,UCWOA1ZGywLbqmigxE4Qlvuw,Netflix,2025-05-14T15:00:01Z,4580010,45062,6417,UgwfCtaOfAxdxkSFPix4AaABAg,NA,@lashardawashington1625,UCXKp45RWDDm7uBp4p3RwkEA,"It was good I don’t care. Tyler was a genius. He is not making the black woman bad. Because I can relate to all the women… Tarij did it! I got the movie. As a woman we so busy taking care of our love ones, running on empty. The world is miserable and assuming. All it took was a little bit of empathy and a little bit of kindness. We are all in a way like Janiyah trying to struggle, survive, and take care of our love ones. But Janiyah didn’t process the pain and her mind did a 360. That’s what happens to black women, we suck things up and go. It wasn’t about the plight of the black woman but how we need to be a little bit kind because you don’t know how someone’s day is. Pure Genius",en,2025-06-24T04:25:08Z,2025-06-24 00:25:08,0,0
k1vWhii4tkE,Tyler Perry’s STRAW | Official Trailer | Netflix,UCWOA1ZGywLbqmigxE4Qlvuw,Netflix,2025-05-14T15:00:01Z,4580010,45062,6417,UgzGGHmVaxhN9KnPCLl4AaABAg,NA,@ThePatrickykm,UC0SP2wAvrbN4zBpaZHFLIHw,Black criminals matter. Why watch a movie when there’s hundreds of thousands of black criminals running around America wt the same victim mentality and say they didn’t do it or justify it wt what ever logic or white supremacy slavery shid.,en,2025-06-24T02:59:13Z,2025-06-23 22:59:13,0,0
k1vWhii4tkE,Tyler Perry’s STRAW | Official Trailer | Netflix,UCWOA1ZGywLbqmigxE4Qlvuw,Netflix,2025-05-14T15:00:01Z,4580010,45062,6417,UgwrXtZx-TP3IMQwme54AaABAg,NA,@giancarlotayag9412,UCage5ro45izwmWF4vXdlH_w,John Q,NA,2025-06-24T01:38:20Z,2025-06-23 21:38:20,0,0
k1vWhii4tkE,Tyler Perry’s STRAW | Official Trailer | Netflix,UCWOA1ZGywLbqmigxE4Qlvuw,Netflix,2025-05-14T15:00:01Z,4580010,45062,6417,Ugx-zi695APX2UmTfXh4AaABAg,NA,@angelicamichelle1646,UCgsRFLuYFEqqFRXfOETl-hg,This woman is a powerhouse and a phenomenal actress,en,2025-06-24T01:24:08Z,2025-06-23 21:24:08,0,0
k1vWhii4tkE,Tyler Perry’s STRAW | Official Trailer | Netflix,UCWOA1ZGywLbqmigxE4Qlvuw,Netflix,2025-05-14T15:00:01Z,4580010,45062,6417,UgxcWrvqiBh2eN7i10x4AaABAg,NA,@OMS_AK,UCC2rZF1UfDgA2keq0JRc4VQ,Did I see Jae from the Kountry Wayne skits😂😂😂😂😂,NA,2025-06-24T01:05:08Z,2025-06-23 21:05:08,0,0
k1vWhii4tkE,Tyler Perry’s STRAW | Official Trailer | Netflix,UCWOA1ZGywLbqmigxE4Qlvuw,Netflix,2025-05-14T15:00:01Z,4580010,45062,6417,UgwrMcQnCkvFqj6rwap4AaABAg,NA,@shugahjamison7961,UC9B-ILeEE4IibLJSC4aOO4g,"I became sick, Flu. My hot water heater went out. My son lost his job. We fell behind on the rent. He started working again, I'm waiting on a more paying job however it was too late and we got evicted. We are living in a hotel. God is still holding us up through the storm. I won't do this but I get it😢🙏🏾🙏🏾🙏🏾🙏🏾🙏🏾🙏🏾🙏🏾🙏🏾",en,2025-06-24T00:57:54Z,2025-06-23 20:57:54,0,0
k1vWhii4tkE,Tyler Perry’s STRAW | Official Trailer | Netflix,UCWOA1ZGywLbqmigxE4Qlvuw,Netflix,2025-05-14T15:00:01Z,4580010,45062,6417,UgzYT9fAYv_ceTjQ4fd4AaABAg,NA,@MrVtime614,UCqtGfMl0-49UKeCre_hGmpg,TRASH!!!!!!!!!!,hi-Latn,2025-06-23T23:08:18Z,2025-06-23 19:08:18,1,1
k1vWhii4tkE,Tyler Perry’s STRAW | Official Trailer | Netflix,UCWOA1ZGywLbqmigxE4Qlvuw,Netflix,2025-05-14T15:00:01Z,4580010,45062,6417,Ugx027dvxjzo3Z6DZyR4AaABAg,NA,@ashleylara8374,UCOsQRsy21wCC9yUgXYG5TEg,"God this movie hit home. My son was really sick the past year and part of 2025. The sleepless nights caring for your child, hospital stays, stressing about the medical bills. Applying for financial aid and waiting on the outcome. Luckily he is ok right now but it is expensive to be poor. I have an ok job and am struggling to get but by the grace of God and the skills he gave me but man it is so hard to work 2 jobs. Especially right now in the summer. Just trying to keep pushing on and working to pay the medical bills so I won't be sent to collections. Please pray for my son who is 6 so God can continue to watch over him and keep him healthy. If you are a struggling mom, or dad, or grandparent or foster parent, I see you, I hear you and I feel you. Sending lots of love and good spirits your way, hopefully one day we can be on the other side of things.",en,2025-06-23T21:02:43Z,2025-06-23 17:02:43,0,0
k1vWhii4tkE,Tyler Perry’s STRAW | Official Trailer | Netflix,UCWOA1ZGywLbqmigxE4Qlvuw,Netflix,2025-05-14T15:00:01Z,4580010,45062,6417,UgyMgjNHtG2GyF9SSyR4AaABAg,NA,@jeanine1406,UC4JVDSIze9IsNWhJDzo8YkA,I did not expect that twist! It made me cry 😢,en,2025-06-23T18:47:48Z,2025-06-23 14:47:48,1,0
k1vWhii4tkE,Tyler Perry’s STRAW | Official Trailer | Netflix,UCWOA1ZGywLbqmigxE4Qlvuw,Netflix,2025-05-14T15:00:01Z,4580010,45062,6417,Ugx81Ll2NjwCj8J9tL54AaABAg,NA,@juliovelez2282,UCMBRPWxAI4tAmkvlS21hoPQ,What an amazing movie and actress she made me cry 😭,en,2025-06-23T18:45:50Z,2025-06-23 14:45:50,0,0
k1vWhii4tkE,Tyler Perry’s STRAW | Official Trailer | Netflix,UCWOA1ZGywLbqmigxE4Qlvuw,Netflix,2025-05-14T15:00:01Z,4580010,45062,6417,Ugw3kg8cijYa43yaboZ4AaABAg,NA,@artstar-001,UCiVZgJrWVqVkaGrBDWJAXiw,"Female Version of The ""Breaking"" Movie (2022)???

🤷🏾‍♂️",en,2025-06-23T17:52:55Z,2025-06-23 13:52:55,0,0
k1vWhii4tkE,Tyler Perry’s STRAW | Official Trailer | Netflix,UCWOA1ZGywLbqmigxE4Qlvuw,Netflix,2025-05-14T15:00:01Z,4580010,45062,6417,UgzVqAjghOxTJt10dDN4AaABAg,NA,@SlayNetwork,UCBQTnCiwEvc76ZfHxDaRpxg,When did Teyana become an actress,en,2025-06-23T17:44:39Z,2025-06-23 13:44:39,0,0
k1vWhii4tkE,Tyler Perry’s STRAW | Official Trailer | Netflix,UCWOA1ZGywLbqmigxE4Qlvuw,Netflix,2025-05-14T15:00:01Z,4580010,45062,6417,UgwY1Uo2jB6h71G0DCN4AaABAg,NA,@newyorkny533,UCxkM9QsKA_6tW_SLaSKa5Wg,Reading these comments all I can say is most of you are either Netflix employees told to leave good reviews or you’re from TP’s casting couch!…,en,2025-06-23T17:44:25Z,2025-06-23 13:44:25,0,0
k1vWhii4tkE,Tyler Perry’s STRAW | Official Trailer | Netflix,UCWOA1ZGywLbqmigxE4Qlvuw,Netflix,2025-05-14T15:00:01Z,4580010,45062,6417,UgzbBl6ugRKs4VJmnHl4AaABAg,NA,@PauloViniciusSoares,UCkl238jcnkSAxrWOJNYRQQA,This woman should win each and every award that ever existed.... She's insane!! OMG,en,2025-06-23T14:11:39Z,2025-06-23 10:11:39,0,1
k1vWhii4tkE,Tyler Perry’s STRAW | Official Trailer | Netflix,UCWOA1ZGywLbqmigxE4Qlvuw,Netflix,2025-05-14T15:00:01Z,4580010,45062,6417,UgwCmf7fVKaq7Ffi4S14AaABAg,NA,@lindajolly935,UCVy-MYj6N3o4lVrbXqlOrOA,This was an Excellent Movie!  Loved it!  Real life!  🙏🏽💝💝💝,en,2025-06-23T13:36:43Z,2025-06-23 09:36:43,0,0
k1vWhii4tkE,Tyler Perry’s STRAW | Official Trailer | Netflix,UCWOA1ZGywLbqmigxE4Qlvuw,Netflix,2025-05-14T15:00:01Z,4580010,45062,6417,UgwzvkFQJpTWDbAmWbN4AaABAg,NA,@TheMJJJoy,UCgR92aLwrFPBAv12xDb9uxA,This film is Phenomenal !!!!! I THOUGHT I KNEW WHAT WAS HAPPENING.,en,2025-06-23T12:07:13Z,2025-06-23 08:07:13,0,0
k1vWhii4tkE,Tyler Perry’s STRAW | Official Trailer | Netflix,UCWOA1ZGywLbqmigxE4Qlvuw,Netflix,2025-05-14T15:00:01Z,4580010,45062,6417,Ugz-Tco52a0XU-T_-NJ4AaABAg,NA,@dablaqgamer463,UCVX7sJsi6iNWs8RiT_PHp_g,So John Q Prdouced by Tyler Perry & Netflix?,NA,2025-06-23T11:50:27Z,2025-06-23 07:50:27,0,0
k1vWhii4tkE,Tyler Perry’s STRAW | Official Trailer | Netflix,UCWOA1ZGywLbqmigxE4Qlvuw,Netflix,2025-05-14T15:00:01Z,4580010,45062,6417,UgxRMMzxtSMZZqXECOF4AaABAg,NA,@WheelieBin03,UCghwWVqB3wMysRblacSY9wg,Laughably bad movie,en,2025-06-23T10:48:49Z,2025-06-23 06:48:49,0,0
k1vWhii4tkE,Tyler Perry’s STRAW | Official Trailer | Netflix,UCWOA1ZGywLbqmigxE4Qlvuw,Netflix,2025-05-14T15:00:01Z,4580010,45062,6417,Ugw3xjUlbzWFeSK0AsJ4AaABAg,NA,@jasonlim7427,UCXTCHDKl8ppzphlNuk4Ieig,why most of the scenes are black people 🤣,en,2025-06-23T10:18:18Z,2025-06-23 06:18:18,0,0
k1vWhii4tkE,Tyler Perry’s STRAW | Official Trailer | Netflix,UCWOA1ZGywLbqmigxE4Qlvuw,Netflix,2025-05-14T15:00:01Z,4580010,45062,6417,UgwXyc6wrz6KPN_NHo54AaABAg,NA,@thefoxandthelynx,UCQmWQT7ZCYpKhNMesAQsYhg,So.... it's a female version of John Q,NA,2025-06-23T09:13:44Z,2025-06-23 05:13:44,0,0
k1vWhii4tkE,Tyler Perry’s STRAW | Official Trailer | Netflix,UCWOA1ZGywLbqmigxE4Qlvuw,Netflix,2025-05-14T15:00:01Z,4580010,45062,6417,Ugyez_WCoeRgOuy9L1h4AaABAg,NA,@KevinCampbell-j9q,UCjeMq05elQt8yalx-qRtiaQ,"If Hollywood doesn't give Teraji P. Henson her FLOWERS NOW they need to be CANCELLED!!!!! What more does she have to do to prove her worth? When will Tyler Perry treat Teraji fairly???? She has delivered YET ANOTHER MASTERPIECE for Tyler Perry, when will she be recognised???",en,2025-06-23T06:00:59Z,2025-06-23 02:00:59,0,0
k1vWhii4tkE,Tyler Perry’s STRAW | Official Trailer | Netflix,UCWOA1ZGywLbqmigxE4Qlvuw,Netflix,2025-05-14T15:00:01Z,4580010,45062,6417,Ugyzsca9Bmk9zzRAyNx4AaABAg,NA,@EliaraTafao_,UCmdItqCtQr2s7kECabjVy-Q,IVE been crying and sobbing for days on end …..truly a masterpiece….. Hats off to all the mothers out there single mothers and fathers everyone WHOS trying to make it,en,2025-06-23T05:17:52Z,2025-06-23 01:17:52,1,0
k1vWhii4tkE,Tyler Perry’s STRAW | Official Trailer | Netflix,UCWOA1ZGywLbqmigxE4Qlvuw,Netflix,2025-05-14T15:00:01Z,4580010,45062,6417,UgzEmSqvxoE3jDDaPfN4AaABAg,NA,@pissedoffbucketguy9115,UCcynFTL_F9Pwt5MKm1TeYzA,This was one of the worst movies i had ever had the misfortune of viewing in my life,en,2025-06-23T04:32:05Z,2025-06-23 00:32:05,0,0
k1vWhii4tkE,Tyler Perry’s STRAW | Official Trailer | Netflix,UCWOA1ZGywLbqmigxE4Qlvuw,Netflix,2025-05-14T15:00:01Z,4580010,45062,6417,Ugy2By7xzxQvO4VdnGl4AaABAg,NA,@parradoxx7123,UCmkZDm2Nj1LGeVNZg1DX8TA,Terrible ending the whole movie was good till the ending,en,2025-06-23T04:12:24Z,2025-06-23 00:12:24,1,0
k1vWhii4tkE,Tyler Perry’s STRAW | Official Trailer | Netflix,UCWOA1ZGywLbqmigxE4Qlvuw,Netflix,2025-05-14T15:00:01Z,4580010,45062,6417,UgxgJxcHkrf54m7nPfZ4AaABAg,NA,@CanadaMath,UCPjak7r62HVJ6rvgsu2xoFA,"So let me get this straight:

A black woman, who is a complete failure in life, murders two people, and commits armed robbery . . . we are supposed to feel sorry for her?

That is the plot of this film. Yes this is true.

She can't pay her rent, can't afford to feed her kid, can't keep a job, can't keep a husband, a total and absolute worthless ghetto single mother.

So she decides to murder her boss and then rob a local bank.

But we have to all stand up and cheer for her just like the stupid people that live in her town are doing outside of the bank she is robbing and keeping people hostage inside.

Absolutely unbearable political correctness and I am sick of it.

She needs to be sentenced to life in prison with no possibility of parole.

Bye Felicia. (or whatever her name was in this film).

P.S. Tyler Perry should spend at least one month in prison for making this disgusting filth.",en,2025-06-23T04:06:41Z,2025-06-23 00:06:41,0,0
k1vWhii4tkE,Tyler Perry’s STRAW | Official Trailer | Netflix,UCWOA1ZGywLbqmigxE4Qlvuw,Netflix,2025-05-14T15:00:01Z,4580010,45062,6417,UgzMUSEq165PiPoRj3l4AaABAg,NA,@williams4994,UCIS48adIdK6zSicB7HcGCQg,It's just a fuking remake of John Q but in a bank...,en,2025-06-23T04:06:29Z,2025-06-23 00:06:29,0,0
k1vWhii4tkE,Tyler Perry’s STRAW | Official Trailer | Netflix,UCWOA1ZGywLbqmigxE4Qlvuw,Netflix,2025-05-14T15:00:01Z,4580010,45062,6417,UgzsalcMSCySyqxuQRt4AaABAg,NA,@PowerIsWithin,UC0Qf8cH3SqCFpvV-lTO1P7Q,May God be with all the single  mothers and please bless them and guide them. Ya go through a lot mentally and it’s not easy.  Not just single mothers all mothers but i sympathize with the single mothers and keep ya in my prayers daily.,en,2025-06-23T03:53:59Z,2025-06-22 23:53:59,0,0
k1vWhii4tkE,Tyler Perry’s STRAW | Official Trailer | Netflix,UCWOA1ZGywLbqmigxE4Qlvuw,Netflix,2025-05-14T15:00:01Z,4580010,45062,6417,UgxUKTz056DjdCsMeWN4AaABAg,NA,@lisahenson802,UCWmPEdH9jn0oCwQ7-GKLCRg,So this movie is a clear rip off of John Q and Falling Down.,en,2025-06-23T02:10:34Z,2025-06-22 22:10:34,1,0
k1vWhii4tkE,Tyler Perry’s STRAW | Official Trailer | Netflix,UCWOA1ZGywLbqmigxE4Qlvuw,Netflix,2025-05-14T15:00:01Z,4580010,45062,6417,UgxL2OfB818V_eW_9LZ4AaABAg,NA,@ElioEVarona,UC7473bPExdK42uZAda4xF8g,"She is a masterpiece with this character....it took me down, broke my heart",en,2025-06-23T01:44:31Z,2025-06-22 21:44:31,0,0
k1vWhii4tkE,Tyler Perry’s STRAW | Official Trailer | Netflix,UCWOA1ZGywLbqmigxE4Qlvuw,Netflix,2025-05-14T15:00:01Z,4580010,45062,6417,UgwU9RhjBgyY9V0YFg14AaABAg,NA,@chaboi7,UCn5eLU1PfafrQrD5pStrYgQ,I stopped feeling bad for her when she killed her manager in cold blood....,en,2025-06-23T01:35:19Z,2025-06-22 21:35:19,0,0
k1vWhii4tkE,Tyler Perry’s STRAW | Official Trailer | Netflix,UCWOA1ZGywLbqmigxE4Qlvuw,Netflix,2025-05-14T15:00:01Z,4580010,45062,6417,Ugy5v4vAZACPbtS6xLt4AaABAg,NA,@willienewton5316,UCQBSJUvufn--IXgJrQFFKzw,"HONESTLY....THIS SHOULD BE IN THEATERS AS WELL...BUT THEY'LL PUT MEDEA UP THERE WHICH HAS IT'S POSITIVES...
BUT MASTERPIECES LIKE THIS ONE WITH SUCH A GREAT ACTRESS BELONGS ON THE BIG SCREEN..

TISSUES ANYONE????😢😢😢😢😊👌👌👍🙏",en,2025-06-23T00:22:20Z,2025-06-22 20:22:20,1,0
k1vWhii4tkE,Tyler Perry’s STRAW | Official Trailer | Netflix,UCWOA1ZGywLbqmigxE4Qlvuw,Netflix,2025-05-14T15:00:01Z,4580010,45062,6417,Ugy-KDHL44NhDmzwM-d4AaABAg,NA,@SarahMohamed-s4q,UCJYh9tEEimQdrLN9WS4xFvw,It’s been along time since I cried my heart out over a film. This was incredible it truly moved me,en,2025-06-22T23:33:31Z,2025-06-22 19:33:31,0,0
k1vWhii4tkE,Tyler Perry’s STRAW | Official Trailer | Netflix,UCWOA1ZGywLbqmigxE4Qlvuw,Netflix,2025-05-14T15:00:01Z,4580010,45062,6417,Ugzxw2H9OWJIjbvJhn94AaABAg,NA,@thalifeofkarter2914,UCEb_rnQXlbxqWoS1l-HGoIg,Denzel already did this movie and it was better😂,en,2025-06-22T22:45:05Z,2025-06-22 18:45:05,0,0
k1vWhii4tkE,Tyler Perry’s STRAW | Official Trailer | Netflix,UCWOA1ZGywLbqmigxE4Qlvuw,Netflix,2025-05-14T15:00:01Z,4580010,45062,6417,UgzJPiV482KWFLjDvwF4AaABAg,NA,@lylaempleoavinon1124,UCqXIQiqDMIMwlQ4KPYpiY0Q,Amazing movie I cried like hell.,haw,2025-06-22T22:25:39Z,2025-06-22 18:25:39,1,0
k1vWhii4tkE,Tyler Perry’s STRAW | Official Trailer | Netflix,UCWOA1ZGywLbqmigxE4Qlvuw,Netflix,2025-05-14T15:00:01Z,4580010,45062,6417,UgzdBIVb9EstXHHoqwZ4AaABAg,NA,@deborahevans5315,UCuY76lcgB-tHeLXBzGWLmMA,"The movie was very good. But it kinda left me hanging. I know    the movie is new but we would like to have to have a part 2. We want to know how things worked out for Jaynia after he was released from prison, that's if she was convicted.  Thank you keep up the good work😊😊😊😊😊😊",en,2025-06-22T22:13:39Z,2025-06-22 18:13:39,0,0
k1vWhii4tkE,Tyler Perry’s STRAW | Official Trailer | Netflix,UCWOA1ZGywLbqmigxE4Qlvuw,Netflix,2025-05-14T15:00:01Z,4580010,45062,6417,Ugx3qy0jDQnVvjw9unl4AaABAg,NA,@d.omoneychaser5112,UC91NukqT4jWOWs7wK1iz3_Q,Taraji was perfect in her acting wow 🔥,en,2025-06-22T22:04:34Z,2025-06-22 18:04:34,0,0
k1vWhii4tkE,Tyler Perry’s STRAW | Official Trailer | Netflix,UCWOA1ZGywLbqmigxE4Qlvuw,Netflix,2025-05-14T15:00:01Z,4580010,45062,6417,UgwYWVi8mEqM9X1iYUl4AaABAg,NA,@tysiaaffoya9,UCH3PFgC0XRIXczhfs7Bdwrg,"Just finished watching the movie..and let me tell you, the storyline is powerful. Very well written. Taraji is so good in it. I got so emotional. She is just so good. I felt every emotions she went through. I didn't expect this kind of ending. This is a great movie.",en,2025-06-22T22:01:35Z,2025-06-22 18:01:35,1,0
