video_id,video_url,comment_id,comment_author_display,comment_author_channel_id,comment_content,comment_lang,comment_time_utc,comment_time_local,comment_like_count,comment_reply_count,reply_id,reply_author_display,reply_author_channel_id,reply_content,reply_lang,reply_time_utc,reply_time_local,reply_like_count,view_count,like_count,comment_count,crawl_time
HcrbR6EXynM,https://www.youtube.com/watch?v=HcrbR6EXynM,UgwLnciIUkSQmvDhH6Z4AaABAg,@MsGnor,UCf43AQ6hPZjZMRTOUuTL-4A,Colour me GOBSMACKED,NA,2025-10-07T00:24:12Z,2025-10-06 20:24:12,0,1,UgwLnciIUkSQmvDhH6Z4AaABAg.ANxiqXW0D8dAO7e6zq4Lq8,@NateByrd-Library5013,UCeC8Xax3YyJeMJryyNlcA8g,"Play It, yea",NA,2025-10-11T06:14:33Z,2025-10-11 02:14:33,0,934596,8098,819,"Wed, 17 Dec 2025 11:59:50 GMT"
HcrbR6EXynM,https://www.youtube.com/watch?v=HcrbR6EXynM,UgzQNog-Urg3Dky5VuN4AaABAg,@mrtheron7200,UC7VhqkR1jAS3RkTZagi0vWg,classic: moves to londonistan to fall for an asian man w a fake british accent. BUT DOES WORSHIP MUHAMMAD,en,2025-08-10T13:45:20Z,2025-08-10 09:45:20,0,1,UgzQNog-Urg3Dky5VuN4AaABAg.ALdoQUVKHhqANaF6KbqgsH,@Bee-w9n,UC4eaaBlQBH_cDaN04IBDKJA,Never happened irl,NA,2025-09-27T21:33:05Z,2025-09-27 17:33:05,0,934596,8098,819,"Wed, 17 Dec 2025 11:59:50 GMT"
HcrbR6EXynM,https://www.youtube.com/watch?v=HcrbR6EXynM,UgxwjAFFGeksK1ctyAZ4AaABAg,@osh886,UC2bXPq0b5g9BhLW7Q1nVMMQ,Why do so many shows/movies have a spitting scene now 🤨 like who's normal and doing that? Bffr is it just for shock value?,en,2025-08-05T22:57:42Z,2025-08-05 18:57:42,1,2,UgxwjAFFGeksK1ctyAZ4AaABAg.ALSvei_iImbALZKgrmsYfk,@fastest-man-alive,UC8NSIeV9t80epRofc2BW7Hg,You just haven't found the one,en,2025-08-08T10:40:38Z,2025-08-08 06:40:38,0,934596,8098,819,"Wed, 17 Dec 2025 11:59:50 GMT"
HcrbR6EXynM,https://www.youtube.com/watch?v=HcrbR6EXynM,UgxwjAFFGeksK1ctyAZ4AaABAg,@osh886,UC2bXPq0b5g9BhLW7Q1nVMMQ,Why do so many shows/movies have a spitting scene now 🤨 like who's normal and doing that? Bffr is it just for shock value?,en,2025-08-05T22:57:42Z,2025-08-05 18:57:42,1,2,UgxwjAFFGeksK1ctyAZ4AaABAg.ALSvei_iImbAL_WAdLeI1b,@osh886,UC2bXPq0b5g9BhLW7Q1nVMMQ,​@fastest-man-alive😂😅maybe,en,2025-08-08T21:40:11Z,2025-08-08 17:40:11,0,934596,8098,819,"Wed, 17 Dec 2025 11:59:50 GMT"
HcrbR6EXynM,https://www.youtube.com/watch?v=HcrbR6EXynM,Ugx4yaNYJZ_qFg0rgZ94AaABAg,@Darlintino,UC6ONPCwMIYkCdzScLC3n0uA,"Okay... can Netflix pls explain why that spitting scene had any business being in the trailer? That was a bit ""Too Much""",en,2025-07-29T09:55:14Z,2025-07-29 05:55:14,6,5,Ugx4yaNYJZ_qFg0rgZ94AaABAg.AL9VYbG2c-5ALL_ZKbQwfy,@tiffanymoton704,UCDTmR-G66qOWltErdNZT0AA,probably because the show is explicit and theyre making sure that anyone who cant handle a little spitting knows right away its not for them,en,2025-08-03T02:29:54Z,2025-08-02 22:29:54,1,934596,8098,819,"Wed, 17 Dec 2025 11:59:50 GMT"
HcrbR6EXynM,https://www.youtube.com/watch?v=HcrbR6EXynM,Ugx4yaNYJZ_qFg0rgZ94AaABAg,@Darlintino,UC6ONPCwMIYkCdzScLC3n0uA,"Okay... can Netflix pls explain why that spitting scene had any business being in the trailer? That was a bit ""Too Much""",en,2025-07-29T09:55:14Z,2025-07-29 05:55:14,6,5,Ugx4yaNYJZ_qFg0rgZ94AaABAg.AL9VYbG2c-5ALfW8Tny9UZ,@terri6854,UC-HdnU56uNl9AaH-sihmqtA,"@tiffanymoton704 They should just say it's for gross people, then.",en,2025-08-11T05:35:20Z,2025-08-11 01:35:20,3,934596,8098,819,"Wed, 17 Dec 2025 11:59:50 GMT"
HcrbR6EXynM,https://www.youtube.com/watch?v=HcrbR6EXynM,Ugx4yaNYJZ_qFg0rgZ94AaABAg,@Darlintino,UC6ONPCwMIYkCdzScLC3n0uA,"Okay... can Netflix pls explain why that spitting scene had any business being in the trailer? That was a bit ""Too Much""",en,2025-07-29T09:55:14Z,2025-07-29 05:55:14,6,5,Ugx4yaNYJZ_qFg0rgZ94AaABAg.AL9VYbG2c-5ALgBwcWKODI,@tiffanymoton704,UCDTmR-G66qOWltErdNZT0AA,@terri6854I mean sure I guess..but I feel like they did that by including the spitting scene in the trailer which was my whole point lol,en,2025-08-11T11:58:04Z,2025-08-11 07:58:04,0,934596,8098,819,"Wed, 17 Dec 2025 11:59:50 GMT"
HcrbR6EXynM,https://www.youtube.com/watch?v=HcrbR6EXynM,Ugx4yaNYJZ_qFg0rgZ94AaABAg,@Darlintino,UC6ONPCwMIYkCdzScLC3n0uA,"Okay... can Netflix pls explain why that spitting scene had any business being in the trailer? That was a bit ""Too Much""",en,2025-07-29T09:55:14Z,2025-07-29 05:55:14,6,5,Ugx4yaNYJZ_qFg0rgZ94AaABAg.AL9VYbG2c-5ALgC16ziVFW,@tiffanymoton704,UCDTmR-G66qOWltErdNZT0AA,⁠@terri6854and btw—kinkshaming is lame. let people live,en,2025-08-11T11:58:49Z,2025-08-11 07:58:49,1,934596,8098,819,"Wed, 17 Dec 2025 11:59:50 GMT"
HcrbR6EXynM,https://www.youtube.com/watch?v=HcrbR6EXynM,Ugx4yaNYJZ_qFg0rgZ94AaABAg,@Darlintino,UC6ONPCwMIYkCdzScLC3n0uA,"Okay... can Netflix pls explain why that spitting scene had any business being in the trailer? That was a bit ""Too Much""",en,2025-07-29T09:55:14Z,2025-07-29 05:55:14,6,5,Ugx4yaNYJZ_qFg0rgZ94AaABAg.AL9VYbG2c-5AMdJOkUHNpF,@Aliena_piano,UCZf4RmhKNplAJp6Hrr6oC2Q,"The show is about experiencing ""the different"" after a totally submissive life with a shitty person as an ex boyfriend. Is that so difficult to understand?",en,2025-09-04T05:36:53Z,2025-09-04 01:36:53,0,934596,8098,819,"Wed, 17 Dec 2025 11:59:50 GMT"
HcrbR6EXynM,https://www.youtube.com/watch?v=HcrbR6EXynM,UgyfIfgTXvlaKffCHNV4AaABAg,@divi2012,UCuIIFEXbduD8GO0s1-SOxnw,I can't be the only one who hated the ending! What! Whhhhhhaaaaat!,en,2025-07-25T19:18:55Z,2025-07-25 15:18:55,1,1,UgyfIfgTXvlaKffCHNV4AaABAg.AL0CsiDySLdALDvhn-sOA0,@Queen1Kingdom,UC4IO_ZMQVqOSDDBixP0A-rA,"I hated the whole show, specially Jessica",en,2025-07-31T03:09:31Z,2025-07-30 23:09:31,1,934596,8098,819,"Wed, 17 Dec 2025 11:59:50 GMT"
HcrbR6EXynM,https://www.youtube.com/watch?v=HcrbR6EXynM,Ugyn7WXZOd9qKz677KF4AaABAg,@TigerLily25,UCkmH7ynuXLrHHZpES6_Ovrw,God there is so much hate wtf!! I LOVE Lena and I LOVE Meg Stalter…LOVED Girls and can’t wait to see this show!!!,en,2025-07-25T14:54:03Z,2025-07-25 10:54:03,3,1,Ugyn7WXZOd9qKz677KF4AaABAg.AL-jZnq6LjBALKM6DfemJI,@hannahk8668,UCKpRQteOptglikx8nAc74nw,"Um THANK YOU! Same. Albeit I have a love hate relationship w GIRLS. BUT WHO COULD POSSIBLY HATE ON MEG STALTER? I'll watch that gloriously  comedic, zany lady ANY DAY.",en,2025-08-02T15:04:21Z,2025-08-02 11:04:21,0,934596,8098,819,"Wed, 17 Dec 2025 11:59:50 GMT"
HcrbR6EXynM,https://www.youtube.com/watch?v=HcrbR6EXynM,UgyaSKcrnYV-mKTYvpJ4AaABAg,@2dclxvi,UCu8iavGELX0-hmYiBy3iOiA,"Ahh yes...another Dunham show about a neurotic, entitled and aggressively unattractive woman.  Hard pass.",en,2025-07-25T01:10:21Z,2025-07-24 21:10:21,3,2,UgyaSKcrnYV-mKTYvpJ4AaABAg.AKzGIlTqYEUALDvnQ8VdWb,@Queen1Kingdom,UC4IO_ZMQVqOSDDBixP0A-rA,You’re not missing anything. This show was awful,en,2025-07-31T03:10:17Z,2025-07-30 23:10:17,1,934596,8098,819,"Wed, 17 Dec 2025 11:59:50 GMT"
HcrbR6EXynM,https://www.youtube.com/watch?v=HcrbR6EXynM,UgyaSKcrnYV-mKTYvpJ4AaABAg,@2dclxvi,UCu8iavGELX0-hmYiBy3iOiA,"Ahh yes...another Dunham show about a neurotic, entitled and aggressively unattractive woman.  Hard pass.",en,2025-07-25T01:10:21Z,2025-07-24 21:10:21,3,2,UgyaSKcrnYV-mKTYvpJ4AaABAg.AKzGIlTqYEUALKMAfZ3T-0,@hannahk8668,UCKpRQteOptglikx8nAc74nw,Meg is beautiful!,fy,2025-08-02T15:04:58Z,2025-08-02 11:04:58,1,934596,8098,819,"Wed, 17 Dec 2025 11:59:50 GMT"
HcrbR6EXynM,https://www.youtube.com/watch?v=HcrbR6EXynM,Ugw4lv14-puq2zVN4xR4AaABAg,@j.t2310,UCoFY-UpnmPC7G40vcwsWOew,"Is this really representative of women? I don't see any of the women I know being this pathetic.. this movie/series is seriously degrading, just from the trailer.",en,2025-07-24T13:09:53Z,2025-07-24 09:09:53,4,1,Ugw4lv14-puq2zVN4xR4AaABAg.AKxyqyehy9WALDvtbBdXHv,@Queen1Kingdom,UC4IO_ZMQVqOSDDBixP0A-rA,I watched the whole thing (unfortunately) and they portrayed ALL the women in this show as awful humans.,en,2025-07-31T03:11:07Z,2025-07-30 23:11:07,2,934596,8098,819,"Wed, 17 Dec 2025 11:59:50 GMT"
HcrbR6EXynM,https://www.youtube.com/watch?v=HcrbR6EXynM,UgyKlZgTypKHPoVlqdZ4AaABAg,@brandinshaeffer8970,UCMd3VthELYCCk3bhlBBmFVQ,London is a cesspool these days compared to 20 years ago,en,2025-07-24T01:47:14Z,2025-07-23 21:47:14,0,1,UgyKlZgTypKHPoVlqdZ4AaABAg.AKwkj6lkxPKALKMEuKHYPw,@hannahk8668,UCKpRQteOptglikx8nAc74nw,Lol,uk,2025-08-02T15:05:32Z,2025-08-02 11:05:32,0,934596,8098,819,"Wed, 17 Dec 2025 11:59:50 GMT"
HcrbR6EXynM,https://www.youtube.com/watch?v=HcrbR6EXynM,Ugwa4FhjatPT2H-bpKd4AaABAg,@carolparker7668,UCo1CC7gtUta6kazxIRU4pRw,Jesus fecking Christ.,NA,2025-07-22T21:00:58Z,2025-07-22 17:00:58,1,1,Ugwa4FhjatPT2H-bpKd4AaABAg.AKtfAT9dvxqALKMIulso8Z,@hannahk8668,UCKpRQteOptglikx8nAc74nw,Lollll hello govna,NA,2025-08-02T15:06:05Z,2025-08-02 11:06:05,0,934596,8098,819,"Wed, 17 Dec 2025 11:59:50 GMT"
HcrbR6EXynM,https://www.youtube.com/watch?v=HcrbR6EXynM,UgxBJ-1LEkWklDo8_6x4AaABAg,@jthesnarkywombat,UCUeR36xeS776qJz1oF1ndJw,I can already tell she's another Lena Dunham and I hate Lena Dunham. Another movie about a fat whiny slob with a vaginal infection? 🤢No thanks.,en,2025-07-22T02:26:13Z,2025-07-21 22:26:13,2,1,UgxBJ-1LEkWklDo8_6x4AaABAg.AKrfakvagoKALKMM-4OMLd,@hannahk8668,UCKpRQteOptglikx8nAc74nw,"Man this comment section is like ""we hate Lena Dunham."" Man.",en,2025-08-02T15:06:31Z,2025-08-02 11:06:31,1,934596,8098,819,"Wed, 17 Dec 2025 11:59:50 GMT"
HcrbR6EXynM,https://www.youtube.com/watch?v=HcrbR6EXynM,UgyjZExlN5jyrexOkB54AaABAg,@Penuel.g,UCWshxRM_g4s0p950zkyvrpw,The title of the series is truly befitting,en,2025-07-20T20:19:31Z,2025-07-20 16:19:31,2,1,UgyjZExlN5jyrexOkB54AaABAg.AKoRq3lo-tuAMLBxiUWFDI,@f4ust85,UCbbMUCQOkgg8w-e3cZ4cUsg,The script is always either Too much or Too little.,en,2025-08-27T19:26:19Z,2025-08-27 15:26:19,0,934596,8098,819,"Wed, 17 Dec 2025 11:59:50 GMT"
HcrbR6EXynM,https://www.youtube.com/watch?v=HcrbR6EXynM,UgwlJUJUtRlD-OP_rpt4AaABAg,@CucWater,UCZytIYeMj8J-a8BKH8wjzcg,"I didn't really get this show... like are we supposed to sympathize with the main character or? Because she's an absolutely terrible human being.

It has that weird like ""haha I'm so quirky!"" thing going on but girl... you arn't quirky... you're just terrible.",en,2025-07-18T02:31:08Z,2025-07-17 22:31:08,8,2,UgwlJUJUtRlD-OP_rpt4AaABAg.AKhNzHgXhwiALDwDPYXq3f,@Queen1Kingdom,UC4IO_ZMQVqOSDDBixP0A-rA,My thoughts exactly. There was no good message in this show. The only tolerable character was Felix and the writers tried to make him into this awful guy on episode 9.,en,2025-07-31T03:13:58Z,2025-07-30 23:13:58,0,934596,8098,819,"Wed, 17 Dec 2025 11:59:50 GMT"
HcrbR6EXynM,https://www.youtube.com/watch?v=HcrbR6EXynM,UgwlJUJUtRlD-OP_rpt4AaABAg,@CucWater,UCZytIYeMj8J-a8BKH8wjzcg,"I didn't really get this show... like are we supposed to sympathize with the main character or? Because she's an absolutely terrible human being.

It has that weird like ""haha I'm so quirky!"" thing going on but girl... you arn't quirky... you're just terrible.",en,2025-07-18T02:31:08Z,2025-07-17 22:31:08,8,2,UgwlJUJUtRlD-OP_rpt4AaABAg.AKhNzHgXhwiAMdIvUkU-iR,@Aliena_piano,UCZf4RmhKNplAJp6Hrr6oC2Q,She pretends she has a great level of self-esteem when she's totally the opposite. Both of them are broken and always trying to fit everywhere till they meet and realise they don't need to fit anymore because they have each other. Just that.,en,2025-09-04T05:32:45Z,2025-09-04 01:32:45,0,934596,8098,819,"Wed, 17 Dec 2025 11:59:50 GMT"
HcrbR6EXynM,https://www.youtube.com/watch?v=HcrbR6EXynM,UgzCbVq0hpJabeTjBOd4AaABAg,@EvetsZerimar23,UCevN-1L0kPnGJ-5vrb9WerA,No plus size men?! Big guys need love too,NA,2025-07-18T00:49:49Z,2025-07-17 20:49:49,1,1,UgzCbVq0hpJabeTjBOd4AaABAg.AKhCODI8xyiAKkfZhtrMEA,@angua65,UC_d13yXkhOT-b1Vn7bJU0JA,Everybody should go on diet instead lol,en,2025-07-19T09:11:15Z,2025-07-19 05:11:15,1,934596,8098,819,"Wed, 17 Dec 2025 11:59:50 GMT"
HcrbR6EXynM,https://www.youtube.com/watch?v=HcrbR6EXynM,Ugzbk6J9zZDnIHk8wsV4AaABAg,@natashakalanda622,UCcmsQxnMN0OnRX--LPqc5xQ,"Nah... millennials we had it so good in our day, this is just sad",en,2025-07-16T15:30:53Z,2025-07-16 11:30:53,0,1,Ugzbk6J9zZDnIHk8wsV4AaABAg.AKdcc_3dctJAKkfuORbpLJ,@angua65,UC_d13yXkhOT-b1Vn7bJU0JA,Truth is being in your twenties in '80 and '90 was the best ;),en,2025-07-19T09:14:12Z,2025-07-19 05:14:12,0,934596,8098,819,"Wed, 17 Dec 2025 11:59:50 GMT"
HcrbR6EXynM,https://www.youtube.com/watch?v=HcrbR6EXynM,UgyyDBZOWHbgrJhr7sh4AaABAg,@alexd1121,UC1Rq73SU9BvgJ4be_pwGA9g,"If only a dude as hot as the White Lotus guy could really go after a girl who by all means is way less attractive than he is and not wealthier in real life, the world would be a very different place. Is this the catch of these Lena D shows? For me the lead is a miscast and the pace was too all over the place to latch on for more than 4 episodes. She’s giving off supporting role vibes.",en,2025-07-16T13:18:06Z,2025-07-16 09:18:06,0,2,UgyyDBZOWHbgrJhr7sh4AaABAg.AKdOR4qcTtFAKe-Qvxk_Gh,@acs12305,UCPsJEohy-lNEmqUC8PS9k4g,I feel like I'm the only one who doesn't find her unattractive?,en,2025-07-16T18:58:52Z,2025-07-16 14:58:52,0,934596,8098,819,"Wed, 17 Dec 2025 11:59:50 GMT"
HcrbR6EXynM,https://www.youtube.com/watch?v=HcrbR6EXynM,UgyyDBZOWHbgrJhr7sh4AaABAg,@alexd1121,UC1Rq73SU9BvgJ4be_pwGA9g,"If only a dude as hot as the White Lotus guy could really go after a girl who by all means is way less attractive than he is and not wealthier in real life, the world would be a very different place. Is this the catch of these Lena D shows? For me the lead is a miscast and the pace was too all over the place to latch on for more than 4 episodes. She’s giving off supporting role vibes.",en,2025-07-16T13:18:06Z,2025-07-16 09:18:06,0,2,UgyyDBZOWHbgrJhr7sh4AaABAg.AKdOR4qcTtFAKe3VjcBx0r,@alexd1121,UC1Rq73SU9BvgJ4be_pwGA9g,@acs12305i don’t think she’s unattractive but I think she’s not an instantly charismatic lead yet.,en,2025-07-16T19:34:28Z,2025-07-16 15:34:28,0,934596,8098,819,"Wed, 17 Dec 2025 11:59:50 GMT"
HcrbR6EXynM,https://www.youtube.com/watch?v=HcrbR6EXynM,UgwcKjy2zVQ0WAG7kAV4AaABAg,@TeresaLeandro,UCMehDGneGFa-odhjGl0cbmQ,It’s so appallingly bad it hurts. Three episodes and a half is all I can take.,en,2025-07-15T19:46:44Z,2025-07-15 15:46:44,10,1,UgwcKjy2zVQ0WAG7kAV4AaABAg.AKbW6fINKeiAMLBtBEBBFI,@f4ust85,UCbbMUCQOkgg8w-e3cZ4cUsg,"Yeah, its a fascinating mixture of boring an unbearable.",en,2025-08-27T19:25:42Z,2025-08-27 15:25:42,1,934596,8098,819,"Wed, 17 Dec 2025 11:59:50 GMT"
HcrbR6EXynM,https://www.youtube.com/watch?v=HcrbR6EXynM,Ugx2Rz_LF5rErDzFE3x4AaABAg,@pinelopiz2841,UCFGOU03H1tDVcm-iehAS7VQ,"Saw 2 episodes. It is unwatchable . The only beautiful thing on it is Meghan. Plus, they did it for the first time without using a condom. Wtf?",en,2025-07-15T18:50:35Z,2025-07-15 14:50:35,0,2,Ugx2Rz_LF5rErDzFE3x4AaABAg.AKbPgOGvAbaAKc5TBvdx3V,@acs12305,UCPsJEohy-lNEmqUC8PS9k4g,wait they didnt use a condom? I don't remember that part,en,2025-07-16T01:13:07Z,2025-07-15 21:13:07,0,934596,8098,819,"Wed, 17 Dec 2025 11:59:50 GMT"
HcrbR6EXynM,https://www.youtube.com/watch?v=HcrbR6EXynM,Ugx2Rz_LF5rErDzFE3x4AaABAg,@pinelopiz2841,UCFGOU03H1tDVcm-iehAS7VQ,"Saw 2 episodes. It is unwatchable . The only beautiful thing on it is Meghan. Plus, they did it for the first time without using a condom. Wtf?",en,2025-07-15T18:50:35Z,2025-07-15 14:50:35,0,2,Ugx2Rz_LF5rErDzFE3x4AaABAg.AKbPgOGvAbaAKe-VuFFh6L,@calgary2800,UC7ZULvD4z59gZy0IfaY3TAg,She is very pretty❤,NA,2025-07-16T18:59:33Z,2025-07-16 14:59:33,0,934596,8098,819,"Wed, 17 Dec 2025 11:59:50 GMT"
HcrbR6EXynM,https://www.youtube.com/watch?v=HcrbR6EXynM,Ugx3kqqMSO89baDxUid4AaABAg,@dawlesstech8904,UCPQ-6ihj2R4lHwFFSPvtvEg,"You can have physical baggage, but more than make up for it with a classy personality - but if you've got both physical AND emotional baggage, you're not winning the race. Sorry but this series is just copium for a generation of women who have been lied to.",en,2025-07-15T18:04:46Z,2025-07-15 14:04:46,2,1,Ugx3kqqMSO89baDxUid4AaABAg.AKbKRpGVihEAKf5-RvqSN2,@Heather-fx7sr,UCGKdwT1tI2jdntFXJQip4FA,"I’m inclined to think it’s not a race, but in any event “copium” is hilarious",en,2025-07-17T05:06:47Z,2025-07-17 01:06:47,0,934596,8098,819,"Wed, 17 Dec 2025 11:59:50 GMT"
HcrbR6EXynM,https://www.youtube.com/watch?v=HcrbR6EXynM,UgxJu5PnTK8HUKo6vC14AaABAg,@psychedelic.kimchi,UCtC4j8Tp3rmO3BMmi4NEl4w,"I loved GIRLS and Fleabag is my favourite series but this show is more ""GIRLS"" meets ""Emilly in Paris"" than ""GIRLS"" meets ""Fleabag"" but it's cute. There's no matching fleabag tho",en,2025-07-15T14:08:09Z,2025-07-15 10:08:09,4,1,UgxJu5PnTK8HUKo6vC14AaABAg.AKauMrbt7m_AKuWuEucvmV,@Deermango,UCaRbKQJ6cRGpPGPA2ERVK_w,Can’t even compare this garbage to the greatest show fleabag. Nothing beats fleabag fr,en,2025-07-23T04:59:14Z,2025-07-23 00:59:14,3,934596,8098,819,"Wed, 17 Dec 2025 11:59:50 GMT"
HcrbR6EXynM,https://www.youtube.com/watch?v=HcrbR6EXynM,Ugy23YZR7306-xPmeUJ4AaABAg,@wanderwithwester2814,UCAn62-wphBnkkJu9srAgklA,"I’m glad we can all agree whoever wrote the spitting scene needs to work through some things, and now that scene is now forever burned into our brains without our consent.",en,2025-07-15T06:02:28Z,2025-07-15 02:02:28,31,1,Ugy23YZR7306-xPmeUJ4AaABAg.AKa1mcSTP4CAKavWtX0FJ2,@jneilson7568,UCeg5_WQgi13E8hsTyN9MDuw,"There's a Prime show with a trailer where that is happening, too, why is something gross and offputting in so much now?!",en,2025-07-15T14:18:16Z,2025-07-15 10:18:16,1,934596,8098,819,"Wed, 17 Dec 2025 11:59:50 GMT"
HcrbR6EXynM,https://www.youtube.com/watch?v=HcrbR6EXynM,UgxrnP8c7EntLCUXgUp4AaABAg,@dnlca6686,UCoL2PH15FUtiMx6XTNmzPmg,"In the last 20 years, watching TV, movies, and now streaming services, I can say the main character of this series is probably the most annoying character I've ever seen. Seriously what the hell is wrong with her?, I cant even describe how I hated every scene of this character.",en,2025-07-14T15:29:12Z,2025-07-14 11:29:12,19,2,UgxrnP8c7EntLCUXgUp4AaABAg.AKZTqXb9ZAFALPmjhArJho,@OneInsignificantLife,UCOixcmka0axC_QpDwHRaidg,"Yeah, I liked the cheating, messed up boyfriend much more than I liked her character",en,2025-08-04T17:42:01Z,2025-08-04 13:42:01,1,934596,8098,819,"Wed, 17 Dec 2025 11:59:50 GMT"
HcrbR6EXynM,https://www.youtube.com/watch?v=HcrbR6EXynM,UgxrnP8c7EntLCUXgUp4AaABAg,@dnlca6686,UCoL2PH15FUtiMx6XTNmzPmg,"In the last 20 years, watching TV, movies, and now streaming services, I can say the main character of this series is probably the most annoying character I've ever seen. Seriously what the hell is wrong with her?, I cant even describe how I hated every scene of this character.",en,2025-07-14T15:29:12Z,2025-07-14 11:29:12,19,2,UgxrnP8c7EntLCUXgUp4AaABAg.AKZTqXb9ZAFAMLBbx_hkU2,@f4ust85,UCbbMUCQOkgg8w-e3cZ4cUsg,@OneInsignificantLife Even her exboyfriend seemed much more sensible and sympathetic than this unbearable eternal child,en,2025-08-27T19:23:21Z,2025-08-27 15:23:21,0,934596,8098,819,"Wed, 17 Dec 2025 11:59:50 GMT"
HcrbR6EXynM,https://www.youtube.com/watch?v=HcrbR6EXynM,UgwnpbPRQUIsAC7foY94AaABAg,@witwitchery,UCuxwvnD7FjJWxN9UWyqhxrA,"Oh good, another Lena Dunham show about Lena Dunham.",gl,2025-07-14T02:22:31Z,2025-07-13 22:22:31,84,4,UgwnpbPRQUIsAC7foY94AaABAg.AKY3okSpqU5AKZuYuts35n,@bill5855,UClO5EvWqz5TG9Z5OaBkpVgg,EXACTLY,xh,2025-07-14T19:31:19Z,2025-07-14 15:31:19,15,934596,8098,819,"Wed, 17 Dec 2025 11:59:50 GMT"
HcrbR6EXynM,https://www.youtube.com/watch?v=HcrbR6EXynM,UgwnpbPRQUIsAC7foY94AaABAg,@witwitchery,UCuxwvnD7FjJWxN9UWyqhxrA,"Oh good, another Lena Dunham show about Lena Dunham.",gl,2025-07-14T02:22:31Z,2025-07-13 22:22:31,84,4,UgwnpbPRQUIsAC7foY94AaABAg.AKY3okSpqU5AL03NikXegv,@ulizez89,UCd2OyUjYSOHP9NmZs6OOolA,"Another ""fat girls are actually hot"" propaganda show.",en,2025-07-25T17:55:55Z,2025-07-25 13:55:55,0,934596,8098,819,"Wed, 17 Dec 2025 11:59:50 GMT"
HcrbR6EXynM,https://www.youtube.com/watch?v=HcrbR6EXynM,UgwnpbPRQUIsAC7foY94AaABAg,@witwitchery,UCuxwvnD7FjJWxN9UWyqhxrA,"Oh good, another Lena Dunham show about Lena Dunham.",gl,2025-07-14T02:22:31Z,2025-07-13 22:22:31,84,4,UgwnpbPRQUIsAC7foY94AaABAg.AKY3okSpqU5ALwSm6PXM-1,@beingquabeing,UCIRbvRVePRD14Ki9pWmckyA,and her tone deafness of what it is actually like to move to another country. she writes it as a privileged person with lots of money and help imitating her version of poor... very off and skewed! She ignores all the true barriers poor people face and romanticizes it.,en,2025-08-17T19:33:01Z,2025-08-17 15:33:01,4,934596,8098,819,"Wed, 17 Dec 2025 11:59:50 GMT"
HcrbR6EXynM,https://www.youtube.com/watch?v=HcrbR6EXynM,UgwnpbPRQUIsAC7foY94AaABAg,@witwitchery,UCuxwvnD7FjJWxN9UWyqhxrA,"Oh good, another Lena Dunham show about Lena Dunham.",gl,2025-07-14T02:22:31Z,2025-07-13 22:22:31,84,4,UgwnpbPRQUIsAC7foY94AaABAg.AKY3okSpqU5AOXIlluuhDV,@avenginggoddess,UC_fTFZW4DFcJIftsxPidc6Q,Precisely.,sr,2025-10-21T05:19:32Z,2025-10-21 01:19:32,0,934596,8098,819,"Wed, 17 Dec 2025 11:59:50 GMT"
HcrbR6EXynM,https://www.youtube.com/watch?v=HcrbR6EXynM,Ugz8RmgmJ1cVjrQkd714AaABAg,@Bibi-c7r,UCaUBCJDjCyndDOQy46WPYvQ,At least Lena Durham is not in it.,en,2025-07-13T07:34:55Z,2025-07-13 03:34:55,1,1,Ugz8RmgmJ1cVjrQkd714AaABAg.AKW2lq9fPwmAKYCCzv5fiS,@acs12305,UCPsJEohy-lNEmqUC8PS9k4g,She is 😆 She plays the main character's sister.,en,2025-07-14T03:35:52Z,2025-07-13 23:35:52,1,934596,8098,819,"Wed, 17 Dec 2025 11:59:50 GMT"
HcrbR6EXynM,https://www.youtube.com/watch?v=HcrbR6EXynM,UgwMVnsU5A4N5TBtlrF4AaABAg,@sheriw1978,UCH503bBLSa_OtyWOPvdyZgQ,I don’t know? I still want Lena to be the main character? She is so funny and odd naturally. Does she play her older sister or aunt? I hope Lena is in the show a lot?!,en,2025-07-12T21:26:11Z,2025-07-12 17:26:11,1,1,UgwMVnsU5A4N5TBtlrF4AaABAg.AKUy6NowEfmAKWNLQBq_WR,@latoyiab79,UC1FvFn31S0JCLqTHM8CJtpg,She's the older sister,NA,2025-07-13T10:34:40Z,2025-07-13 06:34:40,2,934596,8098,819,"Wed, 17 Dec 2025 11:59:50 GMT"
HcrbR6EXynM,https://www.youtube.com/watch?v=HcrbR6EXynM,UgzquHZ2T3cLlqWNdiJ4AaABAg,@boredstrayingtheinternet2557,UCUD27L29kFwfyafYwoCHn7Q,"really unattractive actress and an awful bedscene. Good luck, Netflix!",en,2025-07-12T18:01:51Z,2025-07-12 14:01:51,2,3,UgzquHZ2T3cLlqWNdiJ4AaABAg.AKUaiphBKl0AKVlKKIALId,@acs12305,UCPsJEohy-lNEmqUC8PS9k4g,People keep saying she's unattractive but I think she's so beautiful. Am I losing my mind? Is your issue with her body or is she unattractive in other ways?,en,2025-07-13T04:53:43Z,2025-07-13 00:53:43,0,934596,8098,819,"Wed, 17 Dec 2025 11:59:50 GMT"
HcrbR6EXynM,https://www.youtube.com/watch?v=HcrbR6EXynM,UgzquHZ2T3cLlqWNdiJ4AaABAg,@boredstrayingtheinternet2557,UCUD27L29kFwfyafYwoCHn7Q,"really unattractive actress and an awful bedscene. Good luck, Netflix!",en,2025-07-12T18:01:51Z,2025-07-12 14:01:51,2,3,UgzquHZ2T3cLlqWNdiJ4AaABAg.AKUaiphBKl0AKWQCihOgLj,@latoyiab79,UC1FvFn31S0JCLqTHM8CJtpg,​@acs12305 For me it's the character's personality.  She's not likable.,en,2025-07-13T10:59:41Z,2025-07-13 06:59:41,3,934596,8098,819,"Wed, 17 Dec 2025 11:59:50 GMT"
HcrbR6EXynM,https://www.youtube.com/watch?v=HcrbR6EXynM,UgzquHZ2T3cLlqWNdiJ4AaABAg,@boredstrayingtheinternet2557,UCUD27L29kFwfyafYwoCHn7Q,"really unattractive actress and an awful bedscene. Good luck, Netflix!",en,2025-07-12T18:01:51Z,2025-07-12 14:01:51,2,3,UgzquHZ2T3cLlqWNdiJ4AaABAg.AKUaiphBKl0AKXboJGL-HD,@stinabo77,UCDz0HMdB-FSHYdQ-dLE4LTQ,"Agree, too many bed scenes and her character's personality is not attractive at all. Plus Will Sharpe is out of her league. Don't see any chemistry between the two. Unrealistic.",en,2025-07-13T22:09:04Z,2025-07-13 18:09:04,1,934596,8098,819,"Wed, 17 Dec 2025 11:59:50 GMT"
HcrbR6EXynM,https://www.youtube.com/watch?v=HcrbR6EXynM,UgzCPe_SgYHo3Qj2doB4AaABAg,@alypie1624,UC5ZbNiJsgYbYiIKxDFvjkjg,"Why is everyone (besides Will Sharpe who's very attractive) so terribly, well, not..What a  visually depressing show.",en,2025-07-12T12:28:10Z,2025-07-12 08:28:10,8,2,UgzCPe_SgYHo3Qj2doB4AaABAg.AKU-XuZXOIzAKYCHcwXmTL,@acs12305,UCPsJEohy-lNEmqUC8PS9k4g,"""visually depressing"" is hilarious haha",NA,2025-07-14T03:36:30Z,2025-07-13 23:36:30,3,934596,8098,819,"Wed, 17 Dec 2025 11:59:50 GMT"
HcrbR6EXynM,https://www.youtube.com/watch?v=HcrbR6EXynM,UgzCPe_SgYHo3Qj2doB4AaABAg,@alypie1624,UC5ZbNiJsgYbYiIKxDFvjkjg,"Why is everyone (besides Will Sharpe who's very attractive) so terribly, well, not..What a  visually depressing show.",en,2025-07-12T12:28:10Z,2025-07-12 08:28:10,8,2,UgzCPe_SgYHo3Qj2doB4AaABAg.AKU-XuZXOIzAMLC7HQ0L10,@f4ust85,UCbbMUCQOkgg8w-e3cZ4cUsg,"@acs12305 Because this is Gen Z, honey. Just to think that this is what Bridget Jones stood for 20 years ago...  What a downfall.",en,2025-08-27T19:27:45Z,2025-08-27 15:27:45,0,934596,8098,819,"Wed, 17 Dec 2025 11:59:50 GMT"
HcrbR6EXynM,https://www.youtube.com/watch?v=HcrbR6EXynM,Ugxzd45MYjWEM-wzKmR4AaABAg,@cagayan3657,UCZq28FIOMn-qrhJvfi0PGDQ,"I've had a crush on Will Sharpe since ""Casualty"". Him being in this show is enough to get me to binge the 10 episodes.",en,2025-07-08T22:46:14Z,2025-07-08 18:46:14,5,1,Ugxzd45MYjWEM-wzKmR4AaABAg.AKKo5Fp_SPQAKXcML1hKaV,@stinabo77,UCDz0HMdB-FSHYdQ-dLE4LTQ,It's pretty cringe to watch such a hot guy have sex with her in so many scenes...,en,2025-07-13T22:13:50Z,2025-07-13 18:13:50,0,934596,8098,819,"Wed, 17 Dec 2025 11:59:50 GMT"
HcrbR6EXynM,https://www.youtube.com/watch?v=HcrbR6EXynM,Ugy-ygR4HCo8DKeGodp4AaABAg,@lsimon343,UC9zFmHj52kAHzKdLVt-zcXg,From the twisted mind of Lena Dunham,en,2025-07-05T11:31:07Z,2025-07-05 07:31:07,5,1,Ugy-ygR4HCo8DKeGodp4AaABAg.AKBsRxi9JWMAKLDv00z8oy,@SpintoSopranoSexyYea,UC4AZ6VtANXtVbN_003r28mA,I’m just gonna watch this series on mute with the soundtrack to Beetlejuice blaring as an overdub.,en,2025-07-09T02:40:38Z,2025-07-08 22:40:38,0,934596,8098,819,"Wed, 17 Dec 2025 11:59:50 GMT"
