video_id,video_title,channel_id,channel_title,video_published_at,reply_id,reply_parent_comment_id,reply_author_display,reply_author_channel_id,reply_text,reply_lang,reply_published_utc,reply_published_local,reply_like_count
Wk5OxqtpBR4,Adolescence | Official Trailer | Netflix,UCWOA1ZGywLbqmigxE4Qlvuw,Netflix,2025-02-24T16:00:00Z,UgycFswDcMdA0dMAZ5J4AaABAg.APaLiA6dz69APaeZVa-9oF,UgycFswDcMdA0dMAZ5J4AaABAg,@splinterbyrd,UCYJeJuaHQwBbWDaEiQWS5Mg,An impressive piece of work; only a man with a heart of stone could fail to be moved to laughter🤣,en,2025-11-16T18:27:03Z,2025-11-16 13:27:03,0
Wk5OxqtpBR4,Adolescence | Official Trailer | Netflix,UCWOA1ZGywLbqmigxE4Qlvuw,Netflix,2025-02-24T16:00:00Z,UgycFswDcMdA0dMAZ5J4AaABAg.APaLiA6dz69APbTjjTiI4E,UgycFswDcMdA0dMAZ5J4AaABAg,@JherekLazo,UCaYAcFi1PZNWGdWyuipjP-g,"@splinterbyrd true, still depressing af.",sv,2025-11-17T02:02:58Z,2025-11-16 21:02:58,1
Wk5OxqtpBR4,Adolescence | Official Trailer | Netflix,UCWOA1ZGywLbqmigxE4Qlvuw,Netflix,2025-02-24T16:00:00Z,UgwtLf6bAArgyAFK7xt4AaABAg.APDyTTdJdI3APHw4LJJKja,UgwtLf6bAArgyAFK7xt4AaABAg,@Icerberg07,UCwNVKxm_lzoYmejC7fRsxDA,@offendingtheoffendable it is a national uk tragedy that no one talks about. Man and woman are too divided. Sad.,en,2025-11-09T02:35:16Z,2025-11-08 21:35:16,0
Wk5OxqtpBR4,Adolescence | Official Trailer | Netflix,UCWOA1ZGywLbqmigxE4Qlvuw,Netflix,2025-02-24T16:00:00Z,UgyDhru9OO0r9scIEn94AaABAg.AP1t-DAXmJWAQ1Z-rijBJf,UgyDhru9OO0r9scIEn94AaABAg,@lilmissknowitall5775,UCsrUpZuUJd2bRRjy7R6kk6A,Show was in production before that happened. Lying deliberately to spread false hate.,en,2025-11-27T14:28:29Z,2025-11-27 09:28:29,0
Wk5OxqtpBR4,Adolescence | Official Trailer | Netflix,UCWOA1ZGywLbqmigxE4Qlvuw,Netflix,2025-02-24T16:00:00Z,UgzMgZc4uWA7wszd-vR4AaABAg.AOHU4BFxewvAOjlr-qkhjX,UgzMgZc4uWA7wszd-vR4AaABAg,@franktank1984,UCAU3MWQWbKX23S68i_WESlQ,"This never happened. It is pure fiction.

12,183 people were arrested in the UK in 2023 for stating their political opinion online.

Over 91,000 CONFIRMED instances of gang rape on little English girls have been commited by MUSLIM grooming gangs, with the true number estimated at well over a MILLION due to under-reporting.

Recently Christians have been arrested in 5 separate cases for silently praying in public.

There have no Netflix shows about any of these ACTUAL events.

This is the definition of propoganda.

The UK is a now controlled by a neomarxist regressive regime, supported by propganda from cultural insitutions and corporations like Netflix.",en,2025-10-26T10:52:31Z,2025-10-26 06:52:31,0
Wk5OxqtpBR4,Adolescence | Official Trailer | Netflix,UCWOA1ZGywLbqmigxE4Qlvuw,Netflix,2025-02-24T16:00:00Z,UgwpEhA1JyKNtG5ckEd4AaABAg.AOHNBvnyUMrAOT8v7LqPMe,UgwpEhA1JyKNtG5ckEd4AaABAg,@albertpeters6675,UChOQJRL2d1AhoHe_T-8i-Lg,That's not how this works...,en,2025-10-19T14:36:27Z,2025-10-19 10:36:27,0
Wk5OxqtpBR4,Adolescence | Official Trailer | Netflix,UCWOA1ZGywLbqmigxE4Qlvuw,Netflix,2025-02-24T16:00:00Z,UgwpEhA1JyKNtG5ckEd4AaABAg.AOHNBvnyUMrAOhBgrQd_WW,UgwpEhA1JyKNtG5ckEd4AaABAg,@VanillaV4,UCPGKhui08DGvZ0wSM0CAmjg,The case happened after the shows release and production,en,2025-10-25T10:49:20Z,2025-10-25 06:49:20,0
Wk5OxqtpBR4,Adolescence | Official Trailer | Netflix,UCWOA1ZGywLbqmigxE4Qlvuw,Netflix,2025-02-24T16:00:00Z,Ugx5VF6VDBD_8SbkbbF4AaABAg.AOFm5cfIzgBAOFvPDnKQmI,Ugx5VF6VDBD_8SbkbbF4AaABAg,@ZeroSOFInfinity,UCYosm558zC4m1PN9QIyfgBg,Damn.... when life imitates art....,NA,2025-10-14T11:19:30Z,2025-10-14 07:19:30,1
Wk5OxqtpBR4,Adolescence | Official Trailer | Netflix,UCWOA1ZGywLbqmigxE4Qlvuw,Netflix,2025-02-24T16:00:00Z,Ugx5VF6VDBD_8SbkbbF4AaABAg.AOFm5cfIzgBAOKEmJEDJmK,Ugx5VF6VDBD_8SbkbbF4AaABAg,@niqmahnur7223,UCyDpP34VHpl-W16XO4m3Hjg,Yeah im here after the case.,en,2025-10-16T03:34:31Z,2025-10-15 23:34:31,0
Wk5OxqtpBR4,Adolescence | Official Trailer | Netflix,UCWOA1ZGywLbqmigxE4Qlvuw,Netflix,2025-02-24T16:00:00Z,UgyBbvsMCB5mRqwCc7B4AaABAg.ANp37L2O39VAOviPwbZz1H,UgyBbvsMCB5mRqwCc7B4AaABAg,@potatoesblink3299,UCTvy26GFVGBLm1_8FIb7elA,Its based on multiple knife cases in the UK. It would only be wrong if it was soley based on that one case but the other inspirations of this were cases done by white perpatrators.,en,2025-10-31T02:13:21Z,2025-10-30 22:13:21,0
Wk5OxqtpBR4,Adolescence | Official Trailer | Netflix,UCWOA1ZGywLbqmigxE4Qlvuw,Netflix,2025-02-24T16:00:00Z,Ugx5O3gprAvv7LXuaR54AaABAg.ANdmDl7hypnANgHUCo4Vsu,Ugx5O3gprAvv7LXuaR54AaABAg,@oliverfoley3504,UCxqiMcVucwsIVtXzThUwRPg,You’re literally the problem… This show was made because of kids like you.,en,2025-09-30T05:49:16Z,2025-09-30 01:49:16,7
Wk5OxqtpBR4,Adolescence | Official Trailer | Netflix,UCWOA1ZGywLbqmigxE4Qlvuw,Netflix,2025-02-24T16:00:00Z,Ugx5O3gprAvv7LXuaR54AaABAg.ANdmDl7hypnANgJ-2VKgQb,Ugx5O3gprAvv7LXuaR54AaABAg,@PilgrimButterfly,UCmOG94pr9ABRZP4O8SJfjFg,@oliverfoley3504 And people like you make me elated to the fact that sh&t is about to hit the fans all over the west. You're in for a rude awakening lol,en,2025-09-30T06:02:29Z,2025-09-30 02:02:29,2
Wk5OxqtpBR4,Adolescence | Official Trailer | Netflix,UCWOA1ZGywLbqmigxE4Qlvuw,Netflix,2025-02-24T16:00:00Z,Ugx5O3gprAvv7LXuaR54AaABAg.ANdmDl7hypnAOTRZSPd2nC,Ugx5O3gprAvv7LXuaR54AaABAg,@jethromcgl3697,UC_4mqIirORUu0-DNRLw0F2w,Define woke,fy,2025-10-19T17:19:23Z,2025-10-19 13:19:23,0
Wk5OxqtpBR4,Adolescence | Official Trailer | Netflix,UCWOA1ZGywLbqmigxE4Qlvuw,Netflix,2025-02-24T16:00:00Z,Ugx5O3gprAvv7LXuaR54AaABAg.ANdmDl7hypnAOc5dtH2Z5r,Ugx5O3gprAvv7LXuaR54AaABAg,@thinkemore,UCmUyfQCSnd__ZsoKUSUlsBg,Ur same as the boy in this series,en,2025-10-23T11:20:18Z,2025-10-23 07:20:18,2
Wk5OxqtpBR4,Adolescence | Official Trailer | Netflix,UCWOA1ZGywLbqmigxE4Qlvuw,Netflix,2025-02-24T16:00:00Z,Ugx_Rgpzr7L7oNv39rB4AaABAg.ANdbAn2ddUfAOTRt9Qf18B,Ugx_Rgpzr7L7oNv39rB4AaABAg,@jethromcgl3697,UC_4mqIirORUu0-DNRLw0F2w,"Have you ever seen a video of a girl saying men are bad without it being featured in a video on why that behaviour is bad?
Also, this is a British show",en,2025-10-19T17:22:13Z,2025-10-19 13:22:13,2
Wk5OxqtpBR4,Adolescence | Official Trailer | Netflix,UCWOA1ZGywLbqmigxE4Qlvuw,Netflix,2025-02-24T16:00:00Z,Ugx_Rgpzr7L7oNv39rB4AaABAg.ANdbAn2ddUfAOugCKhdnaJ,Ugx_Rgpzr7L7oNv39rB4AaABAg,@potatoesblink3299,UCTvy26GFVGBLm1_8FIb7elA,"Im pretty sure the producers bases this story on research rather than agenda.

And the themes of the Manosphere in this show already appeared in procedurals back in the 2000s",en,2025-10-30T16:34:46Z,2025-10-30 12:34:46,0
Wk5OxqtpBR4,Adolescence | Official Trailer | Netflix,UCWOA1ZGywLbqmigxE4Qlvuw,Netflix,2025-02-24T16:00:00Z,UgzPc2zDdOQuk5kDImR4AaABAg.ANazmsfy_uqAOTRxFeShXu,UgzPc2zDdOQuk5kDImR4AaABAg,@jethromcgl3697,UC_4mqIirORUu0-DNRLw0F2w,Maybe watch the final episode and pick up context clues in the previous three,en,2025-10-19T17:22:46Z,2025-10-19 13:22:46,0
Wk5OxqtpBR4,Adolescence | Official Trailer | Netflix,UCWOA1ZGywLbqmigxE4Qlvuw,Netflix,2025-02-24T16:00:00Z,UgxMl1KErkezHpd7Dkh4AaABAg.ANY9clHuLEoAOviVHHSGTC,UgxMl1KErkezHpd7Dkh4AaABAg,@potatoesblink3299,UCTvy26GFVGBLm1_8FIb7elA,what part of this is propaganda???? Its literally based on research and various real life cases,en,2025-10-31T02:14:05Z,2025-10-30 22:14:05,0
Wk5OxqtpBR4,Adolescence | Official Trailer | Netflix,UCWOA1ZGywLbqmigxE4Qlvuw,Netflix,2025-02-24T16:00:00Z,UgwsMsnTaGlyi_LBHMx4AaABAg.ANY-pA26231AOTSCUdmDUz,UgwsMsnTaGlyi_LBHMx4AaABAg,@jethromcgl3697,UC_4mqIirORUu0-DNRLw0F2w,"""Wow, I'm so sad that a guy who murdered a girl believes his own shit""",en,2025-10-19T17:24:59Z,2025-10-19 13:24:59,1
Wk5OxqtpBR4,Adolescence | Official Trailer | Netflix,UCWOA1ZGywLbqmigxE4Qlvuw,Netflix,2025-02-24T16:00:00Z,UgzQmHovllofTmdg-it4AaABAg.ANVxTOBjWwdANkko2DBA1n,UgzQmHovllofTmdg-it4AaABAg,@Priceyjoy,UCvXfc8bK_XrJeABODtJEW_w,He got it!,fy,2025-10-01T23:31:13Z,2025-10-01 19:31:13,0
Wk5OxqtpBR4,Adolescence | Official Trailer | Netflix,UCWOA1ZGywLbqmigxE4Qlvuw,Netflix,2025-02-24T16:00:00Z,UgxHHpA_e55loV8F1jF4AaABAg.ANOHxGFQDubANklMGPu_ES,UgxHHpA_e55loV8F1jF4AaABAg,@Priceyjoy,UCvXfc8bK_XrJeABODtJEW_w,"I thought the show was fantastic BUT she was a DREADFUL therapist, for kids at least. And I've seen my share! She poked and pushed and cajoled relentlessly; I don't know, maybe deliberately? For SOME reason? But really AWFUL, in my eyes. 
NOT defending the evil little sociopath (the actor was so good I wished for England to have the death penalty).",en,2025-10-01T23:36:01Z,2025-10-01 19:36:01,1
Wk5OxqtpBR4,Adolescence | Official Trailer | Netflix,UCWOA1ZGywLbqmigxE4Qlvuw,Netflix,2025-02-24T16:00:00Z,UgxHHpA_e55loV8F1jF4AaABAg.ANOHxGFQDubANkp6k2c3U5,UgxHHpA_e55loV8F1jF4AaABAg,@iridium1711,UC5Ylk2VJviaDq1o-pG5ZDRQ,"@Priceyjoy yes dreadful and poisonous.  I paused but I will watch the series out of curiosity.  Cajoled is exactly my feeling.  No matter the accusations, the therapist is under oath to protect the Person against the System especially the Young.  The young can be Evil but they were also babies as we  all were.",en,2025-10-02T00:08:51Z,2025-10-01 20:08:51,1
Wk5OxqtpBR4,Adolescence | Official Trailer | Netflix,UCWOA1ZGywLbqmigxE4Qlvuw,Netflix,2025-02-24T16:00:00Z,Ugz2EFgRTb6U5-ZxKWZ4AaABAg.ANM6AXclzmiANRXTh_q9Bb,Ugz2EFgRTb6U5-ZxKWZ4AaABAg,@kimiki65,UCvAdv28OhGwD5H_CtO5xmbA,Not impressed by the single-take episodes? They can’t all be Michael Bay movies. 😂,en,2025-09-24T03:01:09Z,2025-09-23 23:01:09,0
Wk5OxqtpBR4,Adolescence | Official Trailer | Netflix,UCWOA1ZGywLbqmigxE4Qlvuw,Netflix,2025-02-24T16:00:00Z,Ugz2EFgRTb6U5-ZxKWZ4AaABAg.ANM6AXclzmiANReAlr2hsQ,Ugz2EFgRTb6U5-ZxKWZ4AaABAg,@LarryDanaDavid,UCtdEPzuMvrJTADeslLqIVmQ,"@kimiki65 The film is slow on purpose. It reflects on the humdrum nature of day to day life of a teenager. However, the film is progressive liberal propaganda and total nonsense.",en,2025-09-24T04:08:28Z,2025-09-24 00:08:28,0
Wk5OxqtpBR4,Adolescence | Official Trailer | Netflix,UCWOA1ZGywLbqmigxE4Qlvuw,Netflix,2025-02-24T16:00:00Z,UgynoLacLBzo26a8qQ94AaABAg.ANK0lUPsRWZANL5gsogtUO,UgynoLacLBzo26a8qQ94AaABAg,@jethromcgl3697,UC_4mqIirORUu0-DNRLw0F2w,Owen Cooper went from a sympathetic young boy to a terrifying monster in the span of two episodes. How is not impressive for a 15 year old's first acting gig?,en,2025-09-21T15:02:59Z,2025-09-21 11:02:59,0
Wk5OxqtpBR4,Adolescence | Official Trailer | Netflix,UCWOA1ZGywLbqmigxE4Qlvuw,Netflix,2025-02-24T16:00:00Z,UgynoLacLBzo26a8qQ94AaABAg.ANK0lUPsRWZANLehe1diwK,UgynoLacLBzo26a8qQ94AaABAg,@Brian_______,UCyZiojGeHC6FeROcYpoEI_g,@jethromcgl3697*His portrayal of the boy and progression is not impressive and mediocre at best. Especially in the first episode when he’s being driven into the police station. That unconvincing scared little boy portrayal was comically executed.*,en,2025-09-21T20:17:39Z,2025-09-21 16:17:39,0
Wk5OxqtpBR4,Adolescence | Official Trailer | Netflix,UCWOA1ZGywLbqmigxE4Qlvuw,Netflix,2025-02-24T16:00:00Z,UgynoLacLBzo26a8qQ94AaABAg.ANK0lUPsRWZANLigMEg7ui,UgynoLacLBzo26a8qQ94AaABAg,@jethromcgl3697,UC_4mqIirORUu0-DNRLw0F2w,"​@Brian_______ That's the point. 
You only really notice it on rewatch, but he tries to sound innocent but does a bad job at it.",en,2025-09-21T20:52:26Z,2025-09-21 16:52:26,0
Wk5OxqtpBR4,Adolescence | Official Trailer | Netflix,UCWOA1ZGywLbqmigxE4Qlvuw,Netflix,2025-02-24T16:00:00Z,UgxXIXBS-rEIQNHFMXd4AaABAg.ANIFsEur5XAANJLA3maBXd,UgxXIXBS-rEIQNHFMXd4AaABAg,@V1Variant,UCuPQrrWWahIxVPHLUxTk94A,Me also 😂,gl,2025-09-20T22:39:42Z,2025-09-20 18:39:42,0
Wk5OxqtpBR4,Adolescence | Official Trailer | Netflix,UCWOA1ZGywLbqmigxE4Qlvuw,Netflix,2025-02-24T16:00:00Z,Ugz3wkV4tCTY-KbSpnp4AaABAg.ANI4knfNbR9ANL5ncN73xL,Ugz3wkV4tCTY-KbSpnp4AaABAg,@jethromcgl3697,UC_4mqIirORUu0-DNRLw0F2w,"That's the point.
The showrunners have said that themselves.
""It's not a who dunnit, it's a why dunnit""",en,2025-09-21T15:03:54Z,2025-09-21 11:03:54,1
Wk5OxqtpBR4,Adolescence | Official Trailer | Netflix,UCWOA1ZGywLbqmigxE4Qlvuw,Netflix,2025-02-24T16:00:00Z,UgzeUWLBQRmiOZT3Lwh4AaABAg.ANGEAydWy76ANL5sWHVBKw,UgzeUWLBQRmiOZT3Lwh4AaABAg,@jethromcgl3697,UC_4mqIirORUu0-DNRLw0F2w,D.S Frank and Briony?,en,2025-09-21T15:04:34Z,2025-09-21 11:04:34,0
Wk5OxqtpBR4,Adolescence | Official Trailer | Netflix,UCWOA1ZGywLbqmigxE4Qlvuw,Netflix,2025-02-24T16:00:00Z,UgwO_g1OQvWcuB7G_kJ4AaABAg.ANG-pKHStItANL5z-k5mKt,UgwO_g1OQvWcuB7G_kJ4AaABAg,@jethromcgl3697,UC_4mqIirORUu0-DNRLw0F2w,"This was No. 1 for a while
Also it swept at the Emmys",en,2025-09-21T15:05:27Z,2025-09-21 11:05:27,0
Wk5OxqtpBR4,Adolescence | Official Trailer | Netflix,UCWOA1ZGywLbqmigxE4Qlvuw,Netflix,2025-02-24T16:00:00Z,UgzUSbNayC0pfPdnxo94AaABAg.AND9FoQWeLhANL65DAxTEY,UgzUSbNayC0pfPdnxo94AaABAg,@jethromcgl3697,UC_4mqIirORUu0-DNRLw0F2w,"*murder happened in 2023*
And no other murders happened in that 1 year gap while being made",en,2025-09-21T15:06:26Z,2025-09-21 11:06:26,0
Wk5OxqtpBR4,Adolescence | Official Trailer | Netflix,UCWOA1ZGywLbqmigxE4Qlvuw,Netflix,2025-02-24T16:00:00Z,UgzUSbNayC0pfPdnxo94AaABAg.AND9FoQWeLhANNoRXPqJC8,UgzUSbNayC0pfPdnxo94AaABAg,@VW777,UCgdALaUuTZMvpvIPDteT-8A,"The writer of this programme has made it clear it is fictional. Why are people linking it to the case with a black boy and a black girl, ignoring cases with white youth such as: Holly Newton and Logan MacPhail or Brianna Ghey? Racism is the reason.",en,2025-09-22T16:21:11Z,2025-09-22 12:21:11,0
Wk5OxqtpBR4,Adolescence | Official Trailer | Netflix,UCWOA1ZGywLbqmigxE4Qlvuw,Netflix,2025-02-24T16:00:00Z,UgzUSbNayC0pfPdnxo94AaABAg.AND9FoQWeLhANgJ7EY2RjB,UgzUSbNayC0pfPdnxo94AaABAg,@PilgrimButterfly,UCmOG94pr9ABRZP4O8SJfjFg,Yep he was lol,NA,2025-09-30T06:03:36Z,2025-09-30 02:03:36,1
Wk5OxqtpBR4,Adolescence | Official Trailer | Netflix,UCWOA1ZGywLbqmigxE4Qlvuw,Netflix,2025-02-24T16:00:00Z,UgzmJaJw8BWxWP_O5Zp4AaABAg.AN98jUyod7dANL6Hi1tBfI,UgzmJaJw8BWxWP_O5Zp4AaABAg,@jethromcgl3697,UC_4mqIirORUu0-DNRLw0F2w,It's a British show,NA,2025-09-21T15:08:09Z,2025-09-21 11:08:09,0
Wk5OxqtpBR4,Adolescence | Official Trailer | Netflix,UCWOA1ZGywLbqmigxE4Qlvuw,Netflix,2025-02-24T16:00:00Z,UgzmJaJw8BWxWP_O5Zp4AaABAg.AN98jUyod7dANgHcF_T8PW,UgzmJaJw8BWxWP_O5Zp4AaABAg,@oliverfoley3504,UCxqiMcVucwsIVtXzThUwRPg,Ironic because it’s based off a true knife crime case that happened in the UK,en,2025-09-30T05:50:30Z,2025-09-30 01:50:30,0
Wk5OxqtpBR4,Adolescence | Official Trailer | Netflix,UCWOA1ZGywLbqmigxE4Qlvuw,Netflix,2025-02-24T16:00:00Z,UgzmJaJw8BWxWP_O5Zp4AaABAg.AN98jUyod7dANgO3PdDkxA,UgzmJaJw8BWxWP_O5Zp4AaABAg,@jethromcgl3697,UC_4mqIirORUu0-DNRLw0F2w,"​@oliverfoley3504 It's not, and the showrunners have said as much",en,2025-09-30T06:46:46Z,2025-09-30 02:46:46,0
Wk5OxqtpBR4,Adolescence | Official Trailer | Netflix,UCWOA1ZGywLbqmigxE4Qlvuw,Netflix,2025-02-24T16:00:00Z,UgzmJaJw8BWxWP_O5Zp4AaABAg.AN98jUyod7dANgOW8ddYBJ,UgzmJaJw8BWxWP_O5Zp4AaABAg,@oliverfoley3504,UCxqiMcVucwsIVtXzThUwRPg,@jethromcgl3697 Literally do the slightly amount of research. The show came to be because Stephen Graham wanted to the tell a  story inspired by a real youth knife crime incident that happened near his home town.,en,2025-09-30T06:50:42Z,2025-09-30 02:50:42,0
Wk5OxqtpBR4,Adolescence | Official Trailer | Netflix,UCWOA1ZGywLbqmigxE4Qlvuw,Netflix,2025-02-24T16:00:00Z,UgyfUD2V09g52wExhhJ4AaABAg.AN5jAFRrzD2AN8PO-_Syv_,UgyfUD2V09g52wExhhJ4AaABAg,@infinitydragonoid2655,UCqrTWOOrnP8ku03kekes8_g,"Try using real words next time. Google translated your comment to ""I am a feminist propaganda.""",en,2025-09-16T16:44:54Z,2025-09-16 12:44:54,0
Wk5OxqtpBR4,Adolescence | Official Trailer | Netflix,UCWOA1ZGywLbqmigxE4Qlvuw,Netflix,2025-02-24T16:00:00Z,UgxSr8dLYd9XOdgMO214AaABAg.AN5bk6icA1FAN6ohx4AMHF,UgxSr8dLYd9XOdgMO214AaABAg,@an5925,UCTNTto81yaWjrNgcnnepDyQ,It's a series,NA,2025-09-16T01:56:28Z,2025-09-15 21:56:28,0
Wk5OxqtpBR4,Adolescence | Official Trailer | Netflix,UCWOA1ZGywLbqmigxE4Qlvuw,Netflix,2025-02-24T16:00:00Z,UgzwVdfq_0_Ugy-0ulB4AaABAg.AN5H4QZHI6mAN8MZYEVTOK,UgzwVdfq_0_Ugy-0ulB4AaABAg,@jethromcgl3697,UC_4mqIirORUu0-DNRLw0F2w,Clearly not offensive as the right,en,2025-09-16T16:20:16Z,2025-09-16 12:20:16,0
Wk5OxqtpBR4,Adolescence | Official Trailer | Netflix,UCWOA1ZGywLbqmigxE4Qlvuw,Netflix,2025-02-24T16:00:00Z,Ugz0NMmHH7k_7lmY09d4AaABAg.AN4g5QgBfNsAOjuJ0KlXjD,Ugz0NMmHH7k_7lmY09d4AaABAg,@franktank1984,UCAU3MWQWbKX23S68i_WESlQ,This political propganda makes North Korean films look believable.,NA,2025-10-26T12:06:23Z,2025-10-26 08:06:23,0
Wk5OxqtpBR4,Adolescence | Official Trailer | Netflix,UCWOA1ZGywLbqmigxE4Qlvuw,Netflix,2025-02-24T16:00:00Z,UgxoDQ6VZfdKNhO1vUF4AaABAg.AN4ardidKX4AN8MiUYjd2E,UgxoDQ6VZfdKNhO1vUF4AaABAg,@jethromcgl3697,UC_4mqIirORUu0-DNRLw0F2w,"Minorities in graphs can exist 
Not everyone involved is going to be black",en,2025-09-16T16:21:37Z,2025-09-16 12:21:37,0
Wk5OxqtpBR4,Adolescence | Official Trailer | Netflix,UCWOA1ZGywLbqmigxE4Qlvuw,Netflix,2025-02-24T16:00:00Z,UgxoDQ6VZfdKNhO1vUF4AaABAg.AN4ardidKX4ANgJWEyI4qw,UgxoDQ6VZfdKNhO1vUF4AaABAg,@PilgrimButterfly,UCmOG94pr9ABRZP4O8SJfjFg,@jethromcgl3697 first time someone says this about a netflix movie lmao,en,2025-09-30T06:07:01Z,2025-09-30 02:07:01,0
Wk5OxqtpBR4,Adolescence | Official Trailer | Netflix,UCWOA1ZGywLbqmigxE4Qlvuw,Netflix,2025-02-24T16:00:00Z,UgxAmYd8S8kgvy9BgBt4AaABAg.AN4Iit2cthHAOjnAvDx6n-,UgxAmYd8S8kgvy9BgBt4AaABAg,@franktank1984,UCAU3MWQWbKX23S68i_WESlQ,Using a child to produce political propoganda like this is child abuse.,en,2025-10-26T11:04:06Z,2025-10-26 07:04:06,2
Wk5OxqtpBR4,Adolescence | Official Trailer | Netflix,UCWOA1ZGywLbqmigxE4Qlvuw,Netflix,2025-02-24T16:00:00Z,UgxAmYd8S8kgvy9BgBt4AaABAg.AN4Iit2cthHAQEcXSnd1n-,UgxAmYd8S8kgvy9BgBt4AaABAg,@The_Black_Caps,UCfJG13LVq1cJpgVLLmu02nw,​@franktank1984how the actual f was this show political propaganda??!!,en,2025-12-02T16:18:09Z,2025-12-02 11:18:09,0
Wk5OxqtpBR4,Adolescence | Official Trailer | Netflix,UCWOA1ZGywLbqmigxE4Qlvuw,Netflix,2025-02-24T16:00:00Z,UgxAmYd8S8kgvy9BgBt4AaABAg.AN4Iit2cthHAQErRjNVDyP,UgxAmYd8S8kgvy9BgBt4AaABAg,@franktank1984,UCAU3MWQWbKX23S68i_WESlQ,​@The_Black_Capsbecause it depicts a reality that does not exist to make a point that is actaully counter to reality.,en,2025-12-02T18:28:27Z,2025-12-02 13:28:27,0
Wk5OxqtpBR4,Adolescence | Official Trailer | Netflix,UCWOA1ZGywLbqmigxE4Qlvuw,Netflix,2025-02-24T16:00:00Z,UgxAmYd8S8kgvy9BgBt4AaABAg.AN4Iit2cthHAQGGpUAOsIk,UgxAmYd8S8kgvy9BgBt4AaABAg,@The_Black_Caps,UCfJG13LVq1cJpgVLLmu02nw,​@franktank1984reality that doesn't exist? Mate touch some grass sometimes. Literally every tween / teen were behaving like that during lockdown under the red pill influence. In fact some of em still are. I experienced it first hand myself. Watching amazing people turn into absolute scums was pretty devastating ngl,en,2025-12-03T07:38:15Z,2025-12-03 02:38:15,0
Wk5OxqtpBR4,Adolescence | Official Trailer | Netflix,UCWOA1ZGywLbqmigxE4Qlvuw,Netflix,2025-02-24T16:00:00Z,Ugz-HIjenFG0m38t8St4AaABAg.AN4FK7yDpQDAN4Ku9giFQH,Ugz-HIjenFG0m38t8St4AaABAg,@LVA22-y1m,UCrgIdApo_zZPM2PjpikcUNg,"@slackpanda3643 All of the cases they used had black kids or immigrant Muslims as the killers.  Nobody said it was a documentary but using a British white kid is total propaganda. 
How about you stop the name-calling?  We know what's going on in the UK.  We know who the killers are.  We know bots get paid for spreading the BS.  Get lost.",en,2025-09-15T02:48:46Z,2025-09-14 22:48:46,6
Wk5OxqtpBR4,Adolescence | Official Trailer | Netflix,UCWOA1ZGywLbqmigxE4Qlvuw,Netflix,2025-02-24T16:00:00Z,Ugz-HIjenFG0m38t8St4AaABAg.AN4FK7yDpQDAN4NH6affgd,Ugz-HIjenFG0m38t8St4AaABAg,@LVA22-y1m,UCrgIdApo_zZPM2PjpikcUNg,"@slackpanda3643    Is name-calling the best you can do?  All the cases they used had black or immigrant killers.  Everybody knows who the criminals are.  Crappy shows can't erase the truth, the whole world knows.",en,2025-09-15T03:09:31Z,2025-09-14 23:09:31,3
Wk5OxqtpBR4,Adolescence | Official Trailer | Netflix,UCWOA1ZGywLbqmigxE4Qlvuw,Netflix,2025-02-24T16:00:00Z,Ugz-HIjenFG0m38t8St4AaABAg.AN4FK7yDpQDAN4gXJXSvPA,Ugz-HIjenFG0m38t8St4AaABAg,@LVA22-y1m,UCrgIdApo_zZPM2PjpikcUNg,"@slackpanda3643 Your name calling is making us feel uncomfortable.  It does not feel safe having you in this comments section.  You're also spreading misinformation as all of the cases they based Adolescence on, were ones where the killers were black or immigrant.  And you forget that at first, they did say they based it on one case.  After the outcry they changed their story.",en,2025-09-15T06:06:30Z,2025-09-15 02:06:30,2
Wk5OxqtpBR4,Adolescence | Official Trailer | Netflix,UCWOA1ZGywLbqmigxE4Qlvuw,Netflix,2025-02-24T16:00:00Z,Ugz-HIjenFG0m38t8St4AaABAg.AN4FK7yDpQDAN6ouDLNQQK,Ugz-HIjenFG0m38t8St4AaABAg,@an5925,UCTNTto81yaWjrNgcnnepDyQ,"Uh, it's not based on a true story.",en,2025-09-16T01:58:09Z,2025-09-15 21:58:09,0
Wk5OxqtpBR4,Adolescence | Official Trailer | Netflix,UCWOA1ZGywLbqmigxE4Qlvuw,Netflix,2025-02-24T16:00:00Z,Ugz-HIjenFG0m38t8St4AaABAg.AN4FK7yDpQDAO-UcOwEjzQ,Ugz-HIjenFG0m38t8St4AaABAg,@LVA22-y1m,UCrgIdApo_zZPM2PjpikcUNg,@an5925 YES it is.  Several true stories.  The producers said that from the beginning.,en,2025-10-08T02:08:55Z,2025-10-07 22:08:55,0
Wk5OxqtpBR4,Adolescence | Official Trailer | Netflix,UCWOA1ZGywLbqmigxE4Qlvuw,Netflix,2025-02-24T16:00:00Z,Ugz-HIjenFG0m38t8St4AaABAg.AN4FK7yDpQDAO2_SnnXt93,Ugz-HIjenFG0m38t8St4AaABAg,@an5925,UCTNTto81yaWjrNgcnnepDyQ,​@LVA22-y1m ... The series Adolescence is not based on a single true story or person but was inspired by real-life patterns of knife crime among young boys in the U.K.,en,2025-10-09T06:57:38Z,2025-10-09 02:57:38,0
Wk5OxqtpBR4,Adolescence | Official Trailer | Netflix,UCWOA1ZGywLbqmigxE4Qlvuw,Netflix,2025-02-24T16:00:00Z,UgyNI_IWIciBkv609YV4AaABAg.AN26bc6561VAN8N7h2Lx5b,UgyNI_IWIciBkv609YV4AaABAg,@jethromcgl3697,UC_4mqIirORUu0-DNRLw0F2w,"Idk, Jamie not feeling any remorse and making derogatory comments towards women is a pretty big deal",en,2025-09-16T16:25:12Z,2025-09-16 12:25:12,1
Wk5OxqtpBR4,Adolescence | Official Trailer | Netflix,UCWOA1ZGywLbqmigxE4Qlvuw,Netflix,2025-02-24T16:00:00Z,UgyNI_IWIciBkv609YV4AaABAg.AN26bc6561VAN8rNOViNcl,UgyNI_IWIciBkv609YV4AaABAg,@RobertGST2,UC9h_nIRUjJdAE79eVqzLQkA,"@jethromcgl3697 episode 3 gave some more insight, I will say episode 4 could have been completely dropped. I was waiting for some big revelation or conspiracy but it turned out all the info we had in the first episode never changed. It wasn’t bad but I think it’s overhyped for sure.",en,2025-09-16T20:58:13Z,2025-09-16 16:58:13,0
Wk5OxqtpBR4,Adolescence | Official Trailer | Netflix,UCWOA1ZGywLbqmigxE4Qlvuw,Netflix,2025-02-24T16:00:00Z,Ugy8xYACoZltW95sk8h4AaABAg.AMrLRG3YiotAN8NFvTgUSR,Ugy8xYACoZltW95sk8h4AaABAg,@jethromcgl3697,UC_4mqIirORUu0-DNRLw0F2w,"To be fair, you wouldn't know how much they give away until after you watched it",en,2025-09-16T16:26:19Z,2025-09-16 12:26:19,0
Wk5OxqtpBR4,Adolescence | Official Trailer | Netflix,UCWOA1ZGywLbqmigxE4Qlvuw,Netflix,2025-02-24T16:00:00Z,UgxrReqMsSn7rkNC0Dl4AaABAg.AMkuLZUMs8xAMyL2aKQPXn,UgxrReqMsSn7rkNC0Dl4AaABAg,@Ellie10009,UChd-pQD1Fr3UQ9iOK94W_PQ,"It's based off multiple cases not just 1 specific case so it's not ""DEI"".",en,2025-09-12T09:35:23Z,2025-09-12 05:35:23,0
Wk5OxqtpBR4,Adolescence | Official Trailer | Netflix,UCWOA1ZGywLbqmigxE4Qlvuw,Netflix,2025-02-24T16:00:00Z,UgxrReqMsSn7rkNC0Dl4AaABAg.AMkuLZUMs8xAN1-5BmQ-LT,UgxrReqMsSn7rkNC0Dl4AaABAg,@ConfuMaster,UCkBotpJLhEcb8XcgF4KSivQ,@Ellie10009 and how many criminals in these cases are not the usual suspect? one out of hundred?,en,2025-09-13T19:40:27Z,2025-09-13 15:40:27,0
Wk5OxqtpBR4,Adolescence | Official Trailer | Netflix,UCWOA1ZGywLbqmigxE4Qlvuw,Netflix,2025-02-24T16:00:00Z,UgxrReqMsSn7rkNC0Dl4AaABAg.AMkuLZUMs8xAN4FWctajNJ,UgxrReqMsSn7rkNC0Dl4AaABAg,@LVA22-y1m,UCrgIdApo_zZPM2PjpikcUNg,"@Ellie10009   In all of the cases, the killer was black.  Or Muslim immigrant.",en,2025-09-15T02:01:44Z,2025-09-14 22:01:44,1
Wk5OxqtpBR4,Adolescence | Official Trailer | Netflix,UCWOA1ZGywLbqmigxE4Qlvuw,Netflix,2025-02-24T16:00:00Z,UgxrReqMsSn7rkNC0Dl4AaABAg.AMkuLZUMs8xAN8NVc6jy7l,UgxrReqMsSn7rkNC0Dl4AaABAg,@jethromcgl3697,UC_4mqIirORUu0-DNRLw0F2w,​@LVA22-y1m That implies white crimes simply can't exist,en,2025-09-16T16:28:28Z,2025-09-16 12:28:28,0
Wk5OxqtpBR4,Adolescence | Official Trailer | Netflix,UCWOA1ZGywLbqmigxE4Qlvuw,Netflix,2025-02-24T16:00:00Z,UgwaAoMR_UP0bB2scQd4AaABAg.AMbPdEh7vFPAN6uqxZRJU8,UgwaAoMR_UP0bB2scQd4AaABAg,@maimoonaurs,UCYuwCzblXkzPOTxq9Wd79vQ,yes,en,2025-09-16T02:50:08Z,2025-09-15 22:50:08,1
Wk5OxqtpBR4,Adolescence | Official Trailer | Netflix,UCWOA1ZGywLbqmigxE4Qlvuw,Netflix,2025-02-24T16:00:00Z,UgwFRogducdv6lnKOOd4AaABAg.AMVgO4S41GTAN8NcEYnKpL,UgwFRogducdv6lnKOOd4AaABAg,@jethromcgl3697,UC_4mqIirORUu0-DNRLw0F2w,"That murder happened in 2023
The show released in early 2025
No other people got murdered in that 1 year time gap?",en,2025-09-16T16:29:30Z,2025-09-16 12:29:30,0
Wk5OxqtpBR4,Adolescence | Official Trailer | Netflix,UCWOA1ZGywLbqmigxE4Qlvuw,Netflix,2025-02-24T16:00:00Z,UgwbyrCg9Id7oULuq3p4AaABAg.AMTffb_qo3ZAMcJVccQ_8p,UgwbyrCg9Id7oULuq3p4AaABAg,@jethromcgl3697,UC_4mqIirORUu0-DNRLw0F2w,You just proved the show's point,en,2025-09-03T20:18:35Z,2025-09-03 16:18:35,1
Wk5OxqtpBR4,Adolescence | Official Trailer | Netflix,UCWOA1ZGywLbqmigxE4Qlvuw,Netflix,2025-02-24T16:00:00Z,UgwbyrCg9Id7oULuq3p4AaABAg.AMTffb_qo3ZAMrhQNTbAQ9,UgwbyrCg9Id7oULuq3p4AaABAg,@jasonbourne5142,UCE23S_nTrvbGOlZKTP16Vpg,"​@jethromcgl3697 no you did, you're a simp",pt,2025-09-09T19:44:55Z,2025-09-09 15:44:55,2
Wk5OxqtpBR4,Adolescence | Official Trailer | Netflix,UCWOA1ZGywLbqmigxE4Qlvuw,Netflix,2025-02-24T16:00:00Z,UgwGhGAuz_GDcN2M-C94AaABAg.AMRoKYN8GFKAN8NpNfWSro,UgwGhGAuz_GDcN2M-C94AaABAg,@jethromcgl3697,UC_4mqIirORUu0-DNRLw0F2w,Because you started complaining about that,en,2025-09-16T16:31:18Z,2025-09-16 12:31:18,0
