video_id,video_title,channel_id,channel_title,video_published_at,reply_id,reply_parent_comment_id,reply_author_display,reply_author_channel_id,reply_text,reply_lang,reply_published_utc,reply_published_local,reply_like_count
Wk5OxqtpBR4,Adolescence | Official Trailer | Netflix,UCWOA1ZGywLbqmigxE4Qlvuw,Netflix,2025-02-24T16:00:00Z,UgzdYLLbEWNeFVHA5nt4AaABAg.AGPQ6wo6iDSAGPwMtW7xly,UgzdYLLbEWNeFVHA5nt4AaABAg,@vibovitold,UCQ8U8XZxJAfyFO2Dm_xaGJw,"@Ruud_Brouwer while i'm conservative myself (and not sympathetic towards modern feminist movement), being objective i wouldn't classify it as feminist propaganda.
(or any propaganda, for that matter).

it lacks many typical traits of propaganda, the most prominent one is that propaganda pieces oversimplify reality.
not quite the case in the show.
* nearly all males are portrayed in a positive light, most notably the boy's father (even though he's hardly a 'male feminist' type of guy) 
* the victim is not painted as an innocent angel either.
while obviously nobody deserves to be murderered, the show makes it clear that she acted like a cyberbully, and a particularly cruel one at that, preying on the boy's most vulnerable insecurities until he lashed out.

there's a lot of depth to it, which is uncharacteristic of propaganda.

one can still disagree with the message of course, but that doesn't automatically make it ""propaganda"".

it just means it's something you disagree with.",en,2025-04-02T12:29:11Z,2025-04-02 08:29:11,0
Wk5OxqtpBR4,Adolescence | Official Trailer | Netflix,UCWOA1ZGywLbqmigxE4Qlvuw,Netflix,2025-02-24T16:00:00Z,UgzdYLLbEWNeFVHA5nt4AaABAg.AGPQ6wo6iDSAGQKCg_V2-W,UgzdYLLbEWNeFVHA5nt4AaABAg,@ivermektin6874,UC6rbSEMAGFJaGqjdFs5palA,"@Ruud_Brouwer Only known cases of this happening in the UK were all committed by black teenagers, not white pre-pubescent boys with stable home lives.",en,2025-04-02T16:06:15Z,2025-04-02 12:06:15,0
Wk5OxqtpBR4,Adolescence | Official Trailer | Netflix,UCWOA1ZGywLbqmigxE4Qlvuw,Netflix,2025-02-24T16:00:00Z,UgyrI_paPybRUJ-UnzB4AaABAg.AGPO5LVOc_OAGPQFojroJb,UgyrI_paPybRUJ-UnzB4AaABAg,@teenmartin,UCyNcaUh3EzLi7cAqAZerR6w,"Ind-ian fe-males aren't worth marrying anyways, because they're violent masculine full of themselves and narcissistic.",en,2025-04-02T07:39:51Z,2025-04-02 03:39:51,3
Wk5OxqtpBR4,Adolescence | Official Trailer | Netflix,UCWOA1ZGywLbqmigxE4Qlvuw,Netflix,2025-02-24T16:00:00Z,Ugz_7zqkgeD9CzdMOCJ4AaABAg.AGPHwF7ojzoAGPkV73lKG2,Ugz_7zqkgeD9CzdMOCJ4AaABAg,@Ruud_Brouwer,UCLlq2HtN_do0kj_4KvmwI-Q,So you didn't watch the show?,en,2025-04-02T10:45:26Z,2025-04-02 06:45:26,0
Wk5OxqtpBR4,Adolescence | Official Trailer | Netflix,UCWOA1ZGywLbqmigxE4Qlvuw,Netflix,2025-02-24T16:00:00Z,Ugz_7zqkgeD9CzdMOCJ4AaABAg.AGPHwF7ojzoAGPsizppX8Q,Ugz_7zqkgeD9CzdMOCJ4AaABAg,@mattuiop,UCnnrJo4ttjYVf6eXcnWHA2g,​@Ruud_Brouwerdo you know the statistics of who are most representative of knife crime in the UK?,en,2025-04-02T11:57:23Z,2025-04-02 07:57:23,6
Wk5OxqtpBR4,Adolescence | Official Trailer | Netflix,UCWOA1ZGywLbqmigxE4Qlvuw,Netflix,2025-02-24T16:00:00Z,Ugz_7zqkgeD9CzdMOCJ4AaABAg.AGPHwF7ojzoAGPwvXXZzD8,Ugz_7zqkgeD9CzdMOCJ4AaABAg,@vibovitold,UCQ8U8XZxJAfyFO2Dm_xaGJw,"​@mattuiop fiction isn't obligated to be statistically representative.
if it is, i must have missed that memo.
if it were, noone in their sound mind would ever board a plane...
based on what you get to see in movies, you'd think roughly 1 in 10 flights ends with a crash. 
certainly not 1 in several million (which is the case in real life).",en,2025-04-02T12:34:03Z,2025-04-02 08:34:03,0
Wk5OxqtpBR4,Adolescence | Official Trailer | Netflix,UCWOA1ZGywLbqmigxE4Qlvuw,Netflix,2025-02-24T16:00:00Z,Ugz_7zqkgeD9CzdMOCJ4AaABAg.AGPHwF7ojzoAGQGeDko5oj,Ugz_7zqkgeD9CzdMOCJ4AaABAg,@Quaggabagel,UCoYsGKN1Ib4TCWjSrKe7a7A,@Ruud_Brouwer “you didn’t watch the propaganda”,NA,2025-04-02T15:35:11Z,2025-04-02 11:35:11,1
Wk5OxqtpBR4,Adolescence | Official Trailer | Netflix,UCWOA1ZGywLbqmigxE4Qlvuw,Netflix,2025-02-24T16:00:00Z,Ugz_7zqkgeD9CzdMOCJ4AaABAg.AGPHwF7ojzoAGQOLZgs8TT,Ugz_7zqkgeD9CzdMOCJ4AaABAg,@Ruud_Brouwer,UCLlq2HtN_do0kj_4KvmwI-Q,​@Quaggabagelit's not propaganda.,NA,2025-04-02T16:42:24Z,2025-04-02 12:42:24,1
Wk5OxqtpBR4,Adolescence | Official Trailer | Netflix,UCWOA1ZGywLbqmigxE4Qlvuw,Netflix,2025-02-24T16:00:00Z,Ugz_7zqkgeD9CzdMOCJ4AaABAg.AGPHwF7ojzoAGQT0Nbg4Ni,Ugz_7zqkgeD9CzdMOCJ4AaABAg,@Quaggabagel,UCoYsGKN1Ib4TCWjSrKe7a7A,@Ruud_Brouwer then what’s the message of the movie?,en,2025-04-02T17:23:12Z,2025-04-02 13:23:12,0
Wk5OxqtpBR4,Adolescence | Official Trailer | Netflix,UCWOA1ZGywLbqmigxE4Qlvuw,Netflix,2025-02-24T16:00:00Z,UgwLH-qWWYBrvCFUO9x4AaABAg.AGPBTwMTAB3AGPjFA6uxRY,UgwLH-qWWYBrvCFUO9x4AaABAg,@AlexBeunker,UCB4vv0nngxA-YhBz9w_aMzA,No it isn't.  That didn't even happen in the UK.,en,2025-04-02T10:34:32Z,2025-04-02 06:34:32,1
Wk5OxqtpBR4,Adolescence | Official Trailer | Netflix,UCWOA1ZGywLbqmigxE4Qlvuw,Netflix,2025-02-24T16:00:00Z,UgwrDtrQW3siw_0Q5tl4AaABAg.AGPB--WfKXrAGP_mJmK58-,UgwrDtrQW3siw_0Q5tl4AaABAg,@vibovitold,UCQ8U8XZxJAfyFO2Dm_xaGJw,"Social media is only a tool - you can use it for posting pictures of kittens just the same.
Tools may amplify some issues, but they aren't an explanation.
Remember when video games were the root of all evil?
Every generation has its own ""social media"" scapegoat.",en,2025-04-02T09:11:49Z,2025-04-02 05:11:49,1
Wk5OxqtpBR4,Adolescence | Official Trailer | Netflix,UCWOA1ZGywLbqmigxE4Qlvuw,Netflix,2025-02-24T16:00:00Z,UgxZeDuRHcbKxKzs6kl4AaABAg.AGP1RyMbtFWAGP7kVeXzKz,UgxZeDuRHcbKxKzs6kl4AaABAg,@AbhiramUpadhye,UCmTymT7SazvjnJMcFWkxdAA,LMAO,sr,2025-04-02T04:58:09Z,2025-04-02 00:58:09,2
Wk5OxqtpBR4,Adolescence | Official Trailer | Netflix,UCWOA1ZGywLbqmigxE4Qlvuw,Netflix,2025-02-24T16:00:00Z,Ugy6tekkuGi10ARigwZ4AaABAg.AGP1GiDQHA9AMTfm7tiNzf,Ugy6tekkuGi10ARigwZ4AaABAg,@jasonbourne5142,UCE23S_nTrvbGOlZKTP16Vpg,Its left with crap,en,2025-08-31T02:29:32Z,2025-08-30 22:29:32,3
Wk5OxqtpBR4,Adolescence | Official Trailer | Netflix,UCWOA1ZGywLbqmigxE4Qlvuw,Netflix,2025-02-24T16:00:00Z,Ugy6tekkuGi10ARigwZ4AaABAg.AGP1GiDQHA9APJz8vNMWWb,Ugy6tekkuGi10ARigwZ4AaABAg,@theraven6843,UCVcLnDNvYxEEX1xKZmAMsnQ,Last episode sucks.,la,2025-11-09T21:40:35Z,2025-11-09 16:40:35,0
Wk5OxqtpBR4,Adolescence | Official Trailer | Netflix,UCWOA1ZGywLbqmigxE4Qlvuw,Netflix,2025-02-24T16:00:00Z,Ugy6tekkuGi10ARigwZ4AaABAg.AGP1GiDQHA9AQGQ7t5lXEl,Ugy6tekkuGi10ARigwZ4AaABAg,@Meraidd,UC3KmpJV7Ip4qDFETWFkxsUA,"​@jasonbourne5142sometimes you see a comment and sit there with it for a few minutes wondering, what the heck was this person thinking when they wrote the most ambiguous, general 4 words? What about the original comment filled you with enough emotion to say, ""it's left with crap""? What does it even mean? I'm not being mean I'm genuinely curious what that means 😅",en,2025-12-03T08:59:33Z,2025-12-03 03:59:33,1
Wk5OxqtpBR4,Adolescence | Official Trailer | Netflix,UCWOA1ZGywLbqmigxE4Qlvuw,Netflix,2025-02-24T16:00:00Z,Ugy6tekkuGi10ARigwZ4AaABAg.AGP1GiDQHA9AQWJNMDFBiV,Ugy6tekkuGi10ARigwZ4AaABAg,@Sdaniels3152,UCNRphMK0gNmnREwfgJwXjJA,"​@Meraiddthat the series leans politically to the left and, in his opinion, is a pile of crap. 

Just from watching the trailer, I think he's right about the first part. I have to watch it to be able to comment on the second part.",en,2025-12-09T13:08:20Z,2025-12-09 08:08:20,2
Wk5OxqtpBR4,Adolescence | Official Trailer | Netflix,UCWOA1ZGywLbqmigxE4Qlvuw,Netflix,2025-02-24T16:00:00Z,Ugy6tekkuGi10ARigwZ4AaABAg.AGP1GiDQHA9AQaY4pISfNe,Ugy6tekkuGi10ARigwZ4AaABAg,@pimpinace_175,UCRgZl0KGVlJYY0tths1rR1w,​@Meraiddthe show sucks,NA,2025-12-11T13:53:05Z,2025-12-11 08:53:05,0
Wk5OxqtpBR4,Adolescence | Official Trailer | Netflix,UCWOA1ZGywLbqmigxE4Qlvuw,Netflix,2025-02-24T16:00:00Z,Ugy6tekkuGi10ARigwZ4AaABAg.AGP1GiDQHA9AQc2ZIDStYz,Ugy6tekkuGi10ARigwZ4AaABAg,@Meraidd,UC3KmpJV7Ip4qDFETWFkxsUA,"@Sdaniels3152 ohh that makes sense, 'it's left-leaning politically and thus, is crap'. to each their own. It's very much anti-manosphere. But I like to think it's a realistic look at what manopshere stuff is doing to young boys growing up these days, if someone doesn't think that's a big issue then I wouldn't recommend the show to them.",en,2025-12-12T03:56:06Z,2025-12-11 22:56:06,0
Wk5OxqtpBR4,Adolescence | Official Trailer | Netflix,UCWOA1ZGywLbqmigxE4Qlvuw,Netflix,2025-02-24T16:00:00Z,Ugy6tekkuGi10ARigwZ4AaABAg.AGP1GiDQHA9AQc2rEK9CTX,Ugy6tekkuGi10ARigwZ4AaABAg,@Meraidd,UC3KmpJV7Ip4qDFETWFkxsUA,"@pimpinace_175 It was very well made, from a writing, acting, and directing standpoint. If you don't like the message or the topic they were aiming to explore, that's your opinion and you're allowed to have it 👍",en,2025-12-12T03:58:41Z,2025-12-11 22:58:41,0
Wk5OxqtpBR4,Adolescence | Official Trailer | Netflix,UCWOA1ZGywLbqmigxE4Qlvuw,Netflix,2025-02-24T16:00:00Z,Ugz9fy_tCjwmpTOz6AJ4AaABAg.AGOqk8eRu5KAGPQSJrzAst,Ugz9fy_tCjwmpTOz6AJ4AaABAg,@teenmartin,UCyNcaUh3EzLi7cAqAZerR6w,They don't care what color male you're. Feminist propaganda is based on antagonization of GENDER,en,2025-04-02T07:41:34Z,2025-04-02 03:41:34,0
Wk5OxqtpBR4,Adolescence | Official Trailer | Netflix,UCWOA1ZGywLbqmigxE4Qlvuw,Netflix,2025-02-24T16:00:00Z,Ugz9fy_tCjwmpTOz6AJ4AaABAg.AGOqk8eRu5KAGQJjW1oylw,Ugz9fy_tCjwmpTOz6AJ4AaABAg,@Dannyinkorea,UCF_UarPxL4CnmDV5WYVxlFQ,"​@teenmartin if they don't care, why didn't they use a black in this? This woke crap is based around what a black did, not a white",en,2025-04-02T16:02:07Z,2025-04-02 12:02:07,1
Wk5OxqtpBR4,Adolescence | Official Trailer | Netflix,UCWOA1ZGywLbqmigxE4Qlvuw,Netflix,2025-02-24T16:00:00Z,UgzIB-q4DNEFUQ5d3a54AaABAg.AGOg0DQ_JzrAGPaLwJJQpW,UgzIB-q4DNEFUQ5d3a54AaABAg,@vibovitold,UCQ8U8XZxJAfyFO2Dm_xaGJw,"""The show is based on a Ugandan immigrant who murdered a 15-year-old black girl""

No, it is not ""based"" on that tragedy. 
It was loosely inspired by it. 
But pretty much everything in the story is different  - the perpetrator's age (13, not 17), his motivation, etc.",en,2025-04-02T09:16:49Z,2025-04-02 05:16:49,1
Wk5OxqtpBR4,Adolescence | Official Trailer | Netflix,UCWOA1ZGywLbqmigxE4Qlvuw,Netflix,2025-02-24T16:00:00Z,UgzIB-q4DNEFUQ5d3a54AaABAg.AGOg0DQ_JzrAGPt1-xh5G3,UgzIB-q4DNEFUQ5d3a54AaABAg,@mattuiop,UCnnrJo4ttjYVf6eXcnWHA2g,​@vibovitoldthink of why they had to race swap regardless of how much of an inspiration it was to a real event. Why is it being pushed so hard in parliament? Awfully convenient this can in production in the advent of Southport and Nottingham...,en,2025-04-02T11:59:58Z,2025-04-02 07:59:58,1
Wk5OxqtpBR4,Adolescence | Official Trailer | Netflix,UCWOA1ZGywLbqmigxE4Qlvuw,Netflix,2025-02-24T16:00:00Z,UgzIB-q4DNEFUQ5d3a54AaABAg.AGOg0DQ_JzrAGQ-Qz9V2uI,UgzIB-q4DNEFUQ5d3a54AaABAg,@vibovitold,UCQ8U8XZxJAfyFO2Dm_xaGJw,"@mattuiop ""think of why they had to race swap regardless of how much of an inspiration it was to a real event""

the idea is that viewers can't believe the boy could have killed anyone at first.
we tend to side with the boy until the end of the first act (episode).

and that wouldn't really work as well if they tossed a black angry immigrant in the back of a police car.
they also made him much younger that most of these real life perpetrators (he's 13, not 15 or 17).
do you really think this was out of prejudice against younger teenagers?
or just to increase the contrast between expectations and reality.
to me it's pretty obvious that it was to amplify that contrast.

""Why is it being pushed so hard in parliament?""


that sounds more like a question to the parliament than to me.
i'm totally stumped.
after all, politicians are famous for never stretching interpretations or spinning things to fit their agenda, amirite",en,2025-04-02T13:04:41Z,2025-04-02 09:04:41,0
Wk5OxqtpBR4,Adolescence | Official Trailer | Netflix,UCWOA1ZGywLbqmigxE4Qlvuw,Netflix,2025-02-24T16:00:00Z,UgzIB-q4DNEFUQ5d3a54AaABAg.AGOg0DQ_JzrAGSH2oj7cf6,UgzIB-q4DNEFUQ5d3a54AaABAg,@happycompsognathus4411,UCbiqKCSYS_Dr7FKxBOGSGAQ,@vibovitold yes it was! based on Elianne Andam murder: Hassan Sentamu,NA,2025-04-03T10:17:09Z,2025-04-03 06:17:09,0
Wk5OxqtpBR4,Adolescence | Official Trailer | Netflix,UCWOA1ZGywLbqmigxE4Qlvuw,Netflix,2025-02-24T16:00:00Z,UgyVNuYJ8UG26VqlUTR4AaABAg.AGOTMxqqjWCAGQKHj9dG-3,UgyVNuYJ8UG26VqlUTR4AaABAg,@ivermektin6874,UC6rbSEMAGFJaGqjdFs5palA,Conveniently the other way this time.  Hmmm.,en,2025-04-02T16:06:56Z,2025-04-02 12:06:56,0
Wk5OxqtpBR4,Adolescence | Official Trailer | Netflix,UCWOA1ZGywLbqmigxE4Qlvuw,Netflix,2025-02-24T16:00:00Z,UgyCW2T5oE1jw8SOqzd4AaABAg.AGOPxeqSI-SAGPQc9rLpEF,UgyCW2T5oE1jw8SOqzd4AaABAg,@teenmartin,UCyNcaUh3EzLi7cAqAZerR6w,U clearly don't read newspapers. Native blooded whites aren't different,en,2025-04-02T07:43:02Z,2025-04-02 03:43:02,0
Wk5OxqtpBR4,Adolescence | Official Trailer | Netflix,UCWOA1ZGywLbqmigxE4Qlvuw,Netflix,2025-02-24T16:00:00Z,UgyCW2T5oE1jw8SOqzd4AaABAg.AGOPxeqSI-SAGPx3AmZCL1,UgyCW2T5oE1jw8SOqzd4AaABAg,@fabonzanaon8177,UCQE838Bde4IxItgX6RxFNiQ,​@teenmartinLet's hope so. Otherwise they won't survive the multicultural experiment you have imposed on them against their will.,en,2025-04-02T12:35:13Z,2025-04-02 08:35:13,0
Wk5OxqtpBR4,Adolescence | Official Trailer | Netflix,UCWOA1ZGywLbqmigxE4Qlvuw,Netflix,2025-02-24T16:00:00Z,UgzDNwoCdMKujGOR9Ot4AaABAg.AGONwLjXReeAG_P_Pm9j-4,UgzDNwoCdMKujGOR9Ot4AaABAg,@DatDutchDudee,UCxZN4Pe4oA9bmzqIsyp7x_A,Especially yours it seems. Why is that? Daddy didnt love you? Didnt give you enough attention?,en,2025-04-06T14:05:34Z,2025-04-06 10:05:34,3
Wk5OxqtpBR4,Adolescence | Official Trailer | Netflix,UCWOA1ZGywLbqmigxE4Qlvuw,Netflix,2025-02-24T16:00:00Z,UgzDNwoCdMKujGOR9Ot4AaABAg.AGONwLjXReeAG_uLwmHJzR,UgzDNwoCdMKujGOR9Ot4AaABAg,@highflybirdy851,UC99aF_gzZHK6p7rWNWLONIA,@DatDutchDudee Not in mine Danny boy because i don't meat ride Tate so hard to the point I put him on the netflix show making it look like its kind of his fault that some little prick stabbed a 13 year old girl. Looking for someone to blame 🤣,en,2025-04-06T18:43:13Z,2025-04-06 14:43:13,0
Wk5OxqtpBR4,Adolescence | Official Trailer | Netflix,UCWOA1ZGywLbqmigxE4Qlvuw,Netflix,2025-02-24T16:00:00Z,UgzDNwoCdMKujGOR9Ot4AaABAg.AGONwLjXReeAG_uVcZHin1,UgzDNwoCdMKujGOR9Ot4AaABAg,@highflybirdy851,UC99aF_gzZHK6p7rWNWLONIA,@DatDutchDudee And my dad obviously loved me and did a good job because I grew up without having to stab someone. I'm 31 now so we might be a little past daddy's attention don't you think? This dude probably thought I was some teen talking about daddy didn't love you. England is the prime example of daddy not loving you because knife stabbings sky rocket. 🤣,en,2025-04-06T18:44:32Z,2025-04-06 14:44:32,0
Wk5OxqtpBR4,Adolescence | Official Trailer | Netflix,UCWOA1ZGywLbqmigxE4Qlvuw,Netflix,2025-02-24T16:00:00Z,UgzDNwoCdMKujGOR9Ot4AaABAg.AGONwLjXReeAGvT46TVn--,UgzDNwoCdMKujGOR9Ot4AaABAg,@highflybirdy851,UC99aF_gzZHK6p7rWNWLONIA,"@DatDutchDudee Everyone knows this is a woke movie! Trying to make an issue where really there isn't one. Trying so hard to paint masculanity as a bad thing while masculine men are the ones who save the day in this tv show literally! 😂
Daddy didn't give me enough attention? Bro, I'm 31! Move on wokie 🤣",en,2025-04-15T03:39:24Z,2025-04-14 23:39:24,0
Wk5OxqtpBR4,Adolescence | Official Trailer | Netflix,UCWOA1ZGywLbqmigxE4Qlvuw,Netflix,2025-02-24T16:00:00Z,UgxIrtxNxz2YpGlS_Sx4AaABAg.AGODre0KXh3AGQKRGclwo3,UgxIrtxNxz2YpGlS_Sx4AaABAg,@ivermektin6874,UC6rbSEMAGFJaGqjdFs5palA,And they are forcing it to be shown in schools now.  Propaganda.,en,2025-04-02T16:08:14Z,2025-04-02 12:08:14,0
Wk5OxqtpBR4,Adolescence | Official Trailer | Netflix,UCWOA1ZGywLbqmigxE4Qlvuw,Netflix,2025-02-24T16:00:00Z,UgySeA_a1pGrGQ0FS9R4AaABAg.AGO691mYSLHAGPQlonY3FW,UgySeA_a1pGrGQ0FS9R4AaABAg,@teenmartin,UCyNcaUh3EzLi7cAqAZerR6w,Anti male*,co,2025-04-02T07:44:21Z,2025-04-02 03:44:21,0
Wk5OxqtpBR4,Adolescence | Official Trailer | Netflix,UCWOA1ZGywLbqmigxE4Qlvuw,Netflix,2025-02-24T16:00:00Z,UgzdMTErz6Nn9notkhh4AaABAg.AGNun6eQNUGAGNuvkTx0tx,UgzdMTErz6Nn9notkhh4AaABAg,@allisokandsweet,UC1prAzkNfocz_vdvNIUeT_w,"You ever get the feeling, these writers live in a different reality.",en,2025-04-01T17:38:07Z,2025-04-01 13:38:07,1
Wk5OxqtpBR4,Adolescence | Official Trailer | Netflix,UCWOA1ZGywLbqmigxE4Qlvuw,Netflix,2025-02-24T16:00:00Z,UgzdMTErz6Nn9notkhh4AaABAg.AGNun6eQNUGAGNv0bAgcUk,UgzdMTErz6Nn9notkhh4AaABAg,@allisokandsweet,UC1prAzkNfocz_vdvNIUeT_w,"Or would it be an agenda reality were the dim, witty believe it?",en,2025-04-01T17:38:55Z,2025-04-01 13:38:55,1
Wk5OxqtpBR4,Adolescence | Official Trailer | Netflix,UCWOA1ZGywLbqmigxE4Qlvuw,Netflix,2025-02-24T16:00:00Z,UgxgsOLSfn5nV5spxxx4AaABAg.AGNbvHJzHEzAGNkrXdx7L7,UgxgsOLSfn5nV5spxxx4AaABAg,@AGirlHasNoName1.618,UCTlFnO9p_3oqPve94N1sTMw,you sound a bit deranged 😳,NA,2025-04-01T16:10:09Z,2025-04-01 12:10:09,3
Wk5OxqtpBR4,Adolescence | Official Trailer | Netflix,UCWOA1ZGywLbqmigxE4Qlvuw,Netflix,2025-02-24T16:00:00Z,UgxIswaZWJ6oTEF93mJ4AaABAg.AGNViUgnNYXAGN_h7mTfdX,UgxIswaZWJ6oTEF93mJ4AaABAg,@alejandrotorves6483,UCj5vpQ1jfZwWWU6ft9ZAwUQ,"Hi, and I was watching other videos that talk about the ""real life inspirations"" of the show, the video doesn't show pictures of the immigrant attackers.",en,2025-04-01T14:32:37Z,2025-04-01 10:32:37,1
Wk5OxqtpBR4,Adolescence | Official Trailer | Netflix,UCWOA1ZGywLbqmigxE4Qlvuw,Netflix,2025-02-24T16:00:00Z,UgyQaUqzvOPwkx51Qot4AaABAg.AGN97n7JgRAAGNEwCiVyNu,UgyQaUqzvOPwkx51Qot4AaABAg,@vibovitold,UCQ8U8XZxJAfyFO2Dm_xaGJw,I'm not liberal and I enjoyed it very much,en,2025-04-01T11:22:26Z,2025-04-01 07:22:26,1
Wk5OxqtpBR4,Adolescence | Official Trailer | Netflix,UCWOA1ZGywLbqmigxE4Qlvuw,Netflix,2025-02-24T16:00:00Z,UgyQaUqzvOPwkx51Qot4AaABAg.AGN97n7JgRAAGNMQdQiUIa,UgyQaUqzvOPwkx51Qot4AaABAg,@bobwinner8936,UCAyV8nEYDA5MnlZtKuNSAnA,@vibovitold  awesome.,NA,2025-04-01T12:27:54Z,2025-04-01 08:27:54,1
Wk5OxqtpBR4,Adolescence | Official Trailer | Netflix,UCWOA1ZGywLbqmigxE4Qlvuw,Netflix,2025-02-24T16:00:00Z,UgyQaUqzvOPwkx51Qot4AaABAg.AGN97n7JgRAAGPacOvb4eu,UgyQaUqzvOPwkx51Qot4AaABAg,@vibovitold,UCQ8U8XZxJAfyFO2Dm_xaGJw,"@bobwinner8936 what's awesome about it? i just disagree that it's ""one for the libs""",en,2025-04-02T09:19:12Z,2025-04-02 05:19:12,0
Wk5OxqtpBR4,Adolescence | Official Trailer | Netflix,UCWOA1ZGywLbqmigxE4Qlvuw,Netflix,2025-02-24T16:00:00Z,UgyQaUqzvOPwkx51Qot4AaABAg.AGN97n7JgRAAGPpqNgf1yg,UgyQaUqzvOPwkx51Qot4AaABAg,@bobwinner8936,UCAyV8nEYDA5MnlZtKuNSAnA,@vibovitold ....awesome that you enjoyed the film.....,en,2025-04-02T11:32:10Z,2025-04-02 07:32:10,0
Wk5OxqtpBR4,Adolescence | Official Trailer | Netflix,UCWOA1ZGywLbqmigxE4Qlvuw,Netflix,2025-02-24T16:00:00Z,UgxZ7WjGNZ75DkwI8xd4AaABAg.AGMxxF-HbNxAGN88hOnv-d,UgxZ7WjGNZ75DkwI8xd4AaABAg,@vibovitold,UCQ8U8XZxJAfyFO2Dm_xaGJw,"That's sort of the point here. There is no such thing as a ""full closure"". The trial is not what it is about.",en,2025-04-01T10:23:07Z,2025-04-01 06:23:07,0
Wk5OxqtpBR4,Adolescence | Official Trailer | Netflix,UCWOA1ZGywLbqmigxE4Qlvuw,Netflix,2025-02-24T16:00:00Z,UgwY180-6s3re_qUhYt4AaABAg.AGMd91cg3zZAGMkw-e5iHi,UgwY180-6s3re_qUhYt4AaABAg,@WhatisReal11,UCLyV5MJZV-kXunNftlFif1A,beyond your mind,en,2025-04-01T06:51:31Z,2025-04-01 02:51:31,3
Wk5OxqtpBR4,Adolescence | Official Trailer | Netflix,UCWOA1ZGywLbqmigxE4Qlvuw,Netflix,2025-02-24T16:00:00Z,UgwY180-6s3re_qUhYt4AaABAg.AGMd91cg3zZAGNZn3iB9Rt,UgwY180-6s3re_qUhYt4AaABAg,@Greenpoloboy3,UCJVN9xlfPhJcS4p1TVzRDUA,"maybe because they dont have netflix, i dont have it neither.",en,2025-04-01T14:24:41Z,2025-04-01 10:24:41,0
Wk5OxqtpBR4,Adolescence | Official Trailer | Netflix,UCWOA1ZGywLbqmigxE4Qlvuw,Netflix,2025-02-24T16:00:00Z,UgwY180-6s3re_qUhYt4AaABAg.AGMd91cg3zZAGNoYxhjMux,UgwY180-6s3re_qUhYt4AaABAg,@markcrawford5810,UC_3WthHKEc_KV8e2rbkVvWw,It is propaganda.,fy,2025-04-01T16:42:26Z,2025-04-01 12:42:26,4
Wk5OxqtpBR4,Adolescence | Official Trailer | Netflix,UCWOA1ZGywLbqmigxE4Qlvuw,Netflix,2025-02-24T16:00:00Z,UgwY180-6s3re_qUhYt4AaABAg.AGMd91cg3zZAGPBpQnC5f7,UgwY180-6s3re_qUhYt4AaABAg,@kaede_24,UCn7Up2UA4G5CAXDsUjATBXg,@WhatisReal11 I didn't watch the show so Idk what's going on,en,2025-04-02T05:33:47Z,2025-04-02 01:33:47,2
Wk5OxqtpBR4,Adolescence | Official Trailer | Netflix,UCWOA1ZGywLbqmigxE4Qlvuw,Netflix,2025-02-24T16:00:00Z,UgyvRq7DYotmxLc3UL54AaABAg.AGM_Q-Y74vKAGMugdv_lG_,UgyvRq7DYotmxLc3UL54AaABAg,@vibovitold,UCQ8U8XZxJAfyFO2Dm_xaGJw,"tthere was no such thing as ""the real kid"".
it's not a dramatization of any actual crime.
it was loosely inspired by a real life stabbing, but all the details (not just the race of the perpetrator) are different - age, victim, motivation, everything",en,2025-04-01T08:16:49Z,2025-04-01 04:16:49,1
Wk5OxqtpBR4,Adolescence | Official Trailer | Netflix,UCWOA1ZGywLbqmigxE4Qlvuw,Netflix,2025-02-24T16:00:00Z,UgyfegHWq8S4AuyylqZ4AaABAg.AGMNRGvnVXyAGMj4Muhk_f,UgyfegHWq8S4AuyylqZ4AaABAg,@brandi598,UCdiqDO8EcMhvk8VVjYws0dQ,"who is the actual offender, this was not based on a true story.",en,2025-04-01T06:35:20Z,2025-04-01 02:35:20,0
Wk5OxqtpBR4,Adolescence | Official Trailer | Netflix,UCWOA1ZGywLbqmigxE4Qlvuw,Netflix,2025-02-24T16:00:00Z,UgyfegHWq8S4AuyylqZ4AaABAg.AGMNRGvnVXyAGMkzsGrlAr,UgyfegHWq8S4AuyylqZ4AaABAg,@WhatisReal11,UCLyV5MJZV-kXunNftlFif1A,@brandi598 yes its being sold like one... who is doing the knife crime in UK? maybe look it up?,en,2025-04-01T06:52:03Z,2025-04-01 02:52:03,6
Wk5OxqtpBR4,Adolescence | Official Trailer | Netflix,UCWOA1ZGywLbqmigxE4Qlvuw,Netflix,2025-02-24T16:00:00Z,UgyfegHWq8S4AuyylqZ4AaABAg.AGMNRGvnVXyAGMuw3j9I8z,UgyfegHWq8S4AuyylqZ4AaABAg,@vibovitold,UCQ8U8XZxJAfyFO2Dm_xaGJw,"@WhatisReal11 what exactly do you mean by ""being sold like one""?

""who is doing the knife crime in UK?""

this show is not about ""the knife crime in UK"" though. 
it's about one very specific (and fictional) case.
when you watch ""The Silence of the Lambs"", do you also complain that most murderers aren't white, elderly, well cultured doctors?",en,2025-04-01T08:18:55Z,2025-04-01 04:18:55,0
Wk5OxqtpBR4,Adolescence | Official Trailer | Netflix,UCWOA1ZGywLbqmigxE4Qlvuw,Netflix,2025-02-24T16:00:00Z,UgyfegHWq8S4AuyylqZ4AaABAg.AGMNRGvnVXyAGOBEnjOw8v,UgyfegHWq8S4AuyylqZ4AaABAg,@kermitthefrog836,UCtOeMQu2Be94oEP-au-yhUQ,@brandi598 yes it was my guy.,NA,2025-04-01T20:09:24Z,2025-04-01 16:09:24,2
Wk5OxqtpBR4,Adolescence | Official Trailer | Netflix,UCWOA1ZGywLbqmigxE4Qlvuw,Netflix,2025-02-24T16:00:00Z,UgyfegHWq8S4AuyylqZ4AaABAg.AGMNRGvnVXyAGQKWTgBtfE,UgyfegHWq8S4AuyylqZ4AaABAg,@ivermektin6874,UC6rbSEMAGFJaGqjdFs5palA,"@brandi598 They are saying it is reflective of UK currently.   So yes, they are accountable for what the represent.",en,2025-04-02T16:08:56Z,2025-04-02 12:08:56,1
Wk5OxqtpBR4,Adolescence | Official Trailer | Netflix,UCWOA1ZGywLbqmigxE4Qlvuw,Netflix,2025-02-24T16:00:00Z,UgyfegHWq8S4AuyylqZ4AaABAg.AGMNRGvnVXyAGVapZPguGF,UgyfegHWq8S4AuyylqZ4AaABAg,@juliaj7939,UCmiT6YUaj2NVgKWpdpjULAg,@brandi598 The reality that the vast majority of knife crime in the UK is perpatrated by black and brown men in not fiction.,en,2025-04-04T17:16:26Z,2025-04-04 13:16:26,1
Wk5OxqtpBR4,Adolescence | Official Trailer | Netflix,UCWOA1ZGywLbqmigxE4Qlvuw,Netflix,2025-02-24T16:00:00Z,UgzZjaUAgnNTCN3yhmB4AaABAg.AGMAY72tADCAGMf_LwFT4a,UgzZjaUAgnNTCN3yhmB4AaABAg,@brandi598,UCdiqDO8EcMhvk8VVjYws0dQ,"who is this race swapping? the story is not based on a true event. quote from the director ""I have told a lot of real-life stories in my time, and I know the harm that can come when you take elements of a real-life story and put it on screen and the people aren’t expecting it. There is no part of this that’s based on a true story. Not one single part.”",en,2025-04-01T06:04:45Z,2025-04-01 02:04:45,2
Wk5OxqtpBR4,Adolescence | Official Trailer | Netflix,UCWOA1ZGywLbqmigxE4Qlvuw,Netflix,2025-02-24T16:00:00Z,UgzZjaUAgnNTCN3yhmB4AaABAg.AGMAY72tADCAGMvCCLX009,UgzZjaUAgnNTCN3yhmB4AaABAg,@vibovitold,UCQ8U8XZxJAfyFO2Dm_xaGJw,"@brandi598 real life Hannibal Lecter was black, and Joffrey Baratheon too. the shark from ""Jaws"" was also black. this race swapping hasn't started yesterday you sheep",en,2025-04-01T08:21:15Z,2025-04-01 04:21:15,1
Wk5OxqtpBR4,Adolescence | Official Trailer | Netflix,UCWOA1ZGywLbqmigxE4Qlvuw,Netflix,2025-02-24T16:00:00Z,UgyPllUXuKQbDpZeUQ94AaABAg.AGLq8LQdCuXAGMfoD_7ncF,UgyPllUXuKQbDpZeUQ94AaABAg,@brandi598,UCdiqDO8EcMhvk8VVjYws0dQ,"its a pipeline. Andrew tate is the first part that then leads someone further down the pipeline. He's an entry point. He teaches young men to demean women, treats them like objects, and that is the very first step to someone becoming an incel.",en,2025-04-01T06:06:46Z,2025-04-01 02:06:46,0
Wk5OxqtpBR4,Adolescence | Official Trailer | Netflix,UCWOA1ZGywLbqmigxE4Qlvuw,Netflix,2025-02-24T16:00:00Z,UgyPllUXuKQbDpZeUQ94AaABAg.AGLq8LQdCuXAGMuIPVR_lx,UgyPllUXuKQbDpZeUQ94AaABAg,@temmison1171,UCr9lZHf0GwJIz_slOPDgaXg,@brandi598you need to stop conflating incel and Andrew Tates ideology together. This is what this show did especially. It made up a bunch of terms they don’t exist and conflated the two,en,2025-04-01T08:13:22Z,2025-04-01 04:13:22,0
Wk5OxqtpBR4,Adolescence | Official Trailer | Netflix,UCWOA1ZGywLbqmigxE4Qlvuw,Netflix,2025-02-24T16:00:00Z,UgyPllUXuKQbDpZeUQ94AaABAg.AGLq8LQdCuXAGN4PBkio8d,UgyPllUXuKQbDpZeUQ94AaABAg,@JohnMac-pf6js,UCMyMKJ_jrLPufo-3XMsr_iw,"@temmison1171 Yes or conflating incel with redpill. 

These movements don’t agree with eachother, they reject eachother. 
This can be discovered with two minutes of research.",en,2025-04-01T09:50:25Z,2025-04-01 05:50:25,1
Wk5OxqtpBR4,Adolescence | Official Trailer | Netflix,UCWOA1ZGywLbqmigxE4Qlvuw,Netflix,2025-02-24T16:00:00Z,UgyPllUXuKQbDpZeUQ94AaABAg.AGLq8LQdCuXAGNW21Eh959,UgyPllUXuKQbDpZeUQ94AaABAg,@vadordarth496,UCXWp7q6ubeR8dXgNEf-Rv8Q,​​@temmison1171 man shut  up,de,2025-04-01T13:51:55Z,2025-04-01 09:51:55,0
