video_id,video_title,channel_id,channel_title,video_published_at,reply_id,reply_parent_comment_id,reply_author_display,reply_author_channel_id,reply_text,reply_lang,reply_published_utc,reply_published_local,reply_like_count
Wk5OxqtpBR4,Adolescence | Official Trailer | Netflix,UCWOA1ZGywLbqmigxE4Qlvuw,Netflix,2025-02-24T16:00:00Z,UgwWDEy3VSboUy3VCtd4AaABAg.AGa4cjUB0J0AGaG_pM4Lfg,UgwWDEy3VSboUy3VCtd4AaABAg,@SuburbanoidMisfit111,UCHwz5LH8DJcGcPNK1LRHAUg,"So, you'd want your son acting like this?",en,2025-04-06T22:06:14Z,2025-04-06 18:06:14,0
Wk5OxqtpBR4,Adolescence | Official Trailer | Netflix,UCWOA1ZGywLbqmigxE4Qlvuw,Netflix,2025-02-24T16:00:00Z,UgwWDEy3VSboUy3VCtd4AaABAg.AGa4cjUB0J0AGf4CcO20Fr,UgwWDEy3VSboUy3VCtd4AaABAg,@Alexandra-O23-d7x,UCjDgJn-Vtv-LsVf5VK_1brA,@SuburbanoidMisfit111 OP comment obviously went over YOUR head....lol,en,2025-04-08T18:54:16Z,2025-04-08 14:54:16,3
Wk5OxqtpBR4,Adolescence | Official Trailer | Netflix,UCWOA1ZGywLbqmigxE4Qlvuw,Netflix,2025-02-24T16:00:00Z,UgwWDEy3VSboUy3VCtd4AaABAg.AGa4cjUB0J0AGfJ0A_KQxh,UgwWDEy3VSboUy3VCtd4AaABAg,@SuburbanoidMisfit111,UCHwz5LH8DJcGcPNK1LRHAUg,@ Sure homie,af,2025-04-08T21:03:38Z,2025-04-08 17:03:38,0
Wk5OxqtpBR4,Adolescence | Official Trailer | Netflix,UCWOA1ZGywLbqmigxE4Qlvuw,Netflix,2025-02-24T16:00:00Z,UgwWDEy3VSboUy3VCtd4AaABAg.AGa4cjUB0J0AH835jnsZNS,UgwWDEy3VSboUy3VCtd4AaABAg,@scarecroww7,UCEcs8n68inqZMwym7-_Jq5A,"@SuburbanoidMisfit111 I know its hard to distinguish between fiction and reality, RIP SOUTHPORT GIRLS",en,2025-04-20T10:21:48Z,2025-04-20 06:21:48,0
Wk5OxqtpBR4,Adolescence | Official Trailer | Netflix,UCWOA1ZGywLbqmigxE4Qlvuw,Netflix,2025-02-24T16:00:00Z,UgxWx6Y_aEHA2gAb_xB4AaABAg.AGa3xtKwCjfAGa95_UVKrQ,UgxWx6Y_aEHA2gAb_xB4AaABAg,@pauljames1807,UCR8qJSggeUO778Hlp9jgyWw,Blah blah blah Get a job,jv,2025-04-06T21:00:48Z,2025-04-06 17:00:48,1
Wk5OxqtpBR4,Adolescence | Official Trailer | Netflix,UCWOA1ZGywLbqmigxE4Qlvuw,Netflix,2025-02-24T16:00:00Z,UgwbQVUjoVUCnRcJta14AaABAg.AG_v9PolBo3AGxCycxYRA5,UgwbQVUjoVUCnRcJta14AaABAg,@qndbanu,UCf2VdvMFQGCTEZypFaSqfHQ,There was No cut at all,en,2025-04-15T19:57:12Z,2025-04-15 15:57:12,3
Wk5OxqtpBR4,Adolescence | Official Trailer | Netflix,UCWOA1ZGywLbqmigxE4Qlvuw,Netflix,2025-02-24T16:00:00Z,UgwbQVUjoVUCnRcJta14AaABAg.AG_v9PolBo3AGxLdy7YPMi,UgwbQVUjoVUCnRcJta14AaABAg,@periculosumadversario,UCBgEEtbkSTpNUeXDjrUKsyQ,"@GULZAARB4U  Nope, and that was kinda my point🙂",NA,2025-04-15T21:13:01Z,2025-04-15 17:13:01,0
Wk5OxqtpBR4,Adolescence | Official Trailer | Netflix,UCWOA1ZGywLbqmigxE4Qlvuw,Netflix,2025-02-24T16:00:00Z,Ugx_bV4umo9vWxK24Qh4AaABAg.AG_jM2KKHj5AJ5hNxtxo0y,Ugx_bV4umo9vWxK24Qh4AaABAg,@leiadampapa3848,UC2z0L0RLYT_tFmWd5gNLbgQ,You love Andrew Tate I assume.,NA,2025-06-08T05:27:37Z,2025-06-08 01:27:37,0
Wk5OxqtpBR4,Adolescence | Official Trailer | Netflix,UCWOA1ZGywLbqmigxE4Qlvuw,Netflix,2025-02-24T16:00:00Z,UgyxZPahzhI8Vr8Wmvx4AaABAg.AG_VrWuy7fTAG_dPddCf9Z,UgyxZPahzhI8Vr8Wmvx4AaABAg,@wongziqingmoe,UCO2uHlQQTMm9oBAGCWI7RuA,why is it hated?,en,2025-04-06T16:15:10Z,2025-04-06 12:15:10,0
Wk5OxqtpBR4,Adolescence | Official Trailer | Netflix,UCWOA1ZGywLbqmigxE4Qlvuw,Netflix,2025-02-24T16:00:00Z,UgzAasMuFwtKpfQemDN4AaABAg.AG_UHW71RUYAGa9KodiYBW,UgzAasMuFwtKpfQemDN4AaABAg,@pauljames1807,UCR8qJSggeUO778Hlp9jgyWw,"If Indian schooling is amazing, why are they all so dumb?",en,2025-04-06T21:02:52Z,2025-04-06 17:02:52,0
Wk5OxqtpBR4,Adolescence | Official Trailer | Netflix,UCWOA1ZGywLbqmigxE4Qlvuw,Netflix,2025-02-24T16:00:00Z,UgzAasMuFwtKpfQemDN4AaABAg.AG_UHW71RUYAGc_bdGJXZ_,UgzAasMuFwtKpfQemDN4AaABAg,@Xxxidno113,UC1GOm22EN7TUffJ0GrYFR9g,It’s the discipline system that differs in both country not education system. Educate yourself,en,2025-04-07T19:39:43Z,2025-04-07 15:39:43,0
Wk5OxqtpBR4,Adolescence | Official Trailer | Netflix,UCWOA1ZGywLbqmigxE4Qlvuw,Netflix,2025-02-24T16:00:00Z,UgzAasMuFwtKpfQemDN4AaABAg.AG_UHW71RUYAGdHjLpgv3C,UgzAasMuFwtKpfQemDN4AaABAg,@rakeshreddymaddur,UCj1uMJshItp2aqQDPYGTklw,"@Albertoo12yio  ok bro, thanks for educating me.",NA,2025-04-08T02:13:59Z,2025-04-07 22:13:59,1
Wk5OxqtpBR4,Adolescence | Official Trailer | Netflix,UCWOA1ZGywLbqmigxE4Qlvuw,Netflix,2025-02-24T16:00:00Z,UgxK8X_iQA856nniLkB4AaABAg.AGZot_KcN_JAGnnBonHC6w,UgxK8X_iQA856nniLkB4AaABAg,@P1utia,UCrnJPffkIC6pmhDMgKzX5-A,I dont know but afaik considering the series was about relationships it should have thanked to people who just rejected/friendzoned that person and letting that person become lonely long term.,en,2025-04-12T04:10:02Z,2025-04-12 00:10:02,0
Wk5OxqtpBR4,Adolescence | Official Trailer | Netflix,UCWOA1ZGywLbqmigxE4Qlvuw,Netflix,2025-02-24T16:00:00Z,UgxMPMDJ1VtfqQGPlSt4AaABAg.AGZnIBXaOzjAGZsEQmcgPM,UgxMPMDJ1VtfqQGPlSt4AaABAg,@LittleLoz,UCNOdD4e2Sike4hSh7BZC1tg,Wrong,NA,2025-04-06T09:05:28Z,2025-04-06 05:05:28,1
Wk5OxqtpBR4,Adolescence | Official Trailer | Netflix,UCWOA1ZGywLbqmigxE4Qlvuw,Netflix,2025-02-24T16:00:00Z,UgxMPMDJ1VtfqQGPlSt4AaABAg.AGZnIBXaOzjAG_Te2h0b7g,UgxMPMDJ1VtfqQGPlSt4AaABAg,@MichaelMantion,UC0fWyo9RsOpODBStHwwUZ7w,Blacks kids are 40x more likely to murder.  If they used a black kid this would be reality.,en,2025-04-06T14:41:09Z,2025-04-06 10:41:09,11
Wk5OxqtpBR4,Adolescence | Official Trailer | Netflix,UCWOA1ZGywLbqmigxE4Qlvuw,Netflix,2025-02-24T16:00:00Z,UgxMPMDJ1VtfqQGPlSt4AaABAg.AGZnIBXaOzjAG_dUrvGbD8,UgxMPMDJ1VtfqQGPlSt4AaABAg,@wongziqingmoe,UCO2uHlQQTMm9oBAGCWI7RuA,@MichaelMantion jst say your racist vro,en,2025-04-06T16:15:53Z,2025-04-06 12:15:53,1
Wk5OxqtpBR4,Adolescence | Official Trailer | Netflix,UCWOA1ZGywLbqmigxE4Qlvuw,Netflix,2025-02-24T16:00:00Z,UgxMPMDJ1VtfqQGPlSt4AaABAg.AGZnIBXaOzjAG_jfWLVZRn,UgxMPMDJ1VtfqQGPlSt4AaABAg,@thatailurophile3706,UC4l_jC8bJ_2q8LOS5INL8Ew,This series had nothing to do race and color.,en,2025-04-06T17:09:54Z,2025-04-06 13:09:54,0
Wk5OxqtpBR4,Adolescence | Official Trailer | Netflix,UCWOA1ZGywLbqmigxE4Qlvuw,Netflix,2025-02-24T16:00:00Z,UgxMPMDJ1VtfqQGPlSt4AaABAg.AGZnIBXaOzjAG_k9gKZj30,UgxMPMDJ1VtfqQGPlSt4AaABAg,@SeanSmith-f3t,UCRbxFhLuuz-9KxUgj3PLyiQ,@thatailurophile3706So why cast a white boy when everyone knows it is black boys who are the ones doing the most knife crime.,en,2025-04-06T17:14:10Z,2025-04-06 13:14:10,8
Wk5OxqtpBR4,Adolescence | Official Trailer | Netflix,UCWOA1ZGywLbqmigxE4Qlvuw,Netflix,2025-02-24T16:00:00Z,UgxMPMDJ1VtfqQGPlSt4AaABAg.AGZnIBXaOzjAGaGlfiHslv,UgxMPMDJ1VtfqQGPlSt4AaABAg,@SuburbanoidMisfit111,UCHwz5LH8DJcGcPNK1LRHAUg,@SeanSmith-f3t Can we get stats on that big homie?,en,2025-04-06T22:07:51Z,2025-04-06 18:07:51,1
Wk5OxqtpBR4,Adolescence | Official Trailer | Netflix,UCWOA1ZGywLbqmigxE4Qlvuw,Netflix,2025-02-24T16:00:00Z,UgxMPMDJ1VtfqQGPlSt4AaABAg.AGZnIBXaOzjAGbiP_OF4R3,UgxMPMDJ1VtfqQGPlSt4AaABAg,@vibovitold,UCQ8U8XZxJAfyFO2Dm_xaGJw,"@SeanSmith-f3t 
1. they're not doing literally ""the most"", although they're overrepresented in relation to their share of the population
2. the series is NOT about ""most knife crime"". if you're interested in the typical cases - like gang turf wars - Netlifx has got ""Top Boy"" for you, with dozens of stabbings and shootings.
3. this one is about a very specific, niche type of knife crime.",en,2025-04-07T11:37:20Z,2025-04-07 07:37:20,1
Wk5OxqtpBR4,Adolescence | Official Trailer | Netflix,UCWOA1ZGywLbqmigxE4Qlvuw,Netflix,2025-02-24T16:00:00Z,UgxMPMDJ1VtfqQGPlSt4AaABAg.AGZnIBXaOzjAGeKYDljc1n,UgxMPMDJ1VtfqQGPlSt4AaABAg,@Braquemartable,UCwyb2VU1noxsQ2nkWrpdtOg,@wongziqingmoe statistics are racists then,NA,2025-04-08T11:57:47Z,2025-04-08 07:57:47,1
Wk5OxqtpBR4,Adolescence | Official Trailer | Netflix,UCWOA1ZGywLbqmigxE4Qlvuw,Netflix,2025-02-24T16:00:00Z,UgxMPMDJ1VtfqQGPlSt4AaABAg.AGZnIBXaOzjAGf4OjpAR0I,UgxMPMDJ1VtfqQGPlSt4AaABAg,@Alexandra-O23-d7x,UCjDgJn-Vtv-LsVf5VK_1brA,"@dilxrcg lol, no, the knife-crime murder and his family are White.  I see non-White detectives, etc.

It's propaganda.  It is evvidenced utterly beyond doubt that knife crimes (and violent crime generally) is primarily by non Whites  (everywhere--not just in the UK)",en,2025-04-08T18:55:55Z,2025-04-08 14:55:55,5
Wk5OxqtpBR4,Adolescence | Official Trailer | Netflix,UCWOA1ZGywLbqmigxE4Qlvuw,Netflix,2025-02-24T16:00:00Z,UgwpryxydxrwSqr1ulB4AaABAg.AGZJyoBs0e3AGvXmtSTESR,UgwpryxydxrwSqr1ulB4AaABAg,@diane5140,UCld4lol2vYGTrbQwiTUZSPg,"It was a wonderful show, I also recommend it. If people don't have the attention span of a goldfish, and also enjoy psychology, they'll love it. Incels probably will like it a bit less, unfortunately.",en,2025-04-15T04:20:37Z,2025-04-15 00:20:37,2
Wk5OxqtpBR4,Adolescence | Official Trailer | Netflix,UCWOA1ZGywLbqmigxE4Qlvuw,Netflix,2025-02-24T16:00:00Z,UgyUj2F0UnQRxBNqeQJ4AaABAg.AGZDn7U3d-SAGZW1ZuogVj,UgyUj2F0UnQRxBNqeQJ4AaABAg,@ShiftyRightNow,UCY-toxgXuFrnbOszLiMoifw,"So true. Just like the POS that attacked the daycare with 1-5 yr olds... although the show wouldnt HIT as hard. Its for the majority, not the minority that would of cheered the villan on.",en,2025-04-06T05:42:44Z,2025-04-06 01:42:44,1
Wk5OxqtpBR4,Adolescence | Official Trailer | Netflix,UCWOA1ZGywLbqmigxE4Qlvuw,Netflix,2025-02-24T16:00:00Z,UgyUj2F0UnQRxBNqeQJ4AaABAg.AGZDn7U3d-SAG_VNOr-2N7,UgyUj2F0UnQRxBNqeQJ4AaABAg,@DatDutchDudee,UCxZN4Pe4oA9bmzqIsyp7x_A,"If you think the most important thing when a person kills another person, is either of their skincolors, you are just a sad, pathetic, racist POS",en,2025-04-06T14:56:13Z,2025-04-06 10:56:13,0
Wk5OxqtpBR4,Adolescence | Official Trailer | Netflix,UCWOA1ZGywLbqmigxE4Qlvuw,Netflix,2025-02-24T16:00:00Z,UgyUj2F0UnQRxBNqeQJ4AaABAg.AGZDn7U3d-SAG_j0Rln0O3,UgyUj2F0UnQRxBNqeQJ4AaABAg,@kiyotakaayanokoji6,UC-_PwFRbWTbLmb2JP9z-ixQ,Facts.....why depict a white kid when the perpetrators are middle eastern muslims,en,2025-04-06T17:04:10Z,2025-04-06 13:04:10,3
Wk5OxqtpBR4,Adolescence | Official Trailer | Netflix,UCWOA1ZGywLbqmigxE4Qlvuw,Netflix,2025-02-24T16:00:00Z,UgyUj2F0UnQRxBNqeQJ4AaABAg.AGZDn7U3d-SAGerjfrTOdb,UgyUj2F0UnQRxBNqeQJ4AaABAg,@MikeJohnMentzer,UCHDzxp8VhyAHD33dplR7QQg,Because he is white and most of then are N-,en,2025-04-08T16:56:35Z,2025-04-08 12:56:35,1
Wk5OxqtpBR4,Adolescence | Official Trailer | Netflix,UCWOA1ZGywLbqmigxE4Qlvuw,Netflix,2025-02-24T16:00:00Z,UgyUj2F0UnQRxBNqeQJ4AaABAg.AGZDn7U3d-SAGf4n2LiTW4,UgyUj2F0UnQRxBNqeQJ4AaABAg,@Alexandra-O23-d7x,UCjDgJn-Vtv-LsVf5VK_1brA,"@DatDutchDudee It becomes important when you realize the mainstream media is deliberately and purposefully covering up a pattern and then Hollywood is propagandizing people to believe the OPPOSITE pattern exists.

THEN it becomes a problem.

Clearly, the media and the entertainent industry think that it's a pretty impotant point or they wouldn't be doing their best to hide and lie about the truth.",en,2025-04-08T18:59:23Z,2025-04-08 14:59:23,0
Wk5OxqtpBR4,Adolescence | Official Trailer | Netflix,UCWOA1ZGywLbqmigxE4Qlvuw,Netflix,2025-02-24T16:00:00Z,UgyUj2F0UnQRxBNqeQJ4AaABAg.AGZDn7U3d-SAGgb8LYgTOY,UgyUj2F0UnQRxBNqeQJ4AaABAg,@mattkile1976,UCSkaGrISzUb30QVHvL5kXeA,"@vibovitold it’s pure propaganda. It shows what the elite corporate media and political class think of the white working class. It shows how they wished Southport happened. Starmer called it a documentary twice on live tv. It’s being debated by vacuous MPs in parliament. It will be used as a tool to help them pass draconian internet legislation which they already had planned, because the boogey man A Tate will make your white working class son an incel. And while Tate is a cretin and a grifter, he’s not promoting being an incel. Far from it.",en,2025-04-09T09:10:01Z,2025-04-09 05:10:01,0
Wk5OxqtpBR4,Adolescence | Official Trailer | Netflix,UCWOA1ZGywLbqmigxE4Qlvuw,Netflix,2025-02-24T16:00:00Z,UgyUj2F0UnQRxBNqeQJ4AaABAg.AGZDn7U3d-SAGhZKLFe8wE,UgyUj2F0UnQRxBNqeQJ4AaABAg,@staraptor2711,UC4wbVhna6sG7pTBMcQHFWdg,It’s fictional.,fr,2025-04-09T18:04:41Z,2025-04-09 14:04:41,4
Wk5OxqtpBR4,Adolescence | Official Trailer | Netflix,UCWOA1ZGywLbqmigxE4Qlvuw,Netflix,2025-02-24T16:00:00Z,UgyUj2F0UnQRxBNqeQJ4AaABAg.AGZDn7U3d-SAGhZl-d1IEQ,UgyUj2F0UnQRxBNqeQJ4AaABAg,@mattkile1976,UCSkaGrISzUb30QVHvL5kXeA,@staraptor2711 Starmer called it a documentary twice on live tv. It’s anti whit e working class propaganda. It’s shows you how they think of the working class. It’s how they wish Southport had happened.,en,2025-04-09T18:08:28Z,2025-04-09 14:08:28,8
Wk5OxqtpBR4,Adolescence | Official Trailer | Netflix,UCWOA1ZGywLbqmigxE4Qlvuw,Netflix,2025-02-24T16:00:00Z,UgyUj2F0UnQRxBNqeQJ4AaABAg.AGZDn7U3d-SAGhgbhV_iDP,UgyUj2F0UnQRxBNqeQJ4AaABAg,@staraptor2711,UC4wbVhna6sG7pTBMcQHFWdg,"@mattkile1976 yeah, but Starmer is an idiot, so I don’t care.",en,2025-04-09T19:17:06Z,2025-04-09 15:17:06,6
Wk5OxqtpBR4,Adolescence | Official Trailer | Netflix,UCWOA1ZGywLbqmigxE4Qlvuw,Netflix,2025-02-24T16:00:00Z,UgyUj2F0UnQRxBNqeQJ4AaABAg.AGZDn7U3d-SAGhiggwuiFU,UgyUj2F0UnQRxBNqeQJ4AaABAg,@mattkile1976,UCSkaGrISzUb30QVHvL5kXeA,@ of course. But unfortunately he’s an idiot that is nominally in control of our country and can put people in jail for edgy tweets and true statements. He’s also representative of the broader elite ruling class who are lapping up this portrayal of the white working class.,en,2025-04-09T19:35:15Z,2025-04-09 15:35:15,0
Wk5OxqtpBR4,Adolescence | Official Trailer | Netflix,UCWOA1ZGywLbqmigxE4Qlvuw,Netflix,2025-02-24T16:00:00Z,UgyUj2F0UnQRxBNqeQJ4AaABAg.AGZDn7U3d-SAGkqs4ksRBA,UgyUj2F0UnQRxBNqeQJ4AaABAg,@TheStraightestWhitest,UCl3gj-OS6WHT-h5CIRYcG4A,"Funny enough, it's based on the Southport stabber. And indeed, he did not look like this kid.",en,2025-04-11T00:44:26Z,2025-04-10 20:44:26,3
Wk5OxqtpBR4,Adolescence | Official Trailer | Netflix,UCWOA1ZGywLbqmigxE4Qlvuw,Netflix,2025-02-24T16:00:00Z,UgyUj2F0UnQRxBNqeQJ4AaABAg.AGZDn7U3d-SAGlGKBQhNWA,UgyUj2F0UnQRxBNqeQJ4AaABAg,@robcannon2469,UC5u0oc4-bF56N4xg31j8mXg,100% they race swapped the role,en,2025-04-11T04:35:36Z,2025-04-11 00:35:36,3
Wk5OxqtpBR4,Adolescence | Official Trailer | Netflix,UCWOA1ZGywLbqmigxE4Qlvuw,Netflix,2025-02-24T16:00:00Z,UgyUj2F0UnQRxBNqeQJ4AaABAg.AGZDn7U3d-SAGm00bdOgpY,UgyUj2F0UnQRxBNqeQJ4AaABAg,@CarterKey6,UCcfIqdZaTBu0MSJBFG3IlsA,"@TheStraightestWhitestit’s actually based on a different murder they just happen to have the same hairstyle. The other sweet little fella murdered a young, black girl because she ignored him while he was harassing her on the street.",en,2025-04-11T11:32:21Z,2025-04-11 07:32:21,0
Wk5OxqtpBR4,Adolescence | Official Trailer | Netflix,UCWOA1ZGywLbqmigxE4Qlvuw,Netflix,2025-02-24T16:00:00Z,UgyUj2F0UnQRxBNqeQJ4AaABAg.AGZDn7U3d-SAGxGw8vSyu6,UgyUj2F0UnQRxBNqeQJ4AaABAg,@casey98,UCgt9_qpDtbs9RnotHO6ZJKw,"Netflix, they character swap everything",en,2025-04-15T20:31:48Z,2025-04-15 16:31:48,1
Wk5OxqtpBR4,Adolescence | Official Trailer | Netflix,UCWOA1ZGywLbqmigxE4Qlvuw,Netflix,2025-02-24T16:00:00Z,Ugx7ZbvY_iA1am8tOfp4AaABAg.AGZCaxn-siSAGZsMk8yv7x,Ugx7ZbvY_iA1am8tOfp4AaABAg,@LittleLoz,UCNOdD4e2Sike4hSh7BZC1tg,I think you're missing the point,en,2025-04-06T09:06:37Z,2025-04-06 05:06:37,2
Wk5OxqtpBR4,Adolescence | Official Trailer | Netflix,UCWOA1ZGywLbqmigxE4Qlvuw,Netflix,2025-02-24T16:00:00Z,Ugx7ZbvY_iA1am8tOfp4AaABAg.AGZCaxn-siSAGZtRSHKzjk,Ugx7ZbvY_iA1am8tOfp4AaABAg,@vibovitold,UCQ8U8XZxJAfyFO2Dm_xaGJw,"It's a fictional story. It's not ""rewritten"".",fy,2025-04-06T09:15:59Z,2025-04-06 05:15:59,0
Wk5OxqtpBR4,Adolescence | Official Trailer | Netflix,UCWOA1ZGywLbqmigxE4Qlvuw,Netflix,2025-02-24T16:00:00Z,Ugx7ZbvY_iA1am8tOfp4AaABAg.AGZCaxn-siSAGdyrE72et-,Ugx7ZbvY_iA1am8tOfp4AaABAg,@Cobbido,UCbWfEJtr-9_O8dbIdcbX00A,@LittleLoz What's the point?,en,2025-04-08T08:39:32Z,2025-04-08 04:39:32,0
Wk5OxqtpBR4,Adolescence | Official Trailer | Netflix,UCWOA1ZGywLbqmigxE4Qlvuw,Netflix,2025-02-24T16:00:00Z,Ugx7ZbvY_iA1am8tOfp4AaABAg.AGZCaxn-siSAGdzjbILyYe,Ugx7ZbvY_iA1am8tOfp4AaABAg,@LittleLoz,UCNOdD4e2Sike4hSh7BZC1tg,@Cobbido have you actually watched it and understood the story?,en,2025-04-08T08:47:14Z,2025-04-08 04:47:14,0
Wk5OxqtpBR4,Adolescence | Official Trailer | Netflix,UCWOA1ZGywLbqmigxE4Qlvuw,Netflix,2025-02-24T16:00:00Z,Ugx7ZbvY_iA1am8tOfp4AaABAg.AGZCaxn-siSAGe0xG7yqkO,Ugx7ZbvY_iA1am8tOfp4AaABAg,@Cobbido,UCbWfEJtr-9_O8dbIdcbX00A,"@ Yes but unfortunately I didn't understand the point, what is the point?",en,2025-04-08T09:06:35Z,2025-04-08 05:06:35,0
Wk5OxqtpBR4,Adolescence | Official Trailer | Netflix,UCWOA1ZGywLbqmigxE4Qlvuw,Netflix,2025-02-24T16:00:00Z,Ugx7ZbvY_iA1am8tOfp4AaABAg.AGZCaxn-siSAGe1MPhDT6R,Ugx7ZbvY_iA1am8tOfp4AaABAg,@LittleLoz,UCNOdD4e2Sike4hSh7BZC1tg,@Cobbido  you didn't understand the story? Lol,en,2025-04-08T09:10:09Z,2025-04-08 05:10:09,0
Wk5OxqtpBR4,Adolescence | Official Trailer | Netflix,UCWOA1ZGywLbqmigxE4Qlvuw,Netflix,2025-02-24T16:00:00Z,Ugx7ZbvY_iA1am8tOfp4AaABAg.AGZCaxn-siSAGe2ewW2low,Ugx7ZbvY_iA1am8tOfp4AaABAg,@Cobbido,UCbWfEJtr-9_O8dbIdcbX00A,@ Well that's disappointing. I was hoping for an actual answer.,en,2025-04-08T09:21:33Z,2025-04-08 05:21:33,0
Wk5OxqtpBR4,Adolescence | Official Trailer | Netflix,UCWOA1ZGywLbqmigxE4Qlvuw,Netflix,2025-02-24T16:00:00Z,Ugx7ZbvY_iA1am8tOfp4AaABAg.AGZCaxn-siSAGe4ehgZZS1,Ugx7ZbvY_iA1am8tOfp4AaABAg,@LittleLoz,UCNOdD4e2Sike4hSh7BZC1tg,@Cobbido  I was hoping you'd be smart enough to understand the story,en,2025-04-08T09:39:00Z,2025-04-08 05:39:00,0
Wk5OxqtpBR4,Adolescence | Official Trailer | Netflix,UCWOA1ZGywLbqmigxE4Qlvuw,Netflix,2025-02-24T16:00:00Z,Ugx7ZbvY_iA1am8tOfp4AaABAg.AGZCaxn-siSAGe67Dd6M7D,Ugx7ZbvY_iA1am8tOfp4AaABAg,@Cobbido,UCbWfEJtr-9_O8dbIdcbX00A,"@ Starting to get the slight sense you're just being needlessly antagonistic and deflecting on purpose as a means to avoid answering my initial question, you're giving off an impression of not actually being able to do so. Feel free to prove me wrong though and enlighten me.",en,2025-04-08T09:51:46Z,2025-04-08 05:51:46,0
Wk5OxqtpBR4,Adolescence | Official Trailer | Netflix,UCWOA1ZGywLbqmigxE4Qlvuw,Netflix,2025-02-24T16:00:00Z,Ugx7ZbvY_iA1am8tOfp4AaABAg.AGZCaxn-siSAGeGFNizDhT,Ugx7ZbvY_iA1am8tOfp4AaABAg,@Mew2Winn,UCD_3JCuEwnEtdORSQqa-4uQ,It’s as based in reality as the ideology it all stems from,en,2025-04-08T11:20:16Z,2025-04-08 07:20:16,0
Wk5OxqtpBR4,Adolescence | Official Trailer | Netflix,UCWOA1ZGywLbqmigxE4Qlvuw,Netflix,2025-02-24T16:00:00Z,Ugx7ZbvY_iA1am8tOfp4AaABAg.AGZCaxn-siSAGf4txS8mL5,Ugx7ZbvY_iA1am8tOfp4AaABAg,@Alexandra-O23-d7x,UCjDgJn-Vtv-LsVf5VK_1brA,@dilxrcg by far most violent crimes are committed by non Whites,en,2025-04-08T19:00:19Z,2025-04-08 15:00:19,1
Wk5OxqtpBR4,Adolescence | Official Trailer | Netflix,UCWOA1ZGywLbqmigxE4Qlvuw,Netflix,2025-02-24T16:00:00Z,UgwOmwDZrtHQGdyyfKd4AaABAg.AGYpFaPPN_hAGZsQjiUOQg,UgwOmwDZrtHQGdyyfKd4AaABAg,@LittleLoz,UCNOdD4e2Sike4hSh7BZC1tg,You're missing the point,en,2025-04-06T09:07:09Z,2025-04-06 05:07:09,2
Wk5OxqtpBR4,Adolescence | Official Trailer | Netflix,UCWOA1ZGywLbqmigxE4Qlvuw,Netflix,2025-02-24T16:00:00Z,UgwOmwDZrtHQGdyyfKd4AaABAg.AGYpFaPPN_hAGj6BvBAzwG,UgwOmwDZrtHQGdyyfKd4AaABAg,@janak7455,UCD64foXHFjqR5GqtF_BVE4A,Just say you are racist and sad,en,2025-04-10T08:28:36Z,2025-04-10 04:28:36,0
Wk5OxqtpBR4,Adolescence | Official Trailer | Netflix,UCWOA1ZGywLbqmigxE4Qlvuw,Netflix,2025-02-24T16:00:00Z,UgwvsYhSU6q5sTvNlS94AaABAg.AGYoumMAZHtAGZsStq7IfO,UgwvsYhSU6q5sTvNlS94AaABAg,@LittleLoz,UCNOdD4e2Sike4hSh7BZC1tg,You're missing the point,en,2025-04-06T09:07:27Z,2025-04-06 05:07:27,1
Wk5OxqtpBR4,Adolescence | Official Trailer | Netflix,UCWOA1ZGywLbqmigxE4Qlvuw,Netflix,2025-02-24T16:00:00Z,UgwvsYhSU6q5sTvNlS94AaABAg.AGYoumMAZHtAGa9UPTBOJc,UgwvsYhSU6q5sTvNlS94AaABAg,@pauljames1807,UCR8qJSggeUO778Hlp9jgyWw,They didn't. Think for yourself and stop repeating propaganda,en,2025-04-06T21:04:11Z,2025-04-06 17:04:11,1
Wk5OxqtpBR4,Adolescence | Official Trailer | Netflix,UCWOA1ZGywLbqmigxE4Qlvuw,Netflix,2025-02-24T16:00:00Z,UgwvsYhSU6q5sTvNlS94AaABAg.AGYoumMAZHtAGbk19dbikA,UgwvsYhSU6q5sTvNlS94AaABAg,@vibovitold,UCQ8U8XZxJAfyFO2Dm_xaGJw,"@pauljames1807 there is no ""race swapping"" as this series is not a dramatization of any real-life crime.
it's not statistically representative, of course, but it doesn't mean there's ""race swapping"".
""Columbo"" also wasn't statistically representative, since most murders obviously aren't committed by the upper class.
it doesn't mean it's ""propaganda"".",en,2025-04-07T11:51:29Z,2025-04-07 07:51:29,0
Wk5OxqtpBR4,Adolescence | Official Trailer | Netflix,UCWOA1ZGywLbqmigxE4Qlvuw,Netflix,2025-02-24T16:00:00Z,UgwvsYhSU6q5sTvNlS94AaABAg.AGYoumMAZHtAGf52OpjYS2,UgwvsYhSU6q5sTvNlS94AaABAg,@Alexandra-O23-d7x,UCjDgJn-Vtv-LsVf5VK_1brA,"@vibovitold Although a show like this is not necessarily propaganda, THIS show definitely IS propaganda.",en,2025-04-08T19:01:36Z,2025-04-08 15:01:36,0
Wk5OxqtpBR4,Adolescence | Official Trailer | Netflix,UCWOA1ZGywLbqmigxE4Qlvuw,Netflix,2025-02-24T16:00:00Z,Ugz2xZVL1y17dDgQoh94AaABAg.AGYLSirrLIOAGYcEYJYoQc,Ugz2xZVL1y17dDgQoh94AaABAg,@pauljames1807,UCR8qJSggeUO778Hlp9jgyWw,"It wasn't based on a real story. 

Edit: Just noticed you repeated this lie under half of the comments. Are you a bot or just a sad political shill?",en,2025-04-05T21:26:26Z,2025-04-05 17:26:26,3
Wk5OxqtpBR4,Adolescence | Official Trailer | Netflix,UCWOA1ZGywLbqmigxE4Qlvuw,Netflix,2025-02-24T16:00:00Z,Ugz2xZVL1y17dDgQoh94AaABAg.AGYLSirrLIOAGYiyinn0Uv,Ugz2xZVL1y17dDgQoh94AaABAg,@JohnDoe-ez2ex,UC79t1NxU9Nr89gvzQ7evj0Q,"@pauljames1807 if you'd put down the soy latte and look up the story, you'd have found out that the story is based on a stabbing in the UK by a black immigrant.",en,2025-04-05T22:25:19Z,2025-04-05 18:25:19,3
Wk5OxqtpBR4,Adolescence | Official Trailer | Netflix,UCWOA1ZGywLbqmigxE4Qlvuw,Netflix,2025-02-24T16:00:00Z,Ugz2xZVL1y17dDgQoh94AaABAg.AGYLSirrLIOAGYkIvvBvGE,Ugz2xZVL1y17dDgQoh94AaABAg,@JohnDoe-ez2ex,UC79t1NxU9Nr89gvzQ7evj0Q,@pauljames1807 It was based on a stabbing that took place in the UK. You'd know that if you'd put the soy latte down and looked it up.,en,2025-04-05T22:36:56Z,2025-04-05 18:36:56,4
Wk5OxqtpBR4,Adolescence | Official Trailer | Netflix,UCWOA1ZGywLbqmigxE4Qlvuw,Netflix,2025-02-24T16:00:00Z,Ugz2xZVL1y17dDgQoh94AaABAg.AGYLSirrLIOAGYmuYJniJU,Ugz2xZVL1y17dDgQoh94AaABAg,@pauljames1807,UCR8qJSggeUO778Hlp9jgyWw,"@JohnDoe-ez2ex  I've literally watched the behind the scenes. It wasn't based on a specific incident. This is a lie perpetuated by propagandists. Maybe, take a break from Paul Joseph Watson and go outside.",en,2025-04-05T22:59:41Z,2025-04-05 18:59:41,1
Wk5OxqtpBR4,Adolescence | Official Trailer | Netflix,UCWOA1ZGywLbqmigxE4Qlvuw,Netflix,2025-02-24T16:00:00Z,Ugz2xZVL1y17dDgQoh94AaABAg.AGYLSirrLIOAGYtXQ8jn_o,Ugz2xZVL1y17dDgQoh94AaABAg,@pauljames1807,UCR8qJSggeUO778Hlp9jgyWw,@JohnDoe-ez2ex  I've literally watched the behind the scenes. It wasn't based on a specific incident. This is a lie perpetuated by propagandists. Maybe you should take a break from Paul Joseph Watson and go outside.,en,2025-04-05T23:57:34Z,2025-04-05 19:57:34,0
Wk5OxqtpBR4,Adolescence | Official Trailer | Netflix,UCWOA1ZGywLbqmigxE4Qlvuw,Netflix,2025-02-24T16:00:00Z,Ugz2xZVL1y17dDgQoh94AaABAg.AGYLSirrLIOAGZ1INcWB_m,Ugz2xZVL1y17dDgQoh94AaABAg,@Joemama-vo2mx,UCdo_jrXRWt4F5xo0UTMWb3A,@pauljames1807it isn’t a lie but the show portrays white men only in a bad light which people pick up on pretty easily,en,2025-04-06T01:14:09Z,2025-04-05 21:14:09,4
Wk5OxqtpBR4,Adolescence | Official Trailer | Netflix,UCWOA1ZGywLbqmigxE4Qlvuw,Netflix,2025-02-24T16:00:00Z,Ugz2xZVL1y17dDgQoh94AaABAg.AGYLSirrLIOAGZsZWNOLy7,Ugz2xZVL1y17dDgQoh94AaABAg,@LittleLoz,UCNOdD4e2Sike4hSh7BZC1tg,Wrong,NA,2025-04-06T09:08:21Z,2025-04-06 05:08:21,0
Wk5OxqtpBR4,Adolescence | Official Trailer | Netflix,UCWOA1ZGywLbqmigxE4Qlvuw,Netflix,2025-02-24T16:00:00Z,Ugz2xZVL1y17dDgQoh94AaABAg.AGYLSirrLIOAG_94fhPFwU,Ugz2xZVL1y17dDgQoh94AaABAg,@JohnDoe-ez2ex,UC79t1NxU9Nr89gvzQ7evj0Q,"@LittleLoz what? skin colour?, then yes i agree.",en,2025-04-06T11:41:26Z,2025-04-06 07:41:26,0
Wk5OxqtpBR4,Adolescence | Official Trailer | Netflix,UCWOA1ZGywLbqmigxE4Qlvuw,Netflix,2025-02-24T16:00:00Z,Ugz2xZVL1y17dDgQoh94AaABAg.AGYLSirrLIOAG_AiJJ6TtQ,Ugz2xZVL1y17dDgQoh94AaABAg,@LittleLoz,UCNOdD4e2Sike4hSh7BZC1tg,@JohnDoe-ez2ex amazing how you're so shallow you can't look past a skin colour,en,2025-04-06T11:55:43Z,2025-04-06 07:55:43,0
Wk5OxqtpBR4,Adolescence | Official Trailer | Netflix,UCWOA1ZGywLbqmigxE4Qlvuw,Netflix,2025-02-24T16:00:00Z,Ugz2xZVL1y17dDgQoh94AaABAg.AGYLSirrLIOAGa9e6DYTUp,Ugz2xZVL1y17dDgQoh94AaABAg,@pauljames1807,UCR8qJSggeUO778Hlp9jgyWw,"​@Joemama-vo2mxThe most sympathetic character in the show is his dad, played by Stephen Graham",en,2025-04-06T21:05:39Z,2025-04-06 17:05:39,1
Wk5OxqtpBR4,Adolescence | Official Trailer | Netflix,UCWOA1ZGywLbqmigxE4Qlvuw,Netflix,2025-02-24T16:00:00Z,Ugz2xZVL1y17dDgQoh94AaABAg.AGYLSirrLIOAGf5NCNpf2s,Ugz2xZVL1y17dDgQoh94AaABAg,@Alexandra-O23-d7x,UCjDgJn-Vtv-LsVf5VK_1brA,"@pauljames1807 You're being really naive if you think this was an honest story telling.  Of COURSE Netflix wants to portray White peopel are the enemy.  They ARE the enemy......of ((NETFLIX)) that is.

White people are figuring out ((what's)) going on and ((they)) don't like it, so they're trying to propagandize the masses into believing White people are the trouble in the world.

It's a lie.  ANd it's an OBVIOUS lie, if you are paying even a LITTLE attention.",en,2025-04-08T19:04:27Z,2025-04-08 15:04:27,1
Wk5OxqtpBR4,Adolescence | Official Trailer | Netflix,UCWOA1ZGywLbqmigxE4Qlvuw,Netflix,2025-02-24T16:00:00Z,UgznhyfNLZ5iBWtYTMF4AaABAg.AGYJzfkhtYqAGZschvL3EB,UgznhyfNLZ5iBWtYTMF4AaABAg,@LittleLoz,UCNOdD4e2Sike4hSh7BZC1tg,You're missing the point,en,2025-04-06T09:08:56Z,2025-04-06 05:08:56,0
