video_id,video_title,channel_id,channel_title,video_published_at,reply_id,reply_parent_comment_id,reply_author_display,reply_author_channel_id,reply_text,reply_lang,reply_published_utc,reply_published_local,reply_like_count
Wk5OxqtpBR4,Adolescence | Official Trailer | Netflix,UCWOA1ZGywLbqmigxE4Qlvuw,Netflix,2025-02-24T16:00:00Z,UgxXisGkiYneKTvfUT94AaABAg.AHGgq8RktFtAHLuz3rCJJ3,UgxXisGkiYneKTvfUT94AaABAg,@arunimashukla1786,UCB9Na8xkWpfjoWEuSAmvprA,please educate yourself better.,en,2025-04-25T19:31:29Z,2025-04-25 15:31:29,3
Wk5OxqtpBR4,Adolescence | Official Trailer | Netflix,UCWOA1ZGywLbqmigxE4Qlvuw,Netflix,2025-02-24T16:00:00Z,UgxXisGkiYneKTvfUT94AaABAg.AHGgq8RktFtAHPIG3o1qd7,UgxXisGkiYneKTvfUT94AaABAg,@sizlax,UCkJZPKeF7IodudPo6TNYFFQ,"@arunimashukla1786 That term.. So often spoken in just a singular sentence with no attached context or hint of meaning, by people that wouldn't know a real education if it snacked them upside their forehead with their mamas used tampon.. 

I did mis-speak when I stated that feminists coined the word, I meant to say that they popularized it. In any case, Andrew Tate had nothing to do with it.",en,2025-04-27T03:01:22Z,2025-04-26 23:01:22,1
Wk5OxqtpBR4,Adolescence | Official Trailer | Netflix,UCWOA1ZGywLbqmigxE4Qlvuw,Netflix,2025-02-24T16:00:00Z,UgxXisGkiYneKTvfUT94AaABAg.AHGgq8RktFtAHR_D0eGP8k,UgxXisGkiYneKTvfUT94AaABAg,@yelrahkcorb,UClJ-OxEp-TJEqbeXIbBIZVw,@sizlaxI appreciate you fighting the good fight soldier 🫡,en,2025-04-28T00:16:43Z,2025-04-27 20:16:43,0
Wk5OxqtpBR4,Adolescence | Official Trailer | Netflix,UCWOA1ZGywLbqmigxE4Qlvuw,Netflix,2025-02-24T16:00:00Z,UgxXisGkiYneKTvfUT94AaABAg.AHGgq8RktFtAHRao6mfWpw,UgxXisGkiYneKTvfUT94AaABAg,@sizlax,UCkJZPKeF7IodudPo6TNYFFQ,"@yelrahkcorb NP, long as you're not being cheeky, lol. I mean, someone needs to say something, all that's ever talked about is female oppression, and how they're victims, and somehow 'invisible' despite the fact that they're the only ones ever talked about.. 

I'm not a misogynist, and will easily call out anyone that is, objectively so. But, I really am tired of the hypocrisy and imbalance in representation.. 

According to a campaign by shoppers drug mart, women's health is ""invisible"".. well, then explain why men are the ones overwhelmingly dying sooner than women..? I mean, I'm no biologist or anything, but I'd say living longer is a pretty huge factor when it comes to health..",en,2025-04-28T00:30:40Z,2025-04-27 20:30:40,1
Wk5OxqtpBR4,Adolescence | Official Trailer | Netflix,UCWOA1ZGywLbqmigxE4Qlvuw,Netflix,2025-02-24T16:00:00Z,UgxXisGkiYneKTvfUT94AaABAg.AHGgq8RktFtAHS_AM5KgkE,UgxXisGkiYneKTvfUT94AaABAg,@sizlax,UCkJZPKeF7IodudPo6TNYFFQ,@yelrahkcorb I hate YouTube.. half my comments on average get deleted by the predatory algorithm..,en,2025-04-28T09:35:36Z,2025-04-28 05:35:36,2
Wk5OxqtpBR4,Adolescence | Official Trailer | Netflix,UCWOA1ZGywLbqmigxE4Qlvuw,Netflix,2025-02-24T16:00:00Z,UgxXisGkiYneKTvfUT94AaABAg.AHGgq8RktFtAHTMAAAxwDq,UgxXisGkiYneKTvfUT94AaABAg,@yelrahkcorb,UClJ-OxEp-TJEqbeXIbBIZVw,@sizlax Same for me I can’t even have a normal conversation with someone let alone an intellectual debate.,en,2025-04-28T16:52:29Z,2025-04-28 12:52:29,0
Wk5OxqtpBR4,Adolescence | Official Trailer | Netflix,UCWOA1ZGywLbqmigxE4Qlvuw,Netflix,2025-02-24T16:00:00Z,UgxXisGkiYneKTvfUT94AaABAg.AHGgq8RktFtAHTSsaWh5xp,UgxXisGkiYneKTvfUT94AaABAg,@sizlax,UCkJZPKeF7IodudPo6TNYFFQ,"@yelrahkcorb Yea, the censorship is real. I've had 2 full multi-paragraph messages deleted on this thread alone.. 

There's this whole mentality going around that if you can't say what you gotta say within 2 sentences, then it ain't worth saying. But I say, if you can't articulate more than two sentences, then you ain't worth listening to. At least in terms of being argumentative. 

I mean, there's zero sense in adding arbitrary conflict with zero points that anyone can learn from. It's all this right vs left, good vs bad, shit; that just dilutes all the mainstream conversation. But it's all binary nonsense that doesn't take the bigger picture into account. It only ever focuses on the symptoms but never the causes, and only ever focuses on what's popular, but rarely what is factual.",en,2025-04-28T17:51:07Z,2025-04-28 13:51:07,0
Wk5OxqtpBR4,Adolescence | Official Trailer | Netflix,UCWOA1ZGywLbqmigxE4Qlvuw,Netflix,2025-02-24T16:00:00Z,UgyTF_pRk0ViDv3LjFB4AaABAg.AHGMpiWiviTAHIpGFFLFBt,UgyTF_pRk0ViDv3LjFB4AaABAg,@Domonocdoctor,UC-kZuK_MUamHoOdDbdgkVgg,show has nothing to do with race,en,2025-04-24T14:43:49Z,2025-04-24 10:43:49,2
Wk5OxqtpBR4,Adolescence | Official Trailer | Netflix,UCWOA1ZGywLbqmigxE4Qlvuw,Netflix,2025-02-24T16:00:00Z,UgyTF_pRk0ViDv3LjFB4AaABAg.AHGMpiWiviTAHLv2y8Dy2f,UgyTF_pRk0ViDv3LjFB4AaABAg,@arunimashukla1786,UCB9Na8xkWpfjoWEuSAmvprA,why to bring race into everything? who tf cares.,en,2025-04-25T19:32:09Z,2025-04-25 15:32:09,0
Wk5OxqtpBR4,Adolescence | Official Trailer | Netflix,UCWOA1ZGywLbqmigxE4Qlvuw,Netflix,2025-02-24T16:00:00Z,Ugw0V9eKPy7CeAPqXD14AaABAg.AHG06vJSHsVAHH2zLo8p2y,Ugw0V9eKPy7CeAPqXD14AaABAg,@MattCoates-Whay,UCCRNjQktrP9e7--ReXIZ8Gw,All the work of The Left,en,2025-04-23T22:13:58Z,2025-04-23 18:13:58,3
Wk5OxqtpBR4,Adolescence | Official Trailer | Netflix,UCWOA1ZGywLbqmigxE4Qlvuw,Netflix,2025-02-24T16:00:00Z,Ugz_hc7thY4LX1mzDEd4AaABAg.AHG-V8AMMp3AHIpQXYl-qP,Ugz_hc7thY4LX1mzDEd4AaABAg,@Domonocdoctor,UC-kZuK_MUamHoOdDbdgkVgg,first of all: that's not what whitewashing is second of all: this show has nothing to do with race,en,2025-04-24T14:45:13Z,2025-04-24 10:45:13,2
Wk5OxqtpBR4,Adolescence | Official Trailer | Netflix,UCWOA1ZGywLbqmigxE4Qlvuw,Netflix,2025-02-24T16:00:00Z,Ugz_hc7thY4LX1mzDEd4AaABAg.AHG-V8AMMp3AHLvIkTcfJC,Ugz_hc7thY4LX1mzDEd4AaABAg,@arunimashukla1786,UCB9Na8xkWpfjoWEuSAmvprA,You’re so obsessed with race you missed the entire point of the show. Congrats on failing basic comprehension.,en,2025-04-25T19:34:18Z,2025-04-25 15:34:18,1
Wk5OxqtpBR4,Adolescence | Official Trailer | Netflix,UCWOA1ZGywLbqmigxE4Qlvuw,Netflix,2025-02-24T16:00:00Z,UgxJVJjYF5E8bKkbgnV4AaABAg.AHFuoa2UPMMAHIpU8T5kEm,UgxJVJjYF5E8bKkbgnV4AaABAg,@Domonocdoctor,UC-kZuK_MUamHoOdDbdgkVgg,Just a reminder that irl THIS IS A FICTIONAL STORY,en,2025-04-24T14:45:43Z,2025-04-24 10:45:43,1
Wk5OxqtpBR4,Adolescence | Official Trailer | Netflix,UCWOA1ZGywLbqmigxE4Qlvuw,Netflix,2025-02-24T16:00:00Z,UgxJVJjYF5E8bKkbgnV4AaABAg.AHFuoa2UPMMAHKPkfqoEDF,UgxJVJjYF5E8bKkbgnV4AaABAg,@osakikomatsu156,UCSeJHRFH1mbf8EpYa6u1LqQ,"@Domonocdoctor you white, why you defend them sm?😂",en,2025-04-25T05:30:39Z,2025-04-25 01:30:39,0
Wk5OxqtpBR4,Adolescence | Official Trailer | Netflix,UCWOA1ZGywLbqmigxE4Qlvuw,Netflix,2025-02-24T16:00:00Z,UgxJVJjYF5E8bKkbgnV4AaABAg.AHFuoa2UPMMAHLvJlLvANc,UgxJVJjYF5E8bKkbgnV4AaABAg,@arunimashukla1786,UCB9Na8xkWpfjoWEuSAmvprA,You’re so obsessed with race you missed the entire point of the show. Congrats on failing basic comprehension.,en,2025-04-25T19:34:27Z,2025-04-25 15:34:27,2
Wk5OxqtpBR4,Adolescence | Official Trailer | Netflix,UCWOA1ZGywLbqmigxE4Qlvuw,Netflix,2025-02-24T16:00:00Z,UgxJVJjYF5E8bKkbgnV4AaABAg.AHFuoa2UPMMAHLvNA0WSSE,UgxJVJjYF5E8bKkbgnV4AaABAg,@arunimashukla1786,UCB9Na8xkWpfjoWEuSAmvprA,@osakikomatsu156 because not everyone is a racist mf like you bitch,ny,2025-04-25T19:34:54Z,2025-04-25 15:34:54,1
Wk5OxqtpBR4,Adolescence | Official Trailer | Netflix,UCWOA1ZGywLbqmigxE4Qlvuw,Netflix,2025-02-24T16:00:00Z,UgyToAc1nwD19Ozdzxl4AaABAg.AHFSONg1UNBAHIpY3FqBHr,UgyToAc1nwD19Ozdzxl4AaABAg,@Domonocdoctor,UC-kZuK_MUamHoOdDbdgkVgg,you're racist if you think that because this show has nothing to do with race and is not based on a real story,en,2025-04-24T14:46:15Z,2025-04-24 10:46:15,1
Wk5OxqtpBR4,Adolescence | Official Trailer | Netflix,UCWOA1ZGywLbqmigxE4Qlvuw,Netflix,2025-02-24T16:00:00Z,UgyToAc1nwD19Ozdzxl4AaABAg.AHFSONg1UNBAHJKpBHUSHV,UgyToAc1nwD19Ozdzxl4AaABAg,@24SparrowJack,UCXe0r7CYHGMZc2Zvov7K4kw,@Domonocdoctor if not's racist then why not show the story to the actual accuracy ??,en,2025-04-24T19:28:20Z,2025-04-24 15:28:20,0
Wk5OxqtpBR4,Adolescence | Official Trailer | Netflix,UCWOA1ZGywLbqmigxE4Qlvuw,Netflix,2025-02-24T16:00:00Z,UgyToAc1nwD19Ozdzxl4AaABAg.AHFSONg1UNBAHJLRPsGM8y,UgyToAc1nwD19Ozdzxl4AaABAg,@24SparrowJack,UCXe0r7CYHGMZc2Zvov7K4kw,@Domonocdoctor  it is based on a true story it is based on a black kid stabbing a girl to death about 2 years ago.some racist producers at Netflix have see this case said we can turn this horrible case to make it look like a white kid has done it,en,2025-04-24T19:33:42Z,2025-04-24 15:33:42,2
Wk5OxqtpBR4,Adolescence | Official Trailer | Netflix,UCWOA1ZGywLbqmigxE4Qlvuw,Netflix,2025-02-24T16:00:00Z,UgyToAc1nwD19Ozdzxl4AaABAg.AHFSONg1UNBAHJN3VhScx0,UgyToAc1nwD19Ozdzxl4AaABAg,@Domonocdoctor,UC-kZuK_MUamHoOdDbdgkVgg,"@24SparrowJack what story its a work of fiction
the case everyone's been assosciating with the show happened after it was written and while it was filming
It has nothing to do with the show, you have been lied to by a grifter you have formed an unhealthy parasocial relationship to",en,2025-04-24T19:47:54Z,2025-04-24 15:47:54,1
Wk5OxqtpBR4,Adolescence | Official Trailer | Netflix,UCWOA1ZGywLbqmigxE4Qlvuw,Netflix,2025-02-24T16:00:00Z,UgyToAc1nwD19Ozdzxl4AaABAg.AHFSONg1UNBAHLvQ96uWXF,UgyToAc1nwD19Ozdzxl4AaABAg,@arunimashukla1786,UCB9Na8xkWpfjoWEuSAmvprA,You’re so obsessed with race you missed the entire point of the show. Congrats on failing basic comprehension.,en,2025-04-25T19:35:19Z,2025-04-25 15:35:19,1
Wk5OxqtpBR4,Adolescence | Official Trailer | Netflix,UCWOA1ZGywLbqmigxE4Qlvuw,Netflix,2025-02-24T16:00:00Z,UgzPK4j_RZoDJ75u2ip4AaABAg.AHFDcQa6bouAHIpi94Hj9v,UgzPK4j_RZoDJ75u2ip4AaABAg,@Domonocdoctor,UC-kZuK_MUamHoOdDbdgkVgg,literally what grifter did you hear this from hes british did you watch the show,en,2025-04-24T14:47:46Z,2025-04-24 10:47:46,1
Wk5OxqtpBR4,Adolescence | Official Trailer | Netflix,UCWOA1ZGywLbqmigxE4Qlvuw,Netflix,2025-02-24T16:00:00Z,Ugwlq7xDT0MoXpseCpR4AaABAg.AHCfWU2NUDCAHG-x5YBa1p,Ugwlq7xDT0MoXpseCpR4AaABAg,@peloquin5652,UCPn6_h3fmfRNQMH6NjlOgzA,because you like lies? and propaganda? or why?,en,2025-04-23T12:28:12Z,2025-04-23 08:28:12,3
Wk5OxqtpBR4,Adolescence | Official Trailer | Netflix,UCWOA1ZGywLbqmigxE4Qlvuw,Netflix,2025-02-24T16:00:00Z,Ugwlq7xDT0MoXpseCpR4AaABAg.AHCfWU2NUDCAHG77o6ffR7,Ugwlq7xDT0MoXpseCpR4AaABAg,@haticekaplan1403,UCmkP0R-2OitrLIbbx9D1oPA,@peloquin5652   what do you mean,pt,2025-04-23T13:30:58Z,2025-04-23 09:30:58,0
Wk5OxqtpBR4,Adolescence | Official Trailer | Netflix,UCWOA1ZGywLbqmigxE4Qlvuw,Netflix,2025-02-24T16:00:00Z,Ugwlq7xDT0MoXpseCpR4AaABAg.AHCfWU2NUDCAHIOq7_KNu_,Ugwlq7xDT0MoXpseCpR4AaABAg,@Rya-b4i,UCBwRjNAH63XC_drtQwZGq0Q,​@haticekaplan1403 UK stabbings aren't up because of white teenage virgins who listen to andrew tate lol its straight up because of immigrants coming in and not giving a crap about the countries laws.,en,2025-04-24T10:44:11Z,2025-04-24 06:44:11,2
Wk5OxqtpBR4,Adolescence | Official Trailer | Netflix,UCWOA1ZGywLbqmigxE4Qlvuw,Netflix,2025-02-24T16:00:00Z,UgwqnQxEIfN42ksoZtR4AaABAg.AHB8W3hoRAIAHRn1aBMSME,UgwqnQxEIfN42ksoZtR4AaABAg,@johnsergei,UCCVx1-lQS0Xb9AwNZ_1THyg,It's just male bashing crap.,NA,2025-04-28T02:17:30Z,2025-04-27 22:17:30,3
Wk5OxqtpBR4,Adolescence | Official Trailer | Netflix,UCWOA1ZGywLbqmigxE4Qlvuw,Netflix,2025-02-24T16:00:00Z,UgwqnQxEIfN42ksoZtR4AaABAg.AHB8W3hoRAIAHamQUl9t7R,UgwqnQxEIfN42ksoZtR4AaABAg,@ask343,UCNboPg9O5qy3v2ORnFP3W8g,"I agree with you, I thought it was mid
the reply above me is wrong though",en,2025-05-01T23:24:34Z,2025-05-01 19:24:34,2
Wk5OxqtpBR4,Adolescence | Official Trailer | Netflix,UCWOA1ZGywLbqmigxE4Qlvuw,Netflix,2025-02-24T16:00:00Z,Ugy0RJA3UBP6s2OlApl4AaABAg.AHAs8LK5cg4AHIpqvkk5kC,Ugy0RJA3UBP6s2OlApl4AaABAg,@Domonocdoctor,UC-kZuK_MUamHoOdDbdgkVgg,"That was like the first thing he said to him ""you are under arrest for suspicion of murder""",en,2025-04-24T14:48:58Z,2025-04-24 10:48:58,1
Wk5OxqtpBR4,Adolescence | Official Trailer | Netflix,UCWOA1ZGywLbqmigxE4Qlvuw,Netflix,2025-02-24T16:00:00Z,Ugy0RJA3UBP6s2OlApl4AaABAg.AHAs8LK5cg4AHIqrpSjn26,Ugy0RJA3UBP6s2OlApl4AaABAg,@NoOne-qx4xv,UCZ-f3K-gveHQkd5lnBNPB5g,"@ Yes, indeed.",xh,2025-04-24T14:57:49Z,2025-04-24 10:57:49,0
Wk5OxqtpBR4,Adolescence | Official Trailer | Netflix,UCWOA1ZGywLbqmigxE4Qlvuw,Netflix,2025-02-24T16:00:00Z,UgxGfiydySmcEUhB5uF4AaABAg.AHAS1Gq-TwGAHH3dIlqBwj,UgxGfiydySmcEUhB5uF4AaABAg,@MattCoates-Whay,UCCRNjQktrP9e7--ReXIZ8Gw,Do they all get really light sentences after being found guilty and do Labour help to uncover the whole thing?,en,2025-04-23T22:19:41Z,2025-04-23 18:19:41,0
Wk5OxqtpBR4,Adolescence | Official Trailer | Netflix,UCWOA1ZGywLbqmigxE4Qlvuw,Netflix,2025-02-24T16:00:00Z,UgxGfiydySmcEUhB5uF4AaABAg.AHAS1Gq-TwGAKoXDgWlEgP,UgxGfiydySmcEUhB5uF4AaABAg,@Hazaroth,UC_dff630CBm30Wguj7lXQlA,That'd never get made in a gynocentric society,en,2025-07-20T21:06:34Z,2025-07-20 17:06:34,0
Wk5OxqtpBR4,Adolescence | Official Trailer | Netflix,UCWOA1ZGywLbqmigxE4Qlvuw,Netflix,2025-02-24T16:00:00Z,Ugw1_ODRR2JoxRlQJht4AaABAg.AHAGAxLWvilAHC7HPFIRDQ,Ugw1_ODRR2JoxRlQJht4AaABAg,@4422-w6q,UC8N621QJJwtNitkodnI0uQw,Can you post the list?,en,2025-04-22T00:15:19Z,2025-04-21 20:15:19,0
Wk5OxqtpBR4,Adolescence | Official Trailer | Netflix,UCWOA1ZGywLbqmigxE4Qlvuw,Netflix,2025-02-24T16:00:00Z,Ugx0fil4CZNzCmg_MGt4AaABAg.AHA7f5H3QZ3AHAecJD93LI,Ugx0fil4CZNzCmg_MGt4AaABAg,@ProfessorChocolateCake,UCrFvVXpT32LwhYe59rgItEA,"Just say ""Per capita"" it's much easier and gets straight to the point.",en,2025-04-21T10:36:55Z,2025-04-21 06:36:55,1
Wk5OxqtpBR4,Adolescence | Official Trailer | Netflix,UCWOA1ZGywLbqmigxE4Qlvuw,Netflix,2025-02-24T16:00:00Z,Ugx0fil4CZNzCmg_MGt4AaABAg.AHA7f5H3QZ3AHAfuLCp02h,Ugx0fil4CZNzCmg_MGt4AaABAg,@SonBarbock,UCuKihhW3sfXNWUNEwbVKPug,@ProfessorChocolateCake  Ya but some people don't understand that sadly lol,en,2025-04-21T10:48:07Z,2025-04-21 06:48:07,0
Wk5OxqtpBR4,Adolescence | Official Trailer | Netflix,UCWOA1ZGywLbqmigxE4Qlvuw,Netflix,2025-02-24T16:00:00Z,Ugx0fil4CZNzCmg_MGt4AaABAg.AHA7f5H3QZ3AHIpwoOPeRA,Ugx0fil4CZNzCmg_MGt4AaABAg,@Domonocdoctor,UC-kZuK_MUamHoOdDbdgkVgg,this show has nothing to do with race,en,2025-04-24T14:49:46Z,2025-04-24 10:49:46,1
Wk5OxqtpBR4,Adolescence | Official Trailer | Netflix,UCWOA1ZGywLbqmigxE4Qlvuw,Netflix,2025-02-24T16:00:00Z,Ugx0fil4CZNzCmg_MGt4AaABAg.AHA7f5H3QZ3AHJ63RUQyv_,Ugx0fil4CZNzCmg_MGt4AaABAg,@ProfessorChocolateCake,UCrFvVXpT32LwhYe59rgItEA,@ That was just a desperate cop-out after the backlash of the mainstream media covering up for Axel Rubik's Cube Banana.,en,2025-04-24T17:19:21Z,2025-04-24 13:19:21,0
Wk5OxqtpBR4,Adolescence | Official Trailer | Netflix,UCWOA1ZGywLbqmigxE4Qlvuw,Netflix,2025-02-24T16:00:00Z,Ugx0fil4CZNzCmg_MGt4AaABAg.AHA7f5H3QZ3AHJNevoY-r4,Ugx0fil4CZNzCmg_MGt4AaABAg,@Domonocdoctor,UC-kZuK_MUamHoOdDbdgkVgg,"@ProfessorChocolateCake this show never mentions race and is not based on any specific case, you have been lied to if you think otherwise",en,2025-04-24T19:53:09Z,2025-04-24 15:53:09,1
Wk5OxqtpBR4,Adolescence | Official Trailer | Netflix,UCWOA1ZGywLbqmigxE4Qlvuw,Netflix,2025-02-24T16:00:00Z,Ugx0fil4CZNzCmg_MGt4AaABAg.AHA7f5H3QZ3AHJPoo-93Ht,Ugx0fil4CZNzCmg_MGt4AaABAg,@ProfessorChocolateCake,UCrFvVXpT32LwhYe59rgItEA,"@ If that wasn't the intention behind making it then why is the currently sitting prime minister referring to it as ""a documentary"" despite its own creators admitting it's a fiction and why are they making it a compulsory viewing in schools in England and the Netherlands? Have you ever heard of a subtext?",en,2025-04-24T20:11:59Z,2025-04-24 16:11:59,1
Wk5OxqtpBR4,Adolescence | Official Trailer | Netflix,UCWOA1ZGywLbqmigxE4Qlvuw,Netflix,2025-02-24T16:00:00Z,Ugx0fil4CZNzCmg_MGt4AaABAg.AHA7f5H3QZ3AHJU0wmiSm5,Ugx0fil4CZNzCmg_MGt4AaABAg,@Domonocdoctor,UC-kZuK_MUamHoOdDbdgkVgg,"​@ProfessorChocolateCake did you watch the show? it's very clearly a study of how young men fall down harmful rabbit-holes on the internet, which leads to a mysogynistic worldview and violent tendencies. Nothing to do with race at all.
And with kier starmer calling it a documentary, it is a fictionalized case study on something that happens A LOT EVERYWHERE and the grifters people like you listen to took the most recent case of it happening with a black kid and said the show ""based it on him"" despite the show having been fully written before the tragedy.
it's portraying a real issue without it being based on a specific real event. 
Also even if Kier Starmer said that ""this show is a case study of this one kid who committed the crime while the show was filming"" Kier Starmer did not write the show, and the creators themselves have called it fiction from the beginning. 
Media literacy: 0",en,2025-04-24T20:48:44Z,2025-04-24 16:48:44,2
Wk5OxqtpBR4,Adolescence | Official Trailer | Netflix,UCWOA1ZGywLbqmigxE4Qlvuw,Netflix,2025-02-24T16:00:00Z,UgwfOT-eqKtQeOsBQ2l4AaABAg.AH9w6JT2b5vAHGtaTy-PTj,UgwfOT-eqKtQeOsBQ2l4AaABAg,@theceoofeggmansempire5214,UCSBwcmo6IcZfkvo01fSXdqg,"Give me a definition of woke




It seems like an unofficial synonym to word ""lame""",en,2025-04-23T20:43:11Z,2025-04-23 16:43:11,1
Wk5OxqtpBR4,Adolescence | Official Trailer | Netflix,UCWOA1ZGywLbqmigxE4Qlvuw,Netflix,2025-02-24T16:00:00Z,UgwfOT-eqKtQeOsBQ2l4AaABAg.AH9w6JT2b5vAHR_pZ5lbQG,UgwfOT-eqKtQeOsBQ2l4AaABAg,@yelrahkcorb,UClJ-OxEp-TJEqbeXIbBIZVw,@theceoofeggmansempire5214 Well thats only part of the definition.,en,2025-04-28T00:22:07Z,2025-04-27 20:22:07,1
Wk5OxqtpBR4,Adolescence | Official Trailer | Netflix,UCWOA1ZGywLbqmigxE4Qlvuw,Netflix,2025-02-24T16:00:00Z,UgwfOT-eqKtQeOsBQ2l4AaABAg.AH9w6JT2b5vAHRamPZ-pSc,UgwfOT-eqKtQeOsBQ2l4AaABAg,@theceoofeggmansempire5214,UCSBwcmo6IcZfkvo01fSXdqg,@yelrahkcorb Clarify,NA,2025-04-28T00:30:26Z,2025-04-27 20:30:26,1
Wk5OxqtpBR4,Adolescence | Official Trailer | Netflix,UCWOA1ZGywLbqmigxE4Qlvuw,Netflix,2025-02-24T16:00:00Z,UgwbTOlrM0PN27uekqJ4AaABAg.AH9jARreeC5AHIpyhCAm2L,UgwbTOlrM0PN27uekqJ4AaABAg,@Domonocdoctor,UC-kZuK_MUamHoOdDbdgkVgg,you're racist,en,2025-04-24T14:50:01Z,2025-04-24 10:50:01,0
Wk5OxqtpBR4,Adolescence | Official Trailer | Netflix,UCWOA1ZGywLbqmigxE4Qlvuw,Netflix,2025-02-24T16:00:00Z,UgwbTOlrM0PN27uekqJ4AaABAg.AH9jARreeC5AHR_xVLssGZ,UgwbTOlrM0PN27uekqJ4AaABAg,@yelrahkcorb,UClJ-OxEp-TJEqbeXIbBIZVw,@DomonocdoctorWhat evidence do you have of that claim?,en,2025-04-28T00:23:12Z,2025-04-27 20:23:12,1
Wk5OxqtpBR4,Adolescence | Official Trailer | Netflix,UCWOA1ZGywLbqmigxE4Qlvuw,Netflix,2025-02-24T16:00:00Z,UgwbTOlrM0PN27uekqJ4AaABAg.AH9jARreeC5AHSagkpmI9e,UgwbTOlrM0PN27uekqJ4AaABAg,@Domonocdoctor,UC-kZuK_MUamHoOdDbdgkVgg,"@yelrahkcorb hes making a show about gender roles in society and how that leads to teenage isolation and extremism into a race issue simply because the main character of the show commited a crime and was white
If you can't accept that white people can commit crimes, seems pretty racist to me",en,2025-04-28T09:48:54Z,2025-04-28 05:48:54,0
Wk5OxqtpBR4,Adolescence | Official Trailer | Netflix,UCWOA1ZGywLbqmigxE4Qlvuw,Netflix,2025-02-24T16:00:00Z,Ugw5CtLIfZvvp6ww6q14AaABAg.AH7PgUFB92eAH9IvXjWcRx,Ugw5CtLIfZvvp6ww6q14AaABAg,@connor.bown23,UCl-XmVlhDPLCFouDa7rrMow,That's just blatant racism. Tell me what part it says this is based off of the Southport killer. Not to mention the fact that the killings happened AFTER this script had been written. Believe anything you uneducated racists.,en,2025-04-20T21:59:19Z,2025-04-20 17:59:19,1
Wk5OxqtpBR4,Adolescence | Official Trailer | Netflix,UCWOA1ZGywLbqmigxE4Qlvuw,Netflix,2025-02-24T16:00:00Z,Ugw5CtLIfZvvp6ww6q14AaABAg.AH7PgUFB92eAHA8u-XUAPZ,Ugw5CtLIfZvvp6ww6q14AaABAg,@SonBarbock,UCuKihhW3sfXNWUNEwbVKPug,"​@connor.bown23the co-creator of the show Jack Thorne denied any connection to an actual case but here are some actual statistics.

82% Vs 18%

82% of people in England and Wales are white, and 18% belong to a black, Asian, mixed or other ethnic group (2021 Census data).

Offenses recorded as homicide by a sharp instrument April 2023 to March 2024:

Whites in the UK: 133 total incidents

Black, Asian, mixed, or other ethnic group: 129 total incidents

262 total number of knife incidents.

Black, Asian, mixed, or other ethnic groups make up for 49.2% of knife crime despite being 18% of the England and Wales population.

Source: ONS Centre for Crime and Justice, Office for National Statistics
Ethnicity facts and figures gov UK",en,2025-04-21T05:50:58Z,2025-04-21 01:50:58,0
Wk5OxqtpBR4,Adolescence | Official Trailer | Netflix,UCWOA1ZGywLbqmigxE4Qlvuw,Netflix,2025-02-24T16:00:00Z,Ugw5CtLIfZvvp6ww6q14AaABAg.AH7PgUFB92eAHIq-L24iZs,Ugw5CtLIfZvvp6ww6q14AaABAg,@Domonocdoctor,UC-kZuK_MUamHoOdDbdgkVgg,you're actually racist holy shit,en,2025-04-24T14:50:15Z,2025-04-24 10:50:15,0
Wk5OxqtpBR4,Adolescence | Official Trailer | Netflix,UCWOA1ZGywLbqmigxE4Qlvuw,Netflix,2025-02-24T16:00:00Z,UgwRONwsEJu-7KYthy94AaABAg.AH7K7Nb-nbdAH82CEooBID,UgwRONwsEJu-7KYthy94AaABAg,@scarecroww7,UCEcs8n68inqZMwym7-_Jq5A,get help,nl,2025-04-20T10:13:57Z,2025-04-20 06:13:57,1
Wk5OxqtpBR4,Adolescence | Official Trailer | Netflix,UCWOA1ZGywLbqmigxE4Qlvuw,Netflix,2025-02-24T16:00:00Z,Ugw4e2dCDiGo_w8JHJR4AaABAg.AH61ID6KcK_AH6Fkhs2Ww3,Ugw4e2dCDiGo_w8JHJR4AaABAg,@Domonocdoctor,UC-kZuK_MUamHoOdDbdgkVgg,"that case happened after the show was written and while it was being filmed, you have fallen for a hoax and really need to get out of your narrow mindset",en,2025-04-19T17:33:55Z,2025-04-19 13:33:55,1
Wk5OxqtpBR4,Adolescence | Official Trailer | Netflix,UCWOA1ZGywLbqmigxE4Qlvuw,Netflix,2025-02-24T16:00:00Z,Ugw4e2dCDiGo_w8JHJR4AaABAg.AH61ID6KcK_AHIT082UJyH,Ugw4e2dCDiGo_w8JHJR4AaABAg,@Rya-b4i,UCBwRjNAH63XC_drtQwZGq0Q,​@Domonocdoctor You can argue with statistics and call them fake all you want but the truth is its not 13 year old white kids who listen to andrew tate who are carrying out these crimes.,en,2025-04-24T11:20:38Z,2025-04-24 07:20:38,0
Wk5OxqtpBR4,Adolescence | Official Trailer | Netflix,UCWOA1ZGywLbqmigxE4Qlvuw,Netflix,2025-02-24T16:00:00Z,Ugw4e2dCDiGo_w8JHJR4AaABAg.AH61ID6KcK_AHIq1T9XlKU,Ugw4e2dCDiGo_w8JHJR4AaABAg,@Domonocdoctor,UC-kZuK_MUamHoOdDbdgkVgg,no it wasn't you're just racist,en,2025-04-24T14:50:32Z,2025-04-24 10:50:32,1
Wk5OxqtpBR4,Adolescence | Official Trailer | Netflix,UCWOA1ZGywLbqmigxE4Qlvuw,Netflix,2025-02-24T16:00:00Z,UgxwhcoOx2vGdtr0IH54AaABAg.AH5CvoSsgbuAH5QnaKsUOP,UgxwhcoOx2vGdtr0IH54AaABAg,@Azobichamkartofilaaaaa,UCkgmlyTnU6tj0i-XsdZPpCA,"There's a problem. It turns out white incels have it ""in their culture"" what the crime doing non white people have.
And why on Earth did Tate pretend to take up Islam?",en,2025-04-19T09:51:11Z,2025-04-19 05:51:11,0
Wk5OxqtpBR4,Adolescence | Official Trailer | Netflix,UCWOA1ZGywLbqmigxE4Qlvuw,Netflix,2025-02-24T16:00:00Z,UgxwhcoOx2vGdtr0IH54AaABAg.AH5CvoSsgbuAH6G60IM3M7,UgxwhcoOx2vGdtr0IH54AaABAg,@Domonocdoctor,UC-kZuK_MUamHoOdDbdgkVgg,"the right wing leads young boys to extremism to the point where killing yourself/someone else is so common, it's a meme. ""the blackpill""",en,2025-04-19T17:36:57Z,2025-04-19 13:36:57,1
Wk5OxqtpBR4,Adolescence | Official Trailer | Netflix,UCWOA1ZGywLbqmigxE4Qlvuw,Netflix,2025-02-24T16:00:00Z,UgxwhcoOx2vGdtr0IH54AaABAg.AH5CvoSsgbuAH9JEPhxvtg,UgxwhcoOx2vGdtr0IH54AaABAg,@connor.bown23,UCl-XmVlhDPLCFouDa7rrMow,Your username says it all pal.,en,2025-04-20T22:02:02Z,2025-04-20 18:02:02,2
Wk5OxqtpBR4,Adolescence | Official Trailer | Netflix,UCWOA1ZGywLbqmigxE4Qlvuw,Netflix,2025-02-24T16:00:00Z,UgxwhcoOx2vGdtr0IH54AaABAg.AH5CvoSsgbuAH9qhKEzW-p,UgxwhcoOx2vGdtr0IH54AaABAg,@GiantfuckingRetard,UCa9WnMUDQf-hX7HmXif5drg,@connor.bown23 Comedy is on my side all you can do is seethe!,en,2025-04-21T03:03:13Z,2025-04-20 23:03:13,0
Wk5OxqtpBR4,Adolescence | Official Trailer | Netflix,UCWOA1ZGywLbqmigxE4Qlvuw,Netflix,2025-02-24T16:00:00Z,UgxwhcoOx2vGdtr0IH54AaABAg.AH5CvoSsgbuAHA9J0V8vxL,UgxwhcoOx2vGdtr0IH54AaABAg,@SonBarbock,UCuKihhW3sfXNWUNEwbVKPug,"Statistics agree with you bro. The real incels in these comments are the ones that can't seem to wrap their head around, ""per capita"" lol.

82% Vs 18%


82% of people in England and Wales are white, and 18% belong to a black, Asian, mixed or other ethnic group (2021 Census data).

Offenses recorded as homicide by a sharp instrument April 2023 to March 2024:

Whites in the UK: 133 total incidents

Black, Asian, mixed, or other ethnic group: 129 total incidents

262 total number of knife incidents.

Black, Asian, mixed, or other ethnic groups make up for 49.2% of knife crime despite being 18% of the England and Wales population.

Source: ONS Centre for Crime and Justice, Office for National Statistics
Ethnicity facts and figures gov UK",en,2025-04-21T05:54:32Z,2025-04-21 01:54:32,1
Wk5OxqtpBR4,Adolescence | Official Trailer | Netflix,UCWOA1ZGywLbqmigxE4Qlvuw,Netflix,2025-02-24T16:00:00Z,UgxwhcoOx2vGdtr0IH54AaABAg.AH5CvoSsgbuAHA9OcLzM5T,UgxwhcoOx2vGdtr0IH54AaABAg,@SonBarbock,UCuKihhW3sfXNWUNEwbVKPug,​@Domonocdoctor😆prove it.,sr,2025-04-21T05:55:18Z,2025-04-21 01:55:18,0
Wk5OxqtpBR4,Adolescence | Official Trailer | Netflix,UCWOA1ZGywLbqmigxE4Qlvuw,Netflix,2025-02-24T16:00:00Z,UgxwhcoOx2vGdtr0IH54AaABAg.AH5CvoSsgbuAHA9wrIaFjr,UgxwhcoOx2vGdtr0IH54AaABAg,@GiantfuckingRetard,UCa9WnMUDQf-hX7HmXif5drg,@connor.bown23 you are an actual bot I just realized lmao who would have thought,en,2025-04-21T06:00:06Z,2025-04-21 02:00:06,0
Wk5OxqtpBR4,Adolescence | Official Trailer | Netflix,UCWOA1ZGywLbqmigxE4Qlvuw,Netflix,2025-02-24T16:00:00Z,UgxwhcoOx2vGdtr0IH54AaABAg.AH5CvoSsgbuAHRbS9HOQF-,UgxwhcoOx2vGdtr0IH54AaABAg,@yelrahkcorb,UClJ-OxEp-TJEqbeXIbBIZVw,⁠​⁠​⁠@Azobichamkartofilaaaaa What does Tate converting to that have anything to do with anything? As if that would make a difference. I implore you to do your research if you truly believe that.,en,2025-04-28T00:36:16Z,2025-04-27 20:36:16,0
