video_id,comment_id,reply_id,reply_content,author,published_at,like_count
X1M9NUrZjeo,UgxrCElpF17ATQY_fOZ4AaABAg,UgxrCElpF17ATQY_fOZ4AaABAg.ARGuGLL3pYeARHBcMlG-91,😂😂😂 you..!!!,@pangeran_alfan16,2025-12-28T12:43:24Z,0
X1M9NUrZjeo,UgwJfc7enGsvrZ9mAtd4AaABAg,UgwJfc7enGsvrZ9mAtd4AaABAg.AREp_inWLETARFVLgSGxTy,Shut up 😡,@SandraVamosova,2025-12-27T20:57:16Z,0
X1M9NUrZjeo,UgzbAquToMCtVGn7h-R4AaABAg,UgzbAquToMCtVGn7h-R4AaABAg.AREUibZjZRYAREVMW_b1W-,Still a win,@cricket3006,2025-12-27T11:38:09Z,0
X1M9NUrZjeo,UgzbAquToMCtVGn7h-R4AaABAg,UgzbAquToMCtVGn7h-R4AaABAg.AREUibZjZRYAREXH6DzNHM,@cricket3006yeah but if you like mediocre players then u will be fine do u think for a second this side can play against top teams & win then sorry mate u & fans like u are delusional living on hope sorry mate god bless & have a great 2026🙏💪🏿,@ChicoFrancis-be5fh,2025-12-27T11:54:53Z,1
X1M9NUrZjeo,UgzbAquToMCtVGn7h-R4AaABAg,UgzbAquToMCtVGn7h-R4AaABAg.AREUibZjZRYAREsSbYyojo,​@ChicoFrancis-be5fhstill 3 points but you have to care about your team rather than my team it's my duty to criticize and praise about him instead look at your team placing on 11 position and talking about others,@cricket3006,2025-12-27T15:08:42Z,0
X1M9NUrZjeo,UgwcsJRlDIEWUIIgSZZ4AaABAg,UgwcsJRlDIEWUIIgSZZ4AaABAg.AREFDDLElNNAREOdONQ4vD,"You know nothing about teams in the league, imagine you labelling united a weak home team on boxing day, if not for the missed chances united would have scored 3 goals against  a club who think they're  part of the big clubs, in my area, in my continent there's no single person that is a fan of newcastle that's how small we see them as a club😂😂😂",@ogee2863,2025-12-27T10:39:25Z,1
X1M9NUrZjeo,UgwcsJRlDIEWUIIgSZZ4AaABAg,UgwcsJRlDIEWUIIgSZZ4AaABAg.AREFDDLElNNAREePwI-2kC,"@o@ogee2863 You’ve hit the nail on the head, and it only confirms what I’ve been saying. If Newcastle are supposed to be a “small club”, then it’s frankly embarrassing for a Man Utd fan to watch their team at Old Trafford on Boxing Day dig in for an entire second half and live off counter-attacks.

Newcastle weren’t even pressing hard - Man Utd just dropped deep and stopped playing. If clubs like PSG, Barca, City, Real or Bayern did that at home, they’d be booed off. It says everything about where Man Utd are in the pecking order these days: miles off the top. And yes, it’s embarrassing.

I’ll bet you won’t see another Newcastle away game this season where they have 75% possession for a full half and completely run the show. I’d even argue Everton, despite losing 4–1, looked better than the Man Utd side we saw yesterday. This was a game Newcastle had to win - chances don’t come much bigger than this.",@MadRunner-n9d,2025-12-27T13:06:00Z,0
X1M9NUrZjeo,UgwcsJRlDIEWUIIgSZZ4AaABAg,UgwcsJRlDIEWUIIgSZZ4AaABAg.AREFDDLElNNARHUKBwN7Ao,"​@MadRunner-n9d keep deceiving your self, united lost three important players to afcon and still had some of their starting defenders and captain on injury, they new their situation and how to cope with it some time we have to rearrange our philosophy to navigate, same newcaster that got points against city and chelsea, united showed they're more mature by allowing castle to do the play while they do the scoring thats while they're bigger club, you don't fight your opponent with blows if your hands are down, you just have to wait patiently and make that big leg kick, strategy is not weakness but smartness",@ogee2863,2025-12-28T15:26:49Z,0
X1M9NUrZjeo,UgwcsJRlDIEWUIIgSZZ4AaABAg,UgwcsJRlDIEWUIIgSZZ4AaABAg.AREFDDLElNNARHqfwDiN_V,"@ogee2863 Man Utd have become a thoroughly mediocre side. We saw it ourselves last season when Newcastle humiliated them on two occasions. And the fear of a repeat was plain to see in their extremely destructive approach to the second half on Friday. It’s hard to take you seriously when you’ve clearly only watched the highlights and haven’t experienced them sitting passively and waiting deep in their own half for an entire half. That some Man Utd fans accept this because a few players were missing (due to injuries and AFCON - yet still fewer in total than Newcastle have on their injury list) only shows how far the club has sunk over recent seasons.

It must really hurt you painfully to watch Newcastle, with many injuries, grind through the first half of the season playing roughly every 3-4 days because of the League Cup and Champions League matches - matches Man Utd can only look at and dream about - while at the same time having completely fresh legs for every weekend game. That’s the only reason Man Utd are currently just about hanging on in the top half and a solid four points away from dropping out of the top 10.

If you ask the average Newcastle fan, I’m pretty sure Man Utd aren’t a club they have particularly impressive thoughts about. The focus is aimed forward toward much bigger clubs that Newcastle want to compare themselves with in the future.",@MadRunner-n9d,2025-12-28T18:50:54Z,0
X1M9NUrZjeo,UgzGaH-_oijHG15I2ix4AaABAg,UgzGaH-_oijHG15I2ix4AaABAg.ARE5kidd319AREFsVEgQwf,"Wouldn't brag to much  , we dominated the game , just couldn't finish . Your team are crap.",@bobatwell7505,2025-12-27T09:22:50Z,0
X1M9NUrZjeo,UgzGaH-_oijHG15I2ix4AaABAg,UgzGaH-_oijHG15I2ix4AaABAg.ARE5kidd319AREI8wmolno,​@bobatwell7505 you keep your great performance and we will keep our 3 points with us 😂😂,@AdiBodade,2025-12-27T09:42:42Z,1
X1M9NUrZjeo,UgzGaH-_oijHG15I2ix4AaABAg,UgzGaH-_oijHG15I2ix4AaABAg.ARE5kidd319AREK8_lPYEF,​@AdiBodadeGuessing you don't live in Manchester or even the UK ?,@bobatwell7505,2025-12-27T10:00:07Z,0
X1M9NUrZjeo,UgzGaH-_oijHG15I2ix4AaABAg,UgzGaH-_oijHG15I2ix4AaABAg.ARE5kidd319AREKTd79WQY,​@bobatwell7505 man utd fans are everywhere buddy 😂😂,@AdiBodade,2025-12-27T10:03:00Z,1
X1M9NUrZjeo,UgzGaH-_oijHG15I2ix4AaABAg,UgzGaH-_oijHG15I2ix4AaABAg.ARE5kidd319ARELLZ_MU4s,​@AdiBodade Yeah therefore your not a real Man Utd  fan .😂😂😂,@bobatwell7505,2025-12-27T10:10:38Z,0
X1M9NUrZjeo,UgzDynpbXK6lWUraNFR4AaABAg,UgzDynpbXK6lWUraNFR4AaABAg.ARDzzifZPycARE446RXe3w,Weird st James park only holds 53000,@kennyw218,2025-12-27T07:39:43Z,0
X1M9NUrZjeo,UgxmdFbJbUtqUW16tTR4AaABAg,UgxmdFbJbUtqUW16tTR4AaABAg.ARDwpuhUMYFARE2e_drcgT,They are even missing 6 of their main players....they are just some kind of beasts,@natedaisy7752,2025-12-27T07:27:21Z,20
X1M9NUrZjeo,UgxmdFbJbUtqUW16tTR4AaABAg,UgxmdFbJbUtqUW16tTR4AaABAg.ARDwpuhUMYFARE4xuu1wSF,6 players Re not there from man United..,@Ryan-w9q4s,2025-12-27T07:47:27Z,9
X1M9NUrZjeo,UgxmdFbJbUtqUW16tTR4AaABAg,UgxmdFbJbUtqUW16tTR4AaABAg.ARDwpuhUMYFARE5FryRcEj,Beaten by united b team,@Thadaladi__07,2025-12-27T07:50:03Z,24
X1M9NUrZjeo,UgxmdFbJbUtqUW16tTR4AaABAg,UgxmdFbJbUtqUW16tTR4AaABAg.ARDwpuhUMYFARE6tuWCAS-,20 league titles,@enzymegamer7,2025-12-27T08:04:23Z,10
X1M9NUrZjeo,UgxmdFbJbUtqUW16tTR4AaABAg,UgxmdFbJbUtqUW16tTR4AaABAg.ARDwpuhUMYFAREBJHUWDiT,There is no Shame in losing  to the Real United 😂,@fazalwaqas98,2025-12-27T08:42:57Z,8
X1M9NUrZjeo,Ugw_I-00ppIyaTwT1PB4AaABAg,Ugw_I-00ppIyaTwT1PB4AaABAg.ARDvkFKvpVJAREGb1BzVSL,Did you watch the summer antics? What a clueless post.,@j.j.911,2025-12-27T09:29:12Z,0
X1M9NUrZjeo,Ugw_I-00ppIyaTwT1PB4AaABAg,Ugw_I-00ppIyaTwT1PB4AaABAg.ARDvkFKvpVJAREGj9wOw04,Got to move on,@jackbadabing5609,2025-12-27T09:30:18Z,0
X1M9NUrZjeo,Ugw_I-00ppIyaTwT1PB4AaABAg,Ugw_I-00ppIyaTwT1PB4AaABAg.ARDvkFKvpVJARFFuI6ll1z,"@j.j.911 Where are Newcastle on the table currently? Reality can be a hard pill to swallow, especially if you're clueless. But that's OK, because there's plenty of clueless people in the UK, just look at your immigration policy.",,2025-12-27T18:42:19Z,0
X1M9NUrZjeo,Ugw_I-00ppIyaTwT1PB4AaABAg,Ugw_I-00ppIyaTwT1PB4AaABAg.ARDvkFKvpVJARFTPDoSJRV,"@jackbadabing5609 Newcastle are chokers, they always have been. They suffer from Imposter Syndrome.",,2025-12-27T20:40:17Z,0
X1M9NUrZjeo,Ugw0EuA_uuBmYT5epnR4AaABAg,Ugw0EuA_uuBmYT5epnR4AaABAg.ARDupDS7wm3AREfd4bPsJK,"Lol seriously? The ball hit his body first 
Noob learn to watch football",@durgeshsss,2025-12-27T13:16:40Z,2
X1M9NUrZjeo,Ugw0EuA_uuBmYT5epnR4AaABAg,Ugw0EuA_uuBmYT5epnR4AaABAg.ARDupDS7wm3ARGQqEu1wya,@durgeshsssновичок 😂😂😂пока ты мышей ловил я кота ебал,@iliapublicenemy7857,2025-12-28T05:37:08Z,0
X1M9NUrZjeo,Ugyg9PlayFzYD_HmB0Z4AaABAg,Ugyg9PlayFzYD_HmB0Z4AaABAg.ARDt-BTmDJaAREIsg-Ke-5,Ты не одинок,@smyfik,2025-12-27T09:49:05Z,0
X1M9NUrZjeo,UgzSiKJWXA-FC_rLsaJ4AaABAg,UgzSiKJWXA-FC_rLsaJ4AaABAg.ARDsVL6JfDsARDuYGIq4iQ,That's Eddie Howe's tactics for you.,@anon-zk6iz,2025-12-27T06:07:42Z,6
X1M9NUrZjeo,UgzurkpbdLTLP_vPSgp4AaABAg,UgzurkpbdLTLP_vPSgp4AaABAg.ARDqOxs9UB0AREQk3MgIMq,"Eddie Howe is Newcastle! Don't you understand? Without him, the team will be fighting for survival at the bottom of the table. Should Steve Bruce be brought back?",@NarodnaVlada,2025-12-27T10:57:48Z,0
X1M9NUrZjeo,UgzurkpbdLTLP_vPSgp4AaABAg,UgzurkpbdLTLP_vPSgp4AaABAg.ARDqOxs9UB0AREVw9hvkjT,​@NarodnaVlada  there are far better coaches than Eddie Howe mate he has taken Newcastle as far as he could it's time to get in a world class manager end of or Newcastle will never progress to the next level.,@Brogan.PH1996,2025-12-27T11:43:09Z,0
X1M9NUrZjeo,UgzurkpbdLTLP_vPSgp4AaABAg,UgzurkpbdLTLP_vPSgp4AaABAg.ARDqOxs9UB0ARF-otXta-l,How many coaches has Manchester United had since Alex Ferguson? Has Manchester United become a top team?,@NarodnaVlada,2025-12-27T16:21:47Z,0
X1M9NUrZjeo,UgzurkpbdLTLP_vPSgp4AaABAg,UgzurkpbdLTLP_vPSgp4AaABAg.ARDqOxs9UB0ARF6QpYNHmY,​@NarodnaVlada utd are mid table team for a reason that's a weak argument top.teams replace ass coaches and utd aren't a top team,@Brogan.PH1996,2025-12-27T17:19:31Z,0
X1M9NUrZjeo,UgxwFpVMvXuIYRdhWMp4AaABAg,UgxwFpVMvXuIYRdhWMp4AaABAg.ARDp2gjbGUGARDrIlKOQDh,Diogo Dalot,@rar9034,2025-12-27T05:39:22Z,0
X1M9NUrZjeo,UgxwFpVMvXuIYRdhWMp4AaABAg,UgxwFpVMvXuIYRdhWMp4AaABAg.ARDp2gjbGUGARDra3dvTkf,@rar9034thank you,@Oiak-Eye,2025-12-27T05:41:52Z,0
X1M9NUrZjeo,UgzZWcI_HJSDhhoVGTF4AaABAg,UgzZWcI_HJSDhhoVGTF4AaABAg.ARDoCk_y-LaAREIxVmgf5O,Он должен перейти в Манчестер Юнайтед,@smyfik,2025-12-27T09:49:44Z,0
X1M9NUrZjeo,UgzZWcI_HJSDhhoVGTF4AaABAg,UgzZWcI_HJSDhhoVGTF4AaABAg.ARDoCk_y-LaAREMh8xcb5Y,"@smyfik по этим хайлайтам он реально хорош, ждем в МЮ :))",@rock_metal,2025-12-27T10:22:28Z,0
X1M9NUrZjeo,Ugx2apqpw_8kOI-yooJ4AaABAg,Ugx2apqpw_8kOI-yooJ4AaABAg.ARDjRXezFwZARE3AXEDWA9,Livramento is a rb and defends better,@vishnuc6419,2025-12-27T07:31:50Z,0
X1M9NUrZjeo,UgwBgah3Rmoc2UqYtLJ4AaABAg,UgwBgah3Rmoc2UqYtLJ4AaABAg.ARDg1WXMZ9DARDkVFj3U7p,I would love to see the club extend his contract.,@madmick1013,2025-12-27T04:39:54Z,0
X1M9NUrZjeo,UgxPGYu8S96zJsVQdwB4AaABAg,UgxPGYu8S96zJsVQdwB4AaABAg.ARDfNLixn9eARDk_a81rAY,Ye lot are gash and are not worthy of anything better than Howe.,@madmick1013,2025-12-27T04:40:38Z,2
X1M9NUrZjeo,UgxPGYu8S96zJsVQdwB4AaABAg,UgxPGYu8S96zJsVQdwB4AaABAg.ARDfNLixn9eARERK1vi_hz,"You're not fans, you're idiots.",@NarodnaVlada,2025-12-27T11:02:51Z,0
X1M9NUrZjeo,Ugx3mN-jOsosn8xzvbh4AaABAg,Ugx3mN-jOsosn8xzvbh4AaABAg.ARDeSdV25qnARDkeq3uQiN,"Nah, Sandcastle deserve him.",@madmick1013,2025-12-27T04:41:21Z,0
X1M9NUrZjeo,Ugx3mN-jOsosn8xzvbh4AaABAg,Ugx3mN-jOsosn8xzvbh4AaABAg.ARDeSdV25qnAREQ959YsjD,"Without Eddie, Newcastle will be relegated to the Championship",@NarodnaVlada,2025-12-27T10:52:37Z,0
X1M9NUrZjeo,Ugwp-BC9NR9SCgo72qJ4AaABAg,Ugwp-BC9NR9SCgo72qJ4AaABAg.ARDeDBEFtQEARDkhk64yHb,Sandcastle are shite.,@madmick1013,2025-12-27T04:41:45Z,0
X1M9NUrZjeo,UgxfdEzH7AFrZnPOdcF4AaABAg,UgxfdEzH7AFrZnPOdcF4AaABAg.ARDdrU0Fym6AREQBIE6bpQ,"No! Without Eddie, Newcastle will be relegated to the Championship",@NarodnaVlada,2025-12-27T10:52:55Z,0
X1M9NUrZjeo,UgzQZRTfqUf9QuvjbcR4AaABAg,UgzQZRTfqUf9QuvjbcR4AaABAg.ARD_8Hs1ZH8AREIa5oqBnD,The commentator is annoying with his screams.,@MrLisaFischer,2025-12-27T09:46:33Z,0
X1M9NUrZjeo,Ugx_ekX8LNavTTDrLBl4AaABAg,Ugx_ekX8LNavTTDrLBl4AaABAg.ARD_1Pm0mDlARER2v6Loq1,Eddie is the best trainer,@NarodnaVlada,2025-12-27T11:00:31Z,0
X1M9NUrZjeo,Ugzi6La0lfIL_43rY_V4AaABAg,Ugzi6La0lfIL_43rY_V4AaABAg.ARD_1P1EVQBARDkqNmE7qU,They are shite regardless of who is managing them.,@madmick1013,2025-12-27T04:42:56Z,0
X1M9NUrZjeo,Ugzi6La0lfIL_43rY_V4AaABAg,Ugzi6La0lfIL_43rY_V4AaABAg.ARD_1P1EVQBARDu1w4kP6w,Man City didn't have many happy clappers. Say the obvious Howe out here and morons rise up.,@anon-zk6iz,2025-12-27T06:03:17Z,0
X1M9NUrZjeo,Ugzi6La0lfIL_43rY_V4AaABAg,Ugzi6La0lfIL_43rY_V4AaABAg.ARD_1P1EVQBARE89mFRgEO,"@anon-zk6iz
It is the same at other clubs like Leeds.
Farke is utterly clueless and totally shite, but he has a lot of fan boys.
It is mind boggling.",@madmick1013,2025-12-27T08:15:26Z,0
X1M9NUrZjeo,Ugz-Mdd4xmzHqHB6pSN4AaABAg,Ugz-Mdd4xmzHqHB6pSN4AaABAg.ARDXYYUECKXARDbCStEGFd,Main bagus sekali ntar bapuk lagi dorgu kalian hujat wkwk,@denybagusputra,2025-12-27T03:18:42Z,0
X1M9NUrZjeo,Ugz-Mdd4xmzHqHB6pSN4AaABAg,Ugz-Mdd4xmzHqHB6pSN4AaABAg.ARDXYYUECKXARDdjoN0toj,​@denybagusputrabisa jadi... Karena tim ini aneh... Tapi entah kenapa saya tetap mengidolakannya... 😂,@susiana267,2025-12-27T03:40:52Z,0
X1M9NUrZjeo,Ugz25b5jTeFLscN0RhV4AaABAg,Ugz25b5jTeFLscN0RhV4AaABAg.ARDXNXyXBhoARDhD-2XAzU,😂😂😂 you think so? It would be 3 or 4-1 for manchester cry harder,@Maurisank,2025-12-27T04:11:12Z,0
X1M9NUrZjeo,UgzVQCGDDNrxaMf7qvF4AaABAg,UgzVQCGDDNrxaMf7qvF4AaABAg.ARDXJ1eGM9tARDgxG5BC-W,Just happened...,@Maurisank,2025-12-27T04:08:55Z,0
X1M9NUrZjeo,UgzVQCGDDNrxaMf7qvF4AaABAg,UgzVQCGDDNrxaMf7qvF4AaABAg.ARDXJ1eGM9tARE1OhIheP6,United won,@user-lw9ee8yt8c,2025-12-27T07:16:18Z,0
X1M9NUrZjeo,UgzpkpkR1OLIZTKLW0V4AaABAg,UgzpkpkR1OLIZTKLW0V4AaABAg.ARDXCCEGst3ARE1fLdvH9H,"Yep, this is on Howe and his army of happy clappers who kiss his arse and think he walks on water because he won a cup, look at the players he had/has? Steve mcclaren won a cup at boro, it’s not necessarily a barometer of being a great or even good manager. Howe has always been limited and now he’s utterly exposed. He needs the sack sooner rather than later.",@Steven-e2d2d,2025-12-27T07:18:43Z,0
X1M9NUrZjeo,UgwGjjfIcxgVsS4glYJ4AaABAg,UgwGjjfIcxgVsS4glYJ4AaABAg.ARDX7PwgQ2CARDl-TraBI2,"The owner is the problem, yet Newcastle scum bow to him.
Ye lot are goofs!",@madmick1013,2025-12-27T04:44:18Z,0
X1M9NUrZjeo,UgwGjjfIcxgVsS4glYJ4AaABAg,UgwGjjfIcxgVsS4glYJ4AaABAg.ARDX7PwgQ2CARERGJStozr,"You don't appreciate what you have! Newcastle are playing in the Champions League! Can I give you some glasses? Newcastle have recently had great matches against Manchester City, Everton, Chelsea. With these players, no coach will achieve such success",@NarodnaVlada,2025-12-27T11:02:21Z,0
X1M9NUrZjeo,UgwGjjfIcxgVsS4glYJ4AaABAg,UgwGjjfIcxgVsS4glYJ4AaABAg.ARDX7PwgQ2CARHaJ6FJG3m,"​@NarodnaVlada ""we're in the champions league"" means fuck all if youve won 1 trophy in 70 years and it was a tinpot we've won plenty of times 😂😂",@mBOOMo19,2025-12-28T16:27:50Z,0
X1M9NUrZjeo,Ugzr80cd0jZGfypcWqZ4AaABAg,Ugzr80cd0jZGfypcWqZ4AaABAg.ARDX2MAn6yfARERQdBtbMn,"How is Newcastle. Without him, there would be no Newcastle.",@NarodnaVlada,2025-12-27T11:03:45Z,0
X1M9NUrZjeo,UgwMylOl13wqHfksBN54AaABAg,UgwMylOl13wqHfksBN54AaABAg.ARDWoNtsWz8ARDb2wifgUg,He would fit than gyokeres in arsenal sure,@denybagusputra,2025-12-27T03:17:24Z,2
X1M9NUrZjeo,UgwMylOl13wqHfksBN54AaABAg,UgwMylOl13wqHfksBN54AaABAg.ARDWoNtsWz8AREkf96cGCY,pleased he never come to newcastle,@Anonymous-n3f,2025-12-27T14:00:38Z,3
X1M9NUrZjeo,UgwMylOl13wqHfksBN54AaABAg,UgwMylOl13wqHfksBN54AaABAg.ARDWoNtsWz8ARF1B6d3K-3,"He's no better than Hojlund and should go the way he did, just go!",@jamestan8914,2025-12-27T16:33:41Z,0
X1M9NUrZjeo,Ugw_1R4WWIMXA42I8BB4AaABAg,Ugw_1R4WWIMXA42I8BB4AaABAg.ARDWgQ-SdxMAREWGhiMNOg,And Arab money fc failed to force even a draw 😅,@Wyatt88-4U,2025-12-27T11:46:06Z,0
X1M9NUrZjeo,UgweqFAcxDBWdv1bZtl4AaABAg,UgweqFAcxDBWdv1bZtl4AaABAg.ARDW8lOVm4EARDf6ACD7kA,that long hair is like beyoce ass terrible loooool,@Ilirshaban-t7k,2025-12-27T03:52:48Z,1
X1M9NUrZjeo,UgweqFAcxDBWdv1bZtl4AaABAg,UgweqFAcxDBWdv1bZtl4AaABAg.ARDW8lOVm4EARDiCu9xtMA,@Ilirshaban-t7kyou don’t understand kid this type of stuff 😂,@Airbornecanine,2025-12-27T04:19:56Z,0
X1M9NUrZjeo,Ugwhf4a4RJSeAQr4SVV4AaABAg,Ugwhf4a4RJSeAQr4SVV4AaABAg.ARDV6fSlj0vARDl46j8c85,They are shite.,@madmick1013,2025-12-27T04:44:57Z,1
X1M9NUrZjeo,Ugwhf4a4RJSeAQr4SVV4AaABAg,Ugwhf4a4RJSeAQr4SVV4AaABAg.ARDV6fSlj0vARHaNdJyFlw,losing against our reserves is relegation worthy 😂😂 toon scum played shit got what they deserved,@mBOOMo19,2025-12-28T16:28:27Z,0
X1M9NUrZjeo,UgzcbSvUgrUv7wyAKhZ4AaABAg,UgzcbSvUgrUv7wyAKhZ4AaABAg.ARDSVKtWvyGARDhWQJ6nEw,It could be 3 to 4-1 for manchester 😂😂😂 thanks God that we saw match cry harder cry haters🤪😜,@Maurisank,2025-12-27T04:13:51Z,0
X1M9NUrZjeo,UgzcbSvUgrUv7wyAKhZ4AaABAg,UgzcbSvUgrUv7wyAKhZ4AaABAg.ARDSVKtWvyGARDl9WFNH7a,Put down the pipe!,@madmick1013,2025-12-27T04:45:41Z,0
X1M9NUrZjeo,UgzcbSvUgrUv7wyAKhZ4AaABAg,UgzcbSvUgrUv7wyAKhZ4AaABAg.ARDSVKtWvyGARE1YGvkH8s,"Salty crybaby, you're not slick we see your bias. Keep your moaning to yourself.",@user-lw9ee8yt8c,2025-12-27T07:17:37Z,0
X1M9NUrZjeo,UgwkiU5RTV0R9CgPmaB4AaABAg,UgwkiU5RTV0R9CgPmaB4AaABAg.ARDSRiVZ32hARDSqQZAWvd,"Trying to buy success, how's it going? 😂",@abimbolahelenolulegan1655,2025-12-27T01:56:55Z,0
X1M9NUrZjeo,UgwkiU5RTV0R9CgPmaB4AaABAg,UgwkiU5RTV0R9CgPmaB4AaABAg.ARDSRiVZ32hARDlHOvpdeZ,Ye lot are proper scum and are fully worthy of everything bad that comes to the club.,@madmick1013,2025-12-27T04:46:45Z,0
X1M9NUrZjeo,UgwkiU5RTV0R9CgPmaB4AaABAg,UgwkiU5RTV0R9CgPmaB4AaABAg.ARDSRiVZ32hARDlK0gNMhp,"@abimbolahelenolulegan1655
From a dictator…",@madmick1013,2025-12-27T04:47:07Z,0
X1M9NUrZjeo,UgwBGnGElsSafolFQ954AaABAg,UgwBGnGElsSafolFQ954AaABAg.ARDR7AWno7uAREHfcsUgO5,Sad pathetic on the nufc pages,@captainohcaptain9588,2025-12-27T09:38:34Z,0
X1M9NUrZjeo,UgwBGnGElsSafolFQ954AaABAg,UgwBGnGElsSafolFQ954AaABAg.ARDR7AWno7uARGLZpQ6u-T,​@captainohcaptain9588what's pathetic is losing to this united side. 😂,@izmirs.,2025-12-28T04:51:04Z,0
X1M9NUrZjeo,UgyhPZGEKl3zUJz41Rd4AaABAg,UgyhPZGEKl3zUJz41Rd4AaABAg.ARDQs3P-jtMARDZroxUvr5,So you’re a fan of both clubs?,@aalexlync,2025-12-27T02:58:16Z,0
X1M9NUrZjeo,UgyhPZGEKl3zUJz41Rd4AaABAg,UgyhPZGEKl3zUJz41Rd4AaABAg.ARDQs3P-jtMARDb8LkyuWd,​@aalexlyncyes,@sofianyusof1400,2025-12-27T03:18:08Z,0
X1M9NUrZjeo,UgyhPZGEKl3zUJz41Rd4AaABAg,UgyhPZGEKl3zUJz41Rd4AaABAg.ARDQs3P-jtMARDfx_Gjz8e,"​@aalexlync
""So how did you react with others around you when the goal was scored?""

""That depends on their jersey...""",@seanat8813,2025-12-27T04:00:13Z,1
X1M9NUrZjeo,UgyhPZGEKl3zUJz41Rd4AaABAg,UgyhPZGEKl3zUJz41Rd4AaABAg.ARDQs3P-jtMARDlQ16-cbY,You are a muppet.,@madmick1013,2025-12-27T04:47:56Z,3
X1M9NUrZjeo,UgyhPZGEKl3zUJz41Rd4AaABAg,UgyhPZGEKl3zUJz41Rd4AaABAg.ARDQs3P-jtMARE-tmAdymJ,"How can you be a fan of two clubs competing in the same league? Stick to knitting, you palm wine woman 😂",@imonicheifijen5650,2025-12-27T07:03:12Z,0
X1M9NUrZjeo,UgyWj9J8_X2n8gs-2GV4AaABAg,UgyWj9J8_X2n8gs-2GV4AaABAg.ARDQq9Dh444ARDlT_AF0hp,"Ye lot are proper scum.
End of.",@madmick1013,2025-12-27T04:48:25Z,0
X1M9NUrZjeo,UgwgDzViE32IzKjMcGJ4AaABAg,UgwgDzViE32IzKjMcGJ4AaABAg.ARDQTSlw46-AREMw_Um-If,"What are you on about? Newcastle was the better Team, by miles. Just unlucky",@fRe3eezY,2025-12-27T10:24:34Z,0
X1M9NUrZjeo,UgwgDzViE32IzKjMcGJ4AaABAg,UgwgDzViE32IzKjMcGJ4AaABAg.ARDQTSlw46-AREPxgRJ37x,This is the Premier League! Even Europa League participant Forest is in the relegation zone here,@NarodnaVlada,2025-12-27T10:50:56Z,1
X1M9NUrZjeo,UgysEUQYvjg6TRCT7Il4AaABAg,UgysEUQYvjg6TRCT7Il4AaABAg.ARDOUfAkApSARDsw7pJKpI,Too many happy clappers,@anon-zk6iz,2025-12-27T05:53:37Z,0
X1M9NUrZjeo,UgysEUQYvjg6TRCT7Il4AaABAg,UgysEUQYvjg6TRCT7Il4AaABAg.ARDOUfAkApSARE3J23udFP,See Those Reserve players not too bad,@seabelomaphosa5737,2025-12-27T07:33:00Z,1
X1M9NUrZjeo,UgysEUQYvjg6TRCT7Il4AaABAg,UgysEUQYvjg6TRCT7Il4AaABAg.ARDOUfAkApSAREJDiqLIau,"How can he run out of favour - He is a priviledged white british male. Howe is a great guy, but a mediocre coach. He had all the players to win this game",@MrLisaFischer,2025-12-27T09:52:05Z,0
X1M9NUrZjeo,UgysEUQYvjg6TRCT7Il4AaABAg,UgysEUQYvjg6TRCT7Il4AaABAg.ARDOUfAkApSAREQHz6CsGe,Newcastle can qualify for the Champions League by winning the Champions League,@NarodnaVlada,2025-12-27T10:53:50Z,0
X1M9NUrZjeo,UgysEUQYvjg6TRCT7Il4AaABAg,UgysEUQYvjg6TRCT7Il4AaABAg.ARDOUfAkApSAREQKNRF_cj,@seabelomaphosa5737 oh i’m not having a go at them. Just stating a fact,@bananahammock9119,2025-12-27T10:54:10Z,0
X1M9NUrZjeo,Ugy7WevnTIXuUgbeuWB4AaABAg,Ugy7WevnTIXuUgbeuWB4AaABAg.ARDNCR09jN-ARFNZwtNI3n,,@jackhoward8,2025-12-27T19:49:19Z,0
X1M9NUrZjeo,UgxbIFPqvSZScIJqHF54AaABAg,UgxbIFPqvSZScIJqHF54AaABAg.ARDMrXhzEw0ARER-HNQfNX,"How stupid you are! Doesn't the example of other teams make you think that Newcastle will fall apart with a new coach? Chelsea, Manchester United, Nottingham Forest... You need to be at the bottom of the table for a few seasons to understand what Howe is? This coach has led the team to the Champions League twice! And this is in the strongest League in the World - the Premier League!",@NarodnaVlada,2025-12-27T11:00:01Z,0
X1M9NUrZjeo,UgxpMp0HgHqnwEsxVpV4AaABAg,UgxpMp0HgHqnwEsxVpV4AaABAg.ARDMoIRYSiRARFqUKt54Ry,We all see that … but not Howe. He is so evidently stubborn in tactical changes,@mhkxixi1405,2025-12-28T00:10:42Z,0
X1M9NUrZjeo,UgxpMp0HgHqnwEsxVpV4AaABAg,UgxpMp0HgHqnwEsxVpV4AaABAg.ARDMoIRYSiRARFrurv2AMv,Init,@kadenmartin5811,2025-12-28T00:23:12Z,0
X1M9NUrZjeo,Ugx4jtZ_epk0E7OG5eV4AaABAg,Ugx4jtZ_epk0E7OG5eV4AaABAg.ARDM73CdM6sARDNRMGzZDV,Brilliant,@phil5357,2025-12-27T01:09:40Z,2
X1M9NUrZjeo,Ugx7J7YqKbh-nP4RAe14AaABAg,Ugx7J7YqKbh-nP4RAe14AaABAg.ARDLXjYyJ7oARDM8Kgu5Vt,"What are the chances of this happening do you think? 

Never budges from 4-3-3

Outright refusal to make changes at half time, even when we've been catastrophically bad in then1st half (i.e.Sunderland, Brentford, West Ham)

Every opposition manager knows our subs will be made between the 60th and 70th minute. Every game. Every. Single. Game.

Manager stubbornly will not change his ways, and his ways are not working. Not even close. 

Only leaves one obvious solution for me",@phil5357,2025-12-27T00:58:20Z,2
X1M9NUrZjeo,Ugx7J7YqKbh-nP4RAe14AaABAg,Ugx7J7YqKbh-nP4RAe14AaABAg.ARDLXjYyJ7oARDuHsbUhBj,One trick pony.,@anon-zk6iz,2025-12-27T06:05:28Z,1
X1M9NUrZjeo,Ugx7J7YqKbh-nP4RAe14AaABAg,Ugx7J7YqKbh-nP4RAe14AaABAg.ARDLXjYyJ7oAREQSPv4FHM,"After Howe's resignation, the same thing will happen to the team as it did to Forest",@NarodnaVlada,2025-12-27T10:55:16Z,0
X1M9NUrZjeo,Ugxd4Y2Y817dlhspWmt4AaABAg,Ugxd4Y2Y817dlhspWmt4AaABAg.ARDL24nhyUcARDlewZviNe,"A monster?!
Ba ha ha!
You use hyperbole well.
Ye lot are proper scum.",@madmick1013,2025-12-27T04:50:06Z,0
X1M9NUrZjeo,UgzmsKcdVccWnYD5goV4AaABAg,UgzmsKcdVccWnYD5goV4AaABAg.ARDKznRzmH6ARDNbqRLzFF,Be our last season in the CL for a long time,@phil5357,2025-12-27T01:11:14Z,0
X1M9NUrZjeo,UgzypoG8PeY0E7fvh794AaABAg,UgzypoG8PeY0E7fvh794AaABAg.ARDKr1bKltWARDLBh_gSuV,Correct,@phil5357,2025-12-27T00:50:03Z,2
X1M9NUrZjeo,UgzypoG8PeY0E7fvh794AaABAg,UgzypoG8PeY0E7fvh794AaABAg.ARDKr1bKltWARDTBB6rY1P,"No, he needs better wingers and a forward that fit the system. Barnes, Gordon, Murphy, Elanga not enough and Woltemade is too slow for their style of play",@Skumtomten1,2025-12-27T01:59:53Z,1
X1M9NUrZjeo,UgzypoG8PeY0E7fvh794AaABAg,UgzypoG8PeY0E7fvh794AaABAg.ARDKr1bKltWARDbnwqR5md,​@Skumtomten1How much more do we have to spend? And how long will Eddie keep hiding behind the players?,@sjsinaihsdgywiqyhd,2025-12-27T03:23:57Z,3
X1M9NUrZjeo,UgzypoG8PeY0E7fvh794AaABAg,UgzypoG8PeY0E7fvh794AaABAg.ARDKr1bKltWARDcDLkAnsv,​@Skumtomten1Face reality. Eddie spent like a big club this transfer window and delivered relegation level performances.,@sjsinaihsdgywiqyhd,2025-12-27T03:27:33Z,3
X1M9NUrZjeo,UgzypoG8PeY0E7fvh794AaABAg,UgzypoG8PeY0E7fvh794AaABAg.ARDKr1bKltWARDtiu1c7CO,​@Skumtomten1I wouldn't trust any more more money with Eddie Howe.,@anon-zk6iz,2025-12-27T06:00:33Z,2
X1M9NUrZjeo,UgzzXbwKG-uBFV9kuhh4AaABAg,UgzzXbwKG-uBFV9kuhh4AaABAg.ARDJsZbLHhpARE193KiSMI,Lol,@user-lw9ee8yt8c,2025-12-27T07:14:10Z,0
X1M9NUrZjeo,Ugx1Pde32E1-Zos9rr94AaABAg,Ugx1Pde32E1-Zos9rr94AaABAg.ARDJO0OPkY-ARDO07IlKRV,"We do have an identity.

We are now the easiest team in the league to beat.",@phil5357,2025-12-27T01:14:41Z,1
X1M9NUrZjeo,UgyLpo0gWlvIyUjmRdV4AaABAg,UgyLpo0gWlvIyUjmRdV4AaABAg.ARDIkdXObzdARDgd9e2_8I,I wish he never left Chelsea,@enoughsaiiiid,2025-12-27T04:06:10Z,9
X1M9NUrZjeo,UgyLpo0gWlvIyUjmRdV4AaABAg,UgyLpo0gWlvIyUjmRdV4AaABAg.ARDIkdXObzdARE2KflUw7p,Omo that guy dey play ball ooo.... See confidence,@osaroamax9069,2025-12-27T07:24:29Z,2
X1M9NUrZjeo,UgyLpo0gWlvIyUjmRdV4AaABAg,UgyLpo0gWlvIyUjmRdV4AaABAg.ARDIkdXObzdAREHNSdBggZ,​@osaroamax9069Yeahh,@promiseonyemulu,2025-12-27T09:35:56Z,0
X1M9NUrZjeo,UgyLpo0gWlvIyUjmRdV4AaABAg,UgyLpo0gWlvIyUjmRdV4AaABAg.ARDIkdXObzdARELbLj2gNl,Lewis Baller,@moeyismail2290,2025-12-27T10:12:56Z,2
X1M9NUrZjeo,UgzzbZ6HvHykh1OG74J4AaABAg,UgzzbZ6HvHykh1OG74J4AaABAg.ARDI5OX3crgARDJCF525gz,AGREEEEEED!,@형만띠,2025-12-27T00:32:39Z,1
X1M9NUrZjeo,UgzzbZ6HvHykh1OG74J4AaABAg,UgzzbZ6HvHykh1OG74J4AaABAg.ARDI5OX3crgARDNVAZ4dxZ,"That's his profile. He's not fast enough to start our press and force turnovers or run in behind, he's a link up guy",@amaanhussain3094,2025-12-27T01:10:11Z,1
X1M9NUrZjeo,UgzzbZ6HvHykh1OG74J4AaABAg,UgzzbZ6HvHykh1OG74J4AaABAg.ARDI5OX3crgARDOw3D7ZNY,"@amaanhussain3094
But there’s plenty of very good CF’s that aren’t blessed with pace…
And like I said, he shouldn’t have to do this every game?",@Mr_Linka,2025-12-27T01:22:44Z,1
