video_id,video_url,comment_id,comment_author_display,comment_author_channel_id,comment_content,comment_lang,comment_time_utc,comment_time_local,comment_like_count,comment_reply_count,reply_id,reply_author_display,reply_author_channel_id,reply_content,reply_lang,reply_time_utc,reply_time_local,reply_like_count,view_count,like_count,comment_count,crawl_time
Lxa8poQYRtc,https://www.youtube.com/watch?v=Lxa8poQYRtc,UgxMcI92lu3ou9nlc1l4AaABAg,@Kaled_HSM193,UCAAaLuFz0d7Ch36KTPEXq_g,My Flavour,en,2025-09-02T18:11:48Z,2025-09-02 14:11:48,0,1,UgxMcI92lu3ou9nlc1l4AaABAg.AM_WCCF6Hx0AM_WThaUqYS,@Kaled_HSM193,UCAAaLuFz0d7Ch36KTPEXq_g,My ✏️ is my 🔪,en,2025-09-02T18:14:11Z,2025-09-02 14:14:11,0,9048036,230362,6180,"Mon, 15 Dec 2025 17:18:06 GMT"
Lxa8poQYRtc,https://www.youtube.com/watch?v=Lxa8poQYRtc,UgyBHmpYjAZ7xt-C-Wt4AaABAg,@DarrenParthipan-eb1sz,UCAKzPU3zQimt3hErP9CC5xA,is it me or do i hear 7 rings by ariana grande at the start,en,2025-08-06T20:39:04Z,2025-08-06 16:39:04,0,1,UgyBHmpYjAZ7xt-C-Wt4AaABAg.ALVFaBInG7iALVg5iaBsYF,@Methequeen,UCHdsDcdN0Ecuocvr_FEYy2A,7 rings sampled the sound of music…,en,2025-08-07T00:39:26Z,2025-08-06 20:39:26,0,9048036,230362,6180,"Mon, 15 Dec 2025 17:18:06 GMT"
Lxa8poQYRtc,https://www.youtube.com/watch?v=Lxa8poQYRtc,UgxJq1kZan15cD-aW1J4AaABAg,@Meher-i6u,UC3YLW_cnOXN_6_4jBW3AyvQ,We want season 3 tooo,NA,2025-08-05T11:27:46Z,2025-08-05 07:27:46,0,1,UgxJq1kZan15cD-aW1J4AaABAg.ALRghVSbQGnALRnZt0YaFG,@barakathullahbj9506,UCR5cvDRK7pxQnany6ZVmrkA,Already confirmed,NA,2025-08-05T12:27:46Z,2025-08-05 08:27:46,1,9048036,230362,6180,"Mon, 15 Dec 2025 17:18:06 GMT"
Lxa8poQYRtc,https://www.youtube.com/watch?v=Lxa8poQYRtc,Ugxwl9L81du1pLpRNpJ4AaABAg,@kaitoflick1385,UCdQrh8UQWAlWuYO9knOXpxQ,Wednesday season 2 coming out Wednesday can NOT be a coincidence,en,2025-08-04T19:45:47Z,2025-08-04 15:45:47,2,1,Ugxwl9L81du1pLpRNpJ4AaABAg.ALQ-uEfxmCoALQEDmYVwO-,@anzu_sl,UCS5_Kf7Y4DVhCRIo3REEJJg,I would be disappointed if it weren't on wednesday,en,2025-08-04T21:50:56Z,2025-08-04 17:50:56,0,9048036,230362,6180,"Mon, 15 Dec 2025 17:18:06 GMT"
Lxa8poQYRtc,https://www.youtube.com/watch?v=Lxa8poQYRtc,UgxVyFwddwWm7_FTbxB4AaABAg,@Hussain-tl9vw,UCSSQtauVnVP8QmEOq6mLY3Q,Hey netflix i want to work in this movie please,en,2025-07-25T09:57:52Z,2025-07-25 05:57:52,0,1,UgxVyFwddwWm7_FTbxB4AaABAg.AL-CfTgZKe7AL4MxLXVwnI,@KasiraWani,UCeEf_zZgGI2dpw8ccisce3A,😂😂,ja,2025-07-27T10:03:54Z,2025-07-27 06:03:54,0,9048036,230362,6180,"Mon, 15 Dec 2025 17:18:06 GMT"
Lxa8poQYRtc,https://www.youtube.com/watch?v=Lxa8poQYRtc,UgzKQS-YNhoatyyGtkZ4AaABAg,@charliemartinez4694,UC-0oLbxnf3rgHEnc9fJvWug,"6 weeks, 6 days, 6 hours ago

That's what the unrated version actually says reads

Y so serious 😈🥃🃏",en,2025-07-16T03:21:17Z,2025-07-15 23:21:17,1,1,UgzKQS-YNhoatyyGtkZ4AaABAg.AKcK7swiJHOAKcKyWEh5F1,@August_Is_Alone,UCPjy8gBDmfOzG3R4vUHbM9w,6 MINUTES OF THIS COMMENT-,en,2025-07-16T03:28:36Z,2025-07-15 23:28:36,0,9048036,230362,6180,"Mon, 15 Dec 2025 17:18:06 GMT"
Lxa8poQYRtc,https://www.youtube.com/watch?v=Lxa8poQYRtc,UgwEhHGdzo7osK3IESN4AaABAg,@AlexanderTF,UCv6aM2EN-YzY1cWUgR-cVOA,"WTF is this? what happened to Addams family weird and spooky, their obsessive fascination with murders and horror, why is she a teenage detective? Uncle Fester or Lurch probably know the killer... and why is she learning magic from a book? Her grandma is a witch, heck with their family she could just dig up one of her dead relatives and learn magic from them... what is this trash script... did they even watch the show? or even read the comics? Season 1 only worked cause she was out of her families comfort zone ... where is this family drama coming from with Addams family ideals to always be supportive of each others weird obsessions....",en,2025-07-13T21:34:41Z,2025-07-13 17:34:41,0,4,UgwEhHGdzo7osK3IESN4AaABAg.AKXYsWIbm8bAK_0puhZSDc,@imandan1966,UCs_sGIlaFBUkprvw3LTiDyw,give it a rest,en,2025-07-14T20:34:57Z,2025-07-14 16:34:57,0,9048036,230362,6180,"Mon, 15 Dec 2025 17:18:06 GMT"
Lxa8poQYRtc,https://www.youtube.com/watch?v=Lxa8poQYRtc,UgwEhHGdzo7osK3IESN4AaABAg,@AlexanderTF,UCv6aM2EN-YzY1cWUgR-cVOA,"WTF is this? what happened to Addams family weird and spooky, their obsessive fascination with murders and horror, why is she a teenage detective? Uncle Fester or Lurch probably know the killer... and why is she learning magic from a book? Her grandma is a witch, heck with their family she could just dig up one of her dead relatives and learn magic from them... what is this trash script... did they even watch the show? or even read the comics? Season 1 only worked cause she was out of her families comfort zone ... where is this family drama coming from with Addams family ideals to always be supportive of each others weird obsessions....",en,2025-07-13T21:34:41Z,2025-07-13 17:34:41,0,4,UgwEhHGdzo7osK3IESN4AaABAg.AKXYsWIbm8bAK_38CWc8Bi,@AlexanderTF,UCv6aM2EN-YzY1cWUgR-cVOA,"@imandan1966 Rest my ass, this is a cop out, s01 was ok cause she was forced to be apart from the family ... but now she's just a teen detective? what dumb ass wrote this....",en,2025-07-14T20:55:04Z,2025-07-14 16:55:04,0,9048036,230362,6180,"Mon, 15 Dec 2025 17:18:06 GMT"
Lxa8poQYRtc,https://www.youtube.com/watch?v=Lxa8poQYRtc,UgwEhHGdzo7osK3IESN4AaABAg,@AlexanderTF,UCv6aM2EN-YzY1cWUgR-cVOA,"WTF is this? what happened to Addams family weird and spooky, their obsessive fascination with murders and horror, why is she a teenage detective? Uncle Fester or Lurch probably know the killer... and why is she learning magic from a book? Her grandma is a witch, heck with their family she could just dig up one of her dead relatives and learn magic from them... what is this trash script... did they even watch the show? or even read the comics? Season 1 only worked cause she was out of her families comfort zone ... where is this family drama coming from with Addams family ideals to always be supportive of each others weird obsessions....",en,2025-07-13T21:34:41Z,2025-07-13 17:34:41,0,4,UgwEhHGdzo7osK3IESN4AaABAg.AKXYsWIbm8bAK_4_IKQZBp,@imandan1966,UCs_sGIlaFBUkprvw3LTiDyw,"@AlexanderTF it's a campy little Netflix show, not the next Godfather movie. Get real, grow up and go mow my lawn.",en,2025-07-14T21:07:38Z,2025-07-14 17:07:38,1,9048036,230362,6180,"Mon, 15 Dec 2025 17:18:06 GMT"
Lxa8poQYRtc,https://www.youtube.com/watch?v=Lxa8poQYRtc,UgwEhHGdzo7osK3IESN4AaABAg,@AlexanderTF,UCv6aM2EN-YzY1cWUgR-cVOA,"WTF is this? what happened to Addams family weird and spooky, their obsessive fascination with murders and horror, why is she a teenage detective? Uncle Fester or Lurch probably know the killer... and why is she learning magic from a book? Her grandma is a witch, heck with their family she could just dig up one of her dead relatives and learn magic from them... what is this trash script... did they even watch the show? or even read the comics? Season 1 only worked cause she was out of her families comfort zone ... where is this family drama coming from with Addams family ideals to always be supportive of each others weird obsessions....",en,2025-07-13T21:34:41Z,2025-07-13 17:34:41,0,4,UgwEhHGdzo7osK3IESN4AaABAg.AKXYsWIbm8bAK_6bZPfdEk,@AlexanderTF,UCv6aM2EN-YzY1cWUgR-cVOA,"@imandan1966 that still doesnt excuse poor trashy writing, I can point at a pre schooler with better writing talent ...",en,2025-07-14T21:25:25Z,2025-07-14 17:25:25,0,9048036,230362,6180,"Mon, 15 Dec 2025 17:18:06 GMT"
Lxa8poQYRtc,https://www.youtube.com/watch?v=Lxa8poQYRtc,UgzpW2uTmJZRTqRhtMh4AaABAg,@codytallent6934,UC5TEcjWIDHOTWOL8lP2g_Wg,JD Vance did great here. Look forward to it.,en,2025-06-22T17:53:38Z,2025-06-22 13:53:38,5,1,UgzpW2uTmJZRTqRhtMh4AaABAg.AJg4t6agw44AK04XtZh0x6,@stompythewonderlizard286,UCaOhJbbPLbmXlMlaTRDgn2Q,To have your life suck so bad that you turn everything political.  What a loser. What a small mind.,en,2025-06-30T21:34:39Z,2025-06-30 17:34:39,0,9048036,230362,6180,"Mon, 15 Dec 2025 17:18:06 GMT"
Lxa8poQYRtc,https://www.youtube.com/watch?v=Lxa8poQYRtc,Ugzirw7F1XGEjROtRNB4AaABAg,@kumaranshuman25,UCJhSFIOW8Hv3wapWiW91c5w,Thing is cooked 💀,en,2025-06-16T17:00:15Z,2025-06-16 13:00:15,0,1,Ugzirw7F1XGEjROtRNB4AaABAg.AJRY-zOpnHKAJRYBsjJLK-,@kumaranshuman25,UCJhSFIOW8Hv3wapWiW91c5w,The scolding will be avoided because thing helped  Wednesday a lot,en,2025-06-16T17:01:53Z,2025-06-16 13:01:53,0,9048036,230362,6180,"Mon, 15 Dec 2025 17:18:06 GMT"
Lxa8poQYRtc,https://www.youtube.com/watch?v=Lxa8poQYRtc,UgyJWiTfkESIPCJgLO14AaABAg,@SpyroTheGuardian,UCnCUWcRE4G5kovSNoXzjcUQ,Sora doesn't seem to be doing so great ever since Yozora beat him.,en,2025-06-14T23:45:10Z,2025-06-14 19:45:10,3,1,UgyJWiTfkESIPCJgLO14AaABAg.AJN6kuVTwcvAJNLJbU5AsS,@YUXKE,UCbD4W4V6HB432o09bO45OHA,Lol totally!,en,2025-06-15T01:52:23Z,2025-06-14 21:52:23,2,9048036,230362,6180,"Mon, 15 Dec 2025 17:18:06 GMT"
Lxa8poQYRtc,https://www.youtube.com/watch?v=Lxa8poQYRtc,UgyyQ-Qxq4VOmYlWXSl4AaABAg,@anthonyverdoni2698,UCeet7BRRmWUqZT0ZmHiuMfg,"Sounding like the perv I am, she is too old for season 2.",en,2025-06-14T06:36:34Z,2025-06-14 02:36:34,0,1,UgyyQ-Qxq4VOmYlWXSl4AaABAg.AJLH2EaIZENAJLKAypipEq,@anerdwithglasses7429,UC6M4s5R3E3vwD5yr4T3hZtQ,Maybe don't be a perv and go watch something else.,en,2025-06-14T07:03:59Z,2025-06-14 03:03:59,1,9048036,230362,6180,"Mon, 15 Dec 2025 17:18:06 GMT"
Lxa8poQYRtc,https://www.youtube.com/watch?v=Lxa8poQYRtc,UgzEVlEB0QUkXju_dlp4AaABAg,@Cymone98,UCnMWk5248_vLlDGJV0bTf8A,I don’t have Netflix how do I watch,en,2025-06-13T12:55:20Z,2025-06-13 08:55:20,0,1,UgzEVlEB0QUkXju_dlp4AaABAg.AJJNaPYA3UPAJK9YaTzUHI,@SYEDSHAZEB46013,UCwlRNy29u10tHPL759a2fiQ,torrent it. bruh,la,2025-06-13T20:11:51Z,2025-06-13 16:11:51,0,9048036,230362,6180,"Mon, 15 Dec 2025 17:18:06 GMT"
Lxa8poQYRtc,https://www.youtube.com/watch?v=Lxa8poQYRtc,UgyzrAGLCbwbZnNx2n14AaABAg,@zenmaster8826,UCcg0zPIB4YZDqJGhlnClnvA,The TSA bit reminds me of the key and peele skit.. LMAO 🤣,NA,2025-06-13T11:30:55Z,2025-06-13 07:30:55,0,1,UgyzrAGLCbwbZnNx2n14AaABAg.AJJDw8xf1G3AJK9ZiEd83L,@SYEDSHAZEB46013,UCwlRNy29u10tHPL759a2fiQ,lo l i gotta see that,NA,2025-06-13T20:12:00Z,2025-06-13 16:12:00,0,9048036,230362,6180,"Mon, 15 Dec 2025 17:18:06 GMT"
Lxa8poQYRtc,https://www.youtube.com/watch?v=Lxa8poQYRtc,Ugz-L-AJasJyR4Cfpf94AaABAg,@brianjones7907,UC9qb03PmBLr2cgD95lzAt2w,fantastic cant wait to watch this,en,2025-06-12T22:46:37Z,2025-06-12 18:46:37,0,1,Ugz-L-AJasJyR4Cfpf94AaABAg.AJHrTDFw9ugAJIBRChkA5C,@SiergiejRadowcew,UCVR1ZhPb7FjLWEfu6yxB68A,ты что даун ебаный чтоли,ru,2025-06-13T01:49:50Z,2025-06-12 21:49:50,0,9048036,230362,6180,"Mon, 15 Dec 2025 17:18:06 GMT"
Lxa8poQYRtc,https://www.youtube.com/watch?v=Lxa8poQYRtc,Ugxr4zGbxb-UgJXF5X94AaABAg,@AlexandraLovesActing,UClSena5EGXaQByXx_Hzh7HQ,This are the most insane six minutes I have ever watched 😂. Need the whole episode now.,en,2025-06-09T16:37:25Z,2025-06-09 12:37:25,47,1,Ugxr4zGbxb-UgJXF5X94AaABAg.AJ9TpccHAuQAJHWTsEjzTJ,@kevinb3812,UCk9aIbBmv8rkj5CcMcJSfxA,"I hear you! My interest has fully bloomed, even though after all this time it was slipping away a bit. All it took was a masterful 6 minute mini-movie and we're in!",en,2025-06-12T19:34:27Z,2025-06-12 15:34:27,1,9048036,230362,6180,"Mon, 15 Dec 2025 17:18:06 GMT"
Lxa8poQYRtc,https://www.youtube.com/watch?v=Lxa8poQYRtc,UgwPJ4QRvSOynuaX1iJ4AaABAg,@morganafay2604,UCEelRRnCZ_XwKyfr4nzb-2w,"Adorei essa temporada, tenho a impressão que terminou muito rápido, quando comeca a outra?",pt,2025-06-08T15:56:12Z,2025-06-08 11:56:12,0,1,UgwPJ4QRvSOynuaX1iJ4AaABAg.AJ6pJpBI8VcAJ6x5KBr57X,@SavingQuest_YT,UCv1_P_XbnHvIl8jB_wwq1Og,ainda nem lançou,fr,2025-06-08T17:04:08Z,2025-06-08 13:04:08,0,9048036,230362,6180,"Mon, 15 Dec 2025 17:18:06 GMT"
Lxa8poQYRtc,https://www.youtube.com/watch?v=Lxa8poQYRtc,UgyEha0Bh25wmDNVD_B4AaABAg,@viniciusr.6818,UC8n_FSnQNNdlJZ5sAam9unw,Part I and II? What does that mean?,en,2025-06-08T14:33:12Z,2025-06-08 10:33:12,1,1,UgyEha0Bh25wmDNVD_B4AaABAg.AJ6fouK_mBfAJ6t_P4uG9W,@ARI-x-o-b5b,UC-ERRiECq5819J6E7vtjfLA,Mean 4 episodes will come out on 6 August and other 4 will be on September 3,en,2025-06-08T16:33:25Z,2025-06-08 12:33:25,1,9048036,230362,6180,"Mon, 15 Dec 2025 17:18:06 GMT"
Lxa8poQYRtc,https://www.youtube.com/watch?v=Lxa8poQYRtc,UgwtkhBQFsVTUoJ72Y54AaABAg,@chronnuggets580,UCU28meVg5j3x-tjrQuBKccA,one more way for holyweird to sell satanism to kids,en,2025-06-07T00:41:29Z,2025-06-06 20:41:29,1,3,UgwtkhBQFsVTUoJ72Y54AaABAg.AJ2bqLKf9O6AJ2gNsPsARJ,@TheBrokestGod,UCmyHhDUJF3uTWN8J4YMAo_w,This is a teenage show bro,en,2025-06-07T01:21:09Z,2025-06-06 21:21:09,0,9048036,230362,6180,"Mon, 15 Dec 2025 17:18:06 GMT"
Lxa8poQYRtc,https://www.youtube.com/watch?v=Lxa8poQYRtc,UgwtkhBQFsVTUoJ72Y54AaABAg,@chronnuggets580,UCU28meVg5j3x-tjrQuBKccA,one more way for holyweird to sell satanism to kids,en,2025-06-07T00:41:29Z,2025-06-06 20:41:29,1,3,UgwtkhBQFsVTUoJ72Y54AaABAg.AJ2bqLKf9O6AJ3EWYxVN78,@chronnuggets580,UCU28meVg5j3x-tjrQuBKccA,@TheBrokestGod Teenager is a child,NA,2025-06-07T06:28:10Z,2025-06-07 02:28:10,0,9048036,230362,6180,"Mon, 15 Dec 2025 17:18:06 GMT"
Lxa8poQYRtc,https://www.youtube.com/watch?v=Lxa8poQYRtc,UgwtkhBQFsVTUoJ72Y54AaABAg,@chronnuggets580,UCU28meVg5j3x-tjrQuBKccA,one more way for holyweird to sell satanism to kids,en,2025-06-07T00:41:29Z,2025-06-06 20:41:29,1,3,UgwtkhBQFsVTUoJ72Y54AaABAg.AJ2bqLKf9O6AJ3HOcYCVYC,@TheBrokestGod,UCmyHhDUJF3uTWN8J4YMAo_w,​@chronnuggets580either way it's fiction and should be treated as such,en,2025-06-07T06:53:18Z,2025-06-07 02:53:18,0,9048036,230362,6180,"Mon, 15 Dec 2025 17:18:06 GMT"
Lxa8poQYRtc,https://www.youtube.com/watch?v=Lxa8poQYRtc,Ugxt0pWpgio0cInmKX94AaABAg,@ИванВалентинович-о6ь,UC3K7yCT9umtZSlsbKPXkTbA,"Три сезона вышли  , а в общем доступе только первый сезон. Третий сезон Ортега не играет, другую артистку взяли и смотреть не интересно.",ru,2025-06-06T22:12:05Z,2025-06-06 18:12:05,2,1,Ugxt0pWpgio0cInmKX94AaABAg.AJ2Lk5VcQS-AJ2gR6SGD_Y,@TheBrokestGod,UCmyHhDUJF3uTWN8J4YMAo_w,Fym bro,NA,2025-06-07T01:21:35Z,2025-06-06 21:21:35,0,9048036,230362,6180,"Mon, 15 Dec 2025 17:18:06 GMT"
Lxa8poQYRtc,https://www.youtube.com/watch?v=Lxa8poQYRtc,UgxR3dbU4zMgJGcAVe14AaABAg,@nicetanjagi289,UCIfloOXzckCPxWnEkFoOYNw,"The serial killer is the kid from sixth sense . "" i see dead people "". He a grown man now.",en,2025-06-06T20:31:14Z,2025-06-06 16:31:14,0,1,UgxR3dbU4zMgJGcAVe14AaABAg.AJ2ACTYL2xUAJ2gVn5yra3,@TheBrokestGod,UCmyHhDUJF3uTWN8J4YMAo_w,Bro went from ‘I see dead people’ to ‘I cause dead people’,en,2025-06-07T01:22:14Z,2025-06-06 21:22:14,0,9048036,230362,6180,"Mon, 15 Dec 2025 17:18:06 GMT"
Lxa8poQYRtc,https://www.youtube.com/watch?v=Lxa8poQYRtc,UgxsTFCU9Ufpt8rNNU94AaABAg,@VAMPofficialll,UCkpwhVaOHSrc4dPw8BtrasQ,This is fake i think,en,2025-06-06T18:00:39Z,2025-06-06 14:00:39,0,1,UgxsTFCU9Ufpt8rNNU94AaABAg.AJ1ty_Dked5AJ1zM-B7Fnn,@favoureds11,UCN6QgQ2nOnEgsFxTqomwUWQ,its directly from Netflix this is an official Netflix channel,en,2025-06-06T18:47:41Z,2025-06-06 14:47:41,0,9048036,230362,6180,"Mon, 15 Dec 2025 17:18:06 GMT"
Lxa8poQYRtc,https://www.youtube.com/watch?v=Lxa8poQYRtc,Ugx4TTENgtNrvNOaWkF4AaABAg,@waywardbard,UCS61kbCfAgSZ0hD1grSbGaw,I just really appreciate Haley Joel Osment's range as a child-to-adult actor. He's just really stellar.,en,2025-06-06T13:30:37Z,2025-06-06 09:30:37,139,1,Ugx4TTENgtNrvNOaWkF4AaABAg.AJ1Q3k21KxsALIQWBx_RO9,@Lillireify,UCxRvz8pMH79mkgtxcN5WvOA,Why did I have to scroll so long to find a comment praising him?!,en,2025-08-01T21:04:23Z,2025-08-01 17:04:23,5,9048036,230362,6180,"Mon, 15 Dec 2025 17:18:06 GMT"
Lxa8poQYRtc,https://www.youtube.com/watch?v=Lxa8poQYRtc,Ugxkid0UCmL4MTf7rn14AaABAg,@sherlockholmes-v7l,UCcNDXoMKbrMUdZPUS8N0KrA,pure trash,sw,2025-06-06T04:42:38Z,2025-06-06 00:42:38,0,1,Ugxkid0UCmL4MTf7rn14AaABAg.AJ0Tdihdt-SAJ2gdOrLUih,@TheBrokestGod,UCmyHhDUJF3uTWN8J4YMAo_w,Hater cornball,NA,2025-06-07T01:23:24Z,2025-06-06 21:23:24,0,9048036,230362,6180,"Mon, 15 Dec 2025 17:18:06 GMT"
Lxa8poQYRtc,https://www.youtube.com/watch?v=Lxa8poQYRtc,Ugx1X6kYyLc4Qr4ziSd4AaABAg,@jcfra420,UC8uHO43GtOc-Ubc9Tsb9BSw,"Look at that, he went from seeing dead people...to making dead people....to being dead people.",en,2025-06-05T16:01:49Z,2025-06-05 12:01:49,0,1,Ugx1X6kYyLc4Qr4ziSd4AaABAg.AJ-6_Gf8PkBAJ2gkaZUd1x,@TheBrokestGod,UCmyHhDUJF3uTWN8J4YMAo_w,Ba dum tsss,NA,2025-06-07T01:24:23Z,2025-06-06 21:24:23,0,9048036,230362,6180,"Mon, 15 Dec 2025 17:18:06 GMT"
Lxa8poQYRtc,https://www.youtube.com/watch?v=Lxa8poQYRtc,UgzEapbLqLTAZ9fulX54AaABAg,@kiplen,UCTg-n9r0p3FNaDcTE5egeXA,YALL WHAT IS THE SHOE AT 2:40,en,2025-06-05T15:13:31Z,2025-06-05 11:13:31,0,1,UgzEapbLqLTAZ9fulX54AaABAg.AJ-12ZCX4VOAJ-2aRVmO4M,@kiplen,UCTg-n9r0p3FNaDcTE5egeXA,nevermind they are naked wolfe snatch double black and they are $280 :<(,en,2025-06-05T15:27:01Z,2025-06-05 11:27:01,0,9048036,230362,6180,"Mon, 15 Dec 2025 17:18:06 GMT"
Lxa8poQYRtc,https://www.youtube.com/watch?v=Lxa8poQYRtc,Ugxm9v7F169qV81Hl9p4AaABAg,@kirigayakazuto3001,UCZZhnp_yS6RiX8W1XnaF1Hw,what's wrong with sunscreen,en,2025-06-05T06:20:21Z,2025-06-05 02:20:21,0,1,Ugxm9v7F169qV81Hl9p4AaABAg.AIz41Yq4kqIAJ-JL2E2vmN,@Stosh126,UCnHYBbTDOALQ1eJUIBhUuxg,It's a joke that it's over the travel size limit,en,2025-06-05T17:53:20Z,2025-06-05 13:53:20,0,9048036,230362,6180,"Mon, 15 Dec 2025 17:18:06 GMT"
Lxa8poQYRtc,https://www.youtube.com/watch?v=Lxa8poQYRtc,Ugz1tApMoAXhHWPt5Jt4AaABAg,@joshhtellez5416,UCpcu-j1Jo22bJocjrznAukw,Never understood the hype for this show🤷🏻‍♂️ I've stopped watching everything with Jenna Ortega.😒,en,2025-06-05T06:12:55Z,2025-06-05 02:12:55,0,1,Ugz1tApMoAXhHWPt5Jt4AaABAg.AIz3B1h-XLhAJ2gvcjTfPY,@TheBrokestGod,UCmyHhDUJF3uTWN8J4YMAo_w,Why? She’s a good actor,en,2025-06-07T01:25:54Z,2025-06-06 21:25:54,0,9048036,230362,6180,"Mon, 15 Dec 2025 17:18:06 GMT"
Lxa8poQYRtc,https://www.youtube.com/watch?v=Lxa8poQYRtc,UgyQFiRilv2evheOLel4AaABAg,@chicku_02,UCuTt3zHSc8gM-CQBEkmoRyQ,Overrated,en,2025-06-05T05:53:10Z,2025-06-05 01:53:10,0,1,UgyQFiRilv2evheOLel4AaABAg.AIz0vSDvQstAJ2gyuA5InX,@TheBrokestGod,UCmyHhDUJF3uTWN8J4YMAo_w,"Yea but it is good, not as good as ppl make it out to be, but it’s still good television",en,2025-06-07T01:26:20Z,2025-06-06 21:26:20,0,9048036,230362,6180,"Mon, 15 Dec 2025 17:18:06 GMT"
Lxa8poQYRtc,https://www.youtube.com/watch?v=Lxa8poQYRtc,Ugy58urYOx57LEv024R4AaABAg,@calmyourkittens,UCSBv2hPbwkSwHEYH9IIOqSQ,It's really disgusting the history fraud that they make Jenna look like she's doing witchcraft to steal the credit for the blessings of heaven as witchcraft instead of heaven magic or the blessing of an angel.,en,2025-06-05T05:22:58Z,2025-06-05 01:22:58,0,1,Ugy58urYOx57LEv024R4AaABAg.AIyyTEI5nn8AIyyzLBceMd,@calmyourkittens,UCSBv2hPbwkSwHEYH9IIOqSQ,There's no problem burning candles & meditating & even doing magic but it's that they make it seem like she's reading witchcraft books & doing spells like she's doing something wrong or making it seem like it's okay to do someone wrong if it's for a good cause bc it's never a good cause. Magic doesn't Jenna's magic doesn't work that way. Just explaining that they're doing culture fraud to Jenna (ÇLaire Lightning 🌩️),en,2025-06-05T05:27:29Z,2025-06-05 01:27:29,0,9048036,230362,6180,"Mon, 15 Dec 2025 17:18:06 GMT"
Lxa8poQYRtc,https://www.youtube.com/watch?v=Lxa8poQYRtc,UgyYhPZfPYV9lVGm2nB4AaABAg,@fywongmd,UCTjS8ed4SHiqETgWR1fapAA,I'm glad Haley Joel Osment has a great sense of humor and embellishes his newfound role as a character actor.,en,2025-06-05T01:48:45Z,2025-06-04 21:48:45,7,1,UgyYhPZfPYV9lVGm2nB4AaABAg.AIy_xGwh_pxALaxXFp5kgn,@rafaelarcas942,UCRn8oW9wIitvr6xBVIoVaQw,I KNEW I recognised him !,NA,2025-08-09T11:07:11Z,2025-08-09 07:07:11,0,9048036,230362,6180,"Mon, 15 Dec 2025 17:18:06 GMT"
Lxa8poQYRtc,https://www.youtube.com/watch?v=Lxa8poQYRtc,UgysdQm7aIF6nElAx3J4AaABAg,@knickydymondz33,UC_XQNEEcBXrcyoR01_eTz5A,Love the recreation of the weapon scene from Mad Max Beyond Thunderdome,en,2025-06-04T15:25:56Z,2025-06-04 11:25:56,2,1,UgysdQm7aIF6nElAx3J4AaABAg.AIxTfbqb_yhALP3491HKV6,@captainbeaky,UCv_WVaet2rXpEaTX5_iyS9g,Also loving the recreation of /homage to the medlab scene from ‘Aliens’ 😂,en,2025-08-04T10:54:15Z,2025-08-04 06:54:15,2,9048036,230362,6180,"Mon, 15 Dec 2025 17:18:06 GMT"
