video_id,video_title,channel_id,channel_title,video_published_at,reply_id,reply_parent_comment_id,reply_author_display,reply_author_channel_id,reply_text,reply_lang,reply_published_utc,reply_published_local,reply_like_count
FFzy3qlkIAM,Trainwreck: Balloon Boy | Official Trailer | Netflix,UCWOA1ZGywLbqmigxE4Qlvuw,Netflix,2025-06-18T18:00:00Z,UgxoiBhTbbhG1l-Ue2Z4AaABAg.AQpgmghY-YqAQpgoetYNuG,UgxoiBhTbbhG1l-Ue2Z4AaABAg,@jeremyfisher636,UCYP3uXspyS24_0FgOTCTE_g,this*,en,2025-12-17T11:06:44Z,2025-12-17 06:06:44,0
FFzy3qlkIAM,Trainwreck: Balloon Boy | Official Trailer | Netflix,UCWOA1ZGywLbqmigxE4Qlvuw,Netflix,2025-06-18T18:00:00Z,Ugxk7ker9ic-5hKcxBd4AaABAg.AKuLprkkfFhAKvIZvPR49a,Ugxk7ker9ic-5hKcxBd4AaABAg,@bitw434,UCNqr8jv6NgkZtHDRb5cng-g,yes!!!!,en,2025-07-23T12:13:12Z,2025-07-23 08:13:12,0
FFzy3qlkIAM,Trainwreck: Balloon Boy | Official Trailer | Netflix,UCWOA1ZGywLbqmigxE4Qlvuw,Netflix,2025-06-18T18:00:00Z,UgwM0A4OZWwQg0YKi5N4AaABAg.AKt11y96o7jAKvIbTvtle5,UgwM0A4OZWwQg0YKi5N4AaABAg,@bitw434,UCNqr8jv6NgkZtHDRb5cng-g,richard is on netflix!!!! goal is achieved,en,2025-07-23T12:13:33Z,2025-07-23 08:13:33,3
FFzy3qlkIAM,Trainwreck: Balloon Boy | Official Trailer | Netflix,UCWOA1ZGywLbqmigxE4Qlvuw,Netflix,2025-06-18T18:00:00Z,UgzwKRdAqA6_5Qdrfjd4AaABAg.AKsvZZNJuHhALE7qVYMsbA,UgzwKRdAqA6_5Qdrfjd4AaABAg,@dalemmmm,UCveCKTalFGhJz2faK-Z10PQ,Isn’t he married to a Japanese woman?? WTF is wrong with you 😂,en,2025-07-31T05:04:18Z,2025-07-31 01:04:18,0
FFzy3qlkIAM,Trainwreck: Balloon Boy | Official Trailer | Netflix,UCWOA1ZGywLbqmigxE4Qlvuw,Netflix,2025-06-18T18:00:00Z,UgxMfUyruJAub7k_zhN4AaABAg.AKrHz04DKPaALSiy3Oi9jJ,UgxMfUyruJAub7k_zhN4AaABAg,@queenbee9874,UCzteOPKiqpHpzBschRtu8YQ,Who looks in an attic that needs a trapeze artist to get into? They hid that kid like a bank robber hiding out in a train tunnel,en,2025-08-05T21:06:45Z,2025-08-05 17:06:45,0
FFzy3qlkIAM,Trainwreck: Balloon Boy | Official Trailer | Netflix,UCWOA1ZGywLbqmigxE4Qlvuw,Netflix,2025-06-18T18:00:00Z,Ugx9Z6pbiumF5nEa2Tx4AaABAg.AKoiEk1YGeKAL_EkHXMim-,Ugx9Z6pbiumF5nEa2Tx4AaABAg,@sloppyjoes7,UCMigVX82T2AJelWWO4vRDNg,"NOTHING HAPPENED TO THEM?
They went to jail! They were called liars and hoaxers, in national media! He almost had his wife deported and family destroyed!
Nothing happened? Are you insane?",en,2025-08-08T19:07:54Z,2025-08-08 15:07:54,1
FFzy3qlkIAM,Trainwreck: Balloon Boy | Official Trailer | Netflix,UCWOA1ZGywLbqmigxE4Qlvuw,Netflix,2025-06-18T18:00:00Z,UgyzlPZ25pAn31aX0yh4AaABAg.AKmOBLFSd26AKsGuhVT2wS,UgyzlPZ25pAn31aX0yh4AaABAg,@rodrigoorozco9263,UCcIUEqH2VX-gSM9UliW5-pw,Yea something is weird about this family,en,2025-07-22T08:00:59Z,2025-07-22 04:00:59,0
FFzy3qlkIAM,Trainwreck: Balloon Boy | Official Trailer | Netflix,UCWOA1ZGywLbqmigxE4Qlvuw,Netflix,2025-06-18T18:00:00Z,UgyhlaKQjSBTPdaB3Uh4AaABAg.AKjjoQL6Jy8ANGg9qVRS3k,UgyhlaKQjSBTPdaB3Uh4AaABAg,@conniebobonnie12,UCwLPoEW0CESIX7Jk8qbBb8Q,"that is a lie, he called the news station LAST for one of their helicopters after 911 barely helped at all (you can find the full 911 call pretty easily its literally the operator asking the same shit over and over)",en,2025-09-19T21:54:11Z,2025-09-19 17:54:11,0
FFzy3qlkIAM,Trainwreck: Balloon Boy | Official Trailer | Netflix,UCWOA1ZGywLbqmigxE4Qlvuw,Netflix,2025-06-18T18:00:00Z,UgzZOY-VQSZ16Tdmjs94AaABAg.AKgYkzYN-_KANGgTfAJLZQ,UgzZOY-VQSZ16Tdmjs94AaABAg,@conniebobonnie12,UCwLPoEW0CESIX7Jk8qbBb8Q,"i have indirect eye contact literally speaking to anyone, especially if its some sort of significant, traumatic event, so dont try to play the eye contact card. it really isnt as substantial as you think it is. not saying it isnt a hoax but to go off of something as simple as that is so lame.",en,2025-09-19T21:56:53Z,2025-09-19 17:56:53,0
FFzy3qlkIAM,Trainwreck: Balloon Boy | Official Trailer | Netflix,UCWOA1ZGywLbqmigxE4Qlvuw,Netflix,2025-06-18T18:00:00Z,Ugy0ZONP8XmOnIF8j2p4AaABAg.AKfGdtLTzqlAKfoflU_2H4,Ugy0ZONP8XmOnIF8j2p4AaABAg,@Koala-beer,UCfofTuFLeNDK0wsIDzPC1aQ,He seems bipolar ….,NA,2025-07-17T11:54:39Z,2025-07-17 07:54:39,1
FFzy3qlkIAM,Trainwreck: Balloon Boy | Official Trailer | Netflix,UCWOA1ZGywLbqmigxE4Qlvuw,Netflix,2025-06-18T18:00:00Z,Ugy0ZONP8XmOnIF8j2p4AaABAg.AKfGdtLTzqlAKmQFx6HyMM,Ugy0ZONP8XmOnIF8j2p4AaABAg,@magellanstravels,UCtUkgbz9CQQ1HLCGePR10iw,He working on underwater waterskiing using a submarine,NA,2025-07-20T01:27:13Z,2025-07-19 21:27:13,0
FFzy3qlkIAM,Trainwreck: Balloon Boy | Official Trailer | Netflix,UCWOA1ZGywLbqmigxE4Qlvuw,Netflix,2025-06-18T18:00:00Z,Ugzyot_6XV74-53IZR14AaABAg.AKf9CncVUmtAKf9F_bQOKs,Ugzyot_6XV74-53IZR14AaABAg,@excellinkus,UCXx4HhTot5op0ZyolAz8EYg,Right on!!!,en,2025-07-17T05:43:56Z,2025-07-17 01:43:56,1
FFzy3qlkIAM,Trainwreck: Balloon Boy | Official Trailer | Netflix,UCWOA1ZGywLbqmigxE4Qlvuw,Netflix,2025-06-18T18:00:00Z,UgxJGZ1xRrM-IwZNych4AaABAg.AKesssxm86qAL5H3e6sdzC,UgxJGZ1xRrM-IwZNych4AaABAg,@nancygervais8666,UClZyEjC_Z7uc8QyR0AHMmgg,Definitely a narcissist. I think he has multiple personality disorders but his narcissism is off the charts!!!!,en,2025-07-27T18:31:42Z,2025-07-27 14:31:42,2
FFzy3qlkIAM,Trainwreck: Balloon Boy | Official Trailer | Netflix,UCWOA1ZGywLbqmigxE4Qlvuw,Netflix,2025-06-18T18:00:00Z,UgxIqrqCiv_h2OciyjJ4AaABAg.AKee7Z5ACs-AKelKXQciV1,UgxIqrqCiv_h2OciyjJ4AaABAg,@pete6705,UCJUQIGNtvwMmcSVV1n1wF-Q,Eric never flew with balloons,en,2025-07-17T02:06:09Z,2025-07-16 22:06:09,0
FFzy3qlkIAM,Trainwreck: Balloon Boy | Official Trailer | Netflix,UCWOA1ZGywLbqmigxE4Qlvuw,Netflix,2025-06-18T18:00:00Z,UgxIqrqCiv_h2OciyjJ4AaABAg.AKee7Z5ACs-AKkJ-Ig8Lm1,UgxIqrqCiv_h2OciyjJ4AaABAg,@NolocoLawrence,UCP1NoPwWj8YM2-LG9FGwKkw,​@pete6705poor Eric,nl,2025-07-19T05:45:18Z,2025-07-19 01:45:18,0
FFzy3qlkIAM,Trainwreck: Balloon Boy | Official Trailer | Netflix,UCWOA1ZGywLbqmigxE4Qlvuw,Netflix,2025-06-18T18:00:00Z,Ugy-itkC7CgX3FdgCc14AaABAg.AKdvuXN9nFZAMGbm0bj35R,Ugy-itkC7CgX3FdgCc14AaABAg,@QUEEN-df1mc,UCLLKgLzamYyfDZcxApa52Cg,But it looks like one,en,2025-08-26T00:44:27Z,2025-08-25 20:44:27,0
FFzy3qlkIAM,Trainwreck: Balloon Boy | Official Trailer | Netflix,UCWOA1ZGywLbqmigxE4Qlvuw,Netflix,2025-06-18T18:00:00Z,Ugz_1P15I7PRDJx5os14AaABAg.AKdb0PN9uxnAKsHikZPxFu,Ugz_1P15I7PRDJx5os14AaABAg,@rodrigoorozco9263,UCcIUEqH2VX-gSM9UliW5-pw,Fr lol,cy,2025-07-22T08:08:05Z,2025-07-22 04:08:05,0
FFzy3qlkIAM,Trainwreck: Balloon Boy | Official Trailer | Netflix,UCWOA1ZGywLbqmigxE4Qlvuw,Netflix,2025-06-18T18:00:00Z,UgxZxiJOcb8MCDPvxox4AaABAg.AKdVwDtJgLAAKelOQ4JHHX,UgxZxiJOcb8MCDPvxox4AaABAg,@pete6705,UCJUQIGNtvwMmcSVV1n1wF-Q,"Ya, that was the whole purpose of the hoax",en,2025-07-17T02:06:42Z,2025-07-16 22:06:42,1
FFzy3qlkIAM,Trainwreck: Balloon Boy | Official Trailer | Netflix,UCWOA1ZGywLbqmigxE4Qlvuw,Netflix,2025-06-18T18:00:00Z,UgxZxiJOcb8MCDPvxox4AaABAg.AKdVwDtJgLAAKijxF3fYjo,UgxZxiJOcb8MCDPvxox4AaABAg,@theCommunicationChannel,UC61eUxiCdhCfrbPVy266cQw,"@pete6705 Yup, so now he's succeeded.",en,2025-07-18T15:11:04Z,2025-07-18 11:11:04,2
FFzy3qlkIAM,Trainwreck: Balloon Boy | Official Trailer | Netflix,UCWOA1ZGywLbqmigxE4Qlvuw,Netflix,2025-06-18T18:00:00Z,Ugx66pSYW3dC7peDAqR4AaABAg.AKd3WiobWmBAKfCW_wKMsD,Ugx66pSYW3dC7peDAqR4AaABAg,@Cohodes,UCQKz2cY8Z9r9gdNzdCc-tUQ,He sure did commit..he swatted the world,en,2025-07-17T06:12:28Z,2025-07-17 02:12:28,0
FFzy3qlkIAM,Trainwreck: Balloon Boy | Official Trailer | Netflix,UCWOA1ZGywLbqmigxE4Qlvuw,Netflix,2025-06-18T18:00:00Z,UgxZoeWlKMxTMDqSUOB4AaABAg.AKcsF-kp_bfAKdGpHlylkf,UgxZoeWlKMxTMDqSUOB4AaABAg,@chrismccoy6481,UC3FN2b2HYeh808wmXGNX1Ww,I didn't know about it until I saw it available on Netflix. And wanted to see what it was about. And I'm in Indiana,en,2025-07-16T12:11:38Z,2025-07-16 08:11:38,1
FFzy3qlkIAM,Trainwreck: Balloon Boy | Official Trailer | Netflix,UCWOA1ZGywLbqmigxE4Qlvuw,Netflix,2025-06-18T18:00:00Z,UgziybFgYbSz-F0nzmp4AaABAg.AKcU-cW5kDyAKh8V0_Qbnl,UgziybFgYbSz-F0nzmp4AaABAg,@juliuscaesart,UCow2WCL8qAtYPmiSJdRseFg,💯,ja,2025-07-18T00:15:47Z,2025-07-17 20:15:47,2
FFzy3qlkIAM,Trainwreck: Balloon Boy | Official Trailer | Netflix,UCWOA1ZGywLbqmigxE4Qlvuw,Netflix,2025-06-18T18:00:00Z,UgziybFgYbSz-F0nzmp4AaABAg.AKcU-cW5kDyAKqxD44BjsU,UgziybFgYbSz-F0nzmp4AaABAg,@Gab3769,UCh1X4GAyLx2um11psmBpsaA,Another reason to think the father is not right in the head,en,2025-07-21T19:40:53Z,2025-07-21 15:40:53,2
FFzy3qlkIAM,Trainwreck: Balloon Boy | Official Trailer | Netflix,UCWOA1ZGywLbqmigxE4Qlvuw,Netflix,2025-06-18T18:00:00Z,UgygslxMXTc7XxfwiPt4AaABAg.AKcPK3ZbHQfAKem4fmpAPt,UgygslxMXTc7XxfwiPt4AaABAg,@pete6705,UCJUQIGNtvwMmcSVV1n1wF-Q,Of course they did,en,2025-07-17T02:12:44Z,2025-07-16 22:12:44,1
FFzy3qlkIAM,Trainwreck: Balloon Boy | Official Trailer | Netflix,UCWOA1ZGywLbqmigxE4Qlvuw,Netflix,2025-06-18T18:00:00Z,UgygslxMXTc7XxfwiPt4AaABAg.AKcPK3ZbHQfAKfBmZsZkqS,UgygslxMXTc7XxfwiPt4AaABAg,@Cohodes,UCQKz2cY8Z9r9gdNzdCc-tUQ,"​@pete6705, im sure they made money..",NA,2025-07-17T06:06:03Z,2025-07-17 02:06:03,0
FFzy3qlkIAM,Trainwreck: Balloon Boy | Official Trailer | Netflix,UCWOA1ZGywLbqmigxE4Qlvuw,Netflix,2025-06-18T18:00:00Z,UgyTQL1ZVxH8lWIczzt4AaABAg.AKc3bzm7KOsAKcTuYaW6AR,UgyTQL1ZVxH8lWIczzt4AaABAg,@shaun5047,UCY2LXYCVqJ923oHBy_H7WJw,Yep but that’s not even the worst part imo. It’s the fact that the parents dragged the kids into their super selfish attempt at getting a tv show. Pretty hilarious that the 6 year old immediately shared the secret. 😂,en,2025-07-16T04:46:43Z,2025-07-16 00:46:43,4
FFzy3qlkIAM,Trainwreck: Balloon Boy | Official Trailer | Netflix,UCWOA1ZGywLbqmigxE4Qlvuw,Netflix,2025-06-18T18:00:00Z,UgyTQL1ZVxH8lWIczzt4AaABAg.AKc3bzm7KOsAKd47qZwoq4,UgyTQL1ZVxH8lWIczzt4AaABAg,@liamwatson5125,UCzm0tNA_OG8xvYXzw7KWYaw,Helium asphyxiation is deadly.,en,2025-07-16T10:20:43Z,2025-07-16 06:20:43,0
FFzy3qlkIAM,Trainwreck: Balloon Boy | Official Trailer | Netflix,UCWOA1ZGywLbqmigxE4Qlvuw,Netflix,2025-06-18T18:00:00Z,UgwNtihSUQ3oQVRTw2B4AaABAg.AKbcEud8sYRAKcVK38NWNz,UgwNtihSUQ3oQVRTw2B4AaABAg,@shaun5047,UCY2LXYCVqJ923oHBy_H7WJw,Yea I can’t lie look at the balloon I knew it was impossible for a boy to be onboard. However that 911 call with his voice cracking for a second think wait were they actually telling the truth?? 😂,en,2025-07-16T04:59:04Z,2025-07-16 00:59:04,0
FFzy3qlkIAM,Trainwreck: Balloon Boy | Official Trailer | Netflix,UCWOA1ZGywLbqmigxE4Qlvuw,Netflix,2025-06-18T18:00:00Z,UgwNtihSUQ3oQVRTw2B4AaABAg.AKbcEud8sYRAKvTo50fkhQ,UgwNtihSUQ3oQVRTw2B4AaABAg,@daviddonner-v2u,UCb3cg9GD_-LX7ulF-VrPMLA,@shaun5047 And remember it was filled with helium - no way that kid could have survived without oxygen for an hour.,en,2025-07-23T13:51:24Z,2025-07-23 09:51:24,1
FFzy3qlkIAM,Trainwreck: Balloon Boy | Official Trailer | Netflix,UCWOA1ZGywLbqmigxE4Qlvuw,Netflix,2025-06-18T18:00:00Z,Ugx-XmF4KCU3v7BcSTl4AaABAg.AKbXt1DECdJAKcV0FKXEKt,Ugx-XmF4KCU3v7BcSTl4AaABAg,@shaun5047,UCY2LXYCVqJ923oHBy_H7WJw,Yep which is why it was so obvious to me that the family especially the father was lying. There’s no way he built it from scratch and genuinely thought it was strong enough to take off with a 6 year old inside. 😂 The thing wasn’t even slagging when it took off.,en,2025-07-16T04:56:22Z,2025-07-16 00:56:22,8
FFzy3qlkIAM,Trainwreck: Balloon Boy | Official Trailer | Netflix,UCWOA1ZGywLbqmigxE4Qlvuw,Netflix,2025-06-18T18:00:00Z,Ugx-XmF4KCU3v7BcSTl4AaABAg.AKbXt1DECdJAKdRwMe45N-,Ugx-XmF4KCU3v7BcSTl4AaABAg,@hotsexyangel,UCz51vzaHR6GkJSy9ZG3q9dg,"@shaun5047 well when your son tells you your other son is inside the balloon, you’re not gonna waste time thinking “oh well the balloon isn’t slagging” no, you’re gonna assume it to be true incase the worst possible outcome is real",en,2025-07-16T13:48:43Z,2025-07-16 09:48:43,0
FFzy3qlkIAM,Trainwreck: Balloon Boy | Official Trailer | Netflix,UCWOA1ZGywLbqmigxE4Qlvuw,Netflix,2025-06-18T18:00:00Z,Ugx-XmF4KCU3v7BcSTl4AaABAg.AKbXt1DECdJAKel7GP8umx,Ugx-XmF4KCU3v7BcSTl4AaABAg,@pete6705,UCJUQIGNtvwMmcSVV1n1wF-Q,"Ya I never got that. It was a flimsy little helium balloon, I don’t think it could have lifted a cat. There wasn’t even a part of it that a boy could climb into",en,2025-07-17T02:04:21Z,2025-07-16 22:04:21,4
FFzy3qlkIAM,Trainwreck: Balloon Boy | Official Trailer | Netflix,UCWOA1ZGywLbqmigxE4Qlvuw,Netflix,2025-06-18T18:00:00Z,Ugx-XmF4KCU3v7BcSTl4AaABAg.AKbXt1DECdJANGf4RP0PxG,Ugx-XmF4KCU3v7BcSTl4AaABAg,@conniebobonnie12,UCwLPoEW0CESIX7Jk8qbBb8Q,​@pete6705 wasnt there like a shitton of electrical equipment in there tho,en,2025-09-19T21:44:42Z,2025-09-19 17:44:42,0
FFzy3qlkIAM,Trainwreck: Balloon Boy | Official Trailer | Netflix,UCWOA1ZGywLbqmigxE4Qlvuw,Netflix,2025-06-18T18:00:00Z,UgwhxI_fijqKQWdaj6B4AaABAg.AKHzpuFPySwAKaWrEF8z4e,UgwhxI_fijqKQWdaj6B4AaABAg,@aea9420,UCv73gwZH0oWNcUowYIwh9jA,That's what i was thinking and propably paid them too,en,2025-07-15T10:34:00Z,2025-07-15 06:34:00,1
FFzy3qlkIAM,Trainwreck: Balloon Boy | Official Trailer | Netflix,UCWOA1ZGywLbqmigxE4Qlvuw,Netflix,2025-06-18T18:00:00Z,UgyWvQ5b5bYxYQWCc_d4AaABAg.AKHPoBl6TtCAKzC5jm2vfD,UgyWvQ5b5bYxYQWCc_d4AaABAg,@roberthernandez3902,UCpyNp8ug-LRJEdkkXCOekIg,Now this again lol all bs soooo stupid,NA,2025-07-25T00:33:37Z,2025-07-24 20:33:37,4
FFzy3qlkIAM,Trainwreck: Balloon Boy | Official Trailer | Netflix,UCWOA1ZGywLbqmigxE4Qlvuw,Netflix,2025-06-18T18:00:00Z,UgwiUHbW6LvFxWVr4mh4AaABAg.AKEhJTlas2AAKemdU8Xney,UgwiUHbW6LvFxWVr4mh4AaABAg,@pete6705,UCJUQIGNtvwMmcSVV1n1wF-Q,I saw his video. But I still 100% believe this was a hoax,en,2025-07-17T02:17:37Z,2025-07-16 22:17:37,1
FFzy3qlkIAM,Trainwreck: Balloon Boy | Official Trailer | Netflix,UCWOA1ZGywLbqmigxE4Qlvuw,Netflix,2025-06-18T18:00:00Z,UgwUHnwWOkYJ0yipK_h4AaABAg.AKESTYjT1xcAKd4YHBMIea,UgwUHnwWOkYJ0yipK_h4AaABAg,@liamwatson5125,UCzm0tNA_OG8xvYXzw7KWYaw,Well it is against the law to pretend that you know somebody when you don’t. It makes them fearful and unsafe.,en,2025-07-16T10:24:19Z,2025-07-16 06:24:19,1
FFzy3qlkIAM,Trainwreck: Balloon Boy | Official Trailer | Netflix,UCWOA1ZGywLbqmigxE4Qlvuw,Netflix,2025-06-18T18:00:00Z,UgwUHnwWOkYJ0yipK_h4AaABAg.AKESTYjT1xcAKdHI0c-YfY,UgwUHnwWOkYJ0yipK_h4AaABAg,@chrismccoy6481,UC3FN2b2HYeh808wmXGNX1Ww,​@liamwatson5125😂 no nothing like that exists. People just say random stupid shit,en,2025-07-16T12:15:42Z,2025-07-16 08:15:42,7
FFzy3qlkIAM,Trainwreck: Balloon Boy | Official Trailer | Netflix,UCWOA1ZGywLbqmigxE4Qlvuw,Netflix,2025-06-18T18:00:00Z,UgwUHnwWOkYJ0yipK_h4AaABAg.AKESTYjT1xcAKdVLO0hEe5,UgwUHnwWOkYJ0yipK_h4AaABAg,@liamwatson5125,UCzm0tNA_OG8xvYXzw7KWYaw,"⁠​⁠@chrismccoy6481Yes, that does exist. You can’t legally pretend that you know somebody. That would be stalking.",en,2025-07-16T14:18:29Z,2025-07-16 10:18:29,1
FFzy3qlkIAM,Trainwreck: Balloon Boy | Official Trailer | Netflix,UCWOA1ZGywLbqmigxE4Qlvuw,Netflix,2025-06-18T18:00:00Z,UgwUHnwWOkYJ0yipK_h4AaABAg.AKESTYjT1xcALFD1-xZyV4,UgwUHnwWOkYJ0yipK_h4AaABAg,@AlienScientist,UC1ZJSPHkcgG_g7o1gAP5gxQ,"I did know him... I lived in Fort Collins and worked with Richard Heene in the summer of 2009... These people telling the ""inside story"" don't have the real inside story.",en,2025-07-31T15:08:48Z,2025-07-31 11:08:48,0
FFzy3qlkIAM,Trainwreck: Balloon Boy | Official Trailer | Netflix,UCWOA1ZGywLbqmigxE4Qlvuw,Netflix,2025-06-18T18:00:00Z,UgwUHnwWOkYJ0yipK_h4AaABAg.AKESTYjT1xcANJ13S1kZHR,UgwUHnwWOkYJ0yipK_h4AaABAg,@betosgarage,UC9F_wcMe9Xe_4btzovHx6fQ,"“some face their fears , others fear their face”",en,2025-09-20T19:44:01Z,2025-09-20 15:44:01,0
FFzy3qlkIAM,Trainwreck: Balloon Boy | Official Trailer | Netflix,UCWOA1ZGywLbqmigxE4Qlvuw,Netflix,2025-06-18T18:00:00Z,Ugytph15gkiSyVi6OTR4AaABAg.AKCdIZcPUqiAKcKnSZrdo5,Ugytph15gkiSyVi6OTR4AaABAg,@ashleynxo,UCPcX-tva_wLGT2QClEDxa9Q,They're SO good!,en,2025-07-16T03:27:06Z,2025-07-15 23:27:06,3
FFzy3qlkIAM,Trainwreck: Balloon Boy | Official Trailer | Netflix,UCWOA1ZGywLbqmigxE4Qlvuw,Netflix,2025-06-18T18:00:00Z,Ugytph15gkiSyVi6OTR4AaABAg.AKCdIZcPUqiAKcNbSZ9uIz,Ugytph15gkiSyVi6OTR4AaABAg,@heidiheisele8608,UCrgDpTWTeGee-ougMF7CAAQ,Same Netflix's Trainwreck series have really stepped up 👍,en,2025-07-16T03:51:40Z,2025-07-15 23:51:40,4
FFzy3qlkIAM,Trainwreck: Balloon Boy | Official Trailer | Netflix,UCWOA1ZGywLbqmigxE4Qlvuw,Netflix,2025-06-18T18:00:00Z,Ugytph15gkiSyVi6OTR4AaABAg.AKCdIZcPUqiAKjtqAR0f-0,Ugytph15gkiSyVi6OTR4AaABAg,@justinejustice_league1857,UCiAsE0i9cC0Ir4WXVFaXiew,Just waiting on Eugenia Cooneys story,en,2025-07-19T01:56:44Z,2025-07-18 21:56:44,3
FFzy3qlkIAM,Trainwreck: Balloon Boy | Official Trailer | Netflix,UCWOA1ZGywLbqmigxE4Qlvuw,Netflix,2025-06-18T18:00:00Z,Ugytph15gkiSyVi6OTR4AaABAg.AKCdIZcPUqiANi55nNNcb-,Ugytph15gkiSyVi6OTR4AaABAg,@indubitably01,UCb1Mbx21zQrRBzosBYQEkGA,"Normie slop, just ask chatGPT to tell you a story in the style of a documentary",en,2025-09-30T22:39:33Z,2025-09-30 18:39:33,0
FFzy3qlkIAM,Trainwreck: Balloon Boy | Official Trailer | Netflix,UCWOA1ZGywLbqmigxE4Qlvuw,Netflix,2025-06-18T18:00:00Z,UgyR9XP-fQ7jvurMniV4AaABAg.AJyssfPLxoRAKcWT_DgjMB,UgyR9XP-fQ7jvurMniV4AaABAg,@shaun5047,UCY2LXYCVqJ923oHBy_H7WJw,lol That still wouldn’t explain the “because you guys told me not to” line when asked why he didn’t come down after hearing everyone call his name. Another dead give away was the fact that dad even entertained the idea of the ballon being capable of carrying a 6 year old. No where near strong enough and the thing never even sagged. 😂,en,2025-07-16T05:09:06Z,2025-07-16 01:09:06,2
FFzy3qlkIAM,Trainwreck: Balloon Boy | Official Trailer | Netflix,UCWOA1ZGywLbqmigxE4Qlvuw,Netflix,2025-06-18T18:00:00Z,UgyR9XP-fQ7jvurMniV4AaABAg.AJyssfPLxoRAKdvVr1wrsg,UgyR9XP-fQ7jvurMniV4AaABAg,@liamwatson5125,UCzm0tNA_OG8xvYXzw7KWYaw,That statement was used against his parents in the court of law.,en,2025-07-16T18:15:51Z,2025-07-16 14:15:51,0
FFzy3qlkIAM,Trainwreck: Balloon Boy | Official Trailer | Netflix,UCWOA1ZGywLbqmigxE4Qlvuw,Netflix,2025-06-18T18:00:00Z,UgyR9XP-fQ7jvurMniV4AaABAg.AJyssfPLxoRAKemvN6ydCr,UgyR9XP-fQ7jvurMniV4AaABAg,@pete6705,UCJUQIGNtvwMmcSVV1n1wF-Q,The mother confessed in the police interrogation.  But then later when she realized they were going to get in real trouble she said her English was bad and she didn’t know what the word hoax meant.  But in that interrogation she looks like she completely understands everything she’s saying,en,2025-07-17T02:20:04Z,2025-07-16 22:20:04,4
FFzy3qlkIAM,Trainwreck: Balloon Boy | Official Trailer | Netflix,UCWOA1ZGywLbqmigxE4Qlvuw,Netflix,2025-06-18T18:00:00Z,UgyR9XP-fQ7jvurMniV4AaABAg.AJyssfPLxoRAL5c1AAbCDk,UgyR9XP-fQ7jvurMniV4AaABAg,@Schnibs,UCfcA5Rq57QhGTD5vg7jEkHQ,"​@pete6705 she confessed because she brought in for interogation under false pretenses and was led to believe she could be at risk of deportation. Richard has never been caught in a lie, the feds and the media have.
They said he called the news first, he didn't. He was put on hold with 911 and called the news knowing they would send a helicopter to track the balloon.
I mean the video of the event is him calling his wife a stupid bitch the whole time and he can't trust her to do anything. Not exactly how you'd present yourself of you was going to make it a hoax...",en,2025-07-27T21:43:37Z,2025-07-27 17:43:37,0
FFzy3qlkIAM,Trainwreck: Balloon Boy | Official Trailer | Netflix,UCWOA1ZGywLbqmigxE4Qlvuw,Netflix,2025-06-18T18:00:00Z,UgzC3-KmjiiuZvPng8x4AaABAg.AJyEv_CnCejAK-PnHD4sob,UgzC3-KmjiiuZvPng8x4AaABAg,@LodisVlogs,UCnptCim5XEeMIysHiHB1pYA,"girl, this is what you’re crying about? Must be nice to live your life. ❤",en,2025-06-30T15:21:09Z,2025-06-30 11:21:09,2
FFzy3qlkIAM,Trainwreck: Balloon Boy | Official Trailer | Netflix,UCWOA1ZGywLbqmigxE4Qlvuw,Netflix,2025-06-18T18:00:00Z,UgzC3-KmjiiuZvPng8x4AaABAg.AJyEv_CnCejAK7UievEkVN,UgzC3-KmjiiuZvPng8x4AaABAg,@rydgemolino,UC1vVtlyXsMUC99QrdJaVEaA,But he wasnt in the balloon after the whole fiasco this was televised worldwide i remeber when this happened,en,2025-07-03T18:38:08Z,2025-07-03 14:38:08,0
FFzy3qlkIAM,Trainwreck: Balloon Boy | Official Trailer | Netflix,UCWOA1ZGywLbqmigxE4Qlvuw,Netflix,2025-06-18T18:00:00Z,UgzC3-KmjiiuZvPng8x4AaABAg.AJyEv_CnCejAKaRnog60DP,UgzC3-KmjiiuZvPng8x4AaABAg,@majinbuu19831,UCrv3l9NYMr7OTkKlIE9tNeA,Who cares if they give away the whole story or not it’s lame anyway plus it doesn’t feel like a movie. It feels like a lame documentary of something that never happened.,en,2025-07-15T09:49:50Z,2025-07-15 05:49:50,0
FFzy3qlkIAM,Trainwreck: Balloon Boy | Official Trailer | Netflix,UCWOA1ZGywLbqmigxE4Qlvuw,Netflix,2025-06-18T18:00:00Z,UgyUH7MlMYvWgryxi6Z4AaABAg.AJqG95DJiNoAJsugOs7NTi,UgyUH7MlMYvWgryxi6Z4AaABAg,@eggsandclippy7,UCKB3tE_Ll8YeZquRa4eAxdA,Facts lmao,NA,2025-06-27T17:25:54Z,2025-06-27 13:25:54,0
FFzy3qlkIAM,Trainwreck: Balloon Boy | Official Trailer | Netflix,UCWOA1ZGywLbqmigxE4Qlvuw,Netflix,2025-06-18T18:00:00Z,Ugzqjw183BWWjjGtBkx4AaABAg.AJoaulahDToAKdS-UZC4UO,Ugzqjw183BWWjjGtBkx4AaABAg,@hotsexyangel,UCz51vzaHR6GkJSy9ZG3q9dg,No one is forcing you to relive it bro just don’t watch 😂 the world doesn’t revolve around u dude,en,2025-07-16T13:49:17Z,2025-07-16 09:49:17,0
FFzy3qlkIAM,Trainwreck: Balloon Boy | Official Trailer | Netflix,UCWOA1ZGywLbqmigxE4Qlvuw,Netflix,2025-06-18T18:00:00Z,UgyKTUctJTtibk6NL4l4AaABAg.AJiZj29I7R_AJihtIaoMP_,UgyKTUctJTtibk6NL4l4AaABAg,@RONderluck,UC6ut1f1GQu_2Yq6rP8qvn5A,No,es,2025-06-23T18:21:39Z,2025-06-23 14:21:39,0
FFzy3qlkIAM,Trainwreck: Balloon Boy | Official Trailer | Netflix,UCWOA1ZGywLbqmigxE4Qlvuw,Netflix,2025-06-18T18:00:00Z,UgwSvmtxyibh7iPDGdd4AaABAg.AJhnu4OoYgeAJiJ6g9mVKw,UgwSvmtxyibh7iPDGdd4AaABAg,@brentad2004,UCa1VL2rCuNGuQnnelQZG3PQ,Uh he dead.,nl,2025-06-23T14:36:26Z,2025-06-23 10:36:26,0
FFzy3qlkIAM,Trainwreck: Balloon Boy | Official Trailer | Netflix,UCWOA1ZGywLbqmigxE4Qlvuw,Netflix,2025-06-18T18:00:00Z,UgwSvmtxyibh7iPDGdd4AaABAg.AJhnu4OoYgeAJiQL8V3515,UgwSvmtxyibh7iPDGdd4AaABAg,@DannyDiablo1013,UCKRbTeLbBhyfambzHJpVBTg,This case happened 2009 when Jackson died buddy ​@brentad2004,en,2025-06-23T15:39:34Z,2025-06-23 11:39:34,0
FFzy3qlkIAM,Trainwreck: Balloon Boy | Official Trailer | Netflix,UCWOA1ZGywLbqmigxE4Qlvuw,Netflix,2025-06-18T18:00:00Z,UgwuOlVq4YWd9Y2MSGN4AaABAg.AJhI8ynKOG6AJlSgswRjb7,UgwuOlVq4YWd9Y2MSGN4AaABAg,@TheBlueFox_87,UChsnmOLbBF_SwksAn0mXfgA,I finally found a fnaf comment-,en,2025-06-24T19:57:52Z,2025-06-24 15:57:52,0
FFzy3qlkIAM,Trainwreck: Balloon Boy | Official Trailer | Netflix,UCWOA1ZGywLbqmigxE4Qlvuw,Netflix,2025-06-18T18:00:00Z,UgySTc42qRQlGoTkSJV4AaABAg.AJf5ZCx_uoQAJfCjhgiczm,UgySTc42qRQlGoTkSJV4AaABAg,@Radardocsexplain,UCjbOTMmz-nC6tALavpWt3Eg,No it's a documentary,en,2025-06-22T09:43:00Z,2025-06-22 05:43:00,1
FFzy3qlkIAM,Trainwreck: Balloon Boy | Official Trailer | Netflix,UCWOA1ZGywLbqmigxE4Qlvuw,Netflix,2025-06-18T18:00:00Z,UgySTc42qRQlGoTkSJV4AaABAg.AJf5ZCx_uoQAJfDEY8r3CU,UgySTc42qRQlGoTkSJV4AaABAg,@Kermie-Frog-1955,UCXKiUIN7J1erV-bu9KojV4g,@RadardocsexplainI was joking,la,2025-06-22T09:47:21Z,2025-06-22 05:47:21,0
FFzy3qlkIAM,Trainwreck: Balloon Boy | Official Trailer | Netflix,UCWOA1ZGywLbqmigxE4Qlvuw,Netflix,2025-06-18T18:00:00Z,UgySTc42qRQlGoTkSJV4AaABAg.AJf5ZCx_uoQAJfHAfCzt94,UgySTc42qRQlGoTkSJV4AaABAg,@Radardocsexplain,UCjbOTMmz-nC6tALavpWt3Eg,​@Kermie-Frog-1955ah i see *punches face*,en,2025-06-22T10:21:46Z,2025-06-22 06:21:46,0
FFzy3qlkIAM,Trainwreck: Balloon Boy | Official Trailer | Netflix,UCWOA1ZGywLbqmigxE4Qlvuw,Netflix,2025-06-18T18:00:00Z,UgySTc42qRQlGoTkSJV4AaABAg.AJf5ZCx_uoQAJgs2OeOb_u,UgySTc42qRQlGoTkSJV4AaABAg,@Kermie-Frog-1955,UCXKiUIN7J1erV-bu9KojV4g,@Radardocsexplain🦆,la,2025-06-23T01:11:56Z,2025-06-22 21:11:56,0
FFzy3qlkIAM,Trainwreck: Balloon Boy | Official Trailer | Netflix,UCWOA1ZGywLbqmigxE4Qlvuw,Netflix,2025-06-18T18:00:00Z,Ugy7ns8G1yptAsi1afx4AaABAg.AJdgT2gvkCYAKJxfeUWG8h,Ugy7ns8G1yptAsi1afx4AaABAg,@partywithsaints,UCQgqjdINC1A-1uWICzjDOtQ,I remember that!! And also remember someone auto tuned that interview 😂,en,2025-07-08T14:50:45Z,2025-07-08 10:50:45,5
FFzy3qlkIAM,Trainwreck: Balloon Boy | Official Trailer | Netflix,UCWOA1ZGywLbqmigxE4Qlvuw,Netflix,2025-06-18T18:00:00Z,Ugy7ns8G1yptAsi1afx4AaABAg.AJdgT2gvkCYAK_TyHmfkP1,Ugy7ns8G1yptAsi1afx4AaABAg,@HelloNewMoon,UCimxaogsgxGwYdXo3FpvcOQ,Someone also farted 😂,en,2025-07-15T00:49:30Z,2025-07-14 20:49:30,3
FFzy3qlkIAM,Trainwreck: Balloon Boy | Official Trailer | Netflix,UCWOA1ZGywLbqmigxE4Qlvuw,Netflix,2025-06-18T18:00:00Z,Ugy7ns8G1yptAsi1afx4AaABAg.AJdgT2gvkCYAKbHFXP8WKX,Ugy7ns8G1yptAsi1afx4AaABAg,@cuckmasterflex9106,UCOi_U2hAmmJ_n6q0uJ7HQlg,They're innocent,en,2025-07-15T17:36:52Z,2025-07-15 13:36:52,0
FFzy3qlkIAM,Trainwreck: Balloon Boy | Official Trailer | Netflix,UCWOA1ZGywLbqmigxE4Qlvuw,Netflix,2025-06-18T18:00:00Z,Ugy7ns8G1yptAsi1afx4AaABAg.AJdgT2gvkCYAKd3tEyOh6Q,Ugy7ns8G1yptAsi1afx4AaABAg,@liamwatson5125,UCzm0tNA_OG8xvYXzw7KWYaw,It’s against the law for children to speak out in public unless they’re spoken to by their parents. Falcon was prevaricating.,en,2025-07-16T10:18:35Z,2025-07-16 06:18:35,0
FFzy3qlkIAM,Trainwreck: Balloon Boy | Official Trailer | Netflix,UCWOA1ZGywLbqmigxE4Qlvuw,Netflix,2025-06-18T18:00:00Z,Ugy7ns8G1yptAsi1afx4AaABAg.AJdgT2gvkCYAKdLaST2PwF,Ugy7ns8G1yptAsi1afx4AaABAg,@balanced-shez8226,UCgzBwYt8DRHjaTj5LePyuEA,"What the child meant was A journalist asked Falcon ""show me where you hid, for the show you will be on"" Now do you understand? He was 6 He thought they were talking about him Unbelievable",en,2025-07-16T12:53:18Z,2025-07-16 08:53:18,9
FFzy3qlkIAM,Trainwreck: Balloon Boy | Official Trailer | Netflix,UCWOA1ZGywLbqmigxE4Qlvuw,Netflix,2025-06-18T18:00:00Z,Ugy7ns8G1yptAsi1afx4AaABAg.AJdgT2gvkCYAKdSBrWM-od,Ugy7ns8G1yptAsi1afx4AaABAg,@hotsexyangel,UCz51vzaHR6GkJSy9ZG3q9dg,Why did everyone take this 6 year olds words so seriously? He’s just a kid and there was a media frenzy in his house. He didn’t know what he was saying 😭,en,2025-07-16T13:50:58Z,2025-07-16 09:50:58,0
