video_id,video_title,channel_id,channel_title,video_published_at,reply_id,reply_parent_comment_id,reply_author_display,reply_author_channel_id,reply_text,reply_lang,reply_published_utc,reply_published_local,reply_like_count
FFzy3qlkIAM,Trainwreck: Balloon Boy | Official Trailer | Netflix,UCWOA1ZGywLbqmigxE4Qlvuw,Netflix,2025-06-18T18:00:00Z,Ugy7ns8G1yptAsi1afx4AaABAg.AJdgT2gvkCYAKdUJHBORLJ,Ugy7ns8G1yptAsi1afx4AaABAg,@liamwatson5125,UCzm0tNA_OG8xvYXzw7KWYaw,@balanced-shez8226He hid in the garage attic like Tom Kitten in The Tale of Samuel Whiskers.,NA,2025-07-16T14:09:28Z,2025-07-16 10:09:28,1
FFzy3qlkIAM,Trainwreck: Balloon Boy | Official Trailer | Netflix,UCWOA1ZGywLbqmigxE4Qlvuw,Netflix,2025-06-18T18:00:00Z,Ugy7ns8G1yptAsi1afx4AaABAg.AJdgT2gvkCYAKekqOglcjE,Ugy7ns8G1yptAsi1afx4AaABAg,@pete6705,UCJUQIGNtvwMmcSVV1n1wF-Q,"@balanced-shez8226 no, it was the parent’s hoax",fr,2025-07-17T02:01:55Z,2025-07-16 22:01:55,7
FFzy3qlkIAM,Trainwreck: Balloon Boy | Official Trailer | Netflix,UCWOA1ZGywLbqmigxE4Qlvuw,Netflix,2025-06-18T18:00:00Z,Ugy7ns8G1yptAsi1afx4AaABAg.AJdgT2gvkCYAMCApdroIIt,Ugy7ns8G1yptAsi1afx4AaABAg,@Sk8x4x3v3r,UCc8UZ2fNo0eiH5b_MYEbSlg,lol. The parents didn’t look surprised or thrown off when the kid said that. They were scratching the back of their heads looking around acting like he ain’t said that,en,2025-08-24T07:23:18Z,2025-08-24 03:23:18,0
FFzy3qlkIAM,Trainwreck: Balloon Boy | Official Trailer | Netflix,UCWOA1ZGywLbqmigxE4Qlvuw,Netflix,2025-06-18T18:00:00Z,Ugy7ns8G1yptAsi1afx4AaABAg.AJdgT2gvkCYANjmJaF8q1Z,Ugy7ns8G1yptAsi1afx4AaABAg,@Flugs0,UCIM6pYXT92sq7cLMHO_r_Gw,@pete6705 There's was no hoax. It becomes abundantly obvious once you actually look a little bit beyond mainstream media articles.,en,2025-10-01T14:25:09Z,2025-10-01 10:25:09,0
FFzy3qlkIAM,Trainwreck: Balloon Boy | Official Trailer | Netflix,UCWOA1ZGywLbqmigxE4Qlvuw,Netflix,2025-06-18T18:00:00Z,Ugy7ns8G1yptAsi1afx4AaABAg.AJdgT2gvkCYANjrI4JIHwO,Ugy7ns8G1yptAsi1afx4AaABAg,@pete6705,UCJUQIGNtvwMmcSVV1n1wF-Q,@Flugs0 I’ve read and watched a good amount about this story. I even watched a long video by Internet Historian about why it might not be a hoax.  But with everything I’ve learned I still feel very strongly that it was a hoax,en,2025-10-01T15:08:39Z,2025-10-01 11:08:39,0
FFzy3qlkIAM,Trainwreck: Balloon Boy | Official Trailer | Netflix,UCWOA1ZGywLbqmigxE4Qlvuw,Netflix,2025-06-18T18:00:00Z,Ugy7ns8G1yptAsi1afx4AaABAg.AJdgT2gvkCYANk3NHxfNvO,Ugy7ns8G1yptAsi1afx4AaABAg,@Flugs0,UCIM6pYXT92sq7cLMHO_r_Gw,"@pete6705 I've seen Internet Historian's video too. The argument for it being a hoax basically boils down to one quote by a six year old, doesn't it? I don't find it very convincing. I think there's way too much speaking against it.",en,2025-10-01T17:02:57Z,2025-10-01 13:02:57,0
FFzy3qlkIAM,Trainwreck: Balloon Boy | Official Trailer | Netflix,UCWOA1ZGywLbqmigxE4Qlvuw,Netflix,2025-06-18T18:00:00Z,Ugy7ns8G1yptAsi1afx4AaABAg.AJdgT2gvkCYANz1NsfAdvs,Ugy7ns8G1yptAsi1afx4AaABAg,@pete6705,UCJUQIGNtvwMmcSVV1n1wF-Q,"⁠​⁠@Flugs0 I think it’s more than just what the boy said.  I find it hard to believe the dad really thought his son went into the balloon. That balloon didn’t have any kind of compartment that you could climb into, and the dad knew that. There was no possible way for a boy to climb into it. That balloon couldn’t have lifted a boy anyways, I don’t think it could have lifted a cat.  And just watching all the interviews with the mom and dad, I just don’t trust them.",en,2025-10-07T12:34:10Z,2025-10-07 08:34:10,0
FFzy3qlkIAM,Trainwreck: Balloon Boy | Official Trailer | Netflix,UCWOA1ZGywLbqmigxE4Qlvuw,Netflix,2025-06-18T18:00:00Z,Ugy7ns8G1yptAsi1afx4AaABAg.AJdgT2gvkCYANz62ZcfOPT,Ugy7ns8G1yptAsi1afx4AaABAg,@Flugs0,UCIM6pYXT92sq7cLMHO_r_Gw,"@pete6705 The boy had climbed into the balloon four times on just that day, did you not know about that? Therefore it must have had some kind of compartment. That the balloon wouldn't have been able to lift the boy I do see, but I think in that case the dad's reaction could be chalked up to panic and stress.",en,2025-10-07T13:14:57Z,2025-10-07 09:14:57,0
FFzy3qlkIAM,Trainwreck: Balloon Boy | Official Trailer | Netflix,UCWOA1ZGywLbqmigxE4Qlvuw,Netflix,2025-06-18T18:00:00Z,UgzN-wyIKrdvR-8IUH94AaABAg.AJc8sqtB1hYAJiJJ9jcrO4,UgzN-wyIKrdvR-8IUH94AaABAg,@brentad2004,UCa1VL2rCuNGuQnnelQZG3PQ,He probably work for NF.,en,2025-06-23T14:38:08Z,2025-06-23 10:38:08,0
FFzy3qlkIAM,Trainwreck: Balloon Boy | Official Trailer | Netflix,UCWOA1ZGywLbqmigxE4Qlvuw,Netflix,2025-06-18T18:00:00Z,UgwmldqNHYbpbIhJi5R4AaABAg.AJb4uoBdSjqAKbVM1Avi4E,UgwmldqNHYbpbIhJi5R4AaABAg,@LLandS18,UC2recutIfRA-dbtLEMNB5ZQ,Yeah I might believe he didn't do this as a public stunt if he wasn't clearly. So desperate to be on TV. If he wasn't trying to be a demented version of Bill Nye the science Guy or Neil deGrasse Tyson.,en,2025-07-15T19:40:06Z,2025-07-15 15:40:06,0
FFzy3qlkIAM,Trainwreck: Balloon Boy | Official Trailer | Netflix,UCWOA1ZGywLbqmigxE4Qlvuw,Netflix,2025-06-18T18:00:00Z,UgyBZ-rQ7lmK_L3MXZ54AaABAg.AJay8l1GkehAJdyLx47RBA,UgyBZ-rQ7lmK_L3MXZ54AaABAg,@Charsi_Escobar,UCGnAxMdIuezPcsqcOm4O1sg,Got any memorable anecdotes you can share?,en,2025-06-21T22:09:19Z,2025-06-21 18:09:19,2
FFzy3qlkIAM,Trainwreck: Balloon Boy | Official Trailer | Netflix,UCWOA1ZGywLbqmigxE4Qlvuw,Netflix,2025-06-18T18:00:00Z,UgyBZ-rQ7lmK_L3MXZ54AaABAg.AJay8l1GkehAJpr8Ln8WK2,UgyBZ-rQ7lmK_L3MXZ54AaABAg,@tylermitchell4883,UCZcLlff6EfzJgWgE2-zvq0Q,@Charsi_EscobarI want to know too 😂,NA,2025-06-26T12:57:11Z,2025-06-26 08:57:11,0
FFzy3qlkIAM,Trainwreck: Balloon Boy | Official Trailer | Netflix,UCWOA1ZGywLbqmigxE4Qlvuw,Netflix,2025-06-18T18:00:00Z,UgyBZ-rQ7lmK_L3MXZ54AaABAg.AJay8l1GkehAJv56an6rOD,UgyBZ-rQ7lmK_L3MXZ54AaABAg,@PeteFiftyeight,UCwFLCAQ5HSxYXPJXSwZdHLw,no it didn't and you live nowhere near those people.,en,2025-06-28T13:44:13Z,2025-06-28 09:44:13,1
FFzy3qlkIAM,Trainwreck: Balloon Boy | Official Trailer | Netflix,UCWOA1ZGywLbqmigxE4Qlvuw,Netflix,2025-06-18T18:00:00Z,UgyBZ-rQ7lmK_L3MXZ54AaABAg.AJay8l1GkehAJv5BnN4L4p,UgyBZ-rQ7lmK_L3MXZ54AaABAg,@PeteFiftyeight,UCwFLCAQ5HSxYXPJXSwZdHLw,"@Charsi_Escobar she's obviously lying, do you believe what everyone on the internet tells you",en,2025-06-28T13:44:55Z,2025-06-28 09:44:55,2
FFzy3qlkIAM,Trainwreck: Balloon Boy | Official Trailer | Netflix,UCWOA1ZGywLbqmigxE4Qlvuw,Netflix,2025-06-18T18:00:00Z,UgyBZ-rQ7lmK_L3MXZ54AaABAg.AJay8l1GkehAJvyfRpbt0t,UgyBZ-rQ7lmK_L3MXZ54AaABAg,@Charsi_Escobar,UCGnAxMdIuezPcsqcOm4O1sg,@PeteFiftyeightlolll go write another book that none of your friends will read,en,2025-06-28T21:58:27Z,2025-06-28 17:58:27,3
FFzy3qlkIAM,Trainwreck: Balloon Boy | Official Trailer | Netflix,UCWOA1ZGywLbqmigxE4Qlvuw,Netflix,2025-06-18T18:00:00Z,Ugw5MYqtdJbyESAcZat4AaABAg.AJaaE57HHOKAJb0OD7aPep,Ugw5MYqtdJbyESAcZat4AaABAg,@mogdor,UCLv2Elp_Exd7snMD9G_x-MA,"Don't forget the best part, when he threw up.",en,2025-06-20T18:38:07Z,2025-06-20 14:38:07,13
FFzy3qlkIAM,Trainwreck: Balloon Boy | Official Trailer | Netflix,UCWOA1ZGywLbqmigxE4Qlvuw,Netflix,2025-06-18T18:00:00Z,Ugw5MYqtdJbyESAcZat4AaABAg.AJaaE57HHOKAJeQqQjf9s9,Ugw5MYqtdJbyESAcZat4AaABAg,@GalaxyGirl08,UCFGDEw18Q2J96o7Pns71YEg,“We did it for the show” 😂🤣,en,2025-06-22T02:27:01Z,2025-06-21 22:27:01,12
FFzy3qlkIAM,Trainwreck: Balloon Boy | Official Trailer | Netflix,UCWOA1ZGywLbqmigxE4Qlvuw,Netflix,2025-06-18T18:00:00Z,Ugw5MYqtdJbyESAcZat4AaABAg.AJaaE57HHOKAJeYVZ4E_qO,Ugw5MYqtdJbyESAcZat4AaABAg,@SolidSpark,UCTh-nrp26FZ2qm6BVRMNkbQ,“We did it for the show”,en,2025-06-22T03:33:56Z,2025-06-21 23:33:56,6
FFzy3qlkIAM,Trainwreck: Balloon Boy | Official Trailer | Netflix,UCWOA1ZGywLbqmigxE4Qlvuw,Netflix,2025-06-18T18:00:00Z,Ugw5MYqtdJbyESAcZat4AaABAg.AJaaE57HHOKAJomIfnlAOF,Ugw5MYqtdJbyESAcZat4AaABAg,@highrob7399,UCCU0gDf7SEBs3hF6IMRGkeg,"I remember when this happened, I don't remember it being a ""theory,"" but a fact that one of the kids said the family knew.  All these years later it's not the case?  Sounds like a $$$$ deal to me.  Terrible that we are promoting this type of behavior, how many more people are going to try this now, now how many more people are going to try to go viral?  

Come on netflix, promote this, promote killers IRL, let's give them a story instead of people who do good in the world.",en,2025-06-26T02:55:39Z,2025-06-25 22:55:39,12
FFzy3qlkIAM,Trainwreck: Balloon Boy | Official Trailer | Netflix,UCWOA1ZGywLbqmigxE4Qlvuw,Netflix,2025-06-18T18:00:00Z,Ugw5MYqtdJbyESAcZat4AaABAg.AJaaE57HHOKAKSAhquy9oT,Ugw5MYqtdJbyESAcZat4AaABAg,@UncleJoeBob1986,UCxbvAPIFvt_d6_s195Q3jdg,That show would be WifeSwap,en,2025-07-11T19:27:18Z,2025-07-11 15:27:18,1
FFzy3qlkIAM,Trainwreck: Balloon Boy | Official Trailer | Netflix,UCWOA1ZGywLbqmigxE4Qlvuw,Netflix,2025-06-18T18:00:00Z,Ugw5MYqtdJbyESAcZat4AaABAg.AJaaE57HHOKAKSAm2eM39w,Ugw5MYqtdJbyESAcZat4AaABAg,@UncleJoeBob1986,UCxbvAPIFvt_d6_s195Q3jdg,"​@mogdoryep. If I'm not mistaken, Falcon was a lil sick. Am I right or wrong?",en,2025-07-11T19:27:53Z,2025-07-11 15:27:53,1
FFzy3qlkIAM,Trainwreck: Balloon Boy | Official Trailer | Netflix,UCWOA1ZGywLbqmigxE4Qlvuw,Netflix,2025-06-18T18:00:00Z,Ugw5MYqtdJbyESAcZat4AaABAg.AJaaE57HHOKAKcUOTmlXzs,Ugw5MYqtdJbyESAcZat4AaABAg,@shaun5047,UCY2LXYCVqJ923oHBy_H7WJw,"@highrob7399lol If someone watches this documentary and then decides to pull a similar stunt then they would have been “inspired” by anything. 

Btw a lot of people do dumb things to go viral but I’d argue most don’t also make it a family event. Not to mention waste so emergency resources.",en,2025-07-16T04:50:56Z,2025-07-16 00:50:56,0
FFzy3qlkIAM,Trainwreck: Balloon Boy | Official Trailer | Netflix,UCWOA1ZGywLbqmigxE4Qlvuw,Netflix,2025-06-18T18:00:00Z,Ugw5MYqtdJbyESAcZat4AaABAg.AJaaE57HHOKAKcUbWTiw72,Ugw5MYqtdJbyESAcZat4AaABAg,@shaun5047,UCY2LXYCVqJ923oHBy_H7WJw,@UncleJoeBob1986lol Yes but his illness seem to crank up the moment the reporter started asking him questions  😂,en,2025-07-16T04:52:51Z,2025-07-16 00:52:51,1
FFzy3qlkIAM,Trainwreck: Balloon Boy | Official Trailer | Netflix,UCWOA1ZGywLbqmigxE4Qlvuw,Netflix,2025-06-18T18:00:00Z,Ugw5MYqtdJbyESAcZat4AaABAg.AJaaE57HHOKAKd4Pt2rzji,Ugw5MYqtdJbyESAcZat4AaABAg,@liamwatson5125,UCzm0tNA_OG8xvYXzw7KWYaw,That statement was used against him. Anything said in an interview makes its way into a news report.,en,2025-07-16T10:23:10Z,2025-07-16 06:23:10,0
FFzy3qlkIAM,Trainwreck: Balloon Boy | Official Trailer | Netflix,UCWOA1ZGywLbqmigxE4Qlvuw,Netflix,2025-06-18T18:00:00Z,Ugw5MYqtdJbyESAcZat4AaABAg.AJaaE57HHOKAKd5w9aoGy1,Ugw5MYqtdJbyESAcZat4AaABAg,@NoOne-qx4xv,UCZ-f3K-gveHQkd5lnBNPB5g,@mogdorAfraid to say something wrong again😢,NA,2025-07-16T10:36:27Z,2025-07-16 06:36:27,0
FFzy3qlkIAM,Trainwreck: Balloon Boy | Official Trailer | Netflix,UCWOA1ZGywLbqmigxE4Qlvuw,Netflix,2025-06-18T18:00:00Z,Ugw5MYqtdJbyESAcZat4AaABAg.AJaaE57HHOKAKdM8JGRDXV,Ugw5MYqtdJbyESAcZat4AaABAg,@balanced-shez8226,UCgzBwYt8DRHjaTj5LePyuEA,@mogdor That was the best bit? Unreal,en,2025-07-16T12:58:03Z,2025-07-16 08:58:03,0
FFzy3qlkIAM,Trainwreck: Balloon Boy | Official Trailer | Netflix,UCWOA1ZGywLbqmigxE4Qlvuw,Netflix,2025-06-18T18:00:00Z,Ugw5MYqtdJbyESAcZat4AaABAg.AJaaE57HHOKAKdRk9oTznt,Ugw5MYqtdJbyESAcZat4AaABAg,@hotsexyangel,UCz51vzaHR6GkJSy9ZG3q9dg,That’s not true. He said “we did it for a show” he didn’t directly say it was a hoax. Check your facts before commenting.,en,2025-07-16T13:47:03Z,2025-07-16 09:47:03,0
FFzy3qlkIAM,Trainwreck: Balloon Boy | Official Trailer | Netflix,UCWOA1ZGywLbqmigxE4Qlvuw,Netflix,2025-06-18T18:00:00Z,Ugw5MYqtdJbyESAcZat4AaABAg.AJaaE57HHOKAKga1rvjT_q,Ugw5MYqtdJbyESAcZat4AaABAg,@BarkingShark,UC9kWkPVPuK0WReRsIbcYGcw,"Not exactly what happened. Falcon was asked if he heard his family screaming out while looking for him & he said he heard them. So they asked why Falcon didn't come out then which lead to memorable stataement ""You guys said that we did this for the show' Without a doubt a hoax and the family still not fessing up is shameful",en,2025-07-17T19:05:58Z,2025-07-17 15:05:58,1
FFzy3qlkIAM,Trainwreck: Balloon Boy | Official Trailer | Netflix,UCWOA1ZGywLbqmigxE4Qlvuw,Netflix,2025-06-18T18:00:00Z,Ugw5MYqtdJbyESAcZat4AaABAg.AJaaE57HHOKANjmh8JTEYR,Ugw5MYqtdJbyESAcZat4AaABAg,@Flugs0,UCIM6pYXT92sq7cLMHO_r_Gw,"@BarkingShark It's not a hoax. He said that it was for the show because the reporters asked him before to climb up to the attic in order to demonstrate it, ""for show"".",en,2025-10-01T14:28:30Z,2025-10-01 10:28:30,0
FFzy3qlkIAM,Trainwreck: Balloon Boy | Official Trailer | Netflix,UCWOA1ZGywLbqmigxE4Qlvuw,Netflix,2025-06-18T18:00:00Z,Ugw5MYqtdJbyESAcZat4AaABAg.AJaaE57HHOKANjn0J8NBZI,Ugw5MYqtdJbyESAcZat4AaABAg,@BarkingShark,UC9kWkPVPuK0WReRsIbcYGcw,​@Flugs0No way you believe that,en,2025-10-01T14:31:16Z,2025-10-01 10:31:16,0
FFzy3qlkIAM,Trainwreck: Balloon Boy | Official Trailer | Netflix,UCWOA1ZGywLbqmigxE4Qlvuw,Netflix,2025-06-18T18:00:00Z,Ugw5MYqtdJbyESAcZat4AaABAg.AJaaE57HHOKAO1rkngIvVF,Ugw5MYqtdJbyESAcZat4AaABAg,@redbarron1010,UCIqZvNIjy_fJTvbiW7l1muA,"I agree and it’s not only falcon saying “we did it for the TV show”, it’s the father and the mother’s reaction to him saying that.  The father immediately sighs and looks down embarrassed and the mother shakes her head no like she’s trying to cue him. Their current explanation is completely ludicrous.  Then the wife admits it to the police! They got caught in a lie by their own child.  And now they’re back lying again.  It’s really pathetic actually.",en,2025-10-09T00:18:16Z,2025-10-08 20:18:16,0
FFzy3qlkIAM,Trainwreck: Balloon Boy | Official Trailer | Netflix,UCWOA1ZGywLbqmigxE4Qlvuw,Netflix,2025-06-18T18:00:00Z,UgyOuKq4WmpZcldVvQZ4AaABAg.AJaNSiVVrSdAKbVGWR_e0l,UgyOuKq4WmpZcldVvQZ4AaABAg,@LLandS18,UC2recutIfRA-dbtLEMNB5ZQ,Comments like this are always so stupid. You took time out of your day to not only watch the trailer but then leave a comment. Prove to everyone how little you care. You know what I do when I see stuff on the internet I don't care about. I just scroll by. So you clearly care you care so much you put all this effort in.,en,2025-07-15T19:39:20Z,2025-07-15 15:39:20,0
FFzy3qlkIAM,Trainwreck: Balloon Boy | Official Trailer | Netflix,UCWOA1ZGywLbqmigxE4Qlvuw,Netflix,2025-06-18T18:00:00Z,UgyOuKq4WmpZcldVvQZ4AaABAg.AJaNSiVVrSdAKbbD5ONynV,UgyOuKq4WmpZcldVvQZ4AaABAg,@Beartallica86,UCkNtzn7BOih4FuC5DzPzl4w,"@LLandS18 The funny thing is that you put so much effort on commenting on my opinion, you broke your own routine. Should’ve just scrolled pass my comment. 😊",en,2025-07-15T20:40:02Z,2025-07-15 16:40:02,0
FFzy3qlkIAM,Trainwreck: Balloon Boy | Official Trailer | Netflix,UCWOA1ZGywLbqmigxE4Qlvuw,Netflix,2025-06-18T18:00:00Z,UgyOuKq4WmpZcldVvQZ4AaABAg.AJaNSiVVrSdAKnowyfwaXF,UgyOuKq4WmpZcldVvQZ4AaABAg,@tkraft1442,UCK7TrkKA07BBb7An70te0cQ,"​@LLandS18u hurt by someone that says the truth? This family doesn't need more attention, they did this for money aswell... poor delusion family that will live in a lie rest of their life. 

They are so fake that they want any milliseconds of tv attention. 
Just like Liver king crap documentary.",en,2025-07-20T14:30:56Z,2025-07-20 10:30:56,0
FFzy3qlkIAM,Trainwreck: Balloon Boy | Official Trailer | Netflix,UCWOA1ZGywLbqmigxE4Qlvuw,Netflix,2025-06-18T18:00:00Z,UgzQHHNpsYaKu1MAvDl4AaABAg.AJZj3tOvIBJAJaO3MTKik4,UgzQHHNpsYaKu1MAvDl4AaABAg,@lientavonwergers3325,UCjFhBu0V-auPu8EmNUIFlHA,I thought this was the same family. I came to the comments just to see if anyone mentioned this. Were they storm chasers or something  like that?,en,2025-06-20T12:45:45Z,2025-06-20 08:45:45,4
FFzy3qlkIAM,Trainwreck: Balloon Boy | Official Trailer | Netflix,UCWOA1ZGywLbqmigxE4Qlvuw,Netflix,2025-06-18T18:00:00Z,UgzQHHNpsYaKu1MAvDl4AaABAg.AJZj3tOvIBJAJbyn-7mp6w,UgzQHHNpsYaKu1MAvDl4AaABAg,@aislinnleblanc8019,UCQHCjRmP7Lhm3zgiT9WgcoQ,I think something to that effect! It was something obscure lol but he was such a weirdo ​@lientavonwergers3325,en,2025-06-21T03:34:40Z,2025-06-20 23:34:40,0
FFzy3qlkIAM,Trainwreck: Balloon Boy | Official Trailer | Netflix,UCWOA1ZGywLbqmigxE4Qlvuw,Netflix,2025-06-18T18:00:00Z,UgzQHHNpsYaKu1MAvDl4AaABAg.AJZj3tOvIBJAJvQ0KanI7w,UgzQHHNpsYaKu1MAvDl4AaABAg,@amityrecords,UCXHq5hco17xGky-qB3LCdfg,They swapped with my middle school Spanish teacher. I'll never forget how hyped everyone was at school for the Wife Swap episode and then this.,en,2025-06-28T16:46:51Z,2025-06-28 12:46:51,7
FFzy3qlkIAM,Trainwreck: Balloon Boy | Official Trailer | Netflix,UCWOA1ZGywLbqmigxE4Qlvuw,Netflix,2025-06-18T18:00:00Z,UgyYcQk2ZdDn0e3x2jp4AaABAg.AJZTq0yNHl0AJa-uOQbwyM,UgyYcQk2ZdDn0e3x2jp4AaABAg,@eee_baek,UCXGxbSyuL2L6PrygzzEYjwQ,Woodstock is the first one of the series and then Astroworld.,en,2025-06-20T09:14:40Z,2025-06-20 05:14:40,5
FFzy3qlkIAM,Trainwreck: Balloon Boy | Official Trailer | Netflix,UCWOA1ZGywLbqmigxE4Qlvuw,Netflix,2025-06-18T18:00:00Z,UgyYcQk2ZdDn0e3x2jp4AaABAg.AJZTq0yNHl0AJaHp552e6A,UgyYcQk2ZdDn0e3x2jp4AaABAg,@mike550,UC51vb3VqM00apFbeqaIdtZA,Yeah no shit….that’s exactly what I said. Everyone knows about that already.,en,2025-06-20T11:51:14Z,2025-06-20 07:51:14,3
FFzy3qlkIAM,Trainwreck: Balloon Boy | Official Trailer | Netflix,UCWOA1ZGywLbqmigxE4Qlvuw,Netflix,2025-06-18T18:00:00Z,UgyYcQk2ZdDn0e3x2jp4AaABAg.AJZTq0yNHl0AJdBswi4t7D,UgyYcQk2ZdDn0e3x2jp4AaABAg,@Tx_Jay_,UCBnJutMSR8ConCiWbrdiQNg,"I just figured this out last night browsing, they need to put them all under one series folder, if they haven't already",en,2025-06-21T14:57:03Z,2025-06-21 10:57:03,2
FFzy3qlkIAM,Trainwreck: Balloon Boy | Official Trailer | Netflix,UCWOA1ZGywLbqmigxE4Qlvuw,Netflix,2025-06-18T18:00:00Z,UgyYcQk2ZdDn0e3x2jp4AaABAg.AJZTq0yNHl0AJgKvgtaQFK,UgyYcQk2ZdDn0e3x2jp4AaABAg,@ryanedward7508,UCq7K_IC5R4blpwmUeX7s3Nw,@mike550smh you edited both of your comments. No one knows exactly what you said bc it’s gone,en,2025-06-22T20:13:47Z,2025-06-22 16:13:47,1
FFzy3qlkIAM,Trainwreck: Balloon Boy | Official Trailer | Netflix,UCWOA1ZGywLbqmigxE4Qlvuw,Netflix,2025-06-18T18:00:00Z,UgyYcQk2ZdDn0e3x2jp4AaABAg.AJZTq0yNHl0AJgW90otqpE,UgyYcQk2ZdDn0e3x2jp4AaABAg,@mike550,UC51vb3VqM00apFbeqaIdtZA,@ryanedward7508Shut up!,NA,2025-06-22T21:51:52Z,2025-06-22 17:51:52,0
FFzy3qlkIAM,Trainwreck: Balloon Boy | Official Trailer | Netflix,UCWOA1ZGywLbqmigxE4Qlvuw,Netflix,2025-06-18T18:00:00Z,UgyYcQk2ZdDn0e3x2jp4AaABAg.AJZTq0yNHl0AJl5xI-v3Rb,UgyYcQk2ZdDn0e3x2jp4AaABAg,@mike550,UC51vb3VqM00apFbeqaIdtZA,@ryanedward7508shut up!!!,NA,2025-06-24T16:39:08Z,2025-06-24 12:39:08,0
FFzy3qlkIAM,Trainwreck: Balloon Boy | Official Trailer | Netflix,UCWOA1ZGywLbqmigxE4Qlvuw,Netflix,2025-06-18T18:00:00Z,UgyYcQk2ZdDn0e3x2jp4AaABAg.AJZTq0yNHl0AKgjWBBzvvC,UgyYcQk2ZdDn0e3x2jp4AaABAg,@MultiVickylicious,UCYqNreBb-Sk4ijNpA-Z9Nug,⁠@mike550stop being a smart ssa.Clearly you edited your comment and lucky for you YouTube doesn’t show edit history.I can bet you had written wrongly and that’s why you got corrected 🙄,en,2025-07-17T20:28:45Z,2025-07-17 16:28:45,0
FFzy3qlkIAM,Trainwreck: Balloon Boy | Official Trailer | Netflix,UCWOA1ZGywLbqmigxE4Qlvuw,Netflix,2025-06-18T18:00:00Z,UgyYcQk2ZdDn0e3x2jp4AaABAg.AJZTq0yNHl0AKgjb0xhCme,UgyYcQk2ZdDn0e3x2jp4AaABAg,@MultiVickylicious,UCYqNreBb-Sk4ijNpA-Z9Nug,@ryanedward7508right 100 😂he thinks he’s smart but clearly his comment shows it’s been edited 😅,en,2025-07-17T20:29:33Z,2025-07-17 16:29:33,0
FFzy3qlkIAM,Trainwreck: Balloon Boy | Official Trailer | Netflix,UCWOA1ZGywLbqmigxE4Qlvuw,Netflix,2025-06-18T18:00:00Z,Ugz4zidRe4FvwvxVWOZ4AaABAg.AJZ8GwrRBoQAJfl9MjJDyz,Ugz4zidRe4FvwvxVWOZ4AaABAg,@one-day-at-a-time4134,UCj63_kNoHDhoBWhDOueGurQ,"Is there some kind of misspelling, or did she really say/""rap"" that exact quote? Lol.",en,2025-06-22T14:52:29Z,2025-06-22 10:52:29,2
FFzy3qlkIAM,Trainwreck: Balloon Boy | Official Trailer | Netflix,UCWOA1ZGywLbqmigxE4Qlvuw,Netflix,2025-06-18T18:00:00Z,UgwgvFAT9f6dpkZzCop4AaABAg.AJZ4vMB_E3oAJZjIdpB-ba,UgwgvFAT9f6dpkZzCop4AaABAg,@urielt7,UC9_MnJde_IkwmcbV_jbQXoA,I agree. The dad has always wanted attention and now Netflix is giving it to him..,en,2025-06-19T21:21:35Z,2025-06-19 17:21:35,2
FFzy3qlkIAM,Trainwreck: Balloon Boy | Official Trailer | Netflix,UCWOA1ZGywLbqmigxE4Qlvuw,Netflix,2025-06-18T18:00:00Z,UgwgvFAT9f6dpkZzCop4AaABAg.AJZ4vMB_E3oAJfkIWcuutL,UgwgvFAT9f6dpkZzCop4AaABAg,@one-day-at-a-time4134,UCj63_kNoHDhoBWhDOueGurQ,There might be people who have never heard of this story. Why do people suddenly have a problem with documentaries being made? Lol.,en,2025-06-22T14:45:00Z,2025-06-22 10:45:00,3
FFzy3qlkIAM,Trainwreck: Balloon Boy | Official Trailer | Netflix,UCWOA1ZGywLbqmigxE4Qlvuw,Netflix,2025-06-18T18:00:00Z,UgwXKtSeLYg306RF_1F4AaABAg.AJYiBrSuyyEAKcaH0v6_5E,UgwXKtSeLYg306RF_1F4AaABAg,@heidiheisele8608,UCrgDpTWTeGee-ougMF7CAAQ,Yes and his wife,en,2025-07-16T05:51:05Z,2025-07-16 01:51:05,0
FFzy3qlkIAM,Trainwreck: Balloon Boy | Official Trailer | Netflix,UCWOA1ZGywLbqmigxE4Qlvuw,Netflix,2025-06-18T18:00:00Z,UgyvuTvQ7dMGiF_uFqV4AaABAg.AJYZLsZHmkNAJhISioBkl4,UgyvuTvQ7dMGiF_uFqV4AaABAg,@mogdor,UCLv2Elp_Exd7snMD9G_x-MA,"There's throw up in this one, you'll need a better palate cleanser after lol",en,2025-06-23T05:11:28Z,2025-06-23 01:11:28,5
FFzy3qlkIAM,Trainwreck: Balloon Boy | Official Trailer | Netflix,UCWOA1ZGywLbqmigxE4Qlvuw,Netflix,2025-06-18T18:00:00Z,UgyvuTvQ7dMGiF_uFqV4AaABAg.AJYZLsZHmkNAKBNzgvB04_,UgyvuTvQ7dMGiF_uFqV4AaABAg,@manonlaviggne1085,UComUFSrHGxfBIBaLwkfU1Qg,Also watch Astro world and American apparel,en,2025-07-05T06:56:15Z,2025-07-05 02:56:15,2
FFzy3qlkIAM,Trainwreck: Balloon Boy | Official Trailer | Netflix,UCWOA1ZGywLbqmigxE4Qlvuw,Netflix,2025-06-18T18:00:00Z,Ugy8IH2thzuaXqtT2c54AaABAg.AJXxoqluOI3AKbV1bCdmYv,Ugy8IH2thzuaXqtT2c54AaABAg,@LLandS18,UC2recutIfRA-dbtLEMNB5ZQ,Agreed I love that show,en,2025-07-15T19:37:18Z,2025-07-15 15:37:18,2
FFzy3qlkIAM,Trainwreck: Balloon Boy | Official Trailer | Netflix,UCWOA1ZGywLbqmigxE4Qlvuw,Netflix,2025-06-18T18:00:00Z,UgzLQ4oCHIWAipayD5l4AaABAg.AJXEH7jgoFlAJXqc_droMm,UgzLQ4oCHIWAipayD5l4AaABAg,@theCommunicationChannel,UC61eUxiCdhCfrbPVy266cQw,"Leave God out of it, you poor addicted killer-lover, and go to the right video...",en,2025-06-19T03:47:08Z,2025-06-18 23:47:08,0
FFzy3qlkIAM,Trainwreck: Balloon Boy | Official Trailer | Netflix,UCWOA1ZGywLbqmigxE4Qlvuw,Netflix,2025-06-18T18:00:00Z,Ugy_xsGouDn3aWDnLap4AaABAg.AJXBkhWt7lzAJcYCTxN4E8,Ugy_xsGouDn3aWDnLap4AaABAg,@kylam9543,UC1z3NNOFQ5az-ba7YC6svdw,and fyre fest 2.0 when that ultimately flops as well.,en,2025-06-21T08:52:51Z,2025-06-21 04:52:51,5
FFzy3qlkIAM,Trainwreck: Balloon Boy | Official Trailer | Netflix,UCWOA1ZGywLbqmigxE4Qlvuw,Netflix,2025-06-18T18:00:00Z,Ugy_xsGouDn3aWDnLap4AaABAg.AJXBkhWt7lzAKHSIvKzRBm,Ugy_xsGouDn3aWDnLap4AaABAg,@RealGilbertGan,UCUI_BZV58e7uRdw6Ehu4HZg,@kylam9543 and so does TanaCON and that Willy Wonka fiasco,NA,2025-07-07T15:29:24Z,2025-07-07 11:29:24,0
FFzy3qlkIAM,Trainwreck: Balloon Boy | Official Trailer | Netflix,UCWOA1ZGywLbqmigxE4Qlvuw,Netflix,2025-06-18T18:00:00Z,UgzsrkKy-9KWhJSEyzB4AaABAg.AJX44CyFoPzAKbVWZBNBpI,UgzsrkKy-9KWhJSEyzB4AaABAg,@LLandS18,UC2recutIfRA-dbtLEMNB5ZQ,"He pled guilty. In a court of law. Not no contest guilty. Also things they didn't have in the Netflix show where all the people who talked about how desperate this guy was to be like a Bill Nye the science Guy. To be on TV. That they had tried out for multiple reality TV shows. You know who this guy would be. If he was around today he would be like a family blogger.

Edit also, he tried multiple times to try to make his kids famous. The only indication of future behavior is past behavior.",en,2025-07-15T19:41:32Z,2025-07-15 15:41:32,1
FFzy3qlkIAM,Trainwreck: Balloon Boy | Official Trailer | Netflix,UCWOA1ZGywLbqmigxE4Qlvuw,Netflix,2025-06-18T18:00:00Z,UgwvdK2DkVJKQF4RPkR4AaABAg.AJX-6osX0aJAJXUSdhn3FL,UgwvdK2DkVJKQF4RPkR4AaABAg,@alyseeger834,UCE8BvWFBbVWlJSdQFYskyQg,Wait… this family was on Wife Swap?!?!,en,2025-06-19T00:24:40Z,2025-06-18 20:24:40,2
FFzy3qlkIAM,Trainwreck: Balloon Boy | Official Trailer | Netflix,UCWOA1ZGywLbqmigxE4Qlvuw,Netflix,2025-06-18T18:00:00Z,UgwvdK2DkVJKQF4RPkR4AaABAg.AJX-6osX0aJAJd48V_IYLn,UgwvdK2DkVJKQF4RPkR4AaABAg,@DandyLion0923,UCiM4GAh5BPwmiMP2_qQB4hQ,"​@alyseeger834 yes,  season 5 episode 1. Heene/Martell . I literally just got done watching that episode before this popped up on YouTube",en,2025-06-21T13:49:24Z,2025-06-21 09:49:24,2
FFzy3qlkIAM,Trainwreck: Balloon Boy | Official Trailer | Netflix,UCWOA1ZGywLbqmigxE4Qlvuw,Netflix,2025-06-18T18:00:00Z,UgwvdK2DkVJKQF4RPkR4AaABAg.AJX-6osX0aJAJdWK5ZvyPg,UgwvdK2DkVJKQF4RPkR4AaABAg,@alyseeger834,UCE8BvWFBbVWlJSdQFYskyQg,@DandyLion0923thank you!!! I’m gonna watch haha,NA,2025-06-21T17:55:39Z,2025-06-21 13:55:39,0
FFzy3qlkIAM,Trainwreck: Balloon Boy | Official Trailer | Netflix,UCWOA1ZGywLbqmigxE4Qlvuw,Netflix,2025-06-18T18:00:00Z,UgwilZdiP-abFaxc-_94AaABAg.AJWy2KXCn36AJXGl46-wXO,UgwilZdiP-abFaxc-_94AaABAg,@dls31070,UCPZjo8x8q0EZqXzqKkOTHqQ,Fly me with balloons 🎶🎈,en,2025-06-18T22:24:59Z,2025-06-18 18:24:59,1
FFzy3qlkIAM,Trainwreck: Balloon Boy | Official Trailer | Netflix,UCWOA1ZGywLbqmigxE4Qlvuw,Netflix,2025-06-18T18:00:00Z,UgylbhvuRTzPYq6Hc-R4AaABAg.AJWxismlLeLAJZTY9LWGif,UgylbhvuRTzPYq6Hc-R4AaABAg,@mike550,UC51vb3VqM00apFbeqaIdtZA,"Yup it is!

8 episodes. One every week starting last week with Astroworld tragedy, going to the end of July. 

It’s awesome!",en,2025-06-19T18:55:10Z,2025-06-19 14:55:10,2
FFzy3qlkIAM,Trainwreck: Balloon Boy | Official Trailer | Netflix,UCWOA1ZGywLbqmigxE4Qlvuw,Netflix,2025-06-18T18:00:00Z,UgylbhvuRTzPYq6Hc-R4AaABAg.AJWxismlLeLAJflWWToZKq,UgylbhvuRTzPYq6Hc-R4AaABAg,@one-day-at-a-time4134,UCj63_kNoHDhoBWhDOueGurQ,"​@mike550
It started with Woodstock 99.",en,2025-06-22T14:55:39Z,2025-06-22 10:55:39,0
