video_id,video_title,channel_id,channel_title,video_published_at,reply_id,reply_parent_comment_id,reply_author_display,reply_author_channel_id,reply_text,reply_lang,reply_published_utc,reply_published_local,reply_like_count
FFzy3qlkIAM,Trainwreck: Balloon Boy | Official Trailer | Netflix,UCWOA1ZGywLbqmigxE4Qlvuw,Netflix,2025-06-18T18:00:00Z,UgwBezMTcJNAvI5dyL14AaABAg.AJWq5msP_ZDAJtX_ujQPhj,UgwBezMTcJNAvI5dyL14AaABAg,@bryanporras7028,UCnFnGF9LvigRQ8T637m73dw,Tldr,da,2025-06-27T23:14:32Z,2025-06-27 19:14:32,0
FFzy3qlkIAM,Trainwreck: Balloon Boy | Official Trailer | Netflix,UCWOA1ZGywLbqmigxE4Qlvuw,Netflix,2025-06-18T18:00:00Z,UgwBezMTcJNAvI5dyL14AaABAg.AJWq5msP_ZDAJtmj6Pz_ze,UgwBezMTcJNAvI5dyL14AaABAg,@friendlybane,UCbp5ZBINeyMpZMpE3fFLMDA,"@bryanporras7028 you don't read a Netflix documentary, you watch it, hence TLDW, not TLDR.",en,2025-06-28T01:35:36Z,2025-06-27 21:35:36,0
FFzy3qlkIAM,Trainwreck: Balloon Boy | Official Trailer | Netflix,UCWOA1ZGywLbqmigxE4Qlvuw,Netflix,2025-06-18T18:00:00Z,UgwBezMTcJNAvI5dyL14AaABAg.AJWq5msP_ZDAJv5JjOjDYh,UgwBezMTcJNAvI5dyL14AaABAg,@PeteFiftyeight,UCwFLCAQ5HSxYXPJXSwZdHLw,@itsnick5082 you're parents are brother and sister,en,2025-06-28T13:46:00Z,2025-06-28 09:46:00,0
FFzy3qlkIAM,Trainwreck: Balloon Boy | Official Trailer | Netflix,UCWOA1ZGywLbqmigxE4Qlvuw,Netflix,2025-06-18T18:00:00Z,UgwBezMTcJNAvI5dyL14AaABAg.AJWq5msP_ZDAK4X3NZ_lS3,UgwBezMTcJNAvI5dyL14AaABAg,@Galkelz,UCxhv3MaN5mtJHKiGTWHZhIw,Pp,no,2025-07-02T15:00:51Z,2025-07-02 11:00:51,0
FFzy3qlkIAM,Trainwreck: Balloon Boy | Official Trailer | Netflix,UCWOA1ZGywLbqmigxE4Qlvuw,Netflix,2025-06-18T18:00:00Z,UgwBezMTcJNAvI5dyL14AaABAg.AJWq5msP_ZDAKF6e_h_B0v,UgwBezMTcJNAvI5dyL14AaABAg,@RaymondReignsPullupWitDaStik,UCBQiBDV8cFmZQAnYSZscyPw,Thanks won't be watching now. I swear I hate the comment section sometimes,en,2025-07-06T17:41:47Z,2025-07-06 13:41:47,0
FFzy3qlkIAM,Trainwreck: Balloon Boy | Official Trailer | Netflix,UCWOA1ZGywLbqmigxE4Qlvuw,Netflix,2025-06-18T18:00:00Z,UgwBezMTcJNAvI5dyL14AaABAg.AJWq5msP_ZDAKNZLAuU9Sy,UgwBezMTcJNAvI5dyL14AaABAg,@UncleJoeBob1986,UCxbvAPIFvt_d6_s195Q3jdg,And your point is?!,en,2025-07-10T00:26:19Z,2025-07-09 20:26:19,0
FFzy3qlkIAM,Trainwreck: Balloon Boy | Official Trailer | Netflix,UCWOA1ZGywLbqmigxE4Qlvuw,Netflix,2025-06-18T18:00:00Z,UgwBezMTcJNAvI5dyL14AaABAg.AJWq5msP_ZDAKNvmIZzOqJ,UgwBezMTcJNAvI5dyL14AaABAg,@scottloessel6493,UCWYgOXVDS_R_RELOE9Eknaw,What do you mean “very likely” what else could’ve been?,en,2025-07-10T03:51:08Z,2025-07-09 23:51:08,0
FFzy3qlkIAM,Trainwreck: Balloon Boy | Official Trailer | Netflix,UCWOA1ZGywLbqmigxE4Qlvuw,Netflix,2025-06-18T18:00:00Z,UgwBezMTcJNAvI5dyL14AaABAg.AJWq5msP_ZDAKRMnpY0SW3,UgwBezMTcJNAvI5dyL14AaABAg,@dereklucht4811,UCpMtGHeMrEMRlg1gB97tIbw,​@RaymondReignsPullupWitDaStikit's actually not that simple. There's a LOT more to this story that 95% of people don't know about because they don't do their research on this topic,en,2025-07-11T11:53:44Z,2025-07-11 07:53:44,2
FFzy3qlkIAM,Trainwreck: Balloon Boy | Official Trailer | Netflix,UCWOA1ZGywLbqmigxE4Qlvuw,Netflix,2025-06-18T18:00:00Z,UgwBezMTcJNAvI5dyL14AaABAg.AJWq5msP_ZDAKTdmml4bcO,UgwBezMTcJNAvI5dyL14AaABAg,@airwaveair,UCEFcbDnCcPUmWQIt9mrJ3pg,TLDW: watch the vid before you comment,en,2025-07-12T09:09:22Z,2025-07-12 05:09:22,0
FFzy3qlkIAM,Trainwreck: Balloon Boy | Official Trailer | Netflix,UCWOA1ZGywLbqmigxE4Qlvuw,Netflix,2025-06-18T18:00:00Z,UgwBezMTcJNAvI5dyL14AaABAg.AJWq5msP_ZDAKVShLHizuu,UgwBezMTcJNAvI5dyL14AaABAg,@scottloessel6493,UCWYgOXVDS_R_RELOE9Eknaw,@Nobodyfashoooofor filing a false police report.,NA,2025-07-13T02:02:14Z,2025-07-12 22:02:14,0
FFzy3qlkIAM,Trainwreck: Balloon Boy | Official Trailer | Netflix,UCWOA1ZGywLbqmigxE4Qlvuw,Netflix,2025-06-18T18:00:00Z,UgwBezMTcJNAvI5dyL14AaABAg.AJWq5msP_ZDAKVSlVE8KhC,UgwBezMTcJNAvI5dyL14AaABAg,@scottloessel6493,UCWYgOXVDS_R_RELOE9Eknaw,"@friendlybane later, he claimed that he was forced to plead guilty",en,2025-07-13T02:02:49Z,2025-07-12 22:02:49,2
FFzy3qlkIAM,Trainwreck: Balloon Boy | Official Trailer | Netflix,UCWOA1ZGywLbqmigxE4Qlvuw,Netflix,2025-06-18T18:00:00Z,UgwBezMTcJNAvI5dyL14AaABAg.AJWq5msP_ZDAKVSovAHKZN,UgwBezMTcJNAvI5dyL14AaABAg,@scottloessel6493,UCWYgOXVDS_R_RELOE9Eknaw,"@dereklucht4811 OK enlighten us, how are the parents not guilty of filing a false report if they knew the kid wasn’t in the balloon?",en,2025-07-13T02:03:17Z,2025-07-12 22:03:17,0
FFzy3qlkIAM,Trainwreck: Balloon Boy | Official Trailer | Netflix,UCWOA1ZGywLbqmigxE4Qlvuw,Netflix,2025-06-18T18:00:00Z,UgwBezMTcJNAvI5dyL14AaABAg.AJWq5msP_ZDAKVTKPepm7M,UgwBezMTcJNAvI5dyL14AaABAg,@friendlybane,UCbp5ZBINeyMpZMpE3fFLMDA,@scottloessel6493 forced by who? Did the judge that took his plea point a gun to his head in the courtroom?,en,2025-07-13T02:07:43Z,2025-07-12 22:07:43,0
FFzy3qlkIAM,Trainwreck: Balloon Boy | Official Trailer | Netflix,UCWOA1ZGywLbqmigxE4Qlvuw,Netflix,2025-06-18T18:00:00Z,UgwBezMTcJNAvI5dyL14AaABAg.AJWq5msP_ZDAKVnlubuL67,UgwBezMTcJNAvI5dyL14AaABAg,@scottloessel6493,UCWYgOXVDS_R_RELOE9Eknaw,"@friendlybane don’t ask me I’m just telling you what they’re saying now, the parents involved in the ""Balloon Boy"" hoax, Richard and Mayumi Heene, have stated they pleaded guilty to charges related to the incident to avoid a harsher penalty for Mayumi, who was not a U.S. citizen at the time and feared deportation. They maintained their innocence regarding the hoax itself, claiming they feared the consequences of a more serious conviction.",en,2025-07-13T05:15:06Z,2025-07-13 01:15:06,2
FFzy3qlkIAM,Trainwreck: Balloon Boy | Official Trailer | Netflix,UCWOA1ZGywLbqmigxE4Qlvuw,Netflix,2025-06-18T18:00:00Z,UgwBezMTcJNAvI5dyL14AaABAg.AJWq5msP_ZDAKVnx6IoyLs,UgwBezMTcJNAvI5dyL14AaABAg,@scottloessel6493,UCWYgOXVDS_R_RELOE9Eknaw,"@itsnick5082 was arrested and sentenced to jail time. He was sentenced to 90 days in jail, 100 hours of community service.",en,2025-07-13T05:16:38Z,2025-07-13 01:16:38,1
FFzy3qlkIAM,Trainwreck: Balloon Boy | Official Trailer | Netflix,UCWOA1ZGywLbqmigxE4Qlvuw,Netflix,2025-06-18T18:00:00Z,UgwBezMTcJNAvI5dyL14AaABAg.AJWq5msP_ZDAKWB5Smfgvk,UgwBezMTcJNAvI5dyL14AaABAg,@friendlybane,UCbp5ZBINeyMpZMpE3fFLMDA,"@scottloessel6493 sure, I don't care. Plea agreements happen every single day in the United States. Not sure how that translates to them being forced.",en,2025-07-13T08:47:37Z,2025-07-13 04:47:37,0
FFzy3qlkIAM,Trainwreck: Balloon Boy | Official Trailer | Netflix,UCWOA1ZGywLbqmigxE4Qlvuw,Netflix,2025-06-18T18:00:00Z,UgwBezMTcJNAvI5dyL14AaABAg.AJWq5msP_ZDAKXysRNCPIE,UgwBezMTcJNAvI5dyL14AaABAg,@jamesrockin7950,UC1yycf9Fft47O_-TIGvdsYg,@jimsty7550what do you think Netflix docs are?,en,2025-07-14T01:30:36Z,2025-07-13 21:30:36,0
FFzy3qlkIAM,Trainwreck: Balloon Boy | Official Trailer | Netflix,UCWOA1ZGywLbqmigxE4Qlvuw,Netflix,2025-06-18T18:00:00Z,UgwBezMTcJNAvI5dyL14AaABAg.AJWq5msP_ZDAKalilRP3ip,UgwBezMTcJNAvI5dyL14AaABAg,@fadi59635,UCLrtHvp-ygjaiSTbMA4aHVA,A quoi sert ce reportage ?,NA,2025-07-15T12:52:39Z,2025-07-15 08:52:39,0
FFzy3qlkIAM,Trainwreck: Balloon Boy | Official Trailer | Netflix,UCWOA1ZGywLbqmigxE4Qlvuw,Netflix,2025-06-18T18:00:00Z,UgwBezMTcJNAvI5dyL14AaABAg.AJWq5msP_ZDAKbUUJTEVj2,UgwBezMTcJNAvI5dyL14AaABAg,@LLandS18,UC2recutIfRA-dbtLEMNB5ZQ,"​​@mogdoryeah I have to second what the other person saying. We don't know what's going on in someone's head. If that was a legitimate excuse to get away with illegal behavior, people could get away with anything cuz you don't know what's in their head. That's ridiculous.

Edit I just read the rest of your responses instead of owning up to the fact that you made a mistake or you misinterpreted you doubled down and try to act like the victim. You must have learned how to argue from a child. Because that is how my 6-year-old goddaughter argues.",en,2025-07-15T19:32:29Z,2025-07-15 15:32:29,1
FFzy3qlkIAM,Trainwreck: Balloon Boy | Official Trailer | Netflix,UCWOA1ZGywLbqmigxE4Qlvuw,Netflix,2025-06-18T18:00:00Z,UgwBezMTcJNAvI5dyL14AaABAg.AJWq5msP_ZDAKdRdJ2oj1y,UgwBezMTcJNAvI5dyL14AaABAg,@hotsexyangel,UCz51vzaHR6GkJSy9ZG3q9dg,@KingDavidtheRed1 that’s not what the kid said. He said “for a show” which made people believe it was staged.,en,2025-07-16T13:46:07Z,2025-07-16 09:46:07,0
FFzy3qlkIAM,Trainwreck: Balloon Boy | Official Trailer | Netflix,UCWOA1ZGywLbqmigxE4Qlvuw,Netflix,2025-06-18T18:00:00Z,UgwBezMTcJNAvI5dyL14AaABAg.AJWq5msP_ZDAKemcAgmzKa,UgwBezMTcJNAvI5dyL14AaABAg,@danozism,UCI55glYXQMmb_o73R7ULcug,"TLDW?! Are you actually for real?!

I really can't help but laugh sometimes... I'm sorry, but for the love of  Sweet baby Jesus! 

I don't know how old you are, dear commenter, but I just turned 47, so I'm not super young, but I'm not exactly a crazy old man yelling at clouds either... You don't appear to realise how silly TLDW sounds when commenting on a video with a run-time under 3 minutes! 

In a world that seems to have been over-populated with lazy, foolish idiots in recent times, I made sure that I checked my developing sense of warped privilege at the door quite some time ago. 

Now I just cruise around, man, occasionally attempting to pull people like you up for sounding ridiculous. It's  actually kinda fun! 

No offence intended!

To try and put this in perspective - I was 15 in 1993. Back then, if I wanted to watch a trailer for a TV show, or literally ANYTHING else, it required a shit-tonne more effort than this did!

So while I'm here - Stay cool, show your mother some respect, and don't forget to shave! 😎",en,2025-07-17T02:17:27Z,2025-07-16 22:17:27,0
FFzy3qlkIAM,Trainwreck: Balloon Boy | Official Trailer | Netflix,UCWOA1ZGywLbqmigxE4Qlvuw,Netflix,2025-06-18T18:00:00Z,UgwBezMTcJNAvI5dyL14AaABAg.AJWq5msP_ZDAKeq6d3BTdw,UgwBezMTcJNAvI5dyL14AaABAg,@friendlybane,UCbp5ZBINeyMpZMpE3fFLMDA,"@danozism The TLDW is for the documentary/story itself, not the trailer for the documentary. That's obvious because I summarized the entire ordeal. Take your medication, and maybe spend less time embarrassing yourself on the internet.",en,2025-07-17T02:47:57Z,2025-07-16 22:47:57,0
FFzy3qlkIAM,Trainwreck: Balloon Boy | Official Trailer | Netflix,UCWOA1ZGywLbqmigxE4Qlvuw,Netflix,2025-06-18T18:00:00Z,UgwBezMTcJNAvI5dyL14AaABAg.AJWq5msP_ZDAKfJoaewUND,UgwBezMTcJNAvI5dyL14AaABAg,@danozism,UCI55glYXQMmb_o73R7ULcug,"​@friendlybane  Oh hello again old friend! 

That's all well and good, my sweet, fellow internet embarrassment - but I simply can't accept your excuse that it's actually the documentary that was too long, therefore you didn't watch it. 

In fact I found it to be about the correct length that one would expect a documentary to be.  

So, in my honest summation of the situation, it really does sound like you're talking complete BS. 

The best part of all this? One of the most vitally important differences between you and me is this - I couldn't possibly care any less about the trailer,  the documentary, or your attempt at insulting me! 

Life will keep staggering onward, never caring if I attempt to steer it elsewhere or not.  

Without being bogged down by the perils of philosophical discussion, that's some free and valuable advice right there, my fair weather friend.

Oh and by the way - while I am grateful to you for taking the opportunity to offer your thoughts regarding medication, I have never EVER needed it,  and I seriously doubt I ever will need it, or any other kind of 'medication'. Therefore, it seems like it's my civil duty to remind you to take YOUR own pills! 

Good day to you, sir or madam.",en,2025-07-17T07:16:14Z,2025-07-17 03:16:14,0
FFzy3qlkIAM,Trainwreck: Balloon Boy | Official Trailer | Netflix,UCWOA1ZGywLbqmigxE4Qlvuw,Netflix,2025-06-18T18:00:00Z,UgwBezMTcJNAvI5dyL14AaABAg.AJWq5msP_ZDAKi1e18Xd3q,UgwBezMTcJNAvI5dyL14AaABAg,@actionparkmedia6484,UCAg1uxmXbxT2nwi039WW7tA,@itsnick5082he was,en,2025-07-18T08:35:14Z,2025-07-18 04:35:14,0
FFzy3qlkIAM,Trainwreck: Balloon Boy | Official Trailer | Netflix,UCWOA1ZGywLbqmigxE4Qlvuw,Netflix,2025-06-18T18:00:00Z,UgwBezMTcJNAvI5dyL14AaABAg.AJWq5msP_ZDAKkIEZywz9s,UgwBezMTcJNAvI5dyL14AaABAg,@Frazzled_Chameleon,UCo9sI_r4Oyz-dawJs1jJisA,The way he was acting during the polygraph test was most telling. He was doing everything in his power to throw off the results. All the excuses he gave were laughable. Then Mayumi claiming she didn't know what the word hoax meant. Ha! She had a degree in English.,en,2025-07-19T05:38:39Z,2025-07-19 01:38:39,1
FFzy3qlkIAM,Trainwreck: Balloon Boy | Official Trailer | Netflix,UCWOA1ZGywLbqmigxE4Qlvuw,Netflix,2025-06-18T18:00:00Z,UgwBezMTcJNAvI5dyL14AaABAg.AJWq5msP_ZDAKl1H7oPffa,UgwBezMTcJNAvI5dyL14AaABAg,@JNedoCT,UCxYc1EmyBRPltyBTvA1Ma7A,​@friendlybane so that means he is not guilty,en,2025-07-19T12:29:41Z,2025-07-19 08:29:41,0
FFzy3qlkIAM,Trainwreck: Balloon Boy | Official Trailer | Netflix,UCWOA1ZGywLbqmigxE4Qlvuw,Netflix,2025-06-18T18:00:00Z,UgwBezMTcJNAvI5dyL14AaABAg.AJWq5msP_ZDAKlaYGokQRt,UgwBezMTcJNAvI5dyL14AaABAg,@friendlybane,UCbp5ZBINeyMpZMpE3fFLMDA,"@JNedoCT he pled guilty, so you're wrong.",en,2025-07-19T17:46:36Z,2025-07-19 13:46:36,0
FFzy3qlkIAM,Trainwreck: Balloon Boy | Official Trailer | Netflix,UCWOA1ZGywLbqmigxE4Qlvuw,Netflix,2025-06-18T18:00:00Z,UgwBezMTcJNAvI5dyL14AaABAg.AJWq5msP_ZDAL0ItvJ6WzV,UgwBezMTcJNAvI5dyL14AaABAg,@MsBigact,UCCil5U1fdJj-EV5RmGySBrQ,​@friendlybane because they threatened to deport his wife. Thats called duress.,en,2025-07-25T20:11:31Z,2025-07-25 16:11:31,1
FFzy3qlkIAM,Trainwreck: Balloon Boy | Official Trailer | Netflix,UCWOA1ZGywLbqmigxE4Qlvuw,Netflix,2025-06-18T18:00:00Z,UgwBezMTcJNAvI5dyL14AaABAg.AJWq5msP_ZDAL0KMBh8hSp,UgwBezMTcJNAvI5dyL14AaABAg,@friendlybane,UCbp5ZBINeyMpZMpE3fFLMDA,"@MsBigact who is ""they?"" What evidence is there that this happens?",en,2025-07-25T20:24:15Z,2025-07-25 16:24:15,0
FFzy3qlkIAM,Trainwreck: Balloon Boy | Official Trailer | Netflix,UCWOA1ZGywLbqmigxE4Qlvuw,Netflix,2025-06-18T18:00:00Z,UgwBezMTcJNAvI5dyL14AaABAg.AJWq5msP_ZDAL0L4t9IpY1,UgwBezMTcJNAvI5dyL14AaABAg,@MsBigact,UCCil5U1fdJj-EV5RmGySBrQ,​@friendlybaneits literally in the doc that the DA said that they would deport her if they didn't take the plea deal.,en,2025-07-25T20:30:37Z,2025-07-25 16:30:37,1
FFzy3qlkIAM,Trainwreck: Balloon Boy | Official Trailer | Netflix,UCWOA1ZGywLbqmigxE4Qlvuw,Netflix,2025-06-18T18:00:00Z,UgwBezMTcJNAvI5dyL14AaABAg.AJWq5msP_ZDAL0MH54MaFm,UgwBezMTcJNAvI5dyL14AaABAg,@friendlybane,UCbp5ZBINeyMpZMpE3fFLMDA,"@MsBigact that's what the couple claims the DA said. Yet, there's no evidence supporting that the DA said that. It also doesn't help that a DA doesn't have the authority to deport anyone.",en,2025-07-25T20:41:02Z,2025-07-25 16:41:02,0
FFzy3qlkIAM,Trainwreck: Balloon Boy | Official Trailer | Netflix,UCWOA1ZGywLbqmigxE4Qlvuw,Netflix,2025-06-18T18:00:00Z,UgwBezMTcJNAvI5dyL14AaABAg.AJWq5msP_ZDAL0Qg1UZDl5,UgwBezMTcJNAvI5dyL14AaABAg,@MsBigact,UCCil5U1fdJj-EV5RmGySBrQ,​@friendlybane their lawyer also said it. Why are you trying to defend them so hard?,en,2025-07-25T21:19:31Z,2025-07-25 17:19:31,1
FFzy3qlkIAM,Trainwreck: Balloon Boy | Official Trailer | Netflix,UCWOA1ZGywLbqmigxE4Qlvuw,Netflix,2025-06-18T18:00:00Z,UgwBezMTcJNAvI5dyL14AaABAg.AJWq5msP_ZDAL0XGltofQx,UgwBezMTcJNAvI5dyL14AaABAg,@friendlybane,UCbp5ZBINeyMpZMpE3fFLMDA,"@MsBigact I am asking for evidence that the DA in the case threatened to deport the wife. Not only does a DA not have the power to deport people, threatening that would get the plea deal instantly thrown out by the judge. It's a serious accusation that needs evidence. Unsurprisingly, you have none beyond the claims of the couple, who unsurprisingly never told the judge.",en,2025-07-25T22:17:06Z,2025-07-25 18:17:06,0
FFzy3qlkIAM,Trainwreck: Balloon Boy | Official Trailer | Netflix,UCWOA1ZGywLbqmigxE4Qlvuw,Netflix,2025-06-18T18:00:00Z,UgwBezMTcJNAvI5dyL14AaABAg.AJWq5msP_ZDAL5cuxJ35PZ,UgwBezMTcJNAvI5dyL14AaABAg,@Schnibs,UCfcA5Rq57QhGTD5vg7jEkHQ,"​​@friendlybaneshe was brought in for interogation under false pretenses. She was a US citizen. Richard pled guilty but has always maintained his innocence.
I mean the video of the balloon release is basically richard calling his wife a stupid bitch the whole time who never does anything right. Not exactly how you'd present yourself in a ""hoax""
Also the fact he was trying to expose a corrupt politician at the time.
Richards never been caught in a lie, the feds have. They claimed he called the news first, he didn't. After being put on hold he called the news knowing they would put a helicopter up to follow it.
They said the balloon couldn't lift a child, 3rd parties have done the math and it easily could of.
All of his measuring equipment was found still inside the balloon smashed up. Why, why put expensive gear in there.",en,2025-07-27T21:51:22Z,2025-07-27 17:51:22,0
FFzy3qlkIAM,Trainwreck: Balloon Boy | Official Trailer | Netflix,UCWOA1ZGywLbqmigxE4Qlvuw,Netflix,2025-06-18T18:00:00Z,UgwBezMTcJNAvI5dyL14AaABAg.AJWq5msP_ZDAL5e5lFgUzj,UgwBezMTcJNAvI5dyL14AaABAg,@Schnibs,UCfcA5Rq57QhGTD5vg7jEkHQ,"​@friendlybanethe kid has maintained what he said was taken out of context, even at the time.
The wife swap wife said its not the kind of stunt she could see richard doing, and the kind of prank the kid would do. Then they got pardoned a few years ago.
In the release video you can see lots of helium cannisters, expensive. And implying this was meant for ongoing experiments. And like I said, the initial video he very much loses his cool at moment of losing his expensive experimental balloon.
Actually is no evidence it was a planned hoax. No digital evidence either. When you wigh it all up, it kind of does look like richard was screwed over. I mean, losing a child in a balloon isn't exactly the best look for a prank to begin with.",en,2025-07-27T22:01:43Z,2025-07-27 18:01:43,0
FFzy3qlkIAM,Trainwreck: Balloon Boy | Official Trailer | Netflix,UCWOA1ZGywLbqmigxE4Qlvuw,Netflix,2025-06-18T18:00:00Z,UgwBezMTcJNAvI5dyL14AaABAg.AJWq5msP_ZDAMGcEDZhUnj,UgwBezMTcJNAvI5dyL14AaABAg,@steverich1518,UCdEKLHvFyg0bZ7_bhYVvWFg,"@friendlybaneyou’re not very smart, just how the government wants you. Being convicted doesn’t mean you’re actually guilty, it’s been proven countless times",en,2025-08-26T00:48:26Z,2025-08-25 20:48:26,1
FFzy3qlkIAM,Trainwreck: Balloon Boy | Official Trailer | Netflix,UCWOA1ZGywLbqmigxE4Qlvuw,Netflix,2025-06-18T18:00:00Z,UgwBezMTcJNAvI5dyL14AaABAg.AJWq5msP_ZDAMGgQHxl9Bc,UgwBezMTcJNAvI5dyL14AaABAg,@friendlybane,UCbp5ZBINeyMpZMpE3fFLMDA,"@steverich1518 saying things that are obvious doesn't make you smart either. The justice system doesn't declare you ""actually guilty,"" it declares you ""guilty beyond a reasonable doubt."" I don't concern myself with ""actually guilty"" because it's a standard with no real meaning.",en,2025-08-26T01:25:02Z,2025-08-25 21:25:02,0
FFzy3qlkIAM,Trainwreck: Balloon Boy | Official Trailer | Netflix,UCWOA1ZGywLbqmigxE4Qlvuw,Netflix,2025-06-18T18:00:00Z,UgwBezMTcJNAvI5dyL14AaABAg.AJWq5msP_ZDAMNhv3jdzMB,UgwBezMTcJNAvI5dyL14AaABAg,@lisah8438,UCJyqIAflbQGLzh6vadL9OMw,​@jimsty7550 I mean an innocent person could go to prison with your opinion.,en,2025-08-28T18:52:47Z,2025-08-28 14:52:47,0
FFzy3qlkIAM,Trainwreck: Balloon Boy | Official Trailer | Netflix,UCWOA1ZGywLbqmigxE4Qlvuw,Netflix,2025-06-18T18:00:00Z,UgwBezMTcJNAvI5dyL14AaABAg.AJWq5msP_ZDAMNi2QjvsXc,UgwBezMTcJNAvI5dyL14AaABAg,@lisah8438,UCJyqIAflbQGLzh6vadL9OMw,"​@friendlybaneYou have too much
Faith in the criminal just system.",en,2025-08-28T18:53:56Z,2025-08-28 14:53:56,0
FFzy3qlkIAM,Trainwreck: Balloon Boy | Official Trailer | Netflix,UCWOA1ZGywLbqmigxE4Qlvuw,Netflix,2025-06-18T18:00:00Z,UgwsDdFfoIyRPcOD7fV4AaABAg.AJWphs-vvNBAJX7iNV6oaF,UgwsDdFfoIyRPcOD7fV4AaABAg,@victoriabadass,UCAmGExCpT4b0zWNhbaG9adQ,You can watch the whole episode,en,2025-06-18T21:05:58Z,2025-06-18 17:05:58,0
FFzy3qlkIAM,Trainwreck: Balloon Boy | Official Trailer | Netflix,UCWOA1ZGywLbqmigxE4Qlvuw,Netflix,2025-06-18T18:00:00Z,UgyQGGhq9uryDy-Diyh4AaABAg.AJWp0atrPMzAJWsPIH0X8d,UgyQGGhq9uryDy-Diyh4AaABAg,@YAEL-t7y3i,UCqF424yHhqBb2Ar97wHQjkQ,לא הבנתי כאילו האבא הכניס אותו לשם?,iw,2025-06-18T18:43:25Z,2025-06-18 14:43:25,0
FFzy3qlkIAM,Trainwreck: Balloon Boy | Official Trailer | Netflix,UCWOA1ZGywLbqmigxE4Qlvuw,Netflix,2025-06-18T18:00:00Z,UgyQGGhq9uryDy-Diyh4AaABAg.AJWp0atrPMzAJXqQYVx9Hz,UgyQGGhq9uryDy-Diyh4AaABAg,@theCommunicationChannel,UC61eUxiCdhCfrbPVy266cQw,Then you are completely out of logic upstairs...,en,2025-06-19T03:45:21Z,2025-06-18 23:45:21,1
FFzy3qlkIAM,Trainwreck: Balloon Boy | Official Trailer | Netflix,UCWOA1ZGywLbqmigxE4Qlvuw,Netflix,2025-06-18T18:00:00Z,UgyQGGhq9uryDy-Diyh4AaABAg.AJWp0atrPMzAJXrfLGSuqO,UgyQGGhq9uryDy-Diyh4AaABAg,@marinated_sketches,UCRtkEh54NWQyF6xifZCVMog,"same. I remember watching this and then felt relieved that the boy was at home, but then felt tricked into this thing.",en,2025-06-19T03:56:15Z,2025-06-18 23:56:15,3
FFzy3qlkIAM,Trainwreck: Balloon Boy | Official Trailer | Netflix,UCWOA1ZGywLbqmigxE4Qlvuw,Netflix,2025-06-18T18:00:00Z,UgyQGGhq9uryDy-Diyh4AaABAg.AJWp0atrPMzAJXzpau5hHJ,UgyQGGhq9uryDy-Diyh4AaABAg,@theCommunicationChannel,UC61eUxiCdhCfrbPVy266cQw,Turn off your tv and phone maybe.,en,2025-06-19T05:07:33Z,2025-06-19 01:07:33,3
FFzy3qlkIAM,Trainwreck: Balloon Boy | Official Trailer | Netflix,UCWOA1ZGywLbqmigxE4Qlvuw,Netflix,2025-06-18T18:00:00Z,UgyQGGhq9uryDy-Diyh4AaABAg.AJWp0atrPMzAJZGUrifprH,UgyQGGhq9uryDy-Diyh4AaABAg,@htth613,UCO7q5agxhg4d-gCqLOdXEOA,Corpus Christi: Receive Our Lord with Reverence by Sensus Fidelium.,en,2025-06-19T17:01:07Z,2025-06-19 13:01:07,0
FFzy3qlkIAM,Trainwreck: Balloon Boy | Official Trailer | Netflix,UCWOA1ZGywLbqmigxE4Qlvuw,Netflix,2025-06-18T18:00:00Z,UgyQGGhq9uryDy-Diyh4AaABAg.AJWp0atrPMzAKcVZ6FQtUw,UgyQGGhq9uryDy-Diyh4AaABAg,@shaun5047,UCY2LXYCVqJ923oHBy_H7WJw,lol Remember when the news channels had oxygen countdown clocks as if it were New Year’s Eve. 😂,en,2025-07-16T05:01:07Z,2025-07-16 01:01:07,0
FFzy3qlkIAM,Trainwreck: Balloon Boy | Official Trailer | Netflix,UCWOA1ZGywLbqmigxE4Qlvuw,Netflix,2025-06-18T18:00:00Z,Ugxp_arO6MG6XyYmYLJ4AaABAg.AJWozMpG5H5AJX2IDNiDrd,Ugxp_arO6MG6XyYmYLJ4AaABAg,@szn1580,UClQFxfbJwqhkdaNLqJyFkrQ,Never knew about this lmao,en,2025-06-18T20:18:34Z,2025-06-18 16:18:34,0
FFzy3qlkIAM,Trainwreck: Balloon Boy | Official Trailer | Netflix,UCWOA1ZGywLbqmigxE4Qlvuw,Netflix,2025-06-18T18:00:00Z,Ugxp_arO6MG6XyYmYLJ4AaABAg.AJWozMpG5H5AJXEnnX19Ix,Ugxp_arO6MG6XyYmYLJ4AaABAg,@saturnlights5239,UCtALqaPVbc3W0yS3qXvsCVw,@szn1580you’re too young,en,2025-06-18T22:07:53Z,2025-06-18 18:07:53,0
FFzy3qlkIAM,Trainwreck: Balloon Boy | Official Trailer | Netflix,UCWOA1ZGywLbqmigxE4Qlvuw,Netflix,2025-06-18T18:00:00Z,Ugxp_arO6MG6XyYmYLJ4AaABAg.AJWozMpG5H5AJXFLUMwQJU,Ugxp_arO6MG6XyYmYLJ4AaABAg,@szn1580,UClQFxfbJwqhkdaNLqJyFkrQ,@saturnlights5239you don’t know how old I am 😂,en,2025-06-18T22:12:37Z,2025-06-18 18:12:37,0
FFzy3qlkIAM,Trainwreck: Balloon Boy | Official Trailer | Netflix,UCWOA1ZGywLbqmigxE4Qlvuw,Netflix,2025-06-18T18:00:00Z,Ugxp_arO6MG6XyYmYLJ4AaABAg.AJWozMpG5H5AJXGk8HNkrr,Ugxp_arO6MG6XyYmYLJ4AaABAg,@saturnlights5239,UCtALqaPVbc3W0yS3qXvsCVw,@szn1580around the 15-18 range?,NA,2025-06-18T22:24:51Z,2025-06-18 18:24:51,0
FFzy3qlkIAM,Trainwreck: Balloon Boy | Official Trailer | Netflix,UCWOA1ZGywLbqmigxE4Qlvuw,Netflix,2025-06-18T18:00:00Z,Ugxp_arO6MG6XyYmYLJ4AaABAg.AJWozMpG5H5AJXHAW-TVnB,Ugxp_arO6MG6XyYmYLJ4AaABAg,@szn1580,UClQFxfbJwqhkdaNLqJyFkrQ,@saturnlights5239no man I’m 29 and never heard of this. Was this a big deal or something?,en,2025-06-18T22:28:35Z,2025-06-18 18:28:35,0
FFzy3qlkIAM,Trainwreck: Balloon Boy | Official Trailer | Netflix,UCWOA1ZGywLbqmigxE4Qlvuw,Netflix,2025-06-18T18:00:00Z,UgyaoYVlp8vbEEEW-CJ4AaABAg.AJWoBFUyXV-AJXL8Upb_Y6,UgyaoYVlp8vbEEEW-CJ4AaABAg,@anthonytaylor7928,UCIfjVjlrX0ZsDiAI1l5_3ng,😂,ja,2025-06-18T23:03:16Z,2025-06-18 19:03:16,4
FFzy3qlkIAM,Trainwreck: Balloon Boy | Official Trailer | Netflix,UCWOA1ZGywLbqmigxE4Qlvuw,Netflix,2025-06-18T18:00:00Z,UgyaoYVlp8vbEEEW-CJ4AaABAg.AJWoBFUyXV-AJXZ_UOPpiD,UgyaoYVlp8vbEEEW-CJ4AaABAg,@GoingNorthObv,UCtb5z0XObE6-gl1HYun9cOA,Rogan and this dad has something in common. Severe lack of IQ.,en,2025-06-19T01:09:25Z,2025-06-18 21:09:25,0
FFzy3qlkIAM,Trainwreck: Balloon Boy | Official Trailer | Netflix,UCWOA1ZGywLbqmigxE4Qlvuw,Netflix,2025-06-18T18:00:00Z,UgyaoYVlp8vbEEEW-CJ4AaABAg.AJWoBFUyXV-AJZFntbbR8i,UgyaoYVlp8vbEEEW-CJ4AaABAg,@imacatguyyadya,UCMlQwzPpwriyd5pJ0xxaOtg,😂😂😂,ja,2025-06-19T16:55:07Z,2025-06-19 12:55:07,1
FFzy3qlkIAM,Trainwreck: Balloon Boy | Official Trailer | Netflix,UCWOA1ZGywLbqmigxE4Qlvuw,Netflix,2025-06-18T18:00:00Z,UgyaoYVlp8vbEEEW-CJ4AaABAg.AJWoBFUyXV-AJ_gFsITgR4,UgyaoYVlp8vbEEEW-CJ4AaABAg,@OwellMc1000,UC9bDEquUO2RJ2lkOAoArGSA,He said something about this kids dad having something to do with building the pyramids of Giza. I 💯% don’t believe him 😂,en,2025-06-20T06:14:14Z,2025-06-20 02:14:14,3
FFzy3qlkIAM,Trainwreck: Balloon Boy | Official Trailer | Netflix,UCWOA1ZGywLbqmigxE4Qlvuw,Netflix,2025-06-18T18:00:00Z,UgyaoYVlp8vbEEEW-CJ4AaABAg.AJWoBFUyXV-AJ_hhGFLKOg,UgyaoYVlp8vbEEEW-CJ4AaABAg,@yanderefangirl8317,UCSzUnfGu0sb4aotgaW0rOiA,@OwellMc1000I don’t think the dad is that old 😂,en,2025-06-20T06:26:51Z,2025-06-20 02:26:51,0
FFzy3qlkIAM,Trainwreck: Balloon Boy | Official Trailer | Netflix,UCWOA1ZGywLbqmigxE4Qlvuw,Netflix,2025-06-18T18:00:00Z,UgyaoYVlp8vbEEEW-CJ4AaABAg.AJWoBFUyXV-AJ_nCNiN_au,UgyaoYVlp8vbEEEW-CJ4AaABAg,@radz7106,UC6A47tuX9d8ymRSOsAuXM-w,Alien looking for some DMT,en,2025-06-20T07:14:55Z,2025-06-20 03:14:55,1
FFzy3qlkIAM,Trainwreck: Balloon Boy | Official Trailer | Netflix,UCWOA1ZGywLbqmigxE4Qlvuw,Netflix,2025-06-18T18:00:00Z,UgyaoYVlp8vbEEEW-CJ4AaABAg.AJWoBFUyXV-AJaP_7ivZwi,UgyaoYVlp8vbEEEW-CJ4AaABAg,@MontanaMoorehead,UCCBByUvUXV6hW1VNdDTa81A,Ahahahahahahahaha 😂😂😂😂,NA,2025-06-20T12:58:57Z,2025-06-20 08:58:57,0
