video_id,video_url,comment_id,comment_author_display,comment_author_channel_id,comment_content,comment_lang,comment_time_utc,comment_time_local,comment_like_count,comment_reply_count,reply_id,reply_author_display,reply_author_channel_id,reply_content,reply_lang,reply_time_utc,reply_time_local,reply_like_count,view_count,like_count,comment_count,crawl_time
hl1I10iAXog,https://www.youtube.com/watch?v=hl1I10iAXog,UgzCLMQrD-AUa8eUiZ94AaABAg,@jilliananderson5776,UCM6uTlXa-huq429Wkjx97gA,SO EXCITED!! This was my favorite book in the series I read it in like a day and a half ≡ƒñì,en,2025-11-23T04:42:20Z,2025-11-22 23:42:20,3,1,UgzCLMQrD-AUa8eUiZ94AaABAg.APrCkC7XfC7APsZp5sKbm7,@trungduong4040,UCfKfWed1KcXnKZT50bnz7HQ,"My favourite book, too!",en,2025-11-23T17:23:13Z,2025-11-23 12:23:13,0,2977985,44775,1737,"Tue, 16 Dec 2025 16:39:10 GMT"
hl1I10iAXog,https://www.youtube.com/watch?v=hl1I10iAXog,UgzddAWbaUh_TM_uuDl4AaABAg,@FewFew77,UCNgWgTi1eP7EcQKhXQJ1lgQ,Too many blacks. Disgusting.,NA,2025-10-06T02:31:05Z,2025-10-05 22:31:05,0,1,UgzddAWbaUh_TM_uuDl4AaABAg.ANvNZxNf3v-AORjHj1aPNK,@fattyrat9916,UCIDDnFHMA2DhvqR0ZqveTtQ,"Probably b/c the woman making these shows is Black≡ƒÖä≡ƒÖä≡ƒÖä Go watch Sons of Anarchy, Justified, or Animal Kingdom. Those are the shows for your kind.",en,2025-10-19T01:24:31Z,2025-10-18 21:24:31,0,2977985,44775,1737,"Tue, 16 Dec 2025 16:39:10 GMT"
hl1I10iAXog,https://www.youtube.com/watch?v=hl1I10iAXog,UgylsUQbbS9z5dKAuud4AaABAg,@keerthanak1384,UCZJXBQv81vIb_Lfc5vmkliQ,Donno why but still my heart goes to season 2 Γ¥ñΓ¥ñΓ¥ñalways ≡ƒÿà,en,2025-09-18T14:31:31Z,2025-09-18 10:31:31,2,1,UgylsUQbbS9z5dKAuud4AaABAg.ANDJhsvA95pAORjSJB8DsW,@fattyrat9916,UCIDDnFHMA2DhvqR0ZqveTtQ,That was the best season to me.,en,2025-10-19T01:25:57Z,2025-10-18 21:25:57,0,2977985,44775,1737,"Tue, 16 Dec 2025 16:39:10 GMT"
hl1I10iAXog,https://www.youtube.com/watch?v=hl1I10iAXog,UgxawRIeQANBMuwWzhh4AaABAg,@Octobris,UCxA-SGPTZ2V8q8oEwInYzHA,"I just... Pray they don't completely erase his bisexuality in his season and that they don't treat it as a stereotypical ""experimental phase before settling down with a woman and therefore, turning straight"". I know the fact he was ""made bi"" in the show was a controversial decision, but it spoke to me on so many levels and I hope the writers and producers have enough tact to give Benedict a hetero love story while still respecting his identity and not backtracking.
We're so often told we're promiscuous liars. Let S4 not contribute to that.",en,2025-09-16T10:14:53Z,2025-09-16 06:14:53,0,3,UgxawRIeQANBMuwWzhh4AaABAg.AN7hkTYg6MyANJbwn-cqI3,@tvchatter,UCD6A5yns_hRKxbv62nM-u5A,"Him having a bunch of Threesomes ""spoke to you on so many levels""? What sort of representation is that for bi people?",en,2025-09-21T01:15:02Z,2025-09-20 21:15:02,5,2977985,44775,1737,"Tue, 16 Dec 2025 16:39:10 GMT"
hl1I10iAXog,https://www.youtube.com/watch?v=hl1I10iAXog,UgxawRIeQANBMuwWzhh4AaABAg,@Octobris,UCxA-SGPTZ2V8q8oEwInYzHA,"I just... Pray they don't completely erase his bisexuality in his season and that they don't treat it as a stereotypical ""experimental phase before settling down with a woman and therefore, turning straight"". I know the fact he was ""made bi"" in the show was a controversial decision, but it spoke to me on so many levels and I hope the writers and producers have enough tact to give Benedict a hetero love story while still respecting his identity and not backtracking.
We're so often told we're promiscuous liars. Let S4 not contribute to that.",en,2025-09-16T10:14:53Z,2025-09-16 06:14:53,0,3,UgxawRIeQANBMuwWzhh4AaABAg.AN7hkTYg6MyANrjkO0cOB8,@chipurinn,UCTfCEUyZUvOmiV393yzSqvA,bi people are so much more than threesomes what???,en,2025-10-04T16:36:39Z,2025-10-04 12:36:39,1,2977985,44775,1737,"Tue, 16 Dec 2025 16:39:10 GMT"
hl1I10iAXog,https://www.youtube.com/watch?v=hl1I10iAXog,UgxawRIeQANBMuwWzhh4AaABAg,@Octobris,UCxA-SGPTZ2V8q8oEwInYzHA,"I just... Pray they don't completely erase his bisexuality in his season and that they don't treat it as a stereotypical ""experimental phase before settling down with a woman and therefore, turning straight"". I know the fact he was ""made bi"" in the show was a controversial decision, but it spoke to me on so many levels and I hope the writers and producers have enough tact to give Benedict a hetero love story while still respecting his identity and not backtracking.
We're so often told we're promiscuous liars. Let S4 not contribute to that.",en,2025-09-16T10:14:53Z,2025-09-16 06:14:53,0,3,UgxawRIeQANBMuwWzhh4AaABAg.AN7hkTYg6MyAORjdn0rkwq,@fattyrat9916,UCIDDnFHMA2DhvqR0ZqveTtQ,"They won't. They don't show those scenes in the preview b/c it will turn away a lot of viewers, but I bet he'll probably be having more sex with men than this girl during the season.",en,2025-10-19T01:27:39Z,2025-10-18 21:27:39,0,2977985,44775,1737,"Tue, 16 Dec 2025 16:39:10 GMT"
hl1I10iAXog,https://www.youtube.com/watch?v=hl1I10iAXog,UgxFlIcLtNJsALi3S5t4AaABAg,@richozzy,UCV8Iby2F22gYgUUNieyjv_w,Im gonna cry when I see them and now Eloise my girl is confirmed to have her season next year ≡ƒ⌐╡ finally my girl can have her happy ending ≡ƒÑ│≡ƒÄë≡ƒÑ╣ !,en,2025-09-06T23:33:08Z,2025-09-06 19:33:08,0,1,UgxFlIcLtNJsALi3S5t4AaABAg.AMkO99uGOEvAORk2NSVZZT,@fattyrat9916,UCIDDnFHMA2DhvqR0ZqveTtQ,I want them to bring a Latin King for my girl Eloise.,en,2025-10-19T01:31:09Z,2025-10-18 21:31:09,0,2977985,44775,1737,"Tue, 16 Dec 2025 16:39:10 GMT"
hl1I10iAXog,https://www.youtube.com/watch?v=hl1I10iAXog,UgwQklcV5QflIVjuII54AaABAg,@thedivineluv,UCGZaFQITT6HzMpS2lAwjy0g,I NEED DAPHNE AND THE DUKE.,NA,2025-09-06T17:39:36Z,2025-09-06 13:39:36,1,1,UgwQklcV5QflIVjuII54AaABAg.AMjkgr_BgksAMkNvl34-uX,@richozzy,UCV8Iby2F22gYgUUNieyjv_w,We need,xh,2025-09-06T23:31:10Z,2025-09-06 19:31:10,0,2977985,44775,1737,"Tue, 16 Dec 2025 16:39:10 GMT"
hl1I10iAXog,https://www.youtube.com/watch?v=hl1I10iAXog,Ugz45Lu1DMdgYfycUJN4AaABAg,@superpopyael,UCse8sAQYs4LSFCiNHgReL8A,"I am kind of torn with this. I've always known Benedict is going to be with Sophie. However, now I'm afraid his bisexuality won't be properly explored",en,2025-09-06T17:12:54Z,2025-09-06 13:12:54,0,1,Ugz45Lu1DMdgYfycUJN4AaABAg.AMjhdI07suaAMlfJ7RiKDm,@trungduong4040,UCfKfWed1KcXnKZT50bnz7HQ,"Maybe just a bit of exploration in episode 1, if we're lucky.",en,2025-09-07T11:31:01Z,2025-09-07 07:31:01,1,2977985,44775,1737,"Tue, 16 Dec 2025 16:39:10 GMT"
hl1I10iAXog,https://www.youtube.com/watch?v=hl1I10iAXog,UgwezxyS_aM0QEURRBt4AaABAg,@verol4705,UCvkmsoEuut97Mv5_vnY8SBw,Is this BELLY,en,2025-09-02T01:27:25Z,2025-09-01 21:27:25,0,2,UgwezxyS_aM0QEURRBt4AaABAg.AMYiFuqvSLzAM_gpYSJB8A,@javeriaijaz8558,UCxi8_r69mB2wOYcGyoZ-D7Q,Yes,en,2025-09-02T19:53:25Z,2025-09-02 15:53:25,0,2977985,44775,1737,"Tue, 16 Dec 2025 16:39:10 GMT"
hl1I10iAXog,https://www.youtube.com/watch?v=hl1I10iAXog,UgwezxyS_aM0QEURRBt4AaABAg,@verol4705,UCvkmsoEuut97Mv5_vnY8SBw,Is this BELLY,en,2025-09-02T01:27:25Z,2025-09-01 21:27:25,0,2,UgwezxyS_aM0QEURRBt4AaABAg.AMYiFuqvSLzAN7ydeQxUHx,@noname_706,UCnP_qfiLD9JwpM4f0TzR0LA,? no she's yerin ha,mg,2025-09-16T12:42:30Z,2025-09-16 08:42:30,0,2977985,44775,1737,"Tue, 16 Dec 2025 16:39:10 GMT"
hl1I10iAXog,https://www.youtube.com/watch?v=hl1I10iAXog,UgzMnB7grSATTiUbGSh4AaABAg,@kbowman968,UCudwKnUCPKPokARUzIb-ufw,IsnΓÇÖt Benedict gay?!! I get the strong gay vibe off this dude.,en,2025-08-29T20:57:55Z,2025-08-29 16:57:55,0,2,UgzMnB7grSATTiUbGSh4AaABAg.AMQW1L5htboAMYpIw48aJG,@trungduong4040,UCfKfWed1KcXnKZT50bnz7HQ,He's bi.,NA,2025-09-02T02:29:00Z,2025-09-01 22:29:00,0,2977985,44775,1737,"Tue, 16 Dec 2025 16:39:10 GMT"
hl1I10iAXog,https://www.youtube.com/watch?v=hl1I10iAXog,UgzMnB7grSATTiUbGSh4AaABAg,@kbowman968,UCudwKnUCPKPokARUzIb-ufw,IsnΓÇÖt Benedict gay?!! I get the strong gay vibe off this dude.,en,2025-08-29T20:57:55Z,2025-08-29 16:57:55,0,2,UgzMnB7grSATTiUbGSh4AaABAg.AMQW1L5htboAN7ymr1eFwN,@noname_706,UCnP_qfiLD9JwpM4f0TzR0LA,he's pan,zh-Latn,2025-09-16T12:43:46Z,2025-09-16 08:43:46,0,2977985,44775,1737,"Tue, 16 Dec 2025 16:39:10 GMT"
hl1I10iAXog,https://www.youtube.com/watch?v=hl1I10iAXog,UgyZR76adJzVLlPh4OR4AaABAg,@pyromusik92,UCNX7zfNfSf17C0hCd0LO8OQ,The wait is AGONIZING!!!!,NA,2025-08-29T00:19:17Z,2025-08-28 20:19:17,3,1,UgyZR76adJzVLlPh4OR4AaABAg.AMOIHL1ZSVkAMYpJvikDvY,@trungduong4040,UCfKfWed1KcXnKZT50bnz7HQ,Yesss,kk,2025-09-02T02:29:08Z,2025-09-01 22:29:08,0,2977985,44775,1737,"Tue, 16 Dec 2025 16:39:10 GMT"
hl1I10iAXog,https://www.youtube.com/watch?v=hl1I10iAXog,Ugw8TnbLnHqDQJjMx6x4AaABAg,@dametriawhite1070,UCsQ0vQL7_3ejNUXB7qQDKpQ,I just hope they donΓÇÖt have him in an open marriage ≡ƒÿÆ,en,2025-08-27T02:52:44Z,2025-08-26 22:52:44,1,1,Ugw8TnbLnHqDQJjMx6x4AaABAg.AMJQF_VGnaiAO2NIQwqcx_,@RenHRlover,UCrnz5oNkl_7H9AP0Pq0ZasA,Why would he? This is an exclusive Sophie and Benedict love story much like the other two brothers.,en,2025-10-09T05:02:37Z,2025-10-09 01:02:37,0,2977985,44775,1737,"Tue, 16 Dec 2025 16:39:10 GMT"
hl1I10iAXog,https://www.youtube.com/watch?v=hl1I10iAXog,UgwSfL1qFCU7tb1PBnR4AaABAg,@PhuongChi-e3n,UCBRHILjfx2TFwzqHjZgj66w,I can t stop smiling watching this,en,2025-08-07T18:44:32Z,2025-08-07 14:44:32,3,1,UgwSfL1qFCU7tb1PBnR4AaABAg.ALXcHA_euw5ALj91bzidrA,@trungduong4040,UCfKfWed1KcXnKZT50bnz7HQ,me too,mi,2025-08-12T15:30:23Z,2025-08-12 11:30:23,0,2977985,44775,1737,"Tue, 16 Dec 2025 16:39:10 GMT"
hl1I10iAXog,https://www.youtube.com/watch?v=hl1I10iAXog,UgzmBr5-FigA-az9boR4AaABAg,@MichelleRodriguez-li9zh,UC2mf1vSIdAouQb6tbfA2iNw,I feel like we are Latina are not represented there was Asian and mix heritage.But I feel the culture of Spanish or Portuguese speaking would be awesome to see happen.,en,2025-07-28T02:56:03Z,2025-07-27 22:56:03,0,1,UgzmBr5-FigA-az9boR4AaABAg.AL6Amch_R8zAM8MldgfImW,@NhiYß║┐n-h1i,UCc0Pja4ehidoC9WBpD0B3kg,Maybe Latina will be the MC in Gregory's part. :)),en,2025-08-22T19:50:39Z,2025-08-22 15:50:39,0,2977985,44775,1737,"Tue, 16 Dec 2025 16:39:10 GMT"
hl1I10iAXog,https://www.youtube.com/watch?v=hl1I10iAXog,UgzGdjyErEAZk99NGRl4AaABAg,@RisingPhoenix-y2i,UCjC8oeFMAVw6IKJlV_YSTyg,"My Honest Review of Bridgerton Season 3: Disappointing and Unconvincing

As someone who truly enjoyed the first two seasons of Bridgerton, Season 3 was a major letdown. What once felt like a charming, romantic escape has now taken a sharp turn into something that feels forced, overly political, and disconnected from the emotional depth that made the series special.

One of the biggest issues for me was how the show handled inclusivity. Rather than letting diversity evolve naturally within the story, it felt like characters and plotlines were changed just to tick boxes or follow a current agenda. The changes didnΓÇÖt feel earned ΓÇö they felt like they were there for optics or to push a message, not because they genuinely served the narrative or characters.

FrancescaΓÇÖs storyline is a perfect example. Her quiet, beautiful love story with John Stirling was one of the most heartfelt parts of the season. But right after their wedding, weΓÇÖre suddenly introduced to Michaela (a gender-swapped version of Michael from the books), and Francesca is instantly shown to be drawn to her. It completely undermines her relationship with John and makes it feel like her love for him was never real. That twist felt unnatural, rushed, and emotionally dishonest ΓÇö as if everything we just watched didnΓÇÖt matter.

Then thereΓÇÖs Benedict. Early in the season, there are strong hints that he might be exploring his sexuality, only for him to abruptly return to being the typical ΓÇ£manly, straight guyΓÇ¥ who falls for a woman obsessed with chandeliers. That entire subplot felt shallow and inconsistent. If the writers were going to explore BenedictΓÇÖs bisexuality, they should have committed to it with depth and care ΓÇö not thrown in vague suggestions and then dropped it.

Overall, the tone of the season was off ΓÇö much more negative and even a bit depressing at times. The lighthearted, romantic, ΓÇ£feel-goodΓÇ¥ vibe that defined Bridgerton was missing. Instead, it felt like the show was trying too hard to be politically relevant, at the cost of genuine storytelling and character development.

Unfortunately, this season has made me lose interest in the show. I probably wonΓÇÖt be watching future seasons.",en,2025-07-14T08:13:35Z,2025-07-14 04:13:35,0,2,UgzGdjyErEAZk99NGRl4AaABAg.AKYgzyApKGRAKj9FIXZGwb,@Gipsymmen,UCYlGoahbSbs3ebQEM7Pe4zw,"I do agree with you that Michaela's introduction undermined Francesca's love story with John. I remember Benedict telling John that his mother is obsessed with great love stories, and that's why Violet wasn't enthusiastic about their story. Later on, she realizes that love isn't always so passionate and epic. It can burn slowly. That was the overall message of John and Francesca's love story. When Michaela appeared, I was very disappointed with the plot twist. I'm going to be honest, I never realized that Francesca was drawn to Michaela until I saw the comments.

On the other hand, I disagree with you on your statement regarding Benedict's sexuality. I think the writers never intended to explore his sexuality to begin with. That subplot was meant to show Benedict's character development. He is now brave enough to live outside society's expectations. Which is where Sophie comes in. Do you remember during season 1 when he confronted Mr. Grandville about his affair with Mr. Wetherby? Mr. Grandville explained to him what it's like to be with someone and feel like you are oceans apart. Loving someone without being able to touch them or ever smile at them is torture. Also, Sophie isn't ""obsessed"" with the chandelier. If you read the book, you would understand why she was fascinated by its beauty. In this scene, Benedict was drawn to her because she wasn't like the rest of the people of the ton. She was in her own bubble and happy with where she was. Part of Benedict's personality is that he appreciates art. The masquerade ball was very gorgeous, but no one actually paid attention; she was the only one who stopped and took in all that beauty.",en,2025-07-18T19:00:52Z,2025-07-18 15:00:52,2,2977985,44775,1737,"Tue, 16 Dec 2025 16:39:10 GMT"
hl1I10iAXog,https://www.youtube.com/watch?v=hl1I10iAXog,UgzGdjyErEAZk99NGRl4AaABAg,@RisingPhoenix-y2i,UCjC8oeFMAVw6IKJlV_YSTyg,"My Honest Review of Bridgerton Season 3: Disappointing and Unconvincing

As someone who truly enjoyed the first two seasons of Bridgerton, Season 3 was a major letdown. What once felt like a charming, romantic escape has now taken a sharp turn into something that feels forced, overly political, and disconnected from the emotional depth that made the series special.

One of the biggest issues for me was how the show handled inclusivity. Rather than letting diversity evolve naturally within the story, it felt like characters and plotlines were changed just to tick boxes or follow a current agenda. The changes didnΓÇÖt feel earned ΓÇö they felt like they were there for optics or to push a message, not because they genuinely served the narrative or characters.

FrancescaΓÇÖs storyline is a perfect example. Her quiet, beautiful love story with John Stirling was one of the most heartfelt parts of the season. But right after their wedding, weΓÇÖre suddenly introduced to Michaela (a gender-swapped version of Michael from the books), and Francesca is instantly shown to be drawn to her. It completely undermines her relationship with John and makes it feel like her love for him was never real. That twist felt unnatural, rushed, and emotionally dishonest ΓÇö as if everything we just watched didnΓÇÖt matter.

Then thereΓÇÖs Benedict. Early in the season, there are strong hints that he might be exploring his sexuality, only for him to abruptly return to being the typical ΓÇ£manly, straight guyΓÇ¥ who falls for a woman obsessed with chandeliers. That entire subplot felt shallow and inconsistent. If the writers were going to explore BenedictΓÇÖs bisexuality, they should have committed to it with depth and care ΓÇö not thrown in vague suggestions and then dropped it.

Overall, the tone of the season was off ΓÇö much more negative and even a bit depressing at times. The lighthearted, romantic, ΓÇ£feel-goodΓÇ¥ vibe that defined Bridgerton was missing. Instead, it felt like the show was trying too hard to be politically relevant, at the cost of genuine storytelling and character development.

Unfortunately, this season has made me lose interest in the show. I probably wonΓÇÖt be watching future seasons.",en,2025-07-14T08:13:35Z,2025-07-14 04:13:35,0,2,UgzGdjyErEAZk99NGRl4AaABAg.AKYgzyApKGRAKnVZNOzQ_X,@Gipsymmen,UCYlGoahbSbs3ebQEM7Pe4zw,"Regarding diversity and inclusivity, read the author's explanation of the Important Difference Between 'Race-Blind Casting' and 'Color-Conscious Casting'. 
She said, and I quote, ""Well first of all I wanna point out that the producers donΓÇÖt actually like to call it ΓÇÿrace-blind castingΓÇÖ because that implies that there was no thought given at all. That it was just sort of ΓÇÿWeΓÇÖre gonna go out there, weΓÇÖre gonna pick whoever seems best.ΓÇÖ They call it more color-conscious casting because there is thought that goes into it, and a true color-blind casting would end up with a Bridgerton family that maybe didnΓÇÖt even look biologically related or anything like thatΓÇª I was not part of that decision, but I support it 100%. I think itΓÇÖs amazing. I think anything that can allow more people to see themselves in a story that is big and romantic and glamorous and has a happy ending is a great thing.""
The writers put real thought into where they place diversity. Bring the heritage of the Sharma family into the story, and introduce Queen Charlotte as a woman of color who experienced racism when she first married King George.
I enjoyed  Penelope and Colin's story, but was mostly looking forward to the reveal of Lady Whistledown. I liked Benedict's subplot. The only thing that wasn't handled properly was FrancescaΓÇÖs storyline and Michaela's appearance. I hope they redeem it in future seasons.",en,2025-07-20T11:32:48Z,2025-07-20 07:32:48,1,2977985,44775,1737,"Tue, 16 Dec 2025 16:39:10 GMT"
hl1I10iAXog,https://www.youtube.com/watch?v=hl1I10iAXog,UgwyO6JX8C8s9MVPeq54AaABAg,@JaxLittles,UCSicnijEkFX5u0VSJ4CTKAw,Alright... let's see what diversity is getting married into the family this season. Money is on East Asian this time,en,2025-06-30T14:33:08Z,2025-06-30 10:33:08,1,1,UgwyO6JX8C8s9MVPeq54AaABAg.AK-KIeIJHqgAO2NnGM4os6,@RenHRlover,UCrnz5oNkl_7H9AP0Pq0ZasA,lol and you will be right on that! The lead actress is indeed East Asian,en,2025-10-09T05:06:58Z,2025-10-09 01:06:58,0,2977985,44775,1737,"Tue, 16 Dec 2025 16:39:10 GMT"
hl1I10iAXog,https://www.youtube.com/watch?v=hl1I10iAXog,UgwCexNM0whdGdHJukF4AaABAg,@tin-yennchan301,UCuOMorWrR8lQTxt3D9aLxNw,Woke,st,2025-06-26T01:07:50Z,2025-06-25 21:07:50,0,2,UgwCexNM0whdGdHJukF4AaABAg.AJo_y-q7XnuAJq5VOiaIJ7,@terrie-v6p,UC8p0RkdxTBJt-_u3tKw75zQ,"The show has been ""woke"" since S1. Don't like? Don't watch.",en,2025-06-26T15:11:24Z,2025-06-26 11:11:24,2,2977985,44775,1737,"Tue, 16 Dec 2025 16:39:10 GMT"
hl1I10iAXog,https://www.youtube.com/watch?v=hl1I10iAXog,UgwCexNM0whdGdHJukF4AaABAg,@tin-yennchan301,UCuOMorWrR8lQTxt3D9aLxNw,Woke,st,2025-06-26T01:07:50Z,2025-06-25 21:07:50,0,2,UgwCexNM0whdGdHJukF4AaABAg.AJo_y-q7XnuAJrWG9soTyT,@tin-yennchan301,UCuOMorWrR8lQTxt3D9aLxNw,Lol lol lol,NA,2025-06-27T04:24:29Z,2025-06-27 00:24:29,0,2977985,44775,1737,"Tue, 16 Dec 2025 16:39:10 GMT"
hl1I10iAXog,https://www.youtube.com/watch?v=hl1I10iAXog,Ugz4EytrcWapGcMfQxJ4AaABAg,@jasminkhan661,UCOVCWlaBkOsOrPXYOf2lCGQ,I HOPE TO GOD THE NEXT SEASON SHOULD BE OF ELOISE PLEASE.,NA,2025-06-25T22:02:26Z,2025-06-25 18:02:26,0,1,Ugz4EytrcWapGcMfQxJ4AaABAg.AJoFk-lZNJAAJq5YXguk5d,@terrie-v6p,UC8p0RkdxTBJt-_u3tKw75zQ,"If they are going in book order, Season 5 will be.",en,2025-06-26T15:11:49Z,2025-06-26 11:11:49,1,2977985,44775,1737,"Tue, 16 Dec 2025 16:39:10 GMT"
hl1I10iAXog,https://www.youtube.com/watch?v=hl1I10iAXog,UgyZ5b9s0FaPOwGYM1F4AaABAg,@Kerberosz90,UCUHSSZ-N7tveQWRdCxsAWQg,Its a shame the creators cant make a gay romantic main character in the movie.Frrom creators of claiming themselves so open.... Oh yeah  its more real to have asian and african ancestrors nobels in the seires. it is so fking real. more real than having gays in eurpe,en,2025-06-20T22:59:18Z,2025-06-20 18:59:18,0,1,UgyZ5b9s0FaPOwGYM1F4AaABAg.AJbUH8WcB7VAJgCZ5001ZZ,@terrie-v6p,UC8p0RkdxTBJt-_u3tKw75zQ,"1. It's a TV show, not a movie. 2. Francesca now has a female love interest, so there will be a gay romance.",en,2025-06-22T19:00:40Z,2025-06-22 15:00:40,2,2977985,44775,1737,"Tue, 16 Dec 2025 16:39:10 GMT"
hl1I10iAXog,https://www.youtube.com/watch?v=hl1I10iAXog,UgzKIZD_mwKoWjgeckV4AaABAg,@HelenPolumeheich,UC4-twPj1BFe7qXSIeart9ew,Is it just me or is that a Chinese Megastar on Bridgerton Season 4≡ƒÿ«. But might be a Korean Star instead.,en,2025-06-16T10:18:31Z,2025-06-16 06:18:31,0,1,UgzKIZD_mwKoWjgeckV4AaABAg.AJQp1TeCRuEAJRIP0AqmiD,@terrie-v6p,UC8p0RkdxTBJt-_u3tKw75zQ,She's Korean.,no,2025-06-16T14:43:52Z,2025-06-16 10:43:52,4,2977985,44775,1737,"Tue, 16 Dec 2025 16:39:10 GMT"
hl1I10iAXog,https://www.youtube.com/watch?v=hl1I10iAXog,UgwVQq7qZIWfooDTN0x4AaABAg,@elrom250,UCUWq_slxC7Y_4RnF_7UQmYA,Why do they choose exactly that actress for Sophie? :( She is beutiful but that's not how she was portraited in the book!,en,2025-06-12T15:53:15Z,2025-06-12 11:53:15,1,1,UgwVQq7qZIWfooDTN0x4AaABAg.AJH79gcOu23AJHP-PqaTRM,@terrie-v6p,UC8p0RkdxTBJt-_u3tKw75zQ,"They chose the best actress. In case you haven't noticed, the only love interest who has matched their book counterpart is Penelope.",en,2025-06-12T18:29:08Z,2025-06-12 14:29:08,4,2977985,44775,1737,"Tue, 16 Dec 2025 16:39:10 GMT"
hl1I10iAXog,https://www.youtube.com/watch?v=hl1I10iAXog,Ugwo3j3bSQkKAQQ8IoB4AaABAg,@nanakorobiyaoki9191,UCqQeEejklYAY4TEZH0MJBEw,"I skipped s4 because it felt awkward there's lack of chemistry, I hope they make this good≡ƒñ₧≡ƒÅ╗",en,2025-06-12T08:01:22Z,2025-06-12 04:01:22,0,1,Ugwo3j3bSQkKAQQ8IoB4AaABAg.AJGH9Wy1FpKAJHP2kYwpxB,@terrie-v6p,UC8p0RkdxTBJt-_u3tKw75zQ,You mean Season 3.,NA,2025-06-12T18:29:35Z,2025-06-12 14:29:35,5,2977985,44775,1737,"Tue, 16 Dec 2025 16:39:10 GMT"
hl1I10iAXog,https://www.youtube.com/watch?v=hl1I10iAXog,Ugybrt6b0eQEUd7Hnux4AaABAg,@semiracharles659,UC9NKqF0oCtgTFfP4XupV73A,"He looks 40 tryna play a 20 year old, pick another person",en,2025-06-11T14:57:42Z,2025-06-11 10:57:42,1,3,Ugybrt6b0eQEUd7Hnux4AaABAg.AJES-w_i2JVAJETGEyHXRi,@terrie-v6p,UC8p0RkdxTBJt-_u3tKw75zQ,He's 36. Don't like? Don't watch.,en,2025-06-11T15:08:40Z,2025-06-11 11:08:40,5,2977985,44775,1737,"Tue, 16 Dec 2025 16:39:10 GMT"
hl1I10iAXog,https://www.youtube.com/watch?v=hl1I10iAXog,Ugybrt6b0eQEUd7Hnux4AaABAg,@semiracharles659,UC9NKqF0oCtgTFfP4XupV73A,"He looks 40 tryna play a 20 year old, pick another person",en,2025-06-11T14:57:42Z,2025-06-11 10:57:42,1,3,Ugybrt6b0eQEUd7Hnux4AaABAg.AJES-w_i2JVAJWJwKZx0GV,@bukolaalale8260,UCQ1ykqAEZbzwv1WQ266pwYA,Maybe don't watch,en,2025-06-18T13:33:30Z,2025-06-18 09:33:30,1,2977985,44775,1737,"Tue, 16 Dec 2025 16:39:10 GMT"
hl1I10iAXog,https://www.youtube.com/watch?v=hl1I10iAXog,Ugybrt6b0eQEUd7Hnux4AaABAg,@semiracharles659,UC9NKqF0oCtgTFfP4XupV73A,"He looks 40 tryna play a 20 year old, pick another person",en,2025-06-11T14:57:42Z,2025-06-11 10:57:42,1,3,Ugybrt6b0eQEUd7Hnux4AaABAg.AJES-w_i2JVAJa6DVqDvq_,@trungduong4040,UCfKfWed1KcXnKZT50bnz7HQ,He's 36 and he played a 30-year-old character. Maybe read the book first before commenting.,en,2025-06-20T10:09:51Z,2025-06-20 06:09:51,0,2977985,44775,1737,"Tue, 16 Dec 2025 16:39:10 GMT"
hl1I10iAXog,https://www.youtube.com/watch?v=hl1I10iAXog,UgwMQWeHpmgfx78u9oV4AaABAg,@MsCaroline20,UCRW1Ay6PnsbTXyUi7xy8WyQ,WouldnΓÇÖt it be about the sister. Eloise or Francesca? Will they wrapped all up with all three brothers at once?,en,2025-06-09T18:35:38Z,2025-06-09 14:35:38,0,1,UgwMQWeHpmgfx78u9oV4AaABAg.AJ9gMKm89xLAJECXT3BHyt,@terrie-v6p,UC8p0RkdxTBJt-_u3tKw75zQ,"The first four books go Daphne, Anthony, Benedict, then Colin. Eloise is 5th and Francesca is 6th.",en,2025-06-11T12:42:28Z,2025-06-11 08:42:28,0,2977985,44775,1737,"Tue, 16 Dec 2025 16:39:10 GMT"
hl1I10iAXog,https://www.youtube.com/watch?v=hl1I10iAXog,UgzqlcR__95ozJqCqox4AaABAg,@Kit_Bear,UCTJWLpCxFjo6Ndtl11swxpA,"We wuz aristocrats n sheeeiiiit!

Who the hell finds this historically accurate? If it was anywhere near accurate they'd be scrubbing the floors and chamber pots at most, even then it's the highest of privileges they'd ever get (And deserve).",en,2025-06-08T16:34:56Z,2025-06-08 12:34:56,0,3,UgzqlcR__95ozJqCqox4AaABAg.AJ6tkUlwvyMAJECaD5oNa7,@terrie-v6p,UC8p0RkdxTBJt-_u3tKw75zQ,The show never claimed to be historically accurate -- it is deliberately a historical fantasy.,en,2025-06-11T12:42:59Z,2025-06-11 08:42:59,2,2977985,44775,1737,"Tue, 16 Dec 2025 16:39:10 GMT"
