video_id,video_url,comment_id,comment_author_display,comment_author_channel_id,comment_content,comment_lang,comment_time_utc,comment_time_local,comment_like_count,comment_reply_count,reply_id,reply_author_display,reply_author_channel_id,reply_content,reply_lang,reply_time_utc,reply_time_local,reply_like_count,view_count,like_count,comment_count,crawl_time
ZzjwcujKvho,https://www.youtube.com/watch?v=ZzjwcujKvho,Ugz0PqwA0TfJ3VWrz514AaABAg,@kabtnimahdi9000,UCN9SAEcdvvMY2L3afllXQgQ,their doing this documentary now to give a reason for all the bloodshed and terrorism this evil empire is causing another propaganda to show the US as the good guys well too late everyone is seeing how evil and cruel this racist shithole is realy is,en,2025-04-02T00:21:28Z,2025-04-01 20:21:28,1,3,Ugz0PqwA0TfJ3VWrz514AaABAg.AGOd51SW7wjAHDOyCDald1,@kabtnimahdi9000,UCN9SAEcdvvMY2L3afllXQgQ,@ far from the hillbilly sith lords,en,2025-04-22T12:09:05Z,2025-04-22 08:09:05,0,2153117,31496,3077,"Tue, 16 Dec 2025 03:06:49 GMT"
ZzjwcujKvho,https://www.youtube.com/watch?v=ZzjwcujKvho,UgxNhhf7tG17oReiHT94AaABAg,@user-td5iw5tk9n,UCzLxhw6FYOWQPIDffe7wZ5Q,"If you're looking for English Christian figures responsible for mass killings on an even larger or more brutal scale, here are some notable names:

King Henry VIII (1491–1547) – His reign was marked by religious persecution, mass executions, and the brutal suppression of revolts, including the Pilgrimage of Grace (1536), where thousands were executed. His dissolution of monasteries also led to the suffering and deaths of many poor people.

Queen Elizabeth I (1533–1603) – Under her rule, the English carried out brutal campaigns in Ireland, such as the Desmond Rebellions (1569–1583) and the Nine Years' War (1594–1603). English forces used starvation tactics, burned entire villages, and killed thousands of Irish civilians.

Lord Kitchener (1850–1916) – As a British military leader, he led brutal campaigns during the Boer War (1899–1902), where he established concentration camps in South Africa. Around 26,000 Boer civilians, mostly women and children, died due to disease and starvation.

Sir Robert Clive (1725–1774) – A key figure in British colonial rule in India. His policies and corruption led to the Bengal Famine of 1770, where around 10 million people died due to British mismanagement and exploitative economic policies.

Cecil Rhodes (1853–1902) – A British imperialist responsible for violent colonization in Africa. He led military campaigns that killed thousands of indigenous people in modern-day Zimbabwe and South Africa. His policies encouraged forced labor and the displacement of native populations.

General Reginald Dyer (1864–1927) – The officer responsible for the Jallianwala Bagh massacre (1919) in Amritsar, India. He ordered troops to fire on an unarmed crowd, killing at least 379 people (some estimates say over 1,000).

Many of these figures were celebrated in British history, but their actions led to immense suffering worldwide. Let me know if you're looking for more details on any specific event!",en,2025-03-31T05:48:47Z,2025-03-31 01:48:47,0,1,UgxNhhf7tG17oReiHT94AaABAg.AGK3xXDfvRaAGL5rj7YsNc,@TheGoodGreenScreenKid,UCilaR7pJQSLpWcdMZKPf3Qg,"The difference is that these things happened centuries ago, while Islamists are doing this in 2025.",en,2025-03-31T15:24:42Z,2025-03-31 11:24:42,0,2153117,31496,3077,"Tue, 16 Dec 2025 03:06:49 GMT"
ZzjwcujKvho,https://www.youtube.com/watch?v=ZzjwcujKvho,Ugyy5-X8pV7UMsAizCZ4AaABAg,@personalgm5821,UCGkAdiz_b60XsNzd2yj-jTA,Fake story..amarica want to shows that moslim are Criminal.. But its fake...shame on america,en,2025-03-31T05:32:32Z,2025-03-31 01:32:32,2,2,Ugyy5-X8pV7UMsAizCZ4AaABAg.AGK25WalV5lAGL5tiGgZHq,@TheGoodGreenScreenKid,UCilaR7pJQSLpWcdMZKPf3Qg,What is the real story?,en,2025-03-31T15:24:59Z,2025-03-31 11:24:59,0,2153117,31496,3077,"Tue, 16 Dec 2025 03:06:49 GMT"
ZzjwcujKvho,https://www.youtube.com/watch?v=ZzjwcujKvho,Ugyy5-X8pV7UMsAizCZ4AaABAg,@personalgm5821,UCGkAdiz_b60XsNzd2yj-jTA,Fake story..amarica want to shows that moslim are Criminal.. But its fake...shame on america,en,2025-03-31T05:32:32Z,2025-03-31 01:32:32,2,2,Ugyy5-X8pV7UMsAizCZ4AaABAg.AGK25WalV5lAGYaxNv-Ipb,@personalgm5821,UCGkAdiz_b60XsNzd2yj-jTA,@TheOneRinkana  the real stroy is He a soldier of Islam..And If you want to know the Real story Then  You have to know Why and How Talebans born?What Their mession vission,en,2025-04-05T21:15:13Z,2025-04-05 17:15:13,2,2153117,31496,3077,"Tue, 16 Dec 2025 03:06:49 GMT"
ZzjwcujKvho,https://www.youtube.com/watch?v=ZzjwcujKvho,Ugw0wKPWnFhJzWjfle14AaABAg,@Eke1335,UCRg4DvlYsXQ8Iv63gUIXl0g,I hate these conspiracy theorists commenrs,en,2025-03-30T13:35:16Z,2025-03-30 09:35:16,2,1,Ugw0wKPWnFhJzWjfle14AaABAg.AGIKYIrBvpzAH37n0pQabX,@carljohnson1098,UCJPOmG9tRL26cCIh2NeDmWA,Nah you love the lie media tolds you just who controls american media,en,2025-04-18T12:26:36Z,2025-04-18 08:26:36,0,2153117,31496,3077,"Tue, 16 Dec 2025 03:06:49 GMT"
ZzjwcujKvho,https://www.youtube.com/watch?v=ZzjwcujKvho,UgzhhH3PVKXNKkBs2Rh4AaABAg,@Lostillusion-r6u,UCl7VMx5KhVVuz4UUhDXR5WQ,"actual history  ❌ 

your created history ✔️",en,2025-03-21T15:19:36Z,2025-03-21 11:19:36,39,2,UgzhhH3PVKXNKkBs2Rh4AaABAg.AFwLKbpdXXRAJ9x1Mazj4i,@matib941,UCloVAkf9l1H93i6RWJzAtkQ,Fax,it,2025-06-09T21:01:19Z,2025-06-09 17:01:19,0,2153117,31496,3077,"Tue, 16 Dec 2025 03:06:49 GMT"
ZzjwcujKvho,https://www.youtube.com/watch?v=ZzjwcujKvho,UgzhhH3PVKXNKkBs2Rh4AaABAg,@Lostillusion-r6u,UCl7VMx5KhVVuz4UUhDXR5WQ,"actual history  ❌ 

your created history ✔️",en,2025-03-21T15:19:36Z,2025-03-21 11:19:36,39,2,UgzhhH3PVKXNKkBs2Rh4AaABAg.AFwLKbpdXXRAKY1M_-lFTN,@le_encirclement,UCXy8Bs_ucMmPX4m6YORMMog,Denial 🤡,NA,2025-07-14T02:01:04Z,2025-07-13 22:01:04,0,2153117,31496,3077,"Tue, 16 Dec 2025 03:06:49 GMT"
ZzjwcujKvho,https://www.youtube.com/watch?v=ZzjwcujKvho,UgzXCjWzY1RZa_UJPgR4AaABAg,@IvorySnow_F17XD,UCD5JPTT1sTiUGcoccXIo1UA,0:48 Indonesia mentioned🗣️🇮🇩🇮🇩🇮🇩,en,2025-03-21T13:01:18Z,2025-03-21 09:01:18,0,1,UgzXCjWzY1RZa_UJPgR4AaABAg.AFw5VitHTl8AG5ihgp-cH1,@HYIMSushantoDey,UCURS0UzVQGRX0Z09RW6RINg,So ?,ga,2025-03-25T16:05:01Z,2025-03-25 12:05:01,0,2153117,31496,3077,"Tue, 16 Dec 2025 03:06:49 GMT"
ZzjwcujKvho,https://www.youtube.com/watch?v=ZzjwcujKvho,Ugza-fMxgLy18eD82Ad4AaABAg,@dsiyy,UC_nH7XsMrZhv4PpF8q6eYSA,I guess something important had to be deleted from the documentary thats why it is being delayed?😂,en,2025-03-19T19:42:40Z,2025-03-19 15:42:40,10,1,Ugza-fMxgLy18eD82Ad4AaABAg.AFreqbYsdy0AIHn--H0IOw,@KavitaSharma-u2e,UCWDjTBQFlBL-fgzvLu_F4DA,Yes the US involvement 😅,en,2025-05-19T01:36:08Z,2025-05-18 21:36:08,2,2153117,31496,3077,"Tue, 16 Dec 2025 03:06:49 GMT"
ZzjwcujKvho,https://www.youtube.com/watch?v=ZzjwcujKvho,UgyOXO87fAnGn8hOsTV4AaABAg,@paddybernacki5743,UC9oFrVjT6vZov1CROpc5HsA,Why isn’t it out yet?,en,2025-03-19T15:30:51Z,2025-03-19 11:30:51,8,1,UgyOXO87fAnGn8hOsTV4AaABAg.AFrD1Ft9EY0AG3z2rFCqoT,@Stormlander-1111,UC2zf4na3Val2W0S2fqzJZow,"I think netflix pulled it, atleast until a later date if not altogether. It should have been out the first week of this month.",en,2025-03-24T23:49:22Z,2025-03-24 19:49:22,1,2153117,31496,3077,"Tue, 16 Dec 2025 03:06:49 GMT"
ZzjwcujKvho,https://www.youtube.com/watch?v=ZzjwcujKvho,Ugx_CzQjiUeE1m6y8jZ4AaABAg,@Mister-ottoman,UCJQa9mZ0KH-nC1OsueVBZCQ,911 was a inside job ! So this documentary just makes me laugh. America did the 911 so they can do the war on terror and have a reason to invade Iraq and Afghanistan. But to no shock at all Afghanistan give America a very nice ass whooping and sent them home with billions of dollars in debt..many U.S soldiers killed and nothing to gain.  The real terrorists are the ones wearing suits sitting in the White House !,en,2025-03-19T14:39:13Z,2025-03-19 10:39:13,2,1,Ugx_CzQjiUeE1m6y8jZ4AaABAg.AFr774Jio-mAGL6EK9CFPg,@TheGoodGreenScreenKid,UCilaR7pJQSLpWcdMZKPf3Qg,What are terrorist sympathisers doing here 😂.. just asking,en,2025-03-31T15:27:56Z,2025-03-31 11:27:56,0,2153117,31496,3077,"Tue, 16 Dec 2025 03:06:49 GMT"
ZzjwcujKvho,https://www.youtube.com/watch?v=ZzjwcujKvho,UgyW7XvOZvEI2gocVYl4AaABAg,@kashifqaiyum,UCQQ3yo0KxPkVW1gWcd1zFjA,Do we get an answer why he was thrown in the sea? still a mystery.  May be he is still walking in the streets of bellarus or canada?,en,2025-03-18T17:34:33Z,2025-03-18 13:34:33,0,2,UgyW7XvOZvEI2gocVYl4AaABAg.AForOKMewUiAGL6PuAmqRR,@TheGoodGreenScreenKid,UCilaR7pJQSLpWcdMZKPf3Qg,He was thrown in the sea because they didn't want to bury him on land because it could create a breeding ground for more terrorists.,en,2025-03-31T15:29:30Z,2025-03-31 11:29:30,0,2153117,31496,3077,"Tue, 16 Dec 2025 03:06:49 GMT"
ZzjwcujKvho,https://www.youtube.com/watch?v=ZzjwcujKvho,UgyW7XvOZvEI2gocVYl4AaABAg,@kashifqaiyum,UCQQ3yo0KxPkVW1gWcd1zFjA,Do we get an answer why he was thrown in the sea? still a mystery.  May be he is still walking in the streets of bellarus or canada?,en,2025-03-18T17:34:33Z,2025-03-18 13:34:33,0,2,UgyW7XvOZvEI2gocVYl4AaABAg.AForOKMewUiAH37ynfX9TV,@carljohnson1098,UCJPOmG9tRL26cCIh2NeDmWA,​@TheGoodGreenScreenKidthey never killed him he died lot before,en,2025-04-18T12:28:12Z,2025-04-18 08:28:12,0,2153117,31496,3077,"Tue, 16 Dec 2025 03:06:49 GMT"
ZzjwcujKvho,https://www.youtube.com/watch?v=ZzjwcujKvho,UgxEk_di4qDgVL6y3sd4AaABAg,@TheAnalgesic,UCd_ugVqBcsuFFo71xUI3hLg,Why it is not available till now ?,en,2025-03-17T13:57:16Z,2025-03-17 09:57:16,1,1,UgxEk_di4qDgVL6y3sd4AaABAg.AFltj33FZjDAFoPoMQ08G8,@MameLongas-x7d,UCTT_ajz67IAhm1rxuJmJ3aA,"It’s not available, their fraud",en,2025-03-18T13:24:50Z,2025-03-18 09:24:50,0,2153117,31496,3077,"Tue, 16 Dec 2025 03:06:49 GMT"
ZzjwcujKvho,https://www.youtube.com/watch?v=ZzjwcujKvho,Ugz6RLvtPszeo_b3bOh4AaABAg,@JackPeloquin,UC9NU2bCW73UqIorquk7eW4w,"I love that people are sooo upset… “they’re missing their one binge show a day!!!”??!

Like… are losers really binge full shows… each day?!!

Life on the dole.",en,2025-03-15T11:00:45Z,2025-03-15 07:00:45,2,1,Ugz6RLvtPszeo_b3bOh4AaABAg.AFgQwUv1zyGAIz2GCaNh4Q,@MW-dv9iw,UCFJDi1OCZXvs9A7Nm3sOQCg,Are there a lot of Britons on the dole?,en,2025-06-05T06:04:53Z,2025-06-05 02:04:53,0,2153117,31496,3077,"Tue, 16 Dec 2025 03:06:49 GMT"
ZzjwcujKvho,https://www.youtube.com/watch?v=ZzjwcujKvho,Ugyi1bCQHftXS58ZsnV4AaABAg,@unknown4880,UCCK9qb-8bIbYZhuDLeLWWgg,"Netflix delaying the DOC 
Must’ve had to much information and they put a stop to it 😂 
Question is who made the call ?????",en,2025-03-13T21:49:09Z,2025-03-13 17:49:09,13,1,Ugyi1bCQHftXS58ZsnV4AaABAg.AFcRYolInIxAFdiyKDd5tP,@mikel2674,UClIXOfpQUUPt-W0YzuxlLRg,Bro this actually makes sense,gl,2025-03-14T09:49:18Z,2025-03-14 05:49:18,4,2153117,31496,3077,"Tue, 16 Dec 2025 03:06:49 GMT"
ZzjwcujKvho,https://www.youtube.com/watch?v=ZzjwcujKvho,UgwAKfuR2-fR-bKrFKh4AaABAg,@DOBB14,UC8M2wvnmiLejSUMt0vnLoSQ,Typical Netflix delaying the documentary. I was looking forward to watching it.,en,2025-03-13T20:43:40Z,2025-03-13 16:43:40,28,2,UgwAKfuR2-fR-bKrFKh4AaABAg.AFcK36UK7hjAGVZAT_Rf4P,@SuperFilmregisseur,UCo5eUz4sMz7zcjoQfnNw6VQ,What was the original date?,en,2025-04-04T16:53:12Z,2025-04-04 12:53:12,0,2153117,31496,3077,"Tue, 16 Dec 2025 03:06:49 GMT"
ZzjwcujKvho,https://www.youtube.com/watch?v=ZzjwcujKvho,UgwAKfuR2-fR-bKrFKh4AaABAg,@DOBB14,UC8M2wvnmiLejSUMt0vnLoSQ,Typical Netflix delaying the documentary. I was looking forward to watching it.,en,2025-03-13T20:43:40Z,2025-03-13 16:43:40,28,2,UgwAKfuR2-fR-bKrFKh4AaABAg.AFcK36UK7hjAGeVAU-gMK2,@ScarlettPrice-n8s,UCjA5RclMToEW21UnMOhwdVg,@SuperFilmregisseurit was like over a month ago,en,2025-04-08T13:30:40Z,2025-04-08 09:30:40,0,2153117,31496,3077,"Tue, 16 Dec 2025 03:06:49 GMT"
ZzjwcujKvho,https://www.youtube.com/watch?v=ZzjwcujKvho,UgzWAoXzwarLYwEWnbJ4AaABAg,@mdsakibkamal4408,UCQfKqXeA6goB2YcV4s4tB8w,Juck Fews & their 9:11,NA,2025-03-11T20:06:33Z,2025-03-11 16:06:33,2,1,UgzWAoXzwarLYwEWnbJ4AaABAg.AFY6D_czbicAFh0jAtLwqb,@Wodenlives,UCa5rHZ_Rq7HXknKPIEHdcNg,Wrong,NA,2025-03-15T16:30:59Z,2025-03-15 12:30:59,0,2153117,31496,3077,"Tue, 16 Dec 2025 03:06:49 GMT"
ZzjwcujKvho,https://www.youtube.com/watch?v=ZzjwcujKvho,UgxoNvBT-Jpe22Umva54AaABAg,@Galayi,UCJgvMaKt5GL_06qlfHOyKLg,Warum läuft es in Deutschland noch nicht? Es sollte ab dem 11.03 doch laufen oder?,de,2025-03-11T18:26:00Z,2025-03-11 14:26:00,0,2,UgxoNvBT-Jpe22Umva54AaABAg.AFXvi4WVHSdAFXxJBhm4Rr,@andrewdeen1,UCS8ynVkv9B9atOtTvZZXFZA,it's being edited.. screeners went out last week and someone from government didn't think we should see it without redactions. delayed indefinitely for the moment. i cancelled my netflix over it.,en,2025-03-11T18:39:56Z,2025-03-11 14:39:56,0,2153117,31496,3077,"Tue, 16 Dec 2025 03:06:49 GMT"
ZzjwcujKvho,https://www.youtube.com/watch?v=ZzjwcujKvho,UgxoNvBT-Jpe22Umva54AaABAg,@Galayi,UCJgvMaKt5GL_06qlfHOyKLg,Warum läuft es in Deutschland noch nicht? Es sollte ab dem 11.03 doch laufen oder?,de,2025-03-11T18:26:00Z,2025-03-11 14:26:00,0,2,UgxoNvBT-Jpe22Umva54AaABAg.AFXvi4WVHSdAFXyAV6AhLB,@Galayi,UCJgvMaKt5GL_06qlfHOyKLg,@andrewdeen1  oh vielen dank! Ist es in den USA also auch nicht zu sehen?,de,2025-03-11T18:47:29Z,2025-03-11 14:47:29,0,2153117,31496,3077,"Tue, 16 Dec 2025 03:06:49 GMT"
ZzjwcujKvho,https://www.youtube.com/watch?v=ZzjwcujKvho,Ugwy3aJ7k6EJ6iNi43J4AaABAg,@RaisingLunaAndSimba,UCmfHh8J2phh0urTjJJWzodA,The truth is currently being edited,en,2025-03-11T17:42:05Z,2025-03-11 13:42:05,94,7,Ugwy3aJ7k6EJ6iNi43J4AaABAg.AFXqgR6QZPUAFXxLFSk3Q9,@andrewdeen1,UCS8ynVkv9B9atOtTvZZXFZA,100%,ja,2025-03-11T18:40:13Z,2025-03-11 14:40:13,10,2153117,31496,3077,"Tue, 16 Dec 2025 03:06:49 GMT"
ZzjwcujKvho,https://www.youtube.com/watch?v=ZzjwcujKvho,Ugwy3aJ7k6EJ6iNi43J4AaABAg,@RaisingLunaAndSimba,UCmfHh8J2phh0urTjJJWzodA,The truth is currently being edited,en,2025-03-11T17:42:05Z,2025-03-11 13:42:05,94,7,Ugwy3aJ7k6EJ6iNi43J4AaABAg.AFXqgR6QZPUAI95aBGmB42,@KUNAL-xs2us,UClZufVqlzdVjDeNxpLhTYnQ,Then tell me the truth you have,en,2025-05-15T16:34:12Z,2025-05-15 12:34:12,3,2153117,31496,3077,"Tue, 16 Dec 2025 03:06:49 GMT"
ZzjwcujKvho,https://www.youtube.com/watch?v=ZzjwcujKvho,Ugwy3aJ7k6EJ6iNi43J4AaABAg,@RaisingLunaAndSimba,UCmfHh8J2phh0urTjJJWzodA,The truth is currently being edited,en,2025-03-11T17:42:05Z,2025-03-11 13:42:05,94,7,Ugwy3aJ7k6EJ6iNi43J4AaABAg.AFXqgR6QZPUAIGvRshYT2D,@Showerclouds,UCRDa-WGgmjkyF3qDEyGU-uA,@KUNAL-xs2ustwo words = Iran Oil,NA,2025-05-18T17:30:45Z,2025-05-18 13:30:45,1,2153117,31496,3077,"Tue, 16 Dec 2025 03:06:49 GMT"
ZzjwcujKvho,https://www.youtube.com/watch?v=ZzjwcujKvho,Ugwy3aJ7k6EJ6iNi43J4AaABAg,@RaisingLunaAndSimba,UCmfHh8J2phh0urTjJJWzodA,The truth is currently being edited,en,2025-03-11T17:42:05Z,2025-03-11 13:42:05,94,7,Ugwy3aJ7k6EJ6iNi43J4AaABAg.AFXqgR6QZPUAIHwmq-Yms0,@KUNAL-xs2us,UClZufVqlzdVjDeNxpLhTYnQ,@Showerclouds how does it linked to it?,en,2025-05-19T03:01:43Z,2025-05-18 23:01:43,0,2153117,31496,3077,"Tue, 16 Dec 2025 03:06:49 GMT"
ZzjwcujKvho,https://www.youtube.com/watch?v=ZzjwcujKvho,Ugwy3aJ7k6EJ6iNi43J4AaABAg,@RaisingLunaAndSimba,UCmfHh8J2phh0urTjJJWzodA,The truth is currently being edited,en,2025-03-11T17:42:05Z,2025-03-11 13:42:05,94,7,Ugwy3aJ7k6EJ6iNi43J4AaABAg.AFXqgR6QZPUAIMlCjQgzeW,@peterpeter8217,UCpLnjyrWtc8MAplYWvixeTA,"@KUNAL-xs2us Hello CIA bot, nice to meet you. U are not fooling anybody.",en,2025-05-20T23:56:44Z,2025-05-20 19:56:44,1,2153117,31496,3077,"Tue, 16 Dec 2025 03:06:49 GMT"
ZzjwcujKvho,https://www.youtube.com/watch?v=ZzjwcujKvho,Ugwy3aJ7k6EJ6iNi43J4AaABAg,@RaisingLunaAndSimba,UCmfHh8J2phh0urTjJJWzodA,The truth is currently being edited,en,2025-03-11T17:42:05Z,2025-03-11 13:42:05,94,7,Ugwy3aJ7k6EJ6iNi43J4AaABAg.AFXqgR6QZPUAIO6KL70HLu,@KUNAL-xs2us,UClZufVqlzdVjDeNxpLhTYnQ,"​@peterpeter8217 what tf I have to do with CIA, just asking some questions and you trying to comfort yourself by putting me in a category so there is no scope of talkin",en,2025-05-21T12:29:15Z,2025-05-21 08:29:15,0,2153117,31496,3077,"Tue, 16 Dec 2025 03:06:49 GMT"
ZzjwcujKvho,https://www.youtube.com/watch?v=ZzjwcujKvho,Ugwy3aJ7k6EJ6iNi43J4AaABAg,@RaisingLunaAndSimba,UCmfHh8J2phh0urTjJJWzodA,The truth is currently being edited,en,2025-03-11T17:42:05Z,2025-03-11 13:42:05,94,7,Ugwy3aJ7k6EJ6iNi43J4AaABAg.AFXqgR6QZPUAKY0zgfj4R_,@le_encirclement,UCXy8Bs_ucMmPX4m6YORMMog,"​@KUNAL-xs2us It's one of the only things they can regurgitate.

""Muh CIA, Muh Mossad, muh inside job!""",en,2025-07-14T01:57:48Z,2025-07-13 21:57:48,0,2153117,31496,3077,"Tue, 16 Dec 2025 03:06:49 GMT"
ZzjwcujKvho,https://www.youtube.com/watch?v=ZzjwcujKvho,Ugz9L_2RbPpRj6b-mqJ4AaABAg,@Imaonymous,UC29cuAoCvvUAV6TVQdVq5Tw,Why didn't they release it yesterday? I only subscribed to netflix to watch it wtf,en,2025-03-11T17:12:01Z,2025-03-11 13:12:01,11,2,Ugz9L_2RbPpRj6b-mqJ4AaABAg.AFXnF9M6qPmAFYIn1LMhxV,@mikel2674,UClIXOfpQUUPt-W0YzuxlLRg,Same shit I said smh,NA,2025-03-11T21:56:23Z,2025-03-11 17:56:23,2,2153117,31496,3077,"Tue, 16 Dec 2025 03:06:49 GMT"
ZzjwcujKvho,https://www.youtube.com/watch?v=ZzjwcujKvho,Ugz9L_2RbPpRj6b-mqJ4AaABAg,@Imaonymous,UC29cuAoCvvUAV6TVQdVq5Tw,Why didn't they release it yesterday? I only subscribed to netflix to watch it wtf,en,2025-03-11T17:12:01Z,2025-03-11 13:12:01,11,2,Ugz9L_2RbPpRj6b-mqJ4AaABAg.AFXnF9M6qPmAFcQLcBuhZY,@mimicarotte1241,UC9fJMHA8uvYBoQmZtDrjiTQ,It’s delayed nobody knows why Netflix didn’t even say why,en,2025-03-13T21:38:37Z,2025-03-13 17:38:37,1,2153117,31496,3077,"Tue, 16 Dec 2025 03:06:49 GMT"
ZzjwcujKvho,https://www.youtube.com/watch?v=ZzjwcujKvho,UgxbpE_t_NCausaawnl4AaABAg,@1PieceisR3AL,UCo0wO23Xtr0VdNQdffWvgjg,So when is this actually releasing? I've been waiting for 24 hours already.,en,2025-03-11T15:14:26Z,2025-03-11 11:14:26,4,1,UgxbpE_t_NCausaawnl4AaABAg.AFX_n1uK_ccAFXxPnj5Yty,@andrewdeen1,UCS8ynVkv9B9atOtTvZZXFZA,"probably May 2, the anniversary of the raid",en,2025-03-11T18:40:50Z,2025-03-11 14:40:50,0,2153117,31496,3077,"Tue, 16 Dec 2025 03:06:49 GMT"
ZzjwcujKvho,https://www.youtube.com/watch?v=ZzjwcujKvho,Ugyc6DbJ4j_5b5x6B2h4AaABAg,@MH-vp7lf,UCsAV91g1FLXyho6_Hc7aIiw,It said it will release on 10th March..... its now the 11th still not available,en,2025-03-11T13:12:30Z,2025-03-11 09:12:30,5,1,Ugyc6DbJ4j_5b5x6B2h4AaABAg.AFXMpw4opS7AFXZfMwHte4,@andrewdeen1,UCS8ynVkv9B9atOtTvZZXFZA,they pulled it at the last minute. i cancelled my subscription over it.,en,2025-03-11T15:04:39Z,2025-03-11 11:04:39,1,2153117,31496,3077,"Tue, 16 Dec 2025 03:06:49 GMT"
ZzjwcujKvho,https://www.youtube.com/watch?v=ZzjwcujKvho,Ugy-KSFLg6tp1j26MwV4AaABAg,@Ohshhhii,UCvliAOVKCK8_jxgANCRa8pg,Apparently the doc has been delayed because they forgot to add segments about how white people are racist and men are sexist. Also they didnt bring in a bald headed black woman to get her perspective so they had to go back and fix it. Its slated for release next week sometime,en,2025-03-10T23:22:18Z,2025-03-10 19:22:18,6,5,Ugy-KSFLg6tp1j26MwV4AaABAg.AFVspN3w9k5AFW6TkG95QS,@earthrealm3900,UCZOeuribfsZDER4E6rvmxBQ,Find God,da,2025-03-11T01:30:17Z,2025-03-10 21:30:17,2,2153117,31496,3077,"Tue, 16 Dec 2025 03:06:49 GMT"
ZzjwcujKvho,https://www.youtube.com/watch?v=ZzjwcujKvho,Ugy-KSFLg6tp1j26MwV4AaABAg,@Ohshhhii,UCvliAOVKCK8_jxgANCRa8pg,Apparently the doc has been delayed because they forgot to add segments about how white people are racist and men are sexist. Also they didnt bring in a bald headed black woman to get her perspective so they had to go back and fix it. Its slated for release next week sometime,en,2025-03-10T23:22:18Z,2025-03-10 19:22:18,6,5,Ugy-KSFLg6tp1j26MwV4AaABAg.AFVspN3w9k5AFWDgg3OPvB,@Ohshhhii,UCvliAOVKCK8_jxgANCRa8pg,@earthrealm3900  I did but he couldn't explain why dinosaurs weren't mentioned in the bible and then took off running,en,2025-03-11T02:33:21Z,2025-03-10 22:33:21,0,2153117,31496,3077,"Tue, 16 Dec 2025 03:06:49 GMT"
ZzjwcujKvho,https://www.youtube.com/watch?v=ZzjwcujKvho,Ugy-KSFLg6tp1j26MwV4AaABAg,@Ohshhhii,UCvliAOVKCK8_jxgANCRa8pg,Apparently the doc has been delayed because they forgot to add segments about how white people are racist and men are sexist. Also they didnt bring in a bald headed black woman to get her perspective so they had to go back and fix it. Its slated for release next week sometime,en,2025-03-10T23:22:18Z,2025-03-10 19:22:18,6,5,Ugy-KSFLg6tp1j26MwV4AaABAg.AFVspN3w9k5AFWFHx278sd,@amberthompson106,UCR_iaKRmtPFTWFOThFb7LKQ,The word dinosaur was created until 1842 btw. Find Jesus Christ!,de,2025-03-11T02:47:19Z,2025-03-10 22:47:19,2,2153117,31496,3077,"Tue, 16 Dec 2025 03:06:49 GMT"
ZzjwcujKvho,https://www.youtube.com/watch?v=ZzjwcujKvho,Ugy-KSFLg6tp1j26MwV4AaABAg,@Ohshhhii,UCvliAOVKCK8_jxgANCRa8pg,Apparently the doc has been delayed because they forgot to add segments about how white people are racist and men are sexist. Also they didnt bring in a bald headed black woman to get her perspective so they had to go back and fix it. Its slated for release next week sometime,en,2025-03-10T23:22:18Z,2025-03-10 19:22:18,6,5,Ugy-KSFLg6tp1j26MwV4AaABAg.AFVspN3w9k5AFWFJrxfbiL,@amberthompson106,UCR_iaKRmtPFTWFOThFb7LKQ,​@OhshhhiiTrump must trigger you,en,2025-03-11T02:47:34Z,2025-03-10 22:47:34,1,2153117,31496,3077,"Tue, 16 Dec 2025 03:06:49 GMT"
ZzjwcujKvho,https://www.youtube.com/watch?v=ZzjwcujKvho,Ugy-KSFLg6tp1j26MwV4AaABAg,@Ohshhhii,UCvliAOVKCK8_jxgANCRa8pg,Apparently the doc has been delayed because they forgot to add segments about how white people are racist and men are sexist. Also they didnt bring in a bald headed black woman to get her perspective so they had to go back and fix it. Its slated for release next week sometime,en,2025-03-10T23:22:18Z,2025-03-10 19:22:18,6,5,Ugy-KSFLg6tp1j26MwV4AaABAg.AFVspN3w9k5AFWGWpH2m3I,@Ohshhhii,UCvliAOVKCK8_jxgANCRa8pg,@amberthompson106 Really. Thats your explanation?,en,2025-03-11T02:58:05Z,2025-03-10 22:58:05,1,2153117,31496,3077,"Tue, 16 Dec 2025 03:06:49 GMT"
ZzjwcujKvho,https://www.youtube.com/watch?v=ZzjwcujKvho,Ugy2ua7mYiyAF8PqVW14AaABAg,@its_YZee,UCHxjeod6d96ry105TyyxfAg,LEts hope the truth is told,en,2025-03-10T23:10:54Z,2025-03-10 19:10:54,0,2,Ugy2ua7mYiyAF8PqVW14AaABAg.AFVrWrEmBMzAFVsJzRRMRX,@Ohshhhii,UCvliAOVKCK8_jxgANCRa8pg,Which truth?,en,2025-03-10T23:17:53Z,2025-03-10 19:17:53,0,2153117,31496,3077,"Tue, 16 Dec 2025 03:06:49 GMT"
ZzjwcujKvho,https://www.youtube.com/watch?v=ZzjwcujKvho,Ugy2ua7mYiyAF8PqVW14AaABAg,@its_YZee,UCHxjeod6d96ry105TyyxfAg,LEts hope the truth is told,en,2025-03-10T23:10:54Z,2025-03-10 19:10:54,0,2,Ugy2ua7mYiyAF8PqVW14AaABAg.AFVrWrEmBMzAFXQhx6w1Qu,@its_YZee,UCHxjeod6d96ry105TyyxfAg,@Ohshhhii not the American truth,en,2025-03-11T13:46:22Z,2025-03-11 09:46:22,0,2153117,31496,3077,"Tue, 16 Dec 2025 03:06:49 GMT"
ZzjwcujKvho,https://www.youtube.com/watch?v=ZzjwcujKvho,UgzdFiywFIfWYx8SKmh4AaABAg,@PurpleBunnyMaid,UCFjaLaXBedSmJNbXbWtVElw,Is it just me or did Netflix push this documentary back? It was supposed to come out today but it’s not showing up on my Netflix feed,en,2025-03-10T19:02:09Z,2025-03-10 15:02:09,13,1,UgzdFiywFIfWYx8SKmh4AaABAg.AFVQ30otBP9AFVU929qygs,@NickAAntoniou,UClobp0xVWCGwCquJp3x_3jg,I’m starting to wonder the same.,NA,2025-03-10T19:37:56Z,2025-03-10 15:37:56,2,2153117,31496,3077,"Tue, 16 Dec 2025 03:06:49 GMT"
ZzjwcujKvho,https://www.youtube.com/watch?v=ZzjwcujKvho,UgyT1OYgjJ2VFEkb2ON4AaABAg,@NickAAntoniou,UClobp0xVWCGwCquJp3x_3jg,WHY HAS THIS NOT BEEN RELEASED YET???!,en,2025-03-10T16:25:57Z,2025-03-10 12:25:57,62,18,UgyT1OYgjJ2VFEkb2ON4AaABAg.AFV8AvrXYCCAFVYoYy4PKT,@dennisfboston4543,UCAH6PZbXLRg4_iErwh-p7-Q,I wasn't on before I went to work 8am. Is it still not showing,en,2025-03-10T20:18:41Z,2025-03-10 16:18:41,3,2153117,31496,3077,"Tue, 16 Dec 2025 03:06:49 GMT"
ZzjwcujKvho,https://www.youtube.com/watch?v=ZzjwcujKvho,UgyT1OYgjJ2VFEkb2ON4AaABAg,@NickAAntoniou,UClobp0xVWCGwCquJp3x_3jg,WHY HAS THIS NOT BEEN RELEASED YET???!,en,2025-03-10T16:25:57Z,2025-03-10 12:25:57,62,18,UgyT1OYgjJ2VFEkb2ON4AaABAg.AFV8AvrXYCCAFV_7pYEI4_,@NickAAntoniou,UClobp0xVWCGwCquJp3x_3jg,@dennisfboston4543I just sent Netflix a chat message and they told me that it’s delayed and they are working on it.,en,2025-03-10T20:30:11Z,2025-03-10 16:30:11,0,2153117,31496,3077,"Tue, 16 Dec 2025 03:06:49 GMT"
ZzjwcujKvho,https://www.youtube.com/watch?v=ZzjwcujKvho,UgyT1OYgjJ2VFEkb2ON4AaABAg,@NickAAntoniou,UClobp0xVWCGwCquJp3x_3jg,WHY HAS THIS NOT BEEN RELEASED YET???!,en,2025-03-10T16:25:57Z,2025-03-10 12:25:57,62,18,UgyT1OYgjJ2VFEkb2ON4AaABAg.AFV8AvrXYCCAFVaYMLABvT,@shyrahman4506,UCFVhXbHzmNkK5T_OkTXMeZg,@dennisfboston4543same here I went looking for it tonight here in the Uk 🇬🇧 and could n’t find it am sure they said it was coming out on 10-3-25,en,2025-03-10T20:42:33Z,2025-03-10 16:42:33,0,2153117,31496,3077,"Tue, 16 Dec 2025 03:06:49 GMT"
ZzjwcujKvho,https://www.youtube.com/watch?v=ZzjwcujKvho,UgyT1OYgjJ2VFEkb2ON4AaABAg,@NickAAntoniou,UClobp0xVWCGwCquJp3x_3jg,WHY HAS THIS NOT BEEN RELEASED YET???!,en,2025-03-10T16:25:57Z,2025-03-10 12:25:57,62,18,UgyT1OYgjJ2VFEkb2ON4AaABAg.AFV8AvrXYCCAFVjrauDZd8,@lindsayking3153,UC2PxhI42ClEuWwkYIZWiLGA,⁠6P EST and it’s still not out.,en,2025-03-10T22:03:57Z,2025-03-10 18:03:57,3,2153117,31496,3077,"Tue, 16 Dec 2025 03:06:49 GMT"
ZzjwcujKvho,https://www.youtube.com/watch?v=ZzjwcujKvho,UgyT1OYgjJ2VFEkb2ON4AaABAg,@NickAAntoniou,UClobp0xVWCGwCquJp3x_3jg,WHY HAS THIS NOT BEEN RELEASED YET???!,en,2025-03-10T16:25:57Z,2025-03-10 12:25:57,62,18,UgyT1OYgjJ2VFEkb2ON4AaABAg.AFV8AvrXYCCAFVnqwtKGUd,@kevinrollins9653,UCRg6UuqqKfOlBVwDeJxcptA,@lindsayking3153sure isn’t I called Netflix and They said they didn’t have a date ….. smh😂,en,2025-03-10T22:38:49Z,2025-03-10 18:38:49,1,2153117,31496,3077,"Tue, 16 Dec 2025 03:06:49 GMT"
