video_id,video_title,channel_id,channel_title,video_published_at,view_count,video_like_count,video_comment_count,comment_id,comment_parent_id,comment_author_display,comment_author_channel_id,comment_text,comment_lang,comment_published_utc,comment_published_local,comment_like_count,comment_reply_count
daeL3XxrS-c,Million Dollar Secret | Official Trailer | Netflix,UCWOA1ZGywLbqmigxE4Qlvuw,Netflix,2025-02-25T18:00:00Z,339003,3909,673,UgyEts8spE8h-F9n8zt4AaABAg,NA,@jikaarthou,UC6zprflNF9CcJuDRcfiFPeg,Im absolutely stoked my favorite people stayed at the end. I dont wanna spoil for those that didn't watch. But ending with the most nicest people in the end was very satisfying. 3 of the most likable people.,en,2025-04-16T03:26:08Z,2025-04-15 23:26:08,22,2
daeL3XxrS-c,Million Dollar Secret | Official Trailer | Netflix,UCWOA1ZGywLbqmigxE4Qlvuw,Netflix,2025-02-25T18:00:00Z,339003,3909,673,UgzCsVpwQEOCv4fMZqd4AaABAg,NA,@abeerali1757,UCysOz8tKRPfyvYasbBmeRSQ,"Hoping for new season , happy for cara she played so so well but I wished if sam is the winner",en,2025-04-15T17:36:40Z,2025-04-15 13:36:40,0,0
daeL3XxrS-c,Million Dollar Secret | Official Trailer | Netflix,UCWOA1ZGywLbqmigxE4Qlvuw,Netflix,2025-02-25T18:00:00Z,339003,3909,673,UgwfLK5zfd4DKzY-ww54AaABAg,NA,@yourvibes-YV,UCm2CV4pWtZjOADs5Ccpk51Q,🔥🔥🔥,ja,2025-04-15T10:28:41Z,2025-04-15 06:28:41,1,0
daeL3XxrS-c,Million Dollar Secret | Official Trailer | Netflix,UCWOA1ZGywLbqmigxE4Qlvuw,Netflix,2025-02-25T18:00:00Z,339003,3909,673,UgwWR7NphhLAuf8WYgh4AaABAg,NA,@lallyoisin,UClooFtiuDv0s5uSlnYvIlEw,"I do not usually seek out this kind of show but my partner was watching it and from a BillBurresque like sideline booing position it slowly became a guilty pleasure of mine.  

This is the game of life in a nutshell. 

A very worthy winner in the end ( in more ways than one).",en,2025-04-15T05:26:26Z,2025-04-15 01:26:26,10,0
daeL3XxrS-c,Million Dollar Secret | Official Trailer | Netflix,UCWOA1ZGywLbqmigxE4Qlvuw,Netflix,2025-02-25T18:00:00Z,339003,3909,673,UgyRlgNWbIK1-nODFfp4AaABAg,NA,@xelhacedric4501,UCTTXHaPb5W3eIrYEbuqQj-w,So happy for Cara. She deserved it,en,2025-04-15T01:09:04Z,2025-04-14 21:09:04,5,0
daeL3XxrS-c,Million Dollar Secret | Official Trailer | Netflix,UCWOA1ZGywLbqmigxE4Qlvuw,Netflix,2025-02-25T18:00:00Z,339003,3909,673,UgyEo175BR9sA2lnhfV4AaABAg,NA,@MarvenAlfredo,UCmbZx2sjvbdI6zYfHC2Fayg,"Prefect, But I Want More Episodes Or A New Season!",en,2025-04-14T18:40:16Z,2025-04-14 14:40:16,2,0
daeL3XxrS-c,Million Dollar Secret | Official Trailer | Netflix,UCWOA1ZGywLbqmigxE4Qlvuw,Netflix,2025-02-25T18:00:00Z,339003,3909,673,UgwpSIPWki9CW3X_x0d4AaABAg,NA,@suhflor34,UCoJjdPderUBzh_izZSrDJng,The best player was Sidnee.,en,2025-04-14T12:53:03Z,2025-04-14 08:53:03,4,0
daeL3XxrS-c,Million Dollar Secret | Official Trailer | Netflix,UCWOA1ZGywLbqmigxE4Qlvuw,Netflix,2025-02-25T18:00:00Z,339003,3909,673,Ugw9h9QX6SwKtQxxjNl4AaABAg,NA,@stellaguerra4363,UC5Hz2-Qs2mh8lnm0gVeZs2g,I love this show SO MUCH,en,2025-04-13T23:28:48Z,2025-04-13 19:28:48,1,0
daeL3XxrS-c,Million Dollar Secret | Official Trailer | Netflix,UCWOA1ZGywLbqmigxE4Qlvuw,Netflix,2025-02-25T18:00:00Z,339003,3909,673,UgzLU8coXWJV2E0lmL14AaABAg,NA,@cicifoster3225,UCBKSx2-G16VA_JXq_XD6byg,This is one of the best reality shows I've seen on Netflix! Season 2 is a must!,en,2025-04-13T23:15:13Z,2025-04-13 19:15:13,209,3
daeL3XxrS-c,Million Dollar Secret | Official Trailer | Netflix,UCWOA1ZGywLbqmigxE4Qlvuw,Netflix,2025-02-25T18:00:00Z,339003,3909,673,UgyZzV3jWZMX3f1ITAV4AaABAg,NA,@anuugoo,UCFG9MUB7DTlBucGsw_yYB_g,Cara won fair and square and I am happy she won ❤,fil,2025-04-13T16:15:57Z,2025-04-13 12:15:57,21,2
daeL3XxrS-c,Million Dollar Secret | Official Trailer | Netflix,UCWOA1ZGywLbqmigxE4Qlvuw,Netflix,2025-02-25T18:00:00Z,339003,3909,673,UgzBLPUN3e4nWUgwvRJ4AaABAg,NA,@mujderhan2412,UC9Ny0LqfiHXPZoS2FfccirA,"SPOILER ALERT 🚨

Just finished the show and OMG it was amazing! I have so many thoughts I need to get off my chest.

First of all, I was REALLY hoping that Kyle, Sam, or Corey would win the million dollars — they honestly earned it in my opinion. I’m actually so glad Sydnee didn’t win because her attitude was awful, and the fact that she kills animals? No thanks.

Sam had a real shot at winning, but she lost it when her emotions got in the way — especially when it came to someone she cared about, like Cara. That just shows how soft-hearted Sam actually is, which kind of made her lose her edge as a cop.

As for Jamie, I think she was mostly honest throughout the show. But the way she naturally acted came off as weird to the others, so instead of suspecting the real snake (Cara), they pointed fingers at Jamie.

And speaking of Cara — wow. She played it SO well. This show really teaches you that you can’t trust people like her. And unfortunately, both the guys and Sam made the mistake of trusting her, and she ended up walking away with the million.

Corey, or Kyle instead.
❤❤❤❤❤


P.S Also so glad that Lauren didn’t win either — she was incredibly fake and sneaky the whole time. Seriously, watch out for people like that in real life too!",en,2025-04-13T15:11:12Z,2025-04-13 11:11:12,5,0
daeL3XxrS-c,Million Dollar Secret | Official Trailer | Netflix,UCWOA1ZGywLbqmigxE4Qlvuw,Netflix,2025-02-25T18:00:00Z,339003,3909,673,Ugwje6sYlOoatDKZhct4AaABAg,NA,@Skondtogowno,UCUpywEhErM9Pw0L4fkQNxWA,"To ustawka. W przedostatnim odcinku w ~43.17 wygrywający cały program  gracz zdradził się, że wie o czymś, czego nie powinien, prowadzący nie wspominał o ""immunitecie"". I za to tylko jedna gwiazdka. Od czterdziestej trzeciej minuty wiedziałem, kto wygra program i  już się tak fajnie nie oglądało.",pl,2025-04-13T10:27:46Z,2025-04-13 06:27:46,0,0
daeL3XxrS-c,Million Dollar Secret | Official Trailer | Netflix,UCWOA1ZGywLbqmigxE4Qlvuw,Netflix,2025-02-25T18:00:00Z,339003,3909,673,UgwN9MHOGHnHm4W-Oa54AaABAg,NA,@firnaagustin7278,UCQzbvXkAXZeyzxmBh3v06Ew,"Just finished all episodes, this show is DAMN GOOD, I can't breath...",en,2025-04-13T03:01:14Z,2025-04-12 23:01:14,6,0
daeL3XxrS-c,Million Dollar Secret | Official Trailer | Netflix,UCWOA1ZGywLbqmigxE4Qlvuw,Netflix,2025-02-25T18:00:00Z,339003,3909,673,Ugw-hnYw7ezC-7uB25Z4AaABAg,NA,@mpazinambao2938,UC3Df_wuZFo0ZV3nBJRmaaaQ,"I've forgotten the hosts name, but i love his energy whenever i see him!",en,2025-04-12T17:04:25Z,2025-04-12 13:04:25,1,0
daeL3XxrS-c,Million Dollar Secret | Official Trailer | Netflix,UCWOA1ZGywLbqmigxE4Qlvuw,Netflix,2025-02-25T18:00:00Z,339003,3909,673,UgwPcrJVdd6p35k5dI94AaABAg,NA,@dembeesandgaa8008,UCV2qtcsdFpsY3hd15qUP6QA,"Is anyone should win - it should be Sydnee.

It felt like the whole game was rigged in favor of other players. The matches, tasks, and clues were uneven

Not watching this show again because of how poorly the tasks, clues, and matches were setup",en,2025-04-12T04:35:08Z,2025-04-12 00:35:08,4,2
daeL3XxrS-c,Million Dollar Secret | Official Trailer | Netflix,UCWOA1ZGywLbqmigxE4Qlvuw,Netflix,2025-02-25T18:00:00Z,339003,3909,673,UgyZt_VE69ApW_PJcml4AaABAg,NA,@czerny4186,UCjFu8Go9S5KxxrS2ewPiQjQ,"I always thought Sam was the MVP in my heart, but all she ever cares about is that damn friendship with Cara. I'm really disappointed in her—it's like she's lost her edge as a cop.",en,2025-04-12T02:30:54Z,2025-04-11 22:30:54,78,10
daeL3XxrS-c,Million Dollar Secret | Official Trailer | Netflix,UCWOA1ZGywLbqmigxE4Qlvuw,Netflix,2025-02-25T18:00:00Z,339003,3909,673,UgyCFprG8qTnpYfyVkV4AaABAg,NA,@refayat,UCx7VHuIPMfpNyrJJriom4dg,bring season 2!,NA,2025-04-11T21:12:21Z,2025-04-11 17:12:21,0,0
daeL3XxrS-c,Million Dollar Secret | Official Trailer | Netflix,UCWOA1ZGywLbqmigxE4Qlvuw,Netflix,2025-02-25T18:00:00Z,339003,3909,673,Ugy31q3WAmqh2mtklnp4AaABAg,NA,@StreetsLL1991,UCfjRxJzZ6g0KB-ZXnR2X3yg,Chris is very strategical,NA,2025-04-11T21:04:43Z,2025-04-11 17:04:43,1,0
daeL3XxrS-c,Million Dollar Secret | Official Trailer | Netflix,UCWOA1ZGywLbqmigxE4Qlvuw,Netflix,2025-02-25T18:00:00Z,339003,3909,673,Ugyu1oyt79hz-j-qV6F4AaABAg,NA,@kitkatapril5932,UCrVfE02j0GaD4QWSSViaNjg,Justine Timberlake gonna smash this series up ya?,NA,2025-04-11T19:57:03Z,2025-04-11 15:57:03,1,0
daeL3XxrS-c,Million Dollar Secret | Official Trailer | Netflix,UCWOA1ZGywLbqmigxE4Qlvuw,Netflix,2025-02-25T18:00:00Z,339003,3909,673,UgwZ9VkU1M9VKnlOb0B4AaABAg,NA,@ghbraniac,UCYsAHwhbjAJElRcpQY58tzg,"Based on my observation, those that got the money at the early stages were doomed to be kicked because of the nature of the game. They were tasked to do something that could expose them and the worst part is that, the team got a clue that directly exposed you",en,2025-04-11T19:16:41Z,2025-04-11 15:16:41,44,2
daeL3XxrS-c,Million Dollar Secret | Official Trailer | Netflix,UCWOA1ZGywLbqmigxE4Qlvuw,Netflix,2025-02-25T18:00:00Z,339003,3909,673,UgzJJVZZtGiIHpEA8Ix4AaABAg,NA,@ghbraniac,UCYsAHwhbjAJElRcpQY58tzg,"It was so annoying whenever someone got angry because they were lied to. As if they kept forgetting that it was a game of deceit. You have to be able to lie in order to win the money or else it will be impossible.
I felt so bad for Lauren because she was my favorite at the time. The black lady was so bitter and annoying",en,2025-04-11T18:56:49Z,2025-04-11 14:56:49,26,0
daeL3XxrS-c,Million Dollar Secret | Official Trailer | Netflix,UCWOA1ZGywLbqmigxE4Qlvuw,Netflix,2025-02-25T18:00:00Z,339003,3909,673,Ugz0BiqhxJRq6OlQAhh4AaABAg,NA,@Ispys,UC2774UOaaciOsi9J1i_-WWw,"I always loved Sydney. So beautiful and she played a very classy game. I hate that Cara won. She was just cunning, hence why she won. Not happy with the winner 😒 it was always Sydney for me",en,2025-04-11T18:34:47Z,2025-04-11 14:34:47,4,2
daeL3XxrS-c,Million Dollar Secret | Official Trailer | Netflix,UCWOA1ZGywLbqmigxE4Qlvuw,Netflix,2025-02-25T18:00:00Z,339003,3909,673,Ugy5a9GKGwzYRcusWOJ4AaABAg,NA,@heatherv14513,UChCFEt8cmaQQiGZnYwg4t4Q,LOVED this show.. more seasons please,en,2025-04-11T16:34:07Z,2025-04-11 12:34:07,2,0
daeL3XxrS-c,Million Dollar Secret | Official Trailer | Netflix,UCWOA1ZGywLbqmigxE4Qlvuw,Netflix,2025-02-25T18:00:00Z,339003,3909,673,UgzOLESofX11_OJ-_xh4AaABAg,NA,@jinchang9292,UCoAyLbW1b1nJqxb3bAzK6qw,That was a super fun show,gd,2025-04-11T13:23:38Z,2025-04-11 09:23:38,0,0
daeL3XxrS-c,Million Dollar Secret | Official Trailer | Netflix,UCWOA1ZGywLbqmigxE4Qlvuw,Netflix,2025-02-25T18:00:00Z,339003,3909,673,UgxMaQPKr-pH91IMDP14AaABAg,NA,@JakubPigon-zh9ci,UCjtBRXUvR1pJBHuyIQtz-qA,"Scripted show, unfortunately",en,2025-04-11T12:38:50Z,2025-04-11 08:38:50,1,0
daeL3XxrS-c,Million Dollar Secret | Official Trailer | Netflix,UCWOA1ZGywLbqmigxE4Qlvuw,Netflix,2025-02-25T18:00:00Z,339003,3909,673,UgyG2Gp8cUjGNb1g7CR4AaABAg,NA,@itsschristal3587,UCybgaTIblDXUZfa9wqhuxQw,"If anyone has any hot takes u wanna discuss, feel free to drop them here lol I wanna talk about the show",en,2025-04-11T05:38:27Z,2025-04-11 01:38:27,0,0
daeL3XxrS-c,Million Dollar Secret | Official Trailer | Netflix,UCWOA1ZGywLbqmigxE4Qlvuw,Netflix,2025-02-25T18:00:00Z,339003,3909,673,Ugz78Oq5eGcPNoNRR2Z4AaABAg,NA,@nadiasven4771,UClovrkAzj9COoa1Imzix_UA,"Loved the show!! Itś so refreshing to see a show where u actually have to use your brains while watching. Anybody saw ""pop the balloon?""... OMG how dumb! The worse show ever Netflix!!!",en,2025-04-11T05:11:15Z,2025-04-11 01:11:15,0,0
daeL3XxrS-c,Million Dollar Secret | Official Trailer | Netflix,UCWOA1ZGywLbqmigxE4Qlvuw,Netflix,2025-02-25T18:00:00Z,339003,3909,673,Ugwf8RDN2sMiKbofL-t4AaABAg,NA,@carlitos5336,UC3oycjQXhNFJaovutVEspIQ,I want season 2!!!!,mg,2025-04-11T04:32:34Z,2025-04-11 00:32:34,1,0
daeL3XxrS-c,Million Dollar Secret | Official Trailer | Netflix,UCWOA1ZGywLbqmigxE4Qlvuw,Netflix,2025-02-25T18:00:00Z,339003,3909,673,UgyPdsS9utKOnXVagrx4AaABAg,NA,@vanillamilkbread,UCT0zdAzCJHeFFo07FZ8Mf3g,"good show, 90% of my enjoyment comes from peter because obviously but overall good first season, hope netflix makes another!

also the amount of people saying sam was a good player, i mean yeah i guess in terms of piecing things together to find the millionaire, but did you guys WATCH her performance in the challenges??? omg she had me yelling in the last two episodes especially 😭",en,2025-04-11T00:07:49Z,2025-04-10 20:07:49,2,0
daeL3XxrS-c,Million Dollar Secret | Official Trailer | Netflix,UCWOA1ZGywLbqmigxE4Qlvuw,Netflix,2025-02-25T18:00:00Z,339003,3909,673,Ugwtn_65XmSpcx-0aA94AaABAg,NA,@beamarlo3962,UCXfgr2YYx-SplVlrBzIV7pw,"Please change the rules around to make it fair to win because you're smart and strong and a good competitor. I love the host but change the rules.

I absolutely enjoyed this game except for the last 10 minutes of the finale. So not fair that there wasn't a last challenge to win the money, not fair that the winner was under the radar the entire time and without being a strong player, not winning any challenges, not contributing anything, she got to win. 

I didn't like some of the rules.

There should be some type of reward or advantage for the strongest players like Sydney.

The winner did nothing to earn or win. She didn't play any game.  She just sat there the whole time and for that she won??? She can't even cry right, I didn't believe she was honestly crying...",en,2025-04-10T21:42:07Z,2025-04-10 17:42:07,8,2
daeL3XxrS-c,Million Dollar Secret | Official Trailer | Netflix,UCWOA1ZGywLbqmigxE4Qlvuw,Netflix,2025-02-25T18:00:00Z,339003,3909,673,UgxLC5smiXKLhK9sUJx4AaABAg,NA,@lyrickotela911,UCpRuuaP6fGVBIVH1KnTw2zg,I'll be a spoiler. Cara won ..I don't know why I'm so upset 😭😂 I wanted Corey to win I guess,en,2025-04-10T20:35:25Z,2025-04-10 16:35:25,2,2
daeL3XxrS-c,Million Dollar Secret | Official Trailer | Netflix,UCWOA1ZGywLbqmigxE4Qlvuw,Netflix,2025-02-25T18:00:00Z,339003,3909,673,UgxUq-U2IYUqykMU6Ql4AaABAg,NA,@tshepochoshi3986,UCLauPFBG3gH3rOe8oosSiSQ,"Now that I have thought about it clearly: 

Cara’s part was scripted, can’t be that accurate at everything including that “unfair box switching” game 🚮 she needs and Oscar 🎭 😂",en,2025-04-10T11:34:33Z,2025-04-10 07:34:33,2,1
daeL3XxrS-c,Million Dollar Secret | Official Trailer | Netflix,UCWOA1ZGywLbqmigxE4Qlvuw,Netflix,2025-02-25T18:00:00Z,339003,3909,673,Ugy-0Xe5gQ_TZbSWUL54AaABAg,NA,@jayt4701,UCkfyTnyndt2FKki7baWgSaQ,Its an entertainment show... all  are actors 😂,en,2025-04-10T08:51:32Z,2025-04-10 04:51:32,1,0
daeL3XxrS-c,Million Dollar Secret | Official Trailer | Netflix,UCWOA1ZGywLbqmigxE4Qlvuw,Netflix,2025-02-25T18:00:00Z,339003,3909,673,UgzKd_n2dbkyoiRLk054AaABAg,NA,@telepartychat,UCClwQfGa6gh9M_xehdgXkZg,Netflix does it Again,NA,2025-04-10T06:52:54Z,2025-04-10 02:52:54,1,0
daeL3XxrS-c,Million Dollar Secret | Official Trailer | Netflix,UCWOA1ZGywLbqmigxE4Qlvuw,Netflix,2025-02-25T18:00:00Z,339003,3909,673,Ugwrpuw76m_le04NQKJ4AaABAg,NA,@royaltii_,UCCDiXlyJlh4bDp2PL-NW-Hg,This game is rigged. They cheated the one who actually found out who was the millionaire . Ridiculous!!,en,2025-04-10T05:21:39Z,2025-04-10 01:21:39,1,0
daeL3XxrS-c,Million Dollar Secret | Official Trailer | Netflix,UCWOA1ZGywLbqmigxE4Qlvuw,Netflix,2025-02-25T18:00:00Z,339003,3909,673,UgxW7aJuUwzdgeKoeh94AaABAg,NA,@leonelcadet3833,UCkQQDNQRxTyyQbHydZMTsyg,Cara had a jaw dropping  performance. I would have hate to play poker with her. She didn’t crack.,en,2025-04-10T03:17:16Z,2025-04-09 23:17:16,12,0
daeL3XxrS-c,Million Dollar Secret | Official Trailer | Netflix,UCWOA1ZGywLbqmigxE4Qlvuw,Netflix,2025-02-25T18:00:00Z,339003,3909,673,UgxqbLQZmB2zChUUr3R4AaABAg,NA,@ClaireNasaki,UCEaed-JjiNoUb5PAYMws8og,"It was so stupid when they would say ""I trust you"" ""oh I trust you too"" blah blahh....its a game!",en,2025-04-10T02:56:37Z,2025-04-09 22:56:37,7,0
daeL3XxrS-c,Million Dollar Secret | Official Trailer | Netflix,UCWOA1ZGywLbqmigxE4Qlvuw,Netflix,2025-02-25T18:00:00Z,339003,3909,673,UgxcxlG8ETegvnhF_pN4AaABAg,NA,@Eugeniocaraujo,UCAG-yYPx5Wlm9bu_Sw2FCjg,The rules are so poorly explained in the 1st episode that made me come here just so someone spoils me the winner. Please NETFLIX make something better next time...,en,2025-04-10T01:47:28Z,2025-04-09 21:47:28,2,0
daeL3XxrS-c,Million Dollar Secret | Official Trailer | Netflix,UCWOA1ZGywLbqmigxE4Qlvuw,Netflix,2025-02-25T18:00:00Z,339003,3909,673,UgxK5vA4Pm8dYue2BZx4AaABAg,NA,@limitlesslandon,UCVYGP-xCW2LUg6NcuCnpCmg,just saw the ending! IM SO HAPPY FOR THIS PERSON! I wanted them to win and I hope the millionaire has a wonderful life,en,2025-04-10T00:31:57Z,2025-04-09 20:31:57,3,0
daeL3XxrS-c,Million Dollar Secret | Official Trailer | Netflix,UCWOA1ZGywLbqmigxE4Qlvuw,Netflix,2025-02-25T18:00:00Z,339003,3909,673,UgzqEfiEBsOCIdbO7PJ4AaABAg,NA,@ladyib2402,UCvQgq9U7M8cgUKDcC7dW_eg,I just finished watching the show on netflix. I really liked it👏👌❤.. i  hope for a new season.  I recommend anyone to watch it👌,en,2025-04-10T00:15:47Z,2025-04-09 20:15:47,34,0
daeL3XxrS-c,Million Dollar Secret | Official Trailer | Netflix,UCWOA1ZGywLbqmigxE4Qlvuw,Netflix,2025-02-25T18:00:00Z,339003,3909,673,Ugyr7AkIC2tb0iS7gy54AaABAg,NA,@MobyART-e2y,UCgYn4l7AnxEs35kiAJVseCg,And has anyone else seen the ending yet? ,en,2025-04-09T22:59:59Z,2025-04-09 18:59:59,0,1
daeL3XxrS-c,Million Dollar Secret | Official Trailer | Netflix,UCWOA1ZGywLbqmigxE4Qlvuw,Netflix,2025-02-25T18:00:00Z,339003,3909,673,UgydMOmjTjyPjRYpezB4AaABAg,NA,@whatiswrongwithwhatihadwankers,UCmxJbnuiVUQxVqH4UDKjFhw,I would lay money on Sam the cop being sacked on Monday. absolutely clueless.,en,2025-04-09T22:23:10Z,2025-04-09 18:23:10,0,0
daeL3XxrS-c,Million Dollar Secret | Official Trailer | Netflix,UCWOA1ZGywLbqmigxE4Qlvuw,Netflix,2025-02-25T18:00:00Z,339003,3909,673,UgzIrjqxOQkOMDHtUet4AaABAg,NA,@anonymouskem9834,UCDM4tT9CoHjQaGQX9OxG57g,Cara is one scary lady☠️☠️☠️,en,2025-04-09T20:57:30Z,2025-04-09 16:57:30,0,0
daeL3XxrS-c,Million Dollar Secret | Official Trailer | Netflix,UCWOA1ZGywLbqmigxE4Qlvuw,Netflix,2025-02-25T18:00:00Z,339003,3909,673,UgzmPnp7II89xMjku6t4AaABAg,NA,@BluenvNagya,UCwRs3QQ52uZdCtZ54H_dnkw,"The cop Sammy almost got it, she has the cop skill following the odd behaviour, only if she would stick to be cop only and not add the emotion of being a friend into it, trusting one person from the begging till the end is wild in this game :D :D :D 
Every time  Corey made a guess on anybody it was wrong, which made me laugh so much, like this guy is so off, but u can also tell he is very true to himself, acting pretty much truthful hard for him to lie, which is a good thing and also lead him that far, his last guess was the right one, but too late:)))
And for Cara damn, Miss ""let me cry it out little bit but im gonna finish this game with few lies and strategies and win it with my intuition"" , damn intuition better than cop skills :D :D This show was not bad at all :D",en,2025-04-09T18:04:54Z,2025-04-09 14:04:54,1,0
daeL3XxrS-c,Million Dollar Secret | Official Trailer | Netflix,UCWOA1ZGywLbqmigxE4Qlvuw,Netflix,2025-02-25T18:00:00Z,339003,3909,673,UgxO4EXaY1nkZnGhcG94AaABAg,NA,@shonnynengwex1594,UCfI9aoxuvwhL9eLzxvvR3Pg,Cara played the perfect game. Sam was super and Corey was played.,en,2025-04-09T17:24:50Z,2025-04-09 13:24:50,0,0
daeL3XxrS-c,Million Dollar Secret | Official Trailer | Netflix,UCWOA1ZGywLbqmigxE4Qlvuw,Netflix,2025-02-25T18:00:00Z,339003,3909,673,Ugw4A69TKEmVOJJtMgN4AaABAg,NA,@selenacharles,UCiCXVxZIDPBWJfhwcqxAZQQ,"For me Corey didn't play very well he is intelligent certainly but he changes his mind just after one or two words! Sydney played very well for me she remained honest from the beginning to the end, Phil is not a very good liar lol! For me Sydney deserved to win but unfortunately",en,2025-04-09T17:24:30Z,2025-04-09 13:24:30,8,0
daeL3XxrS-c,Million Dollar Secret | Official Trailer | Netflix,UCWOA1ZGywLbqmigxE4Qlvuw,Netflix,2025-02-25T18:00:00Z,339003,3909,673,Ugw9SIIXWugpX5uW_qx4AaABAg,NA,@flavirs,UCRBt52zG9vky06jHYusf8qw,"Sensacional. Sou apaixonada por reality s, as provas, o enredo, as pistas... Tudo sensacional. Elenco primoroso. Amei, que venha a 2a temporada ou uma temporada aqui no Brasil, meu primo iria ter que participar ❤",pt,2025-04-09T17:02:51Z,2025-04-09 13:02:51,1,0
daeL3XxrS-c,Million Dollar Secret | Official Trailer | Netflix,UCWOA1ZGywLbqmigxE4Qlvuw,Netflix,2025-02-25T18:00:00Z,339003,3909,673,UgxC_0faevMleFDDawJ4AaABAg,NA,@neetha2447,UCk0kVXj-qRS2MtNHgfUAwEw,Finished watching all the episodes in one day. Most amazing reality show. Loved Cara and Sammy. Cara is just the most deserving for not cracking under pressure and playing her cards so well. I’m just amazed at her brilliance. Sammys secret tasks were so brilliantly executed as well. Great show!!!❤️❤️❤️,en,2025-04-09T16:08:33Z,2025-04-09 12:08:33,109,1
daeL3XxrS-c,Million Dollar Secret | Official Trailer | Netflix,UCWOA1ZGywLbqmigxE4Qlvuw,Netflix,2025-02-25T18:00:00Z,339003,3909,673,UgzvOKpF9h6ZUX9u2jN4AaABAg,NA,@noorzakari2781,UCzqxmjVQn6YrrRbfP870yeQ,"I just finished the show. Loved it. More like this Netflix please. 
Spoiler alert / please don't read more if you haven't watched the last episode yet, this is for anyone to share who they wanted the millionaire to be. 



























I was rooting for Sam. Even thu i want it her out the first two episodes 😂 because she was onto Lauren (my first pick) anyways i wanted either sam or Corey to be the millionaire because they really played a good game l. Congrats to cara but it did seem she was handed    the money (when she said she have one sister to sam i was gased again congrats)",en,2025-04-09T15:20:46Z,2025-04-09 11:20:46,2,0
daeL3XxrS-c,Million Dollar Secret | Official Trailer | Netflix,UCWOA1ZGywLbqmigxE4Qlvuw,Netflix,2025-02-25T18:00:00Z,339003,3909,673,UgwxFM8YgOBGYC2FIdB4AaABAg,NA,@BouthainaBallouki,UCVujISpn1a5jvrdcXG6_P_Q,Cory and Sam deserve to lose they are sooooooo dumb and easily manipulated! The millionaire did not even have to try! WHENEVER SOMEONE IS BEING TOO NICE YOU SHOULD NOT TRUST THEM,en,2025-04-09T14:08:43Z,2025-04-09 10:08:43,4,0
daeL3XxrS-c,Million Dollar Secret | Official Trailer | Netflix,UCWOA1ZGywLbqmigxE4Qlvuw,Netflix,2025-02-25T18:00:00Z,339003,3909,673,Ugx9zRk2qChlJ7T7Dxd4AaABAg,NA,@kalenjin-chica3844,UCxghJIEHSqV-p3iu4XX00Nw,Loved it!!!Corey Corey🤗😱,NA,2025-04-09T12:39:08Z,2025-04-09 08:39:08,1,0
daeL3XxrS-c,Million Dollar Secret | Official Trailer | Netflix,UCWOA1ZGywLbqmigxE4Qlvuw,Netflix,2025-02-25T18:00:00Z,339003,3909,673,Ugz0rtM57ErZEmOPIyB4AaABAg,NA,@SMOOTHASMROPERATOR,UCKy__1hmJl2wMIm8DORsMUw,Who is here when Cara wins…😅,en,2025-04-09T10:19:48Z,2025-04-09 06:19:48,45,14
daeL3XxrS-c,Million Dollar Secret | Official Trailer | Netflix,UCWOA1ZGywLbqmigxE4Qlvuw,Netflix,2025-02-25T18:00:00Z,339003,3909,673,UgwkA9t9DGuOl1IW1Hp4AaABAg,NA,@damiencross7334,UCqPXolqANIZ2ejxRSKMHzWw,Looks like a discount traitors show.,NA,2025-04-09T03:54:56Z,2025-04-08 23:54:56,0,0
daeL3XxrS-c,Million Dollar Secret | Official Trailer | Netflix,UCWOA1ZGywLbqmigxE4Qlvuw,Netflix,2025-02-25T18:00:00Z,339003,3909,673,UgwKyrEi7Y3J9-Sfc2N4AaABAg,NA,@zacharydowell6991,UCzeA7EqNyblYJpgKfAwBUfQ,Ok hear me out but what’s the point in voting out the millionaire when it doesn’t actually benefit you in any way??? Point of the game makes no sense…. What they should have done was add like $100K to the pot if they successfully guess the millionaire. This way it keeps people from just voting for whoever they want.,en,2025-04-09T03:06:31Z,2025-04-08 23:06:31,63,8
daeL3XxrS-c,Million Dollar Secret | Official Trailer | Netflix,UCWOA1ZGywLbqmigxE4Qlvuw,Netflix,2025-02-25T18:00:00Z,339003,3909,673,Ugz2wJv1G3ZjQnvHM454AaABAg,NA,@lisy6550,UCdT4gd94QOW5_iFui7FXNTA,Love it & Sam is my favorite ❤,NA,2025-04-08T21:14:54Z,2025-04-08 17:14:54,6,0
daeL3XxrS-c,Million Dollar Secret | Official Trailer | Netflix,UCWOA1ZGywLbqmigxE4Qlvuw,Netflix,2025-02-25T18:00:00Z,339003,3909,673,UgyB3n1QxGKT40wrJIp4AaABAg,NA,@Real_1K,UCEvBqaYYaqABdIX4pJ1rRBQ,So Peter went from Serving John wick his suits to being a millionaire 🫡,en,2025-04-08T13:20:07Z,2025-04-08 09:20:07,3,1
daeL3XxrS-c,Million Dollar Secret | Official Trailer | Netflix,UCWOA1ZGywLbqmigxE4Qlvuw,Netflix,2025-02-25T18:00:00Z,339003,3909,673,UgxnIGLnufhFJEB_USJ4AaABAg,NA,@uyegidgg,UCtH5r0G2zttuXAco-HMuS6A,No wonder society is on a downward spiral with garbage like this that so many stupid people watch,en,2025-04-07T19:13:26Z,2025-04-07 15:13:26,0,0
daeL3XxrS-c,Million Dollar Secret | Official Trailer | Netflix,UCWOA1ZGywLbqmigxE4Qlvuw,Netflix,2025-02-25T18:00:00Z,339003,3909,673,UgzM6M72Q05Bs2re2s54AaABAg,NA,@ZenChameleon,UCVthDHN8wvVOwcYTvw779dw,"I was not expecting this to be SO SO GOOD. You won't be disappointed!
Sydney and Grace.. really *rolls eyes*",en,2025-04-07T16:19:19Z,2025-04-07 12:19:19,37,0
daeL3XxrS-c,Million Dollar Secret | Official Trailer | Netflix,UCWOA1ZGywLbqmigxE4Qlvuw,Netflix,2025-02-25T18:00:00Z,339003,3909,673,Ugy6wA5xu7iFwFgmHv14AaABAg,NA,@philmaccracken,UC-1p9kXXl3bRsMNKg2VKMwg,"Very good show. On Episode 3, Phil got the most obvious hint, it was impossible to deflect or deny. 😭",en,2025-04-07T02:31:43Z,2025-04-06 22:31:43,30,0
daeL3XxrS-c,Million Dollar Secret | Official Trailer | Netflix,UCWOA1ZGywLbqmigxE4Qlvuw,Netflix,2025-02-25T18:00:00Z,339003,3909,673,UgxUvuC4XzYKzey7lqd4AaABAg,NA,@jelenagiljanovic976,UC0oGCdmgUrXmqNxm4MxtiqA,Saaammm 🫶🏼🫶🏼🫶🏼🫶🏼,so,2025-04-07T01:31:06Z,2025-04-06 21:31:06,3,0
