video_id,video_title,channel_id,channel_title,video_published_at,view_count,video_like_count,video_comment_count,comment_id,comment_parent_id,comment_author_display,comment_author_channel_id,comment_text,comment_lang,comment_published_utc,comment_published_local,comment_like_count,comment_reply_count
daeL3XxrS-c,Million Dollar Secret | Official Trailer | Netflix,UCWOA1ZGywLbqmigxE4Qlvuw,Netflix,2025-02-25T18:00:00Z,339003,3909,673,UgzizQKFqsix1zzjX894AaABAg,NA,@christianevik3854,UC4wxC8MVaEeRns-4YDWLU9g,can express how I hate Chris omg,en,2025-06-06T16:43:32Z,2025-06-06 12:43:32,0,0
daeL3XxrS-c,Million Dollar Secret | Official Trailer | Netflix,UCWOA1ZGywLbqmigxE4Qlvuw,Netflix,2025-02-25T18:00:00Z,339003,3909,673,Ugw_ytWf1BSJ1Vybrft4AaABAg,NA,@Nanilrt1,UCEHaUI9pbwwgUMESUOyLrdg,The winner is so unexpected.,en,2025-06-05T04:24:04Z,2025-06-05 00:24:04,1,0
daeL3XxrS-c,Million Dollar Secret | Official Trailer | Netflix,UCWOA1ZGywLbqmigxE4Qlvuw,Netflix,2025-02-25T18:00:00Z,339003,3909,673,Ugx6Oekn_uSdZnGLy-d4AaABAg,NA,@JeffzPhenomkb27,UCRHf-QOd49G7ZFZyuUTGjdw,I think Million Dollar Secret is good.,NA,2025-06-04T00:14:10Z,2025-06-03 20:14:10,0,0
daeL3XxrS-c,Million Dollar Secret | Official Trailer | Netflix,UCWOA1ZGywLbqmigxE4Qlvuw,Netflix,2025-02-25T18:00:00Z,339003,3909,673,Ugx45O6xtCrJRvl3t5V4AaABAg,NA,@SheSheSheSheShe-z5p,UCuFefnTdIQ4niMjS9-5vgCw,Watching this now. Whoever willingly gives Jaimi money for her services is an idiot. Life coach how????,en,2025-06-03T17:39:03Z,2025-06-03 13:39:03,10,0
daeL3XxrS-c,Million Dollar Secret | Official Trailer | Netflix,UCWOA1ZGywLbqmigxE4Qlvuw,Netflix,2025-02-25T18:00:00Z,339003,3909,673,Ugy53ae1dgnMLcLqeFN4AaABAg,NA,@neorable,UCgNvnqkSVSip-N0igX7csHw,Is anyone gonna talk about Peter's rich laugh/chuckle?,en,2025-06-02T19:49:32Z,2025-06-02 15:49:32,1,0
daeL3XxrS-c,Million Dollar Secret | Official Trailer | Netflix,UCWOA1ZGywLbqmigxE4Qlvuw,Netflix,2025-02-25T18:00:00Z,339003,3909,673,Ugy_JldBzAcTgSXnr7J4AaABAg,NA,@mag8547,UCnFDoEMB83zABV0AsoPNYlg,Brilliant show.,NA,2025-06-01T16:36:50Z,2025-06-01 12:36:50,1,0
daeL3XxrS-c,Million Dollar Secret | Official Trailer | Netflix,UCWOA1ZGywLbqmigxE4Qlvuw,Netflix,2025-02-25T18:00:00Z,339003,3909,673,UgwQVMHgDdoADtfSyeR4AaABAg,NA,@kittytangsze,UCuPI9WnIZFUQd-bVjzWkFNw,why don't they use a hair in the second last game.,en,2025-06-01T01:30:58Z,2025-05-31 21:30:58,0,0
daeL3XxrS-c,Million Dollar Secret | Official Trailer | Netflix,UCWOA1ZGywLbqmigxE4Qlvuw,Netflix,2025-02-25T18:00:00Z,339003,3909,673,UgybpYOLEvij3aHjbF94AaABAg,NA,@kemisolabalogunbicz,UC5Ge-VOZwW24o7X0P5MsJvA,I feel bad for Sydney😢,no,2025-05-28T23:27:23Z,2025-05-28 19:27:23,1,0
daeL3XxrS-c,Million Dollar Secret | Official Trailer | Netflix,UCWOA1ZGywLbqmigxE4Qlvuw,Netflix,2025-02-25T18:00:00Z,339003,3909,673,UgzFQlIlr2GpuESv56F4AaABAg,NA,@shaimahamdany4350,UCzDxxJ5gSwP2iGk2bPmPJdA,I don’t get why would you want to vote out the millionaire in the beginning. It would make more sense to unite on voting out the strong players first.,en,2025-05-26T15:33:19Z,2025-05-26 11:33:19,1,0
daeL3XxrS-c,Million Dollar Secret | Official Trailer | Netflix,UCWOA1ZGywLbqmigxE4Qlvuw,Netflix,2025-02-25T18:00:00Z,339003,3909,673,UgzR1urwYOivHoCxyY14AaABAg,NA,@Untz86,UCtG0zOHWb7Fe8wM6bHDwleg,Peter Serafinowicz is the real MVP on this show.,en,2025-05-26T10:08:21Z,2025-05-26 06:08:21,1,0
daeL3XxrS-c,Million Dollar Secret | Official Trailer | Netflix,UCWOA1ZGywLbqmigxE4Qlvuw,Netflix,2025-02-25T18:00:00Z,339003,3909,673,UgxEqUlWLPn7eq_RJXJ4AaABAg,NA,@goombas3040,UCYQm2fUhMn_d2xRNH7RKsWg,This show is so good.  Definitely need more seasons.,en,2025-05-24T22:04:47Z,2025-05-24 18:04:47,4,0
daeL3XxrS-c,Million Dollar Secret | Official Trailer | Netflix,UCWOA1ZGywLbqmigxE4Qlvuw,Netflix,2025-02-25T18:00:00Z,339003,3909,673,UgzLPPqwaIDljhA3PoR4AaABAg,NA,@monik6855,UCzSdBtnS67myeSjCG9WjpFQ,🏆🏆🏆🏆🏆🏆🏆🏆🏆🏆🏆🏆🏆🏆🏆🏆🏆,ja,2025-05-24T18:59:37Z,2025-05-24 14:59:37,0,0
daeL3XxrS-c,Million Dollar Secret | Official Trailer | Netflix,UCWOA1ZGywLbqmigxE4Qlvuw,Netflix,2025-02-25T18:00:00Z,339003,3909,673,UgxgTDSp96qiA-Zrpvp4AaABAg,NA,@stephborr-j8d,UCFaI1gUHO81xNgBlEuBsV3g,I hated Chris and Jaimi .. such winey @&$,en,2025-05-24T00:26:06Z,2025-05-23 20:26:06,0,0
daeL3XxrS-c,Million Dollar Secret | Official Trailer | Netflix,UCWOA1ZGywLbqmigxE4Qlvuw,Netflix,2025-02-25T18:00:00Z,339003,3909,673,Ugw1mFIkUJxmzPpYDjl4AaABAg,NA,@YoBoyGio,UC06bp7OSyPJ5Zb5BVm533uQ,"Just finished the show. A good 6/10. (5 is Avg In my book) it was fun, short, and a good binge reality show. 

I personally wish there was more “Agendas” than the millionaire like they did at the end. Would’ve been more fun if 3 random people got agendas so there constant stuff happening more people to watch and invest cuz some did nothing. Needed more people to be sus than the low IQ stuff people thought.",en,2025-05-23T23:05:43Z,2025-05-23 19:05:43,0,0
daeL3XxrS-c,Million Dollar Secret | Official Trailer | Netflix,UCWOA1ZGywLbqmigxE4Qlvuw,Netflix,2025-02-25T18:00:00Z,339003,3909,673,Ugwy85_qWwlxS4tD89x4AaABAg,NA,@YoBoyGio,UC06bp7OSyPJ5Zb5BVm533uQ,"Finished Ep 1 and the reasoning for voting Harry was low IQ. You would think some smart people would piece together. Harry wanted to hold hands together but failed. The narrator said the person successfully succeeded the agenda so it couldn’t be Harry. I’m surprised no one piece that together IN THAT MOMENT. 

Than someone should’ve got a group of 3s and just ask what is something someone said or done anything small like psychical touch or a weird word. Do that to 2-3 groups and I bet the crying and hug would’ve been in the top. 

They just saw Harry failed and just stuck by it lol didn’t even try to think. What if it isn’t Harry who else could it be. Granted they got somehow close. Only cuz Lauren called out Harry than he called out her back even tho there been others who are “flying under the radar” and the cop lady who kinda sucks notice why she hugging everyone lol 

Likeee",en,2025-05-19T20:15:05Z,2025-05-19 16:15:05,0,4
daeL3XxrS-c,Million Dollar Secret | Official Trailer | Netflix,UCWOA1ZGywLbqmigxE4Qlvuw,Netflix,2025-02-25T18:00:00Z,339003,3909,673,UgzwU5Oc6yb5po9iAe94AaABAg,NA,@Vukani_Ngcobo_97,UC3PAmKNKdlqe2SkpYbPbkDA,Corey will never trust women again,NA,2025-05-19T19:13:05Z,2025-05-19 15:13:05,4,0
daeL3XxrS-c,Million Dollar Secret | Official Trailer | Netflix,UCWOA1ZGywLbqmigxE4Qlvuw,Netflix,2025-02-25T18:00:00Z,339003,3909,673,UgwQKpaibaSKmJwt3hh4AaABAg,NA,@SüleymanKilic-y4n,UC7ErmXFS-B_RNwVbTpefInQ,Das sind 100% Schauspieler. Um ehrlich zu sein nerven mich solche Fake Shows.,de,2025-05-17T23:12:17Z,2025-05-17 19:12:17,0,0
daeL3XxrS-c,Million Dollar Secret | Official Trailer | Netflix,UCWOA1ZGywLbqmigxE4Qlvuw,Netflix,2025-02-25T18:00:00Z,339003,3909,673,Ugz-lIrcN5k8K6PcjFp4AaABAg,NA,@calcontakemeaway9069,UCZ98x099kynLn1krbNcLSqw,Soooooooo gooood ❤❤❤❤❤ loved it all. The Best,NA,2025-05-17T20:40:35Z,2025-05-17 16:40:35,0,0
daeL3XxrS-c,Million Dollar Secret | Official Trailer | Netflix,UCWOA1ZGywLbqmigxE4Qlvuw,Netflix,2025-02-25T18:00:00Z,339003,3909,673,UgxXgkFxRQ_kl4VS3nt4AaABAg,NA,@WanderingNomad482,UCCQW_CYUaoOBvGTagBBZu-w,"Aint none of these people even need the money, all of them got plastic surgery and livin large already",en,2025-05-15T11:11:28Z,2025-05-15 07:11:28,2,1
daeL3XxrS-c,Million Dollar Secret | Official Trailer | Netflix,UCWOA1ZGywLbqmigxE4Qlvuw,Netflix,2025-02-25T18:00:00Z,339003,3909,673,UgxGtzBou50RH4r42cV4AaABAg,NA,@babadosdosfamosos2608,UCw2j9egkvV86qY8jcSXTjTw,"Reality maravilhoso,  fiquei obcecada nele!",NA,2025-05-13T03:33:42Z,2025-05-12 23:33:42,0,0
daeL3XxrS-c,Million Dollar Secret | Official Trailer | Netflix,UCWOA1ZGywLbqmigxE4Qlvuw,Netflix,2025-02-25T18:00:00Z,339003,3909,673,UgxAvjg_oItzPuK8MDt4AaABAg,NA,@dreamsofkaia7275,UCocFbgDaWSNIi_sAUhyxEOg,"I wish they’d do a cast reunion and lash it out!

Then start season two!",en,2025-05-13T01:44:36Z,2025-05-12 21:44:36,1,0
daeL3XxrS-c,Million Dollar Secret | Official Trailer | Netflix,UCWOA1ZGywLbqmigxE4Qlvuw,Netflix,2025-02-25T18:00:00Z,339003,3909,673,Ugyylmr0zDdC22ldYPh4AaABAg,NA,@bonkekunene5910,UCSgiSYTIKhalLcCti9ssqXg,Good afternoon Mr Wick,en,2025-05-10T11:29:39Z,2025-05-10 07:29:39,0,0
daeL3XxrS-c,Million Dollar Secret | Official Trailer | Netflix,UCWOA1ZGywLbqmigxE4Qlvuw,Netflix,2025-02-25T18:00:00Z,339003,3909,673,Ugwkc5reZnfDKc6phNV4AaABAg,NA,@BURGATRON,UC9iPAEfybHbZmvqcnTFK1QQ,just finished. It was fun but they need to fix the mechanics of the game. MINOR SPOILERS: there was no incentive to find the millionaire in the early stages. The contestants got no reward or punishments. It could just become a popularity contest which is why I skipped from episode 5 straight to the last episode because there was not really much suspense anymore.,en,2025-05-08T12:12:54Z,2025-05-08 08:12:54,0,0
daeL3XxrS-c,Million Dollar Secret | Official Trailer | Netflix,UCWOA1ZGywLbqmigxE4Qlvuw,Netflix,2025-02-25T18:00:00Z,339003,3909,673,Ugyg9Qp0UFBCXzkgpX54AaABAg,NA,@RiccaMorri,UClk5yEgLNvYp36BlIhXmG-Q,I love them,NA,2025-05-07T20:24:48Z,2025-05-07 16:24:48,0,0
daeL3XxrS-c,Million Dollar Secret | Official Trailer | Netflix,UCWOA1ZGywLbqmigxE4Qlvuw,Netflix,2025-02-25T18:00:00Z,339003,3909,673,UgxYL7UarPIUazeiKWF4AaABAg,NA,@KEA44,UCA5XXDp7ITmOy8dpd4Dtagg,Harry going out for trying to say Grace🤣 That shit took me out lmfao,en,2025-05-06T17:11:04Z,2025-05-06 13:11:04,47,2
daeL3XxrS-c,Million Dollar Secret | Official Trailer | Netflix,UCWOA1ZGywLbqmigxE4Qlvuw,Netflix,2025-02-25T18:00:00Z,339003,3909,673,UgxfqvYbNFBrN6ibZRV4AaABAg,NA,@KEA44,UCA5XXDp7ITmOy8dpd4Dtagg,"This was soo good! Literally stayed up the whole night watching… Sam played such a good game just to fold under pressure in the end… that advantage might’ve saved her,  she was stressing lol I feel her. 

Any other recommendations similar to this?",en,2025-05-06T17:10:23Z,2025-05-06 13:10:23,0,0
daeL3XxrS-c,Million Dollar Secret | Official Trailer | Netflix,UCWOA1ZGywLbqmigxE4Qlvuw,Netflix,2025-02-25T18:00:00Z,339003,3909,673,UgwJneLpYxcglhU3mk94AaABAg,NA,@KEA44,UCA5XXDp7ITmOy8dpd4Dtagg,"This was soo good! Literally stayed up the whole night watching… Sam played such a good game just to fold under pressure in the end… that advantage might’ve saved her,  she was stressing lol I feel her. 

Any other recommendations similar to this?",en,2025-05-06T16:54:04Z,2025-05-06 12:54:04,0,0
daeL3XxrS-c,Million Dollar Secret | Official Trailer | Netflix,UCWOA1ZGywLbqmigxE4Qlvuw,Netflix,2025-02-25T18:00:00Z,339003,3909,673,Ugy-JfeaBRc9BxzZQux4AaABAg,NA,@trexg96359,UCknwU_R46DFYO8twGPyIy4w,After watching three episodes I just started hating two people with the highest IQ and common sense Sydnee and JAIMI… For crying out loud Lauren had a task and she did a brilliant job she completed both… wish these specimens were given the task I am sure they wouldn’t have been able to complete it… just felt so bad for Lauren.. she did win my heart,en,2025-05-05T19:40:48Z,2025-05-05 15:40:48,4,1
daeL3XxrS-c,Million Dollar Secret | Official Trailer | Netflix,UCWOA1ZGywLbqmigxE4Qlvuw,Netflix,2025-02-25T18:00:00Z,339003,3909,673,Ugy7uOXQmrRpVt3_X4t4AaABAg,NA,@beluwuga,UCQrOVnrBOfmOUopF4AudF1g,Cara is craaaaaazy 😂,so,2025-05-04T14:34:39Z,2025-05-04 10:34:39,1,0
daeL3XxrS-c,Million Dollar Secret | Official Trailer | Netflix,UCWOA1ZGywLbqmigxE4Qlvuw,Netflix,2025-02-25T18:00:00Z,339003,3909,673,UgwMc0JhQshqhvvw0QV4AaABAg,NA,@mukeshimananadine4757,UCBysw3VkD0wK7IQ26yMpTvA,"Something odd about Cara, was it just instinct that she knew the clue was about siblings?? Or how did she know that Sydnee had the reward of immunity. I find it questionable",en,2025-05-03T18:51:42Z,2025-05-03 14:51:42,4,1
daeL3XxrS-c,Million Dollar Secret | Official Trailer | Netflix,UCWOA1ZGywLbqmigxE4Qlvuw,Netflix,2025-02-25T18:00:00Z,339003,3909,673,Ugz2SowQ-tEo7axL3od4AaABAg,NA,@idiaz_kincchannel7592,UC6x-_LscizvXxxCHJ3j9CTw,i want sidney to win so bad....,NA,2025-05-03T10:09:51Z,2025-05-03 06:09:51,0,0
daeL3XxrS-c,Million Dollar Secret | Official Trailer | Netflix,UCWOA1ZGywLbqmigxE4Qlvuw,Netflix,2025-02-25T18:00:00Z,339003,3909,673,UgwggwuOw_LJElOneYp4AaABAg,NA,@theoluwatoyosia,UCFr7Dxr-obOAZq64I2DlJWA,Just finished watching ✨✨✨,en,2025-05-02T23:56:09Z,2025-05-02 19:56:09,0,0
daeL3XxrS-c,Million Dollar Secret | Official Trailer | Netflix,UCWOA1ZGywLbqmigxE4Qlvuw,Netflix,2025-02-25T18:00:00Z,339003,3909,673,Ugzjo3I5DZjWHHJOAGF4AaABAg,NA,@advdostrabalhadores,UCbDhOHz69ZBiexNNjIyagtw,Corey just had to not move de boxes,en,2025-04-30T06:27:09Z,2025-04-30 02:27:09,0,0
daeL3XxrS-c,Million Dollar Secret | Official Trailer | Netflix,UCWOA1ZGywLbqmigxE4Qlvuw,Netflix,2025-02-25T18:00:00Z,339003,3909,673,UgzftqV5Z7Fll8kFTr54AaABAg,NA,@CanadianDreamVisa,UCtldQRKZar2Hc3M-8pY3dPg,Control your emotions control the narrative,en,2025-04-30T01:10:20Z,2025-04-29 21:10:20,3,0
daeL3XxrS-c,Million Dollar Secret | Official Trailer | Netflix,UCWOA1ZGywLbqmigxE4Qlvuw,Netflix,2025-02-25T18:00:00Z,339003,3909,673,UgxCewhi_rt3mOpx_qx4AaABAg,NA,@machiavelli173,UCti-rolHedfj6rEzfA8jFcQ,"Cara Won

Saves your time.",NA,2025-04-28T08:34:09Z,2025-04-28 04:34:09,0,0
daeL3XxrS-c,Million Dollar Secret | Official Trailer | Netflix,UCWOA1ZGywLbqmigxE4Qlvuw,Netflix,2025-02-25T18:00:00Z,339003,3909,673,UgyqnV-qcrDZ17FL4BJ4AaABAg,NA,@mazedaartist5691,UCpndIwGaJvyXp3nkwM3DFTg,This was better than the Traitors. Officially my second favourite reality competition show,en,2025-04-27T02:43:06Z,2025-04-26 22:43:06,0,0
daeL3XxrS-c,Million Dollar Secret | Official Trailer | Netflix,UCWOA1ZGywLbqmigxE4Qlvuw,Netflix,2025-02-25T18:00:00Z,339003,3909,673,UgxgKleZQLsslI4OShx4AaABAg,NA,@akashicrecords123,UC46nswVJ0HEjIHZ1x5iNolQ,"I have a reality show idea that Netflix should totally make!
It’s called Incognito — still a survival show of deception, manipulation, and lies but with a twist.
15 strangers live together in a house or villa, but the catch is they must stay strangers. They can only use their real first names and are forbidden to reveal anything about their job, net income, one big fact about their profession, and maybe even things like their work location or industry.
At the start, a board will show a list of all professions in the house (but not who has which one).
The players have to socialize, investigate, and fish out clues about each other through conversations.
Each day, they’ll have challenges to win a clue about someone’s identity, income, or career.
At night, there’s an elimination: to kick someone out, you must correctly guess their profession. If you guess wrong, you’re at risk too!
It keeps going until only one player remains and wins the prize money.
INCREDIBLE potential for drama, strategy, and mind games. Netflix, make this happen!!
Plus the contestants are random in all ages and their careers like someone is a successful business owner or someone is like a police officer, someone is like an HR or a film director etc.",en,2025-04-26T23:31:34Z,2025-04-26 19:31:34,0,0
daeL3XxrS-c,Million Dollar Secret | Official Trailer | Netflix,UCWOA1ZGywLbqmigxE4Qlvuw,Netflix,2025-02-25T18:00:00Z,339003,3909,673,Ugzxr-1Ddixc1slvrnR4AaABAg,NA,@hand587,UCmzGvKWFF-ZxxN20X0T900A,"Wow, Brian Butterfield has really lost weight! Must be all those hoisin crispy owls.",en,2025-04-26T07:20:26Z,2025-04-26 03:20:26,0,0
daeL3XxrS-c,Million Dollar Secret | Official Trailer | Netflix,UCWOA1ZGywLbqmigxE4Qlvuw,Netflix,2025-02-25T18:00:00Z,339003,3909,673,UgySW5o5e2VlPN2y5gR4AaABAg,NA,@akashicrecords123,UC46nswVJ0HEjIHZ1x5iNolQ,I’m done with the series it is so gooood hoping for a season 2. Also I hope Netflix Sam to another reality shows involving investigations and mind games cause that girl is such a main character,en,2025-04-26T02:19:46Z,2025-04-25 22:19:46,2,0
daeL3XxrS-c,Million Dollar Secret | Official Trailer | Netflix,UCWOA1ZGywLbqmigxE4Qlvuw,Netflix,2025-02-25T18:00:00Z,339003,3909,673,Ugz8QQZp9EqfsJB4kbd4AaABAg,NA,@SCM-n4e,UCgT9-13Vs7miIOy4QaZIxpw,This was so good watched all episodes today,en,2025-04-25T21:29:44Z,2025-04-25 17:29:44,1,0
daeL3XxrS-c,Million Dollar Secret | Official Trailer | Netflix,UCWOA1ZGywLbqmigxE4Qlvuw,Netflix,2025-02-25T18:00:00Z,339003,3909,673,Ugyt4HZSEnPt5ETGwaJ4AaABAg,NA,@jordancrowley1400,UCy0uh7BnCvVL4UFpfV0ljPw,We need season  2!!!,xh,2025-04-25T18:17:28Z,2025-04-25 14:17:28,1,0
daeL3XxrS-c,Million Dollar Secret | Official Trailer | Netflix,UCWOA1ZGywLbqmigxE4Qlvuw,Netflix,2025-02-25T18:00:00Z,339003,3909,673,UgxXP9Egbp3u_idoRSd4AaABAg,NA,@vic7939,UCfhm7GNrHrn8xg865JbSe5w,Watched the god-damned thing non stop on a Saturday. Pretty cool game.,en,2025-04-25T16:54:15Z,2025-04-25 12:54:15,1,0
daeL3XxrS-c,Million Dollar Secret | Official Trailer | Netflix,UCWOA1ZGywLbqmigxE4Qlvuw,Netflix,2025-02-25T18:00:00Z,339003,3909,673,UgwCvgJvLT7uvttuhb54AaABAg,NA,@I_love_Caylus,UC-s5bfvVI6XkNkWDXEtIqOw,One of the best tv shows that I have watched!,en,2025-04-24T14:37:59Z,2025-04-24 10:37:59,2,0
daeL3XxrS-c,Million Dollar Secret | Official Trailer | Netflix,UCWOA1ZGywLbqmigxE4Qlvuw,Netflix,2025-02-25T18:00:00Z,339003,3909,673,UgxktVLJ93KCJT1LVf14AaABAg,NA,@BigTeire,UCdWZVJNYhtph8Ja_nPizdZg,Can we just watch the good host and not these insufferable idiot yanks,en,2025-04-24T10:52:45Z,2025-04-24 06:52:45,0,0
daeL3XxrS-c,Million Dollar Secret | Official Trailer | Netflix,UCWOA1ZGywLbqmigxE4Qlvuw,Netflix,2025-02-25T18:00:00Z,339003,3909,673,Ugwz35BX7HZuTeZB8jh4AaABAg,NA,@skalawitz,UCY_3GjSjQqW2EZ7wi1M1xcA,"That guy.. the host, I really thought he'd bust out ""a Benelli M4, an italian classic.. textured grip should your hands get, wet.""",en,2025-04-23T15:01:51Z,2025-04-23 11:01:51,1,0
daeL3XxrS-c,Million Dollar Secret | Official Trailer | Netflix,UCWOA1ZGywLbqmigxE4Qlvuw,Netflix,2025-02-25T18:00:00Z,339003,3909,673,Ugz5Eyg66xsgWFn1XEd4AaABAg,NA,@HalfMoeHalfAmazing,UCRZdWqaunV4_IFA2AgHgdtQ,"If it wasn't for my wife who likes these types of shows, I would have been happy to never have watched it. The people Netflix picks for these shows have never proved me wrong that they are idiots. Case in point, or should I say points... Lauren's dumb ass tells everyone she was the millionaire making her an outcast. Five people voted for Lauren, knowing she wasn't the millionaire only because she lied about being the millionaire. As if she was supposed to tell people she was the millionaire.  Duh! Of course, if they were the millionaire, they would have lied also. Then Phil, when given the opportunity to take the heat off himself after the first tie vote, voted with his feelings knowing his vote as the millionaire would break the tie. As if he and Sydney could win the million dollars together. And even after the vote made him blatantly look like the millionaire, it took them two days to even consider Phil. Honestly, I'm just gonna move my PS5 to the living room so my wife can watch this dumb show by herself.",en,2025-04-23T01:26:16Z,2025-04-22 21:26:16,0,0
daeL3XxrS-c,Million Dollar Secret | Official Trailer | Netflix,UCWOA1ZGywLbqmigxE4Qlvuw,Netflix,2025-02-25T18:00:00Z,339003,3909,673,UgzgTBTLQSiH2_N2E2N4AaABAg,NA,@RomarjunCabanyog-m9g,UCJrnBBM8pCa-rAuMcoKzlWw,That stupid police girl is useless all her prediction is stupid... I wonder y she became a police women.... 😅😅😅😅,en,2025-04-22T14:15:02Z,2025-04-22 10:15:02,0,0
daeL3XxrS-c,Million Dollar Secret | Official Trailer | Netflix,UCWOA1ZGywLbqmigxE4Qlvuw,Netflix,2025-02-25T18:00:00Z,339003,3909,673,UgxDzBR21hkDSLthAUV4AaABAg,NA,@antoniocarracedo5486,UC--c6AR_10Ub4AtG6Dy5cOw,"My mother and I just watched the entire show last night, it was so freaking amazing, I highly recommend to those who haven’t watched it yet 🤩🙌🏼",en,2025-04-21T23:10:38Z,2025-04-21 19:10:38,1,0
daeL3XxrS-c,Million Dollar Secret | Official Trailer | Netflix,UCWOA1ZGywLbqmigxE4Qlvuw,Netflix,2025-02-25T18:00:00Z,339003,3909,673,UgyATAxL42w2RA8v-o94AaABAg,NA,@luiza7a,UCUzwQifQBPlF6B53BS8cQpA,"Acabei de assistir ao último episódio, já quero nova temporada.",pt,2025-04-21T23:08:02Z,2025-04-21 19:08:02,1,0
daeL3XxrS-c,Million Dollar Secret | Official Trailer | Netflix,UCWOA1ZGywLbqmigxE4Qlvuw,Netflix,2025-02-25T18:00:00Z,339003,3909,673,UgzH6t-AFxoIfC2mfOB4AaABAg,NA,@LAD1578,UCxTLuCzzJZPti1w60YtqprA,❤❤❤ super bueno!,it,2025-04-21T15:51:04Z,2025-04-21 11:51:04,1,0
daeL3XxrS-c,Million Dollar Secret | Official Trailer | Netflix,UCWOA1ZGywLbqmigxE4Qlvuw,Netflix,2025-02-25T18:00:00Z,339003,3909,673,UgzTdIdsRYXYawLHdcF4AaABAg,NA,@jonabrzovic1390,UCm38Gz-3nsSLdbtz4yBg_sQ,"Don t watch it, Cara 🍆 should t win.",NA,2025-04-20T22:57:16Z,2025-04-20 18:57:16,0,0
daeL3XxrS-c,Million Dollar Secret | Official Trailer | Netflix,UCWOA1ZGywLbqmigxE4Qlvuw,Netflix,2025-02-25T18:00:00Z,339003,3909,673,UgwL8hnPfmcdbq66a4V4AaABAg,NA,@MV-wk9xn,UCh0bMNqbEndhZMCFHUNs6tA,"I really wanted to see Lydia and Sydney be the millionaire because I was just so curious how they will handle the game. If they kept philip and lauren, they would have known 2 people cannot have the money again and they would therefore not be contenders anymore. They chose poorly and eventually the most quiet one who lied to her teeth won. It was baffling to me that people were angry towards Lauren for lying when that was the game about. And ultimately seo young's theory of voting your closest friend is the best strategy because sam was blindsided by cara the entire time.",en,2025-04-20T15:46:47Z,2025-04-20 11:46:47,0,0
daeL3XxrS-c,Million Dollar Secret | Official Trailer | Netflix,UCWOA1ZGywLbqmigxE4Qlvuw,Netflix,2025-02-25T18:00:00Z,339003,3909,673,UgwA1Q_L4CNBTeePESh4AaABAg,NA,@ebuka.thenewsguy,UCyLdlPdOwTsD-vn8S1Cll8A,Cara is the perfect player!!,en,2025-04-20T14:32:53Z,2025-04-20 10:32:53,1,0
daeL3XxrS-c,Million Dollar Secret | Official Trailer | Netflix,UCWOA1ZGywLbqmigxE4Qlvuw,Netflix,2025-02-25T18:00:00Z,339003,3909,673,Ugx2YGbB7tkQey6yxmx4AaABAg,NA,@amifeeth,UCCIJ55koWGsumupb7GdpsTA,Wow. That was such a wonderful time watching this show. So many excellent fun game plays and amazing ending! More please!!,en,2025-04-20T03:32:41Z,2025-04-19 23:32:41,1,0
daeL3XxrS-c,Million Dollar Secret | Official Trailer | Netflix,UCWOA1ZGywLbqmigxE4Qlvuw,Netflix,2025-02-25T18:00:00Z,339003,3909,673,UgxsOnE_DiSaJQZcNtp4AaABAg,NA,@carlsonrangey3329,UCJII_cU8k1ny-Wzj_VvGiTA,Just completed this and we need like 55 seasons of it..holly crad!.,en,2025-04-19T21:14:30Z,2025-04-19 17:14:30,16,1
daeL3XxrS-c,Million Dollar Secret | Official Trailer | Netflix,UCWOA1ZGywLbqmigxE4Qlvuw,Netflix,2025-02-25T18:00:00Z,339003,3909,673,Ugw8dFrEz-WgkxjPLFp4AaABAg,NA,@Kenio-z9c,UCWdSQBgbPZR1MBOnALn-tpg,"Good show, but it seems like the whole show was scripted, into them knowing who would win. I wonder if the winner really won a $1 million or did they pay all the participants for their acting roles",en,2025-04-19T17:45:18Z,2025-04-19 13:45:18,0,1
daeL3XxrS-c,Million Dollar Secret | Official Trailer | Netflix,UCWOA1ZGywLbqmigxE4Qlvuw,Netflix,2025-02-25T18:00:00Z,339003,3909,673,Ugw8Oe10jPfqGT5G0_t4AaABAg,NA,@Unadanifeliz,UCNe3ZXngMg6xfsA5JEZL3Ng,Descubrí este reality ayer y me encanta. Lauren cometió un real error al admitir que fue la millonaria. Cara y Sam son increíbles.,es,2025-04-18T13:58:33Z,2025-04-18 09:58:33,0,0
daeL3XxrS-c,Million Dollar Secret | Official Trailer | Netflix,UCWOA1ZGywLbqmigxE4Qlvuw,Netflix,2025-02-25T18:00:00Z,339003,3909,673,UgxlZYZUYYRqtRz2A9d4AaABAg,NA,@Evaa8391,UCoMclWsHJc90aPLd4hdBaYA,"The elimination process in this game is stupid! In 2nd episode, se young actually was right abt who the millionaire is but went home. Ppl can just group together and vote for their strongest competitor to go home and then share the prize when they win at the end.",en,2025-04-18T10:41:09Z,2025-04-18 06:41:09,0,0
daeL3XxrS-c,Million Dollar Secret | Official Trailer | Netflix,UCWOA1ZGywLbqmigxE4Qlvuw,Netflix,2025-02-25T18:00:00Z,339003,3909,673,UgzkQ9EkoJZiRwpGsTR4AaABAg,NA,@jaharradowdell,UCMiRe_rnEAgAPGpRJhpHm3g,"I’m on the fourth episode and it’s definitely a good show…has kept my attention and been tugging my interest to come back for more…can’t wait to see who ends up with it…I think Cory or the cop gonna get it, I forget her name",en,2025-04-18T00:31:20Z,2025-04-17 20:31:20,0,0
daeL3XxrS-c,Million Dollar Secret | Official Trailer | Netflix,UCWOA1ZGywLbqmigxE4Qlvuw,Netflix,2025-02-25T18:00:00Z,339003,3909,673,UgwbteUnqc97RDDb4NV4AaABAg,NA,@Samuel-mj9tl,UCNVAZwQhfZcvn0KjdRR67wQ,Queremos a 2ª Temporadaaaaaa,so,2025-04-17T23:56:37Z,2025-04-17 19:56:37,0,0
daeL3XxrS-c,Million Dollar Secret | Official Trailer | Netflix,UCWOA1ZGywLbqmigxE4Qlvuw,Netflix,2025-02-25T18:00:00Z,339003,3909,673,UgyGi1IvxQmg79aTKuZ4AaABAg,NA,@akamarch1,UCMSLVdTxmWlQz5uWJJCPmhw,How fake friends are born. How manipulator behaves!! How money changes people. This show shows all. FYI Cory is an idiot.,en,2025-04-17T11:29:05Z,2025-04-17 07:29:05,1,0
daeL3XxrS-c,Million Dollar Secret | Official Trailer | Netflix,UCWOA1ZGywLbqmigxE4Qlvuw,Netflix,2025-02-25T18:00:00Z,339003,3909,673,Ugw63KTqccsBy2NYFx54AaABAg,NA,@akamarch1,UCMSLVdTxmWlQz5uWJJCPmhw,Phil got screwed,NA,2025-04-17T11:22:16Z,2025-04-17 07:22:16,1,0
daeL3XxrS-c,Million Dollar Secret | Official Trailer | Netflix,UCWOA1ZGywLbqmigxE4Qlvuw,Netflix,2025-02-25T18:00:00Z,339003,3909,673,UgymYdfFME7SRjnE8QV4AaABAg,NA,@juancarloscorral2746,UCWJDOL0eH6UwBu0cdn1wd0w,I loved it 😂,NA,2025-04-17T05:33:31Z,2025-04-17 01:33:31,0,0
daeL3XxrS-c,Million Dollar Secret | Official Trailer | Netflix,UCWOA1ZGywLbqmigxE4Qlvuw,Netflix,2025-02-25T18:00:00Z,339003,3909,673,UgyNZPw_6-sUXZ6rS-B4AaABAg,NA,@frsena1,UC8BkykPck9MfaN5yd_4NifA,"Just finished the whole series.
Please give us a reunion, Netflix!",en,2025-04-17T00:33:33Z,2025-04-16 20:33:33,165,2
