video_id,video_title,channel_id,channel_title,video_published_at,view_count,video_like_count,video_comment_count,comment_id,comment_parent_id,comment_author_display,comment_author_channel_id,comment_text,comment_lang,comment_published_utc,comment_published_local,comment_like_count,comment_reply_count
daeL3XxrS-c,Million Dollar Secret | Official Trailer | Netflix,UCWOA1ZGywLbqmigxE4Qlvuw,Netflix,2025-02-25T18:00:00Z,339003,3909,673,Ugzp76VtIWh19ipQ_dR4AaABAg,NA,@fabiolagiroto936,UCDUe0nMbaTIi7Zu1bfjZXgw,"NÃO IMPORTA SE É SOBREVIVENTES, OU O SEGREDO DE UM MILHÃO DE DÓLARES,O SABOTADOR ,CASA DOS ARTISTAS,NO LIMITE, BIG BOSTA BRASIL OU OUTROS REALITIES PIORES. TODOS JÁ SÃO MANIPULADOS COM SCRIPT E FEITOS COMO UMA NOVELA, POR ISSO QUE NÃO FICAM TÃO BRAVOS OU NÃO ACONTECEM CONFUSÕES EXTREMAS É TUDO CALCULADO, JÁ TEM UM VENCEDOR,NO CASO A CARA, TAVA NA CARA QUE PODERIA SER A CARA, REPETIRAM CARA O NOME DELA DIVERSAS VEZES UMA MULHER CASADA, UMA SRA CASADA QUE FRITA HAMBÚRGUER... OU SEJA TUDO MARCADO CRONOMETRADO E A SAM PODERIA TER SAÍDO ANTES... MAS NO FINAL FICA A CARA, A CARA DE ROSTO, A CARA DE CARA COMO MILIONÁRIA,ENFIM O APRESENTADOR E O PROGRAMA NUNCA DEIXARAM TÃO ÓBVIO A POLICIAL QUE FOI DESCOBERTA, CARA A AMIGA FALSA DE COREY E QUE ENGANOU A POLICIAL COMO O DONO DA MANSÃO E APRESENTADOR MESMO DIZ QUE PORQUE ESTAVA CHOCADA SE ELA ERA POLICIAL E QUE A CARA TINHA DUAS IRMÃS...😮😮😮😮😮😊😅😅😅😅😅. É UM FINAL BRILHANTE PRA SER COINCIDÊNCIA... TODOS OS REALITIES SÃO COMBINADOS, PORQUE UM SAI O OUTRO FICA. NO REALITY DE VOTAÇÃO É DIFERENTE, TEM UMA PORCENTAGEM E A TV QUALQUER QUE SEJA OMITE DO PÚBLICO A PORCENTAGEM PERFEITA. DEU NÃO SEI QUANTAS BILHÕES DE PESSOAS E DIVIDIDO EM TRÊS,QUEM DISSE QUEM É QUAL E A PORCENTAGEM, NINGUÉM VIU OU VÊ SÓ É FALADO... ALIÁS PAPAGAIO TAMBÉM FALA. E SE DER TANTO PARA % X,  TANTO PARA Y, TANTO PARA K NINGUÉM TEM CERTEZA DESSA REALIDADE PORQUE A TV MAQUEIA TUDO ATÉ OS NÚMEROS. TUDO É UMA NOVELA ORQUESTRADA BEM OU MAL FEITA,MAS É ASSIM... POR MELHOR QUE TENHA SIDO O FINAL DE O SEGREDO DE UM MILHÃO DE DÓLARES. TANTO A EQUIPE APRESENTADOR É TUDO FAKE COMO UMA SÉRIE,UM FILME,NADA É REAL. É TUDO COMBINADO. LOGICAMENTE SÃO PAGOS PRA ISSO. E LOGICAMENTE JÁ ESTAVA PROGRAMADO PRA CARA SER A MILIONÁRIA COM CERTEZA... CASAMENTO AS CEGAS, PODE AINDA TER UMA CHANCE DE SER VERDADEIRO,UMA PEQUENA CHANCE... 90 DIAS PARA CASAR OU CASAMENTO QUEER TAMBÉM É OUTRA ENROLAÇÃO... NÃO ACREDITEM EM TUDO QUE ASSISTEM...EU NUNCA DISSE QUE O VALOR FINAL DE UM MILHÃO DE DÓLARES NÃO FOI PAGO, LOGICAMENTE FOI PAGO PORQUE SERIA UM PROCESSO DE RELEVÂNCIA MUNDIAL... MAS QUE OS OUTROS 11 PERDEDORES TAMBÉM FORAM PAGOS PARA PARTICIPAREM DE UMA FARSA PRÉ GANHA TAMBÉM. ME POUPE.😮😮😮😮😮😂😂😂😂😂.",pt,2025-12-16T21:24:43Z,2025-12-16 16:24:43,1,0
daeL3XxrS-c,Million Dollar Secret | Official Trailer | Netflix,UCWOA1ZGywLbqmigxE4Qlvuw,Netflix,2025-02-25T18:00:00Z,339003,3909,673,Ugx0XWsfr-I_s0VHNM94AaABAg,NA,@CamD477,UCcubK-4HYIZy7jX7C8rj41w,Filmed in beautiful Kelowna British Columbia 🇨🇦 the California of Canada,NA,2025-11-29T16:06:42Z,2025-11-29 11:06:42,0,0
daeL3XxrS-c,Million Dollar Secret | Official Trailer | Netflix,UCWOA1ZGywLbqmigxE4Qlvuw,Netflix,2025-02-25T18:00:00Z,339003,3909,673,UgxrGImJnm1KyNsHLhp4AaABAg,NA,@bReH45,UCjeGQ_eIu2r1q9ZO1571jXQ,guess what.. were getting another season!!!,en,2025-11-26T18:27:37Z,2025-11-26 13:27:37,0,0
daeL3XxrS-c,Million Dollar Secret | Official Trailer | Netflix,UCWOA1ZGywLbqmigxE4Qlvuw,Netflix,2025-02-25T18:00:00Z,339003,3909,673,Ugw1P9oNLyN4Z2Wj3zN4AaABAg,NA,@MrTrance-io2bp,UCf0vkw0oNsC1TzRAq9RQPhA,Wtf is this shite,en,2025-11-23T08:45:26Z,2025-11-23 03:45:26,0,0
daeL3XxrS-c,Million Dollar Secret | Official Trailer | Netflix,UCWOA1ZGywLbqmigxE4Qlvuw,Netflix,2025-02-25T18:00:00Z,339003,3909,673,UgwU8IY1Sq1sf77XcQp4AaABAg,NA,@beachchaos1863,UCWMZHgmXz0sl7AcQSh_169g,Chris and Kyle were so hot,en,2025-11-22T21:54:18Z,2025-11-22 16:54:18,0,0
daeL3XxrS-c,Million Dollar Secret | Official Trailer | Netflix,UCWOA1ZGywLbqmigxE4Qlvuw,Netflix,2025-02-25T18:00:00Z,339003,3909,673,UgzZe5vBeT79aG3ikEN4AaABAg,NA,@MONKEYDFAMILY99,UC1Rmg4fS9WXtRe3mIlyxKMQ,"One of the dumbest show ever  even a 5th grader would win all the games, no mind games people are so dumb watch devil's plan it's an true example for game show how should be",en,2025-11-21T05:09:35Z,2025-11-21 00:09:35,0,0
daeL3XxrS-c,Million Dollar Secret | Official Trailer | Netflix,UCWOA1ZGywLbqmigxE4Qlvuw,Netflix,2025-02-25T18:00:00Z,339003,3909,673,UgxcSxr265D0_I7DBm14AaABAg,NA,@faruklawal5593,UCyEIwRd59fj9MoB3PqO95Bg,Yo this is basically who is the mole,en,2025-11-18T19:33:18Z,2025-11-18 14:33:18,0,0
daeL3XxrS-c,Million Dollar Secret | Official Trailer | Netflix,UCWOA1ZGywLbqmigxE4Qlvuw,Netflix,2025-02-25T18:00:00Z,339003,3909,673,UgzO3ab0qbjmRaeelWB4AaABAg,NA,@irfanlovesanime,UCFg76nh0TTm3LAawiQO5ZlA,Well winner deserve it and it had to be her only,en,2025-11-14T17:00:07Z,2025-11-14 12:00:07,0,0
daeL3XxrS-c,Million Dollar Secret | Official Trailer | Netflix,UCWOA1ZGywLbqmigxE4Qlvuw,Netflix,2025-02-25T18:00:00Z,339003,3909,673,UgxmQjGt5ncP1syYXqd4AaABAg,NA,@BobLee-m8r,UCXwMc-ABgvNh5IMIYH8FBqw,Season 2 now please!,el-Latn,2025-11-10T23:28:34Z,2025-11-10 18:28:34,0,0
daeL3XxrS-c,Million Dollar Secret | Official Trailer | Netflix,UCWOA1ZGywLbqmigxE4Qlvuw,Netflix,2025-02-25T18:00:00Z,339003,3909,673,Ugy6ZKMTF-9ehe4Xuvl4AaABAg,NA,@Liverpoolboy01,UCVOUQizd7nJMJWgi1mIBTUw,"Phil is an ass *ole Bully Boy . Disgusting. 
NYPD cop 😅😂 definitely nothing to brag about. Bbc documentary title Americas biggest gang , NYPD . 
Personally all American cops are the thin blue line gang 
Corey another jerk. Including Kyle disgusting behaviour.",en,2025-11-01T08:18:28Z,2025-11-01 04:18:28,0,1
daeL3XxrS-c,Million Dollar Secret | Official Trailer | Netflix,UCWOA1ZGywLbqmigxE4Qlvuw,Netflix,2025-02-25T18:00:00Z,339003,3909,673,Ugxcsr1HwCKXjCOJD7J4AaABAg,NA,@chemicaes,UCAHIjltAIrjWzINuuVvukoA,Respect 🚀,NA,2025-10-13T03:29:14Z,2025-10-12 23:29:14,0,0
daeL3XxrS-c,Million Dollar Secret | Official Trailer | Netflix,UCWOA1ZGywLbqmigxE4Qlvuw,Netflix,2025-02-25T18:00:00Z,339003,3909,673,Ugw7DRIXuQ65rlUlIjN4AaABAg,NA,@fitgirllegbusta2406,UCjjMEUlx4kHixmK6QtHbCtg,uegh brother eeeeugh! Why that girl head so skinny? whaaaaa,so,2025-10-11T05:50:35Z,2025-10-11 01:50:35,0,0
daeL3XxrS-c,Million Dollar Secret | Official Trailer | Netflix,UCWOA1ZGywLbqmigxE4Qlvuw,Netflix,2025-02-25T18:00:00Z,339003,3909,673,Ugzcvq94awmIZxvq3G54AaABAg,NA,@cediemina4528,UC813XsREo8pDVcyEMGxDecQ,"Lauren, Cara & Kyle are my bias here.

Sam is so smart too

Lauren has a chance to win this if she did not reveal she is the millionaire, what a big mistake from her.",en,2025-10-07T17:30:07Z,2025-10-07 13:30:07,0,0
daeL3XxrS-c,Million Dollar Secret | Official Trailer | Netflix,UCWOA1ZGywLbqmigxE4Qlvuw,Netflix,2025-02-25T18:00:00Z,339003,3909,673,UgyYz32gcvzjh3oYGQl4AaABAg,NA,@geenalawrence8338,UCfYXKJRoD55CqMoSUvu2k4Q,"Absolutely fantastic show. Netflix really knows how to do competition reality shows (The Mole, The Circle, Devil’s Plan etc.) and now this. 
Can’t wait for season 2!",en,2025-10-05T10:02:40Z,2025-10-05 06:02:40,1,0
daeL3XxrS-c,Million Dollar Secret | Official Trailer | Netflix,UCWOA1ZGywLbqmigxE4Qlvuw,Netflix,2025-02-25T18:00:00Z,339003,3909,673,UgzAONyw7qDWns0P1al4AaABAg,NA,@LORD-sg2pg,UCVCgC3nTy4Pe_jqjH_LnJOQ,شونق اكس بونق 🙌,ps,2025-10-04T21:34:37Z,2025-10-04 17:34:37,1,0
daeL3XxrS-c,Million Dollar Secret | Official Trailer | Netflix,UCWOA1ZGywLbqmigxE4Qlvuw,Netflix,2025-02-25T18:00:00Z,339003,3909,673,UgwY96fDM6nVb2YAWQZ4AaABAg,NA,@danjat4256,UC5ukXyOiXm-xUQrg8-wme8A,Its the point of the show to somewhat over dramatic but that jaimi is a real massive B,en,2025-09-26T13:31:35Z,2025-09-26 09:31:35,0,0
daeL3XxrS-c,Million Dollar Secret | Official Trailer | Netflix,UCWOA1ZGywLbqmigxE4Qlvuw,Netflix,2025-02-25T18:00:00Z,339003,3909,673,Ugw9COwyf0P76vlVjAJ4AaABAg,NA,@starboy32,UCPYq8_EAV1IqD4rmGQblZpA,Lol Sam thought her fiery latina intuition was real. Turns out she's just an idiot.,en,2025-09-22T07:09:09Z,2025-09-22 03:09:09,0,0
daeL3XxrS-c,Million Dollar Secret | Official Trailer | Netflix,UCWOA1ZGywLbqmigxE4Qlvuw,Netflix,2025-02-25T18:00:00Z,339003,3909,673,UgxlJ97Sry2ia1pE6Oh4AaABAg,NA,@shruthisharma5981,UCTXViCSn0ylhvhSbkGVK2kw,I literally binge watched!! One the best shows ever❤ . Might not be everyone's cup of tea though. Lovely and strategic show though. It goes so smoothly till the end without any chaos!!,en,2025-09-22T01:52:04Z,2025-09-21 21:52:04,0,0
daeL3XxrS-c,Million Dollar Secret | Official Trailer | Netflix,UCWOA1ZGywLbqmigxE4Qlvuw,Netflix,2025-02-25T18:00:00Z,339003,3909,673,UgxWLxxT7Qq1Remdl094AaABAg,NA,@greyyrpt,UCy7bwJ2MCdIyaBISl_WQGLQ,I felt bad when Kyle was voted out. He deserves to be in the Finale instead of Corey.,en,2025-09-18T10:12:17Z,2025-09-18 06:12:17,0,0
daeL3XxrS-c,Million Dollar Secret | Official Trailer | Netflix,UCWOA1ZGywLbqmigxE4Qlvuw,Netflix,2025-02-25T18:00:00Z,339003,3909,673,UgwEv9FcZqetvoN4aGZ4AaABAg,NA,@khaliphachwayita789,UC3VW_gvP9JtgDQyZ7M6MhEA,"The whole concept of this show was to lie and keep a million, I'm confused that some of these contestants got mad that someone had that money and kept it from them they were so horrible to Lauren!? And she was annoying... don't come on this show if you'll feel guilty for lying and reveal you were the millionaire😅",en,2025-09-15T05:47:48Z,2025-09-15 01:47:48,0,0
daeL3XxrS-c,Million Dollar Secret | Official Trailer | Netflix,UCWOA1ZGywLbqmigxE4Qlvuw,Netflix,2025-02-25T18:00:00Z,339003,3909,673,UgxorI34y69UCzqLPp54AaABAg,NA,@papsje5845,UC91BBpFXCC-wCMkcilkzzCQ,"Too bad, Lauren could’ve won or stayed longer if she didn’t tell the truth, i mean she was really good at the challenges.",en,2025-09-02T01:41:15Z,2025-09-01 21:41:15,0,0
daeL3XxrS-c,Million Dollar Secret | Official Trailer | Netflix,UCWOA1ZGywLbqmigxE4Qlvuw,Netflix,2025-02-25T18:00:00Z,339003,3909,673,Ugx8YId3Q8qFOQNS-294AaABAg,NA,@papsje5845,UC91BBpFXCC-wCMkcilkzzCQ,“why are you shocked? You’re a cop!” was the perfect ending line for this show! 😂😂😂,en,2025-09-02T01:36:43Z,2025-09-01 21:36:43,0,0
daeL3XxrS-c,Million Dollar Secret | Official Trailer | Netflix,UCWOA1ZGywLbqmigxE4Qlvuw,Netflix,2025-02-25T18:00:00Z,339003,3909,673,Ugzj92dcw_ylZOp0baR4AaABAg,NA,@PotatoWedge12,UCkC4rEayDXcVRuhENsxhGMA,"For those who dont get the show:

I didnt get it too at first but that's because all the millionaires so far were weak players imo (im up to ep 4). 

If for example Phil were a stronger player he could lie about what his reward was and say ""all votes against me are not counted"" when in fact its something else, thats a really powerful tool to be able to convince a few people to SIDE WITH YOU.  
And if you're a non millionaire it would be greatly in your advantage if the millionaire does side with you.

The true nature of this game is to find the millionaire NOT to get them out but to get the them to side with you and then backstab them right AT THE END. 

Like i said im up to ep 4 but Lauren and Phil were weak players tbh",en,2025-09-01T18:00:47Z,2025-09-01 14:00:47,2,0
daeL3XxrS-c,Million Dollar Secret | Official Trailer | Netflix,UCWOA1ZGywLbqmigxE4Qlvuw,Netflix,2025-02-25T18:00:00Z,339003,3909,673,Ugy7bVBJUr_kFwGCPL94AaABAg,NA,@RAIKON80,UCFomkrDpzo48p2mpsLkXr6w,I know this man.... He sells guns like they are dessert.,en,2025-08-31T20:26:09Z,2025-08-31 16:26:09,0,0
daeL3XxrS-c,Million Dollar Secret | Official Trailer | Netflix,UCWOA1ZGywLbqmigxE4Qlvuw,Netflix,2025-02-25T18:00:00Z,339003,3909,673,UgwoDvkM0ydu1bF05Q94AaABAg,NA,@domestinger8805,UC3G0SlF8_H6mMVK-o-u8ZZQ,gay,es,2025-08-30T12:23:27Z,2025-08-30 08:23:27,0,0
daeL3XxrS-c,Million Dollar Secret | Official Trailer | Netflix,UCWOA1ZGywLbqmigxE4Qlvuw,Netflix,2025-02-25T18:00:00Z,339003,3909,673,UgwHUjAWOndGqwpdNU94AaABAg,NA,@TheCommanderRoku,UC2wBnLqt8lskCctQ4b2ClKg,At last we will reveal ourselves to the Jedi. At last we will have revenge.,en,2025-08-27T05:10:51Z,2025-08-27 01:10:51,0,0
daeL3XxrS-c,Million Dollar Secret | Official Trailer | Netflix,UCWOA1ZGywLbqmigxE4Qlvuw,Netflix,2025-02-25T18:00:00Z,339003,3909,673,Ugxvz6Y_SwnnX8oit2d4AaABAg,NA,@raulrocha9385,UC8RFto-2SMYmozbWzwPWUog,De las mejores que e visto,es,2025-08-26T23:11:56Z,2025-08-26 19:11:56,0,0
daeL3XxrS-c,Million Dollar Secret | Official Trailer | Netflix,UCWOA1ZGywLbqmigxE4Qlvuw,Netflix,2025-02-25T18:00:00Z,339003,3909,673,UgxI6oX1b1BKlN16RtV4AaABAg,NA,@John.Skelton,UCGx-ktzX--6ORpXrbavEALg,SCTANLEY IS HOSTING A GAME SHOW NOW?!? 😅,en,2025-08-26T14:33:27Z,2025-08-26 10:33:27,0,0
daeL3XxrS-c,Million Dollar Secret | Official Trailer | Netflix,UCWOA1ZGywLbqmigxE4Qlvuw,Netflix,2025-02-25T18:00:00Z,339003,3909,673,UgwyGRTDqBMIOT4QTKd4AaABAg,NA,@Leon14K,UCK_VNvO0UFZqk-mOhri7ijw,Vip masters?,NA,2025-08-23T00:38:06Z,2025-08-22 20:38:06,0,0
daeL3XxrS-c,Million Dollar Secret | Official Trailer | Netflix,UCWOA1ZGywLbqmigxE4Qlvuw,Netflix,2025-02-25T18:00:00Z,339003,3909,673,UgxVzKd1qj46uUybTSd4AaABAg,NA,@khairulanwar8303,UC0e85cHSdOaod5uRhODDhjw,Basically if u win millions dollar in USA....u not a millionaire.. cause government will take half of it as a tax😂😂,en,2025-08-21T23:27:05Z,2025-08-21 19:27:05,0,0
daeL3XxrS-c,Million Dollar Secret | Official Trailer | Netflix,UCWOA1ZGywLbqmigxE4Qlvuw,Netflix,2025-02-25T18:00:00Z,339003,3909,673,UgwA5shrKyS1OJdtTxB4AaABAg,NA,@howtoliveyourbestlife6730,UCOqp3akounr530kKRON50Ww,"Cara won cause she kept quiet and played dumb, she knew what was going on.",en,2025-08-17T20:37:13Z,2025-08-17 16:37:13,8,0
daeL3XxrS-c,Million Dollar Secret | Official Trailer | Netflix,UCWOA1ZGywLbqmigxE4Qlvuw,Netflix,2025-02-25T18:00:00Z,339003,3909,673,UgxSWjmw9oKYDyTFOb14AaABAg,NA,@iraisvasquezmontero7728,UCZjCM_PZeQAYj2QU43rigkw,Que pretenden con este tipo de películas muy alejadas de la realidad de nuestro Méxicocomo dijera mi Abuelo Alfonso Castellanos por qué andar imantando costumbres nocivas extranjeras que no te aportan nada🐷🐷🐷🐷🐷🐷🐷🐷🐷🐒🐒🐸🐸🐸🐸🐸🐸🐶🐶🦊🙉🙈🙊🦅🦅🦅🦅🦅🦅🐍🦎🦖🦖🦖🐙🦀,es,2025-08-10T22:14:22Z,2025-08-10 18:14:22,0,0
daeL3XxrS-c,Million Dollar Secret | Official Trailer | Netflix,UCWOA1ZGywLbqmigxE4Qlvuw,Netflix,2025-02-25T18:00:00Z,339003,3909,673,Ugw-UtO3iSH052v1_iB4AaABAg,NA,@mrfisbees,UCeJMRxT_M2pOr_Wu4qarGgA,"I'm on episode 3 or 4 now, and I can already tell they really didn't think this through. The clues to who has the money are way WAY too easy. Just had the one that said the secret agenda was inspired by a horror movie. Come on, man. It's like the producers are choosing who they want out next.",en,2025-07-30T03:33:24Z,2025-07-29 23:33:24,1,0
daeL3XxrS-c,Million Dollar Secret | Official Trailer | Netflix,UCWOA1ZGywLbqmigxE4Qlvuw,Netflix,2025-02-25T18:00:00Z,339003,3909,673,Ugz-fSG_zLKaBEtxyll4AaABAg,NA,@evalara,UC-_FfxXl5gyuZ9byh02bBQA,Best reality show ever I couldn’t stop watching and I hate reality shows lol,en,2025-07-30T03:20:39Z,2025-07-29 23:20:39,4,0
daeL3XxrS-c,Million Dollar Secret | Official Trailer | Netflix,UCWOA1ZGywLbqmigxE4Qlvuw,Netflix,2025-02-25T18:00:00Z,339003,3909,673,UgxL6BJx3lpVDyQtxLx4AaABAg,NA,@dmnk_ss,UCrHMQG2KE7AXq_Tm5PT6wjQ,"Spoiler alert:





Peter is the winner of this show.",nl,2025-07-29T21:42:04Z,2025-07-29 17:42:04,0,0
daeL3XxrS-c,Million Dollar Secret | Official Trailer | Netflix,UCWOA1ZGywLbqmigxE4Qlvuw,Netflix,2025-02-25T18:00:00Z,339003,3909,673,Ugzw9liRES6DoWZP_Mp4AaABAg,NA,@IFITAINT1THINGITISANOTHER,UCkMi6771jyz7LWGKVcOrpyg,They need to keep who they voted for to themselves. And Sydnee is besides herself because she thinks that  she looks better than she actually looks. Cara never won anything but she wants people to believe she lost  competitions on purpose. She didn't deserve to win🤔👀👎🏽,en,2025-07-28T02:24:30Z,2025-07-27 22:24:30,1,2
daeL3XxrS-c,Million Dollar Secret | Official Trailer | Netflix,UCWOA1ZGywLbqmigxE4Qlvuw,Netflix,2025-02-25T18:00:00Z,339003,3909,673,UgxO7rHlebxv4JZQlNZ4AaABAg,NA,@Unknown-us3ii,UCB40nxweumTU1MoL3Tt61gQ,"The old lady was the only person who was smart, everyone else? A bunch of emotional idiots... why are they crying for people leaving when that's part of the game? Why do they get mad for people lying when that's part of the game!? Why do they take it so personal when that's NOT EVEN part of the game!!?",en,2025-07-26T14:33:28Z,2025-07-26 10:33:28,1,0
daeL3XxrS-c,Million Dollar Secret | Official Trailer | Netflix,UCWOA1ZGywLbqmigxE4Qlvuw,Netflix,2025-02-25T18:00:00Z,339003,3909,673,UgyEAo2LLAiIVzxDtxB4AaABAg,NA,@empressjojo1344,UCLAy-pS-2yhHW7pkLFGQpKw,Am halfway watching and I can't believe Lauren decided that been truthful was gon help her?? Like girl c'mon that makes you a hit for real 😂😂😂😂😂😂😂 that was a dumb move..,en,2025-07-21T12:11:17Z,2025-07-21 08:11:17,1,0
daeL3XxrS-c,Million Dollar Secret | Official Trailer | Netflix,UCWOA1ZGywLbqmigxE4Qlvuw,Netflix,2025-02-25T18:00:00Z,339003,3909,673,Ugy0zxRTR-iwdiN_uJB4AaABAg,NA,@BlueCourtingBooks,UC-Xrg-KIemfGUMlO9NM8Dbg,Does Corey ever get tired of being wrong? That man stays wrong about everything 24/7 😂,en,2025-07-21T03:19:13Z,2025-07-20 23:19:13,18,2
daeL3XxrS-c,Million Dollar Secret | Official Trailer | Netflix,UCWOA1ZGywLbqmigxE4Qlvuw,Netflix,2025-02-25T18:00:00Z,339003,3909,673,UgyXcTBXucLZ-neFlAF4AaABAg,NA,@okeyalright,UCnTgs32KWcd7axoeWXxvbig,"Cara played sooo good, crazy she was born for this show",en,2025-07-19T22:09:08Z,2025-07-19 18:09:08,0,0
daeL3XxrS-c,Million Dollar Secret | Official Trailer | Netflix,UCWOA1ZGywLbqmigxE4Qlvuw,Netflix,2025-02-25T18:00:00Z,339003,3909,673,Ugx0H2nGLWzbgK-Utux4AaABAg,NA,@blakeandkrystallarson8344,UCQBRcfGqg_wjyuvwGCKnVkw,"I was immensely offended when watching with my husband and teenage son and we could see Sydnee’s nipples through her bejeweled dress. This is appalling. This show should definitely be TVMA. She was not the only one dressing inappropriately, although she was the most egregious of the bunch. Yuck!!!!",en,2025-07-17T00:08:27Z,2025-07-16 20:08:27,0,1
daeL3XxrS-c,Million Dollar Secret | Official Trailer | Netflix,UCWOA1ZGywLbqmigxE4Qlvuw,Netflix,2025-02-25T18:00:00Z,339003,3909,673,Ugy5JWDWZVC8hOhuVEV4AaABAg,NA,@magalideflorian4266,UC4C0yf9mWpWl5bHRSJ72ALQ,Cuando se fue Louren pensé en ya no ver la serie,es,2025-07-09T21:57:48Z,2025-07-09 17:57:48,0,0
daeL3XxrS-c,Million Dollar Secret | Official Trailer | Netflix,UCWOA1ZGywLbqmigxE4Qlvuw,Netflix,2025-02-25T18:00:00Z,339003,3909,673,UgxfEQ-gZSlG42jVih54AaABAg,NA,@revz27,UCgA4Yy04n7_5no3dS2_-SFQ,They must put a wild cart visitor as new twist in next season,en,2025-07-04T14:22:28Z,2025-07-04 10:22:28,0,0
daeL3XxrS-c,Million Dollar Secret | Official Trailer | Netflix,UCWOA1ZGywLbqmigxE4Qlvuw,Netflix,2025-02-25T18:00:00Z,339003,3909,673,Ugz2xa1ATj1BMmV7ZlF4AaABAg,NA,@revz27,UCgA4Yy04n7_5no3dS2_-SFQ,Lydia thought Sam was her ally but Sam used her killer shot to evict her,en,2025-07-04T14:20:21Z,2025-07-04 10:20:21,1,0
daeL3XxrS-c,Million Dollar Secret | Official Trailer | Netflix,UCWOA1ZGywLbqmigxE4Qlvuw,Netflix,2025-02-25T18:00:00Z,339003,3909,673,Ugwf_NrqPf14FfG5xI54AaABAg,NA,@atbass41,UC18lVYm0apjrcdMQVvgVVTA,So staged  was so obvious when they set the boxes on the table which one is the heavy one with the money and which are empty.  The producers around episode 3 realized they had no idea what they were doing and their show was a complete flop. They screw over the contestants which will probably get them lawsuits if it was not all staged.,en,2025-07-03T01:39:32Z,2025-07-02 21:39:32,1,0
daeL3XxrS-c,Million Dollar Secret | Official Trailer | Netflix,UCWOA1ZGywLbqmigxE4Qlvuw,Netflix,2025-02-25T18:00:00Z,339003,3909,673,UgxZKIAKyD7yrBK4QiB4AaABAg,NA,@JCIMUDIGERE,UCaewRLWk5nU4-A0k2zPLQCg,"why did no one doubt cara at all. if i were there, i would be like i am having a beef with someone, so why is the other one innocent",en,2025-07-01T00:05:23Z,2025-06-30 20:05:23,0,0
daeL3XxrS-c,Million Dollar Secret | Official Trailer | Netflix,UCWOA1ZGywLbqmigxE4Qlvuw,Netflix,2025-02-25T18:00:00Z,339003,3909,673,UgyKRMMLTJujwja5UmV4AaABAg,NA,@fabiolamadonna5277,UCoBBp7CPfi5uukrRhu940qA,"O LORDE ANGLO-CANADENSE DIZ 😂😂😂😂😂 “NO QUARTO DE CADA UM DE VOCÊS TEM MAIS DE MIL SUPOSITÓRIOS E NA OUTRA CAIXA MAIS 7000 MIL SUPOSITÓRIOS,QUEM CONSEGUIR DERRETER MAIS SUPOSITÓRIOS NO CU, VENCE😂😂😂😂😂😂😂😂😂😂😂😂😃😆😆😆😵🤡☠️🤡🚇😀😄😄😂😆😁🤣🤣😵‍💫😵‍💫😵‍💫😵‍💫😵‍💫 E GANHA 1 MILHÃO DE SUPOSITÓRIOS”🍌🍌🍌🍌🍌🍌🍌🍌🌽🌽🌽🌽🌽🌽🍆🍆🍆🍆🍆🍆🍆🍆🍆🍆🍆…😂😂😂😂😂😂",pt,2025-06-29T10:17:47Z,2025-06-29 06:17:47,1,0
daeL3XxrS-c,Million Dollar Secret | Official Trailer | Netflix,UCWOA1ZGywLbqmigxE4Qlvuw,Netflix,2025-02-25T18:00:00Z,339003,3909,673,UgxwxllX1uQ1EbrPc2F4AaABAg,NA,@courtmoney1283,UCnnN-RFvjCTaUOhQ0prVglQ,When the next season coming out.. it was a good lil show I was on the job site telling my crew about it. Really good cast too,en,2025-06-28T00:08:57Z,2025-06-27 20:08:57,0,0
daeL3XxrS-c,Million Dollar Secret | Official Trailer | Netflix,UCWOA1ZGywLbqmigxE4Qlvuw,Netflix,2025-02-25T18:00:00Z,339003,3909,673,Ugx-jH_tpn6hKW_YNQd4AaABAg,NA,@NadzirahZaidi-g7q,UCwgt-va0UMimbtId5LTr2LA,"I have one friend like the winner. The character is, she is well playey in chess game. She always predict what people will think and will try to create conditions to make people think in specofic way. Calm…and strategic people.. dangeroussss",en,2025-06-25T06:39:17Z,2025-06-25 02:39:17,0,0
daeL3XxrS-c,Million Dollar Secret | Official Trailer | Netflix,UCWOA1ZGywLbqmigxE4Qlvuw,Netflix,2025-02-25T18:00:00Z,339003,3909,673,Ugx4qSvzSrnWK3UBO_14AaABAg,NA,@funtoknow007,UCgzIC_kNeF___Lb7BgA5WwQ,I was addicted.  Sitting at work ready to come home to watch.,en,2025-06-24T04:49:07Z,2025-06-24 00:49:07,9,0
daeL3XxrS-c,Million Dollar Secret | Official Trailer | Netflix,UCWOA1ZGywLbqmigxE4Qlvuw,Netflix,2025-02-25T18:00:00Z,339003,3909,673,UgybnTcBG60cksOBTO14AaABAg,NA,@excommunicado7507,UCIxx9mlymTTyFi6o8qF0z-g,Ngl I was rooting for Sam the whole time. Her downfall was her trust and friendship with Cara.,en,2025-06-22T12:41:36Z,2025-06-22 08:41:36,1,0
daeL3XxrS-c,Million Dollar Secret | Official Trailer | Netflix,UCWOA1ZGywLbqmigxE4Qlvuw,Netflix,2025-02-25T18:00:00Z,339003,3909,673,Ugx6nfNlnzhlBgWCGol4AaABAg,NA,@ValeriuMinistrianu,UCvzeV946Uq7H6e4Uj9tOijg,"Интересно, сколько еще лет в кинематографе будет обсасываться тема миллиона долларов? Ведь эта сумма, уже совсем не та, что была лет 20 назад... сейчас за миллион и дом хороший почти не купить, а в штатах то и подавно. Пора бы уже менять эти шаблоны...",ru,2025-06-19T21:32:35Z,2025-06-19 17:32:35,0,0
daeL3XxrS-c,Million Dollar Secret | Official Trailer | Netflix,UCWOA1ZGywLbqmigxE4Qlvuw,Netflix,2025-02-25T18:00:00Z,339003,3909,673,UgyOWxViG3n_8Kgz3oZ4AaABAg,NA,@Stiflerx7,UC4kmMtf6XuA9ByWBn7YJnsQ,"Spoiler alert:  
.
.
.
.
.
.
.



Cury who made it to final ,he dersreve the moeny more than everyone there.
  i really felt so bad for him , he so good and so nice that's why he lost in the end .",en,2025-06-18T19:27:44Z,2025-06-18 15:27:44,2,0
daeL3XxrS-c,Million Dollar Secret | Official Trailer | Netflix,UCWOA1ZGywLbqmigxE4Qlvuw,Netflix,2025-02-25T18:00:00Z,339003,3909,673,UgzNfYGUCtjXNDdiIWd4AaABAg,NA,@eduardo-ux1yn,UCLGBp-1yvxdiNFp8PYTFY_Q,Esta muy chido 👌 10/10❤,NA,2025-06-15T19:32:26Z,2025-06-15 15:32:26,0,0
daeL3XxrS-c,Million Dollar Secret | Official Trailer | Netflix,UCWOA1ZGywLbqmigxE4Qlvuw,Netflix,2025-02-25T18:00:00Z,339003,3909,673,UgzO-kDJ47_vL_Oj2u94AaABAg,NA,@theluschmasterinc,UC-kfxCc95pT580ffR6-Us8A,"Oh, so Traitors on Peacock ..",en,2025-06-13T16:08:23Z,2025-06-13 12:08:23,0,0
daeL3XxrS-c,Million Dollar Secret | Official Trailer | Netflix,UCWOA1ZGywLbqmigxE4Qlvuw,Netflix,2025-02-25T18:00:00Z,339003,3909,673,UgxnPtRpOrLW7r8cNfJ4AaABAg,NA,@gracegeorge5438,UCYjbcnD4NPVPmPCXJhPiqnA,"It was so good,, was rushing home after work just to watch it.....",en,2025-06-11T06:24:36Z,2025-06-11 02:24:36,0,0
daeL3XxrS-c,Million Dollar Secret | Official Trailer | Netflix,UCWOA1ZGywLbqmigxE4Qlvuw,Netflix,2025-02-25T18:00:00Z,339003,3909,673,UgyFEM8WJU5c4oc3DOx4AaABAg,NA,@nerminbesic1232,UC473oTpUKbGxDVT_KmsuSPA,Sydney should have won..I was rooting for her...anyone else?,en,2025-06-11T04:08:01Z,2025-06-11 00:08:01,2,0
daeL3XxrS-c,Million Dollar Secret | Official Trailer | Netflix,UCWOA1ZGywLbqmigxE4Qlvuw,Netflix,2025-02-25T18:00:00Z,339003,3909,673,UgwnLXTqSUCfmlCxAqJ4AaABAg,NA,@Markkronn,UCK651KB3PAma-icZpAbr_4w,"Cara is the absolutely worst!!!!!!
Good grief! She should have been booted out loooonnnnggg time ago",en,2025-06-11T00:15:58Z,2025-06-10 20:15:58,0,1
daeL3XxrS-c,Million Dollar Secret | Official Trailer | Netflix,UCWOA1ZGywLbqmigxE4Qlvuw,Netflix,2025-02-25T18:00:00Z,339003,3909,673,UgwvzZMvd4TZFkGJSbN4AaABAg,NA,@georgeaslanidis4789,UCbrYJ54fnX7I5MqJrRFnLGQ,"Well done on Cara winning the money. However I think they could improve the show with some incentives if the millionaire is caught and more challenging games.

I remember watching another money show called The Trust and everytime someone won a challenge they would get a clue. Having a team win and only one person having a clue  kind of sucks. 

Anyway I hope there's a season 2 and improvements are made. It was still entertaining.",en,2025-06-07T19:09:39Z,2025-06-07 15:09:39,0,0
