video_id,video_title,channel_id,channel_title,video_published_at,view_count,video_like_count,video_comment_count,comment_id,comment_parent_id,comment_author_display,comment_author_channel_id,comment_text,comment_lang,comment_published_utc,comment_published_local,comment_like_count,comment_reply_count
daeL3XxrS-c,Million Dollar Secret | Official Trailer | Netflix,UCWOA1ZGywLbqmigxE4Qlvuw,Netflix,2025-02-25T18:00:00Z,339003,3909,673,Ugy4FlCeyAGAOS8cqS94AaABAg,NA,@Kyrelel,UC290uvNCq1xdamAa0zNvzOQ,"It is a rip-off of ""The Fortune Hotel""",en,2025-03-24T00:45:04Z,2025-03-23 20:45:04,0,0
daeL3XxrS-c,Million Dollar Secret | Official Trailer | Netflix,UCWOA1ZGywLbqmigxE4Qlvuw,Netflix,2025-02-25T18:00:00Z,339003,3909,673,UgzWjTeZS7tkd6M2jfB4AaABAg,NA,@samstrider3253,UCOFVIIr6053DXVFqTxwhILg,I really hope the twist is that the host wins the money!,en,2025-03-23T23:48:06Z,2025-03-23 19:48:06,6,0
daeL3XxrS-c,Million Dollar Secret | Official Trailer | Netflix,UCWOA1ZGywLbqmigxE4Qlvuw,Netflix,2025-02-25T18:00:00Z,339003,3909,673,UgyaN2-W9JrAX32qoz54AaABAg,NA,@HAL9000.,UCeWqV3E2lPwRbwd6QzXwHKA,I don;t like shows where they screw each other over. Devil's plan was brilliant. I'll give it a shot though.,en,2025-03-23T20:27:29Z,2025-03-23 16:27:29,3,1
daeL3XxrS-c,Million Dollar Secret | Official Trailer | Netflix,UCWOA1ZGywLbqmigxE4Qlvuw,Netflix,2025-02-25T18:00:00Z,339003,3909,673,Ugxmd_TRUer61vmY39B4AaABAg,NA,@andykroe,UCG2Y-ucQ6PTFg6GDc8KK7_g,"It's sounds interesting, but I just couldn't put up with those whiny American accents.",en,2025-03-23T19:39:35Z,2025-03-23 15:39:35,0,0
daeL3XxrS-c,Million Dollar Secret | Official Trailer | Netflix,UCWOA1ZGywLbqmigxE4Qlvuw,Netflix,2025-02-25T18:00:00Z,339003,3909,673,UgxFXSWbDqDaj5udbEV4AaABAg,NA,@Stella-o1c,UCUCAyGqwUs74X1-uf-p6pDw,I am so excited to see the show I hope I get as addicted as I did with traitors,en,2025-03-20T18:22:04Z,2025-03-20 14:22:04,2,0
daeL3XxrS-c,Million Dollar Secret | Official Trailer | Netflix,UCWOA1ZGywLbqmigxE4Qlvuw,Netflix,2025-02-25T18:00:00Z,339003,3909,673,UgyDSdgYkkxSsuoxf3t4AaABAg,NA,@QwkDrw84,UCjnoqPu7_h8ikgfBxdNDC1Q,PLOT TWIST: All the contestants band together to overthrow the oligarch hosting the competition.,en,2025-03-19T00:13:23Z,2025-03-18 20:13:23,3,0
daeL3XxrS-c,Million Dollar Secret | Official Trailer | Netflix,UCWOA1ZGywLbqmigxE4Qlvuw,Netflix,2025-02-25T18:00:00Z,339003,3909,673,UgxcMc-9g2mPz33ULsx4AaABAg,NA,@matcomedywriter,UCqov825uLf3HSvmsnIaCyOw,This looks great and everything Peter Serafinowicz touches is always hilarious,en,2025-03-18T13:30:49Z,2025-03-18 09:30:49,6,0
daeL3XxrS-c,Million Dollar Secret | Official Trailer | Netflix,UCWOA1ZGywLbqmigxE4Qlvuw,Netflix,2025-02-25T18:00:00Z,339003,3909,673,Ugwjd-XdizzWvpElunF4AaABAg,NA,@BigChiefSithLord,UCc2nPBe8Vo2Ui6NFuvimPMA,Bring back The Mole,NA,2025-03-17T14:30:12Z,2025-03-17 10:30:12,0,0
daeL3XxrS-c,Million Dollar Secret | Official Trailer | Netflix,UCWOA1ZGywLbqmigxE4Qlvuw,Netflix,2025-02-25T18:00:00Z,339003,3909,673,UgxqOi9kZh8Z50Y2T8l4AaABAg,NA,@MRM_dadolly,UCuRK6rhXQgxhGBCtyS2JDiw,It’s giving “the traitors” + “the mole”,NA,2025-03-17T12:14:46Z,2025-03-17 08:14:46,26,0
daeL3XxrS-c,Million Dollar Secret | Official Trailer | Netflix,UCWOA1ZGywLbqmigxE4Qlvuw,Netflix,2025-02-25T18:00:00Z,339003,3909,673,Ugwsm9JuAKX0yf9GHYB4AaABAg,NA,@JakeForty,UCw-TxU9RKDI4t-skWrPcQOw,Now this looks amazing 👏 @netflix,sr,2025-03-17T07:40:27Z,2025-03-17 03:40:27,1,0
daeL3XxrS-c,Million Dollar Secret | Official Trailer | Netflix,UCWOA1ZGywLbqmigxE4Qlvuw,Netflix,2025-02-25T18:00:00Z,339003,3909,673,Ugy_xW2L2WNm8c4ljCZ4AaABAg,NA,@ryandury,UCtTgbkugC_q_4pmrcHkns6Q,I don't get it,en,2025-03-15T15:11:12Z,2025-03-15 11:11:12,0,0
daeL3XxrS-c,Million Dollar Secret | Official Trailer | Netflix,UCWOA1ZGywLbqmigxE4Qlvuw,Netflix,2025-02-25T18:00:00Z,339003,3909,673,UgzEtVRHBpmziiZZ-sF4AaABAg,NA,@slf12,UC52KyDImbTJ17NKv3Os807Q,Ahhhh I can’t believe OUR SHOW IS COMING OUT!! Tune in yall to watch me SPRINT for my life from that malinois,en,2025-03-12T21:19:46Z,2025-03-12 17:19:46,6,1
daeL3XxrS-c,Million Dollar Secret | Official Trailer | Netflix,UCWOA1ZGywLbqmigxE4Qlvuw,Netflix,2025-02-25T18:00:00Z,339003,3909,673,Ugz1q-tJ_BFKNMTGSgZ4AaABAg,NA,@mayapena1018,UCqVV917mGE_5MOZlg_6YIIQ,"Youre a piece of shit netflix, gaining privacy by only allowing owners to watch? What about their fucken kids? What about those in college who cant afford that shit? You are a piece of shit",en,2025-03-11T08:52:46Z,2025-03-11 04:52:46,0,0
daeL3XxrS-c,Million Dollar Secret | Official Trailer | Netflix,UCWOA1ZGywLbqmigxE4Qlvuw,Netflix,2025-02-25T18:00:00Z,339003,3909,673,Ugw-8CGIuGPgEfdaHfJ4AaABAg,NA,@Directorkey718,UC7_fO4EvzMDicjLIVDNj0xA,I worked on this show (in post-production) and it was one of the best show experiences I've had! Excited for it to drop!,en,2025-03-05T23:43:45Z,2025-03-05 18:43:45,69,6
daeL3XxrS-c,Million Dollar Secret | Official Trailer | Netflix,UCWOA1ZGywLbqmigxE4Qlvuw,Netflix,2025-02-25T18:00:00Z,339003,3909,673,UgwXyjgNS8U8zUuuZ-J4AaABAg,NA,@MoniqueAlloo-c7k,UCA76o8-qo5_gYdu5E2aNVRA,"This is basically ""The traitors"" on steroids, i'm here for it... 😂",en,2025-03-05T00:06:22Z,2025-03-04 19:06:22,30,0
daeL3XxrS-c,Million Dollar Secret | Official Trailer | Netflix,UCWOA1ZGywLbqmigxE4Qlvuw,Netflix,2025-02-25T18:00:00Z,339003,3909,673,Ugx6cdHRJRf5SzavnCp4AaABAg,NA,@keithabellanosa-f3l,UCrKWLk2U-MfsoIy_Qhk665A,"wow, so cool for making a modern english irishman type character with modern people, thanks so cool for those who disobey social norms, because for me that is what contributes into slut treatment and shaming and the repetetive ways and problems of the human life, do not be afraid for a new conversation.  try something new, like this show did. like dont be afraid to not go by how society or someone thinks you are, wheter a normie, a slut, or whatsoever, we all have our own views in life, we are not to decide with views upon each's life, it's all in how we choose, well, metaphorcally the graphics of the computer. thinking in irishman, i think all of this is so satirical, because they from the front and start failed to hide the million dollars, all of them are being told to get things for him like ice, in a very rich lifestyle, they need a bank safe. wow, but he is looking at them with a one man, one tree, keeping game, in the fronts, all of them is rich, with him, all you could believe they have a million dollars or more, but like a hidden book, only one keeps what he gave. the truth even if to others what i did was stealing, it was all just a hidden book in a shelf of my mom's work and files. i had just read it, while all my siblings are living lives before me, what is stealing in it? they are all just older while i read a book i found after a scold.",en,2025-03-04T03:47:44Z,2025-03-03 22:47:44,1,1
daeL3XxrS-c,Million Dollar Secret | Official Trailer | Netflix,UCWOA1ZGywLbqmigxE4Qlvuw,Netflix,2025-02-25T18:00:00Z,339003,3909,673,Ugy8V9b9fPyO3o6xHQJ4AaABAg,NA,@KBennett77,UC7O0F52INmY0-xcdaMsIzxg,Garbage TV.,jv,2025-03-04T02:00:45Z,2025-03-03 21:00:45,0,0
daeL3XxrS-c,Million Dollar Secret | Official Trailer | Netflix,UCWOA1ZGywLbqmigxE4Qlvuw,Netflix,2025-02-25T18:00:00Z,339003,3909,673,UgwGlQkAM5aFTx5jRkN4AaABAg,NA,@asserlife,UCCFmCFk3DEyqM-fdQoHyAYg,Less then a week,NA,2025-03-04T00:24:49Z,2025-03-03 19:24:49,1,0
daeL3XxrS-c,Million Dollar Secret | Official Trailer | Netflix,UCWOA1ZGywLbqmigxE4Qlvuw,Netflix,2025-02-25T18:00:00Z,339003,3909,673,Ugyi1k_kM-I7HenzxnR4AaABAg,NA,@LydiaPlayer,UCgJTGjNOGB_RmKubfS7Ogqw,"I'm the poker playing grandma on this show. Can't wait for everyone to see the twists, turns and shockers.",en,2025-03-03T16:03:03Z,2025-03-03 11:03:03,424,56
daeL3XxrS-c,Million Dollar Secret | Official Trailer | Netflix,UCWOA1ZGywLbqmigxE4Qlvuw,Netflix,2025-02-25T18:00:00Z,339003,3909,673,Ugyyl0FBYD7-nVR3Hwh4AaABAg,NA,@AsadKhan-mk9it,UCE7JBmgxKGj6eYOFTmT6kdQ,"Who's lie ?
Every body.!",NA,2025-03-01T12:28:54Z,2025-03-01 07:28:54,1,0
daeL3XxrS-c,Million Dollar Secret | Official Trailer | Netflix,UCWOA1ZGywLbqmigxE4Qlvuw,Netflix,2025-02-25T18:00:00Z,339003,3909,673,UgwXhBN6SgP3RS8vhA94AaABAg,NA,@brittenyhowell2150,UCH44xBTDZyl4wL9oytktAzg,Wow if you look at this show a little deeper it’s really morally messed up almost kind of twisted.,en,2025-02-28T15:44:47Z,2025-02-28 10:44:47,2,0
daeL3XxrS-c,Million Dollar Secret | Official Trailer | Netflix,UCWOA1ZGywLbqmigxE4Qlvuw,Netflix,2025-02-25T18:00:00Z,339003,3909,673,UgwHozqlHCdskh0l3m14AaABAg,NA,@jordanrhysfilms,UCnnnu2Fn9LA3LTK4Ahyw99A,Isnt this almost identical to hotel fortune?,en,2025-02-28T10:10:08Z,2025-02-28 05:10:08,1,0
daeL3XxrS-c,Million Dollar Secret | Official Trailer | Netflix,UCWOA1ZGywLbqmigxE4Qlvuw,Netflix,2025-02-25T18:00:00Z,339003,3909,673,UgzsjnnN83yliPPqMaF4AaABAg,NA,@Muvanature,UCioqpgTMvuZ-Hck71pV4IPA,I thought that was Rudy Gobert... also a knives out type movie til the cast intros. Disappointing 😞,en,2025-02-27T15:21:28Z,2025-02-27 10:21:28,0,0
daeL3XxrS-c,Million Dollar Secret | Official Trailer | Netflix,UCWOA1ZGywLbqmigxE4Qlvuw,Netflix,2025-02-25T18:00:00Z,339003,3909,673,UgwukF8BbVvDJ7AUW2Z4AaABAg,NA,@jordancrowley1530,UCBcpGmGP46a5E7ck_R_dOsQ,"it looks similar to ""the trust"" and the mole if mix",en,2025-02-27T00:08:02Z,2025-02-26 19:08:02,4,0
daeL3XxrS-c,Million Dollar Secret | Official Trailer | Netflix,UCWOA1ZGywLbqmigxE4Qlvuw,Netflix,2025-02-25T18:00:00Z,339003,3909,673,Ugx_2rUIq9KepX3Do9h4AaABAg,NA,@ReykoASMR,UCMEltIS7xy5_d0cJpcjeK4w,"So the opposite of the traitor series, but not celebrities in the giant mansion.",en,2025-02-26T23:21:42Z,2025-02-26 18:21:42,0,0
daeL3XxrS-c,Million Dollar Secret | Official Trailer | Netflix,UCWOA1ZGywLbqmigxE4Qlvuw,Netflix,2025-02-25T18:00:00Z,339003,3909,673,UgwhWzCj7B-74nrDbtN4AaABAg,NA,@chris-_-3073,UCbzkuIQDU1yu3J5jALK7Mqg,👎vote,NA,2025-02-26T22:36:26Z,2025-02-26 17:36:26,1,0
daeL3XxrS-c,Million Dollar Secret | Official Trailer | Netflix,UCWOA1ZGywLbqmigxE4Qlvuw,Netflix,2025-02-25T18:00:00Z,339003,3909,673,UgxRrcyhNSNZitpCVn94AaABAg,NA,@MoorishBrooklyn,UCqNZlKNhx1kF0fq4sG8ZWlQ,There are tons of these shows with similar or more extreme themes. But I like this one for some reason. I will give it a watch.,en,2025-02-26T22:15:24Z,2025-02-26 17:15:24,15,1
daeL3XxrS-c,Million Dollar Secret | Official Trailer | Netflix,UCWOA1ZGywLbqmigxE4Qlvuw,Netflix,2025-02-25T18:00:00Z,339003,3909,673,UgwkATDdUyB2w5NAdpl4AaABAg,NA,@DCoppola,UCBppLoNeN9JqsuOEjwVZ1Kw,Looks awesome! Cannot wait to watch!,en,2025-02-26T21:35:11Z,2025-02-26 16:35:11,2,0
daeL3XxrS-c,Million Dollar Secret | Official Trailer | Netflix,UCWOA1ZGywLbqmigxE4Qlvuw,Netflix,2025-02-25T18:00:00Z,339003,3909,673,UgzPrevvkXPXEclEOxF4AaABAg,NA,@seekingsolace,UCBaLEeruJxmVT53BDa8lryA,Peter Serafinovic is an Icon!,NA,2025-02-26T18:44:45Z,2025-02-26 13:44:45,14,0
daeL3XxrS-c,Million Dollar Secret | Official Trailer | Netflix,UCWOA1ZGywLbqmigxE4Qlvuw,Netflix,2025-02-25T18:00:00Z,339003,3909,673,Ugzqw6tWPQBNSiCmfO54AaABAg,NA,@XeniusChannel,UCHEC3-rlQs4elJtityE38rQ,"Me: I don't like your toxic burger
Banan Alice: 1:05",NA,2025-02-26T16:34:16Z,2025-02-26 11:34:16,0,0
daeL3XxrS-c,Million Dollar Secret | Official Trailer | Netflix,UCWOA1ZGywLbqmigxE4Qlvuw,Netflix,2025-02-25T18:00:00Z,339003,3909,673,UgzJh-jhxb66mVMjwL94AaABAg,NA,@rockstarbenjamin02,UCbl842U2yiVkH1yg54ZYBew,"If you are someone who can't handle reality TV, especially when a game is involved I'm BEGGING you to watch something else. I didn't forget how y'all treated cast members from the trust and squid games......and if you're a traitors fan and you've been bashing Danielle or ever bashed Cirie......this is about you as well keep it pushing PLEASE.",en,2025-02-26T15:54:02Z,2025-02-26 10:54:02,4,0
daeL3XxrS-c,Million Dollar Secret | Official Trailer | Netflix,UCWOA1ZGywLbqmigxE4Qlvuw,Netflix,2025-02-25T18:00:00Z,339003,3909,673,UgxIHZtqcOSbqZryHt14AaABAg,NA,@allergyboy8954,UCnSG1H8_0yjqLItjOzngm1A,A Traitor version of Do You want to be A Millionaire,en,2025-02-26T15:12:48Z,2025-02-26 10:12:48,12,0
daeL3XxrS-c,Million Dollar Secret | Official Trailer | Netflix,UCWOA1ZGywLbqmigxE4Qlvuw,Netflix,2025-02-25T18:00:00Z,339003,3909,673,Ugx33KYiqceiSiNeEkh4AaABAg,NA,@KiranAbbavaram-fg2jb,UCvmS6iUtw-I5cG1GIrNeYqw,Im here for just sydney😂,en,2025-02-26T14:49:36Z,2025-02-26 09:49:36,5,0
daeL3XxrS-c,Million Dollar Secret | Official Trailer | Netflix,UCWOA1ZGywLbqmigxE4Qlvuw,Netflix,2025-02-25T18:00:00Z,339003,3909,673,UgxBG_QJq017wNSrpbJ4AaABAg,NA,@rasiaijauoren,UCu6Vybo1Fe8yKR3AbYM3L6A,"I thought its a movie or drama series…
Its a game…!
Oh naaaayyyyy…",en,2025-02-26T13:16:58Z,2025-02-26 08:16:58,0,0
daeL3XxrS-c,Million Dollar Secret | Official Trailer | Netflix,UCWOA1ZGywLbqmigxE4Qlvuw,Netflix,2025-02-25T18:00:00Z,339003,3909,673,UgzdHDH5GT6FS7jf_ed4AaABAg,NA,@sammysep,UC96YlPOqB3khpBjxvrmL96w,I'm on the show also! SO EXCITED TO SEE IF YOU SOME OF YOU SHARE MY PERSPECTIVE ON WHAT I ENDURED!! LOL WHAT A TRIP! HOPE YOU ALL TUNE IN MARCH 26TH AND WATCH YOUR GIRL SAMANTHA 🥰,en,2025-02-26T11:09:46Z,2025-02-26 06:09:46,79,14
daeL3XxrS-c,Million Dollar Secret | Official Trailer | Netflix,UCWOA1ZGywLbqmigxE4Qlvuw,Netflix,2025-02-25T18:00:00Z,339003,3909,673,UgwRq1G7hZ3Jirwwi7t4AaABAg,NA,@davidbolton5141,UCKVYT1t2-n4TrDnz2AcWkAA,Isn't this a copy of The Fortune Hotel with Stephen Mangan on ITV/ ITVX?,en,2025-02-26T10:21:06Z,2025-02-26 05:21:06,7,2
daeL3XxrS-c,Million Dollar Secret | Official Trailer | Netflix,UCWOA1ZGywLbqmigxE4Qlvuw,Netflix,2025-02-25T18:00:00Z,339003,3909,673,UgwHiiUk8Fe6hQ9PSCl4AaABAg,NA,@yoshimasu_k,UC3Q4zfo2fyQxrwG_yrJ9aDA,Hopefully Mr. Bob Netflick will ask Trixie and Katya to tear this show apart 🤣,NA,2025-02-26T09:25:03Z,2025-02-26 04:25:03,2,0
daeL3XxrS-c,Million Dollar Secret | Official Trailer | Netflix,UCWOA1ZGywLbqmigxE4Qlvuw,Netflix,2025-02-25T18:00:00Z,339003,3909,673,UgzyGFHXLwJqyO8Ig714AaABAg,NA,@SunnyLao-o9t,UCpPFkQPFq0QpI7ludywN4LQ,❤,ja,2025-02-26T07:11:41Z,2025-02-26 02:11:41,1,0
daeL3XxrS-c,Million Dollar Secret | Official Trailer | Netflix,UCWOA1ZGywLbqmigxE4Qlvuw,Netflix,2025-02-25T18:00:00Z,339003,3909,673,UgzlHnmutKGobNK00Fp4AaABAg,NA,@nicholasali2182,UCMqWtM8nrYZqwz77J6TzICA,SHOWING THE WORST IN PEOPLE IS EXACTLY WHY PEOPLE TUNE IN. CRAZY WORLD WE LIVE IN.,en,2025-02-26T06:16:50Z,2025-02-26 01:16:50,3,2
daeL3XxrS-c,Million Dollar Secret | Official Trailer | Netflix,UCWOA1ZGywLbqmigxE4Qlvuw,Netflix,2025-02-25T18:00:00Z,339003,3909,673,UgzjSP3--zCu2bHIQ5R4AaABAg,NA,@Danish-e4w,UCfI7XiTVH9a79wKarXBHa5Q,Useless,NA,2025-02-26T04:45:40Z,2025-02-25 23:45:40,0,0
daeL3XxrS-c,Million Dollar Secret | Official Trailer | Netflix,UCWOA1ZGywLbqmigxE4Qlvuw,Netflix,2025-02-25T18:00:00Z,339003,3909,673,UgzXSzYPguoVJo1QUb94AaABAg,NA,@michaeltorio3459,UCfJAkYJW1QYz08py4zodW8g,Hahahahahahahaha cops just waiting you,mi,2025-02-26T04:29:47Z,2025-02-25 23:29:47,1,0
daeL3XxrS-c,Million Dollar Secret | Official Trailer | Netflix,UCWOA1ZGywLbqmigxE4Qlvuw,Netflix,2025-02-25T18:00:00Z,339003,3909,673,UgwLn05UvRKUxxBpIr14AaABAg,NA,@michaeltorio3459,UCfJAkYJW1QYz08py4zodW8g,Oh my god the series the gift that keeps me in the clubhouse,en,2025-02-26T04:29:19Z,2025-02-25 23:29:19,1,0
daeL3XxrS-c,Million Dollar Secret | Official Trailer | Netflix,UCWOA1ZGywLbqmigxE4Qlvuw,Netflix,2025-02-25T18:00:00Z,339003,3909,673,UgxnaoU8ZkbPJounQRN4AaABAg,NA,@sophiedophie,UCFxnZ0peedZUQaSSExovK8g,This is also like claim to fame,en,2025-02-26T03:28:01Z,2025-02-25 22:28:01,0,0
daeL3XxrS-c,Million Dollar Secret | Official Trailer | Netflix,UCWOA1ZGywLbqmigxE4Qlvuw,Netflix,2025-02-25T18:00:00Z,339003,3909,673,Ugzrbxk6iyQyUzSlQIl4AaABAg,NA,@rosellaweigand,UCXLEXbzKuQB7puA9NXu7OPA,Peter Serafinowicz makes it interesting & worth watching.,ny,2025-02-26T02:42:07Z,2025-02-25 21:42:07,8,0
daeL3XxrS-c,Million Dollar Secret | Official Trailer | Netflix,UCWOA1ZGywLbqmigxE4Qlvuw,Netflix,2025-02-25T18:00:00Z,339003,3909,673,UgyRzePTjt4zTuhke7J4AaABAg,NA,@michelebasso3671,UCjLMNIwxlhvydvQLt4r-j8Q,Can’t wait!!!,NA,2025-02-26T00:29:16Z,2025-02-25 19:29:16,3,0
daeL3XxrS-c,Million Dollar Secret | Official Trailer | Netflix,UCWOA1ZGywLbqmigxE4Qlvuw,Netflix,2025-02-25T18:00:00Z,339003,3909,673,Ugw-FCj46LlTbzK30Eh4AaABAg,NA,@alessandrolanzillo3711,UCPLcIuDfB-enhQUhcx7TiKA,CORRADO ESPOSITO E ' IL UOMO DELLE VERE RINASCITE DEL TUTTO IL MONDO DEL 202O E DEL 2O21 E DEL 2O22 E DEL 2O23 E DEL 2O24 E ANNI FUTURI ❤CORRADO ESPOSITO E ROSE ' SI SONO UFFICIALMENTE DAVVERO FINDIZIATI ❤CORRADO ESPOSITO E ROSE 'FOREVER ❤,it,2025-02-26T00:25:45Z,2025-02-25 19:25:45,0,0
daeL3XxrS-c,Million Dollar Secret | Official Trailer | Netflix,UCWOA1ZGywLbqmigxE4Qlvuw,Netflix,2025-02-25T18:00:00Z,339003,3909,673,UgwAsE_TRgyrYb-XeeZ4AaABAg,NA,@Unica8u7,UCr5vmteGYyIHi6I1XUIFEwQ,Que hueva pa programas mejor en L vida real ja!,NA,2025-02-25T23:55:09Z,2025-02-25 18:55:09,1,0
daeL3XxrS-c,Million Dollar Secret | Official Trailer | Netflix,UCWOA1ZGywLbqmigxE4Qlvuw,Netflix,2025-02-25T18:00:00Z,339003,3909,673,UgzQHt6C24iERXdqvsl4AaABAg,NA,@MargorieGupta,UC9_wqwKRF2Vz258NnhVSuqQ,Just put down $30k on XAI70K. This is the one boys,en,2025-02-25T23:51:59Z,2025-02-25 18:51:59,0,0
daeL3XxrS-c,Million Dollar Secret | Official Trailer | Netflix,UCWOA1ZGywLbqmigxE4Qlvuw,Netflix,2025-02-25T18:00:00Z,339003,3909,673,UgxJu9MDzIAZA-CtbNR4AaABAg,NA,@BeatrisPacheco-o3d,UCISTWT6UGgX1kvslQ8jdWuQ,Appreciate the insight on XAI70K it's going to 10x by next week! 🚀,en,2025-02-25T23:50:57Z,2025-02-25 18:50:57,0,0
daeL3XxrS-c,Million Dollar Secret | Official Trailer | Netflix,UCWOA1ZGywLbqmigxE4Qlvuw,Netflix,2025-02-25T18:00:00Z,339003,3909,673,UgxLPR9KM60Hq34eLz94AaABAg,NA,@MustafaCetin-o4i,UC5TxGwTDF44jKGdElY1BUWQ,Remember this comment ‼️ ‼️ because XAI70K is the best investment of 2025🎉🎉,en,2025-02-25T23:50:51Z,2025-02-25 18:50:51,0,0
daeL3XxrS-c,Million Dollar Secret | Official Trailer | Netflix,UCWOA1ZGywLbqmigxE4Qlvuw,Netflix,2025-02-25T18:00:00Z,339003,3909,673,UgzqaF2aGiIfRQl2dN14AaABAg,NA,@m.rogers9155,UCjADDLhOi--gyd6RWegWVzg,Can’t wait!!!,NA,2025-02-25T23:07:48Z,2025-02-25 18:07:48,3,0
daeL3XxrS-c,Million Dollar Secret | Official Trailer | Netflix,UCWOA1ZGywLbqmigxE4Qlvuw,Netflix,2025-02-25T18:00:00Z,339003,3909,673,UgyteM7ePI73USYTBaZ4AaABAg,NA,@KrishLobo007,UCDePIjwFpmgz29Opeo9TBAw,This Series is going to be a great competitor for other aeries👽,en,2025-02-25T21:47:46Z,2025-02-25 16:47:46,7,0
daeL3XxrS-c,Million Dollar Secret | Official Trailer | Netflix,UCWOA1ZGywLbqmigxE4Qlvuw,Netflix,2025-02-25T18:00:00Z,339003,3909,673,Ugw2cgVQJuuk3FmdWW14AaABAg,NA,@chibha96,UCj2FDo4tcmXunfHu1AJvb3Q,I need to watch this show.,en,2025-02-25T21:45:45Z,2025-02-25 16:45:45,12,0
daeL3XxrS-c,Million Dollar Secret | Official Trailer | Netflix,UCWOA1ZGywLbqmigxE4Qlvuw,Netflix,2025-02-25T18:00:00Z,339003,3909,673,UgyjCYJ5DGsq0we115R4AaABAg,NA,@Fireefreeezeee,UCpCoHJsXp6JXhgaTK2CqLPA,Finally netflix is cooking for once,en,2025-02-25T21:40:55Z,2025-02-25 16:40:55,8,0
daeL3XxrS-c,Million Dollar Secret | Official Trailer | Netflix,UCWOA1ZGywLbqmigxE4Qlvuw,Netflix,2025-02-25T18:00:00Z,339003,3909,673,UgwRBW29yIQjEtStVPJ4AaABAg,NA,@mwx5314,UCWQ0Mq0EOfNMjAst5Ip1Fig,"EVERYONE IS LYING - thats the only COMMON SENSE, but it aint so common nowadays, so..",en,2025-02-25T21:28:02Z,2025-02-25 16:28:02,4,0
daeL3XxrS-c,Million Dollar Secret | Official Trailer | Netflix,UCWOA1ZGywLbqmigxE4Qlvuw,Netflix,2025-02-25T18:00:00Z,339003,3909,673,Ugxq8sOHsAD1NsQ6wZp4AaABAg,NA,@marcnadeau4540,UCf_ZYg5nJU7YvZF8fDYG4Gg,"I got to work on this show, such a blast, amazingly done!",en,2025-02-25T21:17:53Z,2025-02-25 16:17:53,22,3
daeL3XxrS-c,Million Dollar Secret | Official Trailer | Netflix,UCWOA1ZGywLbqmigxE4Qlvuw,Netflix,2025-02-25T18:00:00Z,339003,3909,673,Ugz0urldH8Y9YyirDmV4AaABAg,NA,@Jmittle101,UCMgeNrLyF07V7o9EWq_vG2Q,"Another moron show, yawn.",en,2025-02-25T21:11:29Z,2025-02-25 16:11:29,0,0
daeL3XxrS-c,Million Dollar Secret | Official Trailer | Netflix,UCWOA1ZGywLbqmigxE4Qlvuw,Netflix,2025-02-25T18:00:00Z,339003,3909,673,Ugxviu8d4eDjMfmG2D14AaABAg,NA,@silromen42,UCj9upFcqBk32xZZgR8ChaBA,"This sounds like a fun concept, but the trailer makes it look like it’s not a fun time :-/",en,2025-02-25T20:51:46Z,2025-02-25 15:51:46,1,2
daeL3XxrS-c,Million Dollar Secret | Official Trailer | Netflix,UCWOA1ZGywLbqmigxE4Qlvuw,Netflix,2025-02-25T18:00:00Z,339003,3909,673,Ugw8H9eTds1ZuhqRW0F4AaABAg,NA,@BrianElfrink-y3e,UCKVtCfzqwpvMaPqBhOdXcEQ,"I've called the number,  but it's blocked !!! 2:06",en,2025-02-25T20:25:00Z,2025-02-25 15:25:00,0,0
daeL3XxrS-c,Million Dollar Secret | Official Trailer | Netflix,UCWOA1ZGywLbqmigxE4Qlvuw,Netflix,2025-02-25T18:00:00Z,339003,3909,673,UgwwM9z62gPyI9QSaNd4AaABAg,NA,@alamaiii,UCB3fOhuVVVVhCAnR_BBZgew,"NETFLIX, STOP wasting my subscription money on this CRAP!!!",en,2025-02-25T20:21:13Z,2025-02-25 15:21:13,0,0
daeL3XxrS-c,Million Dollar Secret | Official Trailer | Netflix,UCWOA1ZGywLbqmigxE4Qlvuw,Netflix,2025-02-25T18:00:00Z,339003,3909,673,Ugy_ixH_BZ9BUPBI7wh4AaABAg,NA,@alekiny,UCf67F_ACPU3lJk9IWo50Knw,why people like so much to watch other people beeing tourtured????,en,2025-02-25T20:07:27Z,2025-02-25 15:07:27,3,1
daeL3XxrS-c,Million Dollar Secret | Official Trailer | Netflix,UCWOA1ZGywLbqmigxE4Qlvuw,Netflix,2025-02-25T18:00:00Z,339003,3909,673,UgxG9zQPJgwTd80zpwB4AaABAg,NA,@janeg8274,UCQkiDoqcCCO9OH-FRVpt0yw,I WILL watch this but not a garden show that IMO was basically high jacked from a beloved actress!!!!!❤,en,2025-02-25T20:06:45Z,2025-02-25 15:06:45,0,0
daeL3XxrS-c,Million Dollar Secret | Official Trailer | Netflix,UCWOA1ZGywLbqmigxE4Qlvuw,Netflix,2025-02-25T18:00:00Z,339003,3909,673,Ugxqo1oy2wLUGG7_qI54AaABAg,NA,@JackieAlise,UCr9SLbWePJh12j7VzmOvPWg,That’s my best friend Sammy Sep! 🙌🏼🙌🏼🙌🏼🙌🏼🙌🏼🙌🏼🙌🏼🙌🏼🙌🏼🙌🏼🙌🏼,de,2025-02-25T19:56:54Z,2025-02-25 14:56:54,4,0
daeL3XxrS-c,Million Dollar Secret | Official Trailer | Netflix,UCWOA1ZGywLbqmigxE4Qlvuw,Netflix,2025-02-25T18:00:00Z,339003,3909,673,UgyBblhzhdxCvaZl5Mt4AaABAg,NA,@TheJackHigg,UCGFNOd0o38T8TrEFHMsaFtQ,So excited to watch! ❤,en,2025-02-25T19:54:19Z,2025-02-25 14:54:19,2,0
daeL3XxrS-c,Million Dollar Secret | Official Trailer | Netflix,UCWOA1ZGywLbqmigxE4Qlvuw,Netflix,2025-02-25T18:00:00Z,339003,3909,673,Ugx6c5IeGE6FRb3AGm94AaABAg,NA,@astralyeti,UCx322hDKaIdNh7AufGpNtDg,more contestants for the next season of perfect match,en,2025-02-25T19:51:16Z,2025-02-25 14:51:16,2,0
daeL3XxrS-c,Million Dollar Secret | Official Trailer | Netflix,UCWOA1ZGywLbqmigxE4Qlvuw,Netflix,2025-02-25T18:00:00Z,339003,3909,673,UgwT8pUUtue3l-Rqpfl4AaABAg,NA,@WalidsTube,UC5DJ2bQ0u1i9pGUbB70qsFw,"So this is The Mole, but where it's not in everyone else's interest to make the others think that you're the mole.",en,2025-02-25T19:43:08Z,2025-02-25 14:43:08,0,1
daeL3XxrS-c,Million Dollar Secret | Official Trailer | Netflix,UCWOA1ZGywLbqmigxE4Qlvuw,Netflix,2025-02-25T18:00:00Z,339003,3909,673,UgwSAEjz9tUkqcdagZl4AaABAg,NA,@mahmoudnawarr,UCpS1CfQA1ycp8D4m-3ee2Aw,I like this kind of compitition shows,en,2025-02-25T19:22:13Z,2025-02-25 14:22:13,4,0
daeL3XxrS-c,Million Dollar Secret | Official Trailer | Netflix,UCWOA1ZGywLbqmigxE4Qlvuw,Netflix,2025-02-25T18:00:00Z,339003,3909,673,Ugy8KY6V57UmozkmEI94AaABAg,NA,@psg1899,UCVrLFnjqYCSEDB9wxaUIIqA,Every time someone likes this comment l check it again,en,2025-02-25T19:19:38Z,2025-02-25 14:19:38,4,0
daeL3XxrS-c,Million Dollar Secret | Official Trailer | Netflix,UCWOA1ZGywLbqmigxE4Qlvuw,Netflix,2025-02-25T18:00:00Z,339003,3909,673,UgynW9J1zsTOBsHHHRh4AaABAg,NA,@gelokitty8179,UCOLgREUXpo1q2jn4WocxkTQ,Peter Serafinowicz will carry this show!!! watchlist,en,2025-02-25T19:19:26Z,2025-02-25 14:19:26,54,0
daeL3XxrS-c,Million Dollar Secret | Official Trailer | Netflix,UCWOA1ZGywLbqmigxE4Qlvuw,Netflix,2025-02-25T18:00:00Z,339003,3909,673,UgwBc5zbmwcH6mJZnlN4AaABAg,NA,@comingverysoon,UCg3wrl961YsliX9oRc7e5tw,Why would anyone with brain cells want to watch this?,en,2025-02-25T19:16:41Z,2025-02-25 14:16:41,0,0
daeL3XxrS-c,Million Dollar Secret | Official Trailer | Netflix,UCWOA1ZGywLbqmigxE4Qlvuw,Netflix,2025-02-25T18:00:00Z,339003,3909,673,UgwWiCCqUGvo4gKvfZN4AaABAg,NA,@FLOODOFSINS,UC4Zxj8oEP0shaqSB9_uA0Qg,BORING!  Try again,NA,2025-02-25T19:16:11Z,2025-02-25 14:16:11,0,0
daeL3XxrS-c,Million Dollar Secret | Official Trailer | Netflix,UCWOA1ZGywLbqmigxE4Qlvuw,Netflix,2025-02-25T18:00:00Z,339003,3909,673,Ugz4Ih4TsekS3NvY2OZ4AaABAg,NA,@nealwilliamsilvano,UCECbaOYOWzct-BDFYkE09ww,Million dollar this biggest mansion 💲💸,NA,2025-02-25T19:06:00Z,2025-02-25 14:06:00,3,0
daeL3XxrS-c,Million Dollar Secret | Official Trailer | Netflix,UCWOA1ZGywLbqmigxE4Qlvuw,Netflix,2025-02-25T18:00:00Z,339003,3909,673,Ugw7RPaseZ4xIsjqsAp4AaABAg,NA,@eight0088,UCiQg194g8dinCUQWxHyWuHw,the mole season 3 as well please,st,2025-02-25T19:03:23Z,2025-02-25 14:03:23,0,0
daeL3XxrS-c,Million Dollar Secret | Official Trailer | Netflix,UCWOA1ZGywLbqmigxE4Qlvuw,Netflix,2025-02-25T18:00:00Z,339003,3909,673,Ugymwt9uiijf4nPQcWp4AaABAg,NA,@bklynrules,UCHD-aiUB9HSB0zodiQNqJoA,"So tired of these reality competition shows, BORING",en,2025-02-25T19:00:07Z,2025-02-25 14:00:07,0,0
daeL3XxrS-c,Million Dollar Secret | Official Trailer | Netflix,UCWOA1ZGywLbqmigxE4Qlvuw,Netflix,2025-02-25T18:00:00Z,339003,3909,673,UgxwZOtCyVV78nlfnF94AaABAg,NA,@Sammusic773,UCzy4_b9h4OqKHsaxE13oPbw,"I am excited to watch in Hindi 🎉
Bye bye Mr. Beast!  🔥 😎",en,2025-02-25T18:55:52Z,2025-02-25 13:55:52,1,0
daeL3XxrS-c,Million Dollar Secret | Official Trailer | Netflix,UCWOA1ZGywLbqmigxE4Qlvuw,Netflix,2025-02-25T18:00:00Z,339003,3909,673,UgzPJwqOMm6yk9-LN9Z4AaABAg,NA,@joelm91,UCPNJFcxaS13_mVz38UZQ80A,When your cousin appears on this show and you didn't know!!! 🤣🤣🤣,en,2025-02-25T18:54:34Z,2025-02-25 13:54:34,9,0
