video_id,video_url,comment_id,comment_author_display,comment_author_channel_id,comment_content,comment_lang,comment_time_utc,comment_time_local,comment_like_count,comment_reply_count,reply_id,reply_author_display,reply_author_channel_id,reply_content,reply_lang,reply_time_utc,reply_time_local,reply_like_count,view_count,like_count,comment_count,crawl_time
Er18gmgqy2k,https://www.youtube.com/watch?v=Er18gmgqy2k,UgwOHN0qtmUulvWg3sB4AaABAg,@MarinTheFirestarter,UClbDQtMGmE6W9VDst5aed0A,Woke propaganda. Disgusting show and gay trans scenes. Avoid.,NA,2025-10-14T22:24:38Z,2025-10-14 18:24:38,0,1,UgwOHN0qtmUulvWg3sB4AaABAg.AOH6WpqDGSqAP6eWRSpsur,@JoshuaR9763,UC7IiCy5ki5tbwrjUMw7vC7g,Copy and pasting hate over all the trailers…. Get a life man,en,2025-11-04T17:30:10Z,2025-11-04 12:30:10,0,2131931,47062,3066,"Tue, 16 Dec 2025 03:06:49 GMT"
Er18gmgqy2k,https://www.youtube.com/watch?v=Er18gmgqy2k,Ugz650tOrKhRcihYxjF4AaABAg,@Azra140,UCJhsri7PKOTvdhIxSiieTQA,Please bring season 3,NA,2025-08-17T13:13:43Z,2025-08-17 09:13:43,0,1,Ugz650tOrKhRcihYxjF4AaABAg.ALvmMz63GchALye93xhYXx,@GreatStation,UCtQ1IudNoUDitNgUeQJFT4g,They won't do it,NA,2025-08-18T15:59:38Z,2025-08-18 11:59:38,0,2131931,47062,3066,"Tue, 16 Dec 2025 03:06:49 GMT"
Er18gmgqy2k,https://www.youtube.com/watch?v=Er18gmgqy2k,UgxbhJrUmVt7CdU3U3t4AaABAg,@joeypooy9441,UCBbFVAy423a4AKBffnRaa3g,Am i the only 1 a lil disappointed?,en,2025-08-12T09:43:39Z,2025-08-12 05:43:39,3,1,UgxbhJrUmVt7CdU3U3t4AaABAg.ALiXM0w5AaTALyeFt7KNi2,@GreatStation,UCtQ1IudNoUDitNgUeQJFT4g,Nope sir,af,2025-08-18T16:00:34Z,2025-08-18 12:00:34,1,2131931,47062,3066,"Tue, 16 Dec 2025 03:06:49 GMT"
Er18gmgqy2k,https://www.youtube.com/watch?v=Er18gmgqy2k,UgwP3OSRf7jBw3WRjgN4AaABAg,@vinitvsankhe,UC3o5f97Qv8K02nspTvC4Zvw,"Even though Sandman is based of a very clear Christian and European mythos, it's interesting to note that in Vishnu Purana in Hindu Mythology life is termed as 
 
""Vishnu's Dream"" -- Vishnu is the Preserver.

So when he changes his sleeping positions the universe get destroyed and a new one gets created. 

And all of the existence there is, death, desperation, destruction, Derilium, desire, Angels and Demons, Monsters and Warriors, Good and Evil

Just tied to one feeble Dream of Vishnu. We all (our eternally rebirthing souls) are waiting for Vishnu to just turn in his sleep. 

No wonder Dream is so powerful. And yet dutiful. He knows the fabric of illusion he is part of ---- called human life.",en,2025-07-31T14:24:44Z,2025-07-31 10:24:44,1,1,UgwP3OSRf7jBw3WRjgN4AaABAg.ALF7zFDF_hjALKMSG4FEqv,@MrMakingwavesmedia,UCfQn0aidypam_r1vJrXzyTg,not sure Christian ethos has anything to do with being gay because besided celebrating gayness there is absolute zero substance to the show. It's aboout being gay and making the moronic observation that sex and love is somehow the same thing. It's pathetic writing by a very clearly pathetic human being,en,2025-08-02T15:07:22Z,2025-08-02 11:07:22,0,2131931,47062,3066,"Tue, 16 Dec 2025 03:06:49 GMT"
Er18gmgqy2k,https://www.youtube.com/watch?v=Er18gmgqy2k,UgxJiGWSsPQEjAUl__x4AaABAg,@Jose-v7y1f,UCL9_N0jPz3LuqPGo7vYU-8Q,"are the writers such big fagg lovers not a single character can be straight?! 

disgusting fagg show",en,2025-07-28T11:05:29Z,2025-07-28 07:05:29,4,1,UgxJiGWSsPQEjAUl__x4AaABAg.AL72nFS28R8ALOnrV3f0n3,@ViviMary-elle,UCiHiZuBQ_5cJv8Us3TcegQQ,you are disgusting :D,en,2025-08-04T08:32:35Z,2025-08-04 04:32:35,0,2131931,47062,3066,"Tue, 16 Dec 2025 03:06:49 GMT"
Er18gmgqy2k,https://www.youtube.com/watch?v=Er18gmgqy2k,Ugzt2LHu7r0dpNcqA5R4AaABAg,@S0Social,UC6q4PAaBobnSoJ1n-L2Kvfg,Lost me in the first 10 minutes when they forced a tranny c0ck on my screen.,en,2025-07-27T15:40:32Z,2025-07-27 11:40:32,2,5,Ugzt2LHu7r0dpNcqA5R4AaABAg.AL4yTwWvum2AL6HNVpzQS3,@WearySojouner,UCvcN0Gqnf0v2B8A5skkfqSA,Bahaha! It was Shakespearean so it wasn't meant for everyone. But that was funny what you composed.,en,2025-07-28T03:53:39Z,2025-07-27 23:53:39,1,2131931,47062,3066,"Tue, 16 Dec 2025 03:06:49 GMT"
Er18gmgqy2k,https://www.youtube.com/watch?v=Er18gmgqy2k,Ugzt2LHu7r0dpNcqA5R4AaABAg,@S0Social,UC6q4PAaBobnSoJ1n-L2Kvfg,Lost me in the first 10 minutes when they forced a tranny c0ck on my screen.,en,2025-07-27T15:40:32Z,2025-07-27 11:40:32,2,5,Ugzt2LHu7r0dpNcqA5R4AaABAg.AL4yTwWvum2ALHv7l-aBgP,@STELLADIMITRIADOU,UCmpH46MJdQ_cTILFrmZNrCw,DON'T REMIND ME. WOMAN UNDERWEAR AND THAT,en,2025-08-01T16:21:25Z,2025-08-01 12:21:25,3,2131931,47062,3066,"Tue, 16 Dec 2025 03:06:49 GMT"
Er18gmgqy2k,https://www.youtube.com/watch?v=Er18gmgqy2k,Ugzt2LHu7r0dpNcqA5R4AaABAg,@S0Social,UC6q4PAaBobnSoJ1n-L2Kvfg,Lost me in the first 10 minutes when they forced a tranny c0ck on my screen.,en,2025-07-27T15:40:32Z,2025-07-27 11:40:32,2,5,Ugzt2LHu7r0dpNcqA5R4AaABAg.AL4yTwWvum2ALIrviuWDuu,@WearySojouner,UCvcN0Gqnf0v2B8A5skkfqSA,"​@STELLADIMITRIADOU
Unless we are without sin we should never cast any stone. God bless. Help those lost. Don't condemn. But liberate those in sin from sin. Do so by showing them the path to Jesus.",en,2025-08-02T01:12:40Z,2025-08-01 21:12:40,1,2131931,47062,3066,"Tue, 16 Dec 2025 03:06:49 GMT"
Er18gmgqy2k,https://www.youtube.com/watch?v=Er18gmgqy2k,Ugzt2LHu7r0dpNcqA5R4AaABAg,@S0Social,UC6q4PAaBobnSoJ1n-L2Kvfg,Lost me in the first 10 minutes when they forced a tranny c0ck on my screen.,en,2025-07-27T15:40:32Z,2025-07-27 11:40:32,2,5,Ugzt2LHu7r0dpNcqA5R4AaABAg.AL4yTwWvum2ALKDh0fSyjV,@STELLADIMITRIADOU,UCmpH46MJdQ_cTILFrmZNrCw,"​@WearySojouner
I DO NOT THROW STONES. I CAN'T HELP THEM. I DON'T WANT THEM ON MY SCREEN ALL THE TIME.",en,2025-08-02T13:50:53Z,2025-08-02 09:50:53,2,2131931,47062,3066,"Tue, 16 Dec 2025 03:06:49 GMT"
Er18gmgqy2k,https://www.youtube.com/watch?v=Er18gmgqy2k,Ugzt2LHu7r0dpNcqA5R4AaABAg,@S0Social,UC6q4PAaBobnSoJ1n-L2Kvfg,Lost me in the first 10 minutes when they forced a tranny c0ck on my screen.,en,2025-07-27T15:40:32Z,2025-07-27 11:40:32,2,5,Ugzt2LHu7r0dpNcqA5R4AaABAg.AL4yTwWvum2ALLqwH3zuz5,@WearySojouner,UCvcN0Gqnf0v2B8A5skkfqSA,"​@STELLADIMITRIADOU
Who do you think owns and operates this world? You say that you don't want them on your screen all the time but you're watching using technology that was intended to make you see and hear ungodly things. This technology wasn't created to make you happy. It was created to corrupt you.",en,2025-08-03T05:01:43Z,2025-08-03 01:01:43,1,2131931,47062,3066,"Tue, 16 Dec 2025 03:06:49 GMT"
Er18gmgqy2k,https://www.youtube.com/watch?v=Er18gmgqy2k,UgxvS0gt8vIBOVOImUR4AaABAg,@moonknight8693,UC_OAa2tlYwluxRcjAe6SzTQ,I really loved every episode I hope they bring season 3.,en,2025-07-27T05:11:31Z,2025-07-27 01:11:31,1,1,UgxvS0gt8vIBOVOImUR4AaABAg.AL3qUqrhGKrAL6Hf7VCtUU,@WearySojouner,UCvcN0Gqnf0v2B8A5skkfqSA,"Unfortunately I don't believe they will. But it could go on for a while if they truly wanted. 
The journey is boundless in imagination. So many things could be written. The last season and last episode was the very best of all of the episodes before because it tied together so perfectly.",en,2025-07-28T03:56:12Z,2025-07-27 23:56:12,1,2131931,47062,3066,"Tue, 16 Dec 2025 03:06:49 GMT"
Er18gmgqy2k,https://www.youtube.com/watch?v=Er18gmgqy2k,Ugzef8DMz29XubdEIrF4AaABAg,@jerrypanmeih6370,UC7JjICxBdfisXmAZ0PxJHSQ,Netflix n disney has a reputation of destroying good shows and movies and they still continue to do even with all the critics and backlash never learn. Why destroy a good show by killing of the Dream king. I dont get it.,en,2025-07-25T19:07:59Z,2025-07-25 15:07:59,2,2,Ugzef8DMz29XubdEIrF4AaABAg.AL0Bcer_iBdAL2hq1nu-hR,@floremidez4643,UCpcApRgx8p118M83xlWfQng,"He dies in the comics too, the series only followed the original work and the plot of the season is to understand Dream and what led to his death",en,2025-07-26T18:36:39Z,2025-07-26 14:36:39,0,2131931,47062,3066,"Tue, 16 Dec 2025 03:06:49 GMT"
Er18gmgqy2k,https://www.youtube.com/watch?v=Er18gmgqy2k,Ugzef8DMz29XubdEIrF4AaABAg,@jerrypanmeih6370,UC7JjICxBdfisXmAZ0PxJHSQ,Netflix n disney has a reputation of destroying good shows and movies and they still continue to do even with all the critics and backlash never learn. Why destroy a good show by killing of the Dream king. I dont get it.,en,2025-07-25T19:07:59Z,2025-07-25 15:07:59,2,2,Ugzef8DMz29XubdEIrF4AaABAg.AL0Bcer_iBdAL7Jt8Cwd9M,@jerrypanmeih6370,UC7JjICxBdfisXmAZ0PxJHSQ,​@floremidez4643But the new dream king is so off putting for me. It doesn't match the energy of the old dream king or slightly relatable at all,en,2025-07-28T13:34:50Z,2025-07-28 09:34:50,0,2131931,47062,3066,"Tue, 16 Dec 2025 03:06:49 GMT"
Er18gmgqy2k,https://www.youtube.com/watch?v=Er18gmgqy2k,UgyOsCeSgP-ZG2_-NKF4AaABAg,@Aleakwe,UC-wCILjbGGFHKALLx69zukw,"❤ when New Dream Daniel opened Morpheus’ chest, I was like: please be Handover Notes before he frees demons 😂",en,2025-07-25T11:02:42Z,2025-07-25 07:02:42,1,2,UgyOsCeSgP-ZG2_-NKF4AaABAg.AL-K5Hs-SwZAL0vp6ZTYJv,@keno.M,UC_OsHwd0miMiUvb1Xef18dg,😂😂😂😂same,NA,2025-07-26T02:00:23Z,2025-07-25 22:00:23,1,2131931,47062,3066,"Tue, 16 Dec 2025 03:06:49 GMT"
Er18gmgqy2k,https://www.youtube.com/watch?v=Er18gmgqy2k,UgyOsCeSgP-ZG2_-NKF4AaABAg,@Aleakwe,UC-wCILjbGGFHKALLx69zukw,"❤ when New Dream Daniel opened Morpheus’ chest, I was like: please be Handover Notes before he frees demons 😂",en,2025-07-25T11:02:42Z,2025-07-25 07:02:42,1,2,UgyOsCeSgP-ZG2_-NKF4AaABAg.AL-K5Hs-SwZAL1qVpYSdSO,@Aleakwe,UC-wCILjbGGFHKALLx69zukw,⁠@keno.M😂,ht,2025-07-26T10:33:10Z,2025-07-26 06:33:10,1,2131931,47062,3066,"Tue, 16 Dec 2025 03:06:49 GMT"
Er18gmgqy2k,https://www.youtube.com/watch?v=Er18gmgqy2k,UgyTLkjd18WV-pM_4Hx4AaABAg,@GeneralKenobi69420,UC37bbsU_BGpYzmPK-s_Q_5g,Stopped watching after the funeral. Literally an entire episodes worth of time dedicated to trans bs now. Netflix gonna Netflix I guess,en,2025-07-10T23:14:28Z,2025-07-10 19:14:28,1,3,UgyTLkjd18WV-pM_4Hx4AaABAg.AKQ-uilws-UAKQuFw2diGi,@jenniellepples,UCCwaa4CsVXte7swRpqfzGIw,You stopped watching a show because of one episode? 💀 sounds like you never watched the show and just there because of fomo,en,2025-07-11T07:35:34Z,2025-07-11 03:35:34,1,2131931,47062,3066,"Tue, 16 Dec 2025 03:06:49 GMT"
Er18gmgqy2k,https://www.youtube.com/watch?v=Er18gmgqy2k,UgyTLkjd18WV-pM_4Hx4AaABAg,@GeneralKenobi69420,UC37bbsU_BGpYzmPK-s_Q_5g,Stopped watching after the funeral. Literally an entire episodes worth of time dedicated to trans bs now. Netflix gonna Netflix I guess,en,2025-07-10T23:14:28Z,2025-07-10 19:14:28,1,3,UgyTLkjd18WV-pM_4Hx4AaABAg.AKQ-uilws-UAKRvGBYRZtl,@GeneralKenobi69420,UC37bbsU_BGpYzmPK-s_Q_5g,"@jenniellepples That, and because the second seasonwas meh. Morningstar just noping out of nowhere felt incredibly out of character and the episodes sluggish. The woke stuff was just the icing on the cake at this point",en,2025-07-11T17:03:35Z,2025-07-11 13:03:35,0,2131931,47062,3066,"Tue, 16 Dec 2025 03:06:49 GMT"
Er18gmgqy2k,https://www.youtube.com/watch?v=Er18gmgqy2k,UgyTLkjd18WV-pM_4Hx4AaABAg,@GeneralKenobi69420,UC37bbsU_BGpYzmPK-s_Q_5g,Stopped watching after the funeral. Literally an entire episodes worth of time dedicated to trans bs now. Netflix gonna Netflix I guess,en,2025-07-10T23:14:28Z,2025-07-10 19:14:28,1,3,UgyTLkjd18WV-pM_4Hx4AaABAg.AKQ-uilws-UAKT3e7g0fVF,@jenniellepples,UCCwaa4CsVXte7swRpqfzGIw,​@GeneralKenobi69420 had to agree they were indeed sluggish because they had to cram the arcs to make it shorter. The comic itself is queer and progressive but the way the show was made them just fillers,en,2025-07-12T03:44:52Z,2025-07-11 23:44:52,0,2131931,47062,3066,"Tue, 16 Dec 2025 03:06:49 GMT"
Er18gmgqy2k,https://www.youtube.com/watch?v=Er18gmgqy2k,Ugxso6PaLxbYCR_hrZJ4AaABAg,@GERserker,UCETMoC79-TkjbNDQRL6IhCg,"Hope it's not so woke like the first season, only gay realtionships between different races 😅",en,2025-07-10T22:08:53Z,2025-07-10 18:08:53,0,3,Ugxso6PaLxbYCR_hrZJ4AaABAg.AKPtPQhL3T5AKQ-LD3n-Eu,@GeneralKenobi69420,UC37bbsU_BGpYzmPK-s_Q_5g,There's an entire episode worth of time dedicated to trans bs now lol. Stopped watching there,en,2025-07-10T23:09:28Z,2025-07-10 19:09:28,0,2131931,47062,3066,"Tue, 16 Dec 2025 03:06:49 GMT"
Er18gmgqy2k,https://www.youtube.com/watch?v=Er18gmgqy2k,Ugxso6PaLxbYCR_hrZJ4AaABAg,@GERserker,UCETMoC79-TkjbNDQRL6IhCg,"Hope it's not so woke like the first season, only gay realtionships between different races 😅",en,2025-07-10T22:08:53Z,2025-07-10 18:08:53,0,3,Ugxso6PaLxbYCR_hrZJ4AaABAg.AKPtPQhL3T5AKQtl39noNr,@jenniellepples,UCCwaa4CsVXte7swRpqfzGIw,"​@GeneralKenobi69420 i would suggest reading the comic instead of the show, the show is such a bummer and removed a lot of the storyline. The scene about the transwoman was supposed to be heartfelt but the show had to compress the panels so it ended up giving something that looks ""unnecessary"".",en,2025-07-11T07:31:13Z,2025-07-11 03:31:13,0,2131931,47062,3066,"Tue, 16 Dec 2025 03:06:49 GMT"
Er18gmgqy2k,https://www.youtube.com/watch?v=Er18gmgqy2k,Ugxso6PaLxbYCR_hrZJ4AaABAg,@GERserker,UCETMoC79-TkjbNDQRL6IhCg,"Hope it's not so woke like the first season, only gay realtionships between different races 😅",en,2025-07-10T22:08:53Z,2025-07-10 18:08:53,0,3,Ugxso6PaLxbYCR_hrZJ4AaABAg.AKPtPQhL3T5AKQtt0k97Vh,@jenniellepples,UCCwaa4CsVXte7swRpqfzGIw,"I would suggest reading the comic, comic > show !! Many plots were left out in the show so it felt like those scenes were fillers.",en,2025-07-11T07:32:18Z,2025-07-11 03:32:18,0,2131931,47062,3066,"Tue, 16 Dec 2025 03:06:49 GMT"
Er18gmgqy2k,https://www.youtube.com/watch?v=Er18gmgqy2k,UgybyVdFVCe-zVaQSUp4AaABAg,@svarogbg,UCKTdBauAdQGKjOwBqUmhTVQ,What an utter woke trash..,NA,2025-07-10T10:15:03Z,2025-07-10 06:15:03,1,1,UgybyVdFVCe-zVaQSUp4AaABAg.AKObi6h0u8YAKQuLPax58c,@jenniellepples,UCCwaa4CsVXte7swRpqfzGIw,"The comic itself is woke, no one forced you to watch it if you don't want to 💀",en,2025-07-11T07:36:19Z,2025-07-11 03:36:19,2,2131931,47062,3066,"Tue, 16 Dec 2025 03:06:49 GMT"
Er18gmgqy2k,https://www.youtube.com/watch?v=Er18gmgqy2k,UgzRDmN4wjV_mal1egN4AaABAg,@alexanderphilips1101,UCTdfxcmHF4Uikiqhms4UXNA,"I believe they depicted the younger dryas/the great flood in episode 1,  that shit blew me away😂",en,2025-07-09T21:40:43Z,2025-07-09 17:40:43,0,1,UgzRDmN4wjV_mal1egN4AaABAg.AKNGOIIkTvvAKNGylQyz3W,@alexanderphilips1101,UCTdfxcmHF4Uikiqhms4UXNA,"10,000 years ago was about the exact date of the younger dryas according to the Bible and every other culture on the planet",en,2025-07-09T21:45:50Z,2025-07-09 17:45:50,0,2131931,47062,3066,"Tue, 16 Dec 2025 03:06:49 GMT"
Er18gmgqy2k,https://www.youtube.com/watch?v=Er18gmgqy2k,UgxdcTsGOmvnqHmb2uN4AaABAg,@WearySojouner,UCvcN0Gqnf0v2B8A5skkfqSA,"There are not enough good things that I could say about this series! The writers deserve huge praise! It is so deep, dark and at the same time enlightening. If people pay attention you can see the similarities in that realm and ours  It's full of typologies & full of parables. It's Shakespearean and also very easy to digest. One of the best series ever and best series of this genre!",en,2025-07-08T01:16:29Z,2025-07-07 21:16:29,17,3,UgxdcTsGOmvnqHmb2uN4AaABAg.AKIVUrH8ZinAO5yCM-oQ-N,@Negiot_Salmonella,UC9h0hLqfjwzL64xqxEORnpw,you its based on a comics right?,en,2025-10-10T14:31:33Z,2025-10-10 10:31:33,1,2131931,47062,3066,"Tue, 16 Dec 2025 03:06:49 GMT"
Er18gmgqy2k,https://www.youtube.com/watch?v=Er18gmgqy2k,UgxdcTsGOmvnqHmb2uN4AaABAg,@WearySojouner,UCvcN0Gqnf0v2B8A5skkfqSA,"There are not enough good things that I could say about this series! The writers deserve huge praise! It is so deep, dark and at the same time enlightening. If people pay attention you can see the similarities in that realm and ours  It's full of typologies & full of parables. It's Shakespearean and also very easy to digest. One of the best series ever and best series of this genre!",en,2025-07-08T01:16:29Z,2025-07-07 21:16:29,17,3,UgxdcTsGOmvnqHmb2uN4AaABAg.AKIVUrH8ZinAO5zv4LhfUN,@WearySojouner,UCvcN0Gqnf0v2B8A5skkfqSA,"​@Negiot_Salmonella
I don't know. I never knew anything about the sandman character until it aired on Netflix. 
But it was very good in my opinion. I love that it was an amalgam of Shakespeare and the combining of the Gods of old written about in the Bible. I loved the writing styles.",en,2025-10-10T14:46:32Z,2025-10-10 10:46:32,0,2131931,47062,3066,"Tue, 16 Dec 2025 03:06:49 GMT"
Er18gmgqy2k,https://www.youtube.com/watch?v=Er18gmgqy2k,UgxdcTsGOmvnqHmb2uN4AaABAg,@WearySojouner,UCvcN0Gqnf0v2B8A5skkfqSA,"There are not enough good things that I could say about this series! The writers deserve huge praise! It is so deep, dark and at the same time enlightening. If people pay attention you can see the similarities in that realm and ours  It's full of typologies & full of parables. It's Shakespearean and also very easy to digest. One of the best series ever and best series of this genre!",en,2025-07-08T01:16:29Z,2025-07-07 21:16:29,17,3,UgxdcTsGOmvnqHmb2uN4AaABAg.AKIVUrH8ZinAO7vaFcY0lk,@Negiot_Salmonella,UC9h0hLqfjwzL64xqxEORnpw,@WearySojounerthe comics are wat better . You should read them there are so many things they haven’t included,en,2025-10-11T08:47:13Z,2025-10-11 04:47:13,0,2131931,47062,3066,"Tue, 16 Dec 2025 03:06:49 GMT"
Er18gmgqy2k,https://www.youtube.com/watch?v=Er18gmgqy2k,UgzJgkr2Ov6zbbypSyd4AaABAg,@kathleenjones1399,UC63oCq8rf59QKfyIAFRrJiw,"Absolutely love this show! Just finished season 2 and hope for more.  It was so good.  Fantastic acting, sets, etc.  Please do more Netflix!!",en,2025-07-05T22:12:41Z,2025-07-05 18:12:41,0,1,UgzJgkr2Ov6zbbypSyd4AaABAg.AKD0rsQkLsCAKDGm5JuId1,@btgkg9639,UCwyut7JNz89t_2by5LOYeMA,It’s over. Neil Gaimen is in some trouble with SA allegations.,en,2025-07-06T00:31:42Z,2025-07-05 20:31:42,0,2131931,47062,3066,"Tue, 16 Dec 2025 03:06:49 GMT"
Er18gmgqy2k,https://www.youtube.com/watch?v=Er18gmgqy2k,UgwTXdz4_RwedHeEkjJ4AaABAg,@liquido2978,UCEBAJLQn3Tvxz7zNk6-aubg,Feedback: Transgender themes distract from the plot. Most of us are not interested in propaganda when we want to watch a show. Suggestion. Allow viewer to select transgender themes on/ off.,en,2025-07-05T17:21:54Z,2025-07-05 13:21:54,2,2,UgwTXdz4_RwedHeEkjJ4AaABAg.AKCVa9BHbiOAKCbfJWxjlh,@waiskuxx,UCPrYmJ_tRP-T_W0Ryg1mqmw,"Go have a cry sook, what a snowflake.",en,2025-07-05T18:23:47Z,2025-07-05 14:23:47,3,2131931,47062,3066,"Tue, 16 Dec 2025 03:06:49 GMT"
Er18gmgqy2k,https://www.youtube.com/watch?v=Er18gmgqy2k,UgwTXdz4_RwedHeEkjJ4AaABAg,@liquido2978,UCEBAJLQn3Tvxz7zNk6-aubg,Feedback: Transgender themes distract from the plot. Most of us are not interested in propaganda when we want to watch a show. Suggestion. Allow viewer to select transgender themes on/ off.,en,2025-07-05T17:21:54Z,2025-07-05 13:21:54,2,2,UgwTXdz4_RwedHeEkjJ4AaABAg.AKCVa9BHbiOAKDGsJiew3i,@btgkg9639,UCwyut7JNz89t_2by5LOYeMA,"@waiskuxxWe get it, you’re gay.",en,2025-07-06T00:32:33Z,2025-07-05 20:32:33,0,2131931,47062,3066,"Tue, 16 Dec 2025 03:06:49 GMT"
Er18gmgqy2k,https://www.youtube.com/watch?v=Er18gmgqy2k,UgyQ8JHtz1CoiOt7esx4AaABAg,@danielgeorge821,UCzo9FIjX66kgHbNDvgC7Svw,Why are we seeing that idiotic transgender in his underwear in the first episode?!?! These directors are wooooookeee!!!,en,2025-07-05T16:09:41Z,2025-07-05 12:09:41,3,1,UgyQ8JHtz1CoiOt7esx4AaABAg.AKCNK9RcaHUAKCbl-CbzzU,@waiskuxx,UCPrYmJ_tRP-T_W0Ryg1mqmw,They aren't transgender donut they're a transvestite.,en,2025-07-05T18:24:33Z,2025-07-05 14:24:33,0,2131931,47062,3066,"Tue, 16 Dec 2025 03:06:49 GMT"
Er18gmgqy2k,https://www.youtube.com/watch?v=Er18gmgqy2k,UgxcSPuxS00BVSu0NoZ4AaABAg,@thee0ryx939,UCD-A7AZTwftK6UrMpLBQGNg,More woke sloppy tv,no,2025-07-05T14:12:13Z,2025-07-05 10:12:13,1,1,UgxcSPuxS00BVSu0NoZ4AaABAg.AKC9sn0LgO7AKCIIfIYVvL,@Mobilis_InMobili,UCMdxbqxuyC4eSFSYBX6OUzA,You could always buy the Duck Dynasty set and watch that on repeat.,en,2025-07-05T15:25:47Z,2025-07-05 11:25:47,1,2131931,47062,3066,"Tue, 16 Dec 2025 03:06:49 GMT"
Er18gmgqy2k,https://www.youtube.com/watch?v=Er18gmgqy2k,UgysAx50JqdtreVcQiZ4AaABAg,@RandomLBS,UCvvrDn4B_XX8yTPq-3Uu54g,"For once, They finally decided to make something that stays true to the source material that true fans will love,  and not ""re-imagine"" it into something it was never meant to be and just slap a name on it.",en,2025-07-05T07:46:50Z,2025-07-05 03:46:50,0,1,UgysAx50JqdtreVcQiZ4AaABAg.AKBTmFZas1WAKDH7PFYjF3,@btgkg9639,UCwyut7JNz89t_2by5LOYeMA,So much was changed from the source material.,en,2025-07-06T00:34:45Z,2025-07-05 20:34:45,0,2131931,47062,3066,"Tue, 16 Dec 2025 03:06:49 GMT"
Er18gmgqy2k,https://www.youtube.com/watch?v=Er18gmgqy2k,UgyNZ0ZvVdLI7mJY2eJ4AaABAg,@priyanshu3491,UC5CKgzvENHKu6G58kNZTeTg,They show more gay and interracial couples in movies than there actually are,en,2025-07-05T04:16:02Z,2025-07-05 00:16:02,1,2,UgyNZ0ZvVdLI7mJY2eJ4AaABAg.AKB5eGYWFBmAKCIZvuGPD4,@Mobilis_InMobili,UCMdxbqxuyC4eSFSYBX6OUzA,"So you think... How would you even know?
The fact is, gays and lesbians are more prominent as artists cause we are natural rebels. We question things at a young age. Being a hetero, it is easy to fall into commonality.",en,2025-07-05T15:28:08Z,2025-07-05 11:28:08,1,2131931,47062,3066,"Tue, 16 Dec 2025 03:06:49 GMT"
Er18gmgqy2k,https://www.youtube.com/watch?v=Er18gmgqy2k,UgyNZ0ZvVdLI7mJY2eJ4AaABAg,@priyanshu3491,UC5CKgzvENHKu6G58kNZTeTg,They show more gay and interracial couples in movies than there actually are,en,2025-07-05T04:16:02Z,2025-07-05 00:16:02,1,2,UgyNZ0ZvVdLI7mJY2eJ4AaABAg.AKB5eGYWFBmAKEY4xec-Sz,@Hacker-orwot1,UCDCaLO4TGGRO2Szu7rygW0g,Hakk thuii couldn't enjoy the series because they kept showing gay vibes,en,2025-07-06T12:22:12Z,2025-07-06 08:22:12,0,2131931,47062,3066,"Tue, 16 Dec 2025 03:06:49 GMT"
Er18gmgqy2k,https://www.youtube.com/watch?v=Er18gmgqy2k,Ugzhltv04RACXG4hKoR4AaABAg,@James-ro3zr,UCj-auXBBpgkVQViV3lA7Bgw,"Season one was good and then yall turned it into this freak show. Of course a boy that thinks he is a girl is called, “desire.” Of course the queen of the first people is black. Of course the guy calling the meeting is black. Of course there is a fat girl. Of course Dream fell in love with a black girl. It’s like y’all don’t go outside.",en,2025-07-05T02:36:02Z,2025-07-04 22:36:02,2,1,Ugzhltv04RACXG4hKoR4AaABAg.AKAvCqp8qWPAKCcHCV7MNS,@waiskuxx,UCPrYmJ_tRP-T_W0Ryg1mqmw,Well all ethnicities descend from Africa are you a peanut? Why tf wouldn't the Queen of the first peoples be from Africa? Desire is suppose to be fat in comics. Nothing wrong with the actors being black lmao and nothing wrong with Desire being a transvestite. God you sound miserable asf.,en,2025-07-05T18:29:05Z,2025-07-05 14:29:05,0,2131931,47062,3066,"Tue, 16 Dec 2025 03:06:49 GMT"
Er18gmgqy2k,https://www.youtube.com/watch?v=Er18gmgqy2k,Ugz7yLNMhnGwfxo-5d94AaABAg,@TechnikerPeter,UCMovlBT0e7eg9JJZa1TFiqw,"Why do you have to shuv this trans and gay stuff in our faces, like omg...",en,2025-07-04T20:30:33Z,2025-07-04 16:30:33,2,1,Ugz7yLNMhnGwfxo-5d94AaABAg.AKAGNwisjqnAKCIjtpgDtr,@Mobilis_InMobili,UCMdxbqxuyC4eSFSYBX6OUzA,Just turn off the TV and go outside.,en,2025-07-05T15:29:38Z,2025-07-05 11:29:38,0,2131931,47062,3066,"Tue, 16 Dec 2025 03:06:49 GMT"
Er18gmgqy2k,https://www.youtube.com/watch?v=Er18gmgqy2k,UgyUYNjOl7LdEAPIZYx4AaABAg,@ellukalibman2440,UCOzRO7pZ60v49E7l2wKxpKA,Is this a fantasy show or propaganda for sexual minorities?,en,2025-07-04T11:13:13Z,2025-07-04 07:13:13,1,1,UgyUYNjOl7LdEAPIZYx4AaABAg.AK9GaxLKIEtAKCJBIhjir1,@Mobilis_InMobili,UCMdxbqxuyC4eSFSYBX6OUzA,Plenty of straight folks watch without any problem. Sounds like the show gave you a boner and now youre cursing said boner.,en,2025-07-05T15:33:31Z,2025-07-05 11:33:31,0,2131931,47062,3066,"Tue, 16 Dec 2025 03:06:49 GMT"
Er18gmgqy2k,https://www.youtube.com/watch?v=Er18gmgqy2k,UgyIPMwuKuFvmrh8zQ54AaABAg,@maddy_008,UCSkbLZZvVGWkGrtGDQIOyJg,"Yeah one more woke , feminist and Racial diversity nonsense show..
Main lead is white, his lover , sister brother and even assistant is black...
Brother desire is gay, and the most ridiculous woke crap is Lucifer is a female... Yaak what the hell literally...
Western shows and movies are in downwards spiral exactly due to these shenanigans",en,2025-07-04T10:32:18Z,2025-07-04 06:32:18,1,5,UgyIPMwuKuFvmrh8zQ54AaABAg.AK9BvDIpRJVAK9s1wzBcov,@blxckmastr,UC_AExdWrZoSRUP1RCjP14Xg,"I started watching it and 30 minutes in i gave it a thumbs down, removed it from the watchlist and closed Netflix. Unwatchable woke shit.",en,2025-07-04T16:49:06Z,2025-07-04 12:49:06,1,2131931,47062,3066,"Tue, 16 Dec 2025 03:06:49 GMT"
Er18gmgqy2k,https://www.youtube.com/watch?v=Er18gmgqy2k,UgyIPMwuKuFvmrh8zQ54AaABAg,@maddy_008,UCSkbLZZvVGWkGrtGDQIOyJg,"Yeah one more woke , feminist and Racial diversity nonsense show..
Main lead is white, his lover , sister brother and even assistant is black...
Brother desire is gay, and the most ridiculous woke crap is Lucifer is a female... Yaak what the hell literally...
Western shows and movies are in downwards spiral exactly due to these shenanigans",en,2025-07-04T10:32:18Z,2025-07-04 06:32:18,1,5,UgyIPMwuKuFvmrh8zQ54AaABAg.AK9BvDIpRJVAKCJLlgZaKr,@Mobilis_InMobili,UCMdxbqxuyC4eSFSYBX6OUzA,"​@blxckmastrdrama queens. You ain't gotta announce you're bitching. 😂 ""look at me! Im offended!""",en,2025-07-05T15:34:57Z,2025-07-05 11:34:57,0,2131931,47062,3066,"Tue, 16 Dec 2025 03:06:49 GMT"
