video_id,video_url,comment_id,comment_author_display,comment_author_channel_id,comment_content,comment_lang,comment_time_utc,comment_time_local,comment_like_count,comment_reply_count,reply_id,reply_author_display,reply_author_channel_id,reply_content,reply_lang,reply_time_utc,reply_time_local,reply_like_count,view_count,like_count,comment_count,crawl_time
Er18gmgqy2k,https://www.youtube.com/watch?v=Er18gmgqy2k,UgxISz7VwYfu_w7RItp4AaABAg,@lilacsky7726,UCcOvSWEGYZyAoDUF6fDHoFA,"how can the show as good as this lasted only for 2 seasons while crappy shows like, well I wont name names, but still wondering while crappy shows lasted for more than 3 seasons or even 5 seasons and more, this gem right here is butchered after 2 seasons? what a joke!",en,2025-06-28T07:14:37Z,2025-06-28 03:14:37,0,1,UgxISz7VwYfu_w7RItp4AaABAg.AJuOX9gHHqQAJvC86XmIMB,@terrie-v6p,UC8p0RkdxTBJt-_u3tKw75zQ,"Google ""Neil Gaiman"".",NA,2025-06-28T14:45:35Z,2025-06-28 10:45:35,0,2131931,47062,3066,"Tue, 16 Dec 2025 03:06:49 GMT"
Er18gmgqy2k,https://www.youtube.com/watch?v=Er18gmgqy2k,UgxTKS-fQKjBE632wvh4AaABAg,@ThatClipnetwork,UCE9g3CXL4m3zz0R5NfTu7PQ,I was hoping to see desire☹️,en,2025-06-28T07:03:01Z,2025-06-28 03:03:01,0,1,UgxTKS-fQKjBE632wvh4AaABAg.AJuNC9riEE2AJvC9U3lZlD,@terrie-v6p,UC8p0RkdxTBJt-_u3tKw75zQ,"They're in it, they just don't have any lines.",en,2025-06-28T14:45:46Z,2025-06-28 10:45:46,1,2131931,47062,3066,"Tue, 16 Dec 2025 03:06:49 GMT"
Er18gmgqy2k,https://www.youtube.com/watch?v=Er18gmgqy2k,Ugxs21LjoftSYtp7Dzd4AaABAg,@Bacolodcity535,UCb-Stdj2fy-CIzgIviiiWyw,Is this series woke?,af,2025-06-28T06:52:45Z,2025-06-28 02:52:45,0,4,Ugxs21LjoftSYtp7Dzd4AaABAg.AJuM0usw0NMAJvCEEVLuBE,@terrie-v6p,UC8p0RkdxTBJt-_u3tKw75zQ,"If by ""woke,"" you really mean ""diverse,"" then yes, just like the comics.",en,2025-06-28T14:46:25Z,2025-06-28 10:46:25,0,2131931,47062,3066,"Tue, 16 Dec 2025 03:06:49 GMT"
Er18gmgqy2k,https://www.youtube.com/watch?v=Er18gmgqy2k,Ugxs21LjoftSYtp7Dzd4AaABAg,@Bacolodcity535,UCb-Stdj2fy-CIzgIviiiWyw,Is this series woke?,af,2025-06-28T06:52:45Z,2025-06-28 02:52:45,0,4,Ugxs21LjoftSYtp7Dzd4AaABAg.AJuM0usw0NMAJwNWXHZ4n4,@Bacolodcity535,UCb-Stdj2fy-CIzgIviiiWyw,@terrie-v6pthey race swapped death and gender swapped lucifer - definitely not like the comics,en,2025-06-29T01:44:17Z,2025-06-28 21:44:17,0,2131931,47062,3066,"Tue, 16 Dec 2025 03:06:49 GMT"
Er18gmgqy2k,https://www.youtube.com/watch?v=Er18gmgqy2k,Ugxs21LjoftSYtp7Dzd4AaABAg,@Bacolodcity535,UCb-Stdj2fy-CIzgIviiiWyw,Is this series woke?,af,2025-06-28T06:52:45Z,2025-06-28 02:52:45,0,4,Ugxs21LjoftSYtp7Dzd4AaABAg.AJuM0usw0NMAJwYDgiwHzo,@terrie-v6p,UC8p0RkdxTBJt-_u3tKw75zQ,"@Bacolodcity535 Lucifer has always been androgynous. Since Death's skin color has nothing to do with the story, what does it matter?",en,2025-06-29T03:17:50Z,2025-06-28 23:17:50,0,2131931,47062,3066,"Tue, 16 Dec 2025 03:06:49 GMT"
Er18gmgqy2k,https://www.youtube.com/watch?v=Er18gmgqy2k,Ugxs21LjoftSYtp7Dzd4AaABAg,@Bacolodcity535,UCb-Stdj2fy-CIzgIviiiWyw,Is this series woke?,af,2025-06-28T06:52:45Z,2025-06-28 02:52:45,0,4,Ugxs21LjoftSYtp7Dzd4AaABAg.AJuM0usw0NMAJzcRyi8CkN,@craigprescott6169,UCkPX-hhBhlGV-i_Q5gVV5DA,"​@Bacolodcity535 Death is an entity, she does not have a race because she is not human. Lucifer is an angel and angels do not have genders.",en,2025-06-30T08:01:11Z,2025-06-30 04:01:11,0,2131931,47062,3066,"Tue, 16 Dec 2025 03:06:49 GMT"
Er18gmgqy2k,https://www.youtube.com/watch?v=Er18gmgqy2k,Ugw7IQEQKCgOwlopX7J4AaABAg,@agilofk4751,UCkrUkJm9Xi9Vz8s0JkdW1UA,The tv show just ruined comics forever,en,2025-06-28T06:09:11Z,2025-06-28 02:09:11,0,1,Ugw7IQEQKCgOwlopX7J4AaABAg.AJuH1rtKJuaAJuIuCylYun,@terrie-v6p,UC8p0RkdxTBJt-_u3tKw75zQ,1) That's physically impossible. 2) The original comics were a lot more diverse than people remember.,en,2025-06-28T06:25:29Z,2025-06-28 02:25:29,1,2131931,47062,3066,"Tue, 16 Dec 2025 03:06:49 GMT"
Er18gmgqy2k,https://www.youtube.com/watch?v=Er18gmgqy2k,Ugxk-TuwtgDB7eFxA7V4AaABAg,@drnabs872,UCAw7RySEzDqephW4SfyPbFA,Doesn’t look as good as the first season and I smell woke crap🤔 I hope I’m wrong and the show will deliver let’s see how it goes,en,2025-06-28T04:23:33Z,2025-06-28 00:23:33,0,1,Ugxk-TuwtgDB7eFxA7V4AaABAg.AJu4x81Z2pQAJuIy_tDTR5,@terrie-v6p,UC8p0RkdxTBJt-_u3tKw75zQ,"The first season was ""woke,"" just as the original comics were ""woke.""",NA,2025-06-28T06:26:04Z,2025-06-28 02:26:04,0,2131931,47062,3066,"Tue, 16 Dec 2025 03:06:49 GMT"
Er18gmgqy2k,https://www.youtube.com/watch?v=Er18gmgqy2k,UgxduQwECWEefLAin394AaABAg,@theguy892,UC6DJYo3S6Rgb4COQaHI6nyg,I thought they cancelled it,en,2025-06-27T04:34:06Z,2025-06-27 00:34:06,0,1,UgxduQwECWEefLAin394AaABAg.AJrXMaVhgIzAJsHzfY2j47,@terrie-v6p,UC8p0RkdxTBJt-_u3tKw75zQ,They did -- this is the final season.,en,2025-06-27T11:39:00Z,2025-06-27 07:39:00,0,2131931,47062,3066,"Tue, 16 Dec 2025 03:06:49 GMT"
Er18gmgqy2k,https://www.youtube.com/watch?v=Er18gmgqy2k,UgwIt1ZGc7fpURXz0X54AaABAg,@Rajatshankhdhar,UCd5PsGuJnFUIr_SrNUAXQTg,Literally enjoyed few episodes of season 1 but there was loads of unnecessary gay lesbian shit made me leave in half. Now i am not going to watch s2 or s1. Spread your wokeness but can’t let the makers waste my time,en,2025-06-26T18:01:37Z,2025-06-26 14:01:37,0,1,UgwIt1ZGc7fpURXz0X54AaABAg.AJqOzCISjdfAJqo_K1bMQG,@nightview93,UCO-qDngQMCl6-A-TB9IubFw,we dont care,en,2025-06-26T21:54:01Z,2025-06-26 17:54:01,2,2131931,47062,3066,"Tue, 16 Dec 2025 03:06:49 GMT"
Er18gmgqy2k,https://www.youtube.com/watch?v=Er18gmgqy2k,UgxYQg8dLjM76I7sFwB4AaABAg,@AoiMuzitori,UCd29A42mUc6TsbK2rfUoaUg,I hope they don't rush it afterall quality is a must.,en,2025-06-26T15:41:27Z,2025-06-26 11:41:27,0,1,UgxYQg8dLjM76I7sFwB4AaABAg.AJq8wUnoOy7AJqYUeynBWq,@terrie-v6p,UC8p0RkdxTBJt-_u3tKw75zQ,The filming for S2 ended in August 2024. They've had plenty of time to finish it.,en,2025-06-26T19:24:42Z,2025-06-26 15:24:42,0,2131931,47062,3066,"Tue, 16 Dec 2025 03:06:49 GMT"
Er18gmgqy2k,https://www.youtube.com/watch?v=Er18gmgqy2k,Ugwj_T72A2dLo85eb3h4AaABAg,@ThisValiantAdventure,UCDoVoLh6PEMlB_Ftj0FbeVQ,"Man, I was really hoping for  the ”A Game of You” story this season.",en,2025-06-26T01:13:15Z,2025-06-25 21:13:15,0,1,Ugwj_T72A2dLo85eb3h4AaABAg.AJoa_gBp0h5AJpyqEztMM5,@terrie-v6p,UC8p0RkdxTBJt-_u3tKw75zQ,"Barbie and Wanda's story, right? Wanda was cast and according to IMDb, we're getting their story in S2E1. IMDb isn't always accurate when it's a show that hasn't dropped yet, so the episode number might be wrong, but we are supposed to get their story this season.",en,2025-06-26T14:04:28Z,2025-06-26 10:04:28,1,2131931,47062,3066,"Tue, 16 Dec 2025 03:06:49 GMT"
Er18gmgqy2k,https://www.youtube.com/watch?v=Er18gmgqy2k,UgwVXWNvfjZr54vozlZ4AaABAg,@ney8045,UC6d0ah37cqsA5br6wxYDI0g,If it is like season one where everyone is gay. I pass. I respect that but when they forced it as much as they do on season one. I prefer to watch something else.,en,2025-06-26T00:51:11Z,2025-06-25 20:51:11,2,1,UgwVXWNvfjZr54vozlZ4AaABAg.AJoZ3-q2CjbAJpz6GCLsGV,@terrie-v6p,UC8p0RkdxTBJt-_u3tKw75zQ,Did you not read the comics?,en,2025-06-26T14:06:48Z,2025-06-26 10:06:48,0,2131931,47062,3066,"Tue, 16 Dec 2025 03:06:49 GMT"
Er18gmgqy2k,https://www.youtube.com/watch?v=Er18gmgqy2k,Ugxh89ArRsTK4Ux36894AaABAg,@praiseareghan6042,UCcptxBWzNOC_e8uaEeTaIcw,Isnt this a dc character?,en,2025-06-25T23:10:47Z,2025-06-25 19:10:47,0,3,Ugxh89ArRsTK4Ux36894AaABAg.AJoNZc5vC48AJoT32njvat,@terrie-v6p,UC8p0RkdxTBJt-_u3tKw75zQ,Yes.,en,2025-06-25T23:58:46Z,2025-06-25 19:58:46,0,2131931,47062,3066,"Tue, 16 Dec 2025 03:06:49 GMT"
Er18gmgqy2k,https://www.youtube.com/watch?v=Er18gmgqy2k,Ugxh89ArRsTK4Ux36894AaABAg,@praiseareghan6042,UCcptxBWzNOC_e8uaEeTaIcw,Isnt this a dc character?,en,2025-06-25T23:10:47Z,2025-06-25 19:10:47,0,3,Ugxh89ArRsTK4Ux36894AaABAg.AJoNZc5vC48AJqL4g5hjx0,@praiseareghan6042,UCcptxBWzNOC_e8uaEeTaIcw,Is it canon to the dcu?​@terrie-v6p,en,2025-06-26T17:27:33Z,2025-06-26 13:27:33,0,2131931,47062,3066,"Tue, 16 Dec 2025 03:06:49 GMT"
Er18gmgqy2k,https://www.youtube.com/watch?v=Er18gmgqy2k,Ugxh89ArRsTK4Ux36894AaABAg,@praiseareghan6042,UCcptxBWzNOC_e8uaEeTaIcw,Isnt this a dc character?,en,2025-06-25T23:10:47Z,2025-06-25 19:10:47,0,3,Ugxh89ArRsTK4Ux36894AaABAg.AJoNZc5vC48AJqYfSXwNOu,@terrie-v6p,UC8p0RkdxTBJt-_u3tKw75zQ,@praiseareghan6042 No.,NA,2025-06-26T19:26:19Z,2025-06-26 15:26:19,0,2131931,47062,3066,"Tue, 16 Dec 2025 03:06:49 GMT"
Er18gmgqy2k,https://www.youtube.com/watch?v=Er18gmgqy2k,UgwNHmJ7A_VecyrAXqB4AaABAg,@Bushido_92,UCIXpS0FofaaDG9XUzFBBA9Q,The best show on Netflix so far and it's good that there are second seasons even though they said it was canceled,en,2025-06-25T18:34:45Z,2025-06-25 14:34:45,0,1,UgwNHmJ7A_VecyrAXqB4AaABAg.AJnsyuDlzzpAJoNEfIpLCH,@terrie-v6p,UC8p0RkdxTBJt-_u3tKw75zQ,It is cancelled -- Season 2 is the final season.,fy,2025-06-25T23:07:55Z,2025-06-25 19:07:55,0,2131931,47062,3066,"Tue, 16 Dec 2025 03:06:49 GMT"
Er18gmgqy2k,https://www.youtube.com/watch?v=Er18gmgqy2k,UgyN_WM_2sNDqs9t5-l4AaABAg,@tafitaemilerabemanjara9907,UCvy1sNLMniOe3WJRMTHsgNQ,Is that dude with glasses the actual god of DC? Father of Lucifer?,en,2025-06-25T16:01:17Z,2025-06-25 12:01:17,0,1,UgyN_WM_2sNDqs9t5-l4AaABAg.AJnbPr4WlcqAJoNQpqwjtB,@terrie-v6p,UC8p0RkdxTBJt-_u3tKw75zQ,"No, that's Gilbert, we met him in Season 1.",NA,2025-06-25T23:09:35Z,2025-06-25 19:09:35,0,2131931,47062,3066,"Tue, 16 Dec 2025 03:06:49 GMT"
Er18gmgqy2k,https://www.youtube.com/watch?v=Er18gmgqy2k,UgwzdwRwd7vz4-QHlMt4AaABAg,@KelevraTheBadDog,UCA1diNjCzcePnUPkimTAW1Q,"Just Like Season 1 Women Will Take Center Stage & The Protagonist Will Take A Back Seat Coz He's A ""Man"" ... Gender Politics, Woke Ideologies & Weak Writing.",NA,2025-06-24T09:54:34Z,2025-06-24 05:54:34,2,1,UgwzdwRwd7vz4-QHlMt4AaABAg.AJkNe31-UNIAJk_sMGapAX,@terrie-v6p,UC8p0RkdxTBJt-_u3tKw75zQ,Something tells me you never read the comics.,en,2025-06-24T11:50:06Z,2025-06-24 07:50:06,1,2131931,47062,3066,"Tue, 16 Dec 2025 03:06:49 GMT"
Er18gmgqy2k,https://www.youtube.com/watch?v=Er18gmgqy2k,Ugxy9IVPizhgj0Rr9dV4AaABAg,@vincentdakah7669,UC__zUA94iWC4Oe99OZ0kseQ,Where's the dream vortex?,it,2025-06-24T07:12:32Z,2025-06-24 03:12:32,0,1,Ugxy9IVPizhgj0Rr9dV4AaABAg.AJk56ITZeT7AJk_ufQbr7a,@terrie-v6p,UC8p0RkdxTBJt-_u3tKw75zQ,"Her story is done, she's not in S2.",en,2025-06-24T11:50:25Z,2025-06-24 07:50:25,0,2131931,47062,3066,"Tue, 16 Dec 2025 03:06:49 GMT"
Er18gmgqy2k,https://www.youtube.com/watch?v=Er18gmgqy2k,UgwdXej2nQuJY-SBJMh4AaABAg,@bobdylan1968,UCmk4hQOQ7xsR6UN8nuP2GXQ,No. What about niel gaiman being a creep??,en,2025-06-23T22:27:24Z,2025-06-23 18:27:24,1,1,UgwdXej2nQuJY-SBJMh4AaABAg.AJj908tAtM-AJjRr3PydFX,@terrie-v6p,UC8p0RkdxTBJt-_u3tKw75zQ,The allegations became public while this season was in production. Netflix decided there won't be a third season.,en,2025-06-24T01:12:03Z,2025-06-23 21:12:03,0,2131931,47062,3066,"Tue, 16 Dec 2025 03:06:49 GMT"
Er18gmgqy2k,https://www.youtube.com/watch?v=Er18gmgqy2k,UgyQ46F5ePsVWLEc3IF4AaABAg,@unakkuveravelaille-h6u,UCRLJKcxTZCVUyeNzwD8oiIg,Black characters are ruining the goodness.. doesn't fit at all.,en,2025-06-23T15:06:47Z,2025-06-23 11:06:47,1,1,UgyQ46F5ePsVWLEc3IF4AaABAg.AJiM_wcIoVBAJkzlbof10D,@unakkuveravelaille-h6u,UCRLJKcxTZCVUyeNzwD8oiIg,​BuildinWingsblackkks are the worst,NA,2025-06-24T15:36:23Z,2025-06-24 11:36:23,1,2131931,47062,3066,"Tue, 16 Dec 2025 03:06:49 GMT"
Er18gmgqy2k,https://www.youtube.com/watch?v=Er18gmgqy2k,UgxN20iRomu_xDK-H8F4AaABAg,@samanthadiaz2318,UChRswKroXB4to_ScS1UKSWA,CANCEL THIS,NA,2025-06-23T03:55:26Z,2025-06-22 23:55:26,1,1,UgxN20iRomu_xDK-H8F4AaABAg.AJh9kq9DjhLAJiDNG7_IFk,@terrie-v6p,UC8p0RkdxTBJt-_u3tKw75zQ,It's already cancelled -- this is the final season.,en,2025-06-23T13:46:16Z,2025-06-23 09:46:16,1,2131931,47062,3066,"Tue, 16 Dec 2025 03:06:49 GMT"
Er18gmgqy2k,https://www.youtube.com/watch?v=Er18gmgqy2k,UgzBMcpVjgRQEKPROjx4AaABAg,@mystery5964,UCBY8RQkyuAbiqsP8BRRCYgQ,Please make season 3 this show is my fav😢,hmn,2025-06-23T02:31:45Z,2025-06-22 22:31:45,0,1,UgzBMcpVjgRQEKPROjx4AaABAg.AJh0AxRLmn6AJh8BF6CPUp,@terrie-v6p,UC8p0RkdxTBJt-_u3tKw75zQ,"Google ""Neil Gaiman"" and you'll see why there won't be another season.",en,2025-06-23T03:41:42Z,2025-06-22 23:41:42,1,2131931,47062,3066,"Tue, 16 Dec 2025 03:06:49 GMT"
Er18gmgqy2k,https://www.youtube.com/watch?v=Er18gmgqy2k,UgxEzVqq7p4MSSHF5vl4AaABAg,@godofDisRespect,UCSbno7Ho_dL0EGUtcbueOkQ,the old dude looks and Talks like scotty from star trek. James Doohan 0.48 seconds,en,2025-06-23T02:17:11Z,2025-06-22 22:17:11,0,1,UgxEzVqq7p4MSSHF5vl4AaABAg.AJgzWHUis17AJiDZok9o13,@terrie-v6p,UC8p0RkdxTBJt-_u3tKw75zQ,"That would be Sir Stephen Fry, a British comedy legend.",en,2025-06-23T13:47:59Z,2025-06-23 09:47:59,0,2131931,47062,3066,"Tue, 16 Dec 2025 03:06:49 GMT"
Er18gmgqy2k,https://www.youtube.com/watch?v=Er18gmgqy2k,Ugyr2hiq2I649pTfNDR4AaABAg,@jxy_vichi,UCSvEZw2MWvnVOniErriUwXw,This is the most dei show I’ve ever seen,en,2025-06-22T13:16:34Z,2025-06-22 09:16:34,1,1,Ugyr2hiq2I649pTfNDR4AaABAg.AJfaAqkfjjYAJfvLMw_UES,@terrie-v6p,UC8p0RkdxTBJt-_u3tKw75zQ,🙄,ja,2025-06-22T16:21:30Z,2025-06-22 12:21:30,1,2131931,47062,3066,"Tue, 16 Dec 2025 03:06:49 GMT"
Er18gmgqy2k,https://www.youtube.com/watch?v=Er18gmgqy2k,Ugy9aK1Hch0YTA_-UAR4AaABAg,@Rin-Rin-J,UCnftvpiq23pHLW7EfNbRo5A,"Seems like a good story, but will never watch it because of race/gender swaps",en,2025-06-22T09:43:34Z,2025-06-22 05:43:34,0,1,Ugy9aK1Hch0YTA_-UAR4AaABAg.AJfCnjaYSmBAJfvOgoOPMz,@terrie-v6p,UC8p0RkdxTBJt-_u3tKw75zQ,🙄,ja,2025-06-22T16:21:57Z,2025-06-22 12:21:57,0,2131931,47062,3066,"Tue, 16 Dec 2025 03:06:49 GMT"
Er18gmgqy2k,https://www.youtube.com/watch?v=Er18gmgqy2k,Ugx_umcAt5HkfbiJjzF4AaABAg,@scottward6974,UCUf7TXUKrQ4sz4UG9l1mF8w,Can't wait! I hope Lucienne is still played by a bald black woman who can't act for toffee!,en,2025-06-22T09:03:14Z,2025-06-22 05:03:14,0,1,Ugx_umcAt5HkfbiJjzF4AaABAg.AJf8BOKsX78AJfvQs6zNZL,@terrie-v6p,UC8p0RkdxTBJt-_u3tKw75zQ,🙄,ja,2025-06-22T16:22:15Z,2025-06-22 12:22:15,0,2131931,47062,3066,"Tue, 16 Dec 2025 03:06:49 GMT"
Er18gmgqy2k,https://www.youtube.com/watch?v=Er18gmgqy2k,UgyBnWD41SopXI0ypVd4AaABAg,@amandadunn1238,UCfRDDIF4jxUyC2wZWq080qA,One of the BEST fantasy shows I have ever seen!!!! And I've seen them all!!! Truly a Masterpiece of a series!! Why Netflix is giving this gem only 2 seasons? Are they insane?!?!,en,2025-06-22T04:04:05Z,2025-06-22 00:04:05,2,1,UgyBnWD41SopXI0ypVd4AaABAg.AJeaxNQOQbTAJep2g-EhYD,@terrie-v6p,UC8p0RkdxTBJt-_u3tKw75zQ,"Google ""Neil Gaiman"" if you want to know why the show is cancelled.",en,2025-06-22T06:07:17Z,2025-06-22 02:07:17,1,2131931,47062,3066,"Tue, 16 Dec 2025 03:06:49 GMT"
Er18gmgqy2k,https://www.youtube.com/watch?v=Er18gmgqy2k,Ugxlzp2O_pNomCWqrzh4AaABAg,@pixel_artisttt,UC0_vvftkL3FnM8LEKIr_6dA,0:46 is that Barry sloane ? He looks incredibly like him,en,2025-06-22T01:40:31Z,2025-06-21 21:40:31,0,1,Ugxlzp2O_pNomCWqrzh4AaABAg.AJeLWrw7-CFAJfva_MmrM-,@terrie-v6p,UC8p0RkdxTBJt-_u3tKw75zQ,"Yes, that's Barry as Destruction aka The Prodigal.",en,2025-06-22T16:23:43Z,2025-06-22 12:23:43,0,2131931,47062,3066,"Tue, 16 Dec 2025 03:06:49 GMT"
Er18gmgqy2k,https://www.youtube.com/watch?v=Er18gmgqy2k,UgwFa-U5IHQl64Di1414AaABAg,@strangerrrrrrr,UCAGBzQxzCBwayLdU4aI7pKw,why only 2 seasons,en,2025-06-21T19:37:03Z,2025-06-21 15:37:03,1,2,UgwFa-U5IHQl64Di1414AaABAg.AJdgvkkIPeLAJdqd9oom3Y,@terrie-v6p,UC8p0RkdxTBJt-_u3tKw75zQ,"Google ""Neil Gaiman"".",NA,2025-06-21T21:01:54Z,2025-06-21 17:01:54,0,2131931,47062,3066,"Tue, 16 Dec 2025 03:06:49 GMT"
Er18gmgqy2k,https://www.youtube.com/watch?v=Er18gmgqy2k,UgwFa-U5IHQl64Di1414AaABAg,@strangerrrrrrr,UCAGBzQxzCBwayLdU4aI7pKw,why only 2 seasons,en,2025-06-21T19:37:03Z,2025-06-21 15:37:03,1,2,UgwFa-U5IHQl64Di1414AaABAg.AJdgvkkIPeLAK2Ts-iBmDw,@williammorahan4907,UC-00PrLy9i-ywmcVkVZHc6Q,Budgeting,NA,2025-07-01T19:54:28Z,2025-07-01 15:54:28,0,2131931,47062,3066,"Tue, 16 Dec 2025 03:06:49 GMT"
Er18gmgqy2k,https://www.youtube.com/watch?v=Er18gmgqy2k,UgyW4JX2y5jKf927LBh4AaABAg,@86Kera,UCCvUWF49BSiy6FbVPnyJ64w,Final season ?! This show is too good for just only 2 seasons,en,2025-06-21T17:46:10Z,2025-06-21 13:46:10,0,1,UgyW4JX2y5jKf927LBh4AaABAg.AJdVEbKBdNyAJiR-SK_eGi,@terrie-v6p,UC8p0RkdxTBJt-_u3tKw75zQ,"Google ""Neil Gaiman"" -- there's a very good reason why this is the final season.",en,2025-06-23T15:45:21Z,2025-06-23 11:45:21,1,2131931,47062,3066,"Tue, 16 Dec 2025 03:06:49 GMT"
Er18gmgqy2k,https://www.youtube.com/watch?v=Er18gmgqy2k,UgzmtjsrNj5yi9gCMvl4AaABAg,@ahsanameer8232,UCdkKtnZnR13KYlte5oIpxYw,Why's the Lucifer a woman? 😭,en,2025-06-21T10:18:25Z,2025-06-21 06:18:25,0,1,UgzmtjsrNj5yi9gCMvl4AaABAg.AJch-7LqGkcAJd5iP_05Qq,@terrie-v6p,UC8p0RkdxTBJt-_u3tKw75zQ,Lucifer is androgynous and has been played by Gwendoline Christie since S1.,en,2025-06-21T14:03:11Z,2025-06-21 10:03:11,1,2131931,47062,3066,"Tue, 16 Dec 2025 03:06:49 GMT"
Er18gmgqy2k,https://www.youtube.com/watch?v=Er18gmgqy2k,UgzkAFBQYhQDp6bOYrh4AaABAg,@alfonstabz9741,UCaTCCnPE3OsQ8Ixz3pkTjJQ,"I just don't understand why every movie nowadays need to be feminist, and ideological lecturing ..",en,2025-06-21T09:39:18Z,2025-06-21 05:39:18,0,3,UgzkAFBQYhQDp6bOYrh4AaABAg.AJccWeKwj32AJd5r_fyPuT,@terrie-v6p,UC8p0RkdxTBJt-_u3tKw75zQ,"Having previously male characters played by women doesn't inherently make a story (and this is a show, not a movie) feminist.",en,2025-06-21T14:04:26Z,2025-06-21 10:04:26,1,2131931,47062,3066,"Tue, 16 Dec 2025 03:06:49 GMT"
Er18gmgqy2k,https://www.youtube.com/watch?v=Er18gmgqy2k,UgzkAFBQYhQDp6bOYrh4AaABAg,@alfonstabz9741,UCaTCCnPE3OsQ8Ixz3pkTjJQ,"I just don't understand why every movie nowadays need to be feminist, and ideological lecturing ..",en,2025-06-21T09:39:18Z,2025-06-21 05:39:18,0,3,UgzkAFBQYhQDp6bOYrh4AaABAg.AJccWeKwj32AJewPt6raIV,@alfonstabz9741,UCaTCCnPE3OsQ8Ixz3pkTjJQ,@terrie-v6p I'm ranting to entirety of entertainment industry not just of this one. yes I like wonder woman and black widow. they fitted and not trying to preach a religion of ideology.,en,2025-06-22T07:11:37Z,2025-06-22 03:11:37,0,2131931,47062,3066,"Tue, 16 Dec 2025 03:06:49 GMT"
Er18gmgqy2k,https://www.youtube.com/watch?v=Er18gmgqy2k,UgzkAFBQYhQDp6bOYrh4AaABAg,@alfonstabz9741,UCaTCCnPE3OsQ8Ixz3pkTjJQ,"I just don't understand why every movie nowadays need to be feminist, and ideological lecturing ..",en,2025-06-21T09:39:18Z,2025-06-21 05:39:18,0,3,UgzkAFBQYhQDp6bOYrh4AaABAg.AJccWeKwj32AJfD5gdzCXs,@Rin-Rin-J,UCnftvpiq23pHLW7EfNbRo5A,"Because of the manatory woke propaganda, duh. Kids must be brainwashed",NA,2025-06-22T09:46:09Z,2025-06-22 05:46:09,0,2131931,47062,3066,"Tue, 16 Dec 2025 03:06:49 GMT"
Er18gmgqy2k,https://www.youtube.com/watch?v=Er18gmgqy2k,Ugxqs_-E0D_39rVUj7h4AaABAg,@sarabloch1342,UCk64b1_ETrN_Tdmb_3TssMA,This looks amazing and why did they cut it!!!! Like come on this was an amazing cast and show,en,2025-06-20T23:42:55Z,2025-06-20 19:42:55,0,1,Ugxqs_-E0D_39rVUj7h4AaABAg.AJbZGaJQotSAJb_5ODfGRo,@terrie-v6p,UC8p0RkdxTBJt-_u3tKw75zQ,"Google ""Neil Gaiman"" and you'll know why.",en,2025-06-20T23:50:07Z,2025-06-20 19:50:07,1,2131931,47062,3066,"Tue, 16 Dec 2025 03:06:49 GMT"
Er18gmgqy2k,https://www.youtube.com/watch?v=Er18gmgqy2k,UgxdFGbY5IC5jxCLqIJ4AaABAg,@NomadsLand-h3b,UCT2vjoC727AeRO6aAYa-bew,"Yeah but it's the whole hate the ""creator"" love the ""creation"" thing... Sigh 😢 I am so damn conflicted",en,2025-06-20T22:59:04Z,2025-06-20 18:59:04,0,2,UgxdFGbY5IC5jxCLqIJ4AaABAg.AJbUFWNGbURAK2TygIVq4W,@williammorahan4907,UC-00PrLy9i-ywmcVkVZHc6Q,BuildinWingsnot true,nl,2025-07-01T19:55:22Z,2025-07-01 15:55:22,0,2131931,47062,3066,"Tue, 16 Dec 2025 03:06:49 GMT"
Er18gmgqy2k,https://www.youtube.com/watch?v=Er18gmgqy2k,UgxdFGbY5IC5jxCLqIJ4AaABAg,@NomadsLand-h3b,UCT2vjoC727AeRO6aAYa-bew,"Yeah but it's the whole hate the ""creator"" love the ""creation"" thing... Sigh 😢 I am so damn conflicted",en,2025-06-20T22:59:04Z,2025-06-20 18:59:04,0,2,UgxdFGbY5IC5jxCLqIJ4AaABAg.AJbUFWNGbURAK2gsQWqmry,@NomadsLand-h3b,UCT2vjoC727AeRO6aAYa-bew,😢Yea I know. It's really horrible the things he did ​BuildinWings,en,2025-07-01T21:56:51Z,2025-07-01 17:56:51,0,2131931,47062,3066,"Tue, 16 Dec 2025 03:06:49 GMT"
Er18gmgqy2k,https://www.youtube.com/watch?v=Er18gmgqy2k,UgynmCCxYXtK4QAN_i54AaABAg,@precog80,UCLZOf1ALguve-sLBq7K96Aw,There could (and more than likely will) be a 3rd season like in 4 or 5 years (or longer) because of the graphic novel series Sandman: Overture which is a prequel to this entire show series and essentially answers many questions that linger throughout Season 1 and what will be Season 2.,en,2025-06-20T22:50:13Z,2025-06-20 18:50:13,0,6,UgynmCCxYXtK4QAN_i54AaABAg.AJbTEf7LoqVAJcEzxyVU_H,@terrie-v6p,UC8p0RkdxTBJt-_u3tKw75zQ,There won't be any more seasons because of Gaiman.,en,2025-06-21T06:04:59Z,2025-06-21 02:04:59,1,2131931,47062,3066,"Tue, 16 Dec 2025 03:06:49 GMT"
Er18gmgqy2k,https://www.youtube.com/watch?v=Er18gmgqy2k,UgynmCCxYXtK4QAN_i54AaABAg,@precog80,UCLZOf1ALguve-sLBq7K96Aw,There could (and more than likely will) be a 3rd season like in 4 or 5 years (or longer) because of the graphic novel series Sandman: Overture which is a prequel to this entire show series and essentially answers many questions that linger throughout Season 1 and what will be Season 2.,en,2025-06-20T22:50:13Z,2025-06-20 18:50:13,0,6,UgynmCCxYXtK4QAN_i54AaABAg.AJbTEf7LoqVAJdg_oHrIQa,@precog80,UCLZOf1ALguve-sLBq7K96Aw,@terrie-v6p Glad to have a psychic on site. Please also advise on future global nuclear conflicts & natural disasters so that humanity can prepare accordingly.,en,2025-06-21T19:34:03Z,2025-06-21 15:34:03,0,2131931,47062,3066,"Tue, 16 Dec 2025 03:06:49 GMT"
Er18gmgqy2k,https://www.youtube.com/watch?v=Er18gmgqy2k,UgynmCCxYXtK4QAN_i54AaABAg,@precog80,UCLZOf1ALguve-sLBq7K96Aw,There could (and more than likely will) be a 3rd season like in 4 or 5 years (or longer) because of the graphic novel series Sandman: Overture which is a prequel to this entire show series and essentially answers many questions that linger throughout Season 1 and what will be Season 2.,en,2025-06-20T22:50:13Z,2025-06-20 18:50:13,0,6,UgynmCCxYXtK4QAN_i54AaABAg.AJbTEf7LoqVAJdiIiDjv4m,@terrie-v6p,UC8p0RkdxTBJt-_u3tKw75zQ,@precog80 Have you forgotten the accusations against Gaiman?,en,2025-06-21T19:49:04Z,2025-06-21 15:49:04,1,2131931,47062,3066,"Tue, 16 Dec 2025 03:06:49 GMT"
Er18gmgqy2k,https://www.youtube.com/watch?v=Er18gmgqy2k,UgynmCCxYXtK4QAN_i54AaABAg,@precog80,UCLZOf1ALguve-sLBq7K96Aw,There could (and more than likely will) be a 3rd season like in 4 or 5 years (or longer) because of the graphic novel series Sandman: Overture which is a prequel to this entire show series and essentially answers many questions that linger throughout Season 1 and what will be Season 2.,en,2025-06-20T22:50:13Z,2025-06-20 18:50:13,0,6,UgynmCCxYXtK4QAN_i54AaABAg.AJbTEf7LoqVAJdk8CdVTuN,@precog80,UCLZOf1ALguve-sLBq7K96Aw,@terrie-v6p Humanity is still waiting for you to state the future. Please tell us... if and when Gaiman goes to trial...is he guilty or innocent? (I'm assuming you are one of the tripartite  so you should have this insight),en,2025-06-21T20:05:06Z,2025-06-21 16:05:06,0,2131931,47062,3066,"Tue, 16 Dec 2025 03:06:49 GMT"
Er18gmgqy2k,https://www.youtube.com/watch?v=Er18gmgqy2k,UgynmCCxYXtK4QAN_i54AaABAg,@precog80,UCLZOf1ALguve-sLBq7K96Aw,There could (and more than likely will) be a 3rd season like in 4 or 5 years (or longer) because of the graphic novel series Sandman: Overture which is a prequel to this entire show series and essentially answers many questions that linger throughout Season 1 and what will be Season 2.,en,2025-06-20T22:50:13Z,2025-06-20 18:50:13,0,6,UgynmCCxYXtK4QAN_i54AaABAg.AJbTEf7LoqVAJdkr99JHjy,@terrie-v6p,UC8p0RkdxTBJt-_u3tKw75zQ,@precog80 🙄Have you EVER seen Netflix change their mind about cancelling a show? Because I haven't.,en,2025-06-21T20:11:23Z,2025-06-21 16:11:23,1,2131931,47062,3066,"Tue, 16 Dec 2025 03:06:49 GMT"
Er18gmgqy2k,https://www.youtube.com/watch?v=Er18gmgqy2k,UgynmCCxYXtK4QAN_i54AaABAg,@precog80,UCLZOf1ALguve-sLBq7K96Aw,There could (and more than likely will) be a 3rd season like in 4 or 5 years (or longer) because of the graphic novel series Sandman: Overture which is a prequel to this entire show series and essentially answers many questions that linger throughout Season 1 and what will be Season 2.,en,2025-06-20T22:50:13Z,2025-06-20 18:50:13,0,6,UgynmCCxYXtK4QAN_i54AaABAg.AJbTEf7LoqVAJdmJsogxwK,@precog80,UCLZOf1ALguve-sLBq7K96Aw,@terrie-v6p Omgoodness. You are so right!  What was I thinking.,en,2025-06-21T20:24:10Z,2025-06-21 16:24:10,0,2131931,47062,3066,"Tue, 16 Dec 2025 03:06:49 GMT"
Er18gmgqy2k,https://www.youtube.com/watch?v=Er18gmgqy2k,UgyIG6btdyXRn_nMYsd4AaABAg,@Rubybonez,UCkFGpBZJS2d2NXmHAl0Pujg,"If you cancelled dead boy detectives because of Gaiman, why would you make this. He wasn't even that involved in dbd but you cancelled it, meanwhile here he is one of the leading producers.  Do not give bad people platforms like this.",en,2025-06-20T19:44:50Z,2025-06-20 15:44:50,1,2,UgyIG6btdyXRn_nMYsd4AaABAg.AJb80uGMEImAJcF5XNRpPQ,@terrie-v6p,UC8p0RkdxTBJt-_u3tKw75zQ,The allegations were made public while this season was being made. There won't be any seasons after this.,en,2025-06-21T06:05:53Z,2025-06-21 02:05:53,1,2131931,47062,3066,"Tue, 16 Dec 2025 03:06:49 GMT"
