video_id,video_url,comment_id,comment_author_display,comment_author_channel_id,comment_content,comment_lang,comment_time_utc,comment_time_local,comment_like_count,comment_reply_count,reply_id,reply_author_display,reply_author_channel_id,reply_content,reply_lang,reply_time_utc,reply_time_local,reply_like_count,view_count,like_count,comment_count,crawl_time
Er18gmgqy2k,https://www.youtube.com/watch?v=Er18gmgqy2k,UgyIG6btdyXRn_nMYsd4AaABAg,@Rubybonez,UCkFGpBZJS2d2NXmHAl0Pujg,"If you cancelled dead boy detectives because of Gaiman, why would you make this. He wasn't even that involved in dbd but you cancelled it, meanwhile here he is one of the leading producers.  Do not give bad people platforms like this.",en,2025-06-20T19:44:50Z,2025-06-20 15:44:50,1,2,UgyIG6btdyXRn_nMYsd4AaABAg.AJb80uGMEImAJhAHnUyit1,@samanthadiaz2318,UChRswKroXB4to_ScS1UKSWA,"exactly! the news of Neil's monstrosity won't be as popular as the audience for ths show and people will keep watching and praising the story and him too 

he needs to be stripped of every project that ever brought him glory. take it out of his pocket and conpensate other hardworking crew of the production but they definitely shouldn't give him the platform anymore with this",en,2025-06-23T04:00:04Z,2025-06-23 00:00:04,1,2131931,47062,3066,"Tue, 16 Dec 2025 03:06:49 GMT"
Er18gmgqy2k,https://www.youtube.com/watch?v=Er18gmgqy2k,Ugwq9CVVyMgmsExFGCR4AaABAg,@TomasinoTR,UCS9rCDf3H6E4p89eo4Y45Zw,moree then 2 seasons please netflix 😭 FREE GAIMAN,NA,2025-06-20T18:24:24Z,2025-06-20 14:24:24,0,1,Ugwq9CVVyMgmsExFGCR4AaABAg.AJazogqp8PEAJl0TIB-b9e,@TomasinoTR,UCS9rCDf3H6E4p89eo4Y45Zw,​BuildinWingsWhat you mean?,af,2025-06-24T15:51:13Z,2025-06-24 11:51:13,0,2131931,47062,3066,"Tue, 16 Dec 2025 03:06:49 GMT"
Er18gmgqy2k,https://www.youtube.com/watch?v=Er18gmgqy2k,UgyjB4pkh338Mj4A0NR4AaABAg,@ashishindwar5958,UCie5GfQ6U3nmir82tw7YNKA,Gay af 🤢,da,2025-06-20T17:44:42Z,2025-06-20 13:44:42,0,2,UgyjB4pkh338Mj4A0NR4AaABAg.AJavGynbYzXAJazw9hTOC7,@terrie-v6p,UC8p0RkdxTBJt-_u3tKw75zQ,Take your homophobia somewhere else.,NA,2025-06-20T18:25:25Z,2025-06-20 14:25:25,1,2131931,47062,3066,"Tue, 16 Dec 2025 03:06:49 GMT"
Er18gmgqy2k,https://www.youtube.com/watch?v=Er18gmgqy2k,UgyjB4pkh338Mj4A0NR4AaABAg,@ashishindwar5958,UCie5GfQ6U3nmir82tw7YNKA,Gay af 🤢,da,2025-06-20T17:44:42Z,2025-06-20 13:44:42,0,2,UgyjB4pkh338Mj4A0NR4AaABAg.AJavGynbYzXAJbEb5qOAL9,@daudimasinde6280,UCmexnVSgBiIcHdvYobL_wpg,Clearly you’re from India. The asshole of the world. Place smells horrid.,en,2025-06-20T20:42:21Z,2025-06-20 16:42:21,0,2131931,47062,3066,"Tue, 16 Dec 2025 03:06:49 GMT"
Er18gmgqy2k,https://www.youtube.com/watch?v=Er18gmgqy2k,UgxDElVIbMMAm3AWbrN4AaABAg,@ricebeach5593,UCFvnOmNaz5ZTDnH4Ksz-GdQ,Continue this Netflix.,en,2025-06-20T17:00:56Z,2025-06-20 13:00:56,0,1,UgxDElVIbMMAm3AWbrN4AaABAg.AJaqGNrTvGWAJav6_WkTx8,@terrie-v6p,UC8p0RkdxTBJt-_u3tKw75zQ,"Google ""Neil Gaiman"" to find out why they won't.",en,2025-06-20T17:43:17Z,2025-06-20 13:43:17,1,2131931,47062,3066,"Tue, 16 Dec 2025 03:06:49 GMT"
Er18gmgqy2k,https://www.youtube.com/watch?v=Er18gmgqy2k,UgzJW2v-5meb7H2rFyB4AaABAg,@freddymabetha7946,UCCQ4f7lOMe2-kzupvTzUNFQ,still don't understand why they are cancelling this show,en,2025-06-20T13:23:06Z,2025-06-20 09:23:06,0,1,UgzJW2v-5meb7H2rFyB4AaABAg.AJaSKvWTAQwAJaTD1Jthif,@terrie-v6p,UC8p0RkdxTBJt-_u3tKw75zQ,"Google ""Neil Gaiman"".",NA,2025-06-20T13:30:45Z,2025-06-20 09:30:45,2,2131931,47062,3066,"Tue, 16 Dec 2025 03:06:49 GMT"
Er18gmgqy2k,https://www.youtube.com/watch?v=Er18gmgqy2k,UgwOmNRCIRazNZbXxVR4AaABAg,@ichiejasmine9688,UC8bCEVOiE7rqXHMViEhvHlw,I thought it was cancelled for a minute,en,2025-06-20T11:52:25Z,2025-06-20 07:52:25,0,1,UgwOmNRCIRazNZbXxVR4AaABAg.AJaHxiJSHAaAJaMtnW2zFv,@terrie-v6p,UC8p0RkdxTBJt-_u3tKw75zQ,"It is, this is the final season.",en,2025-06-20T12:35:34Z,2025-06-20 08:35:34,1,2131931,47062,3066,"Tue, 16 Dec 2025 03:06:49 GMT"
Er18gmgqy2k,https://www.youtube.com/watch?v=Er18gmgqy2k,UgzqgDpGreFgXcd46jx4AaABAg,@eddpalenciavanegas6739,UCUl9_fJcvP0WDR5bvBx9wqg,What happened to the androgenous Lust??? That was an amazing character!,en,2025-06-20T11:15:13Z,2025-06-20 07:15:13,0,1,UgzqgDpGreFgXcd46jx4AaABAg.AJaDhKdlujRAJaGwR2fFv3,@terrie-v6p,UC8p0RkdxTBJt-_u3tKw75zQ,"You mean Desire and they are in the trailer, they just don't say anything.",en,2025-06-20T11:43:30Z,2025-06-20 07:43:30,0,2131931,47062,3066,"Tue, 16 Dec 2025 03:06:49 GMT"
Er18gmgqy2k,https://www.youtube.com/watch?v=Er18gmgqy2k,Ugz83fR_CHsuBZOjxVd4AaABAg,@neoneve123,UC4Vd1RMTL_bPqEPGxR9RXhA,No desire or dispair?,es,2025-06-20T04:43:33Z,2025-06-20 00:43:33,0,1,Ugz83fR_CHsuBZOjxVd4AaABAg.AJ_WsiDsNC8AJ_X8Y2Gnjk,@terrie-v6p,UC8p0RkdxTBJt-_u3tKw75zQ,"They are both in the trailer, they just don't say anything.",en,2025-06-20T04:45:51Z,2025-06-20 00:45:51,0,2131931,47062,3066,"Tue, 16 Dec 2025 03:06:49 GMT"
Er18gmgqy2k,https://www.youtube.com/watch?v=Er18gmgqy2k,UgxepPoBZtC2pJiEh114AaABAg,@w1shbone184,UCdbt8AguhJRSE3cpT_tho0w,Dead boy detectives where 💔💔,NA,2025-06-20T04:21:28Z,2025-06-20 00:21:28,0,1,UgxepPoBZtC2pJiEh114AaABAg.AJ_ULxdsRuaAK2U4dqcODZ,@williammorahan4907,UC-00PrLy9i-ywmcVkVZHc6Q,Someday……,NA,2025-07-01T19:56:19Z,2025-07-01 15:56:19,0,2131931,47062,3066,"Tue, 16 Dec 2025 03:06:49 GMT"
Er18gmgqy2k,https://www.youtube.com/watch?v=Er18gmgqy2k,UgzAr3yHh5Slv9wXlkd4AaABAg,@basealchemist4396,UC_HXu6RrV9nlbI_8iuP-4oA,"I see DEI, I see unga bungas, straight to the downvote",en,2025-06-20T01:03:37Z,2025-06-19 21:03:37,0,1,UgzAr3yHh5Slv9wXlkd4AaABAg.AJ_7hoB0KvrAJ_KuZmVT_n,@terrie-v6p,UC8p0RkdxTBJt-_u3tKw75zQ,Take your ugly racism elsewhere.,en,2025-06-20T02:58:57Z,2025-06-19 22:58:57,0,2131931,47062,3066,"Tue, 16 Dec 2025 03:06:49 GMT"
Er18gmgqy2k,https://www.youtube.com/watch?v=Er18gmgqy2k,Ugx9DfVXGGvwdXRPfLl4AaABAg,@Luna-ii4mx,UCcp0Va_7suBb0OY17Xpz4tQ,Good shows either die a hero or live long enough to see themselves become the villain (GoT),en,2025-06-19T23:08:12Z,2025-06-19 19:08:12,1,1,Ugx9DfVXGGvwdXRPfLl4AaABAg.AJZvVUEm2JAAJ_1S9MdwZq,@charlotteclarke3393,UC-O8J-sNFtT7hZh__mbs-Kg,"It's good to bow out now, before things get messy with the whole Gaiman nightmare. I wish the actors and crew every success in the future.",en,2025-06-20T00:08:55Z,2025-06-19 20:08:55,1,2131931,47062,3066,"Tue, 16 Dec 2025 03:06:49 GMT"
Er18gmgqy2k,https://www.youtube.com/watch?v=Er18gmgqy2k,UgxkayiWJvlv8cwJ4tZ4AaABAg,@FeministVayne,UC_uvAKt3ZHJOv5hWQdhzKPw,"The Sandman series doesn’t make much sense because the main character, Dream, has supposedly existed since the beginning of time, yet he still doesn’t understand people lmao",en,2025-06-19T21:30:24Z,2025-06-19 17:30:24,1,1,UgxkayiWJvlv8cwJ4tZ4AaABAg.AJZkJ8vOaoDAJZpgC_mKgc,@terrie-v6p,UC8p0RkdxTBJt-_u3tKw75zQ,You can't understand what you actively avoid.,en,2025-06-19T22:17:22Z,2025-06-19 18:17:22,0,2131931,47062,3066,"Tue, 16 Dec 2025 03:06:49 GMT"
Er18gmgqy2k,https://www.youtube.com/watch?v=Er18gmgqy2k,UgwWdYFxAcJ1TwUSGMR4AaABAg,@sarona2887,UCoZIdYSFfXHaqP5LYgeHE3A,I thought Netflix cancelled this?,en,2025-06-19T18:24:00Z,2025-06-19 14:24:00,0,3,UgwWdYFxAcJ1TwUSGMR4AaABAg.AJZPywaACVIAJZavaUFRUe,@terrie-v6p,UC8p0RkdxTBJt-_u3tKw75zQ,They did -- this is the final season.,en,2025-06-19T20:08:24Z,2025-06-19 16:08:24,0,2131931,47062,3066,"Tue, 16 Dec 2025 03:06:49 GMT"
Er18gmgqy2k,https://www.youtube.com/watch?v=Er18gmgqy2k,UgwWdYFxAcJ1TwUSGMR4AaABAg,@sarona2887,UCoZIdYSFfXHaqP5LYgeHE3A,I thought Netflix cancelled this?,en,2025-06-19T18:24:00Z,2025-06-19 14:24:00,0,3,UgwWdYFxAcJ1TwUSGMR4AaABAg.AJZPywaACVIAJZk-jniyGi,@sarona2887,UCoZIdYSFfXHaqP5LYgeHE3A,"@terrie-v6poh, I’ve no idea why they’ve done that this show is well liked",en,2025-06-19T21:27:45Z,2025-06-19 17:27:45,0,2131931,47062,3066,"Tue, 16 Dec 2025 03:06:49 GMT"
Er18gmgqy2k,https://www.youtube.com/watch?v=Er18gmgqy2k,UgwWdYFxAcJ1TwUSGMR4AaABAg,@sarona2887,UCoZIdYSFfXHaqP5LYgeHE3A,I thought Netflix cancelled this?,en,2025-06-19T18:24:00Z,2025-06-19 14:24:00,0,3,UgwWdYFxAcJ1TwUSGMR4AaABAg.AJZPywaACVIAJZoEIJomxh,@terrie-v6p,UC8p0RkdxTBJt-_u3tKw75zQ,"@sarona2887 Google ""Neil Gaiman.""",NA,2025-06-19T22:04:41Z,2025-06-19 18:04:41,0,2131931,47062,3066,"Tue, 16 Dec 2025 03:06:49 GMT"
Er18gmgqy2k,https://www.youtube.com/watch?v=Er18gmgqy2k,UgwyCV4Qe43Si6nV40h4AaABAg,@Farhankhan_the1,UCl4ARD1_hd3MncoYokeiMUg,Guys any idea on why its only 2 seasons?,en,2025-06-19T16:48:59Z,2025-06-19 12:48:59,1,3,UgwyCV4Qe43Si6nV40h4AaABAg.AJZF62fP74XAJZGI2xj2MF,@patrikmacek121,UCocAfdjoOs5W7I6nPzOPK-A,"Season one adapted 2.5 arcs of 10 of the Sandman comics, but creators of the show wanted to focus mainly on Dream of the Endless as the main character and he does appear in many comic issues only as a cameo for one-off stories. So they cut on the board non essantial stuff and they will adapt the rest of the story in this season. I assume the main reason is the budget, season 1 was one of the most expensive projects that Netflix produced. Many people say that reason why there will be only 2 seasons is because of the allegations of Neil Gaiman, but those first appeared in July 2024 and filming of season 2 finished in August 2024, so the story structure was finished atleast year before Gaiman's allegations. Maybe if the season 1 was more succesful, the show could have gone for more seasons with stratching of the source material, but of that would happen, then Sandman would have been likely canceled for the allegations of it's creator. Season 2 will finish the overall story based on the source material.",en,2025-06-19T16:59:22Z,2025-06-19 12:59:22,0,2131931,47062,3066,"Tue, 16 Dec 2025 03:06:49 GMT"
Er18gmgqy2k,https://www.youtube.com/watch?v=Er18gmgqy2k,UgwyCV4Qe43Si6nV40h4AaABAg,@Farhankhan_the1,UCl4ARD1_hd3MncoYokeiMUg,Guys any idea on why its only 2 seasons?,en,2025-06-19T16:48:59Z,2025-06-19 12:48:59,1,3,UgwyCV4Qe43Si6nV40h4AaABAg.AJZF62fP74XAJZHdrah96D,@Farhankhan_the1,UCl4ARD1_hd3MncoYokeiMUg,"​@patrikmacek121oh so lack of much material and budget issue, hopefully 
 They go out with a bang.",en,2025-06-19T17:11:13Z,2025-06-19 13:11:13,0,2131931,47062,3066,"Tue, 16 Dec 2025 03:06:49 GMT"
Er18gmgqy2k,https://www.youtube.com/watch?v=Er18gmgqy2k,UgwyCV4Qe43Si6nV40h4AaABAg,@Farhankhan_the1,UCl4ARD1_hd3MncoYokeiMUg,Guys any idea on why its only 2 seasons?,en,2025-06-19T16:48:59Z,2025-06-19 12:48:59,1,3,UgwyCV4Qe43Si6nV40h4AaABAg.AJZF62fP74XAJZRmEGgSAe,@patrikmacek121,UCocAfdjoOs5W7I6nPzOPK-A,"@Farhankhan_the1 well, not the lack of material, rather a different viewpoint how to adapt the comics to fit the streaming mechanism.",en,2025-06-19T18:39:44Z,2025-06-19 14:39:44,0,2131931,47062,3066,"Tue, 16 Dec 2025 03:06:49 GMT"
Er18gmgqy2k,https://www.youtube.com/watch?v=Er18gmgqy2k,UgwAwTPwuDjKMwqkRd14AaABAg,@nothinghereligma3363,UCZyUPODUiENytakeuGXraaA,Volume 1 is gonna have how many episodes?,en,2025-06-19T16:29:10Z,2025-06-19 12:29:10,0,2,UgwAwTPwuDjKMwqkRd14AaABAg.AJZCpwsmNWSAJZNx2MoKVj,@terrie-v6p,UC8p0RkdxTBJt-_u3tKw75zQ,"6 in Vol 1, 5 in Vol 2, then one bonus Death-centric episode a week after 2 drops.",en,2025-06-19T18:06:16Z,2025-06-19 14:06:16,1,2131931,47062,3066,"Tue, 16 Dec 2025 03:06:49 GMT"
Er18gmgqy2k,https://www.youtube.com/watch?v=Er18gmgqy2k,UgwAwTPwuDjKMwqkRd14AaABAg,@nothinghereligma3363,UCZyUPODUiENytakeuGXraaA,Volume 1 is gonna have how many episodes?,en,2025-06-19T16:29:10Z,2025-06-19 12:29:10,0,2,UgwAwTPwuDjKMwqkRd14AaABAg.AJZCpwsmNWSAJZbvzUqgtL,@nothinghereligma3363,UCZyUPODUiENytakeuGXraaA,@terrie-v6pthank you and omg ❤❤❤,en,2025-06-19T20:17:11Z,2025-06-19 16:17:11,0,2131931,47062,3066,"Tue, 16 Dec 2025 03:06:49 GMT"
Er18gmgqy2k,https://www.youtube.com/watch?v=Er18gmgqy2k,UgwAMq4XORl8fV-Lbb54AaABAg,@OrchidPurple420,UC2iV00G_U9qJljYD6_ooFDw,Damn~ double anyone know that old dude with the small glasses,en,2025-06-19T13:48:35Z,2025-06-19 09:48:35,0,1,UgwAMq4XORl8fV-Lbb54AaABAg.AJYvSlRnXsZAJZ19Th2YM_,@terrie-v6p,UC8p0RkdxTBJt-_u3tKw75zQ,You mean Stephen Fry?,en,2025-06-19T14:47:07Z,2025-06-19 10:47:07,0,2131931,47062,3066,"Tue, 16 Dec 2025 03:06:49 GMT"
Er18gmgqy2k,https://www.youtube.com/watch?v=Er18gmgqy2k,Ugxyo96r5W0KwqwdrNx4AaABAg,@anaellesia7818,UCZl0NrLeXRodFL9CsquEcQA,"So many new actors that I really admire, and so much potential, for it all to be wasted by the despicable actions of one man. As a fan of the comics, I couldn't have been more disappointed when I found out about this.",en,2025-06-19T13:35:53Z,2025-06-19 09:35:53,117,4,Ugxyo96r5W0KwqwdrNx4AaABAg.AJYu-k_OW4CAJpOvyBjPJ4,@kizzykhajiit,UC0NRtHlKrgD6LzifogvJzrA,"Aye.
An' now I'm debatin' inwardly, the morality & ethics of if i should try watch it, or no.
Some elements of the trailer, an' plot, make me feel queezey, wi' whits come te light, recently. 
Now I'm aware, I feela  sense of rotted, an' spoilt, where before, I was as excited as a wee bairn, fir series 2.",en,2025-06-26T08:41:57Z,2025-06-26 04:41:57,1,2131931,47062,3066,"Tue, 16 Dec 2025 03:06:49 GMT"
Er18gmgqy2k,https://www.youtube.com/watch?v=Er18gmgqy2k,Ugxyo96r5W0KwqwdrNx4AaABAg,@anaellesia7818,UCZl0NrLeXRodFL9CsquEcQA,"So many new actors that I really admire, and so much potential, for it all to be wasted by the despicable actions of one man. As a fan of the comics, I couldn't have been more disappointed when I found out about this.",en,2025-06-19T13:35:53Z,2025-06-19 09:35:53,117,4,Ugxyo96r5W0KwqwdrNx4AaABAg.AJYu-k_OW4CAJyYjw_ML4j,@napoleonsolo5929,UC1fdsd1Ip-ZVHHctSMjb-6Q,"I won't let that jackass deprive me of the chance to see more Gwendoline Christie,",en,2025-06-29T22:00:51Z,2025-06-29 18:00:51,0,2131931,47062,3066,"Tue, 16 Dec 2025 03:06:49 GMT"
Er18gmgqy2k,https://www.youtube.com/watch?v=Er18gmgqy2k,Ugxyo96r5W0KwqwdrNx4AaABAg,@anaellesia7818,UCZl0NrLeXRodFL9CsquEcQA,"So many new actors that I really admire, and so much potential, for it all to be wasted by the despicable actions of one man. As a fan of the comics, I couldn't have been more disappointed when I found out about this.",en,2025-06-19T13:35:53Z,2025-06-19 09:35:53,117,4,Ugxyo96r5W0KwqwdrNx4AaABAg.AJYu-k_OW4CAKAW_wvtTaf,@zee.voice5141,UCCi4G-t4vtQJwwKzfB9FWGw,​@kizzykhajiit Please speak good English,NA,2025-07-04T22:52:08Z,2025-07-04 18:52:08,0,2131931,47062,3066,"Tue, 16 Dec 2025 03:06:49 GMT"
Er18gmgqy2k,https://www.youtube.com/watch?v=Er18gmgqy2k,Ugxyo96r5W0KwqwdrNx4AaABAg,@anaellesia7818,UCZl0NrLeXRodFL9CsquEcQA,"So many new actors that I really admire, and so much potential, for it all to be wasted by the despicable actions of one man. As a fan of the comics, I couldn't have been more disappointed when I found out about this.",en,2025-06-19T13:35:53Z,2025-06-19 09:35:53,117,4,Ugxyo96r5W0KwqwdrNx4AaABAg.AJYu-k_OW4CALUDowHzHlz,@sXsKidd,UCy1d6DYDfZECpDhXSCZOJ0A,Just separate the art from the artist holy shit. it's not that hard to do.,en,2025-08-06T11:04:22Z,2025-08-06 07:04:22,0,2131931,47062,3066,"Tue, 16 Dec 2025 03:06:49 GMT"
Er18gmgqy2k,https://www.youtube.com/watch?v=Er18gmgqy2k,UgyckCuMnTeDuTmUmsd4AaABAg,@Syalul,UCj6yDf78KB3-hH51YdqeWPQ,Took ya long enough,NA,2025-06-19T13:09:57Z,2025-06-19 09:09:57,0,2,UgyckCuMnTeDuTmUmsd4AaABAg.AJYr1kwv8dGAJYrVtUIs2e,@ShedrickMoten,UC6dnRV1cd0XKohuCNJq5ZYA,Am I the only one thinking about Marvel's sandman right now? 😂😂😂,en,2025-06-19T13:14:04Z,2025-06-19 09:14:04,0,2131931,47062,3066,"Tue, 16 Dec 2025 03:06:49 GMT"
Er18gmgqy2k,https://www.youtube.com/watch?v=Er18gmgqy2k,UgyckCuMnTeDuTmUmsd4AaABAg,@Syalul,UCj6yDf78KB3-hH51YdqeWPQ,Took ya long enough,NA,2025-06-19T13:09:57Z,2025-06-19 09:09:57,0,2,UgyckCuMnTeDuTmUmsd4AaABAg.AJYr1kwv8dGAJZ1EMKfO4k,@terrie-v6p,UC8p0RkdxTBJt-_u3tKw75zQ,@ShedrickMoten Yes. The rest of us know this is DC's Sandman.,en,2025-06-19T14:47:47Z,2025-06-19 10:47:47,0,2131931,47062,3066,"Tue, 16 Dec 2025 03:06:49 GMT"
Er18gmgqy2k,https://www.youtube.com/watch?v=Er18gmgqy2k,UgyMxxJR9QoWN09k3GN4AaABAg,@marsoblivi0n945,UCB2oOWZyoFGwkIzhWcuC86A,Who cares what Neil gaiman may have done? He’s not in jail. We waited a decade for this. Tired of cancel culture BS.,en,2025-06-19T12:22:27Z,2025-06-19 08:22:27,1,1,UgyMxxJR9QoWN09k3GN4AaABAg.AJYlatRScNAAJZ7yTVsIW6,@terrie-v6p,UC8p0RkdxTBJt-_u3tKw75zQ,"If you think multiple accusations of SA aren't a big deal, you're part of the problem.",en,2025-06-19T15:46:39Z,2025-06-19 11:46:39,4,2131931,47062,3066,"Tue, 16 Dec 2025 03:06:49 GMT"
Er18gmgqy2k,https://www.youtube.com/watch?v=Er18gmgqy2k,Ugzj0xfdxap0tPPugTp4AaABAg,@beccalangner3257,UCeGyXZbHVAJXwYj0xpNrMJw,Finally!!!!!! Wish it was more than 1 season this shows so go. Maybe if they didnt take 5 years between seasons people wouldnt lose interest,en,2025-06-19T09:09:00Z,2025-06-19 05:09:00,0,1,Ugzj0xfdxap0tPPugTp4AaABAg.AJYQT-ctkTUAJZbZft-c6d,@terrie-v6p,UC8p0RkdxTBJt-_u3tKw75zQ,"Google ""Neil Gaiman"".",NA,2025-06-19T20:14:00Z,2025-06-19 16:14:00,1,2131931,47062,3066,"Tue, 16 Dec 2025 03:06:49 GMT"
Er18gmgqy2k,https://www.youtube.com/watch?v=Er18gmgqy2k,UgzXUP8_t8-Ykpl2peV4AaABAg,@santoshganjave9687,UC84rh66VGE-VqlxpnO_TAUg,To much diversity killing the show😢,en,2025-06-19T08:05:22Z,2025-06-19 04:05:22,0,4,UgzXUP8_t8-Ykpl2peV4AaABAg.AJYJAzBPWzZAJYsijrY_ex,@vexto4592,UC5CtpFtMAgLYwMGlKPNCdzQ,"it lacks diversity, they're all British ",NA,2025-06-19T13:24:41Z,2025-06-19 09:24:41,0,2131931,47062,3066,"Tue, 16 Dec 2025 03:06:49 GMT"
Er18gmgqy2k,https://www.youtube.com/watch?v=Er18gmgqy2k,UgzXUP8_t8-Ykpl2peV4AaABAg,@santoshganjave9687,UC84rh66VGE-VqlxpnO_TAUg,To much diversity killing the show😢,en,2025-06-19T08:05:22Z,2025-06-19 04:05:22,0,4,UgzXUP8_t8-Ykpl2peV4AaABAg.AJYJAzBPWzZAJYtlxzDZJT,@santoshganjave9687,UC84rh66VGE-VqlxpnO_TAUg,Unnecessary black actor casting not needed​@vexto4592,en,2025-06-19T13:33:52Z,2025-06-19 09:33:52,0,2131931,47062,3066,"Tue, 16 Dec 2025 03:06:49 GMT"
Er18gmgqy2k,https://www.youtube.com/watch?v=Er18gmgqy2k,UgzXUP8_t8-Ykpl2peV4AaABAg,@santoshganjave9687,UC84rh66VGE-VqlxpnO_TAUg,To much diversity killing the show😢,en,2025-06-19T08:05:22Z,2025-06-19 04:05:22,0,4,UgzXUP8_t8-Ykpl2peV4AaABAg.AJYJAzBPWzZAJZ1UYgmaOQ,@terrie-v6p,UC8p0RkdxTBJt-_u3tKw75zQ,"@santoshganjave9687 The characters' skin color isn't part of the narrative, so they can be any color.",en,2025-06-19T14:50:00Z,2025-06-19 10:50:00,0,2131931,47062,3066,"Tue, 16 Dec 2025 03:06:49 GMT"
Er18gmgqy2k,https://www.youtube.com/watch?v=Er18gmgqy2k,UgzXUP8_t8-Ykpl2peV4AaABAg,@santoshganjave9687,UC84rh66VGE-VqlxpnO_TAUg,To much diversity killing the show😢,en,2025-06-19T08:05:22Z,2025-06-19 04:05:22,0,4,UgzXUP8_t8-Ykpl2peV4AaABAg.AJYJAzBPWzZAJlFKa9zccL,@santoshganjave9687,UC84rh66VGE-VqlxpnO_TAUg,"And that's why I am saying stick to originality , when they race swap white man to black or brown we didn't like it , the DEI crap only exist in America asian people don't want diversity​BuildinWings",en,2025-06-24T18:01:06Z,2025-06-24 14:01:06,0,2131931,47062,3066,"Tue, 16 Dec 2025 03:06:49 GMT"
Er18gmgqy2k,https://www.youtube.com/watch?v=Er18gmgqy2k,UgyonW2hO55kUQMdxGR4AaABAg,@darkwhyt,UCNWjvrKvJoAojMi0JZHHAgg,"When they say volume one and volume two, are they referring to just episodes, or am I missing something?",en,2025-06-19T06:08:19Z,2025-06-19 02:08:19,0,1,UgyonW2hO55kUQMdxGR4AaABAg.AJY5mfQjTcsAJZ1_2J-H4J,@terrie-v6p,UC8p0RkdxTBJt-_u3tKw75zQ,"They mean two parts -- the season has been split in half. Part 1 has 6 episodes, part 2 has 5 episodes, then there is another bonus episode a week after that.",en,2025-06-19T14:50:45Z,2025-06-19 10:50:45,0,2131931,47062,3066,"Tue, 16 Dec 2025 03:06:49 GMT"
Er18gmgqy2k,https://www.youtube.com/watch?v=Er18gmgqy2k,Ugx7baE_pPbfxX9-hGV4AaABAg,@aviendha009,UC6cvJrPwZrCrhc7kaM6mjrg,"I love The Sandman. I'm so happy there is another season. Hopefully, there will be more...",en,2025-06-19T03:12:56Z,2025-06-18 23:12:56,2,1,Ugx7baE_pPbfxX9-hGV4AaABAg.AJXmi6Pv-CfAK2UHbZMuM4,@williammorahan4907,UC-00PrLy9i-ywmcVkVZHc6Q,Someday my friend…..someday.,ru-Latn,2025-07-01T19:58:06Z,2025-07-01 15:58:06,0,2131931,47062,3066,"Tue, 16 Dec 2025 03:06:49 GMT"
Er18gmgqy2k,https://www.youtube.com/watch?v=Er18gmgqy2k,Ugx-trwdtutoJsoeBHV4AaABAg,@Skyturtle-0,UCgRPD6rhgcL93R4J9not3pg,What a shame that Netflix canceled this 5-7 seasons early. Wtf,en,2025-06-19T01:23:56Z,2025-06-18 21:23:56,0,1,Ugx-trwdtutoJsoeBHV4AaABAg.AJXaEmSjZ79AJlTtc1dz6y,@Skyturtle-0,UCgRPD6rhgcL93R4J9not3pg,"BuildinWingsyes. I’m aware. I’m a huge fan.

So does that mean that any works of his should never be adapted again? That messed up.

Edit: should I not let my kids watch Coraline?",en,2025-06-24T20:08:21Z,2025-06-24 16:08:21,0,2131931,47062,3066,"Tue, 16 Dec 2025 03:06:49 GMT"
Er18gmgqy2k,https://www.youtube.com/watch?v=Er18gmgqy2k,UgzIlZc_DQYj9gUSQL54AaABAg,@shepherdofthewest4216,UCdvA_bIB58GA_wdz4NlLYog,I am so sick and tired of the gayness.,en,2025-06-18T22:54:00Z,2025-06-18 18:54:00,0,1,UgzIlZc_DQYj9gUSQL54AaABAg.AJXK4g8JVqUAJXTciDg4mo,@terrie-v6p,UC8p0RkdxTBJt-_u3tKw75zQ,Either you didn't read the comics or you didn't pay attention.,en,2025-06-19T00:17:26Z,2025-06-18 20:17:26,1,2131931,47062,3066,"Tue, 16 Dec 2025 03:06:49 GMT"
Er18gmgqy2k,https://www.youtube.com/watch?v=Er18gmgqy2k,Ugx-Gttm6xu9cX4ljR54AaABAg,@GW2KillerBEE,UCoLX-KbcYweT9T3KC-gAXJg,Just keep the woke shit out please and stick to good story writing... no one needs your political bias injected into a fantasy tv show right or left....,en,2025-06-18T22:23:55Z,2025-06-18 18:23:55,0,4,Ugx-Gttm6xu9cX4ljR54AaABAg.AJXGdFHdXz_AJXTgyyPqUW,@terrie-v6p,UC8p0RkdxTBJt-_u3tKw75zQ,Either you never read the original comics or you didn't pay attention.,en,2025-06-19T00:18:01Z,2025-06-18 20:18:01,2,2131931,47062,3066,"Tue, 16 Dec 2025 03:06:49 GMT"
Er18gmgqy2k,https://www.youtube.com/watch?v=Er18gmgqy2k,Ugx-Gttm6xu9cX4ljR54AaABAg,@GW2KillerBEE,UCoLX-KbcYweT9T3KC-gAXJg,Just keep the woke shit out please and stick to good story writing... no one needs your political bias injected into a fantasy tv show right or left....,en,2025-06-18T22:23:55Z,2025-06-18 18:23:55,0,4,Ugx-Gttm6xu9cX4ljR54AaABAg.AJXGdFHdXz_AJXWCL9boFE,@GW2KillerBEE,UCoLX-KbcYweT9T3KC-gAXJg,"@terrie-v6p i did both, you have 0 clue what you are talking about.",en,2025-06-19T00:39:55Z,2025-06-18 20:39:55,0,2131931,47062,3066,"Tue, 16 Dec 2025 03:06:49 GMT"
Er18gmgqy2k,https://www.youtube.com/watch?v=Er18gmgqy2k,Ugx-Gttm6xu9cX4ljR54AaABAg,@GW2KillerBEE,UCoLX-KbcYweT9T3KC-gAXJg,Just keep the woke shit out please and stick to good story writing... no one needs your political bias injected into a fantasy tv show right or left....,en,2025-06-18T22:23:55Z,2025-06-18 18:23:55,0,4,Ugx-Gttm6xu9cX4ljR54AaABAg.AJXGdFHdXz_AJXX2LzLGmw,@terrie-v6p,UC8p0RkdxTBJt-_u3tKw75zQ,"@GW2KillerBEE The comics had minorities and strong women, including a trans woman. They were ""woke.""",en,2025-06-19T00:47:17Z,2025-06-18 20:47:17,2,2131931,47062,3066,"Tue, 16 Dec 2025 03:06:49 GMT"
Er18gmgqy2k,https://www.youtube.com/watch?v=Er18gmgqy2k,Ugx-Gttm6xu9cX4ljR54AaABAg,@GW2KillerBEE,UCoLX-KbcYweT9T3KC-gAXJg,Just keep the woke shit out please and stick to good story writing... no one needs your political bias injected into a fantasy tv show right or left....,en,2025-06-18T22:23:55Z,2025-06-18 18:23:55,0,4,Ugx-Gttm6xu9cX4ljR54AaABAg.AJXGdFHdXz_AJXa2vvbrQL,@GW2KillerBEE,UCoLX-KbcYweT9T3KC-gAXJg,"@terrie-v6p You are purposely misunderstanding what I said...typical online person that never talks to real people anymore... I don't care that a person is trans black white Asian gay lesbian etc. I care that it get shoved down my throat every 5 mins that WASN'T in the comics....

Think of it like this you can have moments in a show where they tell you there trans or w/e but having it brought up every 5 mins in a show is political.... and nothing to do with good writing...

You dont know me... I could be trans or gay.
Dont assume things.
Maybe go touch some grass. 😘",en,2025-06-19T01:22:19Z,2025-06-18 21:22:19,0,2131931,47062,3066,"Tue, 16 Dec 2025 03:06:49 GMT"
Er18gmgqy2k,https://www.youtube.com/watch?v=Er18gmgqy2k,UgyWgDu02xUuKnsuxm94AaABAg,@Cernl.1,UCjvfar4QTdhGCAedS5cskjQ,Demonic movie 😢😢😢,NA,2025-06-18T20:51:32Z,2025-06-18 16:51:32,0,1,UgyWgDu02xUuKnsuxm94AaABAg.AJX63fwZjqMAJX6JwnY7Y_,@terrie-v6p,UC8p0RkdxTBJt-_u3tKw75zQ,"It's a show, not a movie, and it's fiction.",en,2025-06-18T20:53:46Z,2025-06-18 16:53:46,3,2131931,47062,3066,"Tue, 16 Dec 2025 03:06:49 GMT"
Er18gmgqy2k,https://www.youtube.com/watch?v=Er18gmgqy2k,UgyDiErtV2kSaDFqTrt4AaABAg,@yazar747,UC0-Rar4LKpn7Q1ZA8VSG8jw,WHAT DO U MEAN FINAL ARE YOU GUYS JOKE?,NA,2025-06-18T20:34:01Z,2025-06-18 16:34:01,0,1,UgyDiErtV2kSaDFqTrt4AaABAg.AJX43KYCLUaAJX6N5llMpC,@terrie-v6p,UC8p0RkdxTBJt-_u3tKw75zQ,"Google ""Neil Gaiman"" and you'll see why this is the final season.",en,2025-06-18T20:54:11Z,2025-06-18 16:54:11,2,2131931,47062,3066,"Tue, 16 Dec 2025 03:06:49 GMT"
Er18gmgqy2k,https://www.youtube.com/watch?v=Er18gmgqy2k,UgwRSL6OUyA6mm24Fal4AaABAg,@Ohohoyeah,UChSaLpMed9ta5bUaDDnbwjQ,I think I might be a real life Rose Walker/Dream Vortex  from season 1 because the same things happen to me as well,en,2025-06-18T18:09:43Z,2025-06-18 14:09:43,1,1,UgwRSL6OUyA6mm24Fal4AaABAg.AJWoYUnvkRXAJWshmUnlJ_,@JuliaColeman-w3u,UCHT5UoaHi7H3ZTp-DxUK_NA,Facts,en,2025-06-18T18:46:05Z,2025-06-18 14:46:05,0,2131931,47062,3066,"Tue, 16 Dec 2025 03:06:49 GMT"
Er18gmgqy2k,https://www.youtube.com/watch?v=Er18gmgqy2k,UgwflSZCyTr0hQWF8BV4AaABAg,@MrRuDeDoG1979,UCyq-KX2xwhx7kPLbBoY-lgw,"They didn’t show James Charles, I mean “Desire” even once 😂",en,2025-06-18T18:04:26Z,2025-06-18 14:04:26,1,2,UgwflSZCyTr0hQWF8BV4AaABAg.AJWnwmafvbeAJX0-SAmWyt,@terrie-v6p,UC8p0RkdxTBJt-_u3tKw75zQ,"Desire is in the trailer, watch it again.",fy,2025-06-18T19:58:32Z,2025-06-18 15:58:32,0,2131931,47062,3066,"Tue, 16 Dec 2025 03:06:49 GMT"
