video_id,video_title,channel_id,channel_title,video_published_at,reply_id,reply_parent_comment_id,reply_author_display,reply_author_channel_id,reply_text,reply_lang,reply_published_utc,reply_published_local,reply_like_count
Er18gmgqy2k,The Sandman: Season 2 | Official Trailer | Netflix,UCWOA1ZGywLbqmigxE4Qlvuw,Netflix,2025-06-17T13:00:02Z,Ugz83fR_CHsuBZOjxVd4AaABAg.AJ_WsiDsNC8AJ_X8Y2Gnjk,Ugz83fR_CHsuBZOjxVd4AaABAg,@terrie-v6p,UC8p0RkdxTBJt-_u3tKw75zQ,"They are both in the trailer, they just don't say anything.",en,2025-06-20T04:45:51Z,2025-06-20 00:45:51,0
Er18gmgqy2k,The Sandman: Season 2 | Official Trailer | Netflix,UCWOA1ZGywLbqmigxE4Qlvuw,Netflix,2025-06-17T13:00:02Z,UgxepPoBZtC2pJiEh114AaABAg.AJ_ULxdsRuaAK2U4dqcODZ,UgxepPoBZtC2pJiEh114AaABAg,@williammorahan4907,UC-00PrLy9i-ywmcVkVZHc6Q,Someday……,NA,2025-07-01T19:56:19Z,2025-07-01 15:56:19,0
Er18gmgqy2k,The Sandman: Season 2 | Official Trailer | Netflix,UCWOA1ZGywLbqmigxE4Qlvuw,Netflix,2025-06-17T13:00:02Z,UgzAr3yHh5Slv9wXlkd4AaABAg.AJ_7hoB0KvrAJ_KuZmVT_n,UgzAr3yHh5Slv9wXlkd4AaABAg,@terrie-v6p,UC8p0RkdxTBJt-_u3tKw75zQ,Take your ugly racism elsewhere.,en,2025-06-20T02:58:57Z,2025-06-19 22:58:57,0
Er18gmgqy2k,The Sandman: Season 2 | Official Trailer | Netflix,UCWOA1ZGywLbqmigxE4Qlvuw,Netflix,2025-06-17T13:00:02Z,Ugx9DfVXGGvwdXRPfLl4AaABAg.AJZvVUEm2JAAJ_1S9MdwZq,Ugx9DfVXGGvwdXRPfLl4AaABAg,@charlotteclarke3393,UC-O8J-sNFtT7hZh__mbs-Kg,"It's good to bow out now, before things get messy with the whole Gaiman nightmare. I wish the actors and crew every success in the future.",en,2025-06-20T00:08:55Z,2025-06-19 20:08:55,1
Er18gmgqy2k,The Sandman: Season 2 | Official Trailer | Netflix,UCWOA1ZGywLbqmigxE4Qlvuw,Netflix,2025-06-17T13:00:02Z,UgxkayiWJvlv8cwJ4tZ4AaABAg.AJZkJ8vOaoDAJZpgC_mKgc,UgxkayiWJvlv8cwJ4tZ4AaABAg,@terrie-v6p,UC8p0RkdxTBJt-_u3tKw75zQ,You can't understand what you actively avoid.,en,2025-06-19T22:17:22Z,2025-06-19 18:17:22,0
Er18gmgqy2k,The Sandman: Season 2 | Official Trailer | Netflix,UCWOA1ZGywLbqmigxE4Qlvuw,Netflix,2025-06-17T13:00:02Z,UgwWdYFxAcJ1TwUSGMR4AaABAg.AJZPywaACVIAJZavaUFRUe,UgwWdYFxAcJ1TwUSGMR4AaABAg,@terrie-v6p,UC8p0RkdxTBJt-_u3tKw75zQ,They did -- this is the final season.,en,2025-06-19T20:08:24Z,2025-06-19 16:08:24,0
Er18gmgqy2k,The Sandman: Season 2 | Official Trailer | Netflix,UCWOA1ZGywLbqmigxE4Qlvuw,Netflix,2025-06-17T13:00:02Z,UgwWdYFxAcJ1TwUSGMR4AaABAg.AJZPywaACVIAJZk-jniyGi,UgwWdYFxAcJ1TwUSGMR4AaABAg,@sarona2887,UCoZIdYSFfXHaqP5LYgeHE3A,"@terrie-v6poh, I’ve no idea why they’ve done that this show is well liked",en,2025-06-19T21:27:45Z,2025-06-19 17:27:45,0
Er18gmgqy2k,The Sandman: Season 2 | Official Trailer | Netflix,UCWOA1ZGywLbqmigxE4Qlvuw,Netflix,2025-06-17T13:00:02Z,UgwWdYFxAcJ1TwUSGMR4AaABAg.AJZPywaACVIAJZoEIJomxh,UgwWdYFxAcJ1TwUSGMR4AaABAg,@terrie-v6p,UC8p0RkdxTBJt-_u3tKw75zQ,"@sarona2887 Google ""Neil Gaiman.""",NA,2025-06-19T22:04:41Z,2025-06-19 18:04:41,0
Er18gmgqy2k,The Sandman: Season 2 | Official Trailer | Netflix,UCWOA1ZGywLbqmigxE4Qlvuw,Netflix,2025-06-17T13:00:02Z,UgwyCV4Qe43Si6nV40h4AaABAg.AJZF62fP74XAJZGI2xj2MF,UgwyCV4Qe43Si6nV40h4AaABAg,@patrikmacek121,UCocAfdjoOs5W7I6nPzOPK-A,"Season one adapted 2.5 arcs of 10 of the Sandman comics, but creators of the show wanted to focus mainly on Dream of the Endless as the main character and he does appear in many comic issues only as a cameo for one-off stories. So they cut on the board non essantial stuff and they will adapt the rest of the story in this season. I assume the main reason is the budget, season 1 was one of the most expensive projects that Netflix produced. Many people say that reason why there will be only 2 seasons is because of the allegations of Neil Gaiman, but those first appeared in July 2024 and filming of season 2 finished in August 2024, so the story structure was finished atleast year before Gaiman's allegations. Maybe if the season 1 was more succesful, the show could have gone for more seasons with stratching of the source material, but of that would happen, then Sandman would have been likely canceled for the allegations of it's creator. Season 2 will finish the overall story based on the source material.",en,2025-06-19T16:59:22Z,2025-06-19 12:59:22,0
Er18gmgqy2k,The Sandman: Season 2 | Official Trailer | Netflix,UCWOA1ZGywLbqmigxE4Qlvuw,Netflix,2025-06-17T13:00:02Z,UgwyCV4Qe43Si6nV40h4AaABAg.AJZF62fP74XAJZHdrah96D,UgwyCV4Qe43Si6nV40h4AaABAg,@Farhankhan_the1,UCl4ARD1_hd3MncoYokeiMUg,"​@patrikmacek121oh so lack of much material and budget issue, hopefully 
 They go out with a bang.",en,2025-06-19T17:11:13Z,2025-06-19 13:11:13,0
Er18gmgqy2k,The Sandman: Season 2 | Official Trailer | Netflix,UCWOA1ZGywLbqmigxE4Qlvuw,Netflix,2025-06-17T13:00:02Z,UgwyCV4Qe43Si6nV40h4AaABAg.AJZF62fP74XAJZRmEGgSAe,UgwyCV4Qe43Si6nV40h4AaABAg,@patrikmacek121,UCocAfdjoOs5W7I6nPzOPK-A,"@Farhankhan_the1 well, not the lack of material, rather a different viewpoint how to adapt the comics to fit the streaming mechanism.",en,2025-06-19T18:39:44Z,2025-06-19 14:39:44,0
Er18gmgqy2k,The Sandman: Season 2 | Official Trailer | Netflix,UCWOA1ZGywLbqmigxE4Qlvuw,Netflix,2025-06-17T13:00:02Z,UgwAwTPwuDjKMwqkRd14AaABAg.AJZCpwsmNWSAJZNx2MoKVj,UgwAwTPwuDjKMwqkRd14AaABAg,@terrie-v6p,UC8p0RkdxTBJt-_u3tKw75zQ,"6 in Vol 1, 5 in Vol 2, then one bonus Death-centric episode a week after 2 drops.",en,2025-06-19T18:06:16Z,2025-06-19 14:06:16,1
Er18gmgqy2k,The Sandman: Season 2 | Official Trailer | Netflix,UCWOA1ZGywLbqmigxE4Qlvuw,Netflix,2025-06-17T13:00:02Z,UgwAwTPwuDjKMwqkRd14AaABAg.AJZCpwsmNWSAJZbvzUqgtL,UgwAwTPwuDjKMwqkRd14AaABAg,@nothinghereligma3363,UCZyUPODUiENytakeuGXraaA,@terrie-v6pthank you and omg ❤❤❤,en,2025-06-19T20:17:11Z,2025-06-19 16:17:11,0
Er18gmgqy2k,The Sandman: Season 2 | Official Trailer | Netflix,UCWOA1ZGywLbqmigxE4Qlvuw,Netflix,2025-06-17T13:00:02Z,UgwAMq4XORl8fV-Lbb54AaABAg.AJYvSlRnXsZAJZ19Th2YM_,UgwAMq4XORl8fV-Lbb54AaABAg,@terrie-v6p,UC8p0RkdxTBJt-_u3tKw75zQ,You mean Stephen Fry?,en,2025-06-19T14:47:07Z,2025-06-19 10:47:07,0
Er18gmgqy2k,The Sandman: Season 2 | Official Trailer | Netflix,UCWOA1ZGywLbqmigxE4Qlvuw,Netflix,2025-06-17T13:00:02Z,Ugxyo96r5W0KwqwdrNx4AaABAg.AJYu-k_OW4CAJpOvyBjPJ4,Ugxyo96r5W0KwqwdrNx4AaABAg,@kizzykhajiit,UC0NRtHlKrgD6LzifogvJzrA,"Aye.
An' now I'm debatin' inwardly, the morality & ethics of if i should try watch it, or no.
Some elements of the trailer, an' plot, make me feel queezey, wi' whits come te light, recently. 
Now I'm aware, I feela  sense of rotted, an' spoilt, where before, I was as excited as a wee bairn, fir series 2.",en,2025-06-26T08:41:57Z,2025-06-26 04:41:57,1
Er18gmgqy2k,The Sandman: Season 2 | Official Trailer | Netflix,UCWOA1ZGywLbqmigxE4Qlvuw,Netflix,2025-06-17T13:00:02Z,Ugxyo96r5W0KwqwdrNx4AaABAg.AJYu-k_OW4CAJyYjw_ML4j,Ugxyo96r5W0KwqwdrNx4AaABAg,@napoleonsolo5929,UC1fdsd1Ip-ZVHHctSMjb-6Q,"I won't let that jackass deprive me of the chance to see more Gwendoline Christie,",en,2025-06-29T22:00:51Z,2025-06-29 18:00:51,0
Er18gmgqy2k,The Sandman: Season 2 | Official Trailer | Netflix,UCWOA1ZGywLbqmigxE4Qlvuw,Netflix,2025-06-17T13:00:02Z,Ugxyo96r5W0KwqwdrNx4AaABAg.AJYu-k_OW4CAKAW_wvtTaf,Ugxyo96r5W0KwqwdrNx4AaABAg,@zee.voice5141,UCCi4G-t4vtQJwwKzfB9FWGw,​@kizzykhajiit Please speak good English,NA,2025-07-04T22:52:08Z,2025-07-04 18:52:08,0
Er18gmgqy2k,The Sandman: Season 2 | Official Trailer | Netflix,UCWOA1ZGywLbqmigxE4Qlvuw,Netflix,2025-06-17T13:00:02Z,Ugxyo96r5W0KwqwdrNx4AaABAg.AJYu-k_OW4CALUDowHzHlz,Ugxyo96r5W0KwqwdrNx4AaABAg,@sXsKidd,UCy1d6DYDfZECpDhXSCZOJ0A,Just separate the art from the artist holy shit. it's not that hard to do.,en,2025-08-06T11:04:22Z,2025-08-06 07:04:22,0
Er18gmgqy2k,The Sandman: Season 2 | Official Trailer | Netflix,UCWOA1ZGywLbqmigxE4Qlvuw,Netflix,2025-06-17T13:00:02Z,UgyckCuMnTeDuTmUmsd4AaABAg.AJYr1kwv8dGAJYrVtUIs2e,UgyckCuMnTeDuTmUmsd4AaABAg,@ShedrickMoten,UC6dnRV1cd0XKohuCNJq5ZYA,Am I the only one thinking about Marvel's sandman right now? 😂😂😂,en,2025-06-19T13:14:04Z,2025-06-19 09:14:04,0
Er18gmgqy2k,The Sandman: Season 2 | Official Trailer | Netflix,UCWOA1ZGywLbqmigxE4Qlvuw,Netflix,2025-06-17T13:00:02Z,UgyckCuMnTeDuTmUmsd4AaABAg.AJYr1kwv8dGAJZ1EMKfO4k,UgyckCuMnTeDuTmUmsd4AaABAg,@terrie-v6p,UC8p0RkdxTBJt-_u3tKw75zQ,@ShedrickMoten Yes. The rest of us know this is DC's Sandman.,en,2025-06-19T14:47:47Z,2025-06-19 10:47:47,0
Er18gmgqy2k,The Sandman: Season 2 | Official Trailer | Netflix,UCWOA1ZGywLbqmigxE4Qlvuw,Netflix,2025-06-17T13:00:02Z,UgyMxxJR9QoWN09k3GN4AaABAg.AJYlatRScNAAJZ7yTVsIW6,UgyMxxJR9QoWN09k3GN4AaABAg,@terrie-v6p,UC8p0RkdxTBJt-_u3tKw75zQ,"If you think multiple accusations of SA aren't a big deal, you're part of the problem.",en,2025-06-19T15:46:39Z,2025-06-19 11:46:39,4
Er18gmgqy2k,The Sandman: Season 2 | Official Trailer | Netflix,UCWOA1ZGywLbqmigxE4Qlvuw,Netflix,2025-06-17T13:00:02Z,Ugzj0xfdxap0tPPugTp4AaABAg.AJYQT-ctkTUAJZbZft-c6d,Ugzj0xfdxap0tPPugTp4AaABAg,@terrie-v6p,UC8p0RkdxTBJt-_u3tKw75zQ,"Google ""Neil Gaiman"".",NA,2025-06-19T20:14:00Z,2025-06-19 16:14:00,1
Er18gmgqy2k,The Sandman: Season 2 | Official Trailer | Netflix,UCWOA1ZGywLbqmigxE4Qlvuw,Netflix,2025-06-17T13:00:02Z,UgzXUP8_t8-Ykpl2peV4AaABAg.AJYJAzBPWzZAJYsijrY_ex,UgzXUP8_t8-Ykpl2peV4AaABAg,@vexto4592,UC5CtpFtMAgLYwMGlKPNCdzQ,"it lacks diversity, they're all British ",NA,2025-06-19T13:24:41Z,2025-06-19 09:24:41,0
Er18gmgqy2k,The Sandman: Season 2 | Official Trailer | Netflix,UCWOA1ZGywLbqmigxE4Qlvuw,Netflix,2025-06-17T13:00:02Z,UgzXUP8_t8-Ykpl2peV4AaABAg.AJYJAzBPWzZAJYtlxzDZJT,UgzXUP8_t8-Ykpl2peV4AaABAg,@santoshganjave9687,UC84rh66VGE-VqlxpnO_TAUg,Unnecessary black actor casting not needed​@vexto4592,en,2025-06-19T13:33:52Z,2025-06-19 09:33:52,0
Er18gmgqy2k,The Sandman: Season 2 | Official Trailer | Netflix,UCWOA1ZGywLbqmigxE4Qlvuw,Netflix,2025-06-17T13:00:02Z,UgzXUP8_t8-Ykpl2peV4AaABAg.AJYJAzBPWzZAJZ1UYgmaOQ,UgzXUP8_t8-Ykpl2peV4AaABAg,@terrie-v6p,UC8p0RkdxTBJt-_u3tKw75zQ,"@santoshganjave9687 The characters' skin color isn't part of the narrative, so they can be any color.",en,2025-06-19T14:50:00Z,2025-06-19 10:50:00,0
Er18gmgqy2k,The Sandman: Season 2 | Official Trailer | Netflix,UCWOA1ZGywLbqmigxE4Qlvuw,Netflix,2025-06-17T13:00:02Z,UgzXUP8_t8-Ykpl2peV4AaABAg.AJYJAzBPWzZAJlFKa9zccL,UgzXUP8_t8-Ykpl2peV4AaABAg,@santoshganjave9687,UC84rh66VGE-VqlxpnO_TAUg,"And that's why I am saying stick to originality , when they race swap white man to black or brown we didn't like it , the DEI crap only exist in America asian people don't want diversity​BuildinWings",en,2025-06-24T18:01:06Z,2025-06-24 14:01:06,0
Er18gmgqy2k,The Sandman: Season 2 | Official Trailer | Netflix,UCWOA1ZGywLbqmigxE4Qlvuw,Netflix,2025-06-17T13:00:02Z,UgyonW2hO55kUQMdxGR4AaABAg.AJY5mfQjTcsAJZ1_2J-H4J,UgyonW2hO55kUQMdxGR4AaABAg,@terrie-v6p,UC8p0RkdxTBJt-_u3tKw75zQ,"They mean two parts -- the season has been split in half. Part 1 has 6 episodes, part 2 has 5 episodes, then there is another bonus episode a week after that.",en,2025-06-19T14:50:45Z,2025-06-19 10:50:45,0
Er18gmgqy2k,The Sandman: Season 2 | Official Trailer | Netflix,UCWOA1ZGywLbqmigxE4Qlvuw,Netflix,2025-06-17T13:00:02Z,Ugx7baE_pPbfxX9-hGV4AaABAg.AJXmi6Pv-CfAK2UHbZMuM4,Ugx7baE_pPbfxX9-hGV4AaABAg,@williammorahan4907,UC-00PrLy9i-ywmcVkVZHc6Q,Someday my friend…..someday.,ru-Latn,2025-07-01T19:58:06Z,2025-07-01 15:58:06,0
Er18gmgqy2k,The Sandman: Season 2 | Official Trailer | Netflix,UCWOA1ZGywLbqmigxE4Qlvuw,Netflix,2025-06-17T13:00:02Z,Ugx-trwdtutoJsoeBHV4AaABAg.AJXaEmSjZ79AJlTtc1dz6y,Ugx-trwdtutoJsoeBHV4AaABAg,@Skyturtle-0,UCgRPD6rhgcL93R4J9not3pg,"BuildinWingsyes. I’m aware. I’m a huge fan.

So does that mean that any works of his should never be adapted again? That messed up.

Edit: should I not let my kids watch Coraline?",en,2025-06-24T20:08:21Z,2025-06-24 16:08:21,0
Er18gmgqy2k,The Sandman: Season 2 | Official Trailer | Netflix,UCWOA1ZGywLbqmigxE4Qlvuw,Netflix,2025-06-17T13:00:02Z,UgzIlZc_DQYj9gUSQL54AaABAg.AJXK4g8JVqUAJXTciDg4mo,UgzIlZc_DQYj9gUSQL54AaABAg,@terrie-v6p,UC8p0RkdxTBJt-_u3tKw75zQ,Either you didn't read the comics or you didn't pay attention.,en,2025-06-19T00:17:26Z,2025-06-18 20:17:26,1
Er18gmgqy2k,The Sandman: Season 2 | Official Trailer | Netflix,UCWOA1ZGywLbqmigxE4Qlvuw,Netflix,2025-06-17T13:00:02Z,Ugx-Gttm6xu9cX4ljR54AaABAg.AJXGdFHdXz_AJXTgyyPqUW,Ugx-Gttm6xu9cX4ljR54AaABAg,@terrie-v6p,UC8p0RkdxTBJt-_u3tKw75zQ,Either you never read the original comics or you didn't pay attention.,en,2025-06-19T00:18:01Z,2025-06-18 20:18:01,2
Er18gmgqy2k,The Sandman: Season 2 | Official Trailer | Netflix,UCWOA1ZGywLbqmigxE4Qlvuw,Netflix,2025-06-17T13:00:02Z,Ugx-Gttm6xu9cX4ljR54AaABAg.AJXGdFHdXz_AJXWCL9boFE,Ugx-Gttm6xu9cX4ljR54AaABAg,@GW2KillerBEE,UCoLX-KbcYweT9T3KC-gAXJg,"@terrie-v6p i did both, you have 0 clue what you are talking about.",en,2025-06-19T00:39:55Z,2025-06-18 20:39:55,0
Er18gmgqy2k,The Sandman: Season 2 | Official Trailer | Netflix,UCWOA1ZGywLbqmigxE4Qlvuw,Netflix,2025-06-17T13:00:02Z,Ugx-Gttm6xu9cX4ljR54AaABAg.AJXGdFHdXz_AJXX2LzLGmw,Ugx-Gttm6xu9cX4ljR54AaABAg,@terrie-v6p,UC8p0RkdxTBJt-_u3tKw75zQ,"@GW2KillerBEE The comics had minorities and strong women, including a trans woman. They were ""woke.""",en,2025-06-19T00:47:17Z,2025-06-18 20:47:17,2
Er18gmgqy2k,The Sandman: Season 2 | Official Trailer | Netflix,UCWOA1ZGywLbqmigxE4Qlvuw,Netflix,2025-06-17T13:00:02Z,Ugx-Gttm6xu9cX4ljR54AaABAg.AJXGdFHdXz_AJXa2vvbrQL,Ugx-Gttm6xu9cX4ljR54AaABAg,@GW2KillerBEE,UCoLX-KbcYweT9T3KC-gAXJg,"@terrie-v6p You are purposely misunderstanding what I said...typical online person that never talks to real people anymore... I don't care that a person is trans black white Asian gay lesbian etc. I care that it get shoved down my throat every 5 mins that WASN'T in the comics....

Think of it like this you can have moments in a show where they tell you there trans or w/e but having it brought up every 5 mins in a show is political.... and nothing to do with good writing...

You dont know me... I could be trans or gay.
Dont assume things.
Maybe go touch some grass. 😘",en,2025-06-19T01:22:19Z,2025-06-18 21:22:19,0
Er18gmgqy2k,The Sandman: Season 2 | Official Trailer | Netflix,UCWOA1ZGywLbqmigxE4Qlvuw,Netflix,2025-06-17T13:00:02Z,UgyWgDu02xUuKnsuxm94AaABAg.AJX63fwZjqMAJX6JwnY7Y_,UgyWgDu02xUuKnsuxm94AaABAg,@terrie-v6p,UC8p0RkdxTBJt-_u3tKw75zQ,"It's a show, not a movie, and it's fiction.",en,2025-06-18T20:53:46Z,2025-06-18 16:53:46,3
Er18gmgqy2k,The Sandman: Season 2 | Official Trailer | Netflix,UCWOA1ZGywLbqmigxE4Qlvuw,Netflix,2025-06-17T13:00:02Z,UgyDiErtV2kSaDFqTrt4AaABAg.AJX43KYCLUaAJX6N5llMpC,UgyDiErtV2kSaDFqTrt4AaABAg,@terrie-v6p,UC8p0RkdxTBJt-_u3tKw75zQ,"Google ""Neil Gaiman"" and you'll see why this is the final season.",en,2025-06-18T20:54:11Z,2025-06-18 16:54:11,2
Er18gmgqy2k,The Sandman: Season 2 | Official Trailer | Netflix,UCWOA1ZGywLbqmigxE4Qlvuw,Netflix,2025-06-17T13:00:02Z,UgwRSL6OUyA6mm24Fal4AaABAg.AJWoYUnvkRXAJWshmUnlJ_,UgwRSL6OUyA6mm24Fal4AaABAg,@JuliaColeman-w3u,UCHT5UoaHi7H3ZTp-DxUK_NA,Facts,en,2025-06-18T18:46:05Z,2025-06-18 14:46:05,0
Er18gmgqy2k,The Sandman: Season 2 | Official Trailer | Netflix,UCWOA1ZGywLbqmigxE4Qlvuw,Netflix,2025-06-17T13:00:02Z,UgwflSZCyTr0hQWF8BV4AaABAg.AJWnwmafvbeAJX0-SAmWyt,UgwflSZCyTr0hQWF8BV4AaABAg,@terrie-v6p,UC8p0RkdxTBJt-_u3tKw75zQ,"Desire is in the trailer, watch it again.",fy,2025-06-18T19:58:32Z,2025-06-18 15:58:32,0
Er18gmgqy2k,The Sandman: Season 2 | Official Trailer | Netflix,UCWOA1ZGywLbqmigxE4Qlvuw,Netflix,2025-06-17T13:00:02Z,UgwflSZCyTr0hQWF8BV4AaABAg.AJWnwmafvbeAJX0L_xsYi2,UgwflSZCyTr0hQWF8BV4AaABAg,@MrRuDeDoG1979,UCyq-KX2xwhx7kPLbBoY-lgw,@terrie-v6pcheers.,NA,2025-06-18T20:01:33Z,2025-06-18 16:01:33,0
Er18gmgqy2k,The Sandman: Season 2 | Official Trailer | Netflix,UCWOA1ZGywLbqmigxE4Qlvuw,Netflix,2025-06-17T13:00:02Z,UgyYZPC3oVPupFdQW_B4AaABAg.AJWkzy0HAWwAJWrkY2nrDF,UgyYZPC3oVPupFdQW_B4AaABAg,@JuliaColeman-w3u,UCHT5UoaHi7H3ZTp-DxUK_NA,Me too,mi,2025-06-18T18:37:43Z,2025-06-18 14:37:43,1
Er18gmgqy2k,The Sandman: Season 2 | Official Trailer | Netflix,UCWOA1ZGywLbqmigxE4Qlvuw,Netflix,2025-06-17T13:00:02Z,UgyKHoiir0XbeIV3vft4AaABAg.AJWdqQ7X0q5AJWeE84C0xM,UgyKHoiir0XbeIV3vft4AaABAg,@crapreact5989,UCgJnVK6YLcC38uv4Ct4r-Rg,Its better,NA,2025-06-18T16:39:34Z,2025-06-18 12:39:34,1
Er18gmgqy2k,The Sandman: Season 2 | Official Trailer | Netflix,UCWOA1ZGywLbqmigxE4Qlvuw,Netflix,2025-06-17T13:00:02Z,UgyKHoiir0XbeIV3vft4AaABAg.AJWdqQ7X0q5AJWsqIRowMK,UgyKHoiir0XbeIV3vft4AaABAg,@JuliaColeman-w3u,UCHT5UoaHi7H3ZTp-DxUK_NA,Definitely good,ru-Latn,2025-06-18T18:47:15Z,2025-06-18 14:47:15,0
Er18gmgqy2k,The Sandman: Season 2 | Official Trailer | Netflix,UCWOA1ZGywLbqmigxE4Qlvuw,Netflix,2025-06-17T13:00:02Z,UgxV6cM6nhY1VKeuvj94AaABAg.AJWdJOyoMkZAK6HQ6Uul0Y,UgxV6cM6nhY1VKeuvj94AaABAg,@lalrinpuii-ce6jw,UCQUdWu9XzaqAeTHXvfbthHA,batman has nothing to do with them lol,en,2025-07-03T07:22:37Z,2025-07-03 03:22:37,1
Er18gmgqy2k,The Sandman: Season 2 | Official Trailer | Netflix,UCWOA1ZGywLbqmigxE4Qlvuw,Netflix,2025-06-17T13:00:02Z,UgxV6cM6nhY1VKeuvj94AaABAg.AJWdJOyoMkZAK8m4gVVRGg,UgxV6cM6nhY1VKeuvj94AaABAg,@chloroperoxybenzoicacid,UCLMlIJDhotf3AUt28bNWQ7A,Sybau ​@lalrinpuii-ce6jw,haw,2025-07-04T06:37:48Z,2025-07-04 02:37:48,0
Er18gmgqy2k,The Sandman: Season 2 | Official Trailer | Netflix,UCWOA1ZGywLbqmigxE4Qlvuw,Netflix,2025-06-17T13:00:02Z,UgzPvTSCxftpMZRX41l4AaABAg.AJW_tsqm2sLAJWcRYQ3bN4,UgzPvTSCxftpMZRX41l4AaABAg,@terrie-v6p,UC8p0RkdxTBJt-_u3tKw75zQ,"Google ""Neil Gaiman"".",NA,2025-06-18T16:23:55Z,2025-06-18 12:23:55,2
Er18gmgqy2k,The Sandman: Season 2 | Official Trailer | Netflix,UCWOA1ZGywLbqmigxE4Qlvuw,Netflix,2025-06-17T13:00:02Z,UgzPvTSCxftpMZRX41l4AaABAg.AJW_tsqm2sLAJWcjBnmsR_,UgzPvTSCxftpMZRX41l4AaABAg,@m3rc743,UClJSnsEF-EjVgCOlbiCtVmw,​@terrie-v6p rightt i forgot lol,no,2025-06-18T16:26:28Z,2025-06-18 12:26:28,0
Er18gmgqy2k,The Sandman: Season 2 | Official Trailer | Netflix,UCWOA1ZGywLbqmigxE4Qlvuw,Netflix,2025-06-17T13:00:02Z,UgxgOk8Xo9NJ26FIju94AaABAg.AJW_HKw7wNsAJWsvjwOwbh,UgxgOk8Xo9NJ26FIju94AaABAg,@JuliaColeman-w3u,UCHT5UoaHi7H3ZTp-DxUK_NA,I'm telling u,NA,2025-06-18T18:47:59Z,2025-06-18 14:47:59,0
Er18gmgqy2k,The Sandman: Season 2 | Official Trailer | Netflix,UCWOA1ZGywLbqmigxE4Qlvuw,Netflix,2025-06-17T13:00:02Z,Ugzdsvy16uNIKv3K2o14AaABAg.AJWZdXzSDFcAJWb_N2W6r0,Ugzdsvy16uNIKv3K2o14AaABAg,@terrie-v6p,UC8p0RkdxTBJt-_u3tKw75zQ,"No, these are DC characters.",en,2025-06-18T16:16:23Z,2025-06-18 12:16:23,0
Er18gmgqy2k,The Sandman: Season 2 | Official Trailer | Netflix,UCWOA1ZGywLbqmigxE4Qlvuw,Netflix,2025-06-17T13:00:02Z,UgwVy6L5KD1Q8wqyqPt4AaABAg.AJWV8nAqwkQAJWsyLSFHyJ,UgwVy6L5KD1Q8wqyqPt4AaABAg,@JuliaColeman-w3u,UCHT5UoaHi7H3ZTp-DxUK_NA,Cancelled 😢,en,2025-06-18T18:48:20Z,2025-06-18 14:48:20,1
Er18gmgqy2k,The Sandman: Season 2 | Official Trailer | Netflix,UCWOA1ZGywLbqmigxE4Qlvuw,Netflix,2025-06-17T13:00:02Z,Ugy-7GJaU9ypQJVZhjh4AaABAg.AJWPHwJrNjyAJWTesyuiRR,Ugy-7GJaU9ypQJVZhjh4AaABAg,@terrie-v6p,UC8p0RkdxTBJt-_u3tKw75zQ,This is the final season.,en,2025-06-18T14:58:29Z,2025-06-18 10:58:29,1
Er18gmgqy2k,The Sandman: Season 2 | Official Trailer | Netflix,UCWOA1ZGywLbqmigxE4Qlvuw,Netflix,2025-06-17T13:00:02Z,Ugx4MB_fd7t7OyTtZdB4AaABAg.AJWOBKKZA0nAJWQGgfRoDB,Ugx4MB_fd7t7OyTtZdB4AaABAg,@vietnamabc2290,UCfSQO3NTsUr0HTdqBPdfg_Q,Who would even touch this IPs nowadays lol,en,2025-06-18T14:28:50Z,2025-06-18 10:28:50,1
Er18gmgqy2k,The Sandman: Season 2 | Official Trailer | Netflix,UCWOA1ZGywLbqmigxE4Qlvuw,Netflix,2025-06-17T13:00:02Z,UgxD6kFDQIM-3w80eXd4AaABAg.AJWIvX9gGvrAJWt2hZE8Z_,UgxD6kFDQIM-3w80eXd4AaABAg,@JuliaColeman-w3u,UCHT5UoaHi7H3ZTp-DxUK_NA,Facts,en,2025-06-18T18:49:04Z,2025-06-18 14:49:04,1
Er18gmgqy2k,The Sandman: Season 2 | Official Trailer | Netflix,UCWOA1ZGywLbqmigxE4Qlvuw,Netflix,2025-06-17T13:00:02Z,UgxD6kFDQIM-3w80eXd4AaABAg.AJWIvX9gGvrAKCiYFzFwaD,UgxD6kFDQIM-3w80eXd4AaABAg,@Miss_nice74,UCgVslzYVJcHpArEJnCeiCzg,Yes I finished season 2 in one day and I am yearning for someone to suggest a similar show. The only one that I can think of that was so magnetic was love craft country. I want more,en,2025-07-05T19:23:51Z,2025-07-05 15:23:51,1
Er18gmgqy2k,The Sandman: Season 2 | Official Trailer | Netflix,UCWOA1ZGywLbqmigxE4Qlvuw,Netflix,2025-06-17T13:00:02Z,UgxD6kFDQIM-3w80eXd4AaABAg.AJWIvX9gGvrAKeP7CEu4aD,UgxD6kFDQIM-3w80eXd4AaABAg,@thesaltiestnugget,UCBFO6gULQ7tMUrKXV8yZUuQ,Because of the woke trans garbage. People are sick of it.,en,2025-07-16T22:43:22Z,2025-07-16 18:43:22,7
Er18gmgqy2k,The Sandman: Season 2 | Official Trailer | Netflix,UCWOA1ZGywLbqmigxE4Qlvuw,Netflix,2025-06-17T13:00:02Z,UgxD6kFDQIM-3w80eXd4AaABAg.AJWIvX9gGvrALNJK3aB6rX,UgxD6kFDQIM-3w80eXd4AaABAg,@STELLADIMITRIADOU,UCmpH46MJdQ_cTILFrmZNrCw,👍👍👍,ja,2025-08-03T18:37:45Z,2025-08-03 14:37:45,1
Er18gmgqy2k,The Sandman: Season 2 | Official Trailer | Netflix,UCWOA1ZGywLbqmigxE4Qlvuw,Netflix,2025-06-17T13:00:02Z,UgxD6kFDQIM-3w80eXd4AaABAg.AJWIvX9gGvrALSOgqHM2eN,UgxD6kFDQIM-3w80eXd4AaABAg,@oldyboy2057,UCpt7Fx3yLlh8FmaZOc4kriQ,Cz of too much agenda and woke shit this could have been in one of the  the best fantasy series but no we have to teach the new Gen about the LGBT shit and give them ideas in their unconscious brain,en,2025-08-05T18:00:54Z,2025-08-05 14:00:54,1
Er18gmgqy2k,The Sandman: Season 2 | Official Trailer | Netflix,UCWOA1ZGywLbqmigxE4Qlvuw,Netflix,2025-06-17T13:00:02Z,UgxD6kFDQIM-3w80eXd4AaABAg.AJWIvX9gGvrALULXtgZFNB,UgxD6kFDQIM-3w80eXd4AaABAg,@brandonpalhano,UC7HcYs4PIaEe2SWdyTUiWLQ,cuz its super woke u dumbfuck,bg,2025-08-06T12:11:48Z,2025-08-06 08:11:48,0
Er18gmgqy2k,The Sandman: Season 2 | Official Trailer | Netflix,UCWOA1ZGywLbqmigxE4Qlvuw,Netflix,2025-06-17T13:00:02Z,Ugz5XuPHfjl8RXxcrYZ4AaABAg.AJWGD03D3BxAJWHtsc_MFN,Ugz5XuPHfjl8RXxcrYZ4AaABAg,@terrie-v6p,UC8p0RkdxTBJt-_u3tKw75zQ,"If you think the comics aren't woke, you weren't paying attention.",en,2025-06-18T13:15:41Z,2025-06-18 09:15:41,0
Er18gmgqy2k,The Sandman: Season 2 | Official Trailer | Netflix,UCWOA1ZGywLbqmigxE4Qlvuw,Netflix,2025-06-17T13:00:02Z,Ugx15v8yWMmDsAUJYQF4AaABAg.AJW63HpriE2AJW7vPy330m,Ugx15v8yWMmDsAUJYQF4AaABAg,@terrie-v6p,UC8p0RkdxTBJt-_u3tKw75zQ,What do you think this trailer is for? Of course Season 2 is coming out.,en,2025-06-18T11:48:30Z,2025-06-18 07:48:30,0
Er18gmgqy2k,The Sandman: Season 2 | Official Trailer | Netflix,UCWOA1ZGywLbqmigxE4Qlvuw,Netflix,2025-06-17T13:00:02Z,Ugwv752sGaWOgCgKcRJ4AaABAg.AJW2zrTEJFfAJW80CKj5X-,Ugwv752sGaWOgCgKcRJ4AaABAg,@terrie-v6p,UC8p0RkdxTBJt-_u3tKw75zQ,"Season 2 is the last season, so it is cancelled after this.",en,2025-06-18T11:49:18Z,2025-06-18 07:49:18,1
Er18gmgqy2k,The Sandman: Season 2 | Official Trailer | Netflix,UCWOA1ZGywLbqmigxE4Qlvuw,Netflix,2025-06-17T13:00:02Z,UgwdblHZj5gB88bb9214AaABAg.AJW-SAL0FnOAJWEK6MGIcl,UgwdblHZj5gB88bb9214AaABAg,@FallBoy1,UC4vK6eAm7LMXlP7c1qQgvXQ,"Merlin?
Where?",no,2025-06-18T12:44:27Z,2025-06-18 08:44:27,1
Er18gmgqy2k,The Sandman: Season 2 | Official Trailer | Netflix,UCWOA1ZGywLbqmigxE4Qlvuw,Netflix,2025-06-17T13:00:02Z,UgwdblHZj5gB88bb9214AaABAg.AJW-SAL0FnOAJWKB_845ZQ,UgwdblHZj5gB88bb9214AaABAg,@SandKeats,UCNmxCiwzUsTlf0N57zaADdA,At 1:27 ! 😄 ​@FallBoy1,fil,2025-06-18T13:35:43Z,2025-06-18 09:35:43,0
Er18gmgqy2k,The Sandman: Season 2 | Official Trailer | Netflix,UCWOA1ZGywLbqmigxE4Qlvuw,Netflix,2025-06-17T13:00:02Z,UgwdblHZj5gB88bb9214AaABAg.AJW-SAL0FnOAJWPE7XT75v,UgwdblHZj5gB88bb9214AaABAg,@SandKeats,UCNmxCiwzUsTlf0N57zaADdA,At 1:27 !,fil,2025-06-18T14:19:45Z,2025-06-18 10:19:45,0
Er18gmgqy2k,The Sandman: Season 2 | Official Trailer | Netflix,UCWOA1ZGywLbqmigxE4Qlvuw,Netflix,2025-06-17T13:00:02Z,Ugxv9O8RZx9pgrdstjp4AaABAg.AJVzkwjs0bfAJWGrFHgq65,Ugxv9O8RZx9pgrdstjp4AaABAg,@terrie-v6p,UC8p0RkdxTBJt-_u3tKw75zQ,"They're in the trailer, they just don't have any lines. Watch it again.",en,2025-06-18T13:06:35Z,2025-06-18 09:06:35,0
Er18gmgqy2k,The Sandman: Season 2 | Official Trailer | Netflix,UCWOA1ZGywLbqmigxE4Qlvuw,Netflix,2025-06-17T13:00:02Z,UgyTe87EXrs446D1R6B4AaABAg.AJVqCDW1bwmAJWGu6mrpNc,UgyTe87EXrs446D1R6B4AaABAg,@terrie-v6p,UC8p0RkdxTBJt-_u3tKw75zQ,"They are in the trailer, watch it again.",en,2025-06-18T13:06:58Z,2025-06-18 09:06:58,0
Er18gmgqy2k,The Sandman: Season 2 | Official Trailer | Netflix,UCWOA1ZGywLbqmigxE4Qlvuw,Netflix,2025-06-17T13:00:02Z,UgyTe87EXrs446D1R6B4AaABAg.AJVqCDW1bwmAJW_a-xTwXO,UgyTe87EXrs446D1R6B4AaABAg,@Rehm4nTony,UCl4A8JvVTxo6i4itqHDBejg,"​​@terrie-v6p yeah 0:44 , thanks for a millisecond cameo in the trailer and also they changed a lot. Not my fault if I didn't recognize them at first lol",en,2025-06-18T15:59:00Z,2025-06-18 11:59:00,0
Er18gmgqy2k,The Sandman: Season 2 | Official Trailer | Netflix,UCWOA1ZGywLbqmigxE4Qlvuw,Netflix,2025-06-17T13:00:02Z,UgzDuzhNH6fJBTvOO0x4AaABAg.AJVpFseA_cQAJW8LXoEieg,UgzDuzhNH6fJBTvOO0x4AaABAg,@terrie-v6p,UC8p0RkdxTBJt-_u3tKw75zQ,"No, she was Black, same as this season.",hmn,2025-06-18T11:52:13Z,2025-06-18 07:52:13,0
Er18gmgqy2k,The Sandman: Season 2 | Official Trailer | Netflix,UCWOA1ZGywLbqmigxE4Qlvuw,Netflix,2025-06-17T13:00:02Z,Ugw3HzCWY49XnqhO-iN4AaABAg.AJVjI-j-jR_AJW8TexIN8r,Ugw3HzCWY49XnqhO-iN4AaABAg,@terrie-v6p,UC8p0RkdxTBJt-_u3tKw75zQ,"In the case of Sandman, there was a writer/actor strike.",en,2025-06-18T11:53:19Z,2025-06-18 07:53:19,0
Er18gmgqy2k,The Sandman: Season 2 | Official Trailer | Netflix,UCWOA1ZGywLbqmigxE4Qlvuw,Netflix,2025-06-17T13:00:02Z,UgzGF1L4yEa26keCOnd4AaABAg.AJVj5KR9HEIAJWtGkauct9,UgzGF1L4yEa26keCOnd4AaABAg,@JuliaColeman-w3u,UCHT5UoaHi7H3ZTp-DxUK_NA,Me too,mi,2025-06-18T18:50:59Z,2025-06-18 14:50:59,0
Er18gmgqy2k,The Sandman: Season 2 | Official Trailer | Netflix,UCWOA1ZGywLbqmigxE4Qlvuw,Netflix,2025-06-17T13:00:02Z,UgydPjWKx7E4_guly754AaABAg.AJVgAlTXY7uAJVsUp5VZDC,UgydPjWKx7E4_guly754AaABAg,@HouseMDaddict,UC-xbil4RaylOm_6Uhsz3Fkw,Librarian is my favorite. I also love death,en,2025-06-18T09:24:56Z,2025-06-18 05:24:56,10
