video_id,video_title,channel_id,channel_title,video_published_at,reply_id,reply_parent_comment_id,reply_author_display,reply_author_channel_id,reply_text,reply_lang,reply_published_utc,reply_published_local,reply_like_count
Er18gmgqy2k,The Sandman: Season 2 | Official Trailer | Netflix,UCWOA1ZGywLbqmigxE4Qlvuw,Netflix,2025-06-17T13:00:02Z,UgwOHN0qtmUulvWg3sB4AaABAg.AOH6WpqDGSqAP6eWRSpsur,UgwOHN0qtmUulvWg3sB4AaABAg,@JoshuaR9763,UC7IiCy5ki5tbwrjUMw7vC7g,Copy and pasting hate over all the trailers…. Get a life man,en,2025-11-04T17:30:10Z,2025-11-04 12:30:10,0
Er18gmgqy2k,The Sandman: Season 2 | Official Trailer | Netflix,UCWOA1ZGywLbqmigxE4Qlvuw,Netflix,2025-06-17T13:00:02Z,Ugz650tOrKhRcihYxjF4AaABAg.ALvmMz63GchALye93xhYXx,Ugz650tOrKhRcihYxjF4AaABAg,@GreatStation,UCtQ1IudNoUDitNgUeQJFT4g,They won't do it,NA,2025-08-18T15:59:38Z,2025-08-18 11:59:38,0
Er18gmgqy2k,The Sandman: Season 2 | Official Trailer | Netflix,UCWOA1ZGywLbqmigxE4Qlvuw,Netflix,2025-06-17T13:00:02Z,UgxbhJrUmVt7CdU3U3t4AaABAg.ALiXM0w5AaTALyeFt7KNi2,UgxbhJrUmVt7CdU3U3t4AaABAg,@GreatStation,UCtQ1IudNoUDitNgUeQJFT4g,Nope sir,af,2025-08-18T16:00:34Z,2025-08-18 12:00:34,1
Er18gmgqy2k,The Sandman: Season 2 | Official Trailer | Netflix,UCWOA1ZGywLbqmigxE4Qlvuw,Netflix,2025-06-17T13:00:02Z,UgwP3OSRf7jBw3WRjgN4AaABAg.ALF7zFDF_hjALKMSG4FEqv,UgwP3OSRf7jBw3WRjgN4AaABAg,@MrMakingwavesmedia,UCfQn0aidypam_r1vJrXzyTg,not sure Christian ethos has anything to do with being gay because besided celebrating gayness there is absolute zero substance to the show. It's aboout being gay and making the moronic observation that sex and love is somehow the same thing. It's pathetic writing by a very clearly pathetic human being,en,2025-08-02T15:07:22Z,2025-08-02 11:07:22,0
Er18gmgqy2k,The Sandman: Season 2 | Official Trailer | Netflix,UCWOA1ZGywLbqmigxE4Qlvuw,Netflix,2025-06-17T13:00:02Z,UgxJiGWSsPQEjAUl__x4AaABAg.AL72nFS28R8ALOnrV3f0n3,UgxJiGWSsPQEjAUl__x4AaABAg,@ViviMary-elle,UCiHiZuBQ_5cJv8Us3TcegQQ,you are disgusting :D,en,2025-08-04T08:32:35Z,2025-08-04 04:32:35,0
Er18gmgqy2k,The Sandman: Season 2 | Official Trailer | Netflix,UCWOA1ZGywLbqmigxE4Qlvuw,Netflix,2025-06-17T13:00:02Z,Ugzt2LHu7r0dpNcqA5R4AaABAg.AL4yTwWvum2AL6HNVpzQS3,Ugzt2LHu7r0dpNcqA5R4AaABAg,@WearySojouner,UCvcN0Gqnf0v2B8A5skkfqSA,Bahaha! It was Shakespearean so it wasn't meant for everyone. But that was funny what you composed.,en,2025-07-28T03:53:39Z,2025-07-27 23:53:39,1
Er18gmgqy2k,The Sandman: Season 2 | Official Trailer | Netflix,UCWOA1ZGywLbqmigxE4Qlvuw,Netflix,2025-06-17T13:00:02Z,Ugzt2LHu7r0dpNcqA5R4AaABAg.AL4yTwWvum2ALHv7l-aBgP,Ugzt2LHu7r0dpNcqA5R4AaABAg,@STELLADIMITRIADOU,UCmpH46MJdQ_cTILFrmZNrCw,DON'T REMIND ME. WOMAN UNDERWEAR AND THAT,en,2025-08-01T16:21:25Z,2025-08-01 12:21:25,3
Er18gmgqy2k,The Sandman: Season 2 | Official Trailer | Netflix,UCWOA1ZGywLbqmigxE4Qlvuw,Netflix,2025-06-17T13:00:02Z,Ugzt2LHu7r0dpNcqA5R4AaABAg.AL4yTwWvum2ALIrviuWDuu,Ugzt2LHu7r0dpNcqA5R4AaABAg,@WearySojouner,UCvcN0Gqnf0v2B8A5skkfqSA,"​@STELLADIMITRIADOU
Unless we are without sin we should never cast any stone. God bless. Help those lost. Don't condemn. But liberate those in sin from sin. Do so by showing them the path to Jesus.",en,2025-08-02T01:12:40Z,2025-08-01 21:12:40,1
Er18gmgqy2k,The Sandman: Season 2 | Official Trailer | Netflix,UCWOA1ZGywLbqmigxE4Qlvuw,Netflix,2025-06-17T13:00:02Z,Ugzt2LHu7r0dpNcqA5R4AaABAg.AL4yTwWvum2ALKDh0fSyjV,Ugzt2LHu7r0dpNcqA5R4AaABAg,@STELLADIMITRIADOU,UCmpH46MJdQ_cTILFrmZNrCw,"​@WearySojouner
I DO NOT THROW STONES. I CAN'T HELP THEM. I DON'T WANT THEM ON MY SCREEN ALL THE TIME.",en,2025-08-02T13:50:53Z,2025-08-02 09:50:53,2
Er18gmgqy2k,The Sandman: Season 2 | Official Trailer | Netflix,UCWOA1ZGywLbqmigxE4Qlvuw,Netflix,2025-06-17T13:00:02Z,Ugzt2LHu7r0dpNcqA5R4AaABAg.AL4yTwWvum2ALLqwH3zuz5,Ugzt2LHu7r0dpNcqA5R4AaABAg,@WearySojouner,UCvcN0Gqnf0v2B8A5skkfqSA,"​@STELLADIMITRIADOU
Who do you think owns and operates this world? You say that you don't want them on your screen all the time but you're watching using technology that was intended to make you see and hear ungodly things. This technology wasn't created to make you happy. It was created to corrupt you.",en,2025-08-03T05:01:43Z,2025-08-03 01:01:43,1
Er18gmgqy2k,The Sandman: Season 2 | Official Trailer | Netflix,UCWOA1ZGywLbqmigxE4Qlvuw,Netflix,2025-06-17T13:00:02Z,UgxvS0gt8vIBOVOImUR4AaABAg.AL3qUqrhGKrAL6Hf7VCtUU,UgxvS0gt8vIBOVOImUR4AaABAg,@WearySojouner,UCvcN0Gqnf0v2B8A5skkfqSA,"Unfortunately I don't believe they will. But it could go on for a while if they truly wanted. 
The journey is boundless in imagination. So many things could be written. The last season and last episode was the very best of all of the episodes before because it tied together so perfectly.",en,2025-07-28T03:56:12Z,2025-07-27 23:56:12,1
Er18gmgqy2k,The Sandman: Season 2 | Official Trailer | Netflix,UCWOA1ZGywLbqmigxE4Qlvuw,Netflix,2025-06-17T13:00:02Z,Ugzef8DMz29XubdEIrF4AaABAg.AL0Bcer_iBdAL2hq1nu-hR,Ugzef8DMz29XubdEIrF4AaABAg,@floremidez4643,UCpcApRgx8p118M83xlWfQng,"He dies in the comics too, the series only followed the original work and the plot of the season is to understand Dream and what led to his death",en,2025-07-26T18:36:39Z,2025-07-26 14:36:39,0
Er18gmgqy2k,The Sandman: Season 2 | Official Trailer | Netflix,UCWOA1ZGywLbqmigxE4Qlvuw,Netflix,2025-06-17T13:00:02Z,Ugzef8DMz29XubdEIrF4AaABAg.AL0Bcer_iBdAL7Jt8Cwd9M,Ugzef8DMz29XubdEIrF4AaABAg,@jerrypanmeih6370,UC7JjICxBdfisXmAZ0PxJHSQ,​@floremidez4643But the new dream king is so off putting for me. It doesn't match the energy of the old dream king or slightly relatable at all,en,2025-07-28T13:34:50Z,2025-07-28 09:34:50,0
Er18gmgqy2k,The Sandman: Season 2 | Official Trailer | Netflix,UCWOA1ZGywLbqmigxE4Qlvuw,Netflix,2025-06-17T13:00:02Z,UgyOsCeSgP-ZG2_-NKF4AaABAg.AL-K5Hs-SwZAL0vp6ZTYJv,UgyOsCeSgP-ZG2_-NKF4AaABAg,@keno.M,UC_OsHwd0miMiUvb1Xef18dg,😂😂😂😂same,NA,2025-07-26T02:00:23Z,2025-07-25 22:00:23,1
Er18gmgqy2k,The Sandman: Season 2 | Official Trailer | Netflix,UCWOA1ZGywLbqmigxE4Qlvuw,Netflix,2025-06-17T13:00:02Z,UgyOsCeSgP-ZG2_-NKF4AaABAg.AL-K5Hs-SwZAL1qVpYSdSO,UgyOsCeSgP-ZG2_-NKF4AaABAg,@Aleakwe,UC-wCILjbGGFHKALLx69zukw,⁠@keno.M😂,ht,2025-07-26T10:33:10Z,2025-07-26 06:33:10,1
Er18gmgqy2k,The Sandman: Season 2 | Official Trailer | Netflix,UCWOA1ZGywLbqmigxE4Qlvuw,Netflix,2025-06-17T13:00:02Z,UgyTLkjd18WV-pM_4Hx4AaABAg.AKQ-uilws-UAKQuFw2diGi,UgyTLkjd18WV-pM_4Hx4AaABAg,@jenniellepples,UCCwaa4CsVXte7swRpqfzGIw,You stopped watching a show because of one episode? 💀 sounds like you never watched the show and just there because of fomo,en,2025-07-11T07:35:34Z,2025-07-11 03:35:34,1
Er18gmgqy2k,The Sandman: Season 2 | Official Trailer | Netflix,UCWOA1ZGywLbqmigxE4Qlvuw,Netflix,2025-06-17T13:00:02Z,UgyTLkjd18WV-pM_4Hx4AaABAg.AKQ-uilws-UAKRvGBYRZtl,UgyTLkjd18WV-pM_4Hx4AaABAg,@GeneralKenobi69420,UC37bbsU_BGpYzmPK-s_Q_5g,"@jenniellepples That, and because the second seasonwas meh. Morningstar just noping out of nowhere felt incredibly out of character and the episodes sluggish. The woke stuff was just the icing on the cake at this point",en,2025-07-11T17:03:35Z,2025-07-11 13:03:35,0
Er18gmgqy2k,The Sandman: Season 2 | Official Trailer | Netflix,UCWOA1ZGywLbqmigxE4Qlvuw,Netflix,2025-06-17T13:00:02Z,UgyTLkjd18WV-pM_4Hx4AaABAg.AKQ-uilws-UAKT3e7g0fVF,UgyTLkjd18WV-pM_4Hx4AaABAg,@jenniellepples,UCCwaa4CsVXte7swRpqfzGIw,​@GeneralKenobi69420 had to agree they were indeed sluggish because they had to cram the arcs to make it shorter. The comic itself is queer and progressive but the way the show was made them just fillers,en,2025-07-12T03:44:52Z,2025-07-11 23:44:52,0
Er18gmgqy2k,The Sandman: Season 2 | Official Trailer | Netflix,UCWOA1ZGywLbqmigxE4Qlvuw,Netflix,2025-06-17T13:00:02Z,Ugxso6PaLxbYCR_hrZJ4AaABAg.AKPtPQhL3T5AKQ-LD3n-Eu,Ugxso6PaLxbYCR_hrZJ4AaABAg,@GeneralKenobi69420,UC37bbsU_BGpYzmPK-s_Q_5g,There's an entire episode worth of time dedicated to trans bs now lol. Stopped watching there,en,2025-07-10T23:09:28Z,2025-07-10 19:09:28,0
Er18gmgqy2k,The Sandman: Season 2 | Official Trailer | Netflix,UCWOA1ZGywLbqmigxE4Qlvuw,Netflix,2025-06-17T13:00:02Z,Ugxso6PaLxbYCR_hrZJ4AaABAg.AKPtPQhL3T5AKQtl39noNr,Ugxso6PaLxbYCR_hrZJ4AaABAg,@jenniellepples,UCCwaa4CsVXte7swRpqfzGIw,"​@GeneralKenobi69420 i would suggest reading the comic instead of the show, the show is such a bummer and removed a lot of the storyline. The scene about the transwoman was supposed to be heartfelt but the show had to compress the panels so it ended up giving something that looks ""unnecessary"".",en,2025-07-11T07:31:13Z,2025-07-11 03:31:13,0
Er18gmgqy2k,The Sandman: Season 2 | Official Trailer | Netflix,UCWOA1ZGywLbqmigxE4Qlvuw,Netflix,2025-06-17T13:00:02Z,Ugxso6PaLxbYCR_hrZJ4AaABAg.AKPtPQhL3T5AKQtt0k97Vh,Ugxso6PaLxbYCR_hrZJ4AaABAg,@jenniellepples,UCCwaa4CsVXte7swRpqfzGIw,"I would suggest reading the comic, comic > show !! Many plots were left out in the show so it felt like those scenes were fillers.",en,2025-07-11T07:32:18Z,2025-07-11 03:32:18,0
Er18gmgqy2k,The Sandman: Season 2 | Official Trailer | Netflix,UCWOA1ZGywLbqmigxE4Qlvuw,Netflix,2025-06-17T13:00:02Z,UgybyVdFVCe-zVaQSUp4AaABAg.AKObi6h0u8YAKQuLPax58c,UgybyVdFVCe-zVaQSUp4AaABAg,@jenniellepples,UCCwaa4CsVXte7swRpqfzGIw,"The comic itself is woke, no one forced you to watch it if you don't want to 💀",en,2025-07-11T07:36:19Z,2025-07-11 03:36:19,2
Er18gmgqy2k,The Sandman: Season 2 | Official Trailer | Netflix,UCWOA1ZGywLbqmigxE4Qlvuw,Netflix,2025-06-17T13:00:02Z,UgzRDmN4wjV_mal1egN4AaABAg.AKNGOIIkTvvAKNGylQyz3W,UgzRDmN4wjV_mal1egN4AaABAg,@alexanderphilips1101,UCTdfxcmHF4Uikiqhms4UXNA,"10,000 years ago was about the exact date of the younger dryas according to the Bible and every other culture on the planet",en,2025-07-09T21:45:50Z,2025-07-09 17:45:50,0
Er18gmgqy2k,The Sandman: Season 2 | Official Trailer | Netflix,UCWOA1ZGywLbqmigxE4Qlvuw,Netflix,2025-06-17T13:00:02Z,UgxdcTsGOmvnqHmb2uN4AaABAg.AKIVUrH8ZinAO5yCM-oQ-N,UgxdcTsGOmvnqHmb2uN4AaABAg,@Negiot_Salmonella,UC9h0hLqfjwzL64xqxEORnpw,you its based on a comics right?,en,2025-10-10T14:31:33Z,2025-10-10 10:31:33,1
Er18gmgqy2k,The Sandman: Season 2 | Official Trailer | Netflix,UCWOA1ZGywLbqmigxE4Qlvuw,Netflix,2025-06-17T13:00:02Z,UgxdcTsGOmvnqHmb2uN4AaABAg.AKIVUrH8ZinAO5zv4LhfUN,UgxdcTsGOmvnqHmb2uN4AaABAg,@WearySojouner,UCvcN0Gqnf0v2B8A5skkfqSA,"​@Negiot_Salmonella
I don't know. I never knew anything about the sandman character until it aired on Netflix. 
But it was very good in my opinion. I love that it was an amalgam of Shakespeare and the combining of the Gods of old written about in the Bible. I loved the writing styles.",en,2025-10-10T14:46:32Z,2025-10-10 10:46:32,0
Er18gmgqy2k,The Sandman: Season 2 | Official Trailer | Netflix,UCWOA1ZGywLbqmigxE4Qlvuw,Netflix,2025-06-17T13:00:02Z,UgxdcTsGOmvnqHmb2uN4AaABAg.AKIVUrH8ZinAO7vaFcY0lk,UgxdcTsGOmvnqHmb2uN4AaABAg,@Negiot_Salmonella,UC9h0hLqfjwzL64xqxEORnpw,@WearySojounerthe comics are wat better . You should read them there are so many things they haven’t included,en,2025-10-11T08:47:13Z,2025-10-11 04:47:13,0
Er18gmgqy2k,The Sandman: Season 2 | Official Trailer | Netflix,UCWOA1ZGywLbqmigxE4Qlvuw,Netflix,2025-06-17T13:00:02Z,UgzJgkr2Ov6zbbypSyd4AaABAg.AKD0rsQkLsCAKDGm5JuId1,UgzJgkr2Ov6zbbypSyd4AaABAg,@btgkg9639,UCwyut7JNz89t_2by5LOYeMA,It’s over. Neil Gaimen is in some trouble with SA allegations.,en,2025-07-06T00:31:42Z,2025-07-05 20:31:42,0
Er18gmgqy2k,The Sandman: Season 2 | Official Trailer | Netflix,UCWOA1ZGywLbqmigxE4Qlvuw,Netflix,2025-06-17T13:00:02Z,UgwTXdz4_RwedHeEkjJ4AaABAg.AKCVa9BHbiOAKCbfJWxjlh,UgwTXdz4_RwedHeEkjJ4AaABAg,@waiskuxx,UCPrYmJ_tRP-T_W0Ryg1mqmw,"Go have a cry sook, what a snowflake.",en,2025-07-05T18:23:47Z,2025-07-05 14:23:47,3
Er18gmgqy2k,The Sandman: Season 2 | Official Trailer | Netflix,UCWOA1ZGywLbqmigxE4Qlvuw,Netflix,2025-06-17T13:00:02Z,UgwTXdz4_RwedHeEkjJ4AaABAg.AKCVa9BHbiOAKDGsJiew3i,UgwTXdz4_RwedHeEkjJ4AaABAg,@btgkg9639,UCwyut7JNz89t_2by5LOYeMA,"@waiskuxxWe get it, you’re gay.",en,2025-07-06T00:32:33Z,2025-07-05 20:32:33,0
Er18gmgqy2k,The Sandman: Season 2 | Official Trailer | Netflix,UCWOA1ZGywLbqmigxE4Qlvuw,Netflix,2025-06-17T13:00:02Z,UgyQ8JHtz1CoiOt7esx4AaABAg.AKCNK9RcaHUAKCbl-CbzzU,UgyQ8JHtz1CoiOt7esx4AaABAg,@waiskuxx,UCPrYmJ_tRP-T_W0Ryg1mqmw,They aren't transgender donut they're a transvestite.,en,2025-07-05T18:24:33Z,2025-07-05 14:24:33,0
Er18gmgqy2k,The Sandman: Season 2 | Official Trailer | Netflix,UCWOA1ZGywLbqmigxE4Qlvuw,Netflix,2025-06-17T13:00:02Z,UgxcSPuxS00BVSu0NoZ4AaABAg.AKC9sn0LgO7AKCIIfIYVvL,UgxcSPuxS00BVSu0NoZ4AaABAg,@Mobilis_InMobili,UCMdxbqxuyC4eSFSYBX6OUzA,You could always buy the Duck Dynasty set and watch that on repeat.,en,2025-07-05T15:25:47Z,2025-07-05 11:25:47,1
Er18gmgqy2k,The Sandman: Season 2 | Official Trailer | Netflix,UCWOA1ZGywLbqmigxE4Qlvuw,Netflix,2025-06-17T13:00:02Z,UgysAx50JqdtreVcQiZ4AaABAg.AKBTmFZas1WAKDH7PFYjF3,UgysAx50JqdtreVcQiZ4AaABAg,@btgkg9639,UCwyut7JNz89t_2by5LOYeMA,So much was changed from the source material.,en,2025-07-06T00:34:45Z,2025-07-05 20:34:45,0
Er18gmgqy2k,The Sandman: Season 2 | Official Trailer | Netflix,UCWOA1ZGywLbqmigxE4Qlvuw,Netflix,2025-06-17T13:00:02Z,UgyNZ0ZvVdLI7mJY2eJ4AaABAg.AKB5eGYWFBmAKCIZvuGPD4,UgyNZ0ZvVdLI7mJY2eJ4AaABAg,@Mobilis_InMobili,UCMdxbqxuyC4eSFSYBX6OUzA,"So you think... How would you even know?
The fact is, gays and lesbians are more prominent as artists cause we are natural rebels. We question things at a young age. Being a hetero, it is easy to fall into commonality.",en,2025-07-05T15:28:08Z,2025-07-05 11:28:08,1
Er18gmgqy2k,The Sandman: Season 2 | Official Trailer | Netflix,UCWOA1ZGywLbqmigxE4Qlvuw,Netflix,2025-06-17T13:00:02Z,UgyNZ0ZvVdLI7mJY2eJ4AaABAg.AKB5eGYWFBmAKEY4xec-Sz,UgyNZ0ZvVdLI7mJY2eJ4AaABAg,@Hacker-orwot1,UCDCaLO4TGGRO2Szu7rygW0g,Hakk thuii couldn't enjoy the series because they kept showing gay vibes,en,2025-07-06T12:22:12Z,2025-07-06 08:22:12,0
Er18gmgqy2k,The Sandman: Season 2 | Official Trailer | Netflix,UCWOA1ZGywLbqmigxE4Qlvuw,Netflix,2025-06-17T13:00:02Z,Ugzhltv04RACXG4hKoR4AaABAg.AKAvCqp8qWPAKCcHCV7MNS,Ugzhltv04RACXG4hKoR4AaABAg,@waiskuxx,UCPrYmJ_tRP-T_W0Ryg1mqmw,Well all ethnicities descend from Africa are you a peanut? Why tf wouldn't the Queen of the first peoples be from Africa? Desire is suppose to be fat in comics. Nothing wrong with the actors being black lmao and nothing wrong with Desire being a transvestite. God you sound miserable asf.,en,2025-07-05T18:29:05Z,2025-07-05 14:29:05,0
Er18gmgqy2k,The Sandman: Season 2 | Official Trailer | Netflix,UCWOA1ZGywLbqmigxE4Qlvuw,Netflix,2025-06-17T13:00:02Z,Ugz7yLNMhnGwfxo-5d94AaABAg.AKAGNwisjqnAKCIjtpgDtr,Ugz7yLNMhnGwfxo-5d94AaABAg,@Mobilis_InMobili,UCMdxbqxuyC4eSFSYBX6OUzA,Just turn off the TV and go outside.,en,2025-07-05T15:29:38Z,2025-07-05 11:29:38,0
Er18gmgqy2k,The Sandman: Season 2 | Official Trailer | Netflix,UCWOA1ZGywLbqmigxE4Qlvuw,Netflix,2025-06-17T13:00:02Z,UgyUYNjOl7LdEAPIZYx4AaABAg.AK9GaxLKIEtAKCJBIhjir1,UgyUYNjOl7LdEAPIZYx4AaABAg,@Mobilis_InMobili,UCMdxbqxuyC4eSFSYBX6OUzA,Plenty of straight folks watch without any problem. Sounds like the show gave you a boner and now youre cursing said boner.,en,2025-07-05T15:33:31Z,2025-07-05 11:33:31,0
Er18gmgqy2k,The Sandman: Season 2 | Official Trailer | Netflix,UCWOA1ZGywLbqmigxE4Qlvuw,Netflix,2025-06-17T13:00:02Z,UgyIPMwuKuFvmrh8zQ54AaABAg.AK9BvDIpRJVAK9s1wzBcov,UgyIPMwuKuFvmrh8zQ54AaABAg,@blxckmastr,UC_AExdWrZoSRUP1RCjP14Xg,"I started watching it and 30 minutes in i gave it a thumbs down, removed it from the watchlist and closed Netflix. Unwatchable woke shit.",en,2025-07-04T16:49:06Z,2025-07-04 12:49:06,1
Er18gmgqy2k,The Sandman: Season 2 | Official Trailer | Netflix,UCWOA1ZGywLbqmigxE4Qlvuw,Netflix,2025-06-17T13:00:02Z,UgyIPMwuKuFvmrh8zQ54AaABAg.AK9BvDIpRJVAKCJLlgZaKr,UgyIPMwuKuFvmrh8zQ54AaABAg,@Mobilis_InMobili,UCMdxbqxuyC4eSFSYBX6OUzA,"​@blxckmastrdrama queens. You ain't gotta announce you're bitching. 😂 ""look at me! Im offended!""",en,2025-07-05T15:34:57Z,2025-07-05 11:34:57,0
Er18gmgqy2k,The Sandman: Season 2 | Official Trailer | Netflix,UCWOA1ZGywLbqmigxE4Qlvuw,Netflix,2025-06-17T13:00:02Z,UgyIPMwuKuFvmrh8zQ54AaABAg.AK9BvDIpRJVAKEYK9rc9TV,UgyIPMwuKuFvmrh8zQ54AaABAg,@Hacker-orwot1,UCDCaLO4TGGRO2Szu7rygW0g,​@Mobilis_InMobili I see only you in every comment sections defending gays 😅 must be tiring huh,en,2025-07-06T12:24:17Z,2025-07-06 08:24:17,0
Er18gmgqy2k,The Sandman: Season 2 | Official Trailer | Netflix,UCWOA1ZGywLbqmigxE4Qlvuw,Netflix,2025-06-17T13:00:02Z,UgyIPMwuKuFvmrh8zQ54AaABAg.AK9BvDIpRJVAKEhEt9l5_7,UgyIPMwuKuFvmrh8zQ54AaABAg,@Mobilis_InMobili,UCMdxbqxuyC4eSFSYBX6OUzA,"@Hacker-orwot1 It is easy to comment on the first 3 comments I see :D I am sorry if that amount of reading and typing takes the life out of you :( It is true though that people complain too much and make life all about them ""My Tv shooooows have gaaaaaay and blaaaack people."" You wonder how they get on through every day life. I imagine they have meltdowns in public often. They get up and announce they are leaving from restaurants when they dont like the food... or throw a fit when people of colour join their sports group. These boys need to man up and cope with life :D",en,2025-07-06T13:50:56Z,2025-07-06 09:50:56,0
Er18gmgqy2k,The Sandman: Season 2 | Official Trailer | Netflix,UCWOA1ZGywLbqmigxE4Qlvuw,Netflix,2025-06-17T13:00:02Z,UgyIPMwuKuFvmrh8zQ54AaABAg.AK9BvDIpRJVAKEwCyMcQFb,UgyIPMwuKuFvmrh8zQ54AaABAg,@Hacker-orwot1,UCDCaLO4TGGRO2Szu7rygW0g,​@Mobilis_InMobili too long to read boring,NA,2025-07-06T16:01:45Z,2025-07-06 12:01:45,0
Er18gmgqy2k,The Sandman: Season 2 | Official Trailer | Netflix,UCWOA1ZGywLbqmigxE4Qlvuw,Netflix,2025-06-17T13:00:02Z,Ugwkv1Mu1TOQS_gTJ-h4AaABAg.AK8gQ-H4lqyAKCJQbrnp3H,Ugwkv1Mu1TOQS_gTJ-h4AaABAg,@Mobilis_InMobili,UCMdxbqxuyC4eSFSYBX6OUzA,"""I'm offended easily""",en,2025-07-05T15:35:36Z,2025-07-05 11:35:36,0
Er18gmgqy2k,The Sandman: Season 2 | Official Trailer | Netflix,UCWOA1ZGywLbqmigxE4Qlvuw,Netflix,2025-06-17T13:00:02Z,UgzlboojKXJgVehdL0R4AaABAg.AK8ThMOf_qnAK8YbrWB_tG,UgzlboojKXJgVehdL0R4AaABAg,@dudududupa4018,UCRCZ4EYUker-A_o_avHZbqg,what do you mean,en,2025-07-04T04:31:24Z,2025-07-04 00:31:24,0
Er18gmgqy2k,The Sandman: Season 2 | Official Trailer | Netflix,UCWOA1ZGywLbqmigxE4Qlvuw,Netflix,2025-06-17T13:00:02Z,Ugwatz_7aUZvv2YPRR14AaABAg.AK8RIga0o40AK8m9fnHWKq,Ugwatz_7aUZvv2YPRR14AaABAg,@chloroperoxybenzoicacid,UCLMlIJDhotf3AUt28bNWQ7A,Racist POS learn how to spell first,en,2025-07-04T06:38:29Z,2025-07-04 02:38:29,1
Er18gmgqy2k,The Sandman: Season 2 | Official Trailer | Netflix,UCWOA1ZGywLbqmigxE4Qlvuw,Netflix,2025-06-17T13:00:02Z,UgyFSuBTRAVEfeWdaxV4AaABAg.AK8NPIZlxv8AL-twBQ4QPO,UgyFSuBTRAVEfeWdaxV4AaABAg,@STELLADIMITRIADOU,UCmpH46MJdQ_cTILFrmZNrCw,THANK YOU 🎉,en,2025-07-25T16:24:38Z,2025-07-25 12:24:38,0
Er18gmgqy2k,The Sandman: Season 2 | Official Trailer | Netflix,UCWOA1ZGywLbqmigxE4Qlvuw,Netflix,2025-06-17T13:00:02Z,Ugx8v7nnItIV90yM8_J4AaABAg.AK8NLJQDaHAAK8UGKpt6SV,Ugx8v7nnItIV90yM8_J4AaABAg,@blue1water,UCmSw3ZVWVLRhmd2oi5M_ctw,"Dude, ur letting ur racism cloud ur judgment. The skin color to the character wasn't even the focus. Everything would have been same if the skin was yellow or orange",en,2025-07-04T03:53:22Z,2025-07-03 23:53:22,0
Er18gmgqy2k,The Sandman: Season 2 | Official Trailer | Netflix,UCWOA1ZGywLbqmigxE4Qlvuw,Netflix,2025-06-17T13:00:02Z,Ugx8v7nnItIV90yM8_J4AaABAg.AK8NLJQDaHAAK8YkBlWGqV,Ugx8v7nnItIV90yM8_J4AaABAg,@dudududupa4018,UCRCZ4EYUker-A_o_avHZbqg,"hate to break it to you, but the comics were woke as well. even more.",en,2025-07-04T04:32:32Z,2025-07-04 00:32:32,0
Er18gmgqy2k,The Sandman: Season 2 | Official Trailer | Netflix,UCWOA1ZGywLbqmigxE4Qlvuw,Netflix,2025-06-17T13:00:02Z,Ugx8v7nnItIV90yM8_J4AaABAg.AK8NLJQDaHAAK9tYc-mBcV,Ugx8v7nnItIV90yM8_J4AaABAg,@blxckmastr,UC_AExdWrZoSRUP1RCjP14Xg,"​@blue1watersorry but if every character is black, gay or fat or even all of them obove everything just feels weird and forced. If you dont feel the same thats ok, but i couldnt watch it longer than 30 min",en,2025-07-04T17:02:18Z,2025-07-04 13:02:18,0
Er18gmgqy2k,The Sandman: Season 2 | Official Trailer | Netflix,UCWOA1ZGywLbqmigxE4Qlvuw,Netflix,2025-06-17T13:00:02Z,Ugyw28zXLcrC09SiQ1N4AaABAg.AK7i4Bbh6mBAK7lGbwV49B,Ugyw28zXLcrC09SiQ1N4AaABAg,@DubeIncorperated,UCdoQcLnvTifuca14FK7svog,This was in season 1 as well.,en,2025-07-03T21:11:27Z,2025-07-03 17:11:27,2
Er18gmgqy2k,The Sandman: Season 2 | Official Trailer | Netflix,UCWOA1ZGywLbqmigxE4Qlvuw,Netflix,2025-06-17T13:00:02Z,Ugyw28zXLcrC09SiQ1N4AaABAg.AK7i4Bbh6mBAK8YyeGSiA1,Ugyw28zXLcrC09SiQ1N4AaABAg,@dudududupa4018,UCRCZ4EYUker-A_o_avHZbqg,"bad rage bait, try harder",NA,2025-07-04T04:34:30Z,2025-07-04 00:34:30,0
Er18gmgqy2k,The Sandman: Season 2 | Official Trailer | Netflix,UCWOA1ZGywLbqmigxE4Qlvuw,Netflix,2025-06-17T13:00:02Z,Ugyw28zXLcrC09SiQ1N4AaABAg.AK7i4Bbh6mBAK9tkXXDvya,Ugyw28zXLcrC09SiQ1N4AaABAg,@blxckmastr,UC_AExdWrZoSRUP1RCjP14Xg,"""Lets make all characters black, gay and fat and call it a day"" -Netflix",en,2025-07-04T17:04:03Z,2025-07-04 13:04:03,0
Er18gmgqy2k,The Sandman: Season 2 | Official Trailer | Netflix,UCWOA1ZGywLbqmigxE4Qlvuw,Netflix,2025-06-17T13:00:02Z,Ugw2LH_GNwzpTDuaO714AaABAg.AK7gJ628APjAK82nV-Gn_B,Ugw2LH_GNwzpTDuaO714AaABAg,@synthzz9178,UCjHn_C-D7ZsDN7ddA0cOfDg,"Don't be ashamed, feel free to write it on youtube",en,2025-07-03T23:53:22Z,2025-07-03 19:53:22,0
Er18gmgqy2k,The Sandman: Season 2 | Official Trailer | Netflix,UCWOA1ZGywLbqmigxE4Qlvuw,Netflix,2025-06-17T13:00:02Z,Ugw2LH_GNwzpTDuaO714AaABAg.AK7gJ628APjAK8mGnFLagR,Ugw2LH_GNwzpTDuaO714AaABAg,@chloroperoxybenzoicacid,UCLMlIJDhotf3AUt28bNWQ7A,Pea brain can't evwn understand simple things,en,2025-07-04T06:39:27Z,2025-07-04 02:39:27,0
Er18gmgqy2k,The Sandman: Season 2 | Official Trailer | Netflix,UCWOA1ZGywLbqmigxE4Qlvuw,Netflix,2025-06-17T13:00:02Z,Ugxe15fRG6ewzYn86lp4AaABAg.AK7YHOzFsYgAK7gCrY-aX4,Ugxe15fRG6ewzYn86lp4AaABAg,@gamerchickenmomo7572,UCXc935IVAkSujmV3YL4UXPQ,Don't watch it's boring,NA,2025-07-03T20:27:15Z,2025-07-03 16:27:15,0
Er18gmgqy2k,The Sandman: Season 2 | Official Trailer | Netflix,UCWOA1ZGywLbqmigxE4Qlvuw,Netflix,2025-06-17T13:00:02Z,Ugxe15fRG6ewzYn86lp4AaABAg.AK7YHOzFsYgAK7gp4jTFHJ,Ugxe15fRG6ewzYn86lp4AaABAg,@aphrodite4473,UCkInR5qtBBCQSbhjrWmoPnA,"@gamerchickenmomo7572Really?,well thanks for letting me know from your opinion .",en,2025-07-03T20:32:36Z,2025-07-03 16:32:36,0
Er18gmgqy2k,The Sandman: Season 2 | Official Trailer | Netflix,UCWOA1ZGywLbqmigxE4Qlvuw,Netflix,2025-06-17T13:00:02Z,UgzuNrGzm3zggyc-Dy14AaABAg.AK6mHo3g7VwAKB4Wk0nI89,UgzuNrGzm3zggyc-Dy14AaABAg,@throneofheros8755,UCRBzIslyO9B09yhj3GRlAuw,It follows the comic,NA,2025-07-05T04:06:08Z,2025-07-05 00:06:08,0
Er18gmgqy2k,The Sandman: Season 2 | Official Trailer | Netflix,UCWOA1ZGywLbqmigxE4Qlvuw,Netflix,2025-06-17T13:00:02Z,UgxOxJgi75oDZnHS1Ix4AaABAg.AK6ZVSoDPrqAK83wBUaRCw,UgxOxJgi75oDZnHS1Ix4AaABAg,@synthzz9178,UCjHn_C-D7ZsDN7ddA0cOfDg,"Of course it's better, who cares there won't be a third season in any case.",en,2025-07-04T00:03:18Z,2025-07-03 20:03:18,1
Er18gmgqy2k,The Sandman: Season 2 | Official Trailer | Netflix,UCWOA1ZGywLbqmigxE4Qlvuw,Netflix,2025-06-17T13:00:02Z,UgxOxJgi75oDZnHS1Ix4AaABAg.AK6ZVSoDPrqAK8VqP55SuP,UgxOxJgi75oDZnHS1Ix4AaABAg,@frostyt6458,UCfehL7xDt0zEutpwstPKmfg,Yes really sad 😭​@synthzz9178,mg,2025-07-04T04:07:10Z,2025-07-04 00:07:10,0
Er18gmgqy2k,The Sandman: Season 2 | Official Trailer | Netflix,UCWOA1ZGywLbqmigxE4Qlvuw,Netflix,2025-06-17T13:00:02Z,UgxOxJgi75oDZnHS1Ix4AaABAg.AK6ZVSoDPrqAK8Y67YFfpg,UgxOxJgi75oDZnHS1Ix4AaABAg,@frostyt6458,UCfehL7xDt0zEutpwstPKmfg,"Yes, ​Really sad 😭 ​@synthzz9178",mg,2025-07-04T04:26:55Z,2025-07-04 00:26:55,0
Er18gmgqy2k,The Sandman: Season 2 | Official Trailer | Netflix,UCWOA1ZGywLbqmigxE4Qlvuw,Netflix,2025-06-17T13:00:02Z,UgxOxJgi75oDZnHS1Ix4AaABAg.AK6ZVSoDPrqAK8v5KvDzRI,UgxOxJgi75oDZnHS1Ix4AaABAg,@frostyt6458,UCfehL7xDt0zEutpwstPKmfg,Yed sad 😭​@synthzz9178,NA,2025-07-04T07:56:32Z,2025-07-04 03:56:32,1
Er18gmgqy2k,The Sandman: Season 2 | Official Trailer | Netflix,UCWOA1ZGywLbqmigxE4Qlvuw,Netflix,2025-06-17T13:00:02Z,Ugwu2nw5rAOkiHIrji54AaABAg.AK6JsZx-2Z0AK6ZcOlssFz,Ugwu2nw5rAOkiHIrji54AaABAg,@frostyt6458,UCfehL7xDt0zEutpwstPKmfg,Thanks for information bro,en,2025-07-03T10:01:43Z,2025-07-03 06:01:43,2
Er18gmgqy2k,The Sandman: Season 2 | Official Trailer | Netflix,UCWOA1ZGywLbqmigxE4Qlvuw,Netflix,2025-06-17T13:00:02Z,Ugwu2nw5rAOkiHIrji54AaABAg.AK6JsZx-2Z0AK96y0XeExE,Ugwu2nw5rAOkiHIrji54AaABAg,@STELLADIMITRIADOU,UCmpH46MJdQ_cTILFrmZNrCw,"MORE EPISODES  ?
THANK YOU 🎉",gl,2025-07-04T09:48:59Z,2025-07-04 05:48:59,2
Er18gmgqy2k,The Sandman: Season 2 | Official Trailer | Netflix,UCWOA1ZGywLbqmigxE4Qlvuw,Netflix,2025-06-17T13:00:02Z,Ugwu2nw5rAOkiHIrji54AaABAg.AK6JsZx-2Z0AK9KyJyjUyB,Ugwu2nw5rAOkiHIrji54AaABAg,@frostyt6458,UCfehL7xDt0zEutpwstPKmfg,yes Yayyy ​@STELLADIMITRIADOU,ru-Latn,2025-07-04T11:51:22Z,2025-07-04 07:51:22,1
Er18gmgqy2k,The Sandman: Season 2 | Official Trailer | Netflix,UCWOA1ZGywLbqmigxE4Qlvuw,Netflix,2025-06-17T13:00:02Z,UgwRdh6eCizSORSHn_p4AaABAg.AK5soc7GgAKAK6YV11eGKz,UgwRdh6eCizSORSHn_p4AaABAg,@RoxTeeman,UC2IZ_Xv1Pc8IZKpdWuvboIQ,How is it dumb ? He is going to hurt him and doesn’t feel like lying,en,2025-07-03T09:51:50Z,2025-07-03 05:51:50,0
Er18gmgqy2k,The Sandman: Season 2 | Official Trailer | Netflix,UCWOA1ZGywLbqmigxE4Qlvuw,Netflix,2025-06-17T13:00:02Z,UgwRdh6eCizSORSHn_p4AaABAg.AK5soc7GgAKAK6qtvolRu4,UgwRdh6eCizSORSHn_p4AaABAg,@MindlessYouTube,UCoQuNUl9cnuwkBU3bdcaumg,​@RoxTeeman so he can't make a simple compromise and not hurt someone still seems dumb.,en,2025-07-03T12:41:24Z,2025-07-03 08:41:24,0
Er18gmgqy2k,The Sandman: Season 2 | Official Trailer | Netflix,UCWOA1ZGywLbqmigxE4Qlvuw,Netflix,2025-06-17T13:00:02Z,UgwRdh6eCizSORSHn_p4AaABAg.AK5soc7GgAKAK84Vidkc9w,UgwRdh6eCizSORSHn_p4AaABAg,@synthzz9178,UCjHn_C-D7ZsDN7ddA0cOfDg,​@RoxTeemando you even reply to this bs? 😂,en,2025-07-04T00:08:16Z,2025-07-03 20:08:16,0
