video_id,video_url,comment_id,comment_author_display,comment_author_channel_id,comment_content,comment_lang,comment_time_utc,comment_time_local,comment_like_count,comment_reply_count,reply_id,reply_author_display,reply_author_channel_id,reply_content,reply_lang,reply_time_utc,reply_time_local,reply_like_count,view_count,like_count,comment_count,crawl_time
SgKpEeduwh0,https://www.youtube.com/watch?v=SgKpEeduwh0,UgyLHchKwVTo6brmpid4AaABAg,@seangotts6470,UCdQHEylYvIqIL2asSVKq4Qw,woke dogshit,ny,2025-10-30T19:34:17Z,2025-10-30 15:34:17,0,1,UgyLHchKwVTo6brmpid4AaABAg.AOv-k38V_EAAPlXYKqY_st,@Guesswhay,UCuhIyEV7pfxTWEHjMgFj44Q,Woke means to be aware of injustice you dumbfuck,en,2025-11-20T23:48:38Z,2025-11-20 18:48:38,0,1657021,19553,730,"Wed, 17 Dec 2025 14:21:23 GMT"
SgKpEeduwh0,https://www.youtube.com/watch?v=SgKpEeduwh0,UgwPN2Nj-kCge06JdZ14AaABAg,@japacapa,UC8fJbqcCjYBQa6l9RG_hUrA,"fun movie, I liked it... as a guy I only wish they cast a cute girl for the lead role, but I guess that's the woke time we live in, main characters in movies and games can't be too pretty",en,2025-10-18T08:17:18Z,2025-10-18 04:17:18,0,1,UgwPN2Nj-kCge06JdZ14AaABAg.AOPtjCXmiUDAPlX_fqm_O0,@Guesswhay,UCuhIyEV7pfxTWEHjMgFj44Q,Woke means to be aware of injustice you dumb shit,en,2025-11-20T23:48:57Z,2025-11-20 18:48:57,0,1657021,19553,730,"Wed, 17 Dec 2025 14:21:23 GMT"
SgKpEeduwh0,https://www.youtube.com/watch?v=SgKpEeduwh0,UgyfOAIAUUPqeJ5ZvJV4AaABAg,@wishingonthemoon1,UCur4gzmbjaE1NCXtD4iRegA,"As someone who doesn’t like romantic comedies, this was SO GOOD. I was invested hardcore.",en,2025-09-30T18:54:26Z,2025-09-30 14:54:26,23,2,UgyfOAIAUUPqeJ5ZvJV4AaABAg.ANhgL-x359IAOg354H5uRk,@alana3332,UCyKOXIM3v_2SmwOCQ4G1AYQ,Same! I really enjoyed it!,zu,2025-10-25T00:14:53Z,2025-10-24 20:14:53,1,1657021,19553,730,"Wed, 17 Dec 2025 14:21:23 GMT"
SgKpEeduwh0,https://www.youtube.com/watch?v=SgKpEeduwh0,UgyfOAIAUUPqeJ5ZvJV4AaABAg,@wishingonthemoon1,UCur4gzmbjaE1NCXtD4iRegA,"As someone who doesn’t like romantic comedies, this was SO GOOD. I was invested hardcore.",en,2025-09-30T18:54:26Z,2025-09-30 14:54:26,23,2,UgyfOAIAUUPqeJ5ZvJV4AaABAg.ANhgL-x359IAP-y_6WKiQO,@STUNND-1,UCcWqWgjpV_OJd1K_myR0-aQ,reall i usually hate romcoms but this one was actually really good!!,en,2025-11-02T03:10:45Z,2025-11-01 23:10:45,1,1657021,19553,730,"Wed, 17 Dec 2025 14:21:23 GMT"
SgKpEeduwh0,https://www.youtube.com/watch?v=SgKpEeduwh0,UgzRl9w8mz2g2OWWXs14AaABAg,@harrisonthompson6823,UCEZTEP1Z9psxddG_4qLxfHg,"I would walk 40 kms to stradle any iron beast that rocks my world for 3 and a half minutes. I am the king of roller coasters. I have conquered 99 double black diamonds in my 39 years of international critical coasting, and I've never screamed once. I will say, despite being a disgrace to the Cheter name, he could teach history of the modern keyboard configuration like a son of a bitch. AAAAAAAAAHHHHHH!!!!!!!! AAAAAAAAAAHHHHHHHHH!!!!!! IM GONNA DIE!!! AAAAAHHHHH!!!! The real roller coaster is the blisters we made along the way.",en,2025-09-28T04:44:39Z,2025-09-28 00:44:39,0,1,UgzRl9w8mz2g2OWWXs14AaABAg.ANb0VBhUCt0ANb0eYDwrsb,@kristenregular9846,UC8HaIt-Bmono08PdDfm5eOQ,"iCarly actress Miranda boobs 4K photos and videos POV. T'was the griddy that killed my feet. And I just """"""had to apologize"""""" for dispelling my tummy secretions on her bosom but I didn't really feel all that bad. But that's just how they taught physics back in the day - if rolling coaster 1 is travelling backwards at the speed of light toward de Maisonneuve, and rolling coaster B is travelling at a 360 degree angle at 13.45 km/h towards HEAVEN what is the PROJECTION of my VOMIT PLEASE CALCULATE VISCOSITY IN JOULES PER HOUR AMEN. Understandably, walking on rollercoasters is discouraged in most Western cultures - but little did they know at Canada's La Ronde WonderTown that I, CheterW, the GRANDFATHER of DAVID, AM FROM THE EAST COAST.",en,2025-09-28T04:46:04Z,2025-09-28 00:46:04,0,1657021,19553,730,"Wed, 17 Dec 2025 14:21:23 GMT"
SgKpEeduwh0,https://www.youtube.com/watch?v=SgKpEeduwh0,UgxFemyf6dpDYPrtrF14AaABAg,@aafkgirl91,UCW9hi85B8AdSU-zvW6TbDXg,It's a really good movie 🥰,en,2025-09-19T22:07:59Z,2025-09-19 18:07:59,0,1,UgxFemyf6dpDYPrtrF14AaABAg.ANGhjyENFRWAQVzZdMbLKY,@husseinattas2083,UCFybNCNL6RT8ft6zEVKO3Vw,"No, Not really good movie 😭",mg,2025-12-09T10:06:31Z,2025-12-09 05:06:31,0,1657021,19553,730,"Wed, 17 Dec 2025 14:21:23 GMT"
SgKpEeduwh0,https://www.youtube.com/watch?v=SgKpEeduwh0,UgzSaytQkWxKH0oKlj94AaABAg,@ichchabata3455,UCfLx4tcLW8d-_mzgzf7FXCg,One word must watch! ❤,en,2025-09-19T14:38:37Z,2025-09-19 10:38:37,1,2,UgzSaytQkWxKH0oKlj94AaABAg.ANFuJkJlE32ANJcbGO6s5Y,@HeyItsLizzyK,UC7_mScoBY4jWFXkC7pVj8pQ,Two words?,en,2025-09-21T01:20:50Z,2025-09-20 21:20:50,0,1657021,19553,730,"Wed, 17 Dec 2025 14:21:23 GMT"
SgKpEeduwh0,https://www.youtube.com/watch?v=SgKpEeduwh0,UgzSaytQkWxKH0oKlj94AaABAg,@ichchabata3455,UCfLx4tcLW8d-_mzgzf7FXCg,One word must watch! ❤,en,2025-09-19T14:38:37Z,2025-09-19 10:38:37,1,2,UgzSaytQkWxKH0oKlj94AaABAg.ANFuJkJlE32ANJu_YA_MUT,@ichchabata3455,UCfLx4tcLW8d-_mzgzf7FXCg,😁,ja,2025-09-21T03:57:53Z,2025-09-20 23:57:53,1,1657021,19553,730,"Wed, 17 Dec 2025 14:21:23 GMT"
SgKpEeduwh0,https://www.youtube.com/watch?v=SgKpEeduwh0,UgzqdOPAET1wcAL8KB94AaABAg,@ljubisapanic4074,UCpEpiGpRJfwBJ1F-6-bCEiw,Even trailer sucks,NA,2025-09-19T13:35:46Z,2025-09-19 09:35:46,1,1,UgzqdOPAET1wcAL8KB94AaABAg.ANFn7NxiNZtANH7GxZlRSO,@francescas2872,UCfalWpw_PRjoHBife7hC8LQ,Right? This is such a stupid movie!,en,2025-09-20T01:59:49Z,2025-09-19 21:59:49,0,1657021,19553,730,"Wed, 17 Dec 2025 14:21:23 GMT"
SgKpEeduwh0,https://www.youtube.com/watch?v=SgKpEeduwh0,UgytK2pElB08FgTm5Nl4AaABAg,@wes-leepeertum2505,UCgDw9WmXE4QO8IIoWQ7jqsg,I hate that movie because it's like only romantic. i would like more action like the one in the bar where she kicked the ass of that guy it's only scenes that I like the rest has no interest,en,2025-09-18T18:15:00Z,2025-09-18 14:15:00,1,1,UgytK2pElB08FgTm5Nl4AaABAg.ANDiHfMP2xKANKhKknVi1G,@nunolourenco5984,UCDl2N6hFLp9udQZjlggfWFA,No one cares about your opinion,en,2025-09-21T11:21:22Z,2025-09-21 07:21:22,0,1657021,19553,730,"Wed, 17 Dec 2025 14:21:23 GMT"
SgKpEeduwh0,https://www.youtube.com/watch?v=SgKpEeduwh0,UgyOUuxYK393P-04BB94AaABAg,@tusjinn9274,UCSK5peCzUGgu-J0-BGAadiw,Oh it definitely was a good watch. I expected myself to cringe so hard but Miranda’s acting was so good so I mostly didn’t,en,2025-09-17T16:42:48Z,2025-09-17 12:42:48,12,1,UgyOUuxYK393P-04BB94AaABAg.ANAywSLZhxGANFrwIySkWY,@fishmaker55,UCidsjYBvi12OPeGolcB9eVg,"I agree, Miranda is so cute and stunning, she makes everything looks fun and natural, I really love her ✨",en,2025-09-19T14:17:49Z,2025-09-19 10:17:49,0,1657021,19553,730,"Wed, 17 Dec 2025 14:21:23 GMT"
SgKpEeduwh0,https://www.youtube.com/watch?v=SgKpEeduwh0,UgwMavCqrn9hlZhJrUF4AaABAg,@hyorin4557,UCSma1zWXH4Ci_RRyfJnBTAA,this movie has potential but the plot felt rushed towards the end and as much as I adore Miranda but her acting is not as I expected...,en,2025-09-16T13:09:46Z,2025-09-16 09:09:46,1,1,UgwMavCqrn9hlZhJrUF4AaABAg.AN80lFftcYPANH8FQhtPMu,@francescas2872,UCfalWpw_PRjoHBife7hC8LQ,Right?!??,NA,2025-09-20T02:08:21Z,2025-09-19 22:08:21,0,1657021,19553,730,"Wed, 17 Dec 2025 14:21:23 GMT"
SgKpEeduwh0,https://www.youtube.com/watch?v=SgKpEeduwh0,UgzPHoSIbXBEbVk2G9F4AaABAg,@Raequanjamar,UCehMB8S03SI6jGI_RoNgV2Q,"This was actually a good watch , had me bout to cry 😭",en,2025-09-16T04:40:01Z,2025-09-16 00:40:01,1,1,UgzPHoSIbXBEbVk2G9F4AaABAg.AN76QjHJczTANDX9md_Lel,@BossBabeTrade,UCXK6b9sxWXuzCqFcI4WCDAQ,I cried 😂,haw,2025-09-18T16:29:04Z,2025-09-18 12:29:04,1,1657021,19553,730,"Wed, 17 Dec 2025 14:21:23 GMT"
SgKpEeduwh0,https://www.youtube.com/watch?v=SgKpEeduwh0,UgyMU7C04X0zh9JEgyd4AaABAg,@ratedrachel3670,UCzk5o2bjzOE5TQyiJhwGtJg,"This looks fun. She's going to choose Paris France!! If she chooses him, you know conservatives have successfully pushed their agenda 😂",en,2025-09-15T20:58:35Z,2025-09-15 16:58:35,0,2,UgyMU7C04X0zh9JEgyd4AaABAg.AN6HcCNSvWOAN7FFMwoo_X,@JuiicyDrew,UCAu9U2brUFKeZ0Qxgx8ccwA,Sybau.,NA,2025-09-16T05:57:06Z,2025-09-16 01:57:06,1,1657021,19553,730,"Wed, 17 Dec 2025 14:21:23 GMT"
SgKpEeduwh0,https://www.youtube.com/watch?v=SgKpEeduwh0,UgyMU7C04X0zh9JEgyd4AaABAg,@ratedrachel3670,UCzk5o2bjzOE5TQyiJhwGtJg,"This looks fun. She's going to choose Paris France!! If she chooses him, you know conservatives have successfully pushed their agenda 😂",en,2025-09-15T20:58:35Z,2025-09-15 16:58:35,0,2,UgyMU7C04X0zh9JEgyd4AaABAg.AN6HcCNSvWOAN8BSQNamo4,@k.k8291,UCEvZgkpSSjOo4cBHuwJqtgg,🙄🙄🙄,ja,2025-09-16T14:43:10Z,2025-09-16 10:43:10,0,1657021,19553,730,"Wed, 17 Dec 2025 14:21:23 GMT"
SgKpEeduwh0,https://www.youtube.com/watch?v=SgKpEeduwh0,UgwSea_Q1s_JcoDPJQ54AaABAg,@MyCamille,UC6ijsTwdy3fxj9GHxVfmc1w,I loved this movie! Best one I have seen this year!,en,2025-09-14T23:45:30Z,2025-09-14 19:45:30,1,1,UgwSea_Q1s_JcoDPJQ54AaABAg.AN4-vmrNRm6AQVzfnV4RTu,@husseinattas2083,UCFybNCNL6RT8ft6zEVKO3Vw,Not really!,en,2025-12-09T10:07:30Z,2025-12-09 05:07:30,0,1657021,19553,730,"Wed, 17 Dec 2025 14:21:23 GMT"
SgKpEeduwh0,https://www.youtube.com/watch?v=SgKpEeduwh0,UgyiN6s3vB-_eEk-5nt4AaABAg,@crislem7492,UCn7qwkpVu6vtugwCN6Fct0A,"I laugh so hard watching this movie, while watching it I couldn’t stop thinking about the Bachelor and how silly that is lol",en,2025-09-14T03:41:23Z,2025-09-13 23:41:23,12,1,UgyiN6s3vB-_eEk-5nt4AaABAg.AN1r7c4fgXzAN3Rx_3L8ST,@melc_91,UCySgVf2-LNAAP2BxM2KVb0Q,lol same i thought about the bachelor as well,en,2025-09-14T18:31:10Z,2025-09-14 14:31:10,0,1657021,19553,730,"Wed, 17 Dec 2025 14:21:23 GMT"
SgKpEeduwh0,https://www.youtube.com/watch?v=SgKpEeduwh0,UgyqUAZ7gFzEn_ijkYF4AaABAg,@jaybaby1995,UC6jj4cbjsgyOE9SJ2LIFnRg,Netflix this show was so good I was taken aback ….the lead had actual chemistry and can act …..please no more ‘Oxford year’ disasters…,en,2025-09-13T19:45:06Z,2025-09-13 15:45:06,53,1,UgyqUAZ7gFzEn_ijkYF4AaABAg.AN1-cDgufvFANEtNgCSHaE,@melspati,UCdULoEl2uuDU2phSi0r6kXQ,I gave it 2 thumbs up...hope they get the message,en,2025-09-19T05:11:11Z,2025-09-19 01:11:11,5,1657021,19553,730,"Wed, 17 Dec 2025 14:21:23 GMT"
SgKpEeduwh0,https://www.youtube.com/watch?v=SgKpEeduwh0,UgxGNN_AVVkeGSLXdGJ4AaABAg,@GG80s,UC9jm9mLXeXGGlDYBoeCALoQ,Paris is overrated 😂,la,2025-08-26T23:19:55Z,2025-08-26 19:19:55,1,1,UgxGNN_AVVkeGSLXdGJ4AaABAg.AMJ1tplcgV1AMNK7rPZf5n,@lastdayonearthmysteryman4849,UCMw1tEHL8ijpNBjRYK1fUbw,which one?,en,2025-08-28T15:16:13Z,2025-08-28 11:16:13,1,1657021,19553,730,"Wed, 17 Dec 2025 14:21:23 GMT"
SgKpEeduwh0,https://www.youtube.com/watch?v=SgKpEeduwh0,Ugzk56QDBWHD0gkjixF4AaABAg,@scottibrown3274,UCOjRCkf2baGJi4EYwOe7vRA,"No lie, I will watch this as soon as it’s released",en,2025-08-11T01:26:26Z,2025-08-10 21:26:26,4,1,Ugzk56QDBWHD0gkjixF4AaABAg.ALf3eUdLvNUAOI8WOwBn4K,@WilliamsKimberly-w1g,UCP3N5ctvnq6SPWgayx0YWgg,We can watch together,en,2025-10-15T08:01:18Z,2025-10-15 04:01:18,0,1657021,19553,730,"Wed, 17 Dec 2025 14:21:23 GMT"
SgKpEeduwh0,https://www.youtube.com/watch?v=SgKpEeduwh0,Ugy5Ig3xGfprVTAa0hV4AaABAg,@lilypichon8221,UCM9GumYAUCqfJkwp-y4n8uA,I just watched the whole movie,en,2025-08-10T22:24:17Z,2025-08-10 18:24:17,3,1,Ugy5Ig3xGfprVTAa0hV4AaABAg.ALejoOQZXzjAOlcQZqVa1w,@ribua-h4j,UCAdEVpo3dk3JvuaX9vEUlBA,what is the title plis,en,2025-10-27T04:08:36Z,2025-10-27 00:08:36,0,1657021,19553,730,"Wed, 17 Dec 2025 14:21:23 GMT"
SgKpEeduwh0,https://www.youtube.com/watch?v=SgKpEeduwh0,UgyX2kUkb0ozys_BsZh4AaABAg,@wildpinehomestead,UCX1phCoqIKhozLIrXyeOUGw,As someone who lives 30 minutes from Paris TX this is wildly inaccurate 😂 The terrain and men look nothing like this 😅,en,2025-08-09T16:45:42Z,2025-08-09 12:45:42,96,6,UgyX2kUkb0ozys_BsZh4AaABAg.ALbZGciNkOoALf41E6hz6C,@jouaienttoi,UC7YoEFWCrFzT9wJ9hE-9sqg,"As far as the terrain, it was filmed in British Columbia.",NA,2025-08-11T01:29:41Z,2025-08-10 21:29:41,17,1657021,19553,730,"Wed, 17 Dec 2025 14:21:23 GMT"
SgKpEeduwh0,https://www.youtube.com/watch?v=SgKpEeduwh0,UgyX2kUkb0ozys_BsZh4AaABAg,@wildpinehomestead,UCX1phCoqIKhozLIrXyeOUGw,As someone who lives 30 minutes from Paris TX this is wildly inaccurate 😂 The terrain and men look nothing like this 😅,en,2025-08-09T16:45:42Z,2025-08-09 12:45:42,96,6,UgyX2kUkb0ozys_BsZh4AaABAg.ALbZGciNkOoALf4N8dxXuJ,@wildpinehomestead,UCX1phCoqIKhozLIrXyeOUGw,​@jouaienttoi oh I know it was.,en,2025-08-11T01:32:40Z,2025-08-10 21:32:40,3,1657021,19553,730,"Wed, 17 Dec 2025 14:21:23 GMT"
SgKpEeduwh0,https://www.youtube.com/watch?v=SgKpEeduwh0,UgyX2kUkb0ozys_BsZh4AaABAg,@wildpinehomestead,UCX1phCoqIKhozLIrXyeOUGw,As someone who lives 30 minutes from Paris TX this is wildly inaccurate 😂 The terrain and men look nothing like this 😅,en,2025-08-09T16:45:42Z,2025-08-09 12:45:42,96,6,UgyX2kUkb0ozys_BsZh4AaABAg.ALbZGciNkOoALnKA9MZohn,@Cowgirl99,UCsdzkpLSlHhbtRk5Q20Cjvw,Fr lol😂! I live an 1 from Paris TX🤠!,NA,2025-08-14T06:24:38Z,2025-08-14 02:24:38,1,1657021,19553,730,"Wed, 17 Dec 2025 14:21:23 GMT"
SgKpEeduwh0,https://www.youtube.com/watch?v=SgKpEeduwh0,UgyX2kUkb0ozys_BsZh4AaABAg,@wildpinehomestead,UCX1phCoqIKhozLIrXyeOUGw,As someone who lives 30 minutes from Paris TX this is wildly inaccurate 😂 The terrain and men look nothing like this 😅,en,2025-08-09T16:45:42Z,2025-08-09 12:45:42,96,6,UgyX2kUkb0ozys_BsZh4AaABAg.ALbZGciNkOoAMxH2JEea7d,@guitarstalkandtech9085,UCUcSY3gJkItkcrjZcUoVtVQ,And women look nothing like this!!,en,2025-09-11T23:41:09Z,2025-09-11 19:41:09,1,1657021,19553,730,"Wed, 17 Dec 2025 14:21:23 GMT"
SgKpEeduwh0,https://www.youtube.com/watch?v=SgKpEeduwh0,UgyX2kUkb0ozys_BsZh4AaABAg,@wildpinehomestead,UCX1phCoqIKhozLIrXyeOUGw,As someone who lives 30 minutes from Paris TX this is wildly inaccurate 😂 The terrain and men look nothing like this 😅,en,2025-08-09T16:45:42Z,2025-08-09 12:45:42,96,6,UgyX2kUkb0ozys_BsZh4AaABAg.ALbZGciNkOoAMzlEpnB5-a,@Ranger1287j,UCqLUraCZv714a27V5_BNnow,"As someone who actually lives and works in Paris, TX, the only thing they got accurate was the Red River Memorial aerial shoot! Rofl",en,2025-09-12T22:52:13Z,2025-09-12 18:52:13,4,1657021,19553,730,"Wed, 17 Dec 2025 14:21:23 GMT"
SgKpEeduwh0,https://www.youtube.com/watch?v=SgKpEeduwh0,UgyX2kUkb0ozys_BsZh4AaABAg,@wildpinehomestead,UCX1phCoqIKhozLIrXyeOUGw,As someone who lives 30 minutes from Paris TX this is wildly inaccurate 😂 The terrain and men look nothing like this 😅,en,2025-08-09T16:45:42Z,2025-08-09 12:45:42,96,6,UgyX2kUkb0ozys_BsZh4AaABAg.ALbZGciNkOoANMiQapZY1B,@barbarasmall2821,UCpEEbMoLnjFbdB8UoQeFLxg,"​@Ranger1287jI'm close to Houston. It would take me 5 hours and 7 minutes to get to Paris,Texas 😂 I looked it up. I wish it would have been filmed there so I could go visit and take pictures of where the movie was filmed. Texas is a great place, they should have kept it here! JS",en,2025-09-22T06:09:23Z,2025-09-22 02:09:23,1,1657021,19553,730,"Wed, 17 Dec 2025 14:21:23 GMT"
SgKpEeduwh0,https://www.youtube.com/watch?v=SgKpEeduwh0,Ugy80jhvkeMn0DoyAS94AaABAg,@a1_xoxo1,UCYld4jrfK-cwbbbduHWMERQ,Ts does not look like Paris except the tower😭 town is ass (currently living here),en,2025-08-08T17:21:04Z,2025-08-08 13:21:04,0,1,Ugy80jhvkeMn0DoyAS94AaABAg.AL_2Wj8nPSAALc2Hlzcatq,@sydneycookie,UCI9teH1Tirvu1__cKXyDU4g,"The article I read says the movie was not filmed in Paris, TX. Maybe that brief shot of the Cowboy Hat Eiffel Tower with the Veterans Memorial is the only one they filmed",en,2025-08-09T21:16:44Z,2025-08-09 17:16:44,0,1657021,19553,730,"Wed, 17 Dec 2025 14:21:23 GMT"
SgKpEeduwh0,https://www.youtube.com/watch?v=SgKpEeduwh0,UgyWyJTPOCPZOiWYm394AaABAg,@lukemorrison4791,UCXSUZ910y8VnUcnEgKUi3mA,I’m happy she’s getting more projects. She’s a talented actress.,en,2025-08-08T15:01:24Z,2025-08-08 11:01:24,70,2,UgyWyJTPOCPZOiWYm394AaABAg.ALZnXpqXgGhAQWJGhv8ruR,@husseinattas2083,UCFybNCNL6RT8ft6zEVKO3Vw,I don’t like this movie it’s so lame!,en,2025-12-09T13:07:26Z,2025-12-09 08:07:26,0,1657021,19553,730,"Wed, 17 Dec 2025 14:21:23 GMT"
SgKpEeduwh0,https://www.youtube.com/watch?v=SgKpEeduwh0,UgyWyJTPOCPZOiWYm394AaABAg,@lukemorrison4791,UCXSUZ910y8VnUcnEgKUi3mA,I’m happy she’s getting more projects. She’s a talented actress.,en,2025-08-08T15:01:24Z,2025-08-08 11:01:24,70,2,UgyWyJTPOCPZOiWYm394AaABAg.ALZnXpqXgGhAQXFJ9eE8wG,@lukemorrison4791,UCXSUZ910y8VnUcnEgKUi3mA,@husseinattas2083yeah but I like her acting.,sn,2025-12-09T21:52:03Z,2025-12-09 16:52:03,0,1657021,19553,730,"Wed, 17 Dec 2025 14:21:23 GMT"
SgKpEeduwh0,https://www.youtube.com/watch?v=SgKpEeduwh0,UgyGvzvqKkSHpOfLA2h4AaABAg,@strawberriesncandii,UCCnToAM7an3R6xA2XvMij2Q,I’m so glad we have a rom com. I want this genre to make a comeback.,en,2025-08-08T10:53:25Z,2025-08-08 06:53:25,107,2,UgyGvzvqKkSHpOfLA2h4AaABAg.ALZM9_QocPbAL__yuuvN7Z,@kgal1298,UCYBXBK7QmID7Z0BaMcAR6ZQ,Theres more in production now I think they realized we actually watch these,en,2025-08-08T22:22:09Z,2025-08-08 18:22:09,11,1657021,19553,730,"Wed, 17 Dec 2025 14:21:23 GMT"
SgKpEeduwh0,https://www.youtube.com/watch?v=SgKpEeduwh0,UgyGvzvqKkSHpOfLA2h4AaABAg,@strawberriesncandii,UCCnToAM7an3R6xA2XvMij2Q,I’m so glad we have a rom com. I want this genre to make a comeback.,en,2025-08-08T10:53:25Z,2025-08-08 06:53:25,107,2,UgyGvzvqKkSHpOfLA2h4AaABAg.ALZM9_QocPbANFuKphw5_6,@pumpupthejam28,UC_yeDyDkhtnkWR2EtSKHsAw,Agreed!  💯. Want to add new movies to my romcom list of watch over and over,en,2025-09-19T14:38:46Z,2025-09-19 10:38:46,5,1657021,19553,730,"Wed, 17 Dec 2025 14:21:23 GMT"
SgKpEeduwh0,https://www.youtube.com/watch?v=SgKpEeduwh0,UgyN2X66UUozKKe-8k14AaABAg,@Trekapedia,UCKMuuIpDtwePlJ8VXZ5k0Xw,0:21 Kent Farm from Smallville!,NA,2025-08-08T03:23:48Z,2025-08-07 23:23:48,59,4,UgyN2X66UUozKKe-8k14AaABAg.ALYYhKwHLbUALZTgJlgTly,@person1191,UCXW4XgdbATLkZ5GE2imPo1Q,Which is funny because Miranda Cosgrove played Kid Lana Lang in the pilot episode of Smallville 😂,en,2025-08-08T11:59:12Z,2025-08-08 07:59:12,15,1657021,19553,730,"Wed, 17 Dec 2025 14:21:23 GMT"
SgKpEeduwh0,https://www.youtube.com/watch?v=SgKpEeduwh0,UgyN2X66UUozKKe-8k14AaABAg,@Trekapedia,UCKMuuIpDtwePlJ8VXZ5k0Xw,0:21 Kent Farm from Smallville!,NA,2025-08-08T03:23:48Z,2025-08-07 23:23:48,59,4,UgyN2X66UUozKKe-8k14AaABAg.ALYYhKwHLbUAL_UsmreNG2,@Trekapedia,UCKMuuIpDtwePlJ8VXZ5k0Xw,@person1191yup I remember in the commentary they mentioned the girl from iCarly had played young Lana. Good memory!,en,2025-08-08T21:28:53Z,2025-08-08 17:28:53,4,1657021,19553,730,"Wed, 17 Dec 2025 14:21:23 GMT"
SgKpEeduwh0,https://www.youtube.com/watch?v=SgKpEeduwh0,UgyN2X66UUozKKe-8k14AaABAg,@Trekapedia,UCKMuuIpDtwePlJ8VXZ5k0Xw,0:21 Kent Farm from Smallville!,NA,2025-08-08T03:23:48Z,2025-08-07 23:23:48,59,4,UgyN2X66UUozKKe-8k14AaABAg.ALYYhKwHLbUALj022tmyR2,@SKYzLxmit,UCM8IF4jEpeGdLkmZ6VUml6Q,"@person1191good memory yo.

GOATED show",en,2025-08-12T14:11:48Z,2025-08-12 10:11:48,4,1657021,19553,730,"Wed, 17 Dec 2025 14:21:23 GMT"
SgKpEeduwh0,https://www.youtube.com/watch?v=SgKpEeduwh0,UgyN2X66UUozKKe-8k14AaABAg,@Trekapedia,UCKMuuIpDtwePlJ8VXZ5k0Xw,0:21 Kent Farm from Smallville!,NA,2025-08-08T03:23:48Z,2025-08-07 23:23:48,59,4,UgyN2X66UUozKKe-8k14AaABAg.ALYYhKwHLbUAM0qY3XFzBL,@Itisactually,UCD8ShWNNbv5T8WcOiaf1Avw,​@person1191 huh?? I never noticed that,en,2025-08-19T21:45:37Z,2025-08-19 17:45:37,3,1657021,19553,730,"Wed, 17 Dec 2025 14:21:23 GMT"
SgKpEeduwh0,https://www.youtube.com/watch?v=SgKpEeduwh0,Ugx1rbmRqrikYOm9mQl4AaABAg,@regisphilbin222,UCPyqkCbVO76cv1YdYVRefjw,"I will be watching. But I hope she doesn't become yet another ""girl who didn't go to Paris"" for a small town and a man",en,2025-08-07T18:41:45Z,2025-08-07 14:41:45,0,1,Ugx1rbmRqrikYOm9mQl4AaABAg.ALXbxqwdqLaALZJLeZ1BGy,@TOXICDREAMS67,UCA8kN6OdYjfaYyKiHW5-bPQ,"Make it interesting with Miranda moving to Paris,France with Pierson Fode joining her",en,2025-08-08T10:28:51Z,2025-08-08 06:28:51,0,1657021,19553,730,"Wed, 17 Dec 2025 14:21:23 GMT"
SgKpEeduwh0,https://www.youtube.com/watch?v=SgKpEeduwh0,UgxcYRdzYbOcsd0bRGN4AaABAg,@marciamatthews4943,UCyVgtb6E9vzcBo9cxiAL2Zg,"Was any of this actually filmed in the real Paris, Texas",en,2025-08-07T15:17:08Z,2025-08-07 11:17:08,1,1,UgxcYRdzYbOcsd0bRGN4AaABAg.ALXFY9WCTnpAL_oMYbnnjX,@ringcat69,UClKN1oa-FnCxo7tA3YzVxKg,nah apparently it was flimed in Canada 💀,en,2025-08-09T00:27:50Z,2025-08-08 20:27:50,1,1657021,19553,730,"Wed, 17 Dec 2025 14:21:23 GMT"
SgKpEeduwh0,https://www.youtube.com/watch?v=SgKpEeduwh0,UgwDcqCUtOtmAi2D1jR4AaABAg,@sandramiksawrites,UCQ6OFmlBD0fs3iVdbRRJAvg,"Not even kidding, she better go to Paris at the end.",en,2025-08-07T11:35:50Z,2025-08-07 07:35:50,1646,9,UgwDcqCUtOtmAi2D1jR4AaABAg.ALWrDNjgwcjALmdidanfsh,@joydoggett1801,UCzVt9qFe8DXHOld1zY2Ifig,Honeymoon!!!!🎉,sn,2025-08-14T00:05:00Z,2025-08-13 20:05:00,6,1657021,19553,730,"Wed, 17 Dec 2025 14:21:23 GMT"
SgKpEeduwh0,https://www.youtube.com/watch?v=SgKpEeduwh0,UgwDcqCUtOtmAi2D1jR4AaABAg,@sandramiksawrites,UCQ6OFmlBD0fs3iVdbRRJAvg,"Not even kidding, she better go to Paris at the end.",en,2025-08-07T11:35:50Z,2025-08-07 07:35:50,1646,9,UgwDcqCUtOtmAi2D1jR4AaABAg.ALWrDNjgwcjALnrqghqQ2t,@TOXICDREAMS67,UCA8kN6OdYjfaYyKiHW5-bPQ,I agree. Let that charming man follow that fine lady to France,en,2025-08-14T11:27:40Z,2025-08-14 07:27:40,34,1657021,19553,730,"Wed, 17 Dec 2025 14:21:23 GMT"
SgKpEeduwh0,https://www.youtube.com/watch?v=SgKpEeduwh0,UgwDcqCUtOtmAi2D1jR4AaABAg,@sandramiksawrites,UCQ6OFmlBD0fs3iVdbRRJAvg,"Not even kidding, she better go to Paris at the end.",en,2025-08-07T11:35:50Z,2025-08-07 07:35:50,1646,9,UgwDcqCUtOtmAi2D1jR4AaABAg.ALWrDNjgwcjAM5K4DAuaMg,@laurenfaust3601,UCDKgJ_5ItfTvIeX2yNfHB3A,Haven't we all learned from Lauren Conrad to GO TO PARIS,en,2025-08-21T15:29:24Z,2025-08-21 11:29:24,13,1657021,19553,730,"Wed, 17 Dec 2025 14:21:23 GMT"
SgKpEeduwh0,https://www.youtube.com/watch?v=SgKpEeduwh0,UgwDcqCUtOtmAi2D1jR4AaABAg,@sandramiksawrites,UCQ6OFmlBD0fs3iVdbRRJAvg,"Not even kidding, she better go to Paris at the end.",en,2025-08-07T11:35:50Z,2025-08-07 07:35:50,1646,9,UgwDcqCUtOtmAi2D1jR4AaABAg.ALWrDNjgwcjAM5_9FYioji,@bm6nation,UC154la7nBolApVqrtwBNpDA,"I hope she goes to Paris, realizes that Paris is a shithole and then immediately flies back to Texas",en,2025-08-21T17:49:53Z,2025-08-21 13:49:53,0,1657021,19553,730,"Wed, 17 Dec 2025 14:21:23 GMT"
SgKpEeduwh0,https://www.youtube.com/watch?v=SgKpEeduwh0,UgwDcqCUtOtmAi2D1jR4AaABAg,@sandramiksawrites,UCQ6OFmlBD0fs3iVdbRRJAvg,"Not even kidding, she better go to Paris at the end.",en,2025-08-07T11:35:50Z,2025-08-07 07:35:50,1646,9,UgwDcqCUtOtmAi2D1jR4AaABAg.ALWrDNjgwcjAMN0kdngkUU,@dwaynebanks4194,UCQypzLL6D0zaCVBEKDnrjYA,She will go to school,NA,2025-08-28T12:26:53Z,2025-08-28 08:26:53,0,1657021,19553,730,"Wed, 17 Dec 2025 14:21:23 GMT"
SgKpEeduwh0,https://www.youtube.com/watch?v=SgKpEeduwh0,UgwDcqCUtOtmAi2D1jR4AaABAg,@sandramiksawrites,UCQ6OFmlBD0fs3iVdbRRJAvg,"Not even kidding, she better go to Paris at the end.",en,2025-08-07T11:35:50Z,2025-08-07 07:35:50,1646,9,UgwDcqCUtOtmAi2D1jR4AaABAg.ALWrDNjgwcjAMcDiidgvFy,@Art_rice,UCdVAVNOi-k48gdWX-zRO2-g,@laurenfaust3601YEAHH,NA,2025-09-03T19:28:04Z,2025-09-03 15:28:04,0,1657021,19553,730,"Wed, 17 Dec 2025 14:21:23 GMT"
SgKpEeduwh0,https://www.youtube.com/watch?v=SgKpEeduwh0,UgwDcqCUtOtmAi2D1jR4AaABAg,@sandramiksawrites,UCQ6OFmlBD0fs3iVdbRRJAvg,"Not even kidding, she better go to Paris at the end.",en,2025-08-07T11:35:50Z,2025-08-07 07:35:50,1646,9,UgwDcqCUtOtmAi2D1jR4AaABAg.ALWrDNjgwcjANIbMV8dlAi,@shashankmahalingam5254,UCUywpIEMlLt1YXMbws-JUdg,She is in Paris though,en,2025-09-20T15:50:42Z,2025-09-20 11:50:42,0,1657021,19553,730,"Wed, 17 Dec 2025 14:21:23 GMT"
SgKpEeduwh0,https://www.youtube.com/watch?v=SgKpEeduwh0,UgwDcqCUtOtmAi2D1jR4AaABAg,@sandramiksawrites,UCQ6OFmlBD0fs3iVdbRRJAvg,"Not even kidding, she better go to Paris at the end.",en,2025-08-07T11:35:50Z,2025-08-07 07:35:50,1646,9,UgwDcqCUtOtmAi2D1jR4AaABAg.ALWrDNjgwcjAPm08NPR7rV,@silvielou,UCnNJn5xvfflP4Z_yRYNk2yg,"Who cares, the dreamboat hunk is to die for!",en,2025-11-21T04:15:58Z,2025-11-20 23:15:58,0,1657021,19553,730,"Wed, 17 Dec 2025 14:21:23 GMT"
SgKpEeduwh0,https://www.youtube.com/watch?v=SgKpEeduwh0,UgwDcqCUtOtmAi2D1jR4AaABAg,@sandramiksawrites,UCQ6OFmlBD0fs3iVdbRRJAvg,"Not even kidding, she better go to Paris at the end.",en,2025-08-07T11:35:50Z,2025-08-07 07:35:50,1646,9,UgwDcqCUtOtmAi2D1jR4AaABAg.ALWrDNjgwcjAQWJ7v9E-3Y,@husseinattas2083,UCFybNCNL6RT8ft6zEVKO3Vw,I don’t like this movie it’s so lame!,en,2025-12-09T13:06:14Z,2025-12-09 08:06:14,0,1657021,19553,730,"Wed, 17 Dec 2025 14:21:23 GMT"
SgKpEeduwh0,https://www.youtube.com/watch?v=SgKpEeduwh0,UgxuvlC3NFwROV0oKCV4AaABAg,@under88Me,UC3P9YPuToPLzQzFCzJ_H-uw,I hate movies that over sexualize women and I hate movies that over sexualize men too.,en,2025-08-07T10:51:45Z,2025-08-07 06:51:45,0,1,UgxuvlC3NFwROV0oKCV4AaABAg.ALWmAQdXlk6ALZfNf6c4pR,@kevinjeni5036,UC4Pjh06R3GWPMeR_fS24PGA,I don't think this movie looks like it does that. That's why I'm not watching it.,en,2025-08-08T13:50:06Z,2025-08-08 09:50:06,1,1657021,19553,730,"Wed, 17 Dec 2025 14:21:23 GMT"
SgKpEeduwh0,https://www.youtube.com/watch?v=SgKpEeduwh0,UgwHUlYUPzEzEe2EOUt4AaABAg,@pelumiadenuga,UC-B9owzHT9LinoFNgORKBpg,"""I dont hate this, i just hate that its the only thing ive ever known"" now that was deep 😢❤😢❤😢❤",en,2025-08-07T05:26:37Z,2025-08-07 01:26:37,38,1,UgwHUlYUPzEzEe2EOUt4AaABAg.ALWBy8imVFTAQWJJbMq3pf,@husseinattas2083,UCFybNCNL6RT8ft6zEVKO3Vw,I don’t like this movie it’s so lame! 😒,en,2025-12-09T13:07:50Z,2025-12-09 08:07:50,0,1657021,19553,730,"Wed, 17 Dec 2025 14:21:23 GMT"
