video_id,video_url,comment_id,comment_author_display,comment_author_channel_id,comment_content,comment_lang,comment_time_utc,comment_time_local,comment_like_count,comment_reply_count,reply_id,reply_author_display,reply_author_channel_id,reply_content,reply_lang,reply_time_utc,reply_time_local,reply_like_count,view_count,like_count,comment_count,crawl_time
dCyvk3uyp5Q,https://www.youtube.com/watch?v=dCyvk3uyp5Q,UgyqO8hWwI2M-2M3KpF4AaABAg,@Gigi_cano,UCiPgvrcrGAD_lXYy0kM1KWQ,"1:46 WHO THE HELL WAS MAX ABT TO KISS

Edit : MAX WTH THAT SOPHIE",en,2025-06-01T13:45:20Z,2025-06-01 09:45:20,1,2,UgyqO8hWwI2M-2M3KpF4AaABAg.AIpZmEWFn_-AIpyctWwr-k,@Gigi_cano,UCiPgvrcrGAD_lXYy0kM1KWQ,@leas3174 OMG I FORGOT ABT HER BUT SHE WAS ACTUALLY BETTER THEN “ Sophie “ 🫩😤,en,2025-06-01T17:31:15Z,2025-06-01 13:31:15,1,3689174,90047,2774,"Tue, 16 Dec 2025 12:42:34 GMT"
dCyvk3uyp5Q,https://www.youtube.com/watch?v=dCyvk3uyp5Q,Ugz61zMP4rUfyj2gPl94AaABAg,@123harper_3,UCGZCoX1kHghUwyvkQpaY8_g,1:47 who is thattt??,NA,2025-06-01T01:21:09Z,2025-05-31 21:21:09,2,1,Ugz61zMP4rUfyj2gPl94AaABAg.AIoEbcvjBcGAJ0V01KyyiJ,@angelinamar00,UC6cMyai2LoYspYkFYi8OlQQ,wolfe😏😏,fy,2025-06-06T04:54:33Z,2025-06-06 00:54:33,0,3689174,90047,2774,"Tue, 16 Dec 2025 12:42:34 GMT"
dCyvk3uyp5Q,https://www.youtube.com/watch?v=dCyvk3uyp5Q,Ugw6xajr5xL00Jz8bYh4AaABAg,@polkablondebeautychickadee8668,UCK9qvVXYW9QL1caS55W9mtw,can't wait for this season will there be season 4 too? 🙏🏻🤞🏻,en,2025-05-31T17:53:08Z,2025-05-31 13:53:08,2,2,Ugw6xajr5xL00Jz8bYh4AaABAg.AInRLIR9UsVAInbVM9DEsq,@BWWiDOwzZz,UCZWiVe-rW2aV4Oi9skqd8Wg,Yea,sn,2025-05-31T19:30:38Z,2025-05-31 15:30:38,0,3689174,90047,2774,"Tue, 16 Dec 2025 12:42:34 GMT"
dCyvk3uyp5Q,https://www.youtube.com/watch?v=dCyvk3uyp5Q,Ugw6xajr5xL00Jz8bYh4AaABAg,@polkablondebeautychickadee8668,UCK9qvVXYW9QL1caS55W9mtw,can't wait for this season will there be season 4 too? 🙏🏻🤞🏻,en,2025-05-31T17:53:08Z,2025-05-31 13:53:08,2,2,Ugw6xajr5xL00Jz8bYh4AaABAg.AInRLIR9UsVAIyXOZBkSeM,@pumpkinspiccy15,UCZhdR6gHcPogBs3QuoEg3Jg,Yes,en,2025-06-05T01:17:40Z,2025-06-04 21:17:40,0,3689174,90047,2774,"Tue, 16 Dec 2025 12:42:34 GMT"
dCyvk3uyp5Q,https://www.youtube.com/watch?v=dCyvk3uyp5Q,Ugw-2YBbssiCmqhbwWZ4AaABAg,@gottenm9106,UCkQz7fAA_nQh9nGBcnjFumg,So basically Ginny continues being annoying bitch🤷,en,2025-05-30T17:32:44Z,2025-05-30 13:32:44,0,2,Ugw-2YBbssiCmqhbwWZ4AaABAg.AIkpD0EabWiAInPHLBnzq0,@BWWiDOwzZz,UCZWiVe-rW2aV4Oi9skqd8Wg,How …! She’s literally struggling w self harm and so much more give her a break,en,2025-05-31T17:35:07Z,2025-05-31 13:35:07,1,3689174,90047,2774,"Tue, 16 Dec 2025 12:42:34 GMT"
dCyvk3uyp5Q,https://www.youtube.com/watch?v=dCyvk3uyp5Q,Ugw-2YBbssiCmqhbwWZ4AaABAg,@gottenm9106,UCkQz7fAA_nQh9nGBcnjFumg,So basically Ginny continues being annoying bitch🤷,en,2025-05-30T17:32:44Z,2025-05-30 13:32:44,0,2,Ugw-2YBbssiCmqhbwWZ4AaABAg.AIkpD0EabWiAIyXWDpwTbB,@pumpkinspiccy15,UCZhdR6gHcPogBs3QuoEg3Jg,So I guessed u missed the part where Ginny seemed stressed with her getting arrested and then literally saying “ I’m trying to protect my mom and she needs me” like what,en,2025-06-05T01:18:42Z,2025-06-04 21:18:42,0,3689174,90047,2774,"Tue, 16 Dec 2025 12:42:34 GMT"
dCyvk3uyp5Q,https://www.youtube.com/watch?v=dCyvk3uyp5Q,Ugx0btkuE73Ek6hP2qR4AaABAg,@mjdhsry1939,UCMo0T7xV2NjXPgfRbfMI6pw,1:46 WTF!!!!,NA,2025-05-29T02:10:22Z,2025-05-28 22:10:22,0,1,Ugx0btkuE73Ek6hP2qR4AaABAg.AIgarRq2ojpAIi5XtabaPs,@BWWiDOwzZz,UCZWiVe-rW2aV4Oi9skqd8Wg,Why do ppl get mad at this and think it’s a big deal!!!,en,2025-05-29T16:06:25Z,2025-05-29 12:06:25,0,3689174,90047,2774,"Tue, 16 Dec 2025 12:42:34 GMT"
dCyvk3uyp5Q,https://www.youtube.com/watch?v=dCyvk3uyp5Q,Ugz7b0BtFkK4qC3bU0p4AaABAg,@VictoriaFasan,UCdN3-dDqJnlBNCjLzR_clJQ,1:32 I dont think that's Marcus...,en,2025-05-27T15:37:09Z,2025-05-27 11:37:09,10,10,Ugz7b0BtFkK4qC3bU0p4AaABAg.AIctajmhZY3AIgIJrAguTO,@BWWiDOwzZz,UCZWiVe-rW2aV4Oi9skqd8Wg,Well yea bc they broke uppp,sn,2025-05-28T23:19:37Z,2025-05-28 19:19:37,2,3689174,90047,2774,"Tue, 16 Dec 2025 12:42:34 GMT"
dCyvk3uyp5Q,https://www.youtube.com/watch?v=dCyvk3uyp5Q,Ugz7b0BtFkK4qC3bU0p4AaABAg,@VictoriaFasan,UCdN3-dDqJnlBNCjLzR_clJQ,1:32 I dont think that's Marcus...,en,2025-05-27T15:37:09Z,2025-05-27 11:37:09,10,10,Ugz7b0BtFkK4qC3bU0p4AaABAg.AIctajmhZY3AIi0lH3vkMJ,@VictoriaFasan,UCdN3-dDqJnlBNCjLzR_clJQ,Im gonna be so mad at ginny if she's dancing with some random person with that smirk on her face. Ik its not Marcus but it BETTER BE MARCUSB,en,2025-05-29T15:24:41Z,2025-05-29 11:24:41,5,3689174,90047,2774,"Tue, 16 Dec 2025 12:42:34 GMT"
dCyvk3uyp5Q,https://www.youtube.com/watch?v=dCyvk3uyp5Q,Ugz7b0BtFkK4qC3bU0p4AaABAg,@VictoriaFasan,UCdN3-dDqJnlBNCjLzR_clJQ,1:32 I dont think that's Marcus...,en,2025-05-27T15:37:09Z,2025-05-27 11:37:09,10,10,Ugz7b0BtFkK4qC3bU0p4AaABAg.AIctajmhZY3AIiQJvwgFRs,@TheOnlyGracie,UC3yR76TWFncH5tOUN0XbusA,it is but he changed his hair,en,2025-05-29T19:08:01Z,2025-05-29 15:08:01,3,3689174,90047,2774,"Tue, 16 Dec 2025 12:42:34 GMT"
dCyvk3uyp5Q,https://www.youtube.com/watch?v=dCyvk3uyp5Q,Ugz7b0BtFkK4qC3bU0p4AaABAg,@VictoriaFasan,UCdN3-dDqJnlBNCjLzR_clJQ,1:32 I dont think that's Marcus...,en,2025-05-27T15:37:09Z,2025-05-27 11:37:09,10,10,Ugz7b0BtFkK4qC3bU0p4AaABAg.AIctajmhZY3AInVaLgXs4q,@Ariedits13,UCXsYgHwBFjYWimDg2c1pbEw,That is her mother if you pause and look 😅,en,2025-05-31T18:30:17Z,2025-05-31 14:30:17,4,3689174,90047,2774,"Tue, 16 Dec 2025 12:42:34 GMT"
dCyvk3uyp5Q,https://www.youtube.com/watch?v=dCyvk3uyp5Q,Ugz7b0BtFkK4qC3bU0p4AaABAg,@VictoriaFasan,UCdN3-dDqJnlBNCjLzR_clJQ,1:32 I dont think that's Marcus...,en,2025-05-27T15:37:09Z,2025-05-27 11:37:09,10,10,Ugz7b0BtFkK4qC3bU0p4AaABAg.AIctajmhZY3AIpZdVOkHWK,@Gigi_cano,UCiPgvrcrGAD_lXYy0kM1KWQ,THATS GEORGIA,mi,2025-06-01T13:44:09Z,2025-06-01 09:44:09,5,3689174,90047,2774,"Tue, 16 Dec 2025 12:42:34 GMT"
dCyvk3uyp5Q,https://www.youtube.com/watch?v=dCyvk3uyp5Q,Ugz7b0BtFkK4qC3bU0p4AaABAg,@VictoriaFasan,UCdN3-dDqJnlBNCjLzR_clJQ,1:32 I dont think that's Marcus...,en,2025-05-27T15:37:09Z,2025-05-27 11:37:09,10,10,Ugz7b0BtFkK4qC3bU0p4AaABAg.AIctajmhZY3AIp_z4Xn0NO,@VictoriaFasan,UCdN3-dDqJnlBNCjLzR_clJQ,​@Ariedits13WHA,ig,2025-06-01T13:55:50Z,2025-06-01 09:55:50,0,3689174,90047,2774,"Tue, 16 Dec 2025 12:42:34 GMT"
dCyvk3uyp5Q,https://www.youtube.com/watch?v=dCyvk3uyp5Q,Ugz7b0BtFkK4qC3bU0p4AaABAg,@VictoriaFasan,UCdN3-dDqJnlBNCjLzR_clJQ,1:32 I dont think that's Marcus...,en,2025-05-27T15:37:09Z,2025-05-27 11:37:09,10,10,Ugz7b0BtFkK4qC3bU0p4AaABAg.AIctajmhZY3AIpa1z-nwUu,@VictoriaFasan,UCdN3-dDqJnlBNCjLzR_clJQ,No I'm talking shout after georgia dancing,NA,2025-06-01T13:56:22Z,2025-06-01 09:56:22,1,3689174,90047,2774,"Tue, 16 Dec 2025 12:42:34 GMT"
dCyvk3uyp5Q,https://www.youtube.com/watch?v=dCyvk3uyp5Q,Ugz7b0BtFkK4qC3bU0p4AaABAg,@VictoriaFasan,UCdN3-dDqJnlBNCjLzR_clJQ,1:32 I dont think that's Marcus...,en,2025-05-27T15:37:09Z,2025-05-27 11:37:09,10,10,Ugz7b0BtFkK4qC3bU0p4AaABAg.AIctajmhZY3AIpeLm5_pxY,@Ariedits13,UCXsYgHwBFjYWimDg2c1pbEw,@VictoriaFasanyeah so am I,NA,2025-06-01T14:34:01Z,2025-06-01 10:34:01,0,3689174,90047,2774,"Tue, 16 Dec 2025 12:42:34 GMT"
dCyvk3uyp5Q,https://www.youtube.com/watch?v=dCyvk3uyp5Q,Ugz7b0BtFkK4qC3bU0p4AaABAg,@VictoriaFasan,UCdN3-dDqJnlBNCjLzR_clJQ,1:32 I dont think that's Marcus...,en,2025-05-27T15:37:09Z,2025-05-27 11:37:09,10,10,Ugz7b0BtFkK4qC3bU0p4AaABAg.AIctajmhZY3AIyfGeDfHx1,@VivianaDuran-q6n,UCU4C4qFvPtkgqhLjXgoi0LA,I don’t think that’s Georgia but I REALLY HOPE ITS MARCUS THERE SO CURE TOGETHER❤❤❤,en,2025-06-05T02:35:13Z,2025-06-04 22:35:13,0,3689174,90047,2774,"Tue, 16 Dec 2025 12:42:34 GMT"
dCyvk3uyp5Q,https://www.youtube.com/watch?v=dCyvk3uyp5Q,Ugz7b0BtFkK4qC3bU0p4AaABAg,@VictoriaFasan,UCdN3-dDqJnlBNCjLzR_clJQ,1:32 I dont think that's Marcus...,en,2025-05-27T15:37:09Z,2025-05-27 11:37:09,10,10,Ugz7b0BtFkK4qC3bU0p4AaABAg.AIctajmhZY3AIyjAGm3U6I,@Mdeem430,UCPiv8vTe9UblsWGDDs5JI7Q,Its long hair so I think its max,fil,2025-06-05T03:09:18Z,2025-06-04 23:09:18,1,3689174,90047,2774,"Tue, 16 Dec 2025 12:42:34 GMT"
dCyvk3uyp5Q,https://www.youtube.com/watch?v=dCyvk3uyp5Q,UgznWruYcNimxoIuKq14AaABAg,@Bills.second_lunch,UCZN6HDKEJbxab-iU2zRaOhw,WHO IS MAXIEN KISSINGG OH NY GOD,mg,2025-05-26T19:02:06Z,2025-05-26 15:02:06,0,1,UgznWruYcNimxoIuKq14AaABAg.AIagG0gROWBAIcXp2ILGBf,@BWWiDOwzZz,UCZWiVe-rW2aV4Oi9skqd8Wg,Sophie,af,2025-05-27T12:18:07Z,2025-05-27 08:18:07,0,3689174,90047,2774,"Tue, 16 Dec 2025 12:42:34 GMT"
dCyvk3uyp5Q,https://www.youtube.com/watch?v=dCyvk3uyp5Q,Ugz1uf9lyWkQ-OerFjl4AaABAg,@Venting-20133,UCNp91fgbUXOvFNX_oNSUvVQ,"1:13 “I’m not a bad person but if you come face to face with bad, you become a little bad yourself😊😏”WTF WHY IS SHE SUCH A BAD BITCHHHHHHHHH AHHHHHHHHHHHH❤❤❤",en,2025-05-26T17:39:41Z,2025-05-26 13:39:41,1,1,Ugz1uf9lyWkQ-OerFjl4AaABAg.AIaXpQWJlgaAIcXr36Nd4G,@BWWiDOwzZz,UCZWiVe-rW2aV4Oi9skqd8Wg,..,ja,2025-05-27T12:18:24Z,2025-05-27 08:18:24,0,3689174,90047,2774,"Tue, 16 Dec 2025 12:42:34 GMT"
dCyvk3uyp5Q,https://www.youtube.com/watch?v=dCyvk3uyp5Q,Ugz5tTChZqhEBSsen_l4AaABAg,@ShravyaGokahle,UCDrf8Dkw82qTHlD1UNhz3vA,am i blinded or is that ginny and norah!!!!!???????,en,2025-05-26T17:10:27Z,2025-05-26 13:10:27,0,2,Ugz5tTChZqhEBSsen_l4AaABAg.AIaUUHFtvL5AIaUZwCzarV,@ShravyaGokahle,UCDrf8Dkw82qTHlD1UNhz3vA,"oh wait nvm. its sophie..... wait, SOPHIE!?!?!?",fr,2025-05-26T17:11:13Z,2025-05-26 13:11:13,0,3689174,90047,2774,"Tue, 16 Dec 2025 12:42:34 GMT"
dCyvk3uyp5Q,https://www.youtube.com/watch?v=dCyvk3uyp5Q,Ugz5tTChZqhEBSsen_l4AaABAg,@ShravyaGokahle,UCDrf8Dkw82qTHlD1UNhz3vA,am i blinded or is that ginny and norah!!!!!???????,en,2025-05-26T17:10:27Z,2025-05-26 13:10:27,0,2,Ugz5tTChZqhEBSsen_l4AaABAg.AIaUUHFtvL5AIcXwvbhFVp,@BWWiDOwzZz,UCZWiVe-rW2aV4Oi9skqd8Wg,@ShravyaGokahleit’s max and Sophie not Ginny 😭💀,NA,2025-05-27T12:19:12Z,2025-05-27 08:19:12,0,3689174,90047,2774,"Tue, 16 Dec 2025 12:42:34 GMT"
dCyvk3uyp5Q,https://www.youtube.com/watch?v=dCyvk3uyp5Q,UgxBXZYQivSAToiLnVx4AaABAg,@Emmadriss22532,UCF08_YTJthNkG41lMulx59w,joe and Cynthia are so cute!! ik most people don’t agree but i feel like he brings out the good in her,en,2025-05-23T12:46:13Z,2025-05-23 08:46:13,2,1,UgxBXZYQivSAToiLnVx4AaABAg.AITHrJtn-PUAIUW6oKMen2,@azzz7279,UCoW9-juTKiw_0ll8gYbjFFg,She’s too old for him,en,2025-05-24T00:10:03Z,2025-05-23 20:10:03,0,3689174,90047,2774,"Tue, 16 Dec 2025 12:42:34 GMT"
dCyvk3uyp5Q,https://www.youtube.com/watch?v=dCyvk3uyp5Q,Ugz3sXfyG7OQx5l3pDF4AaABAg,@Randallthegoat,UClVl6K7sYsyIql6RGta4XqQ,"is it just me or does ty doran look a bit like Georgia imagine if that's her last secret she had another kid with that husband we never saw  but gave it up for adoption and he's tracked her down and playing mind games with her like throwing the brick through the window and getting close to Ginny and maybe he's the one who talked to the private investigator to get her arrested somehow BC someone obviously talked 
 
 everyone keeps thinking he's a love interest but idk",en,2025-05-20T06:24:42Z,2025-05-20 02:24:42,0,1,Ugz3sXfyG7OQx5l3pDF4AaABAg.AIKsoQlpVrgAIUWEUaQaYu,@azzz7279,UCoW9-juTKiw_0ll8gYbjFFg,Maybe the girl at 0:47 is a private investigator lol,en,2025-05-24T00:11:05Z,2025-05-23 20:11:05,0,3689174,90047,2774,"Tue, 16 Dec 2025 12:42:34 GMT"
dCyvk3uyp5Q,https://www.youtube.com/watch?v=dCyvk3uyp5Q,UgwkB1Pa9rzgsQigcDJ4AaABAg,@Rosie07462,UCYhekF7Q2qgrbzD0sIBFxjg,You know what I NEED to happen in S3: Georgia and Joe to finally acknowledge the fact that they’d met when they were teens and like the whole Joe x Georgia THING needs to be addressed. They’ve been edging us for too long likeeee,en,2025-05-16T21:41:36Z,2025-05-16 17:41:36,86,2,UgwkB1Pa9rzgsQigcDJ4AaABAg.AICDZUL7vMYAIqVPGQDxGx,@Nitrogenojzr,UC_RCKx3eCCs_Cqe5lUXfEwA,fr slayyy queen 💅💅💅,NA,2025-06-01T22:26:21Z,2025-06-01 18:26:21,1,3689174,90047,2774,"Tue, 16 Dec 2025 12:42:34 GMT"
dCyvk3uyp5Q,https://www.youtube.com/watch?v=dCyvk3uyp5Q,UgwkB1Pa9rzgsQigcDJ4AaABAg,@Rosie07462,UCYhekF7Q2qgrbzD0sIBFxjg,You know what I NEED to happen in S3: Georgia and Joe to finally acknowledge the fact that they’d met when they were teens and like the whole Joe x Georgia THING needs to be addressed. They’ve been edging us for too long likeeee,en,2025-05-16T21:41:36Z,2025-05-16 17:41:36,86,2,UgwkB1Pa9rzgsQigcDJ4AaABAg.AICDZUL7vMYAIqZpQrmQjH,@elinmartensson3163,UCy-KmwSC1gAowyhqcf8DQIw,"They did, in season 2, when Joe returned the glases to Georgia! I think in episode 8 or 9, she said you should have them, its yours and he answered somthing like of course you knew 😣",en,2025-06-01T23:05:01Z,2025-06-01 19:05:01,7,3689174,90047,2774,"Tue, 16 Dec 2025 12:42:34 GMT"
dCyvk3uyp5Q,https://www.youtube.com/watch?v=dCyvk3uyp5Q,UgzKMEHpIBjt-u5W6Hl4AaABAg,@LifestyleWithNikka,UChm8ZZyUTrSYM3Gb6tFUEog,Who else is re-watching the previous seasons? 🙋🏻‍♀️,en,2025-05-15T13:18:17Z,2025-05-15 09:18:17,30,3,UgzKMEHpIBjt-u5W6Hl4AaABAg.AI8kABAayXsAI93geX9Lia,@summerlikesmango,UC7Zx0cDzQMQHCxAIUwdxWUg,mee,nl,2025-05-15T16:17:37Z,2025-05-15 12:17:37,1,3689174,90047,2774,"Tue, 16 Dec 2025 12:42:34 GMT"
dCyvk3uyp5Q,https://www.youtube.com/watch?v=dCyvk3uyp5Q,UgzKMEHpIBjt-u5W6Hl4AaABAg,@LifestyleWithNikka,UChm8ZZyUTrSYM3Gb6tFUEog,Who else is re-watching the previous seasons? 🙋🏻‍♀️,en,2025-05-15T13:18:17Z,2025-05-15 09:18:17,30,3,UgzKMEHpIBjt-u5W6Hl4AaABAg.AI8kABAayXsAIjNPrgA5kT,@tiffanysmith4389,UCbA3Ef_WtxCf4mzurQfCnOA,🙋‍♀️,ne,2025-05-30T04:01:51Z,2025-05-30 00:01:51,1,3689174,90047,2774,"Tue, 16 Dec 2025 12:42:34 GMT"
dCyvk3uyp5Q,https://www.youtube.com/watch?v=dCyvk3uyp5Q,UgzKMEHpIBjt-u5W6Hl4AaABAg,@LifestyleWithNikka,UChm8ZZyUTrSYM3Gb6tFUEog,Who else is re-watching the previous seasons? 🙋🏻‍♀️,en,2025-05-15T13:18:17Z,2025-05-15 09:18:17,30,3,UgzKMEHpIBjt-u5W6Hl4AaABAg.AI8kABAayXsAIr4ai5tyy1,@kbizzle1999,UCuN7Y39NuqoJwVO_T6Eix-A,I definitely am. I just finished the first season.,NA,2025-06-02T03:51:22Z,2025-06-01 23:51:22,1,3689174,90047,2774,"Tue, 16 Dec 2025 12:42:34 GMT"
dCyvk3uyp5Q,https://www.youtube.com/watch?v=dCyvk3uyp5Q,Ugzbhvibeq6qtnWywkJ4AaABAg,@daydreamergal,UCNW51q2Y0AGYon_aZ-5C1HA,Why does Netflix cancel all the good shows but keep making this trash 😭,en,2025-05-12T08:08:48Z,2025-05-12 04:08:48,0,1,Ugzbhvibeq6qtnWywkJ4AaABAg.AI0TMoV3qvLAI1UPnqXX0J,@BWWiDOwzZz,UCZWiVe-rW2aV4Oi9skqd8Wg,It’s not trash 😂😮,fy,2025-05-12T17:37:11Z,2025-05-12 13:37:11,0,3689174,90047,2774,"Tue, 16 Dec 2025 12:42:34 GMT"
dCyvk3uyp5Q,https://www.youtube.com/watch?v=dCyvk3uyp5Q,UgxOjCmdtIjBXamDDfp4AaABAg,@BearPlayzWHI,UCJeruo0kmGYjv4QrtyUOIYw,IVE BEEN WAITING FOR CENTURIES AND ITS FINALLY COMING OUT. WHAT DAY??? JUNE ISNT AN ANSWER>:(,en,2025-05-12T05:19:51Z,2025-05-12 01:19:51,0,2,UgxOjCmdtIjBXamDDfp4AaABAg.AI0A1M15ow0AI3nYvnxT0L,@CW86149,UCXj6AvAIfIX8iUBSbBPXR2A,June 5th.,NA,2025-05-13T15:11:40Z,2025-05-13 11:11:40,1,3689174,90047,2774,"Tue, 16 Dec 2025 12:42:34 GMT"
dCyvk3uyp5Q,https://www.youtube.com/watch?v=dCyvk3uyp5Q,UgxOjCmdtIjBXamDDfp4AaABAg,@BearPlayzWHI,UCJeruo0kmGYjv4QrtyUOIYw,IVE BEEN WAITING FOR CENTURIES AND ITS FINALLY COMING OUT. WHAT DAY??? JUNE ISNT AN ANSWER>:(,en,2025-05-12T05:19:51Z,2025-05-12 01:19:51,0,2,UgxOjCmdtIjBXamDDfp4AaABAg.AI0A1M15ow0AI4o3QjOphe,@BearPlayzWHI,UCJeruo0kmGYjv4QrtyUOIYw,@ thank yoiuuuu,NA,2025-05-14T00:35:21Z,2025-05-13 20:35:21,1,3689174,90047,2774,"Tue, 16 Dec 2025 12:42:34 GMT"
dCyvk3uyp5Q,https://www.youtube.com/watch?v=dCyvk3uyp5Q,Ugzh88J8hy3KpwvPTsN4AaABAg,@libbycorrales869,UC5OfB32V1wrVnRsJ-6Snu0Q,PLEASE NETFLIX DONT MAKE THIS SEASON CRINGE LIKE THE LAST TWO AND I DIDNT SEE HUNTER IS HE FINALLY GONE??!?!!!,en,2025-05-12T04:15:09Z,2025-05-12 00:15:09,0,1,Ugzh88J8hy3KpwvPTsN4AaABAg.AI02cXYmTyNAI1USOR73G6,@BWWiDOwzZz,UCZWiVe-rW2aV4Oi9skqd8Wg,Fr lollll,sv,2025-05-12T17:37:32Z,2025-05-12 13:37:32,0,3689174,90047,2774,"Tue, 16 Dec 2025 12:42:34 GMT"
dCyvk3uyp5Q,https://www.youtube.com/watch?v=dCyvk3uyp5Q,UgyYxwx0lytXTb-nXEJ4AaABAg,@simrandubey2072,UCQp_Mln2fzL2-35PxUiFh-g,"Okay, where is our stoned cutie?",en,2025-05-12T03:26:27Z,2025-05-11 23:26:27,0,1,UgyYxwx0lytXTb-nXEJ4AaABAg.AI-y2qFSNAPAI1UUU4zK8I,@BWWiDOwzZz,UCZWiVe-rW2aV4Oi9skqd8Wg,This isn’t Euphroia,el-Latn,2025-05-12T17:37:49Z,2025-05-12 13:37:49,0,3689174,90047,2774,"Tue, 16 Dec 2025 12:42:34 GMT"
dCyvk3uyp5Q,https://www.youtube.com/watch?v=dCyvk3uyp5Q,Ugz0fcBMYQB9SIUkF-94AaABAg,@kathyjaff,UC8-dswJnlWEk4MLXba-MThg,please make season 4 as soon as possible. i love this series and it takes long time for next season!,en,2025-05-11T14:34:20Z,2025-05-11 10:34:20,108,2,Ugz0fcBMYQB9SIUkF-94AaABAg.AHz_gg6fVSmAIeyrtB9j-a,@bozicajo9051,UCfq_jY9LjW5tL9fl6wHGTNw,"THIS, YEAAAAAAH",so,2025-05-28T11:01:39Z,2025-05-28 07:01:39,3,3689174,90047,2774,"Tue, 16 Dec 2025 12:42:34 GMT"
dCyvk3uyp5Q,https://www.youtube.com/watch?v=dCyvk3uyp5Q,Ugz0fcBMYQB9SIUkF-94AaABAg,@kathyjaff,UC8-dswJnlWEk4MLXba-MThg,please make season 4 as soon as possible. i love this series and it takes long time for next season!,en,2025-05-11T14:34:20Z,2025-05-11 10:34:20,108,2,Ugz0fcBMYQB9SIUkF-94AaABAg.AHz_gg6fVSmAIralkRKwJm,@bilbopuggins,UCGI67Y_v7kH_D4KgPRMNAJQ,Ikr. Austin has been growing so quickly,en,2025-06-02T08:41:14Z,2025-06-02 04:41:14,0,3689174,90047,2774,"Tue, 16 Dec 2025 12:42:34 GMT"
dCyvk3uyp5Q,https://www.youtube.com/watch?v=dCyvk3uyp5Q,UgyWMlLh4SClTHqwzzZ4AaABAg,@LinguistGR,UCLx1zr7ztBnAmq5UX9XucmQ,I hope they make a recap video because... It's been so damn long. I love this series and I was waiting impatiently for the new season but I barely remember anything anymore,en,2025-05-11T09:41:09Z,2025-05-11 05:41:09,0,1,UgyWMlLh4SClTHqwzzZ4AaABAg.AHz38Oayiq6AI4iNcJgBCy,@annafowler9962,UClsrJmmRWyh2SnyHb7IQf9A,That’s why I rewatched it in two days lol,en,2025-05-13T23:45:41Z,2025-05-13 19:45:41,0,3689174,90047,2774,"Tue, 16 Dec 2025 12:42:34 GMT"
dCyvk3uyp5Q,https://www.youtube.com/watch?v=dCyvk3uyp5Q,UgzxuExEHHsVOuI_RR14AaABAg,@La2blea0621,UCVM5o0PZk1YvX-szkrJdRsg,01:55 it’s giving Spider-Man no way home,en,2025-05-11T09:28:51Z,2025-05-11 05:28:51,24,3,UgzxuExEHHsVOuI_RR14AaABAg.AHz1jJ8GNzeAHzr1cdfJsr,@BWWiDOwzZz,UCZWiVe-rW2aV4Oi9skqd8Wg,How,en,2025-05-11T17:05:53Z,2025-05-11 13:05:53,5,3689174,90047,2774,"Tue, 16 Dec 2025 12:42:34 GMT"
dCyvk3uyp5Q,https://www.youtube.com/watch?v=dCyvk3uyp5Q,UgzxuExEHHsVOuI_RR14AaABAg,@La2blea0621,UCVM5o0PZk1YvX-szkrJdRsg,01:55 it’s giving Spider-Man no way home,en,2025-05-11T09:28:51Z,2025-05-11 05:28:51,24,3,UgzxuExEHHsVOuI_RR14AaABAg.AHz1jJ8GNzeAI7sAnxlgrT,@oliviafrancis-g7y,UCOXa3dCD8f643VLINQ312DQ,@BWWiDOwzZzthe brick scene,NA,2025-05-15T05:09:02Z,2025-05-15 01:09:02,0,3689174,90047,2774,"Tue, 16 Dec 2025 12:42:34 GMT"
dCyvk3uyp5Q,https://www.youtube.com/watch?v=dCyvk3uyp5Q,UgzxuExEHHsVOuI_RR14AaABAg,@La2blea0621,UCVM5o0PZk1YvX-szkrJdRsg,01:55 it’s giving Spider-Man no way home,en,2025-05-11T09:28:51Z,2025-05-11 05:28:51,24,3,UgzxuExEHHsVOuI_RR14AaABAg.AHz1jJ8GNzeAIzRgoEEiN_,@La2blea0621,UCVM5o0PZk1YvX-szkrJdRsg,@BWWiDOwzZz when someone throws a brick at Peter Parker’s apartment with the same message “Murd3r3r” after findin’ out that he “k1ll3d” Mysterio,en,2025-06-05T09:47:06Z,2025-06-05 05:47:06,2,3689174,90047,2774,"Tue, 16 Dec 2025 12:42:34 GMT"
dCyvk3uyp5Q,https://www.youtube.com/watch?v=dCyvk3uyp5Q,Ugx3DHqrcNQvBqJFNKN4AaABAg,@bellabenjamin12,UCbcLOmIEHgd1o95TjUmHAwg,Someone pls remind me why Georgia was arrested,en,2025-05-10T21:48:40Z,2025-05-10 17:48:40,0,1,Ugx3DHqrcNQvBqJFNKN4AaABAg.AHxmaubQs71AHxr5tE3xyB,@i25styles,UC-4Gv25dFpJCtK5dBHuRyxw,she murdered cynthia's husband,ig,2025-05-10T22:27:59Z,2025-05-10 18:27:59,0,3689174,90047,2774,"Tue, 16 Dec 2025 12:42:34 GMT"
dCyvk3uyp5Q,https://www.youtube.com/watch?v=dCyvk3uyp5Q,UgwqjkohBvL0yuqEynx4AaABAg,@ashkhan-22,UC2nd7q2IVl1P8BEZKsQXQXg,thank god hunters no where to be seen...,en,2025-05-10T14:37:44Z,2025-05-10 10:37:44,0,1,UgwqjkohBvL0yuqEynx4AaABAg.AHx0HiCjIB7AIUWXI9e3De,@azzz7279,UCoW9-juTKiw_0ll8gYbjFFg,"The actor posted the trailer on his instagram, so that makes me think he’ll be in season 3",en,2025-05-24T00:13:39Z,2025-05-23 20:13:39,0,3689174,90047,2774,"Tue, 16 Dec 2025 12:42:34 GMT"
dCyvk3uyp5Q,https://www.youtube.com/watch?v=dCyvk3uyp5Q,UgwJeqtAXAbWZ4uHABd4AaABAg,@TerranceSilver5625,UCdaM_XlADn4BKveCSymTs-g,"So so, Max and Marcus’s mom and everybody in the town don’t think she did it but only Zion Ginny and Austin know she did do it?",en,2025-05-10T13:29:26Z,2025-05-10 09:29:26,1,1,UgwJeqtAXAbWZ4uHABd4AaABAg.AHwtTRSneRoAHyG143_QSy,@X...MWasHere...X,UCHKqol6cczbVxuBj5oF9Lng,I think Paul suspects something and idk if Ginny knows,en,2025-05-11T02:14:31Z,2025-05-10 22:14:31,0,3689174,90047,2774,"Tue, 16 Dec 2025 12:42:34 GMT"
dCyvk3uyp5Q,https://www.youtube.com/watch?v=dCyvk3uyp5Q,UgyjlThzwcaLIVpnxKt4AaABAg,@MariElia-gd7oz,UCqOm95ueOjqHUN7Yjxnm7PA,wow.... i am really not interested,en,2025-05-10T11:40:35Z,2025-05-10 07:40:35,0,2,UgyjlThzwcaLIVpnxKt4AaABAg.AHwh0B6M8EiAHwkhmlJ6qm,@CW86149,UCXj6AvAIfIX8iUBSbBPXR2A,So why watch the trailer?,en,2025-05-10T12:12:53Z,2025-05-10 08:12:53,0,3689174,90047,2774,"Tue, 16 Dec 2025 12:42:34 GMT"
dCyvk3uyp5Q,https://www.youtube.com/watch?v=dCyvk3uyp5Q,UgyjlThzwcaLIVpnxKt4AaABAg,@MariElia-gd7oz,UCqOm95ueOjqHUN7Yjxnm7PA,wow.... i am really not interested,en,2025-05-10T11:40:35Z,2025-05-10 07:40:35,0,2,UgyjlThzwcaLIVpnxKt4AaABAg.AHwh0B6M8EiAIBwYkFyV_1,@MariElia-gd7oz,UCqOm95ueOjqHUN7Yjxnm7PA,@CW86149 cause i was interested in the new season but after watching the trailer i am not interested anymore... pretty simple,en,2025-05-16T19:04:13Z,2025-05-16 15:04:13,0,3689174,90047,2774,"Tue, 16 Dec 2025 12:42:34 GMT"
dCyvk3uyp5Q,https://www.youtube.com/watch?v=dCyvk3uyp5Q,Ugxbob3OwYtITAN-2PN4AaABAg,@user-dh1rg9zx4v,UCL0wThcDEoUopZ_MGFO2U1w,I trusted Paul to not abandon her after coming so far together 😭😭 Joe might get his chance I guess ❤️,en,2025-05-10T10:24:36Z,2025-05-10 06:24:36,45,4,Ugxbob3OwYtITAN-2PN4AaABAg.AHwZJkFHKmvAI52iJqDUsX,@KaraElizabeth-ny4bh,UCxRpAcwvSeHtGclAqR0IZ8w,He abandoned her?.,xh,2025-05-14T02:52:08Z,2025-05-13 22:52:08,0,3689174,90047,2774,"Tue, 16 Dec 2025 12:42:34 GMT"
dCyvk3uyp5Q,https://www.youtube.com/watch?v=dCyvk3uyp5Q,Ugxbob3OwYtITAN-2PN4AaABAg,@user-dh1rg9zx4v,UCL0wThcDEoUopZ_MGFO2U1w,I trusted Paul to not abandon her after coming so far together 😭😭 Joe might get his chance I guess ❤️,en,2025-05-10T10:24:36Z,2025-05-10 06:24:36,45,4,Ugxbob3OwYtITAN-2PN4AaABAg.AHwZJkFHKmvAI5uHpsc2l0,@user-dh1rg9zx4v,UCL0wThcDEoUopZ_MGFO2U1w,"​@KaraElizabeth-ny4bhNot sure but the headlines of The Boston Local reads ""Mayoress Murderess Abandoned"" so we're assuming Paul abandoned her 😅",en,2025-05-14T10:48:59Z,2025-05-14 06:48:59,0,3689174,90047,2774,"Tue, 16 Dec 2025 12:42:34 GMT"
dCyvk3uyp5Q,https://www.youtube.com/watch?v=dCyvk3uyp5Q,Ugxbob3OwYtITAN-2PN4AaABAg,@user-dh1rg9zx4v,UCL0wThcDEoUopZ_MGFO2U1w,I trusted Paul to not abandon her after coming so far together 😭😭 Joe might get his chance I guess ❤️,en,2025-05-10T10:24:36Z,2025-05-10 06:24:36,45,4,Ugxbob3OwYtITAN-2PN4AaABAg.AHwZJkFHKmvAI8r-ujlP6T,@user-dh1rg9zx4v,UCL0wThcDEoUopZ_MGFO2U1w,"​@KaraElizabeth-ny4bh Not sure but the newspaper did read  'Mayoress Murderess abandoned' so it's just an assumption based on that, but we'll see...",en,2025-05-15T14:18:03Z,2025-05-15 10:18:03,0,3689174,90047,2774,"Tue, 16 Dec 2025 12:42:34 GMT"
dCyvk3uyp5Q,https://www.youtube.com/watch?v=dCyvk3uyp5Q,Ugxbob3OwYtITAN-2PN4AaABAg,@user-dh1rg9zx4v,UCL0wThcDEoUopZ_MGFO2U1w,I trusted Paul to not abandon her after coming so far together 😭😭 Joe might get his chance I guess ❤️,en,2025-05-10T10:24:36Z,2025-05-10 06:24:36,45,4,Ugxbob3OwYtITAN-2PN4AaABAg.AHwZJkFHKmvAIFWMo8G3ol,@KaraElizabeth-ny4bh,UCxRpAcwvSeHtGclAqR0IZ8w,@booze8245i thought it said loves husbands support 😭😭😭😭,en,2025-05-18T04:23:37Z,2025-05-18 00:23:37,0,3689174,90047,2774,"Tue, 16 Dec 2025 12:42:34 GMT"
dCyvk3uyp5Q,https://www.youtube.com/watch?v=dCyvk3uyp5Q,UgwP15lV7KtWbRAsHxx4AaABAg,@alysham519,UC5uebsuHg1uIBe6rrdF5dmQ,"It’s sad how people dont like Ginny and dont understand her character. Ginny’s anger and sadness towards her mother is so valid and relatable. But unfortunately a lot of people see it as “Ginny being difficult” or simply her being “an angsty teen”. Her mental health issues and trauma are completely ignored and it’s baffling. Like yes Georgia loves her kids, but she also has damaged them in ways that aren’t easily fixed.",en,2025-05-10T10:19:31Z,2025-05-10 06:19:31,469,13,UgwP15lV7KtWbRAsHxx4AaABAg.AHwYjY9pWHKAHwZTJR_KYA,@prvsms,UC4FDwuRhxk2Ng3bl75zXiMA,@alysham519 you said it perfectly!,NA,2025-05-10T10:25:54Z,2025-05-10 06:25:54,15,3689174,90047,2774,"Tue, 16 Dec 2025 12:42:34 GMT"
dCyvk3uyp5Q,https://www.youtube.com/watch?v=dCyvk3uyp5Q,UgwP15lV7KtWbRAsHxx4AaABAg,@alysham519,UC5uebsuHg1uIBe6rrdF5dmQ,"It’s sad how people dont like Ginny and dont understand her character. Ginny’s anger and sadness towards her mother is so valid and relatable. But unfortunately a lot of people see it as “Ginny being difficult” or simply her being “an angsty teen”. Her mental health issues and trauma are completely ignored and it’s baffling. Like yes Georgia loves her kids, but she also has damaged them in ways that aren’t easily fixed.",en,2025-05-10T10:19:31Z,2025-05-10 06:19:31,469,13,UgwP15lV7KtWbRAsHxx4AaABAg.AHwYjY9pWHKAHweU0lNqhq,@Aster_Risk,UCGtt-3VdrejDMLApod_pPbA,"I love this show because of the complexity of the emotions and the characters. Ginny is a kid who's had to deal with some awful stuff. I can't understand not having sympathy and empathy for her and her mom. Hopefully, people who feel this way are just young and will learn as they mature.",en,2025-05-10T11:18:26Z,2025-05-10 07:18:26,28,3689174,90047,2774,"Tue, 16 Dec 2025 12:42:34 GMT"
