video_id,video_url,comment_id,comment_author_display,comment_author_channel_id,comment_content,comment_lang,comment_time_utc,comment_time_local,comment_like_count,comment_reply_count,reply_id,reply_author_display,reply_author_channel_id,reply_content,reply_lang,reply_time_utc,reply_time_local,reply_like_count,view_count,like_count,comment_count,crawl_time
dCyvk3uyp5Q,https://www.youtube.com/watch?v=dCyvk3uyp5Q,UgxQ83x86KWJ6BG1ect4AaABAg,@Sonakshi200,UCHxpC57lnWZbH_RGqMVzT3A,"Watched half of s3 and everybody is just focusing on ginny, pampering her but that little boy Austin is being totally ignored😢",en,2025-06-06T06:58:47Z,2025-06-06 02:58:47,8,2,UgxQ83x86KWJ6BG1ect4AaABAg.AJ0iDwPy-5gAJ3m3GlFJiy,@oscargonzalez5529,UCuUCqAD3cXA5MBMUe68ZzgQ,"​@Tilly-k9s probably more like the script, you restarted hippo.    They never show his therapist, schooling ect. Anything.  You dense mud brain",en,2025-06-07T11:30:00Z,2025-06-07 07:30:00,0,3689174,90047,2774,"Tue, 16 Dec 2025 12:42:34 GMT"
dCyvk3uyp5Q,https://www.youtube.com/watch?v=dCyvk3uyp5Q,UgzJ3Z7DRKKoK5cSaRR4AaABAg,@christielauer3322,UCujp8AbwvRHbtZSs35l1sXw,"Dear Ginny and Georgia Season 4,
Please come to Netflix VERY soon.",NA,2025-06-06T06:50:35Z,2025-06-06 02:50:35,9,2,UgzJ3Z7DRKKoK5cSaRR4AaABAg.AJ0hHtFE0HNAJHYQhi49zP,@AP-di8sy,UC0bfVpMmS8XsKvJbx08Wjxg,another 2 years,en,2025-06-12T19:51:30Z,2025-06-12 15:51:30,1,3689174,90047,2774,"Tue, 16 Dec 2025 12:42:34 GMT"
dCyvk3uyp5Q,https://www.youtube.com/watch?v=dCyvk3uyp5Q,UgzJ3Z7DRKKoK5cSaRR4AaABAg,@christielauer3322,UCujp8AbwvRHbtZSs35l1sXw,"Dear Ginny and Georgia Season 4,
Please come to Netflix VERY soon.",NA,2025-06-06T06:50:35Z,2025-06-06 02:50:35,9,2,UgzJ3Z7DRKKoK5cSaRR4AaABAg.AJ0hHtFE0HNAJQ9yEIUmFy,@christielauer3322,UCujp8AbwvRHbtZSs35l1sXw,@AP-di8sy Boo! 👎😭,NA,2025-06-16T04:10:56Z,2025-06-16 00:10:56,0,3689174,90047,2774,"Tue, 16 Dec 2025 12:42:34 GMT"
dCyvk3uyp5Q,https://www.youtube.com/watch?v=dCyvk3uyp5Q,UgwMf6DFOUm2sBLv13l4AaABAg,@knowcomment96,UCsohncZdM40eVyioFkwbhFw,"This season sucks ass. All the reasons that I fell in love with this show are null and void this season. It has no conflict. It's like a bunch of christians took over the script and made it g rated. It initially wasn't a family show. It was full of drama. I can't even finish this season it's sooo bad. The little boy has grown up, but they still have him portraying a child. Ginny, who already has had sex in previous seasons, is now acting like an angel devastated over a friggin kiss. And the used to be hot guy love interest is now a suicidal depressive. It's like the people who wrote this sh!tty script didn't even watch the prior 2 seasons of the show. I HATE THIS SHOW SOOO MUCH. Yall are stupid.",en,2025-06-06T06:32:05Z,2025-06-06 02:32:05,3,2,UgwMf6DFOUm2sBLv13l4AaABAg.AJ0fAJ2hfnQAJ3KHdmyZnj,@Tilly-k9s,UCtpvT7UtTQjstxj9_5Tun5g,"Which kiss are you talking about? Idk where u up to, but Ginny definitely ain't an angel this season. Also, you can't complain about there being no conflict or drama, and then also complain about the former 'hot guy love interest' being depressed. Marcus has always been depressed. Season 2 made that clear, if u watched it. I just know ur the type of person who, if Marcus was completely cured, would complain abt how unrealistic that was. And yes, Austin's actor grew up, but the season is set directly after season 2 ended. You just have to try and see past the fact. You can't magically make the actor stay the same age, it doesn't work like that. Also, these are your opinions, so no hate. 👍👍",en,2025-06-07T07:18:34Z,2025-06-07 03:18:34,1,3689174,90047,2774,"Tue, 16 Dec 2025 12:42:34 GMT"
dCyvk3uyp5Q,https://www.youtube.com/watch?v=dCyvk3uyp5Q,UgwMf6DFOUm2sBLv13l4AaABAg,@knowcomment96,UCsohncZdM40eVyioFkwbhFw,"This season sucks ass. All the reasons that I fell in love with this show are null and void this season. It has no conflict. It's like a bunch of christians took over the script and made it g rated. It initially wasn't a family show. It was full of drama. I can't even finish this season it's sooo bad. The little boy has grown up, but they still have him portraying a child. Ginny, who already has had sex in previous seasons, is now acting like an angel devastated over a friggin kiss. And the used to be hot guy love interest is now a suicidal depressive. It's like the people who wrote this sh!tty script didn't even watch the prior 2 seasons of the show. I HATE THIS SHOW SOOO MUCH. Yall are stupid.",en,2025-06-06T06:32:05Z,2025-06-06 02:32:05,3,2,UgwMf6DFOUm2sBLv13l4AaABAg.AJ0fAJ2hfnQAJ3OTJCRqKh,@knowcomment96,UCsohncZdM40eVyioFkwbhFw,The kiss at the dance that he doesn't remember before destroying the classroom. The show is just so flat. I stopped torturing myself by episode 4. I was bored out of my mind. There is no real conflict that anyone cares about. It's too clean cut. We all liked her best friend's brother as a bad boy. Now he's just meh with a horrible haircut. Im done with the show. Trying to watch it was upsetting my soul. I like my entertainment messy.❤​@Tilly-k9s,en,2025-06-07T07:55:07Z,2025-06-07 03:55:07,0,3689174,90047,2774,"Tue, 16 Dec 2025 12:42:34 GMT"
dCyvk3uyp5Q,https://www.youtube.com/watch?v=dCyvk3uyp5Q,UgxJYXoD1AiHcDtORkR4AaABAg,@giselle239,UCgAph1ii_36IrYO2pX8DWSQ,"I hope Paul and Georgia stay together. He’s like the father figure in Austin’s life and I feel so bad for Austin because while Ginny has Zion, Austin has Gil. Austin and Joe aren’t close like that.",en,2025-06-06T04:49:05Z,2025-06-06 00:49:05,9,2,UgxJYXoD1AiHcDtORkR4AaABAg.AJ0UO--97dfAJ3lsxWBkWC,@oscargonzalez5529,UCuUCqAD3cXA5MBMUe68ZzgQ,He deserves better. He would be wasted on a creature like Georgia,en,2025-06-07T11:28:28Z,2025-06-07 07:28:28,3,3689174,90047,2774,"Tue, 16 Dec 2025 12:42:34 GMT"
dCyvk3uyp5Q,https://www.youtube.com/watch?v=dCyvk3uyp5Q,UgxJYXoD1AiHcDtORkR4AaABAg,@giselle239,UCgAph1ii_36IrYO2pX8DWSQ,"I hope Paul and Georgia stay together. He’s like the father figure in Austin’s life and I feel so bad for Austin because while Ginny has Zion, Austin has Gil. Austin and Joe aren’t close like that.",en,2025-06-06T04:49:05Z,2025-06-06 00:49:05,9,2,UgxJYXoD1AiHcDtORkR4AaABAg.AJ0UO--97dfAJ49NLp0_qZ,@xD4isyFr4gmentsx,UCjYjspKHshG0oX41PnUrcvg,Ew Paul does not need to be in a relationship with a deranged and unhinged narcissist.,en,2025-06-07T15:02:28Z,2025-06-07 11:02:28,2,3689174,90047,2774,"Tue, 16 Dec 2025 12:42:34 GMT"
dCyvk3uyp5Q,https://www.youtube.com/watch?v=dCyvk3uyp5Q,Ugz6dzVAdNiwsNIawcR4AaABAg,@Stafaiaiseynvus,UCzXIUvRxhfxZrNUnaBzRFGQ,Where is austin????,gd,2025-06-06T04:16:40Z,2025-06-06 00:16:40,3,3,Ugz6dzVAdNiwsNIawcR4AaABAg.AJ0QfV5_-cGAJ0QiwCpcKb,@Melon_movie-y2p,UC8DEmKd-YjITFeYVipSBIIA,In the show,en,2025-06-06T04:17:08Z,2025-06-06 00:17:08,1,3689174,90047,2774,"Tue, 16 Dec 2025 12:42:34 GMT"
dCyvk3uyp5Q,https://www.youtube.com/watch?v=dCyvk3uyp5Q,Ugz6dzVAdNiwsNIawcR4AaABAg,@Stafaiaiseynvus,UCzXIUvRxhfxZrNUnaBzRFGQ,Where is austin????,gd,2025-06-06T04:16:40Z,2025-06-06 00:16:40,3,3,Ugz6dzVAdNiwsNIawcR4AaABAg.AJ0QfV5_-cGAJ3lopcMXx5,@oscargonzalez5529,UCuUCqAD3cXA5MBMUe68ZzgQ,​@Melon_movie-y2pdont look like it,fy,2025-06-07T11:27:54Z,2025-06-07 07:27:54,1,3689174,90047,2774,"Tue, 16 Dec 2025 12:42:34 GMT"
dCyvk3uyp5Q,https://www.youtube.com/watch?v=dCyvk3uyp5Q,Ugz6dzVAdNiwsNIawcR4AaABAg,@Stafaiaiseynvus,UCzXIUvRxhfxZrNUnaBzRFGQ,Where is austin????,gd,2025-06-06T04:16:40Z,2025-06-06 00:16:40,3,3,Ugz6dzVAdNiwsNIawcR4AaABAg.AJ0QfV5_-cGAJD3Sew4DEx,@Melon_movie-y2p,UC8DEmKd-YjITFeYVipSBIIA,@oscargonzalez5529he’s in the trailer did u look no offense,NA,2025-06-11T02:03:55Z,2025-06-10 22:03:55,0,3689174,90047,2774,"Tue, 16 Dec 2025 12:42:34 GMT"
dCyvk3uyp5Q,https://www.youtube.com/watch?v=dCyvk3uyp5Q,Ugzuh4zJkdbXnBB2UJN4AaABAg,@annarose7150,UC2FBeAs82cMsVfq_B6hV1PA,I can't get over Austin looking like 3 years older and a deeper voice when it's supposed to be like a couple days since Georgia got arrested 😂😂😂😂,en,2025-06-06T00:19:14Z,2025-06-05 20:19:14,68,1,Ugzuh4zJkdbXnBB2UJN4AaABAg.AJ0-VZqwG4UAJXMgplQ9Eh,@jl7662,UC3BWgPlShKX3g1McAwaUNDA,The trial aged him quick😂😂😂,en,2025-06-18T23:16:50Z,2025-06-18 19:16:50,11,3689174,90047,2774,"Tue, 16 Dec 2025 12:42:34 GMT"
dCyvk3uyp5Q,https://www.youtube.com/watch?v=dCyvk3uyp5Q,Ugwc2GBjTXkMeI40jDx4AaABAg,@EVEMATHURIN25,UCsj2IN3cRA8p-N5Yd88c0Dw,"Will there be a season 4 because at the end of season 3 Ginny tells Georgie that she only drinks milk when she's pregnant, but I wonder if Georgie is pregnant at the end?",en,2025-06-05T18:46:09Z,2025-06-05 14:46:09,4,1,Ugwc2GBjTXkMeI40jDx4AaABAg.AJ-PNsPSI20AJ-dcq7JKeZ,@meesha6723,UCFs0d9P_QTJFEMEWWXJ7QTw,There is a season 4,en,2025-06-05T20:59:24Z,2025-06-05 16:59:24,0,3689174,90047,2774,"Tue, 16 Dec 2025 12:42:34 GMT"
dCyvk3uyp5Q,https://www.youtube.com/watch?v=dCyvk3uyp5Q,Ugyf77Ymw-7mgq5Ozw54AaABAg,@lfairy2174,UCvBleYqM3pARSDjvPQe3jNg,"The acting skills of Georgia actress are terrible, the way she moves her mouth and all the overacting Face expressions….",en,2025-06-05T16:11:07Z,2025-06-05 12:11:07,0,3,Ugyf77Ymw-7mgq5Ozw54AaABAg.AJ-7dUaboIOAJ-M3SM0mEg,@BWWiDOwzZz,UCZWiVe-rW2aV4Oi9skqd8Wg,That’s her character broo,en,2025-06-05T18:17:08Z,2025-06-05 14:17:08,2,3689174,90047,2774,"Tue, 16 Dec 2025 12:42:34 GMT"
dCyvk3uyp5Q,https://www.youtube.com/watch?v=dCyvk3uyp5Q,Ugyf77Ymw-7mgq5Ozw54AaABAg,@lfairy2174,UCvBleYqM3pARSDjvPQe3jNg,"The acting skills of Georgia actress are terrible, the way she moves her mouth and all the overacting Face expressions….",en,2025-06-05T16:11:07Z,2025-06-05 12:11:07,0,3,Ugyf77Ymw-7mgq5Ozw54AaABAg.AJ-7dUaboIOAJ-XCgT60bZ,@AArchitaAchary,UCm6PqasASteOp1GfnL8wpsg,I just love her expressions and accent too,en,2025-06-05T19:54:31Z,2025-06-05 15:54:31,2,3689174,90047,2774,"Tue, 16 Dec 2025 12:42:34 GMT"
dCyvk3uyp5Q,https://www.youtube.com/watch?v=dCyvk3uyp5Q,Ugyf77Ymw-7mgq5Ozw54AaABAg,@lfairy2174,UCvBleYqM3pARSDjvPQe3jNg,"The acting skills of Georgia actress are terrible, the way she moves her mouth and all the overacting Face expressions….",en,2025-06-05T16:11:07Z,2025-06-05 12:11:07,0,3,Ugyf77Ymw-7mgq5Ozw54AaABAg.AJ-7dUaboIOAJ-dknKF-nB,@meesha6723,UCFs0d9P_QTJFEMEWWXJ7QTw,"Seriously? I’d like to see you do better. 
It’s easy to criticize but when you’re actually doing it… that’s when you realize how hard acting really is. 
Brianne did an amazing job",en,2025-06-05T21:00:29Z,2025-06-05 17:00:29,1,3689174,90047,2774,"Tue, 16 Dec 2025 12:42:34 GMT"
dCyvk3uyp5Q,https://www.youtube.com/watch?v=dCyvk3uyp5Q,UgzZhckBO_Yrj0v5mAV4AaABAg,@shraddharai1954,UC0h0n5ud-VyOEaKvcKvoDtw,I've never seen the worst daughter than Ginny. Cut some slack for your mother mannn. She has her own life and her troubles,en,2025-06-05T14:26:57Z,2025-06-05 10:26:57,4,2,UgzZhckBO_Yrj0v5mAV4AaABAg.AIzwiSmFB_7AJ-dmqAPrb9,@meesha6723,UCFs0d9P_QTJFEMEWWXJ7QTw,LITERALLY,NA,2025-06-05T21:00:45Z,2025-06-05 17:00:45,0,3689174,90047,2774,"Tue, 16 Dec 2025 12:42:34 GMT"
dCyvk3uyp5Q,https://www.youtube.com/watch?v=dCyvk3uyp5Q,UgzZhckBO_Yrj0v5mAV4AaABAg,@shraddharai1954,UC0h0n5ud-VyOEaKvcKvoDtw,I've never seen the worst daughter than Ginny. Cut some slack for your mother mannn. She has her own life and her troubles,en,2025-06-05T14:26:57Z,2025-06-05 10:26:57,4,2,UgzZhckBO_Yrj0v5mAV4AaABAg.AIzwiSmFB_7AJ-nY1XHIPX,@sophxe.,UClNexcZRsu6sJuB9CL0kUhw,have you watched season 3 or what. You should be able to see now more than ever how much Ginny has sacrificed for Georgia and all of ginnys pain because of her. Georgia is a serial killer. That’s just the facts.,en,2025-06-05T22:25:59Z,2025-06-05 18:25:59,2,3689174,90047,2774,"Tue, 16 Dec 2025 12:42:34 GMT"
dCyvk3uyp5Q,https://www.youtube.com/watch?v=dCyvk3uyp5Q,UgzffIgBI6bAg4Gawrp4AaABAg,@SusanNjeri-j7d,UC18WQvydQi1JYQeVvq6843Q,"Ginny finally loves mum she always did anyways,she is just more supportive now🎉❤🎉❤🎉❤❤❤🎉🎉🎉",en,2025-06-05T13:21:03Z,2025-06-05 09:21:03,2,3,UgzffIgBI6bAg4Gawrp4AaABAg.AIzpApM7rACAJ3lQb8Z2PH,@oscargonzalez5529,UCuUCqAD3cXA5MBMUe68ZzgQ,Why would anyone support a killer ?,en,2025-06-07T11:24:27Z,2025-06-07 07:24:27,0,3689174,90047,2774,"Tue, 16 Dec 2025 12:42:34 GMT"
dCyvk3uyp5Q,https://www.youtube.com/watch?v=dCyvk3uyp5Q,UgzffIgBI6bAg4Gawrp4AaABAg,@SusanNjeri-j7d,UC18WQvydQi1JYQeVvq6843Q,"Ginny finally loves mum she always did anyways,she is just more supportive now🎉❤🎉❤🎉❤❤❤🎉🎉🎉",en,2025-06-05T13:21:03Z,2025-06-05 09:21:03,2,3,UgzffIgBI6bAg4Gawrp4AaABAg.AIzpApM7rACAJ3oWeaynq_,@SusanNjeri-j7d,UC18WQvydQi1JYQeVvq6843Q,"Its never that serious,get a life ​@oscargonzalez5529",lb,2025-06-07T11:51:30Z,2025-06-07 07:51:30,0,3689174,90047,2774,"Tue, 16 Dec 2025 12:42:34 GMT"
dCyvk3uyp5Q,https://www.youtube.com/watch?v=dCyvk3uyp5Q,UgzffIgBI6bAg4Gawrp4AaABAg,@SusanNjeri-j7d,UC18WQvydQi1JYQeVvq6843Q,"Ginny finally loves mum she always did anyways,she is just more supportive now🎉❤🎉❤🎉❤❤❤🎉🎉🎉",en,2025-06-05T13:21:03Z,2025-06-05 09:21:03,2,3,UgzffIgBI6bAg4Gawrp4AaABAg.AIzpApM7rACAJ7Bk9gnOy2,@0-FroRose-0,UCt5lpTirxiykH_5c-b8srDg,"​@oscargonzalez5529bro-
The people she killed were for good reasons. 

Her first ex husband was an abuser, and threatened her and Ginny. so that was self defense

The second ex husband she killed obviously had disgusting intentions with Ginny. He deserved hell for that. 

And the third although questionable, it wasn't crazy. Cynthia's husband was never gonna live to much longer. It was a better way to go. Besides Cynthia did NOT care about her husband, she is just petty and wants Georgia gone. 

Although I'm not a huge fan of Georgia's actions some times, those murders are definitely justified..",en,2025-06-08T19:20:55Z,2025-06-08 15:20:55,0,3689174,90047,2774,"Tue, 16 Dec 2025 12:42:34 GMT"
dCyvk3uyp5Q,https://www.youtube.com/watch?v=dCyvk3uyp5Q,UgzYRJLhpSoESmZNzkB4AaABAg,@Senmsnairs,UCH-7XHpRhkFcFEQJo16AvFg,MARCUS NERDE AQQQQ,la,2025-06-05T13:06:22Z,2025-06-05 09:06:22,0,1,UgzYRJLhpSoESmZNzkB4AaABAg.AIznVKfm23fAIzoMpe5i86,@damiiiiiiiii,UCmDdZEZq94l-65MUhkvfTrg,Dizide. Sonradan gözüküyor,tr,2025-06-05T13:13:57Z,2025-06-05 09:13:57,0,3689174,90047,2774,"Tue, 16 Dec 2025 12:42:34 GMT"
dCyvk3uyp5Q,https://www.youtube.com/watch?v=dCyvk3uyp5Q,Ugz2ia_jgUvnN8Varsp4AaABAg,@AkelloDubai256,UCAQ6imOGRzHjNfNeM2hXvBg,Am now watching season 3 but Marcus new haircut has changed him 😢 i loved his old haircut wen he sweeps up the hair from his face wow so damn romantic😊,en,2025-06-05T12:39:28Z,2025-06-05 08:39:28,2,1,Ugz2ia_jgUvnN8Varsp4AaABAg.AIzkQEstHNJAJ3lMf7Y0IF,@oscargonzalez5529,UCuUCqAD3cXA5MBMUe68ZzgQ,You sound like a pedo.,NA,2025-06-07T11:23:55Z,2025-06-07 07:23:55,0,3689174,90047,2774,"Tue, 16 Dec 2025 12:42:34 GMT"
dCyvk3uyp5Q,https://www.youtube.com/watch?v=dCyvk3uyp5Q,UgyMrUVLAM3ax-Ly32J4AaABAg,@ballsaxk123,UCtFoCUebXvaihOrwLLAfg4g,5 FRICKIN MINS TILL ITS OUT AHHHH,lb,2025-06-05T06:55:56Z,2025-06-05 02:55:56,1,1,UgyMrUVLAM3ax-Ly32J4AaABAg.AIz86A3eWv1AIz89EiBIa6,@meesha6723,UCFs0d9P_QTJFEMEWWXJ7QTw,YESSS,kk,2025-06-05T06:56:21Z,2025-06-05 02:56:21,0,3689174,90047,2774,"Tue, 16 Dec 2025 12:42:34 GMT"
dCyvk3uyp5Q,https://www.youtube.com/watch?v=dCyvk3uyp5Q,Ugz_Y_R4HoiHdltbL0x4AaABAg,@Linkanator-xn6og,UCseSEBJcoiYOfDcwERwwXbQ,I swear Ginna was so annoying in season 2 but this new season seems redeemable 🥴,NA,2025-06-05T06:31:15Z,2025-06-05 02:31:15,4,3,Ugz_Y_R4HoiHdltbL0x4AaABAg.AIz5HMNMRJCAIz6f_XsQJf,@meesha6723,UCFs0d9P_QTJFEMEWWXJ7QTw,Agreed,en,2025-06-05T06:43:26Z,2025-06-05 02:43:26,1,3689174,90047,2774,"Tue, 16 Dec 2025 12:42:34 GMT"
dCyvk3uyp5Q,https://www.youtube.com/watch?v=dCyvk3uyp5Q,Ugz_Y_R4HoiHdltbL0x4AaABAg,@Linkanator-xn6og,UCseSEBJcoiYOfDcwERwwXbQ,I swear Ginna was so annoying in season 2 but this new season seems redeemable 🥴,NA,2025-06-05T06:31:15Z,2025-06-05 02:31:15,4,3,Ugz_Y_R4HoiHdltbL0x4AaABAg.AIz5HMNMRJCAIz7DfWKfCK,@StewStewart-h4r,UCRlgIywxSzw5I-qO7X_YsNA,😂😂😂SHE WAS PISSING ME OFF!!!!,en,2025-06-05T06:48:13Z,2025-06-05 02:48:13,1,3689174,90047,2774,"Tue, 16 Dec 2025 12:42:34 GMT"
dCyvk3uyp5Q,https://www.youtube.com/watch?v=dCyvk3uyp5Q,Ugz_Y_R4HoiHdltbL0x4AaABAg,@Linkanator-xn6og,UCseSEBJcoiYOfDcwERwwXbQ,I swear Ginna was so annoying in season 2 but this new season seems redeemable 🥴,NA,2025-06-05T06:31:15Z,2025-06-05 02:31:15,4,3,Ugz_Y_R4HoiHdltbL0x4AaABAg.AIz5HMNMRJCAIz7sXTHyYK,@RoyStewart-e3w,UCggrDa04KbzugfVGLrUmNSw,I call her ginna also💀 and yeh she was hard to watch,en,2025-06-05T06:53:56Z,2025-06-05 02:53:56,0,3689174,90047,2774,"Tue, 16 Dec 2025 12:42:34 GMT"
dCyvk3uyp5Q,https://www.youtube.com/watch?v=dCyvk3uyp5Q,UgxLYZZ-DEfut2B7DKF4AaABAg,@EmmaEatsStuff,UCMVAKZRWkxdV4gK6PXWXwgQ,Wait did yall se that clip of sophie and max kissing?!?!?,en,2025-06-05T06:25:51Z,2025-06-05 02:25:51,1,2,UgxLYZZ-DEfut2B7DKF4AaABAg.AIz4eq6FZDRAJ-MB1MXsDw,@BWWiDOwzZz,UCZWiVe-rW2aV4Oi9skqd8Wg,Cmon just watch it u can do it I believe in u…,fy,2025-06-05T18:18:10Z,2025-06-05 14:18:10,0,3689174,90047,2774,"Tue, 16 Dec 2025 12:42:34 GMT"
dCyvk3uyp5Q,https://www.youtube.com/watch?v=dCyvk3uyp5Q,UgxLYZZ-DEfut2B7DKF4AaABAg,@EmmaEatsStuff,UCMVAKZRWkxdV4gK6PXWXwgQ,Wait did yall se that clip of sophie and max kissing?!?!?,en,2025-06-05T06:25:51Z,2025-06-05 02:25:51,1,2,UgxLYZZ-DEfut2B7DKF4AaABAg.AIz4eq6FZDRAJ-N2dq1uL2,@EmmaEatsStuff,UCMVAKZRWkxdV4gK6PXWXwgQ,​@BWWiDOwzZz Bro what..?,pl,2025-06-05T18:25:46Z,2025-06-05 14:25:46,0,3689174,90047,2774,"Tue, 16 Dec 2025 12:42:34 GMT"
dCyvk3uyp5Q,https://www.youtube.com/watch?v=dCyvk3uyp5Q,UgzelLwIZRdqpOLPfF14AaABAg,@nasayzzz,UCqTk3m507ayy6nQ4uQ2fH8g,Is there a specific time its getting released in europe?,en,2025-06-05T06:13:47Z,2025-06-05 02:13:47,1,1,UgzelLwIZRdqpOLPfF14AaABAg.AIz3HT7xnHPAIz3llSGpQH,@jayasharma5044,UC-16rtRK0w8-BDe5FhL3mLg,3 am est convert accordingly,ca,2025-06-05T06:18:04Z,2025-06-05 02:18:04,0,3689174,90047,2774,"Tue, 16 Dec 2025 12:42:34 GMT"
dCyvk3uyp5Q,https://www.youtube.com/watch?v=dCyvk3uyp5Q,UgzukcZmEKVirPmYNdB4AaABAg,@LuvU123-j2l,UCriNwd3jhgIRfFlw-zhskJw,So exited it’s coming out at 3:00AM yesssssssss also her trial fits are cooking lol,en,2025-06-05T05:31:07Z,2025-06-05 01:31:07,2,2,UgzukcZmEKVirPmYNdB4AaABAg.AIyzOtr3RBLAIz2F2ZtbHA,@meesha6723,UCFs0d9P_QTJFEMEWWXJ7QTw,Wait at 3? I thought it comes out at 12 am,en,2025-06-05T06:04:43Z,2025-06-05 02:04:43,1,3689174,90047,2774,"Tue, 16 Dec 2025 12:42:34 GMT"
dCyvk3uyp5Q,https://www.youtube.com/watch?v=dCyvk3uyp5Q,UgzukcZmEKVirPmYNdB4AaABAg,@LuvU123-j2l,UCriNwd3jhgIRfFlw-zhskJw,So exited it’s coming out at 3:00AM yesssssssss also her trial fits are cooking lol,en,2025-06-05T05:31:07Z,2025-06-05 01:31:07,2,2,UgzukcZmEKVirPmYNdB4AaABAg.AIyzOtr3RBLAIzB9EMEOik,@LuvU123-j2l,UCriNwd3jhgIRfFlw-zhskJw,@meesha6723from what I looked up it says 3 might be misinformation who knows lol,en,2025-06-05T07:22:34Z,2025-06-05 03:22:34,0,3689174,90047,2774,"Tue, 16 Dec 2025 12:42:34 GMT"
dCyvk3uyp5Q,https://www.youtube.com/watch?v=dCyvk3uyp5Q,UgwsHIkc2INxj5YXIHV4AaABAg,@PurpleSnow243,UCkdUZ7onMuPme0WrvUIXUjA,Georgia is the star of this show,en,2025-06-04T23:04:40Z,2025-06-04 19:04:40,2,4,UgwsHIkc2INxj5YXIHV4AaABAg.AIyIAV2RzCBAJ-MFM2P0Mt,@BWWiDOwzZz,UCZWiVe-rW2aV4Oi9skqd8Wg,Nooo abby,sn,2025-06-05T18:18:46Z,2025-06-05 14:18:46,1,3689174,90047,2774,"Tue, 16 Dec 2025 12:42:34 GMT"
dCyvk3uyp5Q,https://www.youtube.com/watch?v=dCyvk3uyp5Q,UgwsHIkc2INxj5YXIHV4AaABAg,@PurpleSnow243,UCkdUZ7onMuPme0WrvUIXUjA,Georgia is the star of this show,en,2025-06-04T23:04:40Z,2025-06-04 19:04:40,2,4,UgwsHIkc2INxj5YXIHV4AaABAg.AIyIAV2RzCBAJ3knq2SVrO,@xD4isyFr4gmentsx,UCjYjspKHshG0oX41PnUrcvg,"None of them are. They’re narcissists, unhinged, liars, and killers. Also Abby and the friend group are not good people, they left Maxine out and couldn’t care any less about her feelings. They all need help. And if you support them you’re apart of the problem. You can’t always use your past to manipulate your future.",en,2025-06-07T11:19:01Z,2025-06-07 07:19:01,1,3689174,90047,2774,"Tue, 16 Dec 2025 12:42:34 GMT"
dCyvk3uyp5Q,https://www.youtube.com/watch?v=dCyvk3uyp5Q,UgwsHIkc2INxj5YXIHV4AaABAg,@PurpleSnow243,UCkdUZ7onMuPme0WrvUIXUjA,Georgia is the star of this show,en,2025-06-04T23:04:40Z,2025-06-04 19:04:40,2,4,UgwsHIkc2INxj5YXIHV4AaABAg.AIyIAV2RzCBAJ3lASu4Ozj,@oscargonzalez5529,UCuUCqAD3cXA5MBMUe68ZzgQ,A horrible character with a show named after her. Its obvious she would be the center of attention,en,2025-06-07T11:22:15Z,2025-06-07 07:22:15,1,3689174,90047,2774,"Tue, 16 Dec 2025 12:42:34 GMT"
dCyvk3uyp5Q,https://www.youtube.com/watch?v=dCyvk3uyp5Q,UgwsHIkc2INxj5YXIHV4AaABAg,@PurpleSnow243,UCkdUZ7onMuPme0WrvUIXUjA,Georgia is the star of this show,en,2025-06-04T23:04:40Z,2025-06-04 19:04:40,2,4,UgwsHIkc2INxj5YXIHV4AaABAg.AIyIAV2RzCBAJ3y4nFMd_8,@BWWiDOwzZz,UCZWiVe-rW2aV4Oi9skqd8Wg,@oscargonzalez5529shhh,hu,2025-06-07T13:15:04Z,2025-06-07 09:15:04,0,3689174,90047,2774,"Tue, 16 Dec 2025 12:42:34 GMT"
dCyvk3uyp5Q,https://www.youtube.com/watch?v=dCyvk3uyp5Q,UgxazNXUKEidBgR8P7t4AaABAg,@Sophiaandguero,UCP-RG5ob5JfyGRECAkmOhMg,THIS COMES OUT ON MY SISTERS BIRTHDAYY COULD ANYBODY SAY HAPPY BIRTHDAY maybe?,en,2025-06-04T20:53:12Z,2025-06-04 16:53:12,2,1,UgxazNXUKEidBgR8P7t4AaABAg.AIy37bb9FXVAIyPiyI7wT_,@Fw1417_Miiiiii,UCemR8RjjZciEtgh-U5IYgQw,Happy birthday,NA,2025-06-05T00:10:41Z,2025-06-04 20:10:41,0,3689174,90047,2774,"Tue, 16 Dec 2025 12:42:34 GMT"
dCyvk3uyp5Q,https://www.youtube.com/watch?v=dCyvk3uyp5Q,Ugw7rQThP9WH40-orJN4AaABAg,@ethanethan4504,UCYGfDZ3Rexq8jyWzEfEbkVw,HELP... I'm scared to watch it coz I'll binge it in a day and then I'll be left with a bigger hole 😢😢,en,2025-06-04T20:24:09Z,2025-06-04 16:24:09,1,1,Ugw7rQThP9WH40-orJN4AaABAg.AIy-nqHd0T-AIyPlFOMtA6,@Fw1417_Miiiiii,UCemR8RjjZciEtgh-U5IYgQw,Same,NA,2025-06-05T00:10:59Z,2025-06-04 20:10:59,0,3689174,90047,2774,"Tue, 16 Dec 2025 12:42:34 GMT"
dCyvk3uyp5Q,https://www.youtube.com/watch?v=dCyvk3uyp5Q,UgxtyfB1QiwLOgfDG4t4AaABAg,@Mobina-z1u,UCZZjGVUGQtrSde3V_KLI6TQ,What time will it be released?,en,2025-06-04T14:18:26Z,2025-06-04 10:18:26,0,1,UgxtyfB1QiwLOgfDG4t4AaABAg.AIxLxGAnx2qAIy-CFhi_JO,@urfavvdayday,UCHot9mBtfhBg_n5sQDRN4eg,3 am ET/12 am PT,fr,2025-06-04T20:18:53Z,2025-06-04 16:18:53,0,3689174,90047,2774,"Tue, 16 Dec 2025 12:42:34 GMT"
dCyvk3uyp5Q,https://www.youtube.com/watch?v=dCyvk3uyp5Q,UgykYrokAlYJqW2wkTR4AaABAg,@luvalways_emma,UCpVV-HazzxTsTM-027SfQQA,lowkey how did she even get arrested like i’m sorry why did that guys phone call provide sufficient evidence to arrest her.. tom was actively dying 😭,en,2025-06-03T18:46:07Z,2025-06-03 14:46:07,0,1,UgykYrokAlYJqW2wkTR4AaABAg.AIvFmvu1rT0AIvaUm1t7uz,@leas3174,UCv6fTom_aNcKuY99p3D2Q2Q,"Yes but he was dying slowly, not all of a sudden like when she had stopped his air flow + they can see in autopsy of he died from suffocating or of illness",en,2025-06-03T21:55:45Z,2025-06-03 17:55:45,1,3689174,90047,2774,"Tue, 16 Dec 2025 12:42:34 GMT"
dCyvk3uyp5Q,https://www.youtube.com/watch?v=dCyvk3uyp5Q,Ugx-AbQ2r0pMg5QEbCV4AaABAg,@MissMTune,UCAL2SrU7NtVyGc9gsE6WXzQ,"Max's character development seems great. She's actually concerned for Ginny, not just herself.

Edit: yeah i was right. In all the wrong ways.",en,2025-06-03T17:44:24Z,2025-06-03 13:44:24,76,1,Ugx-AbQ2r0pMg5QEbCV4AaABAg.AIv8izFsJWIAJ6ZK4xUbKW,@pawterream3777,UC5gqCuA72OL2BJ_d2BlDIng,"She really is concerned for Ginny, the most supportive one among MANG.",en,2025-06-08T13:27:41Z,2025-06-08 09:27:41,2,3689174,90047,2774,"Tue, 16 Dec 2025 12:42:34 GMT"
dCyvk3uyp5Q,https://www.youtube.com/watch?v=dCyvk3uyp5Q,UgyMnkT2VZtjMJL1_5d4AaABAg,@joymcclees,UCh9P60o50CBr0cPLSGvYK0w,I have a feeling Paul is gonna pmo this season,en,2025-06-02T23:56:10Z,2025-06-02 19:56:10,1,2,UgyMnkT2VZtjMJL1_5d4AaABAg.AItETt-OEBFAItTdTnsZJ4,@BWWiDOwzZz,UCZWiVe-rW2aV4Oi9skqd8Wg,Whyyyy,NA,2025-06-03T02:08:41Z,2025-06-02 22:08:41,0,3689174,90047,2774,"Tue, 16 Dec 2025 12:42:34 GMT"
dCyvk3uyp5Q,https://www.youtube.com/watch?v=dCyvk3uyp5Q,UgyMnkT2VZtjMJL1_5d4AaABAg,@joymcclees,UCh9P60o50CBr0cPLSGvYK0w,I have a feeling Paul is gonna pmo this season,en,2025-06-02T23:56:10Z,2025-06-02 19:56:10,1,2,UgyMnkT2VZtjMJL1_5d4AaABAg.AItETt-OEBFAIyX1N75sT5,@pumpkinspiccy15,UCZhdR6gHcPogBs3QuoEg3Jg,He didn’t do much tbh,en,2025-06-05T01:14:30Z,2025-06-04 21:14:30,0,3689174,90047,2774,"Tue, 16 Dec 2025 12:42:34 GMT"
dCyvk3uyp5Q,https://www.youtube.com/watch?v=dCyvk3uyp5Q,UgwhlPh8uve_pzseBzl4AaABAg,@Giggi2567,UCunGqh6HVk4ZP4lTCZjS_uw,Did I see Max at Zions house?!!! Hiding??!,en,2025-06-01T22:58:53Z,2025-06-01 18:58:53,1,2,UgwhlPh8uve_pzseBzl4AaABAg.AIqZ7Rs1lBFAIt1z4upj8G,@Txtxfuhjhxvtfbyc,UCF1t2WFeFKkwaloFMkOifrw,If u pause it on the scene. She’s in the doorway of Marcus bedroom,en,2025-06-02T22:06:58Z,2025-06-02 18:06:58,1,3689174,90047,2774,"Tue, 16 Dec 2025 12:42:34 GMT"
dCyvk3uyp5Q,https://www.youtube.com/watch?v=dCyvk3uyp5Q,UgwhlPh8uve_pzseBzl4AaABAg,@Giggi2567,UCunGqh6HVk4ZP4lTCZjS_uw,Did I see Max at Zions house?!!! Hiding??!,en,2025-06-01T22:58:53Z,2025-06-01 18:58:53,1,2,UgwhlPh8uve_pzseBzl4AaABAg.AIqZ7Rs1lBFAJ0THlB2X9L,@pumpkinspiccy15,UCZhdR6gHcPogBs3QuoEg3Jg,Lol she’s in her house,en,2025-06-06T04:39:30Z,2025-06-06 00:39:30,0,3689174,90047,2774,"Tue, 16 Dec 2025 12:42:34 GMT"
dCyvk3uyp5Q,https://www.youtube.com/watch?v=dCyvk3uyp5Q,UgyqO8hWwI2M-2M3KpF4AaABAg,@Gigi_cano,UCiPgvrcrGAD_lXYy0kM1KWQ,"1:46 WHO THE HELL WAS MAX ABT TO KISS

Edit : MAX WTH THAT SOPHIE",en,2025-06-01T13:45:20Z,2025-06-01 09:45:20,1,2,UgyqO8hWwI2M-2M3KpF4AaABAg.AIpZmEWFn_-AIpeuDQRYJh,@leas3174,UCv6fTom_aNcKuY99p3D2Q2Q,Gosh I was so disappointed when I saw it. Like what about Silver???,en,2025-06-01T14:38:51Z,2025-06-01 10:38:51,0,3689174,90047,2774,"Tue, 16 Dec 2025 12:42:34 GMT"
