video_id,video_url,comment_id,comment_author_display,comment_author_channel_id,comment_content,comment_lang,comment_time_utc,comment_time_local,comment_like_count,comment_reply_count,reply_id,reply_author_display,reply_author_channel_id,reply_content,reply_lang,reply_time_utc,reply_time_local,reply_like_count,view_count,like_count,comment_count,crawl_time
LAM63Dj3XBQ,https://www.youtube.com/watch?v=LAM63Dj3XBQ,UgwwoDv-Q9xB6rZNfYp4AaABAg,@harryc1971,UCWy5StQYRiJ6n9mnQYzXQ_A,"I miss those games, whilst Liev is a solid choice it feels like seeing its animation it should be Michael Ironside",en,2025-09-02T23:19:59Z,2025-09-02 19:19:59,1,2,UgwwoDv-Q9xB6rZNfYp4AaABAg.AMa3TNN2eFNAMaRAJpuvfF,@ZGh0st1422,UCVACf_Bf3XtIYLxUECPPFKQ,He said no,ceb,2025-09-03T02:47:05Z,2025-09-02 22:47:05,1,644821,22064,2253,"Tue, 16 Dec 2025 12:42:34 GMT"
LAM63Dj3XBQ,https://www.youtube.com/watch?v=LAM63Dj3XBQ,UgwwoDv-Q9xB6rZNfYp4AaABAg,@harryc1971,UCWy5StQYRiJ6n9mnQYzXQ_A,"I miss those games, whilst Liev is a solid choice it feels like seeing its animation it should be Michael Ironside",en,2025-09-02T23:19:59Z,2025-09-02 19:19:59,1,2,UgwwoDv-Q9xB6rZNfYp4AaABAg.AMa3TNN2eFNAMbQkxET_wA,@harryc1971,UCWy5StQYRiJ6n9mnQYzXQ_A,@ZGh0st1422 thats fair enough,gd,2025-09-03T12:02:44Z,2025-09-03 08:02:44,0,644821,22064,2253,"Tue, 16 Dec 2025 12:42:34 GMT"
LAM63Dj3XBQ,https://www.youtube.com/watch?v=LAM63Dj3XBQ,Ugw6EuIandNfZocKaB54AaABAg,@alexanderberki,UCHjKYY2NDLbU0hQT_OEJX9w,Why tf did they not use ironside,en,2025-09-01T19:33:54Z,2025-09-01 15:33:54,0,1,Ugw6EuIandNfZocKaB54AaABAg.AMY4nhFLOEMAMaUtOhHdL5,@ZGh0st1422,UCVACf_Bf3XtIYLxUECPPFKQ,Because he said no,NA,2025-09-03T03:19:36Z,2025-09-02 23:19:36,0,644821,22064,2253,"Tue, 16 Dec 2025 12:42:34 GMT"
LAM63Dj3XBQ,https://www.youtube.com/watch?v=LAM63Dj3XBQ,Ugxdy-YWPqkQI4SK3oF4AaABAg,@mackenzieowens161,UChcczQearl9A3R3-okWOqqA,"I was so excited to hear Ironside's voice but, I didn't know the backstory. That man's voice was legendary. I am still excited for the show though as long as Netflix didn't stiff Ironside, the G.O.A.T.",en,2025-08-31T02:16:19Z,2025-08-30 22:16:19,0,1,Ugxdy-YWPqkQI4SK3oF4AaABAg.AMTeGLA-KRNAMaQlB2xJus,@ZGh0st1422,UCVACf_Bf3XtIYLxUECPPFKQ,"He said no, he doesn’t want to give a half baked performance",en,2025-09-03T02:43:31Z,2025-09-02 22:43:31,0,644821,22064,2253,"Tue, 16 Dec 2025 12:42:34 GMT"
LAM63Dj3XBQ,https://www.youtube.com/watch?v=LAM63Dj3XBQ,UgzGDBuOO2GnOjKeG_p4AaABAg,@B1RDSEYE,UCSa93JLfFB-inw0kcxUCtrA,"Hey! Any of you fricks need to know the song name, composer, and what movie it’s from?! Awesome! There’s only about 50 comments here letting you know that information!! For Christ’s sake, DIDN’T ASK!!!",en,2025-08-30T04:49:19Z,2025-08-30 00:49:19,0,1,UgzGDBuOO2GnOjKeG_p4AaABAg.AMRLyyUCV89AMTlk0UEBNJ,@doc_vader2776,UCa3TtI9BL7GWPDGBNWT-R1g,"Why are you crying?
You can clearly scroll the comments.",en,2025-08-31T03:21:41Z,2025-08-30 23:21:41,0,644821,22064,2253,"Tue, 16 Dec 2025 12:42:34 GMT"
LAM63Dj3XBQ,https://www.youtube.com/watch?v=LAM63Dj3XBQ,Ugxmtw_qiQLenRpZvoB4AaABAg,@WarDotZom,UC2oplRJKvkP6JsMQZGZDq_Q,No michale ironside!? Or eric Johnson? Idk man 👀,NA,2025-08-29T22:08:26Z,2025-08-29 18:08:26,0,1,Ugxmtw_qiQLenRpZvoB4AaABAg.AMQd5uQC5e_AMaU6KLcLmP,@ZGh0st1422,UCVACf_Bf3XtIYLxUECPPFKQ,People hated Johnson and ironside said no,en,2025-09-03T03:12:45Z,2025-09-02 23:12:45,0,644821,22064,2253,"Tue, 16 Dec 2025 12:42:34 GMT"
LAM63Dj3XBQ,https://www.youtube.com/watch?v=LAM63Dj3XBQ,Ugzlka1QeCZhmqL0emJ4AaABAg,@JulioAvila-ws5kn,UCJjue-Gesb2a6p1QYgbW09w,I'm 100 % sure a new splinter cell game is coming .. 😊,en,2025-08-29T21:35:00Z,2025-08-29 17:35:00,1,1,Ugzlka1QeCZhmqL0emJ4AaABAg.AMQ_H0DR1ImAMQbxGv98fG,@Baltimoredummy,UCUCbtTmDcSJpewgxwed7IqA,Same,NA,2025-08-29T21:58:23Z,2025-08-29 17:58:23,0,644821,22064,2253,"Tue, 16 Dec 2025 12:42:34 GMT"
LAM63Dj3XBQ,https://www.youtube.com/watch?v=LAM63Dj3XBQ,UgyV7uot1jsx8zs7cPZ4AaABAg,@KieranChavez,UCcJsEZVr64c-riSC3SDoUqA,I wish their was a ghost recon movie,en,2025-08-29T04:34:35Z,2025-08-29 00:34:35,1,1,UgyV7uot1jsx8zs7cPZ4AaABAg.AMOkVJj29q_AMOkZDfdYtO,@KieranChavez,UCcJsEZVr64c-riSC3SDoUqA,And it has to be ghost recon wildlands,en,2025-08-29T04:35:07Z,2025-08-29 00:35:07,1,644821,22064,2253,"Tue, 16 Dec 2025 12:42:34 GMT"
LAM63Dj3XBQ,https://www.youtube.com/watch?v=LAM63Dj3XBQ,UgyjgcdjD-nIz1vEAhR4AaABAg,@sa4555,UCprgVNSULMGCbZK3tTzZ8gw,"Michael Ironside is Sam Fisher, and no body else. Netflix offered him to voice a different role.
We need another game while he is still with us, and I hope he remains for a long time.",en,2025-08-29T02:16:04Z,2025-08-28 22:16:04,0,1,UgyjgcdjD-nIz1vEAhR4AaABAg.AMOVdgdrZOyAMaQZi7kTiv,@ZGh0st1422,UCVACf_Bf3XtIYLxUECPPFKQ,"He doesn’t want to be Sam anymore, he doesn’t want to give us a half baked performance and yall cry about it",en,2025-09-03T02:41:49Z,2025-09-02 22:41:49,0,644821,22064,2253,"Tue, 16 Dec 2025 12:42:34 GMT"
LAM63Dj3XBQ,https://www.youtube.com/watch?v=LAM63Dj3XBQ,UgyXsUq1vF1D-s0HKZt4AaABAg,@AbdullahMuhammad-bd9jo,UCC_8hr-PRRsIH5VYo44h4ig,shows looking good Netflix i'm gonna watch it as soon as it drops👍🙂,en,2025-08-27T13:56:30Z,2025-08-27 09:56:30,0,1,UgyXsUq1vF1D-s0HKZt4AaABAg.AMKbD5oOO7qANqFHJvpBxL,@TrentWildman-g1u,UCjb-CelTIloZuDqtXhvHMVg,Me too.,mi,2025-10-04T02:42:26Z,2025-10-03 22:42:26,0,644821,22064,2253,"Tue, 16 Dec 2025 12:42:34 GMT"
LAM63Dj3XBQ,https://www.youtube.com/watch?v=LAM63Dj3XBQ,UgzrSwUzH71GbVwYRaR4AaABAg,@Yourmoms-x3y,UC25T91u2eJG5L6cisaWVnbA,Long time splinter cell fan here.. I have no interest in watching a splinter cell cartoon.. that said.. I’d give my left 🥜 to play a new splinter cell game.. but naw.. everything has to be made into a tv show now.. what’s the point of these expensive consoles nowadays if y’all aren’t gonna make decent games for em? The stupidity of these studios trips me out bruh.,en,2025-08-27T13:22:11Z,2025-08-27 09:22:11,0,1,UgzrSwUzH71GbVwYRaR4AaABAg.AMKYHninVffAMaVNQztHXH,@ZGh0st1422,UCVACf_Bf3XtIYLxUECPPFKQ,"As someone who hates animated things, I’m watching this solely because it’s splinter cell",en,2025-09-03T03:23:50Z,2025-09-02 23:23:50,0,644821,22064,2253,"Tue, 16 Dec 2025 12:42:34 GMT"
LAM63Dj3XBQ,https://www.youtube.com/watch?v=LAM63Dj3XBQ,UgxI8Q-4pED5qaGQVJF4AaABAg,@kriss.7716,UCeM_g07QjVoCfK3i7TJoCWA,"Nobody asked for a new voice. Ironside is Sam Fisher. His voice made Sam Fisher who he is. If age is the issue, use AI to clean it up. Stop disrespecting the fans and the legend who built this franchise.",en,2025-08-27T12:35:22Z,2025-08-27 08:35:22,0,1,UgxI8Q-4pED5qaGQVJF4AaABAg.AMKSvpOdaDrAMaU0ri9UfI,@ZGh0st1422,UCVACf_Bf3XtIYLxUECPPFKQ,"Disrespecting the fans yet you fake fans sit here and disrespect ironside. He said no, have SOME degree of respect for the dude yall pretend to worship",en,2025-09-03T03:12:01Z,2025-09-02 23:12:01,0,644821,22064,2253,"Tue, 16 Dec 2025 12:42:34 GMT"
LAM63Dj3XBQ,https://www.youtube.com/watch?v=LAM63Dj3XBQ,Ugx-sLKf_9TzBnt-CvB4AaABAg,@SkamOneOfficial,UCW2rk87-tFzK3Px_42WbUAA,I'm so glad every comment is about the song instead of the trailer 😂😂😂,en,2025-08-27T02:07:27Z,2025-08-26 22:07:27,41,1,Ugx-sLKf_9TzBnt-CvB4AaABAg.AMJL3s6lsBYAN0pdRxiSW1,@grinvich.76,UCRdRi_UeET3gEpwAKLTEjBw,Bots,NA,2025-09-13T18:09:09Z,2025-09-13 14:09:09,8,644821,22064,2253,"Tue, 16 Dec 2025 12:42:34 GMT"
LAM63Dj3XBQ,https://www.youtube.com/watch?v=LAM63Dj3XBQ,UgyyNljHTMOO0yKwnz14AaABAg,@razo181985,UCPeJ4T_IKLF4uHgc9j_2Nug,So we can't get Michael Ironside?,en,2025-08-26T22:07:00Z,2025-08-26 18:07:00,0,1,UgyyNljHTMOO0yKwnz14AaABAg.AMIuYhCAv8AAMaUO6uz5xK,@ZGh0st1422,UCVACf_Bf3XtIYLxUECPPFKQ,He said no,ceb,2025-09-03T03:15:11Z,2025-09-02 23:15:11,0,644821,22064,2253,"Tue, 16 Dec 2025 12:42:34 GMT"
LAM63Dj3XBQ,https://www.youtube.com/watch?v=LAM63Dj3XBQ,Ugx9062InkESdU91kid4AaABAg,@ryuunorite,UC1KspZgmUIs4jBavXvSTo4g,"Unless Michael Ironside is just fully out of the business at this point, an older Sam should only be played by him. His voice was perfect the entire time he was acting the role and Blacklist was off because of it no matter how much the game was fun.",en,2025-08-26T19:49:31Z,2025-08-26 15:49:31,0,2,Ugx9062InkESdU91kid4AaABAg.AMIeooD9yThAMaQzv5-mnn,@ZGh0st1422,UCVACf_Bf3XtIYLxUECPPFKQ,He said no,ceb,2025-09-03T02:45:32Z,2025-09-02 22:45:32,0,644821,22064,2253,"Tue, 16 Dec 2025 12:42:34 GMT"
LAM63Dj3XBQ,https://www.youtube.com/watch?v=LAM63Dj3XBQ,Ugx9062InkESdU91kid4AaABAg,@ryuunorite,UC1KspZgmUIs4jBavXvSTo4g,"Unless Michael Ironside is just fully out of the business at this point, an older Sam should only be played by him. His voice was perfect the entire time he was acting the role and Blacklist was off because of it no matter how much the game was fun.",en,2025-08-26T19:49:31Z,2025-08-26 15:49:31,0,2,Ugx9062InkESdU91kid4AaABAg.AMIeooD9yThAMaabvF5WGO,@ryuunorite,UC1KspZgmUIs4jBavXvSTo4g,@ZGh0st1422 Well that sucks. I miss the real Sam Fisher.,en,2025-09-03T04:18:22Z,2025-09-03 00:18:22,0,644821,22064,2253,"Tue, 16 Dec 2025 12:42:34 GMT"
LAM63Dj3XBQ,https://www.youtube.com/watch?v=LAM63Dj3XBQ,UgyHwxYY-q2daSOxQPd4AaABAg,@MyKill71,UCCQNQvVlh2huEOJyImdwObQ,"How much more SATISFYING would this be..., if only they got Michael Ironside* back to voice Sam, instead of Leiv.  🤔

*(He's not dead, ya'know  🤷‍♂️)",en,2025-08-26T12:36:41Z,2025-08-26 08:36:41,0,1,UgyHwxYY-q2daSOxQPd4AaABAg.AMHtHaMLMlXAMaSWYPNDsc,@ZGh0st1422,UCVACf_Bf3XtIYLxUECPPFKQ,"He said no, yall have zero respect for him",en,2025-09-03T02:58:52Z,2025-09-02 22:58:52,0,644821,22064,2253,"Tue, 16 Dec 2025 12:42:34 GMT"
LAM63Dj3XBQ,https://www.youtube.com/watch?v=LAM63Dj3XBQ,UgxT3erVfnTfDe1Oe-Z4AaABAg,@filovirus1,UCPymxNn-_OYhvHu_yRzk-Xw,no Michael Ironside??  WTH,NA,2025-08-26T07:21:19Z,2025-08-26 03:21:19,0,1,UgxT3erVfnTfDe1Oe-Z4AaABAg.AMHKBpsT0qLAMaUkp1Unpo,@ZGh0st1422,UCVACf_Bf3XtIYLxUECPPFKQ,He said no,ceb,2025-09-03T03:18:25Z,2025-09-02 23:18:25,0,644821,22064,2253,"Tue, 16 Dec 2025 12:42:34 GMT"
LAM63Dj3XBQ,https://www.youtube.com/watch?v=LAM63Dj3XBQ,UgzUOvDnTC6aSJZehMZ4AaABAg,@Pat0p,UCOJgEqPvRiE8yZkC8jInzWQ,This guy sounds a lot better than the Blacklist Sam Fisher. But I would've rather had Michael Ironside.,en,2025-08-26T01:59:16Z,2025-08-25 21:59:16,0,2,UgzUOvDnTC6aSJZehMZ4AaABAg.AMGkL05cwykAMaTRyH_kgl,@ZGh0st1422,UCVACf_Bf3XtIYLxUECPPFKQ,Ironside said no,ceb,2025-09-03T03:06:58Z,2025-09-02 23:06:58,0,644821,22064,2253,"Tue, 16 Dec 2025 12:42:34 GMT"
LAM63Dj3XBQ,https://www.youtube.com/watch?v=LAM63Dj3XBQ,UgzUOvDnTC6aSJZehMZ4AaABAg,@Pat0p,UCOJgEqPvRiE8yZkC8jInzWQ,This guy sounds a lot better than the Blacklist Sam Fisher. But I would've rather had Michael Ironside.,en,2025-08-26T01:59:16Z,2025-08-25 21:59:16,0,2,UgzUOvDnTC6aSJZehMZ4AaABAg.AMGkL05cwykAMc4aLzo7oc,@Pat0p,UCOJgEqPvRiE8yZkC8jInzWQ,@ZGh0st1422 make me cry,en,2025-09-03T18:08:17Z,2025-09-03 14:08:17,0,644821,22064,2253,"Tue, 16 Dec 2025 12:42:34 GMT"
LAM63Dj3XBQ,https://www.youtube.com/watch?v=LAM63Dj3XBQ,Ugz-0oM9-guX1V2psax4AaABAg,@revivemebrogames,UCwfi6YosQkA95g17ouzH5kw,Pause....why isn't sam being voiced by Ironside?!,en,2025-08-25T21:13:11Z,2025-08-25 17:13:11,0,1,Ugz-0oM9-guX1V2psax4AaABAg.AMGEagnRKSwAMaTu8Y09Ck,@ZGh0st1422,UCVACf_Bf3XtIYLxUECPPFKQ,Because he said no,NA,2025-09-03T03:10:57Z,2025-09-02 23:10:57,1,644821,22064,2253,"Tue, 16 Dec 2025 12:42:34 GMT"
LAM63Dj3XBQ,https://www.youtube.com/watch?v=LAM63Dj3XBQ,Ugw3C5d0uW99_qANNdB4AaABAg,@mprieto57,UCVxTiXBZAtAvvLyq2m5gNQw,Michael Ironside is Sam Fisher.,NA,2025-08-25T19:38:59Z,2025-08-25 15:38:59,2,1,Ugw3C5d0uW99_qANNdB4AaABAg.AMG3oi4UtxTAMGb5X0y2AC,@frostystreamz,UCMnDoPflGUKdc9kWfXmS0WQ,right??,NA,2025-08-26T00:38:30Z,2025-08-25 20:38:30,0,644821,22064,2253,"Tue, 16 Dec 2025 12:42:34 GMT"
LAM63Dj3XBQ,https://www.youtube.com/watch?v=LAM63Dj3XBQ,UgxuPmHDNP9bp-1KN0F4AaABAg,@Elric24,UCVS2hdp1nKujZiiy5Z-bvEQ,The fact that Ironside is still working and wasn't invited to voice Sam is extremely aggravating. I'll give Liev the benefit of the doubt though.,en,2025-08-25T18:28:52Z,2025-08-25 14:28:52,0,1,UgxuPmHDNP9bp-1KN0F4AaABAg.AMFwnE1R7iSAMaTgfudcPv,@ZGh0st1422,UCVACf_Bf3XtIYLxUECPPFKQ,He literally said no,NA,2025-09-03T03:09:07Z,2025-09-02 23:09:07,0,644821,22064,2253,"Tue, 16 Dec 2025 12:42:34 GMT"
LAM63Dj3XBQ,https://www.youtube.com/watch?v=LAM63Dj3XBQ,Ugz2QzhjiOICPNJYJlZ4AaABAg,@jozeph6948,UC2E4CmvoAD_NfOWuLyCkRQg,സുഷിൻ ശ്യാം.. ❤,ml,2025-08-25T14:32:44Z,2025-08-25 10:32:44,12,1,Ugz2QzhjiOICPNJYJlZ4AaABAg.AMFWlm1pwLzAMvTWn6qY06,@SreenathNether,UC0TUoSMHSrheaIE73qa2QMA,I don't see any similarities,mg,2025-09-11T06:51:41Z,2025-09-11 02:51:41,0,644821,22064,2253,"Tue, 16 Dec 2025 12:42:34 GMT"
LAM63Dj3XBQ,https://www.youtube.com/watch?v=LAM63Dj3XBQ,Ugzfd1SUQHhu6CaYUG14AaABAg,@anvidantey,UCiD96GIu7dO1EoiZd11tpsw,"Netflix has become rouge now!!! Stealing others ip's, contents nd music as Ur own is not cool man!!!👎👎👎  The least, give credits appropriately !!! Grow up netflix, grow up!!! Sushin Man, U should file a copyright case against netflix 4 using Ur song without Ur consent!!! Netflix എന്ന് പറഞ്ഞു എന്തും ചെയ്യാമെന്നായാ... കള്ള ബടുവ...",en,2025-08-25T12:37:40Z,2025-08-25 08:37:40,0,1,Ugzfd1SUQHhu6CaYUG14AaABAg.AMFJb0hsNm0AMFhH4UqNZ_,@bloodwarrior314,UC8273aCeu07tzBrR8mHggcw,IM PRETTY SURE NETFLIX MUSTVE PAID HIM,NA,2025-08-25T16:13:16Z,2025-08-25 12:13:16,0,644821,22064,2253,"Tue, 16 Dec 2025 12:42:34 GMT"
LAM63Dj3XBQ,https://www.youtube.com/watch?v=LAM63Dj3XBQ,UgyCnC3TjJZuufETVPx4AaABAg,@soloCreationsFX,UC_jUSTk_a73Bbg1BPdLU_MQ,Who else For Sushin shyam 🙂,NA,2025-08-25T11:10:00Z,2025-08-25 07:10:00,1180,27,UgyCnC3TjJZuufETVPx4AaABAg.AMF9ZsWzp9iAMFa0bhyZ46,@jsjishnus,UCAYx6DZ6LNM1hxwYfgSA2GA,😂😂,ja,2025-08-25T15:09:51Z,2025-08-25 11:09:51,1,644821,22064,2253,"Tue, 16 Dec 2025 12:42:34 GMT"
LAM63Dj3XBQ,https://www.youtube.com/watch?v=LAM63Dj3XBQ,UgyCnC3TjJZuufETVPx4AaABAg,@soloCreationsFX,UC_jUSTk_a73Bbg1BPdLU_MQ,Who else For Sushin shyam 🙂,NA,2025-08-25T11:10:00Z,2025-08-25 07:10:00,1180,27,UgyCnC3TjJZuufETVPx4AaABAg.AMF9ZsWzp9iAMGKv8V2t7A,@srji489,UCbQucwYtCfktM8AnQwho3bA,"Mallus steal movie ideas from foreign films all the time. Yo mad when it happen to you😂😂😂
Sawar wat saaar😂😂",en,2025-08-25T22:08:24Z,2025-08-25 18:08:24,8,644821,22064,2253,"Tue, 16 Dec 2025 12:42:34 GMT"
LAM63Dj3XBQ,https://www.youtube.com/watch?v=LAM63Dj3XBQ,UgyCnC3TjJZuufETVPx4AaABAg,@soloCreationsFX,UC_jUSTk_a73Bbg1BPdLU_MQ,Who else For Sushin shyam 🙂,NA,2025-08-25T11:10:00Z,2025-08-25 07:10:00,1180,27,UgyCnC3TjJZuufETVPx4AaABAg.AMF9ZsWzp9iAMGMa0eBXxk,@kunjata002,UCg8WJQhI9Ke26LGHkg_vBdg,@srji489 we just steal ideas bro never steal the scene directly and paste on our movies 😂😂😂.,en,2025-08-25T22:23:00Z,2025-08-25 18:23:00,63,644821,22064,2253,"Tue, 16 Dec 2025 12:42:34 GMT"
LAM63Dj3XBQ,https://www.youtube.com/watch?v=LAM63Dj3XBQ,UgyCnC3TjJZuufETVPx4AaABAg,@soloCreationsFX,UC_jUSTk_a73Bbg1BPdLU_MQ,Who else For Sushin shyam 🙂,NA,2025-08-25T11:10:00Z,2025-08-25 07:10:00,1180,27,UgyCnC3TjJZuufETVPx4AaABAg.AMF9ZsWzp9iAMGkSEP4A9E,@om_parabrahma,UCpa2dbYpScI6M-caYB22aTA,​@srji489Then other languages and Bollywood just gulp our vomit and remake 😂,en,2025-08-26T02:00:15Z,2025-08-25 22:00:15,0,644821,22064,2253,"Tue, 16 Dec 2025 12:42:34 GMT"
LAM63Dj3XBQ,https://www.youtube.com/watch?v=LAM63Dj3XBQ,UgyCnC3TjJZuufETVPx4AaABAg,@soloCreationsFX,UC_jUSTk_a73Bbg1BPdLU_MQ,Who else For Sushin shyam 🙂,NA,2025-08-25T11:10:00Z,2025-08-25 07:10:00,1180,27,UgyCnC3TjJZuufETVPx4AaABAg.AMF9ZsWzp9iAMGqFtVptcF,@srji489,UCbQucwYtCfktM8AnQwho3bA,"​@kunjata002its called theft of intellectual property.
But since you people have lowIQ , you cant be blamed😂",en,2025-08-26T02:50:59Z,2025-08-25 22:50:59,0,644821,22064,2253,"Tue, 16 Dec 2025 12:42:34 GMT"
LAM63Dj3XBQ,https://www.youtube.com/watch?v=LAM63Dj3XBQ,UgyCnC3TjJZuufETVPx4AaABAg,@soloCreationsFX,UC_jUSTk_a73Bbg1BPdLU_MQ,Who else For Sushin shyam 🙂,NA,2025-08-25T11:10:00Z,2025-08-25 07:10:00,1180,27,UgyCnC3TjJZuufETVPx4AaABAg.AMF9ZsWzp9iAMGx0C9PS-C,@SniffNuclear,UCRANqo9VuZQ0KXBrmMZtxzw,"​@srji489you don't get an opinion here since all you guys do is remake popular South films, especially from mollywood",en,2025-08-26T03:50:01Z,2025-08-25 23:50:01,35,644821,22064,2253,"Tue, 16 Dec 2025 12:42:34 GMT"
LAM63Dj3XBQ,https://www.youtube.com/watch?v=LAM63Dj3XBQ,UgyCnC3TjJZuufETVPx4AaABAg,@soloCreationsFX,UC_jUSTk_a73Bbg1BPdLU_MQ,Who else For Sushin shyam 🙂,NA,2025-08-25T11:10:00Z,2025-08-25 07:10:00,1180,27,UgyCnC3TjJZuufETVPx4AaABAg.AMF9ZsWzp9iAMH6OAgAyGy,@rohanjayaram2344,UCeLOmRp1Pr243ISEkvks3aA,"​@srji489tf you on about? Noone stole anything here. This is probably a licensing deal between sushin, hanumankind and Netflix to use this song exclusively. They probably got paid too. 
Also you and your ""remakewood"" have no right to say shit about our industry. now even your actors are coming to our industry to act cause your movies are utter flop 😂",en,2025-08-26T05:20:40Z,2025-08-26 01:20:40,12,644821,22064,2253,"Tue, 16 Dec 2025 12:42:34 GMT"
LAM63Dj3XBQ,https://www.youtube.com/watch?v=LAM63Dj3XBQ,UgyCnC3TjJZuufETVPx4AaABAg,@soloCreationsFX,UC_jUSTk_a73Bbg1BPdLU_MQ,Who else For Sushin shyam 🙂,NA,2025-08-25T11:10:00Z,2025-08-25 07:10:00,1180,27,UgyCnC3TjJZuufETVPx4AaABAg.AMF9ZsWzp9iAMH83TCQqAB,@PazhamKanji-wd5dy,UCN3NTWRv-nZSgoV5UgfLOIg,Yessur,de,2025-08-26T05:35:19Z,2025-08-26 01:35:19,0,644821,22064,2253,"Tue, 16 Dec 2025 12:42:34 GMT"
LAM63Dj3XBQ,https://www.youtube.com/watch?v=LAM63Dj3XBQ,UgyCnC3TjJZuufETVPx4AaABAg,@soloCreationsFX,UC_jUSTk_a73Bbg1BPdLU_MQ,Who else For Sushin shyam 🙂,NA,2025-08-25T11:10:00Z,2025-08-25 07:10:00,1180,27,UgyCnC3TjJZuufETVPx4AaABAg.AMF9ZsWzp9iAMH9yf2YwSJ,@nidhungl9334,UCgaakkqd3nucxnJZbMKB7QQ,"@rohanjayaram2344 naah bro coz if u go down this very own comment section, u will find sushin himself asking why hes not credited for his work. i mean inspiration is still okay but blatantly copying it thats not okay.",en,2025-08-26T05:52:00Z,2025-08-26 01:52:00,3,644821,22064,2253,"Tue, 16 Dec 2025 12:42:34 GMT"
LAM63Dj3XBQ,https://www.youtube.com/watch?v=LAM63Dj3XBQ,UgyCnC3TjJZuufETVPx4AaABAg,@soloCreationsFX,UC_jUSTk_a73Bbg1BPdLU_MQ,Who else For Sushin shyam 🙂,NA,2025-08-25T11:10:00Z,2025-08-25 07:10:00,1180,27,UgyCnC3TjJZuufETVPx4AaABAg.AMF9ZsWzp9iAMHAoVmGKuf,@rohanjayaram2344,UCeLOmRp1Pr243ISEkvks3aA,"​​@nidhungl9334 oh then that's a scumbag move from Netflix then. As avesham is on Netflix I think there's some fine print agreement which was overlooked through which they can do this. Not saying that it's good, sushin should be credited but that may be the case.",en,2025-08-26T05:59:21Z,2025-08-26 01:59:21,0,644821,22064,2253,"Tue, 16 Dec 2025 12:42:34 GMT"
LAM63Dj3XBQ,https://www.youtube.com/watch?v=LAM63Dj3XBQ,UgyCnC3TjJZuufETVPx4AaABAg,@soloCreationsFX,UC_jUSTk_a73Bbg1BPdLU_MQ,Who else For Sushin shyam 🙂,NA,2025-08-25T11:10:00Z,2025-08-25 07:10:00,1180,27,UgyCnC3TjJZuufETVPx4AaABAg.AMF9ZsWzp9iAMHBBheLRQS,@srji489,UCbQucwYtCfktM8AnQwho3bA,"​@rohanjayaram2344mallus escape kerala the first chance they get and then spend the rest of their lives ranting about how great mallus are😂😂😂
Saare, onnu randu munnu saaree😂😂",en,2025-08-26T06:02:39Z,2025-08-26 02:02:39,0,644821,22064,2253,"Tue, 16 Dec 2025 12:42:34 GMT"
LAM63Dj3XBQ,https://www.youtube.com/watch?v=LAM63Dj3XBQ,UgyCnC3TjJZuufETVPx4AaABAg,@soloCreationsFX,UC_jUSTk_a73Bbg1BPdLU_MQ,Who else For Sushin shyam 🙂,NA,2025-08-25T11:10:00Z,2025-08-25 07:10:00,1180,27,UgyCnC3TjJZuufETVPx4AaABAg.AMF9ZsWzp9iAMHBNUhNvmL,@Hariappu89,UCY9Q3K84YQuPZrDZn0zCmPg,​@srji489kona kona konaaa...,NA,2025-08-26T06:04:16Z,2025-08-26 02:04:16,0,644821,22064,2253,"Tue, 16 Dec 2025 12:42:34 GMT"
LAM63Dj3XBQ,https://www.youtube.com/watch?v=LAM63Dj3XBQ,UgyCnC3TjJZuufETVPx4AaABAg,@soloCreationsFX,UC_jUSTk_a73Bbg1BPdLU_MQ,Who else For Sushin shyam 🙂,NA,2025-08-25T11:10:00Z,2025-08-25 07:10:00,1180,27,UgyCnC3TjJZuufETVPx4AaABAg.AMF9ZsWzp9iAMHCxSdIEWm,@pranayrajesh4549,UCn7PmySPDyxNmAF_P57iiVQ,​@srji489vanam,hr,2025-08-26T06:18:03Z,2025-08-26 02:18:03,0,644821,22064,2253,"Tue, 16 Dec 2025 12:42:34 GMT"
LAM63Dj3XBQ,https://www.youtube.com/watch?v=LAM63Dj3XBQ,UgyCnC3TjJZuufETVPx4AaABAg,@soloCreationsFX,UC_jUSTk_a73Bbg1BPdLU_MQ,Who else For Sushin shyam 🙂,NA,2025-08-25T11:10:00Z,2025-08-25 07:10:00,1180,27,UgyCnC3TjJZuufETVPx4AaABAg.AMF9ZsWzp9iAMHRMn5yplU,@ananth-kris,UCx8CSyR8b7ftEc8Qn1FY5XQ,I dont actually hear Sushins music here. Only the lyrics from hanumankind.,en,2025-08-26T08:23:59Z,2025-08-26 04:23:59,5,644821,22064,2253,"Tue, 16 Dec 2025 12:42:34 GMT"
LAM63Dj3XBQ,https://www.youtube.com/watch?v=LAM63Dj3XBQ,UgyCnC3TjJZuufETVPx4AaABAg,@soloCreationsFX,UC_jUSTk_a73Bbg1BPdLU_MQ,Who else For Sushin shyam 🙂,NA,2025-08-25T11:10:00Z,2025-08-25 07:10:00,1180,27,UgyCnC3TjJZuufETVPx4AaABAg.AMF9ZsWzp9iAMHqlv-jmRT,@AdnanAshraf-hd6lb,UCqBHAseixWQmeAV6rTpNefw,​@srji489We don't use panmasala 😂northi shit,jv,2025-08-26T12:14:44Z,2025-08-26 08:14:44,0,644821,22064,2253,"Tue, 16 Dec 2025 12:42:34 GMT"
LAM63Dj3XBQ,https://www.youtube.com/watch?v=LAM63Dj3XBQ,UgyCnC3TjJZuufETVPx4AaABAg,@soloCreationsFX,UC_jUSTk_a73Bbg1BPdLU_MQ,Who else For Sushin shyam 🙂,NA,2025-08-25T11:10:00Z,2025-08-25 07:10:00,1180,27,UgyCnC3TjJZuufETVPx4AaABAg.AMF9ZsWzp9iAMIPOHHCQ02,@akhilck1475,UCTwpYVnm56IMoWB8WSw88lQ,❤❤,ja,2025-08-26T17:25:57Z,2025-08-26 13:25:57,0,644821,22064,2253,"Tue, 16 Dec 2025 12:42:34 GMT"
LAM63Dj3XBQ,https://www.youtube.com/watch?v=LAM63Dj3XBQ,UgyCnC3TjJZuufETVPx4AaABAg,@soloCreationsFX,UC_jUSTk_a73Bbg1BPdLU_MQ,Who else For Sushin shyam 🙂,NA,2025-08-25T11:10:00Z,2025-08-25 07:10:00,1180,27,UgyCnC3TjJZuufETVPx4AaABAg.AMF9ZsWzp9iAMIX3aAWiEu,@dheerajramakrishnan4002,UCpXVr2PkGsm-CDEn1p5VHEw,​@srji489 And u people remake from us. We only know to eat paan and spit on road saaaar😅,en,2025-08-26T18:33:02Z,2025-08-26 14:33:02,0,644821,22064,2253,"Tue, 16 Dec 2025 12:42:34 GMT"
LAM63Dj3XBQ,https://www.youtube.com/watch?v=LAM63Dj3XBQ,UgyCnC3TjJZuufETVPx4AaABAg,@soloCreationsFX,UC_jUSTk_a73Bbg1BPdLU_MQ,Who else For Sushin shyam 🙂,NA,2025-08-25T11:10:00Z,2025-08-25 07:10:00,1180,27,UgyCnC3TjJZuufETVPx4AaABAg.AMF9ZsWzp9iAMJW64SJcZ-,@4541518,UC7_hpNVmT8pqid_Mp0G3A8A,"Indian movie industry is shit... be it any ""wood"". Hell even our porn industry is better than your country's shit.",en,2025-08-27T03:43:52Z,2025-08-26 23:43:52,0,644821,22064,2253,"Tue, 16 Dec 2025 12:42:34 GMT"
LAM63Dj3XBQ,https://www.youtube.com/watch?v=LAM63Dj3XBQ,UgyCnC3TjJZuufETVPx4AaABAg,@soloCreationsFX,UC_jUSTk_a73Bbg1BPdLU_MQ,Who else For Sushin shyam 🙂,NA,2025-08-25T11:10:00Z,2025-08-25 07:10:00,1180,27,UgyCnC3TjJZuufETVPx4AaABAg.AMF9ZsWzp9iAMJdEqYOezp,@statusmania7008,UCILCJ8MVXTKUhTzrEl4H0Ww,Let's report,en,2025-08-27T04:54:58Z,2025-08-27 00:54:58,0,644821,22064,2253,"Tue, 16 Dec 2025 12:42:34 GMT"
LAM63Dj3XBQ,https://www.youtube.com/watch?v=LAM63Dj3XBQ,UgyCnC3TjJZuufETVPx4AaABAg,@soloCreationsFX,UC_jUSTk_a73Bbg1BPdLU_MQ,Who else For Sushin shyam 🙂,NA,2025-08-25T11:10:00Z,2025-08-25 07:10:00,1180,27,UgyCnC3TjJZuufETVPx4AaABAg.AMF9ZsWzp9iAMN0ixW1q6C,@Billy-bc8pk,UCnP_Tk3goTnojkvgiURSqlg,Who????,NA,2025-08-28T12:26:39Z,2025-08-28 08:26:39,0,644821,22064,2253,"Tue, 16 Dec 2025 12:42:34 GMT"
LAM63Dj3XBQ,https://www.youtube.com/watch?v=LAM63Dj3XBQ,UgyCnC3TjJZuufETVPx4AaABAg,@soloCreationsFX,UC_jUSTk_a73Bbg1BPdLU_MQ,Who else For Sushin shyam 🙂,NA,2025-08-25T11:10:00Z,2025-08-25 07:10:00,1180,27,UgyCnC3TjJZuufETVPx4AaABAg.AMF9ZsWzp9iAMPmpSjnPA6,@silverscreame,UCgFAPCEARp7nceNc_sU4vrA,"@srji489if a story is inspired form hollywood, mallus always gives credit to it in the movie titles. Thats not something i have seen any other industry do.",en,2025-08-29T14:14:12Z,2025-08-29 10:14:12,0,644821,22064,2253,"Tue, 16 Dec 2025 12:42:34 GMT"
LAM63Dj3XBQ,https://www.youtube.com/watch?v=LAM63Dj3XBQ,UgyCnC3TjJZuufETVPx4AaABAg,@soloCreationsFX,UC_jUSTk_a73Bbg1BPdLU_MQ,Who else For Sushin shyam 🙂,NA,2025-08-25T11:10:00Z,2025-08-25 07:10:00,1180,27,UgyCnC3TjJZuufETVPx4AaABAg.AMF9ZsWzp9iAMPupUI9qK8,@srji489,UCbQucwYtCfktM8AnQwho3bA,​@silverscreamename one time that has happened.😂,en,2025-08-29T15:24:06Z,2025-08-29 11:24:06,0,644821,22064,2253,"Tue, 16 Dec 2025 12:42:34 GMT"
LAM63Dj3XBQ,https://www.youtube.com/watch?v=LAM63Dj3XBQ,UgyCnC3TjJZuufETVPx4AaABAg,@soloCreationsFX,UC_jUSTk_a73Bbg1BPdLU_MQ,Who else For Sushin shyam 🙂,NA,2025-08-25T11:10:00Z,2025-08-25 07:10:00,1180,27,UgyCnC3TjJZuufETVPx4AaABAg.AMF9ZsWzp9iAMPvQrNcRl3,@silverscreame,UCgFAPCEARp7nceNc_sU4vrA,@srji489 Bheeshma Parvam.,NA,2025-08-29T15:29:21Z,2025-08-29 11:29:21,0,644821,22064,2253,"Tue, 16 Dec 2025 12:42:34 GMT"
LAM63Dj3XBQ,https://www.youtube.com/watch?v=LAM63Dj3XBQ,UgyCnC3TjJZuufETVPx4AaABAg,@soloCreationsFX,UC_jUSTk_a73Bbg1BPdLU_MQ,Who else For Sushin shyam 🙂,NA,2025-08-25T11:10:00Z,2025-08-25 07:10:00,1180,27,UgyCnC3TjJZuufETVPx4AaABAg.AMF9ZsWzp9iAMQ1P64GQXR,@statusmania7008,UCILCJ8MVXTKUhTzrEl4H0Ww,​@Billy-bc8pkGoggle it.,NA,2025-08-29T16:30:16Z,2025-08-29 12:30:16,0,644821,22064,2253,"Tue, 16 Dec 2025 12:42:34 GMT"
LAM63Dj3XBQ,https://www.youtube.com/watch?v=LAM63Dj3XBQ,UgyCnC3TjJZuufETVPx4AaABAg,@soloCreationsFX,UC_jUSTk_a73Bbg1BPdLU_MQ,Who else For Sushin shyam 🙂,NA,2025-08-25T11:10:00Z,2025-08-25 07:10:00,1180,27,UgyCnC3TjJZuufETVPx4AaABAg.AMF9ZsWzp9iAMTqNNxw2FI,@na_notavailable,UCs3cE4QvPz128oxXczou3KA,​@kunjata002seriously watch 😂😂 priyadarsan movies,lt,2025-08-31T04:02:08Z,2025-08-31 00:02:08,0,644821,22064,2253,"Tue, 16 Dec 2025 12:42:34 GMT"
