video_id,video_title,channel_id,channel_title,video_published_at,view_count,video_like_count,video_comment_count,comment_id,comment_parent_id,comment_author_display,comment_author_channel_id,comment_text,comment_lang,comment_published_utc,comment_published_local,comment_like_count,comment_reply_count
wWziW_vQ_L4,Long Story Short | Official Trailer | Netflix,UCWOA1ZGywLbqmigxE4Qlvuw,Netflix,2025-07-31T14:00:00Z,364471,11786,696,UgyOK3AXTnccidU8Czp4AaABAg,NA,@seraphiim.ang3l,UCu10kxbCrZXRaQ_5ITcK5dw,It's so hard for me to watch this without picturing Ben Feldman as Jonah since his voice is so distinct and I've wached Superstore a billion times already,en,2025-12-14T10:59:00Z,2025-12-14 05:59:00,0,0
wWziW_vQ_L4,Long Story Short | Official Trailer | Netflix,UCWOA1ZGywLbqmigxE4Qlvuw,Netflix,2025-07-31T14:00:00Z,364471,11786,696,UgyxuSKNK9e2YxR8NQ94AaABAg,NA,@seraphiim.ang3l,UCu10kxbCrZXRaQ_5ITcK5dw,Bojack Horseman and Superstore mentioned? Both are my favourite shows in the existence of the universe,en,2025-12-14T10:56:33Z,2025-12-14 05:56:33,0,0
wWziW_vQ_L4,Long Story Short | Official Trailer | Netflix,UCWOA1ZGywLbqmigxE4Qlvuw,Netflix,2025-07-31T14:00:00Z,364471,11786,696,Ugx_B7hJtlH-WKa-mw54AaABAg,NA,@dreamaboutsuzie,UCCmxUswpI1VKHwcBL779zfA,Literally the best netflix series 2025,lb,2025-12-13T04:55:55Z,2025-12-12 23:55:55,0,0
wWziW_vQ_L4,Long Story Short | Official Trailer | Netflix,UCWOA1ZGywLbqmigxE4Qlvuw,Netflix,2025-07-31T14:00:00Z,364471,11786,696,Ugw-YbGmfDDucqXUXVN4AaABAg,NA,@OliverShearer-001X3,UCZ_IUJOtRtwqPek0uM_nKVg,I just finally got round to watching Bojack last year after waiting four ages because I have this thing where I can watch something until it's finished usually and then obviously with all the hype around Bojack which is well deserved but it just put me off watching it for awhile and I finally finished that and that was great and then this came out and I've just finished watching this obviously significantly shorter right now but I really hope they make more it's fantastic you're very moving I love the art style as well it kind of reminds me of like Daria but softer if that makes sense good colour palette I enjoyed the whole thing thoroughly,en,2025-12-03T10:37:08Z,2025-12-03 05:37:08,0,0
wWziW_vQ_L4,Long Story Short | Official Trailer | Netflix,UCWOA1ZGywLbqmigxE4Qlvuw,Netflix,2025-07-31T14:00:00Z,364471,11786,696,Ugy1LAtsq1Oh7-RKwN14AaABAg,NA,@djmoogle,UCfkzKLO9LU9D77QNNE6QbYQ,this show changed my life. strongly recommend,en,2025-11-18T14:20:41Z,2025-11-18 09:20:41,0,0
wWziW_vQ_L4,Long Story Short | Official Trailer | Netflix,UCWOA1ZGywLbqmigxE4Qlvuw,Netflix,2025-07-31T14:00:00Z,364471,11786,696,UgxHK-PSuj5gjCPrCbd4AaABAg,NA,@wak773,UCqS4KcBRUDX5HpNCEdmus8w,why has this barely gotten any attention?,en,2025-11-17T03:57:02Z,2025-11-16 22:57:02,0,0
wWziW_vQ_L4,Long Story Short | Official Trailer | Netflix,UCWOA1ZGywLbqmigxE4Qlvuw,Netflix,2025-07-31T14:00:00Z,364471,11786,696,UgwyB7J5v79CcabniO54AaABAg,NA,@Fitzpatrick5380,UCQQh07tAXAktMxseN30Y6vA,"I love this Satire. It's less absurd than ""F is for Family"" and it sounds more like the last seasons of BoJack when the show was funny, comtemplative and gloomy. I love the combo. I'm close to the end, but I don't want to spoil it in one sitting.",en,2025-11-11T04:43:00Z,2025-11-10 23:43:00,0,1
wWziW_vQ_L4,Long Story Short | Official Trailer | Netflix,UCWOA1ZGywLbqmigxE4Qlvuw,Netflix,2025-07-31T14:00:00Z,364471,11786,696,UgyEKTYJbp5576i79Hd4AaABAg,NA,@whitemonsterenergy,UC-2QSWLffCQl21vCFzKCjEQ,“From the creator of Bojack Horseman” Yeah pack it up,en,2025-10-30T11:45:14Z,2025-10-30 07:45:14,0,0
wWziW_vQ_L4,Long Story Short | Official Trailer | Netflix,UCWOA1ZGywLbqmigxE4Qlvuw,Netflix,2025-07-31T14:00:00Z,364471,11786,696,UgyDPCZz4OIRFRLyAUp4AaABAg,NA,@Caxtelo,UCz0s_n4OtgpC7ASIrJspRYA,This show is awesome,en,2025-10-30T01:19:06Z,2025-10-29 21:19:06,0,0
wWziW_vQ_L4,Long Story Short | Official Trailer | Netflix,UCWOA1ZGywLbqmigxE4Qlvuw,Netflix,2025-07-31T14:00:00Z,364471,11786,696,UgwSUKulbzejJgjfiCR4AaABAg,NA,@efraingonzalez7352,UC5Xb-N8Hcs9xiDG5lE4lMxQ,Sony pictures animation series long story short!!,en,2025-10-24T22:34:46Z,2025-10-24 18:34:46,1,0
wWziW_vQ_L4,Long Story Short | Official Trailer | Netflix,UCWOA1ZGywLbqmigxE4Qlvuw,Netflix,2025-07-31T14:00:00Z,364471,11786,696,UgxWkBfQPFF8DDQxZX54AaABAg,NA,@turquoisesnowflake4613,UCHBVn1u8xjyyab3dkCGPUWQ,Just from the song I can tell this is going to fundamentally change my relationship with my mental health and family,en,2025-10-13T02:13:29Z,2025-10-12 22:13:29,1,0
wWziW_vQ_L4,Long Story Short | Official Trailer | Netflix,UCWOA1ZGywLbqmigxE4Qlvuw,Netflix,2025-07-31T14:00:00Z,364471,11786,696,Ugw40j-YHYJ0Vxv13Dt4AaABAg,NA,@lenawagenfuehr53,UC3CN0gMvh7HJVYUgfUf3vRw,Lisa Edelstein sounds like Susie Essman,NA,2025-09-29T05:52:43Z,2025-09-29 01:52:43,0,0
wWziW_vQ_L4,Long Story Short | Official Trailer | Netflix,UCWOA1ZGywLbqmigxE4Qlvuw,Netflix,2025-07-31T14:00:00Z,364471,11786,696,Ugw6GjAXlhM0gHy9Wkp4AaABAg,NA,@natinah3177,UCZc0GGW4jsSHaEIwtg55Lug,Amazing show!! Can't wait for season 2!!!😊,en,2025-09-28T06:30:56Z,2025-09-28 02:30:56,0,3
wWziW_vQ_L4,Long Story Short | Official Trailer | Netflix,UCWOA1ZGywLbqmigxE4Qlvuw,Netflix,2025-07-31T14:00:00Z,364471,11786,696,UgxRvP2i6zvfiLfuya94AaABAg,NA,@CourtneyNielsen,UC57_mpM9CBlagCG2QVCTvsQ,Bean mouth,gd,2025-09-22T12:32:46Z,2025-09-22 08:32:46,0,0
wWziW_vQ_L4,Long Story Short | Official Trailer | Netflix,UCWOA1ZGywLbqmigxE4Qlvuw,Netflix,2025-07-31T14:00:00Z,364471,11786,696,Ugxcft1xcwXAa8nzB9p4AaABAg,NA,@LuccianoFelipe,UCwbJE7almQ4U75g7rA92BEA,"ingles, muy mal netflix de mierda.",NA,2025-09-19T13:22:44Z,2025-09-19 09:22:44,0,0
wWziW_vQ_L4,Long Story Short | Official Trailer | Netflix,UCWOA1ZGywLbqmigxE4Qlvuw,Netflix,2025-07-31T14:00:00Z,364471,11786,696,Ugz6qTI_7cYaXCU0vbN4AaABAg,NA,@IntrovertDominic,UCoC4_Ifml9sq8fMefPwRAbQ,What is the name of the song in the trailer,en,2025-09-16T16:38:47Z,2025-09-16 12:38:47,0,0
wWziW_vQ_L4,Long Story Short | Official Trailer | Netflix,UCWOA1ZGywLbqmigxE4Qlvuw,Netflix,2025-07-31T14:00:00Z,364471,11786,696,UgzPUjPSXgmlgaCiWLR4AaABAg,NA,@sjcobra84,UC6xfumu2-QmtTS7ajbh1elA,God this looks depressing. Such is life.😒,en,2025-09-16T02:39:33Z,2025-09-15 22:39:33,0,1
wWziW_vQ_L4,Long Story Short | Official Trailer | Netflix,UCWOA1ZGywLbqmigxE4Qlvuw,Netflix,2025-07-31T14:00:00Z,364471,11786,696,UgzWwxwuMpw67ZOWBnV4AaABAg,NA,@patrickspeers4689,UC_teVlGYt73sT-Bc-7sSDMg,"So i watched two episodes with my partner and....I owe him an emotional apology for him, flying over to Canada and basically being Jen. Simon i am so sorry my family is that chaotic but, you don't notice if they are your family",en,2025-09-14T23:07:56Z,2025-09-14 19:07:56,1,0
wWziW_vQ_L4,Long Story Short | Official Trailer | Netflix,UCWOA1ZGywLbqmigxE4Qlvuw,Netflix,2025-07-31T14:00:00Z,364471,11786,696,Ugz_fvywytVbU_AYPth4AaABAg,NA,@SnowdropMoth,UCxyaM6cAyD8yBphVs_UZ4Sg,"The first season is soooo good! I don't have netflix and watched the entire season in one go with a friend, we both cried in episode four. I consider getting Netflix because I wanna watch it again! Big recommandation !",en,2025-09-12T16:54:35Z,2025-09-12 12:54:35,1,0
wWziW_vQ_L4,Long Story Short | Official Trailer | Netflix,UCWOA1ZGywLbqmigxE4Qlvuw,Netflix,2025-07-31T14:00:00Z,364471,11786,696,Ugyi11aGQLaQ8BRWMnF4AaABAg,NA,@michaelNXT1,UCJkjKQTNN8h8vn4TXwyUhWA,What’s the name of the song in the background?,en,2025-09-12T10:53:10Z,2025-09-12 06:53:10,0,0
wWziW_vQ_L4,Long Story Short | Official Trailer | Netflix,UCWOA1ZGywLbqmigxE4Qlvuw,Netflix,2025-07-31T14:00:00Z,364471,11786,696,UgzvZTqlly0AkBfMHnt4AaABAg,NA,@mrinaltalukdar1825,UC_kWkMb6xR3LCVbfc-hfXVw,From the makers of Bojack horseman is enough to make me binge this in one night,en,2025-09-11T13:38:32Z,2025-09-11 09:38:32,2,0
wWziW_vQ_L4,Long Story Short | Official Trailer | Netflix,UCWOA1ZGywLbqmigxE4Qlvuw,Netflix,2025-07-31T14:00:00Z,364471,11786,696,UgzGY-RO8lFfk8-UbY94AaABAg,NA,@ItzMarcusTheAnimeBoy,UCrLzyOXW-TahsxkkYY3meww,The guy looks cute in the toddler seat,en,2025-09-11T01:41:49Z,2025-09-10 21:41:49,0,0
wWziW_vQ_L4,Long Story Short | Official Trailer | Netflix,UCWOA1ZGywLbqmigxE4Qlvuw,Netflix,2025-07-31T14:00:00Z,364471,11786,696,UgxKdpJLnnsm6DNcgyd4AaABAg,NA,@Slime_Finder,UC1-ZKjoLT3z2ya1NkMD1Ccg,BRING MSA TO NETFLIX,NA,2025-09-06T14:13:47Z,2025-09-06 10:13:47,0,0
wWziW_vQ_L4,Long Story Short | Official Trailer | Netflix,UCWOA1ZGywLbqmigxE4Qlvuw,Netflix,2025-07-31T14:00:00Z,364471,11786,696,Ugzo78jFcsO4if1hbZd4AaABAg,NA,@cme2158,UCLrqy7hdAe5k6QZXUfyZguA,This is really entertaining..👏🏻👏🏻👏🏻👏🏻,en,2025-09-05T22:35:39Z,2025-09-05 18:35:39,0,0
wWziW_vQ_L4,Long Story Short | Official Trailer | Netflix,UCWOA1ZGywLbqmigxE4Qlvuw,Netflix,2025-07-31T14:00:00Z,364471,11786,696,UgwSq-bVbxCBYUEzWWF4AaABAg,NA,@datboirb,UC9VKwsvAZN6NwsLGPGX3Wyg,It’s like grown up Doug and pepperann,NA,2025-09-05T14:16:22Z,2025-09-05 10:16:22,0,0
wWziW_vQ_L4,Long Story Short | Official Trailer | Netflix,UCWOA1ZGywLbqmigxE4Qlvuw,Netflix,2025-07-31T14:00:00Z,364471,11786,696,UgwTbuiHQ8RU2D4VNoF4AaABAg,NA,@seamarie3111,UC-qZPwsjG81jpxNbfs8G94g,"Wow, this was SO good! I only ever watched like a few episodes of BoJack, so I came into this fresh. I loved every episode, and was sad when I reached the tenth episode. My favorite set of lines is in episode 0:03 5 when Avi and Yoshi are talking about genetics, using condiments as examples, and Yoshi asks why he's the creamer, Avi retorts that he knows why. You need to watch the show to understand the joke, but OMG that made me giggle. I don't think there was a single character I disliked... other than perhaps the uncle and Yoshi's childhood best friend, who reminded me far too much of my own brother's childhood best friend.
Also, what's with the show creator and making dudes born in 1991 just kind of a little off the wall, even if in different ways? BoJack brought us Todd, who can never be outdone, but then Long Story Short brought us Yoshi, who's definitely a character. I can't decide which of the three siblings was my favorite, honestly.",en,2025-09-04T16:17:07Z,2025-09-04 12:17:07,1,1
wWziW_vQ_L4,Long Story Short | Official Trailer | Netflix,UCWOA1ZGywLbqmigxE4Qlvuw,Netflix,2025-07-31T14:00:00Z,364471,11786,696,Ugy8tOsOqt1PB0rvz1R4AaABAg,NA,@santiagoflores-od7wi,UClwNaTVC3-34YDLMK9LvyPQ,I thank the Crab for letting me know of this one.,en,2025-09-04T03:18:47Z,2025-09-03 23:18:47,1,0
wWziW_vQ_L4,Long Story Short | Official Trailer | Netflix,UCWOA1ZGywLbqmigxE4Qlvuw,Netflix,2025-07-31T14:00:00Z,364471,11786,696,Ugx0zZ3DK9d75Woq7uZ4AaABAg,NA,@Aleakwe,UC-wCILjbGGFHKALLx69zukw,💜,ja,2025-09-03T19:10:54Z,2025-09-03 15:10:54,0,0
wWziW_vQ_L4,Long Story Short | Official Trailer | Netflix,UCWOA1ZGywLbqmigxE4Qlvuw,Netflix,2025-07-31T14:00:00Z,364471,11786,696,Ugx138IQqDRiRL2930l4AaABAg,NA,@jubalcalif9100,UCH0MCdrHx-CBfPForI29YFw,Cool that it's set in the San Francisco area !,en,2025-09-03T16:14:18Z,2025-09-03 12:14:18,0,0
wWziW_vQ_L4,Long Story Short | Official Trailer | Netflix,UCWOA1ZGywLbqmigxE4Qlvuw,Netflix,2025-07-31T14:00:00Z,364471,11786,696,Ugzf8ft1ph1y90fwU3t4AaABAg,NA,@bigmixedhead,UCCKtFY6JMEkgsj5QnJNfXDg,"They didn't mention how much they enjoy killing babies. Despite constantly hiding their own ""genocide"" and pain in the details. It was clear from the author's dismissal of this massive genocide as ""that issue.""",en,2025-09-03T14:52:11Z,2025-09-03 10:52:11,3,0
wWziW_vQ_L4,Long Story Short | Official Trailer | Netflix,UCWOA1ZGywLbqmigxE4Qlvuw,Netflix,2025-07-31T14:00:00Z,364471,11786,696,UgxyZqpvrvNscuylr8l4AaABAg,NA,@madcat789,UC4fXNOJq_0nQa09_LTN5a7w,How am I tired of a show I have not even watched yet.,en,2025-09-03T13:40:57Z,2025-09-03 09:40:57,0,9
wWziW_vQ_L4,Long Story Short | Official Trailer | Netflix,UCWOA1ZGywLbqmigxE4Qlvuw,Netflix,2025-07-31T14:00:00Z,364471,11786,696,Ugxnau0lzXJW-jKH3vd4AaABAg,NA,@OddlyFamiliarStranger,UCFMjBaJquVWfxd1-dfgMSDA,"This show legit exceeded my expectations 
Oh and off topic, I like Jenn so much 😭 I was so sad when her and avi got divorced.",en,2025-09-02T19:36:52Z,2025-09-02 15:36:52,1,1
wWziW_vQ_L4,Long Story Short | Official Trailer | Netflix,UCWOA1ZGywLbqmigxE4Qlvuw,Netflix,2025-07-31T14:00:00Z,364471,11786,696,UgyaIfBqKyq-0lbRF1R4AaABAg,NA,@wotdahail,UC2FXem2ci2Lfbd12zANOIlw,What’s the name of the song used in this trailer??? Can’t find it anywhere.,en,2025-09-01T23:15:05Z,2025-09-01 19:15:05,1,3
wWziW_vQ_L4,Long Story Short | Official Trailer | Netflix,UCWOA1ZGywLbqmigxE4Qlvuw,Netflix,2025-07-31T14:00:00Z,364471,11786,696,UgwN89BHzfJaVShSBYp4AaABAg,NA,@SimpleToons206,UC_KODVx9EwUAYqlrGJvcEgg,"this is going to be absolutely heart wrenching, I can't wait",en,2025-09-01T17:41:28Z,2025-09-01 13:41:28,1,0
wWziW_vQ_L4,Long Story Short | Official Trailer | Netflix,UCWOA1ZGywLbqmigxE4Qlvuw,Netflix,2025-07-31T14:00:00Z,364471,11786,696,UgyLb68VuqAORShr2J94AaABAg,NA,@ulekulek5724,UCMKrgXn7fcUFg7H5b8EY6wg,I watched it and it is peak,en,2025-09-01T15:30:28Z,2025-09-01 11:30:28,2,0
wWziW_vQ_L4,Long Story Short | Official Trailer | Netflix,UCWOA1ZGywLbqmigxE4Qlvuw,Netflix,2025-07-31T14:00:00Z,364471,11786,696,UgxI9YzHW5JlMp6oC7l4AaABAg,NA,@superhetoric,UCbdvXvJ45rAcnuqJ8FBSbqQ,hideous,fr,2025-08-31T00:55:05Z,2025-08-30 20:55:05,0,0
wWziW_vQ_L4,Long Story Short | Official Trailer | Netflix,UCWOA1ZGywLbqmigxE4Qlvuw,Netflix,2025-07-31T14:00:00Z,364471,11786,696,UgzG-ven7ImhO2iprkB4AaABAg,NA,@commenteroftruth9790,UCh1h19iHQhUTHjZrfc1OV7Q,good show. grows on you like a wart until you don't realize you're already at the end of season 1. excited for more.,en,2025-08-30T10:59:19Z,2025-08-30 06:59:19,3,0
wWziW_vQ_L4,Long Story Short | Official Trailer | Netflix,UCWOA1ZGywLbqmigxE4Qlvuw,Netflix,2025-07-31T14:00:00Z,364471,11786,696,Ugx33vfBr65IiHkOwc54AaABAg,NA,@Magikalic,UC3G5hOHcNM2wMh-aQ52TWLw,"Amazing show, it really encapsulated the messiness of an imperfect but loving family. Also, I like the art style. I think it's cute.",en,2025-08-30T10:56:31Z,2025-08-30 06:56:31,1,0
wWziW_vQ_L4,Long Story Short | Official Trailer | Netflix,UCWOA1ZGywLbqmigxE4Qlvuw,Netflix,2025-07-31T14:00:00Z,364471,11786,696,UgzUW0n4LjMVBrZjnNN4AaABAg,NA,@KenikoB,UCAYuuu0n5YKiUjApbXy_x9w,Such a great show!!,en,2025-08-30T10:10:46Z,2025-08-30 06:10:46,0,0
wWziW_vQ_L4,Long Story Short | Official Trailer | Netflix,UCWOA1ZGywLbqmigxE4Qlvuw,Netflix,2025-07-31T14:00:00Z,364471,11786,696,UgxEDs4hCtne8WGMeGd4AaABAg,NA,@monmoreno89,UCb-_ikk-mMP-zo46-cFmFSg,I love this type of animation and raw content. Keep it up!,en,2025-08-30T06:16:59Z,2025-08-30 02:16:59,1,0
wWziW_vQ_L4,Long Story Short | Official Trailer | Netflix,UCWOA1ZGywLbqmigxE4Qlvuw,Netflix,2025-07-31T14:00:00Z,364471,11786,696,Ugy2L862z4U8G7fs3xp4AaABAg,NA,@mickmenn2,UCrEc8TZM9R16Mog52200-IA,"Raphael and Co do not disappoint, like ever",en,2025-08-29T19:28:09Z,2025-08-29 15:28:09,0,0
wWziW_vQ_L4,Long Story Short | Official Trailer | Netflix,UCWOA1ZGywLbqmigxE4Qlvuw,Netflix,2025-07-31T14:00:00Z,364471,11786,696,UgyJ5d2ekoE58-D24JJ4AaABAg,NA,@kafayı7k,UCk6EwHf-9SyJfnDpBFA_xaA,"Beğendim, güzeldi",tr,2025-08-29T19:24:26Z,2025-08-29 15:24:26,0,0
wWziW_vQ_L4,Long Story Short | Official Trailer | Netflix,UCWOA1ZGywLbqmigxE4Qlvuw,Netflix,2025-07-31T14:00:00Z,364471,11786,696,UgyzSdH8Q47U3kivH_x4AaABAg,NA,@locojuliomora426,UCe3qPhH-zEoYrJV2aOZHPzQ,"Gumball: Oh Hi Kendra, How Was Work?😉

Kendra: Pretty Good, But I Quit My Job.😒

Gumball: You Can't Quit Your Job, YOU'RE FIRED!😠

0:37 Kendra: (Screams In Anger)",en,2025-08-29T18:36:55Z,2025-08-29 14:36:55,1,0
wWziW_vQ_L4,Long Story Short | Official Trailer | Netflix,UCWOA1ZGywLbqmigxE4Qlvuw,Netflix,2025-07-31T14:00:00Z,364471,11786,696,UgyaXiFThPU4Y_bYWWJ4AaABAg,NA,@parulthapar222,UCu3E_wKc0EeT9K0Q5UaJ8_Q,"Loved it. 
It’s not typical Netflix cringe content like stupid rom-coms movies and shows that are insufferable but have a big star cast.. I loved it cuz it was grounded, new way of presenting and a very innovative way to narrate stories. I loved it that i didn’t have to see a 100seasons of a show just to relate to the cast. Just simple stories ❤❤",en,2025-08-29T13:57:15Z,2025-08-29 09:57:15,0,0
wWziW_vQ_L4,Long Story Short | Official Trailer | Netflix,UCWOA1ZGywLbqmigxE4Qlvuw,Netflix,2025-07-31T14:00:00Z,364471,11786,696,Ugz6xAUGC2AaWL7jEcp4AaABAg,NA,@ur_pretty_lil_girly,UCYQAoGKsPap_BZXzdra-Jpg,This show definitely made me feel a lot of different emotions and I just really loved this show,en,2025-08-28T23:05:37Z,2025-08-28 19:05:37,2,0
wWziW_vQ_L4,Long Story Short | Official Trailer | Netflix,UCWOA1ZGywLbqmigxE4Qlvuw,Netflix,2025-07-31T14:00:00Z,364471,11786,696,UgwWDGk2WxiBMKETdiN4AaABAg,NA,@bohen2126,UCZQ4jCRtGtRI5lh6SC86zlg,It's good guys go watch it,NA,2025-08-28T21:20:35Z,2025-08-28 17:20:35,0,0
wWziW_vQ_L4,Long Story Short | Official Trailer | Netflix,UCWOA1ZGywLbqmigxE4Qlvuw,Netflix,2025-07-31T14:00:00Z,364471,11786,696,UgyXtSVeH9N0YP6pjbp4AaABAg,NA,@simadellolio2615,UCwcZdg9y597aq9oYqqiF-VA,"Just finished watching this and I can't stop crying!!
Be ready ! ❤😭",en,2025-08-28T20:05:17Z,2025-08-28 16:05:17,0,0
wWziW_vQ_L4,Long Story Short | Official Trailer | Netflix,UCWOA1ZGywLbqmigxE4Qlvuw,Netflix,2025-07-31T14:00:00Z,364471,11786,696,UgzR3mhXmWb_cEiLlx14AaABAg,NA,@JohnnyDepp-h7n,UCVAfOIXFI0mTK2G0QWW1TeQ,So the animation is pretty bad and not just for this cartoon but for a lot of cartoons that come out these days.,en,2025-08-28T00:41:35Z,2025-08-27 20:41:35,0,2
wWziW_vQ_L4,Long Story Short | Official Trailer | Netflix,UCWOA1ZGywLbqmigxE4Qlvuw,Netflix,2025-07-31T14:00:00Z,364471,11786,696,UgxRl5lfISd4Uy2J0E54AaABAg,NA,@kdollaz98,UCTDMbdzl8hQrnd6i_imQp_w,Art style of this show reminds me a lot of Mission Hill. Loved that show and still watch it on YouTube,en,2025-08-27T23:56:08Z,2025-08-27 19:56:08,0,0
wWziW_vQ_L4,Long Story Short | Official Trailer | Netflix,UCWOA1ZGywLbqmigxE4Qlvuw,Netflix,2025-07-31T14:00:00Z,364471,11786,696,Ugz-FXJK6PIdm8ssfi54AaABAg,NA,@sidsthesid,UChQI4LKkXiCuZVwX0JBBLWw,MORE ANIMATED SHOWS PLEASE,en,2025-08-27T13:04:07Z,2025-08-27 09:04:07,1,0
wWziW_vQ_L4,Long Story Short | Official Trailer | Netflix,UCWOA1ZGywLbqmigxE4Qlvuw,Netflix,2025-07-31T14:00:00Z,364471,11786,696,Ugya4eAzPQVuW_50F0F4AaABAg,NA,@evanschwarz2293,UC1A4bVVnViK32WO7fCNYiRw,Loved Bojack. I couldn't get through 10 minutes of this,en,2025-08-27T04:48:42Z,2025-08-27 00:48:42,0,3
wWziW_vQ_L4,Long Story Short | Official Trailer | Netflix,UCWOA1ZGywLbqmigxE4Qlvuw,Netflix,2025-07-31T14:00:00Z,364471,11786,696,UgySMtX8m4rzJ0jCUoF4AaABAg,NA,@TheLynettebacote,UCch8RaFUDekmAazlQ1nps0Q,I really hopes this gets more than one season,NA,2025-08-26T15:57:19Z,2025-08-26 11:57:19,2,0
wWziW_vQ_L4,Long Story Short | Official Trailer | Netflix,UCWOA1ZGywLbqmigxE4Qlvuw,Netflix,2025-07-31T14:00:00Z,364471,11786,696,UgyJrW5fJ_LUb3kG98t4AaABAg,NA,@TheLynettebacote,UCch8RaFUDekmAazlQ1nps0Q,I enjoyed this show and love the intro ❤😊,en,2025-08-26T15:56:19Z,2025-08-26 11:56:19,0,0
wWziW_vQ_L4,Long Story Short | Official Trailer | Netflix,UCWOA1ZGywLbqmigxE4Qlvuw,Netflix,2025-07-31T14:00:00Z,364471,11786,696,Ugw-1hgf_HHUKHHiR3N4AaABAg,NA,@HeIsTheBluesCat,UCCqP0LmfAV29D01bQKSa30w,"Are we gonna ignore the fact the kid in the green at the beginning is named Yoshi?
That got a giggle out of me!",en,2025-08-26T03:20:13Z,2025-08-25 23:20:13,1,0
wWziW_vQ_L4,Long Story Short | Official Trailer | Netflix,UCWOA1ZGywLbqmigxE4Qlvuw,Netflix,2025-07-31T14:00:00Z,364471,11786,696,UgwmUu2cTverykoCau54AaABAg,NA,@bigsybel9105,UCDNxrWPe1O9tmylO1CJZ2XQ,oh this is gonna rip me into a thousand pieces and it's not gonna put me back together,en,2025-08-25T17:01:49Z,2025-08-25 13:01:49,0,0
wWziW_vQ_L4,Long Story Short | Official Trailer | Netflix,UCWOA1ZGywLbqmigxE4Qlvuw,Netflix,2025-07-31T14:00:00Z,364471,11786,696,UgzYkdRSBtiqPzrrhNZ4AaABAg,NA,@Blisterypoet,UCiiZCYyiiH2HkmZvGVzy4RQ,I couldn’t bear to watch 10 minutes 😵‍💫of this who thought that making a show about a Jewish family was a Good idea people hate them enough already and this is not helping it would be better if they were Italian,en,2025-08-25T08:55:30Z,2025-08-25 04:55:30,1,2
wWziW_vQ_L4,Long Story Short | Official Trailer | Netflix,UCWOA1ZGywLbqmigxE4Qlvuw,Netflix,2025-07-31T14:00:00Z,364471,11786,696,UgxkKjQiHFRXehlkU8l4AaABAg,NA,@jo_nm9484,UCuFN0o6l9Tj2NzaLOpu0xyA,"I hope people dont go in expecting another bojack, but something different and new, and still impactful",en,2025-08-25T06:06:19Z,2025-08-25 02:06:19,4,0
wWziW_vQ_L4,Long Story Short | Official Trailer | Netflix,UCWOA1ZGywLbqmigxE4Qlvuw,Netflix,2025-07-31T14:00:00Z,364471,11786,696,UgyoH_JQ-7Uv7fj66kt4AaABAg,NA,@Sailower,UC1xj2sJwgKvrg2KPRSeMVRg,I LOVE IT,mt,2025-08-25T01:25:56Z,2025-08-24 21:25:56,0,0
wWziW_vQ_L4,Long Story Short | Official Trailer | Netflix,UCWOA1ZGywLbqmigxE4Qlvuw,Netflix,2025-07-31T14:00:00Z,364471,11786,696,UgyLE721RYKFNqR0cMV4AaABAg,NA,@DANIELLAB1LL3SV3RS10N,UCe9sDh6epwL-RyblN6gggAQ,I LOVE IT AFTER EP 1,en,2025-08-25T00:30:07Z,2025-08-24 20:30:07,1,0
wWziW_vQ_L4,Long Story Short | Official Trailer | Netflix,UCWOA1ZGywLbqmigxE4Qlvuw,Netflix,2025-07-31T14:00:00Z,364471,11786,696,UgwuU0Ot3DVPX57zOF14AaABAg,NA,@MilliciousLady,UCtywtPG11JpF82QLvhbSDKA,"It got a S2 renewal! Yes netflix! Finally a win for once! Absolutely adore this show, Kendra is amazing and she needs another stand alone episode, I enjoyed seeing her dynamic with her dad and brother, would love to see how her mother was too.",en,2025-08-24T19:13:09Z,2025-08-24 15:13:09,22,0
wWziW_vQ_L4,Long Story Short | Official Trailer | Netflix,UCWOA1ZGywLbqmigxE4Qlvuw,Netflix,2025-07-31T14:00:00Z,364471,11786,696,Ugwwrh3MGjKNdo2dmx14AaABAg,NA,@betasector,UCZiSCF1U0zckuRYGSNLflHw,(((berg))),ms,2025-08-24T10:58:41Z,2025-08-24 06:58:41,0,0
wWziW_vQ_L4,Long Story Short | Official Trailer | Netflix,UCWOA1ZGywLbqmigxE4Qlvuw,Netflix,2025-07-31T14:00:00Z,364471,11786,696,UgzZAqhvW9ZuNndZUot4AaABAg,NA,@JaiBans,UC6dUq_b08pTX5BqGj6n5ttA,Was so good man holy shi,NA,2025-08-24T08:52:59Z,2025-08-24 04:52:59,0,0
wWziW_vQ_L4,Long Story Short | Official Trailer | Netflix,UCWOA1ZGywLbqmigxE4Qlvuw,Netflix,2025-07-31T14:00:00Z,364471,11786,696,UgxHXOXEj34ORAfaZMp4AaABAg,NA,@nadi6643,UCto2y29_qcZuzksmVoaf9Ag,I really liked that show,en,2025-08-24T01:33:06Z,2025-08-23 21:33:06,1,0
wWziW_vQ_L4,Long Story Short | Official Trailer | Netflix,UCWOA1ZGywLbqmigxE4Qlvuw,Netflix,2025-07-31T14:00:00Z,364471,11786,696,UgxAFLOv25i8icxnW5V4AaABAg,NA,@wack9923,UCMIVq3a3mQ7DhR4ueJWKdyg,It feels like a PBS animated show but for adults. Like Samurai Jack on CN to Adult Swim to mature with the audience.,en,2025-08-24T01:30:36Z,2025-08-23 21:30:36,0,0
wWziW_vQ_L4,Long Story Short | Official Trailer | Netflix,UCWOA1ZGywLbqmigxE4Qlvuw,Netflix,2025-07-31T14:00:00Z,364471,11786,696,UgyEsVht2JTnpyC4c9h4AaABAg,NA,@MojaKravica1985,UCx-dKjhaayIPMZEnf0-9amg,Blowjob Horsejack you did it again,ca,2025-08-24T00:23:15Z,2025-08-23 20:23:15,6,0
wWziW_vQ_L4,Long Story Short | Official Trailer | Netflix,UCWOA1ZGywLbqmigxE4Qlvuw,Netflix,2025-07-31T14:00:00Z,364471,11786,696,UgxGvItgs7cvdkFItGJ4AaABAg,NA,@farissoliman7282,UCTEDKJt4ZyRn75fa1Ex3n8g,Sadly it has the ugly rigging...,en,2025-08-23T22:38:11Z,2025-08-23 18:38:11,0,0
wWziW_vQ_L4,Long Story Short | Official Trailer | Netflix,UCWOA1ZGywLbqmigxE4Qlvuw,Netflix,2025-07-31T14:00:00Z,364471,11786,696,Ugz7e5f6VLVFguYB2MF4AaABAg,NA,@Aandi_pants,UCjg84jzcqitREhlK1K_AP6Q,"So I am a little more than halfway through the show, and as a fellow Bojack fan I wanna say for any other Horseman fans that haven’t seen this yet: it’s really good, but a little cozier and nostalgic. It has very real moments, but not near as big gut punches and introspections. It’s more just a real but much lighter and fun representation of a family. It indulges a lot more in light hearted family revelations and is very relatable. If someone is looking for 100 puns a minute alongside the most depressing and poignant emotional gut punches, this show may not scratch that itch fully. But it’s super sweet and relatable and still very funny with very real and grounded moments. Highly recommend.",en,2025-08-23T19:19:30Z,2025-08-23 15:19:30,8,0
wWziW_vQ_L4,Long Story Short | Official Trailer | Netflix,UCWOA1ZGywLbqmigxE4Qlvuw,Netflix,2025-07-31T14:00:00Z,364471,11786,696,UgzUAlnCdvLwXHP0_wR4AaABAg,NA,@lermankatisen7698,UCPQ_snnTsLc-UoWNO1-zWxQ,Bojack,hr,2025-08-23T16:18:20Z,2025-08-23 12:18:20,0,0
wWziW_vQ_L4,Long Story Short | Official Trailer | Netflix,UCWOA1ZGywLbqmigxE4Qlvuw,Netflix,2025-07-31T14:00:00Z,364471,11786,696,UgzQI055h786L4v9Bkp4AaABAg,NA,@pamsanchezoficial,UCtDOnVfQHPgVZTHjC-u2-0A,Esta cómica me hace recordar a las de tipo Dug,es,2025-08-23T16:00:37Z,2025-08-23 12:00:37,0,0
wWziW_vQ_L4,Long Story Short | Official Trailer | Netflix,UCWOA1ZGywLbqmigxE4Qlvuw,Netflix,2025-07-31T14:00:00Z,364471,11786,696,UgyTAayGykvbzcUPFZB4AaABAg,NA,@goodguy1604,UCvaDbWj-CCl-lgxzVlhmJ-w,We are witnessing history!,en,2025-08-23T08:26:21Z,2025-08-23 04:26:21,0,0
wWziW_vQ_L4,Long Story Short | Official Trailer | Netflix,UCWOA1ZGywLbqmigxE4Qlvuw,Netflix,2025-07-31T14:00:00Z,364471,11786,696,UgxyagvPH5-OGTSiVil4AaABAg,NA,@JennyBK55,UCjtZFkJ3jHizrYHaMUEsS1g,"Just saw the first 3 episodes, WHAT A DELIGHT. I hope they get at least 5 seasons!!!! 😂❤🎉",en,2025-08-23T03:49:18Z,2025-08-22 23:49:18,1,0
wWziW_vQ_L4,Long Story Short | Official Trailer | Netflix,UCWOA1ZGywLbqmigxE4Qlvuw,Netflix,2025-07-31T14:00:00Z,364471,11786,696,Ugz8KiwPBf3gc5HH1-R4AaABAg,NA,@ivanskywalker6,UCfXcP7xcH-Cs-oaWIcgM8Hg,looks super woke,NA,2025-08-23T01:38:12Z,2025-08-22 21:38:12,0,3
