video_id,video_title,channel_id,channel_title,video_published_at,view_count,video_like_count,video_comment_count,comment_id,comment_parent_id,comment_author_display,comment_author_channel_id,comment_text,comment_lang,comment_published_utc,comment_published_local,comment_like_count,comment_reply_count
wWziW_vQ_L4,Long Story Short | Official Trailer | Netflix,UCWOA1ZGywLbqmigxE4Qlvuw,Netflix,2025-07-31T14:00:00Z,364471,11786,696,UgxgXUaiV2r30MOcYEt4AaABAg,NA,@AngelloGomez-nh6cc,UC5njTlnjYATmiJMVOgnmYQQ,I don't expect this show to be on the same level of writing as BoJack Horseman but I still think it's gonna be pretty good,en,2025-07-31T18:26:38Z,2025-07-31 14:26:38,0,0
wWziW_vQ_L4,Long Story Short | Official Trailer | Netflix,UCWOA1ZGywLbqmigxE4Qlvuw,Netflix,2025-07-31T14:00:00Z,364471,11786,696,UgynrQuS3Uixald_Zxd4AaABAg,NA,@MaxEndersby,UC6lB-VDPabGY8i7q2JmytkA,I loved BoJack Horseman. So I’m very excited about this.,en,2025-07-31T18:22:04Z,2025-07-31 14:22:04,0,3
wWziW_vQ_L4,Long Story Short | Official Trailer | Netflix,UCWOA1ZGywLbqmigxE4Qlvuw,Netflix,2025-07-31T14:00:00Z,364471,11786,696,Ugz8YFwDD_dMdD9s3Zx4AaABAg,NA,@xoanwahn,UCqnqFKo5o99ChfJzodDNJsg,Looks genuinely good!!!,NA,2025-07-31T18:19:46Z,2025-07-31 14:19:46,0,0
wWziW_vQ_L4,Long Story Short | Official Trailer | Netflix,UCWOA1ZGywLbqmigxE4Qlvuw,Netflix,2025-07-31T14:00:00Z,364471,11786,696,Ugzx6QHrfg8Dz8ArNBl4AaABAg,NA,@VergilLunar,UCo1xG5Gu_guowHiPD8jMuIw,There's only ONE Bojack Horsman,en,2025-07-31T18:15:34Z,2025-07-31 14:15:34,0,0
wWziW_vQ_L4,Long Story Short | Official Trailer | Netflix,UCWOA1ZGywLbqmigxE4Qlvuw,Netflix,2025-07-31T14:00:00Z,364471,11786,696,Ugw4iSwV6SkkV6G8p6F4AaABAg,NA,@ultrainferno.,UC3-_22L71gFrYm8qnjO-Zew,Cal art animation is so boring,NA,2025-07-31T18:14:35Z,2025-07-31 14:14:35,1,1
wWziW_vQ_L4,Long Story Short | Official Trailer | Netflix,UCWOA1ZGywLbqmigxE4Qlvuw,Netflix,2025-07-31T14:00:00Z,364471,11786,696,Ugzl8jqXcnDBXjJaV594AaABAg,NA,@leekenneth-walsh3545,UC8-fd60kIw0bdhifi576UFw,"Bojack Horseman is my favorite show of all time! I can't wait to see RBW capture lightning in a bottle again, and I really hope the show is given the time it needs to come to a natural conclusion rather than being canceled prematurely",en,2025-07-31T18:12:43Z,2025-07-31 14:12:43,39,2
wWziW_vQ_L4,Long Story Short | Official Trailer | Netflix,UCWOA1ZGywLbqmigxE4Qlvuw,Netflix,2025-07-31T14:00:00Z,364471,11786,696,Ugzye1O2ZPgvWhuIJQF4AaABAg,NA,@nathanhargrove1397,UCcBVIA4yA_ykKPMcMerdwsw,Any CreepCast fans currently shuddering in the chat rn?,en,2025-07-31T18:09:56Z,2025-07-31 14:09:56,0,0
wWziW_vQ_L4,Long Story Short | Official Trailer | Netflix,UCWOA1ZGywLbqmigxE4Qlvuw,Netflix,2025-07-31T14:00:00Z,364471,11786,696,UgxhjQOilQ16ZPW4Ax54AaABAg,NA,@jettthewolf887,UCWvPa0R5Z3Ao-ZdJ5veZMVQ,I'm so glad the people in those perscription medication commercials finally got their own show.,en,2025-07-31T18:07:06Z,2025-07-31 14:07:06,7,0
wWziW_vQ_L4,Long Story Short | Official Trailer | Netflix,UCWOA1ZGywLbqmigxE4Qlvuw,Netflix,2025-07-31T14:00:00Z,364471,11786,696,UgyFPEyeN7wN4HRFv7R4AaABAg,NA,@Mankeyification,UCq9Aq6830mvIJ4G2zQKmk2g,Anyone figured out the song playing?,en,2025-07-31T18:01:44Z,2025-07-31 14:01:44,1,0
wWziW_vQ_L4,Long Story Short | Official Trailer | Netflix,UCWOA1ZGywLbqmigxE4Qlvuw,Netflix,2025-07-31T14:00:00Z,364471,11786,696,Ugyoi181e-jFy8DX4uN4AaABAg,NA,@LiterallyJust-An-Artist,UC3VdFUB8qhttWUaxAoWdywQ,"Well I'm excited, but who named their child Yoshi?",en,2025-07-31T18:00:51Z,2025-07-31 14:00:51,0,1
wWziW_vQ_L4,Long Story Short | Official Trailer | Netflix,UCWOA1ZGywLbqmigxE4Qlvuw,Netflix,2025-07-31T14:00:00Z,364471,11786,696,UgxBLIYLEZdCtANcAzB4AaABAg,NA,@79konnex,UCCDvcYlFlu714s_eyneKrew,This looks really good.,en,2025-07-31T17:59:01Z,2025-07-31 13:59:01,0,0
wWziW_vQ_L4,Long Story Short | Official Trailer | Netflix,UCWOA1ZGywLbqmigxE4Qlvuw,Netflix,2025-07-31T14:00:00Z,364471,11786,696,UgyAJh_NHuoJKbQsYGZ4AaABAg,NA,@Bogfrog1,UCBqchv6kuc163A4wh1bMD2g,Dude I can’t wait,en,2025-07-31T17:59:00Z,2025-07-31 13:59:00,0,0
wWziW_vQ_L4,Long Story Short | Official Trailer | Netflix,UCWOA1ZGywLbqmigxE4Qlvuw,Netflix,2025-07-31T14:00:00Z,364471,11786,696,Ugz4hdmNyFPx3iuRqtN4AaABAg,NA,@dmabsanchez,UCLoez3TOSkPRAxunXTlCANA,"I hope I laugh this time



just kidding, Bojack Horseman was very funny actually",en,2025-07-31T17:58:17Z,2025-07-31 13:58:17,0,0
wWziW_vQ_L4,Long Story Short | Official Trailer | Netflix,UCWOA1ZGywLbqmigxE4Qlvuw,Netflix,2025-07-31T14:00:00Z,364471,11786,696,UgwvaRD5MEGUf_kqhZF4AaABAg,NA,@themikx2939,UCmXHNBAPZusAfrA1hKwOE_Q,Definitely checking this out!,en,2025-07-31T17:57:54Z,2025-07-31 13:57:54,0,0
wWziW_vQ_L4,Long Story Short | Official Trailer | Netflix,UCWOA1ZGywLbqmigxE4Qlvuw,Netflix,2025-07-31T14:00:00Z,364471,11786,696,UgwkXk9LWve_1q6k4d14AaABAg,NA,@LifeIdepressing8900,UCqXybUuC-r3LtMFIHyj76Fw,I LOVE THIS,en,2025-07-31T17:56:18Z,2025-07-31 13:56:18,1,0
wWziW_vQ_L4,Long Story Short | Official Trailer | Netflix,UCWOA1ZGywLbqmigxE4Qlvuw,Netflix,2025-07-31T14:00:00Z,364471,11786,696,UgydnadDdrE2O-6YwRJ4AaABAg,NA,@davidasimpkins,UCM19cXD1NSEmHDj4koOfHDg,"im tired of lbgtqia ""comedy""",NA,2025-07-31T17:53:41Z,2025-07-31 13:53:41,1,1
wWziW_vQ_L4,Long Story Short | Official Trailer | Netflix,UCWOA1ZGywLbqmigxE4Qlvuw,Netflix,2025-07-31T14:00:00Z,364471,11786,696,UgzdZJlsKfl_L8soHbV4AaABAg,NA,@binhky4882,UCeipkmJ9wP88qkfGfZApkhg,I can faux with this,en,2025-07-31T17:52:40Z,2025-07-31 13:52:40,0,0
wWziW_vQ_L4,Long Story Short | Official Trailer | Netflix,UCWOA1ZGywLbqmigxE4Qlvuw,Netflix,2025-07-31T14:00:00Z,364471,11786,696,UgxDlzyZYW3OfbvviF94AaABAg,NA,@iorn9814,UCCHt-GgEbG4CyG0rYCyUusQ,"Inside job canceled , this two seasons 😂",en,2025-07-31T17:48:57Z,2025-07-31 13:48:57,0,0
wWziW_vQ_L4,Long Story Short | Official Trailer | Netflix,UCWOA1ZGywLbqmigxE4Qlvuw,Netflix,2025-07-31T14:00:00Z,364471,11786,696,Ugx1M2jzBsMvL3AfFel4AaABAg,NA,@LaserFloyd1971,UCUkTPthb6zfSnq67UgzpD4w,Do we really have to watch more of this dude's therapy in the form of ugly animation?,en,2025-07-31T17:48:14Z,2025-07-31 13:48:14,1,0
wWziW_vQ_L4,Long Story Short | Official Trailer | Netflix,UCWOA1ZGywLbqmigxE4Qlvuw,Netflix,2025-07-31T14:00:00Z,364471,11786,696,UgxEmRCP_CcCVPFw3ON4AaABAg,NA,@MichaelMitchRailfan2009,UCnW8FND6-11dDRemKqjoyeg,Well welcome back BoJack!,ig,2025-07-31T17:47:08Z,2025-07-31 13:47:08,0,0
wWziW_vQ_L4,Long Story Short | Official Trailer | Netflix,UCWOA1ZGywLbqmigxE4Qlvuw,Netflix,2025-07-31T14:00:00Z,364471,11786,696,UgxeHqyyuSG_VZPyex14AaABAg,NA,@hunnybun1128,UCofw-OrnrIzbGaw5pip-JEQ,the world does not need this show,en,2025-07-31T17:46:35Z,2025-07-31 13:46:35,0,2
wWziW_vQ_L4,Long Story Short | Official Trailer | Netflix,UCWOA1ZGywLbqmigxE4Qlvuw,Netflix,2025-07-31T14:00:00Z,364471,11786,696,Ugz09GOKOLCnRv3lOn14AaABAg,NA,@thebigredderg,UCqfkNrUBekaMMqAKqVvSqUA,ok why did i think the thumbnail was deltarune for a second,en,2025-07-31T17:41:13Z,2025-07-31 13:41:13,0,0
wWziW_vQ_L4,Long Story Short | Official Trailer | Netflix,UCWOA1ZGywLbqmigxE4Qlvuw,Netflix,2025-07-31T14:00:00Z,364471,11786,696,Ugw50vE85Ig3JoyfEzF4AaABAg,NA,@asselkamiyeva,UCKl0JkdO4DFknmWzPCVXBnA,aw Bojack was released on August 22 ten years ago! what a great memory and gift to new viewers!,en,2025-07-31T17:37:58Z,2025-07-31 13:37:58,10,2
wWziW_vQ_L4,Long Story Short | Official Trailer | Netflix,UCWOA1ZGywLbqmigxE4Qlvuw,Netflix,2025-07-31T14:00:00Z,364471,11786,696,Ugy2L5cgBnTOzkFcWlh4AaABAg,NA,@sleepingegg1719,UCvttENATusH-c7HnSQVVEnw,"Even this art style feels so nostalgic. Most 90's and 2000's cartoons lean episodic, but man I have been YEARNING for a show that has that kind of a retro look to it, while still having an overarching plot, and being absolutely real in the writing department. Bring it on.",en,2025-07-31T17:33:06Z,2025-07-31 13:33:06,820,10
wWziW_vQ_L4,Long Story Short | Official Trailer | Netflix,UCWOA1ZGywLbqmigxE4Qlvuw,Netflix,2025-07-31T14:00:00Z,364471,11786,696,Ugwemtp6PcJLtWjR59d4AaABAg,NA,@usernew7437,UCE_jyRpxOYhud_ybKUInMUg,THE YEAR MONTAGE MADE ME SCREAM IS THIS ABOUT MY LIFE AT 36?,en,2025-07-31T17:29:26Z,2025-07-31 13:29:26,1,0
wWziW_vQ_L4,Long Story Short | Official Trailer | Netflix,UCWOA1ZGywLbqmigxE4Qlvuw,Netflix,2025-07-31T14:00:00Z,364471,11786,696,Ugy3d_2pfpNEryPFdXB4AaABAg,NA,@Grassythegoat,UCjIvox_iidteD2d9SUJ76KA,Seems like this'll be interesting,NA,2025-07-31T17:19:14Z,2025-07-31 13:19:14,0,0
wWziW_vQ_L4,Long Story Short | Official Trailer | Netflix,UCWOA1ZGywLbqmigxE4Qlvuw,Netflix,2025-07-31T14:00:00Z,364471,11786,696,UgzZXjtgl9oQPFeqnUh4AaABAg,NA,@unabashedlyluckynerd7148,UCKjf3n_7LSz87LNCLdL1A9g,"Close enough, welcome back bojangles",NA,2025-07-31T17:18:27Z,2025-07-31 13:18:27,2,0
wWziW_vQ_L4,Long Story Short | Official Trailer | Netflix,UCWOA1ZGywLbqmigxE4Qlvuw,Netflix,2025-07-31T14:00:00Z,364471,11786,696,UgxOZ1NsMDJ-M_zPYU54AaABAg,NA,@return3168,UCjtwJ4LM_Jzzq4R3jKYxSoA,A little skeptical of the bouncing around time premise but it’s Raphael Bob-Waksberg so it’s probably gonna be amazing,en,2025-07-31T17:17:25Z,2025-07-31 13:17:25,0,1
wWziW_vQ_L4,Long Story Short | Official Trailer | Netflix,UCWOA1ZGywLbqmigxE4Qlvuw,Netflix,2025-07-31T14:00:00Z,364471,11786,696,UgxYxZMP-2615sGiYCV4AaABAg,NA,@sebastiangonzalez2693,UCj4tgr3RXYwk4gjT4Fg9e4Q,"Oh, this show is going to absolutely devastate me isn’t it?",en,2025-07-31T17:17:15Z,2025-07-31 13:17:15,0,0
wWziW_vQ_L4,Long Story Short | Official Trailer | Netflix,UCWOA1ZGywLbqmigxE4Qlvuw,Netflix,2025-07-31T14:00:00Z,364471,11786,696,UgxOuFvpL2tyXBx4fmp4AaABAg,NA,@Zombiesnyder13,UCf-e6Oo0Aj4WAcXc1WHeP1A,I wish I was Jewish,sw,2025-07-31T17:16:36Z,2025-07-31 13:16:36,0,0
wWziW_vQ_L4,Long Story Short | Official Trailer | Netflix,UCWOA1ZGywLbqmigxE4Qlvuw,Netflix,2025-07-31T14:00:00Z,364471,11786,696,UgxkCnqdpLtRX8xS0jp4AaABAg,NA,@shogunspear9739,UCDFfSRWGts5jq4SMNgrap6g,Looks like Tuca and Berty but if it was only humans,en,2025-07-31T17:13:53Z,2025-07-31 13:13:53,0,0
wWziW_vQ_L4,Long Story Short | Official Trailer | Netflix,UCWOA1ZGywLbqmigxE4Qlvuw,Netflix,2025-07-31T14:00:00Z,364471,11786,696,UgwZBy82FVmt7BE_kDN4AaABAg,NA,@chrissyhill7890,UC7q1leJE4cW0jFgxVLT45Ag,Ooo can't wait to have my heart crushed,en,2025-07-31T17:05:13Z,2025-07-31 13:05:13,0,0
wWziW_vQ_L4,Long Story Short | Official Trailer | Netflix,UCWOA1ZGywLbqmigxE4Qlvuw,Netflix,2025-07-31T14:00:00Z,364471,11786,696,UgyYvoXbqlgSSN0TdMV4AaABAg,NA,@DDarkestKnight,UCrTJ4lTKDkftchslaBft0kw,"I want this show to succeed so badly but I know people nowadays  hate animated shows that don't have ""Into the Spiderverse artstyle""",en,2025-07-31T17:03:03Z,2025-07-31 13:03:03,2,0
wWziW_vQ_L4,Long Story Short | Official Trailer | Netflix,UCWOA1ZGywLbqmigxE4Qlvuw,Netflix,2025-07-31T14:00:00Z,364471,11786,696,UgwLHykRi1teY3kBZ7p4AaABAg,NA,@WillBits,UCcBDexrF1_DgvU_oGPvcj3A,"Not having any animal-people is going to go a long way to keeping this from sitting too much in Bojack's shadow, and that's a good thing.  I think everyone's going to be pleasantly surprised by the time they spend with the Schwoopers.",en,2025-07-31T17:00:40Z,2025-07-31 13:00:40,2,0
wWziW_vQ_L4,Long Story Short | Official Trailer | Netflix,UCWOA1ZGywLbqmigxE4Qlvuw,Netflix,2025-07-31T14:00:00Z,364471,11786,696,Ugz54V2c8GESGLhQwJJ4AaABAg,NA,@andrueweghorn9976,UCierjGYYGcq48HAeL1Rc37Q,Long story short I haven't healed from that one Creep Cast epsiode so long story short i think of that story whenever i see the phrase long story short.,en,2025-07-31T16:59:19Z,2025-07-31 12:59:19,0,0
wWziW_vQ_L4,Long Story Short | Official Trailer | Netflix,UCWOA1ZGywLbqmigxE4Qlvuw,Netflix,2025-07-31T14:00:00Z,364471,11786,696,Ugz3K5OcVgzI4esc1Jl4AaABAg,NA,@MegawackyMax,UCnwxfxH6PP6S60xiEhjgtWw,That sandwich pileup joke was just magnificent.,NA,2025-07-31T16:47:08Z,2025-07-31 12:47:08,170,5
wWziW_vQ_L4,Long Story Short | Official Trailer | Netflix,UCWOA1ZGywLbqmigxE4Qlvuw,Netflix,2025-07-31T14:00:00Z,364471,11786,696,Ugw3QTDjuBrGMdOZX5V4AaABAg,NA,@JustaCastle,UCRdBzvqqe5SyoAor_BJRYbQ,"No Kendra, it’s have to",en,2025-07-31T16:47:01Z,2025-07-31 12:47:01,0,0
wWziW_vQ_L4,Long Story Short | Official Trailer | Netflix,UCWOA1ZGywLbqmigxE4Qlvuw,Netflix,2025-07-31T14:00:00Z,364471,11786,696,UgyJgiraVniQwbIm4hR4AaABAg,NA,@anthonyTang-d5w,UCM_XkVN-d7GKtMYVpb3XqLQ,2 Hours Ago.,NA,2025-07-31T16:46:55Z,2025-07-31 12:46:55,0,0
wWziW_vQ_L4,Long Story Short | Official Trailer | Netflix,UCWOA1ZGywLbqmigxE4Qlvuw,Netflix,2025-07-31T14:00:00Z,364471,11786,696,Ugzcn-bHPnI8zR00vMp4AaABAg,NA,@S1rD4niel,UC9nCG3uilA9Ohz1fm_TCwKQ,"""a new COMEDY""

...personally I expect like 15% giggles and 85% gut wrenchingly real moments portrayed in cartoon format and quotes that will keep you awake at night. Can't wait!",en,2025-07-31T16:38:14Z,2025-07-31 12:38:14,2568,12
wWziW_vQ_L4,Long Story Short | Official Trailer | Netflix,UCWOA1ZGywLbqmigxE4Qlvuw,Netflix,2025-07-31T14:00:00Z,364471,11786,696,UgyD9JxK1STr3TOyLQt4AaABAg,NA,@EddieTheFiend_115,UCiqNQvwX__0u_vkkM101tqQ,Looks like a gay unfunny liberal propaganda show. Yall f4gs can have fun with that.,en,2025-07-31T16:34:37Z,2025-07-31 12:34:37,1,1
wWziW_vQ_L4,Long Story Short | Official Trailer | Netflix,UCWOA1ZGywLbqmigxE4Qlvuw,Netflix,2025-07-31T14:00:00Z,364471,11786,696,UgxWlHsgI4q77FFTzft4AaABAg,NA,@Chairacter,UCnSIg6IoWkTvsLQ3QB4lJVA,hold up. will that guy be the kids uncle and father?,en,2025-07-31T16:30:55Z,2025-07-31 12:30:55,0,0
wWziW_vQ_L4,Long Story Short | Official Trailer | Netflix,UCWOA1ZGywLbqmigxE4Qlvuw,Netflix,2025-07-31T14:00:00Z,364471,11786,696,UgxmnTNl3AOAfkvqLdN4AaABAg,NA,@chrispyriceee,UCyIFf1MHesDoUquqcfSN1cw,Im so ready,cy,2025-07-31T16:30:41Z,2025-07-31 12:30:41,0,0
wWziW_vQ_L4,Long Story Short | Official Trailer | Netflix,UCWOA1ZGywLbqmigxE4Qlvuw,Netflix,2025-07-31T14:00:00Z,364471,11786,696,UgzEr3rtH4SrNquVgQZ4AaABAg,NA,@AstersSpam,UCz4AHH353s2K3DhRvG5OxQQ,"God I'm obsessed with this style, hell yeah Netflix I'm looking forward to this",en,2025-07-31T16:28:47Z,2025-07-31 12:28:47,0,0
wWziW_vQ_L4,Long Story Short | Official Trailer | Netflix,UCWOA1ZGywLbqmigxE4Qlvuw,Netflix,2025-07-31T14:00:00Z,364471,11786,696,Ugx6vuycRQskvuSGl754AaABAg,NA,@lunaloutfy,UCxyJBKazwUhsiZFB3_4TFsg,"This already looks like my new obsession! Just watched the official trailer for it and it gave me slice of life + Daria animation style vibes, which is the perfect combination and exactly what I needed right now. I’ve been in a rewatch phase for a few years now because nothing new is exciting me, but this? Yeah… it could be the next best thing to make it into my list of favorite shows. SIGN ME UP 😭❤️",en,2025-07-31T16:28:40Z,2025-07-31 12:28:40,3,0
wWziW_vQ_L4,Long Story Short | Official Trailer | Netflix,UCWOA1ZGywLbqmigxE4Qlvuw,Netflix,2025-07-31T14:00:00Z,364471,11786,696,UgydMkY3OKs0o_z-CoB4AaABAg,NA,@bobbyb_1,UCX5Z52w_GG_wxKqJHCelj9Q,Seems like all those animation people who got laid off from unnecessary mergers are finding new homes and I love it. Keep the adult animation coming ! ❤🎉,en,2025-07-31T16:28:37Z,2025-07-31 12:28:37,14,1
wWziW_vQ_L4,Long Story Short | Official Trailer | Netflix,UCWOA1ZGywLbqmigxE4Qlvuw,Netflix,2025-07-31T14:00:00Z,364471,11786,696,UgzlKzp1c8sFxonOxL94AaABAg,NA,@donniescorner1649,UCdA9EtEsIIVxgI_av_32Y1w,Thank you Netflix for renewing it for a second season. :),en,2025-07-31T16:27:48Z,2025-07-31 12:27:48,21,0
wWziW_vQ_L4,Long Story Short | Official Trailer | Netflix,UCWOA1ZGywLbqmigxE4Qlvuw,Netflix,2025-07-31T14:00:00Z,364471,11786,696,Ugy9HTPkGO22giefeA94AaABAg,NA,@BLANDMEDlA,UC8TInTFTDXVd_Ky_5-tpu5Q,I can see the propaganda already,mg,2025-07-31T16:27:44Z,2025-07-31 12:27:44,1,0
wWziW_vQ_L4,Long Story Short | Official Trailer | Netflix,UCWOA1ZGywLbqmigxE4Qlvuw,Netflix,2025-07-31T14:00:00Z,364471,11786,696,Ugx0JsAXC0-qrT9zj6h4AaABAg,NA,@jvanimation9520,UCQr2sU9ESKJfib455wzAhRw,"0:24 
“Yoshi is pinching me, I should suffer in silence?”
“Yes, that is what life is about.”

That hits so hard.",en,2025-07-31T16:19:06Z,2025-07-31 12:19:06,206,1
wWziW_vQ_L4,Long Story Short | Official Trailer | Netflix,UCWOA1ZGywLbqmigxE4Qlvuw,Netflix,2025-07-31T14:00:00Z,364471,11786,696,Ugx5yE3FHLNRSiFLmWh4AaABAg,NA,@music_teller,UC6QRetEU37eNZRiDFDMtBxA,I hope this doesn't get the [close enough] treatment,en,2025-07-31T16:17:22Z,2025-07-31 12:17:22,0,0
wWziW_vQ_L4,Long Story Short | Official Trailer | Netflix,UCWOA1ZGywLbqmigxE4Qlvuw,Netflix,2025-07-31T14:00:00Z,364471,11786,696,Ugxma1s7-lb92tO1Vrh4AaABAg,NA,@g1apefruit,UCxjMvm3k2h00JEAqKxlDhbA,this actually looks great! i havent seen anything from you guys that looked good in a long time. ill be watching!,en,2025-07-31T16:17:14Z,2025-07-31 12:17:14,0,0
wWziW_vQ_L4,Long Story Short | Official Trailer | Netflix,UCWOA1ZGywLbqmigxE4Qlvuw,Netflix,2025-07-31T14:00:00Z,364471,11786,696,Ugxg-mmbcAARXinoh2N4AaABAg,NA,@lunaloutfy,UCxyJBKazwUhsiZFB3_4TFsg,WAIT OMG NO WAY THIS ACTUALLY LOOKS SO GOOD I WANT TO WATCH IT RIGHT NOW (IT FEELS SO SLICE OF LIFE + DARIA ANIMATION STYLE CODED WOW),en,2025-07-31T16:15:15Z,2025-07-31 12:15:15,1,0
wWziW_vQ_L4,Long Story Short | Official Trailer | Netflix,UCWOA1ZGywLbqmigxE4Qlvuw,Netflix,2025-07-31T14:00:00Z,364471,11786,696,UgwTkvE0Hdg7JDKiAgt4AaABAg,NA,@loveveggies1354,UCCm8QbWEqEJuUOe3TQdNpaA,WHAT SONG WAS PLAYING IN THE BACKGROUND? PLS I NEED TO KNOW!!,en,2025-07-31T16:13:29Z,2025-07-31 12:13:29,5,2
wWziW_vQ_L4,Long Story Short | Official Trailer | Netflix,UCWOA1ZGywLbqmigxE4Qlvuw,Netflix,2025-07-31T14:00:00Z,364471,11786,696,UgzRdIqjGe5eKIhnqqd4AaABAg,NA,@Sin05269,UCPIuQ-L9gVtbyois3UkTuVw,I can already tell this will be peak,en,2025-07-31T16:12:45Z,2025-07-31 12:12:45,0,0
wWziW_vQ_L4,Long Story Short | Official Trailer | Netflix,UCWOA1ZGywLbqmigxE4Qlvuw,Netflix,2025-07-31T14:00:00Z,364471,11786,696,Ugxa1vkniDMiJOA1s094AaABAg,NA,@Alistocrat,UC-1dFR5UDeoqfANLxsOI2hA,I cant wait to ball my eyes out to this show,en,2025-07-31T16:10:54Z,2025-07-31 12:10:54,5,1
wWziW_vQ_L4,Long Story Short | Official Trailer | Netflix,UCWOA1ZGywLbqmigxE4Qlvuw,Netflix,2025-07-31T14:00:00Z,364471,11786,696,UgxfbzXiRTmfkHIpEZl4AaABAg,NA,@gabrielaguilera3960,UC6VhzrLMPYiyU606epCRKWQ,"Wish they would suffer in silence, most are just playing victim",en,2025-07-31T16:07:58Z,2025-07-31 12:07:58,0,1
wWziW_vQ_L4,Long Story Short | Official Trailer | Netflix,UCWOA1ZGywLbqmigxE4Qlvuw,Netflix,2025-07-31T14:00:00Z,364471,11786,696,Ugzw3r6roSFfTCSNoCV4AaABAg,NA,@jayyy4807,UCit6mjWRaBU0SBHU6cabe8w,"This literally looks so amazing, I can't wait to watch it!!! A sitcom by the creator of Bojack Horseman? Sign me tf up!!!!",en,2025-07-31T16:07:36Z,2025-07-31 12:07:36,0,0
wWziW_vQ_L4,Long Story Short | Official Trailer | Netflix,UCWOA1ZGywLbqmigxE4Qlvuw,Netflix,2025-07-31T14:00:00Z,364471,11786,696,UgxPw4e-8QOdsp0cq3h4AaABAg,NA,@ziebelzubel,UCBdQ6C8hqSy6PbwcfflsVWA,Already looking forward to Johnny going all in on this,en,2025-07-31T16:06:53Z,2025-07-31 12:06:53,5,0
wWziW_vQ_L4,Long Story Short | Official Trailer | Netflix,UCWOA1ZGywLbqmigxE4Qlvuw,Netflix,2025-07-31T14:00:00Z,364471,11786,696,Ugw4eyjkSf9k70Ei_V14AaABAg,NA,@BeanBread41916,UCnxXFFSGfwMHnaE6ANvyQQg,1:35 Kendra. I'm gonna love Kendra ❤😂,mt,2025-07-31T16:04:48Z,2025-07-31 12:04:48,168,1
wWziW_vQ_L4,Long Story Short | Official Trailer | Netflix,UCWOA1ZGywLbqmigxE4Qlvuw,Netflix,2025-07-31T14:00:00Z,364471,11786,696,Ugwpm9xGn7VBhagnUPp4AaABAg,NA,@morvent9668,UC37-A69j1Zfupnf1JXjMGwg,Always with the calarts mouth,en,2025-07-31T16:01:19Z,2025-07-31 12:01:19,0,2
wWziW_vQ_L4,Long Story Short | Official Trailer | Netflix,UCWOA1ZGywLbqmigxE4Qlvuw,Netflix,2025-07-31T14:00:00Z,364471,11786,696,UgxotmB-O2b29QGO4Fx4AaABAg,NA,@spacekicker4,UCQQJkytAS2bVQB-id7INDSQ,"Oh great now I watched basically the entire first season, just in time for Netflix to cancel the show.",en,2025-07-31T15:59:39Z,2025-07-31 11:59:39,1,0
wWziW_vQ_L4,Long Story Short | Official Trailer | Netflix,UCWOA1ZGywLbqmigxE4Qlvuw,Netflix,2025-07-31T14:00:00Z,364471,11786,696,Ugz_600JHWDNx0JD1xJ4AaABAg,NA,@zays_2004,UCBiAPUMozSAGBCQv3uM1iLw,The artstyle looks like nintendo miis drawn in 2d form.,NA,2025-07-31T15:58:18Z,2025-07-31 11:58:18,1,0
wWziW_vQ_L4,Long Story Short | Official Trailer | Netflix,UCWOA1ZGywLbqmigxE4Qlvuw,Netflix,2025-07-31T14:00:00Z,364471,11786,696,UgyRnXaFDxohA_5lP6R4AaABAg,NA,@partylrd8699,UCe9Qha3BCTal-QaD99irw8w,.... Let's hope one of them don't pull an Escape from L.A... dear god I hope not,en,2025-07-31T15:55:42Z,2025-07-31 11:55:42,0,0
wWziW_vQ_L4,Long Story Short | Official Trailer | Netflix,UCWOA1ZGywLbqmigxE4Qlvuw,Netflix,2025-07-31T14:00:00Z,364471,11786,696,Ugxv5ZzJRauYkBF2aOd4AaABAg,NA,@mr.cartoonlover9921,UC3LZIS8xNCakLjhq6jMUI1Q,Can’t wait for this,en,2025-07-31T15:53:56Z,2025-07-31 11:53:56,0,0
wWziW_vQ_L4,Long Story Short | Official Trailer | Netflix,UCWOA1ZGywLbqmigxE4Qlvuw,Netflix,2025-07-31T14:00:00Z,364471,11786,696,UgyHf-GfOyCIz6NLLvp4AaABAg,NA,@jonahhex18,UCAgflDXAmNH2XeFmBYTK0eA,"Okay, I'm here for this",en,2025-07-31T15:51:41Z,2025-07-31 11:51:41,0,0
wWziW_vQ_L4,Long Story Short | Official Trailer | Netflix,UCWOA1ZGywLbqmigxE4Qlvuw,Netflix,2025-07-31T14:00:00Z,364471,11786,696,UgzGwhF5H2qCK19v4Dt4AaABAg,NA,@JustTheShowMan,UCFx6rW9QgW7usL1hmlDp4EA,I knew the sister would be gay,en,2025-07-31T15:50:38Z,2025-07-31 11:50:38,0,0
wWziW_vQ_L4,Long Story Short | Official Trailer | Netflix,UCWOA1ZGywLbqmigxE4Qlvuw,Netflix,2025-07-31T14:00:00Z,364471,11786,696,UgxA1I2l-pcgfHGyaIJ4AaABAg,NA,@missourigreen051,UCHWwmCk_aBmEQUCAPRuJkNg,"So the trailer doesn't say if it's a movie or series, so I checked the description underneath the video and it doesn't say anything about it being a tv series, so I assume it's a movie. But I then decided to check IMDB just to be double sure, and it says it's a series but it only has 2 episodes???",en,2025-07-31T15:48:03Z,2025-07-31 11:48:03,1,1
wWziW_vQ_L4,Long Story Short | Official Trailer | Netflix,UCWOA1ZGywLbqmigxE4Qlvuw,Netflix,2025-07-31T14:00:00Z,364471,11786,696,UgxBuvbMK9KkFMAlZ8B4AaABAg,NA,@crisssstopher,UCImmGaa3dM2N9jt-pzVapvw,why is nobody talking abt the fact that she wants her BROTHER'S sperm??? like... isn't that weird??? am i crazy???,en,2025-07-31T15:47:47Z,2025-07-31 11:47:47,1,2
wWziW_vQ_L4,Long Story Short | Official Trailer | Netflix,UCWOA1ZGywLbqmigxE4Qlvuw,Netflix,2025-07-31T14:00:00Z,364471,11786,696,UgwE0bE-EwunWkbAUPt4AaABAg,NA,@HinduSpartan,UCuMzV8pyrF1zQ8XNFM93_TQ,"""BACK IN THE 90'S MY FAMILY WAS IN A FAMOUS TV SSHOOWWWW""",en,2025-07-31T15:45:23Z,2025-07-31 11:45:23,161,0
wWziW_vQ_L4,Long Story Short | Official Trailer | Netflix,UCWOA1ZGywLbqmigxE4Qlvuw,Netflix,2025-07-31T14:00:00Z,364471,11786,696,UgwQorAZ2YAIhSDeocV4AaABAg,NA,@Gordon234,UC518fkZwPka8SNeoIj29EkQ,0:19 Why is Shaggy doing there for 😭🙏,en,2025-07-31T15:43:35Z,2025-07-31 11:43:35,117,2
wWziW_vQ_L4,Long Story Short | Official Trailer | Netflix,UCWOA1ZGywLbqmigxE4Qlvuw,Netflix,2025-07-31T14:00:00Z,364471,11786,696,UgzYpUsIs4Das0hAPxh4AaABAg,NA,@mikesilva3868,UC8CqExaMcG5i4ggDRVCJ95g,Lol😂,uk,2025-07-31T15:37:58Z,2025-07-31 11:37:58,0,0
wWziW_vQ_L4,Long Story Short | Official Trailer | Netflix,UCWOA1ZGywLbqmigxE4Qlvuw,Netflix,2025-07-31T14:00:00Z,364471,11786,696,UgylFVdDro2RJW3DZWB4AaABAg,NA,@LiminalCosmicMoth,UCLNiCjQfTvxVN3ErTvyM4iA,"Welcome Back, Bojack",ig,2025-07-31T15:35:59Z,2025-07-31 11:35:59,4,0
wWziW_vQ_L4,Long Story Short | Official Trailer | Netflix,UCWOA1ZGywLbqmigxE4Qlvuw,Netflix,2025-07-31T14:00:00Z,364471,11786,696,UgzsuRjGKf56Uazy_014AaABAg,NA,@Ushio01,UC3-msr26XwiAvcOy8WGKgTw,Why are US animated shows so often ugly? who wants to watch ugly character designs? We all get enough of seeing ugly people in real life everyday.,en,2025-07-31T15:34:38Z,2025-07-31 11:34:38,1,0
wWziW_vQ_L4,Long Story Short | Official Trailer | Netflix,UCWOA1ZGywLbqmigxE4Qlvuw,Netflix,2025-07-31T14:00:00Z,364471,11786,696,UgxTlB7ac5wnAJOSJY94AaABAg,NA,@Sweetblacklesbian,UCdaHTtZ_wtUlsWVP92YxlMQ,OMG THIS LOOKS SO GOOD I CANNOT WAIT,en,2025-07-31T15:33:56Z,2025-07-31 11:33:56,0,0
wWziW_vQ_L4,Long Story Short | Official Trailer | Netflix,UCWOA1ZGywLbqmigxE4Qlvuw,Netflix,2025-07-31T14:00:00Z,364471,11786,696,UgxhNcSpFs9Y5OQckcl4AaABAg,NA,@normal_norm,UCTCiE_wlacezk7jKS-hzX4Q,Why am I getting the vibe that this feels like I'm watching a new storybooth video,en,2025-07-31T15:33:18Z,2025-07-31 11:33:18,2,0
wWziW_vQ_L4,Long Story Short | Official Trailer | Netflix,UCWOA1ZGywLbqmigxE4Qlvuw,Netflix,2025-07-31T14:00:00Z,364471,11786,696,Ugx8H_u-BLLYc8jDyCl4AaABAg,NA,@jacobtisc3512,UCEjHHDDxLOUG28pbEbjbFtQ,0:59 sandwich truck,fy,2025-07-31T15:31:55Z,2025-07-31 11:31:55,2,2
wWziW_vQ_L4,Long Story Short | Official Trailer | Netflix,UCWOA1ZGywLbqmigxE4Qlvuw,Netflix,2025-07-31T14:00:00Z,364471,11786,696,UgxiUcrTOamIC2qh7QV4AaABAg,NA,@yz4043,UCHLmUjZVxc_IYcJcT4AYP7g,Revenge of the nerds lmfao I'll pass 😊,no,2025-07-31T15:29:53Z,2025-07-31 11:29:53,1,0
wWziW_vQ_L4,Long Story Short | Official Trailer | Netflix,UCWOA1ZGywLbqmigxE4Qlvuw,Netflix,2025-07-31T14:00:00Z,364471,11786,696,UgxpEU5uwtb4uJlGzDh4AaABAg,NA,@starace4031,UC6RwQD9hnFJLe7iXWY3j41Q,"Oh Netflix, we're gonna need all the seasons the creators of Long Story Short want to make - however many and I'll eagerly watch every episode. This already looks amazing, beautiful animation, sounds fantastic with the soundtrack and perfect voice acting. This will be a fave of mine for sure. Thank you to the amazing people that made this show! 🥰🥰",en,2025-07-31T15:28:57Z,2025-07-31 11:28:57,133,0
wWziW_vQ_L4,Long Story Short | Official Trailer | Netflix,UCWOA1ZGywLbqmigxE4Qlvuw,Netflix,2025-07-31T14:00:00Z,364471,11786,696,Ugy3-O0fsw8YMNsmF254AaABAg,NA,@Failosoraptor,UCPgav_2NFGpgDWKUbDJTw-w,Oh man straight into the feels. I got two young kids and they went from babies to crazy kids in a blink of an eye.,en,2025-07-31T15:28:08Z,2025-07-31 11:28:08,25,0
