video_id,video_url,comment_id,comment_author_display,comment_author_channel_id,comment_content,comment_lang,comment_time_utc,comment_time_local,comment_like_count,comment_reply_count,reply_id,reply_author_display,reply_author_channel_id,reply_content,reply_lang,reply_time_utc,reply_time_local,reply_like_count,view_count,like_count,comment_count,crawl_time
VMJckZFOli4,https://www.youtube.com/watch?v=VMJckZFOli4,UgwglVb6xfCl3Vm_XE94AaABAg,@davidrobertson5881,UC7pCeehbBHNCGvkEstBYNSA,Hilarious show but the language is too much. That is the reason I stopped watching. Do all liberals talk that way all the time ?,en,2025-10-07T03:38:04Z,2025-10-06 23:38:04,0,1,UgwglVb6xfCl3Vm_XE94AaABAg.ANy41TJJ3oVAO8ntImfFyw,@countrymusiclibertarer,UC45JVW5phtidUxCc2hWOexw,Don't watch with kids,en,2025-10-11T16:59:09Z,2025-10-11 12:59:09,1,693220,13519,941,"Wed, 17 Dec 2025 11:59:50 GMT"
VMJckZFOli4,https://www.youtube.com/watch?v=VMJckZFOli4,UgwzKFtDz_gvNo3BpLp4AaABAg,@Peezyxo,UCVcN_0KKtPSDwNVlbEIEWVQ,This is so bad just stick to stand up comedy,en,2025-07-02T19:18:38Z,2025-07-02 15:18:38,0,2,UgwzKFtDz_gvNo3BpLp4AaABAg.AK4zZVXmDvsAK9Ft8kdT1_,@KillaCalDal,UCfiS22qTHi7YNY4bxZl7Eow,Your comment is so bad stick to keeping your opinions to yourself.,en,2025-07-04T11:06:58Z,2025-07-04 07:06:58,0,693220,13519,941,"Wed, 17 Dec 2025 11:59:50 GMT"
VMJckZFOli4,https://www.youtube.com/watch?v=VMJckZFOli4,UgwzKFtDz_gvNo3BpLp4AaABAg,@Peezyxo,UCVcN_0KKtPSDwNVlbEIEWVQ,This is so bad just stick to stand up comedy,en,2025-07-02T19:18:38Z,2025-07-02 15:18:38,0,2,UgwzKFtDz_gvNo3BpLp4AaABAg.AK4zZVXmDvsAK9G9u_W3Dl,@Peezyxo,UCVcN_0KKtPSDwNVlbEIEWVQ,@KillaCalDalmake me clown,el-Latn,2025-07-04T11:09:23Z,2025-07-04 07:09:23,0,693220,13519,941,"Wed, 17 Dec 2025 11:59:50 GMT"
VMJckZFOli4,https://www.youtube.com/watch?v=VMJckZFOli4,Ugxct-BSM8xqdQwKG714AaABAg,@teeseries4487,UCKV7vrtMKWJuObqckIMZXew,This is the most special Netflix series in a very long time. Please don’t cancel this,en,2025-06-14T15:40:38Z,2025-06-14 11:40:38,10,1,Ugxct-BSM8xqdQwKG714AaABAg.AJMFJ1C5tCNAKpWilFL5NL,@comicthrill,UCBxCqYOaV4xA6FlL4Aan4Mg,Agreed! Netflix better renew for at the very least two more seasons,en,2025-07-21T06:21:27Z,2025-07-21 02:21:27,0,693220,13519,941,"Wed, 17 Dec 2025 11:59:50 GMT"
VMJckZFOli4,https://www.youtube.com/watch?v=VMJckZFOli4,UgyIFDyFgFNwhgK9FuR4AaABAg,@bossHogOG,UCikmeFP9Fp5szciQWEHYj8A,What’s with the manic cameras? All shakey and spastic zooming. It’s like the production is desperate for attention. It makes no sense. Are the camera operators part of the scene like a documentary style like the office? Pretty sure they’re not. It’s just some dipshit directors hip style. Maybe I’m just unaware the target audience is 12 year olds with short attention spans.,en,2025-06-12T00:45:51Z,2025-06-11 20:45:51,0,1,UgyIFDyFgFNwhgK9FuR4AaABAg.AJFVJfVyHb9AJHPDSISlj8,@Alexander-w7h,UCWmmxoFs9xd_Tyr46CppJqA,You’ve got a lot of anger in you. Try kissing your boyfriend more often.,en,2025-06-12T18:31:03Z,2025-06-12 14:31:03,0,693220,13519,941,"Wed, 17 Dec 2025 11:59:50 GMT"
VMJckZFOli4,https://www.youtube.com/watch?v=VMJckZFOli4,UgzDqaN2dykAfyIwh2h4AaABAg,@aidanbruton2679,UC_kge8HY8EzIxoP0bT9CkWg,"Folded on the trailer, gf said it sucks now can’t watch it👎🏼",en,2025-06-10T01:20:44Z,2025-06-09 21:20:44,1,1,UgzDqaN2dykAfyIwh2h4AaABAg.AJAPiUm8ujZAJAiv6u2Rs0,@Josh-py2pq,UCfy60wboksf31mth3E1ADQA,Shits hilarious. Don’t listen to women when it comes to comedy.,en,2025-06-10T04:17:13Z,2025-06-10 00:17:13,0,693220,13519,941,"Wed, 17 Dec 2025 11:59:50 GMT"
VMJckZFOli4,https://www.youtube.com/watch?v=VMJckZFOli4,Ugy658GfnfJCy2AIOW14AaABAg,@user-zv3fe4nz8o,UCAyIHJJc-k5ekq4GevkDFzQ,As a former Mr Tire employee I can confirm this is exactly how it is. 🤣 😂 I love this show keep it going.,en,2025-06-08T14:40:36Z,2025-06-08 10:40:36,1,1,Ugy658GfnfJCy2AIOW14AaABAg.AJ6gf80VVWWAJ7uguRHaL8,@lesliechow7286,UC35CUmB5XqhLrL_-OBsnRWQ,So very little of anything that’s actually funny. This show sucks.,en,2025-06-09T02:02:25Z,2025-06-08 22:02:25,0,693220,13519,941,"Wed, 17 Dec 2025 11:59:50 GMT"
VMJckZFOli4,https://www.youtube.com/watch?v=VMJckZFOli4,Ugwdm5f-EFk8UfNjfSp4AaABAg,@MattKaspar,UCT9dbhN65KDZVTPcRHfQnZw,Need to get Woody Harrelson on Season 3 as Cal's Dad,en,2025-06-07T21:08:06Z,2025-06-07 17:08:06,0,1,Ugwdm5f-EFk8UfNjfSp4AaABAg.AJ4oDO9CYfWAJ7upEEHxqD,@lesliechow7286,UC35CUmB5XqhLrL_-OBsnRWQ,Need to do something because this show is pathetic if it’s supposed to be a comedy,en,2025-06-09T02:03:33Z,2025-06-08 22:03:33,0,693220,13519,941,"Wed, 17 Dec 2025 11:59:50 GMT"
VMJckZFOli4,https://www.youtube.com/watch?v=VMJckZFOli4,UgwLUPBvr4x1IdY26-54AaABAg,@davelarkin8129,UC1BN800-LQYL32vzv3GphIw,3 episodes in and this season is waaaay better than last.  Stav being more in the show is hilarious,en,2025-06-07T08:44:09Z,2025-06-07 04:44:09,12,1,UgwLUPBvr4x1IdY26-54AaABAg.AJ3U4UvbLWUAKpWwx8teUi,@comicthrill,UCBxCqYOaV4xA6FlL4Aan4Mg,I'm reading comments too look for praise for Stavvy just after 2 eps in,en,2025-07-21T06:23:23Z,2025-07-21 02:23:23,0,693220,13519,941,"Wed, 17 Dec 2025 11:59:50 GMT"
VMJckZFOli4,https://www.youtube.com/watch?v=VMJckZFOli4,UgzTOMi7UlD9fOCXOU54AaABAg,@walkamassie5788,UCJnERWQswRlgpAuJc28XAdQ,Surprised Netflix hasn’t brought in a gay dude yet,en,2025-06-06T06:27:06Z,2025-06-06 02:27:06,1,2,UgzTOMi7UlD9fOCXOU54AaABAg.AJ0eapIVH54AJFqqkjgcLK,@Jsizzle6809,UCQJramwPHeu5Y7Dcw-70fKw,Yep I’m amazed. So far they’ve kept it straight and whyte. No wonder people really like it!,en,2025-06-12T04:02:44Z,2025-06-12 00:02:44,0,693220,13519,941,"Wed, 17 Dec 2025 11:59:50 GMT"
VMJckZFOli4,https://www.youtube.com/watch?v=VMJckZFOli4,UgzTOMi7UlD9fOCXOU54AaABAg,@walkamassie5788,UCJnERWQswRlgpAuJc28XAdQ,Surprised Netflix hasn’t brought in a gay dude yet,en,2025-06-06T06:27:06Z,2025-06-06 02:27:06,1,2,UgzTOMi7UlD9fOCXOU54AaABAg.AJ0eapIVH54AJM7ubjv8Kf,@warhellride,UCSjy4Z86a82WP5lWjZbwvfA,I wouldn’t mind if they added fake business mogul Timothy J. Dillon for season 3 tho NGL,en,2025-06-14T14:36:00Z,2025-06-14 10:36:00,0,693220,13519,941,"Wed, 17 Dec 2025 11:59:50 GMT"
VMJckZFOli4,https://www.youtube.com/watch?v=VMJckZFOli4,Ugy3OGxcq5uOiNCvQPl4AaABAg,@andsykes,UCt4wjVu7iZ39GUtHU5awJCA,Trash.,hi-Latn,2025-05-29T05:22:37Z,2025-05-29 01:22:37,1,1,Ugy3OGxcq5uOiNCvQPl4AaABAg.AIgwrZUIzHAAItTzsoSI0o,@warhellride,UCSjy4Z86a82WP5lWjZbwvfA,☝Reddit mod,NA,2025-06-03T02:11:44Z,2025-06-02 22:11:44,0,693220,13519,941,"Wed, 17 Dec 2025 11:59:50 GMT"
VMJckZFOli4,https://www.youtube.com/watch?v=VMJckZFOli4,UgwLDqoygzuf8pGi7EV4AaABAg,@emirates111,UC5lT340Iv7H_4RPGAGl4hhA,anyone know the song??,en,2025-05-26T00:21:49Z,2025-05-25 20:21:49,2,1,UgwLDqoygzuf8pGi7EV4AaABAg.AIZg2lbfrufAJM7eCuNq5y,@warhellride,UCSjy4Z86a82WP5lWjZbwvfA,Work by Foxygen!,de,2025-06-14T14:33:45Z,2025-06-14 10:33:45,1,693220,13519,941,"Wed, 17 Dec 2025 11:59:50 GMT"
VMJckZFOli4,https://www.youtube.com/watch?v=VMJckZFOli4,UgyUueht9hxlyd2ATjh4AaABAg,@tinogarcia996,UCzxMo26GqQ2Ic36KJC4ji7A,Shaman sighting at 1:47.,fil,2025-05-25T00:46:58Z,2025-05-24 20:46:58,1,3,UgyUueht9hxlyd2ATjh4AaABAg.AIX986Y2_0gAIXIFgnBIL9,@mattallica100,UCkJubzHK28T9NKto4PK1D5Q,? I didn't see Matt.,mt,2025-05-25T02:06:39Z,2025-05-24 22:06:39,6,693220,13519,941,"Wed, 17 Dec 2025 11:59:50 GMT"
VMJckZFOli4,https://www.youtube.com/watch?v=VMJckZFOli4,UgyUueht9hxlyd2ATjh4AaABAg,@tinogarcia996,UCzxMo26GqQ2Ic36KJC4ji7A,Shaman sighting at 1:47.,fil,2025-05-25T00:46:58Z,2025-05-24 20:46:58,1,3,UgyUueht9hxlyd2ATjh4AaABAg.AIX986Y2_0gAIfdZAw2K49,@someonlinevideos,UCTbU30giIszpDKP3y2DBtGg,The blurry dude in the seat?????? 👁️ no way dude,en,2025-05-28T17:14:42Z,2025-05-28 13:14:42,2,693220,13519,941,"Wed, 17 Dec 2025 11:59:50 GMT"
VMJckZFOli4,https://www.youtube.com/watch?v=VMJckZFOli4,UgyUueht9hxlyd2ATjh4AaABAg,@tinogarcia996,UCzxMo26GqQ2Ic36KJC4ji7A,Shaman sighting at 1:47.,fil,2025-05-25T00:46:58Z,2025-05-24 20:46:58,1,3,UgyUueht9hxlyd2ATjh4AaABAg.AIX986Y2_0gAIn6hz6u7WK,@trent810,UCV4pGHIj4vG-QPiNzB3twzg,no,es,2025-05-31T14:52:52Z,2025-05-31 10:52:52,0,693220,13519,941,"Wed, 17 Dec 2025 11:59:50 GMT"
VMJckZFOli4,https://www.youtube.com/watch?v=VMJckZFOli4,UgyBBL0uBCS2MuFRYN14AaABAg,@mixedreceptionpodcast5408,UCiuUOdNM4xA5VZ63TX4uLlA,What’s the name of the song?,en,2025-05-24T19:05:21Z,2025-05-24 15:05:21,1,1,UgyBBL0uBCS2MuFRYN14AaABAg.AIWY22GVkRcAJM7TU3mtGh,@warhellride,UCSjy4Z86a82WP5lWjZbwvfA,Work by Foxygen!,de,2025-06-14T14:32:09Z,2025-06-14 10:32:09,0,693220,13519,941,"Wed, 17 Dec 2025 11:59:50 GMT"
VMJckZFOli4,https://www.youtube.com/watch?v=VMJckZFOli4,UgwTLmQFxtmCvV3yvYB4AaABAg,@jansendawe9212,UCVbkzua2eZCLgFQ3oq8us2g,It's like game of thrones but for 30 year old conservative assholes,en,2025-05-24T17:03:37Z,2025-05-24 13:03:37,0,1,UgwTLmQFxtmCvV3yvYB4AaABAg.AIWK6T3t8MKAIWXZFUHOPn,@PareloInn,UCP9WELx7j_D9GpjmtKRTxVA,Of course you're called Jane.,en,2025-05-24T19:01:09Z,2025-05-24 15:01:09,0,693220,13519,941,"Wed, 17 Dec 2025 11:59:50 GMT"
VMJckZFOli4,https://www.youtube.com/watch?v=VMJckZFOli4,Ugxg4-0wAhyja1wkEjF4AaABAg,@RogueStatusQVX,UCw72CnxM0uxF2aQsdVuQklw,"The Shaman better be in this, and we need more Francis. Looks like it's going to be great!",en,2025-05-24T16:44:56Z,2025-05-24 12:44:56,0,1,Ugxg4-0wAhyja1wkEjF4AaABAg.AIWHy_hIypSAIaWxhegubW,@user-br2qr1dp4r,UCvz94Dh7JKDeqZwodQIQeIg,He was beating off to tranny porn in the trailer,en,2025-05-26T17:32:05Z,2025-05-26 13:32:05,0,693220,13519,941,"Wed, 17 Dec 2025 11:59:50 GMT"
VMJckZFOli4,https://www.youtube.com/watch?v=VMJckZFOli4,UgxU8bUu615FVcpSZp54AaABAg,@michelangelosplinter,UC9wfg8xq3h5z-YBrQbopTAA,"This is exactly what Netflix needs to stay alive this is amazing. They just have to care about the customer again and not just the dollar and they can make it through. 
Spitting in everybody’s faces by taking away the account sharing really screwed them and then that whole boxing match fiasco didn’t help either, but Shane and the DOGS! might just save them",en,2025-05-24T03:01:21Z,2025-05-23 23:01:21,24,2,UgxU8bUu615FVcpSZp54AaABAg.AIUoi_H-rdeAJar5jEpQ_4,@beckybnyc322,UCEOwPFMTZ6agQiWzUkCSJaQ,I’m over the god damn ADS interrupting while watching 🙄 put the damn things & start or finish cause we streamed to get away from constant ads. This is what happens when shareholders want never ending growth. How about focusing on putting out quality so ppl subscribe & stick around otherwise they gonna go bust too,en,2025-06-20T17:08:13Z,2025-06-20 13:08:13,0,693220,13519,941,"Wed, 17 Dec 2025 11:59:50 GMT"
VMJckZFOli4,https://www.youtube.com/watch?v=VMJckZFOli4,UgxU8bUu615FVcpSZp54AaABAg,@michelangelosplinter,UC9wfg8xq3h5z-YBrQbopTAA,"This is exactly what Netflix needs to stay alive this is amazing. They just have to care about the customer again and not just the dollar and they can make it through. 
Spitting in everybody’s faces by taking away the account sharing really screwed them and then that whole boxing match fiasco didn’t help either, but Shane and the DOGS! might just save them",en,2025-05-24T03:01:21Z,2025-05-23 23:01:21,24,2,UgxU8bUu615FVcpSZp54AaABAg.AIUoi_H-rdeAQlw_pnZUhf,@MrMadvillan,UCOi7rBFx1pHy6RaMZXGjyJQ,wtf are you talking about? it’s literally the biggest streamer and they’re running the table. lol derp,en,2025-12-16T00:07:33Z,2025-12-15 19:07:33,0,693220,13519,941,"Wed, 17 Dec 2025 11:59:50 GMT"
VMJckZFOli4,https://www.youtube.com/watch?v=VMJckZFOli4,UgwQcldMn13A_-7tO-J4AaABAg,@kevindvorak3490,UC0Ajuq563d1eOpS_NQIkKhA,No Bobby Lee??..cmon Gillis get the slept king on. Love this show.,en,2025-05-24T02:16:50Z,2025-05-23 22:16:50,2,1,UgwQcldMn13A_-7tO-J4AaABAg.AIUjcU4piMNAJarfYbd7al,@beckybnyc322,UCEOwPFMTZ6agQiWzUkCSJaQ,Oh lord plz no,en,2025-06-20T17:13:14Z,2025-06-20 13:13:14,0,693220,13519,941,"Wed, 17 Dec 2025 11:59:50 GMT"
VMJckZFOli4,https://www.youtube.com/watch?v=VMJckZFOli4,UgzklC_y8YkGNxnoHkd4AaABAg,@chickengenius4202,UCeI-SqOjBq4-lPf8MH8PgZQ,Not getting Phil for his dad is criminal,en,2025-05-24T00:43:48Z,2025-05-23 20:43:48,32,3,UgzklC_y8YkGNxnoHkd4AaABAg.AIUZz2ytwsLAIWcS7-L1V-,@cool-guycharlie6380,UC2rUSzTyopYTQXLx2gnGQDA,Phil wouldn’t be so gay as to try acting.  Give the man some credit.  The lore and mystique of Phil lives on in the randomness of his appearance,en,2025-05-24T19:52:36Z,2025-05-24 15:52:36,31,693220,13519,941,"Wed, 17 Dec 2025 11:59:50 GMT"
VMJckZFOli4,https://www.youtube.com/watch?v=VMJckZFOli4,UgzklC_y8YkGNxnoHkd4AaABAg,@chickengenius4202,UCeI-SqOjBq4-lPf8MH8PgZQ,Not getting Phil for his dad is criminal,en,2025-05-24T00:43:48Z,2025-05-23 20:43:48,32,3,UgzklC_y8YkGNxnoHkd4AaABAg.AIUZz2ytwsLAIWsp0Koc30,@muletowndown,UCb7QiDPnvJBqIpGBEV7yi1w,I was hoping Ron White would have been his dad.,en,2025-05-24T22:15:40Z,2025-05-24 18:15:40,3,693220,13519,941,"Wed, 17 Dec 2025 11:59:50 GMT"
VMJckZFOli4,https://www.youtube.com/watch?v=VMJckZFOli4,UgzklC_y8YkGNxnoHkd4AaABAg,@chickengenius4202,UCeI-SqOjBq4-lPf8MH8PgZQ,Not getting Phil for his dad is criminal,en,2025-05-24T00:43:48Z,2025-05-23 20:43:48,32,3,UgzklC_y8YkGNxnoHkd4AaABAg.AIUZz2ytwsLAIZKPzdc7XU,@mattmarzula,UChR_UCiLPF1Ow44SgSS-oRQ,​@muletowndownyou're only writing that because Thomas Haden Church (whose initials I am just realizing are THC) bares a slight resemblance. So it's not technically a hope.,en,2025-05-25T21:04:00Z,2025-05-25 17:04:00,0,693220,13519,941,"Wed, 17 Dec 2025 11:59:50 GMT"
VMJckZFOli4,https://www.youtube.com/watch?v=VMJckZFOli4,UgxwI74BSRMhKqq5dAp4AaABAg,@georgeptolemy7260,UCK6DkKtqfOgbN7z2Ts5-0JQ,"THEY MENTIONED PRIVATE EQUITY FIRMS IN THE TRAILER, OURS GUYS RIGHT HERE",en,2025-05-23T22:23:33Z,2025-05-23 18:23:33,10,1,UgxwI74BSRMhKqq5dAp4AaABAg.AIUJvs_pg0XAJarHyaaJ4i,@beckybnyc322,UCEOwPFMTZ6agQiWzUkCSJaQ,A beautiful thing 👏🏼,NA,2025-06-20T17:09:53Z,2025-06-20 13:09:53,0,693220,13519,941,"Wed, 17 Dec 2025 11:59:50 GMT"
VMJckZFOli4,https://www.youtube.com/watch?v=VMJckZFOli4,UgxNecXmX8Ik0uSioEN4AaABAg,@stephaniegarfield2914,UCm8jCn_NTmvJk9qw3ms5Syw,Wow Stavros is such a serious and dramatic actor,en,2025-05-23T21:13:06Z,2025-05-23 17:13:06,2,1,UgxNecXmX8Ik0uSioEN4AaABAg.AIUBrqDZ1WFAJas2fS9jAe,@beckybnyc322,UCEOwPFMTZ6agQiWzUkCSJaQ,Such a natural I can name a handful of guys who could be Dave 👏🏼 they should have him pull an insurance scam or open a diner next door & I’ll be able to double that #,en,2025-06-20T17:16:32Z,2025-06-20 13:16:32,0,693220,13519,941,"Wed, 17 Dec 2025 11:59:50 GMT"
VMJckZFOli4,https://www.youtube.com/watch?v=VMJckZFOli4,Ugxga-8XL8rLHh2mFit4AaABAg,@Simon-Sjokvist1995,UC3xUma0lpf7HnYGP4HkSCuQ,1:25 is the most shane gillis look ive ever seen,en,2025-05-23T14:30:04Z,2025-05-23 10:30:04,39,1,Ugxga-8XL8rLHh2mFit4AaABAg.AITTjxr7tidAIfxsIU8bvP,@SmashAdams,UCUDKwN_t4xdCcQW0mF3mNWQ,"where' d you get that chee, danny???",en,2025-05-28T20:12:13Z,2025-05-28 16:12:13,2,693220,13519,941,"Wed, 17 Dec 2025 11:59:50 GMT"
VMJckZFOli4,https://www.youtube.com/watch?v=VMJckZFOli4,UgyTqH_AvysDQuxmRXB4AaABAg,@mikeoxlong3676,UCtT0YgpXCWEf_OsOy-VkRwg,Maybe this season will be funny.,en,2025-05-23T13:58:55Z,2025-05-23 09:58:55,0,1,UgyTqH_AvysDQuxmRXB4AaABAg.AITQAlbkHjHAIULt9Ukdol,@vandalistica,UCtAFeCUvAziq3f7-JYnMKNA,🚪,ja,2025-05-23T22:40:39Z,2025-05-23 18:40:39,0,693220,13519,941,"Wed, 17 Dec 2025 11:59:50 GMT"
VMJckZFOli4,https://www.youtube.com/watch?v=VMJckZFOli4,UgxHMH-tl5TqX6lYjrt4AaABAg,@CorpHicksUSCM,UC20zRBAF5nuPyS26fYMcI5g,I’m so aware of Shane’s real dad through his stories that when I saw Thomas Haden Church I went “Phil doesn’t look like that.”,en,2025-05-23T07:06:07Z,2025-05-23 03:06:07,3,1,UgxHMH-tl5TqX6lYjrt4AaABAg.AISfwJXbjY3AIUKea76xcW,@vandalistica,UCtAFeCUvAziq3f7-JYnMKNA,Need Phil to cameo with a trying times speech.,en,2025-05-23T22:29:56Z,2025-05-23 18:29:56,0,693220,13519,941,"Wed, 17 Dec 2025 11:59:50 GMT"
VMJckZFOli4,https://www.youtube.com/watch?v=VMJckZFOli4,UgxUz94uYjXxdDgccEh4AaABAg,@kiyaleelevyrunaya9495,UCxVv7hnYeHSEXR3s2jtw2cA,"Thìs gets a season 2? Seriously, people? Thìs is what you all watch? :/ 

...


I bet a talk show with andrew tate would score big with you people too... 🤦‍♂️ get better tastes, ffs, man. You're ruining it for everyone by looking for tv shows that mirror, or mimic, your insecurities.",en,2025-05-23T06:15:38Z,2025-05-23 02:15:38,0,1,UgxUz94uYjXxdDgccEh4AaABAg.AISa9bc83uIAISdzZDmwjL,@Chef_BoyarDiesel_Fuel,UCU9U5Qs5xA5IbgG3sbOPohQ,It’s a goofy comedy show. I don’t think anybody is watching this trailer thinking about “insecurities” besides you. Relax,en,2025-05-23T06:49:05Z,2025-05-23 02:49:05,0,693220,13519,941,"Wed, 17 Dec 2025 11:59:50 GMT"
VMJckZFOli4,https://www.youtube.com/watch?v=VMJckZFOli4,UgxI2EqwPic1JLO0G_J4AaABAg,@marzero116,UCjgK-rEpnSGLrbzCp1PUAbQ,1:40 bottom left fully committed lmao,NA,2025-05-23T00:48:54Z,2025-05-22 20:48:54,9,1,UgxI2EqwPic1JLO0G_J4AaABAg.AIS-lYmKmfJAISIj49P8Y1,@RespondifImright,UCvtYnYu59FzoPWehPmtPCGg,What chu talkin' bout Willis?,NA,2025-05-23T03:34:35Z,2025-05-22 23:34:35,0,693220,13519,941,"Wed, 17 Dec 2025 11:59:50 GMT"
VMJckZFOli4,https://www.youtube.com/watch?v=VMJckZFOli4,Ugx6t8O_MwyWS0R872J4AaABAg,@CatRichardBojangles,UCQs_76J_qlS3Fv1jvXmFGEQ,If Guard dawg and lameezy make appearances this will be the best second season of a show ever made. Add a Phil cameo and it will be the best show ever made.,en,2025-05-22T22:29:53Z,2025-05-22 18:29:53,10,1,Ugx6t8O_MwyWS0R872J4AaABAg.AIRkrP90eX4AIdyz2YClm1,@GawblinSlayer,UCZ86Tzz58Zu_cPrF7ZOiFTQ,Needs Billy and spud,en,2025-05-28T01:43:24Z,2025-05-27 21:43:24,0,693220,13519,941,"Wed, 17 Dec 2025 11:59:50 GMT"
VMJckZFOli4,https://www.youtube.com/watch?v=VMJckZFOli4,Ugx8bMeM1SE44koviMN4AaABAg,@agquote,UCFsATZlZH3PAA6c-8pdABXQ,Where’s McCusker ):,NA,2025-05-22T21:13:47Z,2025-05-22 17:13:47,0,1,Ugx8bMeM1SE44koviMN4AaABAg.AIRc8wtTWXSAIUM6IyyRp7,@vandalistica,UCtAFeCUvAziq3f7-JYnMKNA,Biking around Gay St keeping the peace.,NA,2025-05-23T22:42:35Z,2025-05-23 18:42:35,0,693220,13519,941,"Wed, 17 Dec 2025 11:59:50 GMT"
VMJckZFOli4,https://www.youtube.com/watch?v=VMJckZFOli4,Ugw-8_s2bmE2usu19-54AaABAg,@glenje,UCSFoSFtw9Iwm2E0NMNcVtNA,if you aren't excited for season 2 of Tires then chances are you have Low T.,en,2025-05-22T20:24:18Z,2025-05-22 16:24:18,2,1,Ugw-8_s2bmE2usu19-54AaABAg.AIRXUZACJWPAIVfOIBZJi_,@AntoineLefort83,UC7f6BqqVKb2jYS3S7bmf4MQ,"Or high IQ, possibly both. But definitely people who like it have low IQ.",en,2025-05-24T10:59:03Z,2025-05-24 06:59:03,0,693220,13519,941,"Wed, 17 Dec 2025 11:59:50 GMT"
VMJckZFOli4,https://www.youtube.com/watch?v=VMJckZFOli4,Ugzg-Ag5dVYC0MKtFMd4AaABAg,@ThePinkTrees,UCNkqNhhMIbWyYApU0H5pwbg,"“We are glad to hear FOXYGEN, the greatest and most underrated band of the 21st century, on a major netflix trailer. This is a good day for rock music and a good day for America.” — The Pink Trees",en,2025-05-22T19:36:30Z,2025-05-22 15:36:30,17,1,Ugzg-Ag5dVYC0MKtFMd4AaABAg.AIRS0Om_k9SAISKxmPowrt,@stephenmclean3029,UCMprI704L6WbyNjW3byoPoA,Thanks. You saved me a Google session. Loved the song and wanted to figure out the band so I could do a deep dive. Cheers!,en,2025-05-23T03:54:04Z,2025-05-22 23:54:04,1,693220,13519,941,"Wed, 17 Dec 2025 11:59:50 GMT"
VMJckZFOli4,https://www.youtube.com/watch?v=VMJckZFOli4,UgzP_Tig2UGuJQYd7T54AaABAg,@DeeboDeeJay,UCGnvOybB1kb7BnDeuFpY1Rw,was that lamaire in the booth??,en,2025-05-22T19:15:07Z,2025-05-22 15:15:07,0,1,UgzP_Tig2UGuJQYd7T54AaABAg.AIRPZpSHGU4AIULmWChdoS,@vandalistica,UCtAFeCUvAziq3f7-JYnMKNA,All black dudes look the same to you?,en,2025-05-23T22:39:45Z,2025-05-23 18:39:45,0,693220,13519,941,"Wed, 17 Dec 2025 11:59:50 GMT"
VMJckZFOli4,https://www.youtube.com/watch?v=VMJckZFOli4,UgzdamsMPRDkgdlm21J4AaABAg,@mookieentertainment6478,UC8y28tZlVJMvt1Ne0GDB52g,The first season felt like a proof of concept hopefully for this season they’ve found there comfort zone,en,2025-05-22T19:04:09Z,2025-05-22 15:04:09,22,1,UgzdamsMPRDkgdlm21J4AaABAg.AIROJZbf3dXAIUKySuNAfg,@vandalistica,UCtAFeCUvAziq3f7-JYnMKNA,"St Anthony chill, I found the new guy",NA,2025-05-23T22:32:39Z,2025-05-23 18:32:39,2,693220,13519,941,"Wed, 17 Dec 2025 11:59:50 GMT"
VMJckZFOli4,https://www.youtube.com/watch?v=VMJckZFOli4,UgzPEyy0etS5e30032B4AaABAg,@streakingclothed,UC8oAkUZ_KpDqolscGgoYrTA,omg Veronika is in tires ?! that’s amazing,NA,2025-05-22T18:27:43Z,2025-05-22 14:27:43,29,2,UgzPEyy0etS5e30032B4AaABAg.AIRK8fG8qXjAIS0ux_nHnD,@jamestener1107,UCShS4Zd-01Rd8N20pmjFtKw,Legit had to go back to make sure I saw what I saw.,en,2025-05-23T00:58:55Z,2025-05-22 20:58:55,9,693220,13519,941,"Wed, 17 Dec 2025 11:59:50 GMT"
VMJckZFOli4,https://www.youtube.com/watch?v=VMJckZFOli4,UgzPEyy0etS5e30032B4AaABAg,@streakingclothed,UC8oAkUZ_KpDqolscGgoYrTA,omg Veronika is in tires ?! that’s amazing,NA,2025-05-22T18:27:43Z,2025-05-22 14:27:43,29,2,UgzPEyy0etS5e30032B4AaABAg.AIRK8fG8qXjAISHOydN5Fy,@streakingclothed,UC8oAkUZ_KpDqolscGgoYrTA,"@jamestener1107 SAME! i had to look it up to double check, im so happy for her!",en,2025-05-23T03:22:58Z,2025-05-22 23:22:58,4,693220,13519,941,"Wed, 17 Dec 2025 11:59:50 GMT"
VMJckZFOli4,https://www.youtube.com/watch?v=VMJckZFOli4,Ugz7Tc3ciuFg9YDogJt4AaABAg,@MrThrashmonkey,UCRP6_h4tUq8g2q8dVY_wc6w,The non verbal part had me dying,en,2025-05-22T18:23:34Z,2025-05-22 14:23:34,274,2,Ugz7Tc3ciuFg9YDogJt4AaABAg.AIRJfJXVRLhAIZjPxqaGSJ,@CAUSEIMWILL,UCQ5fRPVPeV2beZ3owtjUo0w,Haha as I read this it popped up im dead 😂,en,2025-05-26T00:51:12Z,2025-05-25 20:51:12,2,693220,13519,941,"Wed, 17 Dec 2025 11:59:50 GMT"
VMJckZFOli4,https://www.youtube.com/watch?v=VMJckZFOli4,Ugz7Tc3ciuFg9YDogJt4AaABAg,@MrThrashmonkey,UCRP6_h4tUq8g2q8dVY_wc6w,The non verbal part had me dying,en,2025-05-22T18:23:34Z,2025-05-22 14:23:34,274,2,Ugz7Tc3ciuFg9YDogJt4AaABAg.AIRJfJXVRLhAIZrqGBdcAT,@yep-sb4uf,UChHvsscZXGopUZOWavcvTpQ,Best part,fr,2025-05-26T02:04:49Z,2025-05-25 22:04:49,1,693220,13519,941,"Wed, 17 Dec 2025 11:59:50 GMT"
VMJckZFOli4,https://www.youtube.com/watch?v=VMJckZFOli4,Ugw_CIU_G4OcBA1ZRol4AaABAg,@eldaveo9356,UC2is9Dv3p8r_K90RAbDtkzA,Hell yeah. The D.A.W.G.Z made it here off the back of Phil and Joannes beans.,en,2025-05-22T18:14:31Z,2025-05-22 14:14:31,1,1,Ugw_CIU_G4OcBA1ZRol4AaABAg.AIRIczEs9mrAIUMltKFUF6,@vandalistica,UCtAFeCUvAziq3f7-JYnMKNA,No dis but the lady's name is Joan,en,2025-05-23T22:48:24Z,2025-05-23 18:48:24,0,693220,13519,941,"Wed, 17 Dec 2025 11:59:50 GMT"
VMJckZFOli4,https://www.youtube.com/watch?v=VMJckZFOli4,UgwYUH_FYnV3E0vCv5l4AaABAg,@renovationkitchen724,UC9dfuoK9UgE0HAxhuuhr-0Q,Thomas Hayden Church.....YES PLEASE!,NA,2025-05-22T17:59:26Z,2025-05-22 13:59:26,0,1,UgwYUH_FYnV3E0vCv5l4AaABAg.AIRGuZwLSiNAIRPIQAExkn,@DaBladePwn,UC5mREChgJcbwOfJK-S7Fsnw,I only know him from when Norm destroyed his interview in the best way when he was on conan,en,2025-05-22T19:12:44Z,2025-05-22 15:12:44,0,693220,13519,941,"Wed, 17 Dec 2025 11:59:50 GMT"
VMJckZFOli4,https://www.youtube.com/watch?v=VMJckZFOli4,UgzxfKZ3Ce2A1dgBh0N4AaABAg,@ryanalexander984,UCcndkW5a50AHywk4EpySu1A,Shane Gillis is having the exact career Bert Kreischer always wanted.,nl,2025-05-22T17:35:02Z,2025-05-22 13:35:02,1256,39,UgzxfKZ3Ce2A1dgBh0N4AaABAg.AIRE6lz_TLKAIRVjC6llnd,@erikring8870,UCHm1-Ezr7ve73odQiBI2TJQ,Well said,ceb,2025-05-22T20:08:58Z,2025-05-22 16:08:58,35,693220,13519,941,"Wed, 17 Dec 2025 11:59:50 GMT"
VMJckZFOli4,https://www.youtube.com/watch?v=VMJckZFOli4,UgzxfKZ3Ce2A1dgBh0N4AaABAg,@ryanalexander984,UCcndkW5a50AHywk4EpySu1A,Shane Gillis is having the exact career Bert Kreischer always wanted.,nl,2025-05-22T17:35:02Z,2025-05-22 13:35:02,1256,39,UgzxfKZ3Ce2A1dgBh0N4AaABAg.AIRE6lz_TLKAIRZJahaXku,@DepthFromAbove,UCq0gyDCyOG6gT9h_j7sf04g,It’s amazing what wearing a shirt can do for someone in the entertainment business.,en,2025-05-22T20:40:17Z,2025-05-22 16:40:17,153,693220,13519,941,"Wed, 17 Dec 2025 11:59:50 GMT"
VMJckZFOli4,https://www.youtube.com/watch?v=VMJckZFOli4,UgzxfKZ3Ce2A1dgBh0N4AaABAg,@ryanalexander984,UCcndkW5a50AHywk4EpySu1A,Shane Gillis is having the exact career Bert Kreischer always wanted.,nl,2025-05-22T17:35:02Z,2025-05-22 13:35:02,1256,39,UgzxfKZ3Ce2A1dgBh0N4AaABAg.AIRE6lz_TLKAIR_ngEgC9c,@andrewschmid5917,UCG7no7Z0EpRXwNCtY1X2EXQ,He’s also getting the laughs for his jokes than Bert’s loud ass laugh at his own jokes harder than his whole audience,en,2025-05-22T20:53:16Z,2025-05-22 16:53:16,51,693220,13519,941,"Wed, 17 Dec 2025 11:59:50 GMT"
VMJckZFOli4,https://www.youtube.com/watch?v=VMJckZFOli4,UgzxfKZ3Ce2A1dgBh0N4AaABAg,@ryanalexander984,UCcndkW5a50AHywk4EpySu1A,Shane Gillis is having the exact career Bert Kreischer always wanted.,nl,2025-05-22T17:35:02Z,2025-05-22 13:35:02,1256,39,UgzxfKZ3Ce2A1dgBh0N4AaABAg.AIRE6lz_TLKAIRiV92XZVH,@KillAnthony,UCXanTu_C8sXkfPXpl6eyjIg,Damn bro youre right 😅,NA,2025-05-22T22:09:14Z,2025-05-22 18:09:14,8,693220,13519,941,"Wed, 17 Dec 2025 11:59:50 GMT"
VMJckZFOli4,https://www.youtube.com/watch?v=VMJckZFOli4,UgzxfKZ3Ce2A1dgBh0N4AaABAg,@ryanalexander984,UCcndkW5a50AHywk4EpySu1A,Shane Gillis is having the exact career Bert Kreischer always wanted.,nl,2025-05-22T17:35:02Z,2025-05-22 13:35:02,1256,39,UgzxfKZ3Ce2A1dgBh0N4AaABAg.AIRE6lz_TLKAIRkxKDjxyk,@grimmes1159,UCxe24cMHWJ9DV4fXTBqmHDA,Nailed it,fil,2025-05-22T22:30:42Z,2025-05-22 18:30:42,6,693220,13519,941,"Wed, 17 Dec 2025 11:59:50 GMT"
VMJckZFOli4,https://www.youtube.com/watch?v=VMJckZFOli4,UgzxfKZ3Ce2A1dgBh0N4AaABAg,@ryanalexander984,UCcndkW5a50AHywk4EpySu1A,Shane Gillis is having the exact career Bert Kreischer always wanted.,nl,2025-05-22T17:35:02Z,2025-05-22 13:35:02,1256,39,UgzxfKZ3Ce2A1dgBh0N4AaABAg.AIRE6lz_TLKAIRn7UT31UP,@brandonmurphy3048,UCXpqpd2wEYT50SDk8aAJ3cQ,😢 facts lol 😂,en,2025-05-22T22:49:42Z,2025-05-22 18:49:42,5,693220,13519,941,"Wed, 17 Dec 2025 11:59:50 GMT"
