video_id,video_title,channel_id,channel_title,video_published_at,reply_id,reply_parent_comment_id,reply_author_display,reply_author_channel_id,reply_text,reply_lang,reply_published_utc,reply_published_local,reply_like_count
WqQUvfsavO4,aka Charlie Sheen | Official Trailer | Netflix,UCWOA1ZGywLbqmigxE4Qlvuw,Netflix,2025-08-13T14:00:00Z,Ugwkrbx8tfxt30uCJh54AaABAg.AMDCAxZ-kteAMDgL9IiVja,Ugwkrbx8tfxt30uCJh54AaABAg,@cherylmilke313,UCNKryk7g-EhSbKiCaD7mdOQ,I never knew that just horrible if it's true and horrible if it's a lie. We will NEVER know.,en,2025-08-24T21:26:36Z,2025-08-24 17:26:36,0
WqQUvfsavO4,aka Charlie Sheen | Official Trailer | Netflix,UCWOA1ZGywLbqmigxE4Qlvuw,Netflix,2025-08-13T14:00:00Z,UgwdXPFYoN0SoDAfGhx4AaABAg.AMBqLKRwHQvAMCY1Y-JB9d,UgwdXPFYoN0SoDAfGhx4AaABAg,@RANDOMDUDERELOADED,UCOOxVPKVeIptstgYJsLctvA,You are so wrong 😂,en,2025-08-24T10:46:03Z,2025-08-24 06:46:03,0
WqQUvfsavO4,aka Charlie Sheen | Official Trailer | Netflix,UCWOA1ZGywLbqmigxE4Qlvuw,Netflix,2025-08-13T14:00:00Z,Ugz1_X5D8BCBMkNYbzt4AaABAg.AMAtIhttcjZAN7xVX9qoyg,Ugz1_X5D8BCBMkNYbzt4AaABAg,@Nutrition1995,UCQoeptMC2bwypt4hUSSZlOA,Man behind tiger blood,jv,2025-09-16T12:32:31Z,2025-09-16 08:32:31,6
WqQUvfsavO4,aka Charlie Sheen | Official Trailer | Netflix,UCWOA1ZGywLbqmigxE4Qlvuw,Netflix,2025-08-13T14:00:00Z,Ugz1_X5D8BCBMkNYbzt4AaABAg.AMAtIhttcjZAN9FmW3bT5S,Ugz1_X5D8BCBMkNYbzt4AaABAg,@kevingomez3036,UC6GeL0oI_N54040drpsWNSg,😂😂,ja,2025-09-17T00:40:14Z,2025-09-16 20:40:14,0
WqQUvfsavO4,aka Charlie Sheen | Official Trailer | Netflix,UCWOA1ZGywLbqmigxE4Qlvuw,Netflix,2025-08-13T14:00:00Z,UgwK8dcNpESvX-raJ9p4AaABAg.AMAly0vmmiqAMAw_e_RiDO,UgwK8dcNpESvX-raJ9p4AaABAg,@StankySnake,UCiY52ww17MYfH9oWODDzs6Q,You should stop wondering why you're always alone,en,2025-08-23T19:50:49Z,2025-08-23 15:50:49,1
WqQUvfsavO4,aka Charlie Sheen | Official Trailer | Netflix,UCWOA1ZGywLbqmigxE4Qlvuw,Netflix,2025-08-13T14:00:00Z,UgwK8dcNpESvX-raJ9p4AaABAg.AMAly0vmmiqAMB01d9l2Ee,UgwK8dcNpESvX-raJ9p4AaABAg,@Summerbe550,UC7U8u8ukvLiAhvSfKbTJoPw,"@StankySnakewhy does such crackies like you attack me for no reason🤣 you have hiv too or why do you feel the need to make yourself important, douche?",en,2025-08-23T20:29:43Z,2025-08-23 16:29:43,1
WqQUvfsavO4,aka Charlie Sheen | Official Trailer | Netflix,UCWOA1ZGywLbqmigxE4Qlvuw,Netflix,2025-08-13T14:00:00Z,UgxdKxwD3RB7pN8jGqZ4AaABAg.AMAZHsUexPGAMDePZmO3Fu,UgxdKxwD3RB7pN8jGqZ4AaABAg,@cherylmilke313,UCNKryk7g-EhSbKiCaD7mdOQ,Damn I don't get Netflix I love Charlie.,da,2025-08-24T21:09:44Z,2025-08-24 17:09:44,0
WqQUvfsavO4,aka Charlie Sheen | Official Trailer | Netflix,UCWOA1ZGywLbqmigxE4Qlvuw,Netflix,2025-08-13T14:00:00Z,UgwpeE344kQ5OgnBxDV4AaABAg.AMAShR2HnDhAMAwiA4OeXD,UgwpeE344kQ5OgnBxDV4AaABAg,@StankySnake,UCiY52ww17MYfH9oWODDzs6Q,"It has nearly 2 million views in A day, you're the only person who liked your comment",en,2025-08-23T19:51:58Z,2025-08-23 15:51:58,1
WqQUvfsavO4,aka Charlie Sheen | Official Trailer | Netflix,UCWOA1ZGywLbqmigxE4Qlvuw,Netflix,2025-08-13T14:00:00Z,UgxtCam7yMpHVhi8Ek54AaABAg.AMARDvwosa_AMAwpC8mJRY,UgxtCam7yMpHVhi8Ek54AaABAg,@StankySnake,UCiY52ww17MYfH9oWODDzs6Q,"Shut up WOKIE nobody, how's it feel knowing that ""dirt bag"" is worth more than you're entire next 10 generations combined, you're a loser .",en,2025-08-23T19:52:56Z,2025-08-23 15:52:56,1
WqQUvfsavO4,aka Charlie Sheen | Official Trailer | Netflix,UCWOA1ZGywLbqmigxE4Qlvuw,Netflix,2025-08-13T14:00:00Z,UgyD3FYpI_zv4Mw99-14AaABAg.AM9wXVcaJbWAQE7DAzrFiE,UgyD3FYpI_zv4Mw99-14AaABAg,@vondaniels3214,UCaSWO_ZqOHmhWYa3s_hBa0w,Corey's mum said NOTHING happened. Corey wanted the gravy train. I believe mum. ❤,NA,2025-12-02T11:35:46Z,2025-12-02 06:35:46,0
WqQUvfsavO4,aka Charlie Sheen | Official Trailer | Netflix,UCWOA1ZGywLbqmigxE4Qlvuw,Netflix,2025-08-13T14:00:00Z,UgwFXPWpwnuH545B9CB4AaABAg.AM93XfqQ2vQAQE7eUQLEEY,UgwFXPWpwnuH545B9CB4AaABAg,@vondaniels3214,UCaSWO_ZqOHmhWYa3s_hBa0w,Corey's mum said NOTHING happened.  I believe her.,NA,2025-12-02T11:39:38Z,2025-12-02 06:39:38,0
WqQUvfsavO4,aka Charlie Sheen | Official Trailer | Netflix,UCWOA1ZGywLbqmigxE4Qlvuw,Netflix,2025-08-13T14:00:00Z,UgwadIUXO-prHzxvTtV4AaABAg.AM7f5flB65nAO2UEKS3QiO,UgwadIUXO-prHzxvTtV4AaABAg,@OMW2FYB1010,UCdrQwQbHFSz_gHatS_d4k6A,shut up,NA,2025-10-09T06:03:13Z,2025-10-09 02:03:13,0
WqQUvfsavO4,aka Charlie Sheen | Official Trailer | Netflix,UCWOA1ZGywLbqmigxE4Qlvuw,Netflix,2025-08-13T14:00:00Z,UgwadIUXO-prHzxvTtV4AaABAg.AM7f5flB65nAO2ngsdLyzm,UgwadIUXO-prHzxvTtV4AaABAg,@IamKevinFinnerty,UCRA7FJEZvhm4PsX4Q536qtA,@OMW2FYB1010you shut up,NA,2025-10-09T09:02:01Z,2025-10-09 05:02:01,0
WqQUvfsavO4,aka Charlie Sheen | Official Trailer | Netflix,UCWOA1ZGywLbqmigxE4Qlvuw,Netflix,2025-08-13T14:00:00Z,Ugzfe15BO56r1-UrEy54AaABAg.AM6lWthAWwVAQE7kKRb6QF,Ugzfe15BO56r1-UrEy54AaABAg,@vondaniels3214,UCaSWO_ZqOHmhWYa3s_hBa0w,Corey's mum said NOTHING happened.  I believe her,NA,2025-12-02T11:40:25Z,2025-12-02 06:40:25,0
WqQUvfsavO4,aka Charlie Sheen | Official Trailer | Netflix,UCWOA1ZGywLbqmigxE4Qlvuw,Netflix,2025-08-13T14:00:00Z,UgwJfUEJGU4gAuFRdwd4AaABAg.AM6eplR09YvAQE7yU3e4nB,UgwJfUEJGU4gAuFRdwd4AaABAg,@vondaniels3214,UCaSWO_ZqOHmhWYa3s_hBa0w,Corey's mum said NOTHING happened.  I believe her.,NA,2025-12-02T11:42:21Z,2025-12-02 06:42:21,0
WqQUvfsavO4,aka Charlie Sheen | Official Trailer | Netflix,UCWOA1ZGywLbqmigxE4Qlvuw,Netflix,2025-08-13T14:00:00Z,Ugx88Js1WbHeS5Z1wQt4AaABAg.AM63nYTq_drAMpITh1GO94,Ugx88Js1WbHeS5Z1wQt4AaABAg,@Oohreallytho,UCaQq6VPzXZ1EIRIgSiZRA_w,💯 i doubt they will talk about that in this hollywood cult documentary and Sean Penn is a nasty piece of work.. not the best character witness lol,en,2025-09-08T21:19:42Z,2025-09-08 17:19:42,0
WqQUvfsavO4,aka Charlie Sheen | Official Trailer | Netflix,UCWOA1ZGywLbqmigxE4Qlvuw,Netflix,2025-08-13T14:00:00Z,Ugx88Js1WbHeS5Z1wQt4AaABAg.AM63nYTq_drAMvTkw6rIQn,Ugx88Js1WbHeS5Z1wQt4AaABAg,@kyank1010,UCEJkyXwT8doqqtoRicfAj1g,It is brought up in the documentary. Corey is a grifter and always has been.,en,2025-09-11T06:53:45Z,2025-09-11 02:53:45,3
WqQUvfsavO4,aka Charlie Sheen | Official Trailer | Netflix,UCWOA1ZGywLbqmigxE4Qlvuw,Netflix,2025-08-13T14:00:00Z,Ugx88Js1WbHeS5Z1wQt4AaABAg.AM63nYTq_drAN-9ASMpTKC,Ugx88Js1WbHeS5Z1wQt4AaABAg,@ShaktiFlowww,UC_SFbJWEZ9VXwo9cxgCuFvw,@kyank1010 Cory told the truth,en,2025-09-13T02:30:05Z,2025-09-12 22:30:05,3
WqQUvfsavO4,aka Charlie Sheen | Official Trailer | Netflix,UCWOA1ZGywLbqmigxE4Qlvuw,Netflix,2025-08-13T14:00:00Z,Ugx88Js1WbHeS5Z1wQt4AaABAg.AM63nYTq_drAN8UHl_AY3-,Ugx88Js1WbHeS5Z1wQt4AaABAg,@sometimesiwander7146,UCC3LKrqNzNKxBud_wovJKJQ,I believe Cory. Idk how anyone can watch this doc and not see what a total piece of crap Charlie is.  This isn’t an apology for his behavior. It’s not even him accepting responsibility and taking accountability. It’s a doc his friends did to try to clean up his image.,en,2025-09-16T17:27:44Z,2025-09-16 13:27:44,1
WqQUvfsavO4,aka Charlie Sheen | Official Trailer | Netflix,UCWOA1ZGywLbqmigxE4Qlvuw,Netflix,2025-08-13T14:00:00Z,Ugx88Js1WbHeS5Z1wQt4AaABAg.AM63nYTq_drAN_-Xgt-cpX,Ugx88Js1WbHeS5Z1wQt4AaABAg,@Fran234-h9j,UC2Ot7tPJGVqgZntNpOZaI9Q,"@sometimesiwander7146 Charlie talked about crack cocaine, a drug that is most often smoked. Charlie also told Bill Maher he did not have actual sex with men, just other stuff. So if he did not inject drugs and did not have actual sex with men, how did he contract HIV?",en,2025-09-27T09:57:46Z,2025-09-27 05:57:46,0
WqQUvfsavO4,aka Charlie Sheen | Official Trailer | Netflix,UCWOA1ZGywLbqmigxE4Qlvuw,Netflix,2025-08-13T14:00:00Z,Ugx88Js1WbHeS5Z1wQt4AaABAg.AM63nYTq_drAO2TiKkdS93,Ugx88Js1WbHeS5Z1wQt4AaABAg,@OMW2FYB1010,UCdrQwQbHFSz_gHatS_d4k6A,corey feldman is a lying piece of shit looking for attention,en,2025-10-09T05:58:43Z,2025-10-09 01:58:43,0
WqQUvfsavO4,aka Charlie Sheen | Official Trailer | Netflix,UCWOA1ZGywLbqmigxE4Qlvuw,Netflix,2025-08-13T14:00:00Z,Ugx88Js1WbHeS5Z1wQt4AaABAg.AM63nYTq_drAQE16Xc8tO0,Ugx88Js1WbHeS5Z1wQt4AaABAg,@vondaniels3214,UCaSWO_ZqOHmhWYa3s_hBa0w,What did he do to him?,en,2025-12-02T10:42:26Z,2025-12-02 05:42:26,0
WqQUvfsavO4,aka Charlie Sheen | Official Trailer | Netflix,UCWOA1ZGywLbqmigxE4Qlvuw,Netflix,2025-08-13T14:00:00Z,UgzlyS9MuWZTWdWk2B54AaABAg.AM5FHxgsq-IAMwZmQs5Wt6,UgzlyS9MuWZTWdWk2B54AaABAg,@henryodukomaiya8311,UCQW-osRhF83yoxrc3GXTT5w,yea a star with aids,en,2025-09-11T17:05:38Z,2025-09-11 13:05:38,0
WqQUvfsavO4,aka Charlie Sheen | Official Trailer | Netflix,UCWOA1ZGywLbqmigxE4Qlvuw,Netflix,2025-08-13T14:00:00Z,UgwDcrZ3pDnaqyDEUb94AaABAg.AM5ATpaszqVAM5C66fswTW,UgwDcrZ3pDnaqyDEUb94AaABAg,@RoguePanda98,UC5s-787VT-PCV0BbF3yRxhg,"Its not showing that at all, this is a man that literally let fame and money get to his head, did all these terribile things yes but he is now sober, this is not glorifying anything he has done. There's a saying that all people good or bad have a lesson to teach, this is one of them",en,2025-08-21T14:19:45Z,2025-08-21 10:19:45,0
WqQUvfsavO4,aka Charlie Sheen | Official Trailer | Netflix,UCWOA1ZGywLbqmigxE4Qlvuw,Netflix,2025-08-13T14:00:00Z,UgwsL0zHqG0hrhGi0Ex4AaABAg.AM3y0cgjPflAQE61lgDZkO,UgwsL0zHqG0hrhGi0Ex4AaABAg,@vondaniels3214,UCaSWO_ZqOHmhWYa3s_hBa0w,Corey's mum said NOTHING happened.  Mum's see this stuff. Always.  😢❤ Corey's mum told the truth but no one wants to admit it now he's gone. It's easier to keep blaming Charlie. Hypersexuality doesn't make you screw  everything that walks. It makes you wanna screw lots and lots those you love. It doesn't make you a deviot. 😢,en,2025-12-02T11:25:28Z,2025-12-02 06:25:28,0
WqQUvfsavO4,aka Charlie Sheen | Official Trailer | Netflix,UCWOA1ZGywLbqmigxE4Qlvuw,Netflix,2025-08-13T14:00:00Z,UgyFqS3gFCEfvTx_AaF4AaABAg.AM3aiZfBX0xAO2T_IShIzW,UgyFqS3gFCEfvTx_AaF4AaABAg,@OMW2FYB1010,UCdrQwQbHFSz_gHatS_d4k6A,no he didn‘t. he got enough woman come to his house willingly. he did not have to fly to some pedofile island like trump,en,2025-10-09T05:57:29Z,2025-10-09 01:57:29,0
WqQUvfsavO4,aka Charlie Sheen | Official Trailer | Netflix,UCWOA1ZGywLbqmigxE4Qlvuw,Netflix,2025-08-13T14:00:00Z,UgwLVZkLBsWCss0m-Jx4AaABAg.AM3UKS8oko8AQE6e6UFJNY,UgwLVZkLBsWCss0m-Jx4AaABAg,@vondaniels3214,UCaSWO_ZqOHmhWYa3s_hBa0w,Lol. 😅😅,uk,2025-12-02T11:30:50Z,2025-12-02 06:30:50,0
WqQUvfsavO4,aka Charlie Sheen | Official Trailer | Netflix,UCWOA1ZGywLbqmigxE4Qlvuw,Netflix,2025-08-13T14:00:00Z,UgyXqtAxo4f-WNeiewV4AaABAg.AM3SkcU1mtNAMmn5hOjOPN,UgyXqtAxo4f-WNeiewV4AaABAg,@POTOFGOLD-u6h,UC_b-AnspO67m7ld9kWuEo9w,Exactly 💯 this doc is PR to get his career back nothing more!,en,2025-09-07T21:58:19Z,2025-09-07 17:58:19,11
WqQUvfsavO4,aka Charlie Sheen | Official Trailer | Netflix,UCWOA1ZGywLbqmigxE4Qlvuw,Netflix,2025-08-13T14:00:00Z,UgyXqtAxo4f-WNeiewV4AaABAg.AM3SkcU1mtNAMqAxUtVoHP,UgyXqtAxo4f-WNeiewV4AaABAg,@venomrx6442,UCV03DSX7WiHKDlLqZ2Cn-ug,Now that Charlie talked about experimenting with men recently. I was thinking that Corey Haim even more likely happened. People dont realize when you on drugs you do some fd up shit. So very possible it was true.,en,2025-09-09T05:33:14Z,2025-09-09 01:33:14,6
WqQUvfsavO4,aka Charlie Sheen | Official Trailer | Netflix,UCWOA1ZGywLbqmigxE4Qlvuw,Netflix,2025-08-13T14:00:00Z,UgyXqtAxo4f-WNeiewV4AaABAg.AM3SkcU1mtNAMqBDp0HiNz,UgyXqtAxo4f-WNeiewV4AaABAg,@non-ofyo-business3399,UCKo-64FyLPKoYwJeNYgGr3A,Yeah no shit. It’s all b.s,zh-Latn,2025-09-09T05:35:36Z,2025-09-09 01:35:36,2
WqQUvfsavO4,aka Charlie Sheen | Official Trailer | Netflix,UCWOA1ZGywLbqmigxE4Qlvuw,Netflix,2025-08-13T14:00:00Z,UgyXqtAxo4f-WNeiewV4AaABAg.AM3SkcU1mtNAMx-KFbKa1q,UgyXqtAxo4f-WNeiewV4AaABAg,@vaibhavshukla9288,UCtPvB1H55mPtP99Uq2OP5vw,they did,en,2025-09-11T21:06:19Z,2025-09-11 17:06:19,3
WqQUvfsavO4,aka Charlie Sheen | Official Trailer | Netflix,UCWOA1ZGywLbqmigxE4Qlvuw,Netflix,2025-08-13T14:00:00Z,UgyXqtAxo4f-WNeiewV4AaABAg.AM3SkcU1mtNAMz6msI2wUP,UgyXqtAxo4f-WNeiewV4AaABAg,@Angela-el3gp,UCMaBpMs34T4APPu4gjK6cNw,​@venomrx6442I agree with you. Back in the day it was rumored that his ex wife found child porn at his house and wouldn't let the kids go over there anymore. I remember this very well.,en,2025-09-12T16:50:00Z,2025-09-12 12:50:00,0
WqQUvfsavO4,aka Charlie Sheen | Official Trailer | Netflix,UCWOA1ZGywLbqmigxE4Qlvuw,Netflix,2025-08-13T14:00:00Z,UgyXqtAxo4f-WNeiewV4AaABAg.AM3SkcU1mtNAN0vhCVWUbM,UgyXqtAxo4f-WNeiewV4AaABAg,@Sycophants_should_suffer,UCfZjkZLL-9GtSxp8hc5hIgA,"​@POTOFGOLD-u6h your comment hasn't aged well, has it? You can still delete it.",en,2025-09-13T19:02:06Z,2025-09-13 15:02:06,0
WqQUvfsavO4,aka Charlie Sheen | Official Trailer | Netflix,UCWOA1ZGywLbqmigxE4Qlvuw,Netflix,2025-08-13T14:00:00Z,UgyXqtAxo4f-WNeiewV4AaABAg.AM3SkcU1mtNAN3b5rdlnRN,UgyXqtAxo4f-WNeiewV4AaABAg,@agathajadwiszczok3503,UCyDYsIyQe3i5LHO6ND09dmQ,They did ask him!,en,2025-09-14T19:59:49Z,2025-09-14 15:59:49,0
WqQUvfsavO4,aka Charlie Sheen | Official Trailer | Netflix,UCWOA1ZGywLbqmigxE4Qlvuw,Netflix,2025-08-13T14:00:00Z,UgwWq8-7KfDYXL3MyFt4AaABAg.AM3KfT2BkwlAM3bjG-Gvbe,UgwWq8-7KfDYXL3MyFt4AaABAg,@GrimmEnt.,UC0SJth8OOljAnahvNvIwwDA,Because it's his stage name. His real name is Carlos Estévez.,en,2025-08-20T23:33:56Z,2025-08-20 19:33:56,0
WqQUvfsavO4,aka Charlie Sheen | Official Trailer | Netflix,UCWOA1ZGywLbqmigxE4Qlvuw,Netflix,2025-08-13T14:00:00Z,UgwWq8-7KfDYXL3MyFt4AaABAg.AM3KfT2BkwlAM4MK_DkQTM,UgwWq8-7KfDYXL3MyFt4AaABAg,@shefchenko111,UCO8k1M78qiJVu1F849N7I9Q,"@GrimmEnt. No, I know that :D hahahaha I mean why ""aka Charlie Sheen"". Probably because he's more famous as Charlie Harper, would be my guess.",en,2025-08-21T06:29:52Z,2025-08-21 02:29:52,0
WqQUvfsavO4,aka Charlie Sheen | Official Trailer | Netflix,UCWOA1ZGywLbqmigxE4Qlvuw,Netflix,2025-08-13T14:00:00Z,Ugw06Blbquy61vUTFr14AaABAg.AM3E9tYsNYqAMK5ljV2CbL,Ugw06Blbquy61vUTFr14AaABAg,@Shaman-py4sw,UCL_J2AryBhkeUrhP38oqJyg,"​@ethan_hunt_54no many do, many do",mg,2025-08-27T09:13:00Z,2025-08-27 05:13:00,3
WqQUvfsavO4,aka Charlie Sheen | Official Trailer | Netflix,UCWOA1ZGywLbqmigxE4Qlvuw,Netflix,2025-08-13T14:00:00Z,Ugw06Blbquy61vUTFr14AaABAg.AM3E9tYsNYqAMOjyeEEeNq,Ugw06Blbquy61vUTFr14AaABAg,@JustRezign,UCD_e7liOdwPBnzdbUbgze6g,"​@ethan_hunt_54 just because the people making the allegations are unreliable, that doesn't make the allegations untrue, but allegations are allegations until proven true or false.",en,2025-08-29T04:30:00Z,2025-08-29 00:30:00,0
WqQUvfsavO4,aka Charlie Sheen | Official Trailer | Netflix,UCWOA1ZGywLbqmigxE4Qlvuw,Netflix,2025-08-13T14:00:00Z,Ugw06Blbquy61vUTFr14AaABAg.AM3E9tYsNYqAMmAYVK3WbM,Ugw06Blbquy61vUTFr14AaABAg,@TCB_MAMA,UCXIeJo11pz6qByDMo55VkHw,"@ethan_hunt_54 Haim's mother's perspective: Corey Haim's mother, Judy Haim, and his sister Cari have consistently disputed the abuse claims involving Sheen.
In a 2017 interview on the Dr. Oz Show, Judy stated that her son ""never mentioned Charlie"" and claimed the story was ""all made up"".
In emails obtained by TheWrap in 2020, she reportedly said that the alleged rape ""never happened or else"" she would have known.
She has, at different times, accused another person of abusing her son when he was a child…. Who knows the truth",en,2025-09-07T16:12:44Z,2025-09-07 12:12:44,3
WqQUvfsavO4,aka Charlie Sheen | Official Trailer | Netflix,UCWOA1ZGywLbqmigxE4Qlvuw,Netflix,2025-08-13T14:00:00Z,Ugw06Blbquy61vUTFr14AaABAg.AM3E9tYsNYqAMz6TnhCYJn,Ugw06Blbquy61vUTFr14AaABAg,@Angela-el3gp,UCMaBpMs34T4APPu4gjK6cNw,​@ethan_hunt_54he just admitted on this netflix show that he hooked up with men. Also there were rumors back in the day that his ex wife found child porn at his house and would not let the kids go there when they were little.,en,2025-09-12T16:47:16Z,2025-09-12 12:47:16,0
WqQUvfsavO4,aka Charlie Sheen | Official Trailer | Netflix,UCWOA1ZGywLbqmigxE4Qlvuw,Netflix,2025-08-13T14:00:00Z,Ugw06Blbquy61vUTFr14AaABAg.AM3E9tYsNYqAMznMfSprfe,Ugw06Blbquy61vUTFr14AaABAg,@samdasilva1914,UC-GvW2Tn9eWaUSciSq9Ln5A,They did.,en,2025-09-12T23:10:46Z,2025-09-12 19:10:46,0
WqQUvfsavO4,aka Charlie Sheen | Official Trailer | Netflix,UCWOA1ZGywLbqmigxE4Qlvuw,Netflix,2025-08-13T14:00:00Z,Ugw06Blbquy61vUTFr14AaABAg.AM3E9tYsNYqAN1JRmIPevw,Ugw06Blbquy61vUTFr14AaABAg,@SetASpark,UCrrW0ZfMXEyGmabgkkRPvDw,​@TCB_MAMAHow would she know? She's not the one it happened to and maybe he didn't want to tell her.,en,2025-09-13T22:38:18Z,2025-09-13 18:38:18,1
WqQUvfsavO4,aka Charlie Sheen | Official Trailer | Netflix,UCWOA1ZGywLbqmigxE4Qlvuw,Netflix,2025-08-13T14:00:00Z,Ugw06Blbquy61vUTFr14AaABAg.AM3E9tYsNYqAN1snHiH9zp,Ugw06Blbquy61vUTFr14AaABAg,@ShawnThomas-e5e,UCagDAnawOBHzQlrJp8hbsHw,So they were present?,en,2025-09-14T03:55:57Z,2025-09-13 23:55:57,0
WqQUvfsavO4,aka Charlie Sheen | Official Trailer | Netflix,UCWOA1ZGywLbqmigxE4Qlvuw,Netflix,2025-08-13T14:00:00Z,Ugw06Blbquy61vUTFr14AaABAg.AM3E9tYsNYqAN2y8SEHxto,Ugw06Blbquy61vUTFr14AaABAg,@coleylucas2767,UCGGOyABWPtDOcQfAyS7f4-A,"Don’t know about the Haim stuff, but I do think that Sheen is Feldman’s father. They look identical",en,2025-09-14T14:01:54Z,2025-09-14 10:01:54,0
WqQUvfsavO4,aka Charlie Sheen | Official Trailer | Netflix,UCWOA1ZGywLbqmigxE4Qlvuw,Netflix,2025-08-13T14:00:00Z,Ugxw_yMytCR3gjlXui14AaABAg.AM3AJCTysxMAQE6G79xlu6,Ugxw_yMytCR3gjlXui14AaABAg,@vondaniels3214,UCaSWO_ZqOHmhWYa3s_hBa0w,Agreed. It was very apt and true. And dry. That's Charlie. I loved it but knew USA wouldn't.  It was too close to the bone. ❤😢😮,en,2025-12-02T11:27:25Z,2025-12-02 06:27:25,0
WqQUvfsavO4,aka Charlie Sheen | Official Trailer | Netflix,UCWOA1ZGywLbqmigxE4Qlvuw,Netflix,2025-08-13T14:00:00Z,UgylwzWr62ijPvvHT1x4AaABAg.AM31Nssxb45AN2qIova3I2,UgylwzWr62ijPvvHT1x4AaABAg,@JuhoTunkelo,UCSVF5s7tW_UNI2BZ12kp8_A,probably won't though. people can't look away with this kind of stuff,en,2025-09-14T12:53:25Z,2025-09-14 08:53:25,2
WqQUvfsavO4,aka Charlie Sheen | Official Trailer | Netflix,UCWOA1ZGywLbqmigxE4Qlvuw,Netflix,2025-08-13T14:00:00Z,UgzFrsYhp58T-bjjnKh4AaABAg.AM1R19obB__AQE7MBfd06Q,UgzFrsYhp58T-bjjnKh4AaABAg,@vondaniels3214,UCaSWO_ZqOHmhWYa3s_hBa0w,Smoking?? ❤😢,lt,2025-12-02T11:36:59Z,2025-12-02 06:36:59,0
WqQUvfsavO4,aka Charlie Sheen | Official Trailer | Netflix,UCWOA1ZGywLbqmigxE4Qlvuw,Netflix,2025-08-13T14:00:00Z,UgwucAPv0hRsroZnVBh4AaABAg.AM1OTWMh4nOAQE8AB2LpyE,UgwucAPv0hRsroZnVBh4AaABAg,@vondaniels3214,UCaSWO_ZqOHmhWYa3s_hBa0w,Corey's mum said NOTHING happened.  I believe her.  A lot of folk just after a payout. 😢,en,2025-12-02T11:44:05Z,2025-12-02 06:44:05,0
WqQUvfsavO4,aka Charlie Sheen | Official Trailer | Netflix,UCWOA1ZGywLbqmigxE4Qlvuw,Netflix,2025-08-13T14:00:00Z,UgzRgtFjwFW1UGpeS7t4AaABAg.AM1OMKbsWV0AQE7YwE-dI2,UgzRgtFjwFW1UGpeS7t4AaABAg,@vondaniels3214,UCaSWO_ZqOHmhWYa3s_hBa0w,Corey's mum said NOTHING happened.  I believe her.  ❤,NA,2025-12-02T11:38:44Z,2025-12-02 06:38:44,0
WqQUvfsavO4,aka Charlie Sheen | Official Trailer | Netflix,UCWOA1ZGywLbqmigxE4Qlvuw,Netflix,2025-08-13T14:00:00Z,UgzQjPPqXW6xKhTw9uR4AaABAg.AM1GSVlhwrKAM2KHcaXX_q,UgzQjPPqXW6xKhTw9uR4AaABAg,@bricktop.,UCpRy2f1xTlEiybnWRrcKMlg,This. Absolutely THIS.  How the hell did it never get made?????,en,2025-08-20T11:33:30Z,2025-08-20 07:33:30,0
WqQUvfsavO4,aka Charlie Sheen | Official Trailer | Netflix,UCWOA1ZGywLbqmigxE4Qlvuw,Netflix,2025-08-13T14:00:00Z,UgzQjPPqXW6xKhTw9uR4AaABAg.AM1GSVlhwrKAM6UDNKKA6l,UgzQjPPqXW6xKhTw9uR4AaABAg,@tnightwolf,UCHJAxFjsxlYouuC2_4rFdKA,You even fkn nailed the title of the movie!,en,2025-08-22T02:17:16Z,2025-08-21 22:17:16,0
WqQUvfsavO4,aka Charlie Sheen | Official Trailer | Netflix,UCWOA1ZGywLbqmigxE4Qlvuw,Netflix,2025-08-13T14:00:00Z,Ugyd2pE8aMzyNS6WHIN4AaABAg.AM1EYjMjfAnAMHgiAAWxOm,Ugyd2pE8aMzyNS6WHIN4AaABAg,@juliaunicorn1581,UC542aNQwQeu1MIKYY7I8NLQ,This clip was from 2014,en,2025-08-26T10:46:52Z,2025-08-26 06:46:52,0
WqQUvfsavO4,aka Charlie Sheen | Official Trailer | Netflix,UCWOA1ZGywLbqmigxE4Qlvuw,Netflix,2025-08-13T14:00:00Z,Ugyd2pE8aMzyNS6WHIN4AaABAg.AM1EYjMjfAnAN8Xjdi19Xi,Ugyd2pE8aMzyNS6WHIN4AaABAg,@sometimesiwander7146,UCC3LKrqNzNKxBud_wovJKJQ,I’d find it hard to believe he’s had 7 minutes of sobriety honestly.,en,2025-09-16T17:57:54Z,2025-09-16 13:57:54,1
WqQUvfsavO4,aka Charlie Sheen | Official Trailer | Netflix,UCWOA1ZGywLbqmigxE4Qlvuw,Netflix,2025-08-13T14:00:00Z,UgzHwcFcl2-YuClr4il4AaABAg.AM0wQm2N6i2AMFNnLgRC_o,UgzHwcFcl2-YuClr4il4AaABAg,@danitaharris9919,UCJU69j3DSGyyB_yhgk5IHPQ,What are you a cop?😂,en,2025-08-25T13:14:19Z,2025-08-25 09:14:19,22
WqQUvfsavO4,aka Charlie Sheen | Official Trailer | Netflix,UCWOA1ZGywLbqmigxE4Qlvuw,Netflix,2025-08-13T14:00:00Z,UgzHwcFcl2-YuClr4il4AaABAg.AM0wQm2N6i2AMHPXFT3kbS,UgzHwcFcl2-YuClr4il4AaABAg,@umm2012,UCWeZ6EQ1Nv_yYUTflpgFUEw,@danitaharris9919 I mean I'm not gonna unroll the damn things and put them on for you 🤣,en,2025-08-26T08:07:56Z,2025-08-26 04:07:56,9
WqQUvfsavO4,aka Charlie Sheen | Official Trailer | Netflix,UCWOA1ZGywLbqmigxE4Qlvuw,Netflix,2025-08-13T14:00:00Z,UgzHwcFcl2-YuClr4il4AaABAg.AM0wQm2N6i2AMHTyED6-ET,UgzHwcFcl2-YuClr4il4AaABAg,@danitaharris9919,UCJU69j3DSGyyB_yhgk5IHPQ,​@umm2012 Charlie and Russell have good banter. 🤣🤣🤣🤣,en,2025-08-26T08:46:42Z,2025-08-26 04:46:42,0
WqQUvfsavO4,aka Charlie Sheen | Official Trailer | Netflix,UCWOA1ZGywLbqmigxE4Qlvuw,Netflix,2025-08-13T14:00:00Z,UgzHwcFcl2-YuClr4il4AaABAg.AM0wQm2N6i2AMZkFNxwKSz,UgzHwcFcl2-YuClr4il4AaABAg,@Fahlahlahlahlaaaahhhhhh,UChaLI5k-rrd2x65-GwcxlKQ,I loved it!,NA,2025-09-02T11:04:04Z,2025-09-02 07:04:04,1
WqQUvfsavO4,aka Charlie Sheen | Official Trailer | Netflix,UCWOA1ZGywLbqmigxE4Qlvuw,Netflix,2025-08-13T14:00:00Z,UgzHwcFcl2-YuClr4il4AaABAg.AM0wQm2N6i2AMZktE_mZKU,UgzHwcFcl2-YuClr4il4AaABAg,@danitaharris9919,UCJU69j3DSGyyB_yhgk5IHPQ,​@Fahlahlahlahlaaaahhhhhhhahaha hahahaha 😅,fi,2025-09-02T11:09:38Z,2025-09-02 07:09:38,0
WqQUvfsavO4,aka Charlie Sheen | Official Trailer | Netflix,UCWOA1ZGywLbqmigxE4Qlvuw,Netflix,2025-08-13T14:00:00Z,UgzHwcFcl2-YuClr4il4AaABAg.AM0wQm2N6i2ANMNxpg_wig,UgzHwcFcl2-YuClr4il4AaABAg,@jackjackson721,UCkVFAfB3VIcY74u_Rtwm6Dw,"""What are you, a cop?""",en,2025-09-22T03:01:49Z,2025-09-21 23:01:49,0
WqQUvfsavO4,aka Charlie Sheen | Official Trailer | Netflix,UCWOA1ZGywLbqmigxE4Qlvuw,Netflix,2025-08-13T14:00:00Z,UgzHwcFcl2-YuClr4il4AaABAg.AM0wQm2N6i2ANhSb71wlaR,UgzHwcFcl2-YuClr4il4AaABAg,@Flyrighton79,UCO2E5gHZnDG5mbM8PHtdGew,Charlie Sheen is the poster child for “white privileged” u can’t argue after watching this.,en,2025-09-30T16:45:42Z,2025-09-30 12:45:42,0
WqQUvfsavO4,aka Charlie Sheen | Official Trailer | Netflix,UCWOA1ZGywLbqmigxE4Qlvuw,Netflix,2025-08-13T14:00:00Z,Ugz8Mp2_I1WC9sCivWt4AaABAg.AM0Vaicg3GeAMDeiiKVgfe,Ugz8Mp2_I1WC9sCivWt4AaABAg,@cherylmilke313,UCNKryk7g-EhSbKiCaD7mdOQ,Yea bring it on all of it.,en,2025-08-24T21:12:29Z,2025-08-24 17:12:29,0
WqQUvfsavO4,aka Charlie Sheen | Official Trailer | Netflix,UCWOA1ZGywLbqmigxE4Qlvuw,Netflix,2025-08-13T14:00:00Z,UgxKjPN-6NbJOsLud-54AaABAg.AM08gSgIgJ2AM0DeNg8vwL,UgxKjPN-6NbJOsLud-54AaABAg,@GrimmEnt.,UC0SJth8OOljAnahvNvIwwDA,And yet here you are.,en,2025-08-19T15:57:06Z,2025-08-19 11:57:06,0
WqQUvfsavO4,aka Charlie Sheen | Official Trailer | Netflix,UCWOA1ZGywLbqmigxE4Qlvuw,Netflix,2025-08-13T14:00:00Z,UgzFd-5c-9VUpQH-T5R4AaABAg.AM-Y8m0nxwqAMw6W6BulUy,UgzFd-5c-9VUpQH-T5R4AaABAg,@markm-qf2fn,UCyw8QW2yuYWIBdASf0FR87A,Under 60 old,de,2025-09-11T12:49:51Z,2025-09-11 08:49:51,0
WqQUvfsavO4,aka Charlie Sheen | Official Trailer | Netflix,UCWOA1ZGywLbqmigxE4Qlvuw,Netflix,2025-08-13T14:00:00Z,UgzFd-5c-9VUpQH-T5R4AaABAg.AM-Y8m0nxwqAMw6aMf0zha,UgzFd-5c-9VUpQH-T5R4AaABAg,@markm-qf2fn,UCyw8QW2yuYWIBdASf0FR87A,"Was end 50 interwiew trump biden 20 jears older 

Was biden when this guy is old",NA,2025-09-11T12:50:34Z,2025-09-11 08:50:34,0
WqQUvfsavO4,aka Charlie Sheen | Official Trailer | Netflix,UCWOA1ZGywLbqmigxE4Qlvuw,Netflix,2025-08-13T14:00:00Z,UgzFd-5c-9VUpQH-T5R4AaABAg.AM-Y8m0nxwqAMw6bqyLfnZ,UgzFd-5c-9VUpQH-T5R4AaABAg,@markm-qf2fn,UCyw8QW2yuYWIBdASf0FR87A,End 50 is not very old,en,2025-09-11T12:50:47Z,2025-09-11 08:50:47,0
