video_id,video_title,channel_id,channel_title,video_published_at,reply_id,reply_parent_comment_id,reply_author_display,reply_author_channel_id,reply_text,reply_lang,reply_published_utc,reply_published_local,reply_like_count
WqQUvfsavO4,aka Charlie Sheen | Official Trailer | Netflix,UCWOA1ZGywLbqmigxE4Qlvuw,Netflix,2025-08-13T14:00:00Z,UgyvB0_ZyP53QYbibQh4AaABAg.ANl7XvfuEfvAQE5JTDUBr2,UgyvB0_ZyP53QYbibQh4AaABAg,@vondaniels3214,UCaSWO_ZqOHmhWYa3s_hBa0w,👍 ❤Agreed.,en,2025-12-02T11:19:09Z,2025-12-02 06:19:09,0
WqQUvfsavO4,aka Charlie Sheen | Official Trailer | Netflix,UCWOA1ZGywLbqmigxE4Qlvuw,Netflix,2025-08-13T14:00:00Z,Ugx69NNdd-f_SCEH1f14AaABAg.ANkGC9YA3cEANpo7E7-Qde,Ugx69NNdd-f_SCEH1f14AaABAg,@JeffreyMarksCosmos,UCW-3sSFwngUD8J08tKAKTSQ,You know that's made up BS right? You're hating a guy for something that never even happened,en,2025-10-03T22:36:23Z,2025-10-03 18:36:23,0
WqQUvfsavO4,aka Charlie Sheen | Official Trailer | Netflix,UCWOA1ZGywLbqmigxE4Qlvuw,Netflix,2025-08-13T14:00:00Z,Ugx69NNdd-f_SCEH1f14AaABAg.ANkGC9YA3cEANprDU3PWVX,Ugx69NNdd-f_SCEH1f14AaABAg,@underscorejojo,UCUVdebF0WrU7iyWVH7bRlBw,"​@JeffreyMarksCosmos Believe  what you want to believe. Haim never said it publicly, he only told his friend in confidence. Why would he make up a lie if he had nothing to gain from it?",en,2025-10-03T23:03:27Z,2025-10-03 19:03:27,0
WqQUvfsavO4,aka Charlie Sheen | Official Trailer | Netflix,UCWOA1ZGywLbqmigxE4Qlvuw,Netflix,2025-08-13T14:00:00Z,Ugx69NNdd-f_SCEH1f14AaABAg.ANkGC9YA3cEANptDtlsD9Y,Ugx69NNdd-f_SCEH1f14AaABAg,@JeffreyMarksCosmos,UCW-3sSFwngUD8J08tKAKTSQ,"​@underscorejojopeople like ALL THE TIME with nothing to gain. The hell are you talking about. I will believe what I want. But go on hating some one for something that never happened, doesn't matter to me. You have a great day !!!",en,2025-10-03T23:20:59Z,2025-10-03 19:20:59,0
WqQUvfsavO4,aka Charlie Sheen | Official Trailer | Netflix,UCWOA1ZGywLbqmigxE4Qlvuw,Netflix,2025-08-13T14:00:00Z,Ugx69NNdd-f_SCEH1f14AaABAg.ANkGC9YA3cEAOWqGAB3zkY,Ugx69NNdd-f_SCEH1f14AaABAg,@allisonslocum6948,UCu1gyUZOUl80NcXIyeEd7fg,@JeffreyMarksCosmosthere’s no way to prove if he did or not. He may have or he may not have,en,2025-10-21T01:01:40Z,2025-10-20 21:01:40,0
WqQUvfsavO4,aka Charlie Sheen | Official Trailer | Netflix,UCWOA1ZGywLbqmigxE4Qlvuw,Netflix,2025-08-13T14:00:00Z,Ugxf0jK_ZKwxFEFgsgh4AaABAg.ANHHesbL66bANMrMa3uiNa,Ugxf0jK_ZKwxFEFgsgh4AaABAg,@thesummerland6165,UCA5REcpM8Jl3oGl1BHIrsqQ,"so sorry for your loss, very kind of you",en,2025-09-22T07:27:29Z,2025-09-22 03:27:29,4
WqQUvfsavO4,aka Charlie Sheen | Official Trailer | Netflix,UCWOA1ZGywLbqmigxE4Qlvuw,Netflix,2025-08-13T14:00:00Z,UgzIta1mCZB4F_mW8Sh4AaABAg.ANFaiYw9S-4AQE6s7Ls2Wo,UgzIta1mCZB4F_mW8Sh4AaABAg,@vondaniels3214,UCaSWO_ZqOHmhWYa3s_hBa0w,Agreed. ❤❤,en,2025-12-02T11:32:45Z,2025-12-02 06:32:45,0
WqQUvfsavO4,aka Charlie Sheen | Official Trailer | Netflix,UCWOA1ZGywLbqmigxE4Qlvuw,Netflix,2025-08-13T14:00:00Z,UgwviOW7luTSz0nEm9Z4AaABAg.ANEl08FLRqNAQE5YAWhJc1,UgwviOW7luTSz0nEm9Z4AaABAg,@vondaniels3214,UCaSWO_ZqOHmhWYa3s_hBa0w,❤❤❤❤❤❤❤❤❤❤❤❤,ja,2025-12-02T11:21:09Z,2025-12-02 06:21:09,0
WqQUvfsavO4,aka Charlie Sheen | Official Trailer | Netflix,UCWOA1ZGywLbqmigxE4Qlvuw,Netflix,2025-08-13T14:00:00Z,Ugx-Z6H9TFH9RZT0fR14AaABAg.ANBPHlJSWyHANdL0_BROmA,Ugx-Z6H9TFH9RZT0fR14AaABAg,@Andrea962nd,UCedd9m528koiCwzuxs7PTOg,Exactly my thoughts! There is a BIG piece we are missing here.,en,2025-09-29T02:22:27Z,2025-09-28 22:22:27,0
WqQUvfsavO4,aka Charlie Sheen | Official Trailer | Netflix,UCWOA1ZGywLbqmigxE4Qlvuw,Netflix,2025-08-13T14:00:00Z,UgwRxBK0BcoMuaEVsPZ4AaABAg.AN9tEErWxQaAN9tYbKL9pS,UgwRxBK0BcoMuaEVsPZ4AaABAg,@arsenioseslpodcast3143,UCIzp4EdbJVMhhSnq_0u4ntA,Peckerwood as in white people,en,2025-09-17T06:36:28Z,2025-09-17 02:36:28,1
WqQUvfsavO4,aka Charlie Sheen | Official Trailer | Netflix,UCWOA1ZGywLbqmigxE4Qlvuw,Netflix,2025-08-13T14:00:00Z,Ugw5OZQPmchhQg6KqKN4AaABAg.AN945oRfaVGAN9vpFWmWNB,Ugw5OZQPmchhQg6KqKN4AaABAg,@pagliaccinodlemantra,UCAaKGRCW8cP69a7HA91IJFQ,Yes!,en,2025-09-17T06:56:21Z,2025-09-17 02:56:21,0
WqQUvfsavO4,aka Charlie Sheen | Official Trailer | Netflix,UCWOA1ZGywLbqmigxE4Qlvuw,Netflix,2025-08-13T14:00:00Z,Ugw5OZQPmchhQg6KqKN4AaABAg.AN945oRfaVGANKBLqxtLg4,Ugw5OZQPmchhQg6KqKN4AaABAg,@soliniv1411,UCgNE9FGSW178OO-IerGeKfw,Sign me up for that,en,2025-09-21T06:33:09Z,2025-09-21 02:33:09,0
WqQUvfsavO4,aka Charlie Sheen | Official Trailer | Netflix,UCWOA1ZGywLbqmigxE4Qlvuw,Netflix,2025-08-13T14:00:00Z,Ugw5kUk3zlrGmDnSuWl4AaABAg.AN6R9e4onOdAN6bovGPgM1,Ugw5kUk3zlrGmDnSuWl4AaABAg,@ElliotAlderson-cg2qk,UCX16xskJ8VtISZOG_fj43Ng,Are u referring to ur Dad??,NA,2025-09-16T00:03:50Z,2025-09-15 20:03:50,1
WqQUvfsavO4,aka Charlie Sheen | Official Trailer | Netflix,UCWOA1ZGywLbqmigxE4Qlvuw,Netflix,2025-08-13T14:00:00Z,UgzXaLF6pYFIO-sHyGZ4AaABAg.AN2yHwiZXKRAN4uEFDzpXD,UgzXaLF6pYFIO-sHyGZ4AaABAg,@Eeuu-r2e,UCeYyZhDJDBqbdNdasQuKLfQ,Lo violo,es,2025-09-15T08:06:14Z,2025-09-15 04:06:14,0
WqQUvfsavO4,aka Charlie Sheen | Official Trailer | Netflix,UCWOA1ZGywLbqmigxE4Qlvuw,Netflix,2025-08-13T14:00:00Z,Ugz_74x5ao8DufHpC3F4AaABAg.AN0z9pGG_SPAN3Ug_2dTVl,Ugz_74x5ao8DufHpC3F4AaABAg,@KruimeltjeLief,UCT9TnzLeklqRifkgEf9PCHA,That goes for all women 😂,en,2025-09-14T18:55:04Z,2025-09-14 14:55:04,0
WqQUvfsavO4,aka Charlie Sheen | Official Trailer | Netflix,UCWOA1ZGywLbqmigxE4Qlvuw,Netflix,2025-08-13T14:00:00Z,Ugz_74x5ao8DufHpC3F4AaABAg.AN0z9pGG_SPAN3_-Xb6kyj,Ugz_74x5ao8DufHpC3F4AaABAg,@NatureIsWithin,UCYaXKdevqcyKiEGCYfXUBVQ,@KruimeltjeLiefhave to disagree with that one. Some suit it all too well 😂,en,2025-09-14T19:41:29Z,2025-09-14 15:41:29,1
WqQUvfsavO4,aka Charlie Sheen | Official Trailer | Netflix,UCWOA1ZGywLbqmigxE4Qlvuw,Netflix,2025-08-13T14:00:00Z,Ugz_74x5ao8DufHpC3F4AaABAg.AN0z9pGG_SPAN4MIjxS4xH,Ugz_74x5ao8DufHpC3F4AaABAg,@KruimeltjeLief,UCT9TnzLeklqRifkgEf9PCHA,@NatureIsWithin😂😂💯💯,fi,2025-09-15T03:01:00Z,2025-09-14 23:01:00,0
WqQUvfsavO4,aka Charlie Sheen | Official Trailer | Netflix,UCWOA1ZGywLbqmigxE4Qlvuw,Netflix,2025-08-13T14:00:00Z,Ugyal5ZKBGUR9JPU_Ut4AaABAg.AMyl7P_8aKbANBDx2UuPsi,Ugyal5ZKBGUR9JPU_Ut4AaABAg,@annab306,UCz8kLPtfRLAkJAtmFGjryBg,"Im more surprised what she went through with him and still supported him. His new kids, making food for him and his prostitutes, She have a good heart.",en,2025-09-17T19:02:41Z,2025-09-17 15:02:41,1
WqQUvfsavO4,aka Charlie Sheen | Official Trailer | Netflix,UCWOA1ZGywLbqmigxE4Qlvuw,Netflix,2025-08-13T14:00:00Z,Ugyal5ZKBGUR9JPU_Ut4AaABAg.AMyl7P_8aKbANNUOyY8Ov9,Ugyal5ZKBGUR9JPU_Ut4AaABAg,@maya-jh6iw,UCvvnLUNqseQDEF7Piu-fLXQ,Disgusting comment,en,2025-09-22T13:17:20Z,2025-09-22 09:17:20,0
WqQUvfsavO4,aka Charlie Sheen | Official Trailer | Netflix,UCWOA1ZGywLbqmigxE4Qlvuw,Netflix,2025-08-13T14:00:00Z,Ugyal5ZKBGUR9JPU_Ut4AaABAg.AMyl7P_8aKbAQE546FAf9w,Ugyal5ZKBGUR9JPU_Ut4AaABAg,@vondaniels3214,UCaSWO_ZqOHmhWYa3s_hBa0w,Not surprised. She is a Hollywood lady. That's what they do. 😮😢,en,2025-12-02T11:17:03Z,2025-12-02 06:17:03,0
WqQUvfsavO4,aka Charlie Sheen | Official Trailer | Netflix,UCWOA1ZGywLbqmigxE4Qlvuw,Netflix,2025-08-13T14:00:00Z,Ugx_CX2vUM3257jVpX94AaABAg.AMyLGBA7zzXAMyOrfNqkuz,Ugx_CX2vUM3257jVpX94AaABAg,@OffTheGirdlifestyle,UCmoMFeBLQq3-qm5eGIsw_Vw,So Charlie was one that touched him not michael and all these years later he wants to says something,en,2025-09-12T10:08:42Z,2025-09-12 06:08:42,1
WqQUvfsavO4,aka Charlie Sheen | Official Trailer | Netflix,UCWOA1ZGywLbqmigxE4Qlvuw,Netflix,2025-08-13T14:00:00Z,Ugx_CX2vUM3257jVpX94AaABAg.AMyLGBA7zzXAMyeNkJIWYQ,Ugx_CX2vUM3257jVpX94AaABAg,@peterwolff9344,UCyPBIkwy7kVQQmFgxlVIrgw,"@OffTheGirdlifestyleexcatly. Corey feldman, Macaulay Culkin never had a bad word to say about Michael Jackson. 
It seems Michael may have been abused himself and was a protector of children. 
I dont know. But what I DO KNOW IS. 
There is something rotten about the timing with Corey feldman and many others statements and the sudden Charlie Sheen on Netflix and Joe Rogan. 
I belive Joe Rogan is being used/played to get fokus on the new narretive/misdrection. 
People only see netflix and JRE they dont see the truth. 
I hope Joe Rogan wakes up. 
I use to love Charlie Sheen he was my favorite actor. Now I KNOW and like Robert Deniro Charlie is a bad bad narsicistic creep",en,2025-09-12T12:33:02Z,2025-09-12 08:33:02,0
WqQUvfsavO4,aka Charlie Sheen | Official Trailer | Netflix,UCWOA1ZGywLbqmigxE4Qlvuw,Netflix,2025-08-13T14:00:00Z,UgypDARwdRf79eTx5ox4AaABAg.AMxjHo4v3kNAQE7VzPxTtJ,UgypDARwdRf79eTx5ox4AaABAg,@vondaniels3214,UCaSWO_ZqOHmhWYa3s_hBa0w,😅😅😅😅😅😅😅😅😅,ja,2025-12-02T11:38:20Z,2025-12-02 06:38:20,0
WqQUvfsavO4,aka Charlie Sheen | Official Trailer | Netflix,UCWOA1ZGywLbqmigxE4Qlvuw,Netflix,2025-08-13T14:00:00Z,UgwolXTOY1bhe84JC2F4AaABAg.AMw2qk1OOudAQE29nXArKF,UgwolXTOY1bhe84JC2F4AaABAg,@vondaniels3214,UCaSWO_ZqOHmhWYa3s_hBa0w,I don't think he needs any more. It will pull him down again. He has an addictive personality. He's lovely but he needs to stay home and grow old.  Fate has given him another life chance. Let's not see him blow it. Next time he's dead. I'd rather his kids get to grow up with their dad. ❤❤,en,2025-12-02T10:51:36Z,2025-12-02 05:51:36,1
WqQUvfsavO4,aka Charlie Sheen | Official Trailer | Netflix,UCWOA1ZGywLbqmigxE4Qlvuw,Netflix,2025-08-13T14:00:00Z,UgxwH7oy3d6_0ngKrSt4AaABAg.AMv3bunegfCAMvFWt2CTDf,UgxwH7oy3d6_0ngKrSt4AaABAg,@ronburgundy3172,UC8Ym3eGEUMEsyyXe2nKJuVw,the difference between him and RDJ he aparenlty didn't harm anyone under the influence and he does seem remorseful for his drug addiction and has managed to come out on top where as Charlie doesn't seem to have any shame and his career is in the trash,en,2025-09-11T04:49:22Z,2025-09-11 00:49:22,1
WqQUvfsavO4,aka Charlie Sheen | Official Trailer | Netflix,UCWOA1ZGywLbqmigxE4Qlvuw,Netflix,2025-08-13T14:00:00Z,UgxwH7oy3d6_0ngKrSt4AaABAg.AMv3bunegfCAMwfRjdeliD,UgxwH7oy3d6_0ngKrSt4AaABAg,@misstreas84,UCvULbm8gol5hBqPLPI3sOrw,@ronburgundy3172LOL TRUE!,NA,2025-09-11T18:03:50Z,2025-09-11 14:03:50,0
WqQUvfsavO4,aka Charlie Sheen | Official Trailer | Netflix,UCWOA1ZGywLbqmigxE4Qlvuw,Netflix,2025-08-13T14:00:00Z,UgxwH7oy3d6_0ngKrSt4AaABAg.AMv3bunegfCANslEU2J--v,UgxwH7oy3d6_0ngKrSt4AaABAg,@homermontana2392,UCh5fzG2hx5DJUifd3rYQgxw,@misstreas84 Robert doesn't talk about his past he left a interview because he was asked about his addiction by a british reporter,en,2025-10-05T02:08:53Z,2025-10-04 22:08:53,1
WqQUvfsavO4,aka Charlie Sheen | Official Trailer | Netflix,UCWOA1ZGywLbqmigxE4Qlvuw,Netflix,2025-08-13T14:00:00Z,UgzsX_NEes9JHvPRsE14AaABAg.AMuueASWxisAMvFb9AI_hW,UgzsX_NEes9JHvPRsE14AaABAg,@ronburgundy3172,UC8Ym3eGEUMEsyyXe2nKJuVw,despite all the things that happened to him he hasn't learn humility one bit he seems like if he recoup the money he blew he'd go through it all over again,en,2025-09-11T04:50:05Z,2025-09-11 00:50:05,2
WqQUvfsavO4,aka Charlie Sheen | Official Trailer | Netflix,UCWOA1ZGywLbqmigxE4Qlvuw,Netflix,2025-08-13T14:00:00Z,UgzsX_NEes9JHvPRsE14AaABAg.AMuueASWxisAN8W3X-UiuY,UgzsX_NEes9JHvPRsE14AaABAg,@sometimesiwander7146,UCC3LKrqNzNKxBud_wovJKJQ,Agreed. He’s disgusting.  And it blows my mind how many ppl believe he’s A) sober 8 years B) worth a damn.  What a sad excuse for a human being.  Classic narcissist.,en,2025-09-16T17:43:16Z,2025-09-16 13:43:16,1
WqQUvfsavO4,aka Charlie Sheen | Official Trailer | Netflix,UCWOA1ZGywLbqmigxE4Qlvuw,Netflix,2025-08-13T14:00:00Z,Ugw_zgD42XpQSq_tbSp4AaABAg.AMuqA1yXuB3AMuxcjern3Q,Ugw_zgD42XpQSq_tbSp4AaABAg,@snowcattish,UCJq1KzVlze34vtTJan1TwwQ,"You do realize Martin Sheen raised 3 other children that weren't drug addicts, sex addicts, getting arrested or having an 18 month long public nervous breakdown? 

I'm a huge Charlie Sheen fan but Martin Sheen is the reason Charlie survived his drug addiction.",en,2025-09-11T02:04:17Z,2025-09-10 22:04:17,3
WqQUvfsavO4,aka Charlie Sheen | Official Trailer | Netflix,UCWOA1ZGywLbqmigxE4Qlvuw,Netflix,2025-08-13T14:00:00Z,UgwgIXZl_uNtg2dHIFd4AaABAg.AMuiMpQksFhAMv3kYHtZ6y,UgwgIXZl_uNtg2dHIFd4AaABAg,@misstreas84,UCvULbm8gol5hBqPLPI3sOrw,right! her twitching and the fact she thought he was on footloose lol,en,2025-09-11T03:06:31Z,2025-09-10 23:06:31,1
WqQUvfsavO4,aka Charlie Sheen | Official Trailer | Netflix,UCWOA1ZGywLbqmigxE4Qlvuw,Netflix,2025-08-13T14:00:00Z,UgyNRW0NiVNXe8-Ih7p4AaABAg.AMuftcWs0RjAQE5a8-d8aP,UgyNRW0NiVNXe8-Ih7p4AaABAg,@vondaniels3214,UCaSWO_ZqOHmhWYa3s_hBa0w,❤❤❤❤❤❤❤❤❤❤❤,ja,2025-12-02T11:21:33Z,2025-12-02 06:21:33,0
WqQUvfsavO4,aka Charlie Sheen | Official Trailer | Netflix,UCWOA1ZGywLbqmigxE4Qlvuw,Netflix,2025-08-13T14:00:00Z,UgwvWv96of3yulaKC3R4AaABAg.AMudvZrzuMrAMv3y2ArEwR,UgwvWv96of3yulaKC3R4AaABAg,@misstreas84,UCvULbm8gol5hBqPLPI3sOrw,"You are so judgmental and uneducated about the whole story, how old are you? everything was facts do your research<!",en,2025-09-11T03:08:21Z,2025-09-10 23:08:21,2
WqQUvfsavO4,aka Charlie Sheen | Official Trailer | Netflix,UCWOA1ZGywLbqmigxE4Qlvuw,Netflix,2025-08-13T14:00:00Z,Ugy6aIqaLvjxMB1JGa54AaABAg.AMuGUgUI1hcAMvFqEJfez3,Ugy6aIqaLvjxMB1JGa54AaABAg,@ronburgundy3172,UC8Ym3eGEUMEsyyXe2nKJuVw,curious he wouldn't go into the way he was raised or the mishaps that happened in all of his relationships or where the rage came from when he was on drugs,en,2025-09-11T04:52:09Z,2025-09-11 00:52:09,1
WqQUvfsavO4,aka Charlie Sheen | Official Trailer | Netflix,UCWOA1ZGywLbqmigxE4Qlvuw,Netflix,2025-08-13T14:00:00Z,UgyZ_HXzi4u8O5V9ozZ4AaABAg.AMuDMbehLM4AMzn3yMyaP_,UgyZ_HXzi4u8O5V9ozZ4AaABAg,@lampenfieber,UCkslGx6r9SDAdqrB8qvCtJg,Chat gbt ahh comment,NA,2025-09-12T23:08:13Z,2025-09-12 19:08:13,1
WqQUvfsavO4,aka Charlie Sheen | Official Trailer | Netflix,UCWOA1ZGywLbqmigxE4Qlvuw,Netflix,2025-08-13T14:00:00Z,UgyZ_HXzi4u8O5V9ozZ4AaABAg.AMuDMbehLM4AQE0q_xuaC-,UgyZ_HXzi4u8O5V9ozZ4AaABAg,@vondaniels3214,UCaSWO_ZqOHmhWYa3s_hBa0w,👍 Agreed.,en,2025-12-02T10:40:07Z,2025-12-02 05:40:07,0
WqQUvfsavO4,aka Charlie Sheen | Official Trailer | Netflix,UCWOA1ZGywLbqmigxE4Qlvuw,Netflix,2025-08-13T14:00:00Z,Ugxkbio7WCZwH28t1SN4AaABAg.AMtQeaSTWJlAMtSjI0qaiD,Ugxkbio7WCZwH28t1SN4AaABAg,@wes3044,UCpTggdCKzOxervj7on84Crw,Oo you believe that bullocks do ya go back to bed son 🤦🤦,NA,2025-09-10T12:06:19Z,2025-09-10 08:06:19,0
WqQUvfsavO4,aka Charlie Sheen | Official Trailer | Netflix,UCWOA1ZGywLbqmigxE4Qlvuw,Netflix,2025-08-13T14:00:00Z,UgyovbMgKeVmoh4NM6R4AaABAg.AMsp0BQPYmbAN7xwngItKq,UgyovbMgKeVmoh4NM6R4AaABAg,@kaloyan964,UCd0dJWbWt2ESnyVgbZ3WB5w,"He has a lot of class in him, but he doesn't do classy things if you know what i mean",en,2025-09-16T12:36:23Z,2025-09-16 08:36:23,0
WqQUvfsavO4,aka Charlie Sheen | Official Trailer | Netflix,UCWOA1ZGywLbqmigxE4Qlvuw,Netflix,2025-08-13T14:00:00Z,Ugwy1JYSVcuFNTROSnV4AaABAg.AMrHPlW5c9wAQE70_slQ1b,Ugwy1JYSVcuFNTROSnV4AaABAg,@vondaniels3214,UCaSWO_ZqOHmhWYa3s_hBa0w,Corey's mum said NOTHING happened.  Mums know and see these things. I believe her. Corey was after the gravy train. 😢😢,en,2025-12-02T11:34:02Z,2025-12-02 06:34:02,0
WqQUvfsavO4,aka Charlie Sheen | Official Trailer | Netflix,UCWOA1ZGywLbqmigxE4Qlvuw,Netflix,2025-08-13T14:00:00Z,Ugx8qDmUq-9W1ZoL29h4AaABAg.AMpXpBuoXhHAMqJIZGDd-F,Ugx8qDmUq-9W1ZoL29h4AaABAg,@goodstar8065,UCtqBi1tbxMcKrv3rAFKznLw,Just a “bad look”. Dude stole a minors virginity and traumatized him.,en,2025-09-09T06:46:09Z,2025-09-09 02:46:09,1
WqQUvfsavO4,aka Charlie Sheen | Official Trailer | Netflix,UCWOA1ZGywLbqmigxE4Qlvuw,Netflix,2025-08-13T14:00:00Z,Ugx8qDmUq-9W1ZoL29h4AaABAg.AMpXpBuoXhHAMr-CMQ9dAL,Ugx8qDmUq-9W1ZoL29h4AaABAg,@phaedrus7971,UCo2MtTJ3FFIzhWXP_73zuVA,@goodstar8065this Charlie Sheen is a real jerk.,en,2025-09-09T13:09:47Z,2025-09-09 09:09:47,0
WqQUvfsavO4,aka Charlie Sheen | Official Trailer | Netflix,UCWOA1ZGywLbqmigxE4Qlvuw,Netflix,2025-08-13T14:00:00Z,UgxVKcd9MfHrx_e5IaJ4AaABAg.AMooUwdXxggAMvD087yu-E,UgxVKcd9MfHrx_e5IaJ4AaABAg,@scarlettperl6864,UCwYha7Ic5A0lEXiwz--VFKg,"Really?  His interview with Andrea Canning was painful to watch. He was stoned out of his mind and so rude.  He was not likable at all.  I don't see the appeal even when he is sober.  He was very good looking when he was young, thats about it.",en,2025-09-11T04:27:25Z,2025-09-11 00:27:25,1
WqQUvfsavO4,aka Charlie Sheen | Official Trailer | Netflix,UCWOA1ZGywLbqmigxE4Qlvuw,Netflix,2025-08-13T14:00:00Z,UgwNKLIvHQls19IYE494AaABAg.AMo2O6zBX4cAN8saZDBxRk,UgwNKLIvHQls19IYE494AaABAg,@LogicalVelocity,UC-5bcS9uH47zK5c45JPFVjA,Underrated band for sure.,en,2025-09-16T21:08:54Z,2025-09-16 17:08:54,0
WqQUvfsavO4,aka Charlie Sheen | Official Trailer | Netflix,UCWOA1ZGywLbqmigxE4Qlvuw,Netflix,2025-08-13T14:00:00Z,Ugy8lmAapzvJD_BODMd4AaABAg.AMk7fp4wKTCAMqj6FBqW2-,Ugy8lmAapzvJD_BODMd4AaABAg,@ASenna-he7vr,UCuN66ArBS7GaftHlG2Vb3hg,"Yes, a child rapist.",NA,2025-09-09T10:40:25Z,2025-09-09 06:40:25,0
WqQUvfsavO4,aka Charlie Sheen | Official Trailer | Netflix,UCWOA1ZGywLbqmigxE4Qlvuw,Netflix,2025-08-13T14:00:00Z,UgyS3m3KaRjixdudIjl4AaABAg.AMjjLNeplpWAQE0y-sti8I,UgyS3m3KaRjixdudIjl4AaABAg,@vondaniels3214,UCaSWO_ZqOHmhWYa3s_hBa0w,How did he harm them?,en,2025-12-02T10:41:07Z,2025-12-02 05:41:07,0
WqQUvfsavO4,aka Charlie Sheen | Official Trailer | Netflix,UCWOA1ZGywLbqmigxE4Qlvuw,Netflix,2025-08-13T14:00:00Z,Ugze6J8FMWJBm2AFuS94AaABAg.AMjgMgvbwdBAN0F6uEQviw,Ugze6J8FMWJBm2AFuS94AaABAg,@googlename7943,UC2WcMalL-Vj8zqssH0anTWw,"His mom said this was a lie? I don't believe charlie sheen but if his mom said it , it should be true",en,2025-09-13T12:41:16Z,2025-09-13 08:41:16,0
WqQUvfsavO4,aka Charlie Sheen | Official Trailer | Netflix,UCWOA1ZGywLbqmigxE4Qlvuw,Netflix,2025-08-13T14:00:00Z,Ugze6J8FMWJBm2AFuS94AaABAg.AMjgMgvbwdBAN8UxpIp6Db,Ugze6J8FMWJBm2AFuS94AaABAg,@sometimesiwander7146,UCC3LKrqNzNKxBud_wovJKJQ,Haim’s mom let him go to industry parties alone as a kid according to multiple reports back then. She got paid off imo.  I believe it happened.  Charlie was probably drugged up and drunk and either legitimately doesn’t remember or chooses to claim it didn’t happen. How anyone can believe half what he says I’ll never know.  Seriously untrustworthy drug addict imo.  Sober 8 yrs? Doubtful.,en,2025-09-16T17:33:37Z,2025-09-16 13:33:37,0
WqQUvfsavO4,aka Charlie Sheen | Official Trailer | Netflix,UCWOA1ZGywLbqmigxE4Qlvuw,Netflix,2025-08-13T14:00:00Z,Ugze6J8FMWJBm2AFuS94AaABAg.AMjgMgvbwdBAN9R1XxVqss,Ugze6J8FMWJBm2AFuS94AaABAg,@googlename7943,UC2WcMalL-Vj8zqssH0anTWw,"​@sometimesiwander7146 then it's possible.... this entire project was narcissistic. It was as if to say, hey kids remember me? I was so cool and still am. But the only person that accused him was the other corey . Corey haim never said anything and he passed away. I guess we will never know for sure if it happened or not.",en,2025-09-17T02:18:33Z,2025-09-16 22:18:33,0
WqQUvfsavO4,aka Charlie Sheen | Official Trailer | Netflix,UCWOA1ZGywLbqmigxE4Qlvuw,Netflix,2025-08-13T14:00:00Z,Ugw_g1OOF_XRkWWu9dB4AaABAg.AMjXYqsU_VRAQE6ZhKRMYj,Ugw_g1OOF_XRkWWu9dB4AaABAg,@vondaniels3214,UCaSWO_ZqOHmhWYa3s_hBa0w,Corey's mum said NOTHING happened with Core. Mums see and know these things. Corey wanted MONEY. 😢😢,en,2025-12-02T11:30:06Z,2025-12-02 06:30:06,0
WqQUvfsavO4,aka Charlie Sheen | Official Trailer | Netflix,UCWOA1ZGywLbqmigxE4Qlvuw,Netflix,2025-08-13T14:00:00Z,Ugza6nJKPGYfKYe0OeB4AaABAg.AMhbGHELyypAO2URzOQBwX,Ugza6nJKPGYfKYe0OeB4AaABAg,@OMW2FYB1010,UCdrQwQbHFSz_gHatS_d4k6A,nothing,NA,2025-10-09T06:05:05Z,2025-10-09 02:05:05,0
WqQUvfsavO4,aka Charlie Sheen | Official Trailer | Netflix,UCWOA1ZGywLbqmigxE4Qlvuw,Netflix,2025-08-13T14:00:00Z,Ugx9WCkN4fcZ-Rrwlep4AaABAg.AMcOXPuwY3KAMtE9_Myoz8,Ugx9WCkN4fcZ-Rrwlep4AaABAg,@ameliekouma,UCXltHoHbpcpcjE0gDRZ7ZfA,exactly,xh,2025-09-10T09:58:58Z,2025-09-10 05:58:58,5
WqQUvfsavO4,aka Charlie Sheen | Official Trailer | Netflix,UCWOA1ZGywLbqmigxE4Qlvuw,Netflix,2025-08-13T14:00:00Z,Ugx9WCkN4fcZ-Rrwlep4AaABAg.AMcOXPuwY3KAMtpd3KwTwl,Ugx9WCkN4fcZ-Rrwlep4AaABAg,@jaygatsby9797,UCsHBve3ciO7M2deTEBB2BJQ,He's got tiger blood.  He can't get HIV.,en,2025-09-10T15:35:11Z,2025-09-10 11:35:11,3
WqQUvfsavO4,aka Charlie Sheen | Official Trailer | Netflix,UCWOA1ZGywLbqmigxE4Qlvuw,Netflix,2025-08-13T14:00:00Z,Ugx9WCkN4fcZ-Rrwlep4AaABAg.AMcOXPuwY3KAMv6QEMNysO,Ugx9WCkN4fcZ-Rrwlep4AaABAg,@Por2ugal,UCF-hGsZ9vXDj4hsgDVTcE0g,Allegedly,NA,2025-09-11T03:29:49Z,2025-09-10 23:29:49,0
WqQUvfsavO4,aka Charlie Sheen | Official Trailer | Netflix,UCWOA1ZGywLbqmigxE4Qlvuw,Netflix,2025-08-13T14:00:00Z,Ugx9WCkN4fcZ-Rrwlep4AaABAg.AMcOXPuwY3KAMwPCgJRJz0,Ugx9WCkN4fcZ-Rrwlep4AaABAg,@Richgirlshi,UCvGJIf0FoaSF4Ef63cx6hDw,‼️‼️‼️‼️‼️‼️‼️,ja,2025-09-11T15:33:14Z,2025-09-11 11:33:14,0
WqQUvfsavO4,aka Charlie Sheen | Official Trailer | Netflix,UCWOA1ZGywLbqmigxE4Qlvuw,Netflix,2025-08-13T14:00:00Z,Ugx9WCkN4fcZ-Rrwlep4AaABAg.AMcOXPuwY3KAMz1_OSbHXB,Ugx9WCkN4fcZ-Rrwlep4AaABAg,@lionforlambs9167,UCHd40TyHODb_WVcknpklkvg,Winning,ky,2025-09-12T16:04:28Z,2025-09-12 12:04:28,0
WqQUvfsavO4,aka Charlie Sheen | Official Trailer | Netflix,UCWOA1ZGywLbqmigxE4Qlvuw,Netflix,2025-08-13T14:00:00Z,Ugx9WCkN4fcZ-Rrwlep4AaABAg.AMcOXPuwY3KAN8V6d6gU01,Ugx9WCkN4fcZ-Rrwlep4AaABAg,@sometimesiwander7146,UCC3LKrqNzNKxBud_wovJKJQ,He would be in jail if he wasn’t an actor.,en,2025-09-16T17:34:57Z,2025-09-16 13:34:57,4
WqQUvfsavO4,aka Charlie Sheen | Official Trailer | Netflix,UCWOA1ZGywLbqmigxE4Qlvuw,Netflix,2025-08-13T14:00:00Z,Ugy6k5ozG8RzThiYbpd4AaABAg.AMabJyUJcgbAQE6nNqaiy_,Ugy6k5ozG8RzThiYbpd4AaABAg,@vondaniels3214,UCaSWO_ZqOHmhWYa3s_hBa0w,😂😂😂,ja,2025-12-02T11:32:06Z,2025-12-02 06:32:06,0
WqQUvfsavO4,aka Charlie Sheen | Official Trailer | Netflix,UCWOA1ZGywLbqmigxE4Qlvuw,Netflix,2025-08-13T14:00:00Z,UgxdS_mLmbLkoHVVJI54AaABAg.AMTWbnwXMrkAQE6ay7uZ9c,UgxdS_mLmbLkoHVVJI54AaABAg,@vondaniels3214,UCaSWO_ZqOHmhWYa3s_hBa0w,😅😅😅😅,ja,2025-12-02T11:30:24Z,2025-12-02 06:30:24,0
WqQUvfsavO4,aka Charlie Sheen | Official Trailer | Netflix,UCWOA1ZGywLbqmigxE4Qlvuw,Netflix,2025-08-13T14:00:00Z,UgzHUjXveLs1K5cloP54AaABAg.AMPbQhFf3bEAMSRAcVG1Ky,UgzHUjXveLs1K5cloP54AaABAg,@sksnksksk6503,UC3DEB_HVKW7EJs4-6w7qRXA,what are you gonna do about it,en,2025-08-30T14:53:58Z,2025-08-30 10:53:58,0
WqQUvfsavO4,aka Charlie Sheen | Official Trailer | Netflix,UCWOA1ZGywLbqmigxE4Qlvuw,Netflix,2025-08-13T14:00:00Z,UgwPMFbciygXwDvJl8N4AaABAg.AMM-dkV9vKhAQE0bntXvZ3,UgwPMFbciygXwDvJl8N4AaABAg,@vondaniels3214,UCaSWO_ZqOHmhWYa3s_hBa0w,Agreed.,en,2025-12-02T10:38:06Z,2025-12-02 05:38:06,0
WqQUvfsavO4,aka Charlie Sheen | Official Trailer | Netflix,UCWOA1ZGywLbqmigxE4Qlvuw,Netflix,2025-08-13T14:00:00Z,UgyM9-riTOjZkNRezt54AaABAg.AMJE5xphpomAND20lZS18R,UgyM9-riTOjZkNRezt54AaABAg,@Dagoduna,UCK-iT_AFHasgyJqojKgd1eA,"This is what you Americans have been doing since DW Griffith's The Birth of a Nation: normalizing and encouraging toxic, dangerous, and violent behavior.  That movie is the foundation of how you perceive the world.",en,2025-09-18T11:56:57Z,2025-09-18 07:56:57,0
WqQUvfsavO4,aka Charlie Sheen | Official Trailer | Netflix,UCWOA1ZGywLbqmigxE4Qlvuw,Netflix,2025-08-13T14:00:00Z,UgyM9-riTOjZkNRezt54AaABAg.AMJE5xphpomAQE3G_C4cN1,UgyM9-riTOjZkNRezt54AaABAg,@vondaniels3214,UCaSWO_ZqOHmhWYa3s_hBa0w,Wrong.,NA,2025-12-02T11:01:16Z,2025-12-02 06:01:16,0
WqQUvfsavO4,aka Charlie Sheen | Official Trailer | Netflix,UCWOA1ZGywLbqmigxE4Qlvuw,Netflix,2025-08-13T14:00:00Z,Ugyh3YKj306i9vq94EN4AaABAg.AMJ7xY536uxAMqkpeREvDP,Ugyh3YKj306i9vq94EN4AaABAg,@ASenna-he7vr,UCuN66ArBS7GaftHlG2Vb3hg,Yes,en,2025-09-09T10:55:29Z,2025-09-09 06:55:29,0
WqQUvfsavO4,aka Charlie Sheen | Official Trailer | Netflix,UCWOA1ZGywLbqmigxE4Qlvuw,Netflix,2025-08-13T14:00:00Z,UgxS9E9O9U06rn-50FR4AaABAg.AMFexZP3OLeAMw5nK92yWl,UgxS9E9O9U06rn-50FR4AaABAg,@markm-qf2fn,UCyw8QW2yuYWIBdASf0FR87A,Was end 50 interwiew,en,2025-09-11T12:43:36Z,2025-09-11 08:43:36,0
WqQUvfsavO4,aka Charlie Sheen | Official Trailer | Netflix,UCWOA1ZGywLbqmigxE4Qlvuw,Netflix,2025-08-13T14:00:00Z,UgxS9E9O9U06rn-50FR4AaABAg.AMFexZP3OLeAMw5oMUSQiG,UgxS9E9O9U06rn-50FR4AaABAg,@markm-qf2fn,UCyw8QW2yuYWIBdASf0FR87A,Par days 60,fr,2025-09-11T12:43:45Z,2025-09-11 08:43:45,0
WqQUvfsavO4,aka Charlie Sheen | Official Trailer | Netflix,UCWOA1ZGywLbqmigxE4Qlvuw,Netflix,2025-08-13T14:00:00Z,UgxS9E9O9U06rn-50FR4AaABAg.AMFexZP3OLeAMw5rAy64bU,UgxS9E9O9U06rn-50FR4AaABAg,@markm-qf2fn,UCyw8QW2yuYWIBdASf0FR87A,End 50 very old biden trump 20 jears older,NA,2025-09-11T12:44:08Z,2025-09-11 08:44:08,0
WqQUvfsavO4,aka Charlie Sheen | Official Trailer | Netflix,UCWOA1ZGywLbqmigxE4Qlvuw,Netflix,2025-08-13T14:00:00Z,UgxS9E9O9U06rn-50FR4AaABAg.AMFexZP3OLeAMw5smMpRjh,UgxS9E9O9U06rn-50FR4AaABAg,@markm-qf2fn,UCyw8QW2yuYWIBdASf0FR87A,Biden is older,NA,2025-09-11T12:44:21Z,2025-09-11 08:44:21,0
WqQUvfsavO4,aka Charlie Sheen | Official Trailer | Netflix,UCWOA1ZGywLbqmigxE4Qlvuw,Netflix,2025-08-13T14:00:00Z,UgzFkjK8x-VkumQUBJR4AaABAg.AMFT-JNTVn0AQE5Mf80n0d,UgzFkjK8x-VkumQUBJR4AaABAg,@vondaniels3214,UCaSWO_ZqOHmhWYa3s_hBa0w,Not the lad. He went weird.😢,lb,2025-12-02T11:19:35Z,2025-12-02 06:19:35,0
WqQUvfsavO4,aka Charlie Sheen | Official Trailer | Netflix,UCWOA1ZGywLbqmigxE4Qlvuw,Netflix,2025-08-13T14:00:00Z,UgyC6a6W_DUBgFgd2aR4AaABAg.AMDbE4eTkn4AMDg8Xx6isw,UgyC6a6W_DUBgFgd2aR4AaABAg,@cherylmilke313,UCNKryk7g-EhSbKiCaD7mdOQ,Are you kidding me he NEVER will he will take that to the grave as he should.,en,2025-08-24T21:24:53Z,2025-08-24 17:24:53,0
WqQUvfsavO4,aka Charlie Sheen | Official Trailer | Netflix,UCWOA1ZGywLbqmigxE4Qlvuw,Netflix,2025-08-13T14:00:00Z,Ugwie59-Ja-3PQc1LxR4AaABAg.AMDaWOR5nwHAQE1kDOO7ji,Ugwie59-Ja-3PQc1LxR4AaABAg,@vondaniels3214,UCaSWO_ZqOHmhWYa3s_hBa0w,Me. He was the funny for me just for those shirts he always wore. Lmao. 😂😂,en,2025-12-02T10:47:59Z,2025-12-02 05:47:59,0
