video_id,video_url,comment_id,comment_author_display,comment_author_channel_id,comment_content,comment_lang,comment_time_utc,comment_time_local,comment_like_count,comment_reply_count,reply_id,reply_author_display,reply_author_channel_id,reply_content,reply_lang,reply_time_utc,reply_time_local,reply_like_count,view_count,like_count,comment_count,crawl_time
0PPSFCWO_cA,https://www.youtube.com/watch?v=0PPSFCWO_cA,UgyuPCCEORTeKEp2mXp4AaABAg,@traveltm,UCF0ENqdQ3v-icUvlI89IBSQ,"IDK what to believe. Those recordings could be heard either way. She could be baiting him. He’s talking and she always seems to feel the need to give command to one or other of the children. Intentionally pushing his buttons?  Or see it the way she and her defense say it is?  Yes hear him raise his voice, say some stuff. It is not to the level that it’s obvious he is an angry, controlling person. Her dad is creepy.",en,2025-07-21T17:54:12Z,2025-07-21 13:54:12,1,1,UgyuPCCEORTeKEp2mXp4AaABAg.AKql-hYEgZ1AKqvpvTnpwa,@uniquenessub,UCo-w8eQy9ZbNEobbPRADO5A,"Yes she was baiting him to make him looks aggressive.
She was trying to make distance between jason and his kids.",en,2025-07-21T19:28:51Z,2025-07-21 15:28:51,1,611922,3906,1299,"Tue, 16 Dec 2025 17:36:18 GMT"
0PPSFCWO_cA,https://www.youtube.com/watch?v=0PPSFCWO_cA,UgwrhaSbU1dNmPIHIal4AaABAg,@torinottorinottori,UCdpT7hM7mwzS-vfvYOw0mtg,"Friendly reminder that female murderers are overrepresented in true crime covrage both because it's novel (deemed more interesting) and to deflect from the fact that 90-95% of violent crime is comitted by males. It's so we all watch these rare cases and think,  ""it's not a problem with how we socialize our boys and men, because see, women murder too - some people are just violent"" *shrugs and continues to ignore the epidemic of male violence*",en,2025-06-19T23:40:23Z,2025-06-19 19:40:23,2,1,UgwrhaSbU1dNmPIHIal4AaABAg.AJZzBCe01KGAJgdvAoKTDx,@stephendevlin6455,UCmkNYSaw9eHUDc515oyr-yQ,Jesus Christ. That man’s head got bashed in by a breeze block with his children in the next room and you’re using it to pit crimes by men vs crimes by women points. Have some heart.,en,2025-06-22T23:08:29Z,2025-06-22 19:08:29,0,611922,3906,1299,"Tue, 16 Dec 2025 17:36:18 GMT"
0PPSFCWO_cA,https://www.youtube.com/watch?v=0PPSFCWO_cA,Ugy-0fZMP2B2XJ4ofi14AaABAg,@Asdfyygv,UCZ1vZwBiUJZUQ8FLLjwaUIA,So who did it?!!! Ugh,NA,2025-06-18T08:03:03Z,2025-06-18 04:03:03,0,2,Ugy-0fZMP2B2XJ4ofi14AaABAg.AJVj774cTswAJdr499jy0z,@TimoSea97,UC2CsX3XrswMcZAEdT4xLbcQ,"Well, there’s no doubt about that. Molly and Tom did. But they say it’s because of self defense which is absolute BS if you have any brain cells.",en,2025-06-21T21:05:43Z,2025-06-21 17:05:43,1,611922,3906,1299,"Tue, 16 Dec 2025 17:36:18 GMT"
0PPSFCWO_cA,https://www.youtube.com/watch?v=0PPSFCWO_cA,Ugy-0fZMP2B2XJ4ofi14AaABAg,@Asdfyygv,UCZ1vZwBiUJZUQ8FLLjwaUIA,So who did it?!!! Ugh,NA,2025-06-18T08:03:03Z,2025-06-18 04:03:03,0,2,Ugy-0fZMP2B2XJ4ofi14AaABAg.AJVj774cTswALVaG_edEnG,@Mr.Perry33,UCB4s5q_yXal3N_NorUnHyXQ,Molly and her dad,en,2025-08-06T23:48:29Z,2025-08-06 19:48:29,1,611922,3906,1299,"Tue, 16 Dec 2025 17:36:18 GMT"
0PPSFCWO_cA,https://www.youtube.com/watch?v=0PPSFCWO_cA,UgytUa_24LeLFHGXmQh4AaABAg,@billiamwinton,UCEdNGAc26xc1XILE23zhOpA,"I was back and forth until I heard the recordings of him. If that was him out of control, then he was a pretty even tempered guy. This was cold blooded murder.",en,2025-06-17T16:17:32Z,2025-06-17 12:17:32,6,1,UgytUa_24LeLFHGXmQh4AaABAg.AJU1uwVTqZbAJdrUJ0yHEN,@TimoSea97,UC2CsX3XrswMcZAEdT4xLbcQ,Exactly. You truely heard him being concerned of her trying to take away the kids. A concern which was valid unfortunately.,en,2025-06-21T21:09:17Z,2025-06-21 17:09:17,3,611922,3906,1299,"Tue, 16 Dec 2025 17:36:18 GMT"
0PPSFCWO_cA,https://www.youtube.com/watch?v=0PPSFCWO_cA,Ugys6XNLZQ8pn3CUoSp4AaABAg,@EmilyJurgens-TX,UCUuuXQBlBT1ASOwnxZX6G3g,"Here's how dumb the defense attorneys are.  She's manipulating the conversations that SHE IS RECORDING. Guarantee if he recorded their fights without her knowledge, they would have heard a very different version of Molly. She reminds me of Amber Heard. And regarding fingernail digs in her neck...well duh! That was likely him trying to defend himself. Hence the reason victims usually have trace DNA under their fingernails. The defense attorneys are morons, Molly is a classic psychopath, and her dad is the worst for defending his psychopathic daughter. Deep down, he knows she's crazy.",en,2025-06-12T21:22:20Z,2025-06-12 17:22:20,4,1,Ugys6XNLZQ8pn3CUoSp4AaABAg.AJHhozx2YoXAJR4N-S6c6n,@Anchoviesaredisgusting,UCf8UEHpC2aBl3BXYUDmiQ7A,"I agree she's guilty, but the defense were actually the smart ones in this case. prosecution dropped the ball big time, hence why they're out just as free as you and I. if the prosecution had've been as good as the defense, there never would've been a granted appeal, let alone reduced charge and sentence. But that fingernail mark is the only question I still have. If someone's coming at you with a baseball bat or a brick, or even just their hands, you're going to go for their arms and face, not give a little nick behind their ear. If you're fighting for your life, it shows.",en,2025-06-16T12:41:15Z,2025-06-16 08:41:15,0,611922,3906,1299,"Tue, 16 Dec 2025 17:36:18 GMT"
0PPSFCWO_cA,https://www.youtube.com/watch?v=0PPSFCWO_cA,UgywDWJ4kO7rht8cUTt4AaABAg,@sksolos7,UCP5ZxJ6jUHiczu0082ebpLQ,"it’s crazy how molly and her dad didn’t get a real punishment like how is this not life in prison… the man’s skull was crushed. this wasn’t some accident or a fight gone wrong. she planned it just to get the kids cause she couldn’t have her own. and what’s worse is she acts like she’s the victim the whole time, like she didn’t even hurt anyone. pretending like she didn’t completely destroy a man. it’s honestly sick and justice still feels totally wrong",en,2025-06-08T11:08:29Z,2025-06-08 07:08:29,16,1,UgywDWJ4kO7rht8cUTt4AaABAg.AJ6JOWSbA8kAPz8c69XZQ7,@GaryCarter-x9u,UCKiQfvfIJ2hyEm8kOGy21Ow,"The only reason they got little time is because the prosecutor gave them a plea deal.  He's an idiot.  Not a single person here believed the defense's story, yet the prosecutor was worried he would lose?  I call bullcrap on that.  They are pressured to give plea deals to keep cases out of the court room, and I'd bet that's the real reason he offered a plea deal.",en,2025-11-26T06:40:11Z,2025-11-26 01:40:11,0,611922,3906,1299,"Tue, 16 Dec 2025 17:36:18 GMT"
0PPSFCWO_cA,https://www.youtube.com/watch?v=0PPSFCWO_cA,Ugy8ZoHHaOWEmv0IUtl4AaABAg,@spencerdickson9693,UCKnsFmH9-MKAaIYTjwBsROA,"They brushed over Molly's habit of lying but the wikipedia page has alot more details. she was released from the psych ward just weeks before travelling to Ireland, She may have been bi-polar, She had claimed to be an Olympic swimmer. just weird shit. I knew a girl like this in college. Told me she was a valenvictorian, told us her ex-boyfriend was killed in a car accident and she needed help getting home from the funeral and then said it had all been made up by his new GF (Like you didnt confirm that he was actually dead before driving 6 hours), she just made shit up. it was weird.",en,2025-06-04T17:23:42Z,2025-06-04 13:23:42,5,1,Ugy8ZoHHaOWEmv0IUtl4AaABAg.AIxg9B5EH1yAJR4ovgGJAe,@Anchoviesaredisgusting,UCf8UEHpC2aBl3BXYUDmiQ7A,"pathological lying. I also went to school with a girl like this. She would make up what they had for dinner. There was nothing she said you could trust. She told someone I worked with that she had been an aeromedic. Girl had not only never spent a day in paramedic training in her life, she was about 15 years too young for the job because you need at least 20 years paramedic experience to do it. It's literally a flying ICU. You don't get those jobs straight out of paramedic training lol. She was nuts. But not like Molly.",en,2025-06-16T12:45:12Z,2025-06-16 08:45:12,0,611922,3906,1299,"Tue, 16 Dec 2025 17:36:18 GMT"
0PPSFCWO_cA,https://www.youtube.com/watch?v=0PPSFCWO_cA,UgyGY9fEq-4FdvyS32R4AaABAg,@Zeylah,UCRCA5CG-3EJX5M66dd4DrcQ,"I just watched the Netflix series and there are questions I have in relation to the investigation process…

- DNA the bat to see if Jason did actually grab the bat off the father.

- DNA check Jason’s finger nails to see if he actually strangled Molly and dug his fingers in her neck. 

- Medical record for Mollys injuries or an X-ray to show any signs of strangulations..

- Why Mollys mother wasn’t concerned as much to find out what’s going on if she really cared about her daughter’s safety. Especially if they were creating codes and keywords for Jason because he’s a violent man.. but yeah just go back to sleep zzz

- A friend witnessed Molly belittle and degrade Jason in front of everyone… a real victim of domestic abuse would never ever say these things because they’ll fear what will happen to them behind closed doors at home 🚪. Clear indication that she’s not a victim at all.

Just a few to name but damn a lot of holes.. guessing being a former FBI agent speaks volume and it’s who you know and not what you know..",en,2025-06-03T12:27:34Z,2025-06-03 08:27:34,3,1,UgyGY9fEq-4FdvyS32R4AaABAg.AIu_TNVd1TkAJdsLB0dhv1,@TimoSea97,UC2CsX3XrswMcZAEdT4xLbcQ,It speaks for itself that everyone in the comments exactly knows the truth. Imagine how bad the judge must be to not see this all. Unbelievable. I hope Molly and Tom will meet their ultimate Judge in the afterlife.,en,2025-06-21T21:16:47Z,2025-06-21 17:16:47,0,611922,3906,1299,"Tue, 16 Dec 2025 17:36:18 GMT"
0PPSFCWO_cA,https://www.youtube.com/watch?v=0PPSFCWO_cA,UgzYI_EKKq5tFPMPpBZ4AaABAg,@santoshmagar6198,UCwl3mGgooQEXobGzxE7mKRQ,"I am with molly
She is a real mother still she loves them 
Kids acting was perfect since 8 years to 19 years",en,2025-06-03T10:34:25Z,2025-06-03 06:34:25,1,1,UgzYI_EKKq5tFPMPpBZ4AaABAg.AIuNWaWYcpSAJR58P_0IQh,@Anchoviesaredisgusting,UCf8UEHpC2aBl3BXYUDmiQ7A,"You really need to work on your trolling skills. Or better yet, find a real hobby.",en,2025-06-16T12:48:00Z,2025-06-16 08:48:00,3,611922,3906,1299,"Tue, 16 Dec 2025 17:36:18 GMT"
0PPSFCWO_cA,https://www.youtube.com/watch?v=0PPSFCWO_cA,UgwR9Ctaa1N3JIhen7h4AaABAg,@MineMeMineMeMineMe,UCoMW9sap1_ZvPG78u4ZWAfw,"she has real mental health issues and victim mindset is a part of it. Her psychosis will keep making her believe that she is a victim and she will create circumstance to be a victim when she is not. instead of getting her proper help, that she needs and make her accountable, this doofus, dumbass father, believed in her non-sense and killed her.",en,2025-06-03T10:09:55Z,2025-06-03 06:09:55,3,1,UgwR9Ctaa1N3JIhen7h4AaABAg.AIuKiEOvWdvAJR5JTs16y_,@Anchoviesaredisgusting,UCf8UEHpC2aBl3BXYUDmiQ7A,"She's not psychotic, that's the scariest part. I also don;'t believe her dad believed any nonsense. I think he knows exactly who his daughter is, he raised her after all. Claiming to not be a liar as he lies through his teeth about what his son in law's ex father in law said? Birds of a feather.",en,2025-06-16T12:49:31Z,2025-06-16 08:49:31,0,611922,3906,1299,"Tue, 16 Dec 2025 17:36:18 GMT"
0PPSFCWO_cA,https://www.youtube.com/watch?v=0PPSFCWO_cA,UgxUwxSKGZhoOc2yWXt4AaABAg,@Harsh-qi6vr,UCoX3tubkzXHLEB9l5Q5Ji5A,I just came here to say that I stopped watching few moments after they showed molly ana tom talking. Which means this was proven a defense and those two are out right? yeah thanks for saving my time. Pathetic law,en,2025-05-30T16:38:22Z,2025-05-30 12:38:22,1,1,UgxUwxSKGZhoOc2yWXt4AaABAg.AIkiznhrbWGAJR696329K0,@Anchoviesaredisgusting,UCf8UEHpC2aBl3BXYUDmiQ7A,"It was actually the prosecution that screwed up, not the law. Basically, the children were interviewed early on in the investigation and were clearly coached into making specific statements about their dad and how abusive he was to Molly. Kids come forward some time later and tell the investigators this, and the prosecution made the case that the interviews with the kids should be inadmissible. Judge agreed. Big mistake. If those recordings had been played to the jury, the children could've testified that they were coached and child psychology experts would've easily backed that up, considering the kids were using language that kids of that age group don't use. But because the tapes weren't submitted as evidence, the defense were able to use them for the appeals case on the grounds that it was the one bit of evidence that corroborated Molly's version of events. But because they were no longer in trial, there was no back and forth argument between the prosecution and defense about the coached statements, just that a key part of evidence had been deliberately excluded. Court of Appeals agreed. The prosecution then agreed on a plea deal instead of a full re-trial, which led to reduced charges and sentences. Hence why they are out.",en,2025-06-16T12:56:50Z,2025-06-16 08:56:50,0,611922,3906,1299,"Tue, 16 Dec 2025 17:36:18 GMT"
0PPSFCWO_cA,https://www.youtube.com/watch?v=0PPSFCWO_cA,Ugy4NV4davjo1gaOBrZ4AaABAg,@laoch5658,UCSXMPAKWqyyG3KlWxLbgf5w,"America is a corrupt country, no where else in the world would these people walk free",en,2025-05-29T21:15:42Z,2025-05-29 17:15:42,0,1,Ugy4NV4davjo1gaOBrZ4AaABAg.AIidwAYJG-WAJR6KVskJKC,@Anchoviesaredisgusting,UCf8UEHpC2aBl3BXYUDmiQ7A,lolllll you obviously don't know a lot about criminal justice around the world.,en,2025-06-16T12:58:24Z,2025-06-16 08:58:24,0,611922,3906,1299,"Tue, 16 Dec 2025 17:36:18 GMT"
0PPSFCWO_cA,https://www.youtube.com/watch?v=0PPSFCWO_cA,UgyGAlTqZHYFLuH9ckx4AaABAg,@Mercedes-f7x,UClEkyS_tK55_VUJAWVSTlng,And this is alot pf women now days claiming therw gusband is abusive to try and get out of what they do. Why do women believe kids are better of with them when men do just as good job if not better  its beyond pathetic now days women are so entitled and vile.,en,2025-05-28T04:45:32Z,2025-05-28 00:45:32,0,1,UgyGAlTqZHYFLuH9ckx4AaABAg.AIeIp2l_RmBAKKYOw9IFFr,@bubbi-bubbi,UCOsUi3MDYfxcpZZEx7GVe6w,Because statistically men commit more domestic violence and ped0phelia.,en,2025-07-08T20:20:22Z,2025-07-08 16:20:22,0,611922,3906,1299,"Tue, 16 Dec 2025 17:36:18 GMT"
0PPSFCWO_cA,https://www.youtube.com/watch?v=0PPSFCWO_cA,UgxjYzQJBLMZknTogf54AaABAg,@vickyv83179,UCPKDtXF9UhY0KtRmMSNCeng,"They killed that man, her father  was so cocky cause her worked for a FBI. She was delusional how you going to take his kids she probably could not have any so she wanted to take his. They should be in jail",en,2025-05-25T18:56:33Z,2025-05-25 14:56:33,7,1,UgxjYzQJBLMZknTogf54AaABAg.AIZ5pU0alI9AIZAr5gDqmz,@Pirate-k8m,UCuSE9nRIAeY7a-j_obkkgMw,Also he was in counter intelligence.,en,2025-05-25T19:40:28Z,2025-05-25 15:40:28,0,611922,3906,1299,"Tue, 16 Dec 2025 17:36:18 GMT"
0PPSFCWO_cA,https://www.youtube.com/watch?v=0PPSFCWO_cA,UgxzFLBZZlsJVI0EiA94AaABAg,@YvieT81,UCkPvgIAh-scB583iwSL4h0w,"She gives me Amber Heard vibes. Period. And it's so sickening cause she - as Amber - discredits real victims of abuse. The pathological lying, the secret recordings, the fact that she kept on saying 'they were my children'. Was he perfect? No probably far from that, but the way he was so brutally beaten to death leaves no room for interpretation if you'd ask me.",en,2025-05-23T17:44:36Z,2025-05-23 13:44:36,5,1,UgxzFLBZZlsJVI0EiA94AaABAg.AITp-jCyBEYAIdAVufHU3m,@karolinapakostova4264,UCIf3k_tJUhW2uP1d83nRm4A,Amber? She is Blake Lively 3.0!!😁 a complete delulu,en,2025-05-27T18:13:38Z,2025-05-27 14:13:38,1,611922,3906,1299,"Tue, 16 Dec 2025 17:36:18 GMT"
0PPSFCWO_cA,https://www.youtube.com/watch?v=0PPSFCWO_cA,UgxAmZ2X4cw04QIMYnZ4AaABAg,@semazb1903,UCfmjYPiLgJvOlbDRlUyqx6g,Oh thank god I’m not the only one believing these 2 are guilty.,en,2025-05-23T16:07:07Z,2025-05-23 12:07:07,5,1,UgxAmZ2X4cw04QIMYnZ4AaABAg.AITdqhtL2D1AITrMfnULdR,@christina3763,UCM7AK89tA3JvplDrHvQr83g,Hahaha same here,mi,2025-05-23T18:05:12Z,2025-05-23 14:05:12,1,611922,3906,1299,"Tue, 16 Dec 2025 17:36:18 GMT"
0PPSFCWO_cA,https://www.youtube.com/watch?v=0PPSFCWO_cA,UgzDlK7A1NTqvkkn1HV4AaABAg,@BWayne666,UC8kcGSAv7mAcMsZbZf5KT1Q,"Just because Molly is a compulsive liar, doesn't mean Jason wasn't an abusive husband. The way he talked to her in the recordings sounded like it was normal for him to talk that way to her. Absolutely vile man. Did the judge make the right decision? I honestly believe Molly and her father are not a threat to the society. It's better to let a guilty person free, than imprison an innocent person.",en,2025-05-22T22:31:01Z,2025-05-22 18:31:01,1,1,UgzDlK7A1NTqvkkn1HV4AaABAg.AIRkzeYTPy1AKKZcavgyyr,@bubbi-bubbi,UCOsUi3MDYfxcpZZEx7GVe6w,"I think he killed his first wife. When I heard the recordings, it send shivers down my spine. I think the part being Ex-FBI is to know, when a person is potentially dangerous and manipulative.",en,2025-07-08T20:31:07Z,2025-07-08 16:31:07,0,611922,3906,1299,"Tue, 16 Dec 2025 17:36:18 GMT"
0PPSFCWO_cA,https://www.youtube.com/watch?v=0PPSFCWO_cA,UgySlUOewsGZu1h3I0R4AaABAg,@JennaRational.,UCulk0w6Gh3mp79iokNXkFzQ,The recordings proved nothing more than the fact that they were a married couple arguing.  If they were proof of abuse…every married couple would have a case for murdering their spouse.  Unbelievable.  Psychopaths.,en,2025-05-21T02:11:04Z,2025-05-20 22:11:04,5,2,UgySlUOewsGZu1h3I0R4AaABAg.AIN-_cE65DrAITr8yVtHIl,@christina3763,UCM7AK89tA3JvplDrHvQr83g,"Even i am not married, that doesnt sounds like abusing lol. and those doesnt sounds like a threat, i mean, they are not her biological kids and he thought of divorce if it doesnt work out anymore.",en,2025-05-23T18:03:20Z,2025-05-23 14:03:20,1,611922,3906,1299,"Tue, 16 Dec 2025 17:36:18 GMT"
0PPSFCWO_cA,https://www.youtube.com/watch?v=0PPSFCWO_cA,UgySlUOewsGZu1h3I0R4AaABAg,@JennaRational.,UCulk0w6Gh3mp79iokNXkFzQ,The recordings proved nothing more than the fact that they were a married couple arguing.  If they were proof of abuse…every married couple would have a case for murdering their spouse.  Unbelievable.  Psychopaths.,en,2025-05-21T02:11:04Z,2025-05-20 22:11:04,5,2,UgySlUOewsGZu1h3I0R4AaABAg.AIN-_cE65DrAKK_0kJNzD_,@bubbi-bubbi,UCOsUi3MDYfxcpZZEx7GVe6w,"Wait what? This is absolutely NOT a normal arguing. My parents argue as well, but not like this. What kind of brocken a$$ relationships are you? XD",en,2025-07-08T20:34:33Z,2025-07-08 16:34:33,0,611922,3906,1299,"Tue, 16 Dec 2025 17:36:18 GMT"
0PPSFCWO_cA,https://www.youtube.com/watch?v=0PPSFCWO_cA,UgxaluI52AV7jHupxnl4AaABAg,@MimiFloww,UCwcXo8H3PIJKy8cf5CpAPrQ,Those kids should be grateful dat they put dat abusive father down. Those kids don’t understand domestic abuse n mental abuse so those kids were done a favor by her taking him out. I would Neva want an abusive father. Those kids don’t know wat they talkin about n should forgive her n move on. Ur father was a monster from wat this docu shows,en,2025-05-19T11:14:00Z,2025-05-19 07:14:00,0,1,UgxaluI52AV7jHupxnl4AaABAg.AIIp7PomJJ6AIL5ZMNQm6S,@ohmeohmyyoumakemesigh,UCka8-YCvHSRZT3692MfkanA,BS and you know it,en,2025-05-20T08:24:51Z,2025-05-20 04:24:51,1,611922,3906,1299,"Tue, 16 Dec 2025 17:36:18 GMT"
0PPSFCWO_cA,https://www.youtube.com/watch?v=0PPSFCWO_cA,Ugz6JTAHd8A_cmKb5gd4AaABAg,@dynamicpisces,UC9W1g9URSFOtDtIpYakVF9w,“48 Hours” did an episode on this case a few weeks ago.  Molly and her dad are guilty as sin!!! Molly has been a liar since before she even got married. The grandmother was so concerned for the kids safety that she set up keywords but then when she hears an altercation upstairs that night she turns over and goes back to sleep!? Make it make sense. Tom and Molly have zero remorse and their lawyers are disgusting for suggesting that Jason killed his first wife!🤮🤮🤮,en,2025-05-18T20:45:47Z,2025-05-18 16:45:47,4,1,Ugz6JTAHd8A_cmKb5gd4AaABAg.AIHGlShg4HeAImv5lZAw0l,@frugalferg,UCOtwwYQsxET0pd44XEXbuIg,"Omg I didn't think of that!! Yes, Tom marten's wife claims she went back to sleep when screams were heard but had codewords with the kids. Omg😮",en,2025-05-31T13:02:40Z,2025-05-31 09:02:40,1,611922,3906,1299,"Tue, 16 Dec 2025 17:36:18 GMT"
0PPSFCWO_cA,https://www.youtube.com/watch?v=0PPSFCWO_cA,UgwUP61ofyiPAr8G-_t4AaABAg,@42MOL42,UCCjIMjWJx4I8oQP4JBRn0_g,Can't imagine anyone's dumb enough to marry her again 😂😂😂,en,2025-05-18T16:54:14Z,2025-05-18 12:54:14,1,2,UgwUP61ofyiPAr8G-_t4AaABAg.AIGrGUGxItNAIHA9jh6oJr,@positivitynativity,UCqQEBF9Rg9Wz47f1QtzZ9HA,There's definitely those spineless beta males with little dicks who will take what they can get. Molly will wear the pants while she slaps on strap on and does him dirty,en,2025-05-18T19:48:04Z,2025-05-18 15:48:04,0,611922,3906,1299,"Tue, 16 Dec 2025 17:36:18 GMT"
0PPSFCWO_cA,https://www.youtube.com/watch?v=0PPSFCWO_cA,UgwUP61ofyiPAr8G-_t4AaABAg,@42MOL42,UCCjIMjWJx4I8oQP4JBRn0_g,Can't imagine anyone's dumb enough to marry her again 😂😂😂,en,2025-05-18T16:54:14Z,2025-05-18 12:54:14,1,2,UgwUP61ofyiPAr8G-_t4AaABAg.AIGrGUGxItNAKK_Re4e61K,@bubbi-bubbi,UCOsUi3MDYfxcpZZEx7GVe6w,"​@positivitynativityand yet, they will still get laid, unlike you XD",en,2025-07-08T20:38:13Z,2025-07-08 16:38:13,0,611922,3906,1299,"Tue, 16 Dec 2025 17:36:18 GMT"
0PPSFCWO_cA,https://www.youtube.com/watch?v=0PPSFCWO_cA,Ugwi8f3QEFeSXy2jKxN4AaABAg,@larryhatcher8927,UCqvwmtOmmIllW_GLs0qlhvg,"There were a ton of unanswered questions here.  The first one I had:  Where did all of that money come from?  The show never really addressed the fact they lived in a 3-4 million dollar house.  Was it from his family or hers?  The show made some brief statements about his work but not much.  One reason I ask was because if all of this guy's business was tied up in Ireland, I seriously doubt he would move to America.  My next question is:  Did this woman have any previous experience working with kids?  How did she get a job as an Au Pair?  Also, having children seemed to be this woman's #1 concern.  I assume it still is.  The movie never really mention it, but I assume she is sterile.  Let's face it, she is smoking hot.  She could have her choice of men and get pregnant on her own.    I think this woman was a lot crazier than the show mentioned.  Just my opinion, I believe she came up behind the guy and hit him with something on the back of the head.  Once he was down, she went crazy on him.  I don't think the old man did anything other than try to cover it up.  He came in after the fact.  He could not tell the cops anything about what she actually did.",en,2025-05-18T14:32:54Z,2025-05-18 10:32:54,0,2,Ugwi8f3QEFeSXy2jKxN4AaABAg.AIGb5JVHS3CAITqVTO0HfQ,@christina3763,UCM7AK89tA3JvplDrHvQr83g,"This is what i read from wikipedia

Jason paid US$390,000 for the house, and gave Molly US$80,000 to buy furnishings for it, as well as buying her a BMW SUV. He had also previously given his father-in-law US$49,000 as a contribution toward his wedding ceremony",en,2025-05-23T17:57:42Z,2025-05-23 13:57:42,0,611922,3906,1299,"Tue, 16 Dec 2025 17:36:18 GMT"
0PPSFCWO_cA,https://www.youtube.com/watch?v=0PPSFCWO_cA,Ugwi8f3QEFeSXy2jKxN4AaABAg,@larryhatcher8927,UCqvwmtOmmIllW_GLs0qlhvg,"There were a ton of unanswered questions here.  The first one I had:  Where did all of that money come from?  The show never really addressed the fact they lived in a 3-4 million dollar house.  Was it from his family or hers?  The show made some brief statements about his work but not much.  One reason I ask was because if all of this guy's business was tied up in Ireland, I seriously doubt he would move to America.  My next question is:  Did this woman have any previous experience working with kids?  How did she get a job as an Au Pair?  Also, having children seemed to be this woman's #1 concern.  I assume it still is.  The movie never really mention it, but I assume she is sterile.  Let's face it, she is smoking hot.  She could have her choice of men and get pregnant on her own.    I think this woman was a lot crazier than the show mentioned.  Just my opinion, I believe she came up behind the guy and hit him with something on the back of the head.  Once he was down, she went crazy on him.  I don't think the old man did anything other than try to cover it up.  He came in after the fact.  He could not tell the cops anything about what she actually did.",en,2025-05-18T14:32:54Z,2025-05-18 10:32:54,0,2,Ugwi8f3QEFeSXy2jKxN4AaABAg.AIGb5JVHS3CAITyaWjd10f,@larryhatcher8927,UCqvwmtOmmIllW_GLs0qlhvg,"@christina3763 I read that so, I'm guessing that his family must be pretty rich.  I do know that traditionally it's the bride's family that pays for the wedding.  50K buys a lot of wedding",en,2025-05-23T19:08:24Z,2025-05-23 15:08:24,0,611922,3906,1299,"Tue, 16 Dec 2025 17:36:18 GMT"
0PPSFCWO_cA,https://www.youtube.com/watch?v=0PPSFCWO_cA,UgwdiIl5PWNvr9DZF0p4AaABAg,@ChadBest-ug8uo,UCX0Y2sErql_IAWDqUnF5psw,"As a single father, I am terrified of meeting a random woman.  There are just too many nuts out there.  They bring their checkered past and their nutty family with them.  Might be best to stay single.",en,2025-05-18T13:35:20Z,2025-05-18 09:35:20,2,2,UgwdiIl5PWNvr9DZF0p4AaABAg.AIGVVgaMeGIAIL6Toourik,@ohmeohmyyoumakemesigh,UCka8-YCvHSRZT3692MfkanA,I don't blame you Chad.  Not an American woman anyway.,en,2025-05-20T08:32:50Z,2025-05-20 04:32:50,0,611922,3906,1299,"Tue, 16 Dec 2025 17:36:18 GMT"
