video_id,video_title,channel_id,channel_title,video_published_at,view_count,video_like_count,video_comment_count,comment_id,comment_parent_id,comment_author_display,comment_author_channel_id,comment_text,comment_lang,comment_published_utc,comment_published_local,comment_like_count,comment_reply_count
6LS0gf4jcKE,Haunted Hotel | First 9 Minutes Sneak Peek | Netflix,UCWOA1ZGywLbqmigxE4Qlvuw,Netflix,2025-09-12T19:00:00Z,889318,35064,2218,UgxX_ujLp29H-eZFfFd4AaABAg,NA,@MyChemicalPronouns,UCvLgAQydaq_FJhoK2STNfNg,From first impressions I thought Abaddon was just some emo child who thought he was the king of hell 😭,en,2025-12-03T18:49:42Z,2025-12-03 13:49:42,1,0
6LS0gf4jcKE,Haunted Hotel | First 9 Minutes Sneak Peek | Netflix,UCWOA1ZGywLbqmigxE4Qlvuw,Netflix,2025-09-12T19:00:00Z,889318,35064,2218,UgzYrl1fnhDbvjsUW354AaABAg,NA,@KendraKayeWarde-h6x,UCDRk5kjB41ExRggPCqK1kLA,Wow naglalaro ng Jack Stone,fil,2025-12-02T22:25:51Z,2025-12-02 17:25:51,0,0
6LS0gf4jcKE,Haunted Hotel | First 9 Minutes Sneak Peek | Netflix,UCWOA1ZGywLbqmigxE4Qlvuw,Netflix,2025-09-12T19:00:00Z,889318,35064,2218,Ugwll7sCDq3F756F8_14AaABAg,NA,@StarriXplorer1,UC00Tw3nUFhUU2QMpdcVCahQ,"Dear Netflix,

I absolutely love this show and have rewatched it 5 times already. If you cancel it i will cancel my subscription. And get the rest of us to cancel en masse. This is your warning.",en,2025-11-29T14:03:57Z,2025-11-29 09:03:57,1,0
6LS0gf4jcKE,Haunted Hotel | First 9 Minutes Sneak Peek | Netflix,UCWOA1ZGywLbqmigxE4Qlvuw,Netflix,2025-09-12T19:00:00Z,889318,35064,2218,Ugwi8KhEBo1NrYfRhV94AaABAg,NA,@BernardoAraujo-i8j7l,UCoc0kSwlJUnHw8syyTyzJnQ,"Amo vc também não sei se você é homem de Deus 
😂😅😊😮 ai que lindo meu amor eu não tô conseguindo entrar no meu servidor 😕",pt,2025-11-25T21:43:14Z,2025-11-25 16:43:14,0,0
6LS0gf4jcKE,Haunted Hotel | First 9 Minutes Sneak Peek | Netflix,UCWOA1ZGywLbqmigxE4Qlvuw,Netflix,2025-09-12T19:00:00Z,889318,35064,2218,Ugz8LhjiIpOLgAW5BGB4AaABAg,NA,@Duhlia-the-angler-fish,UCvz6G9MDvW-TNGD8UbS9CcQ,Esther is my diva 🎀,en,2025-11-23T18:46:59Z,2025-11-23 13:46:59,0,0
6LS0gf4jcKE,Haunted Hotel | First 9 Minutes Sneak Peek | Netflix,UCWOA1ZGywLbqmigxE4Qlvuw,Netflix,2025-09-12T19:00:00Z,889318,35064,2218,Ugya1JxrA-grJt7N1y54AaABAg,NA,@Ominous_Anne,UCt--jAZVBexmuVwHwo9IWMg,"This show is so good, hopefully we get more adult animation that doesn't just rely on shock and sex instead of actual humor and stories.",en,2025-11-19T20:01:19Z,2025-11-19 15:01:19,1,0
6LS0gf4jcKE,Haunted Hotel | First 9 Minutes Sneak Peek | Netflix,UCWOA1ZGywLbqmigxE4Qlvuw,Netflix,2025-09-12T19:00:00Z,889318,35064,2218,UgxttVh9-GwIkF141wN4AaABAg,NA,@understated-king,UCm-MRn9seOGv1I1SoHRoGEA,You should recommend a scene where when abbadon falls asleep the boy wake up and is in control,en,2025-11-19T01:51:20Z,2025-11-18 20:51:20,0,0
6LS0gf4jcKE,Haunted Hotel | First 9 Minutes Sneak Peek | Netflix,UCWOA1ZGywLbqmigxE4Qlvuw,Netflix,2025-09-12T19:00:00Z,889318,35064,2218,UgyC2uRv9Vm04Aorg7F4AaABAg,NA,@Plssubscribewithnovideos,UClBHE9xcmi5N7OeteNVxL-A,lwk thought the first part would traumatize me,en,2025-11-14T02:39:19Z,2025-11-13 21:39:19,0,0
6LS0gf4jcKE,Haunted Hotel | First 9 Minutes Sneak Peek | Netflix,UCWOA1ZGywLbqmigxE4Qlvuw,Netflix,2025-09-12T19:00:00Z,889318,35064,2218,Ugw6ad-wtQv9ec_WShh4AaABAg,NA,@elizabethgarza4159,UCei1uS4so6SvvOoqPdEC1fg,I get the bones,ca,2025-11-11T16:15:55Z,2025-11-11 11:15:55,1,0
6LS0gf4jcKE,Haunted Hotel | First 9 Minutes Sneak Peek | Netflix,UCWOA1ZGywLbqmigxE4Qlvuw,Netflix,2025-09-12T19:00:00Z,889318,35064,2218,UgxvPqo5sNSRLLiwgJx4AaABAg,NA,@elizabethgarza4159,UCei1uS4so6SvvOoqPdEC1fg,Go,ga,2025-11-11T16:15:23Z,2025-11-11 11:15:23,0,0
6LS0gf4jcKE,Haunted Hotel | First 9 Minutes Sneak Peek | Netflix,UCWOA1ZGywLbqmigxE4Qlvuw,Netflix,2025-09-12T19:00:00Z,889318,35064,2218,UgxwYfp2DDMSbXVGqnt4AaABAg,NA,@tsumjya,UChFtCi-Lxtwpej6WG18Gg-Q,Love how the topic is the fear of netflix cancellation,en,2025-11-11T14:28:37Z,2025-11-11 09:28:37,1,0
6LS0gf4jcKE,Haunted Hotel | First 9 Minutes Sneak Peek | Netflix,UCWOA1ZGywLbqmigxE4Qlvuw,Netflix,2025-09-12T19:00:00Z,889318,35064,2218,UgzErpA2zs1p4iM1BIl4AaABAg,NA,@VerónicaAffranchino,UCCIIlBeMMfHCbvIfvMEkGLQ,2:51,ja,2025-11-11T00:46:01Z,2025-11-10 19:46:01,1,0
6LS0gf4jcKE,Haunted Hotel | First 9 Minutes Sneak Peek | Netflix,UCWOA1ZGywLbqmigxE4Qlvuw,Netflix,2025-09-12T19:00:00Z,889318,35064,2218,UgwTM7LpRjmTVRvxVL94AaABAg,NA,@fatouwebb8051,UCFYzwpCJoP4xpNZBojFs45w,", 0:19 0:20 0:20",ja,2025-11-09T19:53:22Z,2025-11-09 14:53:22,0,0
6LS0gf4jcKE,Haunted Hotel | First 9 Minutes Sneak Peek | Netflix,UCWOA1ZGywLbqmigxE4Qlvuw,Netflix,2025-09-12T19:00:00Z,889318,35064,2218,UgyhvcKwM-zjtPksY6Z4AaABAg,NA,@VerónicaAffranchino,UCCIIlBeMMfHCbvIfvMEkGLQ,2:52 introoo,NA,2025-11-08T12:00:16Z,2025-11-08 07:00:16,0,0
6LS0gf4jcKE,Haunted Hotel | First 9 Minutes Sneak Peek | Netflix,UCWOA1ZGywLbqmigxE4Qlvuw,Netflix,2025-09-12T19:00:00Z,889318,35064,2218,UgzzMoh1XqI8QBfVNTp4AaABAg,NA,@ELEcomments,UC_A9Li7uFGXX56L6pW8PAnw,Looks like a Gravity Falls clone. Not necessarily a bad thing however as that type of humor is very appealing. Hopefully it finds it footing and Netflix doesn't up and cancel it too quickly.,en,2025-11-06T00:25:54Z,2025-11-05 19:25:54,0,0
6LS0gf4jcKE,Haunted Hotel | First 9 Minutes Sneak Peek | Netflix,UCWOA1ZGywLbqmigxE4Qlvuw,Netflix,2025-09-12T19:00:00Z,889318,35064,2218,Ugx9CMS7bhp7icKs3WJ4AaABAg,NA,@soundofspace8026,UC1SOBG2xh1VDTur_gcNmjEw,"man western animaton really only depicts white men as weak, stupid and incompetent so that all powerful, tough woman can rescue or insult them.",en,2025-11-04T16:17:32Z,2025-11-04 11:17:32,0,0
6LS0gf4jcKE,Haunted Hotel | First 9 Minutes Sneak Peek | Netflix,UCWOA1ZGywLbqmigxE4Qlvuw,Netflix,2025-09-12T19:00:00Z,889318,35064,2218,UgwiLNQV65kJ1uTfHLZ4AaABAg,NA,@Michael_Does_Stuff,UCTcU06x1sTUTJbo5vdrAPMA,I love abaddon already,mg,2025-11-03T01:36:47Z,2025-11-02 20:36:47,1,0
6LS0gf4jcKE,Haunted Hotel | First 9 Minutes Sneak Peek | Netflix,UCWOA1ZGywLbqmigxE4Qlvuw,Netflix,2025-09-12T19:00:00Z,889318,35064,2218,UgxSHx1JnNyere_BBnF4AaABAg,NA,@grease3873,UCGdukaRJ_fbpKsEeTBeRUbw,I can't let myself get too attached to these characters,en,2025-11-02T10:54:43Z,2025-11-02 05:54:43,3,0
6LS0gf4jcKE,Haunted Hotel | First 9 Minutes Sneak Peek | Netflix,UCWOA1ZGywLbqmigxE4Qlvuw,Netflix,2025-09-12T19:00:00Z,889318,35064,2218,UgyQmtI_f01Wu1ufmbR4AaABAg,NA,@toledotoledo3620,UC3tQ6KriTfHB2ocri4Dku2g,"I don’t know why, but the intro gives me Gravity Falls vibes",en,2025-10-30T21:36:19Z,2025-10-30 17:36:19,4,0
6LS0gf4jcKE,Haunted Hotel | First 9 Minutes Sneak Peek | Netflix,UCWOA1ZGywLbqmigxE4Qlvuw,Netflix,2025-09-12T19:00:00Z,889318,35064,2218,UgzHe4GL5lb9UPdtNTN4AaABAg,NA,@rgjarrell,UCFKzzZ_wxxdKpmTKOCTdjvw,"a friend told me about this, cant wait to watch more!",en,2025-10-29T23:56:05Z,2025-10-29 19:56:05,0,0
6LS0gf4jcKE,Haunted Hotel | First 9 Minutes Sneak Peek | Netflix,UCWOA1ZGywLbqmigxE4Qlvuw,Netflix,2025-09-12T19:00:00Z,889318,35064,2218,UgyIthKXp4ftYuy-nBF4AaABAg,NA,@skysea5786,UCWFoqenFJuj9meHzfvRFlaw,I love how they include the story between The Rat and Snake in the intro.,en,2025-10-27T05:58:48Z,2025-10-27 01:58:48,0,0
6LS0gf4jcKE,Haunted Hotel | First 9 Minutes Sneak Peek | Netflix,UCWOA1ZGywLbqmigxE4Qlvuw,Netflix,2025-09-12T19:00:00Z,889318,35064,2218,UgzKWQcI1NzGbo6AoI94AaABAg,NA,@ella9602,UCQ0MzZ-avpQcvR1au3mU6Ew,☦️,ne,2025-10-25T22:34:55Z,2025-10-25 18:34:55,0,0
6LS0gf4jcKE,Haunted Hotel | First 9 Minutes Sneak Peek | Netflix,UCWOA1ZGywLbqmigxE4Qlvuw,Netflix,2025-09-12T19:00:00Z,889318,35064,2218,UgzAcHdAJiNLL2230f54AaABAg,NA,@TheRevengeBros,UCO4XejB1fwQt4R6OQabf65A,W Haunted House!,NA,2025-10-25T15:46:06Z,2025-10-25 11:46:06,0,0
6LS0gf4jcKE,Haunted Hotel | First 9 Minutes Sneak Peek | Netflix,UCWOA1ZGywLbqmigxE4Qlvuw,Netflix,2025-09-12T19:00:00Z,889318,35064,2218,UgwujflwkrNn1PaMhgR4AaABAg,NA,@Kittenfox_55,UCBoqVhFXnop4q93f3_oWTfg,"So much dang pessimism about this show (And many others) getting the ax after season 2, that it's eating up any real discussion about them.",en,2025-10-21T02:54:02Z,2025-10-20 22:54:02,2,0
6LS0gf4jcKE,Haunted Hotel | First 9 Minutes Sneak Peek | Netflix,UCWOA1ZGywLbqmigxE4Qlvuw,Netflix,2025-09-12T19:00:00Z,889318,35064,2218,UgzdpBV0lR3qstEu2Rp4AaABAg,NA,@Snail_sh3llz,UCpTucJ3nWowY8ZmJG3l7VjQ,This reads like an adult gravity falls and I am here for it! It’s probably gonna get canceled after two seasons though :(,en,2025-10-19T20:01:38Z,2025-10-19 16:01:38,0,0
6LS0gf4jcKE,Haunted Hotel | First 9 Minutes Sneak Peek | Netflix,UCWOA1ZGywLbqmigxE4Qlvuw,Netflix,2025-09-12T19:00:00Z,889318,35064,2218,UgwHZOK9X0dNxKw2Pmx4AaABAg,NA,@anabanana77,UCGAewn2ZiBo-iAiUgz2001A,Realy great show I hope it wont get canceled after 2 seasons😃,en,2025-10-19T14:52:27Z,2025-10-19 10:52:27,0,0
6LS0gf4jcKE,Haunted Hotel | First 9 Minutes Sneak Peek | Netflix,UCWOA1ZGywLbqmigxE4Qlvuw,Netflix,2025-09-12T19:00:00Z,889318,35064,2218,UgxfLqGbfE3WHOF-v9R4AaABAg,NA,@Lightbulbmuncher4s,UCa9mq-Vl8PJ0qd5qszQgxQg,PLEASE GO ON FOR MORE THAN TWO SEASONS,en,2025-10-19T04:34:31Z,2025-10-19 00:34:31,1,0
6LS0gf4jcKE,Haunted Hotel | First 9 Minutes Sneak Peek | Netflix,UCWOA1ZGywLbqmigxE4Qlvuw,Netflix,2025-09-12T19:00:00Z,889318,35064,2218,Ugy7nwqfH2O7qXJBePF4AaABAg,NA,@JirehCabrillos-k3z,UCL6C_IjLeBc0mHtY25oDa0w,😂😂😂😂😂😂😂😂😂😂 abbodon out😂😂,en,2025-10-17T04:14:04Z,2025-10-17 00:14:04,0,0
6LS0gf4jcKE,Haunted Hotel | First 9 Minutes Sneak Peek | Netflix,UCWOA1ZGywLbqmigxE4Qlvuw,Netflix,2025-09-12T19:00:00Z,889318,35064,2218,UgzpQzU4_bzaf8hobZN4AaABAg,NA,@ishtar4061,UCc7x30kXjL4M-7dqJd1_Cqw,"Por favor todos paren de decir que la van a cancelar, me da miedo que pase",gl,2025-10-15T20:26:00Z,2025-10-15 16:26:00,0,0
6LS0gf4jcKE,Haunted Hotel | First 9 Minutes Sneak Peek | Netflix,UCWOA1ZGywLbqmigxE4Qlvuw,Netflix,2025-09-12T19:00:00Z,889318,35064,2218,UgyJc8vUxZZG4nrogS54AaABAg,NA,@Boiiiiiiiiiiiiiiiiiiiiiiii,UC3_tHqjhSSCA1Uq0lEUKN8A,PG 13?,NA,2025-10-15T11:58:29Z,2025-10-15 07:58:29,1,0
6LS0gf4jcKE,Haunted Hotel | First 9 Minutes Sneak Peek | Netflix,UCWOA1ZGywLbqmigxE4Qlvuw,Netflix,2025-09-12T19:00:00Z,889318,35064,2218,Ugy1L8oUPdeq4l_yu2B4AaABAg,NA,@KilesKiles,UCxmU2P3EvwE0JdM9H5WvQWw,Nathan is my favorite 😘,en,2025-10-15T05:48:22Z,2025-10-15 01:48:22,2,0
6LS0gf4jcKE,Haunted Hotel | First 9 Minutes Sneak Peek | Netflix,UCWOA1ZGywLbqmigxE4Qlvuw,Netflix,2025-09-12T19:00:00Z,889318,35064,2218,Ugw_9z-EsocKoBurpiJ4AaABAg,NA,@InktheImpassive,UC5jQsmELS-LF5U7bBjPBstw,This reminds me a lot of Ghosts bbc show just that the woman doesnt have a husband.,en,2025-10-15T01:42:55Z,2025-10-14 21:42:55,0,0
6LS0gf4jcKE,Haunted Hotel | First 9 Minutes Sneak Peek | Netflix,UCWOA1ZGywLbqmigxE4Qlvuw,Netflix,2025-09-12T19:00:00Z,889318,35064,2218,UgxSB3nXyEhqG8vgL5t4AaABAg,NA,@عزالدينفلاحه,UCzFv1rZhHwhQnOUIv23o76w,❤❤❤❤,ja,2025-10-14T14:52:54Z,2025-10-14 10:52:54,0,0
6LS0gf4jcKE,Haunted Hotel | First 9 Minutes Sneak Peek | Netflix,UCWOA1ZGywLbqmigxE4Qlvuw,Netflix,2025-09-12T19:00:00Z,889318,35064,2218,UgyrKfFiVgNPALskqJ54AaABAg,NA,@estebangutierrez160,UCKBuGCPL7HBgDrMhACEpKCw,It's actually refreshing to have this teaser not use so many curse words.,en,2025-10-14T12:11:02Z,2025-10-14 08:11:02,2,0
6LS0gf4jcKE,Haunted Hotel | First 9 Minutes Sneak Peek | Netflix,UCWOA1ZGywLbqmigxE4Qlvuw,Netflix,2025-09-12T19:00:00Z,889318,35064,2218,Ugw_vpXJLC8Dmyh_cr54AaABAg,NA,@IheartCynandGiggle,UCXaupoNMDI7exb375mQ31wQ,I never get tired of the intro,en,2025-10-14T03:39:50Z,2025-10-13 23:39:50,4,0
6LS0gf4jcKE,Haunted Hotel | First 9 Minutes Sneak Peek | Netflix,UCWOA1ZGywLbqmigxE4Qlvuw,Netflix,2025-09-12T19:00:00Z,889318,35064,2218,UgzJZ_umth5omU0oo694AaABAg,NA,@beautifulclouds8888,UCz6rYPRrz_xE-kcFoD0meRg,I didn't comment when I first saw this (which was the day it was posted) I love this show honestly. I'm always pleasantly surprised when new things come out by big corporations that are actually good. yippee. please don't cancel it :],en,2025-10-14T03:06:04Z,2025-10-13 23:06:04,3,0
6LS0gf4jcKE,Haunted Hotel | First 9 Minutes Sneak Peek | Netflix,UCWOA1ZGywLbqmigxE4Qlvuw,Netflix,2025-09-12T19:00:00Z,889318,35064,2218,UgzOf7W388LSqUJk3T54AaABAg,NA,@이동연-c6d,UC_vMbRcaR0MNjutiJk0Egtg,1:43 How did that ten year old know that?!?!,en,2025-10-13T22:31:18Z,2025-10-13 18:31:18,2,0
6LS0gf4jcKE,Haunted Hotel | First 9 Minutes Sneak Peek | Netflix,UCWOA1ZGywLbqmigxE4Qlvuw,Netflix,2025-09-12T19:00:00Z,889318,35064,2218,UgyplOnxZjc9q5PHdYB4AaABAg,NA,@prabalbabbar,UCK1rxCWfSRIMJRRT6czb41g,please release 2nd season,fy,2025-10-13T16:52:09Z,2025-10-13 12:52:09,2,0
6LS0gf4jcKE,Haunted Hotel | First 9 Minutes Sneak Peek | Netflix,UCWOA1ZGywLbqmigxE4Qlvuw,Netflix,2025-09-12T19:00:00Z,889318,35064,2218,Ugz2QoPfqOY9gE0GtKJ4AaABAg,NA,@Josie-u1s,UCOkaVVPWGtoDEhz5aDdcnNg,1:40,ja,2025-10-13T10:18:35Z,2025-10-13 06:18:35,0,0
6LS0gf4jcKE,Haunted Hotel | First 9 Minutes Sneak Peek | Netflix,UCWOA1ZGywLbqmigxE4Qlvuw,Netflix,2025-09-12T19:00:00Z,889318,35064,2218,Ugy2EcXU5XPSL8AO5U94AaABAg,NA,@Seemab-m1k,UCah-HpnG-7zKU3g1ocijK-g,season 2 whennnnnnnnnnnnn????????????,NA,2025-10-12T19:22:20Z,2025-10-12 15:22:20,3,0
6LS0gf4jcKE,Haunted Hotel | First 9 Minutes Sneak Peek | Netflix,UCWOA1ZGywLbqmigxE4Qlvuw,Netflix,2025-09-12T19:00:00Z,889318,35064,2218,UgztNMrWTHcaPgG_WgV4AaABAg,NA,@McDonalds-k2b,UCzKFOcKLyDGLuEU2ZbmuUWw,This hotel is better than hazbin hotel,NA,2025-10-11T12:13:02Z,2025-10-11 08:13:02,5,1
6LS0gf4jcKE,Haunted Hotel | First 9 Minutes Sneak Peek | Netflix,UCWOA1ZGywLbqmigxE4Qlvuw,Netflix,2025-09-12T19:00:00Z,889318,35064,2218,UgzhK5UXErCqxDfZy7V4AaABAg,NA,@Shadow8332,UCgfN_OWaP8RdxHN55xXi8kw,I just love that esther gives off louise chaotic vibes. I am happily watching this.,en,2025-10-10T20:38:58Z,2025-10-10 16:38:58,4,0
6LS0gf4jcKE,Haunted Hotel | First 9 Minutes Sneak Peek | Netflix,UCWOA1ZGywLbqmigxE4Qlvuw,Netflix,2025-09-12T19:00:00Z,889318,35064,2218,Ugx08jVqnbhODOMIV2V4AaABAg,NA,@K____y3-zm9mo,UC_4bf_GO9Wl35sCkx4ZuAIw,"I'm so engrossed in these characters that I'm going to be SO UPSET IF NETFLIX CANCELS EVEN SEASON 2, I SWEAR you're going to cancel a show with an amazing idea before it's even finished so just DON'T APPROVE IT IN THE FIRST PLACE, it won't have a decent ending so don't start it.",en,2025-10-10T03:36:36Z,2025-10-09 23:36:36,1,0
6LS0gf4jcKE,Haunted Hotel | First 9 Minutes Sneak Peek | Netflix,UCWOA1ZGywLbqmigxE4Qlvuw,Netflix,2025-09-12T19:00:00Z,889318,35064,2218,Ugw2T2X-JtGd_W0Ir5J4AaABAg,NA,@agustinsmania5270,UCS3WH4OkABJeTTbTQYNWLyQ,"having watched the show, here are my main opinions:

-the show is neat, the comedy is decent, some of the story lines are interesting, and there are some really neat uses of ghost, demon, and monster pop culture

-its a bit too episodic for my taste, with every episode having a self contained plot and barely any followup between episodes if any
new concepts are introduced and only used again once at most

-the show is not afraid to tackle more taboo themes, such as complex adult relationships, toxic romance, and even self harm(of the deadly kind)

-the characters are all likeable, however, abbadon is the clear winner, as he can be quite funny because of his behavior

-the show does not make good use of its ghosts.
dont get me wrong, they are there, but they are just the backdrop for the rest of the show
there is only TWO non main cast characters that have any sort of relevance in the show, and only one of them is a ghosts
every single other ghost, ghoul, or monster either goes unnamed, is only present for background cameos, or is exclusive to a single episode and never shows up again, which can be dissapointing if you were expecting a show more like GHOSTS (us or uk)

in conclusion: the show is still great fun, but its less of a ""family trying to make a haunted hotel work"" and more of a ""family sitcom where the conflict comes from a supernatural source unique to each episode"" not bad, just know what you are going to see least you be dissapointed by the different direction

i will await season 2 eagerly",en,2025-10-10T02:00:51Z,2025-10-09 22:00:51,1,0
6LS0gf4jcKE,Haunted Hotel | First 9 Minutes Sneak Peek | Netflix,UCWOA1ZGywLbqmigxE4Qlvuw,Netflix,2025-09-12T19:00:00Z,889318,35064,2218,Ugyiw5Di6cgbEi8kW-x4AaABAg,NA,@JadeSylvinaVA,UCzCKMjsrmGUF4LXaImbGQAg,"I love the show but the first episode felt like a second episode. If only we had an episode where they show how everyone got to the hotel, how Nathan died, how Katherine got to inherit it, how she had to live there with her kids, how Esther practiced the dark arts, how Ben got involved, how everyone met Abaddon, and how everyone is able to see the ghosts.",en,2025-10-09T00:58:45Z,2025-10-08 20:58:45,3,0
6LS0gf4jcKE,Haunted Hotel | First 9 Minutes Sneak Peek | Netflix,UCWOA1ZGywLbqmigxE4Qlvuw,Netflix,2025-09-12T19:00:00Z,889318,35064,2218,UgyzYghhdb1kK-iYN_J4AaABAg,NA,@bigbbyjesus,UCG5Mn-ssc-2XNQTSzhUhvPA,I love how Will Forte's character kinda looks like him,NA,2025-10-08T21:14:24Z,2025-10-08 17:14:24,0,0
6LS0gf4jcKE,Haunted Hotel | First 9 Minutes Sneak Peek | Netflix,UCWOA1ZGywLbqmigxE4Qlvuw,Netflix,2025-09-12T19:00:00Z,889318,35064,2218,UgyL2QNJWSbP1B6Q3UZ4AaABAg,NA,@nikmien,UCVF8COjMiuqoCd_cSwjTI9A,What demon hunters??,NA,2025-10-08T15:17:04Z,2025-10-08 11:17:04,0,0
6LS0gf4jcKE,Haunted Hotel | First 9 Minutes Sneak Peek | Netflix,UCWOA1ZGywLbqmigxE4Qlvuw,Netflix,2025-09-12T19:00:00Z,889318,35064,2218,UgyHabGqzZ9XZajksOh4AaABAg,NA,@Meaha-p1c,UC99Pl5Bi4sM2FAexQ2EaoEA,And there doing 2 seasons,en,2025-10-08T12:03:47Z,2025-10-08 08:03:47,0,0
6LS0gf4jcKE,Haunted Hotel | First 9 Minutes Sneak Peek | Netflix,UCWOA1ZGywLbqmigxE4Qlvuw,Netflix,2025-09-12T19:00:00Z,889318,35064,2218,UgwvXwGngw4PXnZZelB4AaABAg,NA,@Meaha-p1c,UC99Pl5Bi4sM2FAexQ2EaoEA,I watched this,en,2025-10-08T12:03:21Z,2025-10-08 08:03:21,0,0
6LS0gf4jcKE,Haunted Hotel | First 9 Minutes Sneak Peek | Netflix,UCWOA1ZGywLbqmigxE4Qlvuw,Netflix,2025-09-12T19:00:00Z,889318,35064,2218,UgywBlx_v_7Z0t23_DF4AaABAg,NA,@bellamichaud7896,UCeSVnmGSC_6u19IOWmlIB1g,Netflix I am begging you not to cancel this show after two seasons I am literally in love with it it’s like gravity falls for adults,en,2025-10-08T05:23:12Z,2025-10-08 01:23:12,0,0
6LS0gf4jcKE,Haunted Hotel | First 9 Minutes Sneak Peek | Netflix,UCWOA1ZGywLbqmigxE4Qlvuw,Netflix,2025-09-12T19:00:00Z,889318,35064,2218,Ugzwz4Ppbikr2PkL_Bt4AaABAg,NA,@sofijakoprivica6921,UCXKgO0X9JLlvwWvbjbYisQg,This is amazing,en,2025-10-07T19:51:07Z,2025-10-07 15:51:07,1,0
6LS0gf4jcKE,Haunted Hotel | First 9 Minutes Sneak Peek | Netflix,UCWOA1ZGywLbqmigxE4Qlvuw,Netflix,2025-09-12T19:00:00Z,889318,35064,2218,UgxPThRi4-kyec9Oiqp4AaABAg,NA,@Exilon0193,UChT6ckEk_SWmfiVvGdv_48Q,"So this is like the ""ghosts"" series but more rowdy.",en,2025-10-07T18:23:57Z,2025-10-07 14:23:57,0,0
6LS0gf4jcKE,Haunted Hotel | First 9 Minutes Sneak Peek | Netflix,UCWOA1ZGywLbqmigxE4Qlvuw,Netflix,2025-09-12T19:00:00Z,889318,35064,2218,Ugwb0cGXqFk0ClrOT_d4AaABAg,NA,@Aley_444,UCzQZRWYUIuS8baEYXGjVsGA,"I know i'm going to love this series,I hope they won't cancel it🥲✨",en,2025-10-07T13:17:29Z,2025-10-07 09:17:29,0,0
6LS0gf4jcKE,Haunted Hotel | First 9 Minutes Sneak Peek | Netflix,UCWOA1ZGywLbqmigxE4Qlvuw,Netflix,2025-09-12T19:00:00Z,889318,35064,2218,UgxjZmoOzo0v5d1jeK54AaABAg,NA,@roccomancini4773,UC5H7ahLX2ZGvWUkd8vd05JA,Better than the Hazbin one for sure.,en,2025-10-07T10:10:18Z,2025-10-07 06:10:18,0,0
6LS0gf4jcKE,Haunted Hotel | First 9 Minutes Sneak Peek | Netflix,UCWOA1ZGywLbqmigxE4Qlvuw,Netflix,2025-09-12T19:00:00Z,889318,35064,2218,UgxYWLkjRDrDYTJG5S14AaABAg,NA,@kelseystanton850,UCSTiivIV4mP_QxHnbpxUhTg,I love abbadon he is Hilarious,NA,2025-10-07T00:15:57Z,2025-10-06 20:15:57,0,0
6LS0gf4jcKE,Haunted Hotel | First 9 Minutes Sneak Peek | Netflix,UCWOA1ZGywLbqmigxE4Qlvuw,Netflix,2025-09-12T19:00:00Z,889318,35064,2218,Ugx9isFtShQgXSUbWuF4AaABAg,NA,@brandonfox9610,UCv_idlj6DbYFoyZW243BAnQ,Who else came because of Buttercup? 😅,en,2025-10-06T22:50:14Z,2025-10-06 18:50:14,1,0
6LS0gf4jcKE,Haunted Hotel | First 9 Minutes Sneak Peek | Netflix,UCWOA1ZGywLbqmigxE4Qlvuw,Netflix,2025-09-12T19:00:00Z,889318,35064,2218,UgxQTm4LPGZuHYowScJ4AaABAg,NA,@mikeybruno9659,UClozI037Nt3cgzscJHSUonw,No! No No No! Not Zaid! Ever!,pt,2025-10-06T20:21:52Z,2025-10-06 16:21:52,0,0
6LS0gf4jcKE,Haunted Hotel | First 9 Minutes Sneak Peek | Netflix,UCWOA1ZGywLbqmigxE4Qlvuw,Netflix,2025-09-12T19:00:00Z,889318,35064,2218,UgyhG4-Cu03M8GpJwVl4AaABAg,NA,@creator_official_,UCj-jEIny9PBuWQO7wxWRgGQ,:0,ja,2025-10-06T16:02:43Z,2025-10-06 12:02:43,1,0
6LS0gf4jcKE,Haunted Hotel | First 9 Minutes Sneak Peek | Netflix,UCWOA1ZGywLbqmigxE4Qlvuw,Netflix,2025-09-12T19:00:00Z,889318,35064,2218,UgxwagT-hCFRLgmWylh4AaABAg,NA,@Acorn905,UCMbuvHtLRBb65GYzxX5qmUA,8:00 Something about the way bag-head guy looks down then up is so cute and funny i love it,en,2025-10-05T22:10:33Z,2025-10-05 18:10:33,1,0
6LS0gf4jcKE,Haunted Hotel | First 9 Minutes Sneak Peek | Netflix,UCWOA1ZGywLbqmigxE4Qlvuw,Netflix,2025-09-12T19:00:00Z,889318,35064,2218,UgxSt7yzalKzSjJPI754AaABAg,NA,@efraingonzalez7352,UC5Xb-N8Hcs9xiDG5lE4lMxQ,Froot loops reference 4:29,en,2025-10-05T22:05:10Z,2025-10-05 18:05:10,2,0
6LS0gf4jcKE,Haunted Hotel | First 9 Minutes Sneak Peek | Netflix,UCWOA1ZGywLbqmigxE4Qlvuw,Netflix,2025-09-12T19:00:00Z,889318,35064,2218,Ugz3WpKI4OdhOYE5N5Z4AaABAg,NA,@Acorn905,UCMbuvHtLRBb65GYzxX5qmUA,"Aw i love this, Abbadon kind of reminds me of Hunter from Owlhouse xD",en,2025-10-05T22:01:44Z,2025-10-05 18:01:44,0,0
6LS0gf4jcKE,Haunted Hotel | First 9 Minutes Sneak Peek | Netflix,UCWOA1ZGywLbqmigxE4Qlvuw,Netflix,2025-09-12T19:00:00Z,889318,35064,2218,UgzSFWIvmUrBZGGqvYF4AaABAg,NA,@Guyver32301,UC5OdAybB0xgmrh1wTHdl3xA,1:15,ja,2025-10-05T20:16:25Z,2025-10-05 16:16:25,1,0
6LS0gf4jcKE,Haunted Hotel | First 9 Minutes Sneak Peek | Netflix,UCWOA1ZGywLbqmigxE4Qlvuw,Netflix,2025-09-12T19:00:00Z,889318,35064,2218,Ugyu9QmvUune8RMlXPl4AaABAg,NA,@blossomsae8355,UCKnqfUz2nxcQ2a0YEDCAK1Q,I finished watching the entire season. I LOVE IT SO MUCH. It gives a similar vibe of Gravity Falls that I have loved for years. It's hard to find something similar to Gravity Falls.,en,2025-10-05T17:01:16Z,2025-10-05 13:01:16,1,0
6LS0gf4jcKE,Haunted Hotel | First 9 Minutes Sneak Peek | Netflix,UCWOA1ZGywLbqmigxE4Qlvuw,Netflix,2025-09-12T19:00:00Z,889318,35064,2218,UgzYrvGkf2qOjRyResR4AaABAg,NA,@lollol6978,UCLDayfoIIZo2lfmKbeKH9uw,Bring back dead end,da,2025-10-05T15:49:09Z,2025-10-05 11:49:09,0,0
6LS0gf4jcKE,Haunted Hotel | First 9 Minutes Sneak Peek | Netflix,UCWOA1ZGywLbqmigxE4Qlvuw,Netflix,2025-09-12T19:00:00Z,889318,35064,2218,Ugw633MWmCgq9IKl6E14AaABAg,NA,@MadeForNothing.,UCuEPHTVk7XZ3p2dnclqvQfg,"They've already greenlit a season 2, so that bodes well for the series as a whole I'd think.",en,2025-10-05T04:05:45Z,2025-10-05 00:05:45,0,0
6LS0gf4jcKE,Haunted Hotel | First 9 Minutes Sneak Peek | Netflix,UCWOA1ZGywLbqmigxE4Qlvuw,Netflix,2025-09-12T19:00:00Z,889318,35064,2218,UgwNCen8ztrSqGhoM0N4AaABAg,NA,@ScarletTheBluehog,UC3QEWz8IsmMVY_q7psH37gQ,we want season 2!!!,NA,2025-10-04T19:46:50Z,2025-10-04 15:46:50,0,1
6LS0gf4jcKE,Haunted Hotel | First 9 Minutes Sneak Peek | Netflix,UCWOA1ZGywLbqmigxE4Qlvuw,Netflix,2025-09-12T19:00:00Z,889318,35064,2218,Ugyx5W9d-KuJinGf8S14AaABAg,NA,@Valery-y1x,UC4VChGpKEUxq3tKRJrmJuzQ,Marco and Jenna in the Hanted hotel,en,2025-10-04T16:18:45Z,2025-10-04 12:18:45,0,0
6LS0gf4jcKE,Haunted Hotel | First 9 Minutes Sneak Peek | Netflix,UCWOA1ZGywLbqmigxE4Qlvuw,Netflix,2025-09-12T19:00:00Z,889318,35064,2218,UgwENAF6ljo_WM982Hh4AaABAg,NA,@LeonardoRosales-h7i,UCRLPjRbksxt_FeOIIhhZiEw,4:31😂,ja,2025-10-04T12:32:14Z,2025-10-04 08:32:14,1,0
6LS0gf4jcKE,Haunted Hotel | First 9 Minutes Sneak Peek | Netflix,UCWOA1ZGywLbqmigxE4Qlvuw,Netflix,2025-09-12T19:00:00Z,889318,35064,2218,UgzXUSxydpXCdF-ywmp4AaABAg,NA,@edmar1934,UC9rs9_ybgn1DEFiE11Btu6w,Hopefully it doesn’t end up like “inside job” …,NA,2025-10-04T08:12:19Z,2025-10-04 04:12:19,0,0
6LS0gf4jcKE,Haunted Hotel | First 9 Minutes Sneak Peek | Netflix,UCWOA1ZGywLbqmigxE4Qlvuw,Netflix,2025-09-12T19:00:00Z,889318,35064,2218,UgxjcyJJl8651_6Veht4AaABAg,NA,@sanr1ov4mp,UCNj79rpX5JciFQ93HefiipA,i love abaddon,NA,2025-10-04T07:08:05Z,2025-10-04 03:08:05,1,0
6LS0gf4jcKE,Haunted Hotel | First 9 Minutes Sneak Peek | Netflix,UCWOA1ZGywLbqmigxE4Qlvuw,Netflix,2025-09-12T19:00:00Z,889318,35064,2218,UgzDrjfccEFM1pcXTHB4AaABAg,NA,@ChadHaynes-m4f,UCsx2H6SWuHs3Rz_PAeARBdw,You know they should take tips from one of the shows I believe I washed before where they use the haunted hotel as an attraction some people love that stuff they pay good money to see it,en,2025-10-04T02:09:56Z,2025-10-03 22:09:56,0,0
6LS0gf4jcKE,Haunted Hotel | First 9 Minutes Sneak Peek | Netflix,UCWOA1ZGywLbqmigxE4Qlvuw,Netflix,2025-09-12T19:00:00Z,889318,35064,2218,UgxRxFqWmdhDJwQTVel4AaABAg,NA,@AlastorThe_RadioDem0n-OverLord,UC0YLq6uwNHKgvDT9oUhsdag,0:29 depressed people be like:,et,2025-10-03T15:57:54Z,2025-10-03 11:57:54,0,0
6LS0gf4jcKE,Haunted Hotel | First 9 Minutes Sneak Peek | Netflix,UCWOA1ZGywLbqmigxE4Qlvuw,Netflix,2025-09-12T19:00:00Z,889318,35064,2218,UgwwHRHA8vWBY5348ix4AaABAg,NA,@Chicóevangelizando,UCIGnFpT9EZ_fVNbOBgaSD3w,"Please, I need more episodes.",en,2025-10-03T01:11:14Z,2025-10-02 21:11:14,1,0
6LS0gf4jcKE,Haunted Hotel | First 9 Minutes Sneak Peek | Netflix,UCWOA1ZGywLbqmigxE4Qlvuw,Netflix,2025-09-12T19:00:00Z,889318,35064,2218,UgzTHxwpEgsYEL7e38N4AaABAg,NA,@Masiimo747,UCbADZLY057nNkQ7PnOLBSBg,🤮🏳‍🌈🤮🏳‍🌈🤮,ja,2025-10-02T19:11:41Z,2025-10-02 15:11:41,0,1
6LS0gf4jcKE,Haunted Hotel | First 9 Minutes Sneak Peek | Netflix,UCWOA1ZGywLbqmigxE4Qlvuw,Netflix,2025-09-12T19:00:00Z,889318,35064,2218,Ugyqy_BnpuX7zapBSFh4AaABAg,NA,@elvondrago96,UCZjFb3TfJaFretpkdx1aafw,@ChippyGaming 3:19 What I will build in 1.4.5 update version of Terraria will be:,en,2025-10-02T14:07:32Z,2025-10-02 10:07:32,5,0
