video_id,video_title,channel_id,channel_title,video_published_at,view_count,video_like_count,video_comment_count,comment_id,comment_parent_id,comment_author_display,comment_author_channel_id,comment_text,comment_lang,comment_published_utc,comment_published_local,comment_like_count,comment_reply_count
6LS0gf4jcKE,Haunted Hotel | First 9 Minutes Sneak Peek | Netflix,UCWOA1ZGywLbqmigxE4Qlvuw,Netflix,2025-09-12T19:00:00Z,889318,35064,2218,UgyU16wf8p5NbAusL994AaABAg,NA,@cozybarista,UCqg7aH4TWmWQFJjux9UxLEQ,excited to watch looks like it’ll be good but let’s not cancel it after two season or leave a vague ssa ending netflix,en,2025-09-19T19:34:40Z,2025-09-19 15:34:40,0,0
6LS0gf4jcKE,Haunted Hotel | First 9 Minutes Sneak Peek | Netflix,UCWOA1ZGywLbqmigxE4Qlvuw,Netflix,2025-09-12T19:00:00Z,889318,35064,2218,UgwKp5AxeMrCRssCQFl4AaABAg,NA,@OctoSynthSFM,UCftwTy7vM9bDcNlSGaF1OrA,Same regurgitated art style I see,et,2025-09-19T18:58:33Z,2025-09-19 14:58:33,0,0
6LS0gf4jcKE,Haunted Hotel | First 9 Minutes Sneak Peek | Netflix,UCWOA1ZGywLbqmigxE4Qlvuw,Netflix,2025-09-12T19:00:00Z,889318,35064,2218,UgyG8swoj8lrmNBXbdx4AaABAg,NA,@scarMEL1,UCpA5tc2_2OxU0KfuNDOH7ug,"Oh boy, a new show! Hope it lasts longer than 2 seasons. said with joys",en,2025-09-19T18:12:41Z,2025-09-19 14:12:41,0,0
6LS0gf4jcKE,Haunted Hotel | First 9 Minutes Sneak Peek | Netflix,UCWOA1ZGywLbqmigxE4Qlvuw,Netflix,2025-09-12T19:00:00Z,889318,35064,2218,Ugw3hjuzItxd9PwB8Mx4AaABAg,NA,@PleaseIJustWantToSleep,UCOnf7B50N8XSuQc26OM3FvQ,look forward to getting invested and have nutfix cancel it,en,2025-09-19T17:59:43Z,2025-09-19 13:59:43,2,0
6LS0gf4jcKE,Haunted Hotel | First 9 Minutes Sneak Peek | Netflix,UCWOA1ZGywLbqmigxE4Qlvuw,Netflix,2025-09-12T19:00:00Z,889318,35064,2218,Ugwf2zsaHEBo76VghBZ4AaABAg,NA,@yasminlondon5795,UCcF9KoFWd5u23lFbGZNRDag,Omg ❤ yessssssssssssss,NA,2025-09-19T17:50:06Z,2025-09-19 13:50:06,1,0
6LS0gf4jcKE,Haunted Hotel | First 9 Minutes Sneak Peek | Netflix,UCWOA1ZGywLbqmigxE4Qlvuw,Netflix,2025-09-12T19:00:00Z,889318,35064,2218,UgwpmA9y_biPObzBTl14AaABAg,NA,@Alex-m1p9z,UC4O3F8te8CQm808UfTO7CJQ,For once I wish we could get a show like this where the characters take shit seriously instead of just Marvel quipping all the time.,en,2025-09-19T17:37:43Z,2025-09-19 13:37:43,0,0
6LS0gf4jcKE,Haunted Hotel | First 9 Minutes Sneak Peek | Netflix,UCWOA1ZGywLbqmigxE4Qlvuw,Netflix,2025-09-12T19:00:00Z,889318,35064,2218,Ugw1lILnnERt4oOBbXR4AaABAg,NA,@LavishMadridsta,UCjxRXqI-qDnuQp_FVAN58DA,"Going to start watching this today, anyone else? 🔥",en,2025-09-19T17:15:14Z,2025-09-19 13:15:14,1,0
6LS0gf4jcKE,Haunted Hotel | First 9 Minutes Sneak Peek | Netflix,UCWOA1ZGywLbqmigxE4Qlvuw,Netflix,2025-09-12T19:00:00Z,889318,35064,2218,UgyJ5oSXPQpgf5TbgbV4AaABAg,NA,@Bigpapaforthewin,UChslfIm72sXBqfRDtJRFwAg,"Whoever’s idea it was to post the first 9 minutes of show was a GENIUS! I love the premise and animation, an will now binge watch the show. Thank you Netflix!",en,2025-09-19T17:12:52Z,2025-09-19 13:12:52,5,0
6LS0gf4jcKE,Haunted Hotel | First 9 Minutes Sneak Peek | Netflix,UCWOA1ZGywLbqmigxE4Qlvuw,Netflix,2025-09-12T19:00:00Z,889318,35064,2218,Ugy08cd3jDLdENy7Szl4AaABAg,NA,@facundorivera5872,UCzxIdMyvClPGL3XpuOCxWOw,Looks generic,NA,2025-09-19T16:26:51Z,2025-09-19 12:26:51,0,0
6LS0gf4jcKE,Haunted Hotel | First 9 Minutes Sneak Peek | Netflix,UCWOA1ZGywLbqmigxE4Qlvuw,Netflix,2025-09-12T19:00:00Z,889318,35064,2218,UgxFrVFI1-ERoxwYo7d4AaABAg,NA,@bignicotine,UCb3nD3MSQnRDFpv7IM_NvZw,"Oh wow, a Netflix animation with the same flat style as the rest! Surely this won’t be cancelled quickly and be overall a 4/10 show",en,2025-09-19T15:59:39Z,2025-09-19 11:59:39,1,0
6LS0gf4jcKE,Haunted Hotel | First 9 Minutes Sneak Peek | Netflix,UCWOA1ZGywLbqmigxE4Qlvuw,Netflix,2025-09-12T19:00:00Z,889318,35064,2218,UgzCKimN0jTfBoiDxgJ4AaABAg,NA,@RB-qu3bz,UC9nZs__lx3w1bqaF2iwQ1IA,"I want Rick and Morty 
It’s smart, genius, mind opening  and funny, always interesting  show",en,2025-09-19T15:43:52Z,2025-09-19 11:43:52,0,0
6LS0gf4jcKE,Haunted Hotel | First 9 Minutes Sneak Peek | Netflix,UCWOA1ZGywLbqmigxE4Qlvuw,Netflix,2025-09-12T19:00:00Z,889318,35064,2218,UgxqVnJc_z1B5knlk6x4AaABAg,NA,@JohnC.8209,UCX78hwSaOegSw-d25m8paiA,looks stupid,et,2025-09-19T15:36:01Z,2025-09-19 11:36:01,0,0
6LS0gf4jcKE,Haunted Hotel | First 9 Minutes Sneak Peek | Netflix,UCWOA1ZGywLbqmigxE4Qlvuw,Netflix,2025-09-12T19:00:00Z,889318,35064,2218,UgxotEIlsX0vavqqlXd4AaABAg,NA,@jeffskyward,UCmN75LDY7QU1VTCZHTkheaA,Corny ass show,pt,2025-09-19T15:30:13Z,2025-09-19 11:30:13,0,0
6LS0gf4jcKE,Haunted Hotel | First 9 Minutes Sneak Peek | Netflix,UCWOA1ZGywLbqmigxE4Qlvuw,Netflix,2025-09-12T19:00:00Z,889318,35064,2218,Ugxb3Q99B_aykECqfYJ4AaABAg,NA,@user-we5it3jk9u,UCbNH3o4jP7qQ71MSV2S88-Q,I honestly don’t know how this is possible but I already knew that was will forte in the thumbnail before knowing anything about this show,en,2025-09-19T15:19:58Z,2025-09-19 11:19:58,6,0
6LS0gf4jcKE,Haunted Hotel | First 9 Minutes Sneak Peek | Netflix,UCWOA1ZGywLbqmigxE4Qlvuw,Netflix,2025-09-12T19:00:00Z,889318,35064,2218,UgwgMDJogAO09ekrIHF4AaABAg,NA,@poke-digi-yugioh-bakuagnfa8193,UCmHnqaMHTh_Qag5xx24KlSw,Anyone else curious about the Slender-Man looking Ghost on the right? 8:38,en,2025-09-19T15:13:42Z,2025-09-19 11:13:42,0,0
6LS0gf4jcKE,Haunted Hotel | First 9 Minutes Sneak Peek | Netflix,UCWOA1ZGywLbqmigxE4Qlvuw,Netflix,2025-09-12T19:00:00Z,889318,35064,2218,UgwCHECvx3C4JmcI4P14AaABAg,NA,@asahel980,UCncUvZbLf79PnN4UUpG0_ig,Isnt this like a revise version of that show a woman who can see ghost and inherited a mansion that she turns to AirBNB and turns out its infested with ghosts and 1 among the ghost is her ancestor.,en,2025-09-19T14:21:04Z,2025-09-19 10:21:04,0,0
6LS0gf4jcKE,Haunted Hotel | First 9 Minutes Sneak Peek | Netflix,UCWOA1ZGywLbqmigxE4Qlvuw,Netflix,2025-09-12T19:00:00Z,889318,35064,2218,UgxPaOaUHm5yfJsL2L14AaABAg,NA,@joodybug,UCW1Ys1SdBWvlkW2_WG_iE_A,Why are you showing us this like you’re not gonna cancel it after two seasons if it even lasts that long😂,en,2025-09-19T14:05:55Z,2025-09-19 10:05:55,0,0
6LS0gf4jcKE,Haunted Hotel | First 9 Minutes Sneak Peek | Netflix,UCWOA1ZGywLbqmigxE4Qlvuw,Netflix,2025-09-12T19:00:00Z,889318,35064,2218,UgwxmYxpCPI1VUnMQxN4AaABAg,NA,@TheRoseAlchemist,UC_fpIZRiTSnJyY6NeSrTNcQ,"Im surprised, that woman doesn't realize she's sitting on a paranormal goldmine. Literally TONS of occult junkies would throw their wallets over to even be the tentacle's chew toy.",en,2025-09-19T13:15:29Z,2025-09-19 09:15:29,22,1
6LS0gf4jcKE,Haunted Hotel | First 9 Minutes Sneak Peek | Netflix,UCWOA1ZGywLbqmigxE4Qlvuw,Netflix,2025-09-12T19:00:00Z,889318,35064,2218,Ugz7B6SZ1OkM8uwT33R4AaABAg,NA,@ArabCritic,UC25Hpsv0MaIWZpgHhfSl2xQ,It is amazing how Netflix in 2025 still has money to throw around on shows as unfunny and unoriginal as this.,en,2025-09-19T13:02:37Z,2025-09-19 09:02:37,0,2
6LS0gf4jcKE,Haunted Hotel | First 9 Minutes Sneak Peek | Netflix,UCWOA1ZGywLbqmigxE4Qlvuw,Netflix,2025-09-12T19:00:00Z,889318,35064,2218,Ugwtk9FELRa-opgqvWJ4AaABAg,NA,@hault360,UCKoNDTHhEVYkz0xZVwhAlZQ,Can't wait for this show to get popular just in time for Netflix to cancel it for not being gay enough,en,2025-09-19T11:52:25Z,2025-09-19 07:52:25,0,0
6LS0gf4jcKE,Haunted Hotel | First 9 Minutes Sneak Peek | Netflix,UCWOA1ZGywLbqmigxE4Qlvuw,Netflix,2025-09-12T19:00:00Z,889318,35064,2218,UgzqFyqXBpdBtNaTMpp4AaABAg,NA,@Temporaryusername-i4h,UCDzevSRm5lh94vJMzC--QBA,"Great premise

Generic art style",NA,2025-09-19T10:08:49Z,2025-09-19 06:08:49,0,0
6LS0gf4jcKE,Haunted Hotel | First 9 Minutes Sneak Peek | Netflix,UCWOA1ZGywLbqmigxE4Qlvuw,Netflix,2025-09-12T19:00:00Z,889318,35064,2218,UgzYQGoPqbfB6G_qZyB4AaABAg,NA,@Baneineiwardisreal,UC01bYFRTtoKC0vMDkZ7-LfQ,This vessel requires fruit loops 🗣️🗣️🗣️🗣️🗣️🗣️🗣️,en,2025-09-19T08:28:23Z,2025-09-19 04:28:23,1,0
6LS0gf4jcKE,Haunted Hotel | First 9 Minutes Sneak Peek | Netflix,UCWOA1ZGywLbqmigxE4Qlvuw,Netflix,2025-09-12T19:00:00Z,889318,35064,2218,UgwNVXys95vqCykE7m94AaABAg,NA,@mingeoclock,UCF4iZfEWUhc3U_YDfhgqnIw,So many aspects of this are like bbc ghosts,en,2025-09-19T07:32:37Z,2025-09-19 03:32:37,0,0
6LS0gf4jcKE,Haunted Hotel | First 9 Minutes Sneak Peek | Netflix,UCWOA1ZGywLbqmigxE4Qlvuw,Netflix,2025-09-12T19:00:00Z,889318,35064,2218,UgxqBwn9eF5CU-oRw9Z4AaABAg,NA,@lilyjade3450,UCZmrEayJ_M0shR8DZw44oNA,"i cant wait to watch this show get popular, become amazing, grow a huge fandom, and then netflix cancel it for some other terrible show that will flop after four episodes.",en,2025-09-19T07:22:45Z,2025-09-19 03:22:45,2,0
6LS0gf4jcKE,Haunted Hotel | First 9 Minutes Sneak Peek | Netflix,UCWOA1ZGywLbqmigxE4Qlvuw,Netflix,2025-09-12T19:00:00Z,889318,35064,2218,Ugy5EiqEqQ6Ln3KcWUZ4AaABAg,NA,@Soopi,UCmR4MKmHkvQNpi_IC8x6Y4g,kind of awesome,en,2025-09-19T05:54:12Z,2025-09-19 01:54:12,0,0
6LS0gf4jcKE,Haunted Hotel | First 9 Minutes Sneak Peek | Netflix,UCWOA1ZGywLbqmigxE4Qlvuw,Netflix,2025-09-12T19:00:00Z,889318,35064,2218,UgxS0e_xHKgoOXV0aGV4AaABAg,NA,@Youreclownin,UCbZBlBPdn9ZsbQYXtCangjg,Anytime I hear Will Forte’s voice Im sold,en,2025-09-19T05:45:26Z,2025-09-19 01:45:26,0,0
6LS0gf4jcKE,Haunted Hotel | First 9 Minutes Sneak Peek | Netflix,UCWOA1ZGywLbqmigxE4Qlvuw,Netflix,2025-09-12T19:00:00Z,889318,35064,2218,UgyUA7mf5KAQ723pec14AaABAg,NA,@mariekandi6914,UCiG37HPbJUGbu51ilgBbz8g,I’m liking this lol,hmn,2025-09-19T05:40:37Z,2025-09-19 01:40:37,1,0
6LS0gf4jcKE,Haunted Hotel | First 9 Minutes Sneak Peek | Netflix,UCWOA1ZGywLbqmigxE4Qlvuw,Netflix,2025-09-12T19:00:00Z,889318,35064,2218,Ugz5x3M9bKyd7WTVGtx4AaABAg,NA,@Yapmaster3k,UCBsb8e8x1iA-kJlAyT4FvqA,Please don’t cancel this,en,2025-09-19T05:22:23Z,2025-09-19 01:22:23,1,0
6LS0gf4jcKE,Haunted Hotel | First 9 Minutes Sneak Peek | Netflix,UCWOA1ZGywLbqmigxE4Qlvuw,Netflix,2025-09-12T19:00:00Z,889318,35064,2218,UgylFXHay-wgg3YEFCl4AaABAg,NA,@brookelevy7145,UCS5OZuDN2jeRrL82gif5hNQ,Oh I’m definitely gonna watch this!,NA,2025-09-19T04:31:13Z,2025-09-19 00:31:13,2,0
6LS0gf4jcKE,Haunted Hotel | First 9 Minutes Sneak Peek | Netflix,UCWOA1ZGywLbqmigxE4Qlvuw,Netflix,2025-09-12T19:00:00Z,889318,35064,2218,Ugyzk_u_dk39pck14CB4AaABAg,NA,@lilbloom_memes,UCu70nXGUdO7PbKB4-8czB_g,this shit just looks like big mouth but worse somehow,en,2025-09-19T03:43:36Z,2025-09-18 23:43:36,0,0
6LS0gf4jcKE,Haunted Hotel | First 9 Minutes Sneak Peek | Netflix,UCWOA1ZGywLbqmigxE4Qlvuw,Netflix,2025-09-12T19:00:00Z,889318,35064,2218,Ugw23AQNxFH8209XK1R4AaABAg,NA,@h4dl3ys_h0p3,UCLKo40vBUa2nGa1x1vtooSg,"This is like a cross between Ghosts and Gravity Falls. Nice. And yeah, 2 seasons, tops. Unless the second season is really bad - then we'll get another 3.",en,2025-09-19T03:37:25Z,2025-09-18 23:37:25,0,0
6LS0gf4jcKE,Haunted Hotel | First 9 Minutes Sneak Peek | Netflix,UCWOA1ZGywLbqmigxE4Qlvuw,Netflix,2025-09-12T19:00:00Z,889318,35064,2218,UgyObp39PUIMlyHUIsR4AaABAg,NA,@Firstladyofjuicycouture,UC9leI_MTbxu8LS7JkOYNC7A,Jessica! 🤭,hr,2025-09-19T02:35:04Z,2025-09-18 22:35:04,0,0
6LS0gf4jcKE,Haunted Hotel | First 9 Minutes Sneak Peek | Netflix,UCWOA1ZGywLbqmigxE4Qlvuw,Netflix,2025-09-12T19:00:00Z,889318,35064,2218,UgxSidtRppmdal-nnWJ4AaABAg,NA,@Sai-uj4qb,UCoI9c4n43YH4w2ur-SPCW3A,I am gonna watch it . I like it ❤,fy,2025-09-19T02:10:36Z,2025-09-18 22:10:36,5,0
6LS0gf4jcKE,Haunted Hotel | First 9 Minutes Sneak Peek | Netflix,UCWOA1ZGywLbqmigxE4Qlvuw,Netflix,2025-09-12T19:00:00Z,889318,35064,2218,UgyDnkyIqswiMBon3Hp4AaABAg,NA,@BoredOtakuss,UC6IJaComB1V58C5u-8r6pNA,It’s giving the show Ghosts but instead with and air bnb,en,2025-09-19T01:51:47Z,2025-09-18 21:51:47,0,0
6LS0gf4jcKE,Haunted Hotel | First 9 Minutes Sneak Peek | Netflix,UCWOA1ZGywLbqmigxE4Qlvuw,Netflix,2025-09-12T19:00:00Z,889318,35064,2218,UgwN9PvAX3xV2wB55pN4AaABAg,NA,@scarlettboggs6381,UCbAVHDY-s8R0pWgruxMf-gw,"Love this show already! Can't to see what they do in season 2- oops Netflix already canceled it for a tax write off again :/

Seriously i think if you want to make an animated tv show rn, STAY AWAY FRLM NETFLIX. They'll buy your ip, make 1 season, cancel it, and then never let you take it back so they can let it rott in their archive of lost media so that no 1 else can have it.",en,2025-09-19T00:38:58Z,2025-09-18 20:38:58,0,0
6LS0gf4jcKE,Haunted Hotel | First 9 Minutes Sneak Peek | Netflix,UCWOA1ZGywLbqmigxE4Qlvuw,Netflix,2025-09-12T19:00:00Z,889318,35064,2218,UgwhI6BlDxhRyI1DvYh4AaABAg,NA,@moniquelj84,UCaDroRF_kLDhD1gtuZxgftg,Wolf Tobin!!!!,de,2025-09-18T23:55:49Z,2025-09-18 19:55:49,0,0
6LS0gf4jcKE,Haunted Hotel | First 9 Minutes Sneak Peek | Netflix,UCWOA1ZGywLbqmigxE4Qlvuw,Netflix,2025-09-12T19:00:00Z,889318,35064,2218,Ugwl8bfxSYqBR1fMaDB4AaABAg,NA,@wuzfoz,UCQ0PUE4pnTRhT6mo6yRu7uQ,Its not really that funny.,en,2025-09-18T23:38:45Z,2025-09-18 19:38:45,0,0
6LS0gf4jcKE,Haunted Hotel | First 9 Minutes Sneak Peek | Netflix,UCWOA1ZGywLbqmigxE4Qlvuw,Netflix,2025-09-12T19:00:00Z,889318,35064,2218,UgzolIIdqCTuM4pA_RZ4AaABAg,NA,@eszemaszeszed,UC-dV_5Cr98_av1d-pWoUfcQ,"its missing the whimsy. idk, something is missing. has no charm and the animals feels dead and the colours too. its also clreas a Ghosts ripoff.",en,2025-09-18T22:55:21Z,2025-09-18 18:55:21,0,0
6LS0gf4jcKE,Haunted Hotel | First 9 Minutes Sneak Peek | Netflix,UCWOA1ZGywLbqmigxE4Qlvuw,Netflix,2025-09-12T19:00:00Z,889318,35064,2218,Ugy2az9TTzfStwXShWl4AaABAg,NA,@grunkle_iz_incidentof_1978,UCsKwwf9N3y84PnyH1_QMQwg,"NETFLIX, PLEASE I'M COMMENTING AND BOOSTING DON'T CANCEL THIS, BIG MOUTH SUCKS.",en,2025-09-18T21:47:23Z,2025-09-18 17:47:23,0,0
6LS0gf4jcKE,Haunted Hotel | First 9 Minutes Sneak Peek | Netflix,UCWOA1ZGywLbqmigxE4Qlvuw,Netflix,2025-09-12T19:00:00Z,889318,35064,2218,Ugx7pAGmwAIdSIkeHW14AaABAg,NA,@IamSpacedad,UCxy7CgdHImtdyWcgnFCg85A,Looks great. Hope it doesn’t get cancelled early.,en,2025-09-18T21:46:27Z,2025-09-18 17:46:27,2,0
6LS0gf4jcKE,Haunted Hotel | First 9 Minutes Sneak Peek | Netflix,UCWOA1ZGywLbqmigxE4Qlvuw,Netflix,2025-09-12T19:00:00Z,889318,35064,2218,UgxTYbq2othqSpOwbQh4AaABAg,NA,@Draco-mr7ib,UC5VCvvxljJ0s3NennGqVSQQ,yea ima need this,sn,2025-09-18T21:30:02Z,2025-09-18 17:30:02,0,0
6LS0gf4jcKE,Haunted Hotel | First 9 Minutes Sneak Peek | Netflix,UCWOA1ZGywLbqmigxE4Qlvuw,Netflix,2025-09-12T19:00:00Z,889318,35064,2218,UgzWQE4AukYv0I0V1GV4AaABAg,NA,@TheTubefan8,UCCaJ45RiPxi9q9PMp0wLOdA,"If there’s ever a chance that Netflix will bring back “Inside Job” and let the series run as long as “Disenchantment,” and hopefully continue from that, so both shows can regain the popularity they started with, then everything could hopefully turn out well for those series and other similar ones in the near and/or far future I mean, considering how films and TV series are done these days that almost seems like a(n) idea that doesn’t sound too bad or impossible to make happen or achieve in some way or another, right?",en,2025-09-18T21:04:31Z,2025-09-18 17:04:31,0,0
6LS0gf4jcKE,Haunted Hotel | First 9 Minutes Sneak Peek | Netflix,UCWOA1ZGywLbqmigxE4Qlvuw,Netflix,2025-09-12T19:00:00Z,889318,35064,2218,UgyhqtrQuaW9DGTnHA54AaABAg,NA,@TheTubefan8,UCCaJ45RiPxi9q9PMp0wLOdA,"I do hope they’ll plan on keeping this new animated adult horror comedy series going, and not cancel it out of the blue for no real rhyme or reason!",en,2025-09-18T20:57:58Z,2025-09-18 16:57:58,1,0
6LS0gf4jcKE,Haunted Hotel | First 9 Minutes Sneak Peek | Netflix,UCWOA1ZGywLbqmigxE4Qlvuw,Netflix,2025-09-12T19:00:00Z,889318,35064,2218,UgwwBo_bmDvgFHN1lH54AaABAg,NA,@NickVS,UCV_nnQXt1cRWodUtqiOnbpA,Never will forgive you for canceling inside job... unless you bring it back...,en,2025-09-18T20:54:51Z,2025-09-18 16:54:51,0,0
6LS0gf4jcKE,Haunted Hotel | First 9 Minutes Sneak Peek | Netflix,UCWOA1ZGywLbqmigxE4Qlvuw,Netflix,2025-09-12T19:00:00Z,889318,35064,2218,UgzpkiBUXvWI14lZl0V4AaABAg,NA,@biancasp2023,UC476F0L5lMu0ixKRst7_mSQ,❤️‍🔥🔥❤️‍🔥🔥❤️‍🔥🔥👻🤣🤣🤣,ne,2025-09-18T20:48:03Z,2025-09-18 16:48:03,0,0
6LS0gf4jcKE,Haunted Hotel | First 9 Minutes Sneak Peek | Netflix,UCWOA1ZGywLbqmigxE4Qlvuw,Netflix,2025-09-12T19:00:00Z,889318,35064,2218,UgzMfGOPSilZ2Yqzfc14AaABAg,NA,@AhoBot,UChWRulZ8a2jIeQLMBFsTi3Q,"""Blah blah netflix is gonna cancel this after 2 seasons yadda yadda"" That's what not having faith in an animated show sounds like, assholes.",en,2025-09-18T20:35:02Z,2025-09-18 16:35:02,1,0
6LS0gf4jcKE,Haunted Hotel | First 9 Minutes Sneak Peek | Netflix,UCWOA1ZGywLbqmigxE4Qlvuw,Netflix,2025-09-12T19:00:00Z,889318,35064,2218,UgytrEyoej-_CoVzEJl4AaABAg,NA,@mikethemic-v4h,UCM1scaz4-HMVwiM0EE0fm4g,I’m gona love this show.,NA,2025-09-18T20:18:52Z,2025-09-18 16:18:52,1,0
6LS0gf4jcKE,Haunted Hotel | First 9 Minutes Sneak Peek | Netflix,UCWOA1ZGywLbqmigxE4Qlvuw,Netflix,2025-09-12T19:00:00Z,889318,35064,2218,UgzjtQBtwEr-Mr87R8F4AaABAg,NA,@kaitoumara,UCpFBhI1Mm83hOYdn9585h7g,I will probablycancel my Netflux accou t when this gets cancelled. I feel like they just keep cancelling the good shows so what's the point?,en,2025-09-18T19:27:19Z,2025-09-18 15:27:19,0,0
6LS0gf4jcKE,Haunted Hotel | First 9 Minutes Sneak Peek | Netflix,UCWOA1ZGywLbqmigxE4Qlvuw,Netflix,2025-09-12T19:00:00Z,889318,35064,2218,UgyzQqkXrJFNvrVbcFl4AaABAg,NA,@cookiewookied,UC6YjRJF642yMkXtZFFS44yg,"Yes! Finally, a show with white people and none of them are gay retards",en,2025-09-18T19:17:07Z,2025-09-18 15:17:07,1,0
6LS0gf4jcKE,Haunted Hotel | First 9 Minutes Sneak Peek | Netflix,UCWOA1ZGywLbqmigxE4Qlvuw,Netflix,2025-09-12T19:00:00Z,889318,35064,2218,UgyDemAogHSVHhj1JtV4AaABAg,NA,@jynxthaclown3995,UCU5GmvFaiJUqvfdUBzcWq0Q,"I would watch this, it’s really good so I know Netflix will give it one season",en,2025-09-18T19:13:19Z,2025-09-18 15:13:19,0,0
6LS0gf4jcKE,Haunted Hotel | First 9 Minutes Sneak Peek | Netflix,UCWOA1ZGywLbqmigxE4Qlvuw,Netflix,2025-09-12T19:00:00Z,889318,35064,2218,UgyR_8u8_MdvvJ8bHX14AaABAg,NA,@JamiePinesTheFeralWitch,UCDiPeOV3mEO9okw-xyWnspg,Gonna fall for this show only for it to get cancelled 😢,en,2025-09-18T19:05:54Z,2025-09-18 15:05:54,3,0
6LS0gf4jcKE,Haunted Hotel | First 9 Minutes Sneak Peek | Netflix,UCWOA1ZGywLbqmigxE4Qlvuw,Netflix,2025-09-12T19:00:00Z,889318,35064,2218,UgxOwOgoutHp0CMCDi94AaABAg,NA,@erubeydarkness,UC0TE_eAOYE_tmMwjpdW-y3w,Just cancel it already as you guys do with every show,en,2025-09-18T18:51:19Z,2025-09-18 14:51:19,0,0
6LS0gf4jcKE,Haunted Hotel | First 9 Minutes Sneak Peek | Netflix,UCWOA1ZGywLbqmigxE4Qlvuw,Netflix,2025-09-12T19:00:00Z,889318,35064,2218,Ugza1i_nIf98iNNu0MB4AaABAg,NA,@Banguila,UCj-kLcNAA8rm0XRSMafgDkQ,Generic ahh animation,NA,2025-09-18T17:38:29Z,2025-09-18 13:38:29,0,0
6LS0gf4jcKE,Haunted Hotel | First 9 Minutes Sneak Peek | Netflix,UCWOA1ZGywLbqmigxE4Qlvuw,Netflix,2025-09-12T19:00:00Z,889318,35064,2218,UgwlVxMgXbVc5I5NRWJ4AaABAg,NA,@Pidgeon_Queen,UCUPmbC_yKTx0MjmiyWdcQCQ,"Guys stop saying it'll get cancelled, if it's on Netflix, it's on Netflix, we'll worry about that later",en,2025-09-18T17:28:46Z,2025-09-18 13:28:46,9,0
6LS0gf4jcKE,Haunted Hotel | First 9 Minutes Sneak Peek | Netflix,UCWOA1ZGywLbqmigxE4Qlvuw,Netflix,2025-09-12T19:00:00Z,889318,35064,2218,Ugxp_f_q42aRvdVxEOF4AaABAg,NA,@bobo7918,UCRwNf1N_2zMZTJ8GBdmMGcw,This animation is so uninspiring. Pure slop.,en,2025-09-18T17:25:35Z,2025-09-18 13:25:35,1,0
6LS0gf4jcKE,Haunted Hotel | First 9 Minutes Sneak Peek | Netflix,UCWOA1ZGywLbqmigxE4Qlvuw,Netflix,2025-09-12T19:00:00Z,889318,35064,2218,UgxJ683XZOa4KJWU-QJ4AaABAg,NA,@JoelleFromHell,UCMLMak31Jjow2nxs8cSP2xA,"Do you know how many people would stay at a place with CONFIRMED ghost habitation? Take the already millions of nuts who go to fakies, and multiply by a million.

Also... WHY ARE YOU ADVERTISING CRAP NOT CURRENTLY AVAILABLE! I literally might forget by tomorrow....",en,2025-09-18T17:07:29Z,2025-09-18 13:07:29,0,0
6LS0gf4jcKE,Haunted Hotel | First 9 Minutes Sneak Peek | Netflix,UCWOA1ZGywLbqmigxE4Qlvuw,Netflix,2025-09-12T19:00:00Z,889318,35064,2218,Ugxy5yNwAaQRFr-uesd4AaABAg,NA,@greykollasunneva,UCSRnqL7OwkebJudd5piXGLw,Oh god this can’t keep happening! This looks really fun please give me more than one or two season,en,2025-09-18T17:01:39Z,2025-09-18 13:01:39,1,0
6LS0gf4jcKE,Haunted Hotel | First 9 Minutes Sneak Peek | Netflix,UCWOA1ZGywLbqmigxE4Qlvuw,Netflix,2025-09-12T19:00:00Z,889318,35064,2218,UgxKhHr3S22-BJMUIqV4AaABAg,NA,@claytonhawk8512,UCIx9f1qvUuQNmeOraf7jOEA,This animation style needs to go,en,2025-09-18T16:51:10Z,2025-09-18 12:51:10,0,0
6LS0gf4jcKE,Haunted Hotel | First 9 Minutes Sneak Peek | Netflix,UCWOA1ZGywLbqmigxE4Qlvuw,Netflix,2025-09-12T19:00:00Z,889318,35064,2218,UgywM2dsj3NHSz2Lg-14AaABAg,NA,@alpaca1775,UCrO3k-V4e3NxiIaM3rQ7Fhg,"the spiderwick chronicles meets ghosts, meh ill watch because im a consumer and love slop but im not impressed",en,2025-09-18T15:21:43Z,2025-09-18 11:21:43,0,0
6LS0gf4jcKE,Haunted Hotel | First 9 Minutes Sneak Peek | Netflix,UCWOA1ZGywLbqmigxE4Qlvuw,Netflix,2025-09-12T19:00:00Z,889318,35064,2218,UgyjiQOMra8xS114h_p4AaABAg,NA,@Whothatgiiiiirl,UCOCwmL850jsw2n42gQzMaVQ,I’m predicting Nathan fanart 🥹🥹,fil,2025-09-18T14:32:33Z,2025-09-18 10:32:33,0,0
6LS0gf4jcKE,Haunted Hotel | First 9 Minutes Sneak Peek | Netflix,UCWOA1ZGywLbqmigxE4Qlvuw,Netflix,2025-09-12T19:00:00Z,889318,35064,2218,Ugwp_EZf_TptyXDaC2V4AaABAg,NA,@lovinggossipgirl,UCy6jxapSibOdFdCIoBD77bw,I’m sold😍😍😍,da,2025-09-18T14:13:00Z,2025-09-18 10:13:00,1,0
6LS0gf4jcKE,Haunted Hotel | First 9 Minutes Sneak Peek | Netflix,UCWOA1ZGywLbqmigxE4Qlvuw,Netflix,2025-09-12T19:00:00Z,889318,35064,2218,UgxtsISxw3Kuw9ks2jt4AaABAg,NA,@ManMountainMetals,UCY8UlZV2hRm-zpaSJI_llHQ,This is stupid 😂,en,2025-09-18T14:08:44Z,2025-09-18 10:08:44,1,0
6LS0gf4jcKE,Haunted Hotel | First 9 Minutes Sneak Peek | Netflix,UCWOA1ZGywLbqmigxE4Qlvuw,Netflix,2025-09-12T19:00:00Z,889318,35064,2218,UgwyVr_5jTsePTzRJGx4AaABAg,NA,@blueyblue5831,UC9pinHyAruRbtawL0ueEN0Q,"Why does the cover for this look like a Royal crackers rip off? Plus can we please get a more unique art style for animated shows? Almost Every adult animation looks the same. Also the name is so uninspired & unoriginal :( 

Dan Harmon is a executive producer on this and you can tell the correlation with this & Rick and Morty: Older Male guardian that's weird and everyone ignores, Bossy mom,  the kids seem like aged down Morty & Summer. It's a fun idea... for a Rick and Morty episode but I can see this getting tired towards the end like all of Dans other Newer Animated shows. He just needs to put his all into Rick and Morty cause he's been hands off pretty much for the past few years but maybe that's for the best cause the last season was amazing.

I'll be surprised if Netflix lets this pass the first season but I hope for the best cause I got to support new animation regardless",en,2025-09-18T13:51:43Z,2025-09-18 09:51:43,1,0
6LS0gf4jcKE,Haunted Hotel | First 9 Minutes Sneak Peek | Netflix,UCWOA1ZGywLbqmigxE4Qlvuw,Netflix,2025-09-12T19:00:00Z,889318,35064,2218,UgxWu7Wps4WblDRerC14AaABAg,NA,@sleeping637,UCtbaLbc6bbBRSdHMCEQwWEA,This is like fosters home for imaginary friends but with ghost instead,en,2025-09-18T13:10:58Z,2025-09-18 09:10:58,0,0
6LS0gf4jcKE,Haunted Hotel | First 9 Minutes Sneak Peek | Netflix,UCWOA1ZGywLbqmigxE4Qlvuw,Netflix,2025-09-12T19:00:00Z,889318,35064,2218,UgxWV-u6hkk6iGw0N5R4AaABAg,NA,@OurHourglass,UChZZTThU0QK73cR5OldL_1g,"So, someone over 40 really likes Gravity Falls and Owl House, and also probably Great North. Wonder who...",en,2025-09-18T12:42:01Z,2025-09-18 08:42:01,0,1
6LS0gf4jcKE,Haunted Hotel | First 9 Minutes Sneak Peek | Netflix,UCWOA1ZGywLbqmigxE4Qlvuw,Netflix,2025-09-12T19:00:00Z,889318,35064,2218,Ugx0C4LzNM1d113c0tx4AaABAg,NA,@a-buttonace,UCYWMjoQ4dPpoCtp_RYcQacg,This show still didn't debut? I've heard about it a long time ago.,en,2025-09-18T12:28:52Z,2025-09-18 08:28:52,0,0
6LS0gf4jcKE,Haunted Hotel | First 9 Minutes Sneak Peek | Netflix,UCWOA1ZGywLbqmigxE4Qlvuw,Netflix,2025-09-12T19:00:00Z,889318,35064,2218,UgyWlGTRIB7S3elqRFx4AaABAg,NA,@DaSteeJ07,UC62ySB4F8obPQJHd7ohnvhg,The animation is mid,en,2025-09-18T12:04:44Z,2025-09-18 08:04:44,0,0
6LS0gf4jcKE,Haunted Hotel | First 9 Minutes Sneak Peek | Netflix,UCWOA1ZGywLbqmigxE4Qlvuw,Netflix,2025-09-12T19:00:00Z,889318,35064,2218,UgwKRlIha_7o42LGIsd4AaABAg,NA,@j.j.b.13,UC6cVaLZ9OG9blsC3B2XCN6A,Sounds and looks like Gravity Falls,en,2025-09-18T12:01:11Z,2025-09-18 08:01:11,0,0
6LS0gf4jcKE,Haunted Hotel | First 9 Minutes Sneak Peek | Netflix,UCWOA1ZGywLbqmigxE4Qlvuw,Netflix,2025-09-12T19:00:00Z,889318,35064,2218,UgzeEOPq2USHrwUVLOx4AaABAg,NA,@AlistairKiwi,UC4TSLRc-FCNhzhUWLKL-c_A,"It's Netflix so if this is a great show they'll cancel it after one season, like Kaos or Dead Boy Detectives. If it's only average they'll give it 2 seasons, but if rubbish Netflix will give it 7 seasons.",en,2025-09-18T10:49:25Z,2025-09-18 06:49:25,0,0
6LS0gf4jcKE,Haunted Hotel | First 9 Minutes Sneak Peek | Netflix,UCWOA1ZGywLbqmigxE4Qlvuw,Netflix,2025-09-12T19:00:00Z,889318,35064,2218,UgxiHi6NHMJBNJfKoK94AaABAg,NA,@LucaLőrincz-z3t,UCwsXgOmQzlJjQXDZtE14QaQ,"I can’t wait , to go home from school and watch it😊😊",en,2025-09-18T08:52:01Z,2025-09-18 04:52:01,0,0
6LS0gf4jcKE,Haunted Hotel | First 9 Minutes Sneak Peek | Netflix,UCWOA1ZGywLbqmigxE4Qlvuw,Netflix,2025-09-12T19:00:00Z,889318,35064,2218,UgwLRy4TGROG4jhBYKJ4AaABAg,NA,@JSabu,UCScOWhOHds-i0mUI18DPrEA,Has some elements of Gravity Falls and even the intro sounds similar. I think I will enjoy this.,en,2025-09-18T08:13:17Z,2025-09-18 04:13:17,0,0
6LS0gf4jcKE,Haunted Hotel | First 9 Minutes Sneak Peek | Netflix,UCWOA1ZGywLbqmigxE4Qlvuw,Netflix,2025-09-12T19:00:00Z,889318,35064,2218,UgyoOJE0rONG9DW1zjh4AaABAg,NA,@Everflamen,UC4e8kPG2N4EZLlVU1C-6f9w,Boring animation,NA,2025-09-18T08:03:46Z,2025-09-18 04:03:46,1,0
