video_id,video_title,channel_id,channel_title,video_published_at,reply_id,reply_parent_comment_id,reply_author_display,reply_author_channel_id,reply_text,reply_lang,reply_published_utc,reply_published_local,reply_like_count
1iqra1ojEvM,Black Mirror: Season 7 | Official Trailer | Netflix,UCWOA1ZGywLbqmigxE4Qlvuw,Netflix,2025-03-13T17:00:00Z,UgzZ3DNDUFULEofhIT94AaABAg.ANt3PGVwefEAO66sGTHF3Q,UgzZ3DNDUFULEofhIT94AaABAg,@MissDaisy343,UCPGgfg3I_2dVlJgo4LI_6XQ,It will be a GTA 6 just gimme time 2 unravel these creeps once & 4 all 👩🏾,en,2025-10-10T15:56:04Z,2025-10-10 11:56:04,0
1iqra1ojEvM,Black Mirror: Season 7 | Official Trailer | Netflix,UCWOA1ZGywLbqmigxE4Qlvuw,Netflix,2025-03-13T17:00:00Z,UgzV6W3qW6EidJc4orp4AaABAg.ALnRHE-Ouf1AMXOV9IzQY9,UgzV6W3qW6EidJc4orp4AaABAg,@deckard2665,UChLO95q1hp40fvPyfyqtNaw,Good to have you.,en,2025-09-01T13:06:46Z,2025-09-01 09:06:46,0
1iqra1ojEvM,Black Mirror: Season 7 | Official Trailer | Netflix,UCWOA1ZGywLbqmigxE4Qlvuw,Netflix,2025-03-13T17:00:00Z,UgxyYwFJenw1OlGiwWJ4AaABAg.AKzAyBVkvHaALTKs3jkogs,UgxyYwFJenw1OlGiwWJ4AaABAg,@gloria.meyitt,UCeu06rTrfJztpgR19iT81fQ,Lies,lb,2025-08-06T02:46:43Z,2025-08-05 22:46:43,0
1iqra1ojEvM,Black Mirror: Season 7 | Official Trailer | Netflix,UCWOA1ZGywLbqmigxE4Qlvuw,Netflix,2025-03-13T17:00:00Z,Ugx628EiZFeI9N_PDzN4AaABAg.AKN6TEbXbHYAO67u4Ic4IJ,Ugx628EiZFeI9N_PDzN4AaABAg,@MissDaisy343,UCPGgfg3I_2dVlJgo4LI_6XQ,☄️,ne,2025-10-10T16:05:03Z,2025-10-10 12:05:03,0
1iqra1ojEvM,Black Mirror: Season 7 | Official Trailer | Netflix,UCWOA1ZGywLbqmigxE4Qlvuw,Netflix,2025-03-13T17:00:00Z,UgwVGOnxG1EtzqjGiLt4AaABAg.AHa_DNSsa7hAO68hZ_5TmO,UgwVGOnxG1EtzqjGiLt4AaABAg,@MissDaisy343,UCPGgfg3I_2dVlJgo4LI_6XQ,Skynet,NA,2025-10-10T16:12:04Z,2025-10-10 12:12:04,0
1iqra1ojEvM,Black Mirror: Season 7 | Official Trailer | Netflix,UCWOA1ZGywLbqmigxE4Qlvuw,Netflix,2025-03-13T17:00:00Z,UgxN3JDrh9h7C6sItnt4AaABAg.AHYSNqkgRhLAO68v3rh_Ln,UgxN3JDrh9h7C6sItnt4AaABAg,@MissDaisy343,UCPGgfg3I_2dVlJgo4LI_6XQ,It’s because we’re alone and they’re grouped up,en,2025-10-10T16:13:55Z,2025-10-10 12:13:55,0
1iqra1ojEvM,Black Mirror: Season 7 | Official Trailer | Netflix,UCWOA1ZGywLbqmigxE4Qlvuw,Netflix,2025-03-13T17:00:00Z,UgynMBTW7oc2geL5eSl4AaABAg.AHWTi37CfhaAIq6GQQYsEX,UgynMBTW7oc2geL5eSl4AaABAg,@fh5875,UCRdSueOL0lVQN5sZVJLW4cQ,I agree. This is the only season that was disappointing. Maybe they ran out of ideas.,en,2025-06-01T18:46:42Z,2025-06-01 14:46:42,0
1iqra1ojEvM,Black Mirror: Season 7 | Official Trailer | Netflix,UCWOA1ZGywLbqmigxE4Qlvuw,Netflix,2025-03-13T17:00:00Z,UgzR1oo1eOHuZ3eotDR4AaABAg.AHSXW64J0ZlAHVTG_quYkW,UgzR1oo1eOHuZ3eotDR4AaABAg,@fizzypizzel6477,UCLeCng-tEua0qqZ-9wrBYdQ,yes,en,2025-04-29T12:33:00Z,2025-04-29 08:33:00,0
1iqra1ojEvM,Black Mirror: Season 7 | Official Trailer | Netflix,UCWOA1ZGywLbqmigxE4Qlvuw,Netflix,2025-03-13T17:00:00Z,UgxgohDcjztWL92xy2N4AaABAg.AHQ4y2vy0qGAHZ9iTrf2Zu,UgxgohDcjztWL92xy2N4AaABAg,@classicmac8986,UCtsJMMLvdUm8U6P_2oDvpow,3rd is a piece of art,en,2025-04-30T22:59:09Z,2025-04-30 18:59:09,1
1iqra1ojEvM,Black Mirror: Season 7 | Official Trailer | Netflix,UCWOA1ZGywLbqmigxE4Qlvuw,Netflix,2025-03-13T17:00:00Z,UgxgohDcjztWL92xy2N4AaABAg.AHQ4y2vy0qGAHZmjp9nT60,UgxgohDcjztWL92xy2N4AaABAg,@andyferrans2578,UCNDcwNGx2PFUwGY-ARkpSfA,@ easly please,NA,2025-05-01T04:48:52Z,2025-05-01 00:48:52,0
1iqra1ojEvM,Black Mirror: Season 7 | Official Trailer | Netflix,UCWOA1ZGywLbqmigxE4Qlvuw,Netflix,2025-03-13T17:00:00Z,UgxLvkqqr-StxoXu3b94AaABAg.AHMxeQBDqhYAHOcxCmXnaI,UgxLvkqqr-StxoXu3b94AaABAg,@naz6james570,UC28Uhw8aNd5JHl62JxZLVRA,"This show is not for kids, next time please ask your parents permission before you watch anything on netflix",en,2025-04-26T20:51:40Z,2025-04-26 16:51:40,2
1iqra1ojEvM,Black Mirror: Season 7 | Official Trailer | Netflix,UCWOA1ZGywLbqmigxE4Qlvuw,Netflix,2025-03-13T17:00:00Z,UgwEmzV4uXlDY3sAIQN4AaABAg.AHMKiAqRM-GAHMMlTar9_T,UgwEmzV4uXlDY3sAIQN4AaABAg,@PSpice-k6d,UCR7zVRGYEmIEBzvUC4Nk1CA,It's so sad cuz he's only in it for 3 minutes😢 he's only in the episode for the trailer.,en,2025-04-25T23:43:02Z,2025-04-25 19:43:02,0
1iqra1ojEvM,Black Mirror: Season 7 | Official Trailer | Netflix,UCWOA1ZGywLbqmigxE4Qlvuw,Netflix,2025-03-13T17:00:00Z,UgySRhn8zMeeIukis-Z4AaABAg.AHL_28bfq1VAHOhMEHfaRb,UgySRhn8zMeeIukis-Z4AaABAg,@naz6james570,UC28Uhw8aNd5JHl62JxZLVRA,"In essence, this show is a carried on modern adaptation of the twilight zone. The ""stealing"" part as you said it is the anthology format(every episode is a different and self-contained story). Twilight zone is more towards comedy and fantasy, black mirror more towards darker scifi and dystopian futures.",en,2025-04-26T21:30:10Z,2025-04-26 17:30:10,0
1iqra1ojEvM,Black Mirror: Season 7 | Official Trailer | Netflix,UCWOA1ZGywLbqmigxE4Qlvuw,Netflix,2025-03-13T17:00:00Z,UgySRhn8zMeeIukis-Z4AaABAg.AHL_28bfq1VAHQaC4yov2i,UgySRhn8zMeeIukis-Z4AaABAg,@ChessMage-h1p,UCMsVCrep27EKWGWDG4BCbdA,@naz6james570  think again buddy. I'm from that era. There were tons of episodes that weren't comedic. Give me a break. Are you even an american?,en,2025-04-27T15:06:06Z,2025-04-27 11:06:06,0
1iqra1ojEvM,Black Mirror: Season 7 | Official Trailer | Netflix,UCWOA1ZGywLbqmigxE4Qlvuw,Netflix,2025-03-13T17:00:00Z,UgySRhn8zMeeIukis-Z4AaABAg.AHL_28bfq1VAHQosFenZ2m,UgySRhn8zMeeIukis-Z4AaABAg,@naz6james570,UC28Uhw8aNd5JHl62JxZLVRA,"@ChessMage-h1p  I use the wrong word there, not comedy but more like light-hearted thought provoking. I've watched some of the best episodes recommended online. You were from that era, so you watch that show on tv as a kid. That's the difference, Black Mirror is not for kids. Why are you typing like you mad? It's only a tv show and I'm not american. Are you depressed? Take a break and come visit my country, I live in Singapore.",en,2025-04-27T17:14:19Z,2025-04-27 13:14:19,0
1iqra1ojEvM,Black Mirror: Season 7 | Official Trailer | Netflix,UCWOA1ZGywLbqmigxE4Qlvuw,Netflix,2025-03-13T17:00:00Z,UgzG75ISQL-9GoR4I6N4AaABAg.AHGIz8MGPqWAHMLiaYDBbq,UgzG75ISQL-9GoR4I6N4AaABAg,@PSpice-k6d,UCR7zVRGYEmIEBzvUC4Nk1CA,😂 sure Jan.,NA,2025-04-25T23:33:54Z,2025-04-25 19:33:54,0
1iqra1ojEvM,Black Mirror: Season 7 | Official Trailer | Netflix,UCWOA1ZGywLbqmigxE4Qlvuw,Netflix,2025-03-13T17:00:00Z,UgxD0HBLVlwMmBRLkqZ4AaABAg.AHEqFfgHtfXAHIRBfepm0L,UgxD0HBLVlwMmBRLkqZ4AaABAg,@holdondc,UCC03He1C0vwvm_jqVzgdd_g,"Yes , but some episodes are still good , like in the uss callister",en,2025-04-24T11:04:44Z,2025-04-24 07:04:44,0
1iqra1ojEvM,Black Mirror: Season 7 | Official Trailer | Netflix,UCWOA1ZGywLbqmigxE4Qlvuw,Netflix,2025-03-13T17:00:00Z,UgxD0HBLVlwMmBRLkqZ4AaABAg.AHEqFfgHtfXAHOm9-8ws56,UgxD0HBLVlwMmBRLkqZ4AaABAg,@naz6james570,UC28Uhw8aNd5JHl62JxZLVRA,"At least its better than last season, Uss callister is the best episode imo. Hotel Reverie would've been my favorite, but the main actress sucks. I dont know if it is on script or she just bad at acting. She has  like sister in the hood preaching vibe and it doesn't fit well, it doesn't even look charming at all..😑",en,2025-04-26T22:12:03Z,2025-04-26 18:12:03,1
1iqra1ojEvM,Black Mirror: Season 7 | Official Trailer | Netflix,UCWOA1ZGywLbqmigxE4Qlvuw,Netflix,2025-03-13T17:00:00Z,UgyEszLEGUY73QX6GEF4AaABAg.AHEG9EryOCUAHEOQQ8nI_w,UgyEszLEGUY73QX6GEF4AaABAg,@shrekshrek,UCHk5VKdkf_DAJBP6O50jo8w,"Watch it, it's  pretty good it's  basicaly  just random stories   i recomend watching  the episode  named white bear   the new season is not that good but yeah",en,2025-04-22T21:23:34Z,2025-04-22 17:23:34,0
1iqra1ojEvM,Black Mirror: Season 7 | Official Trailer | Netflix,UCWOA1ZGywLbqmigxE4Qlvuw,Netflix,2025-03-13T17:00:00Z,UgyEszLEGUY73QX6GEF4AaABAg.AHEG9EryOCUAHGH4LNnXvz,UgyEszLEGUY73QX6GEF4AaABAg,@fd3,UCj4kNgU2LSLcKRqDgfbbnFw,"It’s an incredibly phenomenal but very dark show! You could binge in order but Ep 1 turns off a lot of viewers. If you’re scared of a disgusting dark first episode, I’d recommend researching lists of Top Ranked Episodes :) My personal Top episodes I recommend are: USS Callister, Nosedive, Shut Up and Dance, Hang the DJ, Hated in the Nation, Striking Vipers, White Christmas, San Junipero, and I love Black Museum!",en,2025-04-23T14:57:52Z,2025-04-23 10:57:52,1
1iqra1ojEvM,Black Mirror: Season 7 | Official Trailer | Netflix,UCWOA1ZGywLbqmigxE4Qlvuw,Netflix,2025-03-13T17:00:00Z,Ugwu2wAseocC_CBfsNJ4AaABAg.AH9HakOHEBEAHMLsh2jP56,Ugwu2wAseocC_CBfsNJ4AaABAg,@PSpice-k6d,UCR7zVRGYEmIEBzvUC4Nk1CA,The queer episode was disgusting!,en,2025-04-25T23:35:17Z,2025-04-25 19:35:17,0
1iqra1ojEvM,Black Mirror: Season 7 | Official Trailer | Netflix,UCWOA1ZGywLbqmigxE4Qlvuw,Netflix,2025-03-13T17:00:00Z,Ugwd9lv6Pi-XBR9srYt4AaABAg.AH88Uz0fUiUAHMM-YK9wxa,Ugwd9lv6Pi-XBR9srYt4AaABAg,@PSpice-k6d,UCR7zVRGYEmIEBzvUC4Nk1CA,Are you joking? You gotta be 😂 the whole season 7 is riddled with it. Woke abd ruined :(,en,2025-04-25T23:36:21Z,2025-04-25 19:36:21,0
1iqra1ojEvM,Black Mirror: Season 7 | Official Trailer | Netflix,UCWOA1ZGywLbqmigxE4Qlvuw,Netflix,2025-03-13T17:00:00Z,Ugwd9lv6Pi-XBR9srYt4AaABAg.AH88Uz0fUiUAHMNzRJI5Gk,Ugwd9lv6Pi-XBR9srYt4AaABAg,@makeitsonumberone1358,UCHkVhIb9ImJ-kR4alYNSFoA,"@PSpice-k6d  yer after episode 2 it fell on its face 🤣
I was a little premature in my comment lol",en,2025-04-25T23:53:41Z,2025-04-25 19:53:41,0
1iqra1ojEvM,Black Mirror: Season 7 | Official Trailer | Netflix,UCWOA1ZGywLbqmigxE4Qlvuw,Netflix,2025-03-13T17:00:00Z,UgyGaInYMczKv3frQfR4AaABAg.AH2O1FXyfvNAHGHXRY51p-,UgyGaInYMczKv3frQfR4AaABAg,@fd3,UCj4kNgU2LSLcKRqDgfbbnFw,"Squid Games is so trash and mediocre. The “death games” concept has been done for the last 2 decades and is now so overdone and old. Also many people consider Squid Games “modern day slop”because it’s just derived from old concepts. Meanwhile Black Mirror has an original story every episode. If you decide to watch someone else, at least watch Alice in Borderline, it’s 10x better.",en,2025-04-23T15:01:51Z,2025-04-23 11:01:51,0
1iqra1ojEvM,Black Mirror: Season 7 | Official Trailer | Netflix,UCWOA1ZGywLbqmigxE4Qlvuw,Netflix,2025-03-13T17:00:00Z,Ugxy4M15a3Ne-l8kHRZ4AaABAg.AH12-gIjCIlAH3b4pTe15l,Ugxy4M15a3Ne-l8kHRZ4AaABAg,@Soredli,UCdnUpEQ9kPcZ8YHxaSA222g,There was only 1 woke episode what are you talking about lil bro 💀,en,2025-04-18T16:51:19Z,2025-04-18 12:51:19,2
1iqra1ojEvM,Black Mirror: Season 7 | Official Trailer | Netflix,UCWOA1ZGywLbqmigxE4Qlvuw,Netflix,2025-03-13T17:00:00Z,UgyA8UlPY6cvyUI0PRp4AaABAg.AH-0t83lVN7AH-DBTZ8V_M,UgyA8UlPY6cvyUI0PRp4AaABAg,@gabrielmartins2959,UCTvxtsYl72fqfFbeS5c4Rzw,oh no,NA,2025-04-16T23:56:48Z,2025-04-16 19:56:48,0
1iqra1ojEvM,Black Mirror: Season 7 | Official Trailer | Netflix,UCWOA1ZGywLbqmigxE4Qlvuw,Netflix,2025-03-13T17:00:00Z,UgyA8UlPY6cvyUI0PRp4AaABAg.AH-0t83lVN7AH-QaKvkI8X,UgyA8UlPY6cvyUI0PRp4AaABAg,@fd3,UCj4kNgU2LSLcKRqDgfbbnFw,Can you give a logical reasonable meaningful explanation by what you mean is “woke”? We would like to know and hear your logical explaining.,en,2025-04-17T01:53:56Z,2025-04-16 21:53:56,1
1iqra1ojEvM,Black Mirror: Season 7 | Official Trailer | Netflix,UCWOA1ZGywLbqmigxE4Qlvuw,Netflix,2025-03-13T17:00:00Z,UgyA8UlPY6cvyUI0PRp4AaABAg.AH-0t83lVN7AH02KG1Dy_F,UgyA8UlPY6cvyUI0PRp4AaABAg,@rafaelgeorge49,UCiWKNQ19r17737BKO76M3Ag,"@fd3 I like when woke people try to act intelligent. Look at you.
No answer will satisfy your soul.
Grow up and be a man.",en,2025-04-17T07:41:07Z,2025-04-17 03:41:07,3
1iqra1ojEvM,Black Mirror: Season 7 | Official Trailer | Netflix,UCWOA1ZGywLbqmigxE4Qlvuw,Netflix,2025-03-13T17:00:00Z,UgyA8UlPY6cvyUI0PRp4AaABAg.AH-0t83lVN7AH3bEzTmZ_a,UgyA8UlPY6cvyUI0PRp4AaABAg,@Soredli,UCdnUpEQ9kPcZ8YHxaSA222g,​@rafaelgeorge49Bro how is the rest woke lmao the only woke episode was the one with the woman inside the movie 💀💀💀,en,2025-04-18T16:52:42Z,2025-04-18 12:52:42,0
1iqra1ojEvM,Black Mirror: Season 7 | Official Trailer | Netflix,UCWOA1ZGywLbqmigxE4Qlvuw,Netflix,2025-03-13T17:00:00Z,UgyA8UlPY6cvyUI0PRp4AaABAg.AH-0t83lVN7AH3deLUi7J2,UgyA8UlPY6cvyUI0PRp4AaABAg,@rafaelgeorge49,UCiWKNQ19r17737BKO76M3Ag,"@Soredli over pushed diversity, soya latte, d*ck ring in nose, feminist girl power emperor of the university etc etc. just because it's normal for you, it not normal on the rest of the world.",en,2025-04-18T17:13:47Z,2025-04-18 13:13:47,0
1iqra1ojEvM,Black Mirror: Season 7 | Official Trailer | Netflix,UCWOA1ZGywLbqmigxE4Qlvuw,Netflix,2025-03-13T17:00:00Z,UgyA8UlPY6cvyUI0PRp4AaABAg.AH-0t83lVN7AH3eFIcuz1G,UgyA8UlPY6cvyUI0PRp4AaABAg,@rafaelgeorge49,UCiWKNQ19r17737BKO76M3Ag,@Soredli oh almost forgot the sensitization. who cares the episode when the guy looked back in his past and remembered his ex girlfriend. He just cried in the whole episode. Didn't even happen anything. Fck that chick.,en,2025-04-18T17:18:57Z,2025-04-18 13:18:57,0
1iqra1ojEvM,Black Mirror: Season 7 | Official Trailer | Netflix,UCWOA1ZGywLbqmigxE4Qlvuw,Netflix,2025-03-13T17:00:00Z,UgyA8UlPY6cvyUI0PRp4AaABAg.AH-0t83lVN7AH3eVpxhfcn,UgyA8UlPY6cvyUI0PRp4AaABAg,@rafaelgeorge49,UCiWKNQ19r17737BKO76M3Ag,"@Soredli  i had to watch a documentary after about the 2. World war just to balance myself. 
Sry, couldn't find my previous comment.",en,2025-04-18T17:21:13Z,2025-04-18 13:21:13,0
1iqra1ojEvM,Black Mirror: Season 7 | Official Trailer | Netflix,UCWOA1ZGywLbqmigxE4Qlvuw,Netflix,2025-03-13T17:00:00Z,UgyleNZiuZ07oV63CTJ4AaABAg.AGxQHFpWiDxAGxYVH9qtwI,UgyleNZiuZ07oV63CTJ4AaABAg,@horrorclips7629,UCeIbqmg8U9jPZrKDJoS3RGQ,What show do you consider good?,NA,2025-04-15T23:05:17Z,2025-04-15 19:05:17,0
1iqra1ojEvM,Black Mirror: Season 7 | Official Trailer | Netflix,UCWOA1ZGywLbqmigxE4Qlvuw,Netflix,2025-03-13T17:00:00Z,UgyleNZiuZ07oV63CTJ4AaABAg.AGxQHFpWiDxAH2O5Ry0KKK,UgyleNZiuZ07oV63CTJ4AaABAg,@clxxdxd,UCpRXn5SpX3nWLr5dyCAGglw,@horrorclips7629 squid game,en,2025-04-18T05:29:50Z,2025-04-18 01:29:50,0
1iqra1ojEvM,Black Mirror: Season 7 | Official Trailer | Netflix,UCWOA1ZGywLbqmigxE4Qlvuw,Netflix,2025-03-13T17:00:00Z,UgyNu4YzayiDqKOnoJd4AaABAg.AGx8Ke6KEV6AGxYaHrIfQF,UgyNu4YzayiDqKOnoJd4AaABAg,@horrorclips7629,UCeIbqmg8U9jPZrKDJoS3RGQ,Wtf are you even talking about?,en,2025-04-15T23:06:06Z,2025-04-15 19:06:06,1
1iqra1ojEvM,Black Mirror: Season 7 | Official Trailer | Netflix,UCWOA1ZGywLbqmigxE4Qlvuw,Netflix,2025-03-13T17:00:00Z,UgyNu4YzayiDqKOnoJd4AaABAg.AGx8Ke6KEV6AGyX6JS5z7E,UgyNu4YzayiDqKOnoJd4AaABAg,@JacobJackson-gv1ci,UC8IKZgskNe-Aqnb1i6BTsww,"@horrorclips7629 I don't have time to explain to a 3yr old like you what RAPE is or the movie ""Cuties"".  You'll just have to look that up yourself kid.",en,2025-04-16T08:12:23Z,2025-04-16 04:12:23,0
1iqra1ojEvM,Black Mirror: Season 7 | Official Trailer | Netflix,UCWOA1ZGywLbqmigxE4Qlvuw,Netflix,2025-03-13T17:00:00Z,UgyNu4YzayiDqKOnoJd4AaABAg.AGx8Ke6KEV6AH2EqpoX68U,UgyNu4YzayiDqKOnoJd4AaABAg,@JacobJackson-gv1ci,UC8IKZgskNe-Aqnb1i6BTsww,@horrorclips7629 I'm not going to waste my time explaining to a 3yr old what RAPE and NECROPHILIA is. Go look it up yourself kid.,en,2025-04-18T04:09:03Z,2025-04-18 00:09:03,0
1iqra1ojEvM,Black Mirror: Season 7 | Official Trailer | Netflix,UCWOA1ZGywLbqmigxE4Qlvuw,Netflix,2025-03-13T17:00:00Z,UgwlUF27Tq1j1Hr7k9h4AaABAg.AGwqBTnoGkmAH3bSkb4qO0,UgwlUF27Tq1j1Hr7k9h4AaABAg,@Soredli,UCdnUpEQ9kPcZ8YHxaSA222g,There were chinese people in the first episode and the movie episode what are you on about 💀,en,2025-04-18T16:54:35Z,2025-04-18 12:54:35,0
1iqra1ojEvM,Black Mirror: Season 7 | Official Trailer | Netflix,UCWOA1ZGywLbqmigxE4Qlvuw,Netflix,2025-03-13T17:00:00Z,UgwlUF27Tq1j1Hr7k9h4AaABAg.AGwqBTnoGkmAH5nVw3mgUd,UgwlUF27Tq1j1Hr7k9h4AaABAg,@AddictedtotheNet,UC_EaWXYwX2uPmjRkapKDHcA,@Soredli Main Actors Dipshit,id,2025-04-19T13:18:21Z,2025-04-19 09:18:21,0
1iqra1ojEvM,Black Mirror: Season 7 | Official Trailer | Netflix,UCWOA1ZGywLbqmigxE4Qlvuw,Netflix,2025-03-13T17:00:00Z,Ugx5PjV4VA8oVtwbT8p4AaABAg.AGw1adRbT1UAGwjBXrSffW,Ugx5PjV4VA8oVtwbT8p4AaABAg,@thebossmusick,UCJ3VGkhY7URmSgH03o8wO4Q,"I will say that A.I. ""Casablanca"" episode SUCKED.

So did the Fighting Vipers episode (or whatever it was called). I don't care, but I do when it takes priority over a good story. They keep trying to recapture the magic of San Junipero (which I didn't care for either), and they keep failing to.",en,2025-04-15T15:28:12Z,2025-04-15 11:28:12,0
1iqra1ojEvM,Black Mirror: Season 7 | Official Trailer | Netflix,UCWOA1ZGywLbqmigxE4Qlvuw,Netflix,2025-03-13T17:00:00Z,Ugx5PjV4VA8oVtwbT8p4AaABAg.AGw1adRbT1UAGwnYbfkzv0,Ugx5PjV4VA8oVtwbT8p4AaABAg,@wataeisex,UCODxLg2sm60jXf_eCZQbMqQ,Biggest non issue ever,NA,2025-04-15T16:06:19Z,2025-04-15 12:06:19,1
1iqra1ojEvM,Black Mirror: Season 7 | Official Trailer | Netflix,UCWOA1ZGywLbqmigxE4Qlvuw,Netflix,2025-03-13T17:00:00Z,UgwLUJpQiZwx7gsARkV4AaABAg.AGvkeAXyaiqAH1sopI_FnE,UgwLUJpQiZwx7gsARkV4AaABAg,@anthonymorales2915,UCJ4jNlpNDfF01gA_BbwxnEw,"im sorry why rap or necr? did i saw the same episode of space infinity, nothing like that show",en,2025-04-18T00:47:48Z,2025-04-17 20:47:48,0
1iqra1ojEvM,Black Mirror: Season 7 | Official Trailer | Netflix,UCWOA1ZGywLbqmigxE4Qlvuw,Netflix,2025-03-13T17:00:00Z,UgwLUJpQiZwx7gsARkV4AaABAg.AGvkeAXyaiqAH2EAqS3Ulm,UgwLUJpQiZwx7gsARkV4AaABAg,@JacobJackson-gv1ci,UC8IKZgskNe-Aqnb1i6BTsww,"@anthonymorales2915 Unless you didn't see Nanette's lifeless body be infiltrated by her digital clone and her teammates  WITHOUT HER CONSENT WHILE SHE WAS DEEMED ""BRAIN DEAD"", then YES, YOU WATCHED A DIFFERENT SHOW and I'm not going to waste my time explaining to a child what RAPE and NECROPHILIA is. Go learn it yourself or ask your parents what it is.",en,2025-04-18T04:03:11Z,2025-04-18 00:03:11,0
1iqra1ojEvM,Black Mirror: Season 7 | Official Trailer | Netflix,UCWOA1ZGywLbqmigxE4Qlvuw,Netflix,2025-03-13T17:00:00Z,Ugxonj0mDLTD6_Df7l94AaABAg.AGvkIPLPIVzAGwndPJtqYe,Ugxonj0mDLTD6_Df7l94AaABAg,@wataeisex,UCODxLg2sm60jXf_eCZQbMqQ,Are you slow or just schizophrenic im genuinely asking,en,2025-04-15T16:07:06Z,2025-04-15 12:07:06,2
1iqra1ojEvM,Black Mirror: Season 7 | Official Trailer | Netflix,UCWOA1ZGywLbqmigxE4Qlvuw,Netflix,2025-03-13T17:00:00Z,Ugxonj0mDLTD6_Df7l94AaABAg.AGvkIPLPIVzAGx53B7uXej,Ugxonj0mDLTD6_Df7l94AaABAg,@EmmyRonato-q2j,UCDvYj7i3ec0T4fRGIUJlO1A,What a problematic way to overreact towards the concept of a film/series.,en,2025-04-15T18:48:03Z,2025-04-15 14:48:03,1
1iqra1ojEvM,Black Mirror: Season 7 | Official Trailer | Netflix,UCWOA1ZGywLbqmigxE4Qlvuw,Netflix,2025-03-13T17:00:00Z,Ugxonj0mDLTD6_Df7l94AaABAg.AGvkIPLPIVzAGx77FFzuc_,Ugxonj0mDLTD6_Df7l94AaABAg,@JacobJackson-gv1ci,UC8IKZgskNe-Aqnb1i6BTsww,@EmmyRonato-q2j I noticed you didn't say I was wrong in saying that Nanette's body and her privacy was invaded WITHOUT HER CONSENT so I guess you agree with me then?😂😂😂,en,2025-04-15T19:06:04Z,2025-04-15 15:06:04,0
1iqra1ojEvM,Black Mirror: Season 7 | Official Trailer | Netflix,UCWOA1ZGywLbqmigxE4Qlvuw,Netflix,2025-03-13T17:00:00Z,Ugz2AZyUnoCAOqoODX14AaABAg.AGvWM1VPZxcAGwjJ2OO9L7,Ugz2AZyUnoCAOqoODX14AaABAg,@thebossmusick,UCJ3VGkhY7URmSgH03o8wO4Q,"I agree, it should have been a one off. Having sequels to self contained stories ruins it for me.",en,2025-04-15T15:29:14Z,2025-04-15 11:29:14,0
1iqra1ojEvM,Black Mirror: Season 7 | Official Trailer | Netflix,UCWOA1ZGywLbqmigxE4Qlvuw,Netflix,2025-03-13T17:00:00Z,Ugwly63wQ5f9-ii2WbZ4AaABAg.AGtxMJKfmTnAGu25rsJO8s,Ugwly63wQ5f9-ii2WbZ4AaABAg,@Dantiux16,UCOXrhfXDlRGQAFe4jAhK5jA,"I mean what did You expect?, it's Netflix, the episodes are still really good",en,2025-04-14T14:24:28Z,2025-04-14 10:24:28,2
1iqra1ojEvM,Black Mirror: Season 7 | Official Trailer | Netflix,UCWOA1ZGywLbqmigxE4Qlvuw,Netflix,2025-03-13T17:00:00Z,Ugwly63wQ5f9-ii2WbZ4AaABAg.AGtxMJKfmTnAH3be5ZoJ_8,Ugwly63wQ5f9-ii2WbZ4AaABAg,@Soredli,UCdnUpEQ9kPcZ8YHxaSA222g,Only 1 episode was woke first of all,en,2025-04-18T16:56:16Z,2025-04-18 12:56:16,0
1iqra1ojEvM,Black Mirror: Season 7 | Official Trailer | Netflix,UCWOA1ZGywLbqmigxE4Qlvuw,Netflix,2025-03-13T17:00:00Z,Ugw9W_pfDWBnuTslDvZ4AaABAg.AGrxjtHw2naAGs-vqmX_9A,Ugw9W_pfDWBnuTslDvZ4AaABAg,@jayday325,UCFE-fIuGrsa-0POQQtV7EHw,Wahhhhh wahhhhhh cry more,mi,2025-04-13T19:27:01Z,2025-04-13 15:27:01,3
1iqra1ojEvM,Black Mirror: Season 7 | Official Trailer | Netflix,UCWOA1ZGywLbqmigxE4Qlvuw,Netflix,2025-03-13T17:00:00Z,Ugw9W_pfDWBnuTslDvZ4AaABAg.AGrxjtHw2naAGsjuQs5RVX,Ugw9W_pfDWBnuTslDvZ4AaABAg,@petrifiedjello,UCO93S0s4cGxz7rqGW2qVhug,Woe is me,af,2025-04-14T02:17:31Z,2025-04-13 22:17:31,2
1iqra1ojEvM,Black Mirror: Season 7 | Official Trailer | Netflix,UCWOA1ZGywLbqmigxE4Qlvuw,Netflix,2025-03-13T17:00:00Z,UgyjmztY_gyacq5vwud4AaABAg.AGqtnqczV9bAGrrJisF6mH,UgyjmztY_gyacq5vwud4AaABAg,@AS-lg4yf,UCgeEjyF7Vqr19dJI9YloHdA,I’ve watched every episode of this series and there are definitely some stand outs in the season that are on par with the old stuff. Episode 1 and Eulogy in particular are fantastic.,en,2025-04-13T18:03:02Z,2025-04-13 14:03:02,1
1iqra1ojEvM,Black Mirror: Season 7 | Official Trailer | Netflix,UCWOA1ZGywLbqmigxE4Qlvuw,Netflix,2025-03-13T17:00:00Z,UgxykP_58LXuytRUT-54AaABAg.AGpODjrbFg0AGqI4eyt1pa,UgxykP_58LXuytRUT-54AaABAg,@Leprutz,UCEiboMi6uFbt3zysxUb_7sA,"I liked season 6. Wasn't the typical BM, but was still very good.",en,2025-04-13T03:27:10Z,2025-04-12 23:27:10,0
1iqra1ojEvM,Black Mirror: Season 7 | Official Trailer | Netflix,UCWOA1ZGywLbqmigxE4Qlvuw,Netflix,2025-03-13T17:00:00Z,UgwCA3Ty4PYsP5flf3p4AaABAg.AGpDy7hjqvYAGuk4JQ3qff,UgwCA3Ty4PYsP5flf3p4AaABAg,@seansmith6372,UCfS2aWMOpRsY65cEWvdSNxg,So effing good,NA,2025-04-14T20:57:29Z,2025-04-14 16:57:29,0
1iqra1ojEvM,Black Mirror: Season 7 | Official Trailer | Netflix,UCWOA1ZGywLbqmigxE4Qlvuw,Netflix,2025-03-13T17:00:00Z,UgxTGXt8Z8ZFh_PjZ394AaABAg.AGos5JMzd08AGow9pKUHiG,UgxTGXt8Z8ZFh_PjZ394AaABAg,@AFN.90210,UCqlZQpIqonUVLxt7mA8Zt5Q,Shut up 😂,NA,2025-04-12T14:47:39Z,2025-04-12 10:47:39,0
1iqra1ojEvM,Black Mirror: Season 7 | Official Trailer | Netflix,UCWOA1ZGywLbqmigxE4Qlvuw,Netflix,2025-03-13T17:00:00Z,UgxTGXt8Z8ZFh_PjZ394AaABAg.AGos5JMzd08AGphgBaMwp3,UgxTGXt8Z8ZFh_PjZ394AaABAg,@killaryhinton69,UCMA1V3cF-X6cRZh6fErkoEA,Cry harder,NA,2025-04-12T22:00:22Z,2025-04-12 18:00:22,0
1iqra1ojEvM,Black Mirror: Season 7 | Official Trailer | Netflix,UCWOA1ZGywLbqmigxE4Qlvuw,Netflix,2025-03-13T17:00:00Z,Ugxay0PlukVfJq7raZd4AaABAg.AGobeV4905MAH3br51g5QM,Ugxay0PlukVfJq7raZd4AaABAg,@Soredli,UCdnUpEQ9kPcZ8YHxaSA222g,1 and 2 were good but so was USS Calister and Plaything..m,en,2025-04-18T16:58:02Z,2025-04-18 12:58:02,0
1iqra1ojEvM,Black Mirror: Season 7 | Official Trailer | Netflix,UCWOA1ZGywLbqmigxE4Qlvuw,Netflix,2025-03-13T17:00:00Z,Ugzo9eKJ61zKuucfrCF4AaABAg.AGnv8lZywvxAGpmHOSchBH,Ugzo9eKJ61zKuucfrCF4AaABAg,@leslienicholas_001,UCkv-poIHpnlylU5Ig8On_Pg,They never miss with the plots and hidden themes,en,2025-04-12T22:40:32Z,2025-04-12 18:40:32,0
1iqra1ojEvM,Black Mirror: Season 7 | Official Trailer | Netflix,UCWOA1ZGywLbqmigxE4Qlvuw,Netflix,2025-03-13T17:00:00Z,Ugzo9eKJ61zKuucfrCF4AaABAg.AGnv8lZywvxAH7E82xTPGd,Ugzo9eKJ61zKuucfrCF4AaABAg,@dasuniversum5875,UCjbVzjGVkvE1FBUJEQA1jtg,Episode 3 (Season 7) is sooo beautiful,NA,2025-04-20T02:39:00Z,2025-04-19 22:39:00,0
1iqra1ojEvM,Black Mirror: Season 7 | Official Trailer | Netflix,UCWOA1ZGywLbqmigxE4Qlvuw,Netflix,2025-03-13T17:00:00Z,Ugwx8gF446Beyp0OIoB4AaABAg.AGnm2wqcDfvAH0WE8JjQAV,Ugwx8gF446Beyp0OIoB4AaABAg,@JIGAK1,UCKnR2cvjvnw-PP9weGxU3Fg,For me it’s also the best season in the whole series,en,2025-04-17T12:02:26Z,2025-04-17 08:02:26,0
1iqra1ojEvM,Black Mirror: Season 7 | Official Trailer | Netflix,UCWOA1ZGywLbqmigxE4Qlvuw,Netflix,2025-03-13T17:00:00Z,UgwqGu6gataYWWkzYe14AaABAg.AGnQhnvUn_qAGnSarQdleo,UgwqGu6gataYWWkzYe14AaABAg,@s_yd96,UCbKpgM4R8VFgH-Zm4Fgf5Jw,I've watched 4 episodes and the worst of them all is (Plaything) the ending of that episode doesn't even makes sense tbh the first episode was just heartbreaking and sad and The 2nd episode (Bēte noire) was so uncomfortable for me at some point I wanted to punch my laptop screen because of that Annoying Girl.,en,2025-04-12T01:01:21Z,2025-04-11 21:01:21,0
1iqra1ojEvM,Black Mirror: Season 7 | Official Trailer | Netflix,UCWOA1ZGywLbqmigxE4Qlvuw,Netflix,2025-03-13T17:00:00Z,UgwqGu6gataYWWkzYe14AaABAg.AGnQhnvUn_qAGnvCprwREy,UgwqGu6gataYWWkzYe14AaABAg,@rafayet23,UCwI_Yr-XDhv0lm-Ofwa444g,Stop watching black mirror. Show is not for you. This season was incredible.,en,2025-04-12T05:20:05Z,2025-04-12 01:20:05,1
1iqra1ojEvM,Black Mirror: Season 7 | Official Trailer | Netflix,UCWOA1ZGywLbqmigxE4Qlvuw,Netflix,2025-03-13T17:00:00Z,UgwqGu6gataYWWkzYe14AaABAg.AGnQhnvUn_qAGo27oQ9Z3o,UgwqGu6gataYWWkzYe14AaABAg,@qunas101,UCTHxUpyBmp0meLVtKKKK1Zw,"@rafayet23 last year was very dense with shows and games that are ""not for us"" and most of the studios got shut down",en,2025-04-12T06:29:18Z,2025-04-12 02:29:18,0
1iqra1ojEvM,Black Mirror: Season 7 | Official Trailer | Netflix,UCWOA1ZGywLbqmigxE4Qlvuw,Netflix,2025-03-13T17:00:00Z,UgwqGu6gataYWWkzYe14AaABAg.AGnQhnvUn_qAGox52BS75H,UgwqGu6gataYWWkzYe14AaABAg,@user-jl2xi7pg2z,UCtm6FYbk8r4-GCM2nsKCrkw,The episodes were just boring. Season 6 was even better.,en,2025-04-12T14:55:44Z,2025-04-12 10:55:44,1
1iqra1ojEvM,Black Mirror: Season 7 | Official Trailer | Netflix,UCWOA1ZGywLbqmigxE4Qlvuw,Netflix,2025-03-13T17:00:00Z,Ugw6sK0etabZSsIJntJ4AaABAg.AGnQ7xPLqugAGnSmNhOg9P,Ugw6sK0etabZSsIJntJ4AaABAg,@s_yd96,UCbKpgM4R8VFgH-Zm4Fgf5Jw,Really ? I've watched 4 episodes and the worst of them was (Play thing) it doesn't even makes sense in the end but I don't know how the ending will be I hope it will be good,en,2025-04-12T01:02:55Z,2025-04-11 21:02:55,0
1iqra1ojEvM,Black Mirror: Season 7 | Official Trailer | Netflix,UCWOA1ZGywLbqmigxE4Qlvuw,Netflix,2025-03-13T17:00:00Z,UgxNmgAD-dx1-3h7wdt4AaABAg.AGmnvBRvomhAHp3Kp-MxBZ,UgxNmgAD-dx1-3h7wdt4AaABAg,@Strepite,UCriq_dcwr2vVEPKQjQttr5w,Exactly!,xh,2025-05-07T12:30:27Z,2025-05-07 08:30:27,0
