video_id,video_title,channel_id,channel_title,video_published_at,view_count,video_like_count,video_comment_count,comment_id,comment_parent_id,comment_author_display,comment_author_channel_id,comment_text,comment_lang,comment_published_utc,comment_published_local,comment_like_count,comment_reply_count
R7xl9QjtNDc,Bet | Official Trailer | Netflix,UCWOA1ZGywLbqmigxE4Qlvuw,Netflix,2025-04-21T15:00:02Z,1046082,11124,6698,UgwC4J30vTGIPHZMkO14AaABAg,NA,@Beblue-o1q,UChFz8y1VvCfdGxcaELqdARg,"To be honest, this isn’t too bad as people are saying.
Yes, it is completely different than the anime version 
But I think if some people want to watch it, then they should not compare it with the anime version and enjoy as it is 
I watched the series, and yes, it was not as good as the og version, but still it was good if I consider it as a new plot . 
If you don’t like it, then don’t watch it .",en,2025-05-24T21:10:17Z,2025-05-24 17:10:17,7,9
R7xl9QjtNDc,Bet | Official Trailer | Netflix,UCWOA1ZGywLbqmigxE4Qlvuw,Netflix,2025-04-21T15:00:02Z,1046082,11124,6698,UgzWg72QljXOu28EFkB4AaABAg,NA,@outinasia,UCcKhRmhb7LTOWFFp1ZIimjQ,"Cringe! Had to turn it off 3 minutes into episode 1. Sorry, I'm just being honest. 🍅",en,2025-05-24T20:24:56Z,2025-05-24 16:24:56,0,0
R7xl9QjtNDc,Bet | Official Trailer | Netflix,UCWOA1ZGywLbqmigxE4Qlvuw,Netflix,2025-04-21T15:00:02Z,1046082,11124,6698,UgxfMBJrxWmHvkUKfTZ4AaABAg,NA,@netgodz2276,UCE6hHEP5rU-Ss7i0pkeHwug,"I dont like it, looks boring and awkward",NA,2025-05-24T17:34:38Z,2025-05-24 13:34:38,0,0
R7xl9QjtNDc,Bet | Official Trailer | Netflix,UCWOA1ZGywLbqmigxE4Qlvuw,Netflix,2025-04-21T15:00:02Z,1046082,11124,6698,UgzaOf5KzqEmWYPnmcJ4AaABAg,NA,@Taj_kent,UC3Kh7JkO7PqSK8cd9ClYsIg,THE TRAILER DID NOT DO THE SERIES JUSTICE WHAT YALL MEANN ITS GOOOD WEEE NEED SEASON2!!!!!,en,2025-05-24T16:07:50Z,2025-05-24 12:07:50,12,2
R7xl9QjtNDc,Bet | Official Trailer | Netflix,UCWOA1ZGywLbqmigxE4Qlvuw,Netflix,2025-04-21T15:00:02Z,1046082,11124,6698,Ugxca3xKZkpvbmzNgfR4AaABAg,NA,@lolitzmetobi,UC7c5FIrb74VuHl-QQA5PByw,Give us Kakegurui anime season 3. this Bet sh!t ruined my taste in Netflix,NA,2025-05-24T15:20:08Z,2025-05-24 11:20:08,0,0
R7xl9QjtNDc,Bet | Official Trailer | Netflix,UCWOA1ZGywLbqmigxE4Qlvuw,Netflix,2025-04-21T15:00:02Z,1046082,11124,6698,UgxIsmDoPLeZKYl8jt54AaABAg,NA,@lolitzmetobi,UC7c5FIrb74VuHl-QQA5PByw,Instead of this they can continue Kakegurui,en,2025-05-24T15:17:42Z,2025-05-24 11:17:42,0,0
R7xl9QjtNDc,Bet | Official Trailer | Netflix,UCWOA1ZGywLbqmigxE4Qlvuw,Netflix,2025-04-21T15:00:02Z,1046082,11124,6698,UgyZzEfPzMNJa_0R1TJ4AaABAg,NA,@mashamarieta9631,UCID2_yVyEfyNRLHs8EM_PxA,I absolutely loved this series it made me excited and happ surprised ans thrilleed all at same time hope to see the second season soon❤❤❤❤❤❤❤❤❤❤😊😊😊,en,2025-05-24T15:13:58Z,2025-05-24 11:13:58,2,2
R7xl9QjtNDc,Bet | Official Trailer | Netflix,UCWOA1ZGywLbqmigxE4Qlvuw,Netflix,2025-04-21T15:00:02Z,1046082,11124,6698,UgwNiDVDUZ8JSPAJCe94AaABAg,NA,@Lost_in_a_rabbit_whole,UC5org_dNsxAr-e2abtozvIQ,Okay lesbian fan service. Now we want gay fan service please,fy,2025-05-24T13:52:12Z,2025-05-24 09:52:12,0,0
R7xl9QjtNDc,Bet | Official Trailer | Netflix,UCWOA1ZGywLbqmigxE4Qlvuw,Netflix,2025-04-21T15:00:02Z,1046082,11124,6698,UgwEK9RexCr4ZKbHdUh4AaABAg,NA,@belmordok3661,UCODjpQ9Pt82I2IKcpNB2gww,"A total woke garbage, pff...",NA,2025-05-24T13:48:51Z,2025-05-24 09:48:51,0,0
R7xl9QjtNDc,Bet | Official Trailer | Netflix,UCWOA1ZGywLbqmigxE4Qlvuw,Netflix,2025-04-21T15:00:02Z,1046082,11124,6698,UgwwO3_38h3ZJF5YCkp4AaABAg,NA,@Vincey_gamer,UCgrnoaB1WIqGuFtM1r_KIGg,My fav show ever!!!!!,pt,2025-05-24T13:23:16Z,2025-05-24 09:23:16,1,0
R7xl9QjtNDc,Bet | Official Trailer | Netflix,UCWOA1ZGywLbqmigxE4Qlvuw,Netflix,2025-04-21T15:00:02Z,1046082,11124,6698,UgwniL62VHoE3jf9ESJ4AaABAg,NA,@razaalam1520,UCbpR7PFgR41SsON8cLjWcDg,Waiting for Season 2,NA,2025-05-24T13:07:03Z,2025-05-24 09:07:03,0,0
R7xl9QjtNDc,Bet | Official Trailer | Netflix,UCWOA1ZGywLbqmigxE4Qlvuw,Netflix,2025-04-21T15:00:02Z,1046082,11124,6698,UgzKyQmas8mhRVC0_p94AaABAg,NA,@saikinay7005,UCU5HBfV1PcD1OT-2qCXUucA,THIS IS SO GOOD BRUH WHY PEOPLE HATIN,en,2025-05-24T11:53:21Z,2025-05-24 07:53:21,0,0
R7xl9QjtNDc,Bet | Official Trailer | Netflix,UCWOA1ZGywLbqmigxE4Qlvuw,Netflix,2025-04-21T15:00:02Z,1046082,11124,6698,UgwrAgf78_7Y5LAT0mR4AaABAg,NA,@kentymashmilo758,UCwF5HiBtgbPR-WK4ULk-bAw,"Yumeko : 10/10
Other characters:0/10",xh,2025-05-24T11:47:09Z,2025-05-24 07:47:09,1,0
R7xl9QjtNDc,Bet | Official Trailer | Netflix,UCWOA1ZGywLbqmigxE4Qlvuw,Netflix,2025-04-21T15:00:02Z,1046082,11124,6698,UgxE9yp0AXelq68AjsB4AaABAg,NA,@hikari_9619,UChiwgi9O6DLveH0NBDMnu8Q,this is so ass,en,2025-05-24T11:24:18Z,2025-05-24 07:24:18,0,0
R7xl9QjtNDc,Bet | Official Trailer | Netflix,UCWOA1ZGywLbqmigxE4Qlvuw,Netflix,2025-04-21T15:00:02Z,1046082,11124,6698,Ugy-9AsJ9YLPi3RCky14AaABAg,NA,@acyrsse,UCKNE5yINJ-t70oRNNXBAEPA,"Y'all are crazy whatever, Miku did well",en,2025-05-24T11:06:46Z,2025-05-24 07:06:46,0,0
R7xl9QjtNDc,Bet | Official Trailer | Netflix,UCWOA1ZGywLbqmigxE4Qlvuw,Netflix,2025-04-21T15:00:02Z,1046082,11124,6698,UgxNV8Rgjfd7BR3HLC14AaABAg,NA,@MiklokRahmay,UChj9wNrDHqQHKeFEauFOpTQ,WTF,NA,2025-05-24T08:59:52Z,2025-05-24 04:59:52,0,0
R7xl9QjtNDc,Bet | Official Trailer | Netflix,UCWOA1ZGywLbqmigxE4Qlvuw,Netflix,2025-04-21T15:00:02Z,1046082,11124,6698,UgwIAVyprNxT5sIK-qB4AaABAg,NA,@cf2813,UC9FzLUIw7OZAAyv2E4AFqCw,"Kakegurui !!! anime, live japanese action and so far, they are all good !!!",en,2025-05-24T08:53:12Z,2025-05-24 04:53:12,0,0
R7xl9QjtNDc,Bet | Official Trailer | Netflix,UCWOA1ZGywLbqmigxE4Qlvuw,Netflix,2025-04-21T15:00:02Z,1046082,11124,6698,UgyIj9heEX61rvJ_z4Z4AaABAg,NA,@DikzAzx,UC2nuAxVwtmRF-tt9Gfl5JIg,Mc jadi hytam legam😹😹,uz,2025-05-24T08:23:30Z,2025-05-24 04:23:30,0,0
R7xl9QjtNDc,Bet | Official Trailer | Netflix,UCWOA1ZGywLbqmigxE4Qlvuw,Netflix,2025-04-21T15:00:02Z,1046082,11124,6698,UgyeTTjgaDl13OqJUaB4AaABAg,NA,@Cat-it9kk,UCVkRViFgNo2TjaM8UdFmYNA,Lol😂😂 😢 more live action,en,2025-05-24T07:47:29Z,2025-05-24 03:47:29,0,0
R7xl9QjtNDc,Bet | Official Trailer | Netflix,UCWOA1ZGywLbqmigxE4Qlvuw,Netflix,2025-04-21T15:00:02Z,1046082,11124,6698,UgwFbEc7Kle_5vLCIDF4AaABAg,NA,@Mafube_Molange,UCm5U9qzwxWC8uksUgP2KanA,I have a bet myself on how well this abomination will do.,en,2025-05-24T06:12:30Z,2025-05-24 02:12:30,0,0
R7xl9QjtNDc,Bet | Official Trailer | Netflix,UCWOA1ZGywLbqmigxE4Qlvuw,Netflix,2025-04-21T15:00:02Z,1046082,11124,6698,Ugx4Wuutqe-cIW4BsKR4AaABAg,NA,@darcyroberts8873,UCnWGMdkISSARN4punGPR1Sg,Watched the first 4 episodes so far and I have to say it’s actually not bad,en,2025-05-24T05:34:09Z,2025-05-24 01:34:09,1,0
R7xl9QjtNDc,Bet | Official Trailer | Netflix,UCWOA1ZGywLbqmigxE4Qlvuw,Netflix,2025-04-21T15:00:02Z,1046082,11124,6698,UgyhgU564EBkpXwakqt4AaABAg,NA,@aiyulee6366,UCJ1og_7OtywVAdb7_o-V8GQ,"It is here to ruin the original.
Cringe",en,2025-05-24T05:28:07Z,2025-05-24 01:28:07,0,0
R7xl9QjtNDc,Bet | Official Trailer | Netflix,UCWOA1ZGywLbqmigxE4Qlvuw,Netflix,2025-04-21T15:00:02Z,1046082,11124,6698,UgzzY2YdcRHCHJK2iId4AaABAg,NA,@Thebroke_traderSA,UCE12fsCVSqOsFLsrAnmpOxg,Wokekugri,NA,2025-05-24T05:25:02Z,2025-05-24 01:25:02,0,0
R7xl9QjtNDc,Bet | Official Trailer | Netflix,UCWOA1ZGywLbqmigxE4Qlvuw,Netflix,2025-04-21T15:00:02Z,1046082,11124,6698,UgwjLZ_fFnvajIFYsCN4AaABAg,NA,@obyy9878,UCbR9YtW-qUDWf8wS9cY7KwA,WOKE 🤢🤢🤮🤮🤮,st,2025-05-24T04:52:57Z,2025-05-24 00:52:57,0,0
R7xl9QjtNDc,Bet | Official Trailer | Netflix,UCWOA1ZGywLbqmigxE4Qlvuw,Netflix,2025-04-21T15:00:02Z,1046082,11124,6698,UgxboFnp0yXeVfl_lFN4AaABAg,NA,@artexius,UCAgm04RNvXpd5_WfcSOpfhw,aint no way,es,2025-05-24T04:50:16Z,2025-05-24 00:50:16,0,0
R7xl9QjtNDc,Bet | Official Trailer | Netflix,UCWOA1ZGywLbqmigxE4Qlvuw,Netflix,2025-04-21T15:00:02Z,1046082,11124,6698,UgzoVHv6pRQDFEHUuIR4AaABAg,NA,@iisxf,UCIXDQeiqBpLomicc-hsq2mg,"necesito q terminen como parejas del crimen y mejores amigas
nada de que me lo arruinen y se separen o algo así porfaaaaa (yumiko y kira)",es,2025-05-24T04:43:07Z,2025-05-24 00:43:07,0,0
R7xl9QjtNDc,Bet | Official Trailer | Netflix,UCWOA1ZGywLbqmigxE4Qlvuw,Netflix,2025-04-21T15:00:02Z,1046082,11124,6698,Ugwz4qUYWqvEnbmuald4AaABAg,NA,@MarkkleLee,UCgSyahyyNEn80IQ--_ktH7g,"After watching this show, I really like it. Make a 2nd season!!",en,2025-05-24T04:40:21Z,2025-05-24 00:40:21,0,0
R7xl9QjtNDc,Bet | Official Trailer | Netflix,UCWOA1ZGywLbqmigxE4Qlvuw,Netflix,2025-04-21T15:00:02Z,1046082,11124,6698,UgyaFN9JZDJJ4UVBZvt4AaABAg,NA,@danicavaldez7650,UCT4IPdsgTH4T0R6koMhNtYQ,Bet 2025 is number 1 on philippine netflix !🔥We’re Hoping for season 2 🙏,en,2025-05-24T02:58:59Z,2025-05-23 22:58:59,2,0
R7xl9QjtNDc,Bet | Official Trailer | Netflix,UCWOA1ZGywLbqmigxE4Qlvuw,Netflix,2025-04-21T15:00:02Z,1046082,11124,6698,Ugw3EKjnTQ7YoJIZyNN4AaABAg,NA,@SDSakuragi,UCbvRiApgR15Se1-OYv7ex0A,"Asians roles, the only ones you can still whitewash while without being cancelled.",en,2025-05-24T01:45:27Z,2025-05-23 21:45:27,0,0
R7xl9QjtNDc,Bet | Official Trailer | Netflix,UCWOA1ZGywLbqmigxE4Qlvuw,Netflix,2025-04-21T15:00:02Z,1046082,11124,6698,UgzsHJDhCr9eoyIt5ox4AaABAg,NA,@CommonWealth13,UCsa-Q-RRLICpEE5VpDZhd8Q,"I understand you guys hate this  but try to think this is a stand alone series and not connected to the anime, I feel like this is the only woke Netflix series that I like, I love the female lead!",en,2025-05-24T01:22:17Z,2025-05-23 21:22:17,0,0
R7xl9QjtNDc,Bet | Official Trailer | Netflix,UCWOA1ZGywLbqmigxE4Qlvuw,Netflix,2025-04-21T15:00:02Z,1046082,11124,6698,UgxefFp9NNOiiaO1m7h4AaABAg,NA,@auroraluvsfilms,UCw_LoywIlnq1gNoBFMY5wgw,i loved it,NA,2025-05-24T00:48:40Z,2025-05-23 20:48:40,0,0
R7xl9QjtNDc,Bet | Official Trailer | Netflix,UCWOA1ZGywLbqmigxE4Qlvuw,Netflix,2025-04-21T15:00:02Z,1046082,11124,6698,UgwwCfFvPoVzzy34iw94AaABAg,NA,@nischalshakya8056,UCgzPU9lB7p2dXPpsXjAxLOQ,"I watched this and i enjoy watching this and  we all really need next season,,,, isn't it ??? Guys ??",en,2025-05-24T00:15:49Z,2025-05-23 20:15:49,2,0
R7xl9QjtNDc,Bet | Official Trailer | Netflix,UCWOA1ZGywLbqmigxE4Qlvuw,Netflix,2025-04-21T15:00:02Z,1046082,11124,6698,Ugzvups4KyAEQCQt7x14AaABAg,NA,@KpopNiDontStop,UCyNFlnplJewF6SsaBFeovXQ,I watched the anime and im not gonna lie some of this was better than I thought I almost came here and wrote an angry rant like everyone else LOL.,en,2025-05-24T00:10:36Z,2025-05-23 20:10:36,0,0
R7xl9QjtNDc,Bet | Official Trailer | Netflix,UCWOA1ZGywLbqmigxE4Qlvuw,Netflix,2025-04-21T15:00:02Z,1046082,11124,6698,UgyMKHJBrtqTFW-IlGB4AaABAg,NA,@johnnygoatstar,UCjFTAR56URotwy0nNwWFpuA,WAIT GUYS ITS ACTUALLY NOT THAT BAD,en,2025-05-24T00:00:39Z,2025-05-23 20:00:39,1,0
R7xl9QjtNDc,Bet | Official Trailer | Netflix,UCWOA1ZGywLbqmigxE4Qlvuw,Netflix,2025-04-21T15:00:02Z,1046082,11124,6698,UgzQN0zpe4qQCJXJ60J4AaABAg,NA,@Cleva_Thoughts,UCz0cpW_ATgm5W30CXDADwCg,Yesss! My song Venom Perfected is on this trailer! Im the music artist on this song Im super excited! This is so amazing! 🥳🎉 (screaming inside),en,2025-05-23T23:57:45Z,2025-05-23 19:57:45,7,0
R7xl9QjtNDc,Bet | Official Trailer | Netflix,UCWOA1ZGywLbqmigxE4Qlvuw,Netflix,2025-04-21T15:00:02Z,1046082,11124,6698,UgycD8Huma060-z2TXx4AaABAg,NA,@Shewtiee,UC2SKdCqkh4c9DLrmAJcV1Sw,I hate this shit man,en,2025-05-23T21:41:23Z,2025-05-23 17:41:23,0,0
R7xl9QjtNDc,Bet | Official Trailer | Netflix,UCWOA1ZGywLbqmigxE4Qlvuw,Netflix,2025-04-21T15:00:02Z,1046082,11124,6698,UgyMVewsKrdLa9Gurb94AaABAg,NA,@Tomboy-m8e,UCnBn9Up31S5IweQHrRSTkNg,"Вы просто молодцы американцы украли фильм у Японии, и сделали всё по-другому и говном, вы просто хотите заработать денег, я знаю что есть оригинал в Японии и он лучше, чем это говно🤦",ru,2025-05-23T21:36:51Z,2025-05-23 17:36:51,0,0
R7xl9QjtNDc,Bet | Official Trailer | Netflix,UCWOA1ZGywLbqmigxE4Qlvuw,Netflix,2025-04-21T15:00:02Z,1046082,11124,6698,Ugwz-FJKSSnpgegI0Hl4AaABAg,NA,@hstyler69,UCj7ysVriZNIzOXjqRZkJgrQ,This series was so good all these anime and manga geeks are annoying as shit,en,2025-05-23T21:25:02Z,2025-05-23 17:25:02,2,0
R7xl9QjtNDc,Bet | Official Trailer | Netflix,UCWOA1ZGywLbqmigxE4Qlvuw,Netflix,2025-04-21T15:00:02Z,1046082,11124,6698,UgwzUgMt_3Lw1uaV_RF4AaABAg,NA,@aldimuflih87,UC-D2OnmtgEBzVTw9tDNjr1g,absolute trash,NA,2025-05-23T19:51:30Z,2025-05-23 15:51:30,0,0
R7xl9QjtNDc,Bet | Official Trailer | Netflix,UCWOA1ZGywLbqmigxE4Qlvuw,Netflix,2025-04-21T15:00:02Z,1046082,11124,6698,UgylQFsQf_dzJElwMSx4AaABAg,NA,@RMEDiary,UCcQOuPljADIxqYZIKjUi92A,what the actual fcuk,en,2025-05-23T18:52:47Z,2025-05-23 14:52:47,0,0
R7xl9QjtNDc,Bet | Official Trailer | Netflix,UCWOA1ZGywLbqmigxE4Qlvuw,Netflix,2025-04-21T15:00:02Z,1046082,11124,6698,Ugx04BUzDxqc69r4rqd4AaABAg,NA,@shae2227,UCE5BCgppDY7OWJiLv4phHOg,"read a few comments, and i suppose this was originally a mango or an anime? everyone's calling it a super bad adaptation, tho i really liked the trailer, please lemme know if i should watch this or not?",en,2025-05-23T18:30:19Z,2025-05-23 14:30:19,0,2
R7xl9QjtNDc,Bet | Official Trailer | Netflix,UCWOA1ZGywLbqmigxE4Qlvuw,Netflix,2025-04-21T15:00:02Z,1046082,11124,6698,UgzmjZRzUJWlWEANpJV4AaABAg,NA,@이건내가아니야1554,UCUyeuedZJVoCk7cvrhKP-kQ,Glad i didn't watch the anime version so my expectations weren't too high. I love this series so muchh! I really like the one playing yumeko. The way she suddenly laughs at serious situations is just so cute😂,en,2025-05-23T17:23:43Z,2025-05-23 13:23:43,2,0
R7xl9QjtNDc,Bet | Official Trailer | Netflix,UCWOA1ZGywLbqmigxE4Qlvuw,Netflix,2025-04-21T15:00:02Z,1046082,11124,6698,UgzKSbWq8z4TS56_Pup4AaABAg,NA,@aethersx2,UCi3KXVArX35eVROlb1TejrQ,This film is my favorite film after squid game,en,2025-05-23T17:15:59Z,2025-05-23 13:15:59,0,0
R7xl9QjtNDc,Bet | Official Trailer | Netflix,UCWOA1ZGywLbqmigxE4Qlvuw,Netflix,2025-04-21T15:00:02Z,1046082,11124,6698,UgwFDixeX85szeUzZzh4AaABAg,NA,@aethersx2,UCi3KXVArX35eVROlb1TejrQ,This film is my favorite film after squid game,en,2025-05-23T17:15:53Z,2025-05-23 13:15:53,0,0
R7xl9QjtNDc,Bet | Official Trailer | Netflix,UCWOA1ZGywLbqmigxE4Qlvuw,Netflix,2025-04-21T15:00:02Z,1046082,11124,6698,UgzPuRUb1jho6zjhkTd4AaABAg,NA,@yaritwins8405,UCsSMA2znl0dRk11adSpxFaA,"Un Anime 10/10 🥹, está serie ""Bet 0/0 😐",ro,2025-05-23T17:01:39Z,2025-05-23 13:01:39,0,0
R7xl9QjtNDc,Bet | Official Trailer | Netflix,UCWOA1ZGywLbqmigxE4Qlvuw,Netflix,2025-04-21T15:00:02Z,1046082,11124,6698,Ugx9rFtUJawM8Gst2Fh4AaABAg,NA,@Gekkikara,UCCE-zfFnTYK7FO-EXPbm4OQ,Horrible ripoff.,NA,2025-05-23T16:57:42Z,2025-05-23 12:57:42,0,0
R7xl9QjtNDc,Bet | Official Trailer | Netflix,UCWOA1ZGywLbqmigxE4Qlvuw,Netflix,2025-04-21T15:00:02Z,1046082,11124,6698,UgyeVBPrYjB5YLPMn7V4AaABAg,NA,@rjmurad7627,UCktj4FzBrcE-LfqTKDEoxqA,Season 2 pliz😊,eo,2025-05-23T16:55:41Z,2025-05-23 12:55:41,0,0
R7xl9QjtNDc,Bet | Official Trailer | Netflix,UCWOA1ZGywLbqmigxE4Qlvuw,Netflix,2025-04-21T15:00:02Z,1046082,11124,6698,UgxSJjwOOp58bWfHErN4AaABAg,NA,@e_cl06,UCzi54vPNDDW4ns3RoPv28-Q,Looks like ass lol,haw,2025-05-23T16:44:04Z,2025-05-23 12:44:04,0,0
R7xl9QjtNDc,Bet | Official Trailer | Netflix,UCWOA1ZGywLbqmigxE4Qlvuw,Netflix,2025-04-21T15:00:02Z,1046082,11124,6698,UgynJRClLr_1S9dXEvJ4AaABAg,NA,@overlord_id2562,UCwoSWM4m75llwMfnlDUGSzA,🗣️Woke woke woke,NA,2025-05-23T15:15:25Z,2025-05-23 11:15:25,0,0
R7xl9QjtNDc,Bet | Official Trailer | Netflix,UCWOA1ZGywLbqmigxE4Qlvuw,Netflix,2025-04-21T15:00:02Z,1046082,11124,6698,Ugyi3qQHo5kHFhlxQXx4AaABAg,NA,@ChrisJohnson-nv2ir,UCyJhUbDtTQck814cEfDqiag,What's with everyone just complaining about everything that's all I ever hear you people do nowadays complain about everything it's not a shot for shot like the anime it's not supposed to it's a live-action get over yourselves,en,2025-05-23T14:11:59Z,2025-05-23 10:11:59,0,0
R7xl9QjtNDc,Bet | Official Trailer | Netflix,UCWOA1ZGywLbqmigxE4Qlvuw,Netflix,2025-04-21T15:00:02Z,1046082,11124,6698,UgzRImdAOiDimBSepm54AaABAg,NA,@UnrelentingCacophony,UChn_fAOxhLj-m-APNH6S-bg,"At this point, this is just Netflix getting off on its humiliation kink.",en,2025-05-23T13:57:16Z,2025-05-23 09:57:16,0,0
R7xl9QjtNDc,Bet | Official Trailer | Netflix,UCWOA1ZGywLbqmigxE4Qlvuw,Netflix,2025-04-21T15:00:02Z,1046082,11124,6698,Ugx-pUIgzgMiT1z7JUB4AaABAg,NA,@Pilly_drawz,UCxtloVCS25hxKI8NdFctsFw,Did I just see @Ryan comedy :0,en,2025-05-23T13:44:43Z,2025-05-23 09:44:43,2,2
R7xl9QjtNDc,Bet | Official Trailer | Netflix,UCWOA1ZGywLbqmigxE4Qlvuw,Netflix,2025-04-21T15:00:02Z,1046082,11124,6698,UgwWGAftQx6ee_oMXax4AaABAg,NA,@Meednax,UC90zJZrTB1ScOSUyWt2kZgQ,This was good asf why all the comments hating it ? What am I missing ?,en,2025-05-23T13:35:01Z,2025-05-23 09:35:01,0,0
R7xl9QjtNDc,Bet | Official Trailer | Netflix,UCWOA1ZGywLbqmigxE4Qlvuw,Netflix,2025-04-21T15:00:02Z,1046082,11124,6698,UgzFJFkSslPxiTz1ZyJ4AaABAg,NA,@a.a677,UCuFU0lyzef339U-w311myPQ,When will Netflix stop pulling this shit? Death Note now Kakegurui. STOP. This is a crime against manga and anime.,en,2025-05-23T12:13:57Z,2025-05-23 08:13:57,0,0
R7xl9QjtNDc,Bet | Official Trailer | Netflix,UCWOA1ZGywLbqmigxE4Qlvuw,Netflix,2025-04-21T15:00:02Z,1046082,11124,6698,Ugy98lsYjOpu3K3xRr14AaABAg,NA,@hadiexorcist1319,UCyQmN21uRA5wnVD50WiUikw,Is failll😂😂😂😂,NA,2025-05-23T11:56:06Z,2025-05-23 07:56:06,0,0
R7xl9QjtNDc,Bet | Official Trailer | Netflix,UCWOA1ZGywLbqmigxE4Qlvuw,Netflix,2025-04-21T15:00:02Z,1046082,11124,6698,UgyAt1_I7r-srkBNUEN4AaABAg,NA,@sadiasshades,UCbp2q59SsZPeci8D4AYkb3w,Amazing just finished today,en,2025-05-23T11:34:08Z,2025-05-23 07:34:08,1,0
R7xl9QjtNDc,Bet | Official Trailer | Netflix,UCWOA1ZGywLbqmigxE4Qlvuw,Netflix,2025-04-21T15:00:02Z,1046082,11124,6698,UgxtP_naLB2Rb8NHGjl4AaABAg,NA,@byteAbsorbedVlogger,UCXyAvnYmbmqufvZfFGD3j3w,"People struggling with the concept of ""Loose Adaptation"". Having never seen the original Kakegurui. I will now because of this show. lead actor was great. Hope they renew, but it's Netflix so I won't hold my breath.",en,2025-05-23T11:16:39Z,2025-05-23 07:16:39,0,0
R7xl9QjtNDc,Bet | Official Trailer | Netflix,UCWOA1ZGywLbqmigxE4Qlvuw,Netflix,2025-04-21T15:00:02Z,1046082,11124,6698,Ugy_qQXPbc9nXCs8nUF4AaABAg,NA,@chimwemwelubeya4649,UCbye90wMpqa0qRRwt4m9mqg,Oh my....this is  so diluted 😢,en,2025-05-23T11:10:43Z,2025-05-23 07:10:43,0,0
R7xl9QjtNDc,Bet | Official Trailer | Netflix,UCWOA1ZGywLbqmigxE4Qlvuw,Netflix,2025-04-21T15:00:02Z,1046082,11124,6698,UgzNWnZ6ZnNt1R0U6Nh4AaABAg,NA,@addythedaddy,UCLjIbmFbep6TD5-waPo031A,"Feels so bad, watched it on 2x and was still checking how long is left for it to end.",en,2025-05-23T11:03:06Z,2025-05-23 07:03:06,0,0
R7xl9QjtNDc,Bet | Official Trailer | Netflix,UCWOA1ZGywLbqmigxE4Qlvuw,Netflix,2025-04-21T15:00:02Z,1046082,11124,6698,UgyhWhBqxA39QNbNeIt4AaABAg,NA,@ladaeshbenihana5771,UCeglNOxt8ACongZUUsrsU6w,I can’t deal w how americanised this is down to the inclusivity 🤣 not saying it’s bad but it’s way off the actual Yumeko,en,2025-05-23T09:47:08Z,2025-05-23 05:47:08,0,0
R7xl9QjtNDc,Bet | Official Trailer | Netflix,UCWOA1ZGywLbqmigxE4Qlvuw,Netflix,2025-04-21T15:00:02Z,1046082,11124,6698,UgyLuRpioilgRv2Llhp4AaABAg,NA,@need1e123,UCjP15dis6HzvRvSfK5Q6Wpw,I think the series is okay but some parts are cringe and the Covid mask riri wear💔,en,2025-05-23T09:12:18Z,2025-05-23 05:12:18,0,0
R7xl9QjtNDc,Bet | Official Trailer | Netflix,UCWOA1ZGywLbqmigxE4Qlvuw,Netflix,2025-04-21T15:00:02Z,1046082,11124,6698,Ugzz95yp_ITRpPGvcZ94AaABAg,NA,@yogitakharb6799,UCmffx87SgPfE_mwklWNTaPQ,But I actually loved the series I don't know why everyone in the comment section hate it,en,2025-05-23T08:04:34Z,2025-05-23 04:04:34,0,0
R7xl9QjtNDc,Bet | Official Trailer | Netflix,UCWOA1ZGywLbqmigxE4Qlvuw,Netflix,2025-04-21T15:00:02Z,1046082,11124,6698,UgyRlWMz5iZbgXM6laB4AaABAg,NA,@kev_olka,UCQamp89PeawJpgBzG_hhiXA,Why is the boy black,en,2025-05-23T06:25:10Z,2025-05-23 02:25:10,0,0
R7xl9QjtNDc,Bet | Official Trailer | Netflix,UCWOA1ZGywLbqmigxE4Qlvuw,Netflix,2025-04-21T15:00:02Z,1046082,11124,6698,UgyWQRmMG2aR6Ubz1Z94AaABAg,NA,@kev_olka,UCQamp89PeawJpgBzG_hhiXA,Why is the boy black,en,2025-05-23T06:25:10Z,2025-05-23 02:25:10,0,0
R7xl9QjtNDc,Bet | Official Trailer | Netflix,UCWOA1ZGywLbqmigxE4Qlvuw,Netflix,2025-04-21T15:00:02Z,1046082,11124,6698,UgwIaUaWvgi3GJbttJ94AaABAg,NA,@adibabintay8105,UC9yODRGbL6J96IKCh7PsgSw,Another show ruined by Netflix just watch the anime guys far better then whatever this is,en,2025-05-23T05:11:08Z,2025-05-23 01:11:08,1,0
R7xl9QjtNDc,Bet | Official Trailer | Netflix,UCWOA1ZGywLbqmigxE4Qlvuw,Netflix,2025-04-21T15:00:02Z,1046082,11124,6698,UgxI33X5M4tA7YxVaLB4AaABAg,NA,@Sunshine.291,UCzuLgWEp_dZ5obsJ0u1t-0Q,stupid shit,ny,2025-05-23T04:24:57Z,2025-05-23 00:24:57,1,0
R7xl9QjtNDc,Bet | Official Trailer | Netflix,UCWOA1ZGywLbqmigxE4Qlvuw,Netflix,2025-04-21T15:00:02Z,1046082,11124,6698,UgznRwY9_wMJOv8twTt4AaABAg,NA,@ItsJohnCarmichaelNow,UCvnd6re8e46t4STjUEIQXpw,Why netflix adaptation is always trash?,NA,2025-05-23T03:54:45Z,2025-05-22 23:54:45,1,0
R7xl9QjtNDc,Bet | Official Trailer | Netflix,UCWOA1ZGywLbqmigxE4Qlvuw,Netflix,2025-04-21T15:00:02Z,1046082,11124,6698,UgzJWRT_G6TOkGB7TU94AaABAg,NA,@LT-hl3kc,UCqr9QhG26ss__GUdxiCcXVQ,Season 2 I need,mg,2025-05-23T03:53:15Z,2025-05-22 23:53:15,0,0
R7xl9QjtNDc,Bet | Official Trailer | Netflix,UCWOA1ZGywLbqmigxE4Qlvuw,Netflix,2025-04-21T15:00:02Z,1046082,11124,6698,UgwexDPZ4PbyuDKqqUB4AaABAg,NA,,UCT3m6NLBZQbLiHa1eJJMTYw,Btw this entire concept is a rip off of Kaiji.,en,2025-05-22T23:05:55Z,2025-05-22 19:05:55,1,1
R7xl9QjtNDc,Bet | Official Trailer | Netflix,UCWOA1ZGywLbqmigxE4Qlvuw,Netflix,2025-04-21T15:00:02Z,1046082,11124,6698,Ugyg2J7t-0u-C1mRlPx4AaABAg,NA,,UCT3m6NLBZQbLiHa1eJJMTYw,Effing garbage which will never do the manga or anime justice. GTFOH.,en,2025-05-22T23:04:27Z,2025-05-22 19:04:27,1,0
R7xl9QjtNDc,Bet | Official Trailer | Netflix,UCWOA1ZGywLbqmigxE4Qlvuw,Netflix,2025-04-21T15:00:02Z,1046082,11124,6698,UgwuNXl44KDYvx5vYlZ4AaABAg,NA,@Tess11,UCHaLLeAQuqsgbaq95UztRPA,"Netflix pls pls pls don’t cancel this show, literally got hooked on Ep1, hopefully we get a season 2❤",NA,2025-05-22T22:02:20Z,2025-05-22 18:02:20,10,2
R7xl9QjtNDc,Bet | Official Trailer | Netflix,UCWOA1ZGywLbqmigxE4Qlvuw,Netflix,2025-04-21T15:00:02Z,1046082,11124,6698,UgwFhN7bawak73M7lQB4AaABAg,NA,@dondondonchanel7423,UCBrkuINJkx16yOfe6aw_bnA,Finish the whole episode . Don't compare it with original Kakegurui as it only inspired by the manga . Yumeko actress was doing really good job and i like her acting. The woke agenda should be remove because its feel so cringed. Episode 1-3 and 8-10 well acted and make me want to watch more . While middle episode feels really boring and bad scripted . Hopefully can improve in the next season. Can't wait to see Yumeko and Kira in action next season!!,en,2025-05-22T21:33:50Z,2025-05-22 17:33:50,2,0
R7xl9QjtNDc,Bet | Official Trailer | Netflix,UCWOA1ZGywLbqmigxE4Qlvuw,Netflix,2025-04-21T15:00:02Z,1046082,11124,6698,UgxqkvFswddQO48o5yF4AaABAg,NA,@rosendaldk,UC8AVC5yuUAMouBr58-7ScFw,literally just a bad copy deadly class smh,en,2025-05-22T20:37:38Z,2025-05-22 16:37:38,1,0
R7xl9QjtNDc,Bet | Official Trailer | Netflix,UCWOA1ZGywLbqmigxE4Qlvuw,Netflix,2025-04-21T15:00:02Z,1046082,11124,6698,UgzjGK3wJUCjmAB5nD54AaABAg,NA,@mikasarobiatuladawiyah6070,UC2mErjlLv5cN-g4jWCAdt4w,TRASH TRASH TRASH,hi-Latn,2025-05-22T19:40:05Z,2025-05-22 15:40:05,1,0
R7xl9QjtNDc,Bet | Official Trailer | Netflix,UCWOA1ZGywLbqmigxE4Qlvuw,Netflix,2025-04-21T15:00:02Z,1046082,11124,6698,UgxtHN5oOt156s3MXQZ4AaABAg,NA,@ملكمحمود-ف2ر,UC9z3cwD2IZ1lZYEEzndh0-g,"هذا الفيلم يروج لي الشزوز الجنسي 
ارتداء الفتيان ملابس فتيات 
وايضا اتوقع انو مخرج هذا الفلم لم يشاهد المنجا او الأنمي في حياتة",ar,2025-05-22T19:12:00Z,2025-05-22 15:12:00,1,1
R7xl9QjtNDc,Bet | Official Trailer | Netflix,UCWOA1ZGywLbqmigxE4Qlvuw,Netflix,2025-04-21T15:00:02Z,1046082,11124,6698,Ugyw1hhlUqn_epMDbcl4AaABAg,NA,@Graphic-Pen,UCBnxu1fsLCJsDemMtR6tFnw,"but we should appreciate her acting 
its too badass",NA,2025-05-22T18:52:22Z,2025-05-22 14:52:22,3,0
R7xl9QjtNDc,Bet | Official Trailer | Netflix,UCWOA1ZGywLbqmigxE4Qlvuw,Netflix,2025-04-21T15:00:02Z,1046082,11124,6698,Ugyx3nVjjzenJ3Z5qu14AaABAg,NA,@kikirizki3059,UCBeP1asYJ_cg53-b3mT4qzw,"Sorry. IM WATCH THE ANIME AND LIVE ACTION OF KAKEGURUI JAPANESE VERSION. AND WHAT THE F**K IS THAT, BET? AH ARE U KIDDING ME? NETFLIX? WHAT ARE U THINKING ABOUT? ON MY LIFE, FIRST TIME IM DISLIKE UR MOVE NOW. SORRY",en,2025-05-22T18:46:26Z,2025-05-22 14:46:26,0,0
R7xl9QjtNDc,Bet | Official Trailer | Netflix,UCWOA1ZGywLbqmigxE4Qlvuw,Netflix,2025-04-21T15:00:02Z,1046082,11124,6698,UgyAwClfnKgndC_jj5F4AaABAg,NA,@阿爾托莉雅-z5z,UC3v4Bxg6AxLy_IuYj9cdtTA,The actress of Yumeko is the only saving grace of the show.But I love her so much 😭😭😭,en,2025-05-22T16:12:01Z,2025-05-22 12:12:01,4,0
R7xl9QjtNDc,Bet | Official Trailer | Netflix,UCWOA1ZGywLbqmigxE4Qlvuw,Netflix,2025-04-21T15:00:02Z,1046082,11124,6698,UgyMGU7hkA-F58p0eMJ4AaABAg,NA,@つよし-08,UCzz-nOvcXGBFI4PRt_P88DQ,多様性はアジア人は適応されません😂,ja,2025-05-22T14:25:45Z,2025-05-22 10:25:45,0,0
R7xl9QjtNDc,Bet | Official Trailer | Netflix,UCWOA1ZGywLbqmigxE4Qlvuw,Netflix,2025-04-21T15:00:02Z,1046082,11124,6698,Ugw-tyVVcQMUD_HwriR4AaABAg,NA,@peterbrylleromaquinibardol8573,UCMHYBY4H42nkCKd1gKINATg,They turned it into a Riverdale,en,2025-05-22T14:16:19Z,2025-05-22 10:16:19,0,0
R7xl9QjtNDc,Bet | Official Trailer | Netflix,UCWOA1ZGywLbqmigxE4Qlvuw,Netflix,2025-04-21T15:00:02Z,1046082,11124,6698,UgztzHZnYFHGIZdLRGJ4AaABAg,NA,@Kade-Chiyo,UC9ggEvITJbRSH7KiA0y974w,BYE I ACTUALLY LIKED IT..,en,2025-05-22T13:36:24Z,2025-05-22 09:36:24,0,0
