video_id,video_title,channel_id,channel_title,video_published_at,view_count,video_like_count,video_comment_count,comment_id,comment_parent_id,comment_author_display,comment_author_channel_id,comment_text,comment_lang,comment_published_utc,comment_published_local,comment_like_count,comment_reply_count
R7xl9QjtNDc,Bet | Official Trailer | Netflix,UCWOA1ZGywLbqmigxE4Qlvuw,Netflix,2025-04-21T15:00:02Z,1046082,11124,6698,UgzWF21eF6hJEwR9IBN4AaABAg,NA,@vladiks_24,UCC36uCDVpAIXeyPSAbId0QQ,"A typical stupid American series. How could you ruin a team of actors, costumes, images. What is there to talk about, only Yumeko looks like herself. The rest are not😢. Kirari, Saotome, Midari, Suzui, what's wrong with them?",en,2025-06-07T13:27:31Z,2025-06-07 09:27:31,0,0
R7xl9QjtNDc,Bet | Official Trailer | Netflix,UCWOA1ZGywLbqmigxE4Qlvuw,Netflix,2025-04-21T15:00:02Z,1046082,11124,6698,Ugzvs9eoeKpXdEpoh1Z4AaABAg,NA,@vladiks_24,UCC36uCDVpAIXeyPSAbId0QQ,Cringerui,la,2025-06-07T13:23:19Z,2025-06-07 09:23:19,0,0
R7xl9QjtNDc,Bet | Official Trailer | Netflix,UCWOA1ZGywLbqmigxE4Qlvuw,Netflix,2025-04-21T15:00:02Z,1046082,11124,6698,UgyLXdJcWzV_S2GyIzF4AaABAg,NA,@tylerjones9001,UC6wd2hzz1B3deCNdhWvLUVA,season 2neeedddd,so,2025-06-07T05:31:47Z,2025-06-07 01:31:47,0,0
R7xl9QjtNDc,Bet | Official Trailer | Netflix,UCWOA1ZGywLbqmigxE4Qlvuw,Netflix,2025-04-21T15:00:02Z,1046082,11124,6698,Ugzm6WmcIZ6gZnZiaXJ4AaABAg,NA,@Hijacked630,UCoX5OSw5Y6UQP3_Z1NwHuEw,Stup1d movie 😂,NA,2025-06-07T05:29:22Z,2025-06-07 01:29:22,0,0
R7xl9QjtNDc,Bet | Official Trailer | Netflix,UCWOA1ZGywLbqmigxE4Qlvuw,Netflix,2025-04-21T15:00:02Z,1046082,11124,6698,Ugz5JjZggmkwiAT5GWV4AaABAg,NA,@sinner5974,UColoVC5_t_WbQFPh9Sdqouw,I actually really liked it I hope these kids go places in their career. Nice to see new faces and new talent. Well done show,en,2025-06-07T05:18:42Z,2025-06-07 01:18:42,1,1
R7xl9QjtNDc,Bet | Official Trailer | Netflix,UCWOA1ZGywLbqmigxE4Qlvuw,Netflix,2025-04-21T15:00:02Z,1046082,11124,6698,Ugx2bLknojKGHk5ss194AaABAg,NA,@arutohiden3807,UCm3cFqMC3ctkQFx8oTBor_A,Hot Take: It was actually good,en,2025-06-07T04:30:02Z,2025-06-07 00:30:02,0,0
R7xl9QjtNDc,Bet | Official Trailer | Netflix,UCWOA1ZGywLbqmigxE4Qlvuw,Netflix,2025-04-21T15:00:02Z,1046082,11124,6698,Ugx7p_76Ig3fQ3LPYk94AaABAg,NA,@sandyc.4630,UCQvz4BREQoepYMkOdOQ3BrA,Netflix death note movie ahh series 😭,de,2025-06-07T03:02:04Z,2025-06-06 23:02:04,0,0
R7xl9QjtNDc,Bet | Official Trailer | Netflix,UCWOA1ZGywLbqmigxE4Qlvuw,Netflix,2025-04-21T15:00:02Z,1046082,11124,6698,UgyWI8xAUen5KAPHB5h4AaABAg,NA,@mogi-06-f06,UCHuyswMTC9S_RRXTJAhX7CQ,"Peope yapping before watching lol, this series it actually good hope for a s2❤",en,2025-06-06T21:59:03Z,2025-06-06 17:59:03,0,0
R7xl9QjtNDc,Bet | Official Trailer | Netflix,UCWOA1ZGywLbqmigxE4Qlvuw,Netflix,2025-04-21T15:00:02Z,1046082,11124,6698,UgwvnPVKr-S4xhtDr-B4AaABAg,NA,@dyansennn,UCqIDrwU8HgaZH3VCUlrG8rA,"GUYS PLEASE WATCH IT,,,, ITS SO GOOD!!!.. ITS NOTHING LIKE KAKEGURUI ITS TOTALLY DIFFERENT! SO DON'T WORRY!!!!",en,2025-06-06T16:18:43Z,2025-06-06 12:18:43,0,1
R7xl9QjtNDc,Bet | Official Trailer | Netflix,UCWOA1ZGywLbqmigxE4Qlvuw,Netflix,2025-04-21T15:00:02Z,1046082,11124,6698,Ugxe0P0BbAcpLAaNd0B4AaABAg,NA,@Lexy_luv25,UCR2ExEWJ5iBRV6AC5kuVgzg,Netflix please remove this 🙏,NA,2025-06-06T15:42:05Z,2025-06-06 11:42:05,0,0
R7xl9QjtNDc,Bet | Official Trailer | Netflix,UCWOA1ZGywLbqmigxE4Qlvuw,Netflix,2025-04-21T15:00:02Z,1046082,11124,6698,Ugxw3eyRCw-8lYHDkf94AaABAg,NA,@mivvbae,UCNfLg9nFfVmMn4QWDLYv9iw,Y'all understand that this is NOT kakegurui but a Netflix series INSPIRED by kakegurui right? It's NOT supposed to be same 😭 I don't like the cast but the plot seems good,en,2025-06-06T11:14:52Z,2025-06-06 07:14:52,1,1
R7xl9QjtNDc,Bet | Official Trailer | Netflix,UCWOA1ZGywLbqmigxE4Qlvuw,Netflix,2025-04-21T15:00:02Z,1046082,11124,6698,UgwtVck2L4qevZDJEll4AaABAg,NA,@pptrar,UC6p4MS8At7AA_DWx8b28Uzg,They deserve to go to hell for spending money to make this kind of garbage.,en,2025-06-06T02:49:55Z,2025-06-05 22:49:55,0,0
R7xl9QjtNDc,Bet | Official Trailer | Netflix,UCWOA1ZGywLbqmigxE4Qlvuw,Netflix,2025-04-21T15:00:02Z,1046082,11124,6698,Ugyc1Bh-JJHkCS3G-qx4AaABAg,NA,@Cherlyin-Berry,UCmDe8I1AMd0X-jFla0e-peQ,0:27 WHY MY SUMERAGI BECOMING A BOY😭😭😭,NA,2025-06-06T01:12:23Z,2025-06-05 21:12:23,0,0
R7xl9QjtNDc,Bet | Official Trailer | Netflix,UCWOA1ZGywLbqmigxE4Qlvuw,Netflix,2025-04-21T15:00:02Z,1046082,11124,6698,UgwJogulozzkS0KQwNV4AaABAg,NA,@thumpercomet,UCkNZigTveKIs0SXplfTFY-Q,WTF is this?,en,2025-06-05T22:05:17Z,2025-06-05 18:05:17,0,0
R7xl9QjtNDc,Bet | Official Trailer | Netflix,UCWOA1ZGywLbqmigxE4Qlvuw,Netflix,2025-04-21T15:00:02Z,1046082,11124,6698,UgzjdtAWyPAkLcfg_YJ4AaABAg,NA,@yuhanchiyt8931,UCVD6_Rt8BwY7jNjg4aoRpPg,"The only good moment of the whole adaptation is the *Japanese Rickroll* we eat at the end of the last chapter 😭 
It’s cinema (The rickroll ofc)",en,2025-06-05T19:06:13Z,2025-06-05 15:06:13,0,0
R7xl9QjtNDc,Bet | Official Trailer | Netflix,UCWOA1ZGywLbqmigxE4Qlvuw,Netflix,2025-04-21T15:00:02Z,1046082,11124,6698,UgyL8n1R7SWXIVeX9jR4AaABAg,NA,@zaky_08,UC6qXbmuRU4dwyaT8qMTxTVQ,THIS IS TRENDING waiting for s2 🩷,en,2025-06-05T14:17:35Z,2025-06-05 10:17:35,0,0
R7xl9QjtNDc,Bet | Official Trailer | Netflix,UCWOA1ZGywLbqmigxE4Qlvuw,Netflix,2025-04-21T15:00:02Z,1046082,11124,6698,UgyF5mAJY1XidPSfLk94AaABAg,NA,@MikliOktarianto,UCqMI0R_Am-cGo0v7nODcs3g,came here just to give a dislike button,en,2025-06-05T10:04:12Z,2025-06-05 06:04:12,0,0
R7xl9QjtNDc,Bet | Official Trailer | Netflix,UCWOA1ZGywLbqmigxE4Qlvuw,Netflix,2025-04-21T15:00:02Z,1046082,11124,6698,UgxZaSeV8VqIsXSGFLt4AaABAg,NA,@eweb.,UCxCVG0FiNJmewPpdG1vO_GA,"The show was good! I liked it way more than the anime, much shorter and simple and if I remember correctly, less sexual too. Idk why others want a full on live action of Kakegurui when they always end up being bad. (Anime live actions)Changing it up adds fun twists and new content, but I wasn’t a big fan of the anime so I guess it’s not my place so much. Do not treat it as an anime, treat it as a live action inspired series, because that’s exactly what it and if you think differently you’re going to be disappointed obviously",en,2025-06-05T08:52:32Z,2025-06-05 04:52:32,6,3
R7xl9QjtNDc,Bet | Official Trailer | Netflix,UCWOA1ZGywLbqmigxE4Qlvuw,Netflix,2025-04-21T15:00:02Z,1046082,11124,6698,UgzlX5rHtyvR5kANru94AaABAg,NA,@henidesi-r7k,UCqRkvjOdxm2GsAQOTTHILZw,no LGBT pls this is suck,NA,2025-06-05T08:26:29Z,2025-06-05 04:26:29,0,0
R7xl9QjtNDc,Bet | Official Trailer | Netflix,UCWOA1ZGywLbqmigxE4Qlvuw,Netflix,2025-04-21T15:00:02Z,1046082,11124,6698,UgwWLPL1VFmLO3ufLTB4AaABAg,NA,@xieeah,UCJ-tXY_caCMNrGTdltZZMGg,"Watchef the entire thing and it was actually entertaining because i didnt skip a thing

Theres only three things just disappointed me though
1) the character designs 
2) the implied yuri we wanted but not there.
3) Straight yumeko ?? Woah",en,2025-06-05T05:33:00Z,2025-06-05 01:33:00,0,1
R7xl9QjtNDc,Bet | Official Trailer | Netflix,UCWOA1ZGywLbqmigxE4Qlvuw,Netflix,2025-04-21T15:00:02Z,1046082,11124,6698,UgzqsB0IZ-legkPMnF54AaABAg,NA,@SoWhat2857,UCYdqXKMF3u4GJslFcS3XjnQ,ตรงๆเลยหนังมันแย่มากจนทนดูไม่ได้จริงๆ,th,2025-06-05T03:33:52Z,2025-06-04 23:33:52,0,0
R7xl9QjtNDc,Bet | Official Trailer | Netflix,UCWOA1ZGywLbqmigxE4Qlvuw,Netflix,2025-04-21T15:00:02Z,1046082,11124,6698,Ugw4dPfPg3GDL0Hll_x4AaABAg,NA,@Introtab-z9d,UC0bBSYe4Oq9myh6WBb4wjvQ,"As someone who know nothing about kakegurui ,..! (Completely something new for me)
I loved the series and surely want to watch sesion 2..👍🏻🤍",en,2025-06-04T20:04:25Z,2025-06-04 16:04:25,3,1
R7xl9QjtNDc,Bet | Official Trailer | Netflix,UCWOA1ZGywLbqmigxE4Qlvuw,Netflix,2025-04-21T15:00:02Z,1046082,11124,6698,UgzfFaSkC2TzjVYJ9iV4AaABAg,NA,@JonathasJunior,UCqMsTjLD5z3az4-ygUgb4jQ,wtfffff is thissssss ??,NA,2025-06-04T15:30:27Z,2025-06-04 11:30:27,0,0
R7xl9QjtNDc,Bet | Official Trailer | Netflix,UCWOA1ZGywLbqmigxE4Qlvuw,Netflix,2025-04-21T15:00:02Z,1046082,11124,6698,UgwSiq_SPHId-NIGiwB4AaABAg,NA,@pokerxty,UC1hRnBnoZSeWEyCyWyFRmoQ,😂😂😂😂😂😂😂😂😂😂😂😂😂😂😂😂😂😂😂😂 better call Netflix wokeflix,lb,2025-06-04T15:20:54Z,2025-06-04 11:20:54,0,0
R7xl9QjtNDc,Bet | Official Trailer | Netflix,UCWOA1ZGywLbqmigxE4Qlvuw,Netflix,2025-04-21T15:00:02Z,1046082,11124,6698,UgxmmmO0MH6PDxDh2014AaABAg,NA,@uncomunemortale4796,UCB6skpmU0rP5m9JRE-y53gA,"I haven't read the manga nor have I seen the anime. I just watched the TV series, without knowing what it was about, I enjoyed it.",en,2025-06-04T08:56:14Z,2025-06-04 04:56:14,1,1
R7xl9QjtNDc,Bet | Official Trailer | Netflix,UCWOA1ZGywLbqmigxE4Qlvuw,Netflix,2025-04-21T15:00:02Z,1046082,11124,6698,UgzKc-IZJ37VfwOi_Dh4AaABAg,NA,@CattyPetshop-o6e9v,UCxu-4KyfYPVDraKnTJbtc5Q,Ireng😅,lb,2025-06-04T04:10:40Z,2025-06-04 00:10:40,0,0
R7xl9QjtNDc,Bet | Official Trailer | Netflix,UCWOA1ZGywLbqmigxE4Qlvuw,Netflix,2025-04-21T15:00:02Z,1046082,11124,6698,UgzUZiByxQlwDjpuG5R4AaABAg,NA,@prancerjohnponce6889,UCY6Ju99EW5iqhoPgEbXzgHg,This is their way of saying we do hate woke now.,en,2025-06-04T01:53:09Z,2025-06-03 21:53:09,0,0
R7xl9QjtNDc,Bet | Official Trailer | Netflix,UCWOA1ZGywLbqmigxE4Qlvuw,Netflix,2025-04-21T15:00:02Z,1046082,11124,6698,Ugy31IHC4kWW6Xu8qxJ4AaABAg,NA,@aloracarner8948,UCWytR2a1sL8P6aGlXwiyvCA,PLEASE give us a second season,en,2025-06-04T00:26:53Z,2025-06-03 20:26:53,12,2
R7xl9QjtNDc,Bet | Official Trailer | Netflix,UCWOA1ZGywLbqmigxE4Qlvuw,Netflix,2025-04-21T15:00:02Z,1046082,11124,6698,UgzASdgG9l4m7tFuzxZ4AaABAg,NA,@Bluemooque,UCPECE_C9b7dYpOrKkx6HPtw,Is this the new Netflix Death Note?,en,2025-06-03T21:12:46Z,2025-06-03 17:12:46,0,0
R7xl9QjtNDc,Bet | Official Trailer | Netflix,UCWOA1ZGywLbqmigxE4Qlvuw,Netflix,2025-04-21T15:00:02Z,1046082,11124,6698,UgxNPm24B-ENmzhKaUx4AaABAg,NA,@takumi80,UCmX0HqbZK102ATefAfHCczA,Eww so nauseating,jv,2025-06-03T18:51:04Z,2025-06-03 14:51:04,0,0
R7xl9QjtNDc,Bet | Official Trailer | Netflix,UCWOA1ZGywLbqmigxE4Qlvuw,Netflix,2025-04-21T15:00:02Z,1046082,11124,6698,UgxreYohknsJecLfPjh4AaABAg,NA,@FerliantioIEchan,UC3oXb5NxKI6pxf2pYqICjNw,"this adaptation is really dogshit , dont watch it fr",en,2025-06-03T18:17:48Z,2025-06-03 14:17:48,0,0
R7xl9QjtNDc,Bet | Official Trailer | Netflix,UCWOA1ZGywLbqmigxE4Qlvuw,Netflix,2025-04-21T15:00:02Z,1046082,11124,6698,UgxFoRJsObycDZ_9tVZ4AaABAg,NA,@benzakaria5756,UCEBwGX3WfItoW0WRN2r42MQ,dissapointed with diversity,en,2025-06-03T17:43:42Z,2025-06-03 13:43:42,0,0
R7xl9QjtNDc,Bet | Official Trailer | Netflix,UCWOA1ZGywLbqmigxE4Qlvuw,Netflix,2025-04-21T15:00:02Z,1046082,11124,6698,Ugwm0ezEXEd74arAwV94AaABAg,NA,@DomenicPentagan,UCyJm-jIPTIbzRiECgEtZcdg,It's a disappointment. I stop watching the last episodes. To regain my waste of time i watch the anime,en,2025-06-03T15:44:43Z,2025-06-03 11:44:43,0,0
R7xl9QjtNDc,Bet | Official Trailer | Netflix,UCWOA1ZGywLbqmigxE4Qlvuw,Netflix,2025-04-21T15:00:02Z,1046082,11124,6698,UgxJDeDyO2pGrY-yd_l4AaABAg,NA,@shenelgamer746,UCUxe3t7YPB4B5rDmF0u5sUg,I will be canceling my Netflix subscription.,en,2025-06-03T15:23:11Z,2025-06-03 11:23:11,0,0
R7xl9QjtNDc,Bet | Official Trailer | Netflix,UCWOA1ZGywLbqmigxE4Qlvuw,Netflix,2025-04-21T15:00:02Z,1046082,11124,6698,Ugw8s3TGU_v88H-6K6p4AaABAg,NA,@CalonLurahKonoha,UC7GrTYCwEzdcDULL1cd7gdg,Kapan nih episode selanjutnya,id,2025-06-03T14:02:06Z,2025-06-03 10:02:06,1,0
R7xl9QjtNDc,Bet | Official Trailer | Netflix,UCWOA1ZGywLbqmigxE4Qlvuw,Netflix,2025-04-21T15:00:02Z,1046082,11124,6698,Ugxb9Eb5sHhN4kH39i14AaABAg,NA,@HambaYME,UC7JALfSwizsLxhJqDACv1jQ,mengapa harus hitam?!,NA,2025-06-03T12:30:49Z,2025-06-03 08:30:49,0,0
R7xl9QjtNDc,Bet | Official Trailer | Netflix,UCWOA1ZGywLbqmigxE4Qlvuw,Netflix,2025-04-21T15:00:02Z,1046082,11124,6698,Ugzp5dHvsp_FyJ_q9L94AaABAg,NA,@ManishaBhagat-nb4oy,UCZuvrCfptSOnERzDSROQyBQ,Loved it,fy,2025-06-03T12:14:11Z,2025-06-03 08:14:11,0,0
R7xl9QjtNDc,Bet | Official Trailer | Netflix,UCWOA1ZGywLbqmigxE4Qlvuw,Netflix,2025-04-21T15:00:02Z,1046082,11124,6698,UgwhyRG18BW10Br4VXh4AaABAg,NA,@romantic_girlfantasy88,UC4SGQHoe_5WZFTw7I7Ud_Iw,Ooo God I love it,NA,2025-06-03T11:55:26Z,2025-06-03 07:55:26,0,0
R7xl9QjtNDc,Bet | Official Trailer | Netflix,UCWOA1ZGywLbqmigxE4Qlvuw,Netflix,2025-04-21T15:00:02Z,1046082,11124,6698,UgxPKb0qtI_l2xfCQoV4AaABAg,NA,@BurntCheeseCookiezzz,UCinCMsMUstAA7CcO70k1UJg,1:21 BINGOOOOOOOOO,so,2025-06-03T11:45:52Z,2025-06-03 07:45:52,0,0
R7xl9QjtNDc,Bet | Official Trailer | Netflix,UCWOA1ZGywLbqmigxE4Qlvuw,Netflix,2025-04-21T15:00:02Z,1046082,11124,6698,Ugy3OirHIeQfzNVdPyp4AaABAg,NA,@dukegerard5475,UCy9gHKG0Vah30PPX7QLGOfw,perfect for ALITA battle angel,NA,2025-06-03T08:26:39Z,2025-06-03 04:26:39,0,0
R7xl9QjtNDc,Bet | Official Trailer | Netflix,UCWOA1ZGywLbqmigxE4Qlvuw,Netflix,2025-04-21T15:00:02Z,1046082,11124,6698,Ugz53RSA27yWno0nwVR4AaABAg,NA,@nathanbautista7620,UC8oZVF8JVaDAc3ellB3rKWg,Season 2 on 2027,NA,2025-06-03T07:54:40Z,2025-06-03 03:54:40,1,0
R7xl9QjtNDc,Bet | Official Trailer | Netflix,UCWOA1ZGywLbqmigxE4Qlvuw,Netflix,2025-04-21T15:00:02Z,1046082,11124,6698,Ugz4ib6wIPL8oU-hNCt4AaABAg,NA,@MildSyn,UCm9adVXgjNa8QRi0ReiloBg,"EVEN THE NAME IS CRINGE, NETFLIX YOU RUINED KAKEGURUI",NA,2025-06-03T06:39:20Z,2025-06-03 02:39:20,0,0
R7xl9QjtNDc,Bet | Official Trailer | Netflix,UCWOA1ZGywLbqmigxE4Qlvuw,Netflix,2025-04-21T15:00:02Z,1046082,11124,6698,Ugyg5indn1ZqcBA2ost4AaABAg,NA,@SergeantGadriel,UCMsh-fUFSLdyqlS9LSobzWw,Why Hollywood turns everything into wokeshit???,en,2025-06-03T03:14:06Z,2025-06-02 23:14:06,1,0
R7xl9QjtNDc,Bet | Official Trailer | Netflix,UCWOA1ZGywLbqmigxE4Qlvuw,Netflix,2025-04-21T15:00:02Z,1046082,11124,6698,UgzbdVwpNesb_e2D04B4AaABAg,NA,@elaisssac223,UCPe0D1a5LaeGdCPBvHiqaJg,Que bien laive bachion,fr,2025-06-03T00:27:20Z,2025-06-02 20:27:20,0,0
R7xl9QjtNDc,Bet | Official Trailer | Netflix,UCWOA1ZGywLbqmigxE4Qlvuw,Netflix,2025-04-21T15:00:02Z,1046082,11124,6698,UgxP6KG1X8DO73CwxDV4AaABAg,NA,@carlitos5336,UC3oycjQXhNFJaovutVEspIQ,I liked it!!! ❤,mg,2025-06-02T23:04:49Z,2025-06-02 19:04:49,0,0
R7xl9QjtNDc,Bet | Official Trailer | Netflix,UCWOA1ZGywLbqmigxE4Qlvuw,Netflix,2025-04-21T15:00:02Z,1046082,11124,6698,UgypjOlGU9JP3-H5Y_x4AaABAg,NA,@youravantgarde,UCaHcCYbd-AA-b3jBE3haPEg,I just watched the first 15 min and had to shut it off when a dude named Suki in women's clothes showed up with his hairy stomach hanging out. Netflix sure went full woke with this one.,en,2025-06-02T22:07:17Z,2025-06-02 18:07:17,0,0
R7xl9QjtNDc,Bet | Official Trailer | Netflix,UCWOA1ZGywLbqmigxE4Qlvuw,Netflix,2025-04-21T15:00:02Z,1046082,11124,6698,Ugz1t0J7i5mUg82BsPZ4AaABAg,NA,@yumekoylls,UCkelNWQPytGHlB94bLuWagw,Oİİİ,sr,2025-06-02T21:53:02Z,2025-06-02 17:53:02,0,0
R7xl9QjtNDc,Bet | Official Trailer | Netflix,UCWOA1ZGywLbqmigxE4Qlvuw,Netflix,2025-04-21T15:00:02Z,1046082,11124,6698,Ugzsj072pYQMi1apcAV4AaABAg,NA,@bombizombie908,UC30JG7jGDgfFgOI4Hn-RpPg,"That Dude "" influencer "" is so cringe it makes me wanna see bullies in that school. The story is nice but the degeneracy is wild lmao and please spare me of those "" anime/mangas/book had the same kind of people "" speeches.. ain't even gonna watch episode 2.",en,2025-06-02T19:05:06Z,2025-06-02 15:05:06,0,0
R7xl9QjtNDc,Bet | Official Trailer | Netflix,UCWOA1ZGywLbqmigxE4Qlvuw,Netflix,2025-04-21T15:00:02Z,1046082,11124,6698,UgyS27F2kUHxT4R_Lfl4AaABAg,NA,@Zumbie15,UCgVLPRRS14Y_ZhAsgcmT-Bw,screw you netflix for making a western Kekegurui!,NA,2025-06-02T16:47:45Z,2025-06-02 12:47:45,3,0
R7xl9QjtNDc,Bet | Official Trailer | Netflix,UCWOA1ZGywLbqmigxE4Qlvuw,Netflix,2025-04-21T15:00:02Z,1046082,11124,6698,UgxVJEuC2VsDYHjzKp14AaABAg,NA,@m.v.j6804,UCszUGb56nIiKHjynxZclmBg,My friend  watched this before watching the anime and said he loved it. I recommended him to watch the anime and now he wants a refund,en,2025-06-02T16:00:25Z,2025-06-02 12:00:25,0,0
R7xl9QjtNDc,Bet | Official Trailer | Netflix,UCWOA1ZGywLbqmigxE4Qlvuw,Netflix,2025-04-21T15:00:02Z,1046082,11124,6698,UgxCW_k-FFcupQtZRaB4AaABAg,NA,@HCATSONGS,UCKaihaOhhwIheJyo5W6AEKA,this suck !,la,2025-06-02T13:54:23Z,2025-06-02 09:54:23,1,0
R7xl9QjtNDc,Bet | Official Trailer | Netflix,UCWOA1ZGywLbqmigxE4Qlvuw,Netflix,2025-04-21T15:00:02Z,1046082,11124,6698,UgyVZp6PYvpTp1CzDN54AaABAg,NA,@channeldemian8748,UCuBihPiTZr75PEVfajunkzA,it's a good series. All casts are really good at their roles and the plot is a bit off. Idk why ... It could've way darker but now it's a bit soft for the characters. And no offense but it seems low budget school project. Please don't cancel this show Netflix. It has potential. Can't wait to see season 2,en,2025-06-02T09:26:58Z,2025-06-02 05:26:58,1,1
R7xl9QjtNDc,Bet | Official Trailer | Netflix,UCWOA1ZGywLbqmigxE4Qlvuw,Netflix,2025-04-21T15:00:02Z,1046082,11124,6698,Ugy6JYivABm1O9jdKpt4AaABAg,NA,@couturepinkbae6510,UCEnTwdg6NlpUV4wrXc0FeZA,Remove this now (I SWEAR THERE IS ALREADY A LIVE ACTION JUST UPLOAD THAT ONE??),en,2025-06-02T06:46:16Z,2025-06-02 02:46:16,1,0
R7xl9QjtNDc,Bet | Official Trailer | Netflix,UCWOA1ZGywLbqmigxE4Qlvuw,Netflix,2025-04-21T15:00:02Z,1046082,11124,6698,UgxmtXcxJ82zjy8ef-V4AaABAg,NA,@XiaoMaoSu,UCnO8nVugCzcbNc57Xr5U0yA,She needs bbc😂😂😂,NA,2025-06-02T04:09:21Z,2025-06-02 00:09:21,0,0
R7xl9QjtNDc,Bet | Official Trailer | Netflix,UCWOA1ZGywLbqmigxE4Qlvuw,Netflix,2025-04-21T15:00:02Z,1046082,11124,6698,Ugxup8HFvic7rvqga0t4AaABAg,NA,@DonBaTzu,UCw8MK36WAb2zxrWfRdCpQaA,Disgusting,af,2025-06-02T01:32:12Z,2025-06-01 21:32:12,1,0
R7xl9QjtNDc,Bet | Official Trailer | Netflix,UCWOA1ZGywLbqmigxE4Qlvuw,Netflix,2025-04-21T15:00:02Z,1046082,11124,6698,UgzXuMdr-73cuHJql_d4AaABAg,NA,@jane48484,UC2Ey0im-W6GA0uMeaNL7X0Q,I watched this entire series and I really liked it. I think many people might like it. I'd like to see a second season.,en,2025-06-02T00:28:39Z,2025-06-01 20:28:39,2,1
R7xl9QjtNDc,Bet | Official Trailer | Netflix,UCWOA1ZGywLbqmigxE4Qlvuw,Netflix,2025-04-21T15:00:02Z,1046082,11124,6698,UgxAYF2BP57gEn8LHPJ4AaABAg,NA,@DerpyICEcube,UCwtXdV_hE21HpHXpOETT8YQ,"I've watched about 3 episodes in now and ngl it's still enjoyable to watch even though yumiko isn't yumiko but the actor plays well so it doesn't bother me as much but I'll admit they did the whole school council and Kira wrong in so many ways even the games they play are wrong lmao


Like why the hell were they having a sword fight 😭😭😭",en,2025-06-01T22:19:52Z,2025-06-01 18:19:52,3,0
R7xl9QjtNDc,Bet | Official Trailer | Netflix,UCWOA1ZGywLbqmigxE4Qlvuw,Netflix,2025-04-21T15:00:02Z,1046082,11124,6698,UgwVPxe_wp23WNB37uh4AaABAg,NA,@aethersx2,UCi3KXVArX35eVROlb1TejrQ,i just like the main character jabami yumeko,NA,2025-06-01T17:30:57Z,2025-06-01 13:30:57,3,0
R7xl9QjtNDc,Bet | Official Trailer | Netflix,UCWOA1ZGywLbqmigxE4Qlvuw,Netflix,2025-04-21T15:00:02Z,1046082,11124,6698,UgwPzrTNe2L0KrOY8uN4AaABAg,NA,@andyyyj731,UCbmpSVMil-Q54T-e1Ai_HTQ,EWWWWW.... The cringe is...,fy,2025-06-01T14:36:16Z,2025-06-01 10:36:16,1,0
R7xl9QjtNDc,Bet | Official Trailer | Netflix,UCWOA1ZGywLbqmigxE4Qlvuw,Netflix,2025-04-21T15:00:02Z,1046082,11124,6698,UgzlbK47u8k6as3wnbh4AaABAg,NA,@Entzu-n3o,UCAxYhYq1MPVYek96n5rPGeg,I personally enjoy watching this show. I reckon there are many people who may enjoy the show as well.,en,2025-06-01T13:33:32Z,2025-06-01 09:33:32,1,0
R7xl9QjtNDc,Bet | Official Trailer | Netflix,UCWOA1ZGywLbqmigxE4Qlvuw,Netflix,2025-04-21T15:00:02Z,1046082,11124,6698,UgwRAAlbKmWOqfmR_Zp4AaABAg,NA,@zoraizsafana8370,UC_1OgYv6e3ujhfDb91t4L1g,Where to find the coin which Yumeko had?,en,2025-06-01T11:34:33Z,2025-06-01 07:34:33,0,0
R7xl9QjtNDc,Bet | Official Trailer | Netflix,UCWOA1ZGywLbqmigxE4Qlvuw,Netflix,2025-04-21T15:00:02Z,1046082,11124,6698,UgzrQTEeu9xxgGFeNvd4AaABAg,NA,@Hetcuucalo,UC7viNIWijEvgmnRa1uEXIzg,GET OUT BI*CH,co,2025-06-01T09:19:09Z,2025-06-01 05:19:09,0,0
R7xl9QjtNDc,Bet | Official Trailer | Netflix,UCWOA1ZGywLbqmigxE4Qlvuw,Netflix,2025-04-21T15:00:02Z,1046082,11124,6698,UgyYv8_837Xo1XrDh0F4AaABAg,NA,@Meenalkv,UCKWL09bZtTpI03VtPB7RxfQ,"WE NEED SEASON 222
ABSOLUTELY LOVED THE SERIES",en,2025-06-01T09:17:54Z,2025-06-01 05:17:54,6,1
R7xl9QjtNDc,Bet | Official Trailer | Netflix,UCWOA1ZGywLbqmigxE4Qlvuw,Netflix,2025-04-21T15:00:02Z,1046082,11124,6698,Ugwnko4ItI5CcZ23cQJ4AaABAg,NA,@michimendoza_,UCLaM1OyAAj-gJeKfiDg2fjA,They made my comfort anime so cringe,en,2025-06-01T03:40:57Z,2025-05-31 23:40:57,1,0
R7xl9QjtNDc,Bet | Official Trailer | Netflix,UCWOA1ZGywLbqmigxE4Qlvuw,Netflix,2025-04-21T15:00:02Z,1046082,11124,6698,Ugza4jTUU76BtNW3-zB4AaABAg,NA,@crazyminx1000,UCE3woeREXaqHur3wkkXprrA,LOVED THIS!!,en,2025-06-01T01:16:28Z,2025-05-31 21:16:28,1,0
R7xl9QjtNDc,Bet | Official Trailer | Netflix,UCWOA1ZGywLbqmigxE4Qlvuw,Netflix,2025-04-21T15:00:02Z,1046082,11124,6698,UgxXhWsOPwxTlF5UV9N4AaABAg,NA,@biancatuggle9247,UCjWc2ZUkO5apW9Ae_Vc_VJQ,I loved it! ❤,NA,2025-06-01T00:59:54Z,2025-05-31 20:59:54,1,0
R7xl9QjtNDc,Bet | Official Trailer | Netflix,UCWOA1ZGywLbqmigxE4Qlvuw,Netflix,2025-04-21T15:00:02Z,1046082,11124,6698,UgwUFT3VRNCss7UDvXR4AaABAg,NA,@qiyi7433,UC2vCMT_A76MSLHz1k9O0jNQ,"don’t judge a series by it’s trailer, and this is not meant to be a one to one copy of the manga, obviously.",en,2025-05-31T23:40:22Z,2025-05-31 19:40:22,3,1
R7xl9QjtNDc,Bet | Official Trailer | Netflix,UCWOA1ZGywLbqmigxE4Qlvuw,Netflix,2025-04-21T15:00:02Z,1046082,11124,6698,UgzMyQBHdR04p9ojFpl4AaABAg,NA,@danielwolf6477,UCrst8myGk6valMiVNcatjuw,Death note all over again!,en,2025-05-31T23:10:24Z,2025-05-31 19:10:24,1,0
R7xl9QjtNDc,Bet | Official Trailer | Netflix,UCWOA1ZGywLbqmigxE4Qlvuw,Netflix,2025-04-21T15:00:02Z,1046082,11124,6698,Ugz_5amc68etBBMsEth4AaABAg,NA,@danielwolf6477,UCrst8myGk6valMiVNcatjuw,This SCREAMS woke garbage!,af,2025-05-31T23:06:45Z,2025-05-31 19:06:45,0,2
R7xl9QjtNDc,Bet | Official Trailer | Netflix,UCWOA1ZGywLbqmigxE4Qlvuw,Netflix,2025-04-21T15:00:02Z,1046082,11124,6698,UgzzwqJSXqCGWoVZESt4AaABAg,NA,@Ilovematcha27,UCPNq4qpVKrx72BuukF4ITmw,Guys its just based of Kakegur,af,2025-05-31T22:55:24Z,2025-05-31 18:55:24,0,0
R7xl9QjtNDc,Bet | Official Trailer | Netflix,UCWOA1ZGywLbqmigxE4Qlvuw,Netflix,2025-04-21T15:00:02Z,1046082,11124,6698,UgxwrD7UTEo44RFlFaJ4AaABAg,NA,@rayc2680,UCw3NzvkwbZPTMNRcZhfXecQ,"Read the room Netflix, you lick asss with your bastardisations of beloved IP, hopefully you go down taking heavy financial loss like Disney did ... smh",en,2025-05-31T19:37:35Z,2025-05-31 15:37:35,0,3
R7xl9QjtNDc,Bet | Official Trailer | Netflix,UCWOA1ZGywLbqmigxE4Qlvuw,Netflix,2025-04-21T15:00:02Z,1046082,11124,6698,Ugztv7QEMtSsU8EOvyZ4AaABAg,NA,@herRhythm,UCqSo2HIz0amb0zDAOtuHtMw,I love this! ❤,en,2025-05-31T18:56:32Z,2025-05-31 14:56:32,0,0
R7xl9QjtNDc,Bet | Official Trailer | Netflix,UCWOA1ZGywLbqmigxE4Qlvuw,Netflix,2025-04-21T15:00:02Z,1046082,11124,6698,Ugxflq_ifPOqPdRzi_x4AaABAg,NA,@WildXD,UCagHTb3YbvcBrbUz7wa9s5A,Am i only one enjoying this.?.. Tbh didnt watched the anime version probably thats why.. but am sure people like me will njoy this,en,2025-05-31T15:13:40Z,2025-05-31 11:13:40,2,2
R7xl9QjtNDc,Bet | Official Trailer | Netflix,UCWOA1ZGywLbqmigxE4Qlvuw,Netflix,2025-04-21T15:00:02Z,1046082,11124,6698,UgxIYo-1qjNCKE8z1xp4AaABAg,NA,@lesiguezianat.2770,UCF7jEpVeh2myBMVrbCYXMEw,"I dont think this will be accepted like their one piece live action. Live action failure i guess cause it seems cringe, although i like the smile of the lead actress like the corner of her lips( well make up probably enhance it but still)",en,2025-05-31T14:56:47Z,2025-05-31 10:56:47,1,0
R7xl9QjtNDc,Bet | Official Trailer | Netflix,UCWOA1ZGywLbqmigxE4Qlvuw,Netflix,2025-04-21T15:00:02Z,1046082,11124,6698,UgxvUqyN5CJYcGf77BN4AaABAg,NA,@SyhbAhsan,UC6ofTcNc2qbx5c8F8ojrp-g,🏳️‍🌈🏳️‍🌈????,ne,2025-05-31T14:46:01Z,2025-05-31 10:46:01,0,0
R7xl9QjtNDc,Bet | Official Trailer | Netflix,UCWOA1ZGywLbqmigxE4Qlvuw,Netflix,2025-04-21T15:00:02Z,1046082,11124,6698,UgwFGTfewxcxfmDxqrd4AaABAg,NA,@MiyokoMizukii,UCu_ZVI3SJVKPbzAQWN0EfFA,This cant be real... Right?,en,2025-05-31T13:58:41Z,2025-05-31 09:58:41,1,0
R7xl9QjtNDc,Bet | Official Trailer | Netflix,UCWOA1ZGywLbqmigxE4Qlvuw,Netflix,2025-04-21T15:00:02Z,1046082,11124,6698,UgwZQ6QIMTjEjOudx2Z4AaABAg,NA,@wasakwave,UCrOXRsILvbrVaYyyalpgDCw,Yumeko and the black dude,NA,2025-05-31T13:02:32Z,2025-05-31 09:02:32,0,1
R7xl9QjtNDc,Bet | Official Trailer | Netflix,UCWOA1ZGywLbqmigxE4Qlvuw,Netflix,2025-04-21T15:00:02Z,1046082,11124,6698,UgwTwW9PTqNI0K6waCF4AaABAg,NA,@baam1007,UCIUwk7p2G8wX0KrsLeOOJ4A,say no to lgbt,fil,2025-05-31T10:36:12Z,2025-05-31 06:36:12,0,0
R7xl9QjtNDc,Bet | Official Trailer | Netflix,UCWOA1ZGywLbqmigxE4Qlvuw,Netflix,2025-04-21T15:00:02Z,1046082,11124,6698,UgyRnuX3P8NNff2t9Hd4AaABAg,NA,@NPC977,UCKip4dl5eIMrN7Pdg-nts3Q,trash,hi-Latn,2025-05-31T05:51:58Z,2025-05-31 01:51:58,1,0
R7xl9QjtNDc,Bet | Official Trailer | Netflix,UCWOA1ZGywLbqmigxE4Qlvuw,Netflix,2025-04-21T15:00:02Z,1046082,11124,6698,UgwRcVvnFhY7QkLeDqJ4AaABAg,NA,@万恶共匪毒害中华,UC5ATWauOC6Oikb2eRTdOsGw,Stealing Japanese art and culture again?,en,2025-05-30T22:47:53Z,2025-05-30 18:47:53,1,0
R7xl9QjtNDc,Bet | Official Trailer | Netflix,UCWOA1ZGywLbqmigxE4Qlvuw,Netflix,2025-04-21T15:00:02Z,1046082,11124,6698,UgyGoZMQTelRti-r9f54AaABAg,NA,@nias2987,UCaBzX9wWP2LpZpldwZLMfgA,Okkk so this is also a way to make black money white 🤯...,el-Latn,2025-05-30T21:02:26Z,2025-05-30 17:02:26,0,0
R7xl9QjtNDc,Bet | Official Trailer | Netflix,UCWOA1ZGywLbqmigxE4Qlvuw,Netflix,2025-04-21T15:00:02Z,1046082,11124,6698,Ugyl0vJroCGK29bOfut4AaABAg,NA,@thunder7580,UCGFfzjj69PXTu453UQRf8sA,parece kakegurui hecho por disney jaja porque se molestaron en sacar esto mataron la serie lo mismo que hicieron con death note,es,2025-05-30T19:29:52Z,2025-05-30 15:29:52,0,0
