video_id,video_title,channel_id,channel_title,video_published_at,view_count,video_like_count,video_comment_count,comment_id,comment_parent_id,comment_author_display,comment_author_channel_id,comment_text,comment_lang,comment_published_utc,comment_published_local,comment_like_count,comment_reply_count
R7xl9QjtNDc,Bet | Official Trailer | Netflix,UCWOA1ZGywLbqmigxE4Qlvuw,Netflix,2025-04-21T15:00:02Z,1046082,11124,6698,Ugy57rRySiEvEURbMdR4AaABAg,NA,@Jaykayhay97,UCM1Vl-Cn1IzHZeuuCOHfJYg,"The ppl mad about this should try watching it and not compare it to the manga. Just because a show is based on something, doesn’t mean it has to follow it 100%. I binge watched Bet in one sitting and thought it was amazing! The actress that played Yumeko looks and sounds like she walked straight out of an anime. Diverse & interesting characters, as well as great acting from everyone 👍",en,2025-05-18T07:17:20Z,2025-05-18 03:17:20,29,6
R7xl9QjtNDc,Bet | Official Trailer | Netflix,UCWOA1ZGywLbqmigxE4Qlvuw,Netflix,2025-04-21T15:00:02Z,1046082,11124,6698,UgwYOjFzy0Snoowg50F4AaABAg,NA,@Vrod-2,UCzHYvJHLnYlSiLyF6leUH_g,Wow!!! This looks like a massive pile of 🐶💩!!! Way to ruin a great anime Netflix!!!,en,2025-05-18T07:15:20Z,2025-05-18 03:15:20,0,0
R7xl9QjtNDc,Bet | Official Trailer | Netflix,UCWOA1ZGywLbqmigxE4Qlvuw,Netflix,2025-04-21T15:00:02Z,1046082,11124,6698,Ugwsxr_dvrA0g8r0mzV4AaABAg,NA,@armyblink1967,UCLTlYmpxfxF7WrFEM1MBcSw,"Just a boring series, ruined actual anime essence",en,2025-05-18T07:01:52Z,2025-05-18 03:01:52,0,0
R7xl9QjtNDc,Bet | Official Trailer | Netflix,UCWOA1ZGywLbqmigxE4Qlvuw,Netflix,2025-04-21T15:00:02Z,1046082,11124,6698,UgwYh99gMfIw5WeYbJh4AaABAg,NA,@pirate-s9d,UCw6cKay3H7RozrGKebZ14TA,S2,sr,2025-05-18T06:52:36Z,2025-05-18 02:52:36,0,0
R7xl9QjtNDc,Bet | Official Trailer | Netflix,UCWOA1ZGywLbqmigxE4Qlvuw,Netflix,2025-04-21T15:00:02Z,1046082,11124,6698,Ugw-uTxoq6YnURl5Ral4AaABAg,NA,@Fate11222o,UCukIkmcdviyl6rX2AwgnZVw,One of the best shows..,en,2025-05-18T06:45:41Z,2025-05-18 02:45:41,2,0
R7xl9QjtNDc,Bet | Official Trailer | Netflix,UCWOA1ZGywLbqmigxE4Qlvuw,Netflix,2025-04-21T15:00:02Z,1046082,11124,6698,UgzhXlnMsofcflaOIFJ4AaABAg,NA,@William1903-jp,UCphlE42eabODsuCfTpTf5lQ,The lipstick is hilarious btw the girl who cast Yumeko kinda give me the vibe,en,2025-05-18T06:29:20Z,2025-05-18 02:29:20,2,0
R7xl9QjtNDc,Bet | Official Trailer | Netflix,UCWOA1ZGywLbqmigxE4Qlvuw,Netflix,2025-04-21T15:00:02Z,1046082,11124,6698,UgzhaWKtxdo81eJkf5J4AaABAg,NA,@ajolotericardo8141,UChcWsS82GnU3OSnOJ-3MiDg,wow this sucks,sn,2025-05-18T04:35:55Z,2025-05-18 00:35:55,0,0
R7xl9QjtNDc,Bet | Official Trailer | Netflix,UCWOA1ZGywLbqmigxE4Qlvuw,Netflix,2025-04-21T15:00:02Z,1046082,11124,6698,Ugy5ic3zxSepIwKSgS94AaABAg,NA,@rikkimae,UC8vF4UdaTGbrPgxMo7ZQxjw,I dont like it. the Narrator is unnecessary.,en,2025-05-18T04:30:31Z,2025-05-18 00:30:31,0,0
R7xl9QjtNDc,Bet | Official Trailer | Netflix,UCWOA1ZGywLbqmigxE4Qlvuw,Netflix,2025-04-21T15:00:02Z,1046082,11124,6698,Ugz3OdTEaaDFWa7D1AF4AaABAg,NA,@sukroharicots,UCf7ujbnUhtYuk5rzc9_R9Dw,This adaptation look disgusting and hard to look more like bunch fat cosplayer mix with political incorrect brats,en,2025-05-18T04:21:17Z,2025-05-18 00:21:17,0,1
R7xl9QjtNDc,Bet | Official Trailer | Netflix,UCWOA1ZGywLbqmigxE4Qlvuw,Netflix,2025-04-21T15:00:02Z,1046082,11124,6698,Ugxbv2gM4ddoirYx8Yd4AaABAg,NA,@akshaym0143,UCAdR_PI3c6yrbjpL1QsE_TQ,The f**k is this? Don't ruin such a good manhwa.,en,2025-05-18T03:59:39Z,2025-05-17 23:59:39,0,0
R7xl9QjtNDc,Bet | Official Trailer | Netflix,UCWOA1ZGywLbqmigxE4Qlvuw,Netflix,2025-04-21T15:00:02Z,1046082,11124,6698,UgyzyB3t4gN3yKQJi3t4AaABAg,NA,@NuShitWhoDis,UC3WzcJcsIR-_Hi3nQJwfNaQ,I'm not betting this show will still be in rotation by year's end.,en,2025-05-18T03:42:03Z,2025-05-17 23:42:03,0,0
R7xl9QjtNDc,Bet | Official Trailer | Netflix,UCWOA1ZGywLbqmigxE4Qlvuw,Netflix,2025-04-21T15:00:02Z,1046082,11124,6698,UgxlOExOo9KoZ9Rh_Pp4AaABAg,NA,@gregory1136,UC2Ww0wX5gPW-SIeugeqb6lg,"The Japanese culture that white people imagine is insulting to Japanese people. It's fine to admire Japanese culture, but don't get the wrong idea. It makes me sick.",en,2025-05-18T03:29:07Z,2025-05-17 23:29:07,1,0
R7xl9QjtNDc,Bet | Official Trailer | Netflix,UCWOA1ZGywLbqmigxE4Qlvuw,Netflix,2025-04-21T15:00:02Z,1046082,11124,6698,UgxTm3RLGjTE9hCvTdt4AaABAg,NA,@yb4893,UCuj1e7Vhi-eYCK5d574sveg,dislike,ms,2025-05-18T03:12:53Z,2025-05-17 23:12:53,1,0
R7xl9QjtNDc,Bet | Official Trailer | Netflix,UCWOA1ZGywLbqmigxE4Qlvuw,Netflix,2025-04-21T15:00:02Z,1046082,11124,6698,Ugyawqk6En4_nhS3K3h4AaABAg,NA,@elshasumiran8929,UCVkvUF3FWGXvBAgHau9xovQ,Why yall so serious? It's an adaptation. I see this like a fanfic 😂 it has it's own story. I love Kakegurui. And I also love this version 🎉 its entertaining in its own way,en,2025-05-18T03:07:43Z,2025-05-17 23:07:43,1,0
R7xl9QjtNDc,Bet | Official Trailer | Netflix,UCWOA1ZGywLbqmigxE4Qlvuw,Netflix,2025-04-21T15:00:02Z,1046082,11124,6698,UgzNLOKP3ozTh1bqSVZ4AaABAg,NA,@user-nj6de3bg1r,UCaoz6Lm9odO3009nK1aUAWA,여주인공은 진짜 매력적인데 옆에 나오는 남자배우는 40대 아님? 여주 아빠같은데 ㅋㅋ,ko,2025-05-18T02:58:54Z,2025-05-17 22:58:54,0,0
R7xl9QjtNDc,Bet | Official Trailer | Netflix,UCWOA1ZGywLbqmigxE4Qlvuw,Netflix,2025-04-21T15:00:02Z,1046082,11124,6698,UgxiYBjxp2i_7IPQV8h4AaABAg,NA,@nekomimi4923,UCEr1i57KZrnwhEguFjxnE_A,YUCK💀😭,kk,2025-05-18T02:51:14Z,2025-05-17 22:51:14,0,0
R7xl9QjtNDc,Bet | Official Trailer | Netflix,UCWOA1ZGywLbqmigxE4Qlvuw,Netflix,2025-04-21T15:00:02Z,1046082,11124,6698,Ugw3ek3pLJXNxaQXXbh4AaABAg,NA,@Najwa-o6k,UCqScW8wzvMNGmE78CucyMOg,"Movie kakegurui jepang not bad 
Kakegurui Netflix: .... Bad..",NA,2025-05-18T01:54:48Z,2025-05-17 21:54:48,1,0
R7xl9QjtNDc,Bet | Official Trailer | Netflix,UCWOA1ZGywLbqmigxE4Qlvuw,Netflix,2025-04-21T15:00:02Z,1046082,11124,6698,Ugxx6RHNsgPxBdh48uR4AaABAg,NA,@sorisu8797,UCF7Vw24K53xFkvFdhUT72eA,esto le daria un infarto al autor como minimo,es,2025-05-18T00:41:48Z,2025-05-17 20:41:48,0,0
R7xl9QjtNDc,Bet | Official Trailer | Netflix,UCWOA1ZGywLbqmigxE4Qlvuw,Netflix,2025-04-21T15:00:02Z,1046082,11124,6698,Ugz8kt672d_Ygy_qa6J4AaABAg,NA,@leonardomesa5005,UC15XWuXZ6-iLT8lDOQUx2GA,It was really necessary Netflix? 😠,NA,2025-05-18T00:34:28Z,2025-05-17 20:34:28,1,0
R7xl9QjtNDc,Bet | Official Trailer | Netflix,UCWOA1ZGywLbqmigxE4Qlvuw,Netflix,2025-04-21T15:00:02Z,1046082,11124,6698,Ugz6I0LhwkoG5wj2u3t4AaABAg,NA,@XoxoGaming-r6x,UCrw_q70tpv931uVZyY-bPuA,"Bro, stop making a new dumb idea, this thing's disgusting",en,2025-05-17T23:59:20Z,2025-05-17 19:59:20,0,0
R7xl9QjtNDc,Bet | Official Trailer | Netflix,UCWOA1ZGywLbqmigxE4Qlvuw,Netflix,2025-04-21T15:00:02Z,1046082,11124,6698,UgwqOBa4_t-RShVvnWl4AaABAg,NA,@budjank238,UCsLjQSj0GZnK21oV08vgaXg,?,ja,2025-05-17T23:13:07Z,2025-05-17 19:13:07,0,0
R7xl9QjtNDc,Bet | Official Trailer | Netflix,UCWOA1ZGywLbqmigxE4Qlvuw,Netflix,2025-04-21T15:00:02Z,1046082,11124,6698,UgzVIl91f7SPSXNMH4R4AaABAg,NA,@Biyhoolxx6987,UCB5wqzDiTpFHYaA-gFajzQA,Idc It's good,NA,2025-05-17T22:53:55Z,2025-05-17 18:53:55,0,0
R7xl9QjtNDc,Bet | Official Trailer | Netflix,UCWOA1ZGywLbqmigxE4Qlvuw,Netflix,2025-04-21T15:00:02Z,1046082,11124,6698,UgxRz6dPRVJSAECdYJ14AaABAg,NA,@zhouye7647,UC3qAFH8SbHFcsWCURNJJVog,"Better than I thought, it pretty much has nothing to do with manga but used the setting. But by it self its pretty good, refreshing to say the least.",en,2025-05-17T21:19:48Z,2025-05-17 17:19:48,2,0
R7xl9QjtNDc,Bet | Official Trailer | Netflix,UCWOA1ZGywLbqmigxE4Qlvuw,Netflix,2025-04-21T15:00:02Z,1046082,11124,6698,UgzYIo99mN2O6UlYyTB4AaABAg,NA,@Hamilcar85,UCUofgBpw9S9Si7zt2gskpFA,Another black wash  piece of shit made by netflix.,en,2025-05-17T20:42:28Z,2025-05-17 16:42:28,3,1
R7xl9QjtNDc,Bet | Official Trailer | Netflix,UCWOA1ZGywLbqmigxE4Qlvuw,Netflix,2025-04-21T15:00:02Z,1046082,11124,6698,UgwWFYLmKCGU8WSDpwt4AaABAg,NA,@poltergeistx,UCuqQfBXizSvWpiWyf0zQjag,Thanks! I hate it! ✨✨,NA,2025-05-17T20:35:09Z,2025-05-17 16:35:09,2,0
R7xl9QjtNDc,Bet | Official Trailer | Netflix,UCWOA1ZGywLbqmigxE4Qlvuw,Netflix,2025-04-21T15:00:02Z,1046082,11124,6698,UgxJp22xyuUk_81GRbp4AaABAg,NA,@diveytaluja59,UCuefvs_kGxrg9jpQ_KfqL0A,"As a fan of kakeguri watching this show feels so suffocating, like a gamble with THE MIDARI is dancing wtf , midari is known for her dangerous gambles , it's a dance 😂😂😂 I'm pretty sure it was a money laundering project",en,2025-05-17T18:56:17Z,2025-05-17 14:56:17,1,0
R7xl9QjtNDc,Bet | Official Trailer | Netflix,UCWOA1ZGywLbqmigxE4Qlvuw,Netflix,2025-04-21T15:00:02Z,1046082,11124,6698,UgxZSZQKqHee_51QxI94AaABAg,NA,@nameisbad,UCdUVK6CZn_IyM9pIIjsUdZA,"Based on? it's a carbon copy but with race swaps and shit...    
   
This isn't it netflix, I want diversity, but not at the cost of shitting on other peoples works. Or worse... stealing their ideas.",en,2025-05-17T18:55:37Z,2025-05-17 14:55:37,0,0
R7xl9QjtNDc,Bet | Official Trailer | Netflix,UCWOA1ZGywLbqmigxE4Qlvuw,Netflix,2025-04-21T15:00:02Z,1046082,11124,6698,UgzY6ZVyrP94IXjVVm94AaABAg,NA,@gioaja12,UCHJfrmjUxPAG5cK01A1_W9A,Ahhh US logic,NA,2025-05-17T18:46:00Z,2025-05-17 14:46:00,0,0
R7xl9QjtNDc,Bet | Official Trailer | Netflix,UCWOA1ZGywLbqmigxE4Qlvuw,Netflix,2025-04-21T15:00:02Z,1046082,11124,6698,Ugyc0WmB_29K2R0IC2F4AaABAg,NA,@theeangelmann,UCS_r8n-JnmkXDPPEmz9H2cA,as someone who has never watched the manga i love this show and think its highly entertaining. Im guessing Netflix audience for this is other people who've never watched the manga before. Theyre just capitalizing off the trending gambling wave.,en,2025-05-17T18:22:01Z,2025-05-17 14:22:01,46,1
R7xl9QjtNDc,Bet | Official Trailer | Netflix,UCWOA1ZGywLbqmigxE4Qlvuw,Netflix,2025-04-21T15:00:02Z,1046082,11124,6698,UgwxAf6YpciBg9r89zJ4AaABAg,NA,@donttron,UCYZICMdi_8X3YdlhK3D_XLg,like shit,ny,2025-05-17T17:53:51Z,2025-05-17 13:53:51,1,0
R7xl9QjtNDc,Bet | Official Trailer | Netflix,UCWOA1ZGywLbqmigxE4Qlvuw,Netflix,2025-04-21T15:00:02Z,1046082,11124,6698,UgzPJGe5Y-DNIoD746p4AaABAg,NA,@howdoyouwhisk,UCGi3MeRDmJWYfLn5IwpYHqQ,have we not done this enough times already,en,2025-05-17T17:04:47Z,2025-05-17 13:04:47,1,0
R7xl9QjtNDc,Bet | Official Trailer | Netflix,UCWOA1ZGywLbqmigxE4Qlvuw,Netflix,2025-04-21T15:00:02Z,1046082,11124,6698,Ugx5tFGOi9wBnnqKb9d4AaABAg,NA,@robinronin,UCH1_1YGaa4Q-vclBh-aXKyQ,"Just started watching (I ADORE the anime). I expected it to be cringe and over the top, and it is. Anime behavior does NOT translate well to live action (idk how they pulled it off with One Piece but they did). However, I think I’m happy that they didn’t make this super washed out and understated. I can tell it’s going to be completely different, which is fine, because if I wanted to watch the anime again I would just... watch the anime again. I’m gonna embrace the cringe while I WAIT FOR SEASON 3 OF THE ANIME. ANNOUNCE IT PLEASE. THANK YOU. 💀",en,2025-05-17T17:01:00Z,2025-05-17 13:01:00,0,0
R7xl9QjtNDc,Bet | Official Trailer | Netflix,UCWOA1ZGywLbqmigxE4Qlvuw,Netflix,2025-04-21T15:00:02Z,1046082,11124,6698,Ugxk3RjKfpWC28xY03h4AaABAg,NA,@jarednevin9885,UC5g_TLrKH_Y4hOjYmsU_TGA,"yumeko was a good cast, the rest was them just like .... that one horse drawing meme",en,2025-05-17T16:29:06Z,2025-05-17 12:29:06,4,0
R7xl9QjtNDc,Bet | Official Trailer | Netflix,UCWOA1ZGywLbqmigxE4Qlvuw,Netflix,2025-04-21T15:00:02Z,1046082,11124,6698,UgzKq0JeMLoJaexB84h4AaABAg,NA,@AiBernadas,UCukN3RGznRDypyFZjc5Z7UA,"Just finished watching the Netflix series. For someone who is not aware that this is an adaptation of manga. With no expectations, this was actually good.",en,2025-05-17T15:59:15Z,2025-05-17 11:59:15,1,0
R7xl9QjtNDc,Bet | Official Trailer | Netflix,UCWOA1ZGywLbqmigxE4Qlvuw,Netflix,2025-04-21T15:00:02Z,1046082,11124,6698,UgxSwsd6309Qkp_ArPx4AaABAg,NA,@nobody_photographer,UCzIkA7o7ElWPuaNuHy-yeag,worst live action adaptation of any manga I've ever seen,NA,2025-05-17T15:35:29Z,2025-05-17 11:35:29,1,0
R7xl9QjtNDc,Bet | Official Trailer | Netflix,UCWOA1ZGywLbqmigxE4Qlvuw,Netflix,2025-04-21T15:00:02Z,1046082,11124,6698,Ugxgf6eusrjTop9-Tah4AaABAg,NA,@theresnothinelseinmyheqdth8143,UCigcBwgIUy4Yrd2ZU5RKT4A,"we already have a live action and it ATE im telling you, but this? This ate SHIT",en,2025-05-17T14:58:53Z,2025-05-17 10:58:53,2,0
R7xl9QjtNDc,Bet | Official Trailer | Netflix,UCWOA1ZGywLbqmigxE4Qlvuw,Netflix,2025-04-21T15:00:02Z,1046082,11124,6698,UgzVBU8S_TE110RFWlZ4AaABAg,NA,@jardopoint,UCgalssmuQLE47v3BLzl15bw,WTH ....!!! netflix ruined it again...,NA,2025-05-17T14:31:07Z,2025-05-17 10:31:07,1,0
R7xl9QjtNDc,Bet | Official Trailer | Netflix,UCWOA1ZGywLbqmigxE4Qlvuw,Netflix,2025-04-21T15:00:02Z,1046082,11124,6698,UgzU1_9CzpOqfulGOr54AaABAg,NA,@l.b.861,UCoIJdQ3_2YSnf0iQqHpYb0Q,"I can't tell you how many times i had to skip just to see the actor playing Yumeko ... cause she was the only one carrying the series, imo... And the stylist, and the decor and the music..edit dept..etc
But honestly the story had no impact like the manga... 🤷🏻‍♀️
I appreciate the work put in... But it does feel lacking.
When you play an existing character, it should at least be 60-70% similar looks, and the core aspects of their personality and motivation should be respected 🤷🏻‍♀️",en,2025-05-17T14:01:34Z,2025-05-17 10:01:34,1,0
R7xl9QjtNDc,Bet | Official Trailer | Netflix,UCWOA1ZGywLbqmigxE4Qlvuw,Netflix,2025-04-21T15:00:02Z,1046082,11124,6698,UgywyWnfIYqCOWqCyWl4AaABAg,NA,@TianChezzy,UCCh1MqI7oH23gPoVMq4r-6Q,"Please Netflix saya sangat suka film yang diadaptasi dari manga yang berjudul kakegurui
Sebelum nya memang ada film kakegurui yang di rilis 2019.
Tetapi ini lah film yang sangat bagus menurut saya ""bet"" 2025 saya harap season ke 2 semoga ada 
Pemeran yumeko saya sangat sukaaaa, cara dia pembawaan karakter dan gila nya itu dapat ....",ms,2025-05-17T13:46:06Z,2025-05-17 09:46:06,0,0
R7xl9QjtNDc,Bet | Official Trailer | Netflix,UCWOA1ZGywLbqmigxE4Qlvuw,Netflix,2025-04-21T15:00:02Z,1046082,11124,6698,UgzPX5Vtx33JhI9Ened4AaABAg,NA,@Impedance_Z,UCYPuNLNbCRc6VuPd82PXJug,"Inspired from Kakegurui, nobody watches Kakegurui but it trends on Netflix India what a shame.",NA,2025-05-17T13:32:16Z,2025-05-17 09:32:16,1,0
R7xl9QjtNDc,Bet | Official Trailer | Netflix,UCWOA1ZGywLbqmigxE4Qlvuw,Netflix,2025-04-21T15:00:02Z,1046082,11124,6698,UgzlVCQ7nGoD8E4falV4AaABAg,NA,@Fab-gm8yz,UCN5f91CU67zprYj3bIhapSw,"saw the first episode a live action that makes you want to vomit, it seems like a Disney movie actors that have nothing to do with the anime for me this is 1/10 horrible horrible horrible live action.",en,2025-05-17T13:24:18Z,2025-05-17 09:24:18,1,0
R7xl9QjtNDc,Bet | Official Trailer | Netflix,UCWOA1ZGywLbqmigxE4Qlvuw,Netflix,2025-04-21T15:00:02Z,1046082,11124,6698,UgwbkeiY3jpq-vG0F7V4AaABAg,NA,@jupiterolowan1941,UCGRsxGtnVyYwIdsRfNz8JWg,"From a non bias standpoint .. i watched it . 

For those who know the mangga is understandable that they would dislike it and its fine .. 

But for me who doesnt and i just finish watching it actually the story is pretty great and amazing ... 
I will recommend this ... 

And Im hoping for a season 2",en,2025-05-17T13:08:31Z,2025-05-17 09:08:31,5,0
R7xl9QjtNDc,Bet | Official Trailer | Netflix,UCWOA1ZGywLbqmigxE4Qlvuw,Netflix,2025-04-21T15:00:02Z,1046082,11124,6698,UgwSYKVYXxH94cI7iBB4AaABAg,NA,@Khushisingh5323,UCDgU0WnPUjsc92S438TOQYA,"seriously!!! its nothing but a loads of shit compiled together, they just disbalanced the entire autheticity of entire narrative, characters and storyline.",en,2025-05-17T12:35:20Z,2025-05-17 08:35:20,1,0
R7xl9QjtNDc,Bet | Official Trailer | Netflix,UCWOA1ZGywLbqmigxE4Qlvuw,Netflix,2025-04-21T15:00:02Z,1046082,11124,6698,UgwFWCGOlgHmaPWx_N14AaABAg,NA,@egi_arlisandy,UCDtERpz2kRgXUOFFyVoqBZQ,"This is not Kakkegurui, This is LGBT gurui😂. Dislike guys",NA,2025-05-17T11:18:44Z,2025-05-17 07:18:44,2,0
R7xl9QjtNDc,Bet | Official Trailer | Netflix,UCWOA1ZGywLbqmigxE4Qlvuw,Netflix,2025-04-21T15:00:02Z,1046082,11124,6698,UgzwQg2dvNbbqjeoloZ4AaABAg,NA,@yudaprasetya3609,UCqtP23s83roHjns1muxsYtA,WOKEgurui,xh,2025-05-17T09:19:38Z,2025-05-17 05:19:38,2,0
R7xl9QjtNDc,Bet | Official Trailer | Netflix,UCWOA1ZGywLbqmigxE4Qlvuw,Netflix,2025-04-21T15:00:02Z,1046082,11124,6698,UgwZO7J6eKfXDraDm-R4AaABAg,NA,@skylargreenlee01,UCgH0iMMsE_FTuAK3tylKP9A,"Bet (2025) 
Director: Simon Barry 
Filming Dates: May 21, 2024 - July 30, 2024 
Release Date: May 15, 2025 
MPAA Rating: R [Restricted] 
Runtime: 5 hr 44 min (344 min) 
Studio: Universal Pictures (Universal)",en,2025-05-17T09:00:49Z,2025-05-17 05:00:49,0,0
R7xl9QjtNDc,Bet | Official Trailer | Netflix,UCWOA1ZGywLbqmigxE4Qlvuw,Netflix,2025-04-21T15:00:02Z,1046082,11124,6698,UgysvzKBXBZyKv2D4a54AaABAg,NA,@Ace-SaForEver,UC7R-EU6v7G6bt04ySV5TEYA,Where season of Kakegurui,mi,2025-05-17T08:42:29Z,2025-05-17 04:42:29,0,0
R7xl9QjtNDc,Bet | Official Trailer | Netflix,UCWOA1ZGywLbqmigxE4Qlvuw,Netflix,2025-04-21T15:00:02Z,1046082,11124,6698,Ugym5t03CwxPCt6vznx4AaABAg,NA,@mamatkhairi2116,UC2PFTFs1AUfY-I9ydi_W6ow,Bet bed,en,2025-05-17T08:21:12Z,2025-05-17 04:21:12,0,0
R7xl9QjtNDc,Bet | Official Trailer | Netflix,UCWOA1ZGywLbqmigxE4Qlvuw,Netflix,2025-04-21T15:00:02Z,1046082,11124,6698,UgwQwdfMd-lUZTlucAZ4AaABAg,NA,@sssss5598,UCS2ImObrSkDX1vCr8CSh4LA,I dont like it because theres no beauty privilege..,en,2025-05-17T08:08:09Z,2025-05-17 04:08:09,0,0
R7xl9QjtNDc,Bet | Official Trailer | Netflix,UCWOA1ZGywLbqmigxE4Qlvuw,Netflix,2025-04-21T15:00:02Z,1046082,11124,6698,UgwuufBkoUxWnMuLvVl4AaABAg,NA,@UpinIpin-f4f,UCu_T4cRYPOj5qYs2WpcnuCw,"Dislike, this is stupid",et,2025-05-17T07:36:05Z,2025-05-17 03:36:05,1,0
R7xl9QjtNDc,Bet | Official Trailer | Netflix,UCWOA1ZGywLbqmigxE4Qlvuw,Netflix,2025-04-21T15:00:02Z,1046082,11124,6698,UgzT_hAy0P-c1B1fslp4AaABAg,NA,@LetItFly69,UCMeQrp912ZcX-eo2Xzgy9QA,The show was good. I liked it. They should def do a second and 3rd season.,en,2025-05-17T07:24:09Z,2025-05-17 03:24:09,0,0
R7xl9QjtNDc,Bet | Official Trailer | Netflix,UCWOA1ZGywLbqmigxE4Qlvuw,Netflix,2025-04-21T15:00:02Z,1046082,11124,6698,Ugy6pr15_tMT7YK_oTZ4AaABAg,NA,@KevinZavier-i2z,UCi30lM768AVoDoAi7BtqRtQ,woke of shit,NA,2025-05-17T07:00:35Z,2025-05-17 03:00:35,1,0
R7xl9QjtNDc,Bet | Official Trailer | Netflix,UCWOA1ZGywLbqmigxE4Qlvuw,Netflix,2025-04-21T15:00:02Z,1046082,11124,6698,UgzG7GCIZosOTT_80Zp4AaABAg,NA,@Zeee-g6r,UCw1xD3oVp11w9-zUJM7d6yw,Make it black and gay and u have it,en,2025-05-17T06:40:04Z,2025-05-17 02:40:04,2,0
R7xl9QjtNDc,Bet | Official Trailer | Netflix,UCWOA1ZGywLbqmigxE4Qlvuw,Netflix,2025-04-21T15:00:02Z,1046082,11124,6698,UgwKESwz0E3wF36JESV4AaABAg,NA,@kamonte5068,UCQpsohLXlgQQ2hvIG4LyPXg,Stuff like this is being made in 2025? Ain’t no way,en,2025-05-17T06:23:35Z,2025-05-17 02:23:35,0,0
R7xl9QjtNDc,Bet | Official Trailer | Netflix,UCWOA1ZGywLbqmigxE4Qlvuw,Netflix,2025-04-21T15:00:02Z,1046082,11124,6698,Ugw8sUZz8-mPQnrj7Ll4AaABAg,NA,@Shaskaxs,UCWz38G_dF0FDq265CdPYRew,"Another failed filmed. After disney ruined snow white , here is another one. Everybody will leaving bad rating",en,2025-05-17T04:39:06Z,2025-05-17 00:39:06,1,0
R7xl9QjtNDc,Bet | Official Trailer | Netflix,UCWOA1ZGywLbqmigxE4Qlvuw,Netflix,2025-04-21T15:00:02Z,1046082,11124,6698,UgyUZ93L4MHN7YWcB5N4AaABAg,NA,@viviankate7240,UCkWl9wkq5iddX6lxNrTrf0w,"I mean.. I still ask the same question when one piece come to live action in Netflix...Why?  Even that Lilo and Stitch live action movie... Why?  And this... Why?  That Lion King live action... Why?  Milking profits?  Whose the rando who ask for this?  No wonder people these days have trash taste.  The movie industry can't make anything original. Oh, and this Netflix series Bet which i watched. Their acting is cringe. Then again, i always find the Netflix series adaption cringe.. Same goes to Wednesday. The actors and actresses tries so hard to be edgy and cool. Then again, people will watch it because they have nothing else to watch.  Trash industry produce trash taste. That's just  my opinion.",en,2025-05-17T04:17:09Z,2025-05-17 00:17:09,0,0
R7xl9QjtNDc,Bet | Official Trailer | Netflix,UCWOA1ZGywLbqmigxE4Qlvuw,Netflix,2025-04-21T15:00:02Z,1046082,11124,6698,UgyvJwBaoDtu96i8VPJ4AaABAg,NA,@JuluisDoctor,UC1RRNJs9vdrVT42IK6P0zew,"At the end of the day, I think it’s important for all of us to approach adaptations with a bit more understanding and openness. Whether we’re talking about Kakegurui or any other series that gets a new life through an adaptation, we should recognize the immense amount of work, creativity, and passion that goes into making something new. It’s easy to fall into the trap of wanting an adaptation to be exactly like the original, but that's not always the point. Creators take risks, innovate, and offer their own perspective on a familiar story, and that takes courage. It’s not about erasing the original—it’s about building upon it in ways that add something fresh and interesting to the conversation.

To everyone who feels disappointed or upset by changes in adaptations: I get it. When we love something deeply, we can be protective of it. But it’s also crucial to remember that adaptation doesn’t mean replacement. The original work still exists, and no adaptation can ever take that away. The creative teams behind these projects often bring new energy, new interpretations, and even a different cultural lens to the table, and that can give us something to think about, even if it’s not the exact vision we had in mind.

Rather than rushing to dismiss an adaptation as “bad” or “lazy,” let’s remember that there’s an incredible amount of effort and time involved in creating these projects. It's easy to judge based on trailers, surface-level changes, or differences in casting, but these elements don’t define the entire work. The story itself, the emotions conveyed, and the performances delivered are what truly matter. If we approach these adaptations with an open mind, we give ourselves the chance to experience a new layer of what we already love, and maybe even discover something new we wouldn’t have noticed in the original.

I encourage all of us to engage in discussions that are constructive and respectful, rather than purely critical. We can express our opinions, but let’s do so with consideration for the hard work and intentions behind the adaptation. Criticism doesn’t have to be harsh—it can be a chance for all of us to share what we love, what we think could be better, and to open up a dialogue that celebrates both the original and the new creation. Everyone’s voice is important, but so is the ability to engage thoughtfully without tearing something down simply because it’s different.

In the end, it’s not about agreeing on everything or liking every change made, but about fostering a space where we can appreciate creativity in all its forms. Let’s respect the work that’s been done, allow space for new interpretations, and remember that adaptations exist to breathe new life into stories, not to replace what came before. If we can all agree on that, we’ll have a fan community that’s more inclusive, supportive, and open to creative growth. After all, we all share the same love for the original work, and that's something that can unite us all.",en,2025-05-17T04:06:32Z,2025-05-17 00:06:32,0,0
R7xl9QjtNDc,Bet | Official Trailer | Netflix,UCWOA1ZGywLbqmigxE4Qlvuw,Netflix,2025-04-21T15:00:02Z,1046082,11124,6698,Ugzuo95TFlq6OZElqWB4AaABAg,NA,@JuluisDoctor,UC1RRNJs9vdrVT42IK6P0zew,"Ultimately, I want to encourage everyone to think more thoughtfully and engage in a more respectful way within our fan communities. Whether it’s an adaptation of Kakegurui or any other beloved series, it's important that we recognize the immense effort that goes into creating something new and innovative. We may feel protective of the original works we love, and that’s totally valid, but it’s also crucial to appreciate the creative interpretation that comes with adaptations.

Rather than dismissing an adaptation because it’s different or doesn’t match our personal expectations, let’s try to embrace the fact that these new versions offer fresh perspectives while still respecting the original. Just because it’s not a mirror image of the source material doesn’t mean it’s a failure or lacking in effort. We need to remember that adaptations are a way to breathe new life into something, not erase its essence.

I understand that it’s easy to criticize, especially when we feel strongly about the original, but we should all aim for constructive analysis over pure negativity. Instead of shutting down these creative efforts with hurtful comments, let’s engage in discussions that help us understand and appreciate the hard work behind the scenes. This doesn’t mean we have to love every change, but it does mean we should try to respect the artistic vision that went into making the adaptation.

By shifting our focus from criticism to appreciation and thoughtful feedback, we can create a fan environment that’s more inclusive and supportive of both the creators and the fans. Everyone can enjoy adaptations in their own way, and we can still respect and celebrate the foundation that the original work laid down",en,2025-05-17T04:03:34Z,2025-05-17 00:03:34,1,0
R7xl9QjtNDc,Bet | Official Trailer | Netflix,UCWOA1ZGywLbqmigxE4Qlvuw,Netflix,2025-04-21T15:00:02Z,1046082,11124,6698,Ugx5nGxHefY8WklxTg14AaABAg,NA,@pipatsrimongkon,UCC7bZ4YzIcSZPXY8EVnnGyQ,"The main character is a slave, but Netflix do him is black.",en,2025-05-17T03:56:46Z,2025-05-16 23:56:46,0,0
