video_id,video_title,channel_id,channel_title,video_published_at,view_count,video_like_count,video_comment_count,comment_id,comment_parent_id,comment_author_display,comment_author_channel_id,comment_text,comment_lang,comment_published_utc,comment_published_local,comment_like_count,comment_reply_count
R7xl9QjtNDc,Bet | Official Trailer | Netflix,UCWOA1ZGywLbqmigxE4Qlvuw,Netflix,2025-04-21T15:00:02Z,1046082,11124,6698,UgyZOWn7qmKpmpV-CC94AaABAg,NA,@AITUTORIALS-p6y,UCW01ieWO5Ox3uCrc1B3vi0A,i didnt like this anime but series good,NA,2025-12-12T16:55:20Z,2025-12-12 11:55:20,0,0
R7xl9QjtNDc,Bet | Official Trailer | Netflix,UCWOA1ZGywLbqmigxE4Qlvuw,Netflix,2025-04-21T15:00:02Z,1046082,11124,6698,UgwGKn6WVOf6e3lKn7x4AaABAg,NA,@muhamadfahriilham8291,UCK8O7DcH69lp-Rl-8pHw1ig,Netflix always messing,NA,2025-12-10T06:21:45Z,2025-12-10 01:21:45,0,0
R7xl9QjtNDc,Bet | Official Trailer | Netflix,UCWOA1ZGywLbqmigxE4Qlvuw,Netflix,2025-04-21T15:00:02Z,1046082,11124,6698,UgzFVGjdRuksKlwne9p4AaABAg,NA,@BinayRai-t2u,UCuGw3kyIRi96bYKTdE7a0dA,Why why,en,2025-11-28T10:18:57Z,2025-11-28 05:18:57,0,0
R7xl9QjtNDc,Bet | Official Trailer | Netflix,UCWOA1ZGywLbqmigxE4Qlvuw,Netflix,2025-04-21T15:00:02Z,1046082,11124,6698,Ugy1_6mRG0aKSpgelLB4AaABAg,NA,@idamaya3398,UCuDnGRyhavRfOFF0w7Sz_nQ,This show actually really good. Other than two cringy character. It's all actually pretty good,en,2025-11-17T22:32:10Z,2025-11-17 17:32:10,0,0
R7xl9QjtNDc,Bet | Official Trailer | Netflix,UCWOA1ZGywLbqmigxE4Qlvuw,Netflix,2025-04-21T15:00:02Z,1046082,11124,6698,UgzBAE_-psIwkXMNN3R4AaABAg,NA,@alicele728,UCdY-2SyMzEkKGEupPwCWZdA,All of these people insulted the show before they even watch it. Pure bs. I've watched the shows twice for Yumeko.,en,2025-11-11T15:30:29Z,2025-11-11 10:30:29,1,1
R7xl9QjtNDc,Bet | Official Trailer | Netflix,UCWOA1ZGywLbqmigxE4Qlvuw,Netflix,2025-04-21T15:00:02Z,1046082,11124,6698,Ugy_D9mx5wU3DSKqcYJ4AaABAg,NA,@RileyH-z2d,UC_jrvYyghQ3eKL9n0KyN-bA,"I've seen the anime and I'm a huge fan of the live action, and I thoroughly enjoyed this show. It's **loosely based** on Kakegurui - it's not meant to be an adaptation, and I'm honestly kind of concerned at the amount of people who don't seem to realize that. I definitely had my issues with it and I'm not a huge fan of Bet Yumeko - I could go on an entire rant about her - but I'm definitely watching Season 2.

Edit: experimenting with asterisks 😂 I didn't realize they could bold text now",en,2025-11-05T11:49:56Z,2025-11-05 06:49:56,0,0
R7xl9QjtNDc,Bet | Official Trailer | Netflix,UCWOA1ZGywLbqmigxE4Qlvuw,Netflix,2025-04-21T15:00:02Z,1046082,11124,6698,UgyR-YofNZHyRVFEv454AaABAg,NA,@kapeusw,UCxAAPT6G116cz_Y9n2tqXCA,"I don't get the hate. The show is loosely based on the manga, but whatever...to me it was highly entertaining.",en,2025-11-02T08:27:17Z,2025-11-02 03:27:17,2,1
R7xl9QjtNDc,Bet | Official Trailer | Netflix,UCWOA1ZGywLbqmigxE4Qlvuw,Netflix,2025-04-21T15:00:02Z,1046082,11124,6698,Ugz44KReiDxdY4az1Rt4AaABAg,NA,@YouMeWallakpu,UCPRlQvYzy5BcSQSqZA5-nRQ,except for yumeko all the castin seems so weird. not just castin thier outfits. japanese live action was so good and so similar but this was totally diff,en,2025-11-01T12:55:38Z,2025-11-01 08:55:38,0,0
R7xl9QjtNDc,Bet | Official Trailer | Netflix,UCWOA1ZGywLbqmigxE4Qlvuw,Netflix,2025-04-21T15:00:02Z,1046082,11124,6698,UgymIEkdOgZtQ9GAo214AaABAg,NA,@janetfernandez42,UCGeFRosyyeQEiHIenk_0ZqQ,"Wow, LUV ITTTTTT and luv the songs 🎵 ❤️ Take my breath away in Japanese.  Is beautiful!",NA,2025-11-01T01:20:21Z,2025-10-31 21:20:21,0,0
R7xl9QjtNDc,Bet | Official Trailer | Netflix,UCWOA1ZGywLbqmigxE4Qlvuw,Netflix,2025-04-21T15:00:02Z,1046082,11124,6698,UgzrnLOPwBXxxs2Gf4N4AaABAg,NA,@Ahadkabir-zn2ws,UCnc6186V_TWw8SeW7nMqUUA,Ryan the prucum,NA,2025-10-23T15:56:27Z,2025-10-23 11:56:27,0,0
R7xl9QjtNDc,Bet | Official Trailer | Netflix,UCWOA1ZGywLbqmigxE4Qlvuw,Netflix,2025-04-21T15:00:02Z,1046082,11124,6698,Ugyin7HbipR-pit6vmx4AaABAg,NA,@J-Rodolf,UCJB7E_EP4MpU-16g7X6bfFg,"I enjoy the show. The casting, except the protagonist, are non-ASIANS. They're vgly BLACK & WHITE with cringey Japanese names. Disgusting! 🤢🤢🤢🤢",en,2025-10-23T06:06:24Z,2025-10-23 02:06:24,1,0
R7xl9QjtNDc,Bet | Official Trailer | Netflix,UCWOA1ZGywLbqmigxE4Qlvuw,Netflix,2025-04-21T15:00:02Z,1046082,11124,6698,Ugz-FlkKpQG7-8s__M94AaABAg,NA,@SiennaWebster-w9g,UC6nfXLiexjqkFYDXvYCmwfg,I hear advanced German kid is in this,en,2025-10-15T21:27:25Z,2025-10-15 17:27:25,0,0
R7xl9QjtNDc,Bet | Official Trailer | Netflix,UCWOA1ZGywLbqmigxE4Qlvuw,Netflix,2025-04-21T15:00:02Z,1046082,11124,6698,UgyP4DejTEz7d8AuqxF4AaABAg,NA,@elisonle1198,UCrTf2zihYVLQiH6hcfPqRKA,Woke af,da,2025-10-10T11:02:18Z,2025-10-10 07:02:18,0,0
R7xl9QjtNDc,Bet | Official Trailer | Netflix,UCWOA1ZGywLbqmigxE4Qlvuw,Netflix,2025-04-21T15:00:02Z,1046082,11124,6698,UgxPNMDnTie0sKnE8Ph4AaABAg,NA,@ErikaMayBatiao-h5h,UCS_Jace8lNhqg2I4RndW6jA,Tittle please so I can watch full movie,en,2025-10-09T03:53:41Z,2025-10-08 23:53:41,0,0
R7xl9QjtNDc,Bet | Official Trailer | Netflix,UCWOA1ZGywLbqmigxE4Qlvuw,Netflix,2025-04-21T15:00:02Z,1046082,11124,6698,Ugx844Qs4mab5IsgY0R4AaABAg,NA,@Grunzer212,UCBO9431kTDGh0jdIEqOaHaw,"Wenn man Bet nicht mit dem Anime vergleicht ist die Serie gut, nicht außerordentlich gut aber gut. 

Jedoch, wenn man den Anmie als Vorbild und Leitfaden nimmt, sollte man die Charakter auch dementsprechend anpassen, jedoch merkt man, das diese Verfilmung dem heutigen Zeitgeist entspricht! übertriebene Woknes wo das Auge hinreicht.. es ist zum kotzen.... 
Die Serie würde von mir 3 Sterne von 5 erhalten, da sie ohne den Anime als Vorlage recht gut ist.",de,2025-10-08T08:56:23Z,2025-10-08 04:56:23,0,0
R7xl9QjtNDc,Bet | Official Trailer | Netflix,UCWOA1ZGywLbqmigxE4Qlvuw,Netflix,2025-04-21T15:00:02Z,1046082,11124,6698,UgySu0VLe4n7wiN0IA94AaABAg,NA,@sweety-fe9kl,UCMPvWXumqpJwyuJNZugvH8g,"The thing its fine however it's not fully based on anime but it's fine to watch and also the difference is that is Kira is not as powerful as she was in anime and ofcourse yumeko only wants to gamble , so yeah that was missing otherwise that was not that bad series....if U will not completely compare with the anime it will be good to watch I liked it✨",en,2025-10-02T20:01:33Z,2025-10-02 16:01:33,1,0
R7xl9QjtNDc,Bet | Official Trailer | Netflix,UCWOA1ZGywLbqmigxE4Qlvuw,Netflix,2025-04-21T15:00:02Z,1046082,11124,6698,UgxL-4oQcbMCHGYP6ed4AaABAg,NA,@Waleed_brd,UC4SvlyG0oWbSKToCrq2AqQw,"You know creating a bitof depth in a story i can live with, but changing Characters and their whole persona ,i hate that",en,2025-09-29T17:23:19Z,2025-09-29 13:23:19,0,0
R7xl9QjtNDc,Bet | Official Trailer | Netflix,UCWOA1ZGywLbqmigxE4Qlvuw,Netflix,2025-04-21T15:00:02Z,1046082,11124,6698,UgyxuRN5PQyuDokAsaB4AaABAg,NA,@Buraddosutā,UCLJLN0_pVti1cfozDDyjVaw,what is this,en,2025-09-28T01:48:45Z,2025-09-27 21:48:45,1,0
R7xl9QjtNDc,Bet | Official Trailer | Netflix,UCWOA1ZGywLbqmigxE4Qlvuw,Netflix,2025-04-21T15:00:02Z,1046082,11124,6698,UgyL73yYo_kdD23tCGh4AaABAg,NA,@יונהנמירוב,UC2MMzIt_nFBvAwoW4RCGomA,Wow what a good series I really enjoyed when season 2 came out I'm really waiting for her❓️❣️🏆🔥👍,en,2025-09-20T18:46:46Z,2025-09-20 14:46:46,4,1
R7xl9QjtNDc,Bet | Official Trailer | Netflix,UCWOA1ZGywLbqmigxE4Qlvuw,Netflix,2025-04-21T15:00:02Z,1046082,11124,6698,UgwZ_vG_HxvxieQI_yd4AaABAg,NA,@gujjarsaheb,UCS1EHlbekdlRIl5FqSl137g,"The movie is very well made and I liked it a lot, but there is only a slight issue with the death scene. The rest of the movie, which is based on morality, is of a very high quality.🎉❤",en,2025-09-16T11:48:00Z,2025-09-16 07:48:00,0,0
R7xl9QjtNDc,Bet | Official Trailer | Netflix,UCWOA1ZGywLbqmigxE4Qlvuw,Netflix,2025-04-21T15:00:02Z,1046082,11124,6698,Ugy3AY2flyAS9ACJmNt4AaABAg,NA,@ゆきむら-x4l,UCR3PgCl2fUCnUjCXwaoQImQ,"I've watched the Kakegurui anime and the Japanese live-action show. Out of all of them, the Yumeko in the Netflix series is the most wonderful and amazing. I'd love to see a Season 2.❤🎉",en,2025-09-15T13:47:13Z,2025-09-15 09:47:13,0,0
R7xl9QjtNDc,Bet | Official Trailer | Netflix,UCWOA1ZGywLbqmigxE4Qlvuw,Netflix,2025-04-21T15:00:02Z,1046082,11124,6698,UgxIJkSWQHtJ8ozhdEB4AaABAg,NA,@Introtab-z9d,UC0bBSYe4Oq9myh6WBb4wjvQ,We want session 2....!!!🤍🤍🤍,en,2025-09-08T07:14:21Z,2025-09-08 03:14:21,0,0
R7xl9QjtNDc,Bet | Official Trailer | Netflix,UCWOA1ZGywLbqmigxE4Qlvuw,Netflix,2025-04-21T15:00:02Z,1046082,11124,6698,UgyymGSQX3GjMiKfd714AaABAg,NA,@MelanySalazar-u5o,UCFq0XeKmyShD_fGO5mNn5kg,Muy buena película,es,2025-09-07T20:33:49Z,2025-09-07 16:33:49,0,0
R7xl9QjtNDc,Bet | Official Trailer | Netflix,UCWOA1ZGywLbqmigxE4Qlvuw,Netflix,2025-04-21T15:00:02Z,1046082,11124,6698,UgzsKnIkp2nkzIy86514AaABAg,NA,@inferno_storm5056,UCd2ko3YjbWwS429gtdr_x5Q,The black guy ryan is actually original charcter but he based is actually ryota,en,2025-09-06T21:45:51Z,2025-09-06 17:45:51,0,0
R7xl9QjtNDc,Bet | Official Trailer | Netflix,UCWOA1ZGywLbqmigxE4Qlvuw,Netflix,2025-04-21T15:00:02Z,1046082,11124,6698,Ugy48OSLm2dL4E7Wfpd4AaABAg,NA,@MyIDSomebodyStole,UC6G_pydt__QcN_c2hOvUW6g,I love the original story more. In the original version kira was more twisted she looked like she had fun watching over yumeko.  why there are no dealer and where are the others student conceal . In the end it's can't beat the original story but it's better than nothing,en,2025-09-02T17:12:28Z,2025-09-02 13:12:28,0,0
R7xl9QjtNDc,Bet | Official Trailer | Netflix,UCWOA1ZGywLbqmigxE4Qlvuw,Netflix,2025-04-21T15:00:02Z,1046082,11124,6698,Ugw5QM0rYKilLIRuH4F4AaABAg,NA,@AlbertoQuijije-e5o,UCeiWxb9OEvI0R5TwryvWCfQ,15,ja,2025-08-31T22:30:19Z,2025-08-31 18:30:19,0,0
R7xl9QjtNDc,Bet | Official Trailer | Netflix,UCWOA1ZGywLbqmigxE4Qlvuw,Netflix,2025-04-21T15:00:02Z,1046082,11124,6698,UgzCYCK5h1KlIu-pXZN4AaABAg,NA,@owenpkpk,UC5UQWFOylDBiVrQIWQqjDCQ,culture appropriation,en,2025-08-29T00:15:24Z,2025-08-28 20:15:24,2,0
R7xl9QjtNDc,Bet | Official Trailer | Netflix,UCWOA1ZGywLbqmigxE4Qlvuw,Netflix,2025-04-21T15:00:02Z,1046082,11124,6698,UgwHmpM5Dx_qeEgof_V4AaABAg,NA,@yxxnxx,UCtl_5uGCl0u-r9v-VvKgRgQ,Just found out this exists. I'm not hoping it's as good as the manga but please be better than the japanese live action movies,en,2025-08-28T13:39:36Z,2025-08-28 09:39:36,0,0
R7xl9QjtNDc,Bet | Official Trailer | Netflix,UCWOA1ZGywLbqmigxE4Qlvuw,Netflix,2025-04-21T15:00:02Z,1046082,11124,6698,UgyxwlsQa5rU3pM1Nwl4AaABAg,NA,@armymessisfan,UCtp7nopGCZpHbt3tZ68P2Ig,Nhaa I stick with the Japenese live action is damn gold and actress is chefs kiss too.,en,2025-08-25T04:47:19Z,2025-08-25 00:47:19,0,0
R7xl9QjtNDc,Bet | Official Trailer | Netflix,UCWOA1ZGywLbqmigxE4Qlvuw,Netflix,2025-04-21T15:00:02Z,1046082,11124,6698,UgyHBd9jzLcr5cWe0mJ4AaABAg,NA,@zowsi,UCO_ayTz_uZGbsg1T5Udxxog,"do people not know what ""based from"" means 😭",en,2025-08-23T15:23:04Z,2025-08-23 11:23:04,1,0
R7xl9QjtNDc,Bet | Official Trailer | Netflix,UCWOA1ZGywLbqmigxE4Qlvuw,Netflix,2025-04-21T15:00:02Z,1046082,11124,6698,UgwHKdB0fOKZ7YPVsqp4AaABAg,NA,@Terraring,UCq0yLaDF2b2NPwvUdwJyJ3w,"Why there is greyskin character there, makes no sense and its disgusting",en,2025-08-23T06:23:16Z,2025-08-23 02:23:16,2,0
R7xl9QjtNDc,Bet | Official Trailer | Netflix,UCWOA1ZGywLbqmigxE4Qlvuw,Netflix,2025-04-21T15:00:02Z,1046082,11124,6698,UgxQT6zRiebvNcI314Z4AaABAg,NA,@john0doesnt,UCe_gguNQ2f7LXbawDX35U7w,"AHAHAHAHAHAH, get netflixed",NA,2025-08-22T19:50:45Z,2025-08-22 15:50:45,1,0
R7xl9QjtNDc,Bet | Official Trailer | Netflix,UCWOA1ZGywLbqmigxE4Qlvuw,Netflix,2025-04-21T15:00:02Z,1046082,11124,6698,UgwwgFL5_XVBewnJKo54AaABAg,NA,@HamdaIdriss-s5n,UCqBO0ECRU_qmClvJAnT8U5A,Season 2??,NA,2025-08-20T22:27:31Z,2025-08-20 18:27:31,0,0
R7xl9QjtNDc,Bet | Official Trailer | Netflix,UCWOA1ZGywLbqmigxE4Qlvuw,Netflix,2025-04-21T15:00:02Z,1046082,11124,6698,UgyMgItYDjkXy_1_l0x4AaABAg,NA,@dabelyuwww,UCoMBOs4naqD7dwLxrwQzyUg,layak di dislike,id,2025-08-15T13:24:32Z,2025-08-15 09:24:32,0,0
R7xl9QjtNDc,Bet | Official Trailer | Netflix,UCWOA1ZGywLbqmigxE4Qlvuw,Netflix,2025-04-21T15:00:02Z,1046082,11124,6698,Ugxvtqq_djlTugCRbHx4AaABAg,NA,@mattsmiff1753,UCrUpGrQdWJ1GcZ-18kErsBg,"Baby Proofed, non-offensive Modern Audience slop",en,2025-08-14T21:22:18Z,2025-08-14 17:22:18,3,0
R7xl9QjtNDc,Bet | Official Trailer | Netflix,UCWOA1ZGywLbqmigxE4Qlvuw,Netflix,2025-04-21T15:00:02Z,1046082,11124,6698,UgzlQpEV4OMDNSXE2B14AaABAg,NA,@d.cannuscio3151,UCuv-nDEuCU52RMzlrEvsxQQ,This looks very corny,sr,2025-08-14T20:31:45Z,2025-08-14 16:31:45,3,0
R7xl9QjtNDc,Bet | Official Trailer | Netflix,UCWOA1ZGywLbqmigxE4Qlvuw,Netflix,2025-04-21T15:00:02Z,1046082,11124,6698,UgznTIyiFPSlL4exjEx4AaABAg,NA,@Nights25ty,UCgkjGOv3yWAAW_9-d4lUqQw,Just hit money,NA,2025-08-13T06:32:23Z,2025-08-13 02:32:23,1,0
R7xl9QjtNDc,Bet | Official Trailer | Netflix,UCWOA1ZGywLbqmigxE4Qlvuw,Netflix,2025-04-21T15:00:02Z,1046082,11124,6698,UgzeYqV9mLmvObeTfql4AaABAg,NA,@Nights25ty,UCgkjGOv3yWAAW_9-d4lUqQw,Love Netflix buy kfc Netflix,NA,2025-08-13T06:31:58Z,2025-08-13 02:31:58,1,0
R7xl9QjtNDc,Bet | Official Trailer | Netflix,UCWOA1ZGywLbqmigxE4Qlvuw,Netflix,2025-04-21T15:00:02Z,1046082,11124,6698,UgwXsi_KUlN2w0dyFKp4AaABAg,NA,@DolphinSaviour,UCs3yiOIuItvw3Gyulw5Fo-g,"I loved this show -- I haven't read the manga so maybe that's a big part of it, but the show itself was amazing. I feel like many people were dissatisfied because it didn't correctly adapt the manga, but I didn't really care about the adaptation and just treated this show as any standalone show and I loved it.",en,2025-08-10T04:01:31Z,2025-08-10 00:01:31,2,1
R7xl9QjtNDc,Bet | Official Trailer | Netflix,UCWOA1ZGywLbqmigxE4Qlvuw,Netflix,2025-04-21T15:00:02Z,1046082,11124,6698,UgyAbL2nlEVPnGyoIcZ4AaABAg,NA,@Fatorangecar,UCBvLsWAlqtXb45vjE1XEw6g,We could’ve gotten a new season for both Kakegurui and its prequel. It’s been SIX YEARS since  season 2. But we got this instead… Netflix always ruins everything and Americanizes it.,en,2025-08-10T01:30:52Z,2025-08-09 21:30:52,0,0
R7xl9QjtNDc,Bet | Official Trailer | Netflix,UCWOA1ZGywLbqmigxE4Qlvuw,Netflix,2025-04-21T15:00:02Z,1046082,11124,6698,Ugw6RGhpBElGzE1xf_R4AaABAg,NA,@eltonhickey,UCYLRDuLOTWTZavUJuC4EpYA,Haan bhai doosre platforms pe toh verification process itna slow hota hai lekin 4RABeT pe ekdum smooth aur quick hai,NA,2025-08-09T02:41:39Z,2025-08-08 22:41:39,0,0
R7xl9QjtNDc,Bet | Official Trailer | Netflix,UCWOA1ZGywLbqmigxE4Qlvuw,Netflix,2025-04-21T15:00:02Z,1046082,11124,6698,Ugw1uV_lJfS91oxdLsF4AaABAg,NA,@richhay-m2k,UC5n5nGfkHYJc6-71wbhf0ig,Bhai fast payouts aur instant bets ke bina betting ka maza nahi aur 4RA pe dono cheezein ekdum top level hai 💥&quot;,hi-Latn,2025-08-09T02:39:34Z,2025-08-08 22:39:34,0,0
R7xl9QjtNDc,Bet | Official Trailer | Netflix,UCWOA1ZGywLbqmigxE4Qlvuw,Netflix,2025-04-21T15:00:02Z,1046082,11124,6698,Ugy965sSyRk9su7b2dt4AaABAg,NA,@earlemccloud,UCGgQbcjsNlp9GXa0cNEwZiw,Sabse mast feature yeh hai ki verification ek baar ho gaya toh phir koi dikkat nahi direct deposits aur withdrawals,hi-Latn,2025-08-09T02:39:09Z,2025-08-08 22:39:09,0,0
R7xl9QjtNDc,Bet | Official Trailer | Netflix,UCWOA1ZGywLbqmigxE4Qlvuw,Netflix,2025-04-21T15:00:02Z,1046082,11124,6698,UgydI3b8JSlM2y6r4TB4AaABAg,NA,@minhhasan-p3d,UCPveRL2nh8JdX1v9AEm3o4w,Pehle doosri sites pe delay hota tha winnings process hone me but 4RABeT pe toh instant approval milta hai,NA,2025-08-09T02:37:40Z,2025-08-08 22:37:40,0,0
R7xl9QjtNDc,Bet | Official Trailer | Netflix,UCWOA1ZGywLbqmigxE4Qlvuw,Netflix,2025-04-21T15:00:02Z,1046082,11124,6698,UgzKJVFRQlW3fK0k6Gp4AaABAg,NA,@clydesullivan-o6x,UC7qCNsnD03Zva3gG7MK9NIQ,Pehle doosre sites pe withdrawal issues face kiya tha but 4RABeT pe ekdum fast processing hoti hai koi wait nahi ⚡,NA,2025-08-09T02:36:27Z,2025-08-08 22:36:27,0,0
R7xl9QjtNDc,Bet | Official Trailer | Netflix,UCWOA1ZGywLbqmigxE4Qlvuw,Netflix,2025-04-21T15:00:02Z,1046082,11124,6698,UgyWvuRV95vvXtvEYCh4AaABAg,NA,@lemuelthibodeau,UCE5uO0fn4MAXj6N5O14eO_Q,4RABT pe bets lagana itna smooth hai koi bhi game khelo sab instantly process hota hai koi lag nahi hai 😍,hi-Latn,2025-08-09T02:36:02Z,2025-08-08 22:36:02,0,0
R7xl9QjtNDc,Bet | Official Trailer | Netflix,UCWOA1ZGywLbqmigxE4Qlvuw,Netflix,2025-04-21T15:00:02Z,1046082,11124,6698,UgzO6aR1NdzsRtSeEMd4AaABAg,NA,@jeromekearns-q2k,UC0wiUROiH87elgQb-gZ3Z6g,4RABAT pe bets bhi instantly process hoti hai kabhi lag ya delay nahi har game live aur real time chalti hai 💪,hi-Latn,2025-08-09T02:35:55Z,2025-08-08 22:35:55,0,0
R7xl9QjtNDc,Bet | Official Trailer | Netflix,UCWOA1ZGywLbqmigxE4Qlvuw,Netflix,2025-04-21T15:00:02Z,1046082,11124,6698,UgxYB9QMESniPfU7SHJ4AaABAg,NA,@benjaminmilkutat3184,UC2Vgn27yujDltUrvKkJG4MQ,Der letzte Müll Adaption mit nem schwarzen in der Hauptrolle,de,2025-08-03T11:50:16Z,2025-08-03 07:50:16,0,0
R7xl9QjtNDc,Bet | Official Trailer | Netflix,UCWOA1ZGywLbqmigxE4Qlvuw,Netflix,2025-04-21T15:00:02Z,1046082,11124,6698,Ugx6nwDd8hjK9R_xQnZ4AaABAg,NA,@FortuneFortune-ct3yh,UC43hCd2KXVTIgNtzQiePbqw,This movie is dope,en,2025-08-02T04:56:40Z,2025-08-02 00:56:40,0,0
R7xl9QjtNDc,Bet | Official Trailer | Netflix,UCWOA1ZGywLbqmigxE4Qlvuw,Netflix,2025-04-21T15:00:02Z,1046082,11124,6698,UgwYyRsYn2GuiUH9vNp4AaABAg,NA,@ChrisDoesStuff23,UCwkv4n0W9FLaBe-mV4zSjjQ,Lol i just watched it because i heard Ryancomedy was in it,en,2025-08-01T19:25:20Z,2025-08-01 15:25:20,0,0
R7xl9QjtNDc,Bet | Official Trailer | Netflix,UCWOA1ZGywLbqmigxE4Qlvuw,Netflix,2025-04-21T15:00:02Z,1046082,11124,6698,UgzqtNwPQ9yLg8vbOJt4AaABAg,NA,@azqyharun6857,UCB1Viv96I5Ue4VZiO5FUmzw,iklan lgbt 💩💩💩💩💩💩💩,su,2025-07-28T01:19:07Z,2025-07-27 21:19:07,0,0
R7xl9QjtNDc,Bet | Official Trailer | Netflix,UCWOA1ZGywLbqmigxE4Qlvuw,Netflix,2025-04-21T15:00:02Z,1046082,11124,6698,UgzDe3XZgmIcH4GnqU14AaABAg,NA,@ArãoAurélioMachavaMachava,UCc4bogkL3LUYSxZJ5xkxRRA,Quale é o nome de seriado?,pt,2025-07-26T15:16:49Z,2025-07-26 11:16:49,0,0
R7xl9QjtNDc,Bet | Official Trailer | Netflix,UCWOA1ZGywLbqmigxE4Qlvuw,Netflix,2025-04-21T15:00:02Z,1046082,11124,6698,UgxtU2-KlMZXLKEoJnt4AaABAg,NA,@AdepuvijayaVijaya,UCvik0LE8RALJUjK4vXDGVLQ,keren seh kak keren banget  langsung saya coba di kdslot kak,jv,2025-07-26T08:32:46Z,2025-07-26 04:32:46,0,0
R7xl9QjtNDc,Bet | Official Trailer | Netflix,UCWOA1ZGywLbqmigxE4Qlvuw,Netflix,2025-04-21T15:00:02Z,1046082,11124,6698,UgyQXInoEh5pDvShDvF4AaABAg,NA,@oscar437,UCIOVEgCutRFq3ns1ozf08ZA,I'm not gonna sending my kids to a boarding school.,NA,2025-07-26T00:21:22Z,2025-07-25 20:21:22,0,0
R7xl9QjtNDc,Bet | Official Trailer | Netflix,UCWOA1ZGywLbqmigxE4Qlvuw,Netflix,2025-04-21T15:00:02Z,1046082,11124,6698,UgwNjlWlaV2_BZfpPJN4AaABAg,NA,@imheil,UCPvJb2iyiYNO8a5MHi38HbQ,"It’s actually a good show. 
Yumeko Face card was the strongest card in the deck.",en,2025-07-24T19:42:43Z,2025-07-24 15:42:43,0,0
R7xl9QjtNDc,Bet | Official Trailer | Netflix,UCWOA1ZGywLbqmigxE4Qlvuw,Netflix,2025-04-21T15:00:02Z,1046082,11124,6698,UgwFUjrFC6154UyYhlh4AaABAg,NA,@leonidasmonasterios5790,UC4KF_bgwmU7jZwx7nSOnZMg,Great show,en,2025-07-24T04:06:18Z,2025-07-24 00:06:18,1,0
R7xl9QjtNDc,Bet | Official Trailer | Netflix,UCWOA1ZGywLbqmigxE4Qlvuw,Netflix,2025-04-21T15:00:02Z,1046082,11124,6698,UgwYED3YaB5NPb9gX_x4AaABAg,NA,@gorevvx,UCX0nXfadVIAnjWLCaaL8ESA,Am i the only one that absolutely loved the show?,en,2025-07-23T21:12:14Z,2025-07-23 17:12:14,40,11
R7xl9QjtNDc,Bet | Official Trailer | Netflix,UCWOA1ZGywLbqmigxE4Qlvuw,Netflix,2025-04-21T15:00:02Z,1046082,11124,6698,UgxBUgQiweCMeZg0ZB94AaABAg,NA,@kayrababayeva5416,UCvFSwMCbhMXS-Rj2qevxhvg,İ like this😂,NA,2025-07-23T07:54:38Z,2025-07-23 03:54:38,1,0
R7xl9QjtNDc,Bet | Official Trailer | Netflix,UCWOA1ZGywLbqmigxE4Qlvuw,Netflix,2025-04-21T15:00:02Z,1046082,11124,6698,UgwJ4D6XAf4z4q1JkGZ4AaABAg,NA,@rechiddoeggu2949,UCnKpwFcmzJfRAVoT6KmNwKw,"I'll try to watch this, Im ready for anything. I will be back! 
🤖",en,2025-07-21T15:03:12Z,2025-07-21 11:03:12,0,0
R7xl9QjtNDc,Bet | Official Trailer | Netflix,UCWOA1ZGywLbqmigxE4Qlvuw,Netflix,2025-04-21T15:00:02Z,1046082,11124,6698,UgzHf_GlKdyPq_mZ3Sl4AaABAg,NA,@ramonromanjr6407,UCztqojRm4GfjAryuZJ4uqOg,Since when did the sadistic one eyed woman become cringe and fat at the same time? 🤦‍♂️,en,2025-07-20T09:33:43Z,2025-07-20 05:33:43,1,0
R7xl9QjtNDc,Bet | Official Trailer | Netflix,UCWOA1ZGywLbqmigxE4Qlvuw,Netflix,2025-04-21T15:00:02Z,1046082,11124,6698,Ugwk86RmdxU4PDS4KSh4AaABAg,NA,@ramonromanjr6407,UCztqojRm4GfjAryuZJ4uqOg,"Bruh? How is this sh*t Netflix worthy? The acting is cringe, it ain't even accurate from the anime... 🤢🤮🤮 they literally need to get this sh*tshow out of Netflix 🤢",en,2025-07-20T09:25:56Z,2025-07-20 05:25:56,0,0
R7xl9QjtNDc,Bet | Official Trailer | Netflix,UCWOA1ZGywLbqmigxE4Qlvuw,Netflix,2025-04-21T15:00:02Z,1046082,11124,6698,UgxNxwMN7NIffDCc4Kx4AaABAg,NA,@AlexanderShestakov62,UCMcmN1fz7Gmnsbrg_F6MduQ,"Господи, какой ужасный каст 👎",ru,2025-07-17T22:04:02Z,2025-07-17 18:04:02,1,0
R7xl9QjtNDc,Bet | Official Trailer | Netflix,UCWOA1ZGywLbqmigxE4Qlvuw,Netflix,2025-04-21T15:00:02Z,1046082,11124,6698,Ugyw-aP7jDcPSbfughN4AaABAg,NA,@jgang0011,UC7QPDTjhSgM2WvJqVzZ7e6w,did everyone forget that  she went to the school to get even with kiraie . like she legit went there for  revenge on her cousin  for what happened to her older sister .,en,2025-07-16T16:24:46Z,2025-07-16 12:24:46,0,0
R7xl9QjtNDc,Bet | Official Trailer | Netflix,UCWOA1ZGywLbqmigxE4Qlvuw,Netflix,2025-04-21T15:00:02Z,1046082,11124,6698,UgyLjusQSxvKYVGyjHN4AaABAg,NA,@Chesta-m9c,UC3tXERN9C0KBMG2Qx8K7F-Q,hell LGBT 🖕🖕🖕,sv,2025-07-13T09:28:35Z,2025-07-13 05:28:35,1,1
R7xl9QjtNDc,Bet | Official Trailer | Netflix,UCWOA1ZGywLbqmigxE4Qlvuw,Netflix,2025-04-21T15:00:02Z,1046082,11124,6698,Ugw64pQ8XDDUScsjdqB4AaABAg,NA,@weeaaron8075,UCJnKk4uVbUy1F86aJ7qsR2A,"Never heard of ""Kakegurui"". Started watching ""bet"" because the premise was interesting. Started feeling like they cut out a ton of content to rush the story. Went to watch the original anime instead. 

Yea, the remake certainly feel like a bet gone wrong because the story definitely got murdered by Netflix. A whole lot of extremely irritating characters coupled with plot points that went nowhere. That whole ""mob boss"" schtick came off as a pathetic attempt by some two-bit writer who couldn't find a snowball in an avalanche. 

And let's not even consider how unattractive almost every character in the Netflix version is. Oh, the anime titillates? Here, have a blob of androgynous human protoplasm.",en,2025-07-13T04:56:06Z,2025-07-13 00:56:06,0,0
R7xl9QjtNDc,Bet | Official Trailer | Netflix,UCWOA1ZGywLbqmigxE4Qlvuw,Netflix,2025-04-21T15:00:02Z,1046082,11124,6698,UgzxhtbT3iQafIIBLnR4AaABAg,NA,@thesnow691,UCpcvm4-XYDypuj_v550Vz_A,Dih.,NA,2025-07-13T04:29:25Z,2025-07-13 00:29:25,0,0
R7xl9QjtNDc,Bet | Official Trailer | Netflix,UCWOA1ZGywLbqmigxE4Qlvuw,Netflix,2025-04-21T15:00:02Z,1046082,11124,6698,UgylXSEeOHitq9Ha6jB4AaABAg,NA,@HazelTaki,UCXuOpA9GXz3FQHlMYgm2i6w,Im not an anime fan amd im late to a bunch of anime but im going to say this looks like trash but at least trash has treasure this is not treasure,en,2025-07-13T02:01:19Z,2025-07-12 22:01:19,0,0
R7xl9QjtNDc,Bet | Official Trailer | Netflix,UCWOA1ZGywLbqmigxE4Qlvuw,Netflix,2025-04-21T15:00:02Z,1046082,11124,6698,UgwSNPIaTOKrgHumv2V4AaABAg,NA,@Tertawarendem,UCqkV0y_iDGl4VWK0k-CrCkA,Ini penghinaan untuk anime,id,2025-07-12T23:36:31Z,2025-07-12 19:36:31,1,0
R7xl9QjtNDc,Bet | Official Trailer | Netflix,UCWOA1ZGywLbqmigxE4Qlvuw,Netflix,2025-04-21T15:00:02Z,1046082,11124,6698,UgwegGm93sa9R455EpJ4AaABAg,NA,@jadahalsey3579,UCnvFA5POSYR5VTueYVj8nVw,They did THIS instead of continuing the prequel series they made. SMH,en,2025-07-11T19:51:32Z,2025-07-11 15:51:32,0,0
R7xl9QjtNDc,Bet | Official Trailer | Netflix,UCWOA1ZGywLbqmigxE4Qlvuw,Netflix,2025-04-21T15:00:02Z,1046082,11124,6698,UgwHaho2wvXdUx8oBo54AaABAg,NA,@imamnasimhowlather4961,UCj0TZYatBf-g5Km_1GlHoSw,Ru!ned,NA,2025-07-11T18:05:39Z,2025-07-11 14:05:39,1,0
R7xl9QjtNDc,Bet | Official Trailer | Netflix,UCWOA1ZGywLbqmigxE4Qlvuw,Netflix,2025-04-21T15:00:02Z,1046082,11124,6698,UgxtoH_sVqdqlvy5buN4AaABAg,NA,@vrotey,UC09Q8JcBxGfrdUdHq4r41EQ,LMAOO THIS IS ASS,en,2025-07-11T16:09:50Z,2025-07-11 12:09:50,0,0
R7xl9QjtNDc,Bet | Official Trailer | Netflix,UCWOA1ZGywLbqmigxE4Qlvuw,Netflix,2025-04-21T15:00:02Z,1046082,11124,6698,Ugzf-qbPzVArySVmeIV4AaABAg,NA,@AyferPehlivan-hs1jk,UCVm3fBMu285S7Pfqg4SgSWw,İki lokma maaş için çekilen çileler kapat arcelik ve arzum u set çek titanici batır titanyum ol tamamdır hitsubishi değil nikel sishi olursun,tr,2025-07-11T11:36:17Z,2025-07-11 07:36:17,0,0
R7xl9QjtNDc,Bet | Official Trailer | Netflix,UCWOA1ZGywLbqmigxE4Qlvuw,Netflix,2025-04-21T15:00:02Z,1046082,11124,6698,Ugywd_2XesfJ7wYz2bF4AaABAg,NA,@abdel_interieurs,UCZgxlRIQQivis2kbAiQNGbw,"Yet another masterpiece ruined by Americans and their hero complex 
Yeah I'm not watching that",en,2025-07-10T12:38:11Z,2025-07-10 08:38:11,0,0
R7xl9QjtNDc,Bet | Official Trailer | Netflix,UCWOA1ZGywLbqmigxE4Qlvuw,Netflix,2025-04-21T15:00:02Z,1046082,11124,6698,UgyNZWRjdqV4cRFVIRt4AaABAg,NA,@nuriskunjiwa9237,UCrjT87MVnMJWSUOjevr9W8A,"Okay Netflix, if you can't adapt well, don't force it, let alone continue, the impression of the anime is ruined because of you.",en,2025-07-10T08:01:39Z,2025-07-10 04:01:39,0,0
R7xl9QjtNDc,Bet | Official Trailer | Netflix,UCWOA1ZGywLbqmigxE4Qlvuw,Netflix,2025-04-21T15:00:02Z,1046082,11124,6698,UgxPvUv_xycvpjxGMyx4AaABAg,NA,@amarafifi823,UCe1vvmJFq1MYrJg7wcP1tBQ,MC TURNS BLACKK,NA,2025-07-10T06:54:21Z,2025-07-10 02:54:21,0,0
R7xl9QjtNDc,Bet | Official Trailer | Netflix,UCWOA1ZGywLbqmigxE4Qlvuw,Netflix,2025-04-21T15:00:02Z,1046082,11124,6698,UgxdcTXEDoMtEv3SqW54AaABAg,NA,@tockutocku,UCW0jYHepcN_O120XnF2yHag,"so much unlike, really? 😂",en,2025-07-09T17:27:53Z,2025-07-09 13:27:53,0,0
