video_id,video_url,comment_id,comment_author_display,comment_author_channel_id,comment_content,comment_lang,comment_time_utc,comment_time_local,comment_like_count,comment_reply_count,reply_id,reply_author_display,reply_author_channel_id,reply_content,reply_lang,reply_time_utc,reply_time_local,reply_like_count,view_count,like_count,comment_count,crawl_time
5L8intrDcM0,https://www.youtube.com/watch?v=5L8intrDcM0,UgwilEu2nv7fbI_qC_p4AaABAg,@korinostream,UCjoLQjKUy1fhVEpvCFZouRw,I dont wanna watch him portrayed as an old man. Especially not nerfed as a fkin american High school Teacher.,NA,2025-10-08T16:09:10Z,2025-10-08 12:09:10,1,2,UgwilEu2nv7fbI_qC_p4AaABAg.AO0zm_1AriQAO3-EjJ-hQe,@Tessmn,UClSIrbqO4OBsidih8fBarVw,"He isn't portrayed as an old man, he's 48 years in the movie, and 49 now in real life. And he doesn't plays american, but an irish in any english school. Maybe we didn't see the same movie 🤣🤣🤣",en,2025-10-09T10:51:38Z,2025-10-09 06:51:38,0,2910412,41206,1375,"Tue, 16 Dec 2025 17:36:18 GMT"
5L8intrDcM0,https://www.youtube.com/watch?v=5L8intrDcM0,UgwilEu2nv7fbI_qC_p4AaABAg,@korinostream,UCjoLQjKUy1fhVEpvCFZouRw,I dont wanna watch him portrayed as an old man. Especially not nerfed as a fkin american High school Teacher.,NA,2025-10-08T16:09:10Z,2025-10-08 12:09:10,1,2,UgwilEu2nv7fbI_qC_p4AaABAg.AO0zm_1AriQAO3OYDuceAA,@korinostream,UCjoLQjKUy1fhVEpvCFZouRw,@Tessmn tsk! Details bruh details!,da,2025-10-09T14:32:45Z,2025-10-09 10:32:45,0,2910412,41206,1375,"Tue, 16 Dec 2025 17:36:18 GMT"
5L8intrDcM0,https://www.youtube.com/watch?v=5L8intrDcM0,UgxtiYsSxOqU2YQJkRl4AaABAg,@gabrieldarie8611,UCeCrSGUYOy0F7aar8MAG1dg,Shit movie .....,NA,2025-10-07T16:55:03Z,2025-10-07 12:55:03,1,1,UgxtiYsSxOqU2YQJkRl4AaABAg.ANzVEfeCr6xAO-EF83YbbY,@dcsmith111,UCDM71m7sX6w58hU_Tj3vpQQ,What you meant to say was you got a shit personality and your mum is your dad's sister. 😂,en,2025-10-07T23:45:48Z,2025-10-07 19:45:48,1,2910412,41206,1375,"Tue, 16 Dec 2025 17:36:18 GMT"
5L8intrDcM0,https://www.youtube.com/watch?v=5L8intrDcM0,UgwgxICo_Utft40egIF4AaABAg,@christopherhamilton2032,UCud9m1-j_0HQJI2eRbAqptA,Is it a uk version of dangerous minds,fr,2025-10-05T21:22:55Z,2025-10-05 17:22:55,0,1,UgwgxICo_Utft40egIF4AaABAg.ANupIqQQOTMAOGjIV97Tbx,@letsgetlit2829,UCAQKPiRup_e3BXs-yghYnSA,"Sounds terrible, like every movie the last 5 years. More woke crap.",en,2025-10-14T18:52:58Z,2025-10-14 14:52:58,0,2910412,41206,1375,"Tue, 16 Dec 2025 17:36:18 GMT"
5L8intrDcM0,https://www.youtube.com/watch?v=5L8intrDcM0,UgyJV5qVbQ9Uk3-A2eR4AaABAg,@talibsmiler8429,UCFMWW_K3Ti3erCLx51DYdzw,"seems like ""Sitare zameen par""",fy,2025-10-05T05:40:11Z,2025-10-05 01:40:11,0,2,UgyJV5qVbQ9Uk3-A2eR4AaABAg.ANt8Q9KcPUSAO-jwIdNVTZ,@twistedcigar,UCGAHjH7PRwWH0m7UwfAHyiQ,Dude get a life. That movie itself is a remake and this is miles better than that unoriginal piece of shit movie. Nobody is taking inspiration from Indian films. Get a life.,en,2025-10-08T04:31:27Z,2025-10-08 00:31:27,0,2910412,41206,1375,"Tue, 16 Dec 2025 17:36:18 GMT"
5L8intrDcM0,https://www.youtube.com/watch?v=5L8intrDcM0,UgyJV5qVbQ9Uk3-A2eR4AaABAg,@talibsmiler8429,UCFMWW_K3Ti3erCLx51DYdzw,"seems like ""Sitare zameen par""",fy,2025-10-05T05:40:11Z,2025-10-05 01:40:11,0,2,UgyJV5qVbQ9Uk3-A2eR4AaABAg.ANt8Q9KcPUSAO-miqHlslx,@talibsmiler8429,UCFMWW_K3Ti3erCLx51DYdzw,"I am living a good life already. Your response tone tells more about you. You need to get a life when you can handle your rage😂 . If you need few suggestions, I am here buddy!​@twistedcigar",en,2025-10-08T04:55:50Z,2025-10-08 00:55:50,0,2910412,41206,1375,"Tue, 16 Dec 2025 17:36:18 GMT"
5L8intrDcM0,https://www.youtube.com/watch?v=5L8intrDcM0,UgxFLg378GZwBnqSb6R4AaABAg,@sknz2109,UCtaMQyGiqTjoYHaOsDiOUag,How was this rated 8/10??? Movie was  trash,en,2025-10-05T01:10:12Z,2025-10-04 21:10:12,1,2,UgxFLg378GZwBnqSb6R4AaABAg.ANseWd3FV6WANx517UPscF,@toomuchinformation,UC4EBtb7h2gYay_KgkCDr7Jg,I agree. It was just a vehicle for Murphy's acting.,en,2025-10-06T18:27:31Z,2025-10-06 14:27:31,0,2910412,41206,1375,"Tue, 16 Dec 2025 17:36:18 GMT"
5L8intrDcM0,https://www.youtube.com/watch?v=5L8intrDcM0,UgxFLg378GZwBnqSb6R4AaABAg,@sknz2109,UCtaMQyGiqTjoYHaOsDiOUag,How was this rated 8/10??? Movie was  trash,en,2025-10-05T01:10:12Z,2025-10-04 21:10:12,1,2,UgxFLg378GZwBnqSb6R4AaABAg.ANseWd3FV6WANxFDh3al4r,@aliceomalley6215,UCqdkkD_67wEXxtVZtWHmqLA,I thought it was brilliant. It’s one of those movies that needed to exist. Did you even watch to the end?,en,2025-10-06T19:56:37Z,2025-10-06 15:56:37,0,2910412,41206,1375,"Tue, 16 Dec 2025 17:36:18 GMT"
5L8intrDcM0,https://www.youtube.com/watch?v=5L8intrDcM0,UgxRoa6K5NA_ohouRBB4AaABAg,@colincolin5696,UCu_aX6cBlgzZ7GFHnEycm_Q,From Oppenheimer to this… 😂,en,2025-10-02T07:46:28Z,2025-10-02 03:46:28,1,1,UgxRoa6K5NA_ohouRBB4AaABAg.ANldUI7JstbANo7DYMseaw,@Lamp-o4k,UCAxVR4Xcj09YseHzDV4NSRg,"But look like good movie, great actor always do different role",en,2025-10-03T06:53:32Z,2025-10-03 02:53:32,0,2910412,41206,1375,"Tue, 16 Dec 2025 17:36:18 GMT"
5L8intrDcM0,https://www.youtube.com/watch?v=5L8intrDcM0,UgyS2mB1o4Q443kc4pt4AaABAg,@GameTubegames,UC8XeJVRjcpAVFLZkb0tKKKw,Cillian murphy is this generation best actor,nl,2025-09-19T17:46:48Z,2025-09-19 13:46:48,1,3,UgyS2mB1o4Q443kc4pt4AaABAg.ANGEr0E1VUxANo7Z98YGVB,@Lamp-o4k,UCAxVR4Xcj09YseHzDV4NSRg,What about irrfan?,en,2025-10-03T06:56:29Z,2025-10-03 02:56:29,1,2910412,41206,1375,"Tue, 16 Dec 2025 17:36:18 GMT"
5L8intrDcM0,https://www.youtube.com/watch?v=5L8intrDcM0,UgyS2mB1o4Q443kc4pt4AaABAg,@GameTubegames,UC8XeJVRjcpAVFLZkb0tKKKw,Cillian murphy is this generation best actor,nl,2025-09-19T17:46:48Z,2025-09-19 13:46:48,1,3,UgyS2mB1o4Q443kc4pt4AaABAg.ANGEr0E1VUxANoGmk1UwYi,@GameTubegames,UC8XeJVRjcpAVFLZkb0tKKKw,​@Lamp-o4k good but i like cillian,NA,2025-10-03T08:17:07Z,2025-10-03 04:17:07,0,2910412,41206,1375,"Tue, 16 Dec 2025 17:36:18 GMT"
5L8intrDcM0,https://www.youtube.com/watch?v=5L8intrDcM0,UgyS2mB1o4Q443kc4pt4AaABAg,@GameTubegames,UC8XeJVRjcpAVFLZkb0tKKKw,Cillian murphy is this generation best actor,nl,2025-09-19T17:46:48Z,2025-09-19 13:46:48,1,3,UgyS2mB1o4Q443kc4pt4AaABAg.ANGEr0E1VUxANoI4qp0tq4,@Lamp-o4k,UCAxVR4Xcj09YseHzDV4NSRg,"​@GameTubegamesyes I also , but cillian Murphy and irrfan both are legendary actor , you need to discover more , go and watch the Lunch box movie",en,2025-10-03T08:28:28Z,2025-10-03 04:28:28,0,2910412,41206,1375,"Tue, 16 Dec 2025 17:36:18 GMT"
5L8intrDcM0,https://www.youtube.com/watch?v=5L8intrDcM0,UgyJvsTrI50IX2AaFi54AaABAg,@madjack-bv6dv,UC5e8r2YwBHL0T2lW6OpGKSw,I was an extra in two films with Cillian Murphy. One when he was nobody. But even then I could see he was a star in the making. He has such presence. The second was breakfast on Pluto where he played a trans woman. On set even though he was completely dressed as a woman. He was all male. But in the movie he's completely convincing. A great actor.,en,2025-09-06T21:17:55Z,2025-09-06 17:17:55,1,1,UgyJvsTrI50IX2AaFi54AaABAg.AMk8fn48eEmAMkB6CNJ_GX,@madjack-bv6dv,UC5e8r2YwBHL0T2lW6OpGKSw,"On set I was paired with an edgy English woman as my companion who was great fun. We weren't allowed smoke real cigarettes on set but she did and gave me one, even though I don't smoke. She was cool.
But when Cillian came past she lost it. I got chapter and verse on what she'd love to do with him. It was hilarious.",en,2025-09-06T21:39:08Z,2025-09-06 17:39:08,0,2910412,41206,1375,"Tue, 16 Dec 2025 17:36:18 GMT"
5L8intrDcM0,https://www.youtube.com/watch?v=5L8intrDcM0,UgyT-le9K_zsyeJpv7l4AaABAg,@Jamesb431,UCA7qu2845K0ob0ep1LevdpQ,Looks a bit woke for me,NA,2025-08-31T17:39:03Z,2025-08-31 13:39:03,0,1,UgyT-le9K_zsyeJpv7l4AaABAg.AMVIrZiBLs1ANVHEZ5PHCg,@Ygtreegvhbfdi,UCtIL4UjR1oloewzQEcaeR4Q,“Woke”?? Because there’s black people in this?,en,2025-09-25T13:56:14Z,2025-09-25 09:56:14,0,2910412,41206,1375,"Tue, 16 Dec 2025 17:36:18 GMT"
5L8intrDcM0,https://www.youtube.com/watch?v=5L8intrDcM0,Ugymz8BIk2ZGh1jv4fx4AaABAg,@debbiemoore2747,UC0p5eYFOVWD6WK-beUxZC9Q,1:35 of the trailer is spot on to alienation and how we get in our own heads.   Looking forward to this.,en,2025-08-23T10:44:53Z,2025-08-23 06:44:53,4,1,Ugymz8BIk2ZGh1jv4fx4AaABAg.AM9y66DxmcuANuCZ6WIwD5,@redwluv308,UCLcM5tPx4vAw_cnGaBngnfQ,Literally got goosebumps at this exact moment. This is brilliant.,en,2025-10-05T15:35:36Z,2025-10-05 11:35:36,1,2910412,41206,1375,"Tue, 16 Dec 2025 17:36:18 GMT"
5L8intrDcM0,https://www.youtube.com/watch?v=5L8intrDcM0,Ugxh23_Fj2vyrGnqn1t4AaABAg,@mimane2614,UC_K1QRwO2x8sJ_38Jqbo6Ng,Okay British movie Brits this year are killin it bravo 👍👏,NA,2025-08-21T19:08:23Z,2025-08-21 15:08:23,0,1,Ugxh23_Fj2vyrGnqn1t4AaABAg.AM5i86IYHymAM5s9La-zLY,@CillianMurphy-xactor,UCxn_UuBXZvmwfvDZzTbNKtQ,Thanks for the support ❤❤❤,en,2025-08-21T20:35:56Z,2025-08-21 16:35:56,0,2910412,41206,1375,"Tue, 16 Dec 2025 17:36:18 GMT"
5L8intrDcM0,https://www.youtube.com/watch?v=5L8intrDcM0,Ugyymj9aeLwxXbTZVE94AaABAg,@randomgirlondaweb,UCLfPE2DSugfTsh59evS_8gA,The background music being Jungle is so fitting. Netflix you're on the right track with this one.,en,2025-08-21T00:49:18Z,2025-08-20 20:49:18,4,1,Ugyymj9aeLwxXbTZVE94AaABAg.AM3kMEhHFg7AN5n3-sbylJ,@toshibapriest,UC7FAHAblRaLxSZ9SjxdtwAw,what is the song?,en,2025-09-15T16:22:46Z,2025-09-15 12:22:46,0,2910412,41206,1375,"Tue, 16 Dec 2025 17:36:18 GMT"
5L8intrDcM0,https://www.youtube.com/watch?v=5L8intrDcM0,UgxwS6rGZEzDEFvjjgN4AaABAg,@Sin_Of_Greed,UCrgVfBKeByKaz-P4e42j5Zg,"I feel like this is a movie for white people, who don't know what problems look/feel like.
Love Cillian Murphy.
But, why do want to watch movies to make you feel bad?
Only reason for that is if you don't know the feeling yourself, you don't have it enough in your life already, because it's not a feeling you want to relate to. Trust me.",en,2025-08-19T22:43:41Z,2025-08-19 18:43:41,0,1,UgxwS6rGZEzDEFvjjgN4AaABAg.AM0xBGkarsUAM3EO3mANHF,@alexbrettw,UC65qWHUD9YPMzWLnws6WMog,We watch movies that make us feel bad because it is actually good for us. It allows us to release bottled up emotions through connection and empathy to the characters. If we only watch movies with glitter and butterflies we will be living a delusion,en,2025-08-20T20:01:12Z,2025-08-20 16:01:12,0,2910412,41206,1375,"Tue, 16 Dec 2025 17:36:18 GMT"
5L8intrDcM0,https://www.youtube.com/watch?v=5L8intrDcM0,UgzqmdvPmC2VkVABZ8l4AaABAg,@aaronsamson8685,UCaThbK32xCNLEeceYwMwZ2g,1:20 WHAT SOUND TRACK IS THIS ?,en,2025-08-19T21:18:48Z,2025-08-19 17:18:48,5,2,UgzqmdvPmC2VkVABZ8l4AaABAg.AM0nT_XIIFYAM2Nbx-z2D8,@Pimplico-k9f,UC6mG42MB5EJuXQq5krzz0vQ,little simz,lb,2025-08-20T12:02:38Z,2025-08-20 08:02:38,4,2910412,41206,1375,"Tue, 16 Dec 2025 17:36:18 GMT"
5L8intrDcM0,https://www.youtube.com/watch?v=5L8intrDcM0,UgzqmdvPmC2VkVABZ8l4AaABAg,@aaronsamson8685,UCaThbK32xCNLEeceYwMwZ2g,1:20 WHAT SOUND TRACK IS THIS ?,en,2025-08-19T21:18:48Z,2025-08-19 17:18:48,5,2,UgzqmdvPmC2VkVABZ8l4AaABAg.AM0nT_XIIFYAM2Odb1zt9K,@aaronsamson8685,UCaThbK32xCNLEeceYwMwZ2g,@Pimplico-k9f thank you,NA,2025-08-20T12:11:36Z,2025-08-20 08:11:36,0,2910412,41206,1375,"Tue, 16 Dec 2025 17:36:18 GMT"
5L8intrDcM0,https://www.youtube.com/watch?v=5L8intrDcM0,UgxR8oQJuWI-A9m0oEV4AaABAg,@jonatankaszkowiak,UC7tug1rd2m41nrK6CT5XmDg,Woke shit,ht,2025-08-18T09:17:21Z,2025-08-18 05:17:21,2,1,UgxR8oQJuWI-A9m0oEV4AaABAg.ALxw6dsoyFgALy0B91foGU,@GreenIncubusDay1988,UCFmx8eO9PFamgepH_bdKRBA,Bore off,it,2025-08-18T10:01:39Z,2025-08-18 06:01:39,0,2910412,41206,1375,"Tue, 16 Dec 2025 17:36:18 GMT"
5L8intrDcM0,https://www.youtube.com/watch?v=5L8intrDcM0,Ugy8IWN8beEgULH9KOh4AaABAg,@Jackohhs,UC31CA7NDqkUjS41z-XVhRhQ,"Them: ""We're asking everyone to describe themselves in 3 words"" 
Him: ""I am Steve""",en,2025-08-18T05:36:24Z,2025-08-18 01:36:24,3,1,Ugy8IWN8beEgULH9KOh4AaABAg.ALxXpPiK3YIALxc_Y6Hvu1,@Silvanor0,UC6TRK3XTTK9SFvPJ-7YVPsw,The Steve that could have make Minecraft an award winning movie.,en,2025-08-18T06:26:40Z,2025-08-18 02:26:40,0,2910412,41206,1375,"Tue, 16 Dec 2025 17:36:18 GMT"
5L8intrDcM0,https://www.youtube.com/watch?v=5L8intrDcM0,UgwPODvjbic2MWXPDNh4AaABAg,@DennisFeinsteinCEO,UCHvzZIAjf1OmH-PdCzjSyNA,This... Looks terrible.,en,2025-08-18T04:50:37Z,2025-08-18 00:50:37,1,1,UgwPODvjbic2MWXPDNh4AaABAg.ALxSa0N0M3iALy0F_3Wn8W,@GreenIncubusDay1988,UCFmx8eO9PFamgepH_bdKRBA,Don’t watch it then… easy 👍🏻,NA,2025-08-18T10:02:15Z,2025-08-18 06:02:15,1,2910412,41206,1375,"Tue, 16 Dec 2025 17:36:18 GMT"
5L8intrDcM0,https://www.youtube.com/watch?v=5L8intrDcM0,Ugxd4AgzjVny91bTPRN4AaABAg,@pattywolford,UCn_rqaCaToZrbUGaHGrZlyA,So glad to be retired from teaching.  Think i’ll pass on this one.,en,2025-08-17T23:02:27Z,2025-08-17 19:02:27,0,1,Ugxd4AgzjVny91bTPRN4AaABAg.ALwpk0G-qBEALy0Ks6xjeo,@GreenIncubusDay1988,UCFmx8eO9PFamgepH_bdKRBA,Good for you 👍🏻,en,2025-08-18T10:02:59Z,2025-08-18 06:02:59,0,2910412,41206,1375,"Tue, 16 Dec 2025 17:36:18 GMT"
5L8intrDcM0,https://www.youtube.com/watch?v=5L8intrDcM0,UgzHLqbip9zj9XGwe254AaABAg,@iamcable4347,UCsuKIIy1KWP6DKYNiiZ4M4g,0:36 shot is MADD,en,2025-08-17T16:00:59Z,2025-08-17 12:00:59,112,4,UgzHLqbip9zj9XGwe254AaABAg.ALw4W106rXkALzm4gnnMn6,@kanyewestfan1232,UCWcAU7gwJqWQe_xdqVKG34w,Not really,en,2025-08-19T02:28:11Z,2025-08-18 22:28:11,6,2910412,41206,1375,"Tue, 16 Dec 2025 17:36:18 GMT"
5L8intrDcM0,https://www.youtube.com/watch?v=5L8intrDcM0,UgzHLqbip9zj9XGwe254AaABAg,@iamcable4347,UCsuKIIy1KWP6DKYNiiZ4M4g,0:36 shot is MADD,en,2025-08-17T16:00:59Z,2025-08-17 12:00:59,112,4,UgzHLqbip9zj9XGwe254AaABAg.ALw4W106rXkAM2QraO5-7S,@Chewie234,UCtCLjbu4aLm9QpCOp6uA7bg,It is bro,fy,2025-08-20T12:30:59Z,2025-08-20 08:30:59,6,2910412,41206,1375,"Tue, 16 Dec 2025 17:36:18 GMT"
5L8intrDcM0,https://www.youtube.com/watch?v=5L8intrDcM0,UgzHLqbip9zj9XGwe254AaABAg,@iamcable4347,UCsuKIIy1KWP6DKYNiiZ4M4g,0:36 shot is MADD,en,2025-08-17T16:00:59Z,2025-08-17 12:00:59,112,4,UgzHLqbip9zj9XGwe254AaABAg.ALw4W106rXkAMgu8774v9G,@HopeCorbett,UCYqf6uJFquwmNi-M6Qm1GpQ,For real I was like now this is how a trailer and art is done,en,2025-09-05T15:04:23Z,2025-09-05 11:04:23,2,2910412,41206,1375,"Tue, 16 Dec 2025 17:36:18 GMT"
5L8intrDcM0,https://www.youtube.com/watch?v=5L8intrDcM0,UgzHLqbip9zj9XGwe254AaABAg,@iamcable4347,UCsuKIIy1KWP6DKYNiiZ4M4g,0:36 shot is MADD,en,2025-08-17T16:00:59Z,2025-08-17 12:00:59,112,4,UgzHLqbip9zj9XGwe254AaABAg.ALw4W106rXkAP1TDKk0vVW,@ojaun,UC9HZr_fdo8jWnSUIP0oybsg,"for real, homie",en,2025-11-02T17:06:30Z,2025-11-02 12:06:30,0,2910412,41206,1375,"Tue, 16 Dec 2025 17:36:18 GMT"
5L8intrDcM0,https://www.youtube.com/watch?v=5L8intrDcM0,Ugxg9DY1P7G16q9zP654AaABAg,@tirosc,UCf0_4qPekjcDT_RNsTbslPA,The fact that most comments here are talking about Cillian and his award and not about the movie trailer or plot should tell you that these people dgaf about the story or the content. They are just here for the clout and will be gone the moment this movie doesn't get raving reviews.,en,2025-08-16T14:42:15Z,2025-08-16 10:42:15,3,2,Ugxg9DY1P7G16q9zP654AaABAg.ALtMhZdHhuVALtgcp9YxpE,@Litera_Trotter,UCjelynqrMeb12i_5GBtzviQ,I for one was interested in the plot and currently reading the novella on which the movie is based. I am intrigued to see why the movie is from Steve's perspective while the book is from Shy's,en,2025-08-16T17:45:06Z,2025-08-16 13:45:06,0,2910412,41206,1375,"Tue, 16 Dec 2025 17:36:18 GMT"
5L8intrDcM0,https://www.youtube.com/watch?v=5L8intrDcM0,Ugxg9DY1P7G16q9zP654AaABAg,@tirosc,UCf0_4qPekjcDT_RNsTbslPA,The fact that most comments here are talking about Cillian and his award and not about the movie trailer or plot should tell you that these people dgaf about the story or the content. They are just here for the clout and will be gone the moment this movie doesn't get raving reviews.,en,2025-08-16T14:42:15Z,2025-08-16 10:42:15,3,2,Ugxg9DY1P7G16q9zP654AaABAg.ALtMhZdHhuVALv5hcHXgoi,@samjennifer1755,UCpn2Sf3TXpe7Wp8Bb748QqQ,​@Litera_Trotterexactly I was also wondering why it named after teacher,en,2025-08-17T06:52:11Z,2025-08-17 02:52:11,0,2910412,41206,1375,"Tue, 16 Dec 2025 17:36:18 GMT"
5L8intrDcM0,https://www.youtube.com/watch?v=5L8intrDcM0,UgwJyy48to8woZpODgJ4AaABAg,@atlasoptikan,UCWfHukThgwtTutyIzRGM1eA,So the books calls shy why Steve then?,en,2025-08-16T13:07:03Z,2025-08-16 09:07:03,1,1,UgwJyy48to8woZpODgJ4AaABAg.ALtBoGgr4ZMALtHNJ7Hmm8,@SAMTAKENOTES,UCo8gKNyA3rAM2_hdhc-nnwg,"Exactly! Oh by the way, check the vomit inducing comments from bots. Pathetic",en,2025-08-16T13:55:40Z,2025-08-16 09:55:40,0,2910412,41206,1375,"Tue, 16 Dec 2025 17:36:18 GMT"
5L8intrDcM0,https://www.youtube.com/watch?v=5L8intrDcM0,UgwA35Mxg7O5judDxwR4AaABAg,@AlvinChinedu,UC6iZytjE1vsuQGaK78Sap_A,Why is no one noticing that this feels more like an A24 movie than a Netflix movie,en,2025-08-16T11:10:21Z,2025-08-16 07:10:21,3,1,UgwA35Mxg7O5judDxwR4AaABAg.ALszSXqGIFxALtDRzqFZB5,@Saigeee333,UCgx7ctLMmcUk0hPwP94t9CA,The movies they choose to release in theaters (albeit for a limited amount of time) are usually pretty good,en,2025-08-16T13:21:21Z,2025-08-16 09:21:21,4,2910412,41206,1375,"Tue, 16 Dec 2025 17:36:18 GMT"
5L8intrDcM0,https://www.youtube.com/watch?v=5L8intrDcM0,UgxsesmaZVJUYS325vl4AaABAg,@JoeCostigan-b6d2m,UCSPSWgLSB1IcMgjdE5IW4Bg,"Hey, that one younger actor played a minor role in The Batman as the Skull gang member getting egged to punch that passenger.",en,2025-08-15T21:54:14Z,2025-08-15 17:54:14,0,1,UgxsesmaZVJUYS325vl4AaABAg.ALrZLgA_RrQALtgtsn0jaC,@Litera_Trotter,UCjelynqrMeb12i_5GBtzviQ,He also played Tim Drake in Titans if I am not wrong,en,2025-08-16T17:47:26Z,2025-08-16 13:47:26,0,2910412,41206,1375,"Tue, 16 Dec 2025 17:36:18 GMT"
5L8intrDcM0,https://www.youtube.com/watch?v=5L8intrDcM0,Ugz62bb-cIeeSU1CNfJ4AaABAg,@grainneomelia1329,UCQmuUL1TzlCOtj1OOq135-Q,"Id watch Cillian Murphy paint a wall for two hours. He is fantastic. Fantastic. And one of those actors that picks his scripts wisely, so I’d say this has some substance to it. Can’t wait",en,2025-08-15T11:06:43Z,2025-08-15 07:06:43,34,1,Ugz62bb-cIeeSU1CNfJ4AaABAg.ALqPF4GpqCxANFp8MVpHvJ,@Seatacstevis113,UC95V-X_akr_FnXI3I-ppy8w,Top 3 actors of today. Perhaps #1,nl,2025-09-19T13:53:23Z,2025-09-19 09:53:23,0,2910412,41206,1375,"Tue, 16 Dec 2025 17:36:18 GMT"
5L8intrDcM0,https://www.youtube.com/watch?v=5L8intrDcM0,Ugy6sqwzKWLeJZ8jf5B4AaABAg,@think_with-us7tc,UCEzzj7ysrq7sZmoLSen3cqA,1:29: speed?,NA,2025-08-14T20:16:58Z,2025-08-14 16:16:58,14,3,Ugy6sqwzKWLeJZ8jf5B4AaABAg.ALooQPYJhaKALoxw_RgWiF,@Arafaint1,UC5Ielkw_d2u6lIyhC0vSCHg,Heda,NA,2025-08-14T21:40:09Z,2025-08-14 17:40:09,2,2910412,41206,1375,"Tue, 16 Dec 2025 17:36:18 GMT"
5L8intrDcM0,https://www.youtube.com/watch?v=5L8intrDcM0,Ugy6sqwzKWLeJZ8jf5B4AaABAg,@think_with-us7tc,UCEzzj7ysrq7sZmoLSen3cqA,1:29: speed?,NA,2025-08-14T20:16:58Z,2025-08-14 16:16:58,14,3,Ugy6sqwzKWLeJZ8jf5B4AaABAg.ALooQPYJhaKALsS6i0-m-a,@matijajuric5479,UChu_c54A_3FOjm7aQhpIB7A,I rewind and there is a guy walking towards a door😂 nothing ilegal in shot or shot after,en,2025-08-16T06:10:16Z,2025-08-16 02:10:16,0,2910412,41206,1375,"Tue, 16 Dec 2025 17:36:18 GMT"
5L8intrDcM0,https://www.youtube.com/watch?v=5L8intrDcM0,Ugy6sqwzKWLeJZ8jf5B4AaABAg,@think_with-us7tc,UCEzzj7ysrq7sZmoLSen3cqA,1:29: speed?,NA,2025-08-14T20:16:58Z,2025-08-14 16:16:58,14,3,Ugy6sqwzKWLeJZ8jf5B4AaABAg.ALooQPYJhaKAM0M_0Zl5Oh,@HisNameIsEL,UChSIOdvaVyMFC3-djhTvJaQ,Lol,uk,2025-08-19T17:15:00Z,2025-08-19 13:15:00,0,2910412,41206,1375,"Tue, 16 Dec 2025 17:36:18 GMT"
5L8intrDcM0,https://www.youtube.com/watch?v=5L8intrDcM0,UgwSd3ewouNJMhwa4EV4AaABAg,@bungle3912,UCY8Setp0xWkbLanOicq3WpA,"It's funny how the 90s are now seen as this wild decade, which is kind of right. Compared to know, the 90s was a decade that was totally out of control. I loved it!",en,2025-08-14T20:14:05Z,2025-08-14 16:14:05,14,1,UgwSd3ewouNJMhwa4EV4AaABAg.ALoo5AiV6saAOWGL9pirjo,@SpinalFluidz,UC1sOvC-UDwCn3CFc_aZvusQ,Amen. I was at 3 of these places,en,2025-10-20T19:39:02Z,2025-10-20 15:39:02,0,2910412,41206,1375,"Tue, 16 Dec 2025 17:36:18 GMT"
5L8intrDcM0,https://www.youtube.com/watch?v=5L8intrDcM0,UgwRsLL0jhFv2N6NUeZ4AaABAg,@pixalmasterstudios2485,UCUyN_qVLygB7gk3pHOnOZIQ,"This feels like an anxiety-inducing type of movie, and I'm so down for it. Cillian never disappoints",en,2025-08-14T18:50:34Z,2025-08-14 14:50:34,2967,18,UgwRsLL0jhFv2N6NUeZ4AaABAg.ALoeXXGIQYIALoqccLxxuQ,@Jamietheroadrunner,UCS4nKMXIkYaUoSwGRGt4z6Q,"In a way, another Cillian movie about zombies",en,2025-08-14T20:36:15Z,2025-08-14 16:36:15,11,2910412,41206,1375,"Tue, 16 Dec 2025 17:36:18 GMT"
5L8intrDcM0,https://www.youtube.com/watch?v=5L8intrDcM0,UgwRsLL0jhFv2N6NUeZ4AaABAg,@pixalmasterstudios2485,UCUyN_qVLygB7gk3pHOnOZIQ,"This feels like an anxiety-inducing type of movie, and I'm so down for it. Cillian never disappoints",en,2025-08-14T18:50:34Z,2025-08-14 14:50:34,2967,18,UgwRsLL0jhFv2N6NUeZ4AaABAg.ALoeXXGIQYIALpv8OZNIc1,@judbaker5752,UCWvHrmVRiAo4KMJFbGOSGzg,@Jamietheroadrunner😂,NA,2025-08-15T06:34:55Z,2025-08-15 02:34:55,13,2910412,41206,1375,"Tue, 16 Dec 2025 17:36:18 GMT"
5L8intrDcM0,https://www.youtube.com/watch?v=5L8intrDcM0,UgwRsLL0jhFv2N6NUeZ4AaABAg,@pixalmasterstudios2485,UCUyN_qVLygB7gk3pHOnOZIQ,"This feels like an anxiety-inducing type of movie, and I'm so down for it. Cillian never disappoints",en,2025-08-14T18:50:34Z,2025-08-14 14:50:34,2967,18,UgwRsLL0jhFv2N6NUeZ4AaABAg.ALoeXXGIQYIALqrmv8Izg_,@markh9755,UCFAmyibS-OJXx4LRyEeCiIw,Just like uncut gems? That movie terrified me 😂,NA,2025-08-15T15:24:53Z,2025-08-15 11:24:53,8,2910412,41206,1375,"Tue, 16 Dec 2025 17:36:18 GMT"
5L8intrDcM0,https://www.youtube.com/watch?v=5L8intrDcM0,UgwRsLL0jhFv2N6NUeZ4AaABAg,@pixalmasterstudios2485,UCUyN_qVLygB7gk3pHOnOZIQ,"This feels like an anxiety-inducing type of movie, and I'm so down for it. Cillian never disappoints",en,2025-08-14T18:50:34Z,2025-08-14 14:50:34,2967,18,UgwRsLL0jhFv2N6NUeZ4AaABAg.ALoeXXGIQYIALruvFeGPO1,@GFG2gifted,UCj8uwY3nOo8XsYEj54iUrMg,"As much as Americans have anxiety issues. I don't feel this kind of genre should be glorified as a movie. To each their own, but being a product of your environment, things stick with you. I'll pass. ""Anxiety inducing"" sounds torturous. There's an entire field of medical workers trying. Desperately to defeat it and ya got goober children saying ""sign me up for anxiety"".  So bassackwards.",en,2025-08-16T01:11:28Z,2025-08-15 21:11:28,10,2910412,41206,1375,"Tue, 16 Dec 2025 17:36:18 GMT"
5L8intrDcM0,https://www.youtube.com/watch?v=5L8intrDcM0,UgwRsLL0jhFv2N6NUeZ4AaABAg,@pixalmasterstudios2485,UCUyN_qVLygB7gk3pHOnOZIQ,"This feels like an anxiety-inducing type of movie, and I'm so down for it. Cillian never disappoints",en,2025-08-14T18:50:34Z,2025-08-14 14:50:34,2967,18,UgwRsLL0jhFv2N6NUeZ4AaABAg.ALoeXXGIQYIALtPoVz-tE9,@carolinaa.figueroaamenabar5733,UCVua-NKi4TWW3dl_6JEksMg,This dude. Is like wine.,en,2025-08-16T15:09:25Z,2025-08-16 11:09:25,7,2910412,41206,1375,"Tue, 16 Dec 2025 17:36:18 GMT"
5L8intrDcM0,https://www.youtube.com/watch?v=5L8intrDcM0,UgwRsLL0jhFv2N6NUeZ4AaABAg,@pixalmasterstudios2485,UCUyN_qVLygB7gk3pHOnOZIQ,"This feels like an anxiety-inducing type of movie, and I'm so down for it. Cillian never disappoints",en,2025-08-14T18:50:34Z,2025-08-14 14:50:34,2967,18,UgwRsLL0jhFv2N6NUeZ4AaABAg.ALoeXXGIQYIALtuXoypipj,@sudeshnapal1832,UCQq7zGdTHfX5r1mS5eUi7iQ,"@GFG2gifted In what way is this glorifying anxiety issues? If all you want are feel-good movies, that’s fine, but these issues NEED to be addressed. Even now so many people don't take mental health seriously. Art isn’t meant just to make you feel comfortable.",en,2025-08-16T19:46:37Z,2025-08-16 15:46:37,13,2910412,41206,1375,"Tue, 16 Dec 2025 17:36:18 GMT"
5L8intrDcM0,https://www.youtube.com/watch?v=5L8intrDcM0,UgwRsLL0jhFv2N6NUeZ4AaABAg,@pixalmasterstudios2485,UCUyN_qVLygB7gk3pHOnOZIQ,"This feels like an anxiety-inducing type of movie, and I'm so down for it. Cillian never disappoints",en,2025-08-14T18:50:34Z,2025-08-14 14:50:34,2967,18,UgwRsLL0jhFv2N6NUeZ4AaABAg.ALoeXXGIQYIALtw8uF7zDS,@GFG2gifted,UCj8uwY3nOo8XsYEj54iUrMg,"​@sudeshnapal1832to answer your direct question directly in every way. From the sounds to the music, lights and theme. Literally all the major players. As if the thousands of comments echoing their love of anxiety inducing movies. Read the top comments and then come back here. You just like to argue it seems.",en,2025-08-16T20:00:42Z,2025-08-16 16:00:42,3,2910412,41206,1375,"Tue, 16 Dec 2025 17:36:18 GMT"
5L8intrDcM0,https://www.youtube.com/watch?v=5L8intrDcM0,UgwRsLL0jhFv2N6NUeZ4AaABAg,@pixalmasterstudios2485,UCUyN_qVLygB7gk3pHOnOZIQ,"This feels like an anxiety-inducing type of movie, and I'm so down for it. Cillian never disappoints",en,2025-08-14T18:50:34Z,2025-08-14 14:50:34,2967,18,UgwRsLL0jhFv2N6NUeZ4AaABAg.ALoeXXGIQYIALtxuAx-azi,@sudeshnapal1832,UCQq7zGdTHfX5r1mS5eUi7iQ,@GFG2gifted dude if it's not your jam then move along! Go watch Superman or something that'll brighten up your day. But don't others what content to like.,en,2025-08-16T20:16:01Z,2025-08-16 16:16:01,0,2910412,41206,1375,"Tue, 16 Dec 2025 17:36:18 GMT"
5L8intrDcM0,https://www.youtube.com/watch?v=5L8intrDcM0,UgwRsLL0jhFv2N6NUeZ4AaABAg,@pixalmasterstudios2485,UCUyN_qVLygB7gk3pHOnOZIQ,"This feels like an anxiety-inducing type of movie, and I'm so down for it. Cillian never disappoints",en,2025-08-14T18:50:34Z,2025-08-14 14:50:34,2967,18,UgwRsLL0jhFv2N6NUeZ4AaABAg.ALoeXXGIQYIALvVF2xzllI,@BogosBinted416,UCbp8KwtvAwLprbElH1r7Zzw,"Watch Small Things Like These, same director same vibe as this",en,2025-08-17T10:35:21Z,2025-08-17 06:35:21,2,2910412,41206,1375,"Tue, 16 Dec 2025 17:36:18 GMT"
