video_id,video_title,channel_id,channel_title,video_published_at,reply_id,reply_parent_comment_id,reply_author_display,reply_author_channel_id,reply_text,reply_lang,reply_published_utc,reply_published_local,reply_like_count
rDJxJd3FzDY,NONNAS | Official Trailer | Netflix,UCWOA1ZGywLbqmigxE4Qlvuw,Netflix,2025-04-09T15:00:02Z,Ugyrd6daMMsblkjI0fF4AaABAg.AGiAe2wyLalAHtrsK60lA9,Ugyrd6daMMsblkjI0fF4AaABAg,@Leslie27275,UCI4SftCousVr8LquX4cnZsA,@gabyromoroagree. I won watch anything he’s in.,jv,2025-05-09T09:17:46Z,2025-05-09 05:17:46,1
rDJxJd3FzDY,NONNAS | Official Trailer | Netflix,UCWOA1ZGywLbqmigxE4Qlvuw,Netflix,2025-04-09T15:00:02Z,Ugyrd6daMMsblkjI0fF4AaABAg.AGiAe2wyLalAHuPI5TSzP8,Ugyrd6daMMsblkjI0fF4AaABAg,@_WF23,UC4mmyoqEa9TQERR--d0upLA,@gabyromoro grow up. Smh,NA,2025-05-09T14:18:31Z,2025-05-09 10:18:31,2
rDJxJd3FzDY,NONNAS | Official Trailer | Netflix,UCWOA1ZGywLbqmigxE4Qlvuw,Netflix,2025-04-09T15:00:02Z,Ugyrd6daMMsblkjI0fF4AaABAg.AGiAe2wyLalAHv2vJHuZM5,Ugyrd6daMMsblkjI0fF4AaABAg,@wt5626,UCVFw3S3GZzw0TXBPNtRedYg,VV voted for the bad ORANGE MAN❤,da,2025-05-09T20:22:16Z,2025-05-09 16:22:16,1
rDJxJd3FzDY,NONNAS | Official Trailer | Netflix,UCWOA1ZGywLbqmigxE4Qlvuw,Netflix,2025-04-09T15:00:02Z,Ugyrd6daMMsblkjI0fF4AaABAg.AGiAe2wyLalAIQqtAcP4Yu,Ugyrd6daMMsblkjI0fF4AaABAg,@marconicliche9377,UCZg45j8TSJHRh7l4yNjSzmg,"​@selmaferdjiouiOrange Man BAD! Orange Man BAAAD!!!!
😂",NA,2025-05-22T14:03:19Z,2025-05-22 10:03:19,0
rDJxJd3FzDY,NONNAS | Official Trailer | Netflix,UCWOA1ZGywLbqmigxE4Qlvuw,Netflix,2025-04-09T15:00:02Z,UgxUflR1omkpU4MJQ_14AaABAg.AGi9djP2P_wAHz2sa6oEji,UgxUflR1omkpU4MJQ_14AaABAg,@Willy-G-Z-PartyWill,UClUIseRtm7zA92_G0ra3w4w,Agree luckily Netflix snatched it up as an Exclusive 😊,en,2025-05-11T09:38:52Z,2025-05-11 05:38:52,0
rDJxJd3FzDY,NONNAS | Official Trailer | Netflix,UCWOA1ZGywLbqmigxE4Qlvuw,Netflix,2025-04-09T15:00:02Z,Ugybgxon6psx-oUbExd4AaABAg.AGhyUFyrRkxAGmdt5ZU3Kc,Ugybgxon6psx-oUbExd4AaABAg,@wervil,UCY0tGjKthb1XbGpySj2SoiA,Is Spiritos the filming location? the movie is based on Enoteca Maria that is still open on Staten Island.,en,2025-04-11T17:29:28Z,2025-04-11 13:29:28,18
rDJxJd3FzDY,NONNAS | Official Trailer | Netflix,UCWOA1ZGywLbqmigxE4Qlvuw,Netflix,2025-04-09T15:00:02Z,Ugybgxon6psx-oUbExd4AaABAg.AGhyUFyrRkxAGsEgM8gEWV,Ugybgxon6psx-oUbExd4AaABAg,@Linawithabow-b2l,UCf-Cp5OzXKvQtcM7ZmulXrw,"Yes, It is the filming location in Elizabeth New Jersey.",en,2025-04-13T21:35:58Z,2025-04-13 17:35:58,12
rDJxJd3FzDY,NONNAS | Official Trailer | Netflix,UCWOA1ZGywLbqmigxE4Qlvuw,Netflix,2025-04-09T15:00:02Z,Ugybgxon6psx-oUbExd4AaABAg.AGhyUFyrRkxAHO_DvxtXxl,Ugybgxon6psx-oUbExd4AaABAg,@JosephSweet-s2b,UCvSbx-DcT3Z1RpQSygmMEgA,I love how you called the sauce gravy that’s such an Italian thing to do. So proud of my heritage. ❤️,en,2025-04-26T20:19:08Z,2025-04-26 16:19:08,11
rDJxJd3FzDY,NONNAS | Official Trailer | Netflix,UCWOA1ZGywLbqmigxE4Qlvuw,Netflix,2025-04-09T15:00:02Z,Ugybgxon6psx-oUbExd4AaABAg.AGhyUFyrRkxAHWePRpmOLS,Ugybgxon6psx-oUbExd4AaABAg,@lovemusic1963ify,UC5UsG_bmIzMVSE0qoLiUOgQ,Thank you for that bit of history.,en,2025-04-29T23:38:19Z,2025-04-29 19:38:19,5
rDJxJd3FzDY,NONNAS | Official Trailer | Netflix,UCWOA1ZGywLbqmigxE4Qlvuw,Netflix,2025-04-09T15:00:02Z,Ugybgxon6psx-oUbExd4AaABAg.AGhyUFyrRkxAH_lUxhThxA,Ugybgxon6psx-oUbExd4AaABAg,@markmo6535,UC-4x6YqvRdwLs2wpe9LOYsg,"Hey Deena, was your mom able to sneak out the recipe of that gravy? lol, best around",en,2025-05-01T13:57:12Z,2025-05-01 09:57:12,7
rDJxJd3FzDY,NONNAS | Official Trailer | Netflix,UCWOA1ZGywLbqmigxE4Qlvuw,Netflix,2025-04-09T15:00:02Z,Ugybgxon6psx-oUbExd4AaABAg.AGhyUFyrRkxAHkOKvfP6Rs,Ugybgxon6psx-oUbExd4AaABAg,@cmaurigi1,UCg8yRBEEECMdcRzyArVo8cA,@markmo6535 Tony Spirito makes it and sells it.,mg,2025-05-05T16:57:46Z,2025-05-05 12:57:46,0
rDJxJd3FzDY,NONNAS | Official Trailer | Netflix,UCWOA1ZGywLbqmigxE4Qlvuw,Netflix,2025-04-09T15:00:02Z,Ugybgxon6psx-oUbExd4AaABAg.AGhyUFyrRkxAHkmGzSytFa,Ugybgxon6psx-oUbExd4AaABAg,@Deena1313,UCHm0kYIvQPlPdUi6JxUdm4A,@markmo6535lol I wish!,NA,2025-05-05T20:35:41Z,2025-05-05 16:35:41,0
rDJxJd3FzDY,NONNAS | Official Trailer | Netflix,UCWOA1ZGywLbqmigxE4Qlvuw,Netflix,2025-04-09T15:00:02Z,Ugybgxon6psx-oUbExd4AaABAg.AGhyUFyrRkxAHn-WJmnKJd,Ugybgxon6psx-oUbExd4AaABAg,@hajrijedaci1735,UCTUCS51ZXWChanpcjHX7CKQ,😢😢😢😢❤❤❤❤ I got so emotional reading this. Thank you for sharing.  Say hi to your mom ❤,en,2025-05-06T17:18:35Z,2025-05-06 13:18:35,7
rDJxJd3FzDY,NONNAS | Official Trailer | Netflix,UCWOA1ZGywLbqmigxE4Qlvuw,Netflix,2025-04-09T15:00:02Z,Ugybgxon6psx-oUbExd4AaABAg.AGhyUFyrRkxAHo2Uhfn7Nz,Ugybgxon6psx-oUbExd4AaABAg,@briansvcrtaperecordings6295,UCri2dJL0Zbll2fvW46yZ_dQ,@wervilit’s right next to my job in Staten Island… I seen them shooting… so 🤷🏻‍♂️,en,2025-05-07T03:03:49Z,2025-05-06 23:03:49,4
rDJxJd3FzDY,NONNAS | Official Trailer | Netflix,UCWOA1ZGywLbqmigxE4Qlvuw,Netflix,2025-04-09T15:00:02Z,Ugybgxon6psx-oUbExd4AaABAg.AGhyUFyrRkxAHtopGhaOZd,Ugybgxon6psx-oUbExd4AaABAg,@Wakeup-An-In-Light,UCkVDTxyvi7mXzAiBM7ftDzA,I wished I knew this when I used to live in Jersey.,en,2025-05-09T08:51:08Z,2025-05-09 04:51:08,4
rDJxJd3FzDY,NONNAS | Official Trailer | Netflix,UCWOA1ZGywLbqmigxE4Qlvuw,Netflix,2025-04-09T15:00:02Z,Ugybgxon6psx-oUbExd4AaABAg.AGhyUFyrRkxAHvJteRIQqo,Ugybgxon6psx-oUbExd4AaABAg,@anthonymarra2600,UCTn1_RSu4fJc0XLt4JDxBfA,"So sad that all things must end,but by carrying it onto future generations it never really ends unless the traditions of future generations end it.",en,2025-05-09T22:50:36Z,2025-05-09 18:50:36,5
rDJxJd3FzDY,NONNAS | Official Trailer | Netflix,UCWOA1ZGywLbqmigxE4Qlvuw,Netflix,2025-04-09T15:00:02Z,Ugybgxon6psx-oUbExd4AaABAg.AGhyUFyrRkxAHvb-PwAdsv,Ugybgxon6psx-oUbExd4AaABAg,@user-jz4kw7dv9u,UCBtk2doUzpUcyxF5Ku8CssQ,This comment is WAY too long..😳🙈😂,en,2025-05-10T01:28:48Z,2025-05-09 21:28:48,0
rDJxJd3FzDY,NONNAS | Official Trailer | Netflix,UCWOA1ZGywLbqmigxE4Qlvuw,Netflix,2025-04-09T15:00:02Z,Ugybgxon6psx-oUbExd4AaABAg.AGhyUFyrRkxAHxLl80Scj5,Ugybgxon6psx-oUbExd4AaABAg,@Lissa102,UCjKPljRYJRTeqQlXLLjjIYA,The movie is not based on Spirito’s. It’s based on enoteca maria  that’s still open on Staten Island. Spirito’s was just the filming location I believe.,en,2025-05-10T17:45:24Z,2025-05-10 13:45:24,4
rDJxJd3FzDY,NONNAS | Official Trailer | Netflix,UCWOA1ZGywLbqmigxE4Qlvuw,Netflix,2025-04-09T15:00:02Z,Ugybgxon6psx-oUbExd4AaABAg.AGhyUFyrRkxAHzgpANinIz,Ugybgxon6psx-oUbExd4AaABAg,@CuchiGarciaPlaja,UCJyAh6a3i2B45Du2jfvQ_oQ,Is on Netflix now.. i love the movie!,en,2025-05-11T15:36:40Z,2025-05-11 11:36:40,2
rDJxJd3FzDY,NONNAS | Official Trailer | Netflix,UCWOA1ZGywLbqmigxE4Qlvuw,Netflix,2025-04-09T15:00:02Z,Ugybgxon6psx-oUbExd4AaABAg.AGhyUFyrRkxAI-0ItIz7Hj,Ugybgxon6psx-oUbExd4AaABAg,@redbeard36,UCisE8vS6EoqF55M_KZD4eMw,Cool information! thanks!,en,2025-05-11T18:35:37Z,2025-05-11 14:35:37,2
rDJxJd3FzDY,NONNAS | Official Trailer | Netflix,UCWOA1ZGywLbqmigxE4Qlvuw,Netflix,2025-04-09T15:00:02Z,Ugybgxon6psx-oUbExd4AaABAg.AGhyUFyrRkxAI-iBm-Wp7M,Ugybgxon6psx-oUbExd4AaABAg,@Bubblebunzz,UCyAM76Y3zxTyr737qCyF02Q,Im confused its not about Spiritos tho?,en,2025-05-12T01:07:51Z,2025-05-11 21:07:51,1
rDJxJd3FzDY,NONNAS | Official Trailer | Netflix,UCWOA1ZGywLbqmigxE4Qlvuw,Netflix,2025-04-09T15:00:02Z,Ugybgxon6psx-oUbExd4AaABAg.AGhyUFyrRkxAI-laj8L1Zg,Ugybgxon6psx-oUbExd4AaABAg,@redbeard36,UCisE8vS6EoqF55M_KZD4eMw,@Bubblebunzz It's based on Enoteco Maria but filmed at Spiritos location.,en,2025-05-12T01:37:37Z,2025-05-11 21:37:37,5
rDJxJd3FzDY,NONNAS | Official Trailer | Netflix,UCWOA1ZGywLbqmigxE4Qlvuw,Netflix,2025-04-09T15:00:02Z,Ugybgxon6psx-oUbExd4AaABAg.AGhyUFyrRkxAI-uVc1NEa7,Ugybgxon6psx-oUbExd4AaABAg,@NicoleE12388,UCQUgeajxVUElb2JmUggdI_w,I remember being a kid and walking through the kitchen to get to the bathroom,en,2025-05-12T02:55:26Z,2025-05-11 22:55:26,3
rDJxJd3FzDY,NONNAS | Official Trailer | Netflix,UCWOA1ZGywLbqmigxE4Qlvuw,Netflix,2025-04-09T15:00:02Z,Ugybgxon6psx-oUbExd4AaABAg.AGhyUFyrRkxAI1LX3lV7_d,Ugybgxon6psx-oUbExd4AaABAg,@loist9022,UCWT9JdzeMiqTMj21BtPoe5A,Wonderful.  Thanks for your history.,en,2025-05-12T16:19:32Z,2025-05-12 12:19:32,2
rDJxJd3FzDY,NONNAS | Official Trailer | Netflix,UCWOA1ZGywLbqmigxE4Qlvuw,Netflix,2025-04-09T15:00:02Z,Ugybgxon6psx-oUbExd4AaABAg.AGhyUFyrRkxAI1f4uE44M9,Ugybgxon6psx-oUbExd4AaABAg,@donjonestv,UCuiEx-bh-QsHwAlPiD7mbgA,I hear the one in New York is open,en,2025-05-12T19:19:11Z,2025-05-12 15:19:11,1
rDJxJd3FzDY,NONNAS | Official Trailer | Netflix,UCWOA1ZGywLbqmigxE4Qlvuw,Netflix,2025-04-09T15:00:02Z,Ugybgxon6psx-oUbExd4AaABAg.AGhyUFyrRkxAI1jaRLtdZ8,Ugybgxon6psx-oUbExd4AaABAg,@MitsyMoo13,UCsKO14zdaA_c6WKSNuhSS4Q,This made me cry.,en,2025-05-12T19:58:35Z,2025-05-12 15:58:35,2
rDJxJd3FzDY,NONNAS | Official Trailer | Netflix,UCWOA1ZGywLbqmigxE4Qlvuw,Netflix,2025-04-09T15:00:02Z,Ugybgxon6psx-oUbExd4AaABAg.AGhyUFyrRkxAI3H_Gr4PBc,Ugybgxon6psx-oUbExd4AaABAg,@Deena1313,UCHm0kYIvQPlPdUi6JxUdm4A,@markmo6535lol I WISH!!!!,NA,2025-05-13T10:23:30Z,2025-05-13 06:23:30,0
rDJxJd3FzDY,NONNAS | Official Trailer | Netflix,UCWOA1ZGywLbqmigxE4Qlvuw,Netflix,2025-04-09T15:00:02Z,Ugybgxon6psx-oUbExd4AaABAg.AGhyUFyrRkxAI3HmUgtzhR,Ugybgxon6psx-oUbExd4AaABAg,@Deena1313,UCHm0kYIvQPlPdUi6JxUdm4A,"@Lissa102yes, exactly. It was just the filming location  but they did tie the history of it into the story which was awesome!",en,2025-05-13T10:25:18Z,2025-05-13 06:25:18,1
rDJxJd3FzDY,NONNAS | Official Trailer | Netflix,UCWOA1ZGywLbqmigxE4Qlvuw,Netflix,2025-04-09T15:00:02Z,Ugybgxon6psx-oUbExd4AaABAg.AGhyUFyrRkxAI3HwM8_MIx,Ugybgxon6psx-oUbExd4AaABAg,@Deena1313,UCHm0kYIvQPlPdUi6JxUdm4A,@NicoleE12388haha yep! ❤️,sn,2025-05-13T10:26:39Z,2025-05-13 06:26:39,0
rDJxJd3FzDY,NONNAS | Official Trailer | Netflix,UCWOA1ZGywLbqmigxE4Qlvuw,Netflix,2025-04-09T15:00:02Z,Ugybgxon6psx-oUbExd4AaABAg.AGhyUFyrRkxAI3IQPAw6dV,Ugybgxon6psx-oUbExd4AaABAg,@Deena1313,UCHm0kYIvQPlPdUi6JxUdm4A,@donjonestvthe restaurant that the movie is about is in Staten Island NY and it is open. Spiritos in Elizabeth NJ is where the movie was filmed but it’s not related to the restaurant in NY. It was just the filming location but it had such an awesome history that little bits about it were written into the script.,en,2025-05-13T10:30:53Z,2025-05-13 06:30:53,0
rDJxJd3FzDY,NONNAS | Official Trailer | Netflix,UCWOA1ZGywLbqmigxE4Qlvuw,Netflix,2025-04-09T15:00:02Z,Ugybgxon6psx-oUbExd4AaABAg.AGhyUFyrRkxAI3YTIc_-Em,Ugybgxon6psx-oUbExd4AaABAg,@ron07036,UCSUnDLeMOqpQwnu6IjRwaqg,"No butter, dessert, parking, or credit cards, but the ravioli and pizza were delicious. This place was a unique treasure, thank you Spirito family.  If phony enthusiasm and friendliness in a cookie cutter environment are your thing, go to Applebee or Olive Garden. The timeless ambiance of Spirito's was not for everyone.",en,2025-05-13T12:51:06Z,2025-05-13 08:51:06,0
rDJxJd3FzDY,NONNAS | Official Trailer | Netflix,UCWOA1ZGywLbqmigxE4Qlvuw,Netflix,2025-04-09T15:00:02Z,Ugybgxon6psx-oUbExd4AaABAg.AGhyUFyrRkxAI3x0-mud2O,Ugybgxon6psx-oUbExd4AaABAg,@JBR-z75,UCZfploB5TPNXGbBw2MihKwg,"@Lissa102exactly, the movie literally stated the resto is still open 😭",en,2025-05-13T16:34:17Z,2025-05-13 12:34:17,1
rDJxJd3FzDY,NONNAS | Official Trailer | Netflix,UCWOA1ZGywLbqmigxE4Qlvuw,Netflix,2025-04-09T15:00:02Z,Ugybgxon6psx-oUbExd4AaABAg.AGhyUFyrRkxAI4mO7ISBDN,Ugybgxon6psx-oUbExd4AaABAg,@catanthiadover2698,UCcs1dG390Mqt5SLFAu1EGZg,Thank you for writing that you made me and a lot of people smile!,en,2025-05-14T00:20:42Z,2025-05-13 20:20:42,1
rDJxJd3FzDY,NONNAS | Official Trailer | Netflix,UCWOA1ZGywLbqmigxE4Qlvuw,Netflix,2025-04-09T15:00:02Z,Ugybgxon6psx-oUbExd4AaABAg.AGhyUFyrRkxAI74X2vg4fB,Ugybgxon6psx-oUbExd4AaABAg,@Lily01824,UCGjagrTJt4duxr3bBAAlhnA,I truly enjoyed reading this thank you for sharing 💕,en,2025-05-14T21:46:26Z,2025-05-14 17:46:26,1
rDJxJd3FzDY,NONNAS | Official Trailer | Netflix,UCWOA1ZGywLbqmigxE4Qlvuw,Netflix,2025-04-09T15:00:02Z,Ugybgxon6psx-oUbExd4AaABAg.AGhyUFyrRkxAIBuMAp6nrd,Ugybgxon6psx-oUbExd4AaABAg,@pauly260,UCd_Sj3vqu2qN9TLTd0DE1wQ,SPIRITO’S was the best Italian restaurant in all of northern New Jersey. My family has been going there for three generations. Their veal was out of this world. May she Rest In Peace.,en,2025-05-16T18:45:01Z,2025-05-16 14:45:01,2
rDJxJd3FzDY,NONNAS | Official Trailer | Netflix,UCWOA1ZGywLbqmigxE4Qlvuw,Netflix,2025-04-09T15:00:02Z,Ugybgxon6psx-oUbExd4AaABAg.AGhyUFyrRkxAKUg6vNzL9A,Ugybgxon6psx-oUbExd4AaABAg,@HeartSongRadio,UCgu1fgH_OVDSeIHyg7dLE5Q,"The Nonnas movie on Netflix is based on the true story of Jody “Joe” Scaravella and the real-life Enoteca Maria restaurant in New York City, an Italian restaurant that employs grandmothers, or nonnas, as chefs. Enoteca Maria opened in Staten Island in 2007, and still operates to this day. 

Scaravella first opened Enoteca Maria back in 2007, after moving from Brooklyn to Staten Island in 2006. According to a 2017 New York Times profile, the restaurant owner’s mother had recently passed, just a few years after Scaravella’s grandmother died in 1999. Though not shown in the movie, the real Scaravella also lost a sister around the same time.

“After losing all those matriarchal figures in my life, I wanted to try to recreate that, you know, grandma in the kitchen cooking,” Scaravella told the Times.",en,2025-07-12T18:48:58Z,2025-07-12 14:48:58,1
rDJxJd3FzDY,NONNAS | Official Trailer | Netflix,UCWOA1ZGywLbqmigxE4Qlvuw,Netflix,2025-04-09T15:00:02Z,Ugybgxon6psx-oUbExd4AaABAg.AGhyUFyrRkxAN1ceKdNwJk,Ugybgxon6psx-oUbExd4AaABAg,@AmandaL-cj4fj,UCJjAgesvEUrews1pMs_nUrA,It’s not permanently closed it’s still open three days a week its in Staten Island I think you are thinking of spritos,en,2025-09-14T01:34:55Z,2025-09-13 21:34:55,0
rDJxJd3FzDY,NONNAS | Official Trailer | Netflix,UCWOA1ZGywLbqmigxE4Qlvuw,Netflix,2025-04-09T15:00:02Z,Ugybgxon6psx-oUbExd4AaABAg.AGhyUFyrRkxAO-Qza7WFeu,Ugybgxon6psx-oUbExd4AaABAg,@Deena1313,UCHm0kYIvQPlPdUi6JxUdm4A,"@AmandaL-cj4fjyes, I am absolutely referring to Spiritos. 😊 Yes, the Staten Island restaurant that was the subject of the movie is still open, but Spiritos where it was filmed is permanently closed. 😢",en,2025-10-08T01:37:08Z,2025-10-07 21:37:08,0
rDJxJd3FzDY,NONNAS | Official Trailer | Netflix,UCWOA1ZGywLbqmigxE4Qlvuw,Netflix,2025-04-09T15:00:02Z,UgxoqnHwFhLqhJ2lGd54AaABAg.AGhtp4Wzo-uAGk6bthVQrO,UgxoqnHwFhLqhJ2lGd54AaABAg,@nebraskawaters8791,UCU6lTAwdXCDC6mcbhTdguJQ,Literally I was like she in her 70s and she still fine😅,en,2025-04-10T17:51:32Z,2025-04-10 13:51:32,6
rDJxJd3FzDY,NONNAS | Official Trailer | Netflix,UCWOA1ZGywLbqmigxE4Qlvuw,Netflix,2025-04-09T15:00:02Z,UgxoqnHwFhLqhJ2lGd54AaABAg.AGhtp4Wzo-uAGv-XkWgRAB,UgxoqnHwFhLqhJ2lGd54AaABAg,@ZukoHalliwell,UCx13un4erukmhQ87E-jDliw,Her beauty is only skin deep.,en,2025-04-14T23:21:19Z,2025-04-14 19:21:19,1
rDJxJd3FzDY,NONNAS | Official Trailer | Netflix,UCWOA1ZGywLbqmigxE4Qlvuw,Netflix,2025-04-09T15:00:02Z,UgxoqnHwFhLqhJ2lGd54AaABAg.AGhtp4Wzo-uAGv1oClRiLS,UgxoqnHwFhLqhJ2lGd54AaABAg,@royjones8312,UC-fql7Mk_WXHcqTP1XGRD0g,"@ yup, that's all I can tell without knowing her.",en,2025-04-14T23:41:10Z,2025-04-14 19:41:10,1
rDJxJd3FzDY,NONNAS | Official Trailer | Netflix,UCWOA1ZGywLbqmigxE4Qlvuw,Netflix,2025-04-09T15:00:02Z,UgxoqnHwFhLqhJ2lGd54AaABAg.AGhtp4Wzo-uAGvF9X1sIvB,UgxoqnHwFhLqhJ2lGd54AaABAg,@user-zq5il1bz8p,UC12JGYkmG4NmfnSK9OiL8YA,@nebraskawaters8791 She's basically 80! 79 later this year! This woman is crazy!! Love her!,en,2025-04-15T01:37:49Z,2025-04-14 21:37:49,2
rDJxJd3FzDY,NONNAS | Official Trailer | Netflix,UCWOA1ZGywLbqmigxE4Qlvuw,Netflix,2025-04-09T15:00:02Z,UgxoqnHwFhLqhJ2lGd54AaABAg.AGhtp4Wzo-uAHWH5dqBYx-,UgxoqnHwFhLqhJ2lGd54AaABAg,@JJB-unleased,UCZTE17NlXfY6QDi1hmz2Alg,"Photogenic gift.  She's always looked great, but very common looking in person, still attractive.",en,2025-04-29T20:05:54Z,2025-04-29 16:05:54,0
rDJxJd3FzDY,NONNAS | Official Trailer | Netflix,UCWOA1ZGywLbqmigxE4Qlvuw,Netflix,2025-04-09T15:00:02Z,UgxoqnHwFhLqhJ2lGd54AaABAg.AGhtp4Wzo-uAHWkzltBJH-,UgxoqnHwFhLqhJ2lGd54AaABAg,@dannywhiter9704,UCmbpp9D8aRJPzKYAIYdKSPg,She's also part Italian!,NA,2025-04-30T00:35:51Z,2025-04-29 20:35:51,3
rDJxJd3FzDY,NONNAS | Official Trailer | Netflix,UCWOA1ZGywLbqmigxE4Qlvuw,Netflix,2025-04-09T15:00:02Z,UgxoqnHwFhLqhJ2lGd54AaABAg.AGhtp4Wzo-uAI-1rTuAvcn,UgxoqnHwFhLqhJ2lGd54AaABAg,@TheLordCrane,UCWUaAkrg9NlcjfD6izVZgDQ,@royjones8312 half sicilian is why,es,2025-05-11T18:49:13Z,2025-05-11 14:49:13,0
rDJxJd3FzDY,NONNAS | Official Trailer | Netflix,UCWOA1ZGywLbqmigxE4Qlvuw,Netflix,2025-04-09T15:00:02Z,UgxoqnHwFhLqhJ2lGd54AaABAg.AGhtp4Wzo-uAIoixA9uRN2,UgxoqnHwFhLqhJ2lGd54AaABAg,@firecrackerjack68,UC6LjHp8wmg8_z54Cgj3SRJA,"Or you can say Susan Sarandon is beautiful. Why the need of peppering simple vocab, OP?",en,2025-06-01T05:54:58Z,2025-06-01 01:54:58,0
rDJxJd3FzDY,NONNAS | Official Trailer | Netflix,UCWOA1ZGywLbqmigxE4Qlvuw,Netflix,2025-04-09T15:00:02Z,UgxoqnHwFhLqhJ2lGd54AaABAg.AGhtp4Wzo-uAIok9TR1ILw,UgxoqnHwFhLqhJ2lGd54AaABAg,@royjones8312,UC-fql7Mk_WXHcqTP1XGRD0g,@firecrackerjack68cuz I'm dumb af.,ca,2025-06-01T06:05:32Z,2025-06-01 02:05:32,0
rDJxJd3FzDY,NONNAS | Official Trailer | Netflix,UCWOA1ZGywLbqmigxE4Qlvuw,Netflix,2025-04-09T15:00:02Z,UgxoqnHwFhLqhJ2lGd54AaABAg.AGhtp4Wzo-uAIpjySdI0yt,UgxoqnHwFhLqhJ2lGd54AaABAg,@TheLordCrane,UCWUaAkrg9NlcjfD6izVZgDQ,Shut it​@firecrackerjack68,fy,2025-06-01T15:23:08Z,2025-06-01 11:23:08,0
rDJxJd3FzDY,NONNAS | Official Trailer | Netflix,UCWOA1ZGywLbqmigxE4Qlvuw,Netflix,2025-04-09T15:00:02Z,UgxoqnHwFhLqhJ2lGd54AaABAg.AGhtp4Wzo-uAJelcdDlxw8,UgxoqnHwFhLqhJ2lGd54AaABAg,@descartes_8696,UC8P9zl8yhGC5SMjo7JxWKxg,That’s how I feel about Lorraine Bracco,NA,2025-06-22T05:37:22Z,2025-06-22 01:37:22,1
rDJxJd3FzDY,NONNAS | Official Trailer | Netflix,UCWOA1ZGywLbqmigxE4Qlvuw,Netflix,2025-04-09T15:00:02Z,UgxbDIcGCKo92ws3KRl4AaABAg.AGhlKeCihO5AGi-NQygTgp,UgxbDIcGCKo92ws3KRl4AaABAg,@jpzy1jpzy146,UCcoUUrXSmA-k8jNjT1iWlew,Leave it to weird liberals to inject politics into a family movie,en,2025-04-09T22:09:46Z,2025-04-09 18:09:46,0
rDJxJd3FzDY,NONNAS | Official Trailer | Netflix,UCWOA1ZGywLbqmigxE4Qlvuw,Netflix,2025-04-09T15:00:02Z,UgxbDIcGCKo92ws3KRl4AaABAg.AGhlKeCihO5AHvGR4hw-tB,UgxbDIcGCKo92ws3KRl4AaABAg,@SensibleShoesSaveLives,UCtozYX_oj_ZIJcPoyjSfGlw,It’s a good movie!,NA,2025-05-09T22:20:20Z,2025-05-09 18:20:20,0
rDJxJd3FzDY,NONNAS | Official Trailer | Netflix,UCWOA1ZGywLbqmigxE4Qlvuw,Netflix,2025-04-09T15:00:02Z,UgzKdDz2YBUc0PIEu-N4AaABAg.AGhi6FEEKJCAGiVKPxeK7i,UgzKdDz2YBUc0PIEu-N4AaABAg,@downtoearth74,UC8ihNVMhmrKD_OnIUnGwQcw,"have you seen Wedding Crashers , really good",en,2025-04-10T02:48:59Z,2025-04-09 22:48:59,2
rDJxJd3FzDY,NONNAS | Official Trailer | Netflix,UCWOA1ZGywLbqmigxE4Qlvuw,Netflix,2025-04-09T15:00:02Z,UgzKdDz2YBUc0PIEu-N4AaABAg.AGhi6FEEKJCAHvGfpIbtCa,UgzKdDz2YBUc0PIEu-N4AaABAg,@SensibleShoesSaveLives,UCtozYX_oj_ZIJcPoyjSfGlw,Dodge Ball was sooo funny & good!  😂,so,2025-05-09T22:22:29Z,2025-05-09 18:22:29,0
rDJxJd3FzDY,NONNAS | Official Trailer | Netflix,UCWOA1ZGywLbqmigxE4Qlvuw,Netflix,2025-04-09T15:00:02Z,UgzKdDz2YBUc0PIEu-N4AaABAg.AGhi6FEEKJCAHvvhhbUUJQ,UgzKdDz2YBUc0PIEu-N4AaABAg,@FMFvideos,UCkk1_lhO84Fx5zi1-d4sQkQ,@dorothybobo5157 Ok Dodgeball was good but not because of vince.,NA,2025-05-10T04:29:45Z,2025-05-10 00:29:45,0
rDJxJd3FzDY,NONNAS | Official Trailer | Netflix,UCWOA1ZGywLbqmigxE4Qlvuw,Netflix,2025-04-09T15:00:02Z,UgzKdDz2YBUc0PIEu-N4AaABAg.AGhi6FEEKJCAHxoWokZUd-,UgzKdDz2YBUc0PIEu-N4AaABAg,@SensibleShoesSaveLives,UCtozYX_oj_ZIJcPoyjSfGlw,@FMFvideosyeah. Ben Stiller & Rip Torn,lb,2025-05-10T22:05:26Z,2025-05-10 18:05:26,0
rDJxJd3FzDY,NONNAS | Official Trailer | Netflix,UCWOA1ZGywLbqmigxE4Qlvuw,Netflix,2025-04-09T15:00:02Z,UgyQ_Y6zgz3wJ0e5ijN4AaABAg.AGhdsp9BQLYAGheJqKd9c8,UgyQ_Y6zgz3wJ0e5ijN4AaABAg,@wangfoo2693,UCQSMATeuBOS2Th2So_H640A,I don’t know who Lisa Ann Walter is but I do know who Lisa Ann is,en,2025-04-09T18:57:03Z,2025-04-09 14:57:03,0
rDJxJd3FzDY,NONNAS | Official Trailer | Netflix,UCWOA1ZGywLbqmigxE4Qlvuw,Netflix,2025-04-09T15:00:02Z,Ugz0iIb2_VTt6rBjL914AaABAg.AGhdQKXJmEhAIEog9QKHCM,Ugz0iIb2_VTt6rBjL914AaABAg,@randyfroelich,UCnT1mS4JhZcqaXcoADM0Amw,love her acting,en,2025-05-17T21:53:11Z,2025-05-17 17:53:11,0
rDJxJd3FzDY,NONNAS | Official Trailer | Netflix,UCWOA1ZGywLbqmigxE4Qlvuw,Netflix,2025-04-09T15:00:02Z,Ugx9hWc7N15rCjnBg8Z4AaABAg.AGh_v2z-2wbAGiV0cW_gAF,Ugx9hWc7N15rCjnBg8Z4AaABAg,@downtoearth74,UC8ihNVMhmrKD_OnIUnGwQcw,I was wondering the same .,en,2025-04-10T02:46:17Z,2025-04-09 22:46:17,0
rDJxJd3FzDY,NONNAS | Official Trailer | Netflix,UCWOA1ZGywLbqmigxE4Qlvuw,Netflix,2025-04-09T15:00:02Z,Ugx9hWc7N15rCjnBg8Z4AaABAg.AGh_v2z-2wbAGtioe-us3b,Ugx9hWc7N15rCjnBg8Z4AaABAg,@janetpaquette9732,UC8jTOEKW7ZmIUHBf3oNeR5Q,"Yes, her mother is full Italian. Susan’s sister is a good friend of mine so I’ve heard all the family stories. 🇮🇹",en,2025-04-14T11:27:14Z,2025-04-14 07:27:14,3
rDJxJd3FzDY,NONNAS | Official Trailer | Netflix,UCWOA1ZGywLbqmigxE4Qlvuw,Netflix,2025-04-09T15:00:02Z,UgwinE--ThiUUJ1n6NF4AaABAg.AGh_fOXh84MAGhuJjIZO_q,UgwinE--ThiUUJ1n6NF4AaABAg,@Deena1313,UCHm0kYIvQPlPdUi6JxUdm4A,It was also filmed at Spiritos in Elizabeth after they closed permanently. 😢,en,2025-04-09T21:16:50Z,2025-04-09 17:16:50,5
rDJxJd3FzDY,NONNAS | Official Trailer | Netflix,UCWOA1ZGywLbqmigxE4Qlvuw,Netflix,2025-04-09T15:00:02Z,UgwinE--ThiUUJ1n6NF4AaABAg.AGh_fOXh84MAGiGjJpBxBy,UgwinE--ThiUUJ1n6NF4AaABAg,@thehypnoticdog6682,UCAW9oicsM2bEBqTEebFByUg,Been to Nonnas a few times. Each night different nonnas cook their style of cuisine. It’s a small but fun place not far from the ferry,en,2025-04-10T00:41:27Z,2025-04-09 20:41:27,3
rDJxJd3FzDY,NONNAS | Official Trailer | Netflix,UCWOA1ZGywLbqmigxE4Qlvuw,Netflix,2025-04-09T15:00:02Z,UgwinE--ThiUUJ1n6NF4AaABAg.AGh_fOXh84MAHw9H7m4jcZ,UgwinE--ThiUUJ1n6NF4AaABAg,@IAmChiefMalatahk,UCRyeRXzqifZKGpVPVmeEdCA,@Deena1313 can I order from your mother? Please I’ll bring my own butter too. lol.,en,2025-05-10T06:37:03Z,2025-05-10 02:37:03,0
rDJxJd3FzDY,NONNAS | Official Trailer | Netflix,UCWOA1ZGywLbqmigxE4Qlvuw,Netflix,2025-04-09T15:00:02Z,Ugw1CFqY34R8KdW9Ash4AaABAg.AGhY9i5A6R8AHvEnTeCdWD,Ugw1CFqY34R8KdW9Ash4AaABAg,@SensibleShoesSaveLives,UCtozYX_oj_ZIJcPoyjSfGlw,Just now watching the movie on Netflix. Got me teary eyed missing my mom & grandma. We’re not Italian but the feeling is universal: “it hurts when they’re gone.”  🥹,en,2025-05-09T22:06:03Z,2025-05-09 18:06:03,3
rDJxJd3FzDY,NONNAS | Official Trailer | Netflix,UCWOA1ZGywLbqmigxE4Qlvuw,Netflix,2025-04-09T15:00:02Z,Ugw1CFqY34R8KdW9Ash4AaABAg.AGhY9i5A6R8AI8foG3NbPa,Ugw1CFqY34R8KdW9Ash4AaABAg,@HECTORVIT-m8x,UCdLIq-DTeTWnCa4-r4zS0Gg,What day does start and end in you tube,en,2025-05-15T12:40:12Z,2025-05-15 08:40:12,0
rDJxJd3FzDY,NONNAS | Official Trailer | Netflix,UCWOA1ZGywLbqmigxE4Qlvuw,Netflix,2025-04-09T15:00:02Z,Ugw1CFqY34R8KdW9Ash4AaABAg.AGhY9i5A6R8AIEoRdUz3lr,Ugw1CFqY34R8KdW9Ash4AaABAg,@randyfroelich,UCnT1mS4JhZcqaXcoADM0Amw,@HECTORVIT-m8x its on Netflix,hu,2025-05-17T21:51:04Z,2025-05-17 17:51:04,0
rDJxJd3FzDY,NONNAS | Official Trailer | Netflix,UCWOA1ZGywLbqmigxE4Qlvuw,Netflix,2025-04-09T15:00:02Z,UgwY2hcirbhXxRzk5X94AaABAg.AGhV2R-CcPoAGjbBFlttMb,UgwY2hcirbhXxRzk5X94AaABAg,@geoffoldread7684,UC7rt7FzZUW_-ir5jfQW1jQQ,@Bryan-Priime From boredom?,NA,2025-04-10T13:08:08Z,2025-04-10 09:08:08,1
rDJxJd3FzDY,NONNAS | Official Trailer | Netflix,UCWOA1ZGywLbqmigxE4Qlvuw,Netflix,2025-04-09T15:00:02Z,UgwY2hcirbhXxRzk5X94AaABAg.AGhV2R-CcPoAGjiGvqMAU_,UgwY2hcirbhXxRzk5X94AaABAg,@jacquelineking114,UCK4QGdr2knIkXbYCMWj8R_Q,Me too,mi,2025-04-10T14:10:05Z,2025-04-10 10:10:05,4
rDJxJd3FzDY,NONNAS | Official Trailer | Netflix,UCWOA1ZGywLbqmigxE4Qlvuw,Netflix,2025-04-09T15:00:02Z,UgwY2hcirbhXxRzk5X94AaABAg.AGhV2R-CcPoAGjih-LSNT2,UgwY2hcirbhXxRzk5X94AaABAg,@Bryan-Priime,UCnP-Vogba3QGyezCplHBpgQ,@ lol…it’s just a sweet story…and made me miss my Grandma’s cooking.,en,2025-04-10T14:13:46Z,2025-04-10 10:13:46,7
rDJxJd3FzDY,NONNAS | Official Trailer | Netflix,UCWOA1ZGywLbqmigxE4Qlvuw,Netflix,2025-04-09T15:00:02Z,UgwY2hcirbhXxRzk5X94AaABAg.AGhV2R-CcPoAGjw7mZGiuo,UgwY2hcirbhXxRzk5X94AaABAg,@htth613,UCO7q5agxhg4d-gCqLOdXEOA,Passion Sunday: Sanctification of Our Speech by Sensus Fidelium.,en,2025-04-10T16:11:10Z,2025-04-10 12:11:10,2
rDJxJd3FzDY,NONNAS | Official Trailer | Netflix,UCWOA1ZGywLbqmigxE4Qlvuw,Netflix,2025-04-09T15:00:02Z,UgwY2hcirbhXxRzk5X94AaABAg.AGhV2R-CcPoAGm2IOaFz1l,UgwY2hcirbhXxRzk5X94AaABAg,@lilachodan4941,UC5ltqlL8vg78Al9Ik-gAZZQ,Same,NA,2025-04-11T11:52:16Z,2025-04-11 07:52:16,2
rDJxJd3FzDY,NONNAS | Official Trailer | Netflix,UCWOA1ZGywLbqmigxE4Qlvuw,Netflix,2025-04-09T15:00:02Z,UgwY2hcirbhXxRzk5X94AaABAg.AGhV2R-CcPoAHxXbpCevFR,UgwY2hcirbhXxRzk5X94AaABAg,@Guillermo_Carratero,UCFy8g9WPZ76QWpQkCMFCSlg,I feel ya man..,ig,2025-05-10T19:28:58Z,2025-05-10 15:28:58,2
rDJxJd3FzDY,NONNAS | Official Trailer | Netflix,UCWOA1ZGywLbqmigxE4Qlvuw,Netflix,2025-04-09T15:00:02Z,UgwY2hcirbhXxRzk5X94AaABAg.AGhV2R-CcPoAI7NFqifka6,UgwY2hcirbhXxRzk5X94AaABAg,@superdad8274,UCLMLkR4A5wNqCh0lCMhDJhw,@geoffoldread7684you did not like it?,NA,2025-05-15T00:30:06Z,2025-05-14 20:30:06,0
rDJxJd3FzDY,NONNAS | Official Trailer | Netflix,UCWOA1ZGywLbqmigxE4Qlvuw,Netflix,2025-04-09T15:00:02Z,UgwY2hcirbhXxRzk5X94AaABAg.AGhV2R-CcPoAI7Nf1z5osr,UgwY2hcirbhXxRzk5X94AaABAg,@SebWentLegit,UCamtOYztNgbDB_wG48twGtg,@geoffoldread7684 u most be 10 buddy then,cy,2025-05-15T00:33:41Z,2025-05-14 20:33:41,0
rDJxJd3FzDY,NONNAS | Official Trailer | Netflix,UCWOA1ZGywLbqmigxE4Qlvuw,Netflix,2025-04-09T15:00:02Z,Ugyr6ZJFrO_NlljxtTt4AaABAg.AGhPTDvwothAGhT2jn7V5P,Ugyr6ZJFrO_NlljxtTt4AaABAg,@kk_romeow,UCA27_3bvEFBRiO9lw7zUeSA,it's a movie so no worry on that,en,2025-04-09T17:09:52Z,2025-04-09 13:09:52,2
