video_id,video_title,channel_id,channel_title,video_published_at,reply_id,reply_parent_comment_id,reply_author_display,reply_author_channel_id,reply_text,reply_lang,reply_published_utc,reply_published_local,reply_like_count
rDJxJd3FzDY,NONNAS | Official Trailer | Netflix,UCWOA1ZGywLbqmigxE4Qlvuw,Netflix,2025-04-09T15:00:02Z,Ugz7BUp391Y-WXo8ieF4AaABAg.AHwXq9Wv0_JAIpibCE1trE,Ugz7BUp391Y-WXo8ieF4AaABAg,@RocStarr913,UCKOOLdK8nR_9OOvamULrNPA,It could have been better had they polished up the script more and hired a more skilled director.,en,2025-06-01T15:11:13Z,2025-06-01 11:11:13,0
rDJxJd3FzDY,NONNAS | Official Trailer | Netflix,UCWOA1ZGywLbqmigxE4Qlvuw,Netflix,2025-04-09T15:00:02Z,Ugyg0CoakazidvOWrHZ4AaABAg.AHwL7j4GqEEAI6OE5C928h,Ugyg0CoakazidvOWrHZ4AaABAg,@eyerememberufromthefuture5846,UCuU8KTZMJCadCGA0Vt_DezA,"I'm Sicilian so I understand your critique. However I also recognize that the movie was made for a broader audience. To me, that's where some of the authenticity is lost, but I thought it was great overall. American films are generally not known for their nuance, and movies about other cultures are usually steeped in stereotypes. It's not an Italian film after all so I cut them some slack. The fact that nonnas are being uplifted and celebrated for the incredibly strong, loving, talented and family-oriented women that they are was more than enough to make this film worthwhile. I can think of very few films that focus as much on the beauty and heart of Italian-American women.",en,2025-05-14T15:19:21Z,2025-05-14 11:19:21,0
rDJxJd3FzDY,NONNAS | Official Trailer | Netflix,UCWOA1ZGywLbqmigxE4Qlvuw,Netflix,2025-04-09T15:00:02Z,UgzpTJrB6NJ33roQJ7x4AaABAg.AHw-bU-23D3AHyEPLBo8p9,UgzpTJrB6NJ33roQJ7x4AaABAg,@JenHoegeman,UCraOOJ_OqZEraHYrYh9ZvCA,It’s an Italian colloquialism.  Unclench your hole.,en,2025-05-11T02:00:21Z,2025-05-10 22:00:21,1
rDJxJd3FzDY,NONNAS | Official Trailer | Netflix,UCWOA1ZGywLbqmigxE4Qlvuw,Netflix,2025-04-09T15:00:02Z,UgzpTJrB6NJ33roQJ7x4AaABAg.AHw-bU-23D3AIDsoWQ12vo,UgzpTJrB6NJ33roQJ7x4AaABAg,@gnamorfra,UC_30ldl6S6NY-lZwpOZX8Ug,"​@JenHoegemanit's not an Italian colloquialism, it's Italian American slang.  Unknown in Italy",NA,2025-05-17T13:10:02Z,2025-05-17 09:10:02,0
rDJxJd3FzDY,NONNAS | Official Trailer | Netflix,UCWOA1ZGywLbqmigxE4Qlvuw,Netflix,2025-04-09T15:00:02Z,UgywiFG_Xk_gtamsNux4AaABAg.AHv2hXarxYhAHvGDCe3SWU,UgywiFG_Xk_gtamsNux4AaABAg,@SensibleShoesSaveLives,UCtozYX_oj_ZIJcPoyjSfGlw,😂,ja,2025-05-09T22:18:27Z,2025-05-09 18:18:27,0
rDJxJd3FzDY,NONNAS | Official Trailer | Netflix,UCWOA1ZGywLbqmigxE4Qlvuw,Netflix,2025-04-09T15:00:02Z,UgwWXmTQohoEVz9u_Qx4AaABAg.AHut7mELoezAIpirI1txNM,UgwWXmTQohoEVz9u_Qx4AaABAg,@RocStarr913,UCKOOLdK8nR_9OOvamULrNPA,"It was OK. It was a great idea and had a lot of potential, but I felt the script could have been polished up more and the direction could have been more inspired. If this has been a movie made in Hollywood back in the 1990’s, more work would have gone into it on the screenplay and directing front.",en,2025-06-01T15:13:25Z,2025-06-01 11:13:25,0
rDJxJd3FzDY,NONNAS | Official Trailer | Netflix,UCWOA1ZGywLbqmigxE4Qlvuw,Netflix,2025-04-09T15:00:02Z,UgxSAvy00vTTduCEHzt4AaABAg.AHurgjgDndlAIpj4Es6UU5,UgxSAvy00vTTduCEHzt4AaABAg,@RocStarr913,UCKOOLdK8nR_9OOvamULrNPA,"It’s OK. It had a lot of potential. It was a great idea, but it was mostly pretty emotionally flat and forgettable. That lies with the screenplay and director.",en,2025-06-01T15:15:19Z,2025-06-01 11:15:19,0
rDJxJd3FzDY,NONNAS | Official Trailer | Netflix,UCWOA1ZGywLbqmigxE4Qlvuw,Netflix,2025-04-09T15:00:02Z,UgxSAvy00vTTduCEHzt4AaABAg.AHurgjgDndlAIpjU7UNu8W,UgxSAvy00vTTduCEHzt4AaABAg,@sweet_amir,UCzFTicCXafr0C1Sf4_e9vXg,I just saw it and I would give it a solid 6.5/10. As good as the movie Chef.,en,2025-06-01T15:18:51Z,2025-06-01 11:18:51,0
rDJxJd3FzDY,NONNAS | Official Trailer | Netflix,UCWOA1ZGywLbqmigxE4Qlvuw,Netflix,2025-04-09T15:00:02Z,UgxSAvy00vTTduCEHzt4AaABAg.AHurgjgDndlAIpl8dFdpkr,UgxSAvy00vTTduCEHzt4AaABAg,@RocStarr913,UCKOOLdK8nR_9OOvamULrNPA,@sweet_amirThat definitely would be the scale I would have given it for sure.,en,2025-06-01T15:33:24Z,2025-06-01 11:33:24,0
rDJxJd3FzDY,NONNAS | Official Trailer | Netflix,UCWOA1ZGywLbqmigxE4Qlvuw,Netflix,2025-04-09T15:00:02Z,Ugyo3UkE2A6zwjqinGh4AaABAg.AHuauHShGchAIpjLLIkl3_,Ugyo3UkE2A6zwjqinGh4AaABAg,@RocStarr913,UCKOOLdK8nR_9OOvamULrNPA,"Movies like these unfortunately don’t make a lot of people go to theaters anymore. Hence, why Netflix chose to distribute it.",en,2025-06-01T15:17:39Z,2025-06-01 11:17:39,0
rDJxJd3FzDY,NONNAS | Official Trailer | Netflix,UCWOA1ZGywLbqmigxE4Qlvuw,Netflix,2025-04-09T15:00:02Z,UgwsCE5X4l92LphK9Np4AaABAg.AHuHRj4oOJBAIpjkZkWrO1,UgwsCE5X4l92LphK9Np4AaABAg,@RocStarr913,UCKOOLdK8nR_9OOvamULrNPA,"It unfortunately was. It was OK. It was a great idea, but the script and the direction was lacking.",en,2025-06-01T15:21:14Z,2025-06-01 11:21:14,0
rDJxJd3FzDY,NONNAS | Official Trailer | Netflix,UCWOA1ZGywLbqmigxE4Qlvuw,Netflix,2025-04-09T15:00:02Z,UgxgW0E2xFCVB5Ll7xN4AaABAg.AHtrLwuFb2nAI6LDIYr3wb,UgxgW0E2xFCVB5Ll7xN4AaABAg,@eyerememberufromthefuture5846,UCuU8KTZMJCadCGA0Vt_DezA,She's as stunning as ever. It's inconceivable that she's almost 80 years old.,en,2025-05-14T14:53:02Z,2025-05-14 10:53:02,0
rDJxJd3FzDY,NONNAS | Official Trailer | Netflix,UCWOA1ZGywLbqmigxE4Qlvuw,Netflix,2025-04-09T15:00:02Z,UgxU0wj5cTf70qqKQtB4AaABAg.AHt4Bdv4-TzAIpjs2Phx0V,UgxU0wj5cTf70qqKQtB4AaABAg,@RocStarr913,UCKOOLdK8nR_9OOvamULrNPA,I thought she was good.,en,2025-06-01T15:22:15Z,2025-06-01 11:22:15,0
rDJxJd3FzDY,NONNAS | Official Trailer | Netflix,UCWOA1ZGywLbqmigxE4Qlvuw,Netflix,2025-04-09T15:00:02Z,UgygZghsMjSPXQhYcp54AaABAg.AHpCp8jQP_hAHyEamNpkzR,UgygZghsMjSPXQhYcp54AaABAg,@JenHoegeman,UCraOOJ_OqZEraHYrYh9ZvCA,That’s the place this story is based on.,en,2025-05-11T02:02:03Z,2025-05-10 22:02:03,2
rDJxJd3FzDY,NONNAS | Official Trailer | Netflix,UCWOA1ZGywLbqmigxE4Qlvuw,Netflix,2025-04-09T15:00:02Z,UgzVBzUcADAud8tmFdd4AaABAg.AHnSlnSVBstAIpjxwdTCRu,UgzVBzUcADAud8tmFdd4AaABAg,@RocStarr913,UCKOOLdK8nR_9OOvamULrNPA,She was one of the better aspects of this movie.,en,2025-06-01T15:23:04Z,2025-06-01 11:23:04,0
rDJxJd3FzDY,NONNAS | Official Trailer | Netflix,UCWOA1ZGywLbqmigxE4Qlvuw,Netflix,2025-04-09T15:00:02Z,UgyCY2x-k5Oj4p_bPqR4AaABAg.AHmJIvgZKSXAHyIV0vhHit,UgyCY2x-k5Oj4p_bPqR4AaABAg,@32lilbruce,UC9kbgSumUd9pKW6nvZWAJOg,Gaaayyyyy,so,2025-05-11T02:36:04Z,2025-05-10 22:36:04,0
rDJxJd3FzDY,NONNAS | Official Trailer | Netflix,UCWOA1ZGywLbqmigxE4Qlvuw,Netflix,2025-04-09T15:00:02Z,UgyCY2x-k5Oj4p_bPqR4AaABAg.AHmJIvgZKSXAIpk02xEGeg,UgyCY2x-k5Oj4p_bPqR4AaABAg,@RocStarr913,UCKOOLdK8nR_9OOvamULrNPA,That’s a shame. The movie is OK.,en,2025-06-01T15:23:29Z,2025-06-01 11:23:29,0
rDJxJd3FzDY,NONNAS | Official Trailer | Netflix,UCWOA1ZGywLbqmigxE4Qlvuw,Netflix,2025-04-09T15:00:02Z,UgzYI21VqaOiPfkK8I94AaABAg.AHiwZxGKyRWAJvcuT5I5Qt,UgzYI21VqaOiPfkK8I94AaABAg,@thenightporter,UCfsfmoRmnLwEh_PE3Fw35Cg,Is that the lady standing on the stool with the beautiful smile?,en,2025-06-28T18:48:15Z,2025-06-28 14:48:15,0
rDJxJd3FzDY,NONNAS | Official Trailer | Netflix,UCWOA1ZGywLbqmigxE4Qlvuw,Netflix,2025-04-09T15:00:02Z,UgyTyiVsGLWAXCjxqIB4AaABAg.AHg7iMrcHw9AHyEqBISto3,UgyTyiVsGLWAXCjxqIB4AaABAg,@JenHoegeman,UCraOOJ_OqZEraHYrYh9ZvCA,"What are you talking about?  90% of the cast is (at least 50%) Italian, including Vince.",en,2025-05-11T02:04:09Z,2025-05-10 22:04:09,0
rDJxJd3FzDY,NONNAS | Official Trailer | Netflix,UCWOA1ZGywLbqmigxE4Qlvuw,Netflix,2025-04-09T15:00:02Z,UgyTyiVsGLWAXCjxqIB4AaABAg.AHg7iMrcHw9AHyJkZI_d4k,UgyTyiVsGLWAXCjxqIB4AaABAg,@TheLordCrane,UCWUaAkrg9NlcjfD6izVZgDQ,@JenHoegeman vince Vaughn is in fact 0% italian.,nl,2025-05-11T02:47:04Z,2025-05-10 22:47:04,0
rDJxJd3FzDY,NONNAS | Official Trailer | Netflix,UCWOA1ZGywLbqmigxE4Qlvuw,Netflix,2025-04-09T15:00:02Z,UgyTyiVsGLWAXCjxqIB4AaABAg.AHg7iMrcHw9AHy_hArHCYj,UgyTyiVsGLWAXCjxqIB4AaABAg,@JenHoegeman,UCraOOJ_OqZEraHYrYh9ZvCA,@TheLordCrane According to Wikipedia his mother’s maiden name is DePalmo and he is part Italian.  If you’re so sure of yourself why don’t you get on there and correct it?,en,2025-05-11T05:15:09Z,2025-05-11 01:15:09,0
rDJxJd3FzDY,NONNAS | Official Trailer | Netflix,UCWOA1ZGywLbqmigxE4Qlvuw,Netflix,2025-04-09T15:00:02Z,UgyTyiVsGLWAXCjxqIB4AaABAg.AHg7iMrcHw9AHyc8ofy8Ev,UgyTyiVsGLWAXCjxqIB4AaABAg,@TheLordCrane,UCWUaAkrg9NlcjfD6izVZgDQ,@JenHoegeman  Canadian German English Irish and - Italian 🤣 stop reaching and give me a break.,NA,2025-05-11T05:36:33Z,2025-05-11 01:36:33,0
rDJxJd3FzDY,NONNAS | Official Trailer | Netflix,UCWOA1ZGywLbqmigxE4Qlvuw,Netflix,2025-04-09T15:00:02Z,UgyTyiVsGLWAXCjxqIB4AaABAg.AHg7iMrcHw9AHycDtFHpsF,UgyTyiVsGLWAXCjxqIB4AaABAg,@TheLordCrane,UCWUaAkrg9NlcjfD6izVZgDQ,@JenHoegeman are you like 10% italian or something but want to be more,en,2025-05-11T05:37:14Z,2025-05-11 01:37:14,0
rDJxJd3FzDY,NONNAS | Official Trailer | Netflix,UCWOA1ZGywLbqmigxE4Qlvuw,Netflix,2025-04-09T15:00:02Z,UgyTyiVsGLWAXCjxqIB4AaABAg.AHg7iMrcHw9AHzYpdGkshA,UgyTyiVsGLWAXCjxqIB4AaABAg,@JenHoegeman,UCraOOJ_OqZEraHYrYh9ZvCA,"@TheLordCrane Your transcription is flawed.  They listed Italian first because that’s what he is, mostly.  Whatever.  It’s hardly 0%.  He’s just as much Italian as Robert DeNiro is.  Does that make Scorcese a chump, too?  It’s more about the culture you grow up in, anyway.  Not your actual genetics.  It sounds to me like you’re racist towards anyone who is anything BUT 100% Italian.  America is a melting pot and Hollywood is in America.  I’m done here.",en,2025-05-11T14:18:05Z,2025-05-11 10:18:05,0
rDJxJd3FzDY,NONNAS | Official Trailer | Netflix,UCWOA1ZGywLbqmigxE4Qlvuw,Netflix,2025-04-09T15:00:02Z,UgyTyiVsGLWAXCjxqIB4AaABAg.AHg7iMrcHw9AHzxokwZvg_,UgyTyiVsGLWAXCjxqIB4AaABAg,@JenHoegeman,UCraOOJ_OqZEraHYrYh9ZvCA,"@TheLordCrane It looks like my last comment didn’t register (or maybe you deleted it) so I’ll reiterate again… If you want to get technical Vince is 25% Italian, from his maternal grandfather.  The exact same amount as Deniro.  Are you suggesting Scorcese was also a chump for casting him in the Godfather?  America has always been a melting pot of culture.  Hollywood is America.  One doesn’t have to be 100% of any ethnicity to be “legit” in character roles.  It’s about the culture you grow up in.  And since you asked, I am also 25% Italian from my paternal grandmother.  My father’s mother was Italian and his father was a mixture of Eastern European.  However, his father left the picture early and he was raised by his mother, his numerous Italian aunts, and Italian Uncles.  He played in the streets (of Cleveland) with his Italian cousins.  They prepared and he ate authentic Italian food.  My mother was not Italian, but she learned how to cook from her mother in law because that’s what my father liked.  My mother and grandmother taught me.  Are you getting the (rather obvious picture) here?  I am not running around telling people I am Italian, but am still am happy with how the culture has influenced my life.",en,2025-05-11T18:05:09Z,2025-05-11 14:05:09,0
rDJxJd3FzDY,NONNAS | Official Trailer | Netflix,UCWOA1ZGywLbqmigxE4Qlvuw,Netflix,2025-04-09T15:00:02Z,UgyTyiVsGLWAXCjxqIB4AaABAg.AHg7iMrcHw9AI-1dCsn3YK,UgyTyiVsGLWAXCjxqIB4AaABAg,@TheLordCrane,UCWUaAkrg9NlcjfD6izVZgDQ,"@JenHoegeman  damn Jen Hoegeman looks like I struck a nerve. 1st off calling Vince Vaughn ""Vince"" is hilarious,  unless you personally know him. Secondly,  you proved my point to the T. You have a dash of italian blood in you, you have been around italians, and you want to be proud of the culture. Great, much appreciated by my olive skinned brothers and sisters. You're also right, someone can be 10% italian genetically, but if they were born their, and they speak it, they are 100% italian. We on the other hand are italian-Americans who don't speak the language, and have created our own culture, one of which is cool but also a little odd but it is what it is. I think it's great that they put at least some italians in like Lorraine Bracco. But still.... not one full italian except maybe Drea de Matteo in there. The should take notes from the sopranos, not from Luca, Mario and this movie",en,2025-05-11T18:47:16Z,2025-05-11 14:47:16,0
rDJxJd3FzDY,NONNAS | Official Trailer | Netflix,UCWOA1ZGywLbqmigxE4Qlvuw,Netflix,2025-04-09T15:00:02Z,UgyTyiVsGLWAXCjxqIB4AaABAg.AHg7iMrcHw9AIDt5hCYuuG,UgyTyiVsGLWAXCjxqIB4AaABAg,@gnamorfra,UC_30ldl6S6NY-lZwpOZX8Ug,"​@JenHoegemanprobably that they're Italian American, so Americans of Italian heritage, and not Italian themselves",en,2025-05-17T13:12:31Z,2025-05-17 09:12:31,0
rDJxJd3FzDY,NONNAS | Official Trailer | Netflix,UCWOA1ZGywLbqmigxE4Qlvuw,Netflix,2025-04-09T15:00:02Z,UgyTyiVsGLWAXCjxqIB4AaABAg.AHg7iMrcHw9AIE1n8rbGxC,UgyTyiVsGLWAXCjxqIB4AaABAg,@JenHoegeman,UCraOOJ_OqZEraHYrYh9ZvCA,"@gnamorfra ​​⁠So, now you’re going to give me grief for not putting “American” in front of of the Italian?  Of course I’m talking about Italian AMERICANS!  🙄.",en,2025-05-17T14:37:14Z,2025-05-17 10:37:14,0
rDJxJd3FzDY,NONNAS | Official Trailer | Netflix,UCWOA1ZGywLbqmigxE4Qlvuw,Netflix,2025-04-09T15:00:02Z,UgyTyiVsGLWAXCjxqIB4AaABAg.AHg7iMrcHw9AIE2g5wpjrx,UgyTyiVsGLWAXCjxqIB4AaABAg,@gnamorfra,UC_30ldl6S6NY-lZwpOZX8Ug,​@JenHoegemanI was just explaining rhe point of the comment you wrre answering to,en,2025-05-17T14:45:00Z,2025-05-17 10:45:00,0
rDJxJd3FzDY,NONNAS | Official Trailer | Netflix,UCWOA1ZGywLbqmigxE4Qlvuw,Netflix,2025-04-09T15:00:02Z,UgyTyiVsGLWAXCjxqIB4AaABAg.AHg7iMrcHw9AIpkFPfFvbU,UgyTyiVsGLWAXCjxqIB4AaABAg,@TheLordCrane,UCWUaAkrg9NlcjfD6izVZgDQ,​@gnamorfra yes Jen. WE are from AMERICA not ITALY...DARRRRRRRR,NA,2025-06-01T15:25:35Z,2025-06-01 11:25:35,0
rDJxJd3FzDY,NONNAS | Official Trailer | Netflix,UCWOA1ZGywLbqmigxE4Qlvuw,Netflix,2025-04-09T15:00:02Z,Ugz-3deixe3o8IrQfZ14AaABAg.AHffcM-obnXAHvdV1xH-3x,Ugz-3deixe3o8IrQfZ14AaABAg,@AdamLock3,UCBTdALhWfXShKEtFCBM06lQ,I think it was Billy Joel that had me emotional. So nostalgic. Movie looks great through.,NA,2025-05-10T01:50:36Z,2025-05-09 21:50:36,0
rDJxJd3FzDY,NONNAS | Official Trailer | Netflix,UCWOA1ZGywLbqmigxE4Qlvuw,Netflix,2025-04-09T15:00:02Z,UgxkljExPWuF7D68NJ54AaABAg.AHfCa3e-FnJAHwvYVX1jgp,UgxkljExPWuF7D68NJ54AaABAg,@Francorafman1,UC0CKgRPcZoIoSagBEWC1AnQ,Saw someone comments once that every Italian kid thinks their Nonna is the best cook ever and they are all right,en,2025-05-10T13:47:36Z,2025-05-10 09:47:36,0
rDJxJd3FzDY,NONNAS | Official Trailer | Netflix,UCWOA1ZGywLbqmigxE4Qlvuw,Netflix,2025-04-09T15:00:02Z,UgxkljExPWuF7D68NJ54AaABAg.AHfCa3e-FnJAHxRf1NFne2,UgxkljExPWuF7D68NJ54AaABAg,@FrancescaG879,UC0CLeSbfsGAwsL__42Mwnqg,"Actually no - my nonna was not particularly good in the kitchen. Only exception her pasta e fagioli, and the homemade pasta - it would take 20 minutes to make tagliatelle or ravioli for 10 people, a little more for cavatelli. Her sawing and embroidery work instead was terrific.",en,2025-05-10T18:36:59Z,2025-05-10 14:36:59,1
rDJxJd3FzDY,NONNAS | Official Trailer | Netflix,UCWOA1ZGywLbqmigxE4Qlvuw,Netflix,2025-04-09T15:00:02Z,Ugws-DTFfH0WjWUTLvN4AaABAg.AHbMOq2WntsAI6MAjoTTDa,Ugws-DTFfH0WjWUTLvN4AaABAg,@eyerememberufromthefuture5846,UCuU8KTZMJCadCGA0Vt_DezA,I am Sicilian and I hate the typical tropes and cliches around the culture in cinema and TV. This film certainly isn't exempt but it manages to overcome its weaknesses to become a truly heartwarming and inspirational film. Shooting it down after seeing one whole minute of the movie is kinda sad.,en,2025-05-14T15:01:26Z,2025-05-14 11:01:26,0
rDJxJd3FzDY,NONNAS | Official Trailer | Netflix,UCWOA1ZGywLbqmigxE4Qlvuw,Netflix,2025-04-09T15:00:02Z,Ugws-DTFfH0WjWUTLvN4AaABAg.AHbMOq2WntsAI6euI-UPuV,Ugws-DTFfH0WjWUTLvN4AaABAg,@ioannispaxinos5171,UCwCxKGzDKVMw7tgR_WnMyOA,@eyerememberufromthefuture5846  Well it hit every single cliche note so that wasn't very promising.,en,2025-05-14T17:53:48Z,2025-05-14 13:53:48,1
rDJxJd3FzDY,NONNAS | Official Trailer | Netflix,UCWOA1ZGywLbqmigxE4Qlvuw,Netflix,2025-04-09T15:00:02Z,UgyrKp56Z3kiYWFPpTB4AaABAg.AHWskvQDaXZAHz2LOUCW6a,UgyrKp56Z3kiYWFPpTB4AaABAg,@Willy-G-Z-PartyWill,UClUIseRtm7zA92_G0ra3w4w,Vince Vaughns AppleTv series Bad Monkey got renewed,NA,2025-05-11T09:34:11Z,2025-05-11 05:34:11,0
rDJxJd3FzDY,NONNAS | Official Trailer | Netflix,UCWOA1ZGywLbqmigxE4Qlvuw,Netflix,2025-04-09T15:00:02Z,UgzN8lQyEXedabqveHR4AaABAg.AHTwyrkwON3AIHWBhXLyqA,UgzN8lQyEXedabqveHR4AaABAg,@dinahkyle3196,UCgtkr54bJM65lbj9LnVDY4w,I knew I recognized her!!,NA,2025-05-18T23:00:35Z,2025-05-18 19:00:35,0
rDJxJd3FzDY,NONNAS | Official Trailer | Netflix,UCWOA1ZGywLbqmigxE4Qlvuw,Netflix,2025-04-09T15:00:02Z,UgwkHSCEuwa3nsLYB2B4AaABAg.AHTJI3zXDthAHxjYiCE2C8,UgwkHSCEuwa3nsLYB2B4AaABAg,@giselamontgomery3384,UCrScfhTYeywk7bJADzoB7Sg,I moved from FL to CO. Not too many Italians & Cubans live here. I'm re-watching Nonna's first 5min already for 20min while I eat lunch!,en,2025-05-10T21:22:00Z,2025-05-10 17:22:00,0
rDJxJd3FzDY,NONNAS | Official Trailer | Netflix,UCWOA1ZGywLbqmigxE4Qlvuw,Netflix,2025-04-09T15:00:02Z,UgwkHSCEuwa3nsLYB2B4AaABAg.AHTJI3zXDthAHzfBQuHP-9,UgwkHSCEuwa3nsLYB2B4AaABAg,@annasapothecary5704,UC8MmnjelMaaBHw_D-bfHLdw,@giselamontgomery3384 it's rough isn't it?,NA,2025-05-11T15:22:21Z,2025-05-11 11:22:21,0
rDJxJd3FzDY,NONNAS | Official Trailer | Netflix,UCWOA1ZGywLbqmigxE4Qlvuw,Netflix,2025-04-09T15:00:02Z,UgyoHJHJK2U56Aw_q9V4AaABAg.AGub3703YkAAHyId-njjU2,UgyoHJHJK2U56Aw_q9V4AaABAg,@32lilbruce,UC9kbgSumUd9pKW6nvZWAJOg,"Not really,  she looks divine!!",NA,2025-05-11T02:37:18Z,2025-05-10 22:37:18,0
rDJxJd3FzDY,NONNAS | Official Trailer | Netflix,UCWOA1ZGywLbqmigxE4Qlvuw,Netflix,2025-04-09T15:00:02Z,Ugz--Jt-P5kdsrDo2MF4AaABAg.AGsmqKGrAHIAHOZwfQN4TO,Ugz--Jt-P5kdsrDo2MF4AaABAg,@JosephSweet-s2b,UCvSbx-DcT3Z1RpQSygmMEgA,Not all tomatoes come from America in fact in traditional Italian cooking the San Marzano tomatoes used only grow in that region of Italy….you have no idea what you’re talking about. It’s also about the recipes as well,en,2025-04-26T20:16:38Z,2025-04-26 16:16:38,0
rDJxJd3FzDY,NONNAS | Official Trailer | Netflix,UCWOA1ZGywLbqmigxE4Qlvuw,Netflix,2025-04-09T15:00:02Z,Ugz--Jt-P5kdsrDo2MF4AaABAg.AGsmqKGrAHIAHOipkauIv1,Ugz--Jt-P5kdsrDo2MF4AaABAg,@elisharobertson5628,UCVNlaHLhqkKwAw-P0ecg3wA,@JosephSweet-s2b  actually all tomatoes came from America. The first record of tomatoes in Europe is from a manuscript in 1544. The word Tomato is from an Aztec word.,en,2025-04-26T21:43:04Z,2025-04-26 17:43:04,1
rDJxJd3FzDY,NONNAS | Official Trailer | Netflix,UCWOA1ZGywLbqmigxE4Qlvuw,Netflix,2025-04-09T15:00:02Z,UgwA2hfHJjTI628uKw94AaABAg.AGse5VXEn_HAIoa6QZKY4P,UgwA2hfHJjTI628uKw94AaABAg,@Broim_awesome,UCnTX0Qv0_aMzachsm0-AkqA,The show does look awesome,en,2025-06-01T04:37:44Z,2025-06-01 00:37:44,0
rDJxJd3FzDY,NONNAS | Official Trailer | Netflix,UCWOA1ZGywLbqmigxE4Qlvuw,Netflix,2025-04-09T15:00:02Z,UgyQiegOey7C6oOR43h4AaABAg.AGmFSvDUQ1UAHvFBuIIkJ1,UgyQiegOey7C6oOR43h4AaABAg,@SensibleShoesSaveLives,UCtozYX_oj_ZIJcPoyjSfGlw,Food is love 🥰,af,2025-05-09T22:09:32Z,2025-05-09 18:09:32,1
rDJxJd3FzDY,NONNAS | Official Trailer | Netflix,UCWOA1ZGywLbqmigxE4Qlvuw,Netflix,2025-04-09T15:00:02Z,Ugw29cZTCDBkCT_QWDx4AaABAg.AGjUTQZuMVEAGl3K2a8Zea,Ugw29cZTCDBkCT_QWDx4AaABAg,@amoreamore8710,UCuF3oIz_BZ2W1Bx6a2DhyjA,"And Joe, and Joe 😍😍😍",NA,2025-04-11T02:41:59Z,2025-04-10 22:41:59,2
rDJxJd3FzDY,NONNAS | Official Trailer | Netflix,UCWOA1ZGywLbqmigxE4Qlvuw,Netflix,2025-04-09T15:00:02Z,Ugw29cZTCDBkCT_QWDx4AaABAg.AGjUTQZuMVEAHTcJ3NGdrK,Ugw29cZTCDBkCT_QWDx4AaABAg,@Hedwig-Joe,UCbDFlTbdncS0AC62ivF7Uzw,And Brenda ❤,NA,2025-04-28T19:22:15Z,2025-04-28 15:22:15,2
rDJxJd3FzDY,NONNAS | Official Trailer | Netflix,UCWOA1ZGywLbqmigxE4Qlvuw,Netflix,2025-04-09T15:00:02Z,Ugw29cZTCDBkCT_QWDx4AaABAg.AGjUTQZuMVEAHz2ZDqdVDO,Ugw29cZTCDBkCT_QWDx4AaABAg,@Willy-G-Z-PartyWill,UClUIseRtm7zA92_G0ra3w4w,Don't 4get Lorraine 😊,de,2025-05-11T09:36:05Z,2025-05-11 05:36:05,0
rDJxJd3FzDY,NONNAS | Official Trailer | Netflix,UCWOA1ZGywLbqmigxE4Qlvuw,Netflix,2025-04-09T15:00:02Z,UgxVvmgFTo9tDmd_Rlh4AaABAg.AGjB7Fi5QY-AHvGAHkfIwM,UgxVvmgFTo9tDmd_Rlh4AaABAg,@SensibleShoesSaveLives,UCtozYX_oj_ZIJcPoyjSfGlw,"USA celebrates Mother’s Day this year on May 11, 2025

The date changes every year because it’s the second Sunday in May ❤",en,2025-05-09T22:18:03Z,2025-05-09 18:18:03,0
rDJxJd3FzDY,NONNAS | Official Trailer | Netflix,UCWOA1ZGywLbqmigxE4Qlvuw,Netflix,2025-04-09T15:00:02Z,Ugxo-RVfBVh4ZF8BDsx4AaABAg.AGj6xtxXJuDAGjiM0LsF0i,Ugxo-RVfBVh4ZF8BDsx4AaABAg,@jacquelineking114,UCK4QGdr2knIkXbYCMWj8R_Q,Same here😢,NA,2025-04-10T14:10:46Z,2025-04-10 10:10:46,2
rDJxJd3FzDY,NONNAS | Official Trailer | Netflix,UCWOA1ZGywLbqmigxE4Qlvuw,Netflix,2025-04-09T15:00:02Z,Ugxo-RVfBVh4ZF8BDsx4AaABAg.AGj6xtxXJuDAHvEqsytlyo,Ugxo-RVfBVh4ZF8BDsx4AaABAg,@SensibleShoesSaveLives,UCtozYX_oj_ZIJcPoyjSfGlw,🥹❤,ja,2025-05-09T22:06:31Z,2025-05-09 18:06:31,1
rDJxJd3FzDY,NONNAS | Official Trailer | Netflix,UCWOA1ZGywLbqmigxE4Qlvuw,Netflix,2025-04-09T15:00:02Z,Ugxo-RVfBVh4ZF8BDsx4AaABAg.AGj6xtxXJuDAHvdTIpIWZx,Ugxo-RVfBVh4ZF8BDsx4AaABAg,@AdamLock3,UCBTdALhWfXShKEtFCBM06lQ,I think it was Billy Joel that had me emotional. So nostalgic. Movie looks great through.,NA,2025-05-10T01:50:22Z,2025-05-09 21:50:22,3
rDJxJd3FzDY,NONNAS | Official Trailer | Netflix,UCWOA1ZGywLbqmigxE4Qlvuw,Netflix,2025-04-09T15:00:02Z,Ugxo-RVfBVh4ZF8BDsx4AaABAg.AGj6xtxXJuDAHz20plx83r,Ugxo-RVfBVh4ZF8BDsx4AaABAg,@Willy-G-Z-PartyWill,UClUIseRtm7zA92_G0ra3w4w,😢😢 miss my Nonna,NA,2025-05-11T09:31:23Z,2025-05-11 05:31:23,4
rDJxJd3FzDY,NONNAS | Official Trailer | Netflix,UCWOA1ZGywLbqmigxE4Qlvuw,Netflix,2025-04-09T15:00:02Z,Ugxo-RVfBVh4ZF8BDsx4AaABAg.AGj6xtxXJuDAIEoYduryy1,Ugxo-RVfBVh4ZF8BDsx4AaABAg,@randyfroelich,UCnT1mS4JhZcqaXcoADM0Amw,wasn't it good ?,mt,2025-05-17T21:52:01Z,2025-05-17 17:52:01,2
rDJxJd3FzDY,NONNAS | Official Trailer | Netflix,UCWOA1ZGywLbqmigxE4Qlvuw,Netflix,2025-04-09T15:00:02Z,Ugxo-RVfBVh4ZF8BDsx4AaABAg.AGj6xtxXJuDAIUKZrYJcHB,Ugxo-RVfBVh4ZF8BDsx4AaABAg,@dnice4335,UCuqkH_7CTe4jJgqAlXJwk_w,it does just the thought............,en,2025-05-23T22:29:09Z,2025-05-23 18:29:09,1
rDJxJd3FzDY,NONNAS | Official Trailer | Netflix,UCWOA1ZGywLbqmigxE4Qlvuw,Netflix,2025-04-09T15:00:02Z,Ugxo-RVfBVh4ZF8BDsx4AaABAg.AGj6xtxXJuDAJ16QsvttSD,Ugxo-RVfBVh4ZF8BDsx4AaABAg,@nasimkhamsi6401,UCOOuzQPH6X5eb3LJPM-rsnQ,"Oh, you will because I did a lot",en,2025-06-06T10:39:01Z,2025-06-06 06:39:01,1
rDJxJd3FzDY,NONNAS | Official Trailer | Netflix,UCWOA1ZGywLbqmigxE4Qlvuw,Netflix,2025-04-09T15:00:02Z,UgxX_44PSeADCBB5x_Z4AaABAg.AGimI7K51gqAI9mnJkczwy,UgxX_44PSeADCBB5x_Z4AaABAg,@ryangraham7012,UCULK6tOmsUm7EW5qcIEJKDQ,"I don’t give to Fricks about celebrities , but he is one of the very few real ones left  in 💩bag Hollywood and never seen him in movie I didn’t like🙃",en,2025-05-15T23:00:29Z,2025-05-15 19:00:29,4
rDJxJd3FzDY,NONNAS | Official Trailer | Netflix,UCWOA1ZGywLbqmigxE4Qlvuw,Netflix,2025-04-09T15:00:02Z,Ugw_Pze6IDEG71R-ZSp4AaABAg.AGiX0CZYD2EAGiX2Eoq9jx,Ugw_Pze6IDEG71R-ZSp4AaABAg,@chickenzombieking,UC7zR-0xwHJa_-cbv-CNhEsA,If you agree like,NA,2025-04-10T03:03:58Z,2025-04-09 23:03:58,0
rDJxJd3FzDY,NONNAS | Official Trailer | Netflix,UCWOA1ZGywLbqmigxE4Qlvuw,Netflix,2025-04-09T15:00:02Z,UgxROPPHYJ-L6C4004t4AaABAg.AGiGZ-VFuylAGs8E1lxgiy,UgxROPPHYJ-L6C4004t4AaABAg,@carmarasmussen8118,UCUoD1WhiIW6TJIk00pIwPTw,Still handsome.,sv,2025-04-13T20:39:32Z,2025-04-13 16:39:32,0
rDJxJd3FzDY,NONNAS | Official Trailer | Netflix,UCWOA1ZGywLbqmigxE4Qlvuw,Netflix,2025-04-09T15:00:02Z,Ugyrd6daMMsblkjI0fF4AaABAg.AGiAe2wyLalAGiHqxIjD7D,Ugyrd6daMMsblkjI0fF4AaABAg,@alisiddiqui1381,UCBXOQLj5iNZwtnFANXJGOFA,"Check out Bad Monkey. It came out last year, and Vaughn is HILARIOUS in it.",en,2025-04-10T00:51:14Z,2025-04-09 20:51:14,0
rDJxJd3FzDY,NONNAS | Official Trailer | Netflix,UCWOA1ZGywLbqmigxE4Qlvuw,Netflix,2025-04-09T15:00:02Z,Ugyrd6daMMsblkjI0fF4AaABAg.AGiAe2wyLalAGjXOwCr79g,Ugyrd6daMMsblkjI0fF4AaABAg,@MM-ud1xf,UCbFQPlQpr_-s1O-WADPzsjg,You should watch Bad Monkey. It’s the Vince Vaughn-iest project since his last project.,en,2025-04-10T12:26:19Z,2025-04-10 08:26:19,0
rDJxJd3FzDY,NONNAS | Official Trailer | Netflix,UCWOA1ZGywLbqmigxE4Qlvuw,Netflix,2025-04-09T15:00:02Z,Ugyrd6daMMsblkjI0fF4AaABAg.AGiAe2wyLalAGlm_RMjmOy,Ugyrd6daMMsblkjI0fF4AaABAg,@gabejamesmama,UCm53kDaIfj28yb_mG4CIWtg,did you see Bad Monkey?  a bit graphic/gory but really good. VV is so charming in it.,en,2025-04-11T09:26:11Z,2025-04-11 05:26:11,4
rDJxJd3FzDY,NONNAS | Official Trailer | Netflix,UCWOA1ZGywLbqmigxE4Qlvuw,Netflix,2025-04-09T15:00:02Z,Ugyrd6daMMsblkjI0fF4AaABAg.AGiAe2wyLalAGuV08mY-sZ,Ugyrd6daMMsblkjI0fF4AaABAg,@gabyromoro,UCSi5pO_6WdM6jCEqWO1uYLA,"Supports trump, i cant see him the same way anymore",en,2025-04-14T18:37:06Z,2025-04-14 14:37:06,9
rDJxJd3FzDY,NONNAS | Official Trailer | Netflix,UCWOA1ZGywLbqmigxE4Qlvuw,Netflix,2025-04-09T15:00:02Z,Ugyrd6daMMsblkjI0fF4AaABAg.AGiAe2wyLalAH6lVfIx2ob,Ugyrd6daMMsblkjI0fF4AaABAg,@amywade6188,UCI0nYN7m-vOFMYgKFNH5c7A,@gabyromorohe makes me nauseous,el-Latn,2025-04-19T22:20:05Z,2025-04-19 18:20:05,0
rDJxJd3FzDY,NONNAS | Official Trailer | Netflix,UCWOA1ZGywLbqmigxE4Qlvuw,Netflix,2025-04-09T15:00:02Z,Ugyrd6daMMsblkjI0fF4AaABAg.AGiAe2wyLalAHA_vywv_QI,Ugyrd6daMMsblkjI0fF4AaABAg,@selmaferdjioui,UCpvCUCbWB2UBQuUIDpPjMmQ,"@gabyromoro yeah i agree with u but i try (as much as i can) to not focus on people’s political beliefs when watching a movie. however, i admit that it’s hard to do when one of the main actors supports a convicted felon 🥲",en,2025-04-21T09:55:55Z,2025-04-21 05:55:55,1
